"date","state","positive","probableCases","negative","pending","totalTestResultsSource","totalTestResults","hospitalizedCurrently","hospitalizedCumulative","inIcuCurrently","inIcuCumulative","onVentilatorCurrently","onVentilatorCumulative","recovered","lastUpdateEt","dateModified","checkTimeEt","death","hospitalized","hospitalizedDischarged","dateChecked","totalTestsViral","positiveTestsViral","negativeTestsViral","positiveCasesViral","deathConfirmed","deathProbable","totalTestEncountersViral","totalTestsPeopleViral","totalTestsAntibody","positiveTestsAntibody","negativeTestsAntibody","totalTestsPeopleAntibody","positiveTestsPeopleAntibody","negativeTestsPeopleAntibody","totalTestsPeopleAntigen","positiveTestsPeopleAntigen","totalTestsAntigen","positiveTestsAntigen","fips","positiveIncrease","negativeIncrease","total","totalTestResultsIncrease","posNeg","dataQualityGrade","deathIncrease","hospitalizedIncrease","hash","commercialScore","negativeRegularScore","negativeScore","positiveScore","score","grade"
20210307,"AK",56886,,,,"totalTestsViral",1731628,33,1293,,,2,,,"3/5/2021 03:59","2021-03-05T03:59:00Z","03/04 22:59",305,1293,,"2021-03-05T03:59:00Z",1731628,68693,1660758,,,,,,,,,,,,,,,,"02",0,0,56886,0,56886,,0,0,"dc4bccd4bb885349d7e94d6fed058e285d4be164",0,0,0,0,0,""
20210306,"AK",56886,,,,"totalTestsViral",1731628,33,1293,,,2,,,"3/5/2021 03:59","2021-03-05T03:59:00Z","03/04 22:59",305,1293,,"2021-03-05T03:59:00Z",1731628,68693,1660758,,,,,,,,,,,,,,,,"02",0,0,56886,0,56886,,0,0,"749716d5cc5eb3b785af328a6c27e951ea62ffc2",0,0,0,0,0,""
20210305,"AK",56886,,,,"totalTestsViral",1731628,33,1293,,,2,,,"3/5/2021 03:59","2021-03-05T03:59:00Z","03/04 22:59",305,1293,,"2021-03-05T03:59:00Z",1731628,68693,1660758,,,,,,,,,,,,,,,,"02",141,0,56886,7144,56886,,2,3,"7c69ab3363700e0bfc193bc3374d28a89a0d1102",0,0,0,0,0,""
20210304,"AK",56745,,,,"totalTestsViral",1724484,32,1290,,,2,,,"3/4/2021 03:59","2021-03-04T03:59:00Z","03/03 22:59",303,1290,,"2021-03-04T03:59:00Z",1724484,68549,1653763,,,,,,,,,,,,,,,,"02",140,0,56745,13466,56745,,0,5,"bc7a5cc276540e2ec8f649ab256aa42f63777463",0,0,0,0,0,""
20210303,"AK",56605,,,,"totalTestsViral",1711018,26,1285,,,2,,,"3/3/2021 03:59","2021-03-03T03:59:00Z","03/02 22:59",303,1285,,"2021-03-03T03:59:00Z",1711018,68343,1640525,,,,,,,,,,,,,,,,"02",177,0,56605,6358,56605,,1,-1,"06e88c66f6d974e25a99aebd3d4be26ac862a54b",0,0,0,0,0,""
20210302,"AK",56428,,,,"totalTestsViral",1704660,26,1286,,,6,,,"3/2/2021 03:59","2021-03-02T03:59:00Z","03/01 22:59",302,1286,,"2021-03-02T03:59:00Z",1704660,68132,1634388,,,,,,,,,,,,,,,,"02",89,0,56428,6629,56428,,2,7,"dc1ca679901fe84c85e0c108882ea79504d66030",0,0,0,0,0,""
20210301,"AK",56339,,,,"totalTestsViral",1698031,25,1279,,,5,,,"3/1/2021 03:59","2021-03-01T03:59:00Z","02/28 22:59",300,1279,,"2021-03-01T03:59:00Z",1698031,67948,1627988,,,,,,,,,,,,,,,,"02",350,0,56339,18356,56339,,10,2,"775b3fe18a9a67c8d008bae6a870b3b66923e5fc",0,0,0,0,0,""
20210228,"AK",55989,,,,"totalTestsViral",1679675,43,1277,,,5,,,"2/26/2021 03:59","2021-02-26T03:59:00Z","02/25 22:59",290,1277,,"2021-02-26T03:59:00Z",1679675,67580,1610023,,,,,,,,,,,,,,,,"02",0,0,55989,0,55989,,0,0,"6d01ab8f9ee9605ca15805c4665d29ad9e8b6bd4",0,0,0,0,0,""
20210227,"AK",55989,,,,"totalTestsViral",1679675,43,1277,,,5,,,"2/26/2021 03:59","2021-02-26T03:59:00Z","02/25 22:59",290,1277,,"2021-02-26T03:59:00Z",1679675,67580,1610023,,,,,,,,,,,,,,,,"02",0,0,55989,0,55989,,0,0,"22ba940bf484b87e67e142f5f1b88e1507f06ed4",0,0,0,0,0,""
20210226,"AK",55989,,,,"totalTestsViral",1679675,43,1277,,,5,,,"2/26/2021 03:59","2021-02-26T03:59:00Z","02/25 22:59",290,1277,,"2021-02-26T03:59:00Z",1679675,67580,1610023,,,,,,,,,,,,,,,,"02",103,0,55989,8632,55989,,0,6,"5044f52853a381071810a041914daeddb72d2494",0,0,0,0,0,""
20210225,"AK",55886,,,,"totalTestsViral",1671043,45,1271,,,5,,,"2/25/2021 03:59","2021-02-25T03:59:00Z","02/24 22:59",290,1271,,"2021-02-25T03:59:00Z",1671043,67403,1601583,,,,,,,,,,,,,,,,"02",150,0,55886,8887,55886,,0,11,"21a34ec5db88409cfbf700bde95d11af3de7f1aa",0,0,0,0,0,""
20210224,"AK",55736,,,,"totalTestsViral",1662156,46,1260,,,4,,,"2/24/2021 03:59","2021-02-24T03:59:00Z","02/23 22:59",290,1260,,"2021-02-24T03:59:00Z",1662156,67232,1592879,,,,,,,,,,,,,,,,"02",176,0,55736,8731,55736,,0,0,"67b3b6ca1627ea40d08871803b2659b08b55daae",0,0,0,0,0,""
20210223,"AK",55560,,,,"totalTestsViral",1653425,38,1260,,,5,,,"2/23/2021 03:59","2021-02-23T03:59:00Z","02/22 22:59",290,1260,,"2021-02-23T03:59:00Z",1653425,67036,1584367,,,,,,,,,,,,,,,,"02",53,0,55560,4640,55560,,0,9,"8e9b55832d194e6faf511a32f4d3362caac0960e",0,0,0,0,0,""
20210222,"AK",55507,,,,"totalTestsViral",1648785,39,1251,,,5,,,"2/22/2021 03:59","2021-02-22T03:59:00Z","02/21 22:59",290,1251,,"2021-02-22T03:59:00Z",1648785,66945,1579837,,,,,,,,,,,,,,,,"02",309,0,55507,18956,55507,,1,8,"d16719bcd536c718ee212fa36ec5c4d1634ae456",0,0,0,0,0,""
20210221,"AK",55198,,,,"totalTestsViral",1629829,34,1243,,,4,,,"2/19/2021 03:59","2021-02-19T03:59:00Z","02/18 22:59",289,1243,,"2021-02-19T03:59:00Z",1629829,66577,1561281,,,,,,,,,,,,,,,,"02",0,0,55198,0,55198,,0,0,"c5d59c6e6425b2831a663bdf37da6b807d96def3",0,0,0,0,0,""
20210220,"AK",55198,,,,"totalTestsViral",1629829,34,1243,,,4,,,"2/19/2021 03:59","2021-02-19T03:59:00Z","02/18 22:59",289,1243,,"2021-02-19T03:59:00Z",1629829,66577,1561281,,,,,,,,,,,,,,,,"02",0,0,55198,0,55198,,0,0,"1e85af0b5a8d444d4c1c6ffe2e591c0304971ab2",0,0,0,0,0,""
20210219,"AK",55198,,,,"totalTestsViral",1629829,34,1243,,,4,,,"2/19/2021 03:59","2021-02-19T03:59:00Z","02/18 22:59",289,1243,,"2021-02-19T03:59:00Z",1629829,66577,1561281,,,,,,,,,,,,,,,,"02",189,0,55198,10370,55198,,1,0,"ac4229ce35fa13d674c97a3332009e3e73d2257b",0,0,0,0,0,""
20210218,"AK",55009,,,,"totalTestsViral",1619459,37,1243,,,3,,,"2/18/2021 03:59","2021-02-18T03:59:00Z","02/17 22:59",288,1243,,"2021-02-18T03:59:00Z",1619459,66411,1551117,,,,,,,,,,,,,,,,"02",210,0,55009,7488,55009,,0,5,"8b10f7dd94bfd5b1ddd586e750d0b8881efab421",0,0,0,0,0,""
20210217,"AK",54799,,,,"totalTestsViral",1611971,32,1238,,,2,,,"2/17/2021 03:59","2021-02-17T03:59:00Z","02/16 22:59",288,1238,,"2021-02-17T03:59:00Z",1611971,66264,1543783,,,,,,,,,,,,,,,,"02",63,0,54799,6144,54799,,1,5,"96a61e021c5ff72ae4f831f4ffbeac80e993d96f",0,0,0,0,0,""
20210216,"AK",54736,,,,"totalTestsViral",1605827,43,1233,,,2,,,"2/16/2021 03:59","2021-02-16T03:59:00Z","02/15 22:59",287,1233,,"2021-02-16T03:59:00Z",1605827,66077,1537830,,,,,,,,,,,,,,,,"02",454,0,54736,21279,54736,,5,3,"4382a871d22ec982fc4ac57442e3069916a6fc12",0,0,0,0,0,""
20210215,"AK",54282,,,,"totalTestsViral",1584548,35,1230,,,5,,,"2/12/2021 03:59","2021-02-12T03:59:00Z","02/11 22:59",282,1230,,"2021-02-12T03:59:00Z",1584548,65613,1517076,,,,,,,,,,,,,,,,"02",0,0,54282,0,54282,,0,0,"fbdcf64542f36adae78ca378b8ceb3d94fe8d24e",0,0,0,0,0,""
20210214,"AK",54282,,,,"totalTestsViral",1584548,35,1230,,,5,,,"2/12/2021 03:59","2021-02-12T03:59:00Z","02/11 22:59",282,1230,,"2021-02-12T03:59:00Z",1584548,65613,1517076,,,,,,,,,,,,,,,,"02",0,0,54282,0,54282,,0,0,"1de98aa72a395729e4d91c49a23acde2f503c0b8",0,0,0,0,0,""
20210213,"AK",54282,,,,"totalTestsViral",1584548,35,1230,,,5,,,"2/12/2021 03:59","2021-02-12T03:59:00Z","02/11 22:59",282,1230,,"2021-02-12T03:59:00Z",1584548,65613,1517076,,,,,,,,,,,,,,,,"02",0,0,54282,0,54282,,0,0,"69bc93c817c26e15cb1c9c8aa38d73fafd1e638a",0,0,0,0,0,""
20210212,"AK",54282,,,,"totalTestsViral",1584548,35,1230,,,5,,,"2/12/2021 03:59","2021-02-12T03:59:00Z","02/11 22:59",282,1230,,"2021-02-12T03:59:00Z",1584548,65613,1517076,,,,,,,,,,,,,,,,"02",148,0,54282,7192,54282,,2,3,"60508920416c9cda3aedadbc86fbcd96f3df50f0",0,0,0,0,0,""
20210211,"AK",54134,,,,"totalTestsViral",1577356,33,1227,,,6,,,"2/11/2021 03:59","2021-02-11T03:59:00Z","02/10 22:59",280,1227,,"2021-02-11T03:59:00Z",1577356,65457,1510067,,,,,,,,,,,,,,,,"02",143,0,54134,9353,54134,,0,3,"a06f51bbd234e397c67f3e3e0a060e687993ea0a",0,0,0,0,0,""
20210210,"AK",53991,,,,"totalTestsViral",1568003,34,1224,,,6,,,"2/10/2021 03:59","2021-02-10T03:59:00Z","02/09 22:59",280,1224,,"2021-02-10T03:59:00Z",1568003,65272,1500923,,,,,,,,,,,,,,,,"02",182,0,53991,6754,53991,,0,1,"eec441c4a0ce048c36fb663eb4069687d027edd4",0,0,0,0,0,""
20210209,"AK",53809,,,,"totalTestsViral",1561249,35,1223,,,6,,,"2/9/2021 03:59","2021-02-09T03:59:00Z","02/08 22:59",280,1223,,"2021-02-09T03:59:00Z",1561249,65100,1494355,,,,,,,,,,,,,,,,"02",115,0,53809,5717,53809,,1,4,"a39c9a37c4d2ea035144b7916132374ee16de293",0,0,0,0,0,""
20210208,"AK",53694,,,,"totalTestsViral",1555532,39,1219,,,9,,,"2/8/2021 03:59","2021-02-08T03:59:00Z","02/07 22:59",279,1219,,"2021-02-08T03:59:00Z",1555532,64862,1488905,,,,,,,,,,,,,,,,"02",415,0,53694,18621,53694,,0,0,"efba8bbf816318de32c48a0b929199fc63243499",0,0,0,0,0,""
20210207,"AK",53279,,,,"totalTestsViral",1536911,44,1219,,,11,,,"2/5/2021 03:59","2021-02-05T03:59:00Z","02/04 22:59",279,1219,,"2021-02-05T03:59:00Z",1536911,64404,1470760,,,,,,,,,,,,,,,,"02",0,0,53279,0,53279,,0,0,"5b9c4c4f9bdd6ecb7641490fc45a5024bdd53255",0,0,0,0,0,""
20210206,"AK",53279,,,,"totalTestsViral",1536911,44,1219,,,11,,,"2/5/2021 03:59","2021-02-05T03:59:00Z","02/04 22:59",279,1219,,"2021-02-05T03:59:00Z",1536911,64404,1470760,,,,,,,,,,,,,,,,"02",0,0,53279,0,53279,,0,0,"72343e752cdb1995349a1338b5667a275cabd6f1",0,0,0,0,0,""
20210205,"AK",53279,,,,"totalTestsViral",1536911,44,1219,,,11,,,"2/5/2021 03:59","2021-02-05T03:59:00Z","02/04 22:59",279,1219,,"2021-02-05T03:59:00Z",1536911,64404,1470760,,,,,,,,,,,,,,,,"02",165,0,53279,7345,53279,,0,5,"03ae1d67b7c07ee9f81ed3c14f8675d10528584c",0,0,0,0,0,""
20210204,"AK",53114,,,,"totalTestsViral",1529566,43,1214,,,10,,,"2/4/2021 03:59","2021-02-04T03:59:00Z","02/03 22:59",279,1214,,"2021-02-04T03:59:00Z",1529566,64183,1463638,,,,,,,,,,,,,,,,"02",158,0,53114,9360,53114,,0,1,"baae7e6605b4bb94f994c17abb85e5f6864a9aad",0,0,0,0,0,""
20210203,"AK",52956,,,,"totalTestsViral",1520206,42,1213,,,10,,,"2/3/2021 03:59","2021-02-03T03:59:00Z","02/02 22:59",279,1213,,"2021-02-03T03:59:00Z",1520206,63692,1454776,,,,,,,,,,,,,,,,"02",181,0,52956,8421,52956,,0,4,"203c9e7a045719599de6a176778affc9acb349f4",0,0,0,0,0,""
20210202,"AK",52775,,,,"totalTestsViral",1511785,49,1209,,,10,,,"2/2/2021 03:59","2021-02-02T03:59:00Z","02/01 22:59",279,1209,,"2021-02-02T03:59:00Z",1511785,63485,1446577,,,,,,,,,,,,,,,,"02",107,0,52775,4123,52775,,17,4,"4635db34a5e1a4bc2fc4fb076933d38bd911d75b",0,0,0,0,0,""
20210201,"AK",52668,,,,"totalTestsViral",1507662,43,1205,,,10,,,"2/1/2021 03:59","2021-02-01T03:59:00Z","01/31 22:59",262,1205,,"2021-02-01T03:59:00Z",1507662,63384,1442574,,,,,,,,,,,,,,,,"02",70,0,52668,7337,52668,,0,0,"5aab393882c716836ef3f895b114c443a63ba6d0",0,0,0,0,0,""
20210131,"AK",52598,,,,"totalTestsViral",1500325,42,1205,,,9,,,"1/31/2021 03:59","2021-01-31T03:59:00Z","01/30 22:59",262,1205,,"2021-01-31T03:59:00Z",1500325,63202,1435424,,,,,,,,,,,,,,,,"02",128,0,52598,4440,52598,,0,0,"b5e172a9cc81480043d0b4f731acdde02485a643",0,0,0,0,0,""
20210130,"AK",52470,,,,"totalTestsViral",1495885,39,1205,,,10,,,"1/30/2021 03:59","2021-01-30T03:59:00Z","01/29 22:59",262,1205,,"2021-01-30T03:59:00Z",1495885,63117,1431069,,,,,,,,,,,,,,,,"02",135,0,52470,6119,52470,,0,3,"0e9150b53f71a70224f3e564fa6f93c1ca0fee52",0,0,0,0,0,""
20210129,"AK",52335,,,,"totalTestsViral",1489766,48,1202,,,10,,,"1/29/2021 03:59","2021-01-29T03:59:00Z","01/28 22:59",262,1202,,"2021-01-29T03:59:00Z",1489766,62949,1425130,,,,,,,,,,,,,,,,"02",185,0,52335,9917,52335,,0,1,"6834bfaa81dffad91e3a58767da926a34260fdad",0,0,0,0,0,""
20210128,"AK",52150,,,,"totalTestsViral",1479849,42,1201,,,5,,,"1/28/2021 03:59","2021-01-28T03:59:00Z","01/27 22:59",262,1201,,"2021-01-28T03:59:00Z",1479849,62705,1415473,,,,,,,,,,,,,,,,"02",199,0,52150,12449,52150,,1,1,"564e0ae5c6a2fd039261e99f8b3330328762b2fe",0,0,0,0,0,""
20210127,"AK",51951,,,,"totalTestsViral",1467400,49,1200,,,5,,,"1/27/2021 03:59","2021-01-27T03:59:00Z","01/26 22:59",261,1200,,"2021-01-27T03:59:00Z",1467400,62323,1403422,,,,,,,,,,,,,,,,"02",173,0,51951,7211,51951,,1,6,"80fb057a475512293fb257ae3e8bc310b516238d",0,0,0,0,0,""
20210126,"AK",51778,,,,"totalTestsViral",1460189,57,1194,,,5,,,"1/26/2021 03:59","2021-01-26T03:59:00Z","01/25 22:59",260,1194,,"2021-01-26T03:59:00Z",1460189,62144,1396391,,,,,,,,,,,,,,,,"02",85,0,51778,3136,51778,,1,9,"168172a367c88c32479038e2675229893f435e0d",0,0,0,0,0,""
20210125,"AK",51693,,,,"totalTestsViral",1457053,54,1185,,,7,,,"1/25/2021 03:59","2021-01-25T03:59:00Z","01/24 22:59",259,1185,,"2021-01-25T03:59:00Z",1457053,62017,1393392,,,,,,,,,,,,,,,,"02",83,0,51693,3583,51693,,0,0,"25b5df183b2a18df13310ab345e0b8408d4eb916",0,0,0,0,0,""
20210124,"AK",51610,,,,"totalTestsViral",1453470,57,1185,,,7,,,"1/24/2021 03:59","2021-01-24T03:59:00Z","01/23 22:59",259,1185,,"2021-01-24T03:59:00Z",1453470,61912,1389919,,,,,,,,,,,,,,,,"02",165,0,51610,6956,51610,,0,1,"acc33a6e97df58bad51e9cbe56a3e86c22d216e7",0,0,0,0,0,""
20210123,"AK",51445,,,,"totalTestsViral",1446514,56,1184,,,7,,,"1/23/2021 03:59","2021-01-23T03:59:00Z","01/22 22:59",259,1184,,"2021-01-23T03:59:00Z",1446514,61718,1383165,,,,,,,,,,,,,,,,"02",241,0,51445,7556,51445,,5,0,"87b79ed3d8220fdfea23c62e47d0741e237c3c39",0,0,0,0,0,""
20210122,"AK",51204,,,,"totalTestsViral",1438958,51,1184,,,7,,,"1/22/2021 03:59","2021-01-22T03:59:00Z","01/21 22:59",254,1184,,"2021-01-22T03:59:00Z",1438958,61488,1375841,,,,,,,,,,,,,,,,"02",263,0,51204,7991,51204,,0,7,"8a93c7eb71ab4c8293c71ba0e5985eb3480382c9",0,0,0,0,0,""
20210121,"AK",50941,,,,"totalTestsViral",1430967,58,1177,,,7,,,"1/21/2021 03:59","2021-01-21T03:59:00Z","01/20 22:59",254,1177,,"2021-01-21T03:59:00Z",1430967,61170,1368174,,,,,,,,,,,,,,,,"02",209,0,50941,10845,50941,,1,7,"dbbaeb7b7e8a295650bac97e0b3dee218f0a7c34",0,0,0,0,0,""
20210120,"AK",50732,,,,"totalTestsViral",1420122,57,1170,,,9,,,"1/20/2021 03:59","2021-01-20T03:59:00Z","01/19 22:59",253,1170,,"2021-01-20T03:59:00Z",1420122,60791,1357771,,,,,,,,,,,,,,,,"02",160,0,50732,5591,50732,,23,8,"d9de26404c0b41c46d2c2fec2f46bc918ca9e23e",0,0,0,0,0,""
20210119,"AK",50572,,,,"totalTestsViral",1414531,61,1162,,,9,,,"1/19/2021 03:59","2021-01-19T03:59:00Z","01/18 22:59",230,1162,,"2021-01-19T03:59:00Z",1414531,60601,1352390,,,,,,,,,,,,,,,,"02",125,0,50572,3771,50572,,1,9,"afea4f64e7f60b8123c6fef396668397453214d6",0,0,0,0,0,""
20210118,"AK",50447,,,,"totalTestsViral",1410760,58,1153,,,8,,,"1/18/2021 03:59","2021-01-18T03:59:00Z","01/17 22:59",229,1153,,"2021-01-18T03:59:00Z",1410760,60409,1348813,,,,,,,,,,,,,,,,"02",151,0,50447,6004,50447,,0,0,"8b93a15e4e70370e5f33dd2b8a0b04a85f8f50ec",0,0,0,0,0,""
20210117,"AK",50296,,,,"totalTestsViral",1404756,70,1153,,,8,,,"1/17/2021 03:59","2021-01-17T03:59:00Z","01/16 22:59",229,1153,,"2021-01-17T03:59:00Z",1404756,60195,1343030,,,,,,,,,,,,,,,,"02",279,0,50296,6107,50296,,0,1,"ae041b6d3fb0fbe62c27b0eca0a894eba5f6fa0b",0,0,0,0,0,""
20210116,"AK",50017,,,,"totalTestsViral",1398649,67,1152,,,9,,,"1/16/2021 03:59","2021-01-16T03:59:00Z","01/15 22:59",229,1152,,"2021-01-16T03:59:00Z",1398649,59982,1337142,,,,,,,,,,,,,,,,"02",182,0,50017,9423,50017,,0,0,"4af1d040c7a9bfebf6dd744174b7ad3cebddb79a",0,0,0,0,0,""
20210115,"AK",49835,,,,"totalTestsViral",1389226,77,1152,,,10,,,"1/15/2021 03:59","2021-01-15T03:59:00Z","01/14 22:59",229,1152,,"2021-01-15T03:59:00Z",1389226,59624,1328089,,,,,,,,,,,,,,,,"02",300,0,49835,6950,49835,,1,3,"6e3996f208d351f9314cc8f074a01268a1d43faf",0,0,0,0,0,""
20210114,"AK",49535,,,,"totalTestsViral",1382276,81,1149,,,10,,,"1/14/2021 03:59","2021-01-14T03:59:00Z","01/13 22:59",228,1149,,"2021-01-14T03:59:00Z",1382276,59332,1321433,,,,,,,,,,,,,,,,"02",332,0,49535,11441,49535,,2,11,"68ac9eb99feb89e8e7b984362ffd30b49f8b063a",0,0,0,0,0,""
20210113,"AK",49203,,,,"totalTestsViral",1370835,68,1138,,,8,,,"1/13/2021 03:59","2021-01-13T03:59:00Z","01/12 22:59",226,1138,,"2021-01-13T03:59:00Z",1370835,58985,1310360,,,,,,,,,,,,,,,,"02",406,0,49203,13127,49203,,2,34,"ec82b97583c0024143ff6097a39d91c3cb47de39",0,0,0,0,0,""
20210112,"AK",48797,,,,"totalTestsViral",1357708,79,1104,,,9,,,"1/11/2021 03:59","2021-01-11T03:59:00Z","01/10 22:59",224,1104,,"2021-01-11T03:59:00Z",1357708,58423,1297818,,,,,,,,,,,,,,,,"02",0,0,48797,0,48797,,0,0,"096c0ad08d8649dfb654b9366795d533fda0a9fd",0,0,0,0,0,""
20210111,"AK",48797,,,,"totalTestsViral",1357708,79,1104,,,9,,,"1/11/2021 03:59","2021-01-11T03:59:00Z","01/10 22:59",224,1104,,"2021-01-11T03:59:00Z",1357708,58423,1297818,,,,,,,,,,,,,,,,"02",173,0,48797,5228,48797,,0,3,"2cbae5d93561739f6ebbb44fdbcc1863cf2cf7d1",0,0,0,0,0,""
20210110,"AK",48624,,,,"totalTestsViral",1352480,82,1101,,,10,,,"1/10/2021 03:59","2021-01-10T03:59:00Z","01/09 22:59",224,1101,,"2021-01-10T03:59:00Z",1352480,58210,1292805,,,,,,,,,,,,,,,,"02",250,0,48624,6907,48624,,0,1,"c8cce5d8f64008358fc007db70bd3d539e816033",0,0,0,0,0,""
20210109,"AK",48374,,,,"totalTestsViral",1345573,86,1100,,,8,,,"1/9/2021 03:59","2021-01-09T03:59:00Z","01/08 22:59",224,1100,,"2021-01-09T03:59:00Z",1345573,57933,1286179,,,,,,,,,,,,,,,,"02",311,0,48374,7824,48374,,1,5,"ccb610984c8477e459c71cdfd436049bba61c91c",0,0,0,0,0,""
20210108,"AK",48063,,,,"totalTestsViral",1337749,86,1095,,,8,,,"1/8/2021 03:59","2021-01-08T03:59:00Z","01/07 22:59",223,1095,,"2021-01-08T03:59:00Z",1337749,57584,1278710,,,,,,,,,,,,,,,,"02",403,0,48063,11207,48063,,0,11,"89860cc1e418adc968ac0bf684da3a425413e7f1",0,0,0,0,0,""
20210107,"AK",47660,,,,"totalTestsViral",1326542,89,1084,,,8,,,"1/7/2021 03:59","2021-01-07T03:59:00Z","01/06 22:59",223,1084,,"2021-01-07T03:59:00Z",1326542,57120,1267982,,,,,,,,,,,,,,,,"02",326,0,47660,15527,47660,,3,10,"aecae9b48bba7e16f11da1adcf84876882cb8197",0,0,0,0,0,""
20210106,"AK",47334,,,,"totalTestsViral",1311015,101,1074,,,6,,,"1/6/2021 03:59","2021-01-06T03:59:00Z","01/05 22:59",220,1074,,"2021-01-06T03:59:00Z",1311015,56554,1253043,,,,,,,,,,,,,,,,"02",328,0,47334,8156,47334,,2,18,"5e16608c722110d2069f8098889f8ace33a67e4f",0,0,0,0,0,""
20210105,"AK",47006,,,,"totalTestsViral",1302859,93,1056,,,6,,,"1/5/2021 03:59","2021-01-05T03:59:00Z","01/04 22:59",218,1056,,"2021-01-05T03:59:00Z",1302859,56193,1245250,,,,,,,,,,,,,,,,"02",194,0,47006,5361,47006,,0,23,"2f77691bf62569e9a51fb79ceec78a28cadb4faa",0,0,0,0,0,""
20210104,"AK",46812,,,,"totalTestsViral",1297498,97,1033,,,9,,,"1/4/2021 03:59","2021-01-04T03:59:00Z","01/03 22:59",218,1033,,"2021-01-04T03:59:00Z",1297498,55869,1240213,,,,,,,,,,,,,,,,"02",260,0,46812,3661,46812,,3,0,"84239cc04117e10c226eda6fdcff8292b9a17dd7",0,0,0,0,0,""
20210103,"AK",46552,,,,"totalTestsViral",1293837,87,1033,,,7,,,"1/3/2021 03:59","2021-01-03T03:59:00Z","01/02 22:59",215,1033,,"2021-01-03T03:59:00Z",1293837,55664,1236758,,215,,,,,,,,,,,,,,"02",290,0,46552,3488,46552,,0,3,"235bad6f072b50f1a818293fd856812d2d2eac30",0,0,0,0,0,""
20210102,"AK",46262,,,,"totalTestsViral",1290349,77,1030,,,6,,,"1/2/2021 03:59","2021-01-02T03:59:00Z","01/01 22:59",215,1030,,"2021-01-02T03:59:00Z",1290349,55462,1233474,,215,,,,,,,,,,,,,,"02",801,0,46262,14599,46262,,9,7,"6cc2ca02f030bcdf5c270f95c21cbe187d3dca97",0,0,0,0,0,""
20210101,"AK",45461,,,,"totalTestsViral",1275750,79,1023,,,6,,,"12/31/2020 03:59","2020-12-31T03:59:00Z","12/30 22:59",206,1023,,"2020-12-31T03:59:00Z",1275750,54763,1219592,,206,,,,,,,,,,,,,,"02",0,0,45461,0,45461,,0,0,"b950686fa685b23ef2ce4561719c589796c3368c",0,0,0,0,0,""
20201231,"AK",45461,,,,"totalTestsViral",1275750,79,1023,,,6,,,"12/31/2020 03:59","2020-12-31T03:59:00Z","12/30 22:59",206,1023,,"2020-12-31T03:59:00Z",1275750,54763,1219592,,206,,,,,,,,,,,,,,"02",495,0,45461,8658,45461,,3,6,"18bb857b8a2fc5bcd9e182d9566a2d76a9e0a44d",0,0,0,0,0,""
20201230,"AK",44966,,,,"totalTestsViral",1267092,75,1017,,,10,,,"12/30/2020 03:59","2020-12-30T03:59:00Z","12/29 22:59",203,1017,,"2020-12-30T03:59:00Z",1267092,54317,1211380,,203,,,,,,,,,,,,,,"02",385,0,44966,7247,44966,,2,13,"d744e792d06cd7da2e40d331809d716a59514c19",0,0,0,0,0,""
20201229,"AK",44581,,,,"totalTestsViral",1259845,83,1004,,,10,,,"12/29/2020 03:59","2020-12-29T03:59:00Z","12/28 22:59",201,1004,,"2020-12-29T03:59:00Z",1259845,53470,1204992,,201,,,,,,,,,,,,,,"02",175,0,44581,5448,44581,,1,10,"482526ae1a526dd6e3f8f93eb903715cb14d88af",0,0,0,0,0,""
20201228,"AK",44406,,,,"totalTestsViral",1254397,78,994,,,10,,,"12/28/2020 03:59","2020-12-28T03:59:00Z","12/27 22:59",200,994,,"2020-12-28T03:59:00Z",1254397,53213,1199815,,200,,,,,,,,,,,,,,"02",126,0,44406,4146,44406,,0,2,"db91b32eab559ff5a65850013a9fe52cd44a377a",0,0,0,0,0,""
20201227,"AK",44280,,,,"totalTestsViral",1250251,71,992,,,9,,,"12/27/2020 03:59","2020-12-27T03:59:00Z","12/26 22:59",200,992,,"2020-12-27T03:59:00Z",1250251,53053,1195838,,200,,,,,,,,,,,,,,"02",290,0,44280,5188,44280,,0,1,"ab7a86648fe50bddc7f18cefe412c39deb05b604",0,0,0,0,0,""
20201226,"AK",43990,,,,"totalTestsViral",1245063,79,991,,,10,,,"12/26/2020 03:59","2020-12-26T03:59:00Z","12/25 22:59",200,991,,"2020-12-26T03:59:00Z",1245063,52716,1190997,,200,,,,,,,,,,,,,,"02",361,0,43990,17328,43990,,1,8,"4b97866f03ccec8efbd2445dc0c3308e1a8cc3cc",0,0,0,0,0,""
20201225,"AK",43629,,,,"totalTestsViral",1227735,105,983,,,14,,,"12/24/2020 03:59","2020-12-24T03:59:00Z","12/23 22:59",199,983,,"2020-12-24T03:59:00Z",1227735,52047,1174340,,199,,,,,,,,,,,,,,"02",0,0,43629,0,43629,,0,0,"082a24704ea2d00971ab189b1a9c721feac7149b",0,0,0,0,0,""
20201224,"AK",43629,,,,"totalTestsViral",1227735,105,983,,,14,,,"12/24/2020 03:59","2020-12-24T03:59:00Z","12/23 22:59",199,983,,"2020-12-24T03:59:00Z",1227735,52047,1174340,,199,,,,,,,,,,,,,,"02",268,0,43629,5708,43629,,2,22,"43ebb900117f105679037857d1289f1401b13660",0,0,0,0,0,""
20201223,"AK",43361,,,,"totalTestsViral",1222027,111,961,,,15,,,"12/23/2020 03:59","2020-12-23T03:59:00Z","12/22 22:59",197,961,,"2020-12-23T03:59:00Z",1222027,51776,1168903,,197,,,,,,,,,,,,,,"02",360,0,43361,6745,43361,,3,13,"e99faacacef1a4f07ae3d3264bec42ea21d9b313",0,0,0,0,0,""
20201222,"AK",43001,,,,"totalTestsViral",1215282,121,948,,,13,,,"12/22/2020 03:59","2020-12-22T03:59:00Z","12/21 22:59",194,948,,"2020-12-22T03:59:00Z",1215282,51404,1162534,,194,,,,,,,,,,,,,,"02",438,0,43001,14305,43001,,10,11,"99bc386f8368a008030674bbf96aa3d7b66eba4e",0,0,0,0,0,""
20201221,"AK",42563,,,,"totalTestsViral",1200977,123,937,,,13,,,"12/21/2020 03:59","2020-12-21T03:59:00Z","12/20 22:59",184,937,,"2020-12-21T03:59:00Z",1200977,50652,1148986,,184,,,,,,,,,,,,,,"02",150,0,42563,4471,42563,,0,2,"a2832751036255e7bf2b3008dc89de4b08b70251",0,0,0,0,0,""
20201220,"AK",42413,,,,"totalTestsViral",1196506,127,935,,,13,,,"12/20/2020 03:59","2020-12-20T03:59:00Z","12/19 22:59",184,935,,"2020-12-20T03:59:00Z",1196506,50542,1144626,,184,,,,,,,,,,,,,,"02",178,0,42413,3388,42413,,0,0,"ad2a0c7d39d335f2698876950867eb1f94d53db2",0,0,0,0,0,""
20201219,"AK",42235,,,,"totalTestsViral",1193118,146,935,,,13,,,"12/19/2020 03:59","2020-12-19T03:59:00Z","12/18 22:59",184,935,,"2020-12-19T03:59:00Z",1193118,50438,1141344,,184,,,,,,,,,,,,,,"02",330,0,42235,8196,42235,,1,7,"011c8097a1d872f24db36569ad7529d7179e38fc",0,0,0,0,0,""
20201218,"AK",41905,,,,"totalTestsViral",1184922,142,928,,,13,,,"12/18/2020 03:59","2020-12-18T03:59:00Z","12/17 22:59",183,928,,"2020-12-18T03:59:00Z",1184922,50044,1133565,,183,,,,,,,,,,,,,,"02",487,0,41905,9199,41905,,0,7,"668e68850148b34e64b57bbc2e1d49e9a9c7f0bd",0,0,0,0,0,""
20201217,"AK",41418,,,,"totalTestsViral",1175723,140,921,,,14,,,"12/17/2020 03:59","2020-12-17T03:59:00Z","12/16 22:59",183,921,,"2020-12-17T03:59:00Z",1175723,49566,1124849,,183,,,,,,,,,,,,,,"02",377,0,41418,9578,41418,,2,0,"5d1481921a6039d1c280398ca0bd4f4383692fa7",0,0,0,0,0,""
20201216,"AK",41041,,,,"totalTestsViral",1166145,146,921,,,15,,,"12/16/2020 03:59","2020-12-16T03:59:00Z","12/15 22:59",181,921,,"2020-12-16T03:59:00Z",1166145,49120,1115724,,181,,,,,,,,,,,,,,"02",603,0,41041,8278,41041,,2,13,"eea989e4b811b09b985df4dffdcc1751f31345aa",0,0,0,0,0,""
20201215,"AK",40438,,,,"totalTestsViral",1157867,140,908,,,13,,,"12/15/2020 03:59","2020-12-15T03:59:00Z","12/14 22:59",179,908,,"2020-12-15T03:59:00Z",1157867,48598,1107974,,179,,,,,,,,,,,,,,"02",278,0,40438,10307,40438,,3,19,"75de6da9864c5dfd9a0597cbdeb635b4c4528e17",0,0,0,0,0,""
20201214,"AK",40160,,,,"totalTestsViral",1147560,140,889,,,12,,,"12/14/2020 03:59","2020-12-14T03:59:00Z","12/13 22:59",176,889,,"2020-12-14T03:59:00Z",1147560,47796,1098479,,176,,,,,,,,,,,,,,"02",422,0,40160,4462,40160,,0,3,"00b0106ce663fed58467e4436cc8e4bb04c8bdef",0,0,0,0,0,""
20201213,"AK",39738,,,,"totalTestsViral",1143098,139,886,,,15,,,"12/13/2020 03:59","2020-12-13T03:59:00Z","12/12 22:59",176,886,,"2020-12-13T03:59:00Z",1143098,47599,1094215,,176,,,,,,,,,,,,,,"02",637,0,39738,9680,39738,,0,3,"ea63cd0278fb81444f535f696cc1c5712ad73111",0,0,0,0,0,""
20201212,"AK",39101,,,,"totalTestsViral",1133418,146,883,,,18,,,"12/12/2020 03:59","2020-12-12T03:59:00Z","12/11 22:59",176,883,,"2020-12-12T03:59:00Z",1133418,47061,1085086,,176,,,,,,,,,,,,,,"02",517,0,39101,9873,39101,,18,14,"30802fe1995d0b40cc100e5cdeb615d67eaf1e34",0,0,0,0,0,""
20201211,"AK",38584,,,,"totalTestsViral",1123545,146,869,,,17,,,"12/11/2020 03:59","2020-12-11T03:59:00Z","12/10 22:59",158,869,,"2020-12-11T03:59:00Z",1123545,46586,1075703,,158,,,,,,,,,,,,,,"02",622,0,38584,10185,38584,,3,9,"bc95ae721d2eb5f2960ef8e100c949bd23f7cecc",0,0,0,0,0,""
20201210,"AK",37962,,,,"totalTestsViral",1113360,164,860,,,17,,,"12/10/2020 03:59","2020-12-10T03:59:00Z","12/09 22:59",155,860,,"2020-12-10T03:59:00Z",1113360,45990,1066119,,155,,,,,,,,,,,,,,"02",620,0,37962,13805,37962,,5,13,"77c92c0db4202f2ca1d541d861bb3fac6de11b29",0,0,0,0,0,""
20201209,"AK",37342,,,,"totalTestsViral",1099555,165,847,,,19,,,"12/9/2020 03:59","2020-12-09T03:59:00Z","12/08 22:59",150,847,,"2020-12-09T03:59:00Z",1099555,45071,1053252,,150,,,,,,,,,,,,,,"02",584,0,37342,10577,37342,,4,20,"01d076449a2417241aef6b1dc7b69bf78b4d752f",0,0,0,0,0,""
20201208,"AK",36758,,,,"totalTestsViral",1088978,159,827,,,21,,,"12/8/2020 03:59","2020-12-08T03:59:00Z","12/07 22:59",146,827,,"2020-12-08T03:59:00Z",1088978,44423,1043338,,146,,,,,,,,,,,,,,"02",562,0,36758,6838,36758,,0,22,"005c10fc8e34d3ecb4306fe8a9258f39a2f93755",0,0,0,0,0,""
20201207,"AK",36196,,,,"totalTestsViral",1082140,166,805,,,24,,,"12/7/2020 03:59","2020-12-07T03:59:00Z","12/06 22:59",146,805,,"2020-12-07T03:59:00Z",1082140,43903,1037022,,146,,,,,,,,,,,,,,"02",476,0,36196,4364,36196,,3,6,"f7b699646da1474bfe6c0269d16be1d6ced94151",0,0,0,0,0,""
20201206,"AK",35720,,,,"totalTestsViral",1077776,164,799,,,21,,,"12/6/2020 03:59","2020-12-06T03:59:00Z","12/05 22:59",143,799,,"2020-12-06T03:59:00Z",1077776,43746,1032815,,143,,,,,,,,,,,,,,"02",757,0,35720,10545,35720,,0,0,"82e1186d998de30d9940425744b244ee8c70124c",0,0,0,0,0,""
20201205,"AK",34963,,,,"totalTestsViral",1067231,166,799,,,24,,,"12/5/2020 03:59","2020-12-05T03:59:00Z","12/04 22:59",143,799,,"2020-12-05T03:59:00Z",1067231,42805,1023349,,143,,,,,,,,,,,,,,"02",922,0,34963,16862,34963,,1,5,"2c77452ee3e1ce3718d28ce1e426c80a5cc0632d",0,0,0,0,0,""
20201204,"AK",34041,,,,"totalTestsViral",1050369,151,794,,,23,,,"12/4/2020 03:59","2020-12-04T03:59:00Z","12/03 22:59",142,794,,"2020-12-04T03:59:00Z",1050369,41298,1008002,,142,,,,,,,,,,,,,,"02",750,0,34041,9864,34041,,12,11,"28498b5e648d1f5ae21c94552684eefdee868290",0,0,0,0,0,""
20201203,"AK",33291,,,,"totalTestsViral",1040505,157,783,,,24,,,"12/3/2020 03:59","2020-12-03T03:59:00Z","12/02 22:59",130,783,,"2020-12-03T03:59:00Z",1040505,40607,998843,,130,,,,,,,,,,,,,,"02",760,0,33291,15862,33291,,8,15,"d3e346bf97304f7ffe939b823a8e9f3e1840b5f7",0,0,0,0,0,""
20201202,"AK",32531,,,,"totalTestsViral",1024643,164,768,,,23,,,"12/2/2020 03:59","2020-12-02T03:59:00Z","12/01 22:59",122,768,,"2020-12-02T03:59:00Z",1024643,39543,984058,,122,,,,,,,,,,,,,,"02",697,0,32531,6015,32531,,0,19,"af68e3f1f57e5b1759092d44957db6edbb09c040",0,0,0,0,0,""
20201201,"AK",31834,,,,"totalTestsViral",1018628,155,749,,,21,,,"12/1/2020 03:59","2020-12-01T03:59:00Z","11/30 22:59",122,749,,"2020-12-01T03:59:00Z",1018628,38921,978681,,122,,,,,,,,,,,,,,"02",511,0,31834,7232,31834,,1,24,"0a25ef3c1bab7f645bab3cbed699d16fbb3794de",0,0,0,0,0,""
20201130,"AK",31323,,,,"totalTestsViral",1011396,162,725,,,27,,,"11/30/2020 03:59","2020-11-30T03:59:00Z","11/29 22:59",121,725,,"2020-11-30T03:59:00Z",1011396,38426,971946,,121,,,,,,,,,,,,,,"02",507,0,31323,5216,31323,,0,3,"489a7687d7d246065a44667efa5564fac1d9a0e1",0,0,0,0,0,""
20201129,"AK",30816,,,,"totalTestsViral",1006180,159,722,,,27,,,"11/29/2020 03:59","2020-11-29T03:59:00Z","11/28 22:59",121,722,,"2020-11-29T03:59:00Z",1006180,38165,966992,,121,,,,,,,,,,,,,,"02",612,0,30816,7126,30816,,0,1,"b002e693ed95f91124389b637299c07a2937fb4a",0,0,0,0,0,""
20201128,"AK",30204,,,,"totalTestsViral",999054,155,721,,,25,,,"11/28/2020 03:59","2020-11-28T03:59:00Z","11/27 22:59",121,721,,"2020-11-28T03:59:00Z",999054,37764,960276,,121,,,,,,,,,,,,,,"02",650,0,30204,8281,30204,,2,30,"04a658181324fdcc57f0399b9ddeac9d4971c7e9",0,0,0,0,0,""
20201127,"AK",29554,,,,"totalTestsViral",990773,159,691,,,25,,,"11/27/2020 03:59","2020-11-27T03:59:00Z","11/26 22:59",119,691,,"2020-11-27T03:59:00Z",990773,37016,952768,,119,,,,,,,,,,,,,,"02",662,0,29554,21200,29554,,0,3,"b8e4dcae8fb71f774ff95b39b70fb0cce0af5d27",0,0,0,0,0,""
20201126,"AK",28892,,,,"totalTestsViral",969573,145,688,,,22,,,"11/25/2020 03:59","2020-11-25T03:59:00Z","11/24 22:59",119,688,,"2020-11-25T03:59:00Z",969573,35191,933412,,119,,,,,,,,,,,,,,"02",553,0,28892,15297,28892,,3,25,"57a3a24c346458df51d3a2cbb4b0a5cab106eb46",0,0,0,0,0,""
20201125,"AK",28339,,,,"totalTestsViral",954276,145,663,,,22,,,"11/25/2020 03:59","2020-11-25T03:59:00Z","11/24 22:59",116,663,,"2020-11-25T03:59:00Z",954276,33842,919877,,116,,,,,,,,,,,,,,"02",670,0,28339,10875,28339,,0,32,"87fe191eae45f809a4e3cf7b2b917e448a20d524",0,0,0,0,0,""
20201124,"AK",27669,,,,"totalTestsViral",943401,144,631,,,21,,,"11/24/2020 03:59","2020-11-24T03:59:00Z","11/23 22:59",116,631,,"2020-11-24T03:59:00Z",943401,33242,909608,,116,,,,,,,,,,,,,,"02",584,0,27669,10385,27669,,13,14,"d001422f9146586503e5e6ca8c57ca59fccee5ca",0,0,0,0,0,""
20201123,"AK",27085,,,,"totalTestsViral",933016,146,617,,,19,,,"11/23/2020 03:59","2020-11-23T03:59:00Z","11/22 22:59",103,617,,"2020-11-23T03:59:00Z",933016,32270,900198,,103,,,,,,,,,,,,,,"02",498,0,27085,6655,27085,,0,5,"3ec99cb68e7dcd81fd43cde011d87e57d62c7f4d",0,0,0,0,0,""
20201122,"AK",26587,,,,"totalTestsViral",926361,133,612,,,17,,,"11/22/2020 03:59","2020-11-22T03:59:00Z","11/21 22:59",103,612,,"2020-11-22T03:59:00Z",926361,31927,893886,,103,,,,,,,,,,,,,,"02",543,0,26587,7616,26587,,1,0,"fc400bb528d4d0a15cca9e82470a702fa8298e76",0,0,0,0,0,""
20201121,"AK",26044,,,,"totalTestsViral",918745,129,612,,,14,,,"11/21/2020 03:59","2020-11-21T03:59:00Z","11/20 22:59",102,612,,"2020-11-21T03:59:00Z",918745,31523,886676,,102,,,,,,,,,,,,,,"02",675,0,26044,14033,26044,,1,6,"95465e4f0be219e81ef78f8ad8e7e578d9025656",0,0,0,0,0,""
20201120,"AK",25369,,,,"totalTestsViral",904712,127,606,,,15,,,"11/20/2020 03:59","2020-11-20T03:59:00Z","11/19 22:59",101,606,,"2020-11-20T03:59:00Z",904712,30178,874013,,101,,,,,,,,,,,,,,"02",460,0,25369,5913,25369,,0,13,"78aa20191b03bd8270ad455501cf4ad29c670adc",0,0,0,0,0,""
20201119,"AK",24909,,,,"totalTestsViral",898799,139,593,,,14,,,"11/19/2020 03:59","2020-11-19T03:59:00Z","11/18 22:59",101,593,,"2020-11-19T03:59:00Z",898799,29798,868482,,101,,,,,,,,,,,,,,"02",490,0,24909,13241,24909,,1,9,"4be0a79f3555e21a0eec94d50ed8692bd78fbbda",0,0,0,0,0,""
20201118,"AK",24419,,,,"totalTestsViral",885558,147,584,,,15,,,"11/18/2020 03:59","2020-11-18T03:59:00Z","11/17 22:59",100,584,,"2020-11-18T03:59:00Z",885558,28879,856173,,100,,,,,,,,,,,,,,"02",545,0,24419,6936,24419,,0,22,"d82c5508094aa1011c0f55e41b4fa6f34550ac78",0,0,0,0,0,""
20201117,"AK",23874,,,,"totalTestsViral",878622,136,562,,,11,,,"11/17/2020 03:59","2020-11-17T03:59:00Z","11/16 22:59",100,562,,"2020-11-17T03:59:00Z",878622,28361,849757,,100,,,,,,,,,,,,,,"02",634,0,23874,6275,23874,,2,3,"93359a047bff61493bb14a896a0d6e4e9ecc6d0c",0,0,0,0,0,""
20201116,"AK",23240,,,,"totalTestsViral",872347,143,559,,,14,,7165,"11/16/2020 03:59","2020-11-16T03:59:00Z","11/15 22:59",98,559,,"2020-11-16T03:59:00Z",872347,27793,844052,,98,,,,,,,,,,,,,,"02",578,0,23240,4965,23240,,0,9,"a2327663851b95bf4cd076dcc79d27d7f1f19acb",0,0,0,0,0,""
20201115,"AK",22662,,,,"totalTestsViral",867382,141,550,,,7,,7164,"11/15/2020 03:59","2020-11-15T03:59:00Z","11/14 22:59",98,550,,"2020-11-15T03:59:00Z",867382,27414,839467,,98,,,,,,,,,,,,,,"02",642,0,22662,5118,22662,,0,7,"eb0c4b9671bcf827a5d6f9d4f34691c25e656e5a",0,0,0,0,0,""
20201114,"AK",22020,,,,"totalTestsViral",862264,125,543,,,11,,7162,"11/14/2020 03:59","2020-11-14T03:59:00Z","11/13 22:59",98,543,,"2020-11-14T03:59:00Z",862264,27004,834759,,98,,,,,,,,,,,,,,"02",734,0,22020,17598,22020,,2,1,"2515c47da03c374eafe35f0cd794361aa1006651",0,0,0,0,0,""
20201113,"AK",21286,,,,"totalTestsViral",844666,113,542,,,8,,7161,"11/12/2020 03:59","2020-11-12T03:59:00Z","11/11 22:59",96,542,,"2020-11-12T03:59:00Z",844666,25793,818384,,96,,,,,,,,,,,,,,"02",584,0,21286,0,21286,,0,5,"4c49af99671a21760985309a82159e315b967447",0,0,0,0,0,""
20201112,"AK",20702,,,,"totalTestsViral",844666,113,537,,,8,,7161,"11/12/2020 03:59","2020-11-12T03:59:00Z","11/11 22:59",96,537,,"2020-11-12T03:59:00Z",844666,25793,818384,,96,,,,,,,,,,,,,,"02",481,0,20702,10076,20702,,0,9,"2a88a146422e096fb1c576b8decff0397c64a3ec",0,0,0,0,0,""
20201111,"AK",20221,,,,"totalTestsViral",834590,117,528,,,7,,7160,"11/11/2020 03:59","2020-11-11T03:59:00Z","11/10 22:59",96,528,,"2020-11-11T03:59:00Z",834590,24766,809341,,96,,,,,,,,,,,,,,"02",487,0,20221,6450,20221,,4,8,"3220a01ea44690651ed0286368f4829f8728228b",0,0,0,0,0,""
20201110,"AK",19734,,,,"totalTestsViral",828140,120,520,,,10,,7161,"11/10/2020 03:59","2020-11-10T03:59:00Z","11/09 22:59",92,520,,"2020-11-10T03:59:00Z",828140,24234,803424,,92,,,,,,,,,,,,,,"02",538,0,19734,60143,19734,,8,6,"df7105cd819e781c71d09420645119617b279de7",0,0,0,0,0,""
20201109,"AK",19196,,,,"totalTestsViral",767997,119,514,,,9,,7161,"11/9/2020 03:59","2020-11-09T03:59:00Z","11/08 22:59",84,514,,"2020-11-09T03:59:00Z",767997,22430,745182,,84,,,,,,,,,,,,,,"02",464,0,19196,-12177,19196,,0,5,"f375e09812459a4bfe698000f532aa03ae38f5f3",0,0,0,0,0,""
20201108,"AK",18732,,,,"totalTestsViral",780174,119,509,,,7,,7161,"11/8/2020 03:59","2020-11-08T03:59:00Z","11/07 22:59",84,509,,"2020-11-08T03:59:00Z",780174,19277,760511,,84,,,,,,,,,,,,,,"02",511,0,18732,-520,18732,,0,10,"21b09d3ce7d66abcf4689e1a41a70e90bcb41262",0,0,0,0,0,""
20201107,"AK",18221,,,,"totalTestsViral",780694,105,499,,,8,,7157,"11/7/2020 03:59","2020-11-07T03:59:00Z","11/06 22:59",84,499,,"2020-11-07T03:59:00Z",780694,19376,760934,,84,,,,,,,,,,,,,,"02",603,0,18221,-607,18221,,0,8,"fb44326b71d72d27fc05d6a2ffd6010ffc96a81f",0,0,0,0,0,""
20201106,"AK",17618,,,,"totalTestsViral",781301,106,491,,,7,,7122,"11/6/2020 03:59","2020-11-06T03:59:00Z","11/05 22:59",84,491,,"2020-11-06T03:59:00Z",781301,19404,761522,,84,,,,,,,,,,,,,,"02",507,0,17618,-525,17618,,0,9,"bb78a14b3d3b0fbc5747758e7e52ae421d3087d8",0,0,0,0,0,""
20201105,"AK",17111,,,,"totalTestsViral",781826,104,482,,,7,,7125,"11/5/2020 03:59","2020-11-05T03:59:00Z","11/04 22:59",84,482,,"2020-11-05T03:59:00Z",781826,24089,757381,,84,,,,,,,,,,,,,,"02",313,0,17111,154068,17111,,0,6,"63db0f21ef7086e039c227d42cea86236cfb30de",0,0,0,0,0,""
20201104,"AK",16798,,,,"totalTestsViral",627758,95,476,,,9,,7124,"11/4/2020 03:59","2020-11-04T03:59:00Z","11/03 22:59",84,476,,"2020-11-04T03:59:00Z",627758,16353,611067,,84,,,,,,,,,,,,,,"02",408,0,16798,3003,16798,,0,4,"348f31fc9ee9a87a2b39f60f0c9c891dbb03ad54",0,0,0,0,0,""
20201103,"AK",16390,,,,"totalTestsViral",624755,97,472,,,9,,7113,"11/3/2020 03:59","2020-11-03T03:59:00Z","11/02 22:59",84,472,,"2020-11-03T03:59:00Z",624755,16196,608225,,84,,,,,,,,,,,,,,"02",383,0,16390,4585,16390,,0,2,"c219db558f1c485b61dc91af6a400e2c605b9de5",0,0,0,0,0,""
20201102,"AK",16007,,,,"totalTestsViral",620170,97,470,,,6,,7110,"11/2/2020 03:59","2020-11-02T03:59:00Z","11/01 22:59",84,470,,"2020-11-02T03:59:00Z",620170,15834,604003,,84,,,,,,,,,,,,,,"02",344,0,16007,15963,16007,,1,8,"d901c248fabfa64d8b7b77e159e77e92f6249ece",0,0,0,0,0,""
20201101,"AK",15663,,,,"totalTestsViral",604207,98,462,,,5,,7104,"11/1/2020 03:59","2020-11-01T03:59:00Z","10/31 23:59",83,462,,"2020-11-01T03:59:00Z",604207,14906,588975,,83,,,,,,,,,,,,,,"02",351,0,15663,0,15663,,1,7,"6e44c39c1011f2b486b5b3065bd0aaf9542adca0",0,0,0,0,0,""
20201031,"AK",15312,,,,"totalTestsViral",604207,94,455,,,6,,7099,"10/31/2020 03:59","2020-10-31T03:59:00Z","10/30 23:59",82,455,,"2020-10-31T03:59:00Z",604207,14906,588975,,82,,,,,,,,,,,,,,"02",454,0,15312,17884,15312,,1,7,"f910ab513a28dd99c5b137eaf88b5412471e851b",0,0,0,0,0,""
20201030,"AK",14858,,,,"totalTestsViral",586323,90,448,,,6,,7096,"10/30/2020 03:59","2020-10-30T03:59:00Z","10/29 23:59",81,448,,"2020-10-30T03:59:00Z",586323,13775,572229,,81,,,,,,,,,,,,,,"02",377,0,14858,2055,14858,,4,6,"1cb708facfb84800efdea31faa2a3c7ad073a276",0,0,0,0,0,""
20201029,"AK",14481,,,,"totalTestsViral",584268,89,442,,,6,,7094,"10/29/2020 03:59","2020-10-29T03:59:00Z","10/28 23:59",77,442,,"2020-10-29T03:59:00Z",584268,13641,570308,,77,,,,,,,,,,,,,,"02",350,0,14481,3669,14481,,6,8,"56f5b78e50761ccd1ef7f3b8024fdd97fc9d251c",0,0,0,0,0,""
20201028,"AK",14131,,,,"totalTestsViral",580599,80,434,,,8,,7067,"10/28/2020 03:59","2020-10-28T03:59:00Z","10/27 23:59",71,434,,"2020-10-28T03:59:00Z",580599,13393,566887,,71,,,,,,,,,,,,,,"02",352,0,14131,3170,14131,,1,9,"e7c6c4d9b3b20276344db1d4c738e5df8a121552",0,0,0,0,0,""
20201027,"AK",13779,,,,"totalTestsViral",577429,81,425,,,8,,7016,"10/27/2020 03:59","2020-10-27T03:59:00Z","10/26 23:59",70,425,,"2020-10-27T03:59:00Z",577429,13245,563865,,70,,,,,,,,,,,,,,"02",388,0,13779,6585,13779,,2,1,"8187751a65878c4e2790abfe231a0a7ac467563c",0,0,0,0,0,""
20201026,"AK",13391,,,,"totalTestsViral",570844,50,424,,,9,,6948,"10/26/2020 03:59","2020-10-26T03:59:00Z","10/25 23:59",68,424,,"2020-10-26T03:59:00Z",570844,12773,557753,,68,,,,,,,,,,,,,,"02",350,0,13391,10875,13391,,0,3,"c96b697ea64a29e43c3a98d49372a0e51058fee1",0,0,0,0,0,""
20201025,"AK",13041,,,,"totalTestsViral",559969,58,421,,,9,,6946,"10/25/2020 03:59","2020-10-25T03:59:00Z","10/24 23:59",68,421,,"2020-10-25T03:59:00Z",559969,12110,547543,,68,,,,,,,,,,,,,,"02",518,0,13041,7223,13041,,0,2,"b1d3ec69b506af984093158e423cbac0995610ce",0,0,0,0,0,""
20201024,"AK",12523,,,,"totalTestsViral",552746,58,419,,,8,,6939,"10/24/2020 03:59","2020-10-24T03:59:00Z","10/23 23:59",68,419,,"2020-10-24T03:59:00Z",552746,11644,540786,,68,,,,,,,,,,,,,,"02",356,0,12523,0,12523,,0,4,"5035e074f038c7e8765b3a28add1cd596fa11052",0,0,0,0,0,""
20201023,"AK",12167,,,,"totalTestsViral",552746,59,415,,,7,,6915,"10/23/2020 03:59","2020-10-23T03:59:00Z","10/22 23:59",68,415,,"2020-10-23T03:59:00Z",552746,11644,540786,,68,,,,,,,,,,,,,,"02",248,0,12167,4037,12167,,0,14,"338535fee63387c2c011f5288c6e404bbc4a8751",0,0,0,0,0,""
20201022,"AK",11919,,,,"totalTestsViral",548709,41,401,,,5,,6812,"10/22/2020 03:59","2020-10-22T03:59:00Z","10/21 23:59",68,401,,"2020-10-22T03:59:00Z",548709,11348,537045,,68,,,,,,,,,,,,,,"02",239,0,11919,1569,11919,,0,6,"39ede9c32eb0301b04f69ccf92f4ee279e929486",0,0,0,0,0,""
20201021,"AK",11680,,,,"totalTestsViral",547140,41,395,,,8,,6751,"10/21/2020 03:59","2020-10-21T03:59:00Z","10/20 23:59",68,395,,"2020-10-21T03:59:00Z",547140,11195,535629,,68,,,,,,,,,,,,,,"02",224,0,11680,615,11680,,1,6,"eb59b2428a069d895ae65a18f2b29ca55066d000",0,0,0,0,0,""
20201020,"AK",11456,,,,"totalTestsViral",546525,38,389,,,10,,6681,"10/20/2020 03:59","2020-10-20T03:59:00Z","10/19 23:59",67,389,,"2020-10-20T03:59:00Z",546525,11169,535040,,67,,,,,,,,,,,,,,"02",231,0,11456,10302,11456,,0,2,"1a10c18230d2dda86f5d7dbb000c06b81d63db27",0,0,0,0,0,""
20201019,"AK",11225,,,,"totalTestsViral",536223,65,387,,,8,,6516,"10/19/2020 03:59","2020-10-19T03:59:00Z","10/18 23:59",67,387,,"2020-10-19T03:59:00Z",536223,10859,525048,,67,,,,,,,,,,,,,,"02",204,0,11225,3512,11225,,0,4,"9d02a74e2344b53f8b0e6606c7a8a31c25c75853",0,0,0,0,0,""
20201018,"AK",11021,,,,"totalTestsViral",532711,73,383,,,11,,6488,"10/18/2020 03:59","2020-10-18T03:59:00Z","10/17 23:59",67,383,,"2020-10-18T03:59:00Z",532711,10729,521666,,67,,,,,,,,,,,,,,"02",210,0,11021,2211,11021,,0,6,"07ba731013f07b797822dc1498ac18c0eb2930a6",0,0,0,0,0,""
20201017,"AK",10811,,,,"totalTestsViral",530500,68,377,,,9,,6448,"10/17/2020 03:59","2020-10-17T03:59:00Z","10/16 23:59",67,377,,"2020-10-17T03:59:00Z",530500,10678,519506,,67,,,,,,,,,,,,,,"02",210,0,10811,7836,10811,,1,4,"7dace138e9aa9bb45c77745e61ad437662a43851",0,0,0,0,0,""
20201016,"AK",10601,,,,"totalTestsViral",522664,59,373,,,8,,6237,"10/16/2020 03:59","2020-10-16T03:59:00Z","10/15 23:59",66,373,,"2020-10-16T03:59:00Z",522664,10337,512012,,66,,,,,,,,,,,,,,"02",221,0,10601,3203,10601,,1,8,"44fb00e470e944ac92da78fec4ac86316baf7a65",0,0,0,0,0,""
20201015,"AK",10380,,,,"totalTestsViral",519461,60,365,,,7,,6066,"10/15/2020 03:59","2020-10-15T03:59:00Z","10/14 23:59",65,365,,"2020-10-15T03:59:00Z",519461,10178,508970,,65,,,,,,,,,,,,,,"02",166,0,10380,2284,10380,,1,9,"97e859ac6283afe9e6ea9915b117370dfc311b28",0,0,0,0,0,""
20201014,"AK",10214,,,,"totalTestsViral",517177,56,356,,,7,,5950,"10/14/2020 03:59","2020-10-14T03:59:00Z","10/13 23:59",64,356,,"2020-10-14T03:59:00Z",517177,10109,506755,,64,,,,,,,,,,,,,,"02",155,0,10214,2388,10214,,4,1,"af9c3b0d54b011c4e89cb6a3e832e3f115732dc0",0,0,0,0,0,""
20201013,"AK",10059,,,,"totalTestsViral",514789,59,355,,,8,,5909,"10/13/2020 03:59","2020-10-13T03:59:00Z","10/12 23:59",60,355,,"2020-10-13T03:59:00Z",514789,10057,504419,,60,,,,,,,,,,,,,,"02",156,0,10059,8862,10059,,0,3,"c1f804bc2f7794e7757e5dcff545d19a8eeecc18",0,0,0,0,0,""
20201012,"AK",9903,,,,"totalTestsViral",505927,52,352,,,8,,5802,"10/12/2020 03:59","2020-10-12T03:59:00Z","10/11 23:59",60,352,,"2020-10-12T03:59:00Z",505927,9748,495867,,60,,,,,,,,,,,,,,"02",191,0,9903,2930,9903,,0,7,"ccc2c165769caf98a03daf0db6e340ae35f07207",0,0,0,0,0,""
20201011,"AK",9712,,,,"totalTestsViral",502997,57,345,,,7,,5789,"10/11/2020 03:59","2020-10-11T03:59:00Z","10/10 23:59",60,345,,"2020-10-11T03:59:00Z",502997,9620,493071,,60,,,,,,,,,,,,,,"02",250,0,9712,3744,9712,,0,4,"8e39df54e2d4066074eeed18a82ab168e0adc455",0,0,0,0,0,""
20201010,"AK",9462,,,,"totalTestsViral",499253,66,341,,,10,,5761,"10/10/2020 03:59","2020-10-10T03:59:00Z","10/09 23:59",60,341,,"2020-10-10T03:59:00Z",499253,9466,489481,,60,,,,,,,,,,,,,,"02",230,0,9462,6183,9462,,0,2,"31447e3b1a1eedbb393998769299b85283f9cbe8",0,0,0,0,0,""
20201009,"AK",9232,,,,"totalTestsViral",493070,51,339,,,6,,5734,"10/9/2020 03:59","2020-10-09T03:59:00Z","10/08 23:59",60,339,,"2020-10-09T03:59:00Z",493070,9256,483521,,60,,,,,,,,,,,,,,"02",187,0,9232,1899,9232,,0,2,"d706532231b50970e677a009ff18cc972ca13a11",0,0,0,0,0,""
20201008,"AK",9045,,,,"totalTestsViral",491171,46,337,,,6,,5672,"10/8/2020 03:59","2020-10-08T03:59:00Z","10/07 23:59",60,337,,"2020-10-08T03:59:00Z",491171,9133,481745,,60,,,,,,,,,,,,,,"02",134,0,9045,1097,9045,,1,4,"f5f0732b7ea1983ff7f44114649c548cf6cf93c1",0,0,0,0,0,""
20201007,"AK",8911,,,,"totalTestsViral",490074,46,333,,,6,,5626,"10/7/2020 03:59","2020-10-07T03:59:00Z","10/06 23:59",59,333,,"2020-10-07T03:59:00Z",490074,9099,480682,,59,,,,,,,,,,,,,,"02",121,0,8911,10700,8911,,1,5,"647be1f5728cda41f84b9cd436240c93e6088b2d",0,0,0,0,0,""
20201006,"AK",8790,,,,"totalTestsViral",479374,45,328,,,6,,5455,"10/6/2020 16:00","2020-10-06T16:00:00Z","10/06 12:00",58,328,,"2020-10-06T16:00:00Z",479374,8790,470291,,58,,,,,,,,,,,,,,"02",147,0,8790,0,8790,,0,3,"47ddf631bc4ad42d6a0501a5bfefe19c39af586c",0,0,0,0,0,""
20201005,"AK",8643,,,,"totalTestsViral",479374,45,325,,,6,,5455,"10/5/2020 03:59","2020-10-05T03:59:00Z","10/04 23:59",58,325,,"2020-10-05T03:59:00Z",479374,8790,470291,,58,,,,,,,,,,,,,,"02",196,0,8643,2556,8643,,0,1,"32f83994b1ad919598513af24f8a33f1c62d9ccf",0,0,0,0,0,""
20201004,"AK",8447,,,,"totalTestsViral",476818,51,324,,,6,,5281,"10/4/2020 03:59","2020-10-04T03:59:00Z","10/03 23:59",58,324,,"2020-10-04T03:59:00Z",476818,8642,467883,,58,,,,,,,,,,,,,,"02",141,0,8447,3562,8447,,0,2,"63ec31e283aeb0f38c58fb4c2596791eff6998de",0,0,0,0,0,""
20201003,"AK",8306,,,,"totalTestsViral",473256,39,322,,,5,,5199,"10/3/2020 03:59","2020-10-03T03:59:00Z","10/02 23:59",58,322,,"2020-10-03T03:59:00Z",473256,8446,464517,,58,,,,,,,,,,,,,,"02",139,0,8306,3966,8306,,1,2,"56c1c42a83db4fcc683a73fa6cf087e4078dbd53",0,0,0,0,0,""
20201002,"AK",8167,,,,"totalTestsViral",469290,41,320,,,6,,5042,"10/2/2020 03:59","2020-10-02T03:59:00Z","10/01 23:59",57,320,,"2020-10-02T03:59:00Z",469290,8201,460796,,57,,,,,,,,,,,,,,"02",141,0,8167,6967,8167,,0,3,"489e418e866cb9f3a41ebb48fd40a97ff42f332a",0,0,0,0,0,""
20201001,"AK",8026,,,,"totalTestsViral",462323,42,317,,,6,,4838,"10/1/2020 03:59","2020-10-01T03:59:00Z","09/30 23:59",57,317,,"2020-10-01T03:59:00Z",462323,8002,454030,,57,,,,,,,,,,,,,,"02",137,0,8026,5116,8026,,1,2,"9d6b75b85baf2c7440a7a31ca72c02cb2f845c1d",0,0,0,0,0,""
20200930,"AK",7889,,,,"totalTestsViral",457207,53,315,,,7,,4555,"9/30/2020 03:59","2020-09-30T03:59:00Z","09/29 23:59",56,315,,"2020-09-30T03:59:00Z",457207,7807,449109,,56,,,,,,,,,,,,,,"02",104,0,7889,6151,7889,,0,2,"b03559946b69611b042fd76ad275ff7ed1709841",0,0,0,0,0,""
20200929,"AK",7785,,,,"totalTestsViral",451056,49,313,,,7,,4324,"9/29/2020 03:59","2020-09-29T03:59:00Z","09/28 23:59",56,313,,"2020-09-29T03:59:00Z",451056,7606,443163,,56,,,,,,,,,,,,,,"02",122,0,7785,6265,7785,,0,4,"bd2d871d2d945509c7c5f7d80cfc316c2c643c6c",0,0,0,0,0,""
20200928,"AK",7663,,,,"totalTestsViral",444791,43,309,,,14,,3771,"9/28/2020 03:59","2020-09-28T03:59:00Z","09/27 23:59",56,309,,"2020-09-28T03:59:00Z",444791,7487,437017,,56,,,,,,,,,,,,,,"02",114,0,7663,1922,7663,,0,1,"d73fdde367e6d89c3d422c4190b2824be9eb45a6",0,0,0,0,0,""
20200927,"AK",7549,,,,"totalTestsViral",442869,43,308,,,14,,3502,"9/27/2020 03:59","2020-09-27T03:59:00Z","09/26 23:59",56,308,,"2020-09-27T03:59:00Z",442869,7411,435171,,56,,,,,,,,,,,,,,"02",110,0,7549,0,7549,,4,4,"f1cf8fce4fa59d7ffe964c684193a904db11eacd",0,0,0,0,0,""
20200926,"AK",7439,,,,"totalTestsViral",442869,43,304,,,14,,3267,"9/26/2020 03:59","2020-09-26T03:59:00Z","09/25 23:59",52,304,,"2020-09-26T03:59:00Z",442869,7411,435171,,52,,,,,,,,,,,,,,"02",119,0,7439,1537,7439,,1,2,"72cb09fe6899b365c92a2c3654488a08162a36cc",0,0,0,0,0,""
20200925,"AK",7320,,,,"totalTestsViral",441332,43,302,,,14,,3042,"9/25/2020 03:59","2020-09-25T03:59:00Z","09/24 23:59",51,302,,"2020-09-25T03:59:00Z",441332,7357,433688,,51,,,,,,,,,,,,,,"02",126,0,7320,8134,7320,,6,2,"f8638364180a6cdca54263a13f1493399080c2b5",0,0,0,0,0,""
20200924,"AK",7194,,,,"totalTestsViral",433198,43,300,,,14,,2731,"9/23/2020 03:59","2020-09-23T03:59:00Z","09/22 23:59",45,300,,"2020-09-23T03:59:00Z",433198,7180,425736,,45,,,,,,,,,,,,,,"02",131,0,7194,0,7194,,0,4,"53554880d3af9d15315802fa02d2922ede5f7d2c",0,0,0,0,0,""
20200923,"AK",7063,,,,"totalTestsViral",433198,43,296,,,14,,2731,"9/23/2020 03:59","2020-09-23T03:59:00Z","09/22 23:59",45,296,,"2020-09-23T03:59:00Z",433198,7180,425736,,45,,,,,,,,,,,,,,"02",76,0,7063,2007,7063,,0,1,"769677f22e6ab2a5c42cd29ecebee73eaa5e7da9",0,0,0,0,0,""
20200922,"AK",6987,,,,"totalTestsViral",431191,43,295,,,14,,2668,"9/22/2020 03:59","2020-09-22T03:59:00Z","09/21 23:59",45,295,,"2020-09-22T03:59:00Z",431191,7147,423762,,45,,,,,,,,,,,,,,"02",57,0,6987,2546,6987,,0,3,"03fa2b051a2ba1b10507304f1b77b8184c989565",0,0,0,0,0,""
20200921,"AK",6930,,,,"totalTestsViral",428645,47,292,,,13,,2439,"9/21/2020 03:59","2020-09-21T03:59:00Z","09/20 23:59",45,292,,"2020-09-21T03:59:00Z",428645,7089,421275,,45,,,,,,,,,,,,,,"02",70,0,6930,1720,6930,,0,5,"5d6daec27805f56989aa734d676a480e1aa94a8b",0,0,0,0,0,""
20200920,"AK",6860,,,,"totalTestsViral",426925,43,287,,,13,,2438,"9/20/2020 03:59","2020-09-20T03:59:00Z","09/19 23:59",45,287,,"2020-09-20T03:59:00Z",426925,7061,419584,,45,,,,,,,,,,,,,,"02",108,0,6860,4075,6860,,0,4,"09cb711a29f3cb7bb11f905dfd9e5f5d85cb0998",0,0,0,0,0,""
20200919,"AK",6752,,,,"totalTestsViral",422850,41,283,,,13,,2438,"9/19/2020 03:59","2020-09-19T03:59:00Z","09/18 23:59",45,283,,"2020-09-19T03:59:00Z",422850,6970,415600,,45,,,,,,,,,,,,,,"02",94,0,6752,4557,6752,,0,0,"1ea27573bf3d6e8115d0f3cefffbf7e49633e5cf",0,0,0,0,0,""
20200918,"AK",6658,,,,"totalTestsViral",418293,36,283,,,13,,2422,"9/18/2020 03:59","2020-09-18T03:59:00Z","09/17 23:59",45,283,,"2020-09-18T03:59:00Z",418293,6865,411148,,45,,,,,,,,,,,,,,"02",107,0,6658,2430,6658,,1,3,"2e758ee2b4e0cefe26194be9a7dcd86e952c2231",0,0,0,0,0,""
20200917,"AK",6551,,,,"totalTestsViral",415863,41,280,,,13,,2408,"9/17/2020 03:59","2020-09-17T03:59:00Z","09/16 23:59",44,280,,"2020-09-17T03:59:00Z",415863,6814,408769,,44,,,,,,,,,,,,,,"02",108,0,6551,7299,6551,,0,1,"d83a61b9ba6e05db3e91250c76d7397e57b8db66",0,0,0,0,0,""
20200916,"AK",6443,,,,"totalTestsViral",408564,45,279,,,9,,2407,"9/16/2020 03:59","2020-09-16T03:59:00Z","09/15 23:59",44,279,,"2020-09-16T03:59:00Z",408564,6669,401615,,44,,,,,,,,,,,,,,"02",50,0,6443,1440,6443,,0,1,"0fd83d6fe6d65ed4c2969d7efbbe065808e8906f",0,0,0,0,0,""
20200915,"AK",6393,,,,"totalTestsViral",407124,44,278,,,8,,2402,"9/15/2020 03:59","2020-09-15T03:59:00Z","09/14 23:59",44,278,,"2020-09-15T03:59:00Z",407124,6637,400207,,44,,,,,,,,,,,,,,"02",43,0,6393,3711,6393,,0,3,"5004d3b2dfa4b4158e891b6e3e11b0355681206d",0,0,0,0,0,""
20200914,"AK",6350,,,,"totalTestsViral",403413,37,275,,,8,,2377,"9/14/2020 03:59","2020-09-14T03:59:00Z","09/13 23:59",44,275,,"2020-09-14T03:59:00Z",403413,6533,396600,,44,,,,,,,,,,,,,,"02",75,0,6350,2200,6350,,0,3,"51ade3feaf026c68271bf1db816b6a448ed979c7",0,0,0,0,0,""
20200913,"AK",6275,,,,"totalTestsViral",401213,35,272,,,8,,2377,"9/13/2020 03:59","2020-09-13T03:59:00Z","09/12 23:59",44,272,,"2020-09-13T03:59:00Z",401213,6481,394452,,44,,,,,,,,,,,,,,"02",61,0,6275,1584,6275,,0,1,"30665e65dfee5189cd6e495fd22bca9498bd6fed",0,0,0,0,0,""
20200912,"AK",6214,,,,"totalTestsViral",399629,32,271,,,8,,2377,"9/12/2020 03:59","2020-09-12T03:59:00Z","09/11 23:59",44,271,,"2020-09-12T03:59:00Z",399629,6428,392921,,44,,,,,,,,,,,,,,"02",103,0,6214,5043,6214,,1,1,"900c220cd975cf78adccca0ad492f9456f9de0bd",0,0,0,0,0,""
20200911,"AK",6111,,,,"totalTestsViral",394586,44,270,,,7,,2359,"9/11/2020 03:59","2020-09-11T03:59:00Z","09/10 23:59",43,270,,"2020-09-11T03:59:00Z",394586,6340,387966,,43,,,,,,,,,,,,,,"02",89,0,6111,1509,6111,,1,0,"710958691fb3b1a4d6403f797d5ffba50a87ccf5",0,0,0,0,0,""
20200910,"AK",6022,,,,"totalTestsViral",393077,42,270,,,10,,2351,"9/10/2020 03:59","2020-09-10T03:59:00Z","09/09 23:59",42,270,,"2020-09-10T03:59:00Z",393077,6316,386481,,42,,,,,,,,,,,,,,"02",114,0,6022,1140,6022,,0,2,"23f7d91be3005d46df80275c662e9a00c5eb76eb",0,0,0,0,0,""
20200909,"AK",5908,,,,"totalTestsViral",391937,40,268,,,10,,2340,"9/9/2020 03:59","2020-09-09T03:59:00Z","09/08 23:59",42,268,,"2020-09-09T03:59:00Z",391937,6305,385352,,42,,,,,,,,,,,,,,"02",65,0,5908,281,5908,,0,3,"0de0e369a63dcb80a3ce031c1c2e40f2a69eeaa4",0,0,0,0,0,""
20200908,"AK",5843,,,,"totalTestsViral",391656,41,265,,,8,,2339,"9/8/2020 03:59","2020-09-08T03:59:00Z","09/07 23:59",42,265,,"2020-09-08T03:59:00Z",391656,6302,385074,,42,,,,,,,,,,,,,,"02",33,0,5843,3035,5843,,0,5,"139e8d69ecc5fbe51d946c1ccaa45adb94280420",0,0,0,0,0,""
20200907,"AK",5810,,,,"totalTestsViral",388621,36,260,,,8,,2323,"9/7/2020 03:59","2020-09-07T03:59:00Z","09/06 23:59",42,260,,"2020-09-07T03:59:00Z",388621,6236,382106,,42,,,,,,,,,,,,,,"02",34,0,5810,1564,5810,,0,4,"2b264b4645cba3c161e84692aa9ca269dd70470d",0,0,0,0,0,""
20200906,"AK",5776,,,,"totalTestsViral",387057,41,256,,,7,,2323,"9/6/2020 03:59","2020-09-06T03:59:00Z","09/05 23:59",42,256,,"2020-09-06T03:59:00Z",387057,6210,380568,,42,,,,,,,,,,,,,,"02",95,0,5776,2055,5776,,0,0,"2a2c36c5bf2fc160f4009a8c302383bc4189058f",0,0,0,0,0,""
20200905,"AK",5681,,,,"totalTestsViral",385002,36,256,,,8,,2321,"9/5/2020 03:59","2020-09-05T03:59:00Z","09/04 23:59",42,256,,"2020-09-05T03:59:00Z",385002,6169,378554,,42,,,,,,,,,,,,,,"02",87,0,5681,3065,5681,,2,4,"ebcf7d8b94dd985fe4d5f9214e97fc2544b7d1c1",0,0,0,0,0,""
20200904,"AK",5594,,,,"totalTestsViral",381937,43,252,,,4,,2295,"9/4/2020 03:59","2020-09-04T03:59:00Z","09/03 23:59",40,252,,"2020-09-04T03:59:00Z",381937,6115,375546,,40,,,,,,,,,,,,,,"02",119,0,5594,4001,5594,,0,0,"2fa63bf70074dc792286106b7b29291fb8eed561",0,0,0,0,0,""
20200903,"AK",5475,,,,"totalTestsViral",377936,43,252,,,8,,2288,"9/3/2020 03:59","2020-09-03T03:59:00Z","09/02 23:59",40,252,,"2020-09-03T03:59:00Z",377936,6022,371638,,40,,,,,,,,,,,,,,"02",88,0,5475,1052,5475,,1,5,"5780a454a0494e23825b126c057439ae3b19e3da",0,0,0,0,0,""
20200902,"AK",5387,,,,"totalTestsViral",376884,46,247,,,10,,2281,"9/2/2020 03:59","2020-09-02T03:59:00Z","09/01 23:59",39,247,,"2020-09-02T03:59:00Z",376884,6010,370557,,39,,,,,,,,,,,,,,"02",66,0,5387,2629,5387,,0,1,"ecf528fade477b1182c68cfc9b81631c80a2de93",0,0,0,0,0,""
20200901,"AK",5321,,,,"totalTestsViral",374255,41,246,,,9,,2246,"9/1/2020 03:59","2020-09-01T03:59:00Z","08/31 23:59",39,246,,"2020-09-01T03:59:00Z",374255,5974,367949,,39,,,,,,,,,,,,,,"02",35,0,5321,25625,5321,,2,5,"1a61d9056f011a7ed5d4fedb36d82215db6c15e2",0,0,0,0,0,""
20200831,"AK",5286,,,,"totalTestsViral",348630,39,241,,,8,,2238,"8/31/2020 03:59","2020-08-31T03:59:00Z","08/30 23:59",37,241,,"2020-08-31T03:59:00Z",348630,5598,342703,,37,,,,,,,,,,,,,,"02",36,0,5286,1791,5286,,0,0,"c50f290421012766124d076cbdf3f88877b5432b",0,0,0,0,0,""
20200830,"AK",5250,,,,"totalTestsViral",346839,41,241,,,8,,2233,"8/31/2020 03:59","2020-08-31T03:59:00Z","08/30 23:59",37,241,,"2020-08-31T03:59:00Z",346839,5568,340942,,37,,,,,,,,,,,,,,"02",43,0,5250,1144,5250,,0,1,"546ada8a57f7977fa95732360446a7776c5aa63a",0,0,0,0,0,""
20200829,"AK",5207,,,,"totalTestsViral",345695,43,240,,,7,,2201,"8/29/2020 03:59","2020-08-29T03:59:00Z","08/28 23:59",37,240,,"2020-08-29T03:59:00Z",345695,5558,339808,,37,,,,,,,,,,,,,,"02",93,0,5207,6157,5207,,0,1,"630f6d6a900a781d656ff2eb19e5b8cb6ce9d5d4",0,0,0,0,0,""
20200828,"AK",5114,,,,"totalTestsViral",339538,37,239,,,8,,2183,"8/28/2020 03:59","2020-08-28T03:59:00Z","08/27 23:59",37,239,,"2020-08-28T03:59:00Z",339538,5359,333850,,37,,,,,,,,,,,,,,"02",116,0,5114,3318,5114,,0,3,"5aa4b85cc82c8485443877c151f936c2394f0f23",0,0,0,0,0,""
20200827,"AK",4998,,,,"totalTestsViral",336220,43,236,,,9,,2109,"8/27/2020 03:59","2020-08-27T03:59:00Z","08/26 23:59",37,236,,"2020-08-27T03:59:00Z",336220,5324,330567,,37,,,,,,,,,,,,,,"02",84,0,4998,1416,4998,,0,1,"f4ea09f78895954bf3a3cc9b56572f763d8af334",0,0,0,0,0,""
20200826,"AK",4914,,,,"totalTestsViral",334804,44,235,,,6,,2088,"8/26/2020 03:59","2020-08-26T03:59:00Z","08/25 23:59",37,235,,"2020-08-26T03:59:00Z",334804,5305,329171,,37,,,,,,,,,,,,,,"02",52,0,4914,973,4914,,1,2,"f9cc82403984db932a9eea00677aded2fd411633",0,0,0,0,0,""
20200825,"AK",4862,,,,"totalTestsViral",333831,46,233,,,6,,1967,"8/25/2020 03:59","2020-08-25T03:59:00Z","08/24 23:59",36,233,,"2020-08-25T03:59:00Z",333831,5270,328233,,36,,,,,,,,,,,,,,"02",33,0,4862,3328,4862,,4,5,"c36d41e2575911be031aab6e8f5be7f42bf6a125",0,0,0,0,0,""
20200824,"AK",4829,,,,"totalTestsViral",330503,43,228,,,8,,1861,"8/24/2020 03:59","2020-08-24T03:59:00Z","08/23 23:59",32,228,,"2020-08-24T03:59:00Z",330503,5221,324954,,32,,,,,,,,,,,,,,"02",71,0,4829,3063,4829,,0,3,"f94fc1864f2090968e0c438a1bdd3684ca4d681e",0,0,0,0,0,""
20200823,"AK",4758,,,,"totalTestsViral",327440,48,225,,,7,,1745,"8/23/2020 03:59","2020-08-23T03:59:00Z","08/22 23:59",32,225,,"2020-08-23T03:59:00Z",327440,5170,321943,,32,,,,,,,,,,,,,,"02",66,0,4758,1153,4758,,1,2,"ae15157ca348a63a97e04f87bb0fe399a207bc8c",0,0,0,0,0,""
20200822,"AK",4692,,,,"totalTestsViral",326287,46,223,,,6,,1686,"8/22/2020 03:59","2020-08-22T03:59:00Z","08/21 23:59",31,223,,"2020-08-22T03:59:00Z",326287,5151,320811,,31,,,,,,,,,,,,,,"02",88,0,4692,4752,4692,,1,3,"90ef39dcc86620649e4be04c6a2fdd9a888b0796",0,0,0,0,0,""
20200821,"AK",4604,,,,"totalTestsViral",321535,46,220,,,6,,1601,"8/21/2020 00:00","2020-08-21T00:00:00Z","08/20 20:00",30,220,,"2020-08-21T00:00:00Z",321535,5073,316141,,30,,,,,,,,,,,,,,"02",69,0,4604,8888,4604,,1,2,"04b13b35ea2026b615d1b6883a6ba4a0d85368f3",0,0,0,0,0,""
20200820,"AK",4535,,,,"totalTestsViral",312647,51,218,,,6,,1513,"8/20/2020 00:00","2020-08-20T00:00:00Z","08/19 20:00",29,218,,"2020-08-20T00:00:00Z",312647,4970,307360,,29,,,,,,,,,,,,,,"02",83,0,4535,1798,4535,,0,4,"0d40ef8ced59f6b69dd1db6f7fae37b3b48e3e9d",0,0,0,0,0,""
20200819,"AK",4452,,,,"totalTestsViral",310849,56,214,,,6,,1501,"8/19/2020 00:00","2020-08-19T00:00:00Z","08/18 20:00",29,214,,"2020-08-19T00:00:00Z",310849,4950,305582,,29,,,,,,,,,,,,,,"02",73,0,4452,840,4452,,0,6,"49f1367232dfc17b52278ac1732f29b25afb0dc6",0,0,0,0,0,""
20200818,"AK",4379,,,,"totalTestsViral",310009,47,208,,,7,,1468,"8/18/2020 00:00","2020-08-18T00:00:00Z","08/17 20:00",29,208,,"2020-08-18T00:00:00Z",310009,4925,304767,,29,,,,,,,,,,,,,,"02",66,0,4379,4361,4379,,1,2,"f01076d564c24f5cccc487e87231f0fecdf07ab7",0,0,0,0,0,""
20200817,"AK",4313,,,,"totalTestsViral",305648,33,206,,,4,,1432,"8/17/2020 00:00","2020-08-17T00:00:00Z","08/16 20:00",28,206,,"2020-08-17T00:00:00Z",305648,4838,300493,,28,,,,,,,,,,,,,,"02",50,0,4313,4133,4313,,0,3,"33de08c7f1c8fd8c2579c1ba8cf6faff4df4191d",0,0,0,0,0,""
20200816,"AK",4263,,,,"totalTestsViral",301515,42,203,,,3,,1418,"8/16/2020 00:00","2020-08-16T00:00:00Z","08/15 20:00",28,203,,"2020-08-16T00:00:00Z",301515,4777,296426,,28,,,,,,,,,,,,,,"02",101,0,4263,4838,4263,,0,6,"fc562fcbd47a2cbaefdb0a327168d242d255f3fc",0,0,0,0,0,""
20200815,"AK",4162,,,,"totalTestsViral",296677,36,197,,,4,,1384,"8/15/2020 00:00","2020-08-15T00:00:00Z","08/14 20:00",28,197,,"2020-08-15T00:00:00Z",296677,4706,291666,,28,,,,,,,,,,,,,,"02",84,0,4162,748,4162,,1,4,"ae469c7815524158edbead91544fdb2e6669433b",0,0,0,0,0,""
20200814,"AK",4078,,,,"totalTestsViral",295929,38,193,,,3,,1371,"8/14/2020 00:00","2020-08-14T00:00:00Z","08/13 20:00",27,193,,"2020-08-14T00:00:00Z",295929,4698,290927,,27,,,,,,,,,,,,,,"02",100,0,4078,1876,4078,,0,2,"9637be330bfd0d5b291fd1cefef1716dffe5b0db",0,0,0,0,0,""
20200813,"AK",3978,,,,"totalTestsViral",294053,46,191,,,3,,1360,"8/13/2020 00:00","2020-08-13T00:00:00Z","08/12 20:00",27,191,,"2020-08-13T00:00:00Z",294053,4662,289088,,27,,,,,,,,,,,,,,"02",82,0,3978,1471,3978,,0,5,"fb3a074cab275efb10dea8cc3c59b9e8f6a7dc93",0,0,0,0,0,""
20200812,"AK",3896,,,,"totalTestsViral",292582,39,186,,,3,,1359,"8/12/2020 00:00","2020-08-12T00:00:00Z","08/11 20:00",27,186,,"2020-08-12T00:00:00Z",292582,4646,287633,,27,,,,,,,,,,,,,,"02",61,0,3896,1838,3896,,1,5,"3ab624d8599814d0b12d30689e5fcd9bc03105e0",0,0,0,0,0,""
20200811,"AK",3835,,,,"totalTestsViral",290744,39,181,,,4,,1344,"8/11/2020 00:00","2020-08-11T00:00:00Z","08/10 20:00",26,181,,"2020-08-11T00:00:00Z",290744,4628,285813,,26,,,,,,,,,,,,,,"02",49,0,3835,10401,3835,,0,1,"9a1bd657370f46e116fb731590759b36751bd59c",0,0,0,0,0,""
20200810,"AK",3786,,,,"totalTestsViral",280343,37,180,,,3,,1332,"8/10/2020 00:00","2020-08-10T00:00:00Z","08/09 20:00",26,180,,"2020-08-10T00:00:00Z",280343,4290,272428,,26,,,,,,,,,,,,,,"02",68,0,3786,2424,3786,,0,4,"05bae7a9abb1343c356339e87326e265f759899b",0,0,0,0,0,""
20200809,"AK",3718,,,,"totalTestsViral",277919,40,176,,,4,,1269,"8/9/2020 00:00","2020-08-09T00:00:00Z","08/08 20:00",26,176,,"2020-08-09T00:00:00Z",277919,4274,270039,,26,,,,,,,,,,,,,,"02",97,0,3718,4326,3718,,0,4,"54dff200aca5902f7215500c4b2afd08a855165a",0,0,0,0,0,""
20200808,"AK",3621,,,,"totalTestsViral",273593,37,172,,,4,,1254,"8/8/2020 00:00","2020-08-08T00:00:00Z","08/07 20:00",26,172,,"2020-08-08T00:00:00Z",273593,4195,265804,,26,,,,,,,,,,,,,,"02",79,0,3621,4742,3621,,1,5,"5fede125d44407aef8a439164d7a79d965a89f3f",0,0,0,0,0,""
20200807,"AK",3542,,,,"totalTestsViral",268851,37,167,,,3,,1238,"8/7/2020 00:00","2020-08-07T00:00:00Z","08/06 20:00",25,167,,"2020-08-07T00:00:00Z",268851,4124,261152,,25,,,,,,,,,,,,,,"02",55,0,3542,7279,3542,,0,3,"41bfdc73a2ab7af9cdb1bb2227c68677040c89ec",0,0,0,0,0,""
20200806,"AK",3487,,,,"totalTestsViral",261572,42,164,,,2,,1220,"8/6/2020 00:00","2020-08-06T00:00:00Z","08/05 20:00",25,164,,"2020-08-06T00:00:00Z",261572,4024,253987,,25,,,,,,,,,,,,,,"02",40,0,3487,4293,3487,,0,3,"afb803d828b33d7a3863a64f841dd0145c7abd63",0,0,0,0,0,""
20200805,"AK",3447,,,,"totalTestsViral",257279,38,161,,,2,,1017,"8/5/2020 00:00","2020-08-05T00:00:00Z","08/04 20:00",25,161,,"2020-08-05T00:00:00Z",257279,,,,25,,,,,,,,,,,,,,"02",55,0,3447,4630,3447,,0,3,"d9384aa47abd2942cc940cd25066d27f66de5dc5",0,0,0,0,0,""
20200804,"AK",3392,,,,"totalTestsViral",252649,33,158,,,2,,987,"8/4/2020 00:00","2020-08-04T00:00:00Z","08/03 20:00",25,158,,"2020-08-04T00:00:00Z",252649,,,,25,,,,,,,,,,,,,,"02",61,0,3392,6842,3392,,0,2,"18f18297f1a648b2f15b52a4fcfafe102dad6741",0,0,0,0,0,""
20200803,"AK",3331,,,,"totalTestsViral",245807,38,156,,,4,,946,"8/3/2020 00:00","2020-08-03T00:00:00Z","08/02 20:00",25,156,,"2020-08-03T00:00:00Z",245807,,,,25,,,,,,,,,,,,,,"02",58,0,3331,2717,3331,,1,2,"e490b5724530fc9d0c2dfa50bb2ef2c4a4643e2e",0,0,0,0,0,""
20200802,"AK",3273,,,,"totalTestsViral",243090,39,154,,,3,,932,"8/2/2020 00:00","2020-08-02T00:00:00Z","08/01 20:00",24,154,,"2020-08-02T00:00:00Z",243090,,,,24,,,,,,,,,,,,,,"02",136,0,3273,4457,3273,,0,1,"a86a474a286e423c99fb3c8183d829e4ca609120",0,0,0,0,0,""
20200801,"AK",3137,,,,"totalTestsViral",238633,37,153,,,3,,930,"8/1/2020 00:00","2020-08-01T00:00:00Z","07/31 20:00",24,153,,"2020-08-01T00:00:00Z",238633,,,,24,,,,,,,,,,,,,,"02",144,0,3137,5527,3137,,1,2,"078619b537f6974c1e4f80bdba9095818f6af8c6",0,0,0,0,0,""
20200731,"AK",2993,,,,"totalTestsViral",233106,40,151,,,3,,898,"7/31/2020 00:00","2020-07-31T00:00:00Z","07/30 20:00",23,151,,"2020-07-31T00:00:00Z",233106,,,,23,,,,,,,,,,,,,,"02",106,0,2993,8049,2993,,0,4,"9ad1b6f19fc6fc283ba6db9f3c3baf3c50e929ab",0,0,0,0,0,""
20200730,"AK",2887,,,,"totalTestsViral",225057,45,147,,,3,,885,"7/30/2020 00:00","2020-07-30T00:00:00Z","07/29 20:00",23,147,,"2020-07-30T00:00:00Z",225057,,,,23,,,,,,,,,,,,,,"02",84,0,2887,1393,2887,,1,2,"1b402de72691246a72c5587cae664c5eef4f6386",0,0,0,0,0,""
20200729,"AK",2803,,,,"totalTestsViral",223664,45,145,,,3,,854,"7/29/2020 00:00","2020-07-29T00:00:00Z","07/28 20:00",22,145,,"2020-07-29T00:00:00Z",223664,,,,22,,,,,,,,,,,,,,"02",68,0,2803,9789,2803,,0,2,"1ce3f876aaf05b94a64ed0b834a072075d826ce3",0,0,0,0,0,""
20200728,"AK",2735,,,,"totalTestsViral",213875,44,143,,,4,,836,"7/28/2020 00:00","2020-07-28T00:00:00Z","07/27 20:00",22,143,,"2020-07-28T00:00:00Z",213875,,,,22,,,,,,,,,,,,,,"02",108,0,2735,6611,2735,,1,5,"0c2abcc00b6a2129c01d125ddf95cd5cb300fec6",0,0,0,0,0,""
20200727,"AK",2627,,,,"totalTestsViral",207264,38,138,,,3,,817,"7/27/2020 00:00","2020-07-27T00:00:00Z","07/26 20:00",21,138,,"2020-07-27T00:00:00Z",207264,,,,21,,,,,,,,,,,,,,"02",94,0,2627,0,2627,,1,3,"9f99b69a7d4573825a1319cfe83da06868339464",0,0,0,0,0,""
20200726,"AK",2533,,,,"totalTestsViral",207264,43,135,,,4,,817,"7/26/2020 00:00","2020-07-26T00:00:00Z","07/25 20:00",20,135,,"2020-07-26T00:00:00Z",207264,,,,20,,,,,,,,,,,,,,"02",185,0,2533,2198,2533,,0,3,"d0f085d46d8189dd6250e9a87a02bd17cbecb0d4",0,0,0,0,0,""
20200725,"AK",2348,,,,"totalTestsViral",205066,38,132,,,2,,815,"7/25/2020 00:00","2020-07-25T00:00:00Z","07/24 20:00",20,132,,"2020-07-25T00:00:00Z",205066,,,,20,,,,,,,,,,,,,,"02",88,0,2348,4494,2348,,1,6,"5896062301946bb13c6259b8a28d47211e902595",0,0,0,0,0,""
20200724,"AK",2260,,,,"totalTestsViral",200572,37,126,,,1,,800,"7/24/2020 00:00","2020-07-24T00:00:00Z","07/23 20:00",19,126,,"2020-07-24T00:00:00Z",200572,,,,19,,,,,,,,,,,,,,"02",57,0,2260,11063,2260,,0,2,"1b935d2d33b0368ff00fd44b4250b0f998f84508",0,0,0,0,0,""
20200723,"AK",2203,,,,"totalTestsViral",189509,36,124,,,1,,787,"7/23/2020 00:00","2020-07-23T00:00:00Z","07/22 20:00",19,124,,"2020-07-23T00:00:00Z",189509,,,,19,,,,,,,,,,,,,,"02",64,0,2203,4176,2203,,0,6,"949af2d7002f15398c1892172bf9b00ebf7826a2",0,0,0,0,0,""
20200722,"AK",2139,,,,"totalTestsViral",185333,34,118,,,1,,753,"7/22/2020 00:00","2020-07-22T00:00:00Z","07/21 20:00",19,118,,"2020-07-22T00:00:00Z",185333,,,,19,,,,,,,,,,,,,,"02",94,0,2139,6707,2139,,1,5,"9b3d78d25a2147ac06a32da0d7ffd1fcf312c718",0,0,0,0,0,""
20200721,"AK",2045,,,,"totalTestsViral",178626,32,113,,,1,,737,"7/21/2020 00:00","2020-07-21T00:00:00Z","07/20 20:00",18,113,,"2020-07-21T00:00:00Z",178626,,,,18,,,,,,,,,,,,,,"02",90,0,2045,3040,2045,,0,2,"0b748e90b83287a821d40a68c478042c4312d49b",0,0,0,0,0,""
20200720,"AK",1955,,,,"totalTestsViral",175586,29,111,,,0,,712,"7/20/2020 00:00","2020-07-20T00:00:00Z","07/19 20:00",18,111,,"2020-07-20T00:00:00Z",175586,,,,18,,,,,,,,,,,,,,"02",73,0,1955,2576,1955,,0,1,"5620c6b301f001c06bb3e46f2c8c106837b2c457",0,0,0,0,0,""
20200719,"AK",1882,,,,"totalTestsViral",173010,27,110,,,1,,712,"7/19/2020 00:00","2020-07-19T00:00:00Z","07/18 20:00",18,110,,"2020-07-19T00:00:00Z",173010,,,,18,,,,,,,,,,,,,,"02",83,0,1882,4647,1882,,0,3,"36c430c6b641910e8b45202e42cb9ffaeda025b4",0,0,0,0,0,""
20200718,"AK",1799,,,,"totalTestsViral",168363,26,107,,,1,,708,"7/18/2020 00:00","2020-07-18T00:00:00Z","07/17 20:00",18,107,,"2020-07-18T00:00:00Z",168363,,,,18,,,,,,,,,,,,,,"02",62,0,1799,2949,1799,,1,2,"8430230ebc447fb2881d1a2d5d622e501489fc27",0,0,0,0,0,""
20200717,"AK",1737,,,,"totalTestsViral",165414,32,105,,,0,,697,"7/17/2020 00:00","2020-07-17T00:00:00Z","07/16 20:00",17,105,,"2020-07-17T00:00:00Z",165414,,,,17,,,,,,,,,,,,,,"02",42,0,1737,2392,1737,,0,2,"8c62e2db7839ef00b38757abee18d4032561a148",0,0,0,0,0,""
20200716,"AK",1695,,,,"totalTestsViral",163022,32,103,,,0,,688,"7/16/2020 00:00","2020-07-16T00:00:00Z","07/15 20:00",17,103,,"2020-07-16T00:00:00Z",163022,,,,17,,,,,,,,,,,,,,"02",64,0,1695,6929,1695,,0,1,"e3134ca712ed7a53d1d25de0eddc8b8c96d8d606",0,0,0,0,0,""
20200715,"AK",1631,,,,"totalTestsViral",156093,32,102,,,0,,669,"7/15/2020 00:00","2020-07-15T00:00:00Z","07/14 20:00",17,102,,"2020-07-15T00:00:00Z",156093,,,,17,,,,,,,,,,,,,,"02",51,0,1631,6620,1631,,0,4,"fb9f659b0431d9babe859142a1fdbb0e3e79c3ac",0,0,0,0,0,""
20200714,"AK",1580,,,,"totalTestsViral",149473,25,98,,,1,,642,"7/14/2020 00:00","2020-07-14T00:00:00Z","07/13 20:00",17,98,,"2020-07-14T00:00:00Z",149473,,,,17,,,,,,,,,,,,,,"02",43,0,1580,2883,1580,,0,2,"eb89a63f1da5ea6497d253fb7de8c3a5ddcc298f",0,0,0,0,0,""
20200713,"AK",1537,,,,"totalTestsViral",146590,22,96,,,0,,620,"7/13/2020 00:00","2020-07-13T00:00:00Z","07/12 20:00",17,96,,"2020-07-13T00:00:00Z",146590,,,,17,,,,,,,,,,,,,,"02",59,0,1537,1115,1537,,0,1,"db5f0814be3e3e40b929bf527840d0a12b8fde33",0,0,0,0,0,""
20200712,"AK",1478,,,,"totalTestsViral",145475,27,95,,,0,,615,"7/12/2020 00:00","2020-07-12T00:00:00Z","07/11 20:00",17,95,,"2020-07-12T00:00:00Z",145475,,,,17,,,,,,,,,,,,,,"02",92,0,1478,2099,1478,,0,2,"27b54ac3c5ddb4a9494560e036e904ffe730f3d1",0,0,0,0,0,""
20200711,"AK",1386,,,,"totalTestsViral",143376,31,93,,,1,,598,"7/11/2020 00:00","2020-07-11T00:00:00Z","07/10 20:00",17,93,,"2020-07-11T00:00:00Z",143376,,,,17,,,,,,,,,,,,,,"02",63,0,1386,1445,1386,,0,3,"45458c1c04126260ec0cb17fd83a87a2b1cf8fd0",0,0,0,0,0,""
20200710,"AK",1323,,,,"totalTestsViral",141931,30,90,,,0,,588,"7/10/2020 00:00","2020-07-10T00:00:00Z","07/09 20:00",17,90,,"2020-07-10T00:00:00Z",141931,,,,17,,,,,,,,,,,,,,"02",50,0,1323,6187,1323,,0,3,"bf8155c732f22e19bbf9404ca3794220fdbda3c6",0,0,0,0,0,""
20200709,"AK",1273,,,,"totalTestsViral",135744,28,87,,,0,,571,"7/9/2020 00:00","2020-07-09T00:00:00Z","07/08 20:00",17,87,,"2020-07-09T00:00:00Z",135744,,,,17,,,,,,,,,,,,,,"02",47,0,1273,2343,1273,,0,3,"c45977ac57896ab3697aea613569bcd2aa9b23c4",0,0,0,0,0,""
20200708,"AK",1226,,,,"totalTestsViral",133401,30,84,,,0,,563,"7/8/2020 00:00","2020-07-08T00:00:00Z","07/07 20:00",17,84,,"2020-07-08T00:00:00Z",133401,,,,17,,,,,,,,,,,,,,"02",40,0,1226,1981,1226,,0,4,"19219e7e71e4da0f165742e07d09bdfdc8acfcab",0,0,0,0,0,""
20200707,"AK",1186,,,,"totalTestsViral",131420,25,80,,,1,,560,"7/6/2020 00:00","2020-07-06T00:00:00Z","07/05 20:00",17,80,,"2020-07-06T00:00:00Z",131420,,,,17,,,,,,,,,,,,,,"02",18,0,1186,7667,1186,,1,2,"e5ce93f3ff4caa89693cfdceaf0db08786d407dc",0,0,0,0,0,""
20200706,"AK",1168,,,,"totalTestsViral",123753,19,78,,,3,,548,"7/5/2020 00:00","2020-07-05T00:00:00Z","07/04 20:00",16,78,,"2020-07-05T00:00:00Z",123753,,,,16,,,,,,,,,,,,,,"02",27,0,1168,0,1168,,0,3,"0f81951fdd12f32d411bf3e3c9e26ef517a5feb3",0,0,0,0,0,""
20200705,"AK",1141,,,,"totalTestsViral",123753,19,75,,,3,,548,"7/4/2020 00:00","2020-07-04T00:00:00Z","07/03 20:00",16,75,,"2020-07-04T00:00:00Z",123753,,,,16,,,,,,,,,,,,,,"02",27,0,1141,1021,1141,,0,4,"0caae65ae952dfac9f956884aa79308722731d18",0,0,0,0,0,""
20200704,"AK",1114,,,,"totalTestsViral",122732,23,71,,,3,,544,"7/4/2020 00:00","2020-07-04T00:00:00Z","07/03 20:00",16,71,,"2020-07-04T00:00:00Z",122732,,,,16,,,,,,,,,,,,,,"02",49,0,1114,2524,1114,,1,2,"542fc98035d5e9489e7101d7ea4f9d1c6f87f137",0,0,0,0,0,""
20200703,"AK",1065,,,,"totalTestsViral",120208,25,69,,,3,,539,"7/3/2020 00:00","2020-07-03T00:00:00Z","07/02 20:00",15,69,,"2020-07-03T00:00:00Z",120208,,,,15,,,,,,,,,,,,,,"02",45,0,1065,4299,1065,,1,1,"ce8f1d14207315171fab3ade08f0a5cab3d9a465",0,0,0,0,0,""
20200702,"AK",1020,,,,"totalTestsViral",115909,18,68,,,1,,535,"7/2/2020 00:00","2020-07-02T00:00:00Z","07/01 20:00",14,68,,"2020-07-02T00:00:00Z",115909,,,,14,,,,,,,,,,,,,,"02",38,0,1020,1509,1020,,0,0,"6f1a6abba3a37baf21bb2a43aa39a49a86d1ff33",0,0,0,0,0,""
20200701,"AK",982,,,,"totalTestsViral",114400,20,68,,,2,,528,"7/1/2020 00:00","2020-07-01T00:00:00Z","06/30 20:00",14,68,,"2020-07-01T00:00:00Z",114400,,,,14,,,,,,,,,,,,,,"02",38,0,982,2215,982,,0,0,"1130a11e5e2cf12e5a1bdf6b5eb255dc360caf90",0,0,0,0,0,""
20200630,"AK",944,,,,"totalTestsViral",112185,18,68,,,1,,526,"6/29/2020 00:00","2020-06-29T00:00:00Z","06/28 20:00",14,68,,"2020-06-29T00:00:00Z",112185,,,,14,,,,,,,,,,,,,,"02",36,0,944,3476,944,,0,0,"adb10ebaaa02dcf83a5bdf1d96deeefc102722ae",0,0,0,0,0,""
20200629,"AK",908,,,,"totalTestsViral",108709,16,68,,,1,,525,"6/29/2020 00:00","2020-06-29T00:00:00Z","06/28 20:00",14,68,,"2020-06-29T00:00:00Z",108709,,,,14,,,,,,,,,,,,,,"02",21,0,908,409,908,,0,0,"2fe13aa2d0253a83b0c1006e09c0fd846d136765",0,0,0,0,0,""
20200628,"AK",887,,,,"totalTestsViral",108300,12,68,,,1,,521,"6/28/2020 00:00","2020-06-28T00:00:00Z","06/27 20:00",14,68,,"2020-06-28T00:00:00Z",108300,,,,14,,,,,,,,,,,,,,"02",29,0,887,2719,887,,0,1,"80517beb90d5cabb088158aa6271fe81b59f40b3",0,0,0,0,0,""
20200627,"AK",858,,,,"totalTestsViral",105581,11,67,,,1,,521,"6/27/2020 00:00","2020-06-27T00:00:00Z","06/26 20:00",14,67,,"2020-06-27T00:00:00Z",105581,,,,14,,,,,,,,,,,,,,"02",19,0,858,3789,858,,0,0,"413f23f43c91653c4f20683752060513f748f0fb",0,0,0,0,0,""
20200626,"AK",839,,,,"totalTestsViral",101792,12,67,,,2,,519,"6/26/2020 00:00","2020-06-26T00:00:00Z","06/25 20:00",14,67,,"2020-06-26T00:00:00Z",101792,,,,14,,,,,,,,,,,,,,"02",18,0,839,2340,839,,2,0,"981c7858bda5e809cf0df4ddff781f7387b92429",0,0,0,0,0,""
20200625,"AK",821,,,,"totalTestsViral",99452,14,67,,,2,,513,"6/25/2020 00:00","2020-06-25T00:00:00Z","06/24 20:00",12,67,,"2020-06-25T00:00:00Z",99452,,,,12,,,,,,,,,,,,,,"02",24,0,821,3356,821,,0,0,"74edd17a65bc02d114e10e68e4d19bd0d934e621",0,0,0,0,0,""
20200624,"AK",797,,,,"totalTestsViral",96096,16,67,,,2,,507,"6/24/2020 00:00","2020-06-24T00:00:00Z","06/23 20:00",12,67,,"2020-06-24T00:00:00Z",96096,,,,12,,,,,,,,,,,,,,"02",14,0,797,3149,797,,0,1,"82989557dd7e996e4c85edb0e047cdb2bb5c7a10",0,0,0,0,0,""
20200623,"AK",783,,,,"totalTestsViral",92947,14,66,,,1,,502,"6/23/2020 00:00","2020-06-23T00:00:00Z","06/22 20:00",12,66,,"2020-06-23T00:00:00Z",92947,,,,12,,,,,,,,,,,,,,"02",16,0,783,2123,783,,0,1,"68b347ac2dfc1d1e103c1c3cffdfa07499afe57c",0,0,0,0,0,""
20200622,"AK",767,,,,"totalTestsViral",90824,13,65,,,1,,491,"6/22/2020 00:00","2020-06-22T00:00:00Z","06/21 20:00",12,65,,"2020-06-22T00:00:00Z",90824,,,,12,,,,,,,,,,,,,,"02",6,0,767,2773,767,,0,0,"a90f4b290fcf36300ab8842678f4679e1fbeb51d",0,0,0,0,0,""
20200621,"AK",761,,,,"totalTestsViral",88051,15,65,,,1,,475,"6/21/2020 00:00","2020-06-21T00:00:00Z","06/20 20:00",12,65,,"2020-06-21T00:00:00Z",88051,,,,12,,,,,,,,,,,,,,"02",11,0,761,1133,761,,0,0,"baf60cbb762abd5078003c20fe0676415a39ee8a",0,0,0,0,0,""
20200620,"AK",750,,,,"totalTestsViral",86918,16,65,,,1,,464,"6/20/2020 00:00","2020-06-20T00:00:00Z","06/19 20:00",12,65,,"2020-06-20T00:00:00Z",86918,,,,12,,,,,,,,,,,,,,"02",21,0,750,3287,750,,0,2,"ff56b0ed374c338ecb4b71fd399bbd9f14d4d240",0,0,0,0,0,""
20200619,"AK",729,,,,"totalTestsViral",83631,18,63,,,1,,457,"6/19/2020 00:00","2020-06-19T00:00:00Z","06/18 20:00",12,63,,"2020-06-19T00:00:00Z",83631,,,,12,,,,,,,,,,,,,,"02",16,0,729,2446,729,,0,2,"2d1071183a8222a16b93cc8b2a97b95f9d777315",0,0,0,0,0,""
20200618,"AK",713,,,,"totalTestsViral",81185,18,61,,,0,,449,"6/18/2020 00:00","2020-06-18T00:00:00Z","06/17 20:00",12,61,,"2020-06-18T00:00:00Z",81185,,,,12,,,,,,,,,,,,,,"02",12,0,713,3476,713,,0,0,"736d2b491c36974ff4b3fac2109d4140c1ddf090",0,0,0,0,0,""
20200617,"AK",701,,,,"totalTestsViral",77709,23,61,,,0,,438,"6/17/2020 00:00","2020-06-17T00:00:00Z","06/16 20:00",12,61,,"2020-06-17T00:00:00Z",77709,,,,12,,,,,,,,,,,,,,"02",20,0,701,1494,701,,0,0,"dc9c2980829dfc4a9cb22ff3425925f26017b5ca",0,0,0,0,0,""
20200616,"AK",681,,,,"totalTestsViral",76215,22,61,,,2,,429,"6/16/2020 00:00","2020-06-16T00:00:00Z","06/15 20:00",12,61,,"2020-06-16T00:00:00Z",76215,,,,12,,,,,,,,,,,,,,"02",13,0,681,1778,681,,0,1,"9a1c1c62aacd5869535b49fcf8b9c5ec8a5cdfed",0,0,0,0,0,""
20200615,"AK",668,,,,"totalTestsViral",74437,21,60,,,3,,417,"6/15/2020 00:00","2020-06-15T00:00:00Z","06/14 20:00",12,60,,"2020-06-15T00:00:00Z",74437,,,,12,,,,,,,,,,,,,,"02",3,0,668,970,668,,0,3,"8af3b94ebc477240d84c3839ed693c7c7ed82254",0,0,0,0,0,""
20200614,"AK",665,,,,"totalTestsViral",73467,11,57,,,1,,411,"6/14/2020 00:00","2020-06-14T00:00:00Z","06/13 20:00",12,57,,"2020-06-14T00:00:00Z",73467,,,,12,,,,,,,,,,,,,,"02",9,0,665,1664,665,,0,1,"75284196ed07451eeff28406489073d919712627",0,0,0,0,0,""
20200613,"AK",656,,,,"totalTestsViral",71803,12,56,,,2,,405,"6/13/2020 00:00","2020-06-13T00:00:00Z","06/12 20:00",12,56,,"2020-06-13T00:00:00Z",71803,,,,12,,,,,,,,,,,,,,"02",26,0,656,923,656,,0,1,"9ed8c61eb0c4515b16143efbb57a31ee8f14afc7",0,0,0,0,0,""
20200612,"AK",630,,,,"totalTestsViral",70880,15,55,,,3,,403,"6/12/2020 00:00","2020-06-12T00:00:00Z","06/11 20:00",12,55,,"2020-06-12T00:00:00Z",70880,,,,12,,,,,,,,,,,,,,"02",14,0,630,1869,630,,1,1,"b1351efee333e94921c6ba59df33d7986ee9f392",0,0,0,0,0,""
20200611,"AK",616,,,,"totalTestsViral",69011,18,54,,,4,,397,"6/11/2020 00:00","2020-06-11T00:00:00Z","06/10 20:00",11,54,,"2020-06-11T00:00:00Z",69011,,,,11,,,,,,,,,,,,,,"02",18,0,616,1291,616,,0,1,"8fe4ed2c55f2b06fe4cbbc5fb5bfe080ea09a330",0,0,0,0,0,""
20200610,"AK",598,,,,"totalTestsViral",67720,22,53,,,3,,392,"6/10/2020 00:00","2020-06-10T00:00:00Z","06/09 20:00",11,53,,"2020-06-10T00:00:00Z",67720,,,,11,,,,,,,,,,,,,,"02",20,0,598,830,598,,0,0,"505dadf56e092769cf08e8f062effebfdaffd514",0,0,0,0,0,""
20200609,"AK",578,,,,"totalTestsViral",66890,12,53,,,1,,389,"6/9/2020 00:00","2020-06-09T00:00:00Z","06/08 20:00",11,53,,"2020-06-09T00:00:00Z",66890,,,,11,,,,,,,,,,,,,,"02",11,0,578,978,578,,1,0,"87c8c7df3536a22cf67e362c83dfd7ce55aa28b2",0,0,0,0,0,""
20200608,"AK",567,,,,"totalTestsViral",65912,7,53,,,0,,384,"6/8/2020 00:00","2020-06-08T00:00:00Z","06/07 20:00",10,53,,"2020-06-08T00:00:00Z",65912,,,,10,,,,,,,,,,,,,,"02",18,0,567,1008,567,,0,0,"e560f8f7bdae04b65e51dfbc0d7583e075169d70",0,0,0,0,0,""
20200607,"AK",549,,,,"totalTestsViral",64904,7,53,,,1,,382,"6/7/2020 00:00","2020-06-07T00:00:00Z","06/06 20:00",10,53,,"2020-06-07T00:00:00Z",64904,,,,10,,,,,,,,,,,,,,"02",8,0,549,1003,549,,0,0,"654635d295a23d7f92af64534da346776c952e55",0,0,0,0,0,""
20200606,"AK",541,,,,"totalTestsViral",63901,7,53,,,1,,382,"6/6/2020 00:00","2020-06-06T00:00:00Z","06/05 20:00",10,53,,"2020-06-06T00:00:00Z",63901,,,,10,,,,,,,,,,,,,,"02",12,0,541,2911,541,,0,0,"c8a5cb30fca25a605dba5004faf2d7defae875ab",0,0,0,0,0,""
20200605,"AK",529,,,,"totalTestsViral",60990,8,53,,,1,,380,"6/5/2020 00:00","2020-06-05T00:00:00Z","06/04 20:00",10,53,,"2020-06-05T00:00:00Z",60990,,,,10,,,,,,,,,,,,,,"02",11,0,529,893,529,,0,1,"6a0ebf70f7d33928959e4d4a986d6512c5f0d79a",0,0,0,0,0,""
20200604,"AK",518,,,,"totalTestsViral",60097,13,52,,,1,,376,"6/4/2020 00:00","2020-06-04T00:00:00Z","06/03 20:00",10,52,,"2020-06-04T00:00:00Z",60097,,,,10,,,,,,,,,,,,,,"02",10,0,518,1915,518,,0,0,"4869d7feee2d5720e460bbacdbc1f2a3d18530c1",0,0,0,0,0,""
20200603,"AK",508,,,,"totalTestsViral",58182,11,52,,,0,,373,"6/3/2020 00:00","2020-06-03T00:00:00Z","06/02 20:00",10,52,,"2020-06-03T00:00:00Z",58182,,,,10,,,,,,,,,,,,,,"02",18,0,508,1979,508,,0,1,"a88d73842f4f6333291ad0d36e63cb8a5531550b",0,0,0,0,0,""
20200602,"AK",490,,,,"totalTestsViral",56203,10,51,,,0,,371,"6/2/2020 00:00","2020-06-02T00:00:00Z","06/01 20:00",10,51,,"2020-06-02T00:00:00Z",56203,,,,10,,,,,,,,,,,,,,"02",20,0,490,2013,490,,0,1,"a0716bd4a16334bc7614ee08db023b2fd0ba2f39",0,0,0,0,0,""
20200601,"AK",470,,,,"totalTestsViral",54190,10,50,,,1,,368,"6/1/2020 00:00","2020-06-01T00:00:00Z","05/31 20:00",10,50,,"2020-06-01T00:00:00Z",54190,,,,10,,,,,,,,,,,,,,"02",7,0,470,2495,470,,0,0,"a1eaa14ff465da0e7819a457449dcdcd0449420b",0,0,0,0,0,""
20200531,"AK",463,,,,"totalTestsViral",51695,14,50,,,2,,368,"5/30/2020 00:00","2020-05-30T00:00:00Z","05/29 20:00",10,50,,"2020-05-30T00:00:00Z",51695,,,,10,,,,,,,,,,,,,,"02",28,0,463,0,463,,0,0,"913e283a4f1177abaa53d0dd52973a46c86ffb2d",0,0,0,0,0,""
20200530,"AK",435,,,,"totalTestsViral",51695,14,50,,,2,,368,"5/30/2020 00:00","2020-05-30T00:00:00Z","05/29 20:00",10,50,,"2020-05-30T00:00:00Z",51695,,,,10,,,,,,,,,,,,,,"02",3,0,435,2256,435,,0,0,"fdca0e7e5399d7aa0887bb90b413f7e6c0e8f2bb",0,0,0,0,0,""
20200529,"AK",432,,,,"totalTestsViral",49439,14,50,,,1,,367,"5/29/2020 00:00","2020-05-29T00:00:00Z","05/28 20:00",10,50,,"2020-05-29T00:00:00Z",49439,,,,10,,,,,,,,,,,,,,"02",5,0,432,1469,432,,0,1,"e0e87ccbf5c9dae1b6289afa869610bff780a3c7",0,0,0,0,0,""
20200528,"AK",427,,,,"totalTestsViral",47970,10,49,,,,,366,"5/28/2020 00:00","2020-05-28T00:00:00Z","05/27 20:00",10,49,,"2020-05-28T00:00:00Z",47970,,,,10,,,,,,,,,,,,,,"02",13,0,427,1607,427,,0,0,"3af746c633e9b90c91826594041e1f4ffe68f2a6",0,0,0,0,0,""
20200527,"AK",414,,,,"totalTestsViral",46363,14,49,,,,,364,"5/27/2020 00:00","2020-05-27T00:00:00Z","05/26 20:00",10,49,,"2020-05-27T00:00:00Z",46363,,,,10,,,,,,,,,,,,,,"02",1,0,414,1399,414,,0,0,"95749732f5831edeaeaa06ae930c3757e0a8151c",0,0,0,0,0,""
20200526,"AK",413,,,,"totalTestsViral",44964,12,49,,,,,362,"5/26/2020 00:00","2020-05-26T00:00:00Z","05/25 20:00",10,49,,"2020-05-26T00:00:00Z",44964,,,,10,,,,,,,,,,,,,,"02",2,0,413,492,413,,0,0,"6d756850198a2853c22bc11aa347ce2e1bc83ee1",0,0,0,0,0,""
20200525,"AK",411,,,,"totalTestsViral",44472,10,49,,,,,361,"5/25/2020 00:00","2020-05-25T00:00:00Z","05/24 20:00",10,49,,"2020-05-25T00:00:00Z",44472,,,,10,,,,,,,,,,,,,,"02",1,0,411,965,411,,0,0,"28997702647200875b4c600a08702c3a81e59618",0,0,0,0,0,""
20200524,"AK",410,,,,"totalTestsViral",43507,10,49,,,,,358,"5/24/2020 00:00","2020-05-24T00:00:00Z","05/23 20:00",10,49,,"2020-05-24T00:00:00Z",43507,,,,10,,,,,,,,,,,,,,"02",0,0,410,1156,410,,0,0,"3e01fa4f979b22587d5656dd097fc8385053e4e0",0,0,0,0,0,""
20200523,"AK",410,,,,"totalTestsViral",42351,10,49,,,,,358,"5/23/2020 15:00","2020-05-23T15:00:00Z","05/23 11:00",10,49,,"2020-05-23T15:00:00Z",42351,,,,10,,,,,,,,,,,,,,"02",4,0,410,905,410,,0,0,"66d47e4e6a1722195c935b6421c97fdc94354f39",0,0,0,0,0,""
20200522,"AK",406,,,,"totalTestsViral",41446,15,49,,,,,356,"5/22/2020 00:00","2020-05-22T00:00:00Z","05/21 20:00",10,49,,"2020-05-22T00:00:00Z",41446,,,,10,,,,,,,,,,,,,,"02",2,0,406,1901,406,,0,2,"291d6e256fb2430e6292f5ad96568c7a6f246a21",0,0,0,0,0,""
20200521,"AK",404,,,,"totalTestsViral",39545,19,47,,,,,356,"5/21/2020 00:00","2020-05-21T00:00:00Z","05/20 20:00",10,47,,"2020-05-21T00:00:00Z",39545,,,,10,,,,,,,,,,,,,,"02",0,0,404,2500,404,,0,1,"702e674627c0f5ec8396fe05d111a0352c185117",0,0,0,0,0,""
20200520,"AK",404,,,,"totalTestsViral",37045,16,46,,,,,352,"5/20/2020 00:00","2020-05-20T00:00:00Z","05/19 20:00",10,46,,"2020-05-20T00:00:00Z",37045,,,,10,,,,,,,,,,,,,,"02",3,0,404,665,404,,0,0,"255a7f21dc7a6bf65981ad3a76136f43e084dada",0,0,0,0,0,""
20200519,"AK",401,,,,"totalTestsViral",36380,16,46,,,,,348,"5/19/2020 00:00","2020-05-19T00:00:00Z","05/18 20:00",10,46,,"2020-05-19T00:00:00Z",36380,,,,10,,,,,,,,,,,,,,"02",0,0,401,769,401,,0,0,"9e4d1e0887468e85a0da9d4e7e0cbbd0e87b8c30",0,0,0,0,0,""
20200518,"AK",401,,,,"totalTestsViral",35611,9,46,,,,,345,"5/18/2020 00:00","2020-05-18T00:00:00Z","05/17 20:00",10,46,,"2020-05-18T00:00:00Z",35611,,,,10,,,,,,,,,,,,,,"02",3,0,401,960,401,,0,0,"145c85da853d4f16acc5e88167531cd5e7ec4d9c",0,0,0,0,0,""
20200517,"AK",398,,,,"totalTestsViral",34651,13,46,,,,,344,"5/17/2020 00:00","2020-05-17T00:00:00Z","05/16 20:00",10,46,,"2020-05-17T00:00:00Z",34651,,,,10,,,,,,,,,,,,,,"02",4,0,398,1370,398,,0,1,"c6d30c5704ab6e564028f54180cac4a257c8528d",0,0,0,0,0,""
20200516,"AK",394,,,,"totalTestsViral",33281,10,45,,,,,344,"5/16/2020 00:00","2020-05-16T00:00:00Z","05/15 20:00",10,45,,"2020-05-16T00:00:00Z",33281,,,,10,,,,,,,,,,,,,,"02",4,0,394,863,394,,0,2,"b13a048ca47c7769a9c7a1a7bd0cf43bac4e46da",0,0,0,0,0,""
20200515,"AK",390,,,,"totalTestsViral",32418,8,43,,,,,343,"5/14/2020 00:00","2020-05-14T00:00:00Z","05/13 20:00",10,43,,"2020-05-14T00:00:00Z",32418,,,,10,,,,,,,,,,,,,,"02",1,0,390,656,390,,0,1,"824a69cc7500028afc010a71736cfc3cb2e770b5",0,0,0,0,0,""
20200514,"AK",389,,,,"totalTestsViral",31762,12,42,,,,,339,"5/14/2020 00:00","2020-05-14T00:00:00Z","05/13 20:00",10,42,,"2020-05-14T00:00:00Z",31762,,,,10,,,,,,,,,,,,,,"02",5,0,389,1113,389,,0,1,"737e3e4de92b05355423f43d86b330d85bd7719b",0,0,0,0,0,""
20200513,"AK",384,,,,"totalTestsViral",30649,12,41,,,,,338,"5/13/2020 00:00","2020-05-13T00:00:00Z","05/12 20:00",10,41,,"2020-05-13T00:00:00Z",30649,,,,10,,,,,,,,,,,,,,"02",1,0,384,688,384,,0,0,"ca24d9bbc94c61317d26ecde952351acd1d986cc",0,0,0,0,0,""
20200512,"AK",383,,,,"totalTestsViral",29961,10,41,,,,,334,"5/12/2020 00:00","2020-05-12T00:00:00Z","05/11 20:00",10,41,,"2020-05-12T00:00:00Z",29961,,,,10,,,,,,,,,,,,,,"02",2,0,383,1281,383,,0,0,"f9b25896e4d38fa3bf274ade5761374d84e0f810",0,0,0,0,0,""
20200511,"AK",381,,,,"totalTestsViral",28680,7,41,,,,,328,"5/11/2020 00:00","2020-05-11T00:00:00Z","05/10 20:00",10,41,,"2020-05-11T00:00:00Z",28680,,,,10,,,,,,,,,,,,,,"02",2,0,381,1316,381,,0,0,"b418f0b9cd45c5125abb114e0e720aaf6e1b3b13",0,0,0,0,0,""
20200510,"AK",379,,,,"totalTestsViral",27364,8,41,,,,,324,"5/10/2020 14:00","2020-05-10T14:00:00Z","05/10 10:00",10,41,,"2020-05-10T14:00:00Z",27364,,,,10,,,,,,,,,,,,,,"02",1,0,379,915,379,,0,0,"f3b6a11e8239c7fcd993b45e1a7fb5a435915980",0,0,0,0,0,""
20200509,"AK",378,,,,"totalTestsViral",26449,8,41,,,,,318,"5/9/2020 00:00","2020-05-09T00:00:00Z","05/08 20:00",10,41,,"2020-05-09T00:00:00Z",26449,,,,10,,,,,,,,,,,,,,"02",1,0,378,976,378,,0,0,"48737cd1fe4a7b7b9ff0c4a1cdb04104d60d24a3",0,0,0,0,0,""
20200508,"AK",377,,,,"totalTestsViral",25473,16,41,,,,,305,"5/8/2020 00:00","2020-05-08T00:00:00Z","05/07 20:00",10,41,,"2020-05-08T00:00:00Z",25473,,,,10,,,,,,,,,,,,,,"02",3,0,377,1132,377,,0,0,"67f60af7b47ef857c3cd5d88d24d88135d63c7e8",0,0,0,0,0,""
20200507,"AK",374,,,,"totalTestsViral",24341,12,41,,,,,291,"5/7/2020 00:00","2020-05-07T00:00:00Z","05/06 20:00",10,41,,"2020-05-07T00:00:00Z",24341,,,,10,,,,,,,,,,,,,,"02",2,0,374,686,374,,0,0,"d23c9f9aee88e6eb0090ef941504f872fc88be88",0,0,0,0,0,""
20200506,"AK",372,,,,"totalTestsViral",23655,8,41,,,,,284,"5/6/2020 00:00","2020-05-06T00:00:00Z","05/05 20:00",10,41,,"2020-05-06T00:00:00Z",23655,,,,10,,,,,,,,,,,,,,"02",1,0,372,963,372,,1,1,"2f6f579150ade87e7f71bf8f7d9f8d2ccb2f2717",0,0,0,0,0,""
20200505,"AK",371,,,,"totalTestsViral",22692,13,40,,,,,277,"5/5/2020 00:00","2020-05-05T00:00:00Z","05/04 20:00",9,40,,"2020-05-05T00:00:00Z",22692,,,,9,,,,,,,,,,,,,,"02",1,0,371,969,371,,0,1,"dd97b8b6925fa80085bb29fa88ddecc46835f42d",0,0,0,0,0,""
20200504,"AK",370,,,,"totalTestsViral",21723,12,39,,,,,263,"5/4/2020 00:00","2020-05-04T00:00:00Z","05/03 20:00",9,39,,"2020-05-04T00:00:00Z",21723,,,,9,,,,,,,,,,,,,,"02",2,0,370,145,370,,0,0,"ac5daa50a4adbec1e0aca1aefd1bee15dfc67ea6",0,0,0,0,0,""
20200503,"AK",368,,,,"totalTestsViral",21578,12,39,,,,,262,"5/3/2020 14:15","2020-05-03T14:15:00Z","05/03 10:15",9,39,,"2020-05-03T14:15:00Z",21578,,,,9,,,,,,,,,,,,,,"02",3,0,368,179,368,,0,0,"455653777741a54cf325f27975d4f614390a3a76",0,0,0,0,0,""
20200502,"AK",365,,,,"totalTestsViral",21399,10,39,,,,,261,"5/2/2020 00:00","2020-05-02T00:00:00Z","05/01 20:00",9,39,,"2020-05-02T00:00:00Z",21399,,,,,,,,,,,,,,,,,,"02",1,0,365,1074,365,,0,0,"1adb4e01d7e453f26feede5b4b77ff6a262eff9c",0,0,0,0,0,""
20200501,"AK",364,,,,"totalTestsViral",20325,25,39,,,,,254,"5/1/2020 14:00","2020-05-01T14:00:00Z","05/01 10:00",9,39,,"2020-05-01T14:00:00Z",20325,,,,,,,,,,,,,,,,,,"02",9,0,364,1206,364,,0,1,"e6378f39a574ef96f94e8e15dba8e0c2d1ac3c19",0,0,0,0,0,""
20200430,"AK",355,,,,"totalTestsViral",19119,19,38,,,,,252,"4/30/2020 15:00","2020-04-30T15:00:00Z","04/30 11:00",9,38,,"2020-04-30T15:00:00Z",19119,,,,,,,,,,,,,,,,,,"02",0,0,355,0,355,,0,0,"9acd3444a21655122b612f65c460aec4774db8e2",0,0,0,0,0,""
20200429,"AK",355,,,,"totalTestsViral",19119,14,38,,,,,240,"4/28/2020 14:50","2020-04-28T14:50:00Z","04/28 10:50",9,38,,"2020-04-28T14:50:00Z",19119,,,,,,,,,,,,,,,,,,"02",4,0,355,2030,355,,0,0,"8dfceef1c9044b3baee838193d156f06745802f9",0,0,0,0,0,""
20200428,"AK",351,,,,"totalTestsViral",17089,16,38,,,,,228,"4/28/2020 14:50","2020-04-28T14:50:00Z","04/28 10:50",9,38,,"2020-04-28T14:50:00Z",17089,,,,,,,,,,,,,,,,,,"02",6,0,351,833,351,,0,1,"17984964bf24b321103bfbc2879ae043d310c68b",0,0,0,0,0,""
20200427,"AK",345,,,,"totalTestsViral",16256,10,37,,,,,218,"4/27/2020 14:00","2020-04-27T14:00:00Z","04/27 10:00",9,37,,"2020-04-27T14:00:00Z",16256,,,,,,,,,,,,,,,,,,"02",4,0,345,79,345,,0,0,"652fc1591c4692da71d3078a2c8f0a30fa18f314",0,0,0,0,0,""
20200426,"AK",341,,,,"totalTestsViral",16177,14,37,,,,,217,"4/26/2020 14:15","2020-04-26T14:15:00Z","04/26 10:15",9,37,,"2020-04-26T14:15:00Z",16177,,,,,,,,,,,,,,,,,,"02",2,0,341,445,341,,0,0,"166e1d09ba8a16f2e39ecf051907b6c9c9a618e2",0,0,0,0,0,""
20200425,"AK",339,,,,"totalTestsViral",15732,32,37,,,,,217,"4/25/2020 16:00","2020-04-25T16:00:00Z","04/25 12:00",9,37,,"2020-04-25T16:00:00Z",15732,,,,,,,,,,,,,,,,,,"02",0,0,339,3451,339,,0,0,"69dd090a9be585959ae360c2b9c8fbba06fbe9cd",0,0,0,0,0,""
20200424,"AK",339,,,,"totalTestsViral",12281,36,37,,,,,208,"4/24/2020 15:00","2020-04-24T15:00:00Z","04/24 11:00",9,37,,"2020-04-24T15:00:00Z",12281,,,,,,,,,,,,,,,,,,"02",2,0,339,120,339,,0,0,"e6e12041fbe2bb3127fc2a5e77a680f694ae9463",0,0,0,0,0,""
20200423,"AK",337,,,,"totalTestsViral",12161,42,37,,,,,209,"4/23/2020 14:00","2020-04-23T14:00:00Z","04/23 10:00",9,37,,"2020-04-23T14:00:00Z",12161,,,,,,,,,,,,,,,,,,"02",2,0,337,2,337,,0,0,"bae64c8737a6fda7af1ac23f95e037058db27b75",0,0,0,0,0,""
20200422,"AK",335,,,,"totalTestsViral",12159,39,37,,,,,196,"4/22/2020 14:00","2020-04-22T14:00:00Z","04/22 10:00",9,37,,"2020-04-22T14:00:00Z",12159,,,,,,,,,,,,,,,,,,"02",6,0,335,1040,335,,0,0,"2f521f195bd60d0fc5fe7e80fd0782c84b1d7330",0,0,0,0,0,""
20200421,"AK",329,,,,"totalTestsViral",11119,42,37,,,,,168,"4/21/2020 15:15","2020-04-21T15:15:00Z","04/21 11:15",9,37,,"2020-04-21T15:15:00Z",11119,,,,,,,,,,,,,,,,,,"02",8,0,329,995,329,,0,0,"579ed9ee629a0ad1b5cc65e829a17ac00e9ef41d",0,0,0,0,0,""
20200420,"AK",321,,,,"totalTestsViral",10124,46,37,,,,,161,"4/20/2020 14:00","2020-04-20T14:00:00Z","04/20 10:00",9,37,,"2020-04-20T14:00:00Z",10124,,,,,,,,,,,,,,,,,,"02",2,0,321,229,321,,0,0,"6ada993d6f7b9d1119acbe9826547f02e50019b1",0,0,0,0,0,""
20200419,"AK",319,,,,"totalTestsViral",9895,37,37,,,,,153,"4/18/2020 17:45","2020-04-18T17:45:00Z","04/18 13:45",9,37,,"2020-04-18T17:45:00Z",9895,,,,,,,,,,,,,,,,,,"02",5,0,319,240,319,,0,0,"40a9cc180573ff86c6a303bd0ba165b50e9f1cd4",0,0,0,0,0,""
20200418,"AK",314,,,,"totalTestsViral",9655,39,37,,,,,147,"4/18/2020 14:15","2020-04-18T14:15:00Z","04/18 10:15",9,37,,"2020-04-18T14:15:00Z",9655,,,,,,,,,,,,,,,,,,"02",5,0,314,205,314,,0,0,"b61d66afa671da8c217b8d3027a1a2426e630e3a",0,0,0,0,0,""
20200417,"AK",309,,,,"totalTestsViral",9450,,37,,,,,128,"4/16/2020 00:00","2020-04-16T00:00:00Z","04/15 20:00",9,37,,"2020-04-16T00:00:00Z",9450,,,,,,,,,,,,,,,,,,"02",9,0,309,715,309,,0,1,"6492258595856d2cf13d223d56dd2ea4ba00f2d0",0,0,0,0,0,""
20200416,"AK",300,,,,"totalTestsViral",8735,,36,,,,,110,"4/16/2020 15:30","2020-04-16T15:30:00Z","04/16 11:30",9,36,,"2020-04-16T15:30:00Z",8735,,,,,,,,,,,,,,,,,,"02",7,0,300,71,300,,0,3,"6dc9decb88a11a6ca9212c240e311f5b4d766e0a",0,0,0,0,0,""
20200415,"AK",293,,,,"totalTestsViral",8664,,33,,,,,106,"4/15/2020 15:15","2020-04-15T15:15:00Z","04/15 11:15",9,33,,"2020-04-15T15:15:00Z",8664,,,,,,,,,,,,,,,,,,"02",8,0,293,316,293,,0,0,"068237a254764459fdddafe83738a4c8e7f574e7",0,0,0,0,0,""
20200414,"AK",285,,,,"totalTestsViral",8348,,33,,,,,98,"4/14/2020 14:15","2020-04-14T14:15:00Z","04/14 10:15",9,33,,"2020-04-14T14:15:00Z",8348,,,,,,,,,,,,,,,,,,"02",8,0,285,518,285,,1,0,"8c9a01ba4e79976e6068dbffd92ec8706f9a9d7e",0,0,0,0,0,""
20200413,"AK",277,,,,"totalTestsViral",7830,,33,,,,,85,"4/13/2020 00:00","2020-04-13T00:00:00Z","04/12 20:00",8,33,,"2020-04-13T00:00:00Z",7830,,,,,,,,,,,,,,,,,,"02",5,0,277,-208,277,,0,0,"d9f94fa0a79b820e068ac2fcf8afd073ec77f8f2",0,0,0,0,0,""
20200412,"AK",272,,,,"totalTestsViral",8038,,33,,,,,66,"4/12/2020 14:50","2020-04-12T14:50:00Z","04/12 10:50",8,33,,"2020-04-12T14:50:00Z",8038,,,,,,,,,,,,,,,,,,"02",15,0,272,306,272,,0,1,"aa0042cc5209e92f4dddbe766363c84b1bb04050",0,0,0,0,0,""
20200411,"AK",257,,,,"totalTestsViral",7732,,32,,,,,63,"4/11/2020 14:45","2020-04-11T14:45:00Z","04/11 10:45",8,32,,"2020-04-11T14:45:00Z",7732,,,,,,,,,,,,,,,,,,"02",11,0,257,300,257,,1,2,"0ed505f8707bb9e85f9f11817b14af319bef883b",0,0,0,0,0,""
20200410,"AK",246,,,,"totalTestsViral",7432,,30,,,,,55,"4/10/2020 15:30","2020-04-10T15:30:00Z","04/10 11:30",7,30,,"2020-04-10T15:30:00Z",7432,,,,,,,,,,,,,,,,,,"02",11,0,246,209,246,,0,0,"ef81d9dc2967775d1ccbc4a8b401ae30f3d3958a",0,0,0,0,0,""
20200409,"AK",235,,,,"totalTestsViral",7223,,30,,,,,49,"4/9/2020 16:00","2020-04-09T16:00:00Z","04/09 12:00",7,30,,"2020-04-09T16:00:00Z",7223,,,,,,,,,,,,,,,,,,"02",9,0,235,155,235,,0,2,"38d2b2cad9221fc5d3b5c41f5663914a43f9e6da",0,0,0,0,0,""
20200408,"AK",226,,,,"totalTestsViral",7068,,28,,,,,32,"4/8/2020 15:00","2020-04-08T15:00:00Z","04/08 11:00",7,28,,"2020-04-08T15:00:00Z",7068,,,,,,,,,,,,,,,,,,"02",13,0,226,155,226,,1,2,"cf29655475ed981bf5a67f895f45ac717439d7e3",0,0,0,0,0,""
20200407,"AK",213,,,,"totalTestsViral",6913,,26,,,,,29,"4/7/2020 15:15","2020-04-07T15:15:00Z","04/07 11:15",6,26,,"2020-04-07T15:15:00Z",6913,,,,,,,,,,,,,,,,,,"02",22,0,213,30,213,,0,1,"e23a387879a7387141513d026afb57875f488abc",0,0,0,0,0,""
20200406,"AK",191,,,,"totalTestsViral",6883,,25,,,,,,"4/6/2020 14:45","2020-04-06T14:45:00Z","04/06 10:45",6,25,,"2020-04-06T14:45:00Z",6883,,,,,,,,,,,,,,,,,,"02",6,0,191,599,191,,0,4,"64e97c72b6031b0876040a656ddc5a14f2cb8012",0,0,0,0,0,""
20200405,"AK",185,,,,"totalTestsViral",6284,,21,,,,,,"4/5/2020 00:00","2020-04-05T00:00:00Z","04/04 20:00",6,21,,"2020-04-05T00:00:00Z",6284,,,,,,,,,,,,,,,,,,"02",14,0,185,244,185,,1,4,"3a7fd6d84b64deac7495e8f6d93ad0bd14b2f170",0,0,0,0,0,""
20200404,"AK",171,,,,"totalTestsViral",6040,,17,,,,,,"4/4/2020 16:00","2020-04-04T16:00:00Z","04/04 12:00",5,17,,"2020-04-04T16:00:00Z",6040,,,,,,,,,,,,,,,,,,"02",11,0,171,24,171,,2,0,"dc81e7a1d6f6c0fb730c50dc2eecbc3ec6ca4ab2",0,0,0,0,0,""
20200403,"AK",160,,,,"totalTestsViral",6016,,17,,,,,,"4/3/2020 16:00","2020-04-03T16:00:00Z","04/03 12:00",3,17,,"2020-04-03T16:00:00Z",6016,,,,,,,,,,,,,,,,,,"02",11,0,160,994,160,,0,1,"4b8a2ec08197cb3fd7da3041e324873d869296ed",0,0,0,0,0,""
20200402,"AK",149,,,,"totalTestsViral",5022,,16,,,,,,"4/1/2020 21:00","2020-04-01T21:00:00Z","04/01 17:00",3,16,,"2020-04-01T21:00:00Z",5022,,,,,,,,,,,,,,,,,,"02",8,0,149,419,149,,0,1,"0388dd70a500d26fc180d4cbc19b6253ef9cbafa",0,0,0,0,0,""
20200401,"AK",141,,,,"totalTestsViral",4603,,15,,,,,,"3/31/2020 19:00","2020-03-31T19:00:00Z","03/31 15:00",3,15,,"2020-03-31T19:00:00Z",4603,,,,,,,,,,,,,,,,,,"02",13,0,141,890,141,,0,3,"8bd2caead3b0b40494b5e9bde0c7304bd4380aec",0,0,0,0,0,""
20200331,"AK",128,,,,"totalTestsViral",3713,,12,,,,,,"3/30/2020 19:00","2020-03-30T19:00:00Z","03/30 15:00",3,12,,"2020-03-30T19:00:00Z",3713,,,,,,,,,,,,,,,,,,"02",10,0,128,59,128,,0,2,"36b466183d426544514f2c06c3022473da5a8e44",0,0,0,0,0,""
20200330,"AK",118,,,,"totalTestsViral",3654,,10,,,,,,"3/29/2020 19:00","2020-03-29T19:00:00Z","03/29 15:00",3,10,,"2020-03-29T19:00:00Z",3654,,,,,,,,,,,,,,,,,,"02",8,0,118,320,118,,1,0,"e24cd3e671ff25f41643635b3eb1d8824cf854dd",0,0,0,0,0,""
20200329,"AK",110,,,,"totalTestsViral",3334,,10,,,,,,"3/28/2020 19:00","2020-03-28T19:00:00Z","03/28 15:00",2,10,,"2020-03-28T19:00:00Z",3334,,,,,,,,,,,,,,,,,,"02",19,0,110,413,110,,0,0,"f9a51c1e06436e715e5613ceef9e7d36e7b2cb0e",0,0,0,0,0,""
20200328,"AK",91,,,,"totalTestsViral",2921,,10,,,,,,"3/27/2020 19:00","2020-03-27T19:00:00Z","03/27 15:00",2,10,,"2020-03-27T19:00:00Z",2921,,,,,,,,,,,,,,,,,,"02",17,0,91,533,91,,1,4,"74481917f3f103196e1ab64f81756c35024a414e",0,0,0,0,0,""
20200327,"AK",74,,,13,"totalTestsViral",2388,,6,,,,,,"3/26/2020 21:00","2020-03-26T21:00:00Z","03/26 17:00",1,6,,"2020-03-26T21:00:00Z",2388,,,,,,,,,,,,,,,,,,"02",11,0,87,528,74,,0,2,"4224e3f4de5b4de95907d3d4217e43ad88ebe01f",0,0,0,0,0,""
20200326,"AK",63,,,,"totalTestsViral",1860,,4,,,,,,"3/25/2020 21:00","2020-03-25T21:00:00Z","03/25 17:00",1,4,,"2020-03-25T21:00:00Z",1860,,,,,,,,,,,,,,,,,,"02",14,0,63,169,63,,0,1,"3241d11c8d0fe62f765ddd18c1b617edc89251b7",0,0,0,0,0,""
20200325,"AK",49,,,,"totalTestsViral",1691,,3,,,,,,"3/24/2020 21:00","2020-03-24T21:00:00Z","03/24 17:00",1,3,,"2020-03-24T21:00:00Z",1691,,,,,,,,,,,,,,,,,,"02",7,0,49,669,49,,1,1,"b5e4ecb165798774af36d80a1594a9ba567dc9a0",0,0,0,0,0,""
20200324,"AK",42,,,,"totalTestsViral",1022,,2,,,,,,"3/23/2020 19:00","2020-03-23T19:00:00Z","03/23 15:00",0,2,,"2020-03-23T19:00:00Z",1022,,,,,,,,,,,,,,,,,,"02",4,0,42,54,42,,0,1,"38097e60eaa08f260a92b92cf24e25e12fda8956",0,0,0,0,0,""
20200323,"AK",38,,,,"totalTestsViral",968,,1,,,,,,"3/21/2020 16:30","2020-03-21T16:30:00Z","03/21 12:30",0,1,,"2020-03-21T16:30:00Z",968,,,,,,,,,,,,,,,,,,"02",13,0,38,0,38,,0,0,"63767885882528f4cb6d93e059a57321e416e149",0,0,0,0,0,""
20200322,"AK",25,,,,"totalTestsViral",968,,1,,,,,,"3/21/2020 16:30","2020-03-21T16:30:00Z","03/21 12:30",0,1,,"2020-03-21T16:30:00Z",968,,,,,,,,,,,,,,,,,,"02",10,0,25,196,25,,0,0,"342ebafe1412cd0a71eb8a847e331b44a1384adf",0,0,0,0,0,""
20200321,"AK",15,,,,"totalTestsViral",772,,1,,,,,,"3/21/2020 16:30","2020-03-21T16:30:00Z","03/21 12:30",0,1,,"2020-03-21T16:30:00Z",772,,,,,,,,,,,,,,,,,,"02",1,0,15,74,15,,0,0,"3c7d5c9ed1de9bcde6e678bdee54b2c305cf2526",0,0,0,0,0,""
20200320,"AK",14,,,,"totalTestsViral",698,,1,,,,,,"3/20/2020 16:30","2020-03-20T16:30:00Z","03/20 12:30",0,1,,"2020-03-20T16:30:00Z",698,,,,,,,,,,,,,,,,,,"02",3,0,14,260,14,,0,0,"e2f681213889eb5e05422b400337d0b2f92cc124",0,0,0,0,0,""
20200319,"AK",11,,,,"totalTestsViral",438,,1,,,,,,"3/18/2020 16:30","2020-03-18T16:30:00Z","03/18 12:30",0,1,,"2020-03-18T16:30:00Z",438,,,,,,,,,,,,,,,,,,"02",3,0,11,26,11,,0,0,"60f26c10c0d8de513f7afec218a1fdf2240a7ffd",0,0,0,0,0,""
20200318,"AK",8,,,,"totalTestsViral",412,,1,,,,,,"3/17/2020 23:00","2020-03-17T23:00:00Z","03/17 19:00",0,1,,"2020-03-17T23:00:00Z",412,,,,,,,,,,,,,,,,,,"02",5,0,8,75,8,,0,0,"afc74332e61d8646d093dbdb9dc0fa65bad72804",0,0,0,0,0,""
20200317,"AK",3,,,,"totalTestsViral",337,,1,,,,,,"3/17/2020 00:01","2020-03-17T00:01:00Z","03/16 20:01",0,1,,"2020-03-17T00:01:00Z",337,,,,,,,,,,,,,,,,,,"02",3,0,3,193,3,,0,0,"6068bcb8f440ae47f7728cae3828396c2ce7b40d",0,0,0,0,0,""
20200316,"AK",,,,,"totalTestsViral",144,,1,,,,,,"3/16/2020 15:06","2020-03-16T15:06:00Z","03/16 11:06",0,1,,"2020-03-16T15:06:00Z",144,,,,,,,,,,,,,,,,,,"02",0,0,0,0,0,,0,0,"28d01bd157bf2a795abfa7b8391da75b973b744a",0,0,0,0,0,""
20200315,"AK",,,,,"totalTestsViral",144,,1,,,,,,"3/13/2020 16:30","2020-03-13T16:30:00Z","03/13 12:30",0,1,,"2020-03-13T16:30:00Z",144,,,,,,,,,,,,,,,,,,"02",0,0,0,0,0,,0,0,"ff3699238049dcf3b1c96832b6dc80ddb4df3a99",0,0,0,0,0,""
20200314,"AK",,,,,"totalTestsViral",144,,1,,,,,,"3/13/2020 16:30","2020-03-13T16:30:00Z","03/13 12:30",0,1,,"2020-03-13T16:30:00Z",144,,,,,,,,,,,,,,,,,,"02",0,0,0,84,0,,0,0,"dc754cc4c4e086cb906d986bf45986fd040d976b",0,0,0,0,0,""
20200313,"AK",,,,,"totalTestsViral",60,,1,,,,,,"3/13/2020 00:00","2020-03-13T00:00:00Z","03/12 20:00",0,1,,"2020-03-13T00:00:00Z",60,,,,,,,,,,,,,,,,,,"02",0,0,0,14,0,,0,0,"161c1b6d587bf2d0e7c2e392d0526c5bf5a19224",0,0,0,0,0,""
20200312,"AK",,,,14,"totalTestsViral",46,,1,,,,,,"3/11/2020 16:30","2020-03-11T16:30:00Z","03/11 12:30",0,1,,"2020-03-11T16:30:00Z",46,,,,,,,,,,,,,,,,,,"02",0,0,14,0,0,,0,0,"020adeb48c1002ff06cb72e0490424953ef4c442",0,0,0,0,0,""
20200311,"AK",,,,14,"totalTestsViral",46,,1,,,,,,,,,0,1,,,46,,,,,,,,,,,,,,,,,,"02",0,0,14,23,0,,0,0,"1497b3f8301278f44cfdd139ffacc6163f5443a0",0,0,0,0,0,""
20200310,"AK",,,,9,"totalTestsViral",23,,1,,,,,,,,,0,1,,,23,,,,,,,,,,,,,,,,,,"02",0,0,9,0,0,,0,0,"41ecc8af507387301652e0bb695c90af3caca45d",0,0,0,0,0,""
20200309,"AK",,,,9,"totalTestsViral",23,,1,,,,,,,,,0,1,,,23,,,,,,,,,,,,,,,,,,"02",0,0,9,9,0,,0,1,"e5fdecc645ef8aa383bb58cae9bdaf905ab33583",0,0,0,0,0,""
20200308,"AK",,,,6,"totalTestsViral",14,,,,,,,,,,,0,,,,14,,,,,,,,,,,,,,,,,,"02",0,0,6,2,0,,0,0,"c90ce1a21475c44727e5853c22c009321728270c",0,0,0,0,0,""
20200307,"AK",,,,2,"totalTestsViral",12,,,,,,,,,,,0,,,,12,,,,,,,,,,,,,,,,,,"02",0,0,2,4,0,,0,0,"7162c5ea37dd3e1693bfb3c2b9e97fe5e518755d",0,0,0,0,0,""
20200306,"AK",,,,1,"totalTestsViral",8,,,,,,,,,,,0,,,,8,,,,,,,,,,,,,,,,,,"02",0,0,1,0,0,,0,0,"a342f77e8bb779edc91c9e1a1be309cd4338356b",0,0,0,0,0,""