"date","state","positive","probableCases","negative","pending","totalTestResultsSource","totalTestResults","hospitalizedCurrently","hospitalizedCumulative","inIcuCurrently","inIcuCumulative","onVentilatorCurrently","onVentilatorCumulative","recovered","lastUpdateEt","dateModified","checkTimeEt","death","hospitalized","hospitalizedDischarged","dateChecked","totalTestsViral","positiveTestsViral","negativeTestsViral","positiveCasesViral","deathConfirmed","deathProbable","totalTestEncountersViral","totalTestsPeopleViral","totalTestsAntibody","positiveTestsAntibody","negativeTestsAntibody","totalTestsPeopleAntibody","positiveTestsPeopleAntibody","negativeTestsPeopleAntibody","totalTestsPeopleAntigen","positiveTestsPeopleAntigen","totalTestsAntigen","positiveTestsAntigen","fips","positiveIncrease","negativeIncrease","total","totalTestResultsIncrease","posNeg","dataQualityGrade","deathIncrease","hospitalizedIncrease","hash","commercialScore","negativeRegularScore","negativeScore","positiveScore","score","grade"
20210307,"CT",285330,19621,,,"totalTestsViral",6520366,428,,,,,,,"3/4/2021 23:59","2021-03-04T23:59:00Z","03/04 18:59",7704,,,"2021-03-04T23:59:00Z",6520366,323284,6188566,265709,6327,1377,,,,,,,,,,,396680,22245,"09",0,0,285330,0,285330,,0,0,"38f39494134d22cd0d06e4ce63aa4a4ac10aa930",0,0,0,0,0,""
20210306,"CT",285330,19621,,,"totalTestsViral",6520366,428,,,,,,,"3/4/2021 23:59","2021-03-04T23:59:00Z","03/04 18:59",7704,,,"2021-03-04T23:59:00Z",6520366,323284,6188566,265709,6327,1377,,,,,,,,,,,396680,22245,"09",0,0,285330,0,285330,,0,0,"0951e354801a64a05ba03d58d6bdfed350e51930",0,0,0,0,0,""
20210305,"CT",285330,19621,,,"totalTestsViral",6520366,428,,,,,,,"3/4/2021 23:59","2021-03-04T23:59:00Z","03/04 18:59",7704,,,"2021-03-04T23:59:00Z",6520366,323284,6188566,265709,6327,1377,,,,,,,,,,,396680,22245,"09",830,0,285330,41868,285330,,11,0,"8a1ae622434681cd6c63327bc0574dee1f12cdc5",0,0,0,0,0,""
20210304,"CT",284500,19508,,,"totalTestsViral",6478498,433,,,,,,,"3/3/2021 23:59","2021-03-03T23:59:00Z","03/03 18:59",7693,,,"2021-03-03T23:59:00Z",6478498,322440,6147613,264992,6320,1373,,,,,,,,,,,393486,22088,"09",878,0,284500,42863,284500,,15,0,"5e2d861f439f6e51d56069fcef9e47ab0f1402c7",0,0,0,0,0,""
20210303,"CT",283622,19424,,,"totalTestsViral",6435635,451,,,,,,,"3/2/2021 23:59","2021-03-02T23:59:00Z","03/02 18:59",7678,,,"2021-03-02T23:59:00Z",6435635,321537,6105720,264198,6306,1372,,,,,,,,,,,389220,21962,"09",494,0,283622,17168,283622,,20,0,"dd9566d3f2fdc2e5f6a76705c5fc4659d77fc749",0,0,0,0,0,""
20210302,"CT",283128,19252,,,"totalTestsViral",6418467,413,,,,,,,"3/1/2021 23:59","2021-03-01T23:59:00Z","03/01 18:59",7658,,,"2021-03-01T23:59:00Z",6418467,321160,6089025,263876,6287,1371,,,,,,,,,,,384222,21744,"09",502,0,283128,15041,283128,,7,0,"8864e5559e9c68362dfebce559987409ec9f582a",0,0,0,0,0,""
20210301,"CT",282626,19178,,,"totalTestsViral",6403426,417,,,,,,,"2/28/2021 23:59","2021-02-28T23:59:00Z","02/28 18:59",7651,,,"2021-02-28T23:59:00Z",6403426,320670,6074561,263448,6280,1371,,,,,,,,,,,381930,21643,"09",2680,0,282626,104149,282626,,29,0,"1531b9a08e3e667a3e669a330deead1cad402c13",0,0,0,0,0,""
20210228,"CT",279946,18894,,,"totalTestsViral",6299277,451,,,,,,,"2/25/2021 23:59","2021-02-25T23:59:00Z","02/25 18:59",7622,,,"2021-02-25T23:59:00Z",6299277,317614,5973606,261052,6254,1368,,,,,,,,,,,371931,21235,"09",0,0,279946,0,279946,,0,0,"69b411fa5991a9efe9107ab9b01265d06729165e",0,0,0,0,0,""
20210227,"CT",279946,18894,,,"totalTestsViral",6299277,451,,,,,,,"2/25/2021 23:59","2021-02-25T23:59:00Z","02/25 18:59",7622,,,"2021-02-25T23:59:00Z",6299277,317614,5973606,261052,6254,1368,,,,,,,,,,,371931,21235,"09",0,0,279946,0,279946,,0,0,"bf89f0b960fdbfa4e65a3968d7216abb9e01182c",0,0,0,0,0,""
20210226,"CT",279946,18894,,,"totalTestsViral",6299277,451,,,,,,,"2/25/2021 23:59","2021-02-25T23:59:00Z","02/25 18:59",7622,,,"2021-02-25T23:59:00Z",6299277,317614,5973606,261052,6254,1368,,,,,,,,,,,371931,21235,"09",787,0,279946,32146,279946,,8,0,"06a801e1b7e69398b98d3abdee6b6ea96559a28d",0,0,0,0,0,""
20210225,"CT",279159,18734,,,"totalTestsViral",6267131,485,,,,,,,"2/24/2021 23:59","2021-02-24T23:59:00Z","02/24 18:59",7614,,,"2021-02-24T23:59:00Z",6267131,316978,5942165,260425,6248,1366,,,,,,,,,,,368567,21021,"09",975,0,279159,39700,279159,,19,0,"d64e81e7898a3ccd7bbb01d5064ab9d75612fbf6",0,0,0,0,0,""
20210224,"CT",278184,18584,,,"totalTestsViral",6227431,495,,,,,,,"2/23/2021 23:59","2021-02-23T23:59:00Z","02/23 18:59",7595,,,"2021-02-23T23:59:00Z",6227431,315971,5903519,259600,6230,1365,,,,,,,,,,,362250,20801,"09",1493,0,278184,28724,278184,,23,0,"97638d93eea72e7bd37805a20c7c1eee82074651",0,0,0,0,0,""
20210223,"CT",276691,17846,,,"totalTestsViral",6198707,511,,,,,,,"2/22/2021 23:59","2021-02-22T23:59:00Z","02/22 18:59",7572,,,"2021-02-22T23:59:00Z",6198707,315104,5875715,258845,6211,1361,,,,,,,,,,,343598,19450,"09",1357,0,276691,21232,276691,,10,0,"218adc66e078927ed5db233747a3012584ccdebc",0,0,0,0,0,""
20210222,"CT",275334,17041,,,"totalTestsViral",6177475,500,,,,,,,"2/21/2021 23:59","2021-02-21T23:59:00Z","02/21 18:59",7562,,,"2021-02-21T23:59:00Z",6177475,314431,5855183,258293,6202,1360,,,,,,,,,,,330182,18301,"09",2233,0,275334,80961,275334,,39,0,"1ef17bded6727307ef7d89b032fe9091a3b52c36",0,0,0,0,0,""
20210221,"CT",273101,16962,,,"totalTestsViral",6096514,535,,,,,,,"2/18/2021 23:59","2021-02-18T23:59:00Z","02/18 18:59",7523,,,"2021-02-18T23:59:00Z",6096514,311736,5777127,256139,6166,1357,,,,,,,,,,,324744,18150,"09",0,0,273101,0,273101,,0,0,"c92f9414bdc1ae637fad71d51f18174ec3a04e9d",0,0,0,0,0,""
20210220,"CT",273101,16962,,,"totalTestsViral",6096514,535,,,,,,,"2/18/2021 23:59","2021-02-18T23:59:00Z","02/18 18:59",7523,,,"2021-02-18T23:59:00Z",6096514,311736,5777127,256139,6166,1357,,,,,,,,,,,324744,18150,"09",0,0,273101,0,273101,,0,0,"75b758be70c99f830990f65c76860e5a0a386b1f",0,0,0,0,0,""
20210219,"CT",273101,16962,,,"totalTestsViral",6096514,535,,,,,,,"2/18/2021 23:59","2021-02-18T23:59:00Z","02/18 18:59",7523,,,"2021-02-18T23:59:00Z",6096514,311736,5777127,256139,6166,1357,,,,,,,,,,,324744,18150,"09",1198,0,273101,42964,273101,,27,0,"15c8a45fc6c27e4f1d62f93cdf41fc94cf99bac0",0,0,0,0,0,""
20210218,"CT",271903,16923,,,"totalTestsViral",6053550,568,,,,,,,"2/17/2021 23:59","2021-02-17T23:59:00Z","02/17 18:59",7496,,,"2021-02-17T23:59:00Z",6053550,310391,5735579,254980,6145,1351,,,,,,,,,,,321303,18068,"09",547,0,271903,24953,271903,,20,0,"5ea6663e752f1dbb164278f81b051bc905d03176",0,0,0,0,0,""
20210217,"CT",271356,16836,,,"totalTestsViral",6028597,584,,,,,,,"2/16/2021 23:59","2021-02-16T23:59:00Z","02/16 18:59",7476,,,"2021-02-16T23:59:00Z",6028597,309814,5711235,254520,6129,1347,,,,,,,,,,,319256,17961,"09",534,0,271356,23666,271356,,27,0,"3cde49919557671a3a84103f353207e077ec8634",0,0,0,0,0,""
20210216,"CT",270822,16628,,,"totalTestsViral",6004931,606,,,,,,,"2/15/2021 23:59","2021-02-15T23:59:00Z","02/15 18:59",7449,,,"2021-02-15T23:59:00Z",6004931,309330,5688069,254194,6106,1343,,,,,,,,,,,309117,17701,"09",580,0,270822,18312,270822,,2,0,"a7a17d1871c2d100987ffd8c17d4d8728bc769d3",0,0,0,0,0,""
20210215,"CT",270242,16586,,,"totalTestsViral",5986619,618,,,,,,,"2/14/2021 23:59","2021-02-14T23:59:00Z","02/14 18:59",7447,,,"2021-02-14T23:59:00Z",5986619,308684,5670458,253656,6105,1342,,,,,,,,,,,306944,17641,"09",2905,0,270242,88720,270242,,66,0,"36c6244a6bd912c2f67e7ebe3c334cc9655165a0",0,0,0,0,0,""
20210214,"CT",267337,16422,,,"totalTestsViral",5897899,674,,,,,,,"2/11/2021 23:59","2021-02-11T23:59:00Z","02/11 18:59",7381,,,"2021-02-11T23:59:00Z",5897899,305265,5585218,250915,6049,1332,,,,,,,,,,,299011,17354,"09",0,0,267337,0,267337,,0,0,"ec5d1f75b49b03ec99f1c9f844fdd0c9184515f0",0,0,0,0,0,""
20210213,"CT",267337,16422,,,"totalTestsViral",5897899,674,,,,,,,"2/11/2021 23:59","2021-02-11T23:59:00Z","02/11 18:59",7381,,,"2021-02-11T23:59:00Z",5897899,305265,5585218,250915,6049,1332,,,,,,,,,,,299011,17354,"09",0,0,267337,0,267337,,0,0,"5422ee523f236338d8c189fa5087978601b4591f",0,0,0,0,0,""
20210212,"CT",267337,16422,,,"totalTestsViral",5897899,674,,,,,,,"2/11/2021 23:59","2021-02-11T23:59:00Z","02/11 18:59",7381,,,"2021-02-11T23:59:00Z",5897899,305265,5585218,250915,6049,1332,,,,,,,,,,,299011,17354,"09",838,0,267337,33093,267337,,27,0,"6de64603aecc671180842f282b2e612174e3e123",0,0,0,0,0,""
20210211,"CT",266499,16368,,,"totalTestsViral",5864806,731,,,,,,,"2/10/2021 23:59","2021-02-10T23:59:00Z","02/10 18:59",7354,,,"2021-02-10T23:59:00Z",5864806,304302,5553087,250131,6025,1329,,,,,,,,,,,294317,17255,"09",1003,0,266499,40185,266499,,28,0,"2c7de637624b5f73c2655a836c75d0b5f9cd17a0",0,0,0,0,0,""
20210210,"CT",265496,16251,,,"totalTestsViral",5824621,770,,,,,,,"2/9/2021 23:59","2021-02-09T23:59:00Z","02/09 18:59",7326,,,"2021-02-09T23:59:00Z",5824621,303237,5514000,249245,5999,1327,,,,,,,,,,,291264,17090,"09",888,0,265496,25546,265496,,28,0,"bfe077326e76fc1a70accb4b46ccf8cb05eb96a7",0,0,0,0,0,""
20210209,"CT",264608,16122,,,"totalTestsViral",5799075,826,,,,,,,"2/8/2021 23:59","2021-02-08T23:59:00Z","02/08 18:59",7298,,,"2021-02-08T23:59:00Z",5799075,302302,5489419,248486,5979,1319,,,,,,,,,,,288150,16943,"09",869,0,264608,19235,264608,,16,0,"0e35d3cf2b1b7e60e45748a4fe01ea424bb6d918",0,0,0,0,0,""
20210208,"CT",263739,16058,,,"totalTestsViral",5779840,815,,,,,,,"2/7/2021 23:59","2021-02-07T23:59:00Z","02/07 18:59",7282,,,"2021-02-07T23:59:00Z",5779840,301260,5471222,247681,5966,1316,,,,,,,,,,,284789,16843,"09",4367,0,263739,112191,263739,,68,0,"9a93c5683b0e28427ab94287ad9a91040cc4f437",0,0,0,0,0,""
20210207,"CT",259372,15789,,,"totalTestsViral",5667649,827,,,,,,,"2/4/2021 23:59","2021-02-04T23:59:00Z","02/04 18:59",7214,,,"2021-02-04T23:59:00Z",5667649,295992,5364339,243583,5895,1319,,,,,,,,,,,274842,16362,"09",0,0,259372,0,259372,,0,0,"d2aed4415e351041742c762968ad87fe3f375bf4",0,0,0,0,0,""
20210206,"CT",259372,15789,,,"totalTestsViral",5667649,827,,,,,,,"2/4/2021 23:59","2021-02-04T23:59:00Z","02/04 18:59",7214,,,"2021-02-04T23:59:00Z",5667649,295992,5364339,243583,5895,1319,,,,,,,,,,,274842,16362,"09",0,0,259372,0,259372,,0,0,"713a878b006560eb538016806dafa1efa9ab2d39",0,0,0,0,0,""
20210205,"CT",259372,15789,,,"totalTestsViral",5667649,827,,,,,,,"2/4/2021 23:59","2021-02-04T23:59:00Z","02/04 18:59",7214,,,"2021-02-04T23:59:00Z",5667649,295992,5364339,243583,5895,1319,,,,,,,,,,,274842,16362,"09",1431,0,259372,43340,259372,,29,0,"8898de6cf84a3a60453ea94e860b99af184c8cd0",0,0,0,0,0,""
20210204,"CT",257941,15667,,,"totalTestsViral",5624309,837,,,,,,,"2/3/2021 23:59","2021-02-03T23:59:00Z","02/03 18:59",7185,,,"2021-02-03T23:59:00Z",5624309,294361,5322627,242274,5872,1313,,,,,,,,,,,271157,16175,"09",937,0,257941,26207,257941,,28,0,"74b67277df8e6b38bec53fc4880e151191e4316d",0,0,0,0,0,""
20210203,"CT",257004,15651,,,"totalTestsViral",5598102,874,,,,,,,"2/2/2021 23:59","2021-02-02T23:59:00Z","02/02 18:59",7157,,,"2021-02-02T23:59:00Z",5598102,293161,5297652,241353,5839,1318,,,,,,,,,,,267549,16128,"09",482,0,257004,9509,257004,,24,0,"0b19cad47172d17c931c4bb3f3cd65e1b88c2d56",0,0,0,0,0,""
20210202,"CT",256522,15584,,,"totalTestsViral",5588593,900,,,,,,,"2/1/2021 20:30","2021-02-01T20:30:00Z","02/01 15:30",7133,,,"2021-02-01T20:30:00Z",5588593,292660,5288674,240938,5822,1311,,,,,,,,,,,264276,16028,"09",2568,0,256522,51862,256522,,14,0,"c33e6e442a6b4555ed4247b85bce7813cfc4eda7",0,0,0,0,0,""
20210201,"CT",253954,15419,,,"totalTestsViral",5536731,912,,,,,,,"1/31/2021 23:59","2021-01-31T23:59:00Z","01/31 18:59",7119,,,"2021-01-31T23:59:00Z",5536731,289594,5239888,238535,5806,1313,,,,,,,,,,,257183,15705,"09",3931,0,253954,98,253954,,73,0,"9ca60690e1e192f146534a2e3fb42aa7baf232d4",0,0,0,0,0,""
20210131,"CT",250023,15209,,,"totalTestsViral",5536633,985,,,,,,,"1/28/2021 23:59","2021-01-28T23:59:00Z","01/28 18:59",7046,,,"2021-01-28T23:59:00Z",5536633,289589,5239795,234814,5741,1305,,,,,,,,,,,249128,15351,"09",0,0,250023,1952,250023,,0,0,"3123fa51f034f9c766cbeb3e6ca982d63e13b6d5",0,0,0,0,0,""
20210130,"CT",250023,15209,,,"totalTestsViral",5534681,985,,,,,,,"1/28/2021 23:59","2021-01-28T23:59:00Z","01/28 18:59",7046,,,"2021-01-28T23:59:00Z",5534681,289498,5237934,234814,5741,1305,,,,,,,,,,,249128,15351,"09",0,0,250023,13839,250023,,0,0,"3f54606896a75a12148b57e34376dd9d0a1b272b",0,0,0,0,0,""
20210129,"CT",250023,15209,,,"totalTestsViral",5520842,985,,,,,,,"1/28/2021 23:59","2021-01-28T23:59:00Z","01/28 18:59",7046,,,"2021-01-28T23:59:00Z",5520842,288783,5224810,234814,5741,1305,,,,,,,,,,,249128,15351,"09",1258,0,250023,25370,250023,,26,0,"2c60c25caf0b070d6d955aef574f817ecdf91466",0,0,0,0,0,""
20210128,"CT",248765,15104,,,"totalTestsViral",5495472,995,,,,,,,"1/27/2021 20:30","2021-01-27T20:30:00Z","01/27 15:30",7020,,,"2021-01-27T20:30:00Z",5495472,287407,5200823,233661,5718,1302,,,,,,,,,,,246797,15185,"09",1426,0,248765,32888,248765,,44,0,"ee1e86c252646e221097eaf4c7f7e88d7ea44f8c",0,0,0,0,0,""
20210127,"CT",247339,14985,,,"totalTestsViral",5462584,1016,,,,,,,"1/26/2021 20:30","2021-01-26T20:30:00Z","01/26 15:30",6976,,,"2021-01-26T20:30:00Z",5462584,285869,5169488,232354,5679,1297,,,,,,,,,,,243173,15009,"09",2440,0,247339,43223,247339,,42,0,"09194caa8fcc431fb636e1264d35d4d5848001b6",0,0,0,0,0,""
20210126,"CT",244899,14754,,,"totalTestsViral",5419361,1068,,,,,,,"1/25/2021 20:30","2021-01-25T20:30:00Z","01/25 15:30",6934,,,"2021-01-25T20:30:00Z",5419361,284041,5128108,230145,5638,1296,,,,,,,,,,,237037,14675,"09",1267,0,244899,53659,244899,,23,0,"d62069d8efbe4c35175f8953d64d38c8936e629a",0,0,0,0,0,""
20210125,"CT",243632,14655,,,"totalTestsViral",5365702,1068,,,,,,,"1/24/2021 20:30","2021-01-24T20:30:00Z","01/24 15:30",6911,,,"2021-01-24T20:30:00Z",5365702,281700,5076818,228977,5621,1290,,,,,,,,,,,233960,14427,"09",5817,0,243632,17436,243632,,92,0,"ee9757f031aa53f1a72143d39d842466b9b2e6dc",0,0,0,0,0,""
20210124,"CT",237815,14307,,,"totalTestsViral",5348266,1058,,,,,,,"1/21/2021 20:30","2021-01-21T20:30:00Z","01/21 15:30",6819,,,"2021-01-21T20:30:00Z",5348266,280502,5060586,223508,5545,1274,,,,,,,,,,,221289,14025,"09",0,0,237815,18679,237815,,0,0,"27c75c2d375ebe2acef079537d57077ca17ca698",0,0,0,0,0,""
20210123,"CT",237815,14307,,,"totalTestsViral",5329587,1058,,,,,,,"1/21/2021 20:30","2021-01-21T20:30:00Z","01/21 15:30",6819,,,"2021-01-21T20:30:00Z",5329587,278994,5043440,223508,5545,1274,,,,,,,,,,,221289,14025,"09",0,0,237815,33656,237815,,0,0,"23b04f4bb6bc35c2bb0da1ef1efca320b9c4aa29",0,0,0,0,0,""
20210122,"CT",237815,14307,,,"totalTestsViral",5295931,1058,,,,,,,"1/21/2021 20:30","2021-01-21T20:30:00Z","01/21 15:30",6819,,,"2021-01-21T20:30:00Z",5295931,276716,5012080,223508,5545,1274,,,,,,,,,,,221289,14025,"09",2019,0,237815,38323,237815,,45,0,"e060c2aad75fc417e183203e158418f4cf4902c8",0,0,0,0,0,""
20210121,"CT",235796,14151,,,"totalTestsViral",5257608,1069,,,,,,,"1/20/2021 20:30","2021-01-20T20:30:00Z","01/20 15:30",6774,,,"2021-01-20T20:30:00Z",5257608,274382,4976108,221645,5511,1263,,,,,,,,,,,216470,13800,"09",1662,0,235796,41416,235796,,48,0,"8a8f374c0f98b1e7aa4ba58b0a42b6f37647308e",0,0,0,0,0,""
20210120,"CT",234134,14013,,,"totalTestsViral",5216192,1124,,,,,,,"1/19/2021 20:30","2021-01-19T20:30:00Z","01/19 15:30",6726,,,"2021-01-19T20:30:00Z",5216192,272032,4937069,220121,5470,1256,,,,,,,,,,,213226,13651,"09",1915,0,234134,46305,234134,,44,0,"439c25283f45f64e640df56c233b20c3744f205d",0,0,0,0,0,""
20210119,"CT",232219,13459,,,"totalTestsViral",5169887,1141,,,,,,,"1/18/2021 20:30","2021-01-18T20:30:00Z","01/18 15:30",6682,,,"2021-01-18T20:30:00Z",5169887,269606,4893232,218760,5433,1249,,,,,,,,,,,204753,12967,"09",2094,0,232219,41758,232219,,12,0,"38378cdb1c72b69e2645353f11f803353ee0ecdb",0,0,0,0,0,""
20210118,"CT",230125,13433,,,"totalTestsViral",5128129,1114,,,,,,,"1/17/2021 20:30","2021-01-17T20:30:00Z","01/17 15:30",6670,,,"2021-01-17T20:30:00Z",5128129,267326,4853775,216692,5355,1239,,,,,,,,,,,201942,12856,"09",6703,0,230125,16759,230125,,76,0,"9eed1c90c5e315a9c55a7d640a68bec61e502d4a",0,0,0,0,0,""
20210117,"CT",223422,13229,,,"totalTestsViral",5111370,1098,,,,,,,"1/14/2021 20:30","2021-01-14T20:30:00Z","01/14 15:30",6594,,,"2021-01-14T20:30:00Z",5111370,265917,4838433,210193,5355,1239,,,,,,,,,,,190080,12124,"09",0,0,223422,18056,223422,,0,0,"410347a16233026ed2dd136c73799796ffe02e0f",0,0,0,0,0,""
20210116,"CT",223422,13229,,,"totalTestsViral",5093314,1098,,,,,,,"1/14/2021 20:30","2021-01-14T20:30:00Z","01/14 15:30",6594,,,"2021-01-14T20:30:00Z",5093314,264343,4821960,210193,5355,1239,,,,,,,,,,,190080,12124,"09",0,0,223422,33017,223422,,0,0,"a2af15f774828d178e514c947682be36945815a9",0,0,0,0,0,""
20210115,"CT",223422,13229,,,"totalTestsViral",5060297,1098,,,,,,,"1/14/2021 20:30","2021-01-14T20:30:00Z","01/14 15:30",6594,,,"2021-01-14T20:30:00Z",5060297,261875,4791447,210193,5355,1239,,,,,,,,,,,190080,12124,"09",1878,0,223422,36233,223422,,41,0,"8df0c5c2d7212343766a24871dafad32e9f149d5",0,0,0,0,0,""
20210114,"CT",221544,13055,,,"totalTestsViral",5024064,1118,,,,,,,"1/13/2021 20:30","2021-01-13T20:30:00Z","01/13 15:30",6553,,,"2021-01-13T20:30:00Z",5024064,259263,4757850,208489,5319,1234,,,,,,,,,,,186871,11908,"09",968,0,221544,42449,221544,,17,0,"dd4ba2b054ea586889870870574a319a35940109",0,0,0,0,0,""
20210113,"CT",220576,12836,,,"totalTestsViral",4981615,1148,,,,,,,"1/12/2021 20:30","2021-01-12T20:30:00Z","01/12 15:30",6536,,,"2021-01-12T20:30:00Z",4981615,256632,4718071,207740,5305,1231,,,,,,,,,,,181632,11642,"09",3529,0,220576,45116,220576,,87,0,"86034bec9f2c2f2ca0d965c82384db762a717741",0,0,0,0,0,""
20210112,"CT",217047,12542,,,"totalTestsViral",4936499,1154,,,,,,,"1/11/2021 20:30","2021-01-11T20:30:00Z","01/11 15:30",6449,,,"2021-01-11T20:30:00Z",4936499,253845,4675758,204505,5236,1213,,,,,,,,,,,175036,11299,"09",3689,0,217047,50607,217047,,33,0,"fb6efdb87b12d7187102440e36a545c5552c5036",0,0,0,0,0,""
20210111,"CT",213358,12234,,,"totalTestsViral",4885892,1142,,,,,,,"1/10/2021 20:30","2021-01-10T20:30:00Z","01/10 15:30",6416,,,"2021-01-10T20:30:00Z",4885892,250671,4628348,201124,5210,1206,,,,,,,,,,,171097,10919,"09",7364,0,213358,15246,213358,,92,0,"30024661b9df8abdfaf96ad2002fb3a57e408a08",0,0,0,0,0,""
20210110,"CT",205994,12003,,,"totalTestsViral",4870646,1109,,,,,,,"1/7/2021 20:30","2021-01-07T20:30:00Z","01/07 15:30",6324,,,"2021-01-07T20:30:00Z",4870646,249197,4614584,193991,5127,1197,,,,,,,,,,,163058,10518,"09",0,0,205994,19635,205994,,0,0,"4001d508706eedeac8fb2dcdabf227803c7e1a1c",0,0,0,0,0,""
20210109,"CT",205994,12003,,,"totalTestsViral",4851011,1109,,,,,,,"1/7/2021 20:30","2021-01-07T20:30:00Z","01/07 15:30",6324,,,"2021-01-07T20:30:00Z",4851011,247138,4597025,193991,5127,1197,,,,,,,,,,,163058,10518,"09",0,0,205994,32281,205994,,0,0,"50b77cc44c946244ec022f353222e316967a411f",0,0,0,0,0,""
20210108,"CT",205994,12003,,,"totalTestsViral",4818730,1109,,,,,,,"1/7/2021 20:30","2021-01-07T20:30:00Z","01/07 15:30",6324,,,"2021-01-07T20:30:00Z",4818730,244237,4567672,193991,5127,1197,,,,,,,,,,,163058,10518,"09",3236,0,205994,38425,205994,,37,0,"f8e5b4bc74dbbd7df8d9cfce9fecdeec5e10eb30",0,0,0,0,0,""
20210107,"CT",202758,11991,,,"totalTestsViral",4780305,1087,,,,,,,"1/6/2021 20:30","2021-01-06T20:30:00Z","01/06 15:30",6287,,,"2021-01-06T20:30:00Z",4780305,241182,4532364,190767,5096,1191,,,,,,,,,,,160663,10455,"09",3304,0,202758,43574,202758,,57,0,"e1ff08f218f2094ae3297863de70003a3ce531eb",0,0,0,0,0,""
20210106,"CT",199454,11705,,,"totalTestsViral",4736731,1139,,,,,,,"1/5/2021 20:30","2021-01-05T20:30:00Z","01/05 15:30",6230,,,"2021-01-05T20:30:00Z",4736731,237731,4492309,187749,5048,1182,,,,,,,,,,,152840,10054,"09",2486,0,199454,46602,199454,,38,0,"fda4a3a0eaeb03c36b3554fe5a44a8e969a83e19",0,0,0,0,0,""
20210105,"CT",196968,11523,,,"totalTestsViral",4690129,1149,,,,,,,"1/4/2021 20:30","2021-01-04T20:30:00Z","01/04 15:30",6192,,,"2021-01-04T20:30:00Z",4690129,233917,4449554,185445,5017,1175,,,,,,,,,,,149584,9844,"09",2332,0,196968,51399,196968,,24,0,"4195665ea14e0d8ff1e1232b1bdf9d6cb25e3174",0,0,0,0,0,""
20210104,"CT",194636,11326,,,"totalTestsViral",4638730,1111,,,,,,,"1/3/2021 20:30","2021-01-03T20:30:00Z","01/03 15:30",6168,,,"2021-01-03T20:30:00Z",4638730,230057,4402063,183310,4997,1171,,,,,,,,,,,145571,9609,"09",4516,0,194636,17584,194636,,69,0,"b3197a834a809d06c07b895b2a2222ba481e2380",0,0,0,0,0,""
20210103,"CT",190120,11171,,,"totalTestsViral",4621146,1056,,,,,,,"1/1/2021 20:30","2021-01-01T20:30:00Z","01/01 15:30",6099,,,"2021-01-01T20:30:00Z",4621146,228170,4386384,178949,4937,1162,,,,,,,,,,,137821,9340,"09",0,0,190120,22317,190120,,0,0,"88dda09f6b7072e723ea9ddd200b28fde01cca78",0,0,0,0,0,""
20210102,"CT",190120,11171,,,"totalTestsViral",4598829,1056,,,,,,,"1/1/2021 20:30","2021-01-01T20:30:00Z","01/01 15:30",6099,,,"2021-01-01T20:30:00Z",4598829,225736,4366522,178949,4937,1162,,,,,,,,,,,137821,9340,"09",4412,0,190120,5369,190120,,104,0,"c14239def6a5a62dfa7f0475ae80b00dfe5e6b7f",0,0,0,0,0,""
20210101,"CT",185708,11029,,,"totalTestsViral",4593460,1136,,,,,,,"12/30/2020 20:30","2020-12-30T20:30:00Z","12/30 15:30",5995,,,"2020-12-30T20:30:00Z",4593460,225168,4361730,174679,4854,1141,,,,,,,,,,,132201,9121,"09",0,0,185708,28386,185708,,0,0,"e039f7b8501f33a48a61ba5f1cdfd01836d48068",0,0,0,0,0,""
20201231,"CT",185708,11029,,,"totalTestsViral",4565074,1136,,,,,,,"12/30/2020 20:30","2020-12-30T20:30:00Z","12/30 15:30",5995,,,"2020-12-30T20:30:00Z",4565074,222595,4335940,174679,4854,1141,,,,,,,,,,,132201,9121,"09",2045,0,185708,41409,185708,,31,0,"b86c0f757184ffb06420820b0b06b06e0861f1e3",0,0,0,0,0,""
20201230,"CT",183663,10756,,,"totalTestsViral",4523665,1167,,,,,,,"12/29/2020 20:30","2020-12-29T20:30:00Z","12/29 15:30",5964,,,"2020-12-29T20:30:00Z",4523665,219317,4297866,172907,4828,1136,,,,,,,,,,,127711,8783,"09",1696,0,183663,44596,183663,,40,0,"d71328702ca7ca6752051a682b9866de7d54e37c",0,0,0,0,0,""
20201229,"CT",181967,10638,,,"totalTestsViral",4479069,1226,,,,,,,"12/28/2020 20:30","2020-12-28T20:30:00Z","12/28 15:30",5924,,,"2020-12-28T20:30:00Z",4479069,215854,4256777,171329,4792,1132,,,,,,,,,,,125114,8632,"09",767,0,181967,47051,181967,,20,0,"761afa4312b41dcab33c443274a22c1729546aa9",0,0,0,0,0,""
20201228,"CT",181200,10558,,,"totalTestsViral",4432018,1219,,,,,,,"12/27/2020 20:30","2020-12-27T20:30:00Z","12/27 15:30",5904,,,"2020-12-27T20:30:00Z",4432018,212169,4213468,170642,4773,1131,,,,,,,,,,,123538,8544,"09",8457,0,181200,15416,181200,,113,0,"0b4e1488fbbf50fc71e6f0f32227eaefb74ca917",0,0,0,0,0,""
20201227,"CT",172743,10294,,,"totalTestsViral",4416602,1200,,,,,,,"12/23/2020 20:30","2020-12-23T20:30:00Z","12/23 15:30",5791,,,"2020-12-23T20:30:00Z",4416602,210500,4199743,162449,4686,1105,,,,,,,,,,,113686,8079,"09",0,0,172743,17518,172743,,0,0,"f68603adf376379ebe2d87255260f93405c6d39e",0,0,0,0,0,""
20201226,"CT",172743,10294,,,"totalTestsViral",4399084,1200,,,,,,,"12/23/2020 20:30","2020-12-23T20:30:00Z","12/23 15:30",5791,,,"2020-12-23T20:30:00Z",4399084,208429,4184311,162449,4686,1105,,,,,,,,,,,113686,8079,"09",0,0,172743,2625,172743,,0,0,"a6131d455a1b3fa1ecd59013b788de26d9c748eb",0,0,0,0,0,""
20201225,"CT",172743,10294,,,"totalTestsViral",4396459,1200,,,,,,,"12/23/2020 20:30","2020-12-23T20:30:00Z","12/23 15:30",5791,,,"2020-12-23T20:30:00Z",4396459,208095,4182022,162449,4686,1105,,,,,,,,,,,113686,8079,"09",0,0,172743,20562,172743,,0,0,"10973582fe09d297f4d33e98e002314cb7b808c5",0,0,0,0,0,""
20201224,"CT",172743,10294,,,"totalTestsViral",4375897,1200,,,,,,,"12/23/2020 20:30","2020-12-23T20:30:00Z","12/23 15:30",5791,,,"2020-12-23T20:30:00Z",4375897,206231,4163338,162449,4686,1105,,,,,,,,,,,113686,8079,"09",2038,0,172743,39237,172743,,55,0,"ccc5a88ee4ceccd6d64b8e90a0f3b6ea51e640e0",0,0,0,0,0,""
20201223,"CT",170705,10181,,,"totalTestsViral",4336660,1155,,,,,,,"12/22/2020 20:30","2020-12-22T20:30:00Z","12/22 15:30",5736,,,"2020-12-22T20:30:00Z",4336660,203639,4126730,160524,4641,1095,,,,,,,,,,,110620,7910,"09",1745,0,170705,45748,170705,,33,0,"617545adeccc41328ff1247cef810b0b88249f51",0,0,0,0,0,""
20201222,"CT",168960,10003,,,"totalTestsViral",4290912,1159,,,,,,,"12/21/2020 20:30","2020-12-21T20:30:00Z","12/21 15:30",5703,,,"2020-12-21T20:30:00Z",4290912,200899,4083765,158957,4613,1090,,,,,,,,,,,106843,7660,"09",1583,0,168960,47895,168960,,27,0,"261edb7eb0a87e82bd8e591042064b3854479971",0,0,0,0,0,""
20201221,"CT",167377,9869,,,"totalTestsViral",4243017,1143,,,,,,,"12/20/2020 20:30","2020-12-20T20:30:00Z","12/20 15:30",5676,,,"2020-12-20T20:30:00Z",4243017,197812,4039016,157508,4590,1086,,,,,,,,,,,104234,7490,"09",4595,0,167377,15955,167377,,95,0,"488f5d3591e2afc5f664346fce0244aa1bd62624",0,0,0,0,0,""
20201220,"CT",162782,9579,,,"totalTestsViral",4227062,1167,,,,,,,"12/17/2020 20:30","2020-12-17T20:30:00Z","12/17 15:30",5581,,,"2020-12-17T20:30:00Z",4227062,196536,4024365,153203,4514,1067,,,,,,,,,,,98376,7093,"09",0,0,162782,17161,162782,,0,0,"eff2e311faaebf0192c7f7404280fbc311436241",0,0,0,0,0,""
20201219,"CT",162782,9579,,,"totalTestsViral",4209901,1167,,,,,,,"12/17/2020 20:30","2020-12-17T20:30:00Z","12/17 15:30",5581,,,"2020-12-17T20:30:00Z",4209901,194862,4008911,153203,4514,1067,,,,,,,,,,,98376,7093,"09",0,0,162782,33151,162782,,0,0,"1dcc625639505b31f2c20c0d529154ce98168cbd",0,0,0,0,0,""
20201218,"CT",162782,9579,,,"totalTestsViral",4176750,1167,,,,,,,"12/17/2020 20:30","2020-12-17T20:30:00Z","12/17 15:30",5581,,,"2020-12-17T20:30:00Z",4176750,192189,3978475,153203,4514,1067,,,,,,,,,,,98376,7093,"09",2680,0,162782,8349,162782,,29,0,"5012e0be74c2ddf1ccf180128dca252f9f848005",0,0,0,0,0,""
20201217,"CT",160102,9553,,,"totalTestsViral",4168401,1205,,,,,,,"12/16/2020 20:30","2020-12-16T20:30:00Z","12/16 15:30",5552,,,"2020-12-16T20:30:00Z",4168401,191726,3970602,150549,4489,1063,,,,,,,,,,,96479,7015,"09",2321,0,160102,36942,160102,,46,0,"2b02ce5399e58c905cbda36c0e29edb25467618b",0,0,0,0,0,""
20201216,"CT",157781,9398,,,"totalTestsViral",4131459,1254,,,,,,,"12/15/2020 20:30","2020-12-15T20:30:00Z","12/15 15:30",5506,,,"2020-12-15T20:30:00Z",4131459,189410,3936000,148383,4449,1057,,,,,,,,,,,93494,6816,"09",2319,0,157781,42091,157781,,40,0,"9737ec2a952f8000b461ce908076d5dc2bc90e1e",0,0,0,0,0,""
20201215,"CT",155462,9348,,,"totalTestsViral",4089368,1269,,,,,,,"12/14/2020 20:30","2020-12-14T20:30:00Z","12/14 15:30",5466,,,"2020-12-14T20:30:00Z",4089368,186624,3896731,146114,4414,1052,,,,,,,,,,,91514,6725,"09",1470,0,155462,45897,155462,,22,0,"62af59d254261ee1ba80a3adfa7e9c7c825484aa",0,0,0,0,0,""
20201214,"CT",153992,9199,,,"totalTestsViral",4043471,1243,,,,,,,"12/13/2020 20:30","2020-12-13T20:30:00Z","12/13 15:30",5444,,,"2020-12-13T20:30:00Z",4043471,183453,3854049,144793,4397,1047,,,,,,,,,,,88110,6499,"09",7231,0,153992,13612,153992,,81,0,"fd280a368db8d05f34194e581a78870ba305c43f",0,0,0,0,0,""
20201213,"CT",146761,8970,,,"totalTestsViral",4029859,1210,,,,,,,"12/10/2020 20:30","2020-12-10T20:30:00Z","12/10 15:30",5363,,,"2020-12-10T20:30:00Z",4029859,182023,3841894,137791,4332,1031,,,,,,,,,,,81862,6144,"09",0,0,146761,17416,146761,,0,0,"71c4ade2967a57d727ef6bbf8c5defe48c1cddac",0,0,0,0,0,""
20201212,"CT",146761,8970,,,"totalTestsViral",4012443,1210,,,,,,,"12/10/2020 20:30","2020-12-10T20:30:00Z","12/10 15:30",5363,,,"2020-12-10T20:30:00Z",4012443,180190,3826335,137791,4332,1031,,,,,,,,,,,81862,6144,"09",0,0,146761,33402,146761,,0,0,"e19b0ab7ca5ff9277de701203a6f2026b22bdda1",0,0,0,0,0,""
20201211,"CT",146761,8970,,,"totalTestsViral",3979041,1210,,,,,,,"12/10/2020 20:30","2020-12-10T20:30:00Z","12/10 15:30",5363,,,"2020-12-10T20:30:00Z",3979041,177423,3795767,137791,4332,1031,,,,,,,,,,,81862,6144,"09",3782,0,146761,36884,146761,,36,0,"5457d5a5dc735e6bda033f9e0d9c81e8f29da88a",0,0,0,0,0,""
20201210,"CT",142979,8693,,,"totalTestsViral",3942157,1214,,,,,,,"12/9/2020 20:30","2020-12-09T20:30:00Z","12/09 15:30",5327,,,"2020-12-09T20:30:00Z",3942157,174750,3761642,134286,4303,1024,,,,,,,,,,,77245,5786,"09",2431,0,142979,41880,142979,,42,0,"f345142c56080accdeea9f28ca1bf11de2ccdc04",0,0,0,0,0,""
20201209,"CT",140548,8662,,,"totalTestsViral",3900277,1262,,,,,,,"12/8/2020 20:30","2020-12-08T20:30:00Z","12/08 15:30",5285,,,"2020-12-08T20:30:00Z",3900277,171929,3722683,131886,4264,1021,,,,,,,,,,,75093,5708,"09",2290,0,140548,40428,140548,,43,0,"f96da28b46c8fbce9cac146f3c85c61d2efb36b8",0,0,0,0,0,""
20201208,"CT",138258,8629,,,"totalTestsViral",3859849,1223,,,,,,,"12/7/2020 20:30","2020-12-07T20:30:00Z","12/07 15:30",5242,,,"2020-12-07T20:30:00Z",3859849,169096,3685175,129629,4228,1014,,,,,,,,,,,73439,5610,"09",2414,0,138258,40509,138258,,18,0,"004563fcc730c7ce7fb1ac32a1c16127058917bb",0,0,0,0,0,""
20201207,"CT",135844,8433,,,"totalTestsViral",3819340,1183,,,,,,,"12/6/2020 20:30","2020-12-06T20:30:00Z","12/06 15:30",5224,,,"2020-12-06T20:30:00Z",3819340,165936,3647920,127411,4212,1012,,,,,,,,,,,71276,5412,"09",8129,0,135844,14368,135844,,78,0,"9e30bc4dd7c703223cf489d260667163901a3b65",0,0,0,0,0,""
20201206,"CT",127715,8131,,,"totalTestsViral",3804972,1150,,,,,,,"12/3/2020 20:30","2020-12-03T20:30:00Z","12/03 15:30",5146,,,"2020-12-03T20:30:00Z",3804972,164510,3634989,119584,4143,1003,,,,,,,,,,,64103,4927,"09",0,0,127715,15709,127715,,0,0,"0c79ce487d1a5d6e1da54622b8eae82760260099",0,0,0,0,0,""
20201205,"CT",127715,8131,,,"totalTestsViral",3789263,1150,,,,,,,"12/3/2020 20:30","2020-12-03T20:30:00Z","12/03 15:30",5146,,,"2020-12-03T20:30:00Z",3789263,162880,3620929,119584,4143,1003,,,,,,,,,,,64103,4927,"09",0,0,127715,31226,127715,,0,0,"fde4218808119ed86314b794f3194c41e14ca46f",0,0,0,0,0,""
20201204,"CT",127715,8131,,,"totalTestsViral",3758037,1150,,,,,,,"12/3/2020 20:30","2020-12-03T20:30:00Z","12/03 15:30",5146,,,"2020-12-03T20:30:00Z",3758037,159958,3592668,119584,4143,1003,,,,,,,,,,,64103,4927,"09",1538,0,127715,37036,127715,,35,0,"86fff6cc7a11a948bc51e2af260edba48891d089",0,0,0,0,0,""
20201203,"CT",126177,7986,,,"totalTestsViral",3721001,1191,,,,,,,"12/2/2020 20:30","2020-12-02T20:30:00Z","12/02 15:30",5111,,,"2020-12-02T20:30:00Z",3721001,156930,3558711,118191,4112,999,,,,,,,,,,,62592,4759,"09",4751,0,126177,41115,126177,,20,0,"2b9d0098c7577090e101967c6bd80a734f31a2c7",0,0,0,0,0,""
20201202,"CT",121426,7958,,,"totalTestsViral",3679886,1202,,,,,,,"12/1/2020 20:30","2020-12-01T20:30:00Z","12/01 15:30",5091,,,"2020-12-01T20:30:00Z",3679886,153477,3521123,113468,4088,1003,,,,,,,,,,,60636,4600,"09",2672,0,121426,42826,121426,,51,0,"711b0008e28dd15ac4dd0fa6819690e381f9c172",0,0,0,0,0,""
20201201,"CT",118754,7729,,,"totalTestsViral",3637060,1152,,,,,,,"11/30/2020 20:30","2020-11-30T20:30:00Z","11/30 15:30",5040,,,"2020-11-30T20:30:00Z",3637060,149984,3481846,111025,4045,995,,,,,,,,,,,56559,4225,"09",1459,0,118754,40059,118754,,20,0,"a443eea8ef34b07edb00f9ca9d895b530a96283f",0,0,0,0,0,""
20201130,"CT",117295,7804,,,"totalTestsViral",3597001,1098,,,,,,,"11/29/2020 20:30","2020-11-29T20:30:00Z","11/29 15:30",5020,,,"2020-11-29T20:30:00Z",3597001,146947,3444912,109491,4025,995,,,,,,,,,,,56343,4213,"09",4714,0,117295,13316,117295,,59,0,"6d1d9df1932f5b0ffe95beed3aa5b21fcb05900d",0,0,0,0,0,""
20201129,"CT",112581,7788,,,"totalTestsViral",3583685,1017,,,,,,,"11/26/2020 20:30","2020-11-26T20:30:00Z","11/26 15:30",4961,,,"2020-11-26T20:30:00Z",3583685,145659,3432918,104793,3981,980,,,,,,,,,,,53136,3984,"09",0,0,112581,17255,112581,,0,0,"57984656f2541af8a2631a47fd99ee0122005c38",0,0,0,0,0,""
20201128,"CT",112581,7788,,,"totalTestsViral",3566430,1017,,,,,,,"11/26/2020 20:30","2020-11-26T20:30:00Z","11/26 15:30",4961,,,"2020-11-26T20:30:00Z",3566430,143793,3417579,104793,3981,980,,,,,,,,,,,53136,3984,"09",0,0,112581,30037,112581,,0,0,"3fa453f011312ec4dc622021b53ce861236244fe",0,0,0,0,0,""
20201127,"CT",112581,7788,,,"totalTestsViral",3536393,1017,,,,,,,"11/26/2020 20:30","2020-11-26T20:30:00Z","11/26 15:30",4961,,,"2020-11-26T20:30:00Z",3536393,141279,3390156,104793,3981,980,,,,,,,,,,,53136,3984,"09",3429,0,112581,3377,112581,,35,0,"c4d8df0f2e86f2769a8509c1dc2095b066693406",0,0,0,0,0,""
20201126,"CT",109152,7611,,,"totalTestsViral",3533016,968,,,,,,,"11/24/2020 20:30","2020-11-24T20:30:00Z","11/24 15:30",4926,,,"2020-11-24T20:30:00Z",3533016,140912,3387156,101541,3957,969,,,,,,,,,,,49729,3760,"09",0,0,109152,40249,109152,,0,0,"1b0fa90924a9c4e714134594ce45acb8638ce33e",0,0,0,0,0,""
20201125,"CT",109152,7611,,,"totalTestsViral",3492767,968,,,,,,,"11/24/2020 20:30","2020-11-24T20:30:00Z","11/24 15:30",4926,,,"2020-11-24T20:30:00Z",3492767,138211,3349750,101541,3957,969,,,,,,,,,,,49729,3760,"09",1872,0,109152,52455,109152,,45,0,"f1dcca95f2a0626e0857e1b139e764a8b9250c33",0,0,0,0,0,""
20201124,"CT",107280,7460,,,"totalTestsViral",3440312,891,,,,,,,"11/24/2020 20:30","2020-11-24T20:30:00Z","11/24 15:30",4881,,,"2020-11-24T20:30:00Z",3440312,135409,3300265,99820,3922,959,,,,,,,,,,,48549,3665,"09",540,0,107280,53392,107280,,10,0,"e6a0038e2b1a911ebcebe6f5d424ec64e7d15cfe",0,0,0,0,0,""
20201123,"CT",106740,7427,,,"totalTestsViral",3386920,875,,,,,,,"11/22/2020 20:30","2020-11-22T20:30:00Z","11/22 15:30",4871,,,"2020-11-22T20:30:00Z",3386920,132564,3249828,99313,3915,956,,,,,,,,,,,47691,3629,"09",5271,0,106740,18813,106740,,43,0,"b1b60345fa365a8eff575d542db73b97d0dc30cd",0,0,0,0,0,""
20201122,"CT",101469,7043,,,"totalTestsViral",3368107,848,,,,,,,"11/19/2020 20:30","2020-11-19T20:30:00Z","11/19 15:30",4828,,,"2020-11-19T20:30:00Z",3368107,131283,3232317,94426,3878,950,,,,,,,,,,,42917,3269,"09",0,0,101469,20935,101469,,0,0,"780ecbf2655a2ead1384a1b0efce050dda98bfd7",0,0,0,0,0,""
20201121,"CT",101469,7043,,,"totalTestsViral",3347172,848,,,,,,,"11/19/2020 20:30","2020-11-19T20:30:00Z","11/19 15:30",4828,,,"2020-11-19T20:30:00Z",3347172,129650,3213042,94426,3878,950,,,,,,,,,,,42917,3269,"09",0,0,101469,41949,101469,,0,0,"d11141e53120a001b03c5e4e0a643508b10f7da3",0,0,0,0,0,""
20201120,"CT",101469,7043,,,"totalTestsViral",3305223,848,,,,,,,"11/19/2020 20:30","2020-11-19T20:30:00Z","11/19 15:30",4828,,,"2020-11-19T20:30:00Z",3305223,127224,3173610,94426,3878,950,,,,,,,,,,,42917,3269,"09",2088,0,101469,43050,101469,,23,0,"87b47543e8ecf09a092bba723784ce3593c2192e",0,0,0,0,0,""
20201119,"CT",99381,6756,,,"totalTestsViral",3262173,840,,,,,,,"11/18/2020 20:30","2020-11-18T20:30:00Z","11/18 15:30",4805,,,"2020-11-18T20:30:00Z",3262173,124778,3133084,92625,3862,943,,,,,,,,,,,40423,3058,"09",2353,0,99381,48404,99381,,21,0,"79f28da02c432ae2c03aa76e2f1e85cddba294ae",0,0,0,0,0,""
20201118,"CT",97028,6499,,,"totalTestsViral",3213769,816,,,,,,,"11/17/2020 20:30","2020-11-17T20:30:00Z","11/17 15:30",4784,,,"2020-11-17T20:30:00Z",3213769,122207,3087365,90529,3849,935,,,,,,,,,,,38269,2870,"09",2042,0,97028,46757,97028,,13,0,"d5d5d568cea71879e39add0948eb8de2b515fce3",0,0,0,0,0,""
20201117,"CT",94986,6408,,,"totalTestsViral",3167012,777,,,,,,,"11/16/2020 20:30","2020-11-16T20:30:00Z","11/16 15:30",4771,,,"2020-11-16T20:30:00Z",3167012,119616,3043340,88578,3839,932,,,,,,,,,,,37398,2802,"09",1702,0,94986,50085,94986,,12,0,"11314add47b1d1bd6bcd060f7fe98a6ab66c0a37",0,0,0,0,0,""
20201116,"CT",93284,6066,,,"totalTestsViral",3116927,757,,,,,,,"11/15/2020 20:30","2020-11-15T20:30:00Z","11/15 15:30",4759,,,"2020-11-15T20:30:00Z",3116927,116901,2996107,87218,3827,932,,,,,,,,,,,32727,2314,"09",4639,0,93284,16428,93284,,22,0,"2908eb69d92a424437895c397f38bd57b086fb8b",0,0,0,0,0,""
20201115,"CT",88645,5791,,,"totalTestsViral",3100499,659,,,,,,,"11/12/2020 20:30","2020-11-12T20:30:00Z","11/12 15:30",4737,,,"2020-11-12T20:30:00Z",3100499,115829,2980798,82854,3807,930,,,,,,,,,,,32399,2269,"09",0,0,88645,18471,88645,,0,0,"020278d8a82d36cfe374bdd0f408d59adf31c63e",0,0,0,0,0,""
20201114,"CT",88645,5791,,,"totalTestsViral",3082028,659,,,,,,,"11/12/2020 20:30","2020-11-12T20:30:00Z","11/12 15:30",4737,,,"2020-11-12T20:30:00Z",3082028,114264,2963919,82854,3807,930,,,,,,,,,,,32399,2269,"09",0,0,88645,38769,88645,,0,0,"441e9fc0be22f21aee53c7611ec213dadf1fb67d",0,0,0,0,0,""
20201113,"CT",88645,5791,,,"totalTestsViral",3043259,659,,,,,,,"11/12/2020 20:30","2020-11-12T20:30:00Z","11/12 15:30",4737,,,"2020-11-12T20:30:00Z",3043259,111844,2927651,82854,3807,930,,,,,,,,,,,32399,2269,"09",2746,0,88645,41657,88645,,11,0,"d706ff3cc1545b20097d4c7bcc6f172a7c1cad9c",0,0,0,0,0,""
20201112,"CT",85899,5683,,,"totalTestsViral",3001602,617,,,,,,,"11/11/2020 20:30","2020-11-11T20:30:00Z","11/11 15:30",4726,,,"2020-11-11T20:30:00Z",3001602,109501,2888423,80216,3798,928,,,,,,,,,,,27240,1809,"09",1158,0,85899,42441,85899,,10,0,"4b87147d2b952bc6bf8dfa199f486eb9dc822947",0,0,0,0,0,""
20201111,"CT",84741,5408,,,"totalTestsViral",2959161,584,,,,,,,"11/10/2020 20:30","2020-11-10T20:30:00Z","11/10 15:30",4716,,,"2020-11-10T20:30:00Z",2959161,107011,2848568,79333,3791,925,,,,,,,,,,,27240,1809,"09",1754,0,84741,48035,84741,,9,0,"ef80e78376b82d44d0fdc637d0788e32252eb29e",0,0,0,0,0,""
20201110,"CT",82987,5279,,,"totalTestsViral",2911126,548,,,,,,,"11/9/2020 20:30","2020-11-09T20:30:00Z","11/09 15:30",4707,,,"2020-11-09T20:30:00Z",2911126,104513,2803130,77708,3785,922,,,,,,,,,,,27240,1809,"09",1524,0,82987,46754,82987,,9,0,"79cfd2aea71175791e0e880090f298abf38b7e95",0,0,0,0,0,""
20201109,"CT",81463,5207,,,"totalTestsViral",2864372,496,,,,,,,"11/8/2020 20:30","2020-11-08T20:30:00Z","11/08 15:30",4698,,,"2020-11-08T20:30:00Z",2864372,101915,2759057,76256,3779,919,,,,,,,,,,,27240,1809,"09",3338,0,81463,13056,81463,,27,0,"88dd96913e7eee70420b9812a357f4b893a0fc3c",0,0,0,0,0,""
20201108,"CT",78125,4919,,,"totalTestsViral",2851316,402,,,,,,,"11/5/2020 20:30","2020-11-05T20:30:00Z","11/05 15:30",4671,,,"2020-11-05T20:30:00Z",2851316,100884,2747047,73206,3757,914,,,,,,,,,,,26855,1722,"09",0,0,78125,15214,78125,,0,0,"d4ba074cfc1ab10248c1b98f86ddda8326324b90",0,0,0,0,0,""
20201107,"CT",78125,4919,,,"totalTestsViral",2836102,402,,,,,,,"11/5/2020 20:30","2020-11-05T20:30:00Z","11/05 15:30",4671,,,"2020-11-05T20:30:00Z",2836102,99613,2733123,73206,3757,914,,,,,,,,,,,26855,1722,"09",0,0,78125,35667,78125,,0,0,"e5116c0e07b427b4073d33ec0b4b752af80e39f3",0,0,0,0,0,""
20201106,"CT",78125,4919,,,"totalTestsViral",2800435,402,,,,,,,"11/5/2020 20:30","2020-11-05T20:30:00Z","11/05 15:30",4671,,,"2020-11-05T20:30:00Z",2800435,97515,2699607,73206,3757,914,,,,,,,,,,,26855,1722,"09",1065,0,78125,40089,78125,,15,0,"3538c3ec0ca19fa6686b36ed4226f49f2a6d89b4",0,0,0,0,0,""
20201105,"CT",77060,4799,,,"totalTestsViral",2760346,380,,,,,,,"11/4/2020 20:30","2020-11-04T20:30:00Z","11/04 15:30",4656,,,"2020-11-04T20:30:00Z",2760346,95473,2661601,72261,3744,912,,,,,,,,,,,26512,,"09",1687,0,77060,39718,77060,,11,0,"fcb104e102fc2230fbe03b7e338dd7002f3610e9",0,0,0,0,0,""
20201104,"CT",75373,4135,,,"totalTestsViral",2720628,374,,,,,,,"11/3/2020 20:30","2020-11-03T20:30:00Z","11/03 15:30",4645,,,"2020-11-03T20:30:00Z",2720628,93570,2623849,71238,3736,909,,,,,,,,,,,,,"09",1515,0,75373,40582,75373,,18,0,"c8f2f106e8824fc21cd2d531bb30d9591078be0f",0,0,0,0,0,""
20201103,"CT",73858,4032,,,"totalTestsViral",2680046,340,,,,,,,"11/1/2020 20:30","2020-11-01T20:30:00Z","11/01 15:30",4627,,,"2020-11-01T20:30:00Z",2680046,92229,2584649,69826,3718,909,,,,,,,,,,,,,"09",0,0,73858,42355,73858,,0,0,"b7684d34640fc9b3b3394b1d8674343ec7a1b14c",0,0,0,0,0,""
20201102,"CT",73858,4032,,,"totalTestsViral",2637691,340,,,,,,,"11/1/2020 20:30","2020-11-01T20:30:00Z","11/01 15:30",4627,,,"2020-11-01T20:30:00Z",2637691,90671,2543887,69826,3718,909,,,,,,,,,,,,,"09",2651,0,73858,11123,73858,,11,0,"2ae0dcd6ed296915c6fa4dcdfb73b44659afb900",0,0,0,0,0,""
20201101,"CT",71207,3688,,,"totalTestsViral",2626568,329,,,,,,,"10/29/2020 20:30","2020-10-29T20:30:00Z","10/29 16:30",4616,,,"2020-10-29T20:30:00Z",2626568,90097,2533349,67519,3708,908,,,,,,,,,,,,,"09",0,0,71207,11758,71207,,0,0,"25503042272f967649edb8ff353ecbf6951cf1f5",0,0,0,0,0,""
20201031,"CT",71207,3688,,,"totalTestsViral",2614810,329,,,,,,,"10/29/2020 20:30","2020-10-29T20:30:00Z","10/29 16:30",4616,,,"2020-10-29T20:30:00Z",2614810,89454,2522249,67519,3708,908,,,,,,,,,,,,,"09",0,0,71207,26176,71207,,0,0,"720551eaaf33b47d8c7d20cb6cad2afe3b51f6d4",0,0,0,0,0,""
20201030,"CT",71207,3688,,,"totalTestsViral",2588634,329,,,,,,,"10/29/2020 20:30","2020-10-29T20:30:00Z","10/29 16:30",4616,,,"2020-10-29T20:30:00Z",2588634,88405,2497154,67519,3708,908,,,,,,,,,,,,,"09",761,0,71207,33324,71207,,7,0,"efd317adc42ae976371d5dec19ba3ca783dcb39f",0,0,0,0,0,""
20201029,"CT",70446,3550,,,"totalTestsViral",2555310,321,,,,,,,"10/28/2020 20:30","2020-10-28T20:30:00Z","10/28 16:30",4609,,,"2020-10-28T20:30:00Z",2555310,87329,2464993,66896,3702,907,,,,,,,,,,,,,"09",1319,0,70446,38995,70446,,5,0,"2e44c3717213ceb4b7ba8799b75c61c168f5d5f7",0,0,0,0,0,""
20201028,"CT",69127,2770,,,"totalTestsViral",2516315,309,,,,,,9800,"10/27/2020 20:30","2020-10-27T20:30:00Z","10/27 16:30",4604,,9800,"2020-10-27T20:30:00Z",2516315,86143,2427256,66357,3697,907,,,,,,,,,,,,,"09",490,0,69127,45545,69127,,9,0,"840a1c62d343d2bc1830024169c54f19f777346b",0,0,0,0,0,""
20201027,"CT",68637,2736,,,"totalTestsViral",2470770,292,,,,,,9800,"10/26/2020 20:30","2020-10-26T20:30:00Z","10/26 16:30",4595,,9800,"2020-10-26T20:30:00Z",2470770,85038,2382930,65901,3687,908,,,,,,,,,,,,,"09",538,0,68637,39500,68637,,6,0,"924d4e0c2e102e9ecaa0e19889e8c335309eaa79",0,0,0,0,0,""
20201026,"CT",68099,2678,,,"totalTestsViral",2431270,270,,,,,,9800,"10/25/2020 20:30","2020-10-25T20:30:00Z","10/25 16:30",4589,,9800,"2020-10-25T20:30:00Z",2431270,83929,2344610,65421,3683,906,,,,,,,,,,,,,"09",2047,0,68099,10290,68099,,12,0,"668ce560b6020c8c4a13971d27034a1bb9d4e5fb",0,0,0,0,0,""
20201025,"CT",66052,2676,,,"totalTestsViral",2420980,233,,,,,,9800,"10/22/2020 20:30","2020-10-22T20:30:00Z","10/22 16:30",4577,,9800,"2020-10-22T20:30:00Z",2420980,83488,2334776,63376,3674,903,,,,,,,,,,,,,"09",0,0,66052,11294,66052,,0,0,"40f411452e5a895b6f1e6a3e97277aa34f3962e8",0,0,0,0,0,""
20201024,"CT",66052,2676,,,"totalTestsViral",2409686,233,,,,,,9800,"10/22/2020 20:30","2020-10-22T20:30:00Z","10/22 16:30",4577,,9800,"2020-10-22T20:30:00Z",2409686,82962,2324017,63376,3674,903,,,,,,,,,,,,,"09",0,0,66052,26052,66052,,0,0,"21a4bd94886f47a53c2f2e408867f580ca60ee03",0,0,0,0,0,""
20201023,"CT",66052,2676,,,"totalTestsViral",2383634,233,,,,,,9800,"10/22/2020 20:30","2020-10-22T20:30:00Z","10/22 16:30",4577,,9800,"2020-10-22T20:30:00Z",2383634,82117,2298838,63376,3674,903,,,,,,,,,,,,,"09",679,0,66052,33280,66052,,8,-12257,"189c17ec7a3ad046a3b9bfe0c77a598bd3f4514b",0,0,0,0,0,""
20201022,"CT",65373,2630,,,"totalTestsViral",2350354,232,12257,,,,,9800,"10/21/2020 20:30","2020-10-21T20:30:00Z","10/21 16:30",4569,12257,9800,"2020-10-21T20:30:00Z",2350354,81270,2266437,62743,3667,902,,,,,,,,,,,,,"09",502,0,65373,31948,65373,,2,214,"6ca4806e563feba42510439b711a2f1a9e2710f1",0,0,0,0,0,""
20201021,"CT",64871,2610,,,"totalTestsViral",2318406,213,12043,,,,,9651,"10/20/2020 20:30","2020-10-20T20:30:00Z","10/20 16:30",4567,12043,9651,"2020-10-20T20:30:00Z",2318406,80432,2235361,62261,3666,901,,,,,,,,,,,,,"09",416,0,64871,38713,64871,,8,0,"1d15b1cc1567b69d3ea6b88820f049237e472654",0,0,0,0,0,""
20201020,"CT",64455,2592,,,"totalTestsViral",2279693,217,12043,,,,,9651,"10/19/2020 20:30","2020-10-19T20:30:00Z","10/19 16:30",4559,12043,9651,"2020-10-19T20:30:00Z",2279693,79643,2197459,61863,3658,901,,,,,,,,,,,,,"09",434,0,64455,37500,64455,,5,0,"17b94ed9aac470437bd5d0f79fb719ad13c247d4",0,0,0,0,0,""
20201019,"CT",64021,2580,,,"totalTestsViral",2242193,195,12043,,,,,9651,"10/18/2020 20:30","2020-10-18T20:30:00Z","10/18 16:30",4554,12043,9651,"2020-10-18T20:30:00Z",2242193,78817,2160818,61441,3652,902,,,,,,,,,,,,,"09",1191,0,64021,10365,64021,,12,0,"f11a42ce3b4d7cb10957fe6b5e2e81b7100e3a76",0,0,0,0,0,""
20201018,"CT",62830,2521,,,"totalTestsViral",2231828,184,12043,,,,,9651,"10/15/2020 20:30","2020-10-15T20:30:00Z","10/15 16:30",4542,12043,9651,"2020-10-15T20:30:00Z",2231828,78484,2150801,60309,3641,901,,,,,,,,,,,,,"09",0,0,62830,10568,62830,,0,0,"86d417daa473f628ca28c73a95ee4fcd8bf1fde5",0,0,0,0,0,""
20201017,"CT",62830,2521,,,"totalTestsViral",2221260,184,12043,,,,,9651,"10/15/2020 20:30","2020-10-15T20:30:00Z","10/15 16:30",4542,12043,9651,"2020-10-15T20:30:00Z",2221260,78112,2140611,60309,3641,901,,,,,,,,,,,,,"09",0,0,62830,24842,62830,,0,0,"85cf5b5499b41b2ddbee9ff55f21bf2e00ca1e4d",0,0,0,0,0,""
20201016,"CT",62830,2521,,,"totalTestsViral",2196418,184,12043,,,,,9651,"10/15/2020 20:30","2020-10-15T20:30:00Z","10/15 16:30",4542,12043,9651,"2020-10-15T20:30:00Z",2196418,77547,2116348,60309,3641,901,,,,,,,,,,,,,"09",802,0,62830,27708,62830,,2,0,"db114ea9d9e2ca4f09339fa42673f77a69079311",0,0,0,0,0,""
20201015,"CT",62028,2505,,,"totalTestsViral",2168710,191,12043,,,,,9651,"10/14/2020 20:30","2020-10-14T20:30:00Z","10/14 16:30",4540,12043,9651,"2020-10-14T20:30:00Z",2168710,76982,2089217,59523,3640,900,,,,,,,,,,,,,"09",167,0,62028,29271,62028,,3,198,"77759225ec1d97c0477cab71f92344cd0f9024c4",0,0,0,0,0,""
20201014,"CT",61861,2477,,,"totalTestsViral",2139439,188,11845,,,,,9522,"10/13/2020 20:30","2020-10-13T20:30:00Z","10/13 16:30",4537,11845,9522,"2020-10-13T20:30:00Z",2139439,76442,2060495,59384,3637,900,,,,,,,,,,,,,"09",164,0,61861,29145,61861,,4,0,"f30a277074b8fe50b0de2a41905de83001918f41",0,0,0,0,0,""
20201013,"CT",61697,2460,,,"totalTestsViral",2110294,172,11845,,,,,9522,"10/12/2020 20:30","2020-10-12T20:30:00Z","10/12 16:30",4533,11845,9522,"2020-10-12T20:30:00Z",2110294,75889,2031923,59237,3634,899,,,,,,,,,,,,,"09",320,0,61697,27985,61697,,1,0,"05ac34b8b23503407f6a1898d48d4166c48eb0d3",0,0,0,0,0,""
20201012,"CT",61377,2454,,,"totalTestsViral",2082309,155,11845,,,,,9522,"10/11/2020 20:30","2020-10-11T20:30:00Z","10/11 16:30",4532,11845,9522,"2020-10-11T20:30:00Z",2082309,75387,2004458,58923,3633,899,,,,,,,,,,,,,"09",1339,0,61377,7646,61377,,2,0,"a9450290e8048a9f3f286558e8043e0e96d537c9",0,0,0,0,0,""
20201011,"CT",60038,2440,,,"totalTestsViral",2074663,134,11845,,,,,9522,"10/8/2020 20:30","2020-10-08T20:30:00Z","10/08 16:30",4530,11845,9522,"2020-10-08T20:30:00Z",2074663,75199,1997008,57598,3631,899,,,,,,,,,,,,,"09",0,0,60038,9520,60038,,0,0,"d71cb991f5c47bac67cdbbbda02b2c103347bb22",0,0,0,0,0,""
20201010,"CT",60038,2440,,,"totalTestsViral",2065143,134,11845,,,,,9522,"10/8/2020 20:30","2020-10-08T20:30:00Z","10/08 16:30",4530,11845,9522,"2020-10-08T20:30:00Z",2065143,74947,1987742,57598,3631,899,,,,,,,,,,,,,"09",0,0,60038,23792,60038,,0,0,"957477f3747a4c69b543a9987f58e133e212fd99",0,0,0,0,0,""
20201009,"CT",60038,2440,,,"totalTestsViral",2041351,134,11845,,,,,9522,"10/8/2020 20:30","2020-10-08T20:30:00Z","10/08 16:30",4530,11845,9522,"2020-10-08T20:30:00Z",2041351,74474,1964451,57598,3631,899,,,,,,,,,,,,,"09",290,0,60038,27565,60038,,3,0,"230b5d818ac49e77902d71f7d11f51acf8f827bd",0,0,0,0,0,""
20201008,"CT",59748,2416,,,"totalTestsViral",2013786,128,11845,,,,,9522,"10/7/2020 20:30","2020-10-07T20:30:00Z","10/07 16:30",4527,11845,9522,"2020-10-07T20:30:00Z",2013786,74007,1937368,57332,3629,898,,,,,,,,,,,,,"09",384,0,59748,31139,59748,,5,146,"da097ad5b9a6b0c21abb2aefa70b2d0f975e6c50",0,0,0,0,0,""
20201007,"CT",59364,2406,,,"totalTestsViral",1982647,138,11699,,,,,9408,"10/6/2020 20:30","2020-10-06T20:30:00Z","10/06 16:30",4522,11699,9408,"2020-10-06T20:30:00Z",1982647,73405,1906846,56958,3624,898,,,,,,,,,,,,,"09",123,0,59364,34212,59364,,1,0,"dcfc407ca2aa11a0432fbff20a8f1c05b65e38aa",0,0,0,0,0,""
20201006,"CT",59241,2412,,,"totalTestsViral",1948435,129,11699,,,,,9408,"10/5/2020 20:30","2020-10-05T20:30:00Z","10/05 16:30",4521,11699,9408,"2020-10-05T20:30:00Z",1948435,72946,1873100,56829,3623,898,,,,,,,,,,,,,"09",121,0,59241,34209,59241,,4,0,"04df2c5e53b7558bd876edd0bb00ab630d650748",0,0,0,0,0,""
20201005,"CT",59120,2413,,,"totalTestsViral",1914226,129,11699,,,,,9408,"10/4/2020 20:30","2020-10-04T20:30:00Z","10/04 16:30",4517,11699,9408,"2020-10-04T20:30:00Z",1914226,72526,1839324,56707,3619,898,,,,,,,,,,,,,"09",823,0,59120,7799,59120,,4,0,"879eb9a27256115257e384166bcbf3895849640c",0,0,0,0,0,""
20201004,"CT",58297,2435,,,"totalTestsViral",1906427,110,11699,,,,,9408,"10/1/2020 20:30","2020-10-01T20:30:00Z","10/01 16:30",4513,11699,9408,"2020-10-01T20:30:00Z",1906427,72382,1831677,55862,3614,899,,,,,,,,,,,,,"09",0,0,58297,9772,58297,,0,0,"b0262ca94367e0920c77ecb23c7861399df460e2",0,0,0,0,0,""
20201003,"CT",58297,2435,,,"totalTestsViral",1896655,110,11699,,,,,9408,"10/1/2020 20:30","2020-10-01T20:30:00Z","10/01 16:30",4513,11699,9408,"2020-10-01T20:30:00Z",1896655,72193,1822097,55862,3614,899,,,,,,,,,,,,,"09",0,0,58297,23364,58297,,0,0,"a6b9ef3870105222f77fa9ac560091e28f594007",0,0,0,0,0,""
20201002,"CT",58297,2435,,,"totalTestsViral",1873291,110,11699,,,,,9408,"10/1/2020 20:30","2020-10-01T20:30:00Z","10/01 16:30",4513,11699,9408,"2020-10-01T20:30:00Z",1873291,71793,1799143,55862,3614,899,,,,,,,,,,,,,"09",555,0,58297,27049,58297,,2,0,"6567979a9bafc65a6a868bd7bc83b64b6f8f319e",0,0,0,0,0,""
20201001,"CT",57742,2436,,,"totalTestsViral",1846242,107,11699,,,,,9408,"9/30/2020 20:30","2020-09-30T20:30:00Z","09/30 16:30",4511,11699,9408,"2020-09-30T20:30:00Z",1846242,71452,1772448,55306,3613,898,,,,,,,,,,,,,"09",192,0,57742,26763,57742,,3,139,"b835b7c8f05d28861451f9a85ad17be4e0751221",0,0,0,0,0,""
20200930,"CT",57550,2421,,,"totalTestsViral",1819479,104,11560,,,,,9310,"9/29/2020 20:30","2020-09-29T20:30:00Z","09/29 16:30",4508,11560,9310,"2020-09-29T20:30:00Z",1819479,71079,1746066,55129,3610,898,,,,,,,,,,,,,"09",221,0,57550,30630,57550,,3,0,"b2c0c5c81eefa5a0cafd7fc0e1fb068bbf7c115c",0,0,0,0,0,""
20200929,"CT",57329,2410,,,"totalTestsViral",1788849,92,11560,,,,,9310,"9/28/2020 20:30","2020-09-28T20:30:00Z","09/28 16:30",4505,11560,9310,"2020-09-28T20:30:00Z",1788849,70668,1715856,54919,3608,897,,,,,,,,,,,,,"09",182,0,57329,28967,57329,,2,0,"a7c2829342e11d9108eb45e208a1dcd7a07117ed",0,0,0,0,0,""
20200928,"CT",57147,2404,,,"totalTestsViral",1759882,75,11560,,,,,9310,"9/27/2020 20:30","2020-09-27T20:30:00Z","09/27 16:30",4503,11560,9310,"2020-09-27T20:30:00Z",1759882,70267,1687300,54743,3606,897,,,,,,,,,,,,,"09",560,0,57147,5688,57147,,2,0,"c2857ec95fdba8df895df137d9b93f8e32c893da",0,0,0,0,0,""
20200927,"CT",56587,2371,,,"totalTestsViral",1754194,76,11560,,,,,9310,"9/24/2020 20:30","2020-09-24T20:30:00Z","09/24 16:30",4501,11560,9310,"2020-09-24T20:30:00Z",1754194,70158,1681723,54216,3604,897,,,,,,,,,,,,,"09",0,0,56587,7854,56587,,0,0,"141e4736843cb2964ddb8681decd379721369d45",0,0,0,0,0,""
20200926,"CT",56587,2371,,,"totalTestsViral",1746340,76,11560,,,,,9310,"9/24/2020 20:30","2020-09-24T20:30:00Z","09/24 16:30",4501,11560,9310,"2020-09-24T20:30:00Z",1746340,69960,1674070,54216,3604,897,,,,,,,,,,,,,"09",0,0,56587,19115,56587,,0,0,"4706ad59b5e4650c7e0db4e33e01b10faee66dac",0,0,0,0,0,""
20200925,"CT",56587,2371,,,"totalTestsViral",1727225,76,11560,,,,,9310,"9/24/2020 20:30","2020-09-24T20:30:00Z","09/24 16:30",4501,11560,9310,"2020-09-24T20:30:00Z",1727225,69673,1655249,54216,3604,897,,,,,,,,,,,,,"09",115,0,56587,22993,56587,,2,0,"8a7e5d18f7b2674c4fd92ce16b84db5d17ebf701",0,0,0,0,0,""
20200924,"CT",56472,2359,,,"totalTestsViral",1704232,72,11560,,,,,9310,"9/23/2020 20:30","2020-09-23T20:30:00Z","09/23 16:30",4499,11560,9310,"2020-09-23T20:30:00Z",1704232,69430,1632509,54113,3603,896,,,,,,,,,,,,,"09",157,0,56472,23760,56472,,2,113,"1d43873e3d406a47e8b28713b393841e8ad48f8b",0,0,0,0,0,""
20200923,"CT",56315,2346,,,"totalTestsViral",1680472,73,11447,,,,,9204,"9/22/2020 20:30","2020-09-22T20:30:00Z","09/22 16:30",4497,11447,9204,"2020-09-22T20:30:00Z",1680472,69174,1609029,53969,3601,896,,,,,,,,,,,,,"09",155,0,56315,27695,56315,,1,0,"12d5499fadf2d7409cced9204d09d6aff19b5602",0,0,0,0,0,""
20200922,"CT",56160,2346,,,"totalTestsViral",1652777,70,11447,,,,,9204,"9/21/2020 20:30","2020-09-21T20:30:00Z","09/21 16:30",4496,11447,9204,"2020-09-21T20:30:00Z",1652777,68934,1581590,53814,3601,895,,,,,,,,,,,,,"09",136,0,56160,24272,56160,,1,0,"b2ae14d26d0ec3681ec5487f89ba2fc7aa841f15",0,0,0,0,0,""
20200921,"CT",56024,2332,,,"totalTestsViral",1628505,68,11447,,,,,9204,"9/20/2020 20:30","2020-09-20T20:30:00Z","09/20 16:30",4495,11447,9204,"2020-09-20T20:30:00Z",1628505,68682,1557580,53692,3600,895,,,,,,,,,,,,,"09",497,0,56024,7621,56024,,3,0,"1c66a7ede766d0baca66eaa148447342baa200da",0,0,0,0,0,""
20200920,"CT",55527,2309,,,"totalTestsViral",1620884,77,11447,,,,,9204,"9/17/2020 20:30","2020-09-17T20:30:00Z","09/17 16:30",4492,11447,9204,"2020-09-17T20:30:00Z",1620884,68593,1550050,53218,3597,895,,,,,,,,,,,,,"09",0,0,55527,7388,55527,,0,0,"b366ea903136b572752b0c83f8955c6bf5970a7e",0,0,0,0,0,""
20200919,"CT",55527,2309,,,"totalTestsViral",1613496,77,11447,,,,,9204,"9/17/2020 20:30","2020-09-17T20:30:00Z","09/17 16:30",4492,11447,9204,"2020-09-17T20:30:00Z",1613496,68455,1542804,53218,3597,895,,,,,,,,,,,,,"09",0,0,55527,18179,55527,,0,0,"accd187fc478dafe44a402d1010d360640ca9dd6",0,0,0,0,0,""
20200918,"CT",55527,2309,,,"totalTestsViral",1595317,77,11447,,,,,9204,"9/17/2020 20:30","2020-09-17T20:30:00Z","09/17 16:30",4492,11447,9204,"2020-09-17T20:30:00Z",1595317,68264,1524819,53218,3597,895,,,,,,,,,,,,,"09",141,0,55527,21881,55527,,4,0,"96084edf7f271bb88d8620dd5cf319a7a5d6d6df",0,0,0,0,0,""
20200917,"CT",55386,2299,,,"totalTestsViral",1573436,75,11447,,,,,9204,"9/16/2020 20:30","2020-09-16T20:30:00Z","09/16 16:30",4488,11447,9204,"2020-09-16T20:30:00Z",1573436,68043,1503168,53087,3593,895,,,,,,,,,,,,,"09",220,0,55386,23140,55386,,1,90,"94ca9314e07637f8c189ab0cdaab1164fe47fb44",0,0,0,0,0,""
20200916,"CT",55166,2288,,,"totalTestsViral",1550296,70,11357,,,,,9142,"9/15/2020 20:30","2020-09-15T20:30:00Z","09/15 16:30",4487,11357,9142,"2020-09-15T20:30:00Z",1550296,67835,1480248,52878,3592,895,,,,,,,,,,,,,"09",135,0,55166,24992,55166,,2,0,"e630d963addf3b6086f0293fe7cc8a29cfd87585",0,0,0,0,0,""
20200915,"CT",55031,2264,,,"totalTestsViral",1525304,71,11357,,,,,9142,"9/14/2020 20:30","2020-09-14T20:30:00Z","09/14 16:30",4485,11357,9142,"2020-09-14T20:30:00Z",1525304,67639,1455459,52767,3590,895,,,,,,,,,,,,,"09",136,0,55031,23655,55031,,0,0,"30b43941a309d1a61cee53eb35738f4b9a6ec66a",0,0,0,0,0,""
20200914,"CT",54895,2271,,,"totalTestsViral",1501649,64,11357,,,,,9142,"9/13/2020 20:30","2020-09-13T20:30:00Z","09/13 16:30",4485,11357,9142,"2020-09-13T20:30:00Z",1501649,67356,1432096,52624,3590,895,,,,,,,,,,,,,"09",569,0,54895,7361,54895,,5,0,"f45284d6490b8d20725fc352e442ea45a5baa624",0,0,0,0,0,""
20200913,"CT",54326,2231,,,"totalTestsViral",1494288,51,11357,,,,,9142,"9/10/2020 20:30","2020-09-10T20:30:00Z","09/10 16:30",4480,11357,9142,"2020-09-10T20:30:00Z",1494288,67265,1424834,52095,3595,885,,,,,,,,,,,,,"09",0,0,54326,7981,54326,,0,0,"ac375e254e44b8f41fb1abeaa6ef2e8ccdcfc8b2",0,0,0,0,0,""
20200912,"CT",54326,2231,,,"totalTestsViral",1486307,51,11357,,,,,9142,"9/10/2020 20:30","2020-09-10T20:30:00Z","09/10 16:30",4480,11357,9142,"2020-09-10T20:30:00Z",1486307,67111,1417008,52095,3595,885,,,,,,,,,,,,,"09",0,0,54326,17365,54326,,0,0,"9ffd28049be2466cead6bc5f96779ce24fd0c05a",0,0,0,0,0,""
20200911,"CT",54326,2231,,,"totalTestsViral",1468942,51,11357,,,,,9142,"9/10/2020 20:30","2020-09-10T20:30:00Z","09/10 16:30",4480,11357,9142,"2020-09-10T20:30:00Z",1468942,66911,1399849,52095,3595,885,,,,,,,,,,,,,"09",233,0,54326,21638,54326,,2,0,"ceab9fc4ea99a2cca3edd83e3c2c5512b0b3686c",0,0,0,0,0,""
20200910,"CT",54093,2216,,,"totalTestsViral",1447304,52,11357,,,,,9142,"9/9/2020 20:30","2020-09-09T20:30:00Z","09/09 16:30",4478,11357,9142,"2020-09-09T20:30:00Z",1447304,66714,1378415,51877,3593,885,,,,,,,,,,,,,"09",222,0,54093,27376,54093,,4,82,"0afba390cdaa14bf1d35d9b4c24e57fed0f33761",0,0,0,0,0,""
20200909,"CT",53871,2205,,,"totalTestsViral",1419928,57,11275,,,,,9049,"9/8/2020 20:30","2020-09-08T20:30:00Z","09/08 16:30",4474,11275,9049,"2020-09-08T20:30:00Z",1419928,66460,1351301,51666,3589,885,,,,,,,,,,,,,"09",89,0,53871,27839,53871,,0,0,"d4558774ad89efa1fd2e1418b8cd24ce4a3397fb",0,0,0,0,0,""
20200908,"CT",53782,2188,,,"totalTestsViral",1392089,50,11275,,,,,9049,"9/7/2020 20:30","2020-09-07T20:30:00Z","09/07 16:30",4474,11275,9049,"2020-09-07T20:30:00Z",1392089,66175,1323758,51594,3589,885,,,,,,,,,,,,,"09",417,0,53782,9293,53782,,6,0,"734eca22267de1a83b58a594a19b961dbb2d9580",0,0,0,0,0,""
20200907,"CT",53365,2144,,,"totalTestsViral",1382796,58,11275,,,,,9049,"9/4/2020 20:30","2020-09-04T20:30:00Z","09/04 16:30",4468,11275,9049,"2020-09-04T20:30:00Z",1382796,66093,1314551,51221,3583,885,,,,,,,,,,,,,"09",0,0,53365,5568,53365,,0,0,"4d962bfb945b455ff8d2d5c3968d37dee68e8861",0,0,0,0,0,""
20200906,"CT",53365,2144,,,"totalTestsViral",1377228,58,11275,,,,,9049,"9/3/2020 20:30","2020-09-03T20:30:00Z","09/03 16:30",4468,11275,9049,"2020-09-03T20:30:00Z",1377228,66016,1309062,51221,3583,885,,,,,,,,,,,,,"09",0,0,53365,7036,53365,,0,0,"4692b88a280c2831ab7ad4580fccc4540b8cfa08",0,0,0,0,0,""
20200905,"CT",53365,2144,,,"totalTestsViral",1370192,58,11275,,,,,9049,"9/3/2020 20:30","2020-09-03T20:30:00Z","09/03 16:30",4468,11275,9049,"2020-09-03T20:30:00Z",1370192,65906,1302142,51221,3583,885,,,,,,,,,,,,,"09",0,0,53365,16073,53365,,0,0,"fc6c9a6c86d36e19eee98f5d01cc1ae52a302273",0,0,0,0,0,""
20200904,"CT",53365,2144,,,"totalTestsViral",1354119,58,11275,,,,,9049,"9/3/2020 20:30","2020-09-03T20:30:00Z","09/03 16:30",4468,11275,9049,"2020-09-03T20:30:00Z",1354119,65769,1286217,51221,3583,885,,,,,,,,,,,,,"09",156,0,53365,21997,53365,,0,0,"90055fecd1b5a580e2def872bcb7659128a6807c",0,0,0,0,0,""
20200903,"CT",53209,2133,,,"totalTestsViral",1332122,65,11275,,,,,9049,"9/2/2020 20:30","2020-09-02T20:30:00Z","09/02 16:30",4468,11275,9049,"2020-09-02T20:30:00Z",1332122,65570,1264436,51076,3583,885,,,,,,,,,,,,,"09",101,0,53209,20037,53209,,1,95,"b85cf830584da0523237e9ebd61483e866b57495",0,0,0,0,0,""
20200902,"CT",53108,2130,,,"totalTestsViral",1312085,65,11180,,,,,8967,"9/1/2020 20:30","2020-09-01T20:30:00Z","09/01 16:30",4467,11180,8967,"2020-09-01T20:30:00Z",1312085,65365,1244627,50978,3582,885,,,,,,,,,,,,,"09",102,0,53108,20523,53108,,1,0,"972bbefb04d47946e8431946ce7f7f525ec93083",0,0,0,0,0,""
20200901,"CT",53006,2123,,,"totalTestsViral",1291562,56,11180,,,,,8967,"8/31/2020 20:30","2020-08-31T20:30:00Z","08/31 16:30",4466,11180,8967,"2020-08-31T20:30:00Z",1291562,65164,1224334,50883,3581,885,,,,,,,,,,,,,"09",127,0,53006,20481,53006,,1,0,"77c4cb232c8deccd314e208fb2471169de5de7d1",0,0,0,0,0,""
20200831,"CT",52879,2126,,,"totalTestsViral",1271081,52,11180,,,,,8967,"8/30/2020 20:30","2020-08-30T20:30:00Z","08/30 16:30",4465,11180,8967,"2020-08-30T20:30:00Z",1271081,64953,1204088,50753,3580,885,,,,,,,,,,,,,"09",384,0,52879,8399,52879,,0,0,"4d152e515e21484b65784850c226f462b1ac3511",0,0,0,0,0,""
20200830,"CT",52495,2108,,,"totalTestsViral",1262682,60,11180,,,,,8967,"8/27/2020 18:30","2020-08-27T18:30:00Z","08/27 14:30",4465,11180,8967,"2020-08-27T18:30:00Z",1262682,64890,1195754,50387,3579,886,,,,,,,,,,,,,"09",0,0,52495,8204,52495,,0,0,"8f5152c8cb4e21fee14cf2d86eb1277e9bb6184e",0,0,0,0,0,""
20200829,"CT",52495,2108,,,"totalTestsViral",1254478,60,11180,,,,,8967,"8/27/2020 20:30","2020-08-27T20:30:00Z","08/27 16:30",4465,11180,8967,"2020-08-27T20:30:00Z",1254478,64781,1187662,50387,3579,886,,,,,,,,,,,,,"09",0,0,52495,18161,52495,,0,0,"ff6ab03e326389f9773abc32ca6e4e3b6240420b",0,0,0,0,0,""
20200828,"CT",52495,2108,,,"totalTestsViral",1236317,60,11180,,,,,8967,"8/27/2020 20:30","2020-08-27T20:30:00Z","08/27 16:30",4465,11180,8967,"2020-08-27T20:30:00Z",1236317,64575,1169714,50387,3579,886,,,,,,,,,,,,,"09",145,0,52495,19270,52495,,0,0,"cbb1b9c3fd45e3e943a0e6ab69662848f3ab5a12",0,0,0,0,0,""
20200827,"CT",52350,2095,,,"totalTestsViral",1217047,56,11180,,,,,8967,"8/26/2020 20:30","2020-08-26T20:30:00Z","08/26 16:30",4465,11180,8967,"2020-08-26T20:30:00Z",1217047,64421,1150611,50255,3579,886,,,,,,,,,,,,,"09",130,0,52350,20586,52350,,2,93,"0dd0971fbcd9be9f09f8852135351c0dc592a819",0,0,0,0,0,""
20200826,"CT",52220,2086,,,"totalTestsViral",1196461,57,11087,,,,,8893,"8/25/2020 20:30","2020-08-25T20:30:00Z","08/25 16:30",4463,11087,8893,"2020-08-25T20:30:00Z",1196461,64255,1130206,50134,3579,884,,,,,,,,,,,,,"09",180,0,52220,20874,52220,,0,0,"3e5628a390e07c146976cc3a607d8740a1679143",0,0,0,0,0,""
20200825,"CT",52040,2069,,,"totalTestsViral",1175587,59,11087,,,,,8893,"8/24/2020 20:30","2020-08-24T20:30:00Z","08/24 16:30",4463,11087,8893,"2020-08-24T20:30:00Z",1175587,64065,1109525,49971,3580,883,,,,,,,,,,,,,"09",29,0,52040,20013,52040,,3,0,"f4c0b48e2cd06e3a2956e9fc0703b3f98e6a1549",0,0,0,0,0,""
20200824,"CT",52011,2071,,,"totalTestsViral",1155574,57,11087,,,,,8893,"8/23/2020 20:30","2020-08-23T20:30:00Z","08/23 16:30",4460,11087,8893,"2020-08-23T20:30:00Z",1155574,63852,1089729,49940,3574,886,,,,,,,,,,,,,"09",492,0,52011,5824,52011,,0,0,"897903666dbacd834302969432ccbd5bc8bfc975",0,0,0,0,0,""
20200823,"CT",51519,2042,,,"totalTestsViral",1149750,54,11087,,,,,8893,"8/20/2020 20:30","2020-08-20T20:30:00Z","08/20 16:30",4460,11087,8893,"2020-08-20T20:30:00Z",1149750,63793,1083965,49477,3574,886,,,,,,,,,,,,,"09",0,0,51519,6760,51519,,0,0,"5e7cbc184bda1cabb4aa580124652625cbdceb3d",0,0,0,0,0,""
20200822,"CT",51519,2042,,,"totalTestsViral",1142990,54,11087,,,,,8893,"8/20/2020 20:30","2020-08-20T20:30:00Z","08/20 16:30",4460,11087,8893,"2020-08-20T20:30:00Z",1142990,63696,1077306,49477,3574,886,,,,,,,,,,,,,"09",0,0,51519,14515,51519,,0,0,"8c36194dd99a6a0e651f37031ed251db806e03d1",0,0,0,0,0,""
20200821,"CT",51519,2042,,,"totalTestsViral",1128475,54,11087,,,,,8893,"8/20/2020 20:30","2020-08-20T20:30:00Z","08/20 16:30",4460,11087,8893,"2020-08-20T20:30:00Z",1128475,63580,1062914,49477,3574,886,,,,,,,,,,,,,"09",87,0,51519,17843,51519,,2,0,"e1fb185f211df37ea6cc01d6eb9287127362388b",0,0,0,0,0,""
20200820,"CT",51432,2030,,,"totalTestsViral",1110632,47,11087,,,,,8893,"8/19/2020 20:30","2020-08-19T20:30:00Z","08/19 16:30",4458,11087,8893,"2020-08-19T20:30:00Z",1110632,63429,1045227,49402,3572,886,,,,,,,,,,,,,"09",118,0,51432,17816,51432,,1,72,"691b52d9cdab75d5b1b10d41416883d4bdc6b92d",0,0,0,0,0,""
20200819,"CT",51314,2025,,,"totalTestsViral",1092816,49,11015,,,,,8809,"8/18/2020 20:30","2020-08-18T20:30:00Z","08/18 16:30",4457,11015,8809,"2020-08-18T20:30:00Z",1092816,63260,1027593,49289,3572,885,,,,,,,,,,,,,"09",59,0,51314,16997,51314,,1,0,"975cb7f5d1369680ec0b286958f9b98334f11622",0,0,0,0,0,""
20200818,"CT",51255,2019,,,"totalTestsViral",1075819,47,11015,,,,,8809,"8/17/2020 20:30","2020-08-17T20:30:00Z","08/17 16:30",4456,11015,8809,"2020-08-17T20:30:00Z",1075819,63083,1010780,49236,3571,885,,,,,,,,,,,,,"09",-12,0,51255,19513,51255,,0,0,"19c5a60d48a2820de45180ca9c3be987668e13bd",0,0,0,0,0,""
20200817,"CT",51267,2016,,,"totalTestsViral",1056306,42,11015,,,,,8809,"8/16/2020 20:30","2020-08-16T20:30:00Z","08/16 16:30",4456,11015,8809,"2020-08-16T20:30:00Z",1056306,62901,991454,49251,3572,884,,,,,,,,,,,,,"09",370,0,51267,9210,51267,,3,0,"fc6f7cd10fcfa74d5c4ddc5df9f15316ba399092",0,0,0,0,0,""
20200816,"CT",50897,2010,,,"totalTestsViral",1047096,56,11015,,,,,8809,"8/14/2020 16:00","2020-08-14T16:00:00Z","08/14 12:00",4453,11015,8809,"2020-08-14T16:00:00Z",1047096,62850,982296,48887,3569,884,,,,,,,,,,,,,"09",0,0,50897,7239,50897,,0,0,"e1c6bfc3ddf995eca03e2036618d17cdadd193d3",0,0,0,0,0,""
20200815,"CT",50897,2010,,,"totalTestsViral",1039857,56,11015,,,,,8809,"8/14/2020 16:00","2020-08-14T16:00:00Z","08/14 12:00",4453,11015,8809,"2020-08-14T16:00:00Z",1039857,62795,975116,48887,3569,884,,,,,,,,,,,,,"09",0,0,50897,14599,50897,,0,0,"d4998b41eb2ad12d06dd89f6d70c761eb3f617a7",0,0,0,0,0,""
20200814,"CT",50897,2010,,,"totalTestsViral",1025258,56,11015,,,,,8809,"8/13/2020 20:30","2020-08-13T20:30:00Z","08/13 16:30",4453,11015,8809,"2020-08-13T20:30:00Z",1025258,62643,960675,48887,3569,884,,,,,,,,,,,,,"09",115,0,50897,15856,50897,,3,0,"233dbdd203b9b434b16dacc19afcda89f1e89ea8",0,0,0,0,0,""
20200813,"CT",50782,2008,,,"totalTestsViral",1009402,63,11015,,,,,8809,"8/12/2020 20:30","2020-08-12T20:30:00Z","08/12 16:30",4450,11015,8809,"2020-08-12T20:30:00Z",1009402,62508,944963,48774,3566,884,,,,,,,,,,,,,"09",76,0,50782,16409,50782,,0,95,"dd966c841b61f6881137939cfa0926e9874dc39c",0,0,0,0,0,""
20200812,"CT",50706,2001,,,"totalTestsViral",992993,58,10920,,,,,8721,"8/11/2020 20:30","2020-08-11T20:30:00Z","08/11 16:30",4450,10920,8721,"2020-08-11T20:30:00Z",992993,62390,928680,48705,3566,884,,,,,,,,,,,,,"09",22,0,50706,15331,50706,,6,0,"a1a1a505df0a15f61c68e7190c1f0e4fbd7cf4de",0,0,0,0,0,""
20200811,"CT",50684,1994,,,"totalTestsViral",977662,70,10920,,,,,8721,"8/10/2020 20:30","2020-08-10T20:30:00Z","08/10 16:30",4444,10920,8721,"2020-08-10T20:30:00Z",977662,62261,913480,48690,3561,883,,,,,,,,,,,,,"09",117,0,50684,16155,50684,,0,0,"8644a1e6eaae5e0d9879a64cc116c0af303b4a65",0,0,0,0,0,""
20200810,"CT",50567,1990,,,"totalTestsViral",961507,64,10920,,,,,8721,"8/9/2020 20:30","2020-08-09T20:30:00Z","08/09 16:30",4444,10920,8721,"2020-08-09T20:30:00Z",961507,62149,897440,48577,3560,884,,,,,,,,,,,,,"09",247,0,50567,6498,50567,,3,0,"11c80ecd7ff538f148d9e6a080a32f3758672f1b",0,0,0,0,0,""
20200809,"CT",50320,1975,,,"totalTestsViral",955009,65,10920,,,,,8721,"8/6/2020 20:30","2020-08-06T20:30:00Z","08/06 16:30",4441,10920,8721,"2020-08-06T20:30:00Z",955009,62110,890981,48345,3558,883,,,,,,,,,,,,,"09",0,0,50320,5309,50320,,0,0,"0acd09a4ca8bf76316fe5dc068505e695bae8701",0,0,0,0,0,""
20200808,"CT",50320,1975,,,"totalTestsViral",949700,65,10920,,,,,8721,"8/6/2020 20:30","2020-08-06T20:30:00Z","08/06 16:30",4441,10920,8721,"2020-08-06T20:30:00Z",949700,62067,885717,48345,3558,883,,,,,,,,,,,,,"09",0,0,50320,11524,50320,,0,0,"d1660d9a332300f209b5ddafb675fde5fdf38756",0,0,0,0,0,""
20200807,"CT",50320,1975,,,"totalTestsViral",938176,65,10920,,,,,8721,"8/6/2020 20:30","2020-08-06T20:30:00Z","08/06 16:30",4441,10920,8721,"2020-08-06T20:30:00Z",938176,61982,874279,48345,3558,883,,,,,,,,,,,,,"09",75,0,50320,15156,50320,,4,0,"7149d94342251898b6e6ade2d5dd925dffa738bb",0,0,0,0,0,""
20200806,"CT",50245,1972,,,"totalTestsViral",923020,66,10920,,,,,8721,"8/5/2020 20:30","2020-08-05T20:30:00Z","08/05 16:30",4437,10920,8721,"2020-08-05T20:30:00Z",923020,61840,859277,48273,3555,882,,,,,,,,,,,,,"09",20,0,50245,13381,50245,,0,113,"5314dbf95018c8e1bda062ed39c5687915ce32af",0,0,0,0,0,""
20200805,"CT",50225,1967,,,"totalTestsViral",909639,59,10807,,,,,8613,"8/4/2020 20:30","2020-08-04T20:30:00Z","08/04 16:30",4437,10807,8613,"2020-08-04T20:30:00Z",909639,61711,846030,48258,3555,882,,,,,,,,,,,,,"09",115,0,50225,12473,50225,,0,0,"9535b0a4c9ee3311bc3e0436bf1f7b94931312b8",0,0,0,0,0,""
20200804,"CT",50110,1968,,,"totalTestsViral",897166,60,10807,,,,,8613,"8/3/2020 20:30","2020-08-03T20:30:00Z","08/03 16:30",4437,10807,8613,"2020-08-03T20:30:00Z",897166,61586,833688,48142,3555,882,,,,,,,,,,,,,"09",48,0,50110,12903,50110,,0,0,"e7face5bc665c16603e1868a7e7daf029d122166",0,0,0,0,0,""
20200803,"CT",50062,1969,,,"totalTestsViral",884263,56,10807,,,,,8613,"8/2/2020 20:30","2020-08-02T20:30:00Z","08/02 16:30",4437,10807,8613,"2020-08-02T20:30:00Z",884263,61443,820935,48093,3555,882,,,,,,,,,,,,,"09",252,0,50062,7372,50062,,5,0,"ea421b9cb8e28ae4f6906b839aa5f20e518c9da6",0,0,0,0,0,""
20200802,"CT",49810,1956,,,"totalTestsViral",876891,69,10807,,,,,8613,"7/30/2020 20:30","2020-07-30T20:30:00Z","07/30 16:30",4432,10807,8613,"2020-07-30T20:30:00Z",876891,61403,813606,47854,3551,881,,,,,,,,,,,,,"09",0,0,49810,5452,49810,,0,0,"17c11d1c1d48ed8cf9619ae356f42bc6f02aa2cc",0,0,0,0,0,""
20200801,"CT",49810,1956,,,"totalTestsViral",871439,69,10807,,,,,8613,"7/30/2020 20:30","2020-07-30T20:30:00Z","07/30 16:30",4432,10807,8613,"2020-07-30T20:30:00Z",871439,61353,808205,47854,3551,881,,,,,,,,,,,,,"09",0,0,49810,11681,49810,,0,0,"dd48153770a132b7e80980e9f6199fda2cfc81aa",0,0,0,0,0,""
20200731,"CT",49810,1956,,,"totalTestsViral",859758,69,10807,,,,,8613,"7/30/2020 20:30","2020-07-30T20:30:00Z","07/30 16:30",4432,10807,8613,"2020-07-30T20:30:00Z",859758,61256,796624,47854,3551,881,,,,,,,,,,,,,"09",140,0,49810,14496,49810,,1,0,"779cf2d07fffa5d4e6f522e136ef729142415c26",0,0,0,0,0,""
20200730,"CT",49670,1953,,,"totalTestsViral",845262,66,10807,,,,,8613,"7/29/2020 20:30","2020-07-29T20:30:00Z","07/29 16:30",4431,10807,8613,"2020-07-29T20:30:00Z",845262,61121,782270,47717,3550,881,,,,,,,,,,,,,"09",130,0,49670,15237,49670,,6,95,"6240759d111b5a0faee39d34cd561099fba1befe",0,0,0,0,0,""
20200729,"CT",49540,1959,,,"totalTestsViral",830025,53,10712,,,,,8516,"7/28/2020 20:30","2020-07-28T20:30:00Z","07/28 16:30",4425,10712,8516,"2020-07-28T20:30:00Z",830025,60989,767175,47581,3544,881,,,,,,,,,,,,,"09",463,0,49540,14393,49540,,2,0,"e3a1b1276cbd2de067df5ca2916ece448578adf0",0,0,0,0,0,""
20200728,"CT",49077,1988,,,"totalTestsViral",815632,54,10712,,,,,8516,"7/27/2020 20:30","2020-07-27T20:30:00Z","07/27 16:30",4423,10712,8516,"2020-07-27T20:30:00Z",815632,60873,752910,47089,3541,882,,,,,,,,,,,,,"09",94,0,49077,13460,49077,,5,0,"b99869c9c63a3f74f76af427db02a166395dba09",0,0,0,0,0,""
20200727,"CT",48983,1989,,,"totalTestsViral",802172,59,10712,,,,,8516,"7/26/2020 20:30","2020-07-26T20:30:00Z","07/26 16:30",4418,10712,8516,"2020-07-26T20:30:00Z",802172,60713,739616,46994,3536,882,,,,,,,,,,,,,"09",207,0,48983,7263,48983,,5,0,"03d1719e8c5fdb1763a8a4571b318e9339de5b2c",0,0,0,0,0,""
20200726,"CT",48776,1970,,,"totalTestsViral",794909,71,10712,,,,,8516,"7/23/2020 20:30","2020-07-23T20:30:00Z","07/23 16:30",4413,10712,8516,"2020-07-23T20:30:00Z",794909,60678,732393,46806,3531,882,,,,,,,,,,,,,"09",0,0,48776,5405,48776,,0,0,"7a58b482b189178c8da2188d2c5b1a893bf56986",0,0,0,0,0,""
20200725,"CT",48776,1970,,,"totalTestsViral",789504,71,10712,,,,,8516,"7/23/2020 20:30","2020-07-23T20:30:00Z","07/23 16:30",4413,10712,8516,"2020-07-23T20:30:00Z",789504,60614,727054,46806,3531,882,,,,,,,,,,,,,"09",0,0,48776,12220,48776,,0,0,"72d3e54c23ba641dddcc90999458cbfb6635a1ac",0,0,0,0,0,""
20200724,"CT",48776,1970,,,"totalTestsViral",777284,71,10712,,,,,8516,"7/23/2020 20:30","2020-07-23T20:30:00Z","07/23 16:30",4413,10712,8516,"2020-07-23T20:30:00Z",777284,60463,714994,46806,3531,882,,,,,,,,,,,,,"09",544,0,48776,15484,48776,,3,0,"6f3c3a443d3b868bbf8bacf42b0b2beccbcba2ca",0,0,0,0,0,""
20200723,"CT",48232,2019,,,"totalTestsViral",761800,72,10712,,,,,8516,"7/22/2020 20:30","2020-07-22T20:30:00Z","07/22 16:30",4410,10712,8516,"2020-07-22T20:30:00Z",761800,60285,699702,46213,3530,880,,,,,,,,,,,,,"09",9,0,48232,14292,48232,,4,58,"94eafae8fdc216f06a0c126dd8478ca36c3d6edc",0,0,0,0,0,""
20200722,"CT",48223,2020,,,"totalTestsViral",747508,63,10654,,,,,8466,"7/21/2020 20:30","2020-07-21T20:30:00Z","07/21 16:30",4406,10654,8466,"2020-07-21T20:30:00Z",747508,60171,685537,46203,3527,879,,,,,,,,,,,,,"09",127,0,48223,13819,48223,,0,0,"8807e64d544cc2b3f709af56ea3e9ba19cc4ea4b",0,0,0,0,0,""
20200721,"CT",48096,1980,,,"totalTestsViral",733689,62,10654,,,,,8466,"7/20/2020 20:30","2020-07-20T20:30:00Z","07/20 16:30",4406,10654,8466,"2020-07-20T20:30:00Z",733689,60021,671874,46116,3527,879,,,,,,,,,,,,,"09",41,0,48096,13048,48096,,0,0,"bd61f2d2a27d93c39ceb83e041d73a948fcbe658",0,0,0,0,0,""
20200720,"CT",48055,1984,,,"totalTestsViral",720641,54,10654,,,,,8466,"7/19/2020 20:30","2020-07-19T20:30:00Z","07/19 16:30",4406,10654,8466,"2020-07-19T20:30:00Z",720641,59891,658972,46071,3525,881,,,,,,,,,,,,,"09",162,0,48055,6097,48055,,10,0,"19a70b7a0de66d523b22c95b3608dd68cf73f48e",0,0,0,0,0,""
20200719,"CT",47893,1983,,,"totalTestsViral",714544,66,10654,,,,,8466,"7/17/2020 20:30","2020-07-17T20:30:00Z","07/17 16:30",4396,10654,8466,"2020-07-17T20:30:00Z",714544,59849,652922,45910,3519,877,,,,,,,,,,,,,"09",0,0,47893,3953,47893,,0,0,"35e2e09959fd8a1ba0bfcddb0fa7afce32540ff1",0,0,0,0,0,""
20200718,"CT",47893,1983,,,"totalTestsViral",710591,66,10654,,,,,8466,"7/16/2020 20:30","2020-07-16T20:30:00Z","07/16 16:30",4396,10654,8466,"2020-07-16T20:30:00Z",710591,59790,649030,45910,3519,877,,,,,,,,,,,,,"09",0,0,47893,12933,47893,,0,0,"7be20fb6e570d24d5f81b090e800cf9aa712818f",0,0,0,0,0,""
20200717,"CT",47893,1983,,,"totalTestsViral",697658,66,10654,,,,,8466,"7/16/2020 20:30","2020-07-16T20:30:00Z","07/16 16:30",4396,10654,8466,"2020-07-16T20:30:00Z",697658,59702,636198,45910,3519,877,,,,,,,,,,,,,"09",143,0,47893,13211,47893,,7,0,"e130c4a1b53cd56e75033b0c4018b491f60d6aee",0,0,0,0,0,""
20200716,"CT",47750,1979,,,"totalTestsViral",684447,66,10654,,,,,8466,"7/15/2020 20:30","2020-07-15T20:30:00Z","07/15 16:30",4389,10654,8466,"2020-07-15T20:30:00Z",684447,59566,623133,45771,3515,874,,,,,,,,,,,,,"09",114,0,47750,14356,47750,,9,102,"6b8489b72dff82a76fb183bad267017b7e0e0054",0,0,0,0,0,""
20200715,"CT",47636,1983,,,"totalTestsViral",670091,67,10552,,,,,8351,"7/14/2020 20:30","2020-07-14T20:30:00Z","07/14 16:30",4380,10552,8351,"2020-07-14T20:30:00Z",670091,59436,608918,45653,3505,875,,,,,,,,,,,,,"09",106,0,47636,15883,47636,,8,0,"c772963233f63b26fadd48db45a2c53ec0acaf0a",0,0,0,0,0,""
20200714,"CT",47530,1983,,,"totalTestsViral",654208,66,10552,,,,,8351,"7/13/2020 20:30","2020-07-13T20:30:00Z","07/13 16:30",4372,10552,8351,"2020-07-13T20:30:00Z",654208,59283,593199,45547,3497,875,,,,,,,,,,,,,"09",20,0,47530,14435,47530,,1,0,"60acab4caadfb1c5339294d57cf114aa88823450",0,0,0,0,0,""
20200713,"CT",47510,1987,,,"totalTestsViral",639773,74,10552,,,,,8351,"7/12/2020 20:30","2020-07-12T20:30:00Z","07/12 16:30",4371,10552,8351,"2020-07-12T20:30:00Z",639773,59128,578933,45523,3492,879,,,,,,,,,,,,,"09",223,0,47510,4262,47510,,23,0,"4b60b945a75b98b66c15b830e7a58ab546bde8b0",0,0,0,0,0,""
20200712,"CT",47287,1979,,,"totalTestsViral",635511,77,10552,,,,,8351,"7/9/2020 20:30","2020-07-09T20:30:00Z","07/09 16:30",4348,10552,8351,"2020-07-09T20:30:00Z",635511,59079,574724,45308,3476,871,,,,,,,,,,,,,"09",0,0,47287,5121,47287,,0,0,"68faccb888d1d5817baf473f2bb2a5966805dff1",0,0,0,0,0,""
20200711,"CT",47287,1979,,,"totalTestsViral",630390,77,10552,,,,,8351,"7/9/2020 20:30","2020-07-09T20:30:00Z","07/09 16:30",4348,10552,8351,"2020-07-09T20:30:00Z",630390,59014,569674,45308,3476,871,,,,,,,,,,,,,"09",0,0,47287,12281,47287,,0,0,"a8ab4ebafadf51a735c06a200040c498b0ffe9f1",0,0,0,0,0,""
20200710,"CT",47287,1979,,,"totalTestsViral",618109,77,10552,,,,,8351,"7/9/2020 20:30","2020-07-09T20:30:00Z","07/09 16:30",4348,10552,8351,"2020-07-09T20:30:00Z",618109,58899,557519,45308,3476,871,,,,,,,,,,,,,"09",78,0,47287,12691,47287,,0,0,"c603feb2b175ea2a0ea0748cdde0c1676e75e943",0,0,0,0,0,""
20200709,"CT",47209,1985,,,"totalTestsViral",605418,90,10552,,,,,8351,"7/8/2020 20:30","2020-07-08T20:30:00Z","07/08 16:30",4348,10552,8351,"2020-07-08T20:30:00Z",605418,58768,544970,45224,3476,872,,,,,,,,,,,,,"09",101,0,47209,15068,47209,,5,141,"bfeb210ff61d35b230c88607060cd85d5bbb9e8c",0,0,0,0,0,""
20200708,"CT",47108,1979,,,"totalTestsViral",590350,88,10411,,,,,8210,"7/7/2020 20:30","2020-07-07T20:30:00Z","07/07 16:30",4343,10411,8210,"2020-07-07T20:30:00Z",590350,58618,530071,45129,3471,872,,,,,,,,,,,,,"09",75,0,47108,14562,47108,,5,0,"55ca93cede2712e4df520a5badf99b33e8cfae63",0,0,0,0,0,""
20200707,"CT",47033,1977,,,"totalTestsViral",575788,83,10411,,,,,8210,"7/6/2020 20:30","2020-07-06T20:30:00Z","07/06 16:30",4338,10411,8210,"2020-07-06T20:30:00Z",575788,58440,515709,45056,3466,872,,,,,,,,,,,,,"09",57,0,47033,15206,47033,,0,0,"69c48e259adc12ecb139b3a65fdc060105e57969",0,0,0,0,0,""
20200706,"CT",46976,1979,,,"totalTestsViral",560582,69,10411,,,,,8210,"7/5/2020 20:30","2020-07-05T20:30:00Z","07/05 16:30",4338,10411,8210,"2020-07-05T20:30:00Z",560582,58275,500688,44997,3466,872,,,,,,,,,,,,,"09",259,0,46976,4316,46976,,3,0,"96003b6f459640c22397b55da6c11c77cdcae0b9",0,0,0,0,0,""
20200705,"CT",46717,1976,,,"totalTestsViral",556266,95,10411,,,,,8210,"7/2/2020 20:30","2020-07-02T20:30:00Z","07/02 16:30",4335,10411,8210,"2020-07-02T20:30:00Z",556266,58222,496429,44741,3463,872,,,,,,,,,,,,,"09",0,0,46717,2123,46717,,0,0,"ec4d068eec9385fbd9f1af4428201b3634b5bb7a",0,0,0,0,0,""
20200704,"CT",46717,1976,,,"totalTestsViral",554143,95,10411,,,,,8210,"7/2/2020 20:30","2020-07-02T20:30:00Z","07/02 16:30",4335,10411,8210,"2020-07-02T20:30:00Z",554143,58182,494348,44741,3463,872,,,,,,,,,,,,,"09",0,0,46717,5822,46717,,0,0,"4a81d59a6a82ab155e62caf60485ca8cb82a3725",0,0,0,0,0,""
20200703,"CT",46717,1976,,,"totalTestsViral",548321,95,10411,,,,,8210,"7/2/2020 20:30","2020-07-02T20:30:00Z","07/02 16:30",4335,10411,8210,"2020-07-02T20:30:00Z",548321,58097,488620,44741,3463,872,,,,,,,,,,,,,"09",71,0,46717,14104,46717,,9,0,"0371d914e8e3fad6c3fef9548e6d5cf81435e03b",0,0,0,0,0,""
20200702,"CT",46646,1974,,,"totalTestsViral",534217,101,10411,,,,,8210,"7/1/2020 20:30","2020-07-01T20:30:00Z","07/01 16:30",4326,10411,8210,"2020-07-01T20:30:00Z",534217,57911,474717,44672,3459,867,,,,,,,,,,,,,"09",74,0,46646,13863,46646,,2,143,"23ed2613a0941f8a86e2e12b3b0d8077e8520fbe",0,0,0,0,0,""
20200701,"CT",46572,1979,,,"totalTestsViral",520354,100,10268,,,,,8053,"6/30/2020 20:30","2020-06-30T20:30:00Z","06/30 16:30",4324,10268,8053,"2020-06-30T20:30:00Z",520354,57711,461076,44593,3457,867,,,,,,,,,,,,,"09",58,0,46572,15034,46572,,2,0,"6da27276351b1c4c06b35d867026fd2481ad351f",0,0,0,0,0,""
20200630,"CT",46514,1980,,,"totalTestsViral",505320,98,10268,,,,,8053,"6/29/2020 20:30","2020-06-29T20:30:00Z","06/29 16:30",4322,10268,8053,"2020-06-29T20:30:00Z",505320,57508,446265,44534,3453,869,,,,,,,,,,,,,"09",152,0,46514,13287,46514,,2,0,"bb0b673bab13049a80ce372b09a89d4189a56a0f",0,0,0,0,0,""
20200629,"CT",46362,1978,,,"totalTestsViral",492033,99,10268,,,,,8053,"6/28/2020 20:30","2020-06-28T20:30:00Z","06/28 16:30",4320,10268,8053,"2020-06-28T20:30:00Z",492033,57346,433199,44384,3451,869,,,,,,,,,,,,,"09",59,0,46362,3843,46362,,4,0,"ae4dd56f55d68a8e37af250147815bf6f60b054c",0,0,0,0,0,""
20200628,"CT",46303,1979,,,"totalTestsViral",488190,103,10268,,,,,8053,"6/27/2020 20:30","2020-06-27T20:30:00Z","06/27 16:30",4316,10268,8053,"2020-06-27T20:30:00Z",488190,57294,429411,44324,3448,868,,,,,,,,,,,,,"09",97,0,46303,5325,46303,,5,0,"055f6917eefb89f80919793b6b2ee7674e6da00f",0,0,0,0,0,""
20200627,"CT",46206,1981,,,"totalTestsViral",482865,106,10268,,,,,8053,"6/26/2020 20:30","2020-06-26T20:30:00Z","06/26 16:30",4311,10268,8053,"2020-06-26T20:30:00Z",482865,57215,424169,44225,3443,868,,,,,,,,,,,,,"09",147,0,46206,11201,46206,,4,0,"0f0027774847131826cbb92103abce3246449fe8",0,0,0,0,0,""
20200626,"CT",46059,1973,,,"totalTestsViral",471664,127,10268,,,,,8053,"6/25/2020 20:30","2020-06-25T20:30:00Z","06/25 16:30",4307,10268,8053,"2020-06-25T20:30:00Z",471664,57071,413162,44086,3440,867,,,,,,,,,,,,,"09",65,0,46059,13871,46059,,9,0,"789a3208117926586a3ff6cf6e6c8928f8e9dcee",0,0,0,0,0,""
20200625,"CT",45994,1976,,,"totalTestsViral",457793,122,10268,,,,,8053,"6/24/2020 20:30","2020-06-24T20:30:00Z","06/24 16:30",4298,10268,8053,"2020-06-24T20:30:00Z",457793,56907,399481,44018,3434,864,,,,,,,,,,,,,"09",81,0,45994,13534,45994,,11,169,"c21b44b409966da60b848db15b03eb40b9f723ef",0,0,0,0,0,""
20200624,"CT",45913,1959,,,"totalTestsViral",444259,124,10099,,,,,7842,"6/23/2020 20:30","2020-06-23T20:30:00Z","06/23 16:30",4287,10099,7842,"2020-06-23T20:30:00Z",444259,56721,386155,43954,3423,864,,,,,,,,,,,,,"09",14,0,45913,12002,45913,,10,0,"6c24d659f9373019237f75b8bb23e3eafe27abc9",0,0,0,0,0,""
20200623,"CT",45899,1958,,,"totalTestsViral",432257,138,10099,,,,,7842,"6/23/2020 15:30","2020-06-23T15:30:00Z","06/23 11:30",4277,10099,7842,"2020-06-23T15:30:00Z",432257,56556,374333,43941,3414,863,,,,,,,,,,,,,"09",117,0,45899,12034,45899,,14,0,"01fe09bfbf5e9acaf0b3d123ec8b80e691942c36",0,0,0,0,0,""
20200622,"CT",45782,1962,,,"totalTestsViral",420223,140,10099,,,,,7842,"6/21/2020 20:30","2020-06-21T20:30:00Z","06/21 16:30",4263,10099,7842,"2020-06-21T20:30:00Z",420223,56385,362481,43820,3403,860,,,,,,,,,,,,,"09",27,0,45782,3175,45782,,3,0,"0e14d0be2a7e12792f9f7d878aadc69a478a843a",0,0,0,0,0,""
20200621,"CT",45755,1953,,,"totalTestsViral",417048,149,10099,,,,,7842,"6/21/2020 20:30","2020-06-21T20:30:00Z","06/21 16:30",4260,10099,7842,"2020-06-21T20:30:00Z",417048,56339,359353,43802,3401,859,,,,,,,,,,,,,"09",40,0,45755,4330,45755,,9,0,"08e1b8de64778c4bf0a71d3d87a00fecfa2d3857",0,0,0,0,0,""
20200620,"CT",45715,1952,,,"totalTestsViral",412718,150,10099,,,,,7842,"6/19/2020 20:30","2020-06-19T20:30:00Z","06/19 16:30",4251,10099,7842,"2020-06-19T20:30:00Z",412718,56258,355105,43763,3394,857,,,,,,,,,,,,,"09",158,0,45715,6611,45715,,13,0,"a456764ab788a76e4ca8f6643c911b176b7ba7e2",0,0,0,0,0,""
20200619,"CT",45557,1947,,,"totalTestsViral",406107,172,10099,,,,,7842,"6/18/2020 20:30","2020-06-18T20:30:00Z","06/18 16:30",4238,10099,7842,"2020-06-18T20:30:00Z",406107,56110,348646,43610,3385,853,,,,,,,,,,,,,"09",117,0,45557,8866,45557,,12,0,"be3d342bfe32e3ac709de4cdb3440f2c75ea893c",0,0,0,0,0,""
20200618,"CT",45440,1947,,,"totalTestsViral",397241,176,10099,,,,,7842,"6/17/2020 20:30","2020-06-17T20:30:00Z","06/17 16:30",4226,10099,7842,"2020-06-17T20:30:00Z",397241,55939,339957,43493,3378,848,,,,,,,,,,,,,"09",11,0,45440,10184,45440,,7,187,"067aa5ba1f3a4702a1218c3524c81a7b1a68520f",0,0,0,0,0,""
20200617,"CT",45429,1942,,,"totalTestsViral",387057,186,9912,,,,,7611,"6/17/2020 16:00","2020-06-17T16:00:00Z","06/17 12:00",4219,9912,7611,"2020-06-17T16:00:00Z",387057,55715,330006,43487,3373,846,,,,,,,,,,,,,"09",80,0,45429,9880,45429,,9,0,"e3c4594300eec64e7eb222227967ca25cc90608c",0,0,0,0,0,""
20200616,"CT",45349,1934,,,"totalTestsViral",377177,201,9912,,,,,7611,"6/16/2020 20:30","2020-06-16T20:30:00Z","06/16 16:30",4210,9912,7611,"2020-06-16T20:30:00Z",377177,55547,320305,43415,3362,848,,,,,,,,,,,,,"09",114,0,45349,8952,45349,,6,0,"7fa41abb4e3ffdae64d52e0fb8dd40186c06a9e8",0,0,0,0,0,""
20200615,"CT",45235,1932,,,"totalTestsViral",368225,203,9912,,,,,7611,"6/14/2020 20:30","2020-06-14T20:30:00Z","06/14 16:30",4204,9912,7611,"2020-06-14T20:30:00Z",368225,55351,311560,43303,3356,848,,,,,,,,,,,,,"09",147,0,45235,2393,45235,,3,0,"e336cf2d4a056f6d8e78681e5bfc4654587ca338",0,0,0,0,0,""
20200614,"CT",45088,1916,,,"totalTestsViral",365832,205,9912,,,,,7611,"6/14/2020 16:00","2020-06-14T16:00:00Z","06/14 12:00",4201,9912,7611,"2020-06-14T16:00:00Z",365832,55289,309232,43172,3355,846,,,,,,,,,,,,,"09",94,0,45088,3008,45088,,15,0,"39ed258e95e0a5a0fa1c97f47f9fc06a28b7bcec",0,0,0,0,0,""
20200613,"CT",44994,1916,,,"totalTestsViral",362824,233,9912,,,,,7611,"6/12/2020 20:30","2020-06-12T20:30:00Z","06/12 16:30",4186,9912,7611,"2020-06-12T20:30:00Z",362824,55208,306308,43078,3342,844,,,,,,,,,,,,,"09",305,0,44994,6507,44994,,27,0,"931e270e6a52dda7ff6cd01f12466d7dbeb0fb54",0,0,0,0,0,""
20200612,"CT",44689,1901,,,"totalTestsViral",356317,244,9912,,,,,7611,"6/11/2020 20:30","2020-06-11T20:30:00Z","06/11 16:30",4159,9912,7611,"2020-06-11T20:30:00Z",356317,55046,299978,42788,3321,838,,,,,,,,,,,,,"09",228,0,44689,7263,44689,,13,0,"07b97f75d591f045bc17f06383b618ddb753307f",0,0,0,0,0,""
20200611,"CT",44461,1904,,,"totalTestsViral",349054,246,9912,,,,,7611,"6/10/2020 20:30","2020-06-10T20:30:00Z","06/10 16:30",4146,9912,7611,"2020-06-10T20:30:00Z",349054,54789,292985,42557,3308,838,,,,,,,,,,,,,"09",114,0,44461,9282,44461,,26,243,"e99602096fa41642669370bc89de80be7c9d5c26",0,0,0,0,0,""
20200610,"CT",44347,1899,,,"totalTestsViral",339772,270,9669,,,,,7284,"6/9/2020 20:30","2020-06-09T20:30:00Z","06/09 16:30",4120,9669,7284,"2020-06-09T20:30:00Z",339772,54383,284142,42448,3283,837,,,,,,,,,,,,,"09",168,0,44347,8404,44347,,23,0,"49b0c3ba7af196da09596a6ee20686a6ba91672a",0,0,0,0,0,""
20200609,"CT",44179,1997,,,"totalTestsViral",331368,293,9669,,,,,7284,"6/8/2020 20:30","2020-06-08T20:30:00Z","06/08 16:30",4097,9669,7284,"2020-06-08T20:30:00Z",331368,54087,276052,42182,3266,831,,,,,,,,,,,,,"09",87,0,44179,8796,44179,,13,0,"5b1396b886cc4f1ff4549432e22a3e88c06b0199",0,0,0,0,0,""
20200608,"CT",44092,2075,,,"totalTestsViral",322572,324,9669,,,,,7284,"6/7/2020 20:30","2020-06-07T20:30:00Z","06/07 16:30",4084,9669,7284,"2020-06-07T20:30:00Z",322572,53713,267646,42017,3239,845,,,,,,,,,,,,,"09",124,0,44092,2422,44092,,13,0,"47f28f0eb33ad9b1935e4ce2c55e89833523407c",0,0,0,0,0,""
20200607,"CT",43968,2073,,,"totalTestsViral",320150,333,9669,,,,,7284,"6/6/2020 20:30","2020-06-06T20:30:00Z","06/06 16:30",4071,9669,7284,"2020-06-06T20:30:00Z",320150,53631,265311,41895,3229,842,,,,,,,,,,,,,"09",150,0,43968,3595,43968,,16,0,"b06e44698d6723727dfbf960e1da8696d26fb2bc",0,0,0,0,0,""
20200606,"CT",43818,2075,,,"totalTestsViral",316555,333,9669,,,,,7284,"6/5/2020 20:30","2020-06-05T20:30:00Z","06/05 16:30",4055,9669,7284,"2020-06-05T20:30:00Z",316555,53510,261844,41743,3218,837,,,,,,,,,,,,,"09",358,0,43818,8040,43818,,17,0,"46c37940d5570e5bd4c48489901307916f9e5449",0,0,0,0,0,""
20200605,"CT",43460,2073,,,"totalTestsViral",308515,350,9669,,,,,7284,"6/4/2020 20:30","2020-06-04T20:30:00Z","06/04 16:30",4038,9669,7284,"2020-06-04T20:30:00Z",308515,53248,254075,41387,3196,842,,,,,,,,,,,,,"09",221,0,43460,8276,43460,,31,0,"9ac25c9f27fe97845d2d0b61a115ff8e0c05533d",0,0,0,0,0,""
20200604,"CT",43239,2068,,,"totalTestsViral",300239,373,9669,,,,,7284,"6/4/2020 16:00","2020-06-04T16:00:00Z","06/04 12:00",4007,9669,7284,"2020-06-04T16:00:00Z",300239,52864,246207,41171,3171,836,,,,,,,,,,,,,"09",148,0,43239,7608,43239,,18,-4124,"a07664f83fa385d766cea6bb6e98caed8b66c0fe",0,0,0,0,0,""
20200603,"CT",43091,2040,,,"totalTestsViral",292631,406,13793,,,,,7511,"6/2/2020 20:30","2020-06-02T20:30:00Z","06/02 16:30",3989,13793,7511,"2020-06-02T20:30:00Z",292631,52525,238958,41051,3156,833,,,,,,,,,,,,,"09",112,0,43091,7563,43091,,17,0,"030608fa0dff1276c25dc6396ab25b053d67e502",0,0,0,0,0,""
20200602,"CT",42979,2038,,,"totalTestsViral",285068,434,13793,,,,,7511,"6/1/2020 20:30","2020-06-01T20:30:00Z","06/01 16:30",3972,13793,7511,"2020-06-01T20:30:00Z",285068,52099,231839,40941,3139,833,,,,,,,,,,,,,"09",236,0,42979,8225,42979,,8,0,"79de0065d44a25cd1e63554df9e91376bedc456e",0,0,0,0,0,""
20200601,"CT",42743,2073,,,"totalTestsViral",276843,454,13793,,,,,7511,"5/31/2020 20:30","2020-05-31T20:30:00Z","05/31 16:30",3964,13793,7511,"2020-05-31T20:30:00Z",276843,51616,224128,40670,3110,854,,,,,,,,,,,,,"09",542,0,42743,2489,42743,,20,1255,"e6f45abf137de4ae339bd339dc37efca54cfcb93",0,0,0,0,0,""
20200531,"CT",42201,,,,"totalTestsViral",274354,481,12538,,,,,7127,"5/30/2020 20:30","2020-05-30T20:30:00Z","05/30 16:30",3944,12538,7127,"2020-05-30T20:30:00Z",274354,51503,221755,,,,,,,,,,,,,,,,"09",179,0,42201,3746,42201,,32,0,"69701f97983828b514cf5eac352d162b79ef4bfa",0,0,0,0,0,""
20200530,"CT",42022,,,,"totalTestsViral",270608,533,12538,,,,,7127,"5/29/2020 20:30","2020-05-29T20:30:00Z","05/29 16:30",3912,12538,7127,"2020-05-29T20:30:00Z",270608,51296,218226,,,,,,,,,,,,,,,,"09",260,0,42022,7453,42022,,44,0,"b040c67f9e6e38fbff4ed2d340b0435491c0a7d8",0,0,0,0,0,""
20200529,"CT",41762,,,,"totalTestsViral",263155,577,12538,,,,,7127,"5/28/2020 20:30","2020-05-28T20:30:00Z","05/28 16:30",3868,12538,7127,"2020-05-28T20:30:00Z",263155,50951,211142,,,,,,,,,,,,,,,,"09",203,0,41762,8348,41762,,42,0,"30286b44ca57775a616fea78098ce19264234da4",0,0,0,0,0,""
20200528,"CT",41559,,,,"totalTestsViral",254807,648,12538,,,,,7127,"5/27/2020 20:30","2020-05-27T20:30:00Z","05/27 16:30",3826,12538,7127,"2020-05-27T20:30:00Z",254807,50506,203269,,,,,,,,,,,,,,,,"09",271,0,41559,8584,41559,,23,0,"12d8c836b21a316f4cada7b9d7b15e07b7f1ac4d",0,0,0,0,0,""
20200527,"CT",41288,,,,"totalTestsViral",246223,684,12538,,,,,7127,"5/25/2020 20:30","2020-05-25T20:30:00Z","05/25 16:30",3803,12538,7127,"2020-05-25T20:30:00Z",246223,49879,195342,,,,,,,,,,,,,,,,"09",-15,0,41288,9022,41288,,34,0,"9a7141a8225c181019d053ae27c7a82b9506be73",0,0,0,0,0,""
20200526,"CT",41303,,,,"totalTestsViral",237201,694,12538,,,,,7127,"5/25/2020 20:30","2020-05-25T20:30:00Z","05/25 16:30",3769,12538,7127,"2020-05-25T20:30:00Z",237201,49235,187001,,,,,,,,,,,,,,,,"09",430,0,41303,2255,41303,,27,0,"b272754a6df444a214648338cdf6e8152711ae53",0,0,0,0,0,""
20200525,"CT",40873,,,,"totalTestsViral",234946,706,12538,,,,,7127,"5/24/2020 20:30","2020-05-24T20:30:00Z","05/24 16:30",3742,12538,7127,"2020-05-24T20:30:00Z",234946,49091,184895,,,,,,,,,,,,,,,,"09",405,0,40873,2570,40873,,49,0,"a2785c9c7b39ccb0729b312d713a126d8a600a1b",0,0,0,0,0,""
20200524,"CT",40468,,,,"totalTestsViral",232376,701,12538,,,,,7127,"5/23/2020 20:30","2020-05-23T20:30:00Z","05/23 16:30",3693,12538,7127,"2020-05-23T20:30:00Z",232376,48905,182515,,,,,,,,,,,,,,,,"09",446,0,40468,3400,40468,,18,0,"39bbbe519860a1c698796de523e0d2ef667ce09e",0,0,0,0,0,""
20200523,"CT",40022,,,,"totalTestsViral",228976,724,12538,,,,,7127,"5/22/2020 20:30","2020-05-22T20:30:00Z","05/22 16:30",3675,12538,7127,"2020-05-22T20:30:00Z",228976,48689,179333,,,,,,,,,,,,,,,,"09",382,0,40022,7225,40022,,38,0,"b9deb3722c9e369f930b6b59505af1dfd9e9c6b8",0,0,0,0,0,""
20200522,"CT",39640,,,,"totalTestsViral",221751,740,12538,,,,,7127,"5/21/2020 20:30","2020-05-21T20:30:00Z","05/21 16:30",3637,12538,7127,"2020-05-21T20:30:00Z",221751,48200,172616,,,,,,,,,,,,,,,,"09",432,0,39640,7306,39640,,55,1592,"69b424d7be65d1b6620f8fbd7bdc3dbb9cc8ce87",0,0,0,0,0,""
20200521,"CT",39208,,,,"totalTestsViral",214445,816,10946,,,,,6264,"5/20/2020 08:30","2020-05-20T08:30:00Z","05/20 04:30",3582,10946,6264,"2020-05-20T08:30:00Z",214445,47621,165919,,,,,,,,,,,,,,,,"09",191,0,39208,7065,39208,,53,0,"61dba99c69749bb4dc738425e71d955bb5951e99",0,0,0,0,0,""
20200520,"CT",39017,,,,"totalTestsViral",207380,887,10946,,,,,6264,"5/20/2020 16:00","2020-05-20T16:00:00Z","05/20 12:00",3529,10946,6264,"2020-05-20T16:00:00Z",207380,46903,159595,,,,,,,,,,,,,,,,"09",587,0,39017,6915,39017,,57,0,"b13f7cbedb9160aa000ae2c77b83726853a79819",0,0,0,0,0,""
20200519,"CT",38430,,,,"totalTestsViral",200465,914,10946,,,,,6264,"5/18/2020 19:00","2020-05-18T19:00:00Z","05/18 15:00",3472,10946,6264,"2020-05-18T19:00:00Z",200465,46117,153485,,,,,,,,,,,,,,,,"09",314,0,38430,6844,38430,,23,0,"d7566c63d632ac668ab7f65a7a9de1c0aa20c2a8",0,0,0,0,0,""
20200518,"CT",38116,,,,"totalTestsViral",193621,920,10946,,,,,6264,"5/17/2020 20:30","2020-05-17T20:30:00Z","05/17 16:30",3449,10946,6264,"2020-05-17T20:30:00Z",193621,45404,147382,,,,,,,,,,,,,,,,"09",697,0,38116,2682,38116,,41,0,"18448333eb7b06e8a6b92e3ee57a4853194eedec",0,0,0,0,0,""
20200517,"CT",37419,,,,"totalTestsViral",190939,937,10946,,,,,6264,"5/16/2020 20:30","2020-05-16T20:30:00Z","05/16 16:30",3408,10946,6264,"2020-05-16T20:30:00Z",190939,45178,144932,,,,,,,,,,,,,,,,"09",716,0,37419,3717,37419,,69,0,"88bf45614db79bd0b4156d049e51dd3084263b35",0,0,0,0,0,""
20200516,"CT",36703,,,,"totalTestsViral",187222,994,10946,,,,,6264,"5/15/2020 20:15","2020-05-15T20:15:00Z","05/15 16:15",3339,10946,6264,"2020-05-15T20:15:00Z",187222,44870,141531,,,,,,,,,,,,,,,,"09",618,0,36703,7511,36703,,54,0,"822237e312a9b1d85202f5315d44eda740e4fd84",0,0,0,0,0,""
20200515,"CT",36085,,,,"totalTestsViral",179711,1033,10946,,,,,6264,"5/14/2020 20:30","2020-05-14T20:30:00Z","05/14 16:30",3285,10946,6264,"2020-05-14T20:30:00Z",179711,44229,134696,,,,,,,,,,,,,,,,"09",621,0,36085,7701,36085,,66,0,"1e0930d1eeb1f033b87b43b117bc28ebc254f10c",0,0,0,0,0,""
20200514,"CT",35464,,,,"totalTestsViral",172010,1103,10946,,,,,6264,"5/13/2020 20:30","2020-05-13T20:30:00Z","05/13 16:30",3219,10946,6264,"2020-05-13T20:30:00Z",172010,43430,127833,,,,,,,,,,,,,,,,"09",609,0,35464,7650,35464,,94,1557,"b89677495e97e4f06a22806bcb3de75e18d213fb",0,0,0,0,0,""
20200513,"CT",34855,,,,"totalTestsViral",164360,1158,9389,,,,,5413,"5/13/2020 14:00","2020-05-13T14:00:00Z","05/13 10:00",3125,9389,5413,"2020-05-13T14:00:00Z",164360,42499,121139,,,,,,,,,,,,,,,,"09",522,0,34855,8181,34855,,84,0,"90ae87df0f790ba0fb6b880575fda19f9bcb5be1",0,0,0,0,0,""
20200512,"CT",34333,,,,"totalTestsViral",156179,1189,9389,,,,,5413,"5/12/2020 14:00","2020-05-12T14:00:00Z","05/12 10:00",3041,9389,5413,"2020-05-12T14:00:00Z",156179,41688,113793,,,,,,,,,,,,,,,,"09",568,0,34333,6097,34333,,33,0,"6244e12df6870ef57bcccd3aa47fbe5f348ae8a4",0,0,0,0,0,""
20200511,"CT",33765,,,,"totalTestsViral",150082,1212,9389,,,,,5413,"5/11/2020 14:00","2020-05-11T14:00:00Z","05/11 10:00",3008,9389,5413,"2020-05-11T14:00:00Z",150082,40809,108620,,,,,,,,,,,,,,,,"09",211,0,33765,2286,33765,,41,0,"3fc56b3710df525c450be628387a4cb2ebf39784",0,0,0,0,0,""
20200510,"CT",33554,,,,"totalTestsViral",147796,1242,9389,,,,,5413,"5/10/2020 14:00","2020-05-10T14:00:00Z","05/10 10:00",2967,9389,5413,"2020-05-10T14:00:00Z",147796,40518,106634,,,,,,,,,,,,,,,,"09",570,0,33554,2908,33554,,35,0,"12fb095e2519c1b3516967ce03868311e02931e9",0,0,0,0,0,""
20200509,"CT",32984,,,,"totalTestsViral",144888,1301,9389,,,,,5413,"5/9/2020 14:00","2020-05-09T14:00:00Z","05/09 10:00",2932,9389,5413,"2020-05-09T14:00:00Z",144888,40162,104090,,,,,,,,,,,,,,,,"09",573,0,32984,6072,32984,,58,0,"912c9850f1d21f26dbb75468a9d77d7fb2894126",0,0,0,0,0,""
20200508,"CT",32411,,,,"totalTestsViral",138816,1327,9389,,,,,5413,"5/7/2020 20:30","2020-05-07T20:30:00Z","05/07 16:30",2874,9389,5413,"2020-05-07T20:30:00Z",138816,39412,98806,,,,,,,,,,,,,,,,"09",627,0,32411,4519,32411,,77,0,"d311f555f5a2bf092cfab1d8e2ba16ebe8eb80d7",0,0,0,0,0,""
20200507,"CT",31784,,,,"totalTestsViral",134297,1385,9389,,,,,5413,"5/6/2020 20:30","2020-05-06T20:30:00Z","05/06 16:30",2797,9389,5413,"2020-05-06T20:30:00Z",134297,38617,95117,,,,,,,,,,,,,,,,"09",789,0,31784,4276,31784,,79,1631,"8900bdbc539d6ff0313848656a220e87bd3c81a3",0,0,0,0,0,""
20200506,"CT",30995,,,,"totalTestsViral",130021,1445,7758,,,,,4346,"5/5/2020 20:30","2020-05-05T20:30:00Z","05/05 16:30",2718,7758,4346,"2020-05-05T20:30:00Z",130021,37937,91552,,,,,,,,,,,,,,,,"09",374,0,30995,4812,30995,,85,0,"b52a16b788bc4e73c67d0663f48d525b8b2bc685",0,0,0,0,0,""
20200505,"CT",30621,,,,"totalTestsViral",125209,1500,7758,,,,,4346,"5/4/2020 16:00","2020-05-04T16:00:00Z","05/04 12:00",2633,7758,4346,"2020-05-04T16:00:00Z",125209,37055,87665,,,,,,,,,,,,,,,,"09",1334,0,30621,4363,30621,,138,0,"6cf0bf4971ea49ff6ceb5ca42f285218dc08b608",0,0,0,0,0,""
20200504,"CT",29287,,,,"totalTestsViral",120846,1488,7758,,,,,4346,"5/3/2020 16:00","2020-05-03T16:00:00Z","05/03 12:00",2495,7758,4346,"2020-05-03T16:00:00Z",120846,36195,84199,,,,,,,,,,,,,,,,"09",0,0,29287,2333,29287,,59,0,"6795feeb41fadb09cfca7cce732ec893a8566a66",0,0,0,0,0,""
20200503,"CT",29287,,,,"totalTestsViral",118513,1551,7758,,,,,4346,"5/2/2020 18:00","2020-05-02T18:00:00Z","05/02 14:00",2436,7758,4346,"2020-05-02T18:00:00Z",118513,35758,82322,,,,,,,,,,,,,,,,"09",523,0,29287,3188,29287,,97,0,"b144ba53aef2e8f8093ccc9a777d9ee1b02230f0",0,0,0,0,0,""
20200502,"CT",28764,,,,"totalTestsViral",115325,1592,7758,,,,,4346,"5/1/2020 12:00","2020-05-01T12:00:00Z","05/01 08:00",2339,7758,4346,"2020-05-01T12:00:00Z",115325,35188,79731,,,,,,,,,,,,,,,,"09",0,0,28764,4028,28764,,0,0,"3e3cf866a202e513eca74d20050ef38b5a9437f8",0,0,0,0,0,""
20200501,"CT",28764,,,,"totalTestsViral",111297,1592,7758,,,,,4346,"5/1/2020 12:00","2020-05-01T12:00:00Z","05/01 08:00",2339,7758,4346,"2020-05-01T12:00:00Z",111297,34308,76615,,,,,,,,,,,,,,,,"09",1064,0,28764,3561,28764,,82,7758,"5d61e6bb0a612fb43818a47f0622b3b07df9ff53",0,0,0,0,0,""
20200430,"CT",27700,,,,"totalTestsViral",107736,1650,,,,,,,"4/30/2020 16:00","2020-04-30T16:00:00Z","04/30 12:00",2257,,,"2020-04-30T16:00:00Z",107736,33527,73867,,,,,,,,,,,,,,,,"09",933,0,27700,4706,27700,,89,0,"3e36ffec2bc7abf2937b1675ee5a6218fd07ca69",0,0,0,0,0,""
20200429,"CT",26767,,,,"totalTestsViral",103030,1691,,,,,,,"4/29/2020 16:00","2020-04-29T16:00:00Z","04/29 12:00",2168,,,"2020-04-29T16:00:00Z",103030,32538,70195,,,,,,,,,,,,,,,,"09",455,0,26767,3849,26767,,79,0,"22bae6e6c967ea9dd54b49b5d63c69ce179852f1",0,0,0,0,0,""
20200428,"CT",26312,,,,"totalTestsViral",99181,1732,,,,,,,"4/28/2020 16:00","2020-04-28T16:00:00Z","04/28 12:00",2089,,,"2020-04-28T16:00:00Z",99181,31659,67264,,,,,,,,,,,,,,,,"09",1043,0,26312,4402,26312,,91,0,"534faaec435c7b9e24650b2d68affb2a75fe0632",0,0,0,0,0,""
20200427,"CT",25269,,,,"totalTestsViral",94779,1758,,,,,,,"4/27/2020 16:27","2020-04-27T16:27:00Z","04/27 12:27",1998,,,"2020-04-27T16:27:00Z",94779,30635,63926,,,,,,,,,,,,,,,,"09",0,0,25269,1890,25269,,74,0,"6e7bd25c792bfdca69ce9cef569b4352e36c2743",0,0,0,0,0,""
20200426,"CT",25269,,,,"totalTestsViral",92889,1766,,,,,,,"4/26/2020 16:00","2020-04-26T16:00:00Z","04/26 12:00",1924,,,"2020-04-26T16:00:00Z",92889,30218,62460,,,,,,,,,,,,,,,,"09",687,0,25269,2481,25269,,62,0,"37b94b328bad3f5d48949c769448ad763e891fc4",0,0,0,0,0,""
20200425,"CT",24582,,,,"totalTestsViral",90408,1810,,,,,,,"4/25/2020 16:00","2020-04-25T16:00:00Z","04/25 12:00",1862,,,"2020-04-25T16:00:00Z",90408,29598,60618,,,,,,,,,,,,,,,,"09",661,0,24582,4336,24582,,98,0,"3a453851437e5989c8f03df8a3614ea230bf14dc",0,0,0,0,0,""
20200424,"CT",23921,,,,"totalTestsViral",86072,1877,,,,,,,"4/24/2020 16:00","2020-04-24T16:00:00Z","04/24 12:00",1764,,,"2020-04-24T16:00:00Z",86072,28660,57245,,,,,,,,,,,,,,,,"09",821,0,23921,4061,23921,,125,0,"fecf3a75d71f2b45e66d27533b4d707b7b8a26bf",0,0,0,0,0,""
20200423,"CT",23100,,,,"totalTestsViral",82011,1947,,,,,,,"4/23/2020 16:00","2020-04-23T16:00:00Z","04/23 12:00",1639,,,"2020-04-23T16:00:00Z",82011,27670,54198,,,,,,,,,,,,,,,,"09",631,0,23100,4009,23100,,95,0,"6bc0ac8dff97ccedee38da126981b12cfe7c2e27",0,0,0,0,0,""
20200422,"CT",22469,,,,"totalTestsViral",78002,1972,,,,,,,"4/22/2020 16:00","2020-04-22T16:00:00Z","04/22 12:00",1544,,,"2020-04-22T16:00:00Z",78002,26617,51267,,,,,,,,,,,,,,,,"09",2109,0,22469,3024,22469,,121,0,"93c788432383eda194a2a466f4fd67ccbe559874",0,0,0,0,0,""
20200421,"CT",20360,,,,"totalTestsViral",74978,1949,,,,,,,"4/21/2020 00:00","2020-04-21T00:00:00Z","04/20 20:00",1423,,,"2020-04-21T00:00:00Z",74978,25660,49221,,,,,,,,,,,,,,,,"09",545,0,20360,3493,20360,,92,0,"50950705dca5bb042c7707b36586c37e7f15d87a",0,0,0,0,0,""
20200420,"CT",19815,,,,"totalTestsViral",71485,1919,,,,,,,"4/20/2020 16:00","2020-04-20T16:00:00Z","04/20 12:00",1331,,,"2020-04-20T16:00:00Z",71485,24500,46901,,,,,,,,,,,,,,,,"09",2265,0,19815,1594,19815,,245,0,"6bdfcaaab7d414db0c6dbead0864efc2ea18b9e0",0,0,0,0,0,""
20200419,"CT",17550,,,,"totalTestsViral",69891,1938,,,,,,,"4/19/2020 17:00","2020-04-19T17:00:00Z","04/19 13:00",1086,,,"2020-04-19T17:00:00Z",69891,24060,45754,,,,,,,,,,,,,,,,"09",741,0,17550,2227,17550,,50,0,"e7bc1449a926cefaecfa640af65c48550734e0b8",0,0,0,0,0,""
20200418,"CT",16809,,,,"totalTestsViral",67664,1946,,,,,,,"4/17/2020 16:00","2020-04-17T16:00:00Z","04/17 12:00",1036,,,"2020-04-17T16:00:00Z",67664,23466,44127,,,,,,,,,,,,,,,,"09",0,0,16809,3698,16809,,0,0,"6e945cf21aa9abfcf299d4746d41dd798258ffdd",0,0,0,0,0,""
20200417,"CT",16809,,,,"totalTestsViral",63966,1946,,,,,,,"4/17/2020 16:00","2020-04-17T16:00:00Z","04/17 12:00",1036,,,"2020-04-17T16:00:00Z",63966,22343,41564,,,,,,,,,,,,,,,,"09",925,0,16809,3167,16809,,65,0,"9ee49878fbf1a90ad8bd8c480eb4fed124f3a990",0,0,0,0,0,""
20200416,"CT",15884,,,,"totalTestsViral",60799,1926,,,,,,,"4/16/2020 16:30","2020-04-16T16:30:00Z","04/16 12:30",971,,,"2020-04-16T16:30:00Z",60799,21265,39483,,,,,,,,,,,,,,,,"09",1129,0,15884,3110,15884,,103,0,"5eea55b1cf2b7819169cc331b6a934728d32eea9",0,0,0,0,0,""
20200415,"CT",14755,,,,"totalTestsViral",57689,1908,,,,,,,"4/15/2020 16:00","2020-04-15T16:00:00Z","04/15 12:00",868,,,"2020-04-15T16:00:00Z",57689,20068,37576,,,,,,,,,,,,,,,,"09",766,0,14755,3658,14755,,197,0,"d0f42e53fbc516d89a0c2a48be825df60a713fae",0,0,0,0,0,""
20200414,"CT",13989,,,,"totalTestsViral",54031,1779,,,,,,,"4/14/2020 16:00","2020-04-14T16:00:00Z","04/14 12:00",671,,,"2020-04-14T16:00:00Z",54031,18750,35241,,,,,,,,,,,,,,,,"09",608,0,13989,1595,13989,,69,0,"7bf3b9a03715c345a7befdc81329a0f8691db93a",0,0,0,0,0,""
20200413,"CT",13381,,,,"totalTestsViral",52436,1760,,,,,,,"4/13/2020 16:00","2020-04-13T16:00:00Z","04/13 12:00",602,,,"2020-04-13T16:00:00Z",52436,18014,34384,,,,,,,,,,,,,,,,"09",1346,0,13381,1054,13381,,48,0,"83f0f4c666b65f080bfdd804aefb75d00ae32a64",0,0,0,0,0,""
20200412,"CT",12035,,,,"totalTestsViral",51382,1654,,,,,,,"4/12/2020 16:00","2020-04-12T16:00:00Z","04/12 12:00",554,,,"2020-04-12T16:00:00Z",51382,17602,33743,,,,,,,,,,,,,,,,"09",525,0,12035,1805,12035,,60,0,"56568f73cb522173e266e5705ada9799dcc9415b",0,0,0,0,0,""
20200411,"CT",11510,,,,"totalTestsViral",49577,1593,,,,,,,"4/11/2020 15:30","2020-04-11T15:30:00Z","04/11 11:30",494,,,"2020-04-11T15:30:00Z",49577,16908,32632,,,,,,,,,,,,,,,,"09",972,0,11510,2801,11510,,46,0,"0c900b1182b67d8558e244d1963b1d31969dcd7c",0,0,0,0,0,""
