"date","state","positive","probableCases","negative","pending","totalTestResultsSource","totalTestResults","hospitalizedCurrently","hospitalizedCumulative","inIcuCurrently","inIcuCumulative","onVentilatorCurrently","onVentilatorCumulative","recovered","lastUpdateEt","dateModified","checkTimeEt","death","hospitalized","hospitalizedDischarged","dateChecked","totalTestsViral","positiveTestsViral","negativeTestsViral","positiveCasesViral","deathConfirmed","deathProbable","totalTestEncountersViral","totalTestsPeopleViral","totalTestsAntibody","positiveTestsAntibody","negativeTestsAntibody","totalTestsPeopleAntibody","positiveTestsPeopleAntibody","negativeTestsPeopleAntibody","totalTestsPeopleAntigen","positiveTestsPeopleAntigen","totalTestsAntigen","positiveTestsAntigen","fips","positiveIncrease","negativeIncrease","total","totalTestResultsIncrease","posNeg","dataQualityGrade","deathIncrease","hospitalizedIncrease","hash","commercialScore","negativeRegularScore","negativeScore","positiveScore","score","grade"
20210307,"GU",7749,209,112887,,"posNeg",120636,2,,1,,1,,7590,"3/7/2021 01:45","2021-03-07T01:45:00Z","03/06 20:45",133,,,"2021-03-07T01:45:00Z",120426,,,7540,,,,,358,27,,,,,,,9299,248,"66",0,0,120636,0,120636,,0,0,"b6fe9a2c36aa6e5b1f0b14dd057d23c6968b10a4",0,0,0,0,0,""
20210306,"GU",7749,209,112887,,"posNeg",120636,2,,1,,1,,7590,"3/6/2021 04:30","2021-03-06T04:30:00Z","03/05 23:30",133,,,"2021-03-06T04:30:00Z",120426,,,7540,,,,,358,27,,,,,,,9299,248,"66",1,0,120636,1,120636,,0,0,"3cbff9634f41aa86b1d49747dfdfffa10dec13d1",0,0,0,0,0,""
20210305,"GU",7748,209,112887,,"posNeg",120635,2,,1,,1,,7590,"3/5/2021 05:15","2021-03-05T05:15:00Z","03/05 00:15",133,,,"2021-03-05T05:15:00Z",120426,,,7539,,,,,358,27,,,,,,,9299,248,"66",1,538,120635,539,120635,,2,0,"524583f9e978db31d34ee7f054a60d5ecb9725b9",0,0,0,0,0,""
20210304,"GU",7747,209,112349,,"posNeg",120096,5,,1,,1,,7590,"3/4/2021 04:00","2021-03-04T04:00:00Z","03/03 23:00",131,,,"2021-03-04T04:00:00Z",119887,,,7538,,,,,357,24,,,,,,,9262,248,"66",2,424,120096,426,120096,,0,0,"ba6670d27b205a453db70ed72732636f857d0a82",0,0,0,0,0,""
20210303,"GU",7745,209,111925,,"posNeg",119670,4,,1,,1,,7583,"3/3/2021 04:45","2021-03-03T04:45:00Z","03/02 23:45",131,,,"2021-03-03T04:45:00Z",119461,,,7536,,,,,356,24,,,,,,,9234,248,"66",3,378,119670,381,119670,,0,0,"806fc84c298b64d28a38ac7e3c73fd649048f14c",0,0,0,0,0,""
20210302,"GU",7742,209,111547,,"posNeg",119289,4,,2,,1,,7580,"3/2/2021 06:00","2021-03-02T06:00:00Z","03/02 01:00",131,,,"2021-03-02T06:00:00Z",119080,,,7533,,,,,356,24,,,,,,,9204,248,"66",5,1680,119289,1685,119289,,0,0,"00433d3eea8eff01a380277c5648ac3e76a49483",0,0,0,0,0,""
20210301,"GU",7737,209,109867,,"posNeg",117604,3,,2,,1,,7564,"3/1/2021 06:30","2021-03-01T06:30:00Z","03/01 01:30",131,,,"2021-03-01T06:30:00Z",117392,,,7528,,,,,352,24,,,,,,,9111,248,"66",1,0,117604,1,117604,,0,0,"059b1d6fbe9a26e51401758c6676c340ff0d67d9",0,0,0,0,0,""
20210228,"GU",7736,209,109867,,"posNeg",117603,4,,1,,1,,7564,"2/27/2021 22:45","2021-02-27T22:45:00Z","02/27 17:45",131,,,"2021-02-27T22:45:00Z",117392,,,7527,,,,,352,24,,,,,,,9111,248,"66",1,0,117603,1,117603,,0,0,"644a6aca832663004222caee635a99b8b792a9b8",0,0,0,0,0,""
20210227,"GU",7735,209,109867,,"posNeg",117602,4,,1,,1,,7564,"2/27/2021 03:30","2021-02-27T03:30:00Z","02/26 22:30",131,,,"2021-02-27T03:30:00Z",117392,,,7526,,,,,352,24,,,,,,,9111,248,"66",1,0,117602,1,117602,,1,0,"4e0af643c16ca89564ede65d1bb65955503552cb",0,0,0,0,0,""
20210226,"GU",7734,209,109867,,"posNeg",117601,4,,1,,1,,7564,"2/26/2021 04:30","2021-02-26T04:30:00Z","02/25 23:30",130,,,"2021-02-26T04:30:00Z",117392,,,7525,,,,,352,24,,,,,,,9111,248,"66",4,332,117601,336,117601,,0,0,"2ab8dace9367b39c401658d58d2bc9bd96e0cc06",0,0,0,0,0,""
20210225,"GU",7730,209,109535,,"posNeg",117265,4,,1,,1,,7559,"2/25/2021 04:00","2021-02-25T04:00:00Z","02/24 23:00",130,,,"2021-02-25T04:00:00Z",117056,,,7521,,,,,352,23,,,,,,,9085,248,"66",1,371,117265,372,117265,,0,0,"5061f22ebc2e070a4040f528a35a320df6732baf",0,0,0,0,0,""
20210224,"GU",7729,209,109164,,"posNeg",116893,6,,2,,2,,7555,"2/24/2021 04:00","2021-02-24T04:00:00Z","02/23 23:00",130,,,"2021-02-24T04:00:00Z",116684,,,7520,,,,,352,23,,,,,,,9047,248,"66",2,431,116893,433,116893,,0,0,"fd68d3f2f928e5e716b5671052a99c95e41c8ba5",0,0,0,0,0,""
20210223,"GU",7727,209,108733,,"posNeg",116460,4,,2,,2,,7555,"2/23/2021 03:45","2021-02-23T03:45:00Z","02/22 22:45",130,,,"2021-02-23T03:45:00Z",116251,,,7518,,,,,351,23,,,,,,,9034,248,"66",0,592,116460,592,116460,,0,0,"71288597bdb3d63a12b082e280283d40bbeef7d9",0,0,0,0,0,""
20210222,"GU",7727,209,108141,,"posNeg",115868,5,,2,,2,,7544,"2/22/2021 06:00","2021-02-22T06:00:00Z","02/22 01:00",130,,,"2021-02-22T06:00:00Z",115659,,,7518,,,,,351,23,,,,,,,9021,248,"66",7,1147,115868,1154,115868,,0,0,"cc2315ce3ca58dd1d614d47745addb5645eddc1b",0,0,0,0,0,""
20210221,"GU",7720,209,106994,,"posNeg",114714,5,,2,,2,,7528,"2/21/2021 05:30","2021-02-21T05:30:00Z","02/21 00:30",130,,,"2021-02-21T05:30:00Z",114500,,,7511,,,,,349,23,,,,,,,9003,248,"66",4,0,114714,4,114714,,0,0,"cf2a772b2a0f6c283f478144f38cd6b83d758dca",0,0,0,0,0,""
20210220,"GU",7716,209,106994,,"posNeg",114710,5,,2,,2,,7528,"2/20/2021 08:30","2021-02-20T08:30:00Z","02/20 03:30",130,,,"2021-02-20T08:30:00Z",114500,,,7507,,,,,349,23,,,,,,,9003,248,"66",1,0,114710,1,114710,,0,0,"69704ab04096cafba08e0e78050c6cfb4dc0662a",0,0,0,0,0,""
20210219,"GU",7715,209,106994,,"posNeg",114709,5,,2,,2,,7528,"2/19/2021 05:15","2021-02-19T05:15:00Z","02/19 00:15",130,,,"2021-02-19T05:15:00Z",114500,,,7506,,,,,349,23,,,,,,,9003,248,"66",10,373,114709,383,114709,,0,0,"8d5705660e6da200b7f16619443f944c5cc62c55",0,0,0,0,0,""
20210218,"GU",7705,208,106621,,"posNeg",114326,6,,2,,2,,7528,"2/18/2021 06:00","2021-02-18T06:00:00Z","02/18 01:00",130,,,"2021-02-18T06:00:00Z",114118,,,7497,,,,,349,23,,,,,,,8864,247,"66",2,390,114326,392,114326,,0,0,"09352ade5e5e44f06537b7752f23313426bbd367",0,0,0,0,0,""
20210217,"GU",7703,208,106231,,"posNeg",113934,4,,2,,2,,7523,"2/17/2021 04:15","2021-02-17T04:15:00Z","02/16 23:15",130,,,"2021-02-17T04:15:00Z",113726,,,7495,,,,,348,23,,,,,,,8853,247,"66",2,478,113934,480,113934,,0,0,"8e3e8a6532a36a0ba7a1f1935c7a3737afecb0d0",0,0,0,0,0,""
20210216,"GU",7701,208,105753,,"posNeg",113454,6,,2,,2,,7500,"2/16/2021 06:00","2021-02-16T06:00:00Z","02/16 01:00",130,,,"2021-02-16T06:00:00Z",113246,,,7493,,,,,348,23,,,,,,,8837,247,"66",2,537,113454,539,113454,,0,0,"7940727542cd92f9492576d4946c2db6ac229101",0,0,0,0,0,""
20210215,"GU",7699,208,105216,,"posNeg",112915,6,,3,,2,,7484,"2/15/2021 05:15","2021-02-15T05:15:00Z","02/15 00:15",130,,,"2021-02-15T05:15:00Z",112707,,,7491,,,,,347,23,,,,,,,8785,247,"66",4,677,112915,681,112915,,0,0,"288d49046aeb7ac75b7735e3342e6805a6ace355",0,0,0,0,0,""
20210214,"GU",7695,208,104539,,"posNeg",112234,6,,3,,2,,7472,"2/14/2021 06:00","2021-02-14T06:00:00Z","02/14 01:00",130,,,"2021-02-14T06:00:00Z",112020,,,7487,,,,,347,23,,,,,,,8727,247,"66",3,0,112234,3,112234,,0,0,"830e8a8675752127de7893bea5ecf89ae7171bb7",0,0,0,0,0,""
20210213,"GU",7692,208,104539,,"posNeg",112231,7,,4,,2,,7472,"2/13/2021 04:00","2021-02-13T04:00:00Z","02/12 23:00",130,,,"2021-02-13T04:00:00Z",112020,,,7484,,,,,347,23,,,,,,,8727,247,"66",3,0,112231,3,112231,,0,0,"f7f85ab0eda8e3ffe6d95c15d6cda093a8164149",0,0,0,0,0,""
20210212,"GU",7689,208,104539,,"posNeg",112228,8,,4,,4,,7472,"2/12/2021 06:00","2021-02-12T06:00:00Z","02/12 01:00",130,,,"2021-02-12T06:00:00Z",112020,,,7481,,,,,347,23,,,,,,,8727,247,"66",3,367,112228,370,112228,,0,0,"aa9691da6e8ff057f60f12a6830cb488cbf0fa46",0,0,0,0,0,""
20210211,"GU",7686,208,104172,,"posNeg",111858,10,,4,,4,,7467,"2/11/2021 05:45","2021-02-11T05:45:00Z","02/11 00:45",130,,,"2021-02-11T05:45:00Z",111650,,,7478,,,,,347,23,,,,,,,8674,246,"66",3,518,111858,521,111858,,0,0,"7baa66836aca22e4d37ac150b75dc339a7cd463c",0,0,0,0,0,""
20210210,"GU",7683,207,103654,,"posNeg",111337,10,,3,,3,,7460,"2/10/2021 05:30","2021-02-10T05:30:00Z","02/10 00:30",130,,,"2021-02-10T05:30:00Z",111130,,,7476,,,,,345,23,,,,,,,8661,246,"66",10,525,111337,535,111337,,0,0,"549aada6df3a2b7c6e69c60cb474b7a1e6daf6c9",0,0,0,0,0,""
20210209,"GU",7673,207,103129,,"posNeg",110802,8,,3,,3,,7451,"2/9/2021 07:15","2021-02-09T07:15:00Z","02/09 02:15",130,,,"2021-02-09T07:15:00Z",110595,,,7466,,,,,345,23,,,,,,,8518,246,"66",9,399,110802,408,110802,,0,0,"4e437dc725a28b24ad20557017229a8e97012bbb",0,0,0,0,0,""
20210208,"GU",7664,207,102730,,"posNeg",110394,9,,3,,3,,7431,"2/8/2021 07:15","2021-02-08T07:15:00Z","02/08 02:15",130,,,"2021-02-08T07:15:00Z",110187,,,7457,,,,,344,23,,,,,,,8506,246,"66",15,1178,110394,1193,110394,,0,0,"0f9d3eebfdc11f53c97bfdc613eb4fbb8d099619",0,0,0,0,0,""
20210207,"GU",7649,207,101552,,"posNeg",109201,9,,3,,2,,7416,"2/7/2021 08:00","2021-02-07T08:00:00Z","02/07 03:00",130,,,"2021-02-07T08:00:00Z",108981,,,7442,,,,,343,23,,,,,,,8392,246,"66",6,0,109201,6,109201,,1,0,"c0f7340d0209c9b23ca503e0b83e854dd5158729",0,0,0,0,0,""
20210206,"GU",7643,207,101552,,"posNeg",109195,8,,3,,2,,7416,"2/6/2021 05:15","2021-02-06T05:15:00Z","02/06 00:15",129,,,"2021-02-06T05:15:00Z",108981,,,7436,,,,,343,23,,,,,,,8392,246,"66",7,0,109195,7,109195,,0,0,"bceee0dfc364e5d838b46bde98a9eccaba5e6e29",0,0,0,0,0,""
20210205,"GU",7636,207,101552,,"posNeg",109188,6,,2,,2,,7416,"2/5/2021 06:00","2021-02-05T06:00:00Z","02/05 01:00",129,,,"2021-02-05T06:00:00Z",108981,,,7429,,,,,343,23,,,,,,,8392,246,"66",14,355,109188,369,109188,,0,0,"3ee1ab490e43e767b087727c47192306a898122d",0,0,0,0,0,""
20210204,"GU",7622,207,101197,,"posNeg",108819,5,,2,,2,,7410,"2/4/2021 03:30","2021-02-04T03:30:00Z","02/03 22:30",129,,,"2021-02-04T03:30:00Z",108612,,,7415,,,,,343,22,,,,,,,8333,270,"66",4,446,108819,450,108819,,0,0,"b33e94f3c6ad54f36f5317d9c0f40e3e44da68ae",0,0,0,0,0,""
20210203,"GU",7618,207,100751,,"posNeg",108369,6,,2,,2,,7407,"2/3/2021 03:45","2021-02-03T03:45:00Z","02/02 22:45",129,,,"2021-02-03T03:45:00Z",108162,,,7411,,,,,343,22,,,,,,,8321,270,"66",8,529,108369,537,108369,,0,0,"0c10e530a166ffb7899968f26423d8b36532bc7d",0,0,0,0,0,""
20210202,"GU",7610,207,100222,,"posNeg",107832,6,,2,,2,,7381,"2/2/2021 06:30","2021-02-02T06:30:00Z","02/02 01:30",129,,,"2021-02-02T06:30:00Z",107625,,,7403,,,,,343,22,,,,,,,8305,270,"66",2,458,107832,460,107832,,0,0,"160ec45db2509b9aac1511aca7513decfb08e9a7",0,0,0,0,0,""
20210201,"GU",7608,207,99764,,"posNeg",107372,6,,2,,2,,7377,"2/1/2021 07:00","2021-02-01T07:00:00Z","02/01 02:00",129,,,"2021-02-01T07:00:00Z",107165,,,7401,,,,,343,22,,,,,,,8240,270,"66",21,1221,107372,1242,107372,,0,0,"99912850df6384ff54ebb447af5697b1afc608c7",0,0,0,0,0,""
20210131,"GU",7587,207,98543,,"posNeg",106130,7,,2,,2,,7355,"1/31/2021 05:15","2021-01-31T05:15:00Z","01/31 00:15",129,,,"2021-01-31T05:15:00Z",105915,,,7380,,,,,340,22,,,,,,,8139,270,"66",1,0,106130,1,106130,,0,0,"960195c2eda301a6de15336578359c545b9dd288",0,0,0,0,0,""
20210130,"GU",7586,207,98543,,"posNeg",106129,8,,2,,2,,7355,"1/30/2021 07:30","2021-01-30T07:30:00Z","01/30 02:30",129,,,"2021-01-30T07:30:00Z",105915,,,7379,,,,,340,22,,,,,,,8139,270,"66",7,0,106129,7,106129,,0,0,"18d5ab6c2998a408544971437554ca5d24e0091f",0,0,0,0,0,""
20210129,"GU",7579,207,98543,,"posNeg",106122,8,,2,,2,,7355,"1/29/2021 06:15","2021-01-29T06:15:00Z","01/29 01:15",129,,,"2021-01-29T06:15:00Z",105915,,,7372,,,,,340,22,,,,,,,8139,270,"66",7,321,106122,328,106122,,0,0,"89f4fb07898ccc317f8e5b51c8c238cb1c453527",0,0,0,0,0,""
20210128,"GU",7572,207,98222,,"posNeg",105794,8,,2,,2,,7353,"1/28/2021 04:30","2021-01-28T04:30:00Z","01/27 23:30",129,,,"2021-01-28T04:30:00Z",105587,,,7365,,,,,340,22,,,,,,,8100,270,"66",4,403,105794,407,105794,,0,0,"e25112d5523a4935860cca5dd77cc154f885da05",0,0,0,0,0,""
20210127,"GU",7568,207,97819,,"posNeg",105387,9,,3,,2,,7351,"1/27/2021 06:45","2021-01-27T06:45:00Z","01/27 01:45",129,,,"2021-01-27T06:45:00Z",105180,,,7361,,,,,338,22,,,,,,,8087,270,"66",2,502,105387,504,105387,,0,0,"b7694d094e5958c6bdde7d9e706872e79e40b440",0,0,0,0,0,""
20210126,"GU",7566,207,97317,,"posNeg",104883,11,,2,,1,,7335,"1/26/2021 07:30","2021-01-26T07:30:00Z","01/26 02:30",129,,,"2021-01-26T07:30:00Z",104676,,,7359,,,,,338,22,,,,,,,8075,270,"66",12,544,104883,556,104883,,0,0,"a65d3f78a7b4dfb123d972bb5a25390810ce9e69",0,0,0,0,0,""
20210125,"GU",7554,207,96773,,"posNeg",104327,10,,2,,2,,7319,"1/25/2021 06:45","2021-01-25T06:45:00Z","01/25 01:45",129,,,"2021-01-25T06:45:00Z",104120,,,7347,,,,,338,22,,,,,,,8061,270,"66",7,1046,104327,1053,104327,,1,0,"f06322cde358ebcab091069271bb3f5ce3274966",0,0,0,0,0,""
20210124,"GU",7547,207,95727,,"posNeg",103274,11,,3,,3,,7293,"1/24/2021 07:00","2021-01-24T07:00:00Z","01/24 02:00",128,,,"2021-01-24T07:00:00Z",103067,,,7340,,,,,337,22,,,,,,,8012,270,"66",0,0,103274,0,103274,,0,0,"15307768c338ea8e91ef8e2912f34c33a130e2d0",0,0,0,0,0,""
20210123,"GU",7547,207,95727,,"posNeg",103274,9,,3,,3,,7293,"1/23/2021 07:30","2021-01-23T07:30:00Z","01/23 02:30",128,,,"2021-01-23T07:30:00Z",103067,,,7340,,,,,337,22,,,,,,,8012,270,"66",0,0,103274,0,103274,,0,0,"06dc8f8bb38db90b9283eed638bffeec774ed674",0,0,0,0,0,""
20210122,"GU",7547,207,95727,,"posNeg",103274,10,,3,,3,,7293,"1/22/2021 06:00","2021-01-22T06:00:00Z","01/22 01:00",128,,,"2021-01-22T06:00:00Z",103067,,,7340,,,,,337,22,,,,,,,8012,270,"66",19,322,103274,341,103274,,0,0,"692bdcca4ba130b11c378cc1692c7ce0ff8f2bc8",0,0,0,0,0,""
20210121,"GU",7528,207,95405,,"posNeg",102933,8,,3,,3,,7279,"1/21/2021 06:45","2021-01-21T06:45:00Z","01/21 01:45",128,,,"2021-01-21T06:45:00Z",102726,,,7321,,,,,337,22,,,,,,,7983,264,"66",7,614,102933,621,102933,,0,0,"0b138a59cb0d9f92f54c67e2005754cb53e0673b",0,0,0,0,0,""
20210120,"GU",7521,207,94791,,"posNeg",102312,9,,3,,3,,7274,"1/20/2021 03:45","2021-01-20T03:45:00Z","01/19 22:45",128,,,"2021-01-20T03:45:00Z",102105,,,7314,,,,,337,22,,,,,,,7960,264,"66",6,524,102312,530,102312,,0,0,"a64ba530ab957d0e7dc0e0ac64d9cd030644d668",0,0,0,0,0,""
20210119,"GU",7515,206,94267,,"posNeg",101782,8,,3,,3,,7251,"1/19/2021 08:30","2021-01-19T08:30:00Z","01/19 03:30",128,,,"2021-01-19T08:30:00Z",101576,,,7309,,,,,337,22,,,,,,,7924,264,"66",30,1274,101782,1304,101782,,0,0,"85ecd325043f08c7fbde77b7fc26357b9fa026e8",0,0,0,0,0,""
20210118,"GU",7485,198,92993,,"posNeg",100478,7,,3,,3,,7220,"1/18/2021 07:45","2021-01-18T07:45:00Z","01/18 02:45",128,,,"2021-01-18T07:45:00Z",100269,,,7287,,,,,337,22,,,,,,,7258,264,"66",1,0,100478,1,100478,,1,0,"64506cc228ad3ab5285ce0c852b2f3c11ee776fd",0,0,0,0,0,""
20210117,"GU",7484,198,92993,,"posNeg",100477,7,,4,,4,,7220,"1/17/2021 07:00","2021-01-17T07:00:00Z","01/17 02:00",127,,,"2021-01-17T07:00:00Z",100269,,,7286,,,,,337,22,,,,,,,7258,264,"66",3,0,100477,3,100477,,1,0,"f52370e3f9afde741f55d421416b3e70db6401b9",0,0,0,0,0,""
20210116,"GU",7481,198,92993,,"posNeg",100474,8,,5,,4,,7220,"1/16/2021 08:45","2021-01-16T08:45:00Z","01/16 03:45",126,,,"2021-01-16T08:45:00Z",100269,,,7283,,,,,337,19,,,,,,,7258,253,"66",7,0,100474,7,100474,,1,0,"d5c3e2c5fa30a730692fb83cc04038e58b4013da",0,0,0,0,0,""
20210115,"GU",7474,198,92993,,"posNeg",100467,6,,4,,3,,7220,"1/15/2021 04:45","2021-01-15T04:45:00Z","01/14 23:45",125,,,"2021-01-15T04:45:00Z",100269,,,7276,,,,,337,19,,,,,,,7258,253,"66",17,227,100467,244,100467,,1,0,"5b51040733d8495d7799bd98e357f4b402943d6d",0,0,0,0,0,""
20210114,"GU",7457,194,92766,,"posNeg",100223,6,,3,,3,,7218,"1/14/2021 07:15","2021-01-14T07:15:00Z","01/14 02:15",124,,,"2021-01-14T07:15:00Z",100029,,,7263,,,,,337,19,,,,,,,7058,253,"66",13,391,100223,404,100223,,0,0,"0ac96c579b33d36b08840107d433bc8d51e64797",0,0,0,0,0,""
20210113,"GU",7444,194,92375,,"posNeg",99819,7,,3,,3,,7208,"1/13/2021 05:00","2021-01-13T05:00:00Z","01/13 00:00",124,,,"2021-01-13T05:00:00Z",99625,,,7250,,,,,337,19,,,,,,,7013,253,"66",21,295,99819,316,99819,,0,0,"40d24d9dca3dc917b9d527c76ec8eb3919d2d27c",0,0,0,0,0,""
20210112,"GU",7423,190,92080,,"posNeg",99503,9,,4,,4,,7189,"1/12/2021 05:00","2021-01-12T05:00:00Z","01/12 00:00",124,,,"2021-01-12T05:00:00Z",99319,,,7239,,,,,337,19,,,,,,,6813,253,"66",0,343,99503,343,99503,,0,0,"47e09ba281d3feedb7b161cd4f0fdcd6f072fc33",0,0,0,0,0,""
20210111,"GU",7423,189,91737,,"posNeg",99160,9,,4,,4,,7164,"1/11/2021 08:20","2021-01-11T08:20:00Z","01/11 03:20",124,,,"2021-01-11T08:20:00Z",98971,,,7234,,,,,331,19,,,,,,,6552,253,"66",11,630,99160,641,99160,,0,0,"55bfa83e6117a1c02744a3452ac31a56722020ed",0,0,0,0,0,""
20210110,"GU",7412,186,91107,,"posNeg",98519,11,,4,,3,,7146,"1/10/2021 15:15","2021-01-10T15:15:00Z","01/10 10:15",124,,,"2021-01-10T15:15:00Z",98320,,,7226,,,,,331,19,,,,,,,6149,253,"66",8,0,98519,8,98519,,0,0,"ca76afe3d345cdac402870f370103aca51cfefc7",0,0,0,0,0,""
20210109,"GU",7404,186,91107,,"posNeg",98511,11,,4,,3,,7146,"1/9/2021 03:45","2021-01-09T03:45:00Z","01/08 22:45",124,,,"2021-01-09T03:45:00Z",98320,,,7218,,,,,331,19,,,,,,,6149,253,"66",5,0,98511,5,98511,,0,0,"01eb7ae8da13f0d7e92239f9b9a80fe108d898f7",0,0,0,0,0,""
20210108,"GU",7399,186,91107,,"posNeg",98506,10,,3,,2,,7146,"1/8/2021 08:15","2021-01-08T08:15:00Z","01/08 03:15",124,,,"2021-01-08T08:15:00Z",98320,,,7213,,,,,331,19,,,,,,,6149,253,"66",13,223,98506,236,98506,,0,0,"47a1bce92c55023758d2da3b564cbc77c9bd6ab8",0,0,0,0,0,""
20210107,"GU",7386,186,90884,,"posNeg",98270,12,,2,,1,,7145,"1/7/2021 05:15","2021-01-07T05:15:00Z","01/07 00:15",124,,,"2021-01-07T05:15:00Z",98084,,,7200,,,,,331,17,,,,,,,6135,243,"66",8,431,98270,439,98270,,1,0,"d7c707b0b4445a8ba8f2f52034dafe455e15a6f6",0,0,0,0,0,""
20210106,"GU",7378,186,90453,,"posNeg",97831,11,,3,,1,,7145,"1/6/2021 03:45","2021-01-06T03:45:00Z","01/05 22:45",123,,,"2021-01-06T03:45:00Z",97645,,,7192,,,,,329,17,,,,,,,6111,243,"66",21,307,97831,328,97831,,0,0,"b383522c99987bd2087bb86b1ea36f705bbf2550",0,0,0,0,0,""
20210105,"GU",7357,184,90146,,"posNeg",97503,10,,3,,2,,7132,"1/5/2021 03:30","2021-01-05T03:30:00Z","01/04 22:30",123,,,"2021-01-05T03:30:00Z",97319,,,7173,,,,,329,17,,,,,,,5883,243,"66",13,654,97503,667,97503,,0,0,"71978542f323e63132bae3a3bfccef6d402a7abd",0,0,0,0,0,""
20210104,"GU",7344,181,89492,,"posNeg",96836,8,,2,,2,,7089,"1/4/2021 03:45","2021-01-04T03:45:00Z","01/03 22:45",123,,,"2021-01-04T03:45:00Z",96655,,,7163,,,,,326,17,,,,,,,5739,243,"66",17,617,96836,634,96836,,0,0,"ef270c8111c8298e242b1db86fd48ec9671165c3",0,0,0,0,0,""
20210103,"GU",7327,178,88875,,"posNeg",96202,11,,2,,2,,7047,"1/3/2021 05:45","2021-01-03T05:45:00Z","01/03 00:45",123,,,"2021-01-03T05:45:00Z",96014,,,7149,,,,,325,17,,,,,,,5645,239,"66",1,0,96202,1,96202,,0,0,"c4a7a6da4ad5b7563cb9db8fcc4fea97d887da5b",0,0,0,0,0,""
20210102,"GU",7326,178,88875,,"posNeg",96201,13,,3,,2,,7047,"1/2/2021 06:30","2021-01-02T06:30:00Z","01/02 01:30",123,,,"2021-01-02T06:30:00Z",96014,,,7148,,,,,325,17,,,,,,,5645,239,"66",0,0,96201,0,96201,,1,0,"832cd90a68c1d23d7a4b9d086f7085d3cb59959a",0,0,0,0,0,""
20210101,"GU",7326,178,88875,,"posNeg",96201,13,,3,,2,,7047,"1/1/2021 06:45","2021-01-01T06:45:00Z","01/01 01:45",122,,,"2021-01-01T06:45:00Z",96014,,,7148,,,,,325,17,,,,,,,5645,239,"66",9,0,96201,9,96201,,0,0,"59b5521ecbfbf15a584463c3076a2b9ed8983768",0,0,0,0,0,""
20201231,"GU",7317,178,88875,,"posNeg",96192,14,,3,,2,,7047,"12/31/2020 05:15","2020-12-31T05:15:00Z","12/31 00:15",122,,,"2020-12-31T05:15:00Z",96014,,,7139,,,,,325,17,,,,,,,5645,239,"66",9,242,96192,251,96192,,1,0,"efd776c86d6740b11f7ca3521554484d7cf9fb2a",0,0,0,0,0,""
20201230,"GU",7308,179,88633,,"posNeg",95941,15,,3,,2,,7018,"12/30/2020 04:15","2020-12-30T04:15:00Z","12/29 23:15",121,,,"2020-12-30T04:15:00Z",95762,,,7129,,,,,323,17,,,,,,,5645,239,"66",15,257,95941,272,95941,,0,0,"e8d06570684891f159d87e9fa6e3a0bb7f26c03c",0,0,0,0,0,""
20201229,"GU",7293,179,88376,,"posNeg",95669,19,,4,,2,,6954,"12/29/2020 03:15","2020-12-29T03:15:00Z","12/28 22:15",121,,,"2020-12-29T03:15:00Z",95490,,,7114,,,,,323,17,,,,,,,5578,239,"66",12,344,95669,356,95669,,0,0,"6df255f5a5822949d074a056228b26d92f0ce63f",0,0,0,0,0,""
20201228,"GU",7281,179,88032,,"posNeg",95313,19,,5,,2,,6908,"12/28/2020 04:15","2020-12-28T04:15:00Z","12/27 23:15",121,,,"2020-12-28T04:15:00Z",95134,,,7102,,,,,323,17,,,,,,,5576,239,"66",11,616,95313,627,95313,,0,0,"192a05a6a3bd069ea5727c179bb85067f1f9b551",0,0,0,0,0,""
20201227,"GU",7270,175,87416,,"posNeg",94686,18,,7,,3,,6743,"12/27/2020 05:30","2020-12-27T05:30:00Z","12/27 00:30",121,,,"2020-12-27T05:30:00Z",94507,,,7095,,,,,321,17,,,,,,,5347,224,"66",1,0,94686,1,94686,,0,0,"28950690e1ffd5e9ca04b554c0085a4911252b85",0,0,0,0,0,""
20201226,"GU",7269,175,87416,,"posNeg",94685,18,,7,,3,,6743,"12/26/2020 07:15","2020-12-26T07:15:00Z","12/26 02:15",121,,,"2020-12-26T07:15:00Z",94507,,,7094,,,,,321,17,,,,,,,5347,224,"66",1,0,94685,1,94685,,0,0,"2f136b20080be1eaceeb789762d27d2fc36278f5",0,0,0,0,0,""
20201225,"GU",7268,175,87416,,"posNeg",94684,17,,7,,3,,6743,"12/25/2020 04:45","2020-12-25T04:45:00Z","12/24 23:45",121,,,"2020-12-25T04:45:00Z",94507,,,7093,,,,,321,17,,,,,,,5347,224,"66",2,0,94684,2,94684,,0,0,"86c589de00318bbd494bfe3df0b836003dd9aa0a",0,0,0,0,0,""
20201224,"GU",7266,175,87416,,"posNeg",94682,20,,7,,3,,6743,"12/23/2020 05:00","2020-12-23T05:00:00Z","12/23 00:00",121,,,"2020-12-23T05:00:00Z",94507,,,7091,,,,,321,17,,,,,,,5347,224,"66",9,191,94682,200,94682,,0,0,"89afbfd6b9079a329a93042cc2e445668b4b34e1",0,0,0,0,0,""
20201223,"GU",7257,173,87225,,"posNeg",94482,21,,7,,3,,6707,"12/23/2020 05:00","2020-12-23T05:00:00Z","12/23 00:00",121,,,"2020-12-23T05:00:00Z",94309,,,7084,,,,,321,17,,,,,,,5242,224,"66",19,421,94482,440,94482,,0,0,"2a503f487c70076c6c69e15d6ae84823f890c5b4",0,0,0,0,0,""
20201222,"GU",7238,172,86804,,"posNeg",94042,23,,8,,6,,6668,"12/22/2020 03:30","2020-12-22T03:30:00Z","12/21 22:30",121,,,"2020-12-22T03:30:00Z",93870,,,7066,,,,,321,17,,,,,,,5212,224,"66",27,448,94042,475,94042,,1,0,"b11118a401174265a4d94e84437d17bd8550dbc0",0,0,0,0,0,""
20201221,"GU",7211,170,86356,,"posNeg",93567,25,,7,,5,,6660,"12/21/2020 04:45","2020-12-21T04:45:00Z","12/20 23:45",120,,,"2020-12-21T04:45:00Z",93397,,,7041,,,,,321,17,,,,,,,4938,224,"66",9,808,93567,817,93567,,1,0,"ce22c6e4686b6a4134d337f7f4c6c2a8971e14d4",0,0,0,0,0,""
20201220,"GU",7202,167,85548,,"posNeg",92750,25,,8,,6,,6613,"12/20/2020 04:45","2020-12-20T04:45:00Z","12/19 23:45",119,,,"2020-12-20T04:45:00Z",92574,,,7035,,,,,321,17,,,,,,,4876,224,"66",4,0,92750,4,92750,,0,0,"0d21c61efa95dfa06da4af7aa794eec524889a4b",0,0,0,0,0,""
20201219,"GU",7198,167,85548,,"posNeg",92746,26,,8,,5,,6613,"12/19/2020 08:00","2020-12-19T08:00:00Z","12/19 03:00",119,,,"2020-12-19T08:00:00Z",92574,,,7031,,,,,321,17,,,,,,,4876,224,"66",5,0,92746,5,92746,,0,0,"0893f9262581fd8d9bb3885a54812170260a218e",0,0,0,0,0,""
20201218,"GU",7193,167,85548,,"posNeg",92741,25,,9,,5,,6613,"12/18/2020 05:45","2020-12-18T05:45:00Z","12/18 00:45",119,,,"2020-12-18T05:45:00Z",92574,,,7026,,,,,321,17,,,,,,,4876,224,"66",10,379,92741,389,92741,,0,0,"0ddc375cbf50653c26e212f116c9e575a905eb38",0,0,0,0,0,""
20201217,"GU",7183,166,85169,,"posNeg",92352,30,,9,,6,,6580,"12/17/2020 04:00","2020-12-17T04:00:00Z","12/16 23:00",119,,,"2020-12-17T04:00:00Z",92186,,,7017,,,,,321,17,,,,,,,4849,178,"66",15,422,92352,437,92352,,0,0,"55aad3e36043c3bf1fd09be58592badaad692ca6",0,0,0,0,0,""
20201216,"GU",7168,164,84747,,"posNeg",91915,28,,9,,5,,6513,"12/16/2020 04:45","2020-12-16T04:45:00Z","12/15 23:45",119,,,"2020-12-16T04:45:00Z",91751,,,7004,,,,,321,17,,,,,,,4761,178,"66",19,287,91915,306,91915,,0,0,"cda40e57872bab10410f3cd4561c5690a4be8047",0,0,0,0,0,""
20201215,"GU",7149,161,84460,,"posNeg",91609,28,,9,,5,,6511,"12/15/2020 04:30","2020-12-15T04:30:00Z","12/14 23:30",119,,,"2020-12-15T04:30:00Z",91448,,,6988,,,,,320,17,,,,,,,4745,178,"66",12,465,91609,477,91609,,0,0,"4ee65ab65479d4e7d2f0ee1900762ca6eeaef68d",0,0,0,0,0,""
20201214,"GU",7137,159,83995,,"posNeg",91132,25,,9,,5,,6492,"12/14/2020 05:30","2020-12-14T05:30:00Z","12/14 00:30",119,,,"2020-12-14T05:30:00Z",90973,,,6978,,,,,320,17,,,,,,,4736,178,"66",31,965,91132,996,91132,,1,0,"04fc90160894511b40805018397ac1f7f1743c93",0,0,0,0,0,""
20201213,"GU",7106,137,83030,,"posNeg",90136,29,,7,,5,,6413,"12/12/2020 04:15","2020-12-12T04:15:00Z","12/11 23:15",118,,,"2020-12-12T04:15:00Z",89972,,,6953,,,,,319,17,,,,,,,3484,178,"66",16,0,90136,16,90136,,1,0,"e37e23d414c4620cc61e8333a652e8f78f4f7261",0,0,0,0,0,""
20201212,"GU",7090,137,83030,,"posNeg",90120,33,,8,,7,,6413,"12/12/2020 04:15","2020-12-12T04:15:00Z","12/11 23:15",117,,,"2020-12-12T04:15:00Z",89972,,,6953,,,,,319,17,,,,,,,3484,178,"66",11,0,90120,11,90120,,2,0,"f5187bfba9928c40fc9f7b935bd861d2261dd63f",0,0,0,0,0,""
20201211,"GU",7079,137,83030,,"posNeg",90109,36,,10,,7,,6413,"12/11/2020 09:05","2020-12-11T09:05:00Z","12/11 04:05",115,,,"2020-12-11T09:05:00Z",89972,,,6942,,,,,319,17,,,,,,,3484,178,"66",27,388,90109,415,90109,,0,0,"ce9d78a2f4e737c3112af6d8f951e21913b7fb84",0,0,0,0,0,""
20201210,"GU",7052,137,82642,,"posNeg",89694,33,,10,,8,,6382,"12/10/2020 05:30","2020-12-10T05:30:00Z","12/10 00:30",115,,,"2020-12-10T05:30:00Z",89557,,,6915,,,,,315,12,,,,,,,3456,153,"66",13,486,89694,499,89694,,2,0,"a9ea2a0e362ee9fad6d4d25a3043fa45be9044da",0,0,0,0,0,""
20201209,"GU",7039,137,82156,,"posNeg",89195,37,,10,,8,,6332,"12/9/2020 05:50","2020-12-09T05:50:00Z","12/09 00:50",113,,,"2020-12-09T05:50:00Z",89058,,,6902,,,,,314,12,,,,,,,3439,153,"66",13,568,89195,581,89195,,0,0,"fdf076b1862f3b73d7eb29278a94952aabfff9cd",0,0,0,0,0,""
20201208,"GU",7026,136,81588,,"posNeg",88614,33,,10,,8,,6248,"12/8/2020 05:30","2020-12-08T05:30:00Z","12/08 00:30",113,,,"2020-12-08T05:30:00Z",88478,,,6890,,,,,310,12,,,,,,,3392,153,"66",7,170,88614,177,88614,,0,0,"bf70d10ff8fae5c1ca53e42eb09404ae979534e2",0,0,0,0,0,""
20201207,"GU",7019,136,81418,,"posNeg",88437,33,,10,,8,,6248,"12/7/2020 08:45","2020-12-07T08:45:00Z","12/07 03:45",113,,,"2020-12-07T08:45:00Z",88301,,,6883,,,,,310,12,,,,,,,3392,153,"66",15,1847,88437,1862,88437,,0,0,"ff0af5a3604d84f6e239e377d56d8fb249ca6f40",0,0,0,0,0,""
20201206,"GU",7004,132,79571,,"posNeg",86575,33,,10,,6,,6056,"12/6/2020 03:45","2020-12-06T03:45:00Z","12/05 22:45",113,,,"2020-12-06T03:45:00Z",86398,,,6827,,,,,227,12,,,,,,,2591,153,"66",27,0,86575,27,86575,,0,0,"e20cb362f4885c46b96d71eaa4afae8fca76e72f",0,0,0,0,0,""
20201205,"GU",6977,132,79571,,"posNeg",86548,38,,9,,6,,6056,"12/5/2020 05:15","2020-12-05T05:15:00Z","12/05 00:15",113,,,"2020-12-05T05:15:00Z",86398,,,6827,,,,,227,12,,,,,,,2591,153,"66",18,0,86548,18,86548,,0,0,"63656b119949170688d7a7589d6a779117e85904",0,0,0,0,0,""
20201204,"GU",6959,132,79571,,"posNeg",86530,39,,8,,6,,6056,"12/4/2020 09:15","2020-12-04T09:15:00Z","12/04 04:15",113,,,"2020-12-04T09:15:00Z",86398,,,6827,,,,,227,12,,,,,,,2591,153,"66",17,555,86530,572,86530,,1,0,"fae4349e320cdc85be692b815a4c1ef7991aa447",0,0,0,0,0,""
20201203,"GU",6942,140,79016,,"posNeg",85958,39,,9,,7,,6030,"12/3/2020 04:00","2020-12-03T04:00:00Z","12/02 23:00",112,,,"2020-12-03T04:00:00Z",85818,,,6802,,,,,227,12,,,,,,,2308,127,"66",22,450,85958,472,85958,,0,0,"9ec151533fc70dca390fd9d9be0bb49f93d0ee7d",0,0,0,0,0,""
20201202,"GU",6920,138,78566,,"posNeg",85486,38,,10,,7,,6005,"12/2/2020 05:00","2020-12-02T05:00:00Z","12/02 00:00",112,,,"2020-12-02T05:00:00Z",85348,,,6782,,,,,226,12,,,,,,,1972,127,"66",31,417,85486,448,85486,,0,0,"31ccf6ce79c816d12e19574d218086a25f5059ff",0,0,0,0,0,""
20201201,"GU",6889,132,78149,,"posNeg",85038,46,,10,,4,,5846,"12/1/2020 06:30","2020-12-01T06:30:00Z","12/01 01:30",112,,,"2020-12-01T06:30:00Z",84906,,,6757,,,,,225,12,,,,,,,1662,127,"66",37,582,85038,619,85038,,0,0,"49bdff4bfb72242312ef38da940d3d43e68cf250",0,0,0,0,0,""
20201130,"GU",6852,130,77567,,"posNeg",84419,47,,9,,3,,5817,"11/30/2020 05:45","2020-11-30T05:45:00Z","11/30 00:45",112,,,"2020-11-30T05:45:00Z",84289,,,6722,,,,,226,12,,,,,,,1349,127,"66",34,1134,84419,1168,84419,,0,0,"b389b359cea752d6796224f4d658fd870fff28fe",0,0,0,0,0,""
20201129,"GU",6818,127,76433,,"posNeg",83251,44,,8,,3,,5521,"11/29/2020 05:00","2020-11-29T05:00:00Z","11/29 00:00",112,,,"2020-11-29T05:00:00Z",83074,,,6641,,,,,225,12,,,,,,,1264,127,"66",36,0,83251,36,83251,,0,0,"7ca03589c93ea785f353bc0aed4bb835d346e3ab",0,0,0,0,0,""
20201128,"GU",6782,127,76433,,"posNeg",83215,43,,9,,3,,5521,"11/28/2020 03:30","2020-11-28T03:30:00Z","11/27 22:30",112,,,"2020-11-28T03:30:00Z",83074,,,6641,,,,,225,12,,,,,,,1264,127,"66",14,0,83215,14,83215,,0,0,"4d7b25f731f38decbbc9cfa799100710efd0829f",0,0,0,0,0,""
20201127,"GU",6768,127,76433,,"posNeg",83201,45,,9,,3,,5521,"11/27/2020 07:45","2020-11-27T07:45:00Z","11/27 02:45",112,,,"2020-11-27T07:45:00Z",83074,,,6641,,,,,225,12,,,,,,,1264,127,"66",20,429,83201,449,83201,,1,0,"28f2a5fc063d05777c024e768696db3f4ab5ce5a",0,0,0,0,0,""
20201126,"GU",6748,125,76004,,"posNeg",82752,46,,9,,2,,4957,"11/26/2020 04:15","2020-11-26T04:15:00Z","11/25 23:15",111,,,"2020-11-26T04:15:00Z",82584,,,6580,,,,,224,9,,,,,,,1226,121,"66",43,0,82752,43,82752,,2,0,"e9e36ebaa16fae32ce4f9ba9f3867c45d55119e6",0,0,0,0,0,""
20201125,"GU",6705,125,76004,,"posNeg",82709,45,,11,,4,,4957,"11/25/2020 03:30","2020-11-25T03:30:00Z","11/24 22:30",109,,,"2020-11-25T03:30:00Z",82584,,,6580,,,,,224,9,,,,,,,1226,121,"66",50,1059,82709,1109,82709,,2,0,"426090ce119503834354698046aff2d44c6387dc",0,0,0,0,0,""
20201124,"GU",6655,122,74945,,"posNeg",81600,49,,9,,5,,4952,"11/24/2020 05:00","2020-11-24T05:00:00Z","11/24 00:00",107,,,"2020-11-24T05:00:00Z",81478,,,6533,,,,,220,9,,,,,,,1213,121,"66",53,548,81600,601,81600,,1,0,"1f1148ea16a2b316336f1ea7885c8f94c83b91da",0,0,0,0,0,""
20201123,"GU",6602,121,74397,,"posNeg",80999,48,,8,,4,,4846,"11/23/2020 06:30","2020-11-23T06:30:00Z","11/23 01:30",106,,,"2020-11-23T06:30:00Z",80878,,,6481,,,,,216,9,,,,,,,1187,121,"66",53,1061,80999,1114,80999,,0,0,"893f12deff139bd7c4f2dc05690b79d0d201a884",0,0,0,0,0,""
20201122,"GU",6549,121,73336,,"posNeg",79885,50,,7,,3,,4430,"11/22/2020 02:30","2020-11-22T02:30:00Z","11/21 21:30",106,,,"2020-11-22T02:30:00Z",79667,,,6331,,,,,216,9,,,,,,,1151,121,"66",73,0,79885,73,79885,,2,0,"efdb03f192eb614b58d537f8672af34d5624d6dc",0,0,0,0,0,""
20201121,"GU",6476,121,73336,,"posNeg",79812,54,,11,,5,,4430,"11/21/2020 04:45","2020-11-21T04:45:00Z","11/20 23:45",104,,,"2020-11-21T04:45:00Z",79667,,,6331,,,,,216,9,,,,,,,1151,121,"66",24,0,79812,24,79812,,1,0,"494a65c94ded54b779d03efeaf9adcb06f07bb16",0,0,0,0,0,""
20201120,"GU",6452,121,73336,,"posNeg",79788,56,,13,,6,,4430,"11/21/2020 00:00","2020-11-21T00:00:00Z","11/20 19:00",103,,,"2020-11-21T00:00:00Z",79667,,,6331,,,,,216,9,,,,,,,1151,121,"66",36,364,79788,400,79788,,2,0,"26aed2d840c7c837a3050bf1d6ceaa6d069e0245",0,0,0,0,0,""
20201119,"GU",6416,121,72972,,"posNeg",79388,57,,14,,8,,4423,"11/19/2020 06:30","2020-11-19T06:30:00Z","11/19 01:30",101,,,"2020-11-19T06:30:00Z",79267,,,6295,,,,,212,8,,,,,,,1084,111,"66",70,258,79388,328,79388,,1,0,"f1964eb5ed08a36d701890b78289f77f747b31b7",0,0,0,0,0,""
20201118,"GU",6346,121,72714,,"posNeg",79060,58,,12,,6,,4341,"11/18/2020 06:45","2020-11-18T06:45:00Z","11/18 01:45",100,,,"2020-11-18T06:45:00Z",75406,,,6225,,,,,212,8,,,,,,,884,111,"66",112,0,79060,112,79060,,0,0,"70b1d100f86de98c508c965b14bc4d73eda20e92",0,0,0,0,0,""
20201117,"GU",6234,113,72714,,"posNeg",78948,69,,16,,9,,4338,"11/17/2020 06:10","2020-11-17T06:10:00Z","11/17 01:10",100,,,"2020-11-17T06:10:00Z",75406,,,6121,,,,,212,8,,,,,,,884,111,"66",59,756,78948,815,78948,,2,0,"2db652457b5a4b9e2195fdbdc21316899ed2c8a9",0,0,0,0,0,""
20201116,"GU",6175,113,71958,,"posNeg",78133,70,,18,,11,,3950,"11/16/2020 06:30","2020-11-16T06:30:00Z","11/16 01:30",98,,,"2020-11-16T06:30:00Z",75406,,,6062,,,,,212,8,,,,,,,884,111,"66",54,703,78133,757,78133,,4,0,"acf3e83d7e229f93da5d94a295895c10ab21b599",0,0,0,0,0,""
20201115,"GU",6121,111,71255,,"posNeg",77376,75,,21,,12,,3942,"11/15/2020 04:10","2020-11-15T04:10:00Z","11/14 23:10",94,,,"2020-11-15T04:10:00Z",75406,,,6010,,,,,212,8,,,,,,,884,111,"66",156,463,77376,619,77376,,1,0,"d441a010dae08943072e98bfd5f9bc42fc6d3931",0,0,0,0,0,""
20201114,"GU",5965,111,70792,,"posNeg",76757,76,,21,,10,,3942,"11/14/2020 04:05","2020-11-14T04:05:00Z","11/13 23:05",93,,,"2020-11-14T04:05:00Z",75406,,,5854,,,,,212,8,,,,,,,884,111,"66",41,424,76757,465,76757,,0,0,"3692e974bba124615d3b0e803daa41be0bfc7060",0,0,0,0,0,""
20201113,"GU",5924,111,70368,,"posNeg",76292,78,,18,,11,,3942,"11/13/2020 08:00","2020-11-13T08:00:00Z","11/13 03:00",93,,,"2020-11-13T08:00:00Z",75406,,,5813,,,,,212,8,,,,,,,884,111,"66",74,769,76292,843,76292,,2,0,"10a54e298957a6f4b9a861abc7c9c8d56f38bc97",0,0,0,0,0,""
20201112,"GU",5850,110,69599,,"posNeg",75449,83,,17,,11,,3865,"11/12/2020 08:30","2020-11-12T08:30:00Z","11/12 03:30",91,,,"2020-11-12T08:30:00Z",74583,,,5740,,,,,212,8,,,,,,,864,110,"66",95,805,75449,900,75449,,0,0,"eed77f6c957f46b17540f5f3010ae946fb872f28",0,0,0,0,0,""
20201111,"GU",5755,102,68794,,"posNeg",74549,80,,20,,11,,3667,"11/11/2020 03:40","2020-11-11T03:40:00Z","11/10 22:40",91,,,"2020-11-11T03:40:00Z",73039,,,5653,,,,,210,7,,,,,,,818,102,"66",101,589,74549,690,74549,,0,0,"6c56df8e14f3ed1d2592bda0b2791a12bb890e86",0,0,0,0,0,""
20201110,"GU",5654,102,68205,,"posNeg",73859,77,,19,,12,,3667,"11/10/2020 08:30","2020-11-10T08:30:00Z","11/10 03:30",91,,,"2020-11-10T08:30:00Z",73039,,,5552,,,,,210,7,,,,,,,818,102,"66",181,724,73859,905,73859,,1,0,"5a976c76514fd0ac85d30ffda0ff02afd20dcb07",0,0,0,0,0,""
20201109,"GU",5473,98,67481,,"posNeg",72954,75,,18,,13,,3654,"11/8/2020 19:15","2020-11-08T19:15:00Z","11/08 14:15",90,,,"2020-11-08T19:15:00Z",72187,,,5375,,,,,209,7,,,,,,,765,98,"66",240,718,72954,958,72954,,1,0,"416231816e3fed737b44927cabee6218c13d82a9",0,0,0,0,0,""
20201108,"GU",5233,79,66763,,"posNeg",71996,73,,19,,10,,3402,"11/8/2020 06:00","2020-11-08T06:00:00Z","11/08 01:00",89,,,"2020-11-08T06:00:00Z",70403,,,5154,,,,,209,7,,,,,,,699,79,"66",120,369,71996,489,71996,,0,0,"ad062699968ee903e44697fbcabab1a5353ce9d4",0,0,0,0,0,""
20201107,"GU",5113,79,66394,,"posNeg",71507,82,,19,,10,,3403,"11/7/2020 03:40","2020-11-07T03:40:00Z","11/06 22:40",89,,,"2020-11-07T03:40:00Z",70403,,,5034,,,,,209,7,,,,,,,699,79,"66",36,367,71507,403,71507,,1,0,"e34509490d210d34bba80cb64ab69ff3235d247e",0,0,0,0,0,""
20201106,"GU",5077,79,66027,,"posNeg",71104,86,,21,,10,,3403,"11/6/2020 09:00","2020-11-06T09:00:00Z","11/06 04:00",88,,,"2020-11-06T09:00:00Z",70403,,,4998,,,,,209,7,,,,,,,699,79,"66",73,564,71104,637,71104,,3,0,"9bad70841958f12cdce190ee692d3b1069b475f9",0,0,0,0,0,""
20201105,"GU",5004,73,65463,,"posNeg",70467,90,,20,,11,,3352,"11/5/2020 06:30","2020-11-05T06:30:00Z","11/05 01:30",85,,,"2020-11-05T06:30:00Z",69788,,,4931,,,,,208,7,,,,,,,677,73,"66",101,610,70467,711,70467,,2,0,"150bc1f3b3928d4665962279578698d111de3a87",0,0,0,0,0,""
20201104,"GU",4903,73,64853,,"posNeg",69756,94,,22,,12,,3228,"11/4/2020 08:05","2020-11-04T08:05:00Z","11/04 03:05",83,,,"2020-11-04T08:05:00Z",69092,,,4830,,,,,208,7,,,,,,,662,73,"66",91,637,69756,728,69756,,3,0,"ed5b9aa2df457cb7314650388dcf78058f3adc4f",0,0,0,0,0,""
20201103,"GU",4812,64,64216,,"posNeg",69028,94,,22,,10,,3221,"11/3/2020 09:00","2020-11-03T09:00:00Z","11/03 04:00",80,,,"2020-11-03T09:00:00Z",68465,,,4748,,,,,208,7,,,,,,,561,64,"66",119,1245,69028,1364,69028,,1,0,"0f014c0dba0c322c472b8dfc0d33f0ddb60f31d5",0,0,0,0,0,""
20201102,"GU",4693,49,62971,,"posNeg",67664,102,,19,,8,,2666,"11/2/2020 03:20","2020-11-02T03:20:00Z","11/01 22:20",79,,,"2020-11-02T03:20:00Z",66618,,,4644,,,,,206,7,,,,,,,409,49,"66",3,98,67664,101,67664,,0,0,"c7701d38f55364bca081d4c466cb4e8ab7359798",0,0,0,0,0,""
20201101,"GU",4690,49,62873,,"posNeg",67563,100,,16,,4,,2666,"11/1/2020 03:20","2020-11-01T03:20:00Z","10/31 23:20",79,,,"2020-11-01T03:20:00Z",66618,,,4641,,,,,206,7,,,,,,,409,49,"66",9,102,67563,111,67563,,0,0,"1250368dd842045992e3997113ba7368b13ed9b0",0,0,0,0,0,""
20201031,"GU",4681,49,62771,,"posNeg",67452,92,,14,,4,,2666,"10/31/2020 02:30","2020-10-31T02:30:00Z","10/30 22:30",79,,,"2020-10-31T02:30:00Z",66618,,,4632,,,,,206,7,,,,,,,409,49,"66",53,370,67452,423,67452,,0,0,"fb09525c702f0e3b2ac996b706480a05818ca46d",0,0,0,0,0,""
20201030,"GU",4628,49,62401,,"posNeg",67029,92,,14,,4,,2666,"10/30/2020 05:55","2020-10-30T05:55:00Z","10/30 01:55",79,,,"2020-10-30T05:55:00Z",66618,,,4579,,,,,206,7,,,,,,,409,49,"66",79,565,67029,644,67029,,1,0,"207de1d89610ad6f54fa4b2c1d1bca26f65a20fb",0,0,0,0,0,""
20201029,"GU",4549,45,61836,,"posNeg",66385,85,,14,,5,,2636,"10/29/2020 06:45","2020-10-29T06:45:00Z","10/29 02:45",78,,,"2020-10-29T06:45:00Z",65981,,,4504,,,,,204,6,,,,,,,402,45,"66",83,638,66385,721,66385,,1,0,"ca871f63a3e0798d1da6b293c7d6abb45f866a6d",0,0,0,0,0,""
20201028,"GU",4466,34,61198,,"posNeg",65664,86,,13,,6,,2618,"10/28/2020 05:15","2020-10-28T05:15:00Z","10/28 01:15",77,,,"2020-10-28T05:15:00Z",65355,,,4432,,,,,204,6,,,,,,,307,34,"66",48,571,65664,619,65664,,2,0,"3ab32c244d771170fa7ab9ac7cd6b948bdf02dfc",0,0,0,0,0,""
20201027,"GU",4418,34,60627,,"posNeg",65045,81,,16,,5,,2611,"10/27/2020 05:30","2020-10-27T05:30:00Z","10/27 01:30",75,,,"2020-10-27T05:30:00Z",64736,,,4384,,,,,204,6,,,,,,,307,34,"66",82,509,65045,591,65045,,0,0,"4f2d4d4313a95a3951706b1972ea97729af62428",0,0,0,0,0,""
20201026,"GU",4336,28,60118,,"posNeg",64454,77,,17,,6,,2603,"10/26/2020 06:30","2020-10-26T06:30:00Z","10/26 02:30",75,,,"2020-10-26T06:30:00Z",64152,,,4308,,,,,204,6,,,,,,,300,28,"66",120,840,64454,960,64454,,4,0,"848853fbac751504365049a96e081b61acf4611e",0,0,0,0,0,""
20201025,"GU",4216,20,59278,,"posNeg",63494,77,,17,,6,,2503,"10/25/2020 02:00","2020-10-25T02:00:00Z","10/24 22:00",71,,,"2020-10-25T02:00:00Z",62614,,,4196,,,,,203,6,,,,,,,290,20,"66",41,213,63494,254,63494,,0,0,"3d650f2375af79d94b3bedbce57a844c349d8062",0,0,0,0,0,""
20201024,"GU",4175,20,59065,,"posNeg",63240,77,,17,,6,,2503,"10/24/2020 03:40","2020-10-24T03:40:00Z","10/23 23:40",71,,,"2020-10-24T03:40:00Z",62614,,,4155,,,,,203,6,,,,,,,290,20,"66",34,300,63240,334,63240,,2,0,"bed8b1f32c1ec3e577fdb81550d122ec51310a7a",0,0,0,0,0,""
20201023,"GU",4141,20,58765,,"posNeg",62906,77,,17,,6,,2503,"10/23/2020 04:50","2020-10-23T04:50:00Z","10/23 00:50",69,,,"2020-10-23T04:50:00Z",62614,,,4121,,,,,203,6,,,,,,,290,19,"66",85,534,62906,619,62906,,0,0,"a7b8c95fc300e60c35f42331731627f750b9a135",0,0,0,0,0,""
20201022,"GU",4056,19,58231,,"posNeg",62287,78,,15,,7,,2471,"10/22/2020 05:25","2020-10-22T05:25:00Z","10/22 01:25",69,,,"2020-10-22T05:25:00Z",61998,,,4037,,,,,203,6,,,,,,,287,19,"66",88,956,62287,1044,62287,,0,0,"0762742a634aa36602941fd8d734cdf0cb17466e",0,0,0,0,0,""
20201021,"GU",3968,18,57275,,"posNeg",61243,71,,12,,4,,2398,"10/21/2020 05:20","2020-10-21T05:20:00Z","10/21 01:20",69,,,"2020-10-21T05:20:00Z",61200,,,3950,,,,,202,6,,,,,,,41,18,"66",82,655,61243,737,61243,,2,0,"77de8bf8214136ccff6943972af6e76ec6c9c5f1",0,0,0,0,0,""
20201020,"GU",3886,17,56620,,"posNeg",60506,70,,17,,6,,2354,"10/20/2020 06:00","2020-10-20T06:00:00Z","10/20 02:00",67,,,"2020-10-20T06:00:00Z",60465,,,3869,,,,,202,6,,,,,,,39,17,"66",130,827,60506,957,60506,,1,0,"abf4f9281d6bec04ddbcc8d37cdf62701760f3bb",0,0,0,0,0,""
20201019,"GU",3756,14,55793,,"posNeg",59549,68,,14,,3,,2350,"10/19/2020 06:55","2020-10-19T06:55:00Z","10/19 02:55",66,,,"2020-10-19T06:55:00Z",59511,,,3742,,,,,202,6,,,,,,,36,14,"66",81,500,59549,581,59549,,0,0,"4aa491ef6fead33d85aaead7cf8f39f27581bcc4",0,0,0,0,0,""
20201018,"GU",3675,11,55293,,"posNeg",58968,63,,13,,4,,2297,"10/18/2020 07:30","2020-10-18T07:30:00Z","10/18 03:30",66,,,"2020-10-18T07:30:00Z",58088,,,3664,,,,,201,6,,,,,,,32,11,"66",58,230,58968,288,58968,,2,0,"02e667d9e00d4e7425586c0fe76c0908ca273963",0,0,0,0,0,""
20201017,"GU",3617,11,55063,,"posNeg",58680,67,,15,,4,,2297,"10/17/2020 09:15","2020-10-17T09:15:00Z","10/17 05:15",64,,,"2020-10-17T09:15:00Z",58088,,,3606,,,,,201,6,,,,,,,32,11,"66",79,479,58680,558,58680,,1,0,"514d8ab2c7adc1612b5394efce20a7a07e6100c4",0,0,0,0,0,""
20201016,"GU",3538,11,54584,,"posNeg",58122,67,,15,,4,,2297,"10/16/2020 05:00","2020-10-16T05:00:00Z","10/16 01:00",63,,,"2020-10-16T05:00:00Z",58088,,,3527,,,,,201,6,,,,,,,32,11,"66",111,546,58122,657,58122,,1,0,"a8b7cc84e631ac9cf8ab7c1d94a86a409ceb252a",0,0,0,0,0,""
20201015,"GU",3427,10,54038,,"posNeg",57465,72,,19,,4,,2294,"10/15/2020 06:30","2020-10-15T06:30:00Z","10/15 02:30",62,,,"2020-10-15T06:30:00Z",57433,,,3417,,,,,199,6,,,,,,,30,10,"66",86,485,57465,571,57465,,1,0,"d7806bd7618ab6325f4bceb554cf5a3a7e407e78",0,0,0,0,0,""
20201014,"GU",3341,10,53553,,"posNeg",56894,62,,14,,4,,2295,"10/14/2020 05:15","2020-10-14T05:15:00Z","10/14 01:15",61,,,"2020-10-14T05:15:00Z",56865,,,3331,,,,,198,5,,,,,,,27,10,"66",75,451,56894,526,56894,,0,0,"32d834bb9be7e6d4fd330b93e70b2d20fdf51903",0,0,0,0,0,""
20201013,"GU",3266,9,53102,,"posNeg",56368,62,,13,,4,,2190,"10/13/2020 08:25","2020-10-13T08:25:00Z","10/13 04:25",61,,,"2020-10-13T08:25:00Z",56343,,,3257,,,,,198,5,,,,,,,23,9,"66",96,582,56368,678,56368,,1,0,"3a88c47ee1dbc01d4ee58d87e95f9156f52b4e19",0,0,0,0,0,""
20201012,"GU",3170,9,52520,,"posNeg",55690,65,,12,,,,2189,"10/12/2020 06:15","2020-10-12T06:15:00Z","10/12 02:15",60,,,"2020-10-12T06:15:00Z",55665,,,3161,,,,,197,5,,,,,,,23,9,"66",92,627,55690,719,55690,,0,0,"02660ebebee6e9559385bc1939c2919dce67da14",0,0,0,0,0,""
20201011,"GU",3078,7,51893,,"posNeg",54971,60,,12,,,,2072,"10/10/2020 22:00","2020-10-10T22:00:00Z","10/10 18:00",60,,,"2020-10-10T22:00:00Z",54477,,,3071,,,,,192,3,,,,,,,16,7,"66",22,133,54971,155,54971,,1,0,"2b564e322076be7c265aeefaff98e420d743b587",0,0,0,0,0,""
20201010,"GU",3056,7,51760,,"posNeg",54816,62,,13,,,,2072,"10/10/2020 04:00","2020-10-10T04:00:00Z","10/10 00:00",59,,,"2020-10-10T04:00:00Z",54477,,,3049,,,,,192,3,,,,,,,16,7,"66",67,254,54816,321,54816,,1,0,"1ff23a9225e5d61e3b0768c365c2959f8fae42a6",0,0,0,0,0,""
20201009,"GU",2989,7,51506,,"posNeg",54495,55,,14,,,,2072,"10/9/2020 02:35","2020-10-09T02:35:00Z","10/08 22:35",58,,,"2020-10-09T02:35:00Z",54477,,,2982,,,,,192,3,,,,,,,16,7,"66",55,369,54495,424,54495,,0,0,"43c2f4087f706e68a56b6569f3ba428689b83a08",0,0,0,0,0,""
20201008,"GU",2934,5,51137,,"posNeg",54071,50,,15,,,,2067,"10/8/2020 05:10","2020-10-08T05:10:00Z","10/08 01:10",58,,,"2020-10-08T05:10:00Z",54055,,,2929,,,,,192,3,,,,,,,14,5,"66",66,517,54071,583,54071,,1,0,"bc06a3c3e27e4fb169ef23670fac2d86074a1abe",0,0,0,0,0,""
20201007,"GU",2868,4,50620,,"posNeg",53488,45,,15,,,,1924,"10/7/2020 05:00","2020-10-07T05:00:00Z","10/07 01:00",57,,,"2020-10-07T05:00:00Z",53477,,,2864,,,,,191,3,,,,,,,9,4,"66",54,422,53488,476,53488,,2,0,"1b546b9469720ce099f47ed0c78eed39168c1053",0,0,0,0,0,""
20201006,"GU",2814,4,50198,,"posNeg",53012,42,,14,,,,1922,"10/5/2020 07:55","2020-10-05T07:55:00Z","10/05 03:55",55,,,"2020-10-05T07:55:00Z",53007,,,2814,,,,,191,3,,,,,,,7,4,"66",61,586,53012,647,53012,,0,0,"c262f91dd4ca086f45f70ce899c6390f08a76a8b",0,0,0,0,0,""
20201005,"GU",2753,2,49612,,"posNeg",52365,33,,13,,,,1895,"10/5/2020 07:55","2020-10-05T07:55:00Z","10/05 03:55",55,,,"2020-10-05T07:55:00Z",52361,,,2751,,,,,189,3,,,,,,,2,2,"66",54,555,52365,609,52365,,3,0,"142381285c55297420f5e64190cc778a359d218a",0,0,0,0,0,""
20201004,"GU",2699,2,49057,,"posNeg",51756,29,,12,,,,1887,"10/4/2020 04:45","2020-10-04T04:45:00Z","10/04 00:45",52,,,"2020-10-04T04:45:00Z",51114,,,2697,,,,,184,3,,,,,,,2,2,"66",0,0,51756,0,51756,,1,0,"99bb24c3a919ff41d570567d38169bfc854ff82c",0,0,0,0,0,""
20201003,"GU",2699,2,49057,,"posNeg",51756,29,,12,,,,1887,"10/3/2020 08:00","2020-10-03T08:00:00Z","10/03 04:00",51,,,"2020-10-03T08:00:00Z",51114,,,2697,,,,,184,3,,,,,,,2,2,"66",82,556,51756,638,51756,,1,0,"57fa82cccb0a4b26cfa681179195019434904b80",0,0,0,0,0,""
20201002,"GU",2617,2,48501,,"posNeg",51118,30,,13,,,,1887,"10/2/2020 08:40","2020-10-02T08:40:00Z","10/02 04:40",50,,,"2020-10-02T08:40:00Z",51114,,,2615,,,,,184,3,,,,,,,2,2,"66",67,503,51118,570,51118,,1,0,"e7621e887f97d27ac9e3d48f7b82d6a5f2eb60f3",0,0,0,0,0,""
20201001,"GU",2550,2,47998,,"posNeg",50548,27,,10,,,,1866,"10/1/2020 07:50","2020-10-01T07:50:00Z","10/01 03:50",49,,,"2020-10-01T07:50:00Z",50544,,,2548,,,,,181,3,,,,,,,2,2,"66",62,372,50548,434,50548,,0,0,"414b61c9cfe8afc3e9ade1d6cdb54cfb7d231715",0,0,0,0,0,""
20200930,"GU",2488,2,47626,,"posNeg",50114,25,,9,,,,1822,"9/30/2020 08:50","2020-09-30T08:50:00Z","09/30 04:50",49,,,"2020-09-30T08:50:00Z",50110,,,2486,,,,,180,3,,,,,,,,,"66",45,342,50114,387,50114,,2,0,"3d815692e6e313a015ce6171eebeef542af10268",0,0,0,0,0,""
20200929,"GU",2443,0,47284,,"posNeg",49727,26,,9,,,,1811,"9/29/2020 07:00","2020-09-29T07:00:00Z","09/29 03:00",47,,,"2020-09-29T07:00:00Z",49725,,,2443,,,,,180,3,,,,,,,,,"66",53,463,49727,516,49727,,1,0,"6230e9e6eb8897e30140c9da68c39766f215983f",0,0,0,0,0,""
20200928,"GU",2390,0,46821,,"posNeg",49211,28,,10,,,,1795,"9/28/2020 07:45","2020-09-28T07:45:00Z","09/28 03:45",46,,,"2020-09-28T07:45:00Z",49209,,,2390,,,,,180,3,,,,,,,,,"66",36,456,49211,492,49211,,3,0,"3a0d19261f013c464b3eaaeff713b983475044b6",0,0,0,0,0,""
20200927,"GU",2354,0,46365,,"posNeg",48719,30,,9,,,,1668,"9/26/2020 09:45","2020-09-26T09:45:00Z","09/26 05:45",43,,,"2020-09-26T09:45:00Z",48254,,,2354,,,,,179,3,,,,,,,,,"66",0,0,48719,0,48719,,0,0,"2631e132007154f65535d6960462b9b472c3c993",0,0,0,0,0,""
20200926,"GU",2354,0,46365,,"posNeg",48719,30,,9,,,,1668,"9/26/2020 09:45","2020-09-26T09:45:00Z","09/26 05:45",43,,,"2020-09-26T09:45:00Z",48254,,,2354,,,,,179,3,,,,,,,,,"66",68,395,48719,463,48719,,2,0,"8df40cbee0f0470999094ca35e0c4efb6c29f47a",0,0,0,0,0,""
20200925,"GU",2286,0,45970,,"posNeg",48256,31,,11,,,,1668,"9/25/2020 08:00","2020-09-25T08:00:00Z","09/25 04:00",41,,,"2020-09-25T08:00:00Z",48254,,,2286,,,,,179,3,,,,,,,,,"66",23,546,48256,569,48256,,3,0,"8676f1b6fc736387da2007949f33a82c996f9f5e",0,0,0,0,0,""
20200924,"GU",2263,0,45424,,"posNeg",47687,33,,11,,,,1568,"9/24/2020 05:55","2020-09-24T05:55:00Z","09/24 01:55",38,,,"2020-09-24T05:55:00Z",47685,,,2263,,,,,179,3,,,,,,,,,"66",28,408,47687,436,47687,,1,0,"ad6071f7230fc324694e04757c7f2ec6f6a02e0c",0,0,0,0,0,""
20200923,"GU",2235,0,45016,,"posNeg",47251,33,,13,,,,1543,"9/23/2020 06:45","2020-09-23T06:45:00Z","09/23 02:45",37,,,"2020-09-23T06:45:00Z",47249,,,2235,,,,,175,3,,,,,,,,,"66",45,378,47251,423,47251,,0,0,"e3d84ace5b5cc723b6e008bd42c7f9a4e21686ca",0,0,0,0,0,""
20200922,"GU",2190,0,44638,,"posNeg",46828,39,,15,,,,1507,"9/22/2020 05:00","2020-09-22T05:00:00Z","09/22 01:00",37,,,"2020-09-22T05:00:00Z",46826,,,2190,,,,,175,3,,,,,,,,,"66",43,431,46828,474,46828,,2,0,"44c7d518c46f78ddb2a7307cf43f9f9ceab0debe",0,0,0,0,0,""
20200921,"GU",2147,0,44207,,"posNeg",46354,38,,18,,,,1505,"9/21/2020 09:00","2020-09-21T09:00:00Z","09/21 05:00",35,,,"2020-09-21T09:00:00Z",46352,,,2147,,,,,175,3,,,,,,,,,"66",30,366,46354,396,46354,,1,0,"eca4a4b47e87616b317c8afe25c00f3befeec860",0,0,0,0,0,""
20200920,"GU",2117,0,43841,,"posNeg",45958,36,,19,,,,1450,"9/19/2020 04:15","2020-09-19T04:15:00Z","09/19 00:15",34,,,"2020-09-19T04:15:00Z",45651,,,2117,,,,,172,3,,,,,,,,,"66",0,0,45958,0,45958,,0,0,"d6ab60299757c6015a7d654ef94373d51ce4744a",0,0,0,0,0,""
20200919,"GU",2117,0,43841,,"posNeg",45958,36,,19,,,,1450,"9/19/2020 04:15","2020-09-19T04:15:00Z","09/19 00:15",34,,,"2020-09-19T04:15:00Z",45651,,,2117,,,,,172,3,,,,,,,,,"66",43,262,45958,305,45958,,1,0,"6d564b07177e324b1f9fd0329f9d6b12bfe80ca8",0,0,0,0,0,""
20200918,"GU",2074,0,43579,,"posNeg",45653,41,,19,,,,1450,"9/18/2020 07:45","2020-09-18T07:45:00Z","09/18 03:45",33,,,"2020-09-18T07:45:00Z",45651,,,2074,,,,,172,3,,,,,,,,,"66",29,371,45653,400,45653,,2,0,"8bea5c22b43ca979a8e55df928cc47ef60428fdb",0,0,0,0,0,""
20200917,"GU",2045,0,43208,,"posNeg",45253,44,,19,,,,1427,"9/17/2020 05:40","2020-09-17T05:40:00Z","09/17 01:40",31,,,"2020-09-17T05:40:00Z",45251,,,2045,,,,,170,3,,,,,,,,,"66",32,370,45253,402,45253,,2,0,"eb523e5a36b267756e74b4fda8576b56d5ace855",0,0,0,0,0,""
20200916,"GU",2013,0,42838,,"posNeg",44851,46,,10,,,,1406,"9/16/2020 08:05","2020-09-16T08:05:00Z","09/16 04:05",29,,,"2020-09-16T08:05:00Z",44849,,,2013,,,,,158,2,,,,,,,,,"66",47,475,44851,522,44851,,1,0,"d6f431edf8192976f5d4285a1e5798143e217c0f",0,0,0,0,0,""
20200915,"GU",1966,0,42363,,"posNeg",44329,47,,13,,,,1312,"9/15/2020 07:35","2020-09-15T07:35:00Z","09/15 03:35",28,,,"2020-09-15T07:35:00Z",44327,,,1966,,,,,158,2,,,,,,,,,"66",39,396,44329,435,44329,,2,0,"c971c544b6533259f7b1b63f53625c8f32591651",0,0,0,0,0,""
20200914,"GU",1927,0,41967,,"posNeg",43894,50,,15,,,,1274,"9/14/2020 07:40","2020-09-14T07:40:00Z","09/14 03:40",26,,,"2020-09-14T07:40:00Z",43892,,,1927,,,,,158,2,,,,,,,,,"66",36,495,43894,531,43894,,0,0,"bddf1596ac52b30e70bc768caccb554b52c0952f",0,0,0,0,0,""
20200913,"GU",1891,0,41472,,"posNeg",43363,50,,11,,,,1118,"9/13/2020 03:15","2020-09-13T03:15:00Z","09/12 23:15",26,,,"2020-09-13T03:15:00Z",43011,,,1891,,,,,158,2,,,,,,,,,"66",0,0,43363,0,43363,,1,0,"3c750895e4a62b57e0045a548b0cefe1922e9417",0,0,0,0,0,""
20200912,"GU",1891,0,41472,,"posNeg",43363,50,,11,,,,1118,"9/12/2020 07:30","2020-09-12T07:30:00Z","09/12 03:30",25,,,"2020-09-12T07:30:00Z",43011,,,1891,,,,,158,2,,,,,,,,,"66",28,322,43363,350,43363,,2,0,"93b6e9eede2276b69776a74b26d4ea723adc4724",0,0,0,0,0,""
20200911,"GU",1863,0,41150,,"posNeg",43013,52,,13,,,,1118,"9/11/2020 03:15","2020-09-11T03:15:00Z","09/10 23:15",23,,,"2020-09-11T03:15:00Z",43011,,,1863,,,,,158,2,,,,,,,,,"66",17,378,43013,395,43013,,2,0,"d1e4c14d8ce72e2076bbf25507b34dfff30d4c24",0,0,0,0,0,""
20200910,"GU",1846,0,40772,,"posNeg",42618,54,,13,,,,1081,"9/10/2020 05:55","2020-09-10T05:55:00Z","09/10 01:55",21,,,"2020-09-10T05:55:00Z",42616,,,1846,,,,,158,2,,,,,,,,,"66",88,435,42618,523,42618,,0,0,"cce4da4a8b5b5077c0dd520042c15f4ae0ddf0c2",0,0,0,0,0,""
20200909,"GU",1758,0,40337,,"posNeg",42095,57,,13,,,,1042,"9/9/2020 06:45","2020-09-09T06:45:00Z","09/09 02:45",21,,,"2020-09-09T06:45:00Z",42093,,,1758,,,,,158,2,,,,,,,,,"66",45,638,42095,683,42095,,2,0,"cfef5358920068459e45c70f0122b9571254bead",0,0,0,0,0,""
20200908,"GU",1713,0,39699,,"posNeg",41412,54,,14,,,,951,"9/8/2020 07:20","2020-09-08T07:20:00Z","09/08 03:20",19,,,"2020-09-08T07:20:00Z",41410,,,1713,,,,,158,2,,,,,,,,,"66",42,629,41412,671,41412,,1,0,"4fa3d912bf528bd5b9ada647e33428f3881be036",0,0,0,0,0,""
20200907,"GU",1671,0,39070,,"posNeg",40741,57,,14,,,,744,"9/6/2020 22:45","2020-09-06T22:45:00Z","09/06 18:45",18,,,"2020-09-06T22:45:00Z",40110,,,1671,,,,,158,2,,,,,,,,,"66",0,0,40741,0,40741,,2,0,"db2ffac68081868d978c5cff786b556c1a9f8d34",0,0,0,0,0,""
20200906,"GU",1671,0,39070,,"posNeg",40741,57,,14,,,,744,"9/5/2020 12:50","2020-09-05T12:50:00Z","09/05 08:50",16,,,"2020-09-05T12:50:00Z",40110,,,1671,,,,,158,2,,,,,,,,,"66",0,0,40741,0,40741,,1,0,"727c8893475aea32def0e364ece86942d16122c7",0,0,0,0,0,""
20200905,"GU",1671,0,39070,,"posNeg",40741,57,,14,,,,744,"9/5/2020 09:20","2020-09-05T09:20:00Z","09/05 05:20",15,,,"2020-09-05T09:20:00Z",40110,,,1671,,,,,158,2,,,,,,,,,"66",52,577,40741,629,40741,,1,0,"97c1ada228ba505136c08f1209ab5dbdee517222",0,0,0,0,0,""
20200904,"GU",1619,0,38493,,"posNeg",40112,59,,11,,,,744,"9/4/2020 06:00","2020-09-04T06:00:00Z","09/04 02:00",14,,,"2020-09-04T06:00:00Z",40110,,,1619,,,,,158,2,,,,,,,,,"66",59,563,40112,622,40112,,1,0,"c4fd70db224acaf1941874adcd34cc63695128a7",0,0,0,0,0,""
20200903,"GU",1560,0,37930,,"posNeg",39490,45,,9,,,,716,"9/3/2020 05:30","2020-09-03T05:30:00Z","09/03 01:30",13,,,"2020-09-03T05:30:00Z",39488,,,1560,,,,,158,2,,,,,,,,,"66",66,653,39490,719,39490,,0,0,"1972c147b5a52fe9a6c0246e262cb1508c7e9757",0,0,0,0,0,""
20200902,"GU",1494,8,37277,,"posNeg",38771,45,,8,,,,653,"9/2/2020 06:00","2020-09-02T06:00:00Z","09/02 02:00",13,,,"2020-09-02T06:00:00Z",38770,,,1486,,,,,158,2,,,,,,,,,"66",47,402,38771,449,38771,,0,0,"25bc445b628da1cfbd40adefc951e3338a7368c6",0,0,0,0,0,""
20200901,"GU",1447,8,36875,,"posNeg",38322,43,,4,,,,568,"9/1/2020 05:25","2020-09-01T05:25:00Z","09/01 01:25",13,,,"2020-09-01T05:25:00Z",38312,,,1439,,,,,158,2,,,,,,,,,"66",52,386,38322,438,38322,,3,0,"c26322041c5990a46fdb06407809ec1c16dc9661",0,0,0,0,0,""
20200831,"GU",1395,8,36489,,"posNeg",37884,38,,5,,,,533,"8/31/2020 06:00","2020-08-31T06:00:00Z","08/31 02:00",10,,,"2020-08-31T06:00:00Z",37874,,,1387,,,,,158,2,,,,,,,,,"66",48,376,37884,424,37884,,0,0,"e04c44ddb176394adea5aa5c76c89c1cc0fac929",0,0,0,0,0,""
20200830,"GU",1347,8,36113,,"posNeg",37460,36,,4,,,,488,"8/29/2020 05:15","2020-08-29T05:15:00Z","08/29 01:15",10,,,"2020-08-29T05:15:00Z",36916,,,1339,,,,,158,2,,,,,,,,,"66",0,0,37460,0,37460,,0,0,"7140ad83529bf2c78b8e8af695d03a41a11a3d3a",0,0,0,0,0,""
20200829,"GU",1347,8,36113,,"posNeg",37460,36,,4,,,,488,"8/29/2020 05:15","2020-08-29T05:15:00Z","08/29 01:15",10,,,"2020-08-29T05:15:00Z",36916,,,1339,,,,,158,2,,,,,,,,,"66",60,474,37460,534,37460,,0,0,"75ba3d410a379a09e8d3386943362416f436fe8a",0,0,0,0,0,""
20200828,"GU",1287,8,35639,,"posNeg",36926,36,,4,,,,488,"8/28/2020 06:35","2020-08-28T06:35:00Z","08/28 02:35",10,,,"2020-08-28T06:35:00Z",36916,,,1279,,,,,158,2,,,,,,,,,"66",55,515,36926,570,36926,,0,0,"80193616738557e28c6a19d28e1e4ce93285dc68",0,0,0,0,0,""
20200827,"GU",1232,8,35124,,"posNeg",36356,30,,3,,,,456,"8/27/2020 06:30","2020-08-27T06:30:00Z","08/27 02:30",10,,,"2020-08-27T06:30:00Z",36346,,,1224,,,,,158,2,,,,,,,,,"66",112,890,36356,1002,36356,,1,0,"f37a6512ed4abbca1eae29f4990a7cb19daf0f2c",0,0,0,0,0,""
20200826,"GU",1120,8,34234,,"posNeg",35354,26,,4,,,,435,"8/26/2020 07:35","2020-08-26T07:35:00Z","08/26 03:35",9,,,"2020-08-26T07:35:00Z",35344,,,1112,,,,,158,2,,,,,,,,,"66",136,816,35354,952,35354,,2,0,"123e4ff08cf10a7cc6f995589ddd9fd7c46d5017",0,0,0,0,0,""
20200825,"GU",984,8,33418,,"posNeg",34402,27,,6,,,,429,"8/25/2020 05:55","2020-08-25T05:55:00Z","08/25 01:55",7,,,"2020-08-25T05:55:00Z",34392,,,976,,,,,158,2,,,,,,,,,"66",77,854,34402,931,34402,,0,0,"f927fb1874d4570ec7e3fd170b350c0117167911",0,0,0,0,0,""
20200824,"GU",907,8,32564,,"posNeg",33471,17,,4,,,,428,"8/24/2020 05:30","2020-08-24T05:30:00Z","08/24 01:30",7,,,"2020-08-24T05:30:00Z",33461,,,899,,,,,158,2,,,,,,,,,"66",87,793,33471,880,33471,,0,0,"bdbb0e9c048f0abe9b2e3e10a3f4df4c6fbd0e6a",0,0,0,0,0,""
20200823,"GU",820,8,31771,,"posNeg",32591,16,,3,,,,394,"8/22/2020 20:00","2020-08-22T20:00:00Z","08/22 16:00",7,,,"2020-08-22T20:00:00Z",31506,,,812,,,,,155,2,,,,,,,,,"66",53,1022,32591,1075,32591,,0,0,"b79fa2d2aaef34777a1d45d26d5ee6c3b2498501",0,0,0,0,0,""
20200822,"GU",767,8,30749,,"posNeg",31516,14,,3,,,,394,"8/21/2020 08:15","2020-08-21T08:15:00Z","08/21 04:15",7,,,"2020-08-21T08:15:00Z",31506,,,759,,,,,155,2,,,,,,,,,"66",0,0,31516,0,31516,,0,0,"b606ef786929bb81a78fed1c986e8882cb416ffb",0,0,0,0,0,""
20200821,"GU",767,8,30749,,"posNeg",31516,14,,3,,,,394,"8/21/2020 08:15","2020-08-21T08:15:00Z","08/21 04:15",7,,,"2020-08-21T08:15:00Z",31506,,,759,,,,,155,2,,,,,,,,,"66",63,761,31516,824,31516,,1,0,"cbe9bf18081f346bb26d4fa5f634c0b780ee616b",0,0,0,0,0,""
20200820,"GU",704,8,29988,,"posNeg",30692,13,,5,,,,381,"8/20/2020 05:35","2020-08-20T05:35:00Z","08/20 01:35",6,,,"2020-08-20T05:35:00Z",30702,,,696,,,,,155,2,,,,,,,,,"66",105,837,30692,942,30692,,1,0,"f2db9f3c481dccbc22898916bea2cadf8428613f",0,0,0,0,0,""
20200819,"GU",599,8,29151,,"posNeg",29750,14,,4,,,,363,"8/18/2020 23:50","2020-08-18T23:50:00Z","08/18 19:50",5,,,"2020-08-18T23:50:00Z",29740,,,591,,,,,155,2,,,,,,,,,"66",22,502,29750,524,29750,,0,0,"522650b4d5e842d5a6f7b141994087b34b63379a",0,0,0,0,0,""
20200818,"GU",577,8,28649,,"posNeg",29226,14,,4,,,,353,"8/17/2020 23:40","2020-08-17T23:40:00Z","08/17 19:40",5,,,"2020-08-17T23:40:00Z",29216,,,569,,,,,155,2,,,,,,,,,"66",19,434,29226,453,29226,,0,0,"bdbf10c86fabeaf1083863645c408473d151c3dd",0,0,0,0,0,""
20200817,"GU",558,8,28215,,"posNeg",28773,13,,4,,,,352,"8/17/2020 01:30","2020-08-17T01:30:00Z","08/16 21:30",5,,,"2020-08-17T01:30:00Z",28763,,,550,,,,,155,2,,,,,,,,,"66",42,958,28773,1000,28773,,0,0,"4be5a0e5427d1e0a5b11bb08143272748bb39cf9",0,0,0,0,0,""
20200816,"GU",516,8,27257,,"posNeg",27773,12,,3,,,,345,"8/15/2020 20:00","2020-08-15T20:00:00Z","08/15 16:00",5,,,"2020-08-15T20:00:00Z",27086,,,508,,,,,153,2,,,,,,,,,"66",14,663,27773,677,27773,,0,0,"446e140d3fdc6290b8ec54e56ad0736ecb1fb4b8",0,0,0,0,0,""
20200815,"GU",502,8,26594,,"posNeg",27096,8,,2,,,,345,"8/14/2020 05:05","2020-08-14T05:05:00Z","08/14 01:05",5,,,"2020-08-14T05:05:00Z",27086,,,494,,,,,153,2,,,,,,,,,"66",0,0,27096,0,27096,,0,0,"51a808ae4e54651771ee8b8b693fca08cf514ab6",0,0,0,0,0,""
20200814,"GU",502,8,26594,,"posNeg",27096,8,,2,,,,345,"8/14/2020 05:05","2020-08-14T05:05:00Z","08/14 01:05",5,,,"2020-08-14T05:05:00Z",27086,,,494,,,,,153,2,,,,,,,,,"66",25,391,27096,416,27096,,0,0,"4dd12ff1b39fc19a0a71cedc9b75787a473a95eb",0,0,0,0,0,""
20200813,"GU",477,8,26203,,"posNeg",26680,8,,1,,,,343,"8/13/2020 02:55","2020-08-13T02:55:00Z","08/12 22:55",5,,,"2020-08-13T02:55:00Z",26670,,,469,,,,,152,2,,,,,,,,,"66",28,416,26680,444,26680,,0,0,"8cee699f9b9af8deef48ea79d4c11dbec5d32034",0,0,0,0,0,""
20200812,"GU",449,8,25787,,"posNeg",26236,7,,1,,,,341,"8/12/2020 00:15","2020-08-12T00:15:00Z","08/11 20:15",5,,,"2020-08-12T00:15:00Z",26226,,,441,,,,,151,2,,,,,,,,,"66",15,605,26236,620,26236,,0,0,"c22ed1266814ed2c39260edf307c09ab471cf94e",0,0,0,0,0,""
20200811,"GU",434,8,25182,,"posNeg",25616,7,,1,,,,325,"8/11/2020 03:00","2020-08-11T03:00:00Z","08/10 23:00",5,,,"2020-08-11T03:00:00Z",25606,,,426,,,,,151,2,,,,,,,,,"66",16,524,25616,540,25616,,0,0,"2d52a488b770d4963506274ee8e96d43fd304a79",0,0,0,0,0,""
20200810,"GU",418,8,24658,,"posNeg",25076,5,,1,,,,325,"8/10/2020 00:50","2020-08-10T00:50:00Z","08/09 20:50",5,,,"2020-08-10T00:50:00Z",24354,,,410,,,,,147,2,,,,,,,,,"66",6,541,25076,547,25076,,0,0,"b953ab5436f3b779e3bf195e75f6f40e163faac2",0,0,0,0,0,""
20200809,"GU",412,8,24117,,"posNeg",24529,3,,,,,,321,"8/8/2020 01:45","2020-08-08T01:45:00Z","08/07 21:45",5,,,"2020-08-08T01:45:00Z",24354,,,404,,,,,147,2,,,,,,,,,"66",0,0,24529,0,24529,,0,0,"88812fed701b4b14c23afc440085ddb3c9569c24",0,0,0,0,0,""
20200808,"GU",412,8,24117,,"posNeg",24529,3,,1,,,,321,"8/8/2020 01:45","2020-08-08T01:45:00Z","08/07 21:45",5,,,"2020-08-08T01:45:00Z",24354,,,404,,,,,147,2,,,,,,,,,"66",1,166,24529,167,24529,,0,0,"cd0ba0654b1fc00ccb8cc11615fb90a83b395670",0,0,0,0,0,""
20200807,"GU",411,8,23951,,"posNeg",24362,3,,1,,,,321,"8/6/2020 23:30","2020-08-06T23:30:00Z","08/06 19:30",5,,,"2020-08-06T23:30:00Z",24354,,,403,,,,,147,2,,,,,,,,,"66",14,471,24362,485,24362,,0,0,"f15cf23cb323bceea89a473079140814dcbbb7dc",0,0,0,0,0,""
20200806,"GU",397,8,23480,,"posNeg",23877,3,,1,,,,321,"8/5/2020 22:25","2020-08-05T22:25:00Z","08/05 18:25",5,,,"2020-08-05T22:25:00Z",23869,,,389,,,,,147,2,,,,,,,,,"66",8,434,23877,442,23877,,0,0,"a961b876b8183a22678c7d40b63844b4907cd378",0,0,0,0,0,""
20200805,"GU",389,8,23046,,"posNeg",23435,3,,,,,,319,"8/5/2020 01:25","2020-08-05T01:25:00Z","08/04 21:25",5,,,"2020-08-05T01:25:00Z",23427,,,381,,,,,146,2,,,,,,,,,"66",14,498,23435,512,23435,,0,0,"633d0fb6bd1b25fdb6c52727755db7db5ce303e7",0,0,0,0,0,""
20200804,"GU",375,8,22548,,"posNeg",22923,3,,,,,,318,"8/3/2020 22:00","2020-08-03T22:00:00Z","08/03 18:00",5,,,"2020-08-03T22:00:00Z",22914,,,367,,,,,146,2,,,,,,,,,"66",7,343,22923,350,22923,,0,0,"d129885b85447711e0cc2d8ed2e3e58c672c582d",0,0,0,0,0,""
20200803,"GU",368,8,22205,,"posNeg",22573,5,,2,,,,305,"8/2/2020 23:20","2020-08-02T23:20:00Z","08/02 19:20",5,,,"2020-08-02T23:20:00Z",22563,,,360,,,,,146,2,,,,,,,,,"66",1,520,22573,521,22573,,0,0,"8c86cef41d5c4aad6caa055e461db8e656da283e",0,0,0,0,0,""
20200802,"GU",367,8,21685,,"posNeg",22052,2,,2,,,,304,"7/31/2020 21:30","2020-07-31T21:30:00Z","07/31 17:30",5,,,"2020-07-31T21:30:00Z",21873,,,359,,,,,145,2,,,,,,,,,"66",0,0,22052,0,22052,,0,0,"0d4d977bec375dd2eb7b0332348f9a0015df36c0",0,0,0,0,0,""
20200801,"GU",367,8,21685,,"posNeg",22052,2,,2,,,,304,"7/31/2020 21:25","2020-07-31T21:25:00Z","07/31 17:25",5,,,"2020-07-31T21:25:00Z",21873,,,359,,,,,145,2,,,,,,,,,"66",11,159,22052,170,22052,,0,0,"43afc3b0c45efd95f9aa5d60c397c14ceee2a228",0,0,0,0,0,""
20200731,"GU",356,8,21526,,"posNeg",21882,2,,2,,,,304,"7/30/2020 23:30","2020-07-30T23:30:00Z","07/30 19:30",5,,,"2020-07-30T23:30:00Z",21873,,,348,,,,,145,2,,,,,,,,,"66",2,338,21882,340,21882,,0,0,"c48e9a530924dfeafc3c656842646f55b4743ac0",0,0,0,0,0,""
20200730,"GU",354,8,21188,,"posNeg",21542,2,,2,,,,297,"7/29/2020 21:25","2020-07-29T21:25:00Z","07/29 17:25",5,,,"2020-07-29T21:25:00Z",21533,,,346,,,,,145,2,,,,,,,,,"66",3,210,21542,213,21542,,0,0,"6ee1a31613a0d2ea21c82828c4efa6ecb1eb035f",0,0,0,0,0,""
20200729,"GU",351,8,20978,,"posNeg",21329,4,,2,,,,297,"7/28/2020 22:15","2020-07-28T22:15:00Z","07/28 18:15",5,,,"2020-07-28T22:15:00Z",21320,,,343,,,,,145,2,,,,,,,,,"66",2,535,21329,537,21329,,0,0,"6d6837df49725e4cf46c3fa538c0f09eef2c6839",0,0,0,0,0,""
20200728,"GU",349,8,20443,,"posNeg",20792,5,,2,,,,291,"7/28/2020 01:45","2020-07-28T01:45:00Z","07/27 21:45",5,,,"2020-07-28T01:45:00Z",20773,,,341,,,,,145,2,,,,,,,,,"66",3,308,20792,311,20792,,0,0,"d8071e27e455f400252074ed604357e0571f3752",0,0,0,0,0,""
20200727,"GU",346,8,20135,,"posNeg",20481,4,,,,,,291,"7/27/2020 02:40","2020-07-27T02:40:00Z","07/26 22:40",5,,,"2020-07-27T02:40:00Z",20472,,,338,,,,,145,2,,,,,,,,,"66",9,440,20481,449,20481,,0,0,"6a1ffb1740d6410534462806c02a50f3594beb3c",0,0,0,0,0,""
20200726,"GU",337,8,19695,,"posNeg",20032,1,,,,,,244,"7/24/2020 20:40","2020-07-24T20:40:00Z","07/24 16:40",5,,,"2020-07-24T20:40:00Z",19791,,,329,,,,,145,2,,,,,,,,,"66",0,0,20032,0,20032,,0,0,"769e79f5cab4e1676b9a62f8fa041c37dfa75420",0,0,0,0,0,""
20200725,"GU",337,8,19695,,"posNeg",20032,1,,,,,,244,"7/24/2020 20:40","2020-07-24T20:40:00Z","07/24 16:40",5,,,"2020-07-24T20:40:00Z",19791,,,329,,,,,145,2,,,,,,,,,"66",0,563,20032,563,20032,,0,0,"d374da7252fb5244ea68b55e06c0208383f5f31f",0,0,0,0,0,""
20200724,"GU",337,8,19132,,"posNeg",19469,0,,,,,,244,"7/24/2020 00:00","2020-07-24T00:00:00Z","07/23 20:00",5,,,"2020-07-24T00:00:00Z",19791,,,329,,,,,145,2,,,,,,,,,"66",5,0,19469,5,19469,,0,0,"cc7606d99fef86dc2f7677e7ebac0e8d558f4ae2",0,0,0,0,0,""
20200723,"GU",332,8,19132,,"posNeg",19464,0,,,,,,244,"7/22/2020 22:50","2020-07-22T22:50:00Z","07/22 18:50",5,,,"2020-07-22T22:50:00Z",19456,,,324,,,,,145,2,,,,,,,,,"66",2,380,19464,382,19464,,0,0,"27e90e50f2d67be8bd66da9f8d693faf7e544915",0,0,0,0,0,""
20200722,"GU",330,8,18752,,"posNeg",19082,3,,,,,,242,"7/22/2020 02:50","2020-07-22T02:50:00Z","07/21 22:50",5,,,"2020-07-22T02:50:00Z",19074,,,322,,,,,145,2,,,,,,,,,"66",3,322,19082,325,19082,,0,0,"77d56551f77753f8bef369f4e25dd1fa070c4f39",0,0,0,0,0,""
20200721,"GU",327,8,18430,,"posNeg",18757,3,,,,,,235,"7/20/2020 20:30","2020-07-20T20:30:00Z","07/20 16:30",5,,,"2020-07-20T20:30:00Z",18583,,,319,,,,,145,2,,,,,,,,,"66",8,178,18757,186,18757,,0,0,"a43fe46e5ae1029e67cd66e489f965448f9a59e5",0,0,0,0,0,""
20200720,"GU",319,8,18252,,"posNeg",18571,3,,,,,,235,"7/19/2020 22:10","2020-07-19T22:10:00Z","07/19 18:10",5,,,"2020-07-19T22:10:00Z",18583,,,311,,,,,145,2,,,,,,,,,"66",4,314,18571,318,18571,,0,0,"70a7378077f8d33072a0d8a2250587cb9b8019a2",0,0,0,0,0,""
20200719,"GU",315,8,17938,,"posNeg",18253,4,,,,,,222,"7/17/2020 20:50","2020-07-17T20:50:00Z","07/17 16:50",5,,,"2020-07-17T20:50:00Z",18244,,,307,,,,,145,2,,,,,,,,,"66",0,0,18253,0,18253,,0,0,"91fb330be479b468751a5adee5ce7505760b9629",0,0,0,0,0,""
20200718,"GU",315,8,17938,,"posNeg",18253,4,,,,,,222,"7/17/2020 20:50","2020-07-17T20:50:00Z","07/17 16:50",5,,,"2020-07-17T20:50:00Z",18244,,,307,,,,,145,2,,,,,,,,,"66",1,0,18253,1,18253,,0,0,"49fc638e354775946d71af95a54b3ec1b591ed21",0,0,0,0,0,""
20200717,"GU",314,8,17938,,"posNeg",18252,4,,,,,,214,"7/16/2020 21:40","2020-07-16T21:40:00Z","07/16 17:40",5,,,"2020-07-16T21:40:00Z",18224,,,306,,,,,145,2,,,,,,,,,"66",0,241,18252,241,18252,,0,0,"96e2870f2b00056713f58a81ed9943b209b478ff",0,0,0,0,0,""
20200716,"GU",314,8,17697,,"posNeg",18011,4,,,,,,214,"7/15/2020 22:45","2020-07-15T22:45:00Z","07/15 18:45",5,,,"2020-07-15T22:45:00Z",18003,,,306,,,,,145,2,,,,,,,,,"66",1,183,18011,184,18011,,0,0,"5b51e83e7c879288b50f26015b1639438ac5d8f1",0,0,0,0,0,""
20200715,"GU",313,8,17514,,"posNeg",17827,4,,,,,,213,"7/14/2020 22:15","2020-07-14T22:15:00Z","07/14 18:15",5,,,"2020-07-14T22:15:00Z",17819,,,305,,,,,142,2,,,,,,,,,"66",1,289,17827,290,17827,,0,0,"d228b315c9209ced84c6d1941a406f5a3de95690",0,0,0,0,0,""
20200714,"GU",312,8,17225,,"posNeg",17537,3,,,,,,210,"7/13/2020 21:35","2020-07-13T21:35:00Z","07/13 17:35",5,,,"2020-07-13T21:35:00Z",17529,,,304,,,,,142,2,,,,,,,,,"66",0,195,17537,195,17537,,0,0,"c4bfde5341112a3ec099a5155e648f6447605de5",0,0,0,0,0,""
20200713,"GU",312,8,17030,,"posNeg",17342,3,,,,,,202,"7/12/2020 21:45","2020-07-12T21:45:00Z","07/12 17:45",5,,,"2020-07-12T21:45:00Z",17334,,,304,,,,,142,2,,,,,,,,,"66",0,363,17342,363,17342,,0,0,"8662a1f6af5b93010976b80e89b8b20d9e10149b",0,0,0,0,0,""
20200712,"GU",312,8,16667,,"posNeg",16979,3,,,,,,202,"7/10/2020 23:15","2020-07-10T23:15:00Z","07/10 19:15",5,,,"2020-07-10T23:15:00Z",16858,,,304,,,,,142,2,,,,,,,,,"66",0,0,16979,0,16979,,0,0,"342cd69d6c00d0389810cdd7a1c405b32182b0d3",0,0,0,0,0,""
20200711,"GU",312,8,16667,,"posNeg",16979,3,,,,,,202,"7/10/2020 23:15","2020-07-10T23:15:00Z","07/10 19:15",5,,,"2020-07-10T23:15:00Z",16858,,,304,,,,,142,2,,,,,,,,,"66",2,111,16979,113,16979,,0,0,"ba686b512747761991b1761b790826279121f9f4",0,0,0,0,0,""
20200710,"GU",310,8,16556,,"posNeg",16866,3,,,,,,202,"7/9/2020 22:00","2020-07-09T22:00:00Z","07/09 18:00",5,,,"2020-07-09T22:00:00Z",16858,,,302,,,,,142,2,,,,,,,,,"66",1,333,16866,334,16866,,0,0,"85d3b2e0afc64d84764a5c93745a6dca622f6c28",0,0,0,0,0,""
20200709,"GU",309,8,16223,,"posNeg",16532,3,,,,,,202,"7/8/2020 22:00","2020-07-08T22:00:00Z","07/08 18:00",5,,,"2020-07-08T22:00:00Z",16526,,,301,,,,,142,2,,,,,,,,,"66",2,390,16532,392,16532,,0,0,"cc55bb95fd92e98265c32f78a6e64e107d4e2ea0",0,0,0,0,0,""
20200708,"GU",307,8,15833,,"posNeg",16140,3,,,,,,202,"7/7/2020 21:45","2020-07-07T21:45:00Z","07/07 17:45",5,,,"2020-07-07T21:45:00Z",16232,,,299,,,,,142,2,,,,,,,,,"66",4,225,16140,229,16140,,0,0,"097871818d18365284045e6fe1bd39c0282e2e1e",0,0,0,0,0,""
20200707,"GU",303,8,15608,,"posNeg",15911,3,,,,,,184,"7/6/2020 22:15","2020-07-06T22:15:00Z","07/06 18:15",5,,,"2020-07-06T22:15:00Z",15903,,,295,,,,,142,2,,,,,,,,,"66",2,360,15911,362,15911,,0,0,"351b4a2c245ac6815a5df10326e805201ecdd88e",0,0,0,0,0,""
20200706,"GU",301,8,15248,,"posNeg",15549,2,,,,,,179,"7/5/2020 23:45","2020-07-05T23:45:00Z","07/05 19:45",5,,,"2020-07-05T23:45:00Z",15541,,,293,,,,,142,2,,,,,,,,,"66",13,582,15549,595,15549,,0,0,"413a94ddd0a37501ecab714b515f4ed2d2ad84e3",0,0,0,0,0,""
20200705,"GU",288,8,14666,,"posNeg",14954,3,,,,,,179,"7/3/2020 22:30","2020-07-03T22:30:00Z","07/03 18:30",5,,,"2020-07-03T22:30:00Z",13925,,,280,,,,,128,2,,,,,,,,,"66",0,0,14954,0,14954,,0,0,"3360570232ba85dc4985278c24d82d76f1b037b0",0,0,0,0,0,""
20200704,"GU",288,8,14666,,"posNeg",14954,3,,,,,,179,"7/3/2020 22:30","2020-07-03T22:30:00Z","07/03 18:30",5,,,"2020-07-03T22:30:00Z",13925,,,280,,,,,128,2,,,,,,,,,"66",2,403,14954,405,14954,,0,0,"743c3d410f3242c7e82844bf92c51bce2f913163",0,0,0,0,0,""
20200703,"GU",286,8,14263,,"posNeg",14549,2,,,,,,179,"7/3/2020 00:00","2020-07-03T00:00:00Z","07/02 20:00",5,,,"2020-07-03T00:00:00Z",13925,,,278,,,,,128,2,,,,,,,,,"66",6,610,14549,616,14549,,0,0,"458d11e33b545dc233cbaa60cde9d960cb89029e",0,0,0,0,0,""
20200702,"GU",280,8,13653,,"posNeg",13933,1,,,,,,179,"7/1/2020 22:10","2020-07-01T22:10:00Z","07/01 18:10",5,,,"2020-07-01T22:10:00Z",13925,,,272,,,,,128,2,,,,,,,,,"66",13,136,13933,149,13933,,0,0,"1976972155f5068bbd7f296e3e81ba2c218a0070",0,0,0,0,0,""
20200701,"GU",267,8,13517,,"posNeg",13784,0,,,,,,179,"6/30/2020 08:15","2020-06-30T08:15:00Z","06/30 04:15",5,,,"2020-06-30T08:15:00Z",13411,,,259,,,,,128,2,,,,,,,,,"66",8,461,13784,469,13784,,0,0,"7f62535e343acf08872326f0bd65c37b57072fe2",0,0,0,0,0,""
20200630,"GU",259,8,13056,,"posNeg",13315,0,,,,,,179,"6/30/2020 08:15","2020-06-30T08:15:00Z","06/30 04:15",5,,,"2020-06-30T08:15:00Z",13041,,,251,,,,,128,2,,,,,,,,,"66",4,397,13315,401,13315,,0,0,"51d36ead7b9d6fb186ba005fa2e0382ce789b8a7",0,0,0,0,0,""
20200629,"GU",255,8,12659,,"posNeg",12914,0,,,,,,179,"6/29/2020 07:30","2020-06-29T07:30:00Z","06/29 03:30",5,,,"2020-06-29T07:30:00Z",12841,,,247,,,,,128,2,,,,,,,,,"66",7,529,12914,536,12914,,0,0,"c23d4ef300b25fe296a3f52191c5774feb4c054e",0,0,0,0,0,""
20200628,"GU",248,8,12130,,"posNeg",12378,1,,,,,,179,"6/28/2020 03:30","2020-06-28T03:30:00Z","06/27 23:30",5,,,"2020-06-28T03:30:00Z",11523,,,240,,,,,125,2,,,,,,,,,"66",0,227,12378,227,12378,,0,0,"07dc0083bf772b0f55a03c512869eaaa23a382e1",0,0,0,0,0,""
20200627,"GU",248,8,11903,,"posNeg",12151,1,,,,,,179,"6/27/2020 05:45","2020-06-27T05:45:00Z","06/27 01:45",5,,,"2020-06-27T05:45:00Z",11523,,,240,,,,,125,2,,,,,,,,,"66",0,259,12151,259,12151,,0,0,"1f3c73ecb6012924303a7c73f8bee92dcda5c78e",0,0,0,0,0,""
20200626,"GU",248,8,11644,,"posNeg",11892,1,,,,,,179,"6/26/2020 07:30","2020-06-26T07:30:00Z","06/26 03:30",5,,,"2020-06-26T07:30:00Z",11523,,,240,,,,,125,2,,,,,,,,,"66",3,471,11892,474,11892,,0,0,"178cee567738a2314257419f784f644a81d42f36",0,0,0,0,0,""
20200625,"GU",245,8,11173,,"posNeg",11418,0,,0,,0,,174,"6/25/2020 07:15","2020-06-25T07:15:00Z","06/25 03:15",5,,,"2020-06-25T07:15:00Z",11101,,,237,,,,,122,2,,,,,,,,,"66",14,366,11418,380,11418,,0,0,"86e233f36e8e57d0b583b8a43be53ebc5acedf67",0,0,0,0,0,""
20200624,"GU",231,8,10807,,"posNeg",11038,0,,0,,0,,174,"6/24/2020 08:00","2020-06-24T08:00:00Z","06/24 04:00",5,,,"2020-06-24T08:00:00Z",10711,,,223,,,,,122,2,,,,,,,,,"66",6,381,11038,387,11038,,0,0,"0534ba3510d7a677b1522659d1cb1d38c66ff4ad",0,0,0,0,0,""
20200623,"GU",225,8,10426,,"posNeg",10651,0,,0,,0,,174,"6/23/2020 08:00","2020-06-23T08:00:00Z","06/23 04:00",5,,,"2020-06-23T08:00:00Z",10445,,,217,,,,,122,2,,,,,,,,,"66",1,246,10651,247,10651,,0,0,"b3f9f19136f3b48d6967bef1c3abcc9bf563d170",0,0,0,0,0,""
20200622,"GU",224,8,10180,,"posNeg",10404,0,,0,,0,,173,"6/22/2020 08:00","2020-06-22T08:00:00Z","06/22 04:00",5,,,"2020-06-22T08:00:00Z",10293,,,216,,,,,122,2,,,,,,,,,"66",2,392,10404,394,10404,,0,0,"788f3d8d81e6d651db019793dec69e71641566e0",0,0,0,0,0,""
20200621,"GU",222,8,9788,,"posNeg",10010,0,,0,,0,,173,"6/19/2020 22:00","2020-06-19T22:00:00Z","06/19 18:00",5,,,"2020-06-19T22:00:00Z",10066,,,214,,,,,116,2,,,,,,,,,"66",0,0,10010,0,10010,,0,0,"3f8114dcb22ef877bb3229600b562474fa766867",0,0,0,0,0,""
20200620,"GU",222,8,9788,,"posNeg",10010,0,,0,,0,,173,"6/19/2020 22:00","2020-06-19T22:00:00Z","06/19 18:00",5,,,"2020-06-19T22:00:00Z",10066,,,214,,,,,116,2,,,,,,,,,"66",22,273,10010,295,10010,,0,0,"0e6bf239486dfbf3b927e332bfae0e1e94ca5e00",0,0,0,0,0,""
20200619,"GU",200,8,9515,,"posNeg",9715,0,,0,,0,,173,"6/19/2020 07:30","2020-06-19T07:30:00Z","06/19 03:30",5,,,"2020-06-19T07:30:00Z",9707,,,192,,,,,114,2,,,,,,,,,"66",7,120,9715,127,9715,,0,0,"88b995767f8336a5333126f9a5fa4a812b74e93f",0,0,0,0,0,""
20200618,"GU",193,8,9395,,"posNeg",9588,0,,0,,0,,170,"6/18/2020 06:45","2020-06-18T06:45:00Z","06/18 02:45",5,,,"2020-06-18T06:45:00Z",9260,,,185,,,,,114,2,,,,,,,,,"66",5,385,9588,390,9588,,0,0,"798288b0fd31de3bfc1d38e8176c6c182c0b4e2a",0,0,0,0,0,""
20200617,"GU",188,8,9010,,"posNeg",9198,0,,0,,0,,170,"6/17/2020 06:45","2020-06-17T06:45:00Z","06/17 02:45",5,,,"2020-06-17T06:45:00Z",9096,,,180,,,,,114,2,,,,,,,,,"66",2,164,9198,166,9198,,0,0,"e17d355fbf2ff81e166d7f96a85be371c54f20fe",0,0,0,0,0,""
20200616,"GU",186,8,8846,,"posNeg",9032,,,,,,,169,"6/16/2020 07:30","2020-06-16T07:30:00Z","06/16 03:30",5,,,"2020-06-16T07:30:00Z",8801,,,178,,,,,114,2,,,,,,,,,"66",1,273,9032,274,9032,,0,0,"ed4b41c6c9b5446474f8b0507f79a4a75d6a4f49",0,0,0,0,0,""
20200615,"GU",185,8,8573,,"posNeg",8758,,,,,,,169,"6/15/2020 05:50","2020-06-15T05:50:00Z","06/15 01:50",5,,,"2020-06-15T05:50:00Z",8706,,,177,,,,,114,2,,,,,,,,,"66",0,215,8758,215,8758,,0,0,"23617b34bd38b27909cd85b60946def030ff494a",0,0,0,0,0,""
20200614,"GU",185,8,8358,,"posNeg",8543,,,,,,,168,"6/14/2020 01:25","2020-06-14T01:25:00Z","06/13 21:25",5,,,"2020-06-14T01:25:00Z",8426,,,177,,,,,110,2,,,,,,,,,"66",0,0,8543,0,8543,,0,0,"d9e3fcb49bd2918dbced2e1d727eb95df8ac7ba2",0,0,0,0,0,""
20200613,"GU",185,0,8358,,"posNeg",8543,,,,,,,168,"6/13/2020 00:30","2020-06-13T00:30:00Z","06/12 20:30",5,,,"2020-06-13T00:30:00Z",8426,,,185,,,,,110,2,,,,,,,,,"66",1,15,8543,16,8543,,0,0,"82610e109c773eaa71666f74f348b4d303d279bc",0,0,0,0,0,""
20200612,"GU",184,10,8343,,"posNeg",8527,,,,,,,168,"6/12/2020 05:00","2020-06-12T05:00:00Z","06/12 01:00",5,,,"2020-06-12T05:00:00Z",8426,,,174,,,,,110,2,,,,,,,,,"66",1,146,8527,147,8527,,0,0,"f6166d545601a3b93fb1afca146a1e60e7d5581b",0,0,0,0,0,""
20200611,"GU",183,8,8197,,"posNeg",8380,,,,,,,168,"6/11/2020 08:00","2020-06-11T08:00:00Z","06/11 04:00",5,,,"2020-06-11T08:00:00Z",8366,,,175,,,,,109,2,,,,,,,,,"66",1,97,8380,98,8380,,0,0,"acbbd0cd78bb1e9ae30355eb7f9c6e73592ed2d5",0,0,0,0,0,""
20200610,"GU",182,8,8100,,"posNeg",8282,,,,,,,164,"6/10/2020 07:00","2020-06-10T07:00:00Z","06/10 03:00",5,,,"2020-06-10T07:00:00Z",8076,,,174,,,,,109,2,,,,,,,,,"66",2,304,8282,306,8282,,0,0,"0f149a910e52b55fff3b79fa852fe9451b56843c",0,0,0,0,0,""
20200609,"GU",180,8,7796,,"posNeg",7976,,,,,,,163,"6/9/2020 07:00","2020-06-09T07:00:00Z","06/09 03:00",5,,,"2020-06-09T07:00:00Z",7797,,,172,,,,,109,2,,,,,,,,,"66",1,246,7976,247,7976,,0,0,"8bb47498fc57f18b440c8707c9d774d4a8255765",0,0,0,0,0,""
20200608,"GU",179,8,7550,,"posNeg",7729,,,,,,,163,"6/8/2020 07:00","2020-06-08T07:00:00Z","06/08 03:00",5,,,"2020-06-08T07:00:00Z",7729,,,171,,,,,109,2,,,,,,,,,"66",0,266,7729,266,7729,,0,0,"7ab27ff4e429fb779e28cd7a8002f659fb99cec8",0,0,0,0,0,""
20200607,"GU",179,8,7284,,"posNeg",7463,,,,,,,162,"6/6/2020 01:45","2020-06-06T01:45:00Z","06/05 21:45",5,,,"2020-06-06T01:45:00Z",7116,,,171,,,,,105,2,,,,,,,,,"66",0,0,7463,0,7463,,0,0,"e1f7a900746fca3b7890d24fee03e7bfbb6979eb",0,0,0,0,0,""
20200606,"GU",179,8,7284,,"posNeg",7463,,,,,,,162,"6/6/2020 01:45","2020-06-06T01:45:00Z","06/05 21:45",5,,,"2020-06-06T01:45:00Z",7116,,,171,,,,,105,2,,,,,,,,,"66",0,89,7463,89,7463,,0,0,"533ac9ba325670cbdf68c3a5ec3b2626a648c7cc",0,0,0,0,0,""
20200605,"GU",179,8,7195,,"posNeg",7374,,,,,,,162,"6/5/2020 07:30","2020-06-05T07:30:00Z","06/05 03:30",5,,,"2020-06-05T07:30:00Z",7116,,,171,,,,,105,2,,,,,,,,,"66",0,390,7374,390,7374,,0,0,"95d9e2d930efee02d33f8c4d301144b86fdb9027",0,0,0,0,0,""
20200604,"GU",179,8,6805,,"posNeg",6984,,,,,,,162,"6/4/2020 06:45","2020-06-04T06:45:00Z","06/04 02:45",5,,,"2020-06-04T06:45:00Z",6829,,,171,,,,,94,2,,,,,,,,,"66",1,256,6984,257,6984,,0,0,"6c799ea3db95106665606779202ddb6c6db69b5a",0,0,0,0,0,""
20200603,"GU",178,8,6549,,"posNeg",6727,,,,,,,151,"6/3/2020 08:00","2020-06-03T08:00:00Z","06/03 04:00",5,,,"2020-06-03T08:00:00Z",6497,,,170,,,,,93,2,,,,,,,,,"66",1,335,6727,336,6727,,0,0,"a3a258d63fda9b9c900267be6c82fdddf9fcf445",0,0,0,0,0,""
20200602,"GU",177,10,6214,,"posNeg",6391,,,,,,,148,"6/2/2020 06:15","2020-06-02T06:15:00Z","06/02 02:15",5,,,"2020-06-02T06:15:00Z",6354,,,167,,,,,93,2,,,,,,,,,"66",2,73,6391,75,6391,,0,0,"475f907b0b3eec973898fd132c71c6f3b7fad41d",0,0,0,0,0,""
20200601,"GU",175,8,6141,,"posNeg",6316,,,,,,,145,"6/1/2020 06:35","2020-06-01T06:35:00Z","06/01 02:35",5,,,"2020-06-01T06:35:00Z",6281,,,167,,,,,85,2,,,,,,,,,"66",2,212,6316,214,6316,,0,0,"bb6be291def5e3f50d013e09203cee8e6da3a47e",0,0,0,0,0,""
20200531,"GU",173,7,5929,,"posNeg",6102,,,,,,,144,"5/30/2020 03:05","2020-05-30T03:05:00Z","05/29 23:05",5,,,"2020-05-30T03:05:00Z",6011,,,166,,,,,54,1,,,,,,,,,"66",0,0,6102,0,6102,,0,0,"29411fe0b59062202151d320269f051edd35fd34",0,0,0,0,0,""
20200530,"GU",173,7,5929,,"posNeg",6102,,,,,,,144,"5/30/2020 03:05","2020-05-30T03:05:00Z","05/29 23:05",5,,,"2020-05-30T03:05:00Z",6011,,,166,,,,,54,1,,,,,,,,,"66",1,6,6102,7,6102,,0,0,"6b43ffdb269ed51a5fbdd02c92d7b075d6a6203b",0,0,0,0,0,""
20200529,"GU",172,7,5923,,"posNeg",6095,,,,,,,144,"5/29/2020 05:45","2020-05-29T05:45:00Z","05/29 01:45",5,,,"2020-05-29T05:45:00Z",6011,,,165,,,,,54,1,,,,,,,,,"66",0,133,6095,133,6095,,0,0,"6980e001efca79eda67929994779fde96009902b",0,0,0,0,0,""
20200528,"GU",172,8,5790,,"posNeg",5962,,,,,,,143,"5/28/2020 07:45","2020-05-28T07:45:00Z","05/28 03:45",5,,,"2020-05-28T07:45:00Z",5894,,,164,,,,,54,1,,,,,,,,,"66",2,275,5962,277,5962,,0,0,"86d13816b6431202612afe7c717b1dfd033692df",0,0,0,0,0,""
20200527,"GU",170,7,5515,,"posNeg",5685,1,,,,,,143,"5/27/2020 08:15","2020-05-27T08:15:00Z","05/27 04:15",5,,,"2020-05-27T08:15:00Z",5749,,,163,,,,,54,1,,,,,,,,,"66",1,0,5685,1,5685,,0,0,"d7f7f2afbc91c50c932dc8cd8246b32d4b6e4024",0,0,0,0,0,""
20200526,"GU",169,8,5515,,"posNeg",5684,,,,,,,139,"5/26/2020 06:30","2020-05-26T06:30:00Z","05/26 02:30",5,,,"2020-05-26T06:30:00Z",5704,,,161,,,,,,,,,,,,,,,"66",3,112,5684,115,5684,,0,0,"ef249605d30fa36c71abca9d4cbeb7b3c1b4701c",0,0,0,0,0,""
20200525,"GU",166,5,5403,,"posNeg",5569,,,,,,,138,"5/25/2020 00:15","2020-05-25T00:15:00Z","05/24 20:15",5,,,"2020-05-25T00:15:00Z",5704,,,161,,,,,,,,,,,,,,,"66",0,0,5569,0,5569,,0,0,"e770005f8e576d39d9cc35bb0f1d7da14a7cb017",0,0,0,0,0,""
20200524,"GU",166,5,5403,,"posNeg",5569,,,,,,,138,"5/23/2020 18:00","2020-05-23T18:00:00Z","05/23 14:00",5,,,"2020-05-23T18:00:00Z",5704,,,161,,,,,,,,,,,,,,,"66",1,209,5569,210,5569,,0,0,"665ef9349fb534897c65d634b540707f5e19445a",0,0,0,0,0,""
20200523,"GU",165,5,5194,,"posNeg",5359,,,,,,,134,"5/23/2020 02:35","2020-05-23T02:35:00Z","05/22 22:35",5,,,"2020-05-23T02:35:00Z",5487,,,160,,,,,,,,,,,,,,,"66",0,80,5359,80,5359,,0,0,"ebd5ce19d979f863a36bd5649fbaca30355eee63",0,0,0,0,0,""
20200522,"GU",165,5,5114,,"posNeg",5279,,,,,,,125,"5/22/2020 05:35","2020-05-22T05:35:00Z","05/22 01:35",5,,,"2020-05-22T05:35:00Z",5331,,,160,,,,,,,,,,,,,,,"66",0,215,5279,215,5279,,0,0,"f6e8938ccd3739860f53fa9c3ac4ab2adc2334c5",0,0,0,0,0,""
20200521,"GU",165,5,4899,,"posNeg",5064,,,,,,,125,"5/21/2020 08:00","2020-05-21T08:00:00Z","05/21 04:00",5,,,"2020-05-21T08:00:00Z",5167,,,160,,,,,,,,,,,,,,,"66",0,92,5064,92,5064,,0,0,"2daf50608fa3b9780fe058673c51f461de8a7761",0,0,0,0,0,""
20200520,"GU",165,5,4807,,"posNeg",4972,,,,,,,125,"5/20/2020 06:30","2020-05-20T06:30:00Z","05/20 02:30",5,,,"2020-05-20T06:30:00Z",5035,,,160,,,,,,,,,,,,,,,"66",11,134,4972,145,4972,,0,0,"f21a8b1764c13a1dd887d0417af6dbd3043b89cd",0,0,0,0,0,""
20200519,"GU",154,5,4673,,"posNeg",4827,,,,,,,126,"5/19/2020 05:45","2020-05-19T05:45:00Z","05/19 01:45",5,,,"2020-05-19T05:45:00Z",4920,,,149,,,,,,,,,,,,,,,"66",0,104,4827,104,4827,,0,0,"08138588651c8b59e12de24bd681de6bf96a6d4e",0,0,0,0,0,""
20200518,"GU",154,5,4569,,"posNeg",4723,,,,,,,126,"5/16/2020 04:30","2020-05-16T04:30:00Z","05/16 00:30",5,,,"2020-05-16T04:30:00Z",,,,149,,,,,,,,,,,,,,,"66",0,119,4723,119,4723,,0,0,"03c9c4326ca732105de463f9d19a7db5d0163755",0,0,0,0,0,""
20200517,"GU",154,5,4450,,"posNeg",4604,,,,,,,126,"5/16/2020 04:30","2020-05-16T04:30:00Z","05/16 00:30",5,,,"2020-05-16T04:30:00Z",,,,149,,,,,,,,,,,,,,,"66",0,85,4604,85,4604,,0,0,"e0927ebf8a97ee8454446f5bab880b777ad5215c",0,0,0,0,0,""
20200516,"GU",154,5,4365,,"posNeg",4519,,,,,,,126,"5/16/2020 04:30","2020-05-16T04:30:00Z","05/16 00:30",5,,,"2020-05-16T04:30:00Z",,,,149,,,,,,,,,,,,,,,"66",0,4,4519,4,4519,,0,0,"513f9cb159a57424c17f5e6d85880984b80e416e",0,0,0,0,0,""
20200515,"GU",154,4,4361,,"posNeg",4515,,,,,,,124,"5/15/2020 04:45","2020-05-15T04:45:00Z","05/15 00:45",5,,,"2020-05-15T04:45:00Z",,,,150,,,,,,,,,,,,,,,"66",1,135,4515,136,4515,,0,0,"9d4a5a7f4b0e228aa28519d6ae9d1ef9808888b6",0,0,0,0,0,""
20200514,"GU",153,4,4226,,"posNeg",4379,,,,,,,124,"5/14/2020 05:45","2020-05-14T05:45:00Z","05/14 01:45",5,,,"2020-05-14T05:45:00Z",,,,149,,,,,,,,,,,,,,,"66",1,116,4379,117,4379,,0,0,"aee729fc14fc12317771d01aed8f3339f0fe7258",0,0,0,0,0,""
20200513,"GU",152,4,4110,,"posNeg",4262,,,,,,,124,"5/13/2020 07:55","2020-05-13T07:55:00Z","05/13 03:55",5,,,"2020-05-13T07:55:00Z",,,,148,,,,,,,,,,,,,,,"66",0,171,4262,171,4262,,0,0,"295d7170cee39fa985461eb692c363e6f427c28f",0,0,0,0,0,""
20200512,"GU",152,4,3939,,"posNeg",4091,,,,,,,124,"5/11/2020 18:00","2020-05-11T18:00:00Z","05/11 14:00",5,,,"2020-05-11T18:00:00Z",,,,148,,,,,,,,,,,,,,,"66",1,101,4091,102,4091,,0,0,"65f485c25d0f900f7a2e11dbb37ba4f60610c563",0,0,0,0,0,""
20200511,"GU",151,4,3838,,"posNeg",3989,,,,,,,124,"5/11/2020 06:45","2020-05-11T06:45:00Z","05/11 02:45",5,,,"2020-05-11T06:45:00Z",,,,147,,,,,,,,,,,,,,,"66",0,195,3989,195,3989,,0,0,"fbb540c42bfe2f2559b98739ef71f1f248444d0d",0,0,0,0,0,""
20200510,"GU",151,4,3643,,"posNeg",3794,,,,,,,124,"5/9/2020 03:50","2020-05-09T03:50:00Z","05/08 23:50",5,,,"2020-05-09T03:50:00Z",,,,147,,,,,,,,,,,,,,,"66",0,0,3794,0,3794,,0,0,"25e104b61e106f00b8adcb8c65053e2932bd3c4a",0,0,0,0,0,""
20200509,"GU",151,4,3643,,"posNeg",3794,,,,,,,124,"5/9/2020 00:00","2020-05-09T00:00:00Z","05/08 20:00",5,,,"2020-05-09T00:00:00Z",,,,147,,,,,,,,,,,,,,,"66",0,17,3794,17,3794,,0,0,"91228e4f74893fdb2f4c1b540e6e66a2efffd628",0,0,0,0,0,""
20200508,"GU",151,4,3626,,"posNeg",3777,,,,,,,122,"5/8/2020 00:00","2020-05-08T00:00:00Z","05/07 20:00",5,,,"2020-05-08T00:00:00Z",,,,147,,,,,,,,,,,,,,,"66",0,62,3777,62,3777,,0,0,"bb8af7307151592bb8b0cc84ce9248434db382d0",0,0,0,0,0,""
20200507,"GU",151,4,3564,,"posNeg",3715,,,,,,,123,"5/7/2020 00:00","2020-05-07T00:00:00Z","05/06 20:00",5,,,"2020-05-07T00:00:00Z",,,,147,,,,,,,,,,,,,,,"66",0,88,3715,88,3715,,0,0,"279d0761025479c97c41bdb0e11a13933314ab22",0,0,0,0,0,""
20200506,"GU",151,4,3476,,"posNeg",3627,,,,,,,123,"5/6/2020 00:00","2020-05-06T00:00:00Z","05/05 20:00",5,,,"2020-05-06T00:00:00Z",,,,147,,,,,,,,,,,,,,,"66",2,135,3627,137,3627,,0,0,"4a712d945f4992c6a9195a6114ece9f25afa5890",0,0,0,0,0,""
20200505,"GU",149,4,3341,,"posNeg",3490,,,,,,,124,"5/5/2020 09:00","2020-05-05T09:00:00Z","05/05 05:00",5,,,"2020-05-05T09:00:00Z",,,,145,,,,,,,,,,,,,,,"66",0,99,3490,99,3490,,0,0,"5239a1f2225278f75115042422a291829c21c888",0,0,0,0,0,""
20200504,"GU",149,4,3242,,"posNeg",3391,,,,,,,125,"5/4/2020 07:40","2020-05-04T07:40:00Z","05/04 03:40",5,,,"2020-05-04T07:40:00Z",,,,145,,,,,,,,,,,,,,,"66",-1,90,3391,89,3391,,0,0,"57ef545988014d38e5c3e7ffd886583521d777d4",0,0,0,0,0,""
20200503,"GU",150,4,3152,,"posNeg",3302,,,,,,,126,"5/3/2020 06:20","2020-05-03T06:20:00Z","05/03 02:20",5,,,"2020-05-03T06:20:00Z",,,,146,,,,,,,,,,,,,,,"66",2,112,3302,114,3302,,0,0,"fde6c0b0bbea68b0cd3fdb7f667e92d6fa5624c1",0,0,0,0,0,""
20200502,"GU",148,4,3040,,"posNeg",3188,,,,,,,131,"5/2/2020 08:15","2020-05-02T08:15:00Z","05/02 04:15",5,,,"2020-05-02T08:15:00Z",,,,144,,,,,,,,,,,,,,,"66",2,181,3188,183,3188,,0,0,"f722dcdd707f08960492b248296f624f85fb8b2b",0,0,0,0,0,""
20200501,"GU",146,4,2859,,"posNeg",3005,,,,,,,131,"5/1/2020 08:15","2020-05-01T08:15:00Z","05/01 04:15",5,,,"2020-05-01T08:15:00Z",,,,142,,,,,,,,,,,,,,,"66",0,897,3005,897,3005,,0,0,"b5c47a3b8f2a1fe28f3875351f819da52e39eb4f",0,0,0,0,0,""
20200430,"GU",146,4,1962,,"posNeg",2108,,,,,,,131,"4/30/2020 09:15","2020-04-30T09:15:00Z","04/30 05:15",5,,,"2020-04-30T09:15:00Z",,,,142,,,,,,,,,,,,,,,"66",1,260,2108,261,2108,,0,0,"4dde8b835ea9b6d19603d0bb01c0bf9979fb702b",0,0,0,0,0,""
20200429,"GU",145,4,1702,,"posNeg",1847,,,,,,,130,"4/29/2020 09:35","2020-04-29T09:35:00Z","04/29 05:35",5,,,"2020-04-29T09:35:00Z",,,,141,,,,,,,,,,,,,,,"66",1,164,1847,165,1847,,0,0,"22835c6d00bc148bbaf99ccf17df1cbeae4d3cef",0,0,0,0,0,""
20200428,"GU",144,4,1538,,"posNeg",1682,3,,,,,,129,"4/28/2020 09:15","2020-04-28T09:15:00Z","04/28 05:15",5,,,"2020-04-28T09:15:00Z",,,,140,,,,,,,,,,,,,,,"66",2,114,1682,116,1682,,0,0,"e5bae475b6596f0869fe2a208222e8644256d7d3",0,0,0,0,0,""
20200427,"GU",142,4,1424,,"posNeg",1566,3,,,,,,128,"4/27/2020 07:20","2020-04-27T07:20:00Z","04/27 03:20",5,,,"2020-04-27T07:20:00Z",,,,138,,,,,,,,,,,,,,,"66",1,37,1566,38,1566,,0,0,"2bc1d729bbcbbb552ab546e0fecd2cdb5d7802df",0,0,0,0,0,""
20200426,"GU",141,4,1387,,"posNeg",1528,2,,,,,,128,"4/26/2020 07:30","2020-04-26T07:30:00Z","04/26 03:30",5,,,"2020-04-26T07:30:00Z",,,,137,,,,,,,,,,,,,,,"66",0,79,1528,79,1528,,0,0,"1ac92b0670296b4043729e023dd189b2670c1a10",0,0,0,0,0,""
20200425,"GU",141,4,1308,,"posNeg",1449,2,,,,,,128,"4/25/2020 07:30","2020-04-25T07:30:00Z","04/25 03:30",5,,,"2020-04-25T07:30:00Z",,,,137,,,,,,,,,,,,,,,"66",1,75,1449,76,1449,,0,0,"4bb59bb086146386f36e118bc9a8c7f4ca551e41",0,0,0,0,0,""
20200424,"GU",140,4,1233,,"posNeg",1373,2,,,,,,126,"4/24/2020 07:40","2020-04-24T07:40:00Z","04/24 03:40",5,,,"2020-04-24T07:40:00Z",,,,136,,,,,,,,,,,,,,,"66",2,53,1373,55,1373,,0,0,"f0cdcae6625c9ab9f816e8f054d87dd0ae2b20d8",0,0,0,0,0,""
20200423,"GU",138,3,1180,,"posNeg",1318,2,,,,,,126,"4/23/2020 07:45","2020-04-23T07:45:00Z","04/23 03:45",5,,,"2020-04-23T07:45:00Z",,,,135,,,,,,,,,,,,,,,"66",4,94,1318,98,1318,,0,0,"2806960706372789eda4f264976cd627b7cd2a3e",0,0,0,0,0,""
20200422,"GU",134,3,1086,,"posNeg",1220,3,,2,,,,119,"4/22/2020 07:45","2020-04-22T07:45:00Z","04/22 03:45",5,,,"2020-04-22T07:45:00Z",,,,133,,,,,,,,,,,,,,,"66",1,53,1220,54,1220,,0,0,"33612933252e49a203c3cfc770e01efb1950053a",0,0,0,0,0,""
20200421,"GU",133,3,1033,,"posNeg",1166,3,,2,,,,114,"4/21/2020 08:05","2020-04-21T08:05:00Z","04/21 04:05",5,,,"2020-04-21T08:05:00Z",,,,133,,,,,,,,,,,,,,,"66",0,42,1166,42,1166,,0,0,"92b1bf134aea228a258af6f82dd4760e75e1f08c",0,0,0,0,0,""
20200420,"GU",133,3,991,,"posNeg",1124,3,,2,,,,112,"4/20/2020 06:50","2020-04-20T06:50:00Z","04/20 02:50",5,,,"2020-04-20T06:50:00Z",,,,133,,,,,,,,,,,,,,,"66",0,48,1124,48,1124,,0,0,"61c42b11ce84cdcbe69641ae8817f45d4a5a5496",0,0,0,0,0,""
20200419,"GU",133,3,943,,"posNeg",1076,6,,2,,,,112,"4/19/2020 05:00","2020-04-19T05:00:00Z","04/19 01:00",5,,,"2020-04-19T05:00:00Z",,,,133,,,,,,,,,,,,,,,"66",0,0,1076,0,1076,,0,0,"36ee3544848482eb4153230e2ec61e212f954620",0,0,0,0,0,""
20200418,"GU",133,,943,,"posNeg",1076,6,,2,,,,110,"4/18/2020 06:50","2020-04-18T06:50:00Z","04/18 02:50",5,,,"2020-04-18T06:50:00Z",,,,,,,,,,,,,,,,,,,"66",0,3,1076,3,1076,,0,0,"428735024501d4c722c2d404fa6426d2d0297c1d",0,0,0,0,0,""
20200417,"GU",133,,940,,"posNeg",1073,6,,2,,,,97,"4/17/2020 07:00","2020-04-17T07:00:00Z","04/17 03:00",5,,,"2020-04-17T07:00:00Z",,,,,,,,,,,,,,,,,,,"66",0,70,1073,70,1073,,0,0,"1a7a7c6c0865e3494eb9deb701f4de1a555cd68f",0,0,0,0,0,""
20200416,"GU",133,,870,,"posNeg",1003,9,,,,,,86,"4/16/2020 07:45","2020-04-16T07:45:00Z","04/16 03:45",5,,,"2020-04-16T07:45:00Z",,,,,,,,,,,,,,,,,,,"66",0,27,1003,27,1003,,0,0,"f2c9aa956b9702dee0f31930247ca8f1155b9210",0,0,0,0,0,""
20200415,"GU",133,,843,,"posNeg",976,9,,2,,2,,73,"4/15/2020 07:45","2020-04-15T07:45:00Z","04/15 03:45",5,,,"2020-04-15T07:45:00Z",,,,,,,,,,,,,,,,,,,"66",0,32,976,32,976,,0,0,"8617bba6d4f5d51da09ff3eab1b7674f2568dc49",0,0,0,0,0,""
20200414,"GU",133,,811,,"posNeg",944,13,,2,,2,,66,"4/14/2020 08:15","2020-04-14T08:15:00Z","04/14 04:15",5,,,"2020-04-14T08:15:00Z",,,,,,,,,,,,,,,,,,,"66",0,41,944,41,944,,0,0,"5d94f5b5be8a02f63a4d0bd32712d2124c5e700c",0,0,0,0,0,""
20200413,"GU",133,,770,,"posNeg",903,12,,2,,2,,58,"4/13/2020 08:00","2020-04-13T08:00:00Z","04/13 04:00",5,,,"2020-04-13T08:00:00Z",,,,,,,,,,,,,,,,,,,"66",0,77,903,77,903,,0,0,"bec1db359c20f838cdff034075b39b16e96f6132",0,0,0,0,0,""
20200412,"GU",133,,693,,"posNeg",826,13,,2,,2,,58,"4/11/2020 07:40","2020-04-11T07:40:00Z","04/11 03:40",5,,,"2020-04-11T07:40:00Z",,,,,,,,,,,,,,,,,,,"66",0,0,826,0,826,,0,0,"31e0e56af6a91da741a68ee08b40de65304479a8",0,0,0,0,0,""
20200411,"GU",133,,693,,"posNeg",826,14,,2,,2,,58,"4/11/2020 07:40","2020-04-11T07:40:00Z","04/11 03:40",5,,,"2020-04-11T07:40:00Z",,,,,,,,,,,,,,,,,,,"66",3,31,826,34,826,,1,0,"790ec2f69e907fb16a4bf15420c77b1a06c97746",0,0,0,0,0,""
20200410,"GU",130,,662,,"posNeg",792,14,,2,,2,,41,"4/9/2020 20:45","2020-04-09T20:45:00Z","04/09 16:45",4,,,"2020-04-09T20:45:00Z",,,,,,,,,,,,,,,,,,,"66",2,69,792,71,792,,0,0,"fd28d6b6147da94d80795b80465b63b369dc1def",0,0,0,0,0,""
20200409,"GU",128,,593,,"posNeg",721,14,,2,,2,,33,"4/9/2020 08:00","2020-04-09T08:00:00Z","04/09 04:00",4,,,"2020-04-09T08:00:00Z",,,,,,,,,,,,,,,,,,,"66",3,31,721,34,721,,0,0,"936e624726ddf977d3253c0b6c0e734fee729249",0,0,0,0,0,""
20200408,"GU",125,,562,,"posNeg",687,21,,2,,2,,31,"4/8/2020 07:30","2020-04-08T07:30:00Z","04/08 03:30",4,,,"2020-04-08T07:30:00Z",,,,,,,,,,,,,,,,,,,"66",4,33,687,37,687,,0,0,"f064adeeef7a18113b843aaaf333d7bad2ac773a",0,0,0,0,0,""
20200407,"GU",121,,529,,"posNeg",650,21,,2,,2,,27,"4/7/2020 07:00","2020-04-07T07:00:00Z","04/07 03:00",4,,,"2020-04-07T07:00:00Z",,,,,,,,,,,,,,,,,,,"66",8,24,650,32,650,,0,0,"7fa7f6e9fc8333e3a5920b5848e1a8e069220792",0,0,0,0,0,""
20200406,"GU",113,,505,,"posNeg",618,21,,2,,,,25,"4/6/2020 06:00","2020-04-06T06:00:00Z","04/06 02:00",4,,,"2020-04-06T06:00:00Z",,,,,,,,,,,,,,,,,,,"66",1,12,618,13,618,,0,0,"cae67b9037ed10e9807f2ebbc127af94a2617930",0,0,0,0,0,""
20200405,"GU",112,,493,,"posNeg",605,21,,2,,,,23,"4/5/2020 09:05","2020-04-05T09:05:00Z","04/05 05:05",4,,,"2020-04-05T09:05:00Z",,,,,,,,,,,,,,,,,,,"66",19,21,605,40,605,,0,0,"125a1324926185ea9d5e774fb4a3ef57b9654427",0,0,0,0,0,""
20200404,"GU",93,,472,,"posNeg",565,20,,2,,,,20,"4/4/2020 06:45","2020-04-04T06:45:00Z","04/04 02:45",4,,,"2020-04-04T06:45:00Z",,,,,,,,,,,,,,,,,,,"66",9,13,565,22,565,,0,0,"d84dff46e279a97701fc96cd4b1656410887170e",0,0,0,0,0,""
20200403,"GU",84,,459,,"posNeg",543,19,,2,,,,14,"4/3/2020 09:45","2020-04-03T09:45:00Z","04/03 05:45",4,,,"2020-04-03T09:45:00Z",,,,,,,,,,,,,,,,,,,"66",2,17,543,19,543,,1,0,"73d2b6de5cc0a18b5620ca424434978e0179837a",0,0,0,0,0,""
20200402,"GU",82,,442,,"posNeg",524,19,,2,,,,12,"4/2/2020 08:30","2020-04-02T08:30:00Z","04/02 04:30",3,,,"2020-04-02T08:30:00Z",,,,,,,,,,,,,,,,,,,"66",5,36,524,41,524,,0,0,"991c24209859333f122727c8555a2ad4ea32aed3",0,0,0,0,0,""
20200401,"GU",77,,406,,"posNeg",483,19,,2,,,,9,"4/1/2020 08:30","2020-04-01T08:30:00Z","04/01 04:30",3,,,"2020-04-01T08:30:00Z",,,,,,,,,,,,,,,,,,,"66",8,35,483,43,483,,1,0,"ded446545dfb3670fe5dc00515d42c282ed8fe1a",0,0,0,0,0,""
20200331,"GU",69,,371,,"posNeg",440,19,,2,,,,7,"3/31/2020 07:55","2020-03-31T07:55:00Z","03/31 03:55",2,,,"2020-03-31T07:55:00Z",,,,,,,,,,,,,,,,,,,"66",11,19,440,30,440,,1,0,"b8155d3cbdd08a15f4e24004f48467e971737ab8",0,0,0,0,0,""
20200330,"GU",58,,352,,"posNeg",410,19,,2,,,,7,"3/30/2020 04:30","2020-03-30T04:30:00Z","03/30 00:30",1,,,"2020-03-30T04:30:00Z",,,,,,,,,,,,,,,,,,,"66",2,18,410,20,410,,0,0,"11754e8b1e0ab85381b66cb61e185d95810e68e0",0,0,0,0,0,""
20200329,"GU",56,,334,,"posNeg",390,15,,,,,,7,"3/29/2020 04:00","2020-03-29T04:00:00Z","03/29 00:00",1,,,"2020-03-29T04:00:00Z",,,,,,,,,,,,,,,,,,,"66",1,35,390,36,390,,0,0,"574c2c6d55754caf798144c407dea20471585a52",0,0,0,0,0,""
20200328,"GU",55,,299,,"posNeg",354,15,,,,,,7,"3/28/2020 03:00","2020-03-28T03:00:00Z","03/27 23:00",1,,,"2020-03-28T03:00:00Z",,,,,,,,,,,,,,,,,,,"66",4,0,354,4,354,,0,0,"0847711fd99d455a3bcc652002154dc6f77f618d",0,0,0,0,0,""
20200327,"GU",51,,299,,"posNeg",350,13,,,,,,,"3/27/2020 07:00","2020-03-27T07:00:00Z","03/27 03:00",1,,,"2020-03-27T07:00:00Z",,,,,,,,,,,,,,,,,,,"66",6,36,350,42,350,,0,0,"a38ab57fd689a359ae810a63acc1063b673b4cb7",0,0,0,0,0,""
20200326,"GU",45,,263,,"posNeg",308,11,,,,,,,"3/26/2020 06:30","2020-03-26T06:30:00Z","03/26 02:30",1,,,"2020-03-26T06:30:00Z",,,,,,,,,,,,,,,,,,,"66",8,30,308,38,308,,0,0,"a8f0dc371ae44065876dc4105b4e96d6f02b4d9b",0,0,0,0,0,""
20200325,"GU",37,,233,,"posNeg",270,10,,,,,,,"3/25/2020 06:45","2020-03-25T06:45:00Z","03/25 02:45",1,,,"2020-03-25T06:45:00Z",,,,,,,,,,,,,,,,,,,"66",5,32,270,37,270,,0,0,"44901014af31b0ff3c70248516f9005c6cc35878",0,0,0,0,0,""
20200324,"GU",32,,201,,"posNeg",233,5,,,,,,,"3/24/2020 06:45","2020-03-24T06:45:00Z","03/24 02:45",1,,,"2020-03-24T06:45:00Z",,,,,,,,,,,,,,,,,,,"66",3,40,233,43,233,,0,0,"00fdde84c87d9a28f7d95d540aeff3d031981ab9",0,0,0,0,0,""
20200323,"GU",29,,161,,"posNeg",190,,,,,,,,"3/23/2020 06:45","2020-03-23T06:45:00Z","03/23 02:45",1,,,"2020-03-23T06:45:00Z",,,,,,,,,,,,,,,,,,,"66",2,35,190,37,190,,0,0,"3b23778b481d3b667f4a9d8267256c18f2cb1d4f",0,0,0,0,0,""
20200322,"GU",27,,126,,"posNeg",153,,,,,,,,"3/22/2020 07:00","2020-03-22T07:00:00Z","03/22 03:00",1,,,"2020-03-22T07:00:00Z",,,,,,,,,,,,,,,,,,,"66",12,18,153,30,153,,1,0,"35ca2bcea08cf13266dbcee04f35d935134dc637",0,0,0,0,0,""
20200321,"GU",15,,108,,"posNeg",123,,,,,,,,"3/21/2020 07:15","2020-03-21T07:15:00Z","03/21 03:15",,,,"2020-03-21T07:15:00Z",,,,,,,,,,,,,,,,,,,"66",1,22,123,23,123,,0,0,"8fe4bd65b5116a84aad9e6bf0be32a00a4f045d1",0,0,0,0,0,""
20200320,"GU",14,,86,,"posNeg",100,,,,,,,,"3/20/2020 05:15","2020-03-20T05:15:00Z","03/20 01:15",,,,"2020-03-20T05:15:00Z",,,,,,,,,,,,,,,,,,,"66",2,17,100,19,100,,0,0,"efda6cc45f68fbd1d3f350350d2376586b07f3ee",0,0,0,0,0,""
20200319,"GU",12,,69,,"posNeg",81,,,,,,,,"3/19/2020 05:15","2020-03-19T05:15:00Z","03/19 01:15",,,,"2020-03-19T05:15:00Z",,,,,,,,,,,,,,,,,,,"66",4,12,81,16,81,,0,0,"59363feb75dea634c88e75e00dc9a0c1def540fd",0,0,0,0,0,""
20200318,"GU",8,,57,,"posNeg",65,,,,,,,,"3/18/2020 05:45","2020-03-18T05:45:00Z","03/18 01:45",,,,"2020-03-18T05:45:00Z",,,,,,,,,,,,,,,,,,,"66",3,16,65,19,65,,0,0,"545b6195fe20392c1e72a74fa763beff21b2090b",0,0,0,0,0,""
20200317,"GU",5,,41,,"posNeg",46,,,,,,,,"3/17/2020 04:15","2020-03-17T04:15:00Z","03/17 00:15",,,,"2020-03-17T04:15:00Z",,,,,,,,,,,,,,,,,,,"66",2,18,46,20,46,,0,0,"81fff903da93264832d0dc5baf7b1e0f0cb3bcb3",0,0,0,0,0,""
20200316,"GU",3,,23,,"posNeg",26,,,,,,,,"3/16/2020 15:58","2020-03-16T15:58:00Z","03/16 11:58",,,,"2020-03-16T15:58:00Z",,,,,,,,,,,,,,,,,,,"66",0,0,26,0,26,,0,0,"c28529e8696e51e8d27731be019f9944f29701b6",0,0,0,0,0,""