"date","state","positive","probableCases","negative","pending","totalTestResultsSource","totalTestResults","hospitalizedCurrently","hospitalizedCumulative","inIcuCurrently","inIcuCumulative","onVentilatorCurrently","onVentilatorCumulative","recovered","lastUpdateEt","dateModified","checkTimeEt","death","hospitalized","hospitalizedDischarged","dateChecked","totalTestsViral","positiveTestsViral","negativeTestsViral","positiveCasesViral","deathConfirmed","deathProbable","totalTestEncountersViral","totalTestsPeopleViral","totalTestsAntibody","positiveTestsAntibody","negativeTestsAntibody","totalTestsPeopleAntibody","positiveTestsPeopleAntibody","negativeTestsPeopleAntibody","totalTestsPeopleAntigen","positiveTestsPeopleAntigen","totalTestsAntigen","positiveTestsAntigen","fips","positiveIncrease","negativeIncrease","total","totalTestResultsIncrease","posNeg","dataQualityGrade","deathIncrease","hospitalizedIncrease","hash","commercialScore","negativeRegularScore","negativeScore","positiveScore","score","grade"
20210307,"HI",28699,808,,,"totalTestEncountersViral",1146796,27,2226,5,,3,,,"3/5/2021 14:30","2021-03-05T14:30:00Z","03/05 09:30",445,2226,,"2021-03-05T14:30:00Z",,27774,,27891,445,,1146796,,,,,,,,,,,,"15",53,0,28699,5117,28699,,1,0,"4f2c09f953483ffc35e24ac50e0c6c1f10077002",0,0,0,0,0,""
20210306,"HI",28646,808,,,"totalTestEncountersViral",1141679,27,2226,5,,3,,,"3/4/2021 14:30","2021-03-04T14:30:00Z","03/04 09:30",444,2226,,"2021-03-04T14:30:00Z",,27726,,27838,444,,1141679,,,,,,,,,,,,"15",85,0,28646,5284,28646,,1,1,"9fa0a9bc60865ee5f8667e0c6fe4fd74040b134b",0,0,0,0,0,""
20210305,"HI",28561,808,,,"totalTestEncountersViral",1136395,28,2225,5,,3,,,"3/3/2021 14:30","2021-03-03T14:30:00Z","03/03 09:30",443,2225,,"2021-03-03T14:30:00Z",,27648,,27753,443,,1136395,,,,,,,,,,,,"15",95,0,28561,5302,28561,,2,0,"ade158080b2224bd84c26b1cc0da7a49ca3fce7a",0,0,0,0,0,""
20210304,"HI",28466,767,,,"totalTestEncountersViral",1131093,28,2225,5,,3,,,"3/2/2021 14:30","2021-03-02T14:30:00Z","03/02 09:30",441,2225,,"2021-03-02T14:30:00Z",,27595,,27699,441,,1131093,,,,,,,,,,,,"15",59,0,28466,6227,28466,,0,-1,"57c1bf756805543044d26df1250930bed11430fb",0,0,0,0,0,""
20210303,"HI",28407,767,,,"totalTestEncountersViral",1124866,26,2226,7,,3,,,"3/1/2021 14:30","2021-03-01T14:30:00Z","03/01 09:30",441,2226,,"2021-03-01T14:30:00Z",,27528,,27640,441,,1124866,,,,,,,,,,,,"15",17,0,28407,4206,28407,,2,0,"a9e1f441658234afef36bc24627906628c50d497",0,0,0,0,0,""
20210302,"HI",28390,767,,,"totalTestEncountersViral",1120660,31,2226,6,,3,,,"2/28/2021 14:30","2021-02-28T14:30:00Z","02/28 09:30",439,2226,,"2021-02-28T14:30:00Z",,27514,,27623,439,,1120660,,,,,,,,,,,,"15",35,0,28390,3503,28390,,0,12,"fd50733cd86097289b6a01b3cacffd31576d060d",0,0,0,0,0,""
20210301,"HI",28355,767,,,"totalTestEncountersViral",1117157,31,2214,3,,3,,,"2/27/2021 14:30","2021-02-27T14:30:00Z","02/27 09:30",439,2214,,"2021-02-27T14:30:00Z",,27477,,27588,439,,1117157,,,,,,,,,,,,"15",29,0,28355,4179,28355,,0,0,"5c115b65c08029fd38a3a3252755c7f0a37db7fc",0,0,0,0,0,""
20210228,"HI",28326,767,,,"totalTestEncountersViral",1112978,30,2214,3,,3,,,"2/26/2021 14:30","2021-02-26T14:30:00Z","02/26 09:30",439,2214,,"2021-02-26T14:30:00Z",,27437,,27559,439,,1112978,,,,,,,,,,,,"15",56,0,28326,5461,28326,,0,0,"8874ebc04f61b618359f541310c1e680d33e6147",0,0,0,0,0,""
20210227,"HI",28270,767,,,"totalTestEncountersViral",1107517,30,2214,3,,3,,,"2/25/2021 14:30","2021-02-25T14:30:00Z","02/25 09:30",439,2214,,"2021-02-25T14:30:00Z",,27366,,27503,439,,1107517,,,,,,,,,,,,"15",104,0,28270,22034,28270,,2,0,"98d282cfc3afeb2ee89ea4e944897d997c8c6493",0,0,0,0,0,""
20210226,"HI",28166,767,,,"totalTestEncountersViral",1085483,30,2214,3,,3,,,"2/24/2021 14:30","2021-02-24T14:30:00Z","02/24 09:30",437,2214,,"2021-02-24T14:30:00Z",,26939,,27399,437,,1085483,,,,,,,,,,,,"15",78,0,28166,4768,28166,,2,5,"b4c5ca3e5863a0bfff405d26801caaa548083ca4",0,0,0,0,0,""
20210225,"HI",28088,730,,,"totalTestEncountersViral",1080715,34,2209,5,,5,,,"2/23/2021 14:30","2021-02-23T14:30:00Z","02/23 09:30",435,2209,,"2021-02-23T14:30:00Z",,26900,,27358,435,,1080715,,,,,,,,,,,,"15",38,0,28088,5490,28088,,0,5,"74fcc51efdbfbba4abea6161129aa99573922328",0,0,0,0,0,""
20210224,"HI",28050,730,,,"totalTestEncountersViral",1075225,37,2204,6,,6,,,"2/22/2021 14:30","2021-02-22T14:30:00Z","02/22 09:30",435,2204,,"2021-02-22T14:30:00Z",,26853,,27320,435,,1075225,,,,,,,,,,,,"15",50,0,28050,5055,28050,,4,8,"f468650628d43ebedaabe7052bf8f64a8ec80591",0,0,0,0,0,""
20210223,"HI",28000,730,,,"totalTestEncountersViral",1070170,37,2196,7,,6,,,"2/21/2021 14:30","2021-02-21T14:30:00Z","02/21 09:30",431,2196,,"2021-02-21T14:30:00Z",,26785,,27270,431,,1070170,,,,,,,,,,,,"15",47,0,28000,784,28000,,0,-14,"f218b62c5e87d4b9ad942ee7cf294eeaccbdc5c1",0,0,0,0,0,""
20210222,"HI",27953,730,,,"totalTestEncountersViral",1069386,54,2210,24,,23,,,"2/21/2021 14:30","2021-02-21T14:30:00Z","02/21 09:30",431,2210,,"2021-02-21T14:30:00Z",,26748,,27223,431,,1069386,,,,,,,,,,,,"15",49,0,27953,5810,27953,,0,28,"1b9ee5de6fb723d8842c03d8ee31e6bacb0edade",0,0,0,0,0,""
20210221,"HI",27904,730,,,"totalTestEncountersViral",1063576,42,2182,11,,7,,,"2/19/2021 14:30","2021-02-19T14:30:00Z","02/19 09:30",431,2182,,"2021-02-19T14:30:00Z",,26711,,27174,431,,1063576,,,,,,,,,,,,"15",67,0,27904,9477,27904,,1,0,"fe28eb0cfabdb7a68d5288ce8f05e894ca6e5358",0,0,0,0,0,""
20210220,"HI",27837,730,,,"totalTestEncountersViral",1054099,42,2182,11,,7,,,"2/18/2021 14:30","2021-02-18T14:30:00Z","02/18 09:30",430,2182,,"2021-02-18T14:30:00Z",,26648,,27107,430,,1054099,,,,,,,,,,,,"15",59,0,27837,303,27837,,0,0,"7d308bc8e7cd37f25fadf2f90fd4ac1867aeb06b",0,0,0,0,0,""
20210219,"HI",27778,730,,,"totalTestEncountersViral",1053796,42,2182,11,,7,,,"2/17/2021 14:30","2021-02-17T14:30:00Z","02/17 09:30",430,2182,,"2021-02-17T14:30:00Z",,26569,,27048,430,,1053796,,,,,,,,,,,,"15",61,0,27778,4498,27778,,2,3,"8a6ae45475f5602a0e04cb9254f743bc95a5fde7",0,0,0,0,0,""
20210218,"HI",27717,717,,,"totalTestEncountersViral",1049298,39,2179,12,,8,,,"2/16/2021 14:30","2021-02-16T14:30:00Z","02/16 09:30",428,2179,,"2021-02-16T14:30:00Z",,26534,,27000,428,,1049298,,,,,,,,,,,,"15",65,0,27717,7642,27717,,1,5,"4e27fc9832fe4d0ad719310cd692897e5bb33bcb",0,0,0,0,0,""
20210217,"HI",27652,717,,,"totalTestEncountersViral",1041656,39,2174,12,,8,,,"2/15/2021 14:30","2021-02-15T14:30:00Z","02/15 09:30",427,2174,,"2021-02-15T14:30:00Z",,26458,,26935,427,,1041656,,,,,,,,,,,,"15",29,0,27652,2184,27652,,1,0,"158ae237405878fa2ee2f07651fa71f74060213a",0,0,0,0,0,""
20210216,"HI",27623,717,,,"totalTestEncountersViral",1039472,38,2174,14,,9,,,"2/14/2021 14:30","2021-02-14T14:30:00Z","02/14 09:30",426,2174,,"2021-02-14T14:30:00Z",,26433,,26906,426,,1039472,,,,,,,,,,,,"15",17,0,27623,459,27623,,0,25,"427a08cce174b8b98109cb631e8d576b099ac519",0,0,0,0,0,""
20210215,"HI",27606,717,,,"totalTestEncountersViral",1039013,40,2149,13,,10,,,"2/13/2021 14:30","2021-02-13T14:30:00Z","02/13 09:30",426,2149,,"2021-02-13T14:30:00Z",,26420,,26889,426,,1039013,,,,,,,,,,,,"15",33,0,27606,4273,27606,,0,0,"49ae5d096756d114d8839ca6f5c416cc81e8f240",0,0,0,0,0,""
20210214,"HI",27573,717,,,"totalTestEncountersViral",1034740,40,2149,13,,10,,,"2/12/2021 14:30","2021-02-12T14:30:00Z","02/12 09:30",426,2149,,"2021-02-12T14:30:00Z",,26354,,26856,426,,1034740,,,,,,,,,,,,"15",46,0,27573,5584,27573,,1,0,"41cdca2b62d21d9448f9eb7792f60b6a3e48803f",0,0,0,0,0,""
20210213,"HI",27527,717,,,"totalTestEncountersViral",1029156,40,2149,13,,10,,,"2/11/2021 14:30","2021-02-11T14:30:00Z","02/11 09:30",425,2149,,"2021-02-11T14:30:00Z",,26354,,26810,425,,1029156,,,,,,,,,,,,"15",67,0,27527,5604,27527,,0,0,"2d7ea01df6888864df9532457aacb485324ba605",0,0,0,0,0,""
20210212,"HI",27460,717,,,"totalTestEncountersViral",1023552,40,2149,13,,10,,,"2/10/2021 14:30","2021-02-10T14:30:00Z","02/10 09:30",425,2149,,"2021-02-10T14:30:00Z",,26290,,26743,425,,1023552,,,,,,,,,,,,"15",90,0,27460,5556,27460,,1,2,"b394503a4a228bdfb82d1839453fbc0c8c325534",0,0,0,0,0,""
20210211,"HI",27370,695,,,"totalTestEncountersViral",1017996,49,2147,14,,12,,,"2/9/2021 14:30","2021-02-09T14:30:00Z","02/09 09:30",424,2147,,"2021-02-09T14:30:00Z",,26227,,26675,424,,1017996,,,,,,,,,,,,"15",91,0,27370,5184,27370,,1,8,"1f95a470d45c86eddb33b9c3d68021b802a3227d",0,0,0,0,0,""
20210210,"HI",27279,695,,,"totalTestEncountersViral",1012812,58,2139,16,,17,,,"2/8/2021 14:30","2021-02-08T14:30:00Z","02/08 09:30",423,2139,,"2021-02-08T14:30:00Z",,26147,,26584,423,,1012812,,,,,,,,,,,,"15",53,0,27279,4322,27279,,5,-1,"67814ebd9f80a8f1412631b50307bf2ccc051906",0,0,0,0,0,""
20210209,"HI",27226,695,,,"totalTestEncountersViral",1008490,63,2140,16,,12,,,"2/7/2021 14:30","2021-02-07T14:30:00Z","02/07 09:30",418,2140,,"2021-02-07T14:30:00Z",,26098,,26531,418,,1008490,,,,,,,,,,,,"15",31,0,27226,2809,27226,,0,0,"8449ef40b7b1653e94f2f6fc174d09c0d93a6c91",0,0,0,0,0,""
20210208,"HI",27195,695,,,"totalTestEncountersViral",1005681,82,2140,22,,16,,,"2/6/2021 14:30","2021-02-06T14:30:00Z","02/06 09:30",418,2140,,"2021-02-06T14:30:00Z",,26071,,26500,418,,1005681,,,,,,,,,,,,"15",32,0,27195,3662,27195,,0,34,"84f93a3fe9e389be015d1f6d11b90cc1738601a6",0,0,0,0,0,""
20210207,"HI",27163,695,,,"totalTestEncountersViral",1002019,64,2106,17,,13,,,"2/5/2021 14:30","2021-02-05T14:30:00Z","02/05 09:30",418,2106,,"2021-02-05T14:30:00Z",,26043,,26468,418,,1002019,,,,,,,,,,,,"15",75,0,27163,4696,27163,,2,0,"5388064a0f7146d0365e328fe2f0818884511c0a",0,0,0,0,0,""
20210206,"HI",27088,695,,,"totalTestEncountersViral",997323,64,2106,17,,13,,,"2/4/2021 14:30","2021-02-04T14:30:00Z","02/04 09:30",416,2106,,"2021-02-04T14:30:00Z",,25966,,26393,416,,997323,,,,,,,,,,,,"15",107,0,27088,9206,27088,,0,0,"c590f78a90e988acaaf3aae1382096d907d0ee1a",0,0,0,0,0,""
20210205,"HI",26981,695,,,"totalTestEncountersViral",988117,64,2106,17,,13,,,"2/3/2021 14:30","2021-02-03T14:30:00Z","02/03 09:30",416,2106,,"2021-02-03T14:30:00Z",,25847,,26286,416,,988117,,,,,,,,,,,,"15",129,0,26981,5096,26981,,0,3,"293a7e6d1f0b132a74d9662fc5fbbac24748e7db",0,0,0,0,0,""
20210204,"HI",26852,665,,,"totalTestEncountersViral",983021,57,2103,19,,12,,,"2/2/2021 14:30","2021-02-02T14:30:00Z","02/02 09:30",416,2103,,"2021-02-02T14:30:00Z",,25764,,26187,416,,983021,,,,,,,,,,,,"15",106,0,26852,4120,26852,,2,7,"3da953f2f575a945e78c583a799486d6ceead92f",0,0,0,0,0,""
20210203,"HI",26746,665,,,"totalTestEncountersViral",978901,55,2096,21,,16,,,"2/1/2021 14:30","2021-02-01T14:30:00Z","02/01 09:30",414,2096,,"2021-02-01T14:30:00Z",,25665,,26081,414,,978901,,,,,,,,,,,,"15",74,0,26746,-16946,26746,,4,6,"342811d56d37f89136f2c48e34767dbde73cddfd",0,0,0,0,0,""
20210202,"HI",26672,665,,,"totalTestEncountersViral",995847,61,2090,19,,15,,,"1/31/2021 14:30","2021-01-31T14:30:00Z","01/31 09:30",410,2090,,"2021-01-31T14:30:00Z",,25821,,26007,410,,995847,,,,,,,,,,,,"15",64,0,26672,2541,26672,,0,4,"cdb4ff3ea764236b2b14c7328156e99c3c834ada",0,0,0,0,0,""
20210201,"HI",26608,665,,,"totalTestEncountersViral",993306,63,2086,16,,12,,,"1/30/2021 14:30","2021-01-30T14:30:00Z","01/30 09:30",410,2086,,"2021-01-30T14:30:00Z",,25806,,25943,410,,993306,,,,,,,,,,,,"15",90,0,26608,5831,26608,,0,19,"3734a7a724e404260bbfff783f689faf335f31a2",0,0,0,0,0,""
20210131,"HI",26518,665,,,"totalTestEncountersViral",987475,73,2067,19,,15,,,"1/29/2021 14:30","2021-01-29T14:30:00Z","01/29 09:30",410,2067,,"2021-01-29T14:30:00Z",,25468,,25853,410,,987475,,,,,,,,,,,,"15",82,0,26518,4569,26518,,3,0,"126fa2647131368d639cd14f177029e97d698bc0",0,0,0,0,0,""
20210130,"HI",26436,665,,,"totalTestEncountersViral",982906,73,2067,19,,15,,,"1/28/2021 14:30","2021-01-28T14:30:00Z","01/28 09:30",407,2067,,"2021-01-28T14:30:00Z",,25392,,25771,407,,982906,,,,,,,,,,,,"15",115,0,26436,9472,26436,,0,3,"7d9a15ffdc44d450fb1cb19cc15ad38d47c1988e",0,0,0,0,0,""
20210129,"HI",26321,665,,,"totalTestEncountersViral",973434,71,2064,20,,16,,,"1/27/2021 14:30","2021-01-27T14:30:00Z","01/27 09:30",407,2064,,"2021-01-27T14:30:00Z",,25289,,25656,407,,973434,,,,,,,,,,,,"15",152,0,26321,15171,26321,,1,0,"5d50994ea93d67d94670ebc1dc004ebb4ba92753",0,0,0,0,0,""
20210128,"HI",26169,628,,,"totalTestEncountersViral",958263,71,2064,20,,16,,,"1/26/2021 14:30","2021-01-26T14:30:00Z","01/26 09:30",406,2064,,"2021-01-26T14:30:00Z",,25177,,25541,406,,958263,,,,,,,,,,,,"15",99,0,26169,5072,26169,,2,7,"7b34f71861a49e646b4bf71d61795ff99a13d943",0,0,0,0,0,""
20210127,"HI",26070,628,,,"totalTestEncountersViral",953191,80,2057,22,,25,,,"1/25/2021 14:30","2021-01-25T14:30:00Z","01/25 09:30",404,2057,,"2021-01-25T14:30:00Z",,25062,,25442,404,,953191,,,,,,,,,,,,"15",103,0,26070,4500,26070,,3,7,"f769289ff1889b65c10686e57fce119b128730d0",0,0,0,0,0,""
20210126,"HI",25967,628,,,"totalTestEncountersViral",948691,82,2050,21,,18,,,"1/24/2021 14:30","2021-01-24T14:30:00Z","01/24 09:30",401,2050,,"2021-01-24T14:30:00Z",,24951,,25339,401,,948691,,,,,,,,,,,,"15",64,0,25967,2346,25967,,59,11,"754e6ad2eccd245b035196060e2921a11ec888ae",0,0,0,0,0,""
20210125,"HI",25903,628,,,"totalTestEncountersViral",946345,89,2039,21,,17,,,"1/23/2021 14:30","2021-01-23T14:30:00Z","01/23 09:30",342,2039,,"2021-01-23T14:30:00Z",,24898,,25275,342,,946345,,,,,,,,,,,,"15",121,0,25903,4042,25903,,0,25,"be81750acd3e50ffc4a36c4ae41d562f9aeaa7f3",0,0,0,0,0,""
20210124,"HI",25782,628,,,"totalTestEncountersViral",942303,84,2014,21,,18,,,"1/22/2021 14:30","2021-01-22T14:30:00Z","01/22 09:30",342,2014,,"2021-01-22T14:30:00Z",,24783,,25154,342,,942303,,,,,,,,,,,,"15",151,0,25782,5853,25782,,6,0,"d31035e8c70001ab2e71545d1e7383e001fd9645",0,0,0,0,0,""
20210123,"HI",25631,628,,,"totalTestEncountersViral",936450,84,2014,21,,18,,,"1/21/2021 14:30","2021-01-21T14:30:00Z","01/21 09:30",336,2014,,"2021-01-21T14:30:00Z",,24633,,25003,336,,936450,,,,,,,,,,,,"15",133,0,25631,4974,25631,,4,0,"4d494358bcaf600fb460fad2757a391dbd322584",0,0,0,0,0,""
20210122,"HI",25498,628,,,"totalTestEncountersViral",931476,84,2014,21,,18,,,"1/20/2021 14:30","2021-01-20T14:30:00Z","01/20 09:30",332,2014,,"2021-01-20T14:30:00Z",,24497,,24870,332,,931476,,,,,,,,,,,,"15",169,0,25498,5065,25498,,4,9,"3924034d17093f109da1ba9dfb966f85d17317e4",0,0,0,0,0,""
20210121,"HI",25329,590,,,"totalTestEncountersViral",926411,100,2005,23,,21,,,"1/19/2021 14:30","2021-01-19T14:30:00Z","01/19 09:30",328,2005,,"2021-01-19T14:30:00Z",,24377,,24739,328,,926411,,,,,,,,,,,,"15",119,0,25329,4503,25329,,3,9,"e19960c0052d8414757b61519df89de9a802b7a2",0,0,0,0,0,""
20210120,"HI",25210,590,,,"totalTestEncountersViral",921908,102,1996,21,,15,,,"1/18/2021 14:30","2021-01-18T14:30:00Z","01/18 09:30",325,1996,,"2021-01-18T14:30:00Z",,24265,,24620,325,,921908,,,,,,,,,,,,"15",74,0,25210,3547,25210,,1,13,"9b87cf6041fc0ddbb37eaeadcef7ec9178b988d7",0,0,0,0,0,""
20210119,"HI",25136,590,,,"totalTestEncountersViral",918361,55,1983,13,,10,,,"1/17/2021 14:30","2021-01-17T14:30:00Z","01/17 09:30",324,1983,,"2021-01-17T14:30:00Z",,24196,,24546,324,,918361,,,,,,,,,,,,"15",64,0,25136,3275,25136,,2,55,"0efa9f3ab60a6c9f88fb86f91c892d82711bbdf6",0,0,0,0,0,""
20210118,"HI",25072,590,,,"totalTestEncountersViral",915086,108,1928,20,,18,,,"1/16/2021 14:30","2021-01-16T14:30:00Z","01/16 09:30",322,1928,,"2021-01-16T14:30:00Z",,24132,,24482,322,,915086,,,,,,,,,,,,"15",129,0,25072,4307,25072,,0,0,"1abbc560b3a9aebec925530557b87d65ad5cf17f",0,0,0,0,0,""
20210117,"HI",24943,590,,,"totalTestEncountersViral",910779,108,1928,20,,18,,,"1/15/2021 14:30","2021-01-15T14:30:00Z","01/15 09:30",322,1928,,"2021-01-15T14:30:00Z",,24006,,24353,322,,910779,,,,,,,,,,,,"15",130,0,24943,5457,24943,,2,0,"62c4c02bc6a4682b6841302c23d3847ce2b5749e",0,0,0,0,0,""
20210116,"HI",24813,590,,,"totalTestEncountersViral",905322,108,1928,20,,18,,,"1/14/2021 14:30","2021-01-14T14:30:00Z","01/14 09:30",320,1928,,"2021-01-14T14:30:00Z",,23854,,24223,320,,905322,,,,,,,,,,,,"15",229,0,24813,10634,24813,,2,0,"42141e937516eeb0f61296e9175f321b7225c54a",0,0,0,0,0,""
20210115,"HI",24584,526,,,"totalTestEncountersViral",894688,108,1928,20,,18,,,"1/13/2021 14:30","2021-01-13T14:30:00Z","01/13 09:30",318,1928,,"2021-01-13T14:30:00Z",,23695,,24058,318,,894688,,,,,,,,,,,,"15",150,0,24584,5812,24584,,0,8,"4b2140eadd011a2362dbf326cbbdb3c861eb3780",0,0,0,0,0,""
20210114,"HI",24434,526,,,"totalTestEncountersViral",888876,104,1920,24,,19,,,"1/12/2021 14:30","2021-01-12T14:30:00Z","01/12 09:30",318,1920,,"2021-01-12T14:30:00Z",,23547,,23908,318,,888876,,,,,,,,,,,,"15",175,0,24434,5983,24434,,6,7,"ec996b56bcdbcf89231cb39aa24e6950c0e71065",0,0,0,0,0,""
20210113,"HI",24259,526,,,"totalTestEncountersViral",882893,114,1913,26,,22,,,"1/11/2021 14:30","2021-01-11T14:30:00Z","01/11 09:30",312,1913,,"2021-01-11T14:30:00Z",,23384,,23733,312,,882893,,,,,,,,,,,,"15",106,0,24259,4819,24259,,3,11,"66dc1a41328e6a0a3f87919986022879391f4c18",0,0,0,0,0,""
20210112,"HI",24153,526,,,"totalTestEncountersViral",878074,124,1902,26,,22,,,"1/10/2021 14:30","2021-01-10T14:30:00Z","01/10 09:30",309,1902,,"2021-01-10T14:30:00Z",,23283,,23627,309,,878074,,,,,,,,,,,,"15",114,0,24153,3054,24153,,0,7,"02f2d7549fcb7ddc848a51c324ddab0eb544034b",0,0,0,0,0,""
20210111,"HI",24039,526,,,"totalTestEncountersViral",875020,126,1895,25,,21,,,"1/9/2021 14:30","2021-01-09T14:30:00Z","01/09 09:30",309,1895,,"2021-01-09T14:30:00Z",,23188,,23513,309,,875020,,,,,,,,,,,,"15",172,0,24039,5448,24039,,0,31,"8a24b640185c7de30ac3b75bfbd32b3afc3f9721",0,0,0,0,0,""
20210110,"HI",23867,526,,,"totalTestEncountersViral",869572,129,1864,24,,20,,,"1/8/2021 14:30","2021-01-08T14:30:00Z","01/08 09:30",309,1864,,"2021-01-08T14:30:00Z",,23022,,23341,309,,869572,,,,,,,,,,,,"15",198,0,23867,6544,23867,,2,0,"833af3a6277e8092f6b5e33a899fcb4e0bb71d66",0,0,0,0,0,""
20210109,"HI",23669,526,,,"totalTestEncountersViral",863028,129,1864,24,,20,,,"1/7/2021 14:30","2021-01-07T14:30:00Z","01/07 09:30",307,1864,,"2021-01-07T14:30:00Z",,22837,,23143,307,,863028,,,,,,,,,,,,"15",248,0,23669,6502,23669,,4,0,"7f8671ad954c204336775ce71293c8ca7161fa1c",0,0,0,0,0,""
20210108,"HI",23421,526,,,"totalTestEncountersViral",856526,129,1864,24,,20,,,"1/6/2021 14:30","2021-01-06T14:30:00Z","01/06 09:30",303,1864,,"2021-01-06T14:30:00Z",,22630,,22895,303,,856526,,,,,,,,,,,,"15",308,0,23421,6634,23421,,4,12,"fd130b66cf21192abcaa0ae178178c583f6f0288",0,0,0,0,0,""
20210107,"HI",23113,482,,,"totalTestEncountersViral",849892,121,1852,24,,24,,,"1/5/2021 14:30","2021-01-05T14:30:00Z","01/05 09:30",299,1852,,"2021-01-05T14:30:00Z",,22369,,22631,299,,849892,,,,,,,,,,,,"15",321,0,23113,13546,23113,,0,9,"1876c01273800150c91772136252192402e00dad",0,0,0,0,0,""
20210106,"HI",22792,482,,,"totalTestEncountersViral",836346,123,1843,21,,16,,,"1/4/2021 14:30","2021-01-04T14:30:00Z","01/04 09:30",299,1843,,"2021-01-04T14:30:00Z",,22083,,22310,299,,836346,,,,,,,,,,,,"15",142,0,22792,3870,22792,,10,26,"7f4359d7bed52eaaf626e6358c2e928762cb3aba",0,0,0,0,0,""
20210105,"HI",22650,482,,,"totalTestEncountersViral",832476,96,1817,18,,15,,,"1/3/2021 14:30","2021-01-03T14:30:00Z","01/03 09:30",289,1817,,"2021-01-03T14:30:00Z",,21969,,22168,289,,832476,,,,,,,,,,,,"15",123,0,22650,4066,22650,,0,42,"92cca115374ef10db61dadff9c6e798c54f8f312",0,0,0,0,0,""
20210104,"HI",22527,482,,,"totalTestEncountersViral",828410,86,1775,11,,9,,,"1/2/2021 14:30","2021-01-02T14:30:00Z","01/02 09:30",289,1775,,"2021-01-02T14:30:00Z",,21849,,22045,289,,828410,,,,,,,,,,,,"15",89,0,22527,2454,22527,,0,0,"071a7d33f94a44f2e6995595c17358204e0f0ad9",0,0,0,0,0,""
20210103,"HI",22438,482,,,"totalTestEncountersViral",825956,86,1775,11,,9,,,"1/1/2021 14:30","2021-01-01T14:30:00Z","01/01 09:30",289,1775,,"2021-01-01T14:30:00Z",,21766,,21956,289,,825956,,,,,,,,,,,,"15",149,0,22438,3151,22438,,0,0,"2e7167b8bbf28fd12fa541b9cefe291bcd0497dd",0,0,0,0,0,""
20210102,"HI",22289,482,,,"totalTestEncountersViral",822805,86,1775,11,,9,,,"12/31/2020 14:30","2020-12-31T14:30:00Z","12/31 09:30",289,1775,,"2020-12-31T14:30:00Z",,21608,,21807,289,,822805,,,,,,,,,,,,"15",169,0,22289,5994,22289,,0,0,"2f701b644423f7ba6b27af358d99f7b914644313",0,0,0,0,0,""
20210101,"HI",22120,482,,,"totalTestEncountersViral",816811,86,1775,11,,9,,,"12/30/2020 19:30","2020-12-30T19:30:00Z","12/30 14:30",289,1775,,"2020-12-30T19:30:00Z",,21470,,21638,289,,816811,,,,,,,,,,,,"15",288,0,22120,4473,22120,,1,7,"5f12f1117e3d5dd2107ee9cb6014042214b5ed9d",0,0,0,0,0,""
20201231,"HI",21832,435,,,"totalTestEncountersViral",812338,97,1768,16,,18,,,"12/29/2020 17:30","2020-12-29T17:30:00Z","12/29 12:30",288,1768,,"2020-12-29T17:30:00Z",,21233,,21397,288,,812338,,,,,,,,,,,,"15",188,0,21832,5203,21832,,3,12,"157496d7163f3a6b39e55ef20338c7b93e4c63a1",0,0,0,0,0,""
20201230,"HI",21644,435,,,"totalTestEncountersViral",807135,81,1756,14,,12,,,"12/28/2020 19:30","2020-12-28T19:30:00Z","12/28 14:30",285,1756,,"2020-12-28T19:30:00Z",,21063,,21209,285,,807135,,,,,,,,,,,,"15",106,0,21644,3420,21644,,0,10,"0d6c36fe66b3b5dd2630958584122ac73286783a",0,0,0,0,0,""
20201229,"HI",21538,435,,,"totalTestEncountersViral",803715,89,1746,14,,11,,,"12/27/2020 14:30","2020-12-27T14:30:00Z","12/27 09:30",285,1746,,"2020-12-27T14:30:00Z",,20964,,21103,285,,803715,,,,,,,,,,,,"15",75,0,21538,3070,21538,,0,-5,"4e4055d649b7685759db17182b3859ffde6cb213",0,0,0,0,0,""
20201228,"HI",21463,435,,,"totalTestEncountersViral",800645,125,1751,23,,18,,,"12/26/2020 19:30","2020-12-26T19:30:00Z","12/26 14:30",285,1751,,"2020-12-26T19:30:00Z",,20895,,21028,285,,800645,,,,,,,,,,,,"15",45,0,21463,2343,21463,,0,40,"3321b89ea7b6bced01d6a94f72ddfd2eb84deaa0",0,0,0,0,0,""
20201227,"HI",21418,435,,,"totalTestEncountersViral",798302,64,1711,11,,10,,,"12/25/2020 19:30","2020-12-25T19:30:00Z","12/25 14:30",285,1711,,"2020-12-25T19:30:00Z",,20854,,20983,285,,798302,,,,,,,,,,,,"15",95,0,21418,2724,21418,,0,0,"3b61de87e5305a37e67a465d1b5e24bb40b1c338",0,0,0,0,0,""
20201226,"HI",21323,435,,,"totalTestEncountersViral",795578,64,1711,11,,10,,,"12/25/2020 05:59","2020-12-25T05:59:00Z","12/25 00:59",285,1711,,"2020-12-25T05:59:00Z",,20758,,20888,285,,795578,,,,,,,,,,,,"15",119,0,21323,15121,21323,,0,0,"01dabae510fcb26de89c2e38e69031fa7a08f2ca",0,0,0,0,0,""
20201225,"HI",21204,435,,,"totalTestEncountersViral",780457,64,1711,11,,10,,,"12/24/2020 05:59","2020-12-24T05:59:00Z","12/24 00:59",285,1711,,"2020-12-24T05:59:00Z",,20662,,20769,285,,780457,,,,,,,,,,,,"15",156,0,21204,-6184,21204,,0,8,"58edf4bcf0fa5b79ae3cb116b89faea8280731db",0,0,0,0,0,""
20201224,"HI",21048,398,,,"totalTestEncountersViral",786641,67,1703,14,,11,,,"12/23/2020 05:59","2020-12-23T05:59:00Z","12/23 00:59",285,1703,,"2020-12-23T05:59:00Z",,20526,,20650,285,,786641,,,,,,,,,,,,"15",128,0,21048,5206,21048,,0,0,"ec749a919ba3c8f31d57520f3a29efd1194e0364",0,0,0,0,0,""
20201223,"HI",20920,398,,,"totalTestEncountersViral",781435,67,1703,14,,11,,,"12/22/2020 05:59","2020-12-22T05:59:00Z","12/22 00:59",285,1703,,"2020-12-22T05:59:00Z",,20322,,20522,285,,781435,,,,,,,,,,,,"15",105,0,20920,4499,20920,,3,24,"48a3a1639ecd2c721990deef40cb3d831a93342b",0,0,0,0,0,""
20201222,"HI",20815,398,,,"totalTestEncountersViral",776936,49,1679,15,,8,,,"12/21/2020 05:59","2020-12-21T05:59:00Z","12/21 00:59",282,1679,,"2020-12-21T05:59:00Z",,20322,,20417,282,,776936,,,,,,,,,,,,"15",66,0,20815,3486,20815,,0,0,"f9fd2425da295254da6b2070dd2330db8ff73d7c",0,0,0,0,0,""
20201221,"HI",20749,398,,,"totalTestEncountersViral",773450,49,1679,15,,8,,,"12/20/2020 05:59","2020-12-20T05:59:00Z","12/20 00:59",282,1679,,"2020-12-20T05:59:00Z",,20234,,20351,282,,773450,,,,,,,,,,,,"15",134,0,20749,3193,20749,,0,24,"c83aa017b81266022ec19a0d24647a265e4d2bf2",0,0,0,0,0,""
20201220,"HI",20615,398,,,"totalTestEncountersViral",770257,52,1655,14,,7,,,"12/19/2020 05:59","2020-12-19T05:59:00Z","12/19 00:59",282,1655,,"2020-12-19T05:59:00Z",,20120,,20217,282,,770257,,,,,,,,,,,,"15",202,0,20615,5884,20615,,1,0,"19a4e9af81615910ab9d8db87bc273dbc76f8f12",0,0,0,0,0,""
20201219,"HI",20413,398,,,"totalTestEncountersViral",764373,52,1655,14,,7,,,"12/18/2020 05:59","2020-12-18T05:59:00Z","12/18 00:59",281,1655,,"2020-12-18T05:59:00Z",,19931,,20015,281,,764373,,,,,,,,,,,,"15",156,0,20413,6046,20413,,0,0,"9ebe6c572c831f96a179cdebf2cee813469a409c",0,0,0,0,0,""
20201218,"HI",20257,398,,,"totalTestEncountersViral",758327,52,1655,14,,7,,,"12/17/2020 05:59","2020-12-17T05:59:00Z","12/17 00:59",281,1655,,"2020-12-17T05:59:00Z",,19769,,19859,281,,758327,,,,,,,,,,,,"15",162,0,20257,4720,20257,,1,7,"37097d4ccdad630e7b5bd50cb94e7184ec49af11",0,0,0,0,0,""
20201217,"HI",20095,364,,,"totalTestEncountersViral",753607,53,1648,14,,7,,,"12/16/2020 05:59","2020-12-16T05:59:00Z","12/16 00:59",280,1648,,"2020-12-16T05:59:00Z",,19647,,19731,280,,753607,,,,,,,,,,,,"15",141,0,20095,5698,20095,,2,277,"78708e131e288e0cf2f74f5ffc4327afe785180f",0,0,0,0,0,""
20201216,"HI",19954,364,,,"totalTestEncountersViral",747909,60,1371,19,,18,,,"12/15/2020 05:59","2020-12-15T05:59:00Z","12/15 00:59",278,1371,,"2020-12-15T05:59:00Z",,19519,,19590,278,,747909,,,,,,,,,,,,"15",110,0,19954,3662,19954,,4,7,"216003ff9f2ddbcc9c152b6aa305d6268a37fc12",0,0,0,0,0,""
20201215,"HI",19844,364,,,"totalTestEncountersViral",744247,57,1364,17,,14,,,"12/14/2020 05:59","2020-12-14T05:59:00Z","12/14 00:59",274,1364,,"2020-12-14T05:59:00Z",,19423,,19480,274,,744247,,,,,,,,,,,,"15",56,0,19844,3206,19844,,0,7,"859ffbc2b3631ed5e54a60b9aa4c6ab03ba34508",0,0,0,0,0,""
20201214,"HI",19788,364,,,"totalTestEncountersViral",741041,58,1357,21,,17,,,"12/13/2020 05:59","2020-12-13T05:59:00Z","12/13 00:59",274,1357,,"2020-12-13T05:59:00Z",,19348,,19424,274,,741041,,,,,,,,,,,,"15",189,0,19788,4972,19788,,0,0,"a546091a67b1209c34efc3512bed12d75d171efe",0,0,0,0,0,""
20201213,"HI",19599,364,,,"totalTestEncountersViral",736069,58,1357,21,,17,,,"12/12/2020 05:59","2020-12-12T05:59:00Z","12/12 00:59",274,1357,,"2020-12-12T05:59:00Z",,19171,,19235,274,,736069,,,,,,,,,,,,"15",87,0,19599,4851,19599,,3,0,"d955c239d267735dd957a6118425b7f7804600c4",0,0,0,0,0,""
20201212,"HI",19512,364,,,"totalTestEncountersViral",731218,58,1357,21,,17,,,"12/11/2020 05:59","2020-12-11T05:59:00Z","12/11 00:59",271,1357,,"2020-12-11T05:59:00Z",,19079,,19148,271,,731218,,,,,,,,,,,,"15",197,0,19512,4782,19512,,2,3,"c25c5930adc2ad90071ba96dc2183ccfa3b268c6",0,0,0,0,0,""
20201211,"HI",19315,364,,,"totalTestEncountersViral",726436,48,1354,19,,14,,,"12/10/2020 05:59","2020-12-10T05:59:00Z","12/10 00:59",269,1354,,"2020-12-10T05:59:00Z",,18904,,18951,269,,726436,,,,,,,,,,,,"15",136,0,19315,4781,19315,,1,10,"468122ed9127a9571716c448bfc98059bfb4c1bd",0,0,0,0,0,""
20201210,"HI",19179,315,,,"totalTestEncountersViral",721655,51,1344,18,,14,,,"12/9/2020 05:59","2020-12-09T05:59:00Z","12/09 00:59",268,1344,,"2020-12-09T05:59:00Z",,18825,,18864,268,,721655,,,,,,,,,,,,"15",123,0,19179,6987,19179,,2,11,"ac1f14cc34c5a23b72170577703fe091cfbda7f9",0,0,0,0,0,""
20201209,"HI",19056,315,,,"totalTestEncountersViral",714668,47,1333,16,,11,,,"12/8/2020 05:59","2020-12-08T05:59:00Z","12/08 00:59",266,1333,,"2020-12-08T05:59:00Z",,18687,,18741,266,,714668,,,,,,,,,,,,"15",80,0,19056,3852,19056,,4,6,"9055bdc15b2af6d8835a4fd1f4302915e13d3165",0,0,0,0,0,""
20201208,"HI",18976,315,,,"totalTestEncountersViral",710816,46,1327,17,,12,,,"12/7/2020 05:59","2020-12-07T05:59:00Z","12/07 00:59",262,1327,,"2020-12-07T05:59:00Z",,18616,,18661,262,,710816,,,,,,,,,,,,"15",53,0,18976,2650,18976,,0,2,"305b632f1b918b5c9e4293717a38369e38226c61",0,0,0,0,0,""
20201207,"HI",18923,315,,,"totalTestEncountersViral",708166,57,1325,14,,17,,,"12/6/2020 05:59","2020-12-06T05:59:00Z","12/06 00:59",262,1325,,"2020-12-06T05:59:00Z",,18567,,18608,262,,708166,,,,,,,,,,,,"15",81,0,18923,6390,18923,,0,0,"06fc9ba5e2750c6a8a90fa2e54ec8a1096c0defe",0,0,0,0,0,""
20201206,"HI",18842,315,,,"totalTestEncountersViral",701776,57,1325,14,,17,,,"12/5/2020 05:59","2020-12-05T05:59:00Z","12/05 00:59",262,1325,,"2020-12-05T05:59:00Z",,18493,,18527,262,,701776,,,,,,,,,,,,"15",104,0,18842,6599,18842,,1,0,"fc9f3bc6e0d4706aac59432988767f1ed89bd838",0,0,0,0,0,""
20201205,"HI",18738,315,,,"totalTestEncountersViral",695177,57,1325,14,,17,,,"12/4/2020 05:59","2020-12-04T05:59:00Z","12/04 00:59",261,1325,,"2020-12-04T05:59:00Z",,18386,,18423,261,,695177,,,,,,,,,,,,"15",133,0,18738,8421,18738,,5,10,"37a41c24d15a3497ed1b45dd898e43bf72096be9",0,0,0,0,0,""
20201204,"HI",18605,315,,,"totalTestEncountersViral",686756,51,1315,14,,12,,,"12/3/2020 05:59","2020-12-03T05:59:00Z","12/03 00:59",256,1315,,"2020-12-03T05:59:00Z",,18217,,18290,256,,686756,,,,,,,,,,,,"15",121,0,18605,3021,18605,,10,11,"28a9b33df4784577c89b2a102180794ef75079cf",0,0,0,0,0,""
20201203,"HI",18484,298,,,"totalTestEncountersViral",683735,57,1304,20,,15,,,"12/2/2020 05:59","2020-12-02T05:59:00Z","12/02 00:59",246,1304,,"2020-12-02T05:59:00Z",,18179,,18186,246,,683735,,,,,,,,,,,,"15",142,0,18484,6290,18484,,2,13,"1ee2740c1e2d09d3df438a7efabda0e8b7855392",0,0,0,0,0,""
20201202,"HI",18342,298,,,"totalTestEncountersViral",677445,54,1291,19,,15,,,"12/1/2020 05:59","2020-12-01T05:59:00Z","12/01 00:59",244,1291,,"2020-12-01T05:59:00Z",,18036,,18044,244,,677445,,,,,,,,,,,,"15",76,0,18342,4281,18342,,0,3,"ada64b33df27082159f8ea28d912906731e6050c",0,0,0,0,0,""
20201201,"HI",18266,298,,,"totalTestEncountersViral",673164,56,1288,24,,7,,,"11/30/2020 05:59","2020-11-30T05:59:00Z","11/30 00:59",244,1288,,"2020-11-30T05:59:00Z",,17931,,17968,244,,673164,,,,,,,,,,,,"15",43,0,18266,3402,18266,,0,1,"6b948771f367e0db43b996e3a5f423e045ceabf5",0,0,0,0,0,""
20201130,"HI",18223,298,,,"totalTestEncountersViral",669762,60,1287,17,,14,,,"11/29/2020 05:59","2020-11-29T05:59:00Z","11/29 00:59",244,1287,,"2020-11-29T05:59:00Z",,17890,,17925,244,,669762,,,,,,,,,,,,"15",85,0,18223,4525,18223,,0,0,"c45ed9d6cc33810b11a840190abd77e8aeaed6f0",0,0,0,0,0,""
20201129,"HI",18138,298,,,"totalTestEncountersViral",665237,60,1287,17,,14,,,"11/28/2020 05:59","2020-11-28T05:59:00Z","11/28 00:59",244,1287,,"2020-11-28T05:59:00Z",,17802,,17840,244,,665237,,,,,,,,,,,,"15",56,0,18138,5517,18138,,4,0,"74869ad23c10b975808a5bcc52a4d96e9cbc1d62",0,0,0,0,0,""
20201128,"HI",18082,298,,,"totalTestEncountersViral",659720,60,1287,17,,14,,,"11/27/2020 05:59","2020-11-27T05:59:00Z","11/27 00:59",240,1287,,"2020-11-27T05:59:00Z",,17744,,17784,240,,659720,,,,,,,,,,,,"15",76,0,18082,4157,18082,,0,18,"e5bcf74e6fa109f739bab902a69f5698a519e26a",0,0,0,0,0,""
20201127,"HI",18006,298,,,"totalTestEncountersViral",655563,60,1269,17,,12,,,"11/26/2020 05:59","2020-11-26T05:59:00Z","11/26 00:59",240,1269,,"2020-11-26T05:59:00Z",,17670,,17708,240,,655563,,,,,,,,,,,,"15",125,0,18006,5663,18006,,3,0,"124ee7d0d98f1ff8c1771b3e95127486daa53450",0,0,0,0,0,""
20201126,"HI",17881,263,,,"totalTestEncountersViral",649900,60,1269,17,,12,,,"11/25/2020 05:59","2020-11-25T05:59:00Z","11/25 00:59",237,1269,,"2020-11-25T05:59:00Z",,17581,,17618,237,,649900,,,,,,,,,,,,"15",117,0,17881,9041,17881,,2,1,"25cbf9a29efd14fbb0b77a4d1ad6da734c322760",0,0,0,0,0,""
20201125,"HI",17764,263,,,"totalTestEncountersViral",640859,67,1268,16,,11,,,"11/24/2020 05:59","2020-11-24T05:59:00Z","11/24 00:59",235,1268,,"2020-11-24T05:59:00Z",,17361,,17501,235,,640859,,,,,,,,,,,,"15",108,0,17764,1134,17764,,2,9,"211b61d4b26c4082d76ce807765d5030e3356a1f",0,0,0,0,0,""
20201124,"HI",17656,263,,,"totalTestEncountersViral",639725,69,1259,17,,13,,,"11/23/2020 05:59","2020-11-23T05:59:00Z","11/23 00:59",233,1259,,"2020-11-23T05:59:00Z",,17350,,17393,233,,639725,,,,,,,,,,,,"15",60,0,17656,3612,17656,,0,25,"b0f038bfd5b454a43c4b562bc2ecec6de5b38110",0,0,0,0,0,""
20201123,"HI",17596,263,,,"totalTestEncountersViral",636113,72,1234,23,,10,,,"11/22/2020 05:59","2020-11-22T05:59:00Z","11/22 00:59",233,1234,,"2020-11-22T05:59:00Z",,17296,,17333,233,,636113,,,,,,,,,,,,"15",113,0,17596,5756,17596,,0,0,"4959db42b82aa9e8daa9dcdedc3e4f427370765f",0,0,0,0,0,""
20201122,"HI",17483,263,,,"totalTestEncountersViral",630357,72,1234,23,,10,,,"11/21/2020 05:59","2020-11-21T05:59:00Z","11/21 00:59",233,1234,,"2020-11-21T05:59:00Z",,17186,,17220,233,,630357,,,,,,,,,,,,"15",122,0,17483,5342,17483,,2,0,"4d8dc168a0129ea17b8306934095ed92e0fc1813",0,0,0,0,0,""
20201121,"HI",17361,263,,,"totalTestEncountersViral",625015,72,1234,23,,10,,,"11/20/2020 05:59","2020-11-20T05:59:00Z","11/20 00:59",231,1234,,"2020-11-20T05:59:00Z",,17067,,17098,231,,625015,,,,,,,,,,,,"15",162,0,17361,6837,17361,,7,6,"401e147c7b0e821b8f38c2780ef5363841dc8461",0,0,0,0,0,""
20201120,"HI",17199,263,,,"totalTestEncountersViral",618178,77,1228,23,,10,,,"11/19/2020 05:59","2020-11-19T05:59:00Z","11/19 00:59",224,1228,,"2020-11-19T05:59:00Z",,16909,,16936,224,,618178,,,,,,,,,,,,"15",118,0,17199,5563,17199,,1,9,"3f5a5adf7a4e25a6c805cf10456a7a9c0cfdef93",0,0,0,0,0,""
20201119,"HI",17081,240,,,"totalTestEncountersViral",612615,77,1219,23,,13,,,"11/18/2020 05:59","2020-11-18T05:59:00Z","11/18 00:59",223,1219,,"2020-11-18T05:59:00Z",,16812,,16841,223,,612615,,,,,,,,,,,,"15",107,0,17081,5253,17081,,0,9,"78cb39abbd5a88cf3edf65cd1dab7ed16cc9e15e",0,0,0,0,0,""
20201118,"HI",16974,240,,,"totalTestEncountersViral",607362,82,1210,19,,15,,,"11/17/2020 05:59","2020-11-17T05:59:00Z","11/17 00:59",223,1210,,"2020-11-17T05:59:00Z",,16721,,16734,223,,607362,,,,,,,,,,,,"15",69,0,16974,4528,16974,,1,2,"f3d5d386e7d883ab6e64364b07cc8bbfc49b7489",0,0,0,0,0,""
20201117,"HI",16905,240,,,"totalTestEncountersViral",602834,83,1208,15,,10,,,"11/15/2020 23:59","2020-11-15T23:59:00Z","11/15 18:59",222,1208,,"2020-11-15T23:59:00Z",,16656,,16665,222,,602834,,,,,,,,,,,,"15",52,0,16905,2840,16905,,0,14,"b5f5670d9fa17f7b174a06de650d6cd0d1d3d13a",0,0,0,0,0,""
20201116,"HI",16853,240,,,"totalTestEncountersViral",599994,78,1194,18,,10,,,"11/14/2020 23:59","2020-11-14T23:59:00Z","11/14 18:59",222,1194,,"2020-11-14T23:59:00Z",,16605,,16613,222,,599994,,,,,,,,,,,,"15",94,0,16853,4879,16853,,0,0,"d8be5855b647ceebdebcb774d3a05d53f7e10a4b",0,0,0,0,0,""
20201115,"HI",16759,240,,,"totalTestEncountersViral",595115,78,1194,16,,8,,,"11/14/2020 21:00","2020-11-14T21:00:00Z","11/14 16:00",222,1194,,"2020-11-14T21:00:00Z",,16464,,16519,222,,595115,,,,,,,,,,,,"15",107,0,16759,5318,16759,,0,0,"932cd1452808f2ef2624d3f6462de5617aad5f87",0,0,0,0,0,""
20201114,"HI",16652,240,,,"totalTestEncountersViral",589797,63,1194,14,,1,,,"11/13/2020 21:00","2020-11-13T21:00:00Z","11/13 16:00",222,1194,,"2020-11-13T21:00:00Z",,16349,,16412,222,,589797,,,,,,,,,,,,"15",118,0,16652,4860,16652,,0,7,"6d67f99580595c458bad12066554f723735e450d",0,0,0,0,0,""
20201113,"HI",16534,232,,,"totalTestEncountersViral",584937,69,1187,16,,1,,,"11/12/2020 21:00","2020-11-12T21:00:00Z","11/12 16:00",222,1187,,"2020-11-12T21:00:00Z",,16245,,16302,222,,584937,,,,,,,,,,,,"15",97,0,16534,4862,16534,,0,9,"5bbdbe7fbd20c4a391b38f6d8c87df1ca6d798b9",0,0,0,0,0,""
20201112,"HI",16437,232,,,"totalTestEncountersViral",580075,73,1178,16,,1,,,"11/11/2020 21:00","2020-11-11T21:00:00Z","11/11 16:00",222,1178,,"2020-11-11T21:00:00Z",,16150,,16205,222,,580075,,,,,,,,,,,,"15",117,0,16437,5223,16437,,0,0,"6b6ae2d6bb3d19b0ff49cf75b02be7eba1769d82",0,0,0,0,0,""
20201111,"HI",16320,232,,,"totalTestEncountersViral",574852,77,1178,16,,1,,,"11/10/2020 21:00","2020-11-10T21:00:00Z","11/10 16:00",222,1178,,"2020-11-10T21:00:00Z",,16028,,16088,222,,574852,,,,,,,,,,,,"15",78,0,16320,4844,16320,,1,31,"a8c869b4e6e858f8a104af8c28ccc76f3facf5a2",0,0,0,0,0,""
20201110,"HI",16242,232,,,"totalTestEncountersViral",570008,72,1147,22,,4,,,"11/9/2020 21:00","2020-11-09T21:00:00Z","11/09 16:00",221,1147,,"2020-11-09T21:00:00Z",,15956,,16010,221,,570008,,,,,,,,,,,,"15",63,0,16242,3014,16242,,0,-14,"96e33f961e51e55f29c97e9b50b3557325181073",0,0,0,0,0,""
20201109,"HI",16179,232,,,"totalTestEncountersViral",566994,75,1161,13,,8,,,"11/8/2020 21:00","2020-11-08T21:00:00Z","11/08 16:00",221,1161,,"2020-11-08T21:00:00Z",,15885,,15947,221,,566994,,,,,,,,,,,,"15",128,0,16179,4724,16179,,1,4,"01b7d05cf8b4067d8a635a24473d2a3550439970",0,0,0,0,0,""
20201108,"HI",16051,232,,,"totalTestEncountersViral",562270,75,1157,13,,8,,,"11/7/2020 21:00","2020-11-07T21:00:00Z","11/07 16:00",220,1157,,"2020-11-07T21:00:00Z",,15768,,15819,220,,562270,,,,,,,,,,,,"15",128,0,16051,6174,16051,,1,10,"90f280127138d8cad52d4f2a3ba6b3c7059429f9",0,0,0,0,0,""
20201107,"HI",15923,232,,,"totalTestEncountersViral",556096,69,1147,13,,9,,,"11/6/2020 21:00","2020-11-06T21:00:00Z","11/06 16:00",219,1147,,"2020-11-06T21:00:00Z",,15635,,15691,219,,556096,,,,,,,,,,,,"15",138,0,15923,4293,15923,,0,9,"ab918a96ed07bd1f05a0a46fbd11120694dc0fb9",0,0,0,0,0,""
20201106,"HI",15785,213,,,"totalTestEncountersViral",551803,68,1138,13,,9,,,"11/5/2020 18:00","2020-11-05T18:00:00Z","11/05 13:00",219,1138,,"2020-11-05T18:00:00Z",,15520,,15572,219,,551803,,,,,,,,,,,,"15",99,0,15785,4470,15785,,0,13,"bce3520f948d92adcf988bf87e4a366db537ef1c",0,0,0,0,0,""
20201105,"HI",15686,213,,,"totalTestEncountersViral",547333,57,1125,11,,8,,11958,"11/4/2020 18:00","2020-11-04T18:00:00Z","11/04 13:00",219,1125,,"2020-11-04T18:00:00Z",,15406,,15473,219,,547333,,,,,,,,,,,,"15",155,0,15686,5848,15686,,0,1,"9f4e55eca35c0cb6ed74b645fd327d7e3a0c8356",0,0,0,0,0,""
20201104,"HI",15531,213,,,"totalTestEncountersViral",541485,57,1124,11,,8,,11930,"11/3/2020 18:00","2020-11-03T18:00:00Z","11/03 13:00",219,1124,,"2020-11-03T18:00:00Z",,15252,,15318,219,,541485,,,,,,,,,,,,"15",87,0,15531,4064,15531,,0,13,"0fe9287a232d388777e5bdb5b92633c39d2277a5",0,0,0,0,0,""
20201103,"HI",15444,213,,,"totalTestEncountersViral",537421,65,1111,11,,8,,11868,"11/2/2020 18:00","2020-11-02T18:00:00Z","11/02 13:00",219,1111,,"2020-11-02T18:00:00Z",,15167,,15231,219,,537421,,,,,,,,,,,,"15",77,0,15444,3749,15444,,0,4,"fb98805b4ffd66ea2f7179e2ec5f0cd554b403da",0,0,0,0,0,""
20201102,"HI",15367,213,,,"totalTestEncountersViral",533672,58,1107,8,,5,,11824,"11/1/2020 18:00","2020-11-01T18:00:00Z","11/01 13:00",219,1107,,"2020-11-01T18:00:00Z",,15091,,15154,219,,533672,,,,,,,,,,,,"15",83,0,15367,3408,15367,,0,2,"250998664d1f89bffaae453ba6d1cc138df9bfd1",0,0,0,0,0,""
20201101,"HI",15284,213,,,"totalTestEncountersViral",530264,58,1105,8,,5,,11776,"10/31/2020 18:00","2020-10-31T18:00:00Z","10/31 14:00",219,1105,,"2020-10-31T18:00:00Z",,15012,,15071,219,,530264,,,,,,,,,,,,"15",68,0,15284,4234,15284,,3,8,"2a8f8b45c843627a56663ac692948f8f0e71e8e0",0,0,0,0,0,""
20201031,"HI",15216,213,,,"totalTestEncountersViral",526030,59,1097,11,,4,,11738,"10/30/2020 18:00","2020-10-30T18:00:00Z","10/30 14:00",216,1097,,"2020-10-30T18:00:00Z",,14944,,15003,216,,526030,,,,,,,,,,,,"15",100,0,15216,4171,15216,,1,7,"ecc69d2da6b76b5f1b10fe44f77e0b3964ff04b4",0,0,0,0,0,""
20201030,"HI",15116,205,,,"totalTestEncountersViral",521859,62,1090,15,,8,,11682,"10/29/2020 18:00","2020-10-29T18:00:00Z","10/29 14:00",215,1090,,"2020-10-29T18:00:00Z",,14852,,14911,215,,521859,,,,,,,,,,,,"15",77,0,15116,4854,15116,,2,9,"6c1bd15558fb86d3d0bc37506ea49f95145f828b",0,0,0,0,0,""
20201029,"HI",15039,205,,,"totalTestEncountersViral",517005,61,1081,15,,12,,11605,"10/28/2020 18:00","2020-10-28T18:00:00Z","10/28 14:00",213,1081,,"2020-10-28T18:00:00Z",,14776,,14834,213,,517005,,,,,,,,,,,,"15",61,0,15039,4393,15039,,-2,8,"c6c17e9e6e6e1a7a49be1695b9c4c3b3e19379c8",0,0,0,0,0,""
20201028,"HI",14978,205,,,"totalTestEncountersViral",512612,61,1073,15,,12,,11523,"10/27/2020 18:00","2020-10-27T18:00:00Z","10/27 14:00",215,1073,,"2020-10-27T18:00:00Z",,14717,,14773,215,,512612,,,,,,,,,,,,"15",64,0,14978,4122,14978,,3,6,"629e913e55e65ad45af29a0c0bef5f4a3b3a780b",0,0,0,0,0,""
20201027,"HI",14914,205,,,"totalTestEncountersViral",508490,64,1067,15,,10,,11444,"10/26/2020 18:00","2020-10-26T18:00:00Z","10/26 14:00",212,1067,,"2020-10-26T18:00:00Z",,14655,,14709,212,,508490,,,,,,,,,,,,"15",37,0,14914,3235,14914,,0,2,"f88f5daf2d277625d234d39ca4afdbb5f7e35a6e",0,0,0,0,0,""
20201026,"HI",14877,205,,,"totalTestEncountersViral",505255,64,1065,15,,10,,11405,"10/25/2020 18:00","2020-10-25T18:00:00Z","10/25 14:00",212,1065,,"2020-10-25T18:00:00Z",,14617,,14672,212,,505255,,,,,,,,,,,,"15",119,0,14877,4799,14877,,0,0,"9341a0b2e6e59506625006aa79b43f13f1db1267",0,0,0,0,0,""
20201025,"HI",14758,205,,,"totalTestEncountersViral",500456,64,1065,15,,10,,11346,"10/24/2020 18:00","2020-10-24T18:00:00Z","10/24 14:00",212,1065,,"2020-10-24T18:00:00Z",,14497,,14553,212,,500456,,,,,,,,,,,,"15",89,0,14758,4163,14758,,3,8,"1ba216e54cad2ea9e71cf857c4d7c011bde1e19b",0,0,0,0,0,""
20201024,"HI",14669,205,,,"totalTestEncountersViral",496293,71,1057,18,,11,,11292,"10/23/2020 18:00","2020-10-23T18:00:00Z","10/23 14:00",209,1057,,"2020-10-23T18:00:00Z",,14409,,14464,209,,496293,,,,,,,,,,,,"15",140,0,14669,4843,14669,,3,12,"67fbb08b8361bd4f5dd20e02b9c3edf524560305",0,0,0,0,0,""
20201023,"HI",14529,194,,,"totalTestEncountersViral",491450,75,1045,18,,13,,11232,"10/22/2020 18:00","2020-10-22T18:00:00Z","10/22 14:00",206,1045,,"2020-10-22T18:00:00Z",,14282,,14335,206,,491450,,,,,,,,,,,,"15",102,0,14529,4139,14529,,3,12,"02e9d7087a28809487fa60bde461d4622cab3d7f",0,0,0,0,0,""
20201022,"HI",14427,194,,,"totalTestEncountersViral",487311,75,1033,18,,15,,11188,"10/21/2020 18:00","2020-10-21T18:00:00Z","10/21 14:00",203,1033,,"2020-10-21T18:00:00Z",,14180,,14233,203,,487311,,,,,,,,,,,,"15",77,0,14427,4329,14427,,14,8,"08e2886bcaa01adb110c70585b2751a770115d84",0,0,0,0,0,""
20201021,"HI",14350,194,,,"totalTestEncountersViral",482982,81,1025,19,,13,,11150,"10/20/2020 18:00","2020-10-20T18:00:00Z","10/20 14:00",189,1025,,"2020-10-20T18:00:00Z",,14097,,14156,189,,482982,,,,,,,,,,,,"15",88,0,14350,3681,14350,,2,13,"74a336efeb5b5123a4d8053ed4b09975c632daf6",0,0,0,0,0,""
20201020,"HI",14262,194,,,"totalTestEncountersViral",479301,96,1012,22,,15,,11078,"10/19/2020 18:00","2020-10-19T18:00:00Z","10/19 14:00",187,1012,,"2020-10-19T18:00:00Z",,14014,,14068,187,,479301,,,,,,,,,,,,"15",37,0,14262,1985,14262,,0,7,"217c47e5a90fa22d32746aea1763e9b075834933",0,0,0,0,0,""
20201019,"HI",14225,194,,,"totalTestEncountersViral",477316,96,1005,22,,15,,11044,"10/18/2020 18:00","2020-10-18T18:00:00Z","10/18 14:00",187,1005,,"2020-10-18T18:00:00Z",,13975,,14031,187,,477316,,,,,,,,,,,,"15",82,0,14225,3735,14225,,1,4,"2e273894e78f7ba7365bf4c79559eb902e2628c3",0,0,0,0,0,""
20201018,"HI",14143,194,,,"totalTestEncountersViral",473581,96,1001,22,,15,,10995,"10/17/2020 18:00","2020-10-17T18:00:00Z","10/17 14:00",186,1001,,"2020-10-17T18:00:00Z",,13890,,13949,186,,473581,,,,,,,,,,,,"15",96,0,14143,3897,14143,,1,13,"81f8c9ae444f4fce82c11092592189d37eca060f",0,0,0,0,0,""
20201017,"HI",14047,194,,,"totalTestEncountersViral",469684,100,988,25,,14,,10947,"10/16/2020 18:00","2020-10-16T18:00:00Z","10/16 14:00",185,988,,"2020-10-16T18:00:00Z",,13794,,13853,185,,469684,,,,,,,,,,,,"15",85,0,14047,3654,14047,,1,10,"011457a3cb6417e5679db6c65f9e27b74ae8c65f",0,0,0,0,0,""
20201016,"HI",13962,198,,,"totalTestEncountersViral",466030,103,978,23,,5,,10915,"10/15/2020 18:00","2020-10-15T18:00:00Z","10/15 14:00",184,978,,"2020-10-15T18:00:00Z",,13703,,13764,184,,466030,,,,,,,,,,,,"15",90,0,13962,3489,13962,,1,17,"c9121799cb1ad9410a5ce1cdce5de6f825363016",0,0,0,0,0,""
20201015,"HI",13872,198,,,"totalTestEncountersViral",462541,105,961,27,,9,,10883,"10/14/2020 18:00","2020-10-14T18:00:00Z","10/14 14:00",183,961,,"2020-10-14T18:00:00Z",,13613,,13674,183,,462541,,,,,,,,,,,,"15",99,0,13872,4069,13872,,10,10,"a12e3c42c5f5e2b2263ed91b8fb6444563117cc7",0,0,0,0,0,""
20201014,"HI",13773,198,,,"totalTestEncountersViral",458472,109,951,26,,14,,10834,"10/13/2020 18:00","2020-10-13T18:00:00Z","10/13 14:00",173,951,,"2020-10-13T18:00:00Z",,13520,,13575,173,,458472,,,,,,,,,,,,"15",61,0,13773,2354,13773,,4,12,"1a4ae5d3738e8080b46feff012abbaa961f79893",0,0,0,0,0,""
20201013,"HI",13712,198,,,"totalTestEncountersViral",456118,103,939,34,,18,,10781,"10/12/2020 18:00","2020-10-12T18:00:00Z","10/12 14:00",169,939,,"2020-10-12T18:00:00Z",,13466,,13514,169,,456118,,,,,,,,,,,,"15",42,0,13712,1405,13712,,0,4,"d7892fe9c5f246c969afd62be7be3076a6043ae8",0,0,0,0,0,""
20201012,"HI",13670,198,,,"totalTestEncountersViral",454713,103,935,34,,18,,10750,"10/11/2020 18:00","2020-10-11T18:00:00Z","10/11 14:00",169,935,,"2020-10-11T18:00:00Z",,13426,,13472,169,,454713,,,,,,,,,,,,"15",101,0,13670,0,13670,,1,6,"e90d6ed2f670fabbd43bcf730e47036adb3688e6",0,0,0,0,0,""
20201011,"HI",13569,198,,,"totalTestEncountersViral",454713,103,929,34,,18,,10713,"10/10/2020 18:00","2020-10-10T18:00:00Z","10/10 14:00",168,929,,"2020-10-10T18:00:00Z",,13426,,13371,168,,454713,,,,,,,,,,,,"15",71,0,13569,6903,13569,,2,18,"f79014246928ee3ac85d5ae4b1c5a800840787cf",0,0,0,0,0,""
20201010,"HI",13498,198,,,"totalTestEncountersViral",447810,106,911,29,,18,,10651,"10/9/2020 18:00","2020-10-09T18:00:00Z","10/09 14:00",166,911,,"2020-10-09T18:00:00Z",,13244,,13300,166,,447810,,,,,,,,,,,,"15",165,0,13498,3818,13498,,2,11,"b8146e88d1c113d9326b5dab7c0265396cf533c3",0,0,0,0,0,""
20201009,"HI",13333,187,,,"totalTestEncountersViral",443992,111,900,32,,18,,10604,"10/8/2020 18:00","2020-10-08T18:00:00Z","10/08 14:00",164,900,,"2020-10-08T18:00:00Z",,13021,,13146,164,,443992,,,,,,,,,,,,"15",101,0,13333,3903,13333,,1,6,"54ebd347979514ce0cd532513b85e3847f09c48a",0,0,0,0,0,""
20201008,"HI",13232,187,,,"totalTestEncountersViral",440089,109,894,35,,18,,10573,"10/7/2020 18:00","2020-10-07T18:00:00Z","10/07 14:00",163,894,,"2020-10-07T18:00:00Z",,12998,,13045,163,,440089,,,,,,,,,,,,"15",108,-295153,13232,3591,13232,,3,5,"39b487c1a4d2b06be57dd5e7a6cba9b6be4a651f",0,0,0,0,0,""
20201007,"HI",13124,187,295153,,"totalTestEncountersViral",436498,115,889,35,,18,,10526,"10/6/2020 18:00","2020-10-06T18:00:00Z","10/06 14:00",160,889,,"2020-10-06T18:00:00Z",441593,12910,,12937,160,,436498,308090,,,,,,,,,,,"15",83,1166,308277,3344,308277,,3,0,"63df8cccd23a5476bab2d8111b138e4c9becd35e",0,0,0,0,0,""
20201006,"HI",13041,187,293987,,"totalTestEncountersViral",433154,128,889,39,,29,,10470,"10/5/2020 18:00","2020-10-05T18:00:00Z","10/05 14:00",157,889,,"2020-10-05T18:00:00Z",438212,12819,,12854,157,,433154,306841,,,,,,,,,,,"15",50,866,307028,1750,307028,,1,0,"861200f55be0a2129029c053c5f1459ff24df0f2",0,0,0,0,0,""
20201005,"HI",12991,187,293121,,"totalTestEncountersViral",431404,128,889,39,,29,,10446,"10/4/2020 18:00","2020-10-04T18:00:00Z","10/04 14:00",156,889,,"2020-10-04T18:00:00Z",436462,12770,,12804,156,,431404,305925,,,,,,,,,,,"15",70,1893,306112,3561,306112,,3,4,"39642250803d92024e52c3ae9237ec2cf095bd9f",0,0,0,0,0,""
20201004,"HI",12921,187,291228,,"totalTestEncountersViral",427843,128,885,39,,29,,10415,"10/3/2020 18:00","2020-10-03T18:00:00Z","10/03 14:00",153,885,,"2020-10-03T18:00:00Z",432711,12696,,12734,153,,427843,303962,,,,,,,,,,,"15",133,1803,304149,4982,304149,,11,5,"72245337aaddb348e832476a6d9267b95fadb45a",0,0,0,0,0,""
20201003,"HI",12788,187,289425,,"totalTestEncountersViral",422861,125,880,40,,27,,10389,"10/2/2020 18:00","2020-10-02T18:00:00Z","10/02 14:00",142,880,,"2020-10-02T18:00:00Z",427746,12567,,12601,142,,422861,302026,,,,,,,,,,,"15",94,1660,302213,3665,302213,,3,18,"cd2c26c147ff9b7019f0e5e4975dfb3fedc4c8a0",0,0,0,0,0,""
20201002,"HI",12694,179,287765,,"totalTestEncountersViral",419196,130,862,45,,21,,10340,"10/1/2020 18:00","2020-10-01T18:00:00Z","10/01 14:00",139,862,,"2020-10-01T18:00:00Z",424242,12478,,12515,139,,419196,300280,,,,,,,,,,,"15",105,1712,300459,3229,300459,,3,15,"323e4f9aa97b79464e017d14605be0f6e996b444",0,0,0,0,0,""
20201001,"HI",12589,179,286053,,"totalTestEncountersViral",415967,140,847,47,,33,,10298,"9/30/2020 18:00","2020-09-30T18:00:00Z","09/30 14:00",136,847,,"2020-09-30T18:00:00Z",420433,12381,,12410,136,,415967,298463,,,,,,,,,,,"15",120,1842,298642,4583,298642,,4,15,"8f2d99389bdf604578cd987a91f3dd8c631adcbb",0,0,0,0,0,""
20200930,"HI",12469,179,284211,,"totalTestEncountersViral",411384,147,832,44,,12,,10256,"9/29/2020 18:00","2020-09-29T18:00:00Z","09/29 14:00",132,832,,"2020-09-29T18:00:00Z",415940,12257,,12290,132,,411384,296414,,,,,,,,,,,"15",87,0,296680,3424,296680,,0,13,"65bd3bad8effc173efdaf03899fd0a1f2e70b03f",0,0,0,0,0,""
20200929,"HI",12382,179,284211,,"totalTestEncountersViral",407960,147,819,44,,12,,10215,"9/28/2020 18:00","2020-09-28T18:00:00Z","09/28 14:00",132,819,,"2020-09-28T18:00:00Z",412790,12168,,12203,132,,407960,296414,,,,,,,,,,,"15",87,2765,296593,2429,296593,,0,3,"43ac196423488e17d9379930a516e6f02350b5a9",0,0,0,0,0,""
20200928,"HI",12295,179,281446,,"totalTestEncountersViral",405531,148,816,48,,31,,10155,"9/27/2020 18:00","2020-09-27T18:00:00Z","09/27 14:00",132,816,,"2020-09-27T18:00:00Z",410341,12078,,12116,132,,405531,293562,,,,,,,,,,,"15",98,1807,293741,4280,293741,,1,14,"ccca36ea91449a73621d7eba916130187e55e733",0,0,0,0,0,""
20200927,"HI",12197,179,279639,,"totalTestEncountersViral",401251,150,802,48,,31,,10126,"9/26/2020 18:00","2020-09-26T18:00:00Z","09/26 14:00",131,802,,"2020-09-26T18:00:00Z",406092,11979,,12018,131,,401251,291657,,,,,,,,,,,"15",127,1563,291836,4255,291836,,4,15,"b4efb62d748edd5ca737d7c29808b63fd5e9d820",0,0,0,0,0,""
20200926,"HI",12070,179,278076,,"totalTestEncountersViral",396996,150,787,55,,30,,5397,"9/25/2020 18:00","2020-09-25T18:00:00Z","09/25 14:00",127,787,,"2020-09-25T18:00:00Z",402010,11853,,11891,127,,396996,289967,,,,,,,,,,,"15",132,2980,290146,3275,290146,,3,8,"de1e900b2b25014c832439281752d29a928c10fa",0,0,0,0,0,""
20200925,"HI",11938,159,275096,,"totalTestEncountersViral",393721,150,779,55,,30,,5265,"9/24/2020 18:00","2020-09-24T18:00:00Z","09/24 14:00",124,779,,"2020-09-24T18:00:00Z",398945,11743,,11779,124,,393721,286785,,,,,,,,,,,"15",90,0,287034,3361,287034,,2,16,"a51cddbabe5b5c82a291833f55a831ead5f02abc",0,0,0,0,0,""
20200924,"HI",11848,159,275096,,"totalTestEncountersViral",390360,162,763,54,,34,,5125,"9/23/2020 18:00","2020-09-23T18:00:00Z","09/23 14:00",122,763,,"2020-09-23T18:00:00Z",395503,11640,,11689,122,,390360,286785,,,,,,,,,,,"15",167,2549,286944,5108,286944,,2,14,"5a542611328197ef66eea41b4d419ef00e547654",0,0,0,0,0,""
20200923,"HI",11681,159,272547,,"totalTestEncountersViral",385252,181,749,61,,39,,4992,"9/22/2020 18:00","2020-09-22T18:00:00Z","09/22 14:00",120,749,,"2020-09-22T18:00:00Z",390003,11469,,11522,120,,385252,284069,,,,,,,,,,,"15",63,1426,284228,3079,284228,,0,14,"dddca48a20cc175c60af51e1f317c3e4d004269d",0,0,0,0,0,""
20200922,"HI",11618,159,271121,,"totalTestEncountersViral",382173,185,735,51,,40,,4888,"9/21/2020 18:00","2020-09-21T18:00:00Z","09/21 14:00",120,735,,"2020-09-21T18:00:00Z",387200,11410,,11459,120,,382173,282580,,,,,,,,,,,"15",56,1106,282739,1865,282739,,0,5,"40540b4a8de66616f490a77766f88fa68da02902",0,0,0,0,0,""
20200921,"HI",11562,159,270015,,"totalTestEncountersViral",380308,185,730,51,,40,,4759,"9/20/2020 18:00","2020-09-20T18:00:00Z","09/20 14:00",120,730,,"2020-09-20T18:00:00Z",385103,11356,,11403,120,,380308,281418,,,,,,,,,,,"15",77,1492,281577,3654,281577,,0,4,"663dab77820366c4a8fdb73f0b4bd6a03b6aa052",0,0,0,0,0,""
20200920,"HI",11485,159,268523,,"totalTestEncountersViral",376654,185,726,51,,40,,4622,"9/19/2020 18:00","2020-09-19T18:00:00Z","09/19 14:00",120,726,,"2020-09-19T18:00:00Z",381571,11273,,11326,120,,376654,279740,,,,,,,,,,,"15",109,0,280008,9252,280008,,0,26,"7b777e7ca9fae485e937319444397b8c7bed2c61",0,0,0,0,0,""
20200919,"HI",11376,159,268523,,"totalTestEncountersViral",367402,200,700,52,,34,,4394,"9/18/2020 18:00","2020-09-18T18:00:00Z","09/18 14:00",120,700,,"2020-09-18T18:00:00Z",372617,11152,,11217,120,,367402,279740,,,,,,,,,,,"15",137,10299,279899,6975,279899,,13,15,"e086e3c0ae6d0dc28c4b1cbeb80744cb68043da3",0,0,0,0,0,""
20200918,"HI",11239,134,258224,,"totalTestEncountersViral",360427,197,685,51,,31,,4248,"9/17/2020 18:00","2020-09-17T18:00:00Z","09/17 14:00",107,685,,"2020-09-17T18:00:00Z",365690,11041,,11105,107,,360427,269329,,,,,,,,,,,"15",159,3670,269463,4600,269463,,4,18,"92adda9a542dde002aef5fe07239c356ce086297",0,0,0,0,0,""
20200917,"HI",11080,134,254554,,"totalTestEncountersViral",355827,210,667,56,,38,,4105,"9/16/2020 18:00","2020-09-16T18:00:00Z","09/16 14:00",103,667,,"2020-09-16T18:00:00Z",358335,10930,,10946,103,,355827,265500,,,,,,,,,,,"15",102,2390,265634,6453,265634,,3,13,"3d9f010d7839a036e979ce8de6b980e138956ae5",0,0,0,0,0,""
20200916,"HI",10978,134,252164,,"totalTestEncountersViral",349374,222,654,60,,48,,3885,"9/15/2020 18:00","2020-09-15T18:00:00Z","09/15 14:00",100,654,,"2020-09-15T18:00:00Z",354450,10792,,10844,100,,349374,263008,,,,,,,,,,,"15",65,1036,263142,2853,263142,,1,16,"81fee95c001dea8162576ef30b94213282eaf8a7",0,0,0,0,0,""
20200915,"HI",10913,134,251128,,"totalTestEncountersViral",346521,225,638,53,,31,,3693,"9/14/2020 18:00","2020-09-14T18:00:00Z","09/14 14:00",99,638,,"2020-09-14T18:00:00Z",352137,10720,,10779,99,,346521,261907,,,,,,,,,,,"15",79,2297,262041,3545,262041,,0,2,"2aac76871f3bcedbf75052a601b79cc1328abde2",0,0,0,0,0,""
20200914,"HI",10834,134,248831,,"totalTestEncountersViral",342976,225,636,53,,31,,3565,"9/13/2020 18:00","2020-09-13T18:00:00Z","09/13 14:00",99,636,,"2020-09-13T18:00:00Z",348561,10644,,10700,99,,342976,259531,,,,,,,,,,,"15",112,4020,259665,6406,259665,,2,1,"3681fbf3aca3ed3184577a086e94aa79e62911ce",0,0,0,0,0,""
20200913,"HI",10722,134,244811,,"totalTestEncountersViral",336570,220,635,51,,41,,3418,"9/12/2020 18:00","2020-09-12T18:00:00Z","09/12 14:00",97,635,,"2020-09-12T18:00:00Z",342202,10531,,10588,97,,336570,255399,,,,,,,,,,,"15",129,5231,255533,7349,255533,,1,13,"11d6ded8f5a6dabcbe56e11bc585a284b7b50d02",0,0,0,0,0,""
20200912,"HI",10593,134,239580,,"totalTestEncountersViral",329221,220,622,51,,41,,3334,"9/11/2020 18:00","2020-09-11T18:00:00Z","09/11 14:00",96,622,,"2020-09-11T18:00:00Z",334756,10398,,10459,96,,329221,250039,,,,,,,,,,,"15",170,3389,250173,5724,250173,,2,12,"2cf549e777c46012c3e4960d714be171b76d16ae",0,0,0,0,0,""
20200911,"HI",10423,131,236191,,"totalTestEncountersViral",323497,240,610,52,,29,,3176,"9/10/2020 18:00","2020-09-10T18:00:00Z","09/10 14:00",94,610,,"2020-09-10T18:00:00Z",329209,10240,,10292,94,,323497,246483,,,,,,,,,,,"15",169,7042,246614,9914,246614,,3,6,"e6c358901d95638e6438e4b44b3b93fe83eadbe8",0,0,0,0,0,""
20200910,"HI",10254,131,229149,,"totalTestEncountersViral",313583,240,604,53,,40,,3120,"9/9/2020 18:00","2020-09-09T18:00:00Z","09/09 14:00",91,604,,"2020-09-09T18:00:00Z",319350,10069,,10123,91,,313583,239272,,,,,,,,,,,"15",98,1388,239403,2710,239403,,3,5,"be137c34fe2f076e03f2954d91eb88eb8d56958b",0,0,0,0,0,""
20200909,"HI",10156,131,227761,,"totalTestEncountersViral",310873,257,599,47,,29,,3063,"9/8/2020 18:00","2020-09-08T18:00:00Z","09/08 14:00",88,599,,"2020-09-08T18:00:00Z",316505,9964,,10025,88,,310873,237786,,,,,,,,,,,"15",197,708,237917,1244,237917,,2,1,"dbe5c8767e059a5be40badcb92ccb45ed893b6a8",0,0,0,0,0,""
20200908,"HI",9959,,227053,,"totalTestEncountersViral",309629,265,598,50,,37,,3028,"9/7/2020 18:00","2020-09-07T18:00:00Z","09/07 14:00",86,598,,"2020-09-07T18:00:00Z",315191,9903,,,86,,309629,237012,,,,,,,,,,,"15",104,2005,237012,3159,237012,,1,1,"6742daf5db280ca1dd68abb220330d9f67067e73",0,0,0,0,0,""
20200907,"HI",9855,,225048,,"totalTestEncountersViral",306470,265,597,50,,37,,2991,"9/6/2020 18:00","2020-09-06T18:00:00Z","09/06 14:00",85,597,,"2020-09-06T18:00:00Z",311961,9802,,,85,,306470,234903,,,,,,,,,,,"15",162,4945,234903,6899,234903,,1,5,"05b78d4b01f955ebce5c33afc7aacc1d04d34aee",0,0,0,0,0,""
20200906,"HI",9693,,220103,,"totalTestEncountersViral",299571,265,592,50,,37,,2931,"9/5/2020 18:00","2020-09-05T18:00:00Z","09/05 14:00",84,592,,"2020-09-05T18:00:00Z",305226,9639,,,84,,299571,229796,,,,,,,,,,,"15",220,8185,229796,10725,229796,,3,9,"398d07097f52a3dabae973b236e4b8c3102a1de7",0,0,0,0,0,""
20200905,"HI",9473,,211918,,"totalTestEncountersViral",288846,265,583,50,,37,,2855,"9/4/2020 18:00","2020-09-04T18:00:00Z","09/04 14:00",81,583,,"2020-09-04T18:00:00Z",294102,9430,,,81,,288846,221391,,,,,,,,,,,"15",271,7398,221391,9986,221391,,2,10,"5ad6c4751ea94de89ae74519c82931ddb80b45e3",0,0,0,0,0,""
20200904,"HI",9202,,204520,,"totalTestEncountersViral",278860,277,573,51,,31,,2778,"9/3/2020 05:59","2020-09-03T05:59:00Z","09/03 01:59",79,573,,"2020-09-03T05:59:00Z",284177,9149,,,79,,278860,213722,,,,,,,,,,,"15",211,6080,213722,8482,213722,,4,21,"44bf45c263dab28e2a3ce56f86318d83cb86beb2",0,0,0,0,0,""
20200903,"HI",8991,,198440,,"totalTestEncountersViral",270378,276,552,47,,27,,2689,"9/2/2020 05:59","2020-09-02T05:59:00Z","09/02 01:59",75,552,,"2020-09-02T05:59:00Z",275704,8947,,,75,,270378,207431,,,,,,,,,,,"15",338,4907,207431,7309,207431,,1,20,"38c233cdfef6d711d1ba4d07b3aa1012a4cd06a2",0,0,0,0,0,""
20200902,"HI",8653,,193533,,"totalTestEncountersViral",263069,288,532,48,,27,,2634,"9/1/2020 05:59","2020-09-01T05:59:00Z","09/01 01:59",74,532,,"2020-09-01T05:59:00Z",268461,8699,,,74,,263069,202186,,,,,,,,,,,"15",181,3823,202186,5368,202186,,4,24,"b71b4b3752e80588fff570de59d0d8539461ae68",0,0,0,0,0,""
20200901,"HI",8472,,189710,,"totalTestEncountersViral",257701,297,508,57,,42,,2578,"8/31/2020 05:59","2020-08-31T05:59:00Z","08/31 01:59",70,508,,"2020-08-31T05:59:00Z",263187,8519,,,70,,257701,198182,,,,,,,,,,,"15",133,1330,198182,2002,198182,,7,3,"15cd2dfdba7cfb375704c39eaacfd67d0e2914e0",0,0,0,0,0,""
20200831,"HI",8339,,188380,,"totalTestEncountersViral",255699,272,505,57,,42,,2520,"8/30/2020 05:59","2020-08-30T05:59:00Z","08/30 01:59",63,505,,"2020-08-30T05:59:00Z",260737,8392,,,63,,255699,196719,,,,,,,,,,,"15",200,2584,196719,4322,196719,,1,8,"e9df507cca4127c57e88f657567642697613e9cf",0,0,0,0,0,""
20200830,"HI",8139,,185796,,"totalTestEncountersViral",251377,272,497,57,,42,,2477,"8/29/2020 05:59","2020-08-29T05:59:00Z","08/29 01:59",62,497,,"2020-08-29T05:59:00Z",256650,8197,,,62,,251377,193935,,,,,,,,,,,"15",309,2716,193935,5310,193935,,3,12,"899be76517d0b8a35c31a7f6f2b4c5eb29ec0c26",0,0,0,0,0,""
20200829,"HI",7830,,183080,,"totalTestEncountersViral",246067,279,485,55,,38,,2410,"8/28/2020 05:59","2020-08-28T05:59:00Z","08/28 01:59",59,485,,"2020-08-28T05:59:00Z",251710,7877,,,59,,246067,190910,,,,,,,,,,,"15",264,2493,190910,4582,190910,,4,23,"37fa27ccd45e7a4a69d97fd612adf4f52215af20",0,0,0,0,0,""
20200828,"HI",7566,,180587,,"totalTestEncountersViral",241485,286,462,56,,39,,2371,"8/27/2020 05:59","2020-08-27T05:59:00Z","08/27 01:59",55,462,,"2020-08-27T05:59:00Z",247017,7591,,,55,,241485,188153,,,,,,,,,,,"15",306,2172,188153,3682,188153,,4,18,"cd79c90bc3dbc26e2e109e620e9fbd0331a68faf",0,0,0,0,0,""
20200827,"HI",7260,,178415,,"totalTestEncountersViral",237803,291,444,54,,35,,2288,"8/26/2020 05:59","2020-08-26T05:59:00Z","08/26 01:59",51,444,,"2020-08-26T05:59:00Z",243154,7276,,,51,,237803,185675,,,,,,,,,,,"15",276,2242,185675,4064,185675,,2,25,"5497cd992ecabe502c69b52de310288044bde9a5",0,0,0,0,0,""
20200826,"HI",6984,,176173,,"totalTestEncountersViral",233739,270,419,50,,19,,2236,"8/25/2020 05:59","2020-08-25T05:59:00Z","08/25 01:59",49,419,,"2020-08-25T05:59:00Z",239269,6987,,,49,,233739,183157,,,,,,,,,,,"15",0,2307,183157,3364,183157,,0,0,"a8a8fa6b178f9247f56e7c995f12abbb01e58dde",0,0,0,0,0,""
20200825,"HI",6984,,173866,,"totalTestEncountersViral",230375,250,419,35,,19,,2236,"8/25/2020 05:59","2020-08-25T05:59:00Z","08/25 01:59",49,419,,"2020-08-25T05:59:00Z",239269,6775,,,49,,230375,180850,,,,,,,,,,,"15",384,1642,180850,3087,180850,,2,23,"0eeaa6530ee6ba7d235e570d1f7af481df9fc353",0,0,0,0,0,""
20200824,"HI",6600,,172224,,"totalTestEncountersViral",227288,192,396,35,,19,,2143,"8/23/2020 18:00","2020-08-23T18:00:00Z","08/23 14:00",47,396,,"2020-08-23T18:00:00Z",232334,6615,,,47,,227288,178824,,,,,,,,,,,"15",244,2396,178824,3841,178824,,0,19,"0123da95c9a4ad6f15e2061d05d32d767ec91a56",0,0,0,0,0,""
20200823,"HI",6356,,169828,,"totalTestEncountersViral",223447,192,377,35,,19,,2107,"8/22/2020 18:00","2020-08-22T18:00:00Z","08/22 14:00",47,377,,"2020-08-22T18:00:00Z",228381,6369,,,47,,223447,176184,,,,,,,,,,,"15",284,2350,176184,4390,176184,,1,40,"e60e2818ca6e6887333ac6ca9c861917d35dbb47",0,0,0,0,0,""
20200822,"HI",6072,,167478,,"totalTestEncountersViral",219057,227,337,44,,23,,2072,"8/21/2020 00:00","2020-08-21T00:00:00Z","08/20 20:00",46,337,,"2020-08-21T00:00:00Z",223985,6050,,,46,,219057,173550,,,,,,,,,,,"15",228,4650,173550,3806,173550,,1,20,"0b36fe6348605cd9060a88a5c913b7cad1c42d6a",0,0,0,0,0,""
20200821,"HI",5844,,162828,,"totalTestEncountersViral",215251,165,317,29,,19,,2031,"8/20/2020 23:24","2020-08-20T23:24:00Z","08/20 19:24",45,317,,"2020-08-20T23:24:00Z",219986,5825,,,45,,215251,171184,,,,,,,,,,,"15",0,0,168672,3520,168672,,0,0,"1168e880baab274b7d9b6957c6949f17db5f6f2f",0,0,0,0,0,""
20200820,"HI",5844,,162828,,"totalTestEncountersViral",211731,187,317,33,,20,,2031,"8/19/2020 23:29","2020-08-19T23:29:00Z","08/19 19:29",45,317,,"2020-08-19T23:29:00Z",219986,5596,,,45,,211731,168672,,,,,,,,,,,"15",235,2324,168672,3741,168672,,3,14,"908002794dab2bbb9b2c2b992b2ed4dcbc3f8242",0,0,0,0,0,""
20200819,"HI",5609,,160504,,"totalTestEncountersViral",207990,205,303,39,,22,,1977,"8/19/2020 00:52","2020-08-19T00:52:00Z","08/18 20:52",42,303,,"2020-08-19T00:52:00Z",216120,5341,,,42,,207990,166113,,,,,,,,,,,"15",394,1520,166113,2719,166113,,2,15,"2f8dafbac0c5343de2e59abca4fcb49131348916",0,0,0,0,0,""
20200818,"HI",5215,,158984,,"totalTestEncountersViral",205271,175,288,35,,25,,1868,"8/17/2020 22:55","2020-08-17T22:55:00Z","08/17 18:55",40,288,,"2020-08-17T22:55:00Z",209529,5193,,,40,,205271,164199,,,,,,,,,,,"15",173,2078,164199,3246,164199,,0,5,"570540e5e316566ca3fa6fd43ecd81e85b84b2fb",0,0,0,0,0,""
20200817,"HI",5042,,156906,,"totalTestEncountersViral",202025,143,283,35,,25,,1841,"8/16/2020 00:00","2020-08-16T00:00:00Z","08/15 20:00",40,283,,"2020-08-16T00:00:00Z",206537,5017,,,40,,202025,161948,,,,,,,,,,,"15",217,2432,161948,3840,161948,,0,4,"df971d0f10ea6d6be42c4b81849a87fd28058b78",0,0,0,0,0,""
20200816,"HI",4825,,154474,,"totalTestEncountersViral",198185,143,279,35,,25,,1808,"8/14/2020 22:38","2020-08-14T22:38:00Z","08/14 18:38",40,279,,"2020-08-14T22:38:00Z",202753,4806,,,40,,198185,159299,,,,,,,,,,,"15",282,2751,159299,4379,159299,,0,2,"bf4221e5fe06bd3362e6ec0ee3f2fed7b57fe0f6",0,0,0,0,0,""
20200815,"HI",4543,,151723,,"totalTestEncountersViral",193806,173,277,41,,22,,1756,"8/14/2020 22:38","2020-08-14T22:38:00Z","08/14 18:38",40,277,,"2020-08-14T22:38:00Z",198152,4512,,,40,,193806,156266,,,,,,,,,,,"15",231,2418,156266,3675,156266,,0,10,"548afdb291e952b37292beaf7ac7ee6fb301a2ce",0,0,0,0,0,""
20200814,"HI",4312,,149305,,"totalTestEncountersViral",190131,146,267,29,,22,,1716,"8/13/2020 23:15","2020-08-13T23:15:00Z","08/13 19:15",40,267,,"2020-08-13T23:15:00Z",194351,4278,,,40,,190131,153617,,,,,,,,,,,"15",0,3030,153617,4649,153617,,0,0,"2c56cde777f54abf604e3991a2b4f6f1970f7601",0,0,0,0,0,""
20200813,"HI",4312,,146275,,"totalTestEncountersViral",185482,132,267,33,,24,,1716,"8/13/2020 16:28","2020-08-13T16:28:00Z","08/13 12:28",40,267,,"2020-08-13T16:28:00Z",194351,3937,,,40,,185482,150233,,,,,,,,,,,"15",354,0,150587,3648,150587,,2,7,"5caa5af62785ed41002bea4142d3f174ca24850f",0,0,0,0,0,""
20200812,"HI",3958,,146275,,"totalTestEncountersViral",181834,166,260,31,,23,,1665,"8/11/2020 23:06","2020-08-11T23:06:00Z","08/11 19:06",38,260,,"2020-08-11T23:06:00Z",189492,3745,,,38,,181834,150233,,,,,,,,,,,"15",320,4077,150233,2412,150233,,4,18,"934c72c05be93da7c7500daa3c6bbb8b2769872f",0,0,0,0,0,""
20200811,"HI",3638,,142198,,"totalTestEncountersViral",179422,105,242,24,,15,,1586,"8/10/2020 23:37","2020-08-10T23:37:00Z","08/10 19:37",34,242,,"2020-08-10T23:37:00Z",183508,3605,,,34,,179422,145836,,,,,,,,,,,"15",140,3600,145836,2442,145836,,3,3,"62dd4af8ec49812a73ad0aa162d73ab7a6ee1d51",0,0,0,0,0,""
20200810,"HI",3498,,138598,,"totalTestEncountersViral",176980,105,239,24,,15,,1548,"8/8/2020 20:40","2020-08-08T20:40:00Z","08/08 16:40",31,239,,"2020-08-08T20:40:00Z",181000,3461,,,31,,176980,141944,,,,,,,,,,,"15",152,0,142096,2746,142096,,0,2,"368f77eb8f14c8970233449257baa764bf9a6046",0,0,0,0,0,""
20200809,"HI",3346,,138598,,"totalTestEncountersViral",174234,105,237,24,,15,,1511,"8/8/2020 20:40","2020-08-08T20:40:00Z","08/08 16:40",31,237,,"2020-08-08T20:40:00Z",178211,3319,,,31,,174234,141944,,,,,,,,,,,"15",231,2467,141944,3129,141944,,0,6,"20ecae5e0e184f18e355df0c99d12c2498c994c4",0,0,0,0,0,""
20200808,"HI",3115,,136131,,"totalTestEncountersViral",171105,102,231,24,,19,,1467,"8/7/2020 23:38","2020-08-07T23:38:00Z","08/07 19:38",31,231,,"2020-08-07T23:38:00Z",174717,3107,,,31,,171105,139246,,,,,,,,,,,"15",201,3761,139246,2975,139246,,2,6,"1598cc53a034c2bc43abb1031f926fe8d97a7555",0,0,0,0,0,""
20200807,"HI",2914,,132370,,"totalTestEncountersViral",168130,117,225,21,,14,,1440,"8/6/2020 23:37","2020-08-06T23:37:00Z","08/06 19:37",29,225,,"2020-08-06T23:37:00Z",172699,2893,,,29,,168130,135284,,,,,,,,,,,"15",151,224,135284,3403,135284,,2,11,"b42bd32c0689007164ca0268aeedd5812b31b75a",0,0,0,0,0,""
20200806,"HI",2763,,132146,,"totalTestEncountersViral",164727,83,214,15,,13,,1402,"8/5/2020 23:10","2020-08-05T23:10:00Z","08/05 19:10",27,214,,"2020-08-05T23:10:00Z",168422,2717,,,27,,164727,134909,,,,,,,,,,,"15",172,2211,134909,3327,134909,,0,6,"0a5e524333a3ae288a53e5be5fbc86ed07550d70",0,0,0,0,0,""
20200805,"HI",2591,,129935,,"totalTestEncountersViral",161400,83,208,15,,13,,1354,"8/4/2020 23:22","2020-08-04T23:22:00Z","08/04 19:22",27,208,,"2020-08-04T23:22:00Z",165176,2561,,,27,,161400,132526,,,,,,,,,,,"15",143,1671,132526,2307,132526,,1,7,"fdcf8c8c50e808fc24ae4e371f375e69ec0e4f37",0,0,0,0,0,""
20200804,"HI",2448,,128264,,"totalTestEncountersViral",159093,138,201,15,,10,,1315,"8/3/2020 22:53","2020-08-03T22:53:00Z","08/03 18:53",26,201,,"2020-08-03T22:53:00Z",162785,2407,,,26,,159093,130712,,,,,,,,,,,"15",206,3227,130712,1789,130712,,0,2,"3004b19a7ce7f2759693ac17bd5d3510dc3219a7",0,0,0,0,0,""
20200803,"HI",2242,,125037,,"totalTestEncountersViral",157304,75,199,15,,10,,1294,"8/2/2020 22:32","2020-08-02T22:32:00Z","08/02 18:32",26,199,,"2020-08-02T22:32:00Z",158188,2284,,,26,,157304,127279,,,,,,,,,,,"15",45,593,127279,2790,127279,,0,5,"ccd899dde047438c2871b58727e4e7c5eaa442e4",0,0,0,0,0,""
20200802,"HI",2197,,124444,,"totalTestEncountersViral",154514,75,194,15,,10,,1269,"8/1/2020 21:25","2020-08-01T21:25:00Z","08/01 17:25",26,194,,"2020-08-01T21:25:00Z",157291,2166,,,26,,154514,126641,,,,,,,,,,,"15",86,3304,126641,2428,126641,,0,15,"f1be6f2098fa008fff2dd4f34dea82b469679b5c",0,0,0,0,0,""
20200801,"HI",2111,,121140,,"totalTestEncountersViral",152086,75,179,15,,10,,1243,"7/31/2020 23:31","2020-07-31T23:31:00Z","07/31 19:31",26,179,,"2020-07-31T23:31:00Z",152976,2072,,,26,,152086,123251,,,,,,,,,,,"15",122,1761,123251,2690,123251,,0,2,"15d54d222c396bc70fe5e3d94bdbea8eb513136f",0,0,0,0,0,""
20200731,"HI",1989,,119379,,"totalTestEncountersViral",149396,65,177,14,,10,,1226,"7/30/2020 23:30","2020-07-30T23:30:00Z","07/30 19:30",26,177,,"2020-07-30T23:30:00Z",150394,1941,,,26,,149396,121368,,,,,,,,,,,"15",124,2032,121368,2500,121368,,0,4,"935af31bff814dcbeaa46d1169008b0a6fe90085",0,0,0,0,0,""
20200730,"HI",1865,,117347,,"totalTestEncountersViral",146896,61,173,11,,9,,1215,"7/29/2020 18:00","2020-07-29T18:00:00Z","07/29 14:00",26,173,,"2020-07-29T18:00:00Z",147553,1826,,,26,,146896,119212,,,,,,,,,,,"15",108,1545,119212,2740,119212,,0,6,"4ac1beb31e940b71bb3ec44322ac72807e69a654",0,0,0,0,0,""
20200729,"HI",1757,,115802,,"totalTestEncountersViral",144156,47,167,,,,,1205,"7/28/2020 23:04","2020-07-28T23:04:00Z","07/28 19:04",26,167,,"2020-07-28T23:04:00Z",145404,1719,,,26,,144156,117559,,,,,,,,,,,"15",46,1126,117559,1031,117559,,0,2,"af8c4e84a32b8d0c2e441c855934cb5b0ef065aa",0,0,0,0,0,""
20200728,"HI",1711,,114676,,"totalTestEncountersViral",143125,39,165,,,,,1191,"7/28/2020 00:00","2020-07-28T00:00:00Z","07/27 20:00",26,165,,"2020-07-28T00:00:00Z",143791,1680,,,26,,143125,116387,,,,,,,,,,,"15",28,2244,116387,1234,116387,,0,2,"05781001280bb961e59d16c9c9457c7fabfceb4b",0,0,0,0,0,""
20200727,"HI",1683,,112432,,"totalTestEncountersViral",141891,26,163,,,,,1179,"7/27/2020 00:00","2020-07-27T00:00:00Z","07/26 20:00",26,163,,"2020-07-27T00:00:00Z",142900,1635,,,26,,141891,114052,,,,,,,,,,,"15",63,0,114115,2541,114115,,0,2,"6b458aa2c683815fecc88bb98a7624a4c799b4e1",0,0,0,0,0,""
20200726,"HI",1620,,112432,,"totalTestEncountersViral",139350,29,161,,,,,1167,"7/25/2020 18:39","2020-07-25T18:39:00Z","07/25 14:39",26,161,,"2020-07-25T18:39:00Z",140442,1572,,,26,,139350,114052,,,,,,,,,,,"15",71,1191,114052,2247,114052,,0,5,"db6135d7ccdc554a06dc99dcfb9330888ba7a927",0,0,0,0,0,""
20200725,"HI",1549,,111241,,"totalTestEncountersViral",137103,29,156,,,,,1148,"7/24/2020 18:00","2020-07-24T18:00:00Z","07/24 14:00",26,156,,"2020-07-24T18:00:00Z",138354,1502,,,26,,137103,112790,,,,,,,,,,,"15",59,1440,112790,1951,112790,,0,1,"8c3f45ff745a7138fadbc392a2d2a01da09e43e1",0,0,0,0,0,""
20200724,"HI",1490,,109801,,"totalTestEncountersViral",135152,39,155,,,,,1125,"7/23/2020 18:00","2020-07-23T18:00:00Z","07/23 14:00",26,155,,"2020-07-23T18:00:00Z",136008,1445,,,26,,135152,111291,,,,,,,,,,,"15",55,2423,111291,2412,111291,,1,1,"d61a59fb12e4965cd566d9fab8b6c3aa94b028a7",0,0,0,0,0,""
20200723,"HI",1435,,107378,,"totalTestEncountersViral",132740,39,154,,,,,1113,"7/22/2020 18:00","2020-07-22T18:00:00Z","07/22 14:00",25,154,,"2020-07-22T18:00:00Z",132361,1399,,,25,,132740,108813,,,,,,,,,,,"15",17,614,108813,2614,108813,,1,3,"3cd90b44f3cf396ab4feec65f50d3fd98817962b",0,0,0,0,0,""
20200722,"HI",1418,,106764,,"totalTestEncountersViral",130126,47,151,,,,,1084,"7/21/2020 00:00","2020-07-21T00:00:00Z","07/20 20:00",24,151,,"2020-07-21T00:00:00Z",131371,1374,,,24,,130126,108182,,,,,,,,,,,"15",25,1374,108182,1668,108182,,0,1,"d7c3d00f3b2ed13e5f208e5730b72286d50f3d3b",0,0,0,0,0,""
20200721,"HI",1393,,105390,,"totalTestEncountersViral",128458,46,150,,,,,1057,"7/20/2020 00:00","2020-07-20T00:00:00Z","07/19 20:00",24,150,,"2020-07-20T00:00:00Z",129510,1348,,,24,,128458,106783,,,,,,,,,,,"15",12,815,106783,1240,106783,,0,0,"18dd07d4c27d1917058e61e00a71b42f0dd1f881",0,0,0,0,0,""
20200720,"HI",1381,,104575,,"totalTestEncountersViral",127218,33,150,,,,,1043,"7/19/2020 00:00","2020-07-19T00:00:00Z","07/18 20:00",24,150,,"2020-07-19T00:00:00Z",128374,1336,,,24,,127218,105956,,,,,,,,,,,"15",27,1294,105956,1983,105956,,0,10,"cb321d3b44bdd70cd1b4f50920ef1b6cfa66a2e6",0,0,0,0,0,""
20200719,"HI",1354,,103281,,"totalTestEncountersViral",125235,39,140,,,,,1019,"7/18/2020 18:00","2020-07-18T18:00:00Z","07/18 14:00",24,140,,"2020-07-18T18:00:00Z",126454,1309,,,24,,125235,104635,,,,,,,,,,,"15",20,1620,104635,2368,104635,,1,1,"703154790fd3133eca456a4032958bd12ac4065a",0,0,0,0,0,""
20200718,"HI",1334,,101661,,"totalTestEncountersViral",122867,39,139,,,,,994,"7/17/2020 18:00","2020-07-17T18:00:00Z","07/17 14:00",23,139,,"2020-07-17T18:00:00Z",124068,1287,,,23,,122867,102995,,,,,,,,,,,"15",23,1768,102995,2420,102995,,1,1,"8afac3c53bc6cf2212cfe66d6d128ec1f97a7bf8",0,0,0,0,0,""
20200717,"HI",1311,,99893,,"totalTestEncountersViral",120447,39,138,,,,,975,"7/16/2020 18:00","2020-07-16T18:00:00Z","07/16 14:00",22,138,,"2020-07-16T18:00:00Z",121512,1267,,,22,,120447,101204,,,,,,,,,,,"15",19,1798,101204,2417,101204,,0,1,"3601a4076e81088465b3c7de43c7fd2b51d5e62a",0,0,0,0,0,""
20200716,"HI",1292,,98095,,"totalTestEncountersViral",118030,40,137,,,,,951,"7/15/2020 18:00","2020-07-15T18:00:00Z","07/15 14:00",22,137,,"2020-07-15T18:00:00Z",118842,1246,,,22,,118030,99387,,,,,,,,,,,"15",28,1802,99387,2805,99387,,0,4,"99ed3d0d61acc458eca019da7809b335a7d11644",0,0,0,0,0,""
20200715,"HI",1264,,96293,,"totalTestEncountersViral",115225,31,133,,,,,921,"7/14/2020 18:00","2020-07-14T18:00:00Z","07/14 14:00",22,133,,"2020-07-14T18:00:00Z",116275,1219,,,22,,115225,97557,,,,,,,,,,,"15",21,1466,97557,1724,97557,,0,5,"9f88bac057a9e342eacb829762df264a1ccda731",0,0,0,0,0,""
20200714,"HI",1243,,94827,,"totalTestEncountersViral",113501,23,128,,,,,911,"7/13/2020 18:00","2020-07-13T18:00:00Z","07/13 14:00",22,128,,"2020-07-13T18:00:00Z",114109,1198,,,22,,113501,96070,,,,,,,,,,,"15",23,877,96070,1200,96070,,3,3,"e8156c2406f0d1e40dce4ae7f5020ce96e2219d3",0,0,0,0,0,""
20200713,"HI",1220,,93950,,"totalTestEncountersViral",112301,,125,,,,,890,"7/12/2020 00:00","2020-07-12T00:00:00Z","07/11 20:00",19,125,,"2020-07-12T00:00:00Z",112882,1174,,,19,,112301,95170,,,,,,,,,,,"15",20,1230,95170,1896,95170,,0,0,"6c789b505610f1498440f37b6d1c61ee8b2dc5cd",0,0,0,0,0,""
20200712,"HI",1200,,92720,,"totalTestEncountersViral",110405,,125,,,,,872,"7/11/2020 18:00","2020-07-11T18:00:00Z","07/11 14:00",19,125,,"2020-07-11T18:00:00Z",111318,1154,,,19,,110405,93920,,,,,,,,,,,"15",42,1644,93920,1999,93920,,0,0,"8d7984b519d1700fd28579b49c9b85f642c7e58d",0,0,0,0,0,""
20200711,"HI",1158,,91076,,"totalTestEncountersViral",108406,,125,,,,,847,"7/10/2020 18:00","2020-07-10T18:00:00Z","07/10 14:00",19,125,,"2020-07-10T18:00:00Z",109096,1114,,,19,,108406,92234,,,,,,,,,,,"15",28,1611,92234,1975,92234,,0,2,"e486267c207f7e316ac85486c86e85806472a2b5",0,0,0,0,0,""
20200710,"HI",1130,,89465,,"totalTestEncountersViral",106431,,123,,,,,840,"7/9/2020 18:00","2020-07-09T18:00:00Z","07/09 14:00",19,123,,"2020-07-09T18:00:00Z",107009,1086,,,19,,106431,90595,,,,,,,,,,,"15",36,1407,90595,2245,90595,,0,1,"8555e2f5f0389b5591b01118af16a942c242c983",0,0,0,0,0,""
20200709,"HI",1094,,88058,,"totalTestEncountersViral",104186,,122,,,,,811,"7/8/2020 18:00","2020-07-08T18:00:00Z","07/08 14:00",19,122,,"2020-07-08T18:00:00Z",105290,1053,,,19,,104186,89152,,,,,,,,,,,"15",23,2033,89152,2068,89152,,0,3,"efdd51c19ff050d474a52abb871d0f071d70797e",0,0,0,0,0,""
20200708,"HI",1071,,86025,,"totalTestEncountersViral",102118,,119,,,,,797,"7/7/2020 18:00","2020-07-07T18:00:00Z","07/07 14:00",19,119,,"2020-07-07T18:00:00Z",102674,1032,,,19,,102118,87096,,,,,,,,,,,"15",41,1382,87096,1539,87096,,0,0,"c6b0780cb5449424bb64487a239979240be1db6c",0,0,0,0,0,""
20200707,"HI",1030,,84643,,"totalTestEncountersViral",100579,,119,,,,,781,"7/6/2020 18:00","2020-07-06T18:00:00Z","07/06 14:00",19,119,,"2020-07-06T18:00:00Z",100888,993,,,19,,100579,85673,,,,,,,,,,,"15",7,608,85673,666,85673,,0,1,"2987ef5c9e8aec0c5d32ff8cdab059fb7d6d0ea6",0,0,0,0,0,""
20200706,"HI",1023,,84035,,"totalTestEncountersViral",99913,,118,,,,,777,"7/5/2020 18:00","2020-07-05T18:00:00Z","07/05 14:00",19,118,,"2020-07-05T18:00:00Z",100110,983,,,19,,99913,85058,,,,,,,,,,,"15",24,709,85058,1135,85058,,0,0,"c4eac05b78876fc720a3cbc5683fb51ff9ef02c5",0,0,0,0,0,""
20200705,"HI",999,,83326,,"totalTestEncountersViral",98778,,118,,,,,756,"7/4/2020 18:00","2020-07-04T18:00:00Z","07/04 14:00",19,118,,"2020-07-04T18:00:00Z",99282,958,,,19,,98778,84325,,,,,,,,,,,"15",24,825,84325,1424,84325,,0,0,"245b67734c1d610038d7a3209e4ee5cb08d89c6d",0,0,0,0,0,""
20200704,"HI",975,,82501,,"totalTestEncountersViral",97354,,118,,,,,754,"7/3/2020 18:00","2020-07-03T18:00:00Z","07/03 14:00",19,118,,"2020-07-03T18:00:00Z",98278,935,,,19,,97354,83476,,,,,,,,,,,"15",29,1829,83476,1963,83476,,1,2,"f26a028ca4d38d531d0d4629466e5d9f13d5c1f1",0,0,0,0,0,""
20200703,"HI",946,,80672,,"totalTestEncountersViral",95391,,116,,,,,746,"7/2/2020 18:00","2020-07-02T18:00:00Z","07/02 14:00",18,116,,"2020-07-02T18:00:00Z",95866,904,,,18,,95391,81618,,,,,,,,,,,"15",20,1308,81618,1698,81618,,0,0,"111a4e6761cb717bab7d9d97e8d9c2b5563e0c15",0,0,0,0,0,""
20200702,"HI",926,,79364,,"totalTestEncountersViral",93693,,116,,,,,741,"7/1/2020 18:00","2020-07-01T18:00:00Z","07/01 14:00",18,116,,"2020-07-01T18:00:00Z",94160,887,,,18,,93693,80290,,,,,,,,,,,"15",9,1223,80290,2001,80290,,0,3,"e934443df22f80875a3d6ed5e06f56996502548a",0,0,0,0,0,""
20200701,"HI",917,,78141,,"totalTestEncountersViral",91692,,113,,,,,736,"6/30/2020 18:00","2020-06-30T18:00:00Z","06/30 14:00",18,113,,"2020-06-30T18:00:00Z",92225,878,,,18,,91692,79058,,,,,,,,,,,"15",17,1298,79058,1454,79058,,0,2,"cb450d50255e538f610228976335519dd3142c63",0,0,0,0,0,""
20200630,"HI",900,,76843,,"totalTestEncountersViral",90238,,111,,,,,722,"6/29/2020 18:00","2020-06-29T18:00:00Z","06/29 14:00",18,111,,"2020-06-29T18:00:00Z",90577,860,,,18,,90238,77743,,,,,,,,,,,"15",1,587,77743,880,77743,,0,0,"9f1f3a77b0944b42d592f3c09d09b61598371be8",0,0,0,0,0,""
20200629,"HI",899,,76256,,"totalTestEncountersViral",89358,,111,,,,,719,"6/28/2020 18:00","2020-06-28T18:00:00Z","06/28 14:00",18,111,,"2020-06-28T18:00:00Z",89866,859,,,18,,89358,77155,,,,,,,,,,,"15",27,1650,77155,1901,77155,,0,1,"3427d56448ba7d6821e7c05e08bbfdde664b3637",0,0,0,0,0,""
20200628,"HI",872,,74606,,"totalTestEncountersViral",87457,,110,,,,,714,"6/27/2020 18:00","2020-06-27T18:00:00Z","06/27 14:00",18,110,,"2020-06-27T18:00:00Z",87882,833,,,18,,87457,75478,,,,,,,,,,,"15",6,1171,75478,1457,75478,,1,1,"15ede64e9dcc3e877ea70fb4b1638ae52f044c0d",0,0,0,0,0,""
20200627,"HI",866,,73435,,"totalTestEncountersViral",86000,,109,,,,,705,"6/26/2020 18:00","2020-06-26T18:00:00Z","06/26 14:00",17,109,,"2020-06-26T18:00:00Z",86464,828,,,17,,86000,74301,,,,,,,,,,,"15",16,1280,74301,1630,74301,,0,0,"77543ff838cdfde291f261ac778b998e427d5b18",0,0,0,0,0,""
20200626,"HI",850,,72155,,"totalTestEncountersViral",84370,,109,,,,,696,"6/25/2020 18:00","2020-06-25T18:00:00Z","06/25 14:00",17,109,,"2020-06-25T18:00:00Z",84910,812,,,17,,84370,73005,,,,,,,,,,,"15",15,1055,73005,1569,73005,,0,4,"bddc2d9c657c34235f8280788c728385734018f9",0,0,0,0,0,""
20200625,"HI",835,,71100,,"totalTestEncountersViral",82801,,105,,,,,686,"6/24/2020 18:00","2020-06-24T18:00:00Z","06/24 14:00",17,105,,"2020-06-24T18:00:00Z",83301,793,,,17,,82801,71935,,,,,,,,,,,"15",16,1380,71935,2046,71935,,0,1,"10ed8f8fa862a5251880da30c2e0acb1c442f7a9",0,0,0,0,0,""
20200624,"HI",819,,69720,,"totalTestEncountersViral",80755,,104,,,,,673,"6/23/2020 18:00","2020-06-23T18:00:00Z","06/23 14:00",17,104,,"2020-06-23T18:00:00Z",81648,782,,,17,,80755,70539,,,,,,,,,,,"15",3,1196,70539,1275,70539,,0,5,"2a1108b7615cd1936724fab1490130d40033edd0",0,0,0,0,0,""
20200623,"HI",816,,68524,,"totalTestEncountersViral",79480,,99,,,,,669,"6/22/2020 18:00","2020-06-22T18:00:00Z","06/22 14:00",17,99,,"2020-06-22T18:00:00Z",80394,778,,,17,,79480,69340,,,,,,,,,,,"15",2,627,69340,707,69340,,0,2,"8d38841c00d41b6d50695040d3a999d8b236218a",0,0,0,0,0,""
20200622,"HI",814,,67897,,"totalTestEncountersViral",78773,,97,,,,,651,"6/21/2020 18:00","2020-06-21T18:00:00Z","06/21 14:00",17,97,,"2020-06-21T18:00:00Z",79795,774,,,17,,78773,68711,,,,,,,,,,,"15",11,840,68711,1436,68711,,0,1,"fbdf1be50621a271054c5de2d40ca216605daafd",0,0,0,0,0,""
20200621,"HI",803,,67057,,"totalTestEncountersViral",77337,,96,,,,,644,"6/20/2020 18:00","2020-06-20T18:00:00Z","06/20 14:00",17,96,,"2020-06-20T18:00:00Z",78744,765,,,17,,77337,67860,,,,,,,,,,,"15",14,1112,67860,1282,67860,,0,0,"aeac6dec1a558e7a8b448f6c28d101c608e16c24",0,0,0,0,0,""
20200620,"HI",789,,65945,,"totalTestEncountersViral",76055,,96,,,,,642,"6/19/2020 18:00","2020-06-19T18:00:00Z","06/19 14:00",17,96,,"2020-06-19T18:00:00Z",77620,753,,,17,,76055,66734,,,,,,,,,,,"15",27,963,66734,1361,66734,,0,1,"463fc272bcd24ca95ffce9c9ac8957fd99b65478",0,0,0,0,0,""
20200619,"HI",762,,64982,,"totalTestEncountersViral",74694,,95,,,,,640,"6/18/2020 18:00","2020-06-18T18:00:00Z","06/18 14:00",17,95,,"2020-06-18T18:00:00Z",76340,727,,,17,,74694,65744,,,,,,,,,,,"15",18,1352,65744,1890,65744,,0,0,"f896c9940de97c008565cb3d9723cb0e2fa132ee",0,0,0,0,0,""
20200618,"HI",744,,63630,,"totalTestEncountersViral",72804,,95,,,,,639,"6/17/2020 18:00","2020-06-17T18:00:00Z","06/17 14:00",17,95,,"2020-06-17T18:00:00Z",74533,709,,,17,,72804,64374,,,,,,,,,,,"15",4,1127,64374,1452,64374,,0,3,"154b05d87f0abb5fdb5df76ee154b455bc3cf54d",0,0,0,0,0,""
20200617,"HI",740,,62503,,"totalTestEncountersViral",71352,,92,,,,,637,"6/16/2020 18:00","2020-06-16T18:00:00Z","06/16 14:00",17,92,,"2020-06-16T18:00:00Z",73078,703,,,17,,71352,63243,,,,,,,,,,,"15",4,1211,63243,1198,63243,,0,1,"1496421d17270def56b135509af9d12328453c73",0,0,0,0,0,""
20200616,"HI",736,,61292,,"totalTestEncountersViral",70154,,91,,,,,630,"6/15/2020 18:00","2020-06-15T18:00:00Z","06/15 14:00",17,91,,"2020-06-15T18:00:00Z",71575,699,,,17,,70154,62028,,,,,,,,,,,"15",8,546,62028,671,62028,,0,0,"51932799acb94da1530e6499d1fcb2a9affab025",0,0,0,0,0,""
20200615,"HI",728,,60746,,"totalTestEncountersViral",69483,,91,,,,,629,"6/14/2020 18:00","2020-06-14T18:00:00Z","06/14 14:00",17,91,,"2020-06-14T18:00:00Z",70877,691,,,17,,69483,61474,,,,,,,,,,,"15",5,1147,61474,1202,61474,,0,2,"d4bb00f41edf4cc4e6052ca2749b9be3082e8d8d",0,0,0,0,0,""
20200614,"HI",723,,59599,,"totalTestEncountersViral",68281,,89,,,,,628,"6/13/2020 18:00","2020-06-13T18:00:00Z","06/13 14:00",17,89,,"2020-06-13T18:00:00Z",69512,675,,,17,,68281,60322,,,,,,,,,,,"15",17,967,60322,1205,60322,,0,2,"830ad5ba9b2c2120cc990976c7848a0e32ea593c",0,0,0,0,0,""
20200613,"HI",706,,58632,,"totalTestEncountersViral",67076,,87,,,,,627,"6/12/2020 18:00","2020-06-12T18:00:00Z","06/12 14:00",17,87,,"2020-06-12T18:00:00Z",68738,659,,,17,,67076,59338,,,,,,,,,,,"15",14,745,59338,949,59338,,0,1,"c0802a109da77258c3f64c77eb78715d7525f926",0,0,0,0,0,""
20200612,"HI",692,,57887,,"totalTestEncountersViral",66127,,86,,,,,623,"6/11/2020 18:00","2020-06-11T18:00:00Z","06/11 14:00",17,86,,"2020-06-11T18:00:00Z",67392,655,,,17,,66127,58579,,,,,,,,,,,"15",7,1277,58579,1464,58579,,0,1,"42682aabdd5dcedec49c4e3db4d4d09fbb120e9b",0,0,0,0,0,""
20200611,"HI",685,,56610,,"totalTestEncountersViral",64663,,85,,,,,622,"6/10/2020 18:00","2020-06-10T18:00:00Z","06/10 14:00",17,85,,"2020-06-10T18:00:00Z",65852,649,,,17,,64663,57295,,,,,,,,,,,"15",3,1119,57295,1508,57295,,0,1,"86d01316d753c216eb811e4523c45bec7c4c9ae3",0,0,0,0,0,""
20200610,"HI",682,,55491,,"totalTestEncountersViral",63155,,84,,,,,621,"6/9/2020 18:00","2020-06-09T18:00:00Z","06/09 14:00",17,84,,"2020-06-09T18:00:00Z",64501,644,,,17,,63155,56173,,,,,,,,,,,"15",6,693,56173,895,56173,,0,0,"3d9a9e1cafee0668ee0751f1db9b0bddeaccb7c7",0,0,0,0,0,""
20200609,"HI",676,,54798,,"totalTestEncountersViral",62260,,84,,,,,618,"6/8/2020 18:00","2020-06-08T18:00:00Z","06/08 14:00",17,84,,"2020-06-08T18:00:00Z",63533,638,,,17,,62260,55474,,,,,,,,,,,"15",1,326,55474,611,55474,,0,0,"4279db76ed38104158455a6d5d6820f73ae6f80f",0,0,0,0,0,""
20200608,"HI",675,,54472,,"totalTestEncountersViral",61649,,84,,,,,617,"6/7/2020 18:00","2020-06-07T18:00:00Z","06/07 14:00",17,84,,"2020-06-07T18:00:00Z",63259,637,,,17,,61649,55147,,,,,,,,,,,"15",2,1090,55147,945,55147,,0,1,"f7eff866793e27103f149ff55a16e811264bc28e",0,0,0,0,0,""
20200607,"HI",673,,53382,,"totalTestEncountersViral",60704,,83,,,,,616,"6/6/2020 18:00","2020-06-06T18:00:00Z","06/06 14:00",17,83,,"2020-06-06T18:00:00Z",62005,636,,,17,,60704,47985,,,,,,,,,,,"15",9,789,54055,1031,54055,,0,0,"809039838b69c03281e70fb01bfcbc85fa1ab4bd",0,0,0,0,0,""
20200606,"HI",664,,52593,,"totalTestEncountersViral",59673,,83,,,,,614,"6/5/2020 18:00","2020-06-05T18:00:00Z","06/05 14:00",17,83,,"2020-06-05T18:00:00Z",60985,626,,,17,,59673,47985,,,,,,,,,,,"15",9,912,53257,1137,53257,,0,0,"23abf0da4908f472e4122425694e07e76ff966d2",0,0,0,0,0,""
20200605,"HI",655,,51681,,"totalTestEncountersViral",58536,,83,,,,,611,"6/4/2020 18:00","2020-06-04T18:00:00Z","06/04 14:00",17,83,,"2020-06-04T18:00:00Z",59842,622,,,17,,58536,47985,,,,,,,,,,,"15",2,1696,52336,1790,52336,,0,0,"2c4ad26206f3adc8d3d8d4efa07b5dd97dc70184",0,0,0,0,0,""
20200604,"HI",653,,49985,,"totalTestEncountersViral",56746,,83,,,,,612,"6/3/2020 18:00","2020-06-03T18:00:00Z","06/03 14:00",17,83,,"2020-06-03T18:00:00Z",57942,621,,,17,,56746,47985,,,,,,,,,,,"15",0,1130,50638,1301,50638,,0,0,"19358f22d982012deecf35db307ca7a2c10f8a0e",0,0,0,0,0,""
20200603,"HI",653,,48855,,"totalTestEncountersViral",55445,,83,,,,,609,"6/2/2020 18:00","2020-06-02T18:00:00Z","06/02 14:00",17,83,,"2020-06-02T18:00:00Z",56569,620,,,17,,55445,47985,,,,,,,,,,,"15",1,586,49508,817,49508,,0,0,"52ae0f73fce8a18dd3f1ea20e87f165611be96bd",0,0,0,0,0,""
20200602,"HI",652,,48269,,"totalTestEncountersViral",54628,,83,,,,,608,"6/1/2020 18:00","2020-06-01T18:00:00Z","06/01 14:00",17,83,,"2020-06-01T18:00:00Z",55719,620,,,17,,54628,47985,,,,,,,,,,,"15",0,434,48921,524,48921,,0,0,"7cb412fb09368028c83b85cef3fcea2733fd0ef9",0,0,0,0,0,""
20200601,"HI",652,,47835,,"totalTestEncountersViral",54104,,83,,,,,608,"5/31/2020 18:00","2020-05-31T18:00:00Z","05/31 14:00",17,83,,"2020-05-31T18:00:00Z",55336,620,,,17,,54104,47985,,,,,,,,,,,"15",1,-6134,48487,725,48487,,0,0,"6b70054921550474399aee884222a6719115462f",0,0,0,0,0,""
20200531,"HI",651,,53969,,"totalTestEncountersViral",53379,,83,,,,,606,"5/30/2020 18:00","2020-05-30T18:00:00Z","05/30 14:00",17,83,,"2020-05-30T18:00:00Z",54620,618,,,17,,53379,47985,,,,,,,,,,,"15",2,604,54620,829,54620,,0,0,"6ab42528acf8386934c359c4d707b3eaad52d509",0,0,0,0,0,""
20200530,"HI",649,,53365,,"totalTestEncountersViral",52550,,83,,,,,605,"5/29/2020 18:00","2020-05-29T18:00:00Z","05/29 14:00",17,83,,"2020-05-29T18:00:00Z",54014,616,,,17,,52550,47985,,,,,,,,,,,"15",2,1188,54014,980,54014,,0,0,"8469cbfbcbfd7bb163e1e7bd0518faf918e2083a",0,0,0,0,0,""
20200529,"HI",647,,52177,,"totalTestEncountersViral",51570,,83,,,,,604,"5/28/2020 00:00","2020-05-28T00:00:00Z","05/27 20:00",17,83,,"2020-05-28T00:00:00Z",52824,613,,,17,,51570,47985,,,,,,,,,,,"15",3,982,52824,898,52824,,0,0,"69c381e4d7f61c9ecce5dc649c188457be61ccc9",0,0,0,0,0,""
20200528,"HI",644,,51195,,"totalTestEncountersViral",50672,,83,,,,,600,"5/27/2020 18:00","2020-05-27T18:00:00Z","05/27 14:00",17,83,,"2020-05-27T18:00:00Z",51839,611,,,17,,50672,47985,,,,,,,,,,,"15",1,636,51839,610,51839,,0,0,"2bf2b6c1694f22d9bdcb2fa5b969660d2007a1e4",0,0,0,0,0,""
20200527,"HI",643,,50559,,"totalTestEncountersViral",50062,,83,,,,,593,"5/26/2020 00:00","2020-05-26T00:00:00Z","05/25 20:00",17,83,,"2020-05-26T00:00:00Z",51202,610,,,17,,50062,47985,,,,,,,,,,,"15",0,831,51202,454,51202,,0,-1,"18cfa8c215616dc4e3ad3d6b8eda8210bddf1cd5",0,0,0,0,0,""
20200526,"HI",643,,49728,,"totalTestEncountersViral",49608,,84,,,,,592,"5/25/2020 18:00","2020-05-25T18:00:00Z","05/25 14:00",17,84,,"2020-05-25T18:00:00Z",50371,610,,,17,,49608,47985,,,,,,,,,,,"15",0,0,50371,445,50371,,0,0,"5a86153da4862e86699cb05cf62321fbd573f2dc",0,0,0,0,0,""
20200525,"HI",643,,49728,,"totalTestEncountersViral",49163,,84,,,,,591,"5/24/2020 18:00","2020-05-24T18:00:00Z","05/24 14:00",17,84,,"2020-05-24T18:00:00Z",50371,610,,,17,,49163,47985,,,,,,,,,,,"15",0,799,50371,724,50371,,0,0,"dcf2f7fd7d895395780b68e52018175122228806",0,0,0,0,0,""
20200524,"HI",643,,48929,,"totalTestEncountersViral",48439,,84,,,,,589,"5/23/2020 18:00","2020-05-23T18:00:00Z","05/23 14:00",17,84,,"2020-05-23T18:00:00Z",49572,610,,,17,,48439,47985,,,,,,,,,,,"15",1,750,49572,846,49572,,0,0,"5dafee708476b1cc461cb1f3e1671f3467193067",0,0,0,0,0,""
20200523,"HI",642,,48179,,"totalTestEncountersViral",47593,,84,,,,,585,"5/22/2020 18:00","2020-05-22T18:00:00Z","05/22 14:00",17,84,,"2020-05-22T18:00:00Z",48821,610,,,17,,47593,47985,,,,,,,,,,,"15",-5,841,48821,738,48821,,0,1,"e1b39ee02c31fce04fcc81921f144c11a90f0ab6",0,0,0,0,0,""
20200522,"HI",647,,47338,,"totalTestEncountersViral",46855,,83,,,,,579,"5/21/2020 00:00","2020-05-21T00:00:00Z","05/20 20:00",17,83,,"2020-05-21T00:00:00Z",,610,,,17,,46855,47985,,,,,,,,,,,"15",4,832,47985,886,47985,,0,1,"c664775f5a6feff9569450da878d8b9b88f50fb2",0,0,0,0,0,""
20200521,"HI",643,,46506,,"totalTestEncountersViral",45969,,82,,,,,578,"5/20/2020 18:00","2020-05-20T18:00:00Z","05/20 14:00",17,82,,"2020-05-20T18:00:00Z",,606,,,17,,45969,47149,,,,,,,,,,,"15",2,843,47149,1033,47149,,0,0,"f778f33232032fc32a4ebc7612c5b2fe8fb93bcc",0,0,0,0,0,""
20200520,"HI",641,,45663,,"totalTestEncountersViral",44936,,82,,,,,578,"5/19/2020 18:00","2020-05-19T18:00:00Z","05/19 14:00",17,82,,"2020-05-19T18:00:00Z",,606,,,17,,44936,46304,,,,,,,,,,,"15",1,1280,46304,836,46304,,0,0,"911ae58814495f2d2a52b0517513852022b87db6",0,0,0,0,0,""
20200519,"HI",640,,44383,,"totalTestEncountersViral",44100,,82,,,,,574,"5/17/2020 00:00","2020-05-17T00:00:00Z","05/16 20:00",17,82,,"2020-05-17T00:00:00Z",,604,,,17,,44100,45023,,,,,,,,,,,"15",0,2978,45023,478,45023,,0,0,"d6e43c461c2c931a66940e96e6e2b15c7693bb8a",0,0,0,0,0,""
20200518,"HI",640,,41405,,"totalTestEncountersViral",43622,,82,,,,,573,"5/17/2020 00:00","2020-05-17T00:00:00Z","05/16 20:00",17,82,,"2020-05-17T00:00:00Z",,604,,,17,,43622,42524,,,,,,,,,,,"15",1,370,42045,717,42045,,0,0,"e97f15a3aa27e93d211179316e8dccb322896905",0,0,0,0,0,""
20200517,"HI",639,,41035,,"totalTestEncountersViral",42905,,82,,,,,572,"5/16/2020 18:00","2020-05-16T18:00:00Z","05/16 14:00",17,82,,"2020-05-16T18:00:00Z",,601,,,17,,42905,41778,,,,,,,,,,,"15",1,790,41674,745,41674,,0,1,"61aa2ca050465caf961b367106de650959d14ba3",0,0,0,0,0,""
20200516,"HI",638,,40245,,"totalTestEncountersViral",42160,,81,,,,,565,"5/15/2020 18:00","2020-05-15T18:00:00Z","05/15 14:00",17,81,,"2020-05-15T18:00:00Z",,600,,,17,,42160,40990,,,,,,,,,,,"15",1,2106,40883,739,40883,,0,0,"9cf7e2710c5cd5a46a6eb5a2462c366d0779ebc5",0,0,0,0,0,""
20200515,"HI",637,,38139,,"totalTestEncountersViral",41421,,81,,,,,564,"5/14/2020 18:00","2020-05-14T18:00:00Z","05/14 14:00",17,81,,"2020-05-14T18:00:00Z",,600,,,17,,41421,39767,,,,,,,,,,,"15",-1,-104,38776,832,38776,,0,0,"8c0fc98d7552a6e823ce51e151811ef65216e359",0,0,0,0,0,""
20200514,"HI",638,,38243,,"totalTestEncountersViral",40589,,81,,,,,563,"5/13/2020 18:00","2020-05-13T18:00:00Z","05/13 14:00",17,81,,"2020-05-13T18:00:00Z",,599,,,17,,40589,38467,,,,,,,,,,,"15",3,513,38881,756,38881,,0,0,"d9c04118b80f75a332d00ff9349b76fb0c0b20c5",0,0,0,0,0,""
20200513,"HI",635,,37730,,"totalTestEncountersViral",39833,,81,,,,,563,"5/12/2020 18:00","2020-05-12T18:00:00Z","05/12 14:00",17,81,,"2020-05-12T18:00:00Z",,596,,,17,,39833,38042,,,,,,,,,,,"15",1,425,38365,641,38365,,0,0,"e326de69e13b154ffb60c07d2591ba5406315b9f",0,0,0,0,0,""
20200512,"HI",634,,37305,,"totalTestEncountersViral",39192,,81,,,,,561,"5/11/2020 18:00","2020-05-11T18:00:00Z","05/11 14:00",17,81,,"2020-05-11T18:00:00Z",,595,,,17,,39192,,,,,,,,,,,,"15",2,254,37939,270,37939,,0,0,"bf0732a8e9d41131610c2235e0c9f8396f69857c",0,0,0,0,0,""
20200511,"HI",632,,37051,,"totalTestEncountersViral",38922,,81,,,,,561,"5/10/2020 18:00","2020-05-10T18:00:00Z","05/10 14:00",17,81,,"2020-05-10T18:00:00Z",,593,,,17,,38922,,,,,,,,,,,,"15",1,412,37683,685,37683,,0,0,"4e1cd3e0208b304528d04820119c99214e9faecf",0,0,0,0,0,""
20200510,"HI",631,,36639,,"totalTestEncountersViral",38237,,81,,,,,551,"5/9/2020 18:00","2020-05-09T18:00:00Z","05/09 14:00",17,81,,"2020-05-09T18:00:00Z",,592,,,17,,38237,,,,,,,,,,,,"15",2,1006,37270,569,37270,,0,0,"6f9a36fe3aa18fe7d3a456b7be875560ae1869df",0,0,0,0,0,""
20200509,"HI",629,,35633,,"totalTestEncountersViral",37668,,81,,,,,566,"5/8/2020 00:00","2020-05-08T00:00:00Z","05/07 20:00",17,81,,"2020-05-08T00:00:00Z",,589,,,17,,37668,,,,,,,,,,,,"15",0,-356,36262,670,36262,,0,7,"c7c02ec6b701121a1296e7484c9389e404637d96",0,0,0,0,0,""
20200508,"HI",629,,35989,,"totalTestEncountersViral",36998,,74,,,,,565,"5/7/2020 00:00","2020-05-07T00:00:00Z","05/06 20:00",17,74,,"2020-05-07T00:00:00Z",,588,,,17,,36998,,,,,,,,,,,,"15",3,1074,36618,686,36618,,0,0,"aa99a10d5a885e4bb56c1ec0c68a95b80149e6a6",0,0,0,0,0,""
20200507,"HI",626,,34915,,"totalTestEncountersViral",36312,,74,,,,,558,"5/6/2020 18:00","2020-05-06T18:00:00Z","05/06 14:00",17,74,,"2020-05-06T18:00:00Z",,586,,,17,,36312,,,,,,,,,,,,"15",1,341,35541,587,35541,,0,1,"f8d4dcf0ab290a8e70357202cd5453ed2af51a68",0,0,0,0,0,""
20200506,"HI",625,,34574,,"totalTestEncountersViral",35725,,73,,,,,551,"5/5/2020 18:00","2020-05-05T18:00:00Z","05/05 14:00",17,73,,"2020-05-05T18:00:00Z",,584,,,17,,35725,,,,,,,,,,,,"15",4,1196,35199,863,35199,,0,0,"14c6adecd4bc305866f55ea56a038e3533ebf89b",0,0,0,0,0,""
20200505,"HI",621,,33378,,"totalTestEncountersViral",34862,,73,,,,,548,"5/4/2020 18:00","2020-05-04T18:00:00Z","05/04 14:00",17,73,,"2020-05-04T18:00:00Z",,580,,,17,,34862,,,,,,,,,,,,"15",1,132,33999,498,33999,,0,0,"a76ae048d290a835cf04547e24602987db4d3904",0,0,0,0,0,""
20200504,"HI",620,,33246,,"totalTestEncountersViral",34364,,73,,,,,544,"5/3/2020 18:00","2020-05-03T18:00:00Z","05/03 14:00",17,73,,"2020-05-03T18:00:00Z",,579,,,17,,34364,,,,,,,,,,,,"15",0,916,33866,510,33866,,1,1,"8bb11120c8e24d0b1bea3c437985d1f23fd9f672",0,0,0,0,0,""
20200503,"HI",620,,32330,,"totalTestEncountersViral",33854,,72,,,,,541,"5/2/2020 00:00","2020-05-02T00:00:00Z","05/01 20:00",16,72,,"2020-05-02T00:00:00Z",,576,,,16,,33854,,,,,,,,,,,,"15",1,964,32950,614,32950,,0,0,"b037f41db1f3d8e930fe2c6d0861ee1f0dcef434",0,0,0,0,0,""
20200502,"HI",619,,31366,,"totalTestEncountersViral",33240,,72,,,,,532,"5/1/2020 00:00","2020-05-01T00:00:00Z","04/30 20:00",16,72,,"2020-05-01T00:00:00Z",,576,,,16,,33240,,,,,,,,,,,,"15",1,890,31985,867,31985,,0,2,"791106ac9f77a581c8f1d2f36e1b6999db5ae177",0,0,0,0,0,""
20200501,"HI",618,,30476,,"totalTestEncountersViral",32373,,70,,,,,526,"4/30/2020 00:00","2020-04-30T00:00:00Z","04/29 20:00",16,70,,"2020-04-30T00:00:00Z",,571,,,16,,32373,,,,,,,,,,,,"15",5,449,31094,736,31094,,0,1,"9c3a48571fc9b6d7de358010ae835295c5be23ab",0,0,0,0,0,""
20200430,"HI",613,,30027,,"totalTestEncountersViral",31637,,69,,,,,516,"4/29/2020 18:00","2020-04-29T18:00:00Z","04/29 14:00",16,69,,"2020-04-29T18:00:00Z",,567,,,16,,31637,,,,,,,,,,,,"15",4,1018,30640,1324,30640,,0,0,"c3d0907c156f041f452184b5519ad9f7cc122594",0,0,0,0,0,""
20200429,"HI",609,,29009,,"totalTestEncountersViral",30313,,69,,,,,505,"4/28/2020 18:00","2020-04-28T18:00:00Z","04/28 14:00",16,69,,"2020-04-28T18:00:00Z",,562,27632,,16,,30313,,,,,,,,,,,,"15",2,433,29618,306,29618,,0,1,"7ef4eb324234d4a4957e56fd43124342568a2dcc",0,0,0,0,0,""
20200428,"HI",607,,28576,,"totalTestEncountersViral",30007,,68,,,,,493,"4/27/2020 18:00","2020-04-27T18:00:00Z","04/27 14:00",16,68,,"2020-04-27T18:00:00Z",,558,,,16,,30007,,,,,,,,,,,,"15",1,172,29183,249,29183,,2,0,"c6fab19c353ac5319224f658dfbfe68c9ca5162a",0,0,0,0,0,""
20200427,"HI",606,,28404,,"totalTestEncountersViral",29758,,68,,,,,488,"4/26/2020 18:00","2020-04-26T18:00:00Z","04/26 14:00",14,68,,"2020-04-26T18:00:00Z",,557,,,14,,29758,,,,,,,,,,,,"15",3,524,29010,576,29010,,0,0,"953aa345316bee70f2a7eea96d60b2d78cd421da",0,0,0,0,0,""
20200426,"HI",603,,27880,,"totalTestEncountersViral",29182,,68,,,,,482,"4/25/2020 18:00","2020-04-25T18:00:00Z","04/25 14:00",14,68,,"2020-04-25T18:00:00Z",,554,,,14,,29182,,,,,,,,,,,,"15",2,441,28483,617,28483,,1,1,"9822687a72d56158141856323b2eb8354ab2201c",0,0,0,0,0,""
20200425,"HI",601,,27439,,"totalTestEncountersViral",28565,,67,,,,,463,"4/24/2020 18:00","2020-04-24T18:00:00Z","04/24 14:00",13,67,,"2020-04-24T18:00:00Z",,549,,,13,,28565,,,,,,,,,,,,"15",5,1148,28040,727,28040,,1,4,"83986b3e68126092641b91deac5e1011c3f8f41c",0,0,0,0,0,""
20200424,"HI",596,,26291,,"totalTestEncountersViral",27838,,63,,,,,455,"4/24/2020 18:00","2020-04-24T18:00:00Z","04/24 14:00",12,63,,"2020-04-24T18:00:00Z",,545,,,12,,27838,,,,,,,,,,,,"15",4,755,26887,837,26887,,0,0,"560ad793e85fef7681d4b8456b2734f133a52efa",0,0,0,0,0,""
20200423,"HI",592,,25536,,"totalTestEncountersViral",27001,,63,,,,,444,"4/22/2020 18:00","2020-04-22T18:00:00Z","04/22 14:00",12,63,,"2020-04-22T18:00:00Z",,540,,,12,,27001,,,,,,,,,,,,"15",6,776,26128,802,26128,,0,7,"a367a901dca7172ac47a2719ae96f4352ee307df",0,0,0,0,0,""
20200422,"HI",586,,24760,,"totalTestEncountersViral",26199,,56,,,,,437,"4/22/2020 18:00","2020-04-22T18:00:00Z","04/22 14:00",12,56,,"2020-04-22T18:00:00Z",,529,,,12,,26199,,,,,,,,,,,,"15",2,648,25346,543,25346,,2,1,"5644088f98b1c9adcb9d3e37ef993c5af15daaf8",0,0,0,0,0,""
20200421,"HI",584,,24112,,"totalTestEncountersViral",25656,,55,,,,,423,"4/21/2020 19:30","2020-04-21T19:30:00Z","04/21 15:30",10,55,,"2020-04-21T19:30:00Z",,527,,,10,,25656,,,,,,,,,,,,"15",4,517,24696,647,24696,,0,3,"d42f677429ca33f29e8ea30be793ab7a560de14d",0,0,0,0,0,""
20200420,"HI",580,,23595,,"totalTestEncountersViral",25009,,52,,,,,414,"4/19/2020 18:00","2020-04-19T18:00:00Z","04/19 14:00",10,52,,"2020-04-19T18:00:00Z",,523,,,10,,25009,,,,,,,,,,,,"15",6,699,24175,913,24175,,1,1,"c0c6a5e93d75b8bafc3fd9b0ace5a1ff70663614",0,0,0,0,0,""
20200419,"HI",574,,22896,,"totalTestEncountersViral",24096,,51,,,,,410,"4/19/2020 18:00","2020-04-19T18:00:00Z","04/19 14:00",9,51,,"2020-04-19T18:00:00Z",,516,,,9,,24096,,,,,,,,,,,,"15",21,1106,23470,942,23470,,0,3,"e2d29fc3281a61d4077db630a11bc00a1f9d6a5c",0,0,0,0,0,""
20200418,"HI",553,,21790,,"totalTestEncountersViral",23154,,48,,,,,390,"4/17/2020 18:30","2020-04-17T18:30:00Z","04/17 14:30",9,48,,"2020-04-17T18:30:00Z",,496,,,9,,23154,,,,,,,,,,,,"15",12,474,22343,716,22343,,0,3,"7ec668eefa67fdc62ff936b8196dd244ddc5dcd0",0,0,0,0,0,""
20200417,"HI",541,,21316,,"totalTestEncountersViral",22438,,45,,,,,374,"4/17/2020 18:30","2020-04-17T18:30:00Z","04/17 14:30",9,45,,"2020-04-17T18:30:00Z",,487,,,9,,22438,,,,,,,,,,,,"15",11,1146,21857,1292,21857,,0,0,"200bf519d0c7ac86b73585a7cf96aa52907651bc",0,0,0,0,0,""
20200416,"HI",530,,20170,,"totalTestEncountersViral",21146,,45,,,,,359,"4/16/2020 18:00","2020-04-16T18:00:00Z","04/16 14:00",9,45,,"2020-04-16T18:00:00Z",,478,,,9,,21146,,,,,,,,,,,,"15",13,884,20700,905,20700,,0,0,"4899628dc0cb3fa1bbd8dbc9248a3472d59a94c7",0,0,0,0,0,""
20200415,"HI",517,,19286,,"totalTestEncountersViral",20241,,45,,,,,333,"4/14/2020 18:00","2020-04-14T18:00:00Z","04/14 14:00",9,45,,"2020-04-14T18:00:00Z",,462,,,9,,20241,,,,,,,,,,,,"15",13,370,19803,404,19803,,0,1,"a360c81afa996242624d2d2d6d921feed7e411c2",0,0,0,0,0,""
20200414,"HI",504,,18916,,"totalTestEncountersViral",19837,,44,,,,,315,"4/14/2020 18:00","2020-04-14T18:00:00Z","04/14 14:00",9,44,,"2020-04-14T18:00:00Z",,457,,,9,,19837,,,,,,,,,,,,"15",5,571,19420,702,19420,,0,0,"72288903189f6c6995c5d98d2ec2fff715c7052b",0,0,0,0,0,""
20200413,"HI",499,,18345,,"totalTestEncountersViral",19135,,44,,,,,310,"4/13/2020 18:00","2020-04-13T18:00:00Z","04/13 14:00",9,44,,"2020-04-13T18:00:00Z",,452,,,9,,19135,,,,,,,,,,,,"15",13,863,18844,867,18844,,1,0,"28dbe09019ad6754720b1c915ed7b0b7697249ce",0,0,0,0,0,""
20200412,"HI",486,,17482,,"totalTestEncountersViral",18268,,44,,,,,300,"4/11/2020 18:00","2020-04-11T18:00:00Z","04/11 14:00",8,44,,"2020-04-11T18:00:00Z",,440,,,8,,18268,,,,,,,,,,,,"15",21,416,17968,1013,17968,,0,1,"18689f3edb8a086558d3bb8b3ee58ecfaa698274",0,0,0,0,0,""
20200411,"HI",465,,17066,,"totalTestEncountersViral",17255,,43,,,,,284,"4/10/2020 18:00","2020-04-10T18:00:00Z","04/10 14:00",8,43,,"2020-04-10T18:00:00Z",,420,,,8,,17255,,,,,,,,,,,,"15",23,1359,17531,717,17531,,2,1,"7c1f17a3b1604a295ca1006d35882485bacaa730",0,0,0,0,0,""
20200410,"HI",442,,15707,,"totalTestEncountersViral",16538,,42,,,,,251,"4/9/2020 18:00","2020-04-09T18:00:00Z","04/09 14:00",6,42,,"2020-04-09T18:00:00Z",,410,,,6,,16538,,,,,,,,,,,,"15",7,391,16149,553,16149,,1,0,"ff084c4023045eca8c3f4c9f9801f3478e3a03b4",0,0,0,0,0,""
20200409,"HI",435,,15316,,"totalTestEncountersViral",15985,,42,,,,,113,"4/8/2020 18:00","2020-04-08T18:00:00Z","04/08 14:00",5,42,,"2020-04-08T18:00:00Z",,401,,,5,,15985,,,,,,,,,,,,"15",25,577,15751,756,15751,,0,0,"61d9d898c4955f8aedd0b0804122dc7bee00739f",0,0,0,0,0,""
20200408,"HI",410,,14739,,"totalTestEncountersViral",15229,,42,,,,,113,"4/7/2020 18:00","2020-04-07T18:00:00Z","04/07 14:00",5,42,,"2020-04-07T18:00:00Z",,372,,,5,,15229,,,,,,,,,,,,"15",23,1584,15149,830,15149,,0,16,"6b6a2070d23d79bd0b15b0b333e6ee6fd719a396",0,0,0,0,0,""
20200407,"HI",387,,13155,,"totalTestEncountersViral",14399,,26,,,,,89,"4/6/2020 18:00","2020-04-06T18:00:00Z","04/06 14:00",5,26,,"2020-04-06T18:00:00Z",,347,,,5,,14399,,,,,,,,,,,,"15",16,0,13542,701,13542,,1,5,"e4b497b853eb1915727f2e532be095850831d34d",0,0,0,0,0,""
20200406,"HI",371,,13155,,"totalTestEncountersViral",13698,,21,,,,,85,"4/5/2020 18:00","2020-04-05T18:00:00Z","04/05 14:00",4,21,,"2020-04-05T18:00:00Z",,330,,,4,,13698,,,,,,,,,,,,"15",20,551,13526,450,13526,,0,2,"436343e312b4e552b3d67ed3d13fece16bbd6fa6",0,0,0,0,0,""
20200405,"HI",351,,12604,,"totalTestEncountersViral",13248,,19,,,,,82,"4/4/2020 18:00","2020-04-04T18:00:00Z","04/04 14:00",4,19,,"2020-04-04T18:00:00Z",,317,,,4,,13248,,,,,,,,,,,,"15",32,645,12955,760,12955,,1,1,"6741dacc0a4aed946c110d9b7955912ef2beb1e7",0,0,0,0,0,""
20200404,"HI",319,,11959,,"totalTestEncountersViral",12488,,18,,,,,78,"4/3/2020 18:00","2020-04-03T18:00:00Z","04/03 14:00",3,18,,"2020-04-03T18:00:00Z",,300,,,3,,12488,,,,,,,,,,,,"15",34,1753,12278,915,12278,,1,3,"ebaf05fa31609ec95ba9d6e59dba9aeb8b33f099",0,0,0,0,0,""
20200403,"HI",285,,10206,,"totalTestEncountersViral",11573,,15,,,,,72,"4/2/2020 18:00","2020-04-02T18:00:00Z","04/02 14:00",2,15,,"2020-04-02T18:00:00Z",,273,,,2,,11573,,,,,,,,,,,,"15",27,0,10491,917,10491,,1,0,"7bcd55640da8ad9ea7d9d67a558b9042e5c9ef1c",0,0,0,0,0,""
