"date","state","positive","probableCases","negative","pending","totalTestResultsSource","totalTestResults","hospitalizedCurrently","hospitalizedCumulative","inIcuCurrently","inIcuCumulative","onVentilatorCurrently","onVentilatorCumulative","recovered","lastUpdateEt","dateModified","checkTimeEt","death","hospitalized","hospitalizedDischarged","dateChecked","totalTestsViral","positiveTestsViral","negativeTestsViral","positiveCasesViral","deathConfirmed","deathProbable","totalTestEncountersViral","totalTestsPeopleViral","totalTestsAntibody","positiveTestsAntibody","negativeTestsAntibody","totalTestsPeopleAntibody","positiveTestsPeopleAntibody","negativeTestsPeopleAntibody","totalTestsPeopleAntigen","positiveTestsPeopleAntigen","totalTestsAntigen","positiveTestsAntigen","fips","positiveIncrease","negativeIncrease","total","totalTestResultsIncrease","posNeg","dataQualityGrade","deathIncrease","hospitalizedIncrease","hash","commercialScore","negativeRegularScore","negativeScore","positiveScore","score","grade"
20210307,"IA",282384,,1044418,,"posNeg",1326802,167,,35,,6,,320054,"3/7/2021 00:00","2021-03-07T00:00:00Z","03/06 19:00",5558,,,"2021-03-07T00:00:00Z",2753899,306343,2432425,282384,,,,1329195,,,,113739,19704,93984,247999,57190,1390094,60700,"19",257,1299,1326802,1556,1326802,,6,0,"33548da1aa99383ebd1ef74769d8bb1eba36b959",0,0,0,0,0,""
20210306,"IA",282127,,1043119,,"posNeg",1325246,170,,38,,10,,319780,"3/6/2021 00:00","2021-03-06T00:00:00Z","03/05 19:00",5552,,,"2021-03-06T00:00:00Z",2749435,306056,2428315,282127,,,,1327640,,,,113559,19635,93873,247775,57133,1388623,60633,"19",362,1515,1325246,1877,1325246,,3,0,"1142f60050fea038a820b3444d5d15ccbc344bef",0,0,0,0,0,""
20210305,"IA",281765,,1041604,,"posNeg",1323369,176,,39,,9,,318996,"3/5/2021 00:00","2021-03-05T00:00:00Z","03/04 19:00",5549,,,"2021-03-05T00:00:00Z",2742341,305649,2421684,281765,,,,1325769,,,,113413,19454,93908,246773,57011,1381718,60505,"19",374,1549,1323369,1923,1323369,,13,0,"a488d06f2e63d4b8d9ac3fbe4d166ec965dac507",0,0,0,0,0,""
20210304,"IA",281391,,1040055,,"posNeg",1321446,184,,39,,11,,318560,"3/4/2021 00:00","2021-03-04T00:00:00Z","03/03 19:00",5536,,,"2021-03-04T00:00:00Z",2734777,305285,2414548,281391,,,,1323845,,,,113067,19240,93776,245588,56878,1372820,60354,"19",400,2052,1321446,2452,1321446,,35,0,"4b267af6e507dc39c2d8d481c89f4dbaa4e31ce6",0,0,0,0,0,""
20210303,"IA",280991,,1038003,,"posNeg",1318994,191,,40,,11,,317731,"3/3/2021 00:00","2021-03-03T00:00:00Z","03/02 19:00",5501,,,"2021-03-03T00:00:00Z",2725336,304861,2405624,280991,,,,1321384,,,,112728,18996,93681,244598,56695,1365388,60142,"19",482,1896,1318994,2378,1318994,,3,0,"ddf0209a710941be41fb5c6127d606e073741192",0,0,0,0,0,""
20210302,"IA",280509,,1036107,,"posNeg",1316616,209,,39,,11,,316185,"3/2/2021 00:00","2021-03-02T00:00:00Z","03/01 19:00",5498,,,"2021-03-02T00:00:00Z",2716525,304305,2397458,280509,,,,1319002,,,,112261,18760,93450,243583,56553,1356153,60009,"19",230,988,1316616,1218,1316616,,26,0,"e490ddd9b01e8b405138c443c4307ffc806c029d",0,0,0,0,0,""
20210301,"IA",280279,,1035119,,"posNeg",1315398,197,,48,,15,,315443,"2/28/2021 00:00","2021-02-28T00:00:00Z","02/27 19:00",5472,,,"2021-02-28T00:00:00Z",2711184,304008,2392446,280279,,,,1317777,,,,112011,18571,93389,242163,56368,1346025,59842,"19",240,1329,1315398,1569,1315398,,1,0,"9202bb28684fedf3813600cf4aef9248f4ccd283",0,0,0,0,0,""
20210228,"IA",280039,,1033790,,"posNeg",1313829,196,,50,,19,,315134,"2/28/2021 00:00","2021-02-28T00:00:00Z","02/27 19:00",5471,,,"2021-02-28T00:00:00Z",2706509,303738,2388052,280039,,,,1316215,,,,111938,18549,93338,241907,56292,1343678,59760,"19",295,1527,1313829,1822,1313829,,1,0,"e1767feb02ff3476dadbed8ea4e8f39b36a193cb",0,0,0,0,0,""
20210227,"IA",279744,,1032263,,"posNeg",1312007,181,,43,,18,,314750,"2/27/2021 00:00","2021-02-27T00:00:00Z","02/26 19:00",5470,,,"2021-02-27T00:00:00Z",2701416,303407,2383385,279744,,,,1314393,,,,111913,18534,93328,241787,56264,1342398,59727,"19",315,1273,1312007,1588,1312007,,7,0,"81df8a67073b75bc001fa0833895e6d9b9bc6504",0,0,0,0,0,""
20210226,"IA",279429,,1030990,,"posNeg",1310419,196,,46,,18,,313771,"2/26/2021 00:00","2021-02-26T00:00:00Z","02/25 19:00",5463,,,"2021-02-26T00:00:00Z",2695742,303076,2378147,279429,,,,1312807,,,,111562,18258,93253,240854,56159,1336491,59599,"19",546,1377,1310419,1923,1310419,,25,0,"d0e87b4094aac2481f370a2ff36ad7b1cbefff3f",0,0,0,0,0,""
20210225,"IA",278883,,1029613,,"posNeg",1308496,227,,55,,22,,312817,"2/25/2021 00:00","2021-02-25T00:00:00Z","02/24 19:00",5438,,,"2021-02-25T00:00:00Z",2687335,302488,2370413,278883,,,,1310879,,,,111268,18054,93163,239898,56023,1328035,59448,"19",473,2121,1308496,2594,1308496,,23,0,"68f9e814d2d72a2ee81714f466971776263a3493",0,0,0,0,0,""
20210224,"IA",278410,,1027492,,"posNeg",1305902,233,,57,,23,,311666,"2/24/2021 00:00","2021-02-24T00:00:00Z","02/23 19:00",5415,,,"2021-02-24T00:00:00Z",2677457,301944,2361198,278410,,,,1308273,,,,110812,17836,92925,238935,55836,1320798,59265,"19",589,2101,1305902,2690,1305902,,15,0,"a254fb7351a480404922d9d50b42c15236937a13",0,0,0,0,0,""
20210223,"IA",277821,,1025391,,"posNeg",1303212,227,,58,,25,,310864,"2/23/2021 00:00","2021-02-23T00:00:00Z","02/22 19:00",5400,,,"2021-02-23T00:00:00Z",2667365,301276,2351828,277821,,,,1305590,,,,110653,17705,92898,237914,55682,1311504,59115,"19",241,1101,1303212,1342,1303212,,26,0,"ab2b509f9aa652f0473b52281c88078e77eb8519",0,0,0,0,0,""
20210222,"IA",277580,,1024290,,"posNeg",1301870,222,,54,,25,,309539,"2/22/2021 00:00","2021-02-22T00:00:00Z","02/21 19:00",5374,,,"2021-02-22T00:00:00Z",2661973,301026,2346702,277580,,,,1304246,,,,110336,17557,92729,236660,55488,1299980,58913,"19",312,1387,1301870,1699,1301870,,38,0,"143517370318500aca8935ae142084746204cea5",0,0,0,0,0,""
20210221,"IA",277268,,1022903,,"posNeg",1300171,229,,58,,27,,309192,"2/21/2021 00:00","2021-02-21T00:00:00Z","02/20 19:00",5336,,,"2021-02-21T00:00:00Z",2657072,300663,2342175,277268,,,,1302551,,,,110195,17472,92673,236184,55373,1296918,58786,"19",302,1262,1300171,1564,1300171,,0,0,"0a8948881b8659ef87848494cfc07fa47e0a05ec",0,0,0,0,0,""
20210220,"IA",276966,,1021641,,"posNeg",1298607,238,,56,,24,,308712,"2/20/2021 00:00","2021-02-20T00:00:00Z","02/19 19:00",5336,,,"2021-02-20T00:00:00Z",2652280,300322,2337743,276966,,,,1300986,,,,110164,17455,92659,235832,55262,1295002,58671,"19",345,948,1298607,1293,1298607,,0,0,"19bc91f590d393c40f44c030eac7013a6e904887",0,0,0,0,0,""
20210219,"IA",276621,,1020693,,"posNeg",1297314,241,,60,,26,,307605,"2/19/2021 00:00","2021-02-19T00:00:00Z","02/18 19:00",5336,,,"2021-02-19T00:00:00Z",2646982,299936,2332876,276621,,,,1299688,,,,109872,17286,92536,234889,55147,1287352,58545,"19",392,1366,1297314,1758,1297314,,15,0,"1097ece0a8504dca6e50512e41b6cdbc57890a08",0,0,0,0,0,""
20210218,"IA",276229,,1019327,,"posNeg",1295556,252,,59,,24,,306399,"2/18/2021 00:00","2021-02-18T00:00:00Z","02/17 19:00",5321,,,"2021-02-18T00:00:00Z",2638855,299530,2325188,276229,,,,1297926,,,,109519,17082,92387,233996,54992,1277680,58388,"19",516,1708,1295556,2224,1295556,,15,0,"181dd27f716ac3173c975b4c50871d1583c8ce25",0,0,0,0,0,""
20210217,"IA",275713,,1017619,,"posNeg",1293332,235,,52,,20,,305238,"2/17/2021 00:00","2021-02-17T00:00:00Z","02/16 19:00",5306,,,"2021-02-17T00:00:00Z",2630380,298944,2317402,275713,,,,1295703,,,,108818,16843,91925,233113,54794,1270242,58175,"19",466,1933,1293332,2399,1293332,,43,0,"e46c789b465b54a9ddd11502079b03ebcb21ca0b",0,0,0,0,0,""
20210216,"IA",275247,,1015686,,"posNeg",1290933,255,,57,,25,,303697,"2/16/2021 00:00","2021-02-16T00:00:00Z","02/15 19:00",5263,,,"2021-02-16T00:00:00Z",2622302,298412,2309877,275247,,,,1293305,,,,108656,16712,91894,232344,54662,1260611,58034,"19",292,8318,1290933,8610,1290933,,26,0,"85090064fb3d816e0f2cb30106ef2f7eb7259c3b",0,0,0,0,0,""
20210215,"IA",274955,,1007368,,"posNeg",1282323,242,,57,,28,,302158,"2/15/2021 00:00","2021-02-15T00:00:00Z","02/14 19:00",5237,,,"2021-02-15T00:00:00Z",2601081,298099,2289099,274955,,,,1284680,,,,107584,16436,91098,230635,54498,1246489,57858,"19",214,1117,1282323,1331,1282323,,1,0,"96808570d2e8e512934d083eaeb6108a0e9fd2c8",0,0,0,0,0,""
20210214,"IA",274741,,1006251,,"posNeg",1280992,240,,57,,29,,301774,"2/14/2021 00:00","2021-02-14T00:00:00Z","02/13 19:00",5236,,,"2021-02-14T00:00:00Z",2596862,297817,2285173,274741,,,,1283347,,,,106966,16331,90583,230121,54378,1243995,57745,"19",355,1304,1280992,1659,1280992,,0,0,"0871cefbcf851d1672b5add2d43ddce56e46557e",0,0,0,0,0,""
20210213,"IA",274386,,1004947,,"posNeg",1279333,225,,55,,33,,301196,"2/13/2021 00:00","2021-02-13T00:00:00Z","02/12 19:00",5236,,,"2021-02-13T00:00:00Z",2592151,297412,2280957,274386,,,,1281692,,,,106700,16244,90406,229994,54333,1242704,57698,"19",450,1392,1279333,1842,1279333,,13,0,"a1ed2c49d2bda48eafd9bfafab50e01e61d7c529",0,0,0,0,0,""
20210212,"IA",273936,,1003555,,"posNeg",1277491,249,,59,,33,,300366,"2/12/2021 00:00","2021-02-12T00:00:00Z","02/11 19:00",5223,,,"2021-02-12T00:00:00Z",2585809,296909,2275171,273936,,,,1279853,,,,106528,16144,90334,229287,54203,1234633,57564,"19",519,1290,1277491,1809,1277491,,27,0,"6a9198fce86d95701824566e63238491d92af912",0,0,0,0,0,""
20210211,"IA",273417,,1002265,,"posNeg",1275682,273,,64,,26,,299106,"2/11/2021 00:00","2021-02-11T00:00:00Z","02/10 19:00",5196,,,"2021-02-11T00:00:00Z",2577469,296332,2267439,273417,,,,1278044,,,,105528,15820,89660,227836,54009,1222971,57368,"19",593,1762,1275682,2355,1275682,,22,0,"020f539d9d4dd1a6e7aba030c7092354bfd1d6f1",0,0,0,0,0,""
20210210,"IA",272824,,1000503,,"posNeg",1273327,292,,67,,27,,297805,"2/10/2021 00:00","2021-02-10T00:00:00Z","02/09 19:00",5174,,,"2021-02-10T00:00:00Z",2567481,295657,2258224,272824,,,,1275694,,,,105073,15683,89342,226576,53749,1214772,57113,"19",721,1593,1273327,2314,1273327,,29,0,"91bdeebf18924c23863183b97f79c4a0e747c883",0,0,0,0,0,""
20210209,"IA",272103,,998910,,"posNeg",1271013,327,,67,,29,,296420,"2/9/2021 00:00","2021-02-09T00:00:00Z","02/08 19:00",5145,,,"2021-02-09T00:00:00Z",2557851,294857,2249469,272103,,,,1273386,,,,104639,15478,89113,225241,53480,1203429,56826,"19",405,1189,1271013,1594,1271013,,35,0,"831ba5108d0db3a31c3bd8b20cd3f08f4ea11bd1",0,0,0,0,0,""
20210208,"IA",271698,,997721,,"posNeg",1269419,318,,69,,35,,294118,"2/8/2021 00:00","2021-02-08T00:00:00Z","02/07 19:00",5110,,,"2021-02-08T00:00:00Z",2551739,294404,2243854,271698,,,,1271781,,,,104191,15252,88891,223833,53210,1190444,56540,"19",317,941,1269419,1258,1269419,,2,0,"4661f6695ea24be88623955bf173df2f637ccf0b",0,0,0,0,0,""
20210207,"IA",271381,,996780,,"posNeg",1268161,316,,68,,32,,293597,"2/7/2021 00:00","2021-02-07T00:00:00Z","02/06 19:00",5108,,,"2021-02-07T00:00:00Z",2547600,294069,2240056,271381,,,,1270520,,,,103979,15165,88766,223290,53063,1187711,56369,"19",446,1652,1268161,2098,1268161,,0,0,"a314b72c7b913258b1aa21f5bec3948c591ba41e",0,0,0,0,0,""
20210206,"IA",270935,,995128,,"posNeg",1266063,336,,67,,30,,293073,"2/6/2021 00:00","2021-02-06T00:00:00Z","02/05 19:00",5108,,,"2021-02-06T00:00:00Z",2541550,293563,2234618,270935,,,,1268416,,,,103956,15154,88754,223218,53001,1185288,56308,"19",302,822,1266063,1124,1266063,,41,0,"b77faebdb03dc3bc5c882fd576562ba075a851bb",0,0,0,0,0,""
20210205,"IA",270633,,994306,,"posNeg",1264939,348,,66,,31,,291527,"2/5/2021 00:00","2021-02-05T00:00:00Z","02/04 19:00",5067,,,"2021-02-05T00:00:00Z",2536894,293232,2230348,270633,,,,1267289,,,,103457,14916,88493,222308,52876,1175736,56185,"19",649,1857,1264939,2506,1264939,,34,0,"63969591c3e029509f9016fbd1260ec34eb78d1e",0,0,0,0,0,""
20210204,"IA",269984,,992449,,"posNeg",1262433,360,,77,,31,,289989,"2/4/2021 00:00","2021-02-04T00:00:00Z","02/03 19:00",5033,,,"2021-02-04T00:00:00Z",2527503,292520,2221735,269984,,,,1264787,,,,103285,14854,88383,221403,52725,1165803,56018,"19",700,1548,1262433,2248,1262433,,58,0,"da7ffd535ed500176bdd952647c5e71980f01b16",0,0,0,0,0,""
20210203,"IA",269284,,990901,,"posNeg",1260185,382,,86,,34,,288259,"2/3/2021 00:00","2021-02-03T00:00:00Z","02/02 19:00",4975,,,"2021-02-03T00:00:00Z",2519240,291757,2214317,269284,,,,1262530,,,,102726,14602,88076,220482,52546,1158058,55837,"19",908,2615,1260185,3523,1260185,,56,0,"48269648461eb20966f188c04f1f2ef90f3ff5b8",0,0,0,0,0,""
20210202,"IA",268376,,988286,,"posNeg",1256662,390,,88,,31,,286315,"2/2/2021 00:00","2021-02-02T00:00:00Z","02/01 19:00",4919,,,"2021-02-02T00:00:00Z",2506499,290749,2202680,268376,,,,1259008,,,,102218,14364,87806,219208,52242,1146087,55511,"19",463,1011,1256662,1474,1256662,,13,0,"86a22efd7f6c2c967985af4ad10f1bbc708f37bf",0,0,0,0,0,""
20210201,"IA",267913,,987275,,"posNeg",1255188,368,,92,,28,,283036,"1/2/2021 00:00","2021-01-02T00:00:00Z","01/01 19:00",4906,,,"2021-01-02T00:00:00Z",2499887,290215,2196634,267913,,,,1257527,,,,101560,14114,87398,217424,51905,1131661,55190,"19",355,1145,1255188,1500,1255188,,5,0,"540b672e72709cea618ff5942eb7dba728111d9d",0,0,0,0,0,""
20210131,"IA",267558,,986130,,"posNeg",1253688,358,,94,,29,,282324,"1/31/2021 00:00","2021-01-31T00:00:00Z","01/30 19:00",4901,,,"2021-01-31T00:00:00Z",2495390,289845,2192534,267558,,,,1256026,,,,101326,14024,87256,216692,51688,1127364,54951,"19",624,1812,1253688,2436,1253688,,250,0,"0bb3f8c9da49e12b931eb8179e44e610499bddc8",0,0,0,0,0,""
20210130,"IA",266934,,984318,,"posNeg",1251252,376,,84,,31,,281466,"1/30/2021 00:00","2021-01-30T00:00:00Z","01/29 19:00",4651,,,"2021-01-30T00:00:00Z",2488662,289190,2186570,266934,,,,1253586,,,,101290,14015,87229,216558,51627,1125151,54853,"19",654,3730,1251252,4384,1251252,,74,0,"b861df6cf950c0f2d7a792c75ab8d9eb31245ad5",0,0,0,0,0,""
20210129,"IA",266280,,980588,,"posNeg",1246868,383,,82,,29,,281179,"1/29/2021 00:00","2021-01-29T00:00:00Z","01/28 19:00",4577,,,"2021-01-29T00:00:00Z",2475832,288437,2174598,266280,,,,1249196,,,,100325,13685,86595,215555,51409,1115432,54661,"19",734,1915,1246868,2649,1246868,,45,0,"cda2d0112213a62ae9d99a34565d4f0fb5444a27",0,0,0,0,0,""
20210128,"IA",265546,,978673,,"posNeg",1244219,391,,80,,32,,279641,"1/28/2021 00:00","2021-01-28T00:00:00Z","01/27 19:00",4532,,,"2021-01-28T00:00:00Z",2465630,287616,2165346,265546,,,,1246542,,,,100064,13557,86462,214221,51138,1102683,54358,"19",963,2177,1244219,3140,1244219,,32,0,"f6e3f6dc25bd1f8cec3c3ae826223a4dae9aef68",0,0,0,0,0,""
20210127,"IA",264583,,976496,,"posNeg",1241079,408,,81,,37,,277824,"1/27/2021 00:00","2021-01-27T00:00:00Z","01/26 19:00",4500,,,"2021-01-27T00:00:00Z",2454125,286587,2154915,264583,,,,1243407,,,,99020,13226,85750,213029,50829,1093439,54027,"19",731,1866,1241079,2597,1241079,,8,0,"cabb8c0dac6288344d53485e2d376783b7287d7e",0,0,0,0,0,""
20210126,"IA",263852,,974630,,"posNeg",1238482,415,,78,,37,,276465,"1/26/2021 00:00","2021-01-26T00:00:00Z","01/25 19:00",4492,,,"2021-01-26T00:00:00Z",2444329,285750,2146053,263852,,,,1240816,,,,98439,13016,85379,212097,50559,1084132,53762,"19",591,1367,1238482,1958,1238482,,4,0,"1adc2c69743ecf897cbdbe873bb6424395955866",0,0,0,0,0,""
20210125,"IA",263261,,973263,,"posNeg",1236524,383,,78,,37,,273751,"1/25/2021 00:00","2021-01-25T00:00:00Z","01/24 19:00",4488,,,"2021-01-25T00:00:00Z",2437176,285129,2139510,263261,,,,1238857,,,,98127,12898,85185,210952,50254,1070588,53417,"19",401,1064,1236524,1465,1236524,,0,0,"a58405d3a125c8756b93d8948fab8a440038040c",0,0,0,0,0,""
20210124,"IA",262860,,972199,,"posNeg",1235059,382,,79,,36,,274101,"1/24/2021 00:00","2021-01-24T00:00:00Z","01/23 19:00",4488,,,"2021-01-24T00:00:00Z",2432803,284695,2135604,262860,,,,1237393,,,,97948,12811,85093,210197,50072,1067363,53243,"19",711,1885,1235059,2596,1235059,,1,0,"0b5c02c78bcbaca3e656b39b3f49a65c637d25ee",0,0,0,0,0,""
20210123,"IA",262149,,970314,,"posNeg",1232463,419,,76,,38,,273189,"1/23/2021 00:00","2021-01-23T00:00:00Z","01/22 19:00",4487,,,"2021-01-23T00:00:00Z",2425317,283898,2129046,262149,,,,1234793,,,,96814,12532,84239,210043,49935,1065393,53102,"19",956,2393,1232463,3349,1232463,,9,0,"7598ef4ce4c0f7e3f24299f085ff789947b34a43",0,0,0,0,0,""
20210122,"IA",261193,,967921,,"posNeg",1229114,450,,89,,34,,273035,"1/22/2021 00:00","2021-01-22T00:00:00Z","01/21 19:00",4478,,,"2021-01-22T00:00:00Z",2414589,282868,2119392,261193,,,,1231449,,,,96432,12380,84010,209236,49742,1055116,52883,"19",966,1797,1229114,2763,1229114,,33,0,"8282cf8d681857d33d8541b242adc25073bfd9aa",0,0,0,0,0,""
20210121,"IA",260227,,966124,,"posNeg",1226351,474,,86,,36,,272004,"1/21/2021 00:00","2021-01-21T00:00:00Z","01/20 19:00",4445,,,"2021-01-21T00:00:00Z",2403859,281824,2109809,260227,,,,1228679,,,,95501,12076,83383,207629,49373,1043078,52478,"19",1362,2526,1226351,3888,1226351,,51,0,"5d93e1aacfbffb761b43c9533e262a4b83a76c17",0,0,0,0,0,""
20210120,"IA",258865,,963598,,"posNeg",1222463,474,,86,,36,,270625,"1/20/2021 00:00","2021-01-20T00:00:00Z","01/19 19:00",4394,,,"2021-01-20T00:00:00Z",2389856,280272,2097416,258865,,,,1224789,,,,93702,11562,82100,206525,49043,1034330,52151,"19",717,1295,1222463,2012,1222463,,62,0,"8230c2060754859cc20e97489adaddf2390cf22c",0,0,0,0,0,""
20210119,"IA",258148,,962303,,"posNeg",1220451,490,,85,,36,,268931,"1/19/2021 00:00","2021-01-19T00:00:00Z","01/18 19:00",4332,,,"2021-01-19T00:00:00Z",2381724,279548,2090071,258148,,,,1222770,,,,91926,11104,80782,204635,48531,1022228,51620,"19",717,1309,1220451,2026,1220451,,8,0,"aaca89996cb9386d6a273b5397e70caa2951184b",0,0,0,0,0,""
20210118,"IA",257431,,960994,,"posNeg",1218425,483,,84,,38,,266453,"1/18/2021 00:00","2021-01-18T00:00:00Z","01/17 19:00",4324,,,"2021-01-18T00:00:00Z",2374176,278762,2083330,257431,,,,1220747,,,,91611,10980,80591,203355,48191,1007063,51266,"19",480,1252,1218425,1732,1218425,,1,0,"95a36c7654d6fa48cbf038f2866abb4fe1418c58",0,0,0,0,0,""
20210117,"IA",256951,,959742,,"posNeg",1216693,474,,93,,40,,265923,"1/17/2021 00:00","2021-01-17T00:00:00Z","01/16 19:00",4323,,,"2021-01-17T00:00:00Z",2369373,278288,2079011,256951,,,,1219011,,,,91585,10967,80578,202610,47954,1004137,50995,"19",548,1416,1216693,1964,1216693,,2,0,"1bbdad1fc103f5c595bef4f79747f63f0d51eb42",0,0,0,0,0,""
20210116,"IA",256403,,958326,,"posNeg",1214729,505,,91,,39,,265320,"1/16/2021 00:00","2021-01-16T00:00:00Z","01/15 19:00",4321,,,"2021-01-16T00:00:00Z",2364055,277635,2074377,256403,,,,1217044,,,,91534,10946,80548,202381,47868,1002439,50909,"19",915,1693,1214729,2608,1214729,,64,0,"4492cec1509ef0960aa8f869cc09a39f59e4793f",0,0,0,0,0,""
20210115,"IA",255488,,956633,,"posNeg",1212121,513,,91,,35,,263844,"1/15/2021 00:00","2021-01-15T00:00:00Z","01/14 19:00",4257,,,"2021-01-15T00:00:00Z",2355205,276641,2066591,255488,,,,1214432,,,,91226,10797,80389,201353,47623,993311,50653,"19",1035,2208,1212121,3243,1212121,,6,0,"78e29130aa2a8d17ddd41f61ebebd207b37db7f7",0,0,0,0,0,""
20210114,"IA",254453,,954425,,"posNeg",1208878,532,,85,,35,,262266,"1/14/2021 00:00","2021-01-14T00:00:00Z","01/13 19:00",4251,,,"2021-01-14T00:00:00Z",2343078,275473,2055687,254453,,,,1211182,,,,90921,10623,80258,200217,47353,980719,50390,"19",1146,2510,1208878,3656,1208878,,19,0,"85bad047af6c6f7bb5310d31a12077d4a7ad16cd",0,0,0,0,0,""
20210113,"IA",253307,,951915,,"posNeg",1205222,516,,79,,30,,260557,"1/13/2021 00:00","2021-01-13T00:00:00Z","01/12 19:00",4232,,,"2021-01-13T00:00:00Z",2331547,274250,2045503,253307,,,,1207498,,,,90419,10446,79933,198901,47012,972075,50025,"19",1441,2310,1205222,3751,1205222,,10,0,"e145e256e9caaf46192212d265aa9dab88f6c20d",0,0,0,0,0,""
20210112,"IA",251866,,949605,,"posNeg",1201471,552,,90,,30,,258758,"1/12/2021 00:00","2021-01-12T00:00:00Z","01/11 19:00",4222,,,"2021-01-12T00:00:00Z",2319258,272707,2034801,251866,,,,1203745,,,,90166,10320,79806,197154,46529,960489,49499,"19",637,1075,1201471,1712,1201471,,83,0,"c7ef4f53fe85256e2216468acdea2fc7be9ea110",0,0,0,0,0,""
20210111,"IA",251229,,948530,,"posNeg",1199759,555,,96,,36,,256151,"1/10/2021 00:00","2021-01-10T00:00:00Z","01/09 19:00",4139,,,"2021-01-10T00:00:00Z",2312086,272000,2028374,251229,,,,1202038,,,,89689,10106,79543,195523,46066,945534,49008,"19",476,992,1199759,1468,1199759,,1,0,"0a921ec7fc4a646a99a5b5476ab3cc198e082b64",0,0,0,0,0,""
20210110,"IA",250753,,947538,,"posNeg",1198291,541,,105,,41,,255593,"1/10/2021 00:00","2021-01-10T00:00:00Z","01/09 19:00",4138,,,"2021-01-10T00:00:00Z",2307113,271514,2023893,250753,,,,1200578,,,,89582,10043,79499,194313,45727,941644,48638,"19",940,1815,1198291,2755,1198291,,11,0,"16d715f412ce5f3a5e4fb904575ac848be39371e",0,0,0,0,0,""
20210109,"IA",249813,,945723,,"posNeg",1195536,549,,110,,47,,255103,"1/9/2021 00:00","2021-01-09T00:00:00Z","01/08 19:00",4127,,,"2021-01-09T00:00:00Z",2299426,270502,2017300,249813,,,,1197812,,,,89538,10029,79469,193740,45539,939073,48442,"19",1072,1983,1195536,3055,1195536,,3,0,"8c1c4db20b248d5e5b2a4c4c7e8f3e56d028f270",0,0,0,0,0,""
20210108,"IA",248741,,943740,,"posNeg",1192481,579,,108,,51,,253501,"1/8/2021 00:00","2021-01-08T00:00:00Z","01/07 19:00",4124,,,"2021-01-08T00:00:00Z",2289559,269326,2008682,248741,,,,1194751,,,,89127,9833,79254,192781,45266,928678,48160,"19",1608,1965,1192481,3573,1192481,,59,0,"05743e197885644dfdd36b0f2ae3f507b092a256",0,0,0,0,0,""
20210107,"IA",247133,,941775,,"posNeg",1188908,613,,119,,52,,251659,"1/7/2021 00:00","2021-01-07T00:00:00Z","01/06 19:00",4065,,,"2021-01-07T00:00:00Z",2275201,267595,1996135,247133,,,,1191162,,,,88724,9677,79007,190342,44620,913003,47470,"19",1294,2136,1188908,3430,1188908,,5,0,"7b41da3b35f9fdc3b78a38d26a41ad1cb87fdfec",0,0,0,0,0,""
20210106,"IA",245839,,939639,,"posNeg",1185478,604,,116,,54,,249919,"1/6/2021 00:00","2021-01-06T00:00:00Z","01/05 19:00",4060,,,"2021-01-06T00:00:00Z",2264494,266187,1986902,245839,,,,1187729,,,,88267,9518,78709,189129,44077,904912,46889,"19",2010,2224,1185478,4234,1185478,,61,0,"6882e234374dfa18817e5a32e2b6de8a3a8f7e4b",0,0,0,0,0,""
20210105,"IA",243829,,937415,,"posNeg",1181244,582,,115,,53,,247853,"1/5/2021 00:00","2021-01-05T00:00:00Z","01/04 19:00",3999,,,"2021-01-05T00:00:00Z",2251081,263998,1975711,243829,,,,1183491,,,,87760,9315,78405,187445,43476,894222,46281,"19",1021,602,1181244,1623,1181244,,7,0,"2f7d8501628c8523913f731bd99d6e2704e56c7a",0,0,0,0,0,""
20210104,"IA",242808,,936813,,"posNeg",1179621,571,,117,,55,,244677,"1/4/2021 00:00","2021-01-04T00:00:00Z","01/03 19:00",3992,,,"2021-01-04T00:00:00Z",2244098,262936,1969809,242808,,,,1181863,,,,87255,9087,78128,184968,42668,875556,45458,"19",701,824,1179621,1525,1179621,,46,0,"c6524f0553eb219be9cea119d41e49c33a92108c",0,0,0,0,0,""
20210103,"IA",242107,,935989,,"posNeg",1178096,577,,120,,52,,244021,"1/3/2021 00:00","2021-01-03T00:00:00Z","01/02 19:00",3946,,,"2021-01-03T00:00:00Z",2239319,262206,1965775,242107,,,,1180337,,,,87266,9083,78143,184153,42273,872129,45041,"19",865,1311,1178096,2176,1178096,,0,0,"44314652e1560de6c0c81a0066f82abc86a82765",0,0,0,0,0,""
20210102,"IA",241242,,934678,,"posNeg",1175920,572,,119,,60,,243214,"1/2/2021 00:00","2021-01-02T00:00:00Z","01/01 19:00",3946,,,"2021-01-02T00:00:00Z",2233594,261270,1960998,241242,,,,1178164,,,,87211,9062,78109,183907,42087,870488,44837,"19",476,1038,1175920,1514,1175920,,48,0,"c1f0047d5c7f97497c523bb67615f13a10677569",0,0,0,0,0,""
20210101,"IA",240766,,933640,,"posNeg",1174406,575,,117,,63,,241229,"1/1/2021 00:00","2021-01-01T00:00:00Z","12/31 19:00",3898,,,"2021-01-01T00:00:00Z",2228904,260753,1956842,240766,,,,1176651,,,,87174,9050,78084,183464,41898,867217,44622,"19",1593,1594,1174406,3187,1174406,,7,0,"57b2d9079026540fe23b72c8f82e0cd11bee7913",0,0,0,0,0,""
20201231,"IA",239173,,932046,,"posNeg",1171219,600,,134,,69,,238982,"12/31/2020 00:00","2020-12-31T00:00:00Z","12/30 19:00",3891,,,"2020-12-31T00:00:00Z",2218153,259105,1947769,239173,,,,1173467,,,,86849,8910,77899,182537,41484,854563,44174,"19",1323,1726,1171219,3049,1171219,,69,0,"b7e0159fd848a37a7997c76a5e16b9c538b1e0bb",0,0,0,0,0,""
20201230,"IA",237850,,930320,,"posNeg",1168170,612,,127,,66,,236666,"12/30/2020 00:00","2020-12-30T00:00:00Z","12/29 19:00",3822,,,"2020-12-30T00:00:00Z",2207796,257617,1938935,237850,,,,1170415,,,,86581,8760,77781,181210,41084,844222,43739,"19",1052,1067,1168170,2119,1168170,,10,0,"9db37138cadf7a3829f9458d14f7cc3de615be8a",0,0,0,0,0,""
20201229,"IA",236798,,929253,,"posNeg",1166051,620,,117,,67,,233736,"12/29/2020 00:00","2020-12-29T00:00:00Z","12/28 19:00",3812,,,"2020-12-29T00:00:00Z",2199346,256495,1931640,236798,,,,1168299,,,,86217,8636,77541,179118,40439,832621,43076,"19",697,519,1166051,1216,1166051,,67,0,"ecbcd4daecb0614e25a0a4a53e2bb6e0b64aa24c",0,0,0,0,0,""
20201228,"IA",236101,,928734,,"posNeg",1164835,586,,111,,60,,229624,"12/28/2020 00:00","2020-12-28T00:00:00Z","12/27 19:00",3745,,,"2020-12-28T00:00:00Z",2193550,255770,1926606,236101,,,,1167075,,,,85551,8330,77181,177010,39755,814235,42361,"19",562,906,1164835,1468,1164835,,0,0,"51b61642609b90a1346d675cdae1c6d3468cc008",0,0,0,0,0,""
20201227,"IA",235539,,927828,,"posNeg",1163367,553,,109,,65,,228761,"12/27/2020 00:00","2020-12-27T00:00:00Z","12/26 19:00",3745,,,"2020-12-27T00:00:00Z",2187609,255146,1921310,235539,,,,1165614,,,,85561,8327,77194,175915,39443,810077,42002,"19",478,1209,1163367,1687,1163367,,1,0,"13e7a1694c038f3ada30fdedbadb363def1d6c56",0,0,0,0,0,""
20201226,"IA",235061,,926619,,"posNeg",1161680,558,,114,,63,,227670,"12/26/2020 00:00","2020-12-26T00:00:00Z","12/25 19:00",3744,,,"2020-12-26T00:00:00Z",2183122,254620,1917372,235061,,,,1163919,,,,85535,8322,77173,175811,39343,808492,41923,"19",310,950,1161680,1260,1161680,,0,0,"69f013f232c8acd1f22e9eb4b8b80d907f3b8d3e",0,0,0,0,0,""
20201225,"IA",234751,,925669,,"posNeg",1160420,600,,121,,69,,225156,"12/25/2020 00:00","2020-12-25T00:00:00Z","12/24 19:00",3744,,,"2020-12-25T00:00:00Z",2179675,254266,1914292,234751,,,,1162663,,,,85523,8319,77164,175519,39264,806456,41836,"19",870,1839,1160420,2709,1160420,,5,0,"8762894e22d1514e9ec7881a2b843d2f1f498593",0,0,0,0,0,""
20201224,"IA",233881,,923830,,"posNeg",1157711,625,,127,,70,,224817,"12/24/2020 00:00","2020-12-24T00:00:00Z","12/23 19:00",3739,,,"2020-12-24T00:00:00Z",2170162,253283,1905791,233881,,,,1159957,,,,85408,8278,77090,174174,38958,796334,41540,"19",1116,1811,1157711,2927,1157711,,71,0,"764f565bbe2edb6f5cc77e333f47379a6bd36ecd",0,0,0,0,0,""
20201223,"IA",232765,,922019,,"posNeg",1154784,644,,139,,71,,222079,"12/23/2020 00:00","2020-12-23T00:00:00Z","12/22 19:00",3668,,,"2020-12-23T00:00:00Z",2159082,252063,1895983,232765,,,,1157029,,,,84951,8097,76814,172087,38530,783600,41069,"19",1501,2515,1154784,4016,1154784,,15,0,"62e2a2e1f1f5f99caf5fb7a1c1b1b87627f7f4c6",0,0,0,0,0,""
20201222,"IA",231264,,919504,,"posNeg",1150768,651,,140,,71,,219071,"12/22/2020 00:00","2020-12-22T00:00:00Z","12/21 19:00",3653,,,"2020-12-22T00:00:00Z",2144560,250465,1883131,231264,,,,1153004,,,,84260,7849,76371,169606,37951,768903,40455,"19",642,1065,1150768,1707,1150768,,64,0,"142efe8a08cdcf817f82b54d6f986fb8dc754cef",0,0,0,0,0,""
20201221,"IA",230622,,918439,,"posNeg",1149061,644,,142,,72,,214741,"12/21/2020 00:00","2020-12-21T00:00:00Z","12/20 19:00",3589,,,"2020-12-21T00:00:00Z",2135829,249771,1875128,230622,,,,1151287,,,,83556,7603,75913,167825,37492,748659,39982,"19",538,1131,1149061,1669,1149061,,0,0,"e53a45b7180ad28767713fef1e92355bf31be99e",0,0,0,0,0,""
20201220,"IA",230084,,917308,,"posNeg",1147392,639,,149,,79,,213641,"12/20/2020 00:00","2020-12-20T00:00:00Z","12/19 19:00",3589,,,"2020-12-20T00:00:00Z",2130660,249185,1870572,230084,,,,1149616,,,,83440,7541,75859,166638,37165,744214,39631,"19",897,2697,1147392,3594,1147392,,56,0,"6a2a118c540bba7f660be4a19f86dd32b8efb723",0,0,0,0,0,""
20201219,"IA",229187,,914611,,"posNeg",1143798,679,,140,,77,,212379,"12/19/2020 00:00","2020-12-19T00:00:00Z","12/18 19:00",3533,,,"2020-12-19T00:00:00Z",2121806,248219,1862708,229187,,,,1146034,,,,83350,7513,75797,166454,37043,742517,39493,"19",1198,3007,1143798,4205,1143798,,82,0,"75d34a3e201ede71d17d07c30d6cde4e15966a10",0,0,0,0,0,""
20201218,"IA",227989,,911604,,"posNeg",1139593,701,,136,,80,,208802,"12/18/2020 00:00","2020-12-18T00:00:00Z","12/17 19:00",3451,,,"2020-12-18T00:00:00Z",2107647,246945,1849920,227989,,,,1141812,,,,82795,7247,75508,165614,36718,730761,39127,"19",1524,2347,1139593,3871,1139593,,0,0,"210a37412d812b4b22f12dac1b7e5aee341ff140",0,0,0,0,0,""
20201217,"IA",226465,,909257,,"posNeg",1135722,746,,146,,87,,204861,"12/17/2020 00:00","2020-12-17T00:00:00Z","12/16 19:00",3451,,,"2020-12-17T00:00:00Z",2094488,245334,1838477,226465,,,,1137943,,,,82255,7051,75164,163502,36114,717403,38487,"19",1415,3125,1135722,4540,1135722,,97,0,"55b98e48e1beff71124f83c995b69d8c5920e1b7",0,0,0,0,0,""
20201216,"IA",225050,,906132,,"posNeg",1131182,776,,152,,85,,200792,"12/16/2020 00:00","2020-12-16T00:00:00Z","12/15 19:00",3354,,,"2020-12-16T00:00:00Z",2081314,243800,1826895,225050,,,,1133412,,,,81703,6790,74873,162641,35724,708292,38061,"19",1539,2559,1131182,4098,1131182,,14,0,"dee44e943daeddee0ee1a5b491e227abefd6a5d0",0,0,0,0,0,""
20201215,"IA",223511,,903573,,"posNeg",1127084,798,,166,,88,,196157,"12/15/2020 00:00","2020-12-15T00:00:00Z","12/14 19:00",3340,,,"2020-12-15T00:00:00Z",2065300,242125,1812659,223511,,,,1129325,,,,81191,6539,74612,160291,35062,693906,37363,"19",726,1584,1127084,2310,1127084,,67,0,"42d02a55ac5c2c0b0c955f86678918199a7ed34c",0,0,0,0,0,""
20201214,"IA",222785,,901989,,"posNeg",1124774,764,,160,,86,,190221,"12/14/2020 00:00","2020-12-14T00:00:00Z","12/13 19:00",3273,,,"2020-12-14T00:00:00Z",2057727,241353,1805916,222785,,,,1126999,,,,80537,6281,74216,158857,34515,679284,36776,"19",637,1554,1124774,2191,1124774,,60,0,"17cacf10bff5a378ae814c7a0f9188153ab83ea8",0,0,0,0,0,""
20201213,"IA",222148,,900435,,"posNeg",1122583,749,,170,,99,,188924,"12/13/2020 00:00","2020-12-13T00:00:00Z","12/12 19:00",3213,,,"2020-12-13T00:00:00Z",2051931,240688,1800804,222148,,,,1124806,,,,80514,6272,74202,158062,34211,676492,36441,"19",989,2239,1122583,3228,1122583,,1,0,"01d3f83f52affe4c8da5ad62fbb5bb8baebfc20f",0,0,0,0,0,""
20201212,"IA",221159,,898196,,"posNeg",1119355,820,,170,,94,,187458,"12/12/2020 00:00","2020-12-12T00:00:00Z","12/11 19:00",3212,,,"2020-12-12T00:00:00Z",2044360,239592,1794468,221159,,,,1121534,,,,80422,6246,74136,158139,34082,675159,36318,"19",1245,2303,1119355,3548,1119355,,15,0,"af6a45c60a0ddb9c367555b9ea7f7274a8261c12",0,0,0,0,0,""
20201211,"IA",219914,,895893,,"posNeg",1115807,833,,175,,97,,183216,"12/11/2020 00:00","2020-12-11T00:00:00Z","12/10 19:00",3197,,,"2020-12-11T00:00:00Z",2033474,238221,1785001,219914,,,,1117984,,,,79847,5990,73817,156926,33673,662415,35889,"19",1537,2330,1115807,3867,1115807,,77,0,"c82350a869121e6ef2802eea3eac6608bf99e8fb",0,0,0,0,0,""
20201210,"IA",218377,,893563,,"posNeg",1111940,863,,189,,114,,177803,"12/10/2020 00:00","2020-12-10T00:00:00Z","12/09 19:00",3120,,,"2020-12-10T00:00:00Z",2021555,236590,1774745,218377,,,,1114135,,,,79398,5806,73552,154822,32994,647094,35178,"19",1683,2770,1111940,4453,1111940,,99,0,"3104a27a812d0c1238ee9557360e0ea851d74797",0,0,0,0,0,""
20201209,"IA",216694,,890793,,"posNeg",1107487,894,,196,,120,,173440,"12/9/2020 00:00","2020-12-09T00:00:00Z","12/08 19:00",3021,,,"2020-12-09T00:00:00Z",2008660,234720,1763766,216694,,,,1109681,,,,78993,5635,73318,153581,32596,638561,34767,"19",1797,2953,1107487,4750,1107487,,102,0,"04720020e79f64f6498dec53c063fc72e8fb4bae",0,0,0,0,0,""
20201208,"IA",214897,,887840,,"posNeg",1102737,900,,191,,111,,168056,"12/8/2020 00:00","2020-12-08T00:00:00Z","12/07 19:00",2919,,,"2020-12-08T00:00:00Z",1994187,232741,1751325,214897,,,,1104948,,,,78476,5366,73070,151536,31914,625552,34054,"19",830,1254,1102737,2084,1102737,,201,0,"4129004a97c6cec32e2ffc63da6bc5416b15b4a3",0,0,0,0,0,""
20201207,"IA",214067,,886586,,"posNeg",1100653,898,,200,,120,,160836,"12/7/2020 00:00","2020-12-07T00:00:00Z","12/06 19:00",2718,,,"2020-12-07T00:00:00Z",1985953,231843,1744017,214067,,,,1102858,,,,78003,5199,72764,149492,31203,609129,33334,"19",677,1387,1100653,2064,1100653,,35,0,"f31ce72f3a58b837089bde5ba95a815c93e754fa",0,0,0,0,0,""
20201206,"IA",213390,,885199,,"posNeg",1098589,918,,195,,122,,159063,"12/6/2020 00:00","2020-12-06T00:00:00Z","12/05 19:00",2683,,,"2020-12-06T00:00:00Z",,,,213390,,,,1100789,,,,77835,5189,72606,148950,30921,,,"19",1499,2588,1098589,4087,1098589,,16,0,"98018bea3fd128885ddd537da8b564b5a35b7f3a",0,0,0,0,0,""
20201205,"IA",211891,,882611,,"posNeg",1094502,960,,204,,117,,157026,"12/5/2020 00:00","2020-12-05T00:00:00Z","12/04 19:00",2667,,,"2020-12-05T00:00:00Z",,,,211891,,,,1096713,,,,77717,5143,72534,147321,30321,,,"19",1655,3286,1094502,4941,1094502,,62,0,"49a2ed482061c56c3f87416e484e43073e7c75d0",0,0,0,0,0,""
20201204,"IA",210236,,879325,,"posNeg",1089561,1000,,209,,128,,152331,"12/4/2020 00:00","2020-12-04T00:00:00Z","12/03 19:00",2605,,,"2020-12-04T00:00:00Z",,,,210236,,,,1091778,,,,77252,5076,72136,146793,30055,,,"19",2267,3809,1089561,6076,1089561,,83,0,"89cb0ca3eca76a41df1ca51ff15ad31b031e37c7",0,0,0,0,0,""
20201203,"IA",207969,,875516,,"posNeg",1083485,1124,,224,,131,,147169,"12/3/2020 00:00","2020-12-03T00:00:00Z","12/02 19:00",2522,,,"2020-12-03T00:00:00Z",,,,207969,,,,1085657,,,,76843,5019,71784,145053,29491,,,"19",2196,3260,1083485,5456,1083485,,73,0,"8a2541c0a3fe9fe6cf1102cee53670e253755212",0,0,0,0,0,""
20201202,"IA",205773,,872256,,"posNeg",1078029,1162,,226,,131,,142246,"12/2/2020 00:00","2020-12-02T00:00:00Z","12/01 19:00",2449,,,"2020-12-02T00:00:00Z",,,,205773,,,,1080193,,,,76512,4961,71511,144130,29027,,,"19",2375,2662,1078029,5037,1078029,,18,0,"d93b2a865c5c26e90b030b3e0a9f80cf45a4028e",0,0,0,0,0,""
20201201,"IA",203398,,869594,,"posNeg",1072992,1172,,235,,144,,137431,"12/1/2020 00:00","2020-12-01T00:00:00Z","11/30 19:00",2431,,,"2020-12-01T00:00:00Z",,,,203398,,,,1075131,,,,76167,4899,71228,141534,28011,,,"19",988,1188,1072992,2176,1072992,,28,0,"50076729e54e79f2ff48996097a0d595802f55e2",0,0,0,0,0,""
20201130,"IA",202410,,868406,,"posNeg",1070816,1162,,224,,147,,132271,"11/30/2020 00:00","2020-11-30T00:00:00Z","11/29 19:00",2403,,,"2020-11-30T00:00:00Z",,,,202410,,,,1072933,,,,75873,4852,70981,139206,27038,,,"19",1143,1688,1070816,2831,1070816,,36,0,"e62bc7a20a566d2dd3b5292461d6f8d1e36c692d",0,0,0,0,0,""
20201129,"IA",201267,,866718,,"posNeg",1067985,1175,,235,,151,,131098,"11/29/2020 00:00","2020-11-29T00:00:00Z","11/28 19:00",2367,,,"2020-11-29T00:00:00Z",,,,201267,,,,1070113,,,,75566,4843,70683,138472,26696,,,"19",1584,2720,1067985,4304,1067985,,7,0,"990413b191a446a6e089a320ba6470555538e71d",0,0,0,0,0,""
20201128,"IA",199683,,863998,,"posNeg",1063681,1221,,244,,146,,130008,"11/28/2020 00:00","2020-11-28T00:00:00Z","11/27 19:00",2360,,,"2020-11-28T00:00:00Z",,,,199683,,,,1065778,,,,75276,4830,70406,138452,26575,,,"19",1461,1742,1063681,3203,1063681,,8,0,"ab76817d6f50512f344142938f7e1132333d4235",0,0,0,0,0,""
20201127,"IA",198222,,862256,,"posNeg",1060478,1226,,256,,141,,127348,"11/27/2020 00:00","2020-11-27T00:00:00Z","11/26 19:00",2352,,,"2020-11-27T00:00:00Z",,,,198222,,,,1062583,,,,75182,4789,70353,136538,26034,,,"19",1136,1624,1060478,2760,1060478,,40,0,"d5086074ce4b810ab63b5a69504977995bab012b",0,0,0,0,0,""
20201126,"IA",197086,,860632,,"posNeg",1057718,1269,,271,,142,,124520,"11/26/2020 00:00","2020-11-26T00:00:00Z","11/25 19:00",2312,,,"2020-11-26T00:00:00Z",,,,197086,,,,1059805,,,,74935,4757,70138,135888,25713,,,"19",2691,4387,1057718,7078,1057718,,41,0,"b72beba288231dd803e061b2aefa010b9642e98b",0,0,0,0,0,""
20201125,"IA",194395,,856245,,"posNeg",1050640,1305,,269,,198,,122059,"11/25/2020 00:00","2020-11-25T00:00:00Z","11/24 19:00",2271,,,"2020-11-25T00:00:00Z",,,,194395,,,,1052694,,,,74488,4667,69781,134681,25214,,,"19",3243,2608,1050640,5851,1050640,,45,0,"ddba454b14eea7db0c8c7d80efba042576275a22",0,0,0,0,0,""
20201124,"IA",191152,,853637,,"posNeg",1044789,1351,,275,,155,,119713,"11/24/2020 00:00","2020-11-24T00:00:00Z","11/23 19:00",2226,,,"2020-11-24T00:00:00Z",,,,191152,,,,1047635,,,,74177,4611,69526,130848,24165,,,"19",1296,3120,1044789,4416,1044789,,20,0,"7e343b64d072ec3fc21d7607e5b6b2a58bd50cf0",0,0,0,0,0,""
20201123,"IA",189856,,850517,,"posNeg",1040373,1333,,273,,135,,116837,"11/22/2020 00:00","2020-11-22T00:00:00Z","11/21 19:00",2206,,,"2020-11-22T00:00:00Z",,,,189856,,,,1042428,,,,73912,4564,69308,128726,23323,,,"19",2351,4222,1040373,6573,1040373,,14,0,"ab33adb882869c2c03843ea93b75c011ce56ac67",0,0,0,0,0,""
20201122,"IA",187505,,846295,,"posNeg",1033800,1340,,255,,132,,116308,"11/22/2020 00:00","2020-11-22T00:00:00Z","11/21 19:00",2192,,,"2020-11-22T00:00:00Z",,,,187505,,,,1035847,,,,73675,4555,69080,128007,23009,,,"19",2537,4190,1033800,6727,1033800,,32,0,"1f03d35f6d316f3a66953eedf5fc34b091c7b1db",0,0,0,0,0,""
20201121,"IA",184968,,842105,,"posNeg",1027073,1416,,273,,137,,115736,"11/21/2020 00:00","2020-11-21T00:00:00Z","11/20 19:00",2160,,,"2020-11-21T00:00:00Z",,,,184968,,,,1029114,,,,73322,4530,68752,127114,22702,,,"19",3178,4421,1027073,7599,1027073,,27,0,"0b50e3081df147fa9fca8cc2de1677f46ddc9e17",0,0,0,0,0,""
20201120,"IA",181790,,837684,,"posNeg",1019474,1447,,275,,144,,114338,"11/20/2020 00:00","2020-11-20T00:00:00Z","11/19 19:00",2133,,,"2020-11-20T00:00:00Z",,,,181790,,,,1021492,,,,72916,4455,68421,125266,22164,,,"19",3477,4521,1019474,7998,1019474,,27,0,"86121ef60ba59edbe99b908b8e113f6a3eaf39dd",0,0,0,0,0,""
20201119,"IA",178313,,833163,,"posNeg",1011476,1516,,286,,135,,112778,"11/19/2020 00:00","2020-11-19T00:00:00Z","11/18 19:00",2106,,,"2020-11-19T00:00:00Z",,,,178313,,,,1013482,,,,72445,4407,67998,122918,21351,,,"19",3474,4016,1011476,7490,1011476,,40,0,"fb7063c82abe0dc173fb96e8fd9b462ef16298f6",0,0,0,0,0,""
20201118,"IA",174839,,829147,,"posNeg",1003986,1527,,283,,134,,111305,"11/18/2020 00:00","2020-11-18T00:00:00Z","11/17 19:00",2066,,,"2020-11-18T00:00:00Z",,,,174839,,,,1005825,,,,71985,4356,67589,120517,20727,,,"19",3294,3658,1003986,6952,1003986,,39,0,"2f4b6e401833a1d91abe9361be9f0c910345a3fc",0,0,0,0,0,""
20201117,"IA",171545,,825489,,"posNeg",997034,1510,,288,,130,,109978,"11/17/2020 00:00","2020-11-17T00:00:00Z","11/16 19:00",2027,,,"2020-11-17T00:00:00Z",,,,171545,,,,998857,,,,71616,4303,67273,117600,19863,,,"19",2192,1991,997034,4183,997034,,36,0,"dc14c4b9d396b0c3331015adb3058d22818b0173",0,0,0,0,0,""
20201116,"IA",169353,,823498,,"posNeg",992851,1392,,271,,123,,108187,"11/16/2020 00:00","2020-11-16T00:00:00Z","11/15 19:00",1991,,,"2020-11-16T00:00:00Z",,,,169353,,,,994671,,,,71214,4261,66913,114591,18979,,,"19",2071,2179,992851,4250,992851,,6,0,"f7c860e43321aa4abbb4e2e7dc404d4e5fd9cce5",0,0,0,0,0,""
20201115,"IA",167282,,821319,,"posNeg",988601,1279,,247,,115,,107888,"11/15/2020 00:00","2020-11-15T00:00:00Z","11/14 19:00",1985,,,"2020-11-15T00:00:00Z",,,,167282,,,,990411,,,,70922,4244,66638,110636,17874,,,"19",3554,5161,988601,8715,988601,,13,0,"88ac066ffa55071325919d6be19eacbdf618cf54",0,0,0,0,0,""
20201114,"IA",163728,,816158,,"posNeg",979886,1261,,246,,107,,107541,"11/14/2020 00:00","2020-11-14T00:00:00Z","11/13 19:00",1972,,,"2020-11-14T00:00:00Z",,,,163728,,,,981709,,,,70856,4229,66587,110178,17591,,,"19",4093,4149,979886,8242,979886,,24,0,"6ba007a82c15226eda5bfd8eb2bf73f4e9984d41",0,0,0,0,0,""
20201113,"IA",159635,,812009,,"posNeg",971644,1227,,240,,107,,106529,"11/13/2020 00:00","2020-11-13T00:00:00Z","11/12 19:00",1948,,,"2020-11-13T00:00:00Z",,,,159635,,,,973422,,,,70460,4194,66226,108344,17031,,,"19",4032,2856,971644,6888,971644,,18,0,"6a99c2e18c16a798d91913fa3d08418dfd6623e5",0,0,0,0,0,""
20201112,"IA",155603,,809153,,"posNeg",964756,1208,,215,,101,,105384,"11/12/2020 00:00","2020-11-12T00:00:00Z","11/11 19:00",1930,,,"2020-11-12T00:00:00Z",,,,155603,,,,966524,,,,70254,4157,66057,103440,15636,,,"19",3650,2753,964756,6403,964756,,31,0,"914d37343f17e7703d774a9844c6db3653bb00c0",0,0,0,0,0,""
20201111,"IA",151953,,806400,,"posNeg",958353,1190,,210,,101,,104226,"11/11/2020 00:00","2020-11-11T00:00:00Z","11/10 19:00",1899,,,"2020-11-11T00:00:00Z",,,,151953,,,,960139,,,,69862,4110,65712,101190,14888,,,"19",4297,3865,958353,8162,958353,,25,0,"16b37eee237ac113050af0c07923c4ee08464569",0,0,0,0,0,""
20201110,"IA",147656,,802535,,"posNeg",950191,1135,,196,,89,,102981,"11/10/2020 00:00","2020-11-10T00:00:00Z","11/09 19:00",1874,,,"2020-11-10T00:00:00Z",,,,147656,,,,951985,,,,69536,4095,65401,98882,14124,,,"19",2734,1836,950191,4570,950191,,25,0,"44350e37fd88c462cb2d69a6f3a9d66390e6f475",0,0,0,0,0,""
20201109,"IA",144922,,800699,,"posNeg",945621,1034,,184,,82,,101158,"11/9/2020 00:00","2020-11-09T00:00:00Z","11/08 19:00",1849,,,"2020-11-09T00:00:00Z",,,,144922,,,,947377,,,,69300,4059,65201,95944,12965,,,"19",4381,5401,945621,9782,945621,,7,0,"dc39f3beade069b6c143e288478d7df425ddff54",0,0,0,0,0,""
20201108,"IA",140541,,795298,,"posNeg",935839,992,,190,,77,,100747,"11/8/2020 00:00","2020-11-08T00:00:00Z","11/07 19:00",1842,,,"2020-11-08T00:00:00Z",,,,140541,,,,937543,,,,69197,4027,65130,93929,12260,,,"19",3313,4267,935839,7580,935839,,13,0,"2726c93364c9933d0b342cdc0496ab2d6913a749",0,0,0,0,0,""
20201107,"IA",137228,,791031,,"posNeg",928259,901,,194,,72,,100359,"11/7/2020 00:00","2020-11-07T00:00:00Z","11/06 19:00",1829,,,"2020-11-07T00:00:00Z",,,,137228,,,,929957,,,,68947,4017,64890,93647,12045,,,"19",3718,2524,928259,6242,928259,,11,0,"14c5dc2596abd5331a42a26b3b5b3858af0969f5",0,0,0,0,0,""
20201106,"IA",133510,,788507,,"posNeg",922017,912,,188,,67,,99243,"11/6/2020 00:00","2020-11-06T00:00:00Z","11/05 19:00",1818,,,"2020-11-06T00:00:00Z",,,,133510,,,,923705,,,,68582,3987,64555,90450,11106,,,"19",2778,2835,922017,5613,922017,,16,0,"9b2cb0e0044d476b3c82d930a8cd26328bf2f05c",0,0,0,0,0,""
20201105,"IA",130732,,785672,,"posNeg",916404,839,,188,,60,,98037,"11/5/2020 00:00","2020-11-05T00:00:00Z","11/04 19:00",1802,,,"2020-11-05T00:00:00Z",,,,130732,,,,918096,,,,68349,3970,64339,88445,10502,,,"19",3992,4358,916404,8350,916404,,15,0,"e78f62234f315c9a4a90fd1d3e874e6ce0afb338",0,0,0,0,0,""
20201104,"IA",126740,,781314,,"posNeg",908054,777,,182,,63,,96753,"11/4/2020 00:00","2020-11-04T00:00:00Z","11/03 19:00",1787,,,"2020-11-04T00:00:00Z",,,,126740,,,,909756,,,,68036,3952,64044,86091,9782,,,"19",2276,2642,908054,4918,908054,,24,0,"d97a6d47922b096245e9a897d7caecdbad41a70e",0,0,0,0,0,""
20201103,"IA",124464,,778672,,"posNeg",903136,730,,170,,59,,95500,"11/3/2020 00:00","2020-11-03T00:00:00Z","11/02 19:00",1763,,,"2020-11-03T00:00:00Z",,,,124464,,,,904836,,,,67791,3938,63813,84206,9145,,,"19",1092,1050,903136,2142,903136,,22,0,"ab043ca16e6697d33c4d5b7cfe0e44237b56acc2",0,0,0,0,0,""
20201102,"IA",123372,,777622,,"posNeg",900994,718,,156,,57,,93943,"11/2/2020 00:00","2020-11-02T00:00:00Z","11/01 19:00",1741,,,"2020-11-02T00:00:00Z",,,,123372,,,,902681,,,,67608,3921,63647,82806,8741,,,"19",1405,2414,900994,3819,900994,,24,0,"dd290c3ab238c8c28e32543646bc696e935716eb",0,0,0,0,0,""
20201101,"IA",121967,,775208,,"posNeg",897175,718,,156,,57,,93522,"11/1/2020 00:00","2020-11-01T00:00:00Z","10/31 20:00",1717,,,"2020-11-01T00:00:00Z",,,,121967,,,,898851,,,,67569,3909,63620,81999,8393,,,"19",2212,4531,897175,6743,897175,,1,0,"5c047d4989b03057099add3a39640cd8be759818",0,0,0,0,0,""
20201031,"IA",119755,,770677,,"posNeg",890432,630,,153,,55,,93200,"10/31/2020 00:00","2020-10-31T00:00:00Z","10/30 20:00",1716,,,"2020-10-31T00:00:00Z",,,,119755,,,,892097,,,,67286,3889,63357,81284,8197,,,"19",2570,3610,890432,6180,890432,,10,0,"2ab9a222314c07630ced11a387ad0b5f9d0205b7",0,0,0,0,0,""
20201030,"IA",117185,,767067,,"posNeg",884252,606,,152,,55,,92387,"10/30/2020 00:00","2020-10-30T00:00:00Z","10/29 20:00",1706,,,"2020-10-30T00:00:00Z",,,,117185,,,,885919,,,,66863,3850,62973,79221,7759,,,"19",2203,3185,884252,5388,884252,,13,0,"1567be0a717cdf66d19c532f26f213a3cb544823",0,0,0,0,0,""
20201029,"IA",114982,,763882,,"posNeg",878864,605,,135,,56,,91449,"10/29/2020 00:00","2020-10-29T00:00:00Z","10/28 20:00",1693,,,"2020-10-29T00:00:00Z",,,,114982,,,,880527,,,,66562,3831,62691,77568,7349,,,"19",1940,3562,878864,5502,878864,,11,0,"153b9cdab76df46e05a598742cc1f84f22b94c37",0,0,0,0,0,""
20201028,"IA",113042,,760320,,"posNeg",873362,596,,136,,51,,90532,"10/28/2020 00:00","2020-10-28T00:00:00Z","10/27 20:00",1682,,,"2020-10-28T00:00:00Z",,,,113042,,,,875020,,,,66342,3807,62495,75535,6949,,,"19",1781,2561,873362,4342,873362,,21,0,"194febbe46c003c20d523c544df4674adfa47b6e",0,0,0,0,0,""
20201027,"IA",111261,,757759,,"posNeg",869020,564,,128,,46,,89490,"10/27/2020 00:00","2020-10-27T00:00:00Z","10/26 20:00",1661,,,"2020-10-27T00:00:00Z",,,,111261,,,,870679,,,,66073,3796,62237,73681,6521,,,"19",857,1840,869020,2697,869020,,13,0,"979115a1867ea48332216481110450dc444d6f8c",0,0,0,0,0,""
20201026,"IA",110404,,755919,,"posNeg",866323,561,,129,,45,,88124,"10/26/2020 00:00","2020-10-26T00:00:00Z","10/25 20:00",1648,,,"2020-10-26T00:00:00Z",,,,110404,,,,867967,,,,65924,3780,62105,72763,6299,,,"19",747,2215,866323,2962,866323,,14,0,"6b2cea1ea4aa5cfef3e4847bd71aa098fc8f45e4",0,0,0,0,0,""
20201025,"IA",109657,,753704,,"posNeg",863361,541,,119,,42,,87739,"10/25/2020 00:00","2020-10-25T00:00:00Z","10/24 20:00",1634,,,"2020-10-25T00:00:00Z",,,,109657,,,,865004,,,,65891,3772,62080,72039,6187,,,"19",1143,2799,863361,3942,863361,,3,0,"15c4723d06cc7aebb50e50d9b6ef70cc7064bd29",0,0,0,0,0,""
20201024,"IA",108514,,750905,,"posNeg",859419,545,,130,,49,,87463,"10/24/2020 00:00","2020-10-24T00:00:00Z","10/23 20:00",1631,,,"2020-10-24T00:00:00Z",,,,108514,,,,861067,,,,65653,3766,61848,71378,6117,,,"19",1640,4830,859419,6470,859419,,11,0,"cb9d6390b0423899a68c489a8c22ec11291380ba",0,0,0,0,0,""
20201023,"IA",106874,,746075,,"posNeg",852949,536,,134,,49,,86630,"10/23/2020 00:00","2020-10-23T00:00:00Z","10/22 20:00",1620,,,"2020-10-23T00:00:00Z",,,,106874,,,,854599,,,,65299,3748,61512,71282,6043,,,"19",1249,3430,852949,4679,852949,,19,0,"0e5f69dbf9f952546a7fb50b182325acbdf8fedb",0,0,0,0,0,""
20201022,"IA",105625,,742645,,"posNeg",848270,530,,135,,53,,85697,"10/22/2020 00:00","2020-10-22T00:00:00Z","10/21 20:00",1601,,,"2020-10-22T00:00:00Z",,,,105625,,,,849925,,,,64981,3725,61217,70128,5801,,,"19",1435,4293,848270,5728,848270,,17,0,"7398c5dc5dcfffb1e5387b9ce7a4e96e4dfc3de0",0,0,0,0,0,""
20201021,"IA",104190,,738352,,"posNeg",842542,534,,134,,49,,84671,"10/21/2020 00:00","2020-10-21T00:00:00Z","10/20 20:00",1584,,,"2020-10-21T00:00:00Z",,,,104190,,,,844194,,,,64568,3695,60834,68339,5615,,,"19",1179,3645,842542,4824,842542,,29,0,"e14f82de54c69359c335e99db1fa7d428dc649e6",0,0,0,0,0,""
20201020,"IA",103011,,734707,,"posNeg",837718,501,,122,,45,,83518,"10/20/2020 00:00","2020-10-20T00:00:00Z","10/19 20:00",1555,,,"2020-10-20T00:00:00Z",,,,103011,,,,839348,,,,64329,3685,60605,67096,5433,,,"19",494,1651,837718,2145,837718,,17,0,"8f26cf6f5a958276ab73e03e7ab27189adce2cc1",0,0,0,0,0,""
20201019,"IA",102517,,733056,,"posNeg",835573,480,,113,,45,,82188,"10/19/2020 00:00","2020-10-19T00:00:00Z","10/18 20:00",1538,,,"2020-10-19T00:00:00Z",,,,102517,,,,837201,,,,64121,3674,60408,65534,5221,,,"19",557,2480,835573,3037,835573,,10,0,"1dd1bc9c260087c640f5c3a8633da72676fd0036",0,0,0,0,0,""
20201018,"IA",101960,,730576,,"posNeg",832536,475,,108,,45,,81811,"10/18/2020 00:00","2020-10-18T00:00:00Z","10/17 20:00",1528,,,"2020-10-18T00:00:00Z",,,,101960,,,,834160,,,,64094,3667,60388,65140,5161,,,"19",857,3795,832536,4652,832536,,1,0,"6f5cc073aa207715c23ab0e8c960f09c2e42c658",0,0,0,0,0,""
20201017,"IA",101103,,726781,,"posNeg",827884,461,,104,,46,,81502,"10/17/2020 00:00","2020-10-17T00:00:00Z","10/16 20:00",1527,,,"2020-10-17T00:00:00Z",,,,101103,,,,829503,,,,63869,3663,60167,65216,5158,,,"19",1157,3952,827884,5109,827884,,4,0,"48c1808a56273fefa082b8f7dc6fd91a57160f50",0,0,0,0,0,""
20201016,"IA",99946,,722829,,"posNeg",822775,468,,105,,48,,80560,"10/16/2020 00:00","2020-10-16T00:00:00Z","10/15 20:00",1523,,,"2020-10-16T00:00:00Z",,,,99946,,,,824384,,,,63528,3654,59835,63948,5026,,,"19",1229,-14060,822775,-12831,822775,,17,0,"bf45de3c6739c27fd94a3c0aa451bbb67d9e50c7",0,0,0,0,0,""
20201015,"IA",98717,,736889,,"posNeg",835606,482,,107,,49,,80203,"10/15/2020 00:00","2020-10-15T00:00:00Z","10/14 20:00",1506,,,"2020-10-15T00:00:00Z",,,,98717,,,,837215,,,,63224,3638,59547,44640,4921,,,"19",1333,5020,835606,6353,835606,,9,0,"5bbcabde81696b0ad9e35efb5dae29f2100f6547",0,0,0,0,0,""
20201014,"IA",97384,,731869,,"posNeg",829253,473,,106,,46,,79121,"10/14/2020 00:00","2020-10-14T00:00:00Z","10/13 20:00",1497,,,"2020-10-14T00:00:00Z",,,,97384,,,,830861,,,,62877,3612,59226,43301,4722,,,"19",1046,3338,829253,4384,829253,,12,0,"a123e8775be7abb165fc793c47b1fb381a2289c1",0,0,0,0,0,""
20201013,"IA",96338,,728531,,"posNeg",824869,463,,114,,44,,78136,"10/13/2020 00:00","2020-10-13T00:00:00Z","10/12 20:00",1485,,,"2020-10-13T00:00:00Z",,,,96338,,,,826482,,,,62562,3605,58918,42383,4558,,,"19",529,2200,824869,2729,824869,,13,0,"6b197f659a02081ef8bd38b3f1f1835b93744291",0,0,0,0,0,""
20201012,"IA",95809,,726331,,"posNeg",822140,449,,109,,39,,76611,"10/12/2020 00:00","2020-10-12T00:00:00Z","10/11 20:00",1472,,,"2020-10-12T00:00:00Z",,,,95809,,,,823756,,,,62388,3594,58755,41464,4385,,,"19",463,2217,822140,2680,822140,,12,0,"a45a05c1a282fa714fb2f96453bb3da01d16f902",0,0,0,0,0,""
20201011,"IA",95346,,724114,,"posNeg",819460,438,,100,,40,,76260,"10/11/2020 00:00","2020-10-11T00:00:00Z","10/10 20:00",1460,,,"2020-10-11T00:00:00Z",,,,95346,,,,821074,,,,62364,3594,58731,41229,4339,,,"19",1075,4307,819460,5382,819460,,5,0,"645d280e2d0af9a224040b8e54802f344dc4290b",0,0,0,0,0,""
20201010,"IA",94271,,719807,,"posNeg",814078,450,,101,,40,,75948,"10/10/2020 00:00","2020-10-10T00:00:00Z","10/09 20:00",1455,,,"2020-10-10T00:00:00Z",,,,94271,,,,815700,,,,62093,3586,58468,41240,4320,,,"19",1084,4193,814078,5277,814078,,18,0,"41fc08499aa2e8b6face24a7304c1d3f12b01229",0,0,0,0,0,""
20201009,"IA",93187,,715614,,"posNeg",808801,461,,104,,38,,75113,"10/9/2020 00:00","2020-10-09T00:00:00Z","10/08 20:00",1437,,,"2020-10-09T00:00:00Z",,,,93187,,,,810428,,,,61682,3569,58074,40536,4263,,,"19",1042,4722,808801,5764,808801,,16,0,"c873db6ba37498c0e7ac301395e690ee32fa7ee8",0,0,0,0,0,""
20201008,"IA",92145,,710892,,"posNeg",803037,449,,112,,63,,74250,"10/8/2020 00:00","2020-10-08T00:00:00Z","10/07 20:00",1421,,,"2020-10-08T00:00:00Z",,,,92145,,,,804658,,,,61395,3550,57806,39309,4075,,,"19",1261,5719,803037,6980,803037,,6,0,"b7f5b068d5e6aba52828613078720145cc3dbec0",0,0,0,0,0,""
20201007,"IA",90884,,705173,,"posNeg",796057,444,,104,,42,,73311,"10/7/2020 00:00","2020-10-07T00:00:00Z","10/06 20:00",1415,,,"2020-10-07T00:00:00Z",,,,90884,,,,797684,,,,60955,3531,57385,36763,3691,,,"19",950,4264,796057,5214,796057,,15,0,"1fc99564f55689c6847fd71b2bb16f7c1c91be6f",0,0,0,0,0,""
20201006,"IA",89934,,700909,,"posNeg",790843,413,,104,,43,,72273,"10/6/2020 00:00","2020-10-06T00:00:00Z","10/05 20:00",1400,,,"2020-10-06T00:00:00Z",,,,89934,,,,792418,,,,60637,3515,57083,35866,3629,,,"19",474,2355,790843,2829,790843,,11,0,"2b691ae7fb7a9416eabf5f7c49adb9cb76600222",0,0,0,0,0,""
20201005,"IA",89460,,698554,,"posNeg",788014,389,,99,,43,,71920,"10/5/2020 00:00","2020-10-05T00:00:00Z","10/04 20:00",1389,,,"2020-10-05T00:00:00Z",,,,89460,,,,789576,,,,60388,3497,56852,34953,3526,,,"19",364,2083,788014,2447,788014,,7,0,"d099052c45f5f4fc34bd4c4fa834a9d9836a8497",0,0,0,0,0,""
20201004,"IA",89096,,696471,,"posNeg",785567,392,,104,,39,,71600,"10/4/2020 00:00","2020-10-04T00:00:00Z","10/03 20:00",1382,,,"2020-10-04T00:00:00Z",,,,89096,,,,787127,,,,60347,3488,56820,34814,3502,,,"19",626,3632,785567,4258,785567,,5,0,"2ded110f194ce00ae7519cdac9d1edc7bc8b677a",0,0,0,0,0,""
20201003,"IA",88470,,692839,,"posNeg",781309,402,,100,,38,,71319,"10/3/2020 00:00","2020-10-03T00:00:00Z","10/02 20:00",1377,,,"2020-10-03T00:00:00Z",,,,88470,,,,782856,,,,60125,3483,56603,34763,3493,,,"19",911,4406,781309,5317,781309,,5,0,"9a918c3e172111a17f0631a7ebea382f52feb472",0,0,0,0,0,""
20201002,"IA",87559,,688433,,"posNeg",775992,393,,95,,36,,70501,"10/2/2020 00:00","2020-10-02T00:00:00Z","10/01 20:00",1372,,,"2020-10-02T00:00:00Z",,,,87559,,,,777529,,,,59708,3462,56207,34592,3464,,,"19",925,4124,775992,5049,775992,,12,0,"de2204e3afc1ff39fc9ac635d9188a195e4e0f40",0,0,0,0,0,""
20201001,"IA",86634,,684309,,"posNeg",770943,407,,104,,33,,69619,"10/1/2020 00:00","2020-10-01T00:00:00Z","09/30 20:00",1360,,,"2020-10-01T00:00:00Z",,,,86634,,,,772483,,,,59364,3450,55875,33336,3375,,,"19",1038,5038,770943,6076,770943,,16,0,"18c48103459b516c025ef664f4b4dcd37781cb58",0,0,0,0,0,""
20200930,"IA",85596,,679271,,"posNeg",764867,390,,100,,31,,68456,"9/30/2020 00:00","2020-09-30T00:00:00Z","09/29 20:00",1344,,,"2020-09-30T00:00:00Z",,,,85596,,,,766417,,,,58927,3429,55459,32440,3233,,,"19",1120,5359,764867,6479,764867,,16,0,"e075ff64f49f367af8d6a8ac95869fa1c357add3",0,0,0,0,0,""
20200929,"IA",84476,,673912,,"posNeg",758388,376,,97,,36,,67477,"9/29/2020 00:00","2020-09-29T00:00:00Z","09/28 20:00",1328,,,"2020-09-29T00:00:00Z",,,,84476,,,,759938,,,,58556,3416,55101,31617,3162,,,"19",474,2598,758388,3072,758388,,8,0,"d440f13e5c3363f3245439aa3d834eb91ab0509e",0,0,0,0,0,""
20200928,"IA",84002,,671314,,"posNeg",755316,353,,96,,39,,66327,"9/28/2020 00:00","2020-09-28T00:00:00Z","09/27 20:00",1320,,,"2020-09-28T00:00:00Z",,,,84002,,,,756871,,,,58318,3400,54878,30094,2994,,,"19",366,327,755316,693,755316,,6,0,"a3a378980fc806f1fbfa079bb37f77fe96c14831",0,0,0,0,0,""
20200927,"IA",83636,,670987,,"posNeg",754623,343,,89,,34,,65838,"9/27/2020 00:00","2020-09-27T00:00:00Z","09/26 20:00",1314,,,"2020-09-27T00:00:00Z",,,,83636,,,,756180,,,,58298,3396,54862,26254,2792,,,"19",692,3033,754623,3725,754623,,3,0,"de30e39c8416b3356f929dbaeac456155a1aba4e",0,0,0,0,0,""
20200926,"IA",82944,,667954,,"posNeg",750898,334,,84,,29,,65490,"9/26/2020 00:00","2020-09-26T00:00:00Z","09/25 20:00",1311,,,"2020-09-26T00:00:00Z",,,,82944,,,,752449,,,,57997,3389,54568,20350,2645,,,"19",899,5018,750898,5917,750898,,4,0,"53043b393a4b289e75908a65f35c4a421a9cd216",0,0,0,0,0,""
20200925,"IA",82045,,662936,,"posNeg",744981,330,,87,,35,,62648,"9/25/2020 00:00","2020-09-25T00:00:00Z","09/24 20:00",1307,,,"2020-09-25T00:00:00Z",,,,82045,,,,746536,,,,57499,3371,54088,20262,2640,,,"19",974,5427,744981,6401,744981,,5,0,"c49a8c9b843f383ed8d36b3441c507acedce9d7c",0,0,0,0,0,""
20200924,"IA",81071,,657509,,"posNeg",738580,305,,79,,37,,61509,"9/24/2020 00:00","2020-09-24T00:00:00Z","09/23 20:00",1302,,,"2020-09-24T00:00:00Z",,,,81071,,,,740125,,,,57067,3357,53670,19784,2511,,,"19",1148,5579,738580,6727,738580,,8,0,"102c65af4f6b62afeae93da16f78490d119035d6",0,0,0,0,0,""
20200923,"IA",79923,,651930,,"posNeg",731853,301,,77,,37,,60350,"9/23/2020 00:00","2020-09-23T00:00:00Z","09/22 20:00",1294,,,"2020-09-23T00:00:00Z",,,,79923,,,,733400,,,,56600,3345,53215,19021,2434,,,"19",1036,5735,731853,6771,731853,,8,0,"773d67ff830c00039cddda572f12906c115dcf35",0,0,0,0,0,""
20200922,"IA",78887,,646195,,"posNeg",725082,285,,72,,34,,59216,"9/22/2020 00:00","2020-09-22T00:00:00Z","09/21 20:00",1286,,,"2020-09-22T00:00:00Z",,,,78887,,,,726620,,,,56190,3339,52811,18946,2416,,,"19",548,2939,725082,3487,725082,,12,0,"3caa6eb6f7211df30de163e8ae18032d7f3a561b",0,0,0,0,0,""
20200921,"IA",78339,,643256,,"posNeg",721595,271,,74,,35,,57942,"9/21/2020 00:00","2020-09-21T00:00:00Z","09/20 20:00",1274,,,"2020-09-21T00:00:00Z",,,,78339,,,,723128,,,,55948,3326,52582,18817,2401,,,"19",660,2656,721595,3316,721595,,9,0,"6a86ca018841796a393591f277331793daa52ed3",0,0,0,0,0,""
20200920,"IA",77679,,640600,,"posNeg",718279,269,,73,,38,,57524,"9/20/2020 00:00","2020-09-20T00:00:00Z","09/19 20:00",1265,,,"2020-09-20T00:00:00Z",,,,77679,,,,719817,,,,55887,3320,52527,18671,2368,,,"19",621,3883,718279,4504,718279,,1,0,"e2056f469f594730e4518c271e59455bae33e0b2",0,0,0,0,0,""
20200919,"IA",77058,,636717,,"posNeg",713775,282,,81,,40,,57269,"9/19/2020 00:00","2020-09-19T00:00:00Z","09/18 20:00",1264,,,"2020-09-19T00:00:00Z",,,,77058,,,,715311,,,,55107,3312,51755,18314,2326,,,"19",847,4897,713775,5744,713775,,4,0,"219c77b21c8bc140a7ea04aa2c29e132f1498254",0,0,0,0,0,""
20200918,"IA",76211,,631820,,"posNeg",708031,281,,91,,39,,56546,"9/18/2020 00:00","2020-09-18T00:00:00Z","09/17 20:00",1260,,,"2020-09-18T00:00:00Z",,,,76211,,,,709565,,,,54988,3289,51659,18101,2314,,,"19",1183,5410,708031,6593,708031,,9,0,"01ee9f125d5f3d91af30a28157501e6a6215fc30",0,0,0,0,0,""
20200917,"IA",75028,,626410,,"posNeg",701438,271,,85,,36,,55834,"9/17/2020 00:00","2020-09-17T00:00:00Z","09/16 20:00",1251,,,"2020-09-17T00:00:00Z",,,,75028,,,,702988,,,,54504,3269,51195,17663,2250,,,"19",948,5379,701438,6327,701438,,14,0,"3f38befe059abdd6d0c50b9654766d8c6de79511",0,0,0,0,0,""
20200916,"IA",74080,,621031,,"posNeg",695111,291,,79,,32,,55067,"9/16/2020 00:00","2020-09-16T00:00:00Z","09/15 20:00",1237,,,"2020-09-16T00:00:00Z",,,,74080,,,,696656,,,,53963,3240,50683,17285,2201,,,"19",803,4696,695111,5499,695111,,3,0,"af15030569cb440e16055f3ae24443638599f91d",0,0,0,0,0,""
20200915,"IA",73277,,616335,,"posNeg",689612,284,,74,,29,,54352,"9/15/2020 00:00","2020-09-15T00:00:00Z","09/14 20:00",1234,,,"2020-09-15T00:00:00Z",,,,73277,,,,691147,,,,53494,3224,50230,16832,2112,,,"19",401,2575,689612,2976,689612,,10,0,"5331f53135770d380262691b2c166b002eefb5d2",0,0,0,0,0,""
20200914,"IA",72876,,613760,,"posNeg",686636,272,,75,,29,,53417,"9/14/2020 00:00","2020-09-14T00:00:00Z","09/13 20:00",1224,,,"2020-09-14T00:00:00Z",,,,72876,,,,688157,,,,53228,3205,49983,16383,2024,,,"19",386,2805,686636,3191,686636,,6,0,"db30a0afdf8adc26fc4fc74dd6a0331dee8be3f1",0,0,0,0,0,""
20200913,"IA",72490,,610955,,"posNeg",683445,274,,79,,28,,53151,"9/13/2020 00:00","2020-09-13T00:00:00Z","09/12 20:00",1218,,,"2020-09-13T00:00:00Z",,,,72490,,,,684959,,,,53195,3199,49956,16319,2016,,,"19",784,3771,683445,4555,683445,,1,0,"46573e16b88fbca593039649848ccdf9f98b7455",0,0,0,0,0,""
20200912,"IA",71706,,607184,,"posNeg",678890,290,,90,,35,,52953,"9/12/2020 00:00","2020-09-12T00:00:00Z","09/11 20:00",1217,,,"2020-09-12T00:00:00Z",,,,71706,,,,680421,,,,52915,3188,49687,16279,1991,,,"19",573,4720,678890,5293,678890,,6,0,"e4aac794f631ecd4acafd46d125773306038859b",0,0,0,0,0,""
20200911,"IA",71133,,602464,,"posNeg",673597,281,,83,,36,,52370,"9/11/2020 00:00","2020-09-11T00:00:00Z","09/10 20:00",1211,,,"2020-09-11T00:00:00Z",,,,71133,,,,675126,,,,52493,3177,49276,15171,1895,,,"19",728,5000,673597,5728,673597,,4,0,"5e0405bb4dfa74b94823ec74c778efccf1557537",0,0,0,0,0,""
20200910,"IA",70405,,597464,,"posNeg",667869,302,,85,,34,,51691,"9/10/2020 00:00","2020-09-10T00:00:00Z","09/09 20:00",1207,,,"2020-09-10T00:00:00Z",,,,70405,,,,669391,,,,52103,3155,48908,14985,1852,,,"19",902,5392,667869,6294,667869,,13,0,"104b6aa03b48c96189c638a7b70203ced22fbc86",0,0,0,0,0,""
20200909,"IA",69503,,592072,,"posNeg",661575,322,,83,,37,,51014,"9/9/2020 00:00","2020-09-09T00:00:00Z","09/08 20:00",1194,,,"2020-09-09T00:00:00Z",,,,69503,,,,663101,,,,51688,3149,48499,14539,1762,,,"19",364,2234,661575,2598,661575,,14,0,"bb3fdb0101468c50d070e71a54ca2761e8fb4303",0,0,0,0,0,""
20200908,"IA",69139,,589838,,"posNeg",658977,326,,92,,37,,50466,"9/8/2020 00:00","2020-09-08T00:00:00Z","09/07 20:00",1180,,,"2020-09-08T00:00:00Z",,,,69139,,,,660497,,,,51459,3130,48289,14126,1726,,,"19",455,2676,658977,3131,658977,,12,0,"c127dfae48faabab9902bfcad738922ba632777d",0,0,0,0,0,""
20200907,"IA",68684,,587162,,"posNeg",655846,311,,99,,35,,49884,"9/7/2020 00:00","2020-09-07T00:00:00Z","09/06 20:00",1168,,,"2020-09-07T00:00:00Z",,,,68684,,,,657363,,,,51445,3126,48279,14069,1719,,,"19",393,2516,655846,2909,655846,,3,0,"cd937accf681cdd2e331c6c98817fda9af1ee98a",0,0,0,0,0,""
20200906,"IA",68291,,584646,,"posNeg",652937,309,,91,,37,,49723,"9/6/2020 00:00","2020-09-06T00:00:00Z","09/05 20:00",1165,,,"2020-09-06T00:00:00Z",,,,68291,,,,654436,,,,51413,3121,48252,14081,1719,,,"19",649,3777,652937,4426,652937,,4,0,"b6c1a0027824c54af6f2c5bc3715ab52b09675fb",0,0,0,0,0,""
20200905,"IA",67642,,580869,,"posNeg",648511,315,,94,,38,,49521,"9/5/2020 00:00","2020-09-05T00:00:00Z","09/04 20:00",1161,,,"2020-09-05T00:00:00Z",,,,67642,,,,650020,,,,51112,3118,47954,13362,1664,,,"19",1028,5148,648511,6176,648511,,20,0,"097d8988527253260fa3fc9b79c00692e95e3856",0,0,0,0,0,""
20200904,"IA",66614,,575721,,"posNeg",642335,317,,87,,41,,49053,"9/4/2020 00:00","2020-09-04T00:00:00Z","09/03 20:00",1141,,,"2020-09-04T00:00:00Z",,,,66614,,,,643829,,,,50680,3106,47534,13188,1642,,,"19",1091,6486,642335,7577,642335,,6,0,"ceb1e601c75ace32d1530f8d3ba7d46fe2fb1a97",0,0,0,0,0,""
20200903,"IA",65523,,569235,,"posNeg",634758,323,,88,,41,,48580,"9/3/2020 00:00","2020-09-03T00:00:00Z","09/02 20:00",1135,,,"2020-09-03T00:00:00Z",,,,65523,,,,636250,,,,50202,3091,47071,13081,1628,,,"19",878,4226,634758,5104,634758,,9,0,"fe9a33e3b3e7ebf3068cde6698755770aedda667",0,0,0,0,0,""
20200902,"IA",64645,,565009,,"posNeg",629654,310,,87,,39,,48074,"9/2/2020 00:00","2020-09-02T00:00:00Z","09/01 20:00",1126,,,"2020-09-02T00:00:00Z",,,,64645,,,,631146,,,,49749,3084,46625,12809,1604,,,"19",726,5381,629654,6107,629654,,3,0,"6a829c801fb0a8125e367a7ef97095cc1c083b67",0,0,0,0,0,""
20200901,"IA",63919,,559628,,"posNeg",623547,311,,88,,43,,47437,"9/1/2020 00:00","2020-09-01T00:00:00Z","08/31 20:00",1123,,,"2020-09-01T00:00:00Z",,,,63919,,,,625058,,,,49415,3071,46304,12398,1558,,,"19",591,2084,623547,2675,623547,,7,0,"4d698fd5ac5f63e33522efce9aa2c071a025ac0d",0,0,0,0,0,""
20200831,"IA",63328,,557544,,"posNeg",620872,299,,85,,46,,46740,"8/31/2020 00:00","2020-08-31T00:00:00Z","08/30 20:00",1116,,,"2020-08-31T00:00:00Z",,,,63328,,,,622372,,,,49191,3052,46099,11957,1500,,,"19",608,3169,620872,3777,620872,,3,0,"89d6166f735407add21891531c86982310a2abd6",0,0,0,0,0,""
20200830,"IA",62720,,554375,,"posNeg",617095,308,,88,,42,,46555,"8/30/2020 00:00","2020-08-30T00:00:00Z","08/29 20:00",1113,,,"2020-08-30T00:00:00Z",,,,62720,,,,618597,,,,49157,3044,46073,11962,1488,,,"19",971,3545,617095,4516,617095,,5,0,"bd7e1d041cc72d176f4e5f2232bd0fdc31958c39",0,0,0,0,0,""
20200829,"IA",61749,,550830,,"posNeg",612579,315,,91,,43,,46409,"8/29/2020 00:00","2020-08-29T00:00:00Z","08/28 20:00",1108,,,"2020-08-29T00:00:00Z",,,,61749,,,,614094,,,,48817,3034,45743,11775,1450,,,"19",778,4642,612579,5420,612579,,13,0,"1ae3f4f7548a3a158ee6fe20dea9bedc96717ef0",0,0,0,0,0,""
20200828,"IA",60971,,546188,,"posNeg",607159,299,,91,,41,,45977,"8/28/2020 00:00","2020-08-28T00:00:00Z","08/27 20:00",1095,,,"2020-08-28T00:00:00Z",,,,60971,,,,608675,,,,48321,3020,45261,11155,1382,,,"19",1185,4331,607159,5516,607159,,12,0,"d68da6e3e48556aae2eb3ebcd6aaf6130ed5a3f3",0,0,0,0,0,""
20200827,"IA",59786,,541857,,"posNeg",601643,305,,99,,44,,45447,"8/27/2020 00:00","2020-08-27T00:00:00Z","08/26 20:00",1083,,,"2020-08-27T00:00:00Z",,,,59786,,,,608333,,,,47705,3011,44654,,,,,"19",1551,6284,601643,7835,601643,,16,0,"bb0a88941347f665e9af61bc3422a5c4b458235b",0,0,0,0,0,""
20200826,"IA",58235,,535573,,"posNeg",593808,313,,102,,40,,44903,"8/26/2020 00:00","2020-08-26T00:00:00Z","08/25 20:00",1067,,,"2020-08-26T00:00:00Z",,,,58235,,,,608333,,,,47597,2999,44558,,,,,"19",941,5124,593808,6065,593808,,15,0,"cf5492a08064c7cfde094f294844400ecacc341c",0,0,0,0,0,""
20200825,"IA",57294,,530449,,"posNeg",587743,295,,82,,37,,44396,"8/25/2020 00:00","2020-08-25T00:00:00Z","08/24 20:00",1052,,,"2020-08-25T00:00:00Z",,,,57294,,,,602037,,,,47180,2993,44147,,,,,"19",661,2984,587743,3645,587743,,8,0,"a4a3b2b98b18334038dc617479ce4547bae3d9df",0,0,0,0,0,""
20200824,"IA",56633,,527465,,"posNeg",584098,275,,86,,37,,43738,"8/24/2020 00:00","2020-08-24T00:00:00Z","08/23 20:00",1044,,,"2020-08-24T00:00:00Z",,,,56633,,,,598215,,,,46923,2986,43897,,,,,"19",358,1764,584098,2122,584098,,8,0,"ddd18fba20d84bf9318466ebd433ae2c7944cadc",0,0,0,0,0,""
20200823,"IA",56275,,525701,,"posNeg",581976,260,,82,,39,,43493,"8/23/2020 00:00","2020-08-23T00:00:00Z","08/22 20:00",1036,,,"2020-08-23T00:00:00Z",,,,56275,,,,595765,,,,46862,2980,43842,,,,,"19",540,3081,581976,3621,581976,,5,0,"1c874f8c6c386ee6c1f171f0a4c01041e467990c",0,0,0,0,0,""
20200822,"IA",55735,,522620,,"posNeg",578355,268,,79,,34,,43383,"8/22/2020 00:00","2020-08-22T00:00:00Z","08/21 20:00",1031,,,"2020-08-22T00:00:00Z",,,,55735,,,,591963,,,,46576,2975,43561,,,,,"19",729,4487,578355,5216,578355,,10,0,"84017b286a26b6b17fdbfa3d1d528f94a6034b66",0,0,0,0,0,""
20200821,"IA",55006,,518133,,"posNeg",573139,293,,81,,32,,42912,"8/21/2020 00:00","2020-08-21T00:00:00Z","08/20 20:00",1021,,,"2020-08-21T00:00:00Z",,,,55006,,,,586622,,,,46117,2964,43113,,,,,"19",991,3957,573139,4948,573139,,7,0,"ae9cf86ca01f7ea076a2d651782f171a6558782d",0,0,0,0,0,""
20200820,"IA",54015,,514176,,"posNeg",568191,300,,89,,31,,42372,"8/20/2020 00:00","2020-08-20T00:00:00Z","08/19 20:00",1014,,,"2020-08-20T00:00:00Z",,,,54015,,,,581522,,,,45627,2955,42632,,,,,"19",727,5142,568191,5869,568191,,8,0,"26db095a4ac4a346e105a7b301c8811a35444296",0,0,0,0,0,""
20200819,"IA",53288,,509034,,"posNeg",562322,299,,90,,33,,41837,"8/19/2020 00:00","2020-08-19T00:00:00Z","08/18 20:00",1006,,,"2020-08-19T00:00:00Z",,,,53288,,,,571408,,,,45090,2942,42108,,,,,"19",337,4887,562322,5224,562322,,17,0,"194d70e35be360ba769b35da0c7c28645f1e7a0d",0,0,0,0,0,""
20200818,"IA",52951,,504147,,"posNeg",557098,287,,86,,35,,41565,"8/18/2020 00:00","2020-08-18T00:00:00Z","08/17 20:00",989,,,"2020-08-18T00:00:00Z",,,,52951,,,,565139,,,,44689,2928,41721,,,,,"19",229,2885,557098,3114,557098,,8,0,"dab96bd2cbc4d9c5390b1cfaeb7d3502a0aeb181",0,0,0,0,0,""
20200817,"IA",52722,,501262,,"posNeg",553984,283,,85,,33,,40788,"8/17/2020 00:00","2020-08-17T00:00:00Z","08/16 20:00",981,,,"2020-08-17T00:00:00Z",,,,52722,,,,561762,,,,44376,2919,41418,,,,,"19",294,2497,553984,2791,553984,,6,0,"5ea269c8f36dda6fc296443303dfd694e7f633f3",0,0,0,0,0,""
20200816,"IA",52428,,498765,,"posNeg",551193,271,,80,,34,,40525,"8/16/2020 00:00","2020-08-16T00:00:00Z","08/15 20:00",975,,,"2020-08-16T00:00:00Z",,,,52428,,,,558953,,,,44309,2915,41355,,,,,"19",635,4484,551193,5119,551193,,2,0,"830566ebb8dcbb3bed655f6e21f3b774c2ca2da7",0,0,0,0,0,""
20200815,"IA",51793,,494281,,"posNeg",546074,261,,82,,35,,40381,"8/15/2020 00:00","2020-08-15T00:00:00Z","08/14 20:00",973,,,"2020-08-15T00:00:00Z",,,,51793,,,,553559,,,,43996,2911,41046,,,,,"19",861,4976,546074,5837,546074,,7,0,"9da71a79bcf614a72cdc16d78e85134a09186bc2",0,0,0,0,0,""
20200814,"IA",50932,,489305,,"posNeg",540237,258,,75,,28,,39879,"8/14/2020 00:00","2020-08-14T00:00:00Z","08/13 20:00",966,,,"2020-08-14T00:00:00Z",,,,50932,,,,543482,,,,43518,2901,40578,,,,,"19",596,4828,540237,5424,540237,,7,0,"be1ae92acc5631010adacea01f42942ffd3a4282",0,0,0,0,0,""
20200813,"IA",50336,,484477,,"posNeg",534813,261,,88,,25,,39320,"8/13/2020 00:00","2020-08-13T00:00:00Z","08/12 20:00",959,,,"2020-08-13T00:00:00Z",,,,50336,,,,538099,,,,43119,2896,40184,,,,,"19",530,6135,534813,6665,534813,,8,0,"69f90d9ab6c693eba071843ec1d6f815dcd3058e",0,0,0,0,0,""
20200812,"IA",49806,,478342,,"posNeg",528148,243,,72,,25,,38657,"8/12/2020 00:00","2020-08-12T00:00:00Z","08/11 20:00",951,,,"2020-08-12T00:00:00Z",,,,49806,,,,531310,,,,42311,2871,39401,,,,,"19",477,3751,528148,4228,528148,,11,0,"d3b811049c038b2a99a872ad799db720a702f6bc",0,0,0,0,0,""
20200811,"IA",49329,,474591,,"posNeg",523920,244,,64,,25,,38033,"8/11/2020 00:00","2020-08-11T00:00:00Z","08/10 20:00",940,,,"2020-08-11T00:00:00Z",,,,49329,,,,527055,,,,42235,2860,39336,,,,,"19",258,2275,523920,2533,523920,,7,0,"9622044731699ba02a91b438eb8c55422cca4ea3",0,0,0,0,0,""
20200810,"IA",49071,,472316,,"posNeg",521387,224,,57,,23,,37317,"8/10/2020 00:00","2020-08-10T00:00:00Z","08/09 20:00",933,,,"2020-08-10T00:00:00Z",,,,49071,,,,524445,,,,42105,2849,39217,,,,,"19",282,2295,521387,2577,521387,,3,0,"672deed49875b7db8ff9859d6ee723997ab9642b",0,0,0,0,0,""
20200809,"IA",48789,,470021,,"posNeg",518810,221,,57,,20,,37096,"8/9/2020 00:00","2020-08-09T00:00:00Z","08/08 20:00",930,,,"2020-08-09T00:00:00Z",,,,48789,,,,521783,,,,42052,2839,39174,,,,,"19",506,4757,518810,5263,518810,,5,0,"0db5184d25180f08aadd33d40cc841c03d81d00c",0,0,0,0,0,""
20200808,"IA",48283,,465264,,"posNeg",513547,229,,58,,22,,36882,"8/8/2020 00:00","2020-08-08T00:00:00Z","08/07 20:00",925,,,"2020-08-08T00:00:00Z",,,,48283,,,,516402,,,,41699,2829,38831,,,,,"19",418,4429,513547,4847,513547,,12,0,"a444d2bb99b1d1b832c93e4170606469abfac388",0,0,0,0,0,""
20200807,"IA",47865,,460835,,"posNeg",508700,223,,65,,25,,36322,"8/7/2020 00:00","2020-08-07T00:00:00Z","08/06 20:00",913,,,"2020-08-07T00:00:00Z",,,,47865,,,,511424,,,,41130,2821,38270,,,,,"19",504,5076,508700,5580,508700,,5,0,"e389e2169aab3d2e13556bdd6db5a09063da2871",0,0,0,0,0,""
20200806,"IA",47361,,455759,,"posNeg",503120,237,,68,,32,,35548,"8/6/2020 00:00","2020-08-06T00:00:00Z","08/05 20:00",908,,,"2020-08-06T00:00:00Z",,,,47361,,,,505772,,,,40563,2808,37716,,,,,"19",702,5990,503120,6692,503120,,9,0,"2162625533ce84bd4727f2837073fdadc2c57e50",0,0,0,0,0,""
20200805,"IA",46659,,449769,,"posNeg",496428,248,,77,,34,,34733,"8/5/2020 00:00","2020-08-05T00:00:00Z","08/04 20:00",899,,,"2020-08-05T00:00:00Z",,,,46659,,,,498949,,,,39746,2796,36911,,,,,"19",617,5440,496428,6057,496428,,11,0,"6c89102d303a25904d3ed8cd79a3772837c1c649",0,0,0,0,0,""
20200804,"IA",46042,,444329,,"posNeg",490371,243,,75,,32,,34023,"8/4/2020 00:00","2020-08-04T00:00:00Z","08/03 20:00",888,,,"2020-08-04T00:00:00Z",,,,46042,,,,492517,,,,39596,2776,36781,,,,,"19",201,3695,490371,3896,490371,,6,0,"2d2ff891f839188ba56ad5612e74a4800a70dee9",0,0,0,0,0,""
20200803,"IA",45841,,440634,,"posNeg",486475,241,,78,,31,,33219,"8/3/2020 00:00","2020-08-03T00:00:00Z","08/02 20:00",882,,,"2020-08-03T00:00:00Z",,,,45841,,,,488480,,,,39487,2768,36680,,,,,"19",349,2008,486475,2357,486475,,6,0,"3fefd1d544da104caefec0145d0f8bf11eceb929",0,0,0,0,0,""
20200802,"IA",45492,,438626,,"posNeg",484118,231,,75,,36,,32952,"8/2/2020 00:00","2020-08-02T00:00:00Z","08/01 20:00",876,,,"2020-08-02T00:00:00Z",,,,45492,,,,486119,,,,39426,2760,36627,,,,,"19",516,4632,484118,5148,484118,,4,0,"307d9715732dfe1c54aba9f463d18c5a012f1601",0,0,0,0,0,""
20200801,"IA",44976,,433994,,"posNeg",478970,242,,77,,35,,32819,"8/1/2020 14:00","2020-08-01T14:00:00Z","08/01 10:00",872,,,"2020-08-01T14:00:00Z",,,,44976,,,,480891,,,,39382,2753,36590,,,,,"19",394,4164,478970,4558,478970,,5,0,"8723aace95827f43403ef7597205924637fa535e",0,0,0,0,0,""
20200731,"IA",44582,,429830,,"posNeg",474412,225,,71,,29,,32578,"7/31/2020 00:00","2020-07-31T00:00:00Z","07/30 20:00",867,,,"2020-07-31T00:00:00Z",,,,44582,,,,476322,,,,39222,2744,36439,,,,,"19",544,4770,474412,5314,474412,,10,0,"4ac82fb196a79bbf11279e2ad36e2ae8c8f21dc9",0,0,0,0,0,""
20200730,"IA",44038,,425060,,"posNeg",469098,237,,76,,31,,31835,"7/30/2020 00:00","2020-07-30T00:00:00Z","07/29 20:00",857,,,"2020-07-30T00:00:00Z",,,,44038,,,,471006,,,,38971,2738,36194,,,,,"19",761,5625,469098,6386,469098,,11,0,"3b737fb983c8388ce29095ff07e7feb6c546e8e5",0,0,0,0,0,""
20200729,"IA",43277,,419435,,"posNeg",462712,246,,76,,32,,31246,"7/29/2020 00:00","2020-07-29T00:00:00Z","07/28 20:00",846,,,"2020-07-29T00:00:00Z",,,,43277,,,,464517,,,,38808,2728,36041,,,,,"19",500,4777,462712,5277,462712,,7,0,"a95e9cebf7fef11df8100df0752c808d7881ede5",0,0,0,0,0,""
20200728,"IA",42777,,414658,,"posNeg",457435,253,,75,,31,,30623,"7/28/2020 00:00","2020-07-28T00:00:00Z","07/27 20:00",839,,,"2020-07-28T00:00:00Z",,,,42777,,,,459226,,,,38634,2719,35876,,,,,"19",223,2367,457435,2590,457435,,6,0,"e58ba225925cdbaef14c47dc8eed4eaee9e3d78b",0,0,0,0,0,""
20200727,"IA",42554,,412291,,"posNeg",454845,241,,78,,32,,29873,"7/27/2020 00:00","2020-07-27T00:00:00Z","07/26 20:00",833,,,"2020-07-27T00:00:00Z",,,,42554,,,,456519,,,,38491,2705,35747,,,,,"19",354,3892,454845,4246,454845,,6,0,"f180c326e48506212453167855cb1cb9e6878268",0,0,0,0,0,""
20200726,"IA",42200,,408399,,"posNeg",450599,226,,77,,29,,29625,"7/26/2020 00:00","2020-07-26T00:00:00Z","07/25 20:00",827,,,"2020-07-26T00:00:00Z",,,,42200,,,,452280,,,,38438,2700,35699,,,,,"19",529,3807,450599,4336,450599,,1,0,"f7a2108b613d770466ce55d5a29065d88ae75b4f",0,0,0,0,0,""
20200725,"IA",41671,,404592,,"posNeg",446263,220,,72,,28,,29477,"7/25/2020 00:00","2020-07-25T00:00:00Z","07/24 20:00",826,,,"2020-07-25T00:00:00Z",,,,41671,,,,447923,,,,38332,2693,35600,,,,,"19",400,3990,446263,4390,446263,,3,0,"835749904bcc92893b3c507f363e4fa58eee7979",0,0,0,0,0,""
20200724,"IA",41271,,400602,,"posNeg",441873,230,,72,,27,,29216,"7/24/2020 00:00","2020-07-24T00:00:00Z","07/23 20:00",823,,,"2020-07-24T00:00:00Z",,,,41271,,,,443499,,,,38137,2673,35425,,,,,"19",637,4950,441873,5587,441873,,5,0,"85b09216037916a4d4cb236b556f245ca74dfdd2",0,0,0,0,0,""
20200723,"IA",40634,,395652,,"posNeg",436286,232,,73,,32,,28924,"7/23/2020 00:00","2020-07-23T00:00:00Z","07/22 20:00",818,,,"2020-07-23T00:00:00Z",,,,40634,,,,437848,,,,37958,2663,35257,,,,,"19",841,9009,436286,9850,436286,,10,0,"6033c331556f7a0cdb71f749c8593bd5c665cc5c",0,0,0,0,0,""
20200722,"IA",39793,,386643,,"posNeg",426436,224,,71,,31,,28607,"7/22/2020 00:00","2020-07-22T00:00:00Z","07/21 20:00",808,,,"2020-07-22T00:00:00Z",,,,39793,,,,427908,,,,37646,2641,34967,,,,,"19",319,3684,426436,4003,426436,,6,0,"0d84e7c6d037939805b38f0dd2008c1aecd5c790",0,0,0,0,0,""
20200721,"IA",39474,,382959,,"posNeg",422433,223,,74,,32,,28388,"7/21/2020 00:00","2020-07-21T00:00:00Z","07/20 20:00",802,,,"2020-07-21T00:00:00Z",,,,39474,,,,423878,,,,37535,2632,34865,,,,,"19",308,3581,422433,3889,422433,,5,0,"fd64502d8b67fbb6e517ccf98d611cda8e473cb9",0,0,0,0,0,""
20200720,"IA",39166,,379378,,"posNeg",418544,221,,76,,30,,28024,"7/20/2020 00:00","2020-07-20T00:00:00Z","07/19 20:00",797,,,"2020-07-20T00:00:00Z",,,,39166,,,,419862,,,,37265,2619,34610,,,,,"19",443,2610,418544,3053,418544,,3,0,"6dcd8e9b37e995b2e5e52f58e65fabf70f360f6f",0,0,0,0,0,""
20200719,"IA",38723,,376768,,"posNeg",415491,214,,75,,31,,27894,"7/19/2020 00:00","2020-07-19T00:00:00Z","07/18 20:00",794,,,"2020-07-19T00:00:00Z",,,,38723,,,,416735,,,,37180,2595,34549,,,,,"19",816,10946,415491,11762,415491,,7,0,"843b8a46d3de61f4ecf6db4b143a5e9c7f1f00dc",0,0,0,0,0,""
20200718,"IA",37907,,365822,,"posNeg",403729,210,,70,,27,,27820,"7/18/2020 00:00","2020-07-18T00:00:00Z","07/17 20:00",787,,,"2020-07-18T00:00:00Z",,,,37907,,,,403729,,,,36656,2516,34104,,,,,"19",185,1091,403729,1276,403729,,3,0,"ce79489259f1a41b41b0c4083668f9ee8a57ca8a",0,0,0,0,0,""
20200717,"IA",37722,,364731,,"posNeg",402453,210,,70,,32,,27609,"7/17/2020 00:00","2020-07-17T00:00:00Z","07/16 20:00",784,,,"2020-07-17T00:00:00Z",,,,37722,,,,403691,,,,36654,2514,34104,,,,,"19",590,5412,402453,6002,402453,,6,0,"84913e3ca83b174870cdc8b7a274f7855e1efb4b",0,0,0,0,0,""
20200716,"IA",37132,,359319,,"posNeg",396451,195,,65,,34,,27404,"7/16/2020 00:00","2020-07-16T00:00:00Z","07/15 20:00",778,,,"2020-07-16T00:00:00Z",,,,37132,,,,397678,,,,36397,2499,33862,,,,,"19",841,8298,396451,9139,396451,,16,0,"4f6910b7685399f5fd86a18bc7126ddd6eb8a2d4",0,0,0,0,0,""
20200715,"IA",36291,,351021,,"posNeg",387312,190,,62,,30,,27177,"7/15/2020 00:00","2020-07-15T00:00:00Z","07/14 20:00",762,,,"2020-07-15T00:00:00Z",,,,36291,,,,388516,,,,36077,2464,33578,,,,,"19",442,6462,387312,6904,387312,,5,0,"2181c892411f6ff3e39cb4b58a08adc57937969a",0,0,0,0,0,""
20200714,"IA",35849,,344559,,"posNeg",380408,186,,67,,32,,26952,"7/14/2020 00:00","2020-07-14T00:00:00Z","07/13 20:00",757,,,"2020-07-14T00:00:00Z",,,,35849,,,,381606,,,,35823,2446,33342,,,,,"19",320,3372,380408,3692,380408,,3,0,"be64a46b781733c979170698a33eb9569272eac7",0,0,0,0,0,""
20200713,"IA",35529,,341187,,"posNeg",376716,186,,67,,32,,26664,"7/13/2020 00:00","2020-07-13T00:00:00Z","07/12 20:00",754,,,"2020-07-13T00:00:00Z",,,,35529,,,,377874,,,,35456,2435,32986,,,,,"19",458,1845,376716,2303,376716,,4,0,"f37afae020581957b7cfb88eb4e13d8fb0556c36",0,0,0,0,0,""
20200712,"IA",35071,,339342,,"posNeg",374413,177,,54,,26,,26234,"7/12/2020 00:00","2020-07-12T00:00:00Z","07/11 20:00",750,,,"2020-07-12T00:00:00Z",,,,35071,,,,375563,,,,35357,2428,32894,,,,,"19",424,5628,374413,6052,374413,,2,0,"2002bdac23b68ba7a0da26523ef896a6022e257c",0,0,0,0,0,""
20200711,"IA",34647,,333714,,"posNeg",368361,178,,56,,25,,26104,"7/11/2020 00:00","2020-07-11T00:00:00Z","07/10 20:00",748,,,"2020-07-11T00:00:00Z",,,,34647,,,,369503,,,,35213,2423,32755,,,,,"19",663,5450,368361,6113,368361,,5,0,"33c089305daec24fdd1be5471a1a889aa618a0e4",0,0,0,0,0,""
20200710,"IA",33984,,328264,,"posNeg",362248,169,,54,,26,,25891,"7/10/2020 00:00","2020-07-10T00:00:00Z","07/09 20:00",743,,,"2020-07-10T00:00:00Z",,,,33984,,,,362997,,,,34982,2410,32537,,,,,"19",744,6845,362248,7589,362248,,4,0,"1e2bbf50b3a5f480cbccb38a5d9544736fc73ad3",0,0,0,0,0,""
20200709,"IA",33240,,321419,,"posNeg",354659,168,,49,,22,,26340,"7/9/2020 00:00","2020-07-09T00:00:00Z","07/08 20:00",739,,,"2020-07-09T00:00:00Z",,,,33240,,,,355338,,,,34568,2395,32139,,,,,"19",731,7577,354659,8308,354659,,4,0,"4fd884f7a33163876f95a34160a0bfa7493a6c57",0,0,0,0,0,""
20200708,"IA",32509,,313842,,"posNeg",346351,165,,44,,23,,25974,"7/8/2020 00:00","2020-07-08T00:00:00Z","07/07 20:00",735,,,"2020-07-08T00:00:00Z",,,,32509,,,,347006,,,,34326,2382,31910,,,,,"19",480,6573,346351,7053,346351,,10,0,"16c9fd22f0138e4e844a6bdcb77988bfa694baae",0,0,0,0,0,""
20200707,"IA",32029,,307269,,"posNeg",339298,165,,44,,20,,25594,"7/7/2020 00:00","2020-07-07T00:00:00Z","07/06 20:00",725,,,"2020-07-07T00:00:00Z",,,,32029,,,,339940,,,,34103,2375,31695,,,,,"19",372,3464,339298,3836,339298,,2,0,"1246a6d7da47b0cb4ee8537288214fe07e2012ec",0,0,0,0,0,""
20200706,"IA",31657,,303805,,"posNeg",335462,151,,41,,15,,25121,"7/6/2020 00:00","2020-07-06T00:00:00Z","07/05 20:00",723,,,"2020-07-06T00:00:00Z",,,,31657,,,,335980,,,,33891,2366,31492,,,,,"19",304,2686,335462,2990,335462,,2,0,"78523ec19a20f964640d4ace9d4beca0f510ab01",0,0,0,0,0,""
20200705,"IA",31353,,301119,,"posNeg",332472,141,,43,,16,,24739,"7/5/2020 00:00","2020-07-05T00:00:00Z","07/04 20:00",721,,,"2020-07-05T00:00:00Z",,,,31353,,,,332991,,,,33883,2359,31441,,,,,"19",312,3149,332472,3461,332472,,0,0,"14448474609ab9eb69a6eb967adbbe152307e6ae",0,0,0,0,0,""
20200704,"IA",31041,,297970,,"posNeg",329011,134,,40,,16,,24604,"7/4/2020 00:00","2020-07-04T00:00:00Z","07/03 20:00",721,,,"2020-07-04T00:00:00Z",,,,31041,,,,329518,,,,33761,2355,31373,,,,,"19",612,6938,329011,7550,329011,,1,0,"c1b0ef4e5f8498de700bbd53dfcc075e6b1ef970",0,0,0,0,0,""
20200703,"IA",30429,,291032,,"posNeg",321461,146,,40,,20,,24338,"7/3/2020 00:00","2020-07-03T00:00:00Z","07/02 20:00",720,,,"2020-07-03T00:00:00Z",,,,30429,,,,321958,,,,33421,2347,31041,,,,,"19",220,3703,321461,3923,321461,,2,0,"e4b2b6a91fd006601a1323efaf86526bdfb997e4",0,0,0,0,0,""
20200702,"IA",30209,,287329,,"posNeg",317538,145,,36,,18,,23993,"7/2/2020 00:00","2020-07-02T00:00:00Z","07/01 20:00",718,,,"2020-07-02T00:00:00Z",,,,30209,,,,317985,,,,33210,2339,30838,,,,,"19",758,6990,317538,7748,317538,,1,0,"5e1d11295a91f8043d536d86d7ee2fc360a4105b",0,0,0,0,0,""
20200701,"IA",29451,,280339,,"posNeg",309790,149,,37,,21,,23607,"7/1/2020 00:00","2020-07-01T00:00:00Z","06/30 20:00",717,,,"2020-07-01T00:00:00Z",,,,29451,,,,310218,,,,32844,2315,30496,,,,,"19",444,5158,309790,5602,309790,,2,0,"3de8909e93acad67e6f7dab98a2e8c076e8e6bdd",0,0,0,0,0,""
20200630,"IA",29007,,275181,,"posNeg",304188,133,,34,,20,,23212,"6/30/2020 00:00","2020-06-30T00:00:00Z","06/29 20:00",715,,,"2020-06-30T00:00:00Z",,,,29007,,,,304608,,,,32644,2303,30308,,,,,"19",225,3118,304188,3343,304188,,7,0,"10237ca48ab71bf65fac1dc988e21c2c51037bc9",0,0,0,0,0,""
20200629,"IA",28782,,272063,,"posNeg",300845,119,,35,,18,,17851,"6/29/2020 00:00","2020-06-29T00:00:00Z","06/28 20:00",708,,,"2020-06-29T00:00:00Z",,,,28782,,,,301263,,,,32172,2282,29858,,,,,"19",293,4637,300845,4930,300845,,3,0,"cb3fc946c7f5182a6c09ae9ef52ad1779b2e6826",0,0,0,0,0,""
20200628,"IA",28489,,267426,,"posNeg",295915,118,,36,,18,,17620,"6/28/2020 00:00","2020-06-28T00:00:00Z","06/27 20:00",705,,,"2020-06-28T00:00:00Z",,,,28489,,,,296335,,,,31915,2276,29607,,,,,"19",477,5686,295915,6163,295915,,1,0,"3047b12e5f073c1e0ed7fa93a88606519165ee81",0,0,0,0,0,""
20200627,"IA",28012,,261740,,"posNeg",289752,131,,40,,22,,17467,"6/27/2020 00:00","2020-06-27T00:00:00Z","06/26 20:00",704,,,"2020-06-27T00:00:00Z",,,,28012,,,,290171,,,,31769,2271,29466,,,,,"19",326,5783,289752,6109,289752,,0,0,"830366492b40b166de121d8d5096e5bf236c1566",0,0,0,0,0,""
20200626,"IA",27686,,255957,,"posNeg",283643,141,,42,,24,,17313,"6/26/2020 00:00","2020-06-26T00:00:00Z","06/25 20:00",704,,,"2020-06-26T00:00:00Z",,,,27686,,,,284046,,,,31185,2255,28898,,,,,"19",489,6100,283643,6589,283643,,9,0,"8d083aec45830bedcec1f558d43b374f3a381bc2",0,0,0,0,0,""
20200625,"IA",27197,,249857,,"posNeg",277054,137,,42,,26,,17017,"6/25/2020 00:00","2020-06-25T00:00:00Z","06/24 20:00",695,,,"2020-06-25T00:00:00Z",,,,27197,,,,277444,,,,30674,2238,28404,,,,,"19",492,6603,277054,7095,277054,,3,0,"9169cbd509ad5b8d02c2162af3f0193d710f152e",0,0,0,0,0,""
20200624,"IA",26705,,243254,,"posNeg",269959,140,,43,,25,,16858,"6/24/2020 00:00","2020-06-24T00:00:00Z","06/23 20:00",692,,,"2020-06-24T00:00:00Z",,,,26705,,,,270332,,,,30276,2223,28021,,,,,"19",332,4924,269959,5256,269959,,4,0,"29b43ae8cf261dbc177605da1157cc51c2bb6375",0,0,0,0,0,""
20200623,"IA",26373,,238330,,"posNeg",264703,163,,47,,26,,16579,"6/23/2020 00:00","2020-06-23T00:00:00Z","06/22 20:00",688,,,"2020-06-23T00:00:00Z",,,,26373,,,,265074,,,,29977,2214,27733,,,,,"19",322,5749,264703,6071,264703,,2,0,"3df7bbce6bd44d67d4764ecdd19c2a252b46f54c",0,0,0,0,0,""
20200622,"IA",26051,,232581,,"posNeg",258632,169,,51,,28,,16240,"6/22/2020 00:00","2020-06-22T00:00:00Z","06/21 20:00",686,,,"2020-06-22T00:00:00Z",,,,26051,,,,259002,,,,29086,2207,26850,,,,,"19",88,1392,258632,1480,258632,,1,0,"6263700eee4888eaa266123ee3d40b6f6a022914",0,0,0,0,0,""
20200621,"IA",25963,,231189,,"posNeg",257152,170,,53,,27,,16068,"6/21/2020 00:00","2020-06-21T00:00:00Z","06/20 20:00",685,,,"2020-06-21T00:00:00Z",,,,25963,,,,257522,,,,28898,2207,26662,,,,,"19",467,6478,257152,6945,257152,,4,0,"1ab256a33c242b122d849205b2d6c8f5e94e26dd",0,0,0,0,0,""
20200620,"IA",25496,,224711,,"posNeg",250207,182,,58,,30,,15963,"6/20/2020 00:00","2020-06-20T00:00:00Z","06/19 20:00",681,,,"2020-06-20T00:00:00Z",,,,25496,,,,250576,,,,28486,2202,26256,,,,,"19",221,3337,250207,3558,250207,,0,0,"ba9cd85d8288811780ebc9e67853173f4507d266",0,0,0,0,0,""
20200619,"IA",25275,,221374,,"posNeg",246649,197,,60,,37,,15816,"6/19/2020 00:00","2020-06-19T00:00:00Z","06/18 20:00",681,,,"2020-06-19T00:00:00Z",,,,25275,,,,247015,,,,28015,2171,25816,,,,,"19",421,5297,246649,5718,246649,,2,0,"eb1aa6b15e3f6a46f04e21b17f4d68e9c7b5962f",0,0,0,0,0,""
20200618,"IA",24854,,216077,,"posNeg",240931,188,,64,,47,,15604,"6/18/2020 00:00","2020-06-18T00:00:00Z","06/17 20:00",679,,,"2020-06-18T00:00:00Z",,,,24854,,,,241301,,,,27641,2160,25453,,,,,"19",393,5407,240931,5800,240931,,6,0,"c68648c353e014ee22d878026cdcbdb547660dd2",0,0,0,0,0,""
20200617,"IA",24461,,210670,,"posNeg",235131,188,,64,,47,,15289,"6/17/2020 00:00","2020-06-17T00:00:00Z","06/16 20:00",673,,,"2020-06-17T00:00:00Z",,,,24461,,,,235508,,,,27366,2152,25186,,,,,"19",282,4211,235131,4493,235131,,4,0,"8efd327108f20c231fbd6c4693b62485af9108fd",0,0,0,0,0,""
20200616,"IA",24179,,206459,,"posNeg",230638,193,,71,,49,,15025,"6/16/2020 00:00","2020-06-16T00:00:00Z","06/15 20:00",669,,,"2020-06-16T00:00:00Z",,,,24179,,,,231012,,,,26817,2131,24658,,,,,"19",126,3124,230638,3250,230638,,14,0,"b8b0d95abc3805066a50a14a84b4f2869c14fdc0",0,0,0,0,0,""
20200615,"IA",24053,,203335,,"posNeg",227388,197,,71,,51,,14625,"6/15/2020 00:00","2020-06-15T00:00:00Z","06/14 20:00",655,,,"2020-06-15T00:00:00Z",,,,24053,,,,227759,,,,26262,2114,24121,,,,,"19",127,2627,227388,2754,227388,,3,0,"0f3d2e2fce38b98beb6c757acbc62c4f481acd9b",0,0,0,0,0,""
20200614,"IA",23926,,200708,,"posNeg",224634,203,,77,,47,,14383,"6/14/2020 00:00","2020-06-14T00:00:00Z","06/13 20:00",652,,,"2020-06-14T00:00:00Z",,,,23926,,,,225001,,,,26080,2101,23952,,,,,"19",209,4817,224634,5026,224634,,2,0,"24bc339b8faccf27ad699c8b1c9c93bc1e14f030",0,0,0,0,0,""
20200613,"IA",23717,,195891,,"posNeg",219608,200,,76,,43,,14326,"6/13/2020 00:00","2020-06-13T00:00:00Z","06/12 20:00",650,,,"2020-06-13T00:00:00Z",,,,23717,,,,219976,,,,25876,2097,23752,,,,,"19",380,4684,219608,5064,219608,,7,0,"a2ce252d5db124b90523f6099a2cba34c2487abb",0,0,0,0,0,""
20200612,"IA",23337,,191207,,"posNeg",214544,225,,81,,47,,14227,"6/12/2020 00:00","2020-06-12T00:00:00Z","06/11 20:00",643,,,"2020-06-12T00:00:00Z",,,,23337,,,,214943,,,,25697,2095,23575,,,,,"19",399,5606,214544,6005,214544,,4,0,"921756f78b55887382fbf4e7b4464a32d2859112",0,0,0,0,0,""
20200611,"IA",22938,,185601,,"posNeg",208539,242,,75,,48,,13956,"6/11/2020 00:00","2020-06-11T00:00:00Z","06/10 20:00",639,,,"2020-06-11T00:00:00Z",,,,22938,,,,208539,,,,24898,2070,22801,,,,,"19",387,5323,208539,5710,208539,,9,0,"82b93d8a4c343270102a87a6eafbb2bd29ac8fb1",0,0,0,0,0,""
20200610,"IA",22551,,180278,,"posNeg",202829,245,,73,,49,,13628,"6/10/2020 00:00","2020-06-10T00:00:00Z","06/09 20:00",630,,,"2020-06-10T00:00:00Z",,,,22551,,,,202829,,,,24404,2048,22331,,,,,"19",315,4791,202829,5106,202829,,6,0,"dffd9dc99bed8d2ef64d78ac2341b4881d6cccc7",0,0,0,0,0,""
20200609,"IA",22236,,175487,,"posNeg",197723,255,,82,,51,,13411,"6/9/2020 00:00","2020-06-09T00:00:00Z","06/08 20:00",624,,,"2020-06-09T00:00:00Z",,,,22236,,,,197723,,,,23790,1994,21771,,,,,"19",249,3852,197723,4101,197723,,12,0,"0c7e42e013f3ab5124dffb0a5ffbcdf308ed43b6",0,0,0,0,0,""
20200608,"IA",21987,,171635,,"posNeg",193622,265,,85,,53,,13028,"6/8/2020 00:00","2020-06-08T00:00:00Z","06/07 20:00",612,,,"2020-06-08T00:00:00Z",,,,21987,,,,193622,,,,23143,1972,21153,,,,,"19",320,5110,193622,5430,193622,,8,0,"768d0b908f3a5e800c61e65a45cd32fbac8d4b90",0,0,0,0,0,""
20200607,"IA",21667,,166525,,"posNeg",188192,269,,86,,54,,12805,"6/7/2020 00:00","2020-06-07T00:00:00Z","06/06 20:00",604,,,"2020-06-07T00:00:00Z",,,,21667,,,,188192,,,,22237,1952,20267,,,,,"19",189,3289,188192,3478,188192,,6,0,"7fee155239d8388c24af13b91f72b081a0accaff",0,0,0,0,0,""
20200606,"IA",21478,,163236,,"posNeg",184714,299,,102,,62,,12715,"6/6/2020 00:00","2020-06-06T00:00:00Z","06/05 20:00",598,,,"2020-06-06T00:00:00Z",,,,21478,,,,184714,,,,21415,1934,19464,,,,,"19",326,3725,184714,4051,184714,,6,0,"1c1ac503413ea3abef5042818a9eacb727aabda1",0,0,0,0,0,""
20200605,"IA",21152,,159511,,"posNeg",180663,299,,102,,62,,12585,"6/5/2020 00:00","2020-06-05T00:00:00Z","06/04 20:00",592,,,"2020-06-05T00:00:00Z",,,,21152,,,,180663,,,,20917,1920,18980,,,,,"19",347,5381,180663,5728,180663,,12,0,"581cc3340af58180be016e7e2bc24fc21dd40ee7",0,0,0,0,0,""
20200604,"IA",20805,,154130,,"posNeg",174935,310,,105,,70,,12333,"6/3/2020 00:00","2020-06-03T00:00:00Z","06/02 20:00",580,,,"2020-06-03T00:00:00Z",,,,20805,,,,174935,,,,20328,1912,18399,,,,,"19",750,9740,174935,10490,174935,,6,0,"9c189724bd0a4e8e9688d115c6aece5bd2b2d923",0,0,0,0,0,""
20200603,"IA",20055,,144390,,"posNeg",164445,314,,116,,76,,12064,"6/3/2020 00:00","2020-06-03T00:00:00Z","06/02 20:00",574,,,"2020-06-03T00:00:00Z",,,,20055,,,,164445,,,,19502,1880,17607,,,,,"19",39,716,164445,755,164445,,13,0,"335b742dd95a098ccc31a641b8cf686b25f68c00",0,0,0,0,0,""
20200602,"IA",20016,,143674,,"posNeg",163690,327,,114,,76,,11742,"6/2/2020 00:00","2020-06-02T00:00:00Z","06/01 20:00",561,,,"2020-06-02T00:00:00Z",,,,20016,,,,163969,,,,19449,1876,17559,,,,,"19",319,4290,163690,4609,163690,,10,0,"39ff40c17e357fe0c2b352eb6b13032787542e1e",0,0,0,0,0,""
20200601,"IA",19697,,139384,,"posNeg",159081,339,,125,,73,,11440,"6/1/2020 00:00","2020-06-01T00:00:00Z","05/31 20:00",551,,,"2020-06-01T00:00:00Z",,,,19697,,,,159292,,,,19051,1869,17170,,,,,"19",145,2640,159081,2785,159081,,17,0,"f13ce8a255ee3455eaf6814950dd473078ee529c",0,0,0,0,0,""
20200531,"IA",19552,,136744,,"posNeg",156296,341,,116,,70,,11147,"5/31/2020 00:00","2020-05-31T00:00:00Z","05/30 20:00",534,,,"2020-05-31T00:00:00Z",,,,19552,,,,154948,,,,18682,1861,16810,,,,,"19",308,5565,156296,5873,156296,,3,0,"2fc78230ca5e662b0192fdbfc8844cad8bb01a62",0,0,0,0,0,""
20200530,"IA",19244,,131179,,"posNeg",150423,368,,118,,69,,11019,"5/30/2020 00:00","2020-05-30T00:00:00Z","05/29 20:00",531,,,"2020-05-30T00:00:00Z",,,,19244,,,,150851,,,,18658,1861,16786,,,,,"19",318,2785,150423,3103,150423,,9,0,"97d0a13340746ccca6b9a40da9fb4a9f325e4ff0",0,0,0,0,0,""
20200529,"IA",18926,,128394,,"posNeg",147320,376,,117,,78,,10753,"5/29/2020 00:00","2020-05-29T00:00:00Z","05/28 20:00",522,,,"2020-05-29T00:00:00Z",,,,18926,,,,147768,,,,17906,1846,16050,,,,,"19",353,4034,147320,4387,147320,,18,0,"14288a2c51dc281211fe930c95a32fcbd25e2446",0,0,0,0,0,""
20200528,"IA",18573,,124360,,"posNeg",142933,383,,112,,67,,10359,"5/28/2020 00:00","2020-05-28T00:00:00Z","05/27 20:00",504,,,"2020-05-28T00:00:00Z",,,,18573,,,,143359,,,,16138,1805,14324,,,,,"19",213,3194,142933,3407,142933,,13,0,"ae2690d5d5d04256aa1c5acf24498314635d0de2",0,0,0,0,0,""
20200527,"IA",18360,,121166,,"posNeg",139526,393,,109,,66,,10016,"5/27/2020 00:00","2020-05-27T00:00:00Z","05/26 20:00",491,,,"2020-05-27T00:00:00Z",,,,18360,,,,139946,,,,15875,1795,14071,,,,,"19",657,3865,139526,4522,139526,,13,0,"48f5cf3dd89c605869c6022c7a2f0e3efca22932",0,0,0,0,0,""
20200526,"IA",17703,,117301,,"posNeg",135004,379,,115,,65,,9791,"5/26/2020 00:00","2020-05-26T00:00:00Z","05/25 20:00",478,,,"2020-05-26T00:00:00Z",,,,17703,,,,135307,,,,15597,1787,13806,,,,,"19",126,2163,135004,2289,135004,,19,0,"95642778451b9dd98f59938ccf8bc0e18f060432",0,0,0,0,0,""
20200525,"IA",17577,,115138,,"posNeg",132715,377,,118,,66,,9377,"5/25/2020 00:00","2020-05-25T00:00:00Z","05/24 20:00",459,,,"2020-05-25T00:00:00Z",,,,17252,,,,133046,,,,15504,1786,13714,,,,,"19",325,4634,132715,4959,132715,,5,0,"ade9c5563812cf2bcc5ac8134439a0e9956ee304",0,0,0,0,0,""
20200524,"IA",17252,,110504,,"posNeg",127756,363,,114,,61,,9318,"5/24/2020 00:00","2020-05-24T00:00:00Z","05/23 20:00",454,,,"2020-05-24T00:00:00Z",,,,17252,,,,128040,,,,15219,1772,13443,,,,,"19",359,3456,127756,3815,127756,,10,0,"5d325d5086d021d4d4eb93ca5cf2e1c44737e88c",0,0,0,0,0,""
20200523,"IA",16893,,107048,,"posNeg",123941,362,,111,,70,,9254,"5/23/2020 00:00","2020-05-23T00:00:00Z","05/22 20:00",444,,,"2020-05-23T00:00:00Z",,,,16893,,,,124214,,,,14560,1757,12799,,,,,"19",389,3302,123941,3691,123941,,19,0,"aed9fa87fb624c9a5622243ecaf0e6381ae6b68c",0,0,0,0,0,""
20200522,"IA",16504,,103746,,"posNeg",120250,362,,123,,79,,9079,"5/22/2020 00:00","2020-05-22T00:00:00Z","05/21 20:00",425,,,"2020-05-22T00:00:00Z",,,,16504,,,,120514,,,,13818,1725,12090,,,,,"19",334,3351,120250,3685,120250,,19,0,"bd2b845206bcb30a4b2e09d936f4bfe6aa6fa509",0,0,0,0,0,""
20200521,"IA",16170,,100395,,"posNeg",116565,376,,125,,80,,8672,"5/21/2020 00:00","2020-05-21T00:00:00Z","05/20 20:00",406,,,"2020-05-21T00:00:00Z",,,,16170,,,,116828,,,,13622,1711,11908,,,,,"19",556,5261,116565,5817,116565,,18,0,"304ff8da58cabfe6f830d8be57ca3f449c0705e7",0,0,0,0,0,""
20200520,"IA",15614,,95134,,"posNeg",110748,381,,126,,84,,8362,"5/20/2020 00:00","2020-05-20T00:00:00Z","05/19 20:00",388,,,"2020-05-20T00:00:00Z",,,,15614,,,,111007,,,,13004,1696,11304,,,,,"19",265,2835,110748,3100,110748,,16,0,"6901ab68df4af42b51575cb37b4d47425b0ebcbc",0,0,0,0,0,""
20200519,"IA",15349,,92299,,"posNeg",107648,383,,126,,83,,8130,"5/19/2020 00:00","2020-05-19T00:00:00Z","05/18 20:00",372,,,"2020-05-19T00:00:00Z",,,,15349,,,,107648,,,,12404,1683,10718,,,,,"19",394,4106,107648,4500,107648,,17,0,"e24fbccfa73d6986dda3d9be1f6a65604d16d832",0,0,0,0,0,""
20200518,"IA",14955,,88193,,"posNeg",103148,382,,121,,85,,7324,"5/17/2020 13:00","2020-05-17T13:00:00Z","05/17 09:00",355,,,"2020-05-17T13:00:00Z",,,,14955,,,,103148,,,,,,,,,,,"19",304,2603,103148,2907,103148,,4,0,"d97aa53f9f5912ebd9d7dd130a8f4134804e5e62",0,0,0,0,0,""
20200517,"IA",14651,,85590,,"posNeg",100241,376,,124,,85,,7154,"5/16/2020 13:00","2020-05-16T13:00:00Z","05/16 09:00",351,,,"2020-05-16T13:00:00Z",,,,14651,,,,100241,,,,,,,,,,,"19",323,3618,100241,3941,100241,,5,0,"35b4c2430f73750f0ea8eb1ad7f4c56d43ef3e86",0,0,0,0,0,""
20200516,"IA",14328,,81972,,"posNeg",96300,387,,128,,83,,6927,"5/15/2020 00:00","2020-05-15T00:00:00Z","05/14 20:00",346,,,"2020-05-15T00:00:00Z",,,,14328,,,,96300,,,,,,,,,,,"19",279,2455,96300,2734,96300,,10,0,"a3037e9f2eaed9f85f5f4d934a35a6113ba68d29",0,0,0,0,0,""
20200515,"IA",14049,,79517,,"posNeg",93566,387,,130,,87,,6561,"5/14/2020 00:00","2020-05-14T00:00:00Z","05/13 20:00",336,,,"2020-05-14T00:00:00Z",,,,14049,,,,93566,,,,,,,,,,,"19",374,3898,93566,4272,93566,,18,0,"0bac9010bcc3cb3768f6de446c99a23e96dece9e",0,0,0,0,0,""
20200514,"IA",13675,,75619,,"posNeg",89294,405,,134,,93,,6231,"5/13/2020 00:00","2020-05-13T00:00:00Z","05/12 20:00",318,,,"2020-05-13T00:00:00Z",,,,13675,,,,85719,,,,,,,,,,,"19",386,3189,89294,3575,89294,,12,0,"d8deadebfafb73073cc8f2d90ad501e07766113b",0,0,0,0,0,""
20200513,"IA",13289,,72430,,"posNeg",85719,388,,133,,101,,5954,"5/12/2020 00:00","2020-05-12T00:00:00Z","05/11 20:00",306,,,"2020-05-12T00:00:00Z",,,,13289,,,,81288,,,,,,,,,,,"19",377,4054,85719,4431,85719,,17,0,"338dfa3e631b8399eb41ecf2ad11bb89fb2f69d7",0,0,0,0,0,""
20200512,"IA",12912,,68376,,"posNeg",81288,385,,143,,101,,5618,"5/12/2020 00:00","2020-05-12T00:00:00Z","05/11 20:00",289,,,"2020-05-12T00:00:00Z",,,,12912,,,,,,,,,,,,,,,"19",539,2957,81288,3496,81288,,18,0,"62e2532fc32558f11a6274b44e852e37e8880c70",0,0,0,0,0,""
20200511,"IA",12373,,65419,,"posNeg",77792,394,,152,,107,,5249,"5/11/2020 00:00","2020-05-11T00:00:00Z","05/10 20:00",271,,,"2020-05-11T00:00:00Z",,,,12373,,,,,,,,,,,,,,,"19",414,3204,77792,3618,77792,,6,0,"78a7152260e512edde7a01b7fea184fa1940f9a5",0,0,0,0,0,""
20200510,"IA",11959,,62215,,"posNeg",74174,413,,157,,105,,5154,"5/10/2020 00:00","2020-05-10T00:00:00Z","05/09 20:00",265,,,"2020-05-10T00:00:00Z",,,,11959,,,,,,,,,,,,,,,"19",288,2410,74174,2698,74174,,13,0,"44c8b0e936b5caa10504fe4174d039d17b3c9326",0,0,0,0,0,""
20200509,"IA",11671,,59805,,"posNeg",71476,402,,161,,106,,5011,"5/8/2020 00:00","2020-05-08T00:00:00Z","05/07 20:00",252,,,"2020-05-08T00:00:00Z",,,,11671,,,,,,,,,,,,,,,"19",214,1001,71476,1215,71476,,9,0,"eb32191c7cf92818fb001403c8c6d0d40e5d5a55",0,0,0,0,0,""
20200508,"IA",11457,,58804,,"posNeg",70261,407,,164,,109,,4685,"5/7/2020 00:00","2020-05-07T00:00:00Z","05/06 20:00",243,,,"2020-05-07T00:00:00Z",,,,11457,,,,,,,,,,,,,,,"19",398,3436,70261,3834,70261,,12,0,"1606a46f79ffc4dc382c57f2a0249c773afb27ea",0,0,0,0,0,""
20200507,"IA",11059,,55368,,"posNeg",66427,417,,151,,107,,4266,"5/6/2020 12:00","2020-05-06T12:00:00Z","05/06 08:00",231,,,"2020-05-06T12:00:00Z",,,,11059,,,,,,,,,,,,,,,"19",655,2601,66427,3256,66427,,12,0,"fe60a86993e27ec6b6d905081a14301167951a85",0,0,0,0,0,""
20200506,"IA",10404,,52767,,"posNeg",63171,414,,151,,103,,3803,"5/5/2020 12:00","2020-05-05T12:00:00Z","05/05 08:00",219,,,"2020-05-05T12:00:00Z",,,,10404,,,,,,,,,,,,,,,"19",293,2309,63171,2602,63171,,12,0,"5b2bec438ffcc913d18bfb46ddcdafb55052aef8",0,0,0,0,0,""
20200505,"IA",10111,,50458,,"posNeg",60569,407,,152,,94,,3572,"5/4/2020 12:00","2020-05-04T12:00:00Z","05/04 08:00",207,,,"2020-05-04T12:00:00Z",,,,10111,,,,,,,,,,,,,,,"19",408,3000,60569,3408,60569,,19,0,"71951fa4b0039bb84101b7e0967e85b5f53f2161",0,0,0,0,0,""
20200504,"IA",9703,,47458,,"posNeg",57161,389,,143,,93,,3486,"5/3/2020 12:00","2020-05-03T12:00:00Z","05/03 08:00",188,,,"2020-05-03T12:00:00Z",,,,9703,,,,,,,,,,,,,,,"19",534,3441,57161,3975,57161,,4,0,"625af04bc80b72812f4b8d11e72d6a020b7734ad",0,0,0,0,0,""
20200503,"IA",9169,,44017,,"posNeg",53186,378,,133,,93,,3325,"5/2/2020 12:00","2020-05-02T12:00:00Z","05/02 08:00",184,,,"2020-05-02T12:00:00Z",,,,9169,,,,,,,,,,,,,,,"19",528,6309,53186,6837,53186,,9,0,"002ac28c4035431beafe2706854d93dc0de5c973",0,0,0,0,0,""
20200502,"IA",8641,,37708,,"posNeg",46349,353,,131,,90,,3156,"5/1/2020 12:00","2020-05-01T12:00:00Z","05/01 08:00",175,,,"2020-05-01T12:00:00Z",,,,8641,,,,,,,,,,,,,,,"19",757,0,46349,757,46349,,5,0,"b955ad06f8a9c38f3cc74e782c53b83c0d324ad5",0,0,0,0,0,""
20200501,"IA",7884,,37708,,"posNeg",45592,345,,121,,91,,2899,"4/30/2020 12:00","2020-04-30T12:00:00Z","04/30 08:00",170,,,"2020-04-30T12:00:00Z",,,,7884,,,,,,,,,,,,,,,"19",739,2186,45592,2925,45592,,8,0,"5bd2bcd64a975757c6bafab00af308248188b9fa",0,0,0,0,0,""
20200430,"IA",7145,,35522,,"posNeg",42667,335,,121,,86,,2697,"4/29/2020 12:00","2020-04-29T12:00:00Z","04/29 08:00",162,,,"2020-04-29T12:00:00Z",,,,7145,,,,,,,,,,,,,,,"19",302,1028,42667,1330,42667,,14,0,"f25b1047fe404bf9a107b470c7ad15a0f71f5974",0,0,0,0,0,""
20200429,"IA",6843,,34494,,"posNeg",41337,323,,100,,74,,2428,"4/28/2020 12:00","2020-04-28T12:00:00Z","04/28 08:00",148,,,"2020-04-28T12:00:00Z",,,,6843,,,,,,,,,,,,,,,"19",467,1047,41337,1514,41337,,12,0,"9ddab73054b99615b2f08f179067bf51582cb880",0,0,0,0,0,""
20200428,"IA",6376,,33447,,"posNeg",39823,304,,98,,64,,2164,"4/27/2020 12:00","2020-04-27T12:00:00Z","04/27 08:00",136,,,"2020-04-27T12:00:00Z",,,,6376,,,,,,,,,,,,,,,"19",508,1165,39823,1673,39823,,9,0,"741ea7dbbe80e32616bc0022abb4c2847d14a6ad",0,0,0,0,0,""
20200427,"IA",5868,,32282,,"posNeg",38150,300,,100,,58,,2021,"4/25/2020 12:00","2020-04-25T12:00:00Z","04/25 08:00",127,,,"2020-04-25T12:00:00Z",,,,5868,,,,,,,,,,,,,,,"19",392,1668,38150,2060,38150,,9,0,"229b97c8d8901572a9d39e3c9cc28a3d5504005c",0,0,0,0,0,""
20200426,"IA",5476,,30614,,"posNeg",36090,286,,99,,55,,1900,"4/25/2020 12:00","2020-04-25T12:00:00Z","04/25 08:00",118,,,"2020-04-25T12:00:00Z",,,,5476,,,,,,,,,,,,,,,"19",384,1356,36090,1740,36090,,6,0,"03b6bd6ecef570f457c0370dc3893c3bf14b3731",0,0,0,0,0,""
20200425,"IA",5092,,29258,,"posNeg",34350,293,,108,,60,,1723,"4/24/2020 12:00","2020-04-24T12:00:00Z","04/24 08:00",112,,,"2020-04-24T12:00:00Z",,,,5092,,,,,,,,,,,,,,,"19",647,1730,34350,2377,34350,,5,0,"f902d08689151e8460bda3960dcc464f9d866499",0,0,0,0,0,""
20200424,"IA",4445,,27528,,"posNeg",31973,278,,104,,60,,1604,"4/23/2020 12:00","2020-04-23T12:00:00Z","04/23 08:00",107,,,"2020-04-23T12:00:00Z",,,,4445,,,,,,,,,,,,,,,"19",521,2190,31973,2711,31973,,11,0,"165d56882697aeca23b627f487536b11d413b495",0,0,0,0,0,""
20200423,"IA",3924,,25338,,"posNeg",29262,282,,102,,55,,1492,"4/22/2020 12:00","2020-04-22T12:00:00Z","04/22 08:00",96,,,"2020-04-22T12:00:00Z",,,,3924,,,,,,,,,,,,,,,"19",176,842,29262,1018,29262,,6,0,"86531b166d50a750d37ceb76ad6fb8ffb5ae602a",0,0,0,0,0,""
20200422,"IA",3748,,24496,,"posNeg",28244,272,,92,,57,,1428,"4/21/2020 12:00","2020-04-21T12:00:00Z","04/21 08:00",90,,,"2020-04-21T12:00:00Z",,,,3748,,,,,,,,,,,,,,,"19",107,522,28244,629,28244,,7,0,"dce0fe763af0165c86c321c6cf991291d559d7f9",0,0,0,0,0,""
20200421,"IA",3641,,23974,,"posNeg",27615,214,,89,,60,,1293,"4/20/2020 12:00","2020-04-20T12:00:00Z","04/20 08:00",83,,,"2020-04-20T12:00:00Z",,,,3641,,,,,,,,,,,,,,,"19",482,1313,27615,1795,27615,,4,0,"0e43cff4ca25320b21ca1a4ec647baf87b837894",0,0,0,0,0,""
20200420,"IA",3159,,22661,,"posNeg",25820,214,,91,,58,,1235,"4/19/2020 12:00","2020-04-19T12:00:00Z","04/19 08:00",79,,,"2020-04-19T12:00:00Z",,,,3159,,,,,,,,,,,,,,,"19",257,1013,25820,1270,25820,,4,0,"da052e959ec0d52e102fce126d29b0e61aa8356b",0,0,0,0,0,""
20200419,"IA",2902,,21648,,"posNeg",24550,198,,86,,54,,1171,"4/18/2020 12:00","2020-04-18T12:00:00Z","04/18 08:00",75,,,"2020-04-18T12:00:00Z",,,,2902,,,,,,,,,,,,,,,"19",389,1214,24550,1603,24550,,1,0,"f26c5175f70856a0b06d86d1ef5398e6b4ed7cae",0,0,0,0,0,""
20200418,"IA",2513,,20434,,"posNeg",22947,193,,84,,51,,1095,"4/17/2020 12:00","2020-04-17T12:00:00Z","04/17 08:00",74,,,"2020-04-17T12:00:00Z",,,,2513,,,,,,,,,,,,,,,"19",181,974,22947,1155,22947,,10,0,"45e97409ae81fa33fd06aa08c2b2f93708911712",0,0,0,0,0,""
20200417,"IA",2332,,19460,,"posNeg",21792,183,,88,,52,,1007,"4/16/2020 12:00","2020-04-16T12:00:00Z","04/16 08:00",64,,,"2020-04-16T12:00:00Z",,,,2332,,,,,,,,,,,,,,,"19",191,926,21792,1117,21792,,4,0,"eb091f9b9297d3573f2465384837f500464bd391",0,0,0,0,0,""
20200416,"IA",2141,,18534,,"posNeg",20675,175,,84,,48,,987,"4/15/2020 12:00","2020-04-15T12:00:00Z","04/15 08:00",60,,,"2020-04-15T12:00:00Z",,,,2141,,,,,,,,,,,,,,,"19",146,660,20675,806,20675,,7,0,"bf52222174c9ca2dd9a4a461a4b9e9681f197ee3",0,0,0,0,0,""
20200415,"IA",1995,,17874,,"posNeg",19869,171,,78,,43,,908,"4/14/2020 12:00","2020-04-14T12:00:00Z","04/14 08:00",53,,,"2020-04-14T12:00:00Z",,,,1995,,,,,,,,,,,,,,,"19",96,888,19869,984,19869,,4,0,"e1df19a92c8cf39f295f68507ee5ada8bb3b33ad",0,0,0,0,0,""
