"date","state","positive","probableCases","negative","pending","totalTestResultsSource","totalTestResults","hospitalizedCurrently","hospitalizedCumulative","inIcuCurrently","inIcuCumulative","onVentilatorCurrently","onVentilatorCumulative","recovered","lastUpdateEt","dateModified","checkTimeEt","death","hospitalized","hospitalizedDischarged","dateChecked","totalTestsViral","positiveTestsViral","negativeTestsViral","positiveCasesViral","deathConfirmed","deathProbable","totalTestEncountersViral","totalTestsPeopleViral","totalTestsAntibody","positiveTestsAntibody","negativeTestsAntibody","totalTestsPeopleAntibody","positiveTestsPeopleAntibody","negativeTestsPeopleAntibody","totalTestsPeopleAntigen","positiveTestsPeopleAntigen","totalTestsAntigen","positiveTestsAntigen","fips","positiveIncrease","negativeIncrease","total","totalTestResultsIncrease","posNeg","dataQualityGrade","deathIncrease","hospitalizedIncrease","hash","commercialScore","negativeRegularScore","negativeScore","positiveScore","score","grade"
20210307,"ID",172931,33057,505964,,"totalTestsPeopleViral",645838,150,7184,33,1245,,,96017,"3/6/2021 19:00","2021-03-06T19:00:00Z","03/06 14:00",1879,7184,,"2021-03-06T19:00:00Z",1103725,,,139874,1652,227,,645838,,,,,,,,,123809,,"16",104,535,678895,396,678895,,3,5,"78595a6705d321c83cba079dbee71b6db1897502",0,0,0,0,0,""
20210306,"ID",172827,32814,505429,,"totalTestsPeopleViral",645442,150,7179,33,1245,,,95808,"3/5/2021 19:02","2021-03-05T19:02:00Z","03/05 14:02",1876,7179,,"2021-03-05T19:02:00Z",1102848,,,140013,1649,227,,645442,,,,,,,,,123809,,"16",240,504,678256,646,678256,,0,15,"35d8f1d09c758c9e752bbc38a6481a8d7608b9c6",0,0,0,0,0,""
20210305,"ID",172587,32716,504925,,"totalTestsPeopleViral",644796,139,7164,32,1242,,,95524,"3/5/2021 11:34","2021-03-05T11:34:00Z","03/05 06:34",1876,7164,,"2021-03-05T11:34:00Z",1100276,,,139871,1649,227,,644796,,,,,,,,,123809,,"16",299,1234,677512,1438,677512,,0,20,"90b36aabf6016cfef8d9282e4ab91eba6e5ae206",0,0,0,0,0,""
20210304,"ID",172288,32621,503691,,"totalTestsPeopleViral",643358,139,7144,32,1241,,,95222,"3/3/2021 19:25","2021-03-03T19:25:00Z","03/03 14:25",1876,7144,,"2021-03-03T19:25:00Z",1096824,,,139667,1649,227,,643358,,,,,,,,,123809,,"16",452,1096,675979,1441,675979,,5,13,"e2f9a0ba7e0b3a0a2fa7bd369970320bad2a47a9",0,0,0,0,0,""
20210303,"ID",171836,32514,502595,,"totalTestsPeopleViral",641917,121,7131,32,1239,,,94936,"3/3/2021 10:59","2021-03-03T10:59:00Z","03/03 05:59",1871,7131,,"2021-03-03T10:59:00Z",1092871,,,139322,1645,226,,641917,,,,,,,,,123809,,"16",374,1239,674431,1505,674431,,4,20,"89eca05f6b3d98f1dff0376399a19fdc0b00f3da",0,0,0,0,0,""
20210302,"ID",171462,32406,501356,,"totalTestsPeopleViral",640412,121,7111,32,1234,,,94707,"3/1/2021 19:04","2021-03-01T19:04:00Z","03/01 14:04",1867,7111,,"2021-03-01T19:04:00Z",1088968,,,139056,1641,226,,640412,,,,,,,,,123809,,"16",322,1260,672818,1493,672818,,7,35,"3ec59adbcf1d7f94ee1b6b3c0cc32643334d84f2",0,0,0,0,0,""
20210301,"ID",171140,32317,500096,,"totalTestsPeopleViral",638919,162,7076,35,1231,,,94230,"2/27/2021 19:06","2021-02-27T19:06:00Z","02/27 14:06",1860,7076,,"2021-02-27T19:06:00Z",1083384,,,138823,1634,226,,638919,,,,,,,,,123809,,"16",0,0,671236,0,671236,,0,0,"ed541174e3aaa95276628cfa039c6a4182164f3a",0,0,0,0,0,""
20210228,"ID",171140,32317,500096,,"totalTestsPeopleViral",638919,162,7076,35,1231,,,94230,"2/27/2021 19:06","2021-02-27T19:06:00Z","02/27 14:06",1860,7076,,"2021-02-27T19:06:00Z",1083384,,,138823,1634,226,,638919,,,,,,,,,123809,,"16",233,865,671236,1036,671236,,1,11,"e72f2a54a0ccc1e04e3c175a7075d049ee555c3c",0,0,0,0,0,""
20210227,"ID",170907,32255,499231,,"totalTestsPeopleViral",637883,162,7065,35,1229,,,93975,"2/26/2021 19:53","2021-02-26T19:53:00Z","02/26 14:53",1859,7065,,"2021-02-26T19:53:00Z",1080708,,,138652,1633,226,,637883,,,,,,,,,123809,,"16",312,1131,670138,1350,670138,,9,8,"48774a6afb3710b2b893aabc1a8d789ee76de3d3",0,0,0,0,0,""
20210226,"ID",170595,32162,498100,,"totalTestsPeopleViral",636533,143,7057,38,1228,,,93679,"2/25/2021 19:08","2021-02-25T19:08:00Z","02/25 14:08",1850,7057,,"2021-02-25T19:08:00Z",1075256,,,138433,1628,222,,636533,,,,,,,,,123809,,"16",306,1037,668695,1219,668695,,10,13,"2faa43f0de29f0fd2dc5b646b283992b8e371f71",0,0,0,0,0,""
20210225,"ID",170289,32038,497063,,"totalTestsPeopleViral",635314,143,7044,38,1229,,,93252,"2/25/2021 15:48","2021-02-25T15:48:00Z","02/25 10:48",1840,7044,,"2021-02-25T15:48:00Z",1070527,,,138251,1620,220,,635314,,,,,,,,,123809,,"16",423,1212,667352,1456,667352,,0,11,"66989ea1e0a17d2167d35b75e6b8c9363f8dfbd7",0,0,0,0,0,""
20210224,"ID",169866,31859,495851,,"totalTestsPeopleViral",633858,110,7033,25,1227,,,92859,"2/23/2021 19:00","2021-02-23T19:00:00Z","02/23 14:00",1840,7033,,"2021-02-23T19:00:00Z",1066095,,,138007,1620,220,,633858,,,,,,,,,123809,,"16",282,1078,665717,1297,665717,,14,26,"250773c2c22ee225c9d5bc25bb7cd7c27a43fa29",0,0,0,0,0,""
20210223,"ID",169584,31796,494773,,"totalTestsPeopleViral",632561,110,7007,25,1224,,,92573,"2/22/2021 19:00","2021-02-22T19:00:00Z","02/22 14:00",1826,7007,,"2021-02-22T19:00:00Z",1062630,,,137788,1607,219,,632561,,,,,,,,,123809,,"16",434,1479,664357,1837,664357,,0,24,"48b04558f796b4ab20a5ea2742adfaa8685e5e66",0,0,0,0,0,""
20210222,"ID",169150,31720,493294,,"totalTestsPeopleViral",630724,142,6983,37,1220,,,91926,"2/20/2021 19:00","2021-02-20T19:00:00Z","02/20 14:00",1826,6983,,"2021-02-20T19:00:00Z",1059842,,,137430,1607,219,,630724,,,,,,,,,123809,,"16",0,0,662444,0,662444,,0,0,"267e723130f8012c9b97f4d637afedca5d4d71b5",0,0,0,0,0,""
20210221,"ID",169150,31720,493294,,"totalTestsPeopleViral",630724,142,6983,37,1220,,,91926,"2/20/2021 19:00","2021-02-20T19:00:00Z","02/20 14:00",1826,6983,,"2021-02-20T19:00:00Z",1059842,,,137430,1607,219,,630724,,,,,,,,,123809,,"16",197,926,662444,1077,662444,,0,10,"0f1b4b8d84de7ce24683d43d9bed041d9138cdbe",0,0,0,0,0,""
20210220,"ID",168953,31674,492368,,"totalTestsPeopleViral",629647,142,6973,37,1219,,,91637,"2/19/2021 19:00","2021-02-19T19:00:00Z","02/19 14:00",1826,6973,,"2021-02-19T19:00:00Z",1056739,,,137279,1607,219,,629647,,,,,,,,,123809,,"16",314,1105,661321,1380,661321,,0,9,"5c29ec8a65250947dfedf93d8b47ac9a2b01fa0d",0,0,0,0,0,""
20210219,"ID",168639,31635,491263,,"totalTestsPeopleViral",628267,164,6964,37,1218,,,91241,"2/18/2021 19:00","2021-02-18T19:00:00Z","02/18 14:00",1826,6964,,"2021-02-18T19:00:00Z",1052070,,,137004,1607,219,,628267,,,,,,,,,123809,,"16",286,1397,659902,1591,659902,,9,17,"aadf33735b78513046fa074f756c77b75af342d3",0,0,0,0,0,""
20210218,"ID",168353,31543,489866,,"totalTestsPeopleViral",626676,164,6947,37,1214,,,90706,"2/17/2021 19:00","2021-02-17T19:00:00Z","02/17 14:00",1817,6947,,"2021-02-17T19:00:00Z",1047880,,,136810,1600,217,,626676,,,,,,,,,78973,,"16",408,1060,658219,1357,658219,,11,14,"52f9ac74974bfb9073ccdb8cd75790b7ea4a8ccc",0,0,0,0,0,""
20210217,"ID",167945,31432,488806,,"totalTestsPeopleViral",625319,177,6933,38,1206,,,90300,"2/16/2021 19:00","2021-02-16T19:00:00Z","02/16 14:00",1806,6933,,"2021-02-16T19:00:00Z",1043924,,,136513,1589,217,,625319,,,,,,,,,78973,,"16",462,2602,656751,2966,656751,,3,43,"ba6db79e922e6a879aa8234057978c4314d41df9",0,0,0,0,0,""
20210216,"ID",167483,31334,486204,,"totalTestsPeopleViral",622353,180,6890,45,1206,,,89410,"2/14/2021 19:00","2021-02-14T19:00:00Z","02/14 14:00",1803,6890,,"2021-02-14T19:00:00Z",1035119,,,136149,1587,216,,622353,,,,,,,,,78973,,"16",0,0,653687,0,653687,,0,0,"786e02ff47be8fe4ca2f8e34dae4fb2fcb40d692",0,0,0,0,0,""
20210215,"ID",167483,31334,486204,,"totalTestsPeopleViral",622353,180,6890,45,1206,,,89410,"2/14/2021 19:00","2021-02-14T19:00:00Z","02/14 14:00",1803,6890,,"2021-02-14T19:00:00Z",1035119,,,136149,1587,216,,622353,,,,,,,,,78973,,"16",0,0,653687,0,653687,,0,0,"281581faa343c2636fa68213f3d7a095977091ba",0,0,0,0,0,""
20210214,"ID",167483,31334,486204,,"totalTestsPeopleViral",622353,180,6890,45,1206,,,89410,"2/13/2021 19:00","2021-02-13T19:00:00Z","02/13 14:00",1803,6890,,"2021-02-13T19:00:00Z",1035119,,,136149,1587,216,,622353,,,,,,,,,78973,,"16",258,726,653687,926,653687,,7,15,"836983696463c63c188a3bba6b72ddc0bac69fce",0,0,0,0,0,""
20210213,"ID",167225,31276,485478,,"totalTestsPeopleViral",621427,180,6875,45,1204,,,89126,"2/12/2021 19:00","2021-02-12T19:00:00Z","02/12 14:00",1796,6875,,"2021-02-12T19:00:00Z",1032823,,,135949,1582,214,,621427,,,,,,,,,78973,,"16",349,1246,652703,1484,652703,,5,23,"2e927955fb87fd54aa5176b6b319082a6834c503",0,0,0,0,0,""
20210212,"ID",166876,31165,484232,,"totalTestsPeopleViral",619943,176,6852,37,1201,,,88672,"2/11/2021 19:00","2021-02-11T19:00:00Z","02/11 14:00",1791,6852,,"2021-02-11T19:00:00Z",1027856,,,135711,1577,214,,619943,,,,,,,,,78973,,"16",323,1472,651108,1720,651108,,0,14,"2f5661f4047770d78f2c1c28bb990b6e5da0a6f1",0,0,0,0,0,""
20210211,"ID",166553,31090,482760,,"totalTestsPeopleViral",618223,176,6838,37,1199,,,88126,"2/10/2021 19:00","2021-02-10T19:00:00Z","02/10 14:00",1791,6838,,"2021-02-10T19:00:00Z",1022527,,,135463,1577,214,,618223,,,,,,,,,78973,,"16",458,1021,649313,1366,649313,,11,-1,"a17710ff814d2ab15d1f3ecd69021639f44e526e",0,0,0,0,0,""
20210210,"ID",166095,30977,481739,,"totalTestsPeopleViral",616857,178,6839,39,1194,,,87505,"2/9/2021 19:00","2021-02-09T19:00:00Z","02/09 14:00",1780,6839,,"2021-02-09T19:00:00Z",1018052,,,135118,1567,213,,616857,,,,,,,,,78973,,"16",437,1287,647834,1587,647834,,4,20,"44c2792b3c648ecf594bf5422f9984990d724e74",0,0,0,0,0,""
20210209,"ID",165658,30840,480452,,"totalTestsPeopleViral",615270,178,6819,39,1191,,,86880,"2/8/2021 19:00","2021-02-08T19:00:00Z","02/08 14:00",1776,6819,,"2021-02-08T19:00:00Z",1018052,,,134818,1562,214,,615270,,,,,,,,,78973,,"16",449,1685,646110,2060,646110,,9,26,"a0ce339eeeb57f9a5a18dbce55169cee8468785e",0,0,0,0,0,""
20210208,"ID",165209,30766,478767,,"totalTestsPeopleViral",613210,207,6793,41,1184,,,86078,"2/6/2021 19:00","2021-02-06T19:00:00Z","02/06 14:00",1767,6793,,"2021-02-06T19:00:00Z",1014556,,,134443,1553,214,,613210,,,,,,,,,78973,,"16",0,0,643976,0,643976,,0,0,"89b111d544fe0d697550c4074019cac3f051f149",0,0,0,0,0,""
20210207,"ID",165209,30766,478767,,"totalTestsPeopleViral",613210,207,6793,41,1184,,,86078,"2/6/2021 19:00","2021-02-06T19:00:00Z","02/06 14:00",1767,6793,,"2021-02-06T19:00:00Z",1014556,,,134443,1553,214,,613210,,,,,,,,,78973,,"16",240,951,643976,1129,643976,,9,8,"6985c857a373574f296792f88242291d640e66c7",0,0,0,0,0,""
20210206,"ID",164969,30704,477816,,"totalTestsPeopleViral",612081,199,6785,41,1184,,,85439,"2/5/2021 19:00","2021-02-05T19:00:00Z","02/05 14:00",1758,6785,,"2021-02-05T19:00:00Z",1011836,,,134265,1544,214,,612081,,,,,,,,,78973,,"16",404,1119,642785,1445,642785,,11,14,"83dcb049bdaa44748584894c27d8309ac45ea374",0,0,0,0,0,""
20210205,"ID",164565,30626,476697,,"totalTestsPeopleViral",610636,203,6771,47,1183,,,84824,"2/4/2021 19:00","2021-02-04T19:00:00Z","02/04 14:00",1747,6771,,"2021-02-04T19:00:00Z",1007899,,,133939,1533,214,,610636,,,,,,,,,78973,,"16",402,1432,641262,1740,641262,,-1,22,"c7ee0137083f794c2b83a5432b02971409fee370",0,0,0,0,0,""
20210204,"ID",164163,30532,475265,,"totalTestsPeopleViral",608896,203,6749,47,1181,,,84159,"2/3/2021 19:00","2021-02-03T19:00:00Z","02/03 14:00",1748,6749,,"2021-02-03T19:00:00Z",1002998,,,133631,1534,214,,608896,,,,,,,,,78973,,"16",507,1388,639428,1781,639428,,7,17,"00d0efc1fc2f8a68037a435bfb6d3062ddaf007d",0,0,0,0,0,""
20210203,"ID",163656,30418,473877,,"totalTestsPeopleViral",607115,157,6732,46,1176,,,83336,"2/2/2021 19:00","2021-02-02T19:00:00Z","02/02 14:00",1741,6732,,"2021-02-02T19:00:00Z",997625,,,133238,1527,214,,607115,,,,,,,,,78973,,"16",491,1498,637533,1878,637533,,6,30,"9e01f532a7d539e44c021ec53ac26d1f40587a84",0,0,0,0,0,""
20210202,"ID",163165,30307,472379,,"totalTestsPeopleViral",605237,157,6702,46,1172,,,82721,"2/1/2021 19:00","2021-02-01T19:00:00Z","02/01 14:00",1735,6702,,"2021-02-01T19:00:00Z",993978,,,132858,1522,213,,605237,,,,,,,,,78973,,"16",482,1742,635544,2122,635544,,10,28,"f86ccb187d8824688c93b5bcb1520315ebf90702",0,0,0,0,0,""
20210201,"ID",162683,30205,470637,,"totalTestsPeopleViral",603115,225,6674,57,1169,,,81591,"1/30/2021 19:00","2021-01-30T19:00:00Z","01/30 14:00",1725,6674,,"2021-01-30T19:00:00Z",990444,,,132478,1513,212,,603115,,,,,,,,,78973,,"16",0,0,633320,0,633320,,0,0,"bf85eb6e9a6b26c243f128f9b7c4e1679ee6f45c",0,0,0,0,0,""
20210131,"ID",162683,30205,470637,,"totalTestsPeopleViral",603115,225,6674,57,1169,,,81591,"1/30/2021 19:00","2021-01-30T19:00:00Z","01/30 14:00",1725,6674,,"2021-01-30T19:00:00Z",990444,,,132478,1513,212,,603115,,,,,,,,,78973,,"16",328,1208,633320,1469,633320,,0,15,"6335c937329f03735ef0e0d32194f0726d18fef3",0,0,0,0,0,""
20210130,"ID",162355,30138,469429,,"totalTestsPeopleViral",601646,225,6659,57,1165,,,81034,"1/29/2021 19:00","2021-01-29T19:00:00Z","01/29 14:00",1725,6659,,"2021-01-29T19:00:00Z",987111,,,132217,1513,212,,601646,,,,,,,,,78973,,"16",635,1475,631784,2010,631784,,4,30,"19320fede15a1fa769d93957858fc95576406e70",0,0,0,0,0,""
20210129,"ID",161720,30038,467954,,"totalTestsPeopleViral",599636,241,6629,64,1157,,,80252,"1/28/2021 19:00","2021-01-28T19:00:00Z","01/28 14:00",1721,6629,,"2021-01-28T19:00:00Z",981362,,,131682,1508,213,,599636,,,,,,,,,78973,,"16",508,1799,629674,2123,629674,,7,25,"a054d659c6e7832e13de15ea53475ce5598d4e6c",0,0,0,0,0,""
20210128,"ID",161212,29854,466155,,"totalTestsPeopleViral",597513,241,6604,64,1153,,,79298,"1/27/2021 19:00","2021-01-27T19:00:00Z","01/27 14:00",1714,6604,,"2021-01-27T19:00:00Z",975555,,,131358,1501,213,,597513,,,,,,,,,78973,,"16",620,1876,627367,2326,627367,,26,44,"cbfe6a0cd4ae3e5841a5908c748257031398b268",0,0,0,0,0,""
20210127,"ID",160592,29684,464279,,"totalTestsPeopleViral",595187,241,6560,64,1144,,,78246,"1/26/2021 19:00","2021-01-26T19:00:00Z","01/26 14:00",1688,6560,,"2021-01-26T19:00:00Z",970325,,,130908,1481,207,,595187,,,,,,,,,78973,,"16",559,2151,624871,2540,624871,,7,35,"a07ebcdebb594341d1b0e0aef88a04b95ad5068a",0,0,0,0,0,""
20210126,"ID",160033,29514,462128,,"totalTestsPeopleViral",592647,169,6525,53,1135,,,77351,"1/25/2021 19:00","2021-01-25T19:00:00Z","01/25 14:00",1681,6525,,"2021-01-25T19:00:00Z",966258,,,130519,1475,206,,592647,,,,,,,,,78973,,"16",527,1266,622161,1680,622161,,12,29,"154aa261fcfc30d01e680083c3a0ab7fca7088d9",0,0,0,0,0,""
20210125,"ID",159506,29401,460862,,"totalTestsPeopleViral",590967,252,6496,67,1129,,,76392,"1/24/2021 19:00","2021-01-24T19:00:00Z","01/24 14:00",1669,6496,,"2021-01-24T19:00:00Z",961106,,,130105,1464,205,,590967,,,,,,,,,78973,,"16",181,1188,620368,1338,620368,,1,15,"bdcb79b8682969b9bfb15fcedca52d8ac360ab0e",0,0,0,0,0,""
20210124,"ID",159325,29370,459674,,"totalTestsPeopleViral",589629,252,6481,67,1127,,,75752,"1/23/2021 19:00","2021-01-23T19:00:00Z","01/23 14:00",1668,6481,,"2021-01-23T19:00:00Z",958656,,,129955,1464,204,,589629,,,,,,,,,78973,,"16",527,1359,618999,1802,618999,,1,17,"fca23580718b09069ed2d44206f72d1466bfa067",0,0,0,0,0,""
20210123,"ID",158798,29286,458315,,"totalTestsPeopleViral",587827,252,6464,67,1127,,,75041,"1/22/2021 19:00","2021-01-22T19:00:00Z","01/22 14:00",1667,6464,,"2021-01-22T19:00:00Z",954658,,,129512,1462,205,,587827,,,,,,,,,78973,,"16",598,2019,617113,2468,617113,,13,24,"039321214928b0d0b614c6eb0c84193a05b4cfe0",0,0,0,0,0,""
20210122,"ID",158200,29137,456296,,"totalTestsPeopleViral",585359,286,6440,71,1125,,,74269,"1/21/2021 19:00","2021-01-21T19:00:00Z","01/21 14:00",1654,6440,,"2021-01-21T19:00:00Z",947759,,,129063,1452,202,,585359,,,,,,,,,78973,,"16",612,1488,614496,1918,614496,,19,34,"e7f505ac3cd67dca7d75263d0051f8ca0bcc071b",0,0,0,0,0,""
20210121,"ID",157588,28955,454808,,"totalTestsPeopleViral",583441,286,6406,71,1117,,,73517,"1/20/2021 19:00","2021-01-20T19:00:00Z","01/20 14:00",1635,6406,,"2021-01-20T19:00:00Z",942272,,,128633,1436,199,,583441,,,,,,,,,78973,,"16",810,1576,612396,2142,612396,,-2,36,"1ab93d735766f99922201dd8bbf2e22bce717f26",0,0,0,0,0,""
20210120,"ID",156778,28711,453232,,"totalTestsPeopleViral",581299,266,6370,77,1114,,,72711,"1/19/2021 19:00","2021-01-19T19:00:00Z","01/19 14:00",1637,6370,,"2021-01-19T19:00:00Z",937399,,,128067,1438,199,,581299,,,,,,,,,78973,,"16",1224,2386,610010,3361,610010,,30,63,"8372e259814113daab8d39fb156f8ba31632d28a",0,0,0,0,0,""
20210119,"ID",155554,28462,450846,,"totalTestsPeopleViral",577938,345,6307,90,1106,,,71374,"1/17/2021 19:00","2021-01-17T19:00:00Z","01/17 14:00",1607,6307,,"2021-01-17T19:00:00Z",929598,,,127092,1415,192,,577938,,,,,,,,,78973,,"16",0,0,606400,0,606400,,0,0,"2e11fb4667bcf219c2e289cb20bbfaf6bd9f0868",0,0,0,0,0,""
20210118,"ID",155554,28462,450846,,"totalTestsPeopleViral",577938,345,6307,90,1106,,,71374,"1/17/2021 19:00","2021-01-17T19:00:00Z","01/17 14:00",1607,6307,,"2021-01-17T19:00:00Z",929598,,,127092,1415,192,,577938,,,,,,,,,78973,,"16",278,1783,606400,1930,606400,,2,12,"271d585cdcead197f5146595a663e68a6850cb6e",0,0,0,0,0,""
20210117,"ID",155276,28331,449063,,"totalTestsPeopleViral",576008,345,6295,90,1103,,,70736,"1/16/2021 19:00","2021-01-16T19:00:00Z","01/16 14:00",1605,6295,,"2021-01-16T19:00:00Z",926337,,,126945,1414,191,,576008,,,,,,,,,78973,,"16",806,1197,604339,1720,604339,,2,26,"36889d9b4cc6dac65e5bcc145597e6524192b769",0,0,0,0,0,""
20210116,"ID",154470,28048,447866,,"totalTestsPeopleViral",574288,345,6269,90,1098,,,70163,"1/15/2021 19:00","2021-01-15T19:00:00Z","01/15 14:00",1603,6269,,"2021-01-15T19:00:00Z",923207,,,126422,1412,191,,574288,,,,,,,,,78973,,"16",1112,1804,602336,2475,602336,,12,44,"35ca641256f72fd44cf12678a36c288d073f590e",0,0,0,0,0,""
20210115,"ID",153358,27607,446062,,"totalTestsPeopleViral",571813,338,6225,88,1091,,,69460,"1/14/2021 19:00","2021-01-14T19:00:00Z","01/14 14:00",1591,6225,,"2021-01-14T19:00:00Z",917901,,,125751,1401,190,,571813,,,,,,,,,78973,,"16",994,1899,599420,2614,599420,,27,47,"008f7ec8310e0653ee14d4a94660f69fcf31eb13",0,0,0,0,0,""
20210114,"ID",152364,27328,444163,,"totalTestsPeopleViral",569199,338,6178,88,1084,,,68657,"1/13/2021 19:00","2021-01-13T19:00:00Z","01/13 14:00",1564,6178,,"2021-01-13T19:00:00Z",909722,,,125036,1378,186,,569199,,,,,,,,,78973,,"16",1091,2186,596527,2974,596527,,8,50,"b6cb4d04263795035548487f2fb04e779b94c462",0,0,0,0,0,""
20210113,"ID",151273,27025,441977,,"totalTestsPeopleViral",566225,283,6128,72,1076,,,67633,"1/12/2021 19:00","2021-01-12T19:00:00Z","01/12 14:00",1556,6128,,"2021-01-12T19:00:00Z",903361,,,124248,1373,183,,566225,,,,,,,,,78973,,"16",1034,779,593250,1510,593250,,12,49,"a8f062867197d476a61c5b0516eef5ad8862aa42",0,0,0,0,0,""
20210112,"ID",150239,26722,441198,,"totalTestsPeopleViral",564715,283,6079,72,1076,,,66796,"1/11/2021 19:00","2021-01-11T19:00:00Z","01/11 14:00",1544,6079,,"2021-01-11T19:00:00Z",899887,,,123517,1363,179,,564715,,,,,,,,,78973,,"16",572,1560,591437,2000,591437,,10,42,"e99c8145e69051e5a11024198b169ffd0604bdfa",0,0,0,0,0,""
20210111,"ID",149667,26590,439638,,"totalTestsPeopleViral",562715,375,6037,76,1074,,,66012,"1/10/2021 19:00","2021-01-10T19:00:00Z","01/10 14:00",1534,6037,,"2021-01-10T19:00:00Z",895449,,,123077,1355,179,,562715,,,,,,,,,78973,,"16",432,1067,589305,1408,589305,,6,22,"8aa3387b069d6069e3eaad035990605a11d9a3ef",0,0,0,0,0,""
20210110,"ID",149235,26499,438571,,"totalTestsPeopleViral",561307,375,6015,76,1070,,,64785,"1/9/2021 19:00","2021-01-09T19:00:00Z","01/09 14:00",1528,6015,,"2021-01-09T19:00:00Z",893010,,,122736,1349,179,,561307,,,,,,,,,78973,,"16",977,1154,587806,1936,587806,,5,20,"9b4b08312b3d660a85d4cef74af3dff4ff57bf20",0,0,0,0,0,""
20210109,"ID",148258,26304,437417,,"totalTestsPeopleViral",559371,375,5995,76,1062,,,64538,"1/8/2021 19:00","2021-01-08T19:00:00Z","01/08 14:00",1523,5995,,"2021-01-08T19:00:00Z",888716,,,121954,1344,179,,559371,,,,,,,,,78973,,"16",1085,1389,585675,2227,585675,,6,57,"16af56a2662477117d257b93fe98778b8775061d",0,0,0,0,0,""
20210108,"ID",147173,26057,436028,,"totalTestsPeopleViral",557144,366,5938,77,1055,,,63778,"1/7/2021 19:00","2021-01-07T19:00:00Z","01/07 14:00",1517,5938,,"2021-01-07T19:00:00Z",881852,,,121116,1339,178,,557144,,,,,,,,,78973,,"16",1067,2126,583201,2848,583201,,29,67,"b8c174af2c40f700d20e6012e9492d06a915d898",0,0,0,0,0,""
20210107,"ID",146106,25712,433902,,"totalTestsPeopleViral",554296,366,5871,77,1043,,,63097,"1/6/2021 19:00","2021-01-06T19:00:00Z","01/06 14:00",1488,5871,,"2021-01-06T19:00:00Z",876370,,,120394,1313,175,,554296,,,,,,,,,52274,,"16",1263,1337,580008,2270,580008,,17,47,"71bae0b971814db52b9e762bdb6e3ef8b8c28df6",0,0,0,0,0,""
20210106,"ID",144843,25382,432565,,"totalTestsPeopleViral",552026,254,5824,54,1040,,,62215,"1/5/2021 19:00","2021-01-05T19:00:00Z","01/05 14:00",1471,5824,,"2021-01-05T19:00:00Z",871888,,,119461,1298,173,,552026,,,,,,,,,52274,,"16",1538,735,577408,1718,577408,,12,79,"c8e2bb361b39df2072763e6c0d729d7f596e9692",0,0,0,0,0,""
20210105,"ID",143305,24827,431830,,"totalTestsPeopleViral",550308,254,5745,54,1036,,,61493,"1/4/2021 19:00","2021-01-04T19:00:00Z","01/04 14:00",1459,5745,,"2021-01-04T19:00:00Z",867462,,,118478,1290,169,,550308,,,,,,,,,52274,,"16",798,629,575135,1209,575135,,11,39,"4c31754e90fde4b7f1170482fc0466c503968ea0",0,0,0,0,0,""
20210104,"ID",142507,24609,431201,,"totalTestsPeopleViral",549099,352,5706,84,1030,,,60820,"1/3/2021 19:00","2021-01-03T19:00:00Z","01/03 14:00",1448,5706,,"2021-01-03T19:00:00Z",863660,,,117898,1281,167,,549099,,,,,,,,,52274,,"16",308,829,573708,1091,573708,,0,19,"de1e8cfe0c45601d4fe2766f6ba87e5a468defd6",0,0,0,0,0,""
20210103,"ID",142199,24563,430372,,"totalTestsPeopleViral",548008,352,5687,84,1024,,,60164,"1/2/2021 19:00","2021-01-02T19:00:00Z","01/02 14:00",1448,5687,,"2021-01-02T19:00:00Z",861643,,,117636,1281,167,,548008,,,,,,,,,52274,,"16",1122,1604,572571,2523,572571,,12,57,"a07dee66da3d165defb1cd91b9724a94dde54fed",0,0,0,0,0,""
20210102,"ID",141077,24360,428768,,"totalTestsPeopleViral",545485,375,5630,85,1018,,,58649,"12/31/2020 19:00","2020-12-31T19:00:00Z","12/31 14:00",1436,5630,,"2020-12-31T19:00:00Z",859851,,,116717,1269,167,,545485,,,,,,,,,52274,,"16",0,0,569845,0,569845,,0,0,"960072397c8bc8e545b90b728ce161a57ade2795",0,0,0,0,0,""
20210101,"ID",141077,24360,428768,,"totalTestsPeopleViral",545485,375,5630,85,1018,,,58649,"12/31/2020 19:00","2020-12-31T19:00:00Z","12/31 14:00",1436,5630,,"2020-12-31T19:00:00Z",859851,,,116717,1269,167,,545485,,,,,,,,,52274,,"16",1213,1350,569845,2217,569845,,33,63,"ecfb8d5ee5ff6e86d4e2781a793daaef935d6649",0,0,0,0,0,""
20201231,"ID",139864,24014,427418,,"totalTestsPeopleViral",543268,375,5567,85,1012,,,57770,"12/30/2020 19:00","2020-12-30T19:00:00Z","12/30 14:00",1403,5567,,"2020-12-30T19:00:00Z",855567,,,115850,1240,163,,543268,,,,,,,,,52274,,"16",1340,1781,567282,2798,567282,,10,48,"775eb72f7298eaeb2405d725771110e3b1e23728",0,0,0,0,0,""
20201230,"ID",138524,23691,425637,,"totalTestsPeopleViral",540470,280,5519,77,1003,,,56799,"12/29/2020 19:00","2020-12-29T19:00:00Z","12/29 14:00",1393,5519,,"2020-12-29T19:00:00Z",850169,,,114833,1232,161,,540470,,,,,,,,,52274,,"16",1514,492,564161,1590,564161,,16,43,"a9fc519f6144356cf95f46c60e8810a58f747697",0,0,0,0,0,""
20201229,"ID",137010,23275,425145,,"totalTestsPeopleViral",538880,280,5476,77,999,,,55959,"12/28/2020 19:00","2020-12-28T19:00:00Z","12/28 14:00",1377,5476,,"2020-12-28T19:00:00Z",846888,,,113735,1216,161,,538880,,,,,,,,,52274,,"16",795,778,562155,1344,562155,,23,51,"27cd5812c5b4472a2db5a8858d8b03505d0700f2",0,0,0,0,0,""
20201228,"ID",136215,23046,424367,,"totalTestsPeopleViral",537536,393,5425,95,993,,,55186,"12/27/2020 19:00","2020-12-27T19:00:00Z","12/27 14:00",1354,5425,,"2020-12-27T19:00:00Z",842238,,,113169,1195,159,,537536,,,,,,,,,52274,,"16",428,438,560582,769,560582,,0,33,"a26f88317a9894ce76a4888127481ddadc2e7547",0,0,0,0,0,""
20201227,"ID",135787,22949,423929,,"totalTestsPeopleViral",536767,393,5392,95,984,,,54574,"12/26/2020 19:00","2020-12-26T19:00:00Z","12/26 14:00",1354,5392,,"2020-12-26T19:00:00Z",840931,,,112838,1195,159,,536767,,,,,,,,,52274,,"16",554,1694,559716,2135,559716,,5,35,"cc53357cc2768df07eb5e07cedba86d1aaf4af5c",0,0,0,0,0,""
20201226,"ID",135233,22836,422235,,"totalTestsPeopleViral",534632,433,5357,106,978,,,53535,"12/24/2020 19:00","2020-12-24T19:00:00Z","12/24 14:00",1349,5357,,"2020-12-24T19:00:00Z",837503,,,112397,1191,158,,534632,,,,,,,,,52274,,"16",0,0,557468,0,557468,,0,0,"d75272ee681120f1c3df564966f6e0dc43f159c3",0,0,0,0,0,""
20201225,"ID",135233,22836,422235,,"totalTestsPeopleViral",534632,433,5357,106,978,,,53535,"12/24/2020 19:00","2020-12-24T19:00:00Z","12/24 14:00",1349,5357,,"2020-12-24T19:00:00Z",837503,,,112397,1191,158,,534632,,,,,,,,,52274,,"16",1248,981,557468,1917,557468,,25,41,"2df7be7f1d9d834003a0682a265890fd1c8c7f42",0,0,0,0,0,""
20201224,"ID",133985,22524,421254,,"totalTestsPeopleViral",532715,433,5316,106,965,,,52799,"12/23/2020 19:00","2020-12-23T19:00:00Z","12/23 14:00",1324,5316,,"2020-12-23T19:00:00Z",833369,,,111461,1169,155,,532715,,,,,,,,,52274,,"16",1391,1067,555239,2177,555239,,11,49,"948ba62474d313033cd3b0afd2c08d332b0f9bee",0,0,0,0,0,""
20201223,"ID",132594,22243,420187,,"totalTestsPeopleViral",530538,345,5267,87,958,,,51996,"12/22/2020 19:00","2020-12-22T19:00:00Z","12/22 14:00",1313,5267,,"2020-12-22T19:00:00Z",828858,,,110351,1158,155,,530538,,,,,,,,,52274,,"16",1717,794,552781,2043,552781,,12,59,"37c5d3a9b0a4651bb7b846c4a44c4cb58a625f4d",0,0,0,0,0,""
20201222,"ID",130877,21775,419393,,"totalTestsPeopleViral",528495,345,5208,87,948,,,51421,"12/21/2020 19:00","2020-12-21T19:00:00Z","12/21 14:00",1301,5208,,"2020-12-21T19:00:00Z",824413,,,109102,1151,150,,528495,,,,,,,,,52274,,"16",917,1449,550270,2127,550270,,21,53,"29e67944d01ad91703fd5a3bc2bb289a0d7531b0",0,0,0,0,0,""
20201221,"ID",129960,21536,417944,,"totalTestsPeopleViral",526368,467,5155,118,942,,,50950,"12/20/2020 19:00","2020-12-20T19:00:00Z","12/20 14:00",1280,5155,,"2020-12-20T19:00:00Z",819320,,,108424,1136,144,,526368,,,,,,,,,52274,,"16",891,817,547904,1452,547904,,5,34,"a0058377dbfabe93243f6d76b325f15b9c21a7aa",0,0,0,0,0,""
20201220,"ID",129069,21280,417127,,"totalTestsPeopleViral",524916,467,5121,118,932,,,50324,"12/19/2020 19:00","2020-12-19T19:00:00Z","12/19 14:00",1275,5121,,"2020-12-19T19:00:00Z",817152,,,107789,1133,142,,524916,,,,,,,,,52274,,"16",851,2177,546196,2999,546196,,0,35,"134f1e587be9defef8fa18472be89bcc47ff7633",0,0,0,0,0,""
20201219,"ID",128218,21251,414950,,"totalTestsPeopleViral",521917,467,5086,118,928,,,49914,"12/18/2020 19:00","2020-12-18T19:00:00Z","12/18 14:00",1275,5086,,"2020-12-18T19:00:00Z",813341,,,106967,1131,144,,521917,,,,,,,,,52274,,"16",1340,1723,543168,2792,543168,,16,65,"64e9aef677c5fe957094cf62b3e749aaac3e2ee1",0,0,0,0,0,""
20201218,"ID",126878,20980,413227,,"totalTestsPeopleViral",519125,467,5021,118,918,,,49318,"12/17/2020 19:00","2020-12-17T19:00:00Z","12/17 14:00",1259,5021,,"2020-12-17T19:00:00Z",808130,,,105898,1121,138,,519125,,,,,,,,,52274,,"16",1426,3180,540105,4325,540105,,28,56,"339e9290d00f8b12c4388d606e21a66268816abe",0,0,0,0,0,""
20201217,"ID",125452,20699,410047,,"totalTestsPeopleViral",514800,470,4965,109,908,,,48752,"12/16/2020 19:00","2020-12-16T19:00:00Z","12/16 14:00",1231,4965,,"2020-12-16T19:00:00Z",799525,,,104753,1104,127,,514800,,,,,,,,,45753,,"16",1433,2243,535499,3256,535499,,17,57,"5aa8013dc77c9c43a0ac1739e986497152ac3cf9",0,0,0,0,0,""
20201216,"ID",124019,20279,407804,,"totalTestsPeopleViral",511544,444,4908,101,895,,,48070,"12/15/2020 19:00","2020-12-15T19:00:00Z","12/15 14:00",1214,4908,,"2020-12-15T19:00:00Z",789794,,,103740,1088,126,,511544,,,,,,,,,45753,,"16",1802,2765,531823,4165,531823,,20,81,"1d855a75b2c5e45cff2820180d6fca0c2a170de9",0,0,0,0,0,""
20201215,"ID",122217,19877,405039,,"totalTestsPeopleViral",507379,444,4827,101,884,,,47497,"12/14/2020 19:00","2020-12-14T19:00:00Z","12/14 14:00",1194,4827,,"2020-12-14T19:00:00Z",783713,,,102340,1075,119,,507379,,,,,,,,,45753,,"16",1038,558,527256,1421,527256,,19,64,"6ce710b42c2f1d53d5fcf64f15e38438124141b5",0,0,0,0,0,""
20201214,"ID",121179,19702,404481,,"totalTestsPeopleViral",505958,444,4763,101,881,,,46980,"12/13/2020 19:00","2020-12-13T19:00:00Z","12/13 14:00",1175,4763,,"2020-12-13T19:00:00Z",780048,,,101477,1058,117,,505958,,,,,,,,,45753,,"16",547,1234,525660,1745,525660,,6,17,"bbd769184c8cc66682f800329092d6fe4d13de74",0,0,0,0,0,""
20201213,"ID",120632,19666,403247,,"totalTestsPeopleViral",504213,458,4746,104,875,,,46247,"12/12/2020 19:00","2020-12-12T19:00:00Z","12/12 14:00",1169,4746,,"2020-12-12T19:00:00Z",776954,,,100966,1053,116,,504213,,,,,,,,,45753,,"16",1022,1259,523879,2143,523879,,18,27,"b9598ecaff0fa67e9604ef50111ff731bbfee593",0,0,0,0,0,""
20201212,"ID",119610,19528,401988,,"totalTestsPeopleViral",502070,458,4719,104,871,,,45810,"12/11/2020 19:00","2020-12-11T19:00:00Z","12/11 14:00",1151,4719,,"2020-12-11T19:00:00Z",772770,,,100082,1036,115,,502070,,,,,,,,,45753,,"16",1582,1771,521598,2968,521598,,15,48,"75e455a33c1f14c7e87c2a4dc0bed9cdad41c332",0,0,0,0,0,""
20201211,"ID",118028,19143,400217,,"totalTestsPeopleViral",499102,455,4671,93,862,,,45303,"12/10/2020 19:00","2020-12-10T19:00:00Z","12/10 14:00",1136,4671,,"2020-12-10T19:00:00Z",766580,,,98885,1023,113,,499102,,,,,,,,,45753,,"16",1825,1929,518245,3364,518245,,33,66,"abd98f7142236e041e1171c8123477eaee537ce4",0,0,0,0,0,""
20201210,"ID",116203,18753,398288,,"totalTestsPeopleViral",495738,455,4605,93,854,,,44811,"12/9/2020 19:00","2020-12-09T19:00:00Z","12/09 14:00",1103,4605,,"2020-12-09T19:00:00Z",760315,,,97450,1006,97,,495738,,,,,,,,,45253,,"16",2298,1566,514491,3473,514491,,29,66,"434cc2b898c24f910c5961d9a5cd16ccee2cbb1a",0,0,0,0,0,""
20201209,"ID",113905,18362,396722,,"totalTestsPeopleViral",492265,455,4539,93,846,,,44314,"12/8/2020 19:00","2020-12-08T19:00:00Z","12/08 14:00",1074,4539,,"2020-12-08T19:00:00Z",754418,,,95543,982,92,,492265,,,,,,,,,45253,,"16",2012,-4236,510627,-2649,510627,,19,91,"38edf9ec63bdf808fe05665ef0f4cd2dafb2a4c7",0,0,0,0,0,""
20201208,"ID",111893,17937,400958,,"totalTestsPeopleViral",494914,360,4448,89,829,,,43926,"12/7/2020 19:00","2020-12-07T19:00:00Z","12/07 14:00",1055,4448,,"2020-12-07T19:00:00Z",750652,,,93956,965,90,,494914,,,,,,,,,45253,,"16",1383,1247,512851,2189,512851,,20,60,"f7f2402c52954eb10a26894aa5a1fc25a76b8a59",0,0,0,0,0,""
20201207,"ID",110510,17496,399711,,"totalTestsPeopleViral",492725,477,4388,105,822,,,43380,"12/6/2020 19:00","2020-12-06T19:00:00Z","12/06 14:00",1035,4388,,"2020-12-06T19:00:00Z",744982,,,93014,946,89,,492725,,,,,,,,,45253,,"16",805,1684,510221,2338,510221,,3,16,"a23b4b093ad78918e4f2bce5b85a0833d0fb9767",0,0,0,0,0,""
20201206,"ID",109705,17345,398027,,"totalTestsPeopleViral",490387,477,4372,105,814,,,42932,"12/5/2020 19:00","2020-12-05T19:00:00Z","12/05 14:00",1032,4372,,"2020-12-05T19:00:00Z",741864,,,92360,944,88,,490387,,,,,,,,,45253,,"16",1339,1810,507732,2927,507732,,0,30,"702beb974b2feec065df2de1ba510e9a8f14b175",0,0,0,0,0,""
20201205,"ID",108366,17123,396217,,"totalTestsPeopleViral",487460,477,4342,105,805,,,42671,"12/4/2020 19:00","2020-12-04T19:00:00Z","12/04 14:00",1032,4342,,"2020-12-04T19:00:00Z",737597,,,91243,943,89,,487460,,,,,,,,,45253,,"16",1911,1764,504583,3268,504583,,18,71,"d0cc3821f606458e15acc9910fc74956bf84adea",0,0,0,0,0,""
20201204,"ID",106455,16716,394453,,"totalTestsPeopleViral",484192,466,4271,108,791,,,42274,"12/3/2020 19:00","2020-12-03T19:00:00Z","12/03 14:00",1014,4271,,"2020-12-03T19:00:00Z",732469,,,89739,927,87,,484192,,,,,,,,,45253,,"16",1721,2178,500908,3492,500908,,23,71,"374c45433145be373587cef304c5951abad96de2",0,0,0,0,0,""
20201203,"ID",104734,16309,392275,,"totalTestsPeopleViral",480700,466,4200,108,780,,,41838,"12/2/2020 19:00","2020-12-02T19:00:00Z","12/02 14:00",991,4200,,"2020-12-02T19:00:00Z",726473,,,88425,905,86,,480700,,,,,,,,,31219,,"16",1429,2446,497009,3452,497009,,31,65,"56b8740f28c08aec322ad805fbbe0807c1e925cd",0,0,0,0,0,""
20201202,"ID",103305,15886,389829,,"totalTestsPeopleViral",477248,446,4135,110,769,,,41354,"12/1/2020 19:00","2020-12-01T19:00:00Z","12/01 14:00",960,4135,,"2020-12-01T19:00:00Z",720635,,,87419,881,79,,477248,,,,,,,,,31219,,"16",1607,1424,493134,2572,493134,,31,86,"5e9794790270d6125d16f09797384bad95b7f4e3",0,0,0,0,0,""
20201201,"ID",101698,15427,388405,,"totalTestsPeopleViral",474676,446,4049,110,756,,,40929,"11/30/2020 19:00","2020-11-30T19:00:00Z","11/30 14:00",929,4049,,"2020-11-30T19:00:00Z",716978,,,86271,854,75,,474676,,,,,,,,,31219,,"16",1214,799,490103,1639,490103,,9,71,"786ddae2e70fd0a232f32f5cafea0929dc785012",0,0,0,0,0,""
20201130,"ID",100484,15053,387606,,"totalTestsPeopleViral",473037,470,3978,92,749,,,40461,"11/29/2020 19:00","2020-11-29T19:00:00Z","11/29 14:00",920,3978,,"2020-11-29T19:00:00Z",713302,,,85431,848,72,,473037,,,,,,,,,31219,,"16",824,1199,488090,1893,488090,,7,30,"8003970a3815852c751fa39c6949bcb04752b717",0,0,0,0,0,""
20201129,"ID",99660,14923,386407,,"totalTestsPeopleViral",471144,470,3948,92,742,,,40120,"11/28/2020 19:00","2020-11-28T19:00:00Z","11/28 14:00",913,3948,,"2020-11-28T19:00:00Z",710402,,,84737,843,70,,471144,,,,,,,,,31219,,"16",1160,1248,486067,2249,486067,,4,70,"93a720eccfa75bc7ad130b9026628cd85d89042d",0,0,0,0,0,""
20201128,"ID",98500,14764,385159,,"totalTestsPeopleViral",468895,470,3878,92,727,,,39900,"11/27/2020 19:00","2020-11-27T19:00:00Z","11/27 14:00",909,3878,,"2020-11-27T19:00:00Z",706739,,,83736,839,70,,468895,,,,,,,,,31219,,"16",1997,2776,483659,4449,483659,,14,61,"1185a787ebdec30eb1ccff8bb4d9b0f9d9ee2f8c",0,0,0,0,0,""
20201127,"ID",96503,14440,382383,,"totalTestsPeopleViral",464446,453,3817,108,715,,,39199,"11/25/2020 19:00","2020-11-25T19:00:00Z","11/25 14:00",895,3817,,"2020-11-25T19:00:00Z",698256,,,82063,827,68,,464446,,,,,,,,,31219,,"16",0,0,478886,0,478886,,0,0,"51408905bb1c246d93669ce7e2f42ea1cfd3d2ad",0,0,0,0,0,""
20201126,"ID",96503,14440,382383,,"totalTestsPeopleViral",464446,453,3817,108,715,,,39199,"11/25/2020 19:00","2020-11-25T19:00:00Z","11/25 14:00",895,3817,,"2020-11-25T19:00:00Z",698256,,,82063,827,68,,464446,,,,,,,,,31219,,"16",1773,3071,478886,4425,478886,,21,55,"2cd7f355cf45ec5a0c9d4f33e0e9bfa5aa5e74fb",0,0,0,0,0,""
20201125,"ID",94730,14021,379312,,"totalTestsPeopleViral",460021,408,3762,91,701,,,38397,"11/24/2020 19:00","2020-11-24T19:00:00Z","11/24 14:00",874,3762,,"2020-11-24T19:00:00Z",691303,,,80709,808,66,,460021,,,,,,,,,31219,,"16",1640,1614,474042,2913,474042,,8,80,"d7c7e5d912c271a39ce70442018bd7e988ecfc0a",0,0,0,0,0,""
20201124,"ID",93090,13680,377698,,"totalTestsPeopleViral",457108,408,3682,91,689,,,38397,"11/23/2020 19:00","2020-11-23T19:00:00Z","11/23 14:00",866,3682,,"2020-11-23T19:00:00Z",686385,,,79410,800,66,,457108,,,,,,,,,31219,,"16",1437,1989,470788,3236,470788,,17,72,"9ff4506cade3624e32eac2e3f893725797a8ab28",0,0,0,0,0,""
20201123,"ID",91653,13490,375709,,"totalTestsPeopleViral",453872,442,3610,89,688,,,38025,"11/22/2020 19:00","2020-11-22T19:00:00Z","11/22 14:00",849,3610,,"2020-11-22T19:00:00Z",679194,,,78163,783,66,,453872,,,,,,,,,31219,,"16",819,1996,467362,2627,467362,,2,25,"7e9d9caab223d55872ce4d0908a627646ed008dd",0,0,0,0,0,""
20201122,"ID",90834,13302,373713,,"totalTestsPeopleViral",451245,442,3585,89,681,,,37504,"11/21/2020 19:00","2020-11-21T19:00:00Z","11/21 14:00",847,3585,,"2020-11-21T19:00:00Z",675719,,,77532,783,64,,451245,,,,,,,,,31219,,"16",1070,2282,464547,3244,464547,,2,93,"cb3622d684e6fad03847e4a0571b37e58d610634",0,0,0,0,0,""
20201121,"ID",89764,13194,371431,,"totalTestsPeopleViral",448001,404,3492,89,673,,,37232,"11/20/2020 19:00","2020-11-20T19:00:00Z","11/20 14:00",845,3492,,"2020-11-20T19:00:00Z",671184,,,76570,780,65,,448001,,,,,,,,,31219,,"16",1786,2289,461195,3775,461195,,10,89,"05158c9b7c6c05bb1f310bccb6e09dec33adced2",0,0,0,0,0,""
20201120,"ID",87978,12894,369142,,"totalTestsPeopleViral",444226,389,3403,84,651,,,36831,"11/19/2020 19:00","2020-11-19T19:00:00Z","11/19 14:00",835,3403,,"2020-11-19T19:00:00Z",615492,,,75084,769,66,,444226,,,,,,,,,24306,,"16",1543,2627,457120,3871,457120,,23,91,"c907e5346f2552053491b4bbd1943504c3918780",0,0,0,0,0,""
20201119,"ID",86435,12595,366515,,"totalTestsPeopleViral",440355,389,3312,84,635,,,36339,"11/18/2020 19:00","2020-11-18T19:00:00Z","11/18 14:00",812,3312,,"2020-11-18T19:00:00Z",608512,,,73840,746,66,,440355,,,,,,,,,24306,,"16",1310,3247,452950,4322,452950,,14,58,"719a46917070bc9511b1ccee4ea8a286cf77af9c",0,0,0,0,0,""
20201118,"ID",85125,12360,363268,,"totalTestsPeopleViral",436033,376,3254,79,632,,,35948,"11/17/2020 19:00","2020-11-17T19:00:00Z","11/17 14:00",798,3254,,"2020-11-17T19:00:00Z",601597,,,72765,733,65,,436033,,,,,,,,,24306,,"16",1781,1405,448393,2811,448393,,35,52,"e19a70cc55ae32769db9c64f077812391b230aaa",0,0,0,0,0,""
20201117,"ID",83344,11985,361863,,"totalTestsPeopleViral",433222,376,3202,79,621,,,35530,"11/16/2020 19:00","2020-11-16T19:00:00Z","11/16 14:00",763,3202,,"2020-11-16T19:00:00Z",595984,,,71359,703,60,,433222,,,,,,,,,24306,,"16",1099,1875,445207,2799,445207,,4,34,"4c49031d5861a4cd0d84be713685e5bb60909a49",0,0,0,0,0,""
20201116,"ID",82245,11810,359988,,"totalTestsPeopleViral",430423,395,3168,96,613,,,35215,"11/15/2020 19:00","2020-11-15T19:00:00Z","11/15 14:00",759,3168,,"2020-11-15T19:00:00Z",590232,,,70435,700,59,,430423,,,,,,,,,24306,,"16",928,1591,442233,2469,442233,,0,20,"70d41bc62d28f78782501a8efc56220b0dad7437",0,0,0,0,0,""
20201115,"ID",81317,11760,358397,,"totalTestsPeopleViral",427954,395,3148,96,610,,,34826,"11/14/2020 19:00","2020-11-14T19:00:00Z","11/14 14:00",759,3148,,"2020-11-14T19:00:00Z",586249,,,69557,700,59,,427954,,,,,,,,,24306,,"16",1519,2332,439714,3539,439714,,7,46,"eb0bfc457b65ef6aed165f4f8dde1405d9efa1ba",0,0,0,0,0,""
20201114,"ID",79798,11448,356065,,"totalTestsPeopleViral",424415,395,3102,96,602,,,34482,"11/13/2020 19:00","2020-11-13T19:00:00Z","11/13 14:00",752,3102,,"2020-11-13T19:00:00Z",580624,,,68350,695,57,,424415,,,,,,,,,24306,,"16",1519,2362,435863,3632,435863,,3,41,"0169dc002384bbbab47e122124424d40a908d0e5",0,0,0,0,0,""
20201113,"ID",78279,11199,353703,,"totalTestsPeopleViral",420783,395,3061,96,600,,,34104,"11/12/2020 19:00","2020-11-12T19:00:00Z","11/12 14:00",749,3061,,"2020-11-12T19:00:00Z",575397,,,67080,692,57,,420783,,,,,,,,,24306,,"16",1158,2457,431982,3337,431982,,16,59,"03124d4b93468af5a5168a909331ccf7b39a2e72",0,0,0,0,0,""
20201112,"ID",77121,10921,351246,,"totalTestsPeopleViral",417446,361,3002,94,598,,,33715,"11/11/2020 19:00","2020-11-11T19:00:00Z","11/11 14:00",733,3002,,"2020-11-11T19:00:00Z",570334,,,66200,676,57,,417446,,,,,,,,,17332,,"16",1693,2283,428367,3608,428367,,19,40,"ba49b07c848f20d0507c9c3310ecd7eb91469b64",0,0,0,0,0,""
20201111,"ID",75428,10553,348963,,"totalTestsPeopleViral",413838,288,2962,72,593,,,33330,"11/10/2020 19:00","2020-11-10T19:00:00Z","11/10 14:00",714,2962,,"2020-11-10T19:00:00Z",565671,,,64875,660,54,,413838,,,,,,,,,17332,,"16",1201,2379,424391,3343,424391,,16,36,"1bdd4213fced52ce40a1b2782164a1c5624f3769",0,0,0,0,0,""
20201110,"ID",74227,10316,346584,,"totalTestsPeopleViral",410495,288,2926,72,585,,,33032,"11/9/2020 19:00","2020-11-09T19:00:00Z","11/09 14:00",698,2926,,"2020-11-09T19:00:00Z",560939,,,63911,646,52,,410495,,,,,,,,,17332,,"16",1266,1041,420811,2187,420811,,12,37,"fe2f8f0e48faead21886025211f0c5cde0750d71",0,0,0,0,0,""
20201109,"ID",72961,10196,345543,,"totalTestsPeopleViral",408308,320,2889,90,580,,,32702,"11/8/2020 19:00","2020-11-08T19:00:00Z","11/08 14:00",686,2889,,"2020-11-08T19:00:00Z",555820,,,62765,636,50,,408308,,,,,,,,,17332,,"16",649,2134,418504,2739,418504,,3,19,"11ee2634a05e334e54a2d41200db58e68e15b089",0,0,0,0,0,""
20201108,"ID",72312,10152,343409,,"totalTestsPeopleViral",405569,320,2870,90,576,,,32330,"11/7/2020 19:00","2020-11-07T19:00:00Z","11/07 14:00",683,2870,,"2020-11-07T19:00:00Z",551859,,,62160,633,50,,405569,,,,,,,,,17332,,"16",1403,1431,415721,2481,415721,,4,45,"534584ef4bc73fff3fe7b6281cf121445decb93b",0,0,0,0,0,""
20201107,"ID",70909,9799,341978,,"totalTestsPeopleViral",403088,320,2825,90,574,,,31969,"11/6/2020 19:00","2020-11-06T19:00:00Z","11/06 14:00",679,2825,,"2020-11-06T19:00:00Z",547929,,,61110,630,49,,403088,,,,,,,,,17332,,"16",1330,3322,412887,4367,412887,,8,37,"de897ad9e2f11fb2a2632e594195c4967025ff3d",0,0,0,0,0,""
20201106,"ID",69579,9514,338656,,"totalTestsPeopleViral",398721,296,2788,77,568,,,31574,"11/5/2020 19:00","2020-11-05T19:00:00Z","11/05 14:00",671,2788,,"2020-11-05T19:00:00Z",543322,,,60065,622,49,,398721,,,,,,,,,17332,,"16",1265,2160,408235,3045,408235,,7,58,"c10a6902d74801cefb6e510dd4d0223b673310f8",0,0,0,0,0,""
20201105,"ID",68314,9134,336496,,"totalTestsPeopleViral",395676,296,2730,77,566,,,31210,"11/4/2020 19:00","2020-11-04T19:00:00Z","11/04 14:00",664,2730,,"2020-11-04T19:00:00Z",539021,,,59180,616,48,,395676,,,,,,,,,12903,,"16",1290,1746,404810,2703,404810,,17,39,"ecec165572a02ed39e4e5ba7362824f4f5da88b4",0,0,0,0,0,""
20201104,"ID",67024,8801,334750,,"totalTestsPeopleViral",392973,155,2691,55,560,,,30844,"11/3/2020 19:00","2020-11-03T19:00:00Z","11/03 14:00",647,2691,,"2020-11-03T19:00:00Z",535065,,,58223,600,47,,392973,,,,,,,,,,,"16",1179,1856,401774,2682,401774,,15,48,"ec5e444306835a94bbbfae24d11fc63bbc565af5",0,0,0,0,0,""
20201103,"ID",65845,8448,332894,,"totalTestsPeopleViral",390291,155,2643,55,555,,,30525,"11/2/2020 19:01","2020-11-02T19:01:00Z","11/02 14:01",632,2643,,"2020-11-02T19:01:00Z",530779,,,57397,588,44,,390291,,,,,,,,,,,"16",757,1715,398739,2356,398739,,2,28,"058567bdca18ae5aea080bd3dbc6ec921594a7d3",0,0,0,0,0,""
20201102,"ID",65088,8332,331179,,"totalTestsPeopleViral",387935,263,2615,74,552,,,30218,"11/1/2020 19:00","2020-11-01T19:00:00Z","11/01 14:00",630,2615,,"2020-11-01T19:00:00Z",526012,,,56756,586,44,,387935,,,,,,,,,,,"16",480,1596,396267,1953,396267,,1,21,"3d81e00ec11c19e791bea93493b5101ee2e913c3",0,0,0,0,0,""
20201101,"ID",64608,8209,329583,,"totalTestsPeopleViral",385982,263,2594,74,551,,,29867,"10/31/2020 19:00","2020-10-31T19:00:00Z","10/31 15:00",629,2594,,"2020-10-31T19:00:00Z",523318,,,56399,585,44,,385982,,,,,,,,,,,"16",798,1503,394191,2068,394191,,3,22,"f8c8b81b342ab0b6f882ec0cd4e74d7c05c5fd20",0,0,0,0,0,""
20201031,"ID",63810,7976,328080,,"totalTestsPeopleViral",383914,263,2572,74,549,,,29556,"10/30/2020 19:00","2020-10-30T19:00:00Z","10/30 15:00",626,2572,,"2020-10-30T19:00:00Z",520322,,,55834,582,44,,383914,,,,,,,,,,,"16",1064,2041,391890,2906,391890,,11,23,"b0b6234426fa8b1724e2904fa002a0b67835194c",0,0,0,0,0,""
20201030,"ID",62746,7777,326039,,"totalTestsPeopleViral",381008,286,2549,72,546,,,29195,"10/29/2020 19:00","2020-10-29T19:00:00Z","10/29 15:00",615,2549,,"2020-10-29T19:00:00Z",515774,,,54969,571,44,,381008,,,,,,,,,,,"16",961,2018,388785,2794,388785,,16,35,"6483f4a7706a4bd7ebb32c054504b15f73baa2e3",0,0,0,0,0,""
20201029,"ID",61785,7592,324021,,"totalTestsPeopleViral",378214,286,2514,72,546,,,28890,"10/28/2020 19:00","2020-10-28T19:00:00Z","10/28 15:00",599,2514,,"2020-10-28T19:00:00Z",511141,,,54193,555,44,,378214,,,,,,,,,,,"16",862,2160,385806,2814,385806,,14,31,"daa53c83a5e9d823df02f36b87e59d8597ac6c20",0,0,0,0,0,""
20201028,"ID",60923,7384,321861,,"totalTestsPeopleViral",375400,272,2483,75,542,,,28553,"10/27/2020 19:00","2020-10-27T19:00:00Z","10/27 15:00",585,2483,,"2020-10-27T19:00:00Z",507279,,,53539,541,44,,375400,,,,,,,,,,,"16",882,1370,382784,2063,382784,,5,36,"c9c80d84f4687fa237eb1c0d178fa74a533364c2",0,0,0,0,0,""
20201027,"ID",60041,7195,320491,,"totalTestsPeopleViral",373337,272,2447,75,539,,,28309,"10/26/2020 19:00","2020-10-26T19:00:00Z","10/26 15:00",580,2447,,"2020-10-26T19:00:00Z",503424,,,52846,536,44,,373337,,,,,,,,,,,"16",697,2012,380532,2596,380532,,7,16,"ef78bdfe37a6b9e51f54151ca207fb66c14795ca",0,0,0,0,0,""
20201026,"ID",59344,7082,318479,,"totalTestsPeopleViral",370741,272,2431,75,535,,,28056,"10/25/2020 19:00","2020-10-25T19:00:00Z","10/25 15:00",573,2431,,"2020-10-25T19:00:00Z",498257,,,52262,528,45,,370741,,,,,,,,,,,"16",650,1646,377823,2172,377823,,1,22,"eec6a5d66083c1a2f09dc5bc3bcdaf47c2a2dca5",0,0,0,0,0,""
20201025,"ID",58694,6958,316833,,"totalTestsPeopleViral",368569,259,2409,66,530,,,27760,"10/24/2020 19:00","2020-10-24T19:00:00Z","10/24 15:00",572,2409,,"2020-10-24T19:00:00Z",495961,,,51736,527,45,,368569,,,,,,,,,,,"16",1021,1688,375527,2522,375527,,10,22,"e06046003e21b24e2d5938ce24cdcd062a7733f3",0,0,0,0,0,""
20201024,"ID",57673,6771,315145,,"totalTestsPeopleViral",366047,259,2387,66,527,,,27509,"10/23/2020 19:10","2020-10-23T19:10:00Z","10/23 15:10",562,2387,,"2020-10-23T19:10:00Z",492461,,,50902,518,44,,366047,,,,,,,,,,,"16",1073,2078,372818,2999,372818,,9,24,"8dcb2ee0cd46db6c3cc21e65cfbf8ca923a3fc49",0,0,0,0,0,""
20201023,"ID",56600,6619,313067,,"totalTestsPeopleViral",363048,193,2363,54,524,,,27221,"10/22/2020 19:00","2020-10-22T19:00:00Z","10/22 15:00",553,2363,,"2020-10-22T19:00:00Z",487896,,,49981,509,44,,363048,,,,,,,,,,,"16",950,2110,369667,2863,369667,,7,36,"0ad735837f71f58d4e07cca92ae912ab2edc78de",0,0,0,0,0,""
20201022,"ID",55650,6422,310957,,"totalTestsPeopleViral",360185,193,2327,54,514,,,26916,"10/21/2020 19:25","2020-10-21T19:25:00Z","10/21 15:25",546,2327,,"2020-10-21T19:25:00Z",475429,,,49228,503,43,,360185,,,,,,,,,,,"16",987,1648,366607,2352,366607,,11,50,"f6f802f1fec3f5d5909765ce95a95bf8a90c39a9",0,0,0,0,0,""
20201021,"ID",54663,6139,309309,,"totalTestsPeopleViral",357833,187,2277,54,509,,,26549,"10/20/2020 16:25","2020-10-20T16:25:00Z","10/20 12:25",535,2277,,"2020-10-20T16:25:00Z",471700,,,48524,492,43,,357833,,,,,,,,,,,"16",873,1697,363972,2451,363972,,4,46,"19cd80e2b6490b2493cbf6b89c79b5fec466eae9",0,0,0,0,0,""
20201020,"ID",53790,6020,307612,,"totalTestsPeopleViral",355382,187,2231,54,506,,,26238,"10/19/2020 19:38","2020-10-19T19:38:00Z","10/19 15:38",531,2231,,"2020-10-19T19:38:00Z",467709,,,47770,488,43,,355382,,,,,,,,,,,"16",698,1597,361402,2192,361402,,3,25,"a02d71291bf9c6478c480cb16e2b231adef19618",0,0,0,0,0,""
20201019,"ID",53092,5917,306015,,"totalTestsPeopleViral",353190,221,2206,55,504,,,25980,"10/18/2020 19:00","2020-10-18T19:00:00Z","10/18 15:00",528,2206,,"2020-10-18T19:00:00Z",463548,,,47175,486,42,,353190,,,,,,,,,,,"16",510,2457,359107,2878,359107,,-1,13,"aa60717b14387b39f9f16f0de4f2e7ba4dc2e15f",0,0,0,0,0,""
20201018,"ID",52582,5828,303558,,"totalTestsPeopleViral",350312,221,2193,55,503,,,25679,"10/17/2020 19:00","2020-10-17T19:00:00Z","10/17 15:00",529,2193,,"2020-10-17T19:00:00Z",460230,,,46754,487,42,,350312,,,,,,,,,,,"16",878,1126,356140,1794,356140,,6,19,"7b38e45414af9dbf1bf8efb02dfb5a8ff058ec23",0,0,0,0,0,""
20201017,"ID",51704,5618,302432,,"totalTestsPeopleViral",348518,221,2174,55,495,,,25457,"10/16/2020 19:00","2020-10-16T19:00:00Z","10/16 15:00",523,2174,,"2020-10-16T19:00:00Z",457644,,,46086,482,41,,348518,,,,,,,,,,,"16",1094,2070,354136,2933,354136,,6,37,"2a459171c1839395585795f6c9827de1fea510b9",0,0,0,0,0,""
20201016,"ID",50610,5387,300362,,"totalTestsPeopleViral",345585,219,2137,56,494,,,25214,"10/15/2020 19:17","2020-10-15T19:17:00Z","10/15 15:17",517,2137,,"2020-10-15T19:17:00Z",452701,,,45223,476,41,,345585,,,,,,,,,,,"16",718,2143,350972,2715,350972,,1,15,"ac6191e8a1a5f755a82a6e96a68bc823a755542f",0,0,0,0,0,""
20201015,"ID",49892,5241,298219,,"totalTestsPeopleViral",342870,219,2122,56,492,,,24983,"10/14/2020 19:00","2020-10-14T19:00:00Z","10/14 15:00",516,2122,,"2020-10-14T19:00:00Z",,,,44651,475,41,,342870,,,,,,,,,,,"16",645,1603,348111,2094,348111,,4,36,"4db799a5e884b49cce89877216bc4b7939aa8d2f",0,0,0,0,0,""
20201014,"ID",49247,5087,296616,,"totalTestsPeopleViral",340776,187,2086,54,487,,,24699,"10/13/2020 19:06","2020-10-13T19:06:00Z","10/13 15:06",512,2086,,"2020-10-13T19:06:00Z",,,,44160,471,41,,340776,,,,,,,,,,,"16",584,2276,345863,2776,345863,,2,28,"2330f3ee04833aa2a2c337e7adca6e96f5cef28c",0,0,0,0,0,""
20201013,"ID",48663,5003,294340,,"totalTestsPeopleViral",338000,187,2058,54,481,,,24523,"10/12/2020 19:00","2020-10-12T19:00:00Z","10/12 15:00",510,2058,,"2020-10-12T19:00:00Z",,,,43660,469,41,,338000,,,,,,,,,,,"16",597,1783,343003,2330,343003,,3,17,"2eceb8aa51f681f05fa30fa4c06ca19e8328708f",0,0,0,0,0,""
20201012,"ID",48066,4953,292557,,"totalTestsPeopleViral",335670,192,2041,45,479,,,24304,"10/11/2020 19:00","2020-10-11T19:00:00Z","10/11 15:00",507,2041,,"2020-10-11T19:00:00Z",,,,43113,466,41,,335670,,,,,,,,,,,"16",365,1488,340623,1831,340623,,0,10,"27edefd3449b6b9814917d56c83fdb9ccccd8d8a",0,0,0,0,0,""
20201011,"ID",47701,4931,291069,,"totalTestsPeopleViral",333839,192,2031,45,478,,,24089,"10/10/2020 19:00","2020-10-10T19:00:00Z","10/10 15:00",507,2031,,"2020-10-10T19:00:00Z",,,,42770,466,41,,333839,,,,,,,,,,,"16",613,2367,338770,2877,338770,,1,18,"15e23ae44e8b1986ec5381a62013bcf1f4949dc9",0,0,0,0,0,""
20201010,"ID",47088,4828,288702,,"totalTestsPeopleViral",330962,192,2013,45,475,,,23881,"10/9/2020 19:00","2020-10-09T19:00:00Z","10/09 15:00",506,2013,,"2020-10-09T19:00:00Z",,,,42260,464,42,,330962,,,,,,,,,,,"16",662,3653,335790,4173,335790,,3,16,"b8e9f91fcdb9d1ad8739824694e4685d7a7b741a",0,0,0,0,0,""
20201009,"ID",46426,4686,285049,,"totalTestsPeopleViral",326789,191,1997,41,474,,,23678,"10/8/2020 19:00","2020-10-08T19:00:00Z","10/08 15:00",503,1997,,"2020-10-08T19:00:00Z",,,,41740,462,41,,326789,,,,,,,,,,,"16",673,1941,331475,2461,331475,,3,25,"8cab3afbf95f30b06e95cdf3f382bda714d227b5",0,0,0,0,0,""
20201008,"ID",45753,4533,283108,,"totalTestsPeopleViral",324328,191,1972,41,470,,,23475,"10/7/2020 19:00","2020-10-07T19:00:00Z","10/07 15:00",500,1972,,"2020-10-07T19:00:00Z",,,,41220,459,41,,324328,,,,,,,,,,,"16",671,1999,328861,2534,328861,,8,40,"712df8dbdaf445bc7dc44cc645f1c3430403e3a5",0,0,0,0,0,""
20201007,"ID",45082,4397,281109,,"totalTestsPeopleViral",321794,151,1932,36,468,,,23288,"10/6/2020 19:00","2020-10-06T19:00:00Z","10/06 15:00",492,1932,,"2020-10-06T19:00:00Z",,,,40685,452,40,,321794,,,,,,,,,,,"16",660,1295,326191,1849,326191,,5,21,"12390a8839055837cc2f9d5573a0ea58df8deaa9",0,0,0,0,0,""
20201006,"ID",44422,4291,279814,,"totalTestsPeopleViral",319945,151,1911,36,466,,,23115,"10/5/2020 19:00","2020-10-05T19:00:00Z","10/05 15:00",487,1911,,"2020-10-05T19:00:00Z",,,,40131,447,40,,319945,,,,,,,,,,,"16",458,1369,324236,1778,324236,,5,8,"85ce489778b57633c359f23bc4c1f6973aba766a",0,0,0,0,0,""
20201005,"ID",43964,4242,278445,,"totalTestsPeopleViral",318167,152,1903,49,466,,,22930,"10/5/2020 13:59","2020-10-05T13:59:00Z","10/05 09:59",482,1903,,"2020-10-05T13:59:00Z",,,,39722,442,40,,318167,,,,,,,,,,,"16",262,1569,322409,1797,322409,,2,3,"150759f70d6d023ed74f08b264853238026afd10",0,0,0,0,0,""
20201004,"ID",43702,4208,276876,,"totalTestsPeopleViral",316370,152,1900,49,465,,,22744,"10/3/2020 18:55","2020-10-03T18:55:00Z","10/03 14:55",480,1900,,"2020-10-03T18:55:00Z",,,,39494,440,40,,316370,,,,,,,,,,,"16",464,1571,320578,1928,320578,,6,7,"cfa3da6f1b9464027f34aac054a0d8f60fe2ffda",0,0,0,0,0,""
20201003,"ID",43238,4101,275305,,"totalTestsPeopleViral",314442,152,1893,49,462,,,22568,"10/2/2020 19:00","2020-10-02T19:00:00Z","10/02 15:00",474,1893,,"2020-10-02T19:00:00Z",,,,39137,435,39,,314442,,,,,,,,,,,"16",677,2552,318543,3105,318543,,2,20,"2466280af022942a94b73d2e9bd32554800adc0c",0,0,0,0,0,""
20201002,"ID",42561,3977,272753,,"totalTestsPeopleViral",311337,135,1873,36,460,,,22371,"10/1/2020 19:03","2020-10-01T19:03:00Z","10/01 15:03",472,1873,,"2020-10-01T19:03:00Z",,,,38584,433,39,,311337,,,,,,,,,,,"16",513,1783,315314,2181,315314,,3,14,"57711a31a0bb888ff231311bfdcfde9d9b46fdd7",0,0,0,0,0,""
20201001,"ID",42048,3862,270970,,"totalTestsPeopleViral",309156,135,1859,36,457,,,22180,"9/30/2020 19:00","2020-09-30T19:00:00Z","09/30 15:00",469,1859,,"2020-09-30T19:00:00Z",,,,38186,431,38,,309156,,,,,,,,,,,"16",614,1963,313018,2450,313018,,5,12,"3ac02ebcb82c7bac6902a4d104a9945810d72e18",0,0,0,0,0,""
20200930,"ID",41434,3735,269007,,"totalTestsPeopleViral",306706,137,1847,38,457,,,21976,"9/29/2020 19:00","2020-09-29T19:00:00Z","09/29 15:00",464,1847,,"2020-09-29T19:00:00Z",,,,37699,427,37,,306706,,,,,,,,,,,"16",511,1388,310441,1815,310441,,4,15,"99c1601673e49fa37f0d3155d4f7c18a6728c644",0,0,0,0,0,""
20200929,"ID",40923,3651,267619,,"totalTestsPeopleViral",304891,135,1832,44,454,,,21796,"9/28/2020 19:00","2020-09-28T19:00:00Z","09/28 15:00",460,1832,,"2020-09-28T19:00:00Z",,,,37272,423,37,,304891,,,,,,,,,,,"16",422,1266,308542,1639,308542,,0,18,"40a0b73d620891fcacc0e035e9cdc1a044d850f6",0,0,0,0,0,""
20200928,"ID",40501,3602,266353,,"totalTestsPeopleViral",303252,135,1814,44,452,,,21630,"9/27/2020 19:00","2020-09-27T19:00:00Z","09/27 15:00",460,1814,,"2020-09-27T19:00:00Z",,,,36899,423,37,,303252,,,,,,,,,,,"16",205,1868,306854,2046,306854,,0,3,"dfa6b27ba99b3c22e270c59c73cb8e79a3383ff4",0,0,0,0,0,""
20200927,"ID",40296,3575,264485,,"totalTestsPeopleViral",301206,135,1811,44,451,,,21468,"9/26/2020 19:00","2020-09-26T19:00:00Z","09/26 15:00",460,1811,,"2020-09-26T19:00:00Z",,,,36721,423,37,,301206,,,,,,,,,,,"16",539,2065,304781,2554,304781,,2,16,"26f61f4f01d8cb449f0df536b3e8de3c11c781a2",0,0,0,0,0,""
20200926,"ID",39757,3525,262420,,"totalTestsPeopleViral",298652,135,1795,44,451,,,21291,"9/25/2020 18:55","2020-09-25T18:55:00Z","09/25 14:55",458,1795,,"2020-09-25T18:55:00Z",,,,36232,421,37,,298652,,,,,,,,,,,"16",523,1772,302177,2240,302177,,1,29,"941c0ea9a19f2d123a0fdbd4c6f9e531e8b763b3",0,0,0,0,0,""
20200925,"ID",39234,3470,260648,,"totalTestsPeopleViral",296412,147,1766,40,449,,,21105,"9/24/2020 18:54","2020-09-24T18:54:00Z","09/24 14:54",457,1766,,"2020-09-24T18:54:00Z",,,,35764,419,38,,296412,,,,,,,,,,,"16",491,1948,299882,2349,299882,,3,12,"3a318d542743f7b862b7fe5e8e7fb6356fde6e0b",0,0,0,0,0,""
20200924,"ID",38743,3380,258700,,"totalTestsPeopleViral",294063,147,1754,40,448,,,20901,"9/23/2020 19:00","2020-09-23T19:00:00Z","09/23 15:00",454,1754,,"2020-09-23T19:00:00Z",,,,35363,416,38,,294063,,,,,,,,,,,"16",396,1646,297443,1904,297443,,3,14,"cfe0078d8fb8096d15bf9bf897186b017e353678",0,0,0,0,0,""
20200923,"ID",38347,3242,257054,,"totalTestsPeopleViral",292159,130,1740,39,447,,,20674,"9/22/2020 19:00","2020-09-22T19:00:00Z","09/22 15:00",451,1740,,"2020-09-22T19:00:00Z",,,,35105,413,38,,292159,,,,,,,,,,,"16",446,884,295401,1248,295401,,4,14,"13db3da4b10dad39fbac79042c950f9bb900c05c",0,0,0,0,0,""
20200922,"ID",37901,3160,256170,,"totalTestsPeopleViral",290911,130,1726,39,446,,,20485,"9/21/2020 19:00","2020-09-21T19:00:00Z","09/21 15:00",447,1726,,"2020-09-21T19:00:00Z",,,,34741,409,38,,290911,,,,,,,,,,,"16",410,1375,294071,1748,294071,,4,8,"84758703b80987a6cb74dc96c1041e4c9ff7d3a9",0,0,0,0,0,""
20200921,"ID",37491,3123,254795,,"totalTestsPeopleViral",289163,146,1718,51,443,,,20304,"9/20/2020 19:00","2020-09-20T19:00:00Z","09/20 15:00",443,1718,,"2020-09-20T19:00:00Z",,,,34368,405,38,,289163,,,,,,,,,,,"16",244,2114,292286,2333,292286,,2,7,"b9b0e0fb22435de8ffc1631c31554adccc33342b",0,0,0,0,0,""
20200920,"ID",37247,3098,252681,,"totalTestsPeopleViral",286830,146,1711,51,442,,,20105,"9/19/2020 19:00","2020-09-19T19:00:00Z","09/19 15:00",441,1711,,"2020-09-19T19:00:00Z",,,,34149,403,38,,286830,,,,,,,,,,,"16",288,1445,289928,1693,289928,,3,10,"4dd47a00e0565025be90f1ab8e7e8f83a1832c1d",0,0,0,0,0,""
20200919,"ID",36959,3058,251236,,"totalTestsPeopleViral",285137,146,1701,51,441,,,19915,"9/18/2020 19:00","2020-09-18T19:00:00Z","09/18 15:00",438,1701,,"2020-09-18T19:00:00Z",,,,33901,400,38,,285137,,,,,,,,,,,"16",470,2173,288195,2615,288195,,4,19,"8c58b0d86e70093f4f8d72c41df4228e7686b2e4",0,0,0,0,0,""
20200918,"ID",36489,3000,249063,,"totalTestsPeopleViral",282522,123,1682,54,438,,,19691,"9/17/2020 19:00","2020-09-17T19:00:00Z","09/17 15:00",434,1682,,"2020-09-17T19:00:00Z",,,,33489,396,38,,282522,,,,,,,,,,,"16",396,1791,285552,2096,285552,,5,24,"6c6f1f21c162f38f98a278742eb705dea0ed738c",0,0,0,0,0,""
20200917,"ID",36093,2939,247272,,"totalTestsPeopleViral",280426,123,1658,54,433,,,19405,"9/17/2020 15:44","2020-09-17T15:44:00Z","09/17 11:44",429,1658,,"2020-09-17T15:44:00Z",,,,33154,391,38,,280426,,,,,,,,,,,"16",283,1440,283365,1647,283365,,6,27,"c52d440f880b416af3f5e1429a240ca4d7a66d6f",0,0,0,0,0,""
20200916,"ID",35810,2863,245832,,"totalTestsPeopleViral",278779,105,1631,34,426,,,19075,"9/15/2020 19:00","2020-09-15T19:00:00Z","09/15 15:00",423,1631,,"2020-09-15T19:00:00Z",,,,32947,385,38,,278779,,,,,,,,,,,"16",278,1194,281642,1411,281642,,4,19,"af8d4dfbe2b49e08022f9ba186316179f7c8735e",0,0,0,0,0,""
20200915,"ID",35532,2802,244638,,"totalTestsPeopleViral",277368,105,1612,34,424,,,18826,"9/14/2020 19:00","2020-09-14T19:00:00Z","09/14 15:00",419,1612,,"2020-09-14T19:00:00Z",,,,32730,382,37,,277368,,,,,,,,,,,"16",253,1304,280170,1528,280170,,4,8,"dcb59fe0534a9c23be6465e5249d6ca5276236c1",0,0,0,0,0,""
20200914,"ID",35279,2773,243334,,"totalTestsPeopleViral",275840,165,1604,46,423,,,18619,"9/13/2020 19:00","2020-09-13T19:00:00Z","09/13 15:00",415,1604,,"2020-09-13T19:00:00Z",,,,32506,378,37,,275840,,,,,,,,,,,"16",112,1378,278613,1473,278613,,0,8,"e8e7cf4ca46dabc913db9628eb04c3cc56e6c906",0,0,0,0,0,""
20200913,"ID",35167,2756,241956,,"totalTestsPeopleViral",274367,165,1596,46,422,,,18406,"9/12/2020 18:57","2020-09-12T18:57:00Z","09/12 14:57",415,1596,,"2020-09-12T18:57:00Z",,,,32411,378,37,,274367,,,,,,,,,,,"16",217,1296,277123,1479,277123,,3,27,"cdebf7d6176a1ecfa276a498f677aaf7c27c447d",0,0,0,0,0,""
20200912,"ID",34950,2722,240660,,"totalTestsPeopleViral",272888,165,1569,46,412,,,18052,"9/11/2020 19:00","2020-09-11T19:00:00Z","09/11 15:00",412,1569,,"2020-09-11T19:00:00Z",,,,32228,375,37,,272888,,,,,,,,,,,"16",333,1461,275610,1746,275610,,5,18,"10378d3b6f07703a8497ee82055fb0b10c8dd0a9",0,0,0,0,0,""
20200911,"ID",34617,2674,239199,,"totalTestsPeopleViral",271142,158,1551,51,407,,,17599,"9/10/2020 19:00","2020-09-10T19:00:00Z","09/10 15:00",407,1551,,"2020-09-10T19:00:00Z",,,,31943,369,37,,271142,,,,,,,,,,,"16",307,1345,273816,1600,273816,,1,15,"a01e1c4ff5423df704ddcec3f3fe6fb49ba64230",0,0,0,0,0,""
20200910,"ID",34310,2622,237854,,"totalTestsPeopleViral",269542,158,1536,51,406,,,17304,"9/9/2020 19:00","2020-09-09T19:00:00Z","09/09 15:00",406,1536,,"2020-09-09T19:00:00Z",,,,31688,369,37,,269542,,,,,,,,,,,"16",329,1301,272164,1546,272164,,17,34,"781fcde8e10a76e6afac1341f74b01a9bdf36533",0,0,0,0,0,""
20200909,"ID",33981,2538,236553,,"totalTestsPeopleViral",267996,114,1502,35,399,,,16956,"9/8/2020 19:00","2020-09-08T19:00:00Z","09/08 15:00",389,1502,,"2020-09-08T19:00:00Z",,,,31443,353,36,,267996,,,,,,,,,,,"16",240,1056,270534,1254,270534,,4,34,"bba6ba717d96bb6d4a1113fb8560c576d94b23e8",0,0,0,0,0,""
20200908,"ID",33741,2496,235497,,"totalTestsPeopleViral",266742,114,1468,35,394,,,16760,"9/7/2020 19:00","2020-09-07T19:00:00Z","09/07 15:00",385,1468,,"2020-09-07T19:00:00Z",,,,31245,349,36,,266742,,,,,,,,,,,"16",74,975,269238,1039,269238,,0,2,"b0d6fcb2f8d03f177a466bfe5bd888fd918e3287",0,0,0,0,0,""
20200907,"ID",33667,2486,234522,,"totalTestsPeopleViral",265703,151,1466,50,394,,,16554,"9/6/2020 19:00","2020-09-06T19:00:00Z","09/06 15:00",385,1466,,"2020-09-06T19:00:00Z",,,,31181,349,36,,265703,,,,,,,,,,,"16",190,827,268189,1009,268189,,1,0,"4c0127bd95fc16d3a1283a25aa4170eb1f44fc17",0,0,0,0,0,""
20200906,"ID",33477,2478,233695,,"totalTestsPeopleViral",264694,151,1466,50,394,,,16339,"9/5/2020 19:00","2020-09-05T19:00:00Z","09/05 15:00",384,1466,,"2020-09-05T19:00:00Z",,,,30999,348,36,,264694,,,,,,,,,,,"16",281,1246,267172,1511,267172,,2,5,"ad8093772bd7cfe1516326d756ba43872b87a9d6",0,0,0,0,0,""
20200905,"ID",33196,2462,232449,,"totalTestsPeopleViral",263183,151,1461,50,394,,,16071,"9/4/2020 19:00","2020-09-04T19:00:00Z","09/04 15:00",382,1461,,"2020-09-04T19:00:00Z",,,,30734,346,36,,263183,,,,,,,,,,,"16",269,1649,265645,1894,265645,,10,19,"fd4af61a0c70c43268ed2694cdabac259e4fd1ad",0,0,0,0,0,""
20200904,"ID",32927,2438,230800,,"totalTestsPeopleViral",261289,171,1442,45,392,,,15787,"9/3/2020 19:00","2020-09-03T19:00:00Z","09/03 15:00",372,1442,,"2020-09-03T19:00:00Z",,,,30489,336,36,,261289,,,,,,,,,,,"16",263,2064,263727,2326,263727,,0,7,"b749f10d2634336e3ebe27336c2ffbefd2e0131f",0,0,0,0,0,""
20200903,"ID",32664,2437,228736,,"totalTestsPeopleViral",258963,171,1435,45,388,,,15585,"9/2/2020 19:00","2020-09-02T19:00:00Z","09/02 15:00",372,1435,,"2020-09-02T19:00:00Z",,,,30227,336,36,,258963,,,,,,,,,,,"16",296,2008,261400,2266,261400,,4,41,"7383916300a1caaaafb70f7ccf6db64378828ac5",0,0,0,0,0,""
20200902,"ID",32368,2399,226728,,"totalTestsPeopleViral",256697,162,1394,46,381,,,15212,"9/1/2020 19:00","2020-09-01T19:00:00Z","09/01 15:00",368,1394,,"2020-09-01T19:00:00Z",,,,29969,333,35,,256697,,,,,,,,,,,"16",280,1127,259096,1349,259096,,7,0,"cb95dfeb207e1661103d91f0b44a6f9ddc93cf91",0,0,0,0,0,""
20200901,"ID",32088,2341,225601,,"totalTestsPeopleViral",255348,162,1394,46,379,,,14963,"8/31/2020 19:05","2020-08-31T19:05:00Z","08/31 15:05",361,1394,,"2020-08-31T19:05:00Z",,,,29747,327,34,,255348,,,,,,,,,,,"16",221,1455,257689,1646,257689,,2,25,"a657b1628247ab2e9211b779f2e0b4c80784afd4",0,0,0,0,0,""
20200831,"ID",31867,2311,224146,,"totalTestsPeopleViral",253702,181,1369,52,375,,,14712,"8/30/2020 19:00","2020-08-30T19:00:00Z","08/30 15:00",359,1369,,"2020-08-30T19:00:00Z",,,,29556,325,34,,253702,,,,,,,,,,,"16",190,1498,256013,1680,256013,,1,4,"2e59f9d291a5a8f7e5f55eb2fd272d93f075b5bb",0,0,0,0,0,""
20200830,"ID",31677,2303,222648,,"totalTestsPeopleViral",252022,181,1365,52,374,,,14490,"8/29/2020 19:00","2020-08-29T19:00:00Z","08/29 15:00",358,1365,,"2020-08-29T19:00:00Z",,,,29374,324,34,,252022,,,,,,,,,,,"16",293,2982,254325,3268,254325,,5,16,"33938d8a1bb93c365a6ce99415c047ff60dfc15d",0,0,0,0,0,""
20200829,"ID",31384,2296,219666,,"totalTestsPeopleViral",248754,181,1349,52,369,,,14175,"8/28/2020 19:00","2020-08-28T19:00:00Z","08/28 15:00",353,1349,,"2020-08-28T19:00:00Z",,,,29088,319,34,,248754,,,,,,,,,,,"16",262,1601,251050,1848,251050,,10,21,"52b549a129a507d82573cb5db9d5f0f59b5fd695",0,0,0,0,0,""
20200828,"ID",31122,2281,218065,,"totalTestsPeopleViral",246906,176,1328,53,366,,,13928,"8/27/2020 19:00","2020-08-27T19:00:00Z","08/27 15:00",343,1328,,"2020-08-27T19:00:00Z",,,,28841,309,34,,246906,,,,,,,,,,,"16",342,2174,249187,2459,249187,,6,24,"a0530e02c35b22303a8ded18d41c32889c1646e6",0,0,0,0,0,""
20200827,"ID",30780,2224,215891,,"totalTestsPeopleViral",244447,176,1304,53,363,,,13657,"8/26/2020 19:00","2020-08-26T19:00:00Z","08/26 15:00",337,1304,,"2020-08-26T19:00:00Z",,,,28556,304,33,,244447,,,,,,,,,,,"16",305,1504,246671,1728,246671,,11,19,"9660b4a312e6a34ba2d56726e1695705e3c473b8",0,0,0,0,0,""
20200826,"ID",30475,2143,214387,,"totalTestsPeopleViral",242719,160,1285,47,359,,,13353,"8/25/2020 18:59","2020-08-25T18:59:00Z","08/25 14:59",326,1285,,"2020-08-25T18:59:00Z",,,,28332,293,33,,242719,,,,,,,,,,,"16",405,4362,244862,4705,244862,,12,16,"8191c1357cfbcd636d003da7a7b22f0ee43914c0",0,0,0,0,0,""
20200825,"ID",30070,2081,210025,,"totalTestsPeopleViral",238014,160,1269,47,350,,,13081,"8/24/2020 19:04","2020-08-24T19:04:00Z","08/24 15:04",314,1269,,"2020-08-24T19:04:00Z",,,,27989,285,29,,238014,,,,,,,,,,,"16",217,1293,240095,1467,240095,,7,13,"e4a31207171b94b65b0e71f2766e217c836887e3",0,0,0,0,0,""
20200824,"ID",29853,2038,208732,,"totalTestsPeopleViral",236547,192,1256,52,347,,,12867,"8/23/2020 19:00","2020-08-23T19:00:00Z","08/23 15:00",307,1256,,"2020-08-23T19:00:00Z",,,,27815,278,29,,236547,,,,,,,,,,,"16",191,1114,238585,1292,238585,,1,10,"918ee8d3f0ce43390061704763a211257a8eca0c",0,0,0,0,0,""
20200823,"ID",29662,2025,207618,,"totalTestsPeopleViral",235255,192,1246,52,346,,,12606,"8/22/2020 18:55","2020-08-22T18:55:00Z","08/22 14:55",306,1246,,"2020-08-22T18:55:00Z",,,,27637,277,29,,235255,,,,,,,,,,,"16",293,1134,237280,1400,237280,,2,13,"8395ffc641bf6d6bd3ed0d1599e8bb4a15169c84",0,0,0,0,0,""
20200822,"ID",29369,1998,206484,,"totalTestsPeopleViral",233855,192,1233,52,344,,,12359,"8/21/2020 19:00","2020-08-21T19:00:00Z","08/21 15:00",304,1233,,"2020-08-21T19:00:00Z",,,,27371,274,30,,233855,,,,,,,,,,,"16",249,1824,235853,2056,235853,,6,7,"d087fccfa186a606d0a3ce8fe52a9d97e0d4d029",0,0,0,0,0,""
20200821,"ID",29120,1981,204660,,"totalTestsPeopleViral",231799,205,1226,51,340,,,12007,"8/20/2020 19:00","2020-08-20T19:00:00Z","08/20 15:00",298,1226,,"2020-08-20T19:00:00Z",,,,27139,269,29,,231799,,,,,,,,,,,"16",424,2209,233780,2594,233780,,7,26,"aa3b68b82acba08e33904211da8fc4dbc0bc9d0f",0,0,0,0,0,""
20200820,"ID",28696,1942,202451,,"totalTestsPeopleViral",229205,205,1200,43,337,,,11733,"8/19/2020 19:00","2020-08-19T19:00:00Z","08/19 15:00",291,1200,,"2020-08-19T19:00:00Z",,,,26754,264,27,,229205,,,,,,,,,,,"16",370,1654,231147,1977,231147,,9,30,"fe8966b6a639945ea85f9131c03adab386928921",0,0,0,0,0,""
20200819,"ID",28326,1895,200797,,"totalTestsPeopleViral",227228,167,1170,37,328,,,11397,"8/18/2020 19:00","2020-08-18T19:00:00Z","08/18 15:00",282,1170,,"2020-08-18T19:00:00Z",,,,26431,255,27,,227228,,,,,,,,,,,"16",384,1870,229123,2210,229123,,9,41,"fe32082c4fd3b47a0e8a0bdeeddcb5d6f8118251",0,0,0,0,0,""
20200818,"ID",27942,1851,198927,,"totalTestsPeopleViral",225018,167,1129,37,316,,,11093,"8/17/2020 19:00","2020-08-17T19:00:00Z","08/17 15:00",273,1129,,"2020-08-17T19:00:00Z",,,,26091,245,28,,225018,,,,,,,,,,,"16",282,2100,226869,2350,226869,,4,19,"0b9002907d8df72f1a306d285b4e05e4c96210bb",0,0,0,0,0,""
20200817,"ID",27660,1819,196827,,"totalTestsPeopleViral",222668,206,1110,38,313,,,10883,"8/16/2020 19:00","2020-08-16T19:00:00Z","08/16 15:00",269,1110,,"2020-08-16T19:00:00Z",,,,25841,241,28,,222668,,,,,,,,,,,"16",183,1082,224487,1262,224487,,0,7,"aeecdfa78a901d3f8a517b7ccfbfb0b9b396ce8f",0,0,0,0,0,""
20200816,"ID",27477,1816,195745,,"totalTestsPeopleViral",221406,206,1103,38,312,,,10616,"8/15/2020 19:00","2020-08-15T19:00:00Z","08/15 15:00",269,1103,,"2020-08-15T19:00:00Z",,,,25661,241,28,,221406,,,,,,,,,,,"16",304,1906,223222,2182,223222,,4,12,"0eb21d8b2b0d18e3838f0b3747710e7d05331a92",0,0,0,0,0,""
20200815,"ID",27173,1788,193839,,"totalTestsPeopleViral",219224,206,1091,38,309,,,10369,"8/14/2020 19:00","2020-08-14T19:00:00Z","08/14 15:00",265,1091,,"2020-08-14T19:00:00Z",,,,25385,239,26,,219224,,,,,,,,,,,"16",542,2249,221012,2751,221012,,14,23,"cd59ff6515b9274a78f4c4678812805f520d8721",0,0,0,0,0,""
20200814,"ID",26631,1748,191590,,"totalTestsPeopleViral",216473,216,1068,36,302,,,10089,"8/13/2020 19:03","2020-08-13T19:03:00Z","08/13 15:03",251,1068,,"2020-08-13T19:03:00Z",,,,24883,225,26,,216473,,,,,,,,,,,"16",498,3110,218221,3575,218221,,5,17,"91fbe8c4a4c830716ddb5fded4b2ca882e08fbbd",0,0,0,0,0,""
20200813,"ID",26133,1715,188480,,"totalTestsPeopleViral",212898,216,1051,36,296,,,9850,"8/12/2020 18:52","2020-08-12T18:52:00Z","08/12 14:52",246,1051,,"2020-08-12T18:52:00Z",,,,24418,221,25,,212898,,,,,,,,,,,"16",538,1831,214613,2299,214613,,0,14,"dc94534cf6a63c300e6cfbcd4c8558e8bdd98c94",0,0,0,0,0,""
20200812,"ID",25595,1645,186649,,"totalTestsPeopleViral",210599,189,1037,32,289,,,9548,"8/11/2020 18:58","2020-08-11T18:58:00Z","08/11 14:58",246,1037,,"2020-08-11T18:58:00Z",,,,23950,221,25,,210599,,,,,,,,,,,"16",495,3344,212244,3769,212244,,7,31,"a39f85bc341cb342ca7ef114a27abb44b8cb823a",0,0,0,0,0,""
20200811,"ID",25100,1575,183305,,"totalTestsPeopleViral",206830,189,1006,32,282,,,9341,"8/10/2020 18:58","2020-08-10T18:58:00Z","08/10 14:58",239,1006,,"2020-08-10T18:58:00Z",,,,23525,214,25,,206830,,,,,,,,,,,"16",429,1500,208405,1902,208405,,2,7,"b2a6bf52470ff31e794fa72aff43b8bdc997130f",0,0,0,0,0,""
20200810,"ID",24671,1548,181805,,"totalTestsPeopleViral",204928,201,999,48,280,,,9157,"8/9/2020 18:46","2020-08-09T18:46:00Z","08/09 14:46",237,999,,"2020-08-09T18:46:00Z",,,,23123,212,25,,204928,,,,,,,,,,,"16",176,1469,206476,1639,206476,,2,11,"946ba871e75667a936eda711efe23875474c8813",0,0,0,0,0,""
20200809,"ID",24495,1542,180336,,"totalTestsPeopleViral",203289,201,988,48,279,,,8921,"8/8/2020 19:00","2020-08-08T19:00:00Z","08/08 15:00",235,988,,"2020-08-08T19:00:00Z",,,,22953,211,24,,203289,,,,,,,,,,,"16",573,1287,204831,1832,204831,,6,20,"fe63df479880c69cf2c0122b264e28c93a899af9",0,0,0,0,0,""
20200808,"ID",23922,1514,179049,,"totalTestsPeopleViral",201457,201,968,48,276,,,8738,"8/7/2020 18:46","2020-08-07T18:46:00Z","08/07 14:46",229,968,,"2020-08-07T18:46:00Z",,,,22408,205,24,,201457,,,,,,,,,,,"16",523,3748,202971,4240,202971,,6,14,"a67d318a2eee562d4936a42ede76c660df1635f3",0,0,0,0,0,""
20200807,"ID",23399,1483,175301,,"totalTestsPeopleViral",197217,242,954,42,269,,,8486,"8/6/2020 19:00","2020-08-06T19:00:00Z","08/06 15:00",223,954,,"2020-08-06T19:00:00Z",,,,21916,199,24,,197217,,,,,,,,,,,"16",692,3415,198700,4063,198700,,6,23,"e9bfce3df62ed844083feee42a9818ed9c0d7649",0,0,0,0,0,""
20200806,"ID",22707,1439,171886,,"totalTestsPeopleViral",193154,242,931,42,262,,,8207,"8/5/2020 19:00","2020-08-05T19:00:00Z","08/05 15:00",217,931,,"2020-08-05T19:00:00Z",,,,21268,194,23,,193154,,,,,,,,,,,"16",473,2233,194593,2634,194593,,7,25,"5c0823bed65fc69916946f57f1f6f36b22600613",0,0,0,0,0,""
20200805,"ID",22234,1367,169653,,"totalTestsPeopleViral",190520,195,906,39,260,,,7875,"8/4/2020 19:00","2020-08-04T19:00:00Z","08/04 15:00",210,906,,"2020-08-04T19:00:00Z",,,,20867,187,23,,190520,,,,,,,,,,,"16",559,3550,191887,4045,191887,,10,20,"4669fa9e6f3ac8d6f126ae7afa339b41eea32ff8",0,0,0,0,0,""
20200804,"ID",21675,1303,166103,,"totalTestsPeopleViral",186475,106,886,22,256,,,7617,"8/3/2020 18:56","2020-08-03T18:56:00Z","08/03 14:56",200,886,,"2020-08-03T18:56:00Z",,,,20372,177,23,,186475,,,,,,,,,,,"16",331,2110,187778,2415,187778,,3,12,"0ce706c82a44644f4fc3ab6a39153e27c9376c60",0,0,0,0,0,""
20200803,"ID",21344,1277,163993,,"totalTestsPeopleViral",184060,239,874,54,253,,,7370,"8/2/2020 18:49","2020-08-02T18:49:00Z","08/02 14:49",197,874,,"2020-08-02T18:49:00Z",,,,20067,174,23,,184060,,,,,,,,,,,"16",230,808,185337,1026,185337,,0,18,"8e69676ff60f103673766d5cc072643776180950",0,0,0,0,0,""
20200802,"ID",21114,1265,163185,,"totalTestsPeopleViral",183034,239,856,54,250,,,7146,"8/1/2020 18:52","2020-08-01T18:52:00Z","08/01 14:52",197,856,,"2020-08-01T18:52:00Z",,,,19849,174,23,,183034,,,,,,,,,,,"16",393,2033,184299,2419,184299,,8,6,"ff957a824d6fa73da6066741b4af1202c3b6f5d5",0,0,0,0,0,""
20200801,"ID",20721,1258,161152,,"totalTestsPeopleViral",180615,239,850,54,249,,,6998,"7/31/2020 19:15","2020-07-31T19:15:00Z","07/31 15:15",189,850,,"2020-07-31T19:15:00Z",,,,19463,155,22,,180615,,,,,,,,,,,"16",475,2288,181873,2731,181873,,12,15,"49f5b9020e7e4be503087f109a8f110ce9eb3e9c",0,0,0,0,0,""
20200731,"ID",20246,1226,158864,,"totalTestsPeopleViral",177884,236,835,51,247,,,6744,"7/30/2020 18:52","2020-07-30T18:52:00Z","07/30 14:52",177,835,,"2020-07-30T18:52:00Z",,,,19020,155,22,,177884,,,,,,,,,,,"16",567,3024,179110,3541,179110,,4,27,"fc907335b557038c923a571b93f65815f5d3efde",0,0,0,0,0,""
20200730,"ID",19679,1176,155840,,"totalTestsPeopleViral",174343,236,808,51,236,,,6472,"7/29/2020 18:58","2020-07-29T18:58:00Z","07/29 14:58",173,808,,"2020-07-29T18:58:00Z",,,,18503,152,21,,174343,,,,,,,,,,,"16",457,2020,175519,2451,175519,,13,25,"ede2eb220e8077e9337e51da04c4536304523d4f",0,0,0,0,0,""
20200729,"ID",19222,1150,153820,,"totalTestsPeopleViral",171892,209,783,40,232,,,6203,"7/28/2020 19:00","2020-07-28T19:00:00Z","07/28 15:00",160,783,,"2020-07-28T19:00:00Z",,,,18072,139,21,,171892,,,,,,,,,,,"16",528,1797,173042,2304,173042,,8,33,"06b1a16c2bec329b484425e680b98cb0ba5e196e",0,0,0,0,0,""
20200728,"ID",18694,1129,152023,,"totalTestsPeopleViral",169588,209,750,40,224,,,5964,"7/27/2020 19:00","2020-07-27T19:00:00Z","07/27 15:00",152,750,,"2020-07-27T19:00:00Z",,,,17565,130,22,,169588,,,,,,,,,,,"16",517,2206,170717,2685,170717,,6,9,"562e59e0b8d6135796b6bbee716b4aedc1a13628",0,0,0,0,0,""
20200727,"ID",18177,1091,149817,,"totalTestsPeopleViral",166903,204,741,45,222,,,5731,"7/26/2020 19:00","2020-07-26T19:00:00Z","07/26 15:00",146,741,,"2020-07-26T19:00:00Z",,,,17086,125,21,,166903,,,,,,,,,,,"16",350,1420,167994,1771,167994,,0,18,"76b36e94563dee762f9478fa6ab517190cbd26aa",0,0,0,0,0,""
20200726,"ID",17827,1092,148397,,"totalTestsPeopleViral",165132,204,723,45,217,,,5483,"7/25/2020 19:00","2020-07-25T19:00:00Z","07/25 15:00",146,723,,"2020-07-25T19:00:00Z",,,,16735,125,21,,165132,,,,,,,,,,,"16",563,2221,166224,2748,166224,,2,14,"d8bb576e94d4210ab6b21408e2f1e6aa26dec88c",0,0,0,0,0,""
20200725,"ID",17264,1056,146176,,"totalTestsPeopleViral",162384,204,709,45,210,,,5251,"7/24/2020 19:00","2020-07-24T19:00:00Z","07/24 15:00",144,709,,"2020-07-24T19:00:00Z",,,,16208,123,21,,162384,,,,,,,,,,,"16",528,2719,163440,3221,163440,,6,12,"f4b0128c7431d6924060d797e3546f8083e97b46",0,0,0,0,0,""
20200724,"ID",16736,1030,143457,,"totalTestsPeopleViral",159163,204,697,46,207,,,5008,"7/23/2020 19:00","2020-07-23T19:00:00Z","07/23 15:00",138,697,,"2020-07-23T19:00:00Z",,,,15706,117,21,,159163,,,,,,,,,,,"16",414,2953,160193,3338,160193,,3,23,"23b049f2aa8aa125b03948bc07beeaad63039321",0,0,0,0,0,""
20200723,"ID",16322,1001,140504,,"totalTestsPeopleViral",155825,188,674,46,201,,,4746,"7/22/2020 19:00","2020-07-22T19:00:00Z","07/22 15:00",135,674,,"2020-07-22T19:00:00Z",,,,15321,114,21,,155825,,,,,,,,,,,"16",500,2355,156826,2816,156826,,9,18,"5720c2a2aa1074ff6ac88989f572fdc188dacad2",0,0,0,0,0,""
20200722,"ID",15822,962,138149,,"totalTestsPeopleViral",153009,188,656,46,197,,,4504,"7/21/2020 19:00","2020-07-21T19:00:00Z","07/21 15:00",126,656,,"2020-07-21T19:00:00Z",,,,14860,103,33,,153009,,,,,,,,,,,"16",556,2344,153971,2867,153971,,4,35,"9757a8707b2160cf33d354c30963f8df6fdae41e",0,0,0,0,0,""
20200721,"ID",15266,929,135805,,"totalTestsPeopleViral",150142,188,621,46,186,,,4335,"7/20/2020 19:00","2020-07-20T19:00:00Z","07/20 15:00",122,621,,"2020-07-20T19:00:00Z",,,,14337,100,22,,150142,,,,,,,,,,,"16",393,2790,151071,3148,151071,,3,21,"f9619d5b3a85cfd8580244c144485710c7460df1",0,0,0,0,0,""
20200720,"ID",14873,894,133015,,"totalTestsPeopleViral",146994,224,600,33,181,,,4149,"7/19/2020 19:00","2020-07-19T19:00:00Z","07/19 15:00",119,600,,"2020-07-19T19:00:00Z",,,,13979,97,22,,146994,,,,,,,,,,,"16",571,1131,147888,1691,147888,,0,17,"50a3accb7b78cd1ef84a531aa9c138e221c3cd5f",0,0,0,0,0,""
20200719,"ID",14302,883,131884,,"totalTestsPeopleViral",145303,224,583,33,180,,,3989,"7/18/2020 18:52","2020-07-18T18:52:00Z","07/18 14:52",119,583,,"2020-07-18T18:52:00Z",,,,13419,97,22,,145303,,,,,,,,,,,"16",550,3131,146186,3667,146186,,1,13,"9db018e991334ace2a0a274867ea944ddcf533ff",0,0,0,0,0,""
20200718,"ID",13752,869,128753,,"totalTestsPeopleViral",141636,224,570,33,170,,,3827,"7/17/2020 19:00","2020-07-17T19:00:00Z","07/17 15:00",118,570,,"2020-07-17T19:00:00Z",,,,12883,96,22,,141636,,,,,,,,,,,"16",619,1567,142505,2155,142505,,4,16,"1140addfcc06d5e6dee696c9e3c3f135775638d8",0,0,0,0,0,""
20200717,"ID",13133,838,127186,,"totalTestsPeopleViral",139481,153,554,35,165,,,3676,"7/16/2020 19:00","2020-07-16T19:00:00Z","07/16 15:00",114,554,,"2020-07-16T19:00:00Z",,,,12295,93,21,,139481,,,,,,,,,,,"16",688,2768,140319,3426,140319,,4,28,"087bd4642e28d3349e412aaed51889ceb37bffd8",0,0,0,0,0,""
20200716,"ID",12445,808,124418,,"totalTestsPeopleViral",136055,153,526,35,151,,,3513,"7/15/2020 19:00","2020-07-15T19:00:00Z","07/15 15:00",110,526,,"2020-07-15T19:00:00Z",,,,11637,89,21,,136055,,,,,,,,,,,"16",727,2222,136863,2913,136863,,7,16,"aef2256a5593ebb4c259ab938dec0ec55833667b",0,0,0,0,0,""
20200715,"ID",11718,772,122196,,"totalTestsPeopleViral",133142,153,510,35,151,,,3360,"7/14/2020 19:00","2020-07-14T19:00:00Z","07/14 15:00",103,510,,"2020-07-14T19:00:00Z",,,,10946,83,20,,133142,,,,,,,,,,,"16",316,3314,133914,3602,133914,,1,10,"2c2520af13554cdca58cdf3b39f60f4f1ebea84c",0,0,0,0,0,""
20200714,"ID",11402,744,118882,,"totalTestsPeopleViral",129540,153,500,35,144,,,3262,"7/13/2020 19:00","2020-07-13T19:00:00Z","07/13 15:00",102,500,,"2020-07-13T19:00:00Z",,,,10658,82,20,,129540,,,,,,,,,,,"16",500,2652,130284,3147,130284,,0,23,"e94832a6753ae8bb9c6b92fe29844c5323be3e89",0,0,0,0,0,""
20200713,"ID",10902,739,116230,,"totalTestsPeopleViral",126393,153,477,35,142,,,3179,"7/12/2020 19:00","2020-07-12T19:00:00Z","07/12 15:00",102,477,,"2020-07-12T19:00:00Z",,,,10163,82,20,,126393,,,,,,,,,,,"16",397,1474,127132,1862,127132,,0,9,"717aa87da7a4795db0451662c955ca05ffa3a97c",0,0,0,0,0,""
20200712,"ID",10505,730,114756,,"totalTestsPeopleViral",124531,140,468,33,139,,,3114,"7/11/2020 19:00","2020-07-11T19:00:00Z","07/11 15:00",102,468,,"2020-07-11T19:00:00Z",,,,9775,82,20,,124531,,,,,,,,,,,"16",577,2335,125261,2891,125261,,1,19,"0443157e60785198950034e5ebdb854c3e1bb980",0,0,0,0,0,""
20200711,"ID",9928,709,112421,,"totalTestsPeopleViral",121640,122,449,33,138,,,3066,"7/10/2020 19:00","2020-07-10T19:00:00Z","07/10 15:00",101,449,,"2020-07-10T19:00:00Z",,,,9219,81,20,,121640,,,,,,,,,,,"16",500,3771,122349,4250,122349,,1,17,"bb8e50ca1265ddb9e48a61ec5c1319f3bab6bc03",0,0,0,0,0,""
20200710,"ID",9428,688,108650,,"totalTestsPeopleViral",117390,124,432,29,137,,,3022,"7/9/2020 19:00","2020-07-09T19:00:00Z","07/09 15:00",100,432,,"2020-07-09T19:00:00Z",,,,8740,80,20,,117390,,,,,,,,,,,"16",459,2999,118078,3432,118078,,2,21,"a792e3e50d5e285d304e83142efd4e69d54f387d",0,0,0,0,0,""
20200709,"ID",8969,662,105651,,"totalTestsPeopleViral",113958,120,411,28,133,,,2978,"7/8/2020 19:00","2020-07-08T19:00:00Z","07/08 15:00",98,411,,"2020-07-08T19:00:00Z",,,,8307,78,20,,113958,,,,,,,,,,,"16",430,2859,114620,3282,114620,,4,15,"17a6e5dd68ca1ef8edeb08ab04dd4768ae5f6645",0,0,0,0,0,""
20200708,"ID",8539,655,102792,,"totalTestsPeopleViral",110676,118,396,26,130,,,2932,"7/7/2020 19:00","2020-07-07T19:00:00Z","07/07 15:00",94,396,,"2020-07-07T19:00:00Z",,,,7884,74,20,,110676,,,,,,,,,,,"16",487,2303,111331,2751,111331,,0,9,"65f4b9f6442ab5e5a97fe19c7ec6227265d0ef00",0,0,0,0,0,""
20200707,"ID",8052,616,100489,,"totalTestsPeopleViral",107925,105,387,25,130,,,2907,"7/6/2020 19:00","2020-07-06T19:00:00Z","07/06 15:00",94,387,,"2020-07-06T19:00:00Z",,,,7436,74,20,,107925,,,,,,,,,,,"16",319,1757,108541,2049,108541,,1,18,"2df11768c38525218ffa0a7efb75d9a85c64eb8d",0,0,0,0,0,""
20200706,"ID",7733,589,98732,,"totalTestsPeopleViral",105876,85,369,22,124,,,2886,"7/5/2020 19:00","2020-07-05T19:00:00Z","07/05 15:00",93,369,,"2020-07-05T19:00:00Z",,,,7144,73,20,,105876,,,,,,,,,,,"16",363,1836,106465,2201,106465,,0,10,"8f1502ec9b267f4e112fe5496f5143506e86cff4",0,0,0,0,0,""
20200705,"ID",7370,591,96896,,"totalTestsPeopleViral",103675,71,359,19,122,,,2858,"7/3/2020 19:00","2020-07-03T19:00:00Z","07/03 15:00",93,359,,"2020-07-03T19:00:00Z",,,,6779,73,20,,103675,,,,,,,,,,,"16",376,2823,104266,3201,104266,,0,4,"230be996598c125035ed71e60d7b49c4bb87a99a",0,0,0,0,0,""
20200704,"ID",6994,593,94073,,"totalTestsPeopleViral",100474,67,355,23,121,,,2831,"7/3/2020 19:00","2020-07-03T19:00:00Z","07/03 15:00",93,355,,"2020-07-03T19:00:00Z",,,,6401,73,20,,100474,,,,,,,,,,,"16",401,1957,101067,2355,101067,,1,5,"e52947e30e7a243277706bf190b37513697173ea",0,0,0,0,0,""
20200703,"ID",6593,590,92116,,"totalTestsPeopleViral",98119,64,350,23,121,,,2801,"7/2/2020 19:00","2020-07-02T19:00:00Z","07/02 15:00",92,350,,"2020-07-02T19:00:00Z",,,,6003,72,20,,98119,,,,,,,,,,,"16",223,3365,98709,3582,98709,,0,10,"f68735da5459cbdb3a5f8e123c7d143cdf7b4794",0,0,0,0,0,""
20200702,"ID",6370,584,88751,,"totalTestsPeopleViral",94537,69,340,17,118,,,4393,"7/1/2020 19:00","2020-07-01T19:00:00Z","07/01 15:00",92,340,,"2020-07-01T19:00:00Z",,,,5786,72,20,,94537,,,,,,,,,,,"16",253,3828,95121,4061,95121,,0,10,"2c209e64530b01043e3914c93972eed9291a1cda",0,0,0,0,0,""
20200701,"ID",6117,564,84923,,"totalTestsPeopleViral",90476,75,330,18,116,,,4233,"6/30/2020 19:00","2020-06-30T19:00:00Z","06/30 15:00",92,330,,"2020-06-30T19:00:00Z",,,,5553,72,20,,90476,,,,,,,,,,,"16",365,1372,91040,1713,91040,,1,8,"274796805725d93c275f7352918cbe101303c98d",0,0,0,0,0,""
20200630,"ID",5752,540,83551,,"totalTestsPeopleViral",88763,60,322,18,114,,,4073,"6/29/2020 19:00","2020-06-29T19:00:00Z","06/29 15:00",91,322,,"2020-06-29T19:00:00Z",,,,5212,71,20,,88763,,,,,,,,,,,"16",433,2525,89303,2947,89303,,0,10,"a896cfabc49e9d97dc039cc7d706bfbb96aef7d3",0,0,0,0,0,""
20200629,"ID",5319,529,81026,,"totalTestsPeopleViral",85816,50,312,17,111,,,3898,"6/27/2020 19:00","2020-06-27T19:00:00Z","06/27 15:00",91,312,,"2020-06-27T19:00:00Z",,,,4790,71,20,,85816,,,,,,,,,,,"16",0,0,86345,0,86345,,0,0,"d722a75109dda99710bc0cb66489b46fcb93fcb5",0,0,0,0,0,""
20200628,"ID",5319,529,81026,,"totalTestsPeopleViral",85816,48,312,18,111,,,3898,"6/27/2020 19:00","2020-06-27T19:00:00Z","06/27 15:00",91,312,,"2020-06-27T19:00:00Z",,,,4790,71,20,,85816,,,,,,,,,,,"16",171,2118,86345,2279,86345,,1,3,"c287a909e9b3f35495f70e97952f045b40cbe975",0,0,0,0,0,""
20200627,"ID",5148,519,78908,,"totalTestsPeopleViral",83537,42,309,19,108,,,3827,"6/26/2020 19:00","2020-06-26T19:00:00Z","06/26 15:00",90,309,,"2020-06-26T19:00:00Z",,,,4629,70,20,,83537,,,,,,,,,,,"16",283,1403,84056,1666,84056,,0,6,"d9384bd85f6a4a22d8b4723bd3f89a3740719d9b",0,0,0,0,0,""
20200626,"ID",4865,499,77505,,"totalTestsPeopleViral",81871,48,303,20,106,,,3712,"6/25/2020 19:00","2020-06-25T19:00:00Z","06/25 15:00",90,303,,"2020-06-25T19:00:00Z",,,,4366,70,20,,81871,,,,,,,,,,,"16",220,1611,82370,1811,82370,,0,3,"a318abc9a46e16e2bc0bbe8a5d95b5316709bb47",0,0,0,0,0,""
20200625,"ID",4645,479,75894,,"totalTestsPeopleViral",80060,45,300,14,106,,,3610,"6/25/2020 00:00","2020-06-25T00:00:00Z","06/24 20:00",90,300,,"2020-06-25T00:00:00Z",,,,4166,70,20,,80060,,,,,,,,,,,"16",243,2461,80539,2684,80539,,1,2,"6700e6fd4f0ec8960c16134f3a0384e1c2a7fad4",0,0,0,0,0,""
20200624,"ID",4402,459,73433,,"totalTestsPeopleViral",77376,34,298,14,105,,,3484,"6/24/2020 00:00","2020-06-24T00:00:00Z","06/23 20:00",89,298,,"2020-06-24T00:00:00Z",,,,3943,69,20,,77376,,,,,,,,,,,"16",148,1523,77835,1646,77835,,0,5,"057a8ebb1efc9f066a406ba63e1cb9d4be959699",0,0,0,0,0,""
20200623,"ID",4254,434,71910,,"totalTestsPeopleViral",75730,39,293,14,102,,,3405,"6/23/2020 00:00","2020-06-23T00:00:00Z","06/22 20:00",89,293,,"2020-06-23T00:00:00Z",,,,3820,69,20,,75730,,,,,,,,,,,"16",248,2948,76164,3183,76164,,0,10,"0ec2d88d0dc95bb29e32eb039b199b8c3f4ba3d6",0,0,0,0,0,""
20200622,"ID",4006,421,68962,,"totalTestsPeopleViral",72547,41,283,12,101,,,3305,"6/20/2020 00:00","2020-06-20T00:00:00Z","06/19 20:00",89,283,,"2020-06-20T00:00:00Z",,,,3585,69,20,,72547,,,,,,,,,,,"16",0,0,72968,0,72968,,0,0,"5511c68a6c2128bff008776bc1dd2fed95eb73f5",0,0,0,0,0,""
20200621,"ID",4006,421,68962,,"totalTestsPeopleViral",72547,31,283,12,101,,,3305,"6/20/2020 00:00","2020-06-20T00:00:00Z","06/19 20:00",89,283,,"2020-06-20T00:00:00Z",,,,3585,69,20,,72547,,,,,,,,,,,"16",135,1637,72968,1756,72968,,0,4,"aa00062de20f684ae17011a614b17006e7eb3bc1",0,0,0,0,0,""
20200620,"ID",3871,405,67325,,"totalTestsPeopleViral",70791,28,279,9,101,,,3183,"6/19/2020 19:00","2020-06-19T19:00:00Z","06/19 15:00",89,279,,"2020-06-19T19:00:00Z",,,,3466,69,20,,70791,,,,,,,,,,,"16",128,1523,71196,1635,71196,,0,1,"172af4af09742574f838b6b16f46585abaf8c250",0,0,0,0,0,""
20200619,"ID",3743,389,65802,,"totalTestsPeopleViral",69156,28,278,9,101,,,3088,"6/18/2020 19:00","2020-06-18T19:00:00Z","06/18 15:00",89,278,,"2020-06-18T19:00:00Z",,,,3354,69,20,,69156,,,,,,,,,,,"16",111,1422,69545,1518,69545,,1,3,"c00b030361276ed7e5949d746fa8f8c4415457e2",0,0,0,0,0,""
20200618,"ID",3632,374,64380,,"totalTestsPeopleViral",67638,23,275,7,101,,,3013,"6/17/2020 19:00","2020-06-17T19:00:00Z","06/17 15:00",88,275,,"2020-06-17T19:00:00Z",,,,3258,68,20,,67638,,,,,,,,,,,"16",92,1136,68012,1197,68012,,0,0,"910664e70bebf1ea9624ebb5e37b6fc46329388e",0,0,0,0,0,""
20200617,"ID",3540,343,63244,,"totalTestsPeopleViral",66441,28,275,8,101,,,2921,"6/16/2020 19:00","2020-06-16T19:00:00Z","06/16 15:00",88,275,,"2020-06-16T19:00:00Z",,,,3197,68,20,,66441,,,,,,,,,,,"16",78,1059,66784,1135,66784,,0,5,"6666a4683de4ce2d7b12026ab6d0f3081e07c2b3",0,0,0,0,0,""
20200616,"ID",3462,341,62185,,"totalTestsPeopleViral",65306,24,270,6,100,,,2877,"6/15/2020 19:00","2020-06-15T19:00:00Z","06/15 15:00",88,270,,"2020-06-15T19:00:00Z",,,,3121,68,20,,65306,,,,,,,,,,,"16",63,2604,65647,2664,65647,,1,4,"1bf750072ee63bbdbd9f034f387cf5778de47a5e",0,0,0,0,0,""
20200615,"ID",3399,338,59581,,"totalTestsPeopleViral",62642,23,266,5,98,,,2837,"6/13/2020 19:00","2020-06-13T19:00:00Z","06/13 15:00",87,266,,"2020-06-13T19:00:00Z",,,,3061,67,20,,62642,,,,,,,,,,,"16",0,0,62980,0,62980,,0,0,"c838b0b9954a6a9553348d8e3f19622039e3364b",0,0,0,0,0,""
20200614,"ID",3399,338,59581,,"totalTestsPeopleViral",62642,22,266,6,98,,,2837,"6/13/2020 19:00","2020-06-13T19:00:00Z","06/13 15:00",87,266,,"2020-06-13T19:00:00Z",,,,3061,67,20,,62642,,,,,,,,,,,"16",46,276,62980,314,62980,,0,1,"da4ff4a6d73d6053aaea1f0635aae70d6d5b361d",0,0,0,0,0,""
20200613,"ID",3353,330,59305,,"totalTestsPeopleViral",62328,24,265,5,98,,,2776,"6/12/2020 19:00","2020-06-12T19:00:00Z","06/12 15:00",87,265,,"2020-06-12T19:00:00Z",,,,3023,67,20,,62328,,,,,,,,,,,"16",51,1175,62658,1214,62658,,1,0,"08c6f351d21620bb91d02e392bd4b60191cce4cc",0,0,0,0,0,""
20200612,"ID",3302,318,58130,,"totalTestsPeopleViral",61114,20,265,5,98,,,2684,"6/11/2020 19:00","2020-06-11T19:00:00Z","06/11 15:00",86,265,,"2020-06-11T19:00:00Z",,,,2984,66,20,,61114,,,,,,,,,,,"16",42,1275,61432,1312,61432,,1,3,"6517b04984e92084da3005636438ffa106dacfdf",0,0,0,0,0,""
20200611,"ID",3260,313,56855,,"totalTestsPeopleViral",59802,28,262,7,99,,,2628,"6/10/2020 19:00","2020-06-10T19:00:00Z","06/10 15:00",85,262,,"2020-06-10T19:00:00Z",,,,2947,65,20,,59802,,,,,,,,,,,"16",40,1023,60115,1056,60115,,0,0,"13f4abcad4820c54320edec07d956251334a525e",0,0,0,0,0,""
20200610,"ID",3220,306,55832,,"totalTestsPeopleViral",58746,20,262,7,99,,,2554,"6/9/2020 19:00","2020-06-09T19:00:00Z","06/09 15:00",85,262,,"2020-06-09T19:00:00Z",,,,2914,65,20,,58746,,,,,,,,,,,"16",31,1344,59052,1370,59052,,2,2,"fc0444f2fbeee603a1642eba103aa6c1b1a84041",0,0,0,0,0,""
20200609,"ID",3189,301,54488,,"totalTestsPeopleViral",57376,21,260,7,99,,,2509,"6/8/2020 19:00","2020-06-08T19:00:00Z","06/08 15:00",83,260,,"2020-06-08T19:00:00Z",,,,2888,63,20,,57376,,,,,,,,,,,"16",50,1586,57677,1634,57677,,0,0,"5d6b0aef6ceb3db1ab7596e3f67fe49f2de28916",0,0,0,0,0,""
20200608,"ID",3139,299,52902,,"totalTestsPeopleViral",55742,23,260,8,99,,,2461,"6/6/2020 19:00","2020-06-06T19:00:00Z","06/06 15:00",83,260,,"2020-06-06T19:00:00Z",,,,2840,63,20,,55742,,,,,,,,,,,"16",0,0,56041,0,56041,,0,0,"20083c1ff15a0969d25961ac221834abb8192df9",0,0,0,0,0,""
20200607,"ID",3139,299,52902,,"totalTestsPeopleViral",55742,30,260,8,99,,,2461,"6/6/2020 19:00","2020-06-06T19:00:00Z","06/06 15:00",83,260,,"2020-06-06T19:00:00Z",,,,2840,63,20,,55742,,,,,,,,,,,"16",28,774,56041,793,56041,,0,3,"82a35d5c871833e5b8b6bedeead27062f67f5b9d",0,0,0,0,0,""
20200606,"ID",3111,290,52128,,"totalTestsPeopleViral",54949,21,257,8,98,,,2408,"6/5/2020 19:00","2020-06-05T19:00:00Z","06/05 15:00",83,257,,"2020-06-05T19:00:00Z",,,,2821,63,20,,54949,,,,,,,,,,,"16",57,1558,55239,1616,55239,,0,2,"5af37014f2ba604917b0d6a19d09f3ef39eb959f",0,0,0,0,0,""
20200605,"ID",3054,291,50570,,"totalTestsPeopleViral",53333,29,255,8,98,,,2362,"6/4/2020 19:00","2020-06-04T19:00:00Z","06/04 15:00",83,255,,"2020-06-04T19:00:00Z",,,,2763,63,20,,53333,,,,,,,,,,,"16",64,3755,53624,3809,53624,,0,2,"07e6504985fa50123693c8c3bb4f497c967e0b88",0,0,0,0,0,""
20200604,"ID",2990,281,46815,,"totalTestsPeopleViral",49524,28,253,3,98,,,2311,"6/3/2020 19:00","2020-06-03T19:00:00Z","06/03 15:00",83,253,,"2020-06-03T19:00:00Z",,,,2709,63,20,,49524,,,,,,,,,,,"16",57,806,49805,855,49805,,0,2,"a42e46b6aacbd467dd1bd31cbbb62fbfdd62bd02",0,0,0,0,0,""
20200603,"ID",2933,273,46009,,"totalTestsPeopleViral",48669,30,251,3,98,,,2282,"6/2/2020 19:00","2020-06-02T19:00:00Z","06/02 15:00",83,251,,"2020-06-02T19:00:00Z",,,,2660,63,20,,48669,,,,,,,,,,,"16",27,782,48942,799,48942,,0,4,"b0ad1f32db3b7dee4a25becf4f706a297626b5fb",0,0,0,0,0,""
20200602,"ID",2906,263,45227,,"totalTestsPeopleViral",47870,34,247,4,98,,,2266,"6/1/2020 19:00","2020-06-01T19:00:00Z","06/01 15:00",83,247,,"2020-06-01T19:00:00Z",,,,2643,63,20,,47870,,,,,,,,,,,"16",67,1369,48133,1434,48133,,1,5,"c1751da4b8b889ee407335c0d1fadbdfcfcd305f",0,0,0,0,0,""
20200601,"ID",2839,261,43858,,"totalTestsPeopleViral",46436,25,242,3,96,,,2248,"5/30/2020 19:00","2020-05-30T19:00:00Z","05/30 15:00",82,242,,"2020-05-30T19:00:00Z",,,,2578,62,20,,46436,,,,,,,,,,,"16",0,0,46697,0,46697,,0,0,"9f3851f9df8be5f283b244e2966bf7d2729c595f",0,0,0,0,0,""
20200531,"ID",2839,261,43858,,"totalTestsPeopleViral",46436,29,242,3,96,,,2248,"5/30/2020 19:00","2020-05-30T19:00:00Z","05/30 15:00",82,242,,"2020-05-30T19:00:00Z",,,,2578,62,20,,46436,,,,,,,,,,,"16",36,1237,46697,1264,46697,,0,2,"9b99d9ad73fb9ff6208512f87d581cb3ad5eabeb",0,0,0,0,0,""
20200530,"ID",2803,252,42621,,"totalTestsPeopleViral",45172,30,240,,96,,,2225,"5/29/2020 19:00","2020-05-29T19:00:00Z","05/29 15:00",82,240,,"2020-05-29T19:00:00Z",,,,2551,62,20,,45172,,,,,,,,,,,"16",34,629,45424,661,45424,,0,2,"b1b5f742b5aba97fa695017373a876e740e40769",0,0,0,0,0,""
20200529,"ID",2769,250,41992,,"totalTestsPeopleViral",44511,31,238,,96,,,2195,"5/28/2020 19:00","2020-05-28T19:00:00Z","05/28 15:00",82,238,,"2020-05-28T19:00:00Z",,,,2519,62,20,,44511,,,,,,,,,,,"16",38,848,44761,882,44761,,0,4,"ec3c29acc879629318b4936cf1d783cfad937659",0,0,0,0,0,""
20200528,"ID",2731,246,41144,,"totalTestsPeopleViral",43629,30,234,,95,,,2185,"5/27/2020 19:00","2020-05-27T19:00:00Z","05/27 15:00",82,234,,"2020-05-27T19:00:00Z",,,,2485,62,20,,43629,,,,,,,,,,,"16",32,826,43875,853,43875,,1,3,"722cc09cc9368688032bc7d52abbb16a5677613f",0,0,0,0,0,""
20200527,"ID",2699,241,40318,,"totalTestsPeopleViral",42776,24,231,,95,,,2100,"5/26/2020 19:00","2020-05-26T19:00:00Z","05/26 15:00",81,231,,"2020-05-26T19:00:00Z",,,,2458,61,20,,42776,,,,,,,,,,,"16",73,1538,43017,1609,43017,,2,6,"83be7754d1d2a6984336ccc7d6df6a8530d4b7a7",0,0,0,0,0,""
20200526,"ID",2626,239,38780,,"totalTestsPeopleViral",41167,19,225,,94,,,1755,"5/23/2020 19:00","2020-05-23T19:00:00Z","05/23 15:00",79,225,,"2020-05-23T19:00:00Z",,,,2387,59,20,,41167,,,,,,,,,,,"16",0,0,41406,0,41406,,0,0,"a6e2bdf9f8ea057221bb232d0c1585ae489584cf",0,0,0,0,0,""
20200525,"ID",2626,239,38780,,"totalTestsPeopleViral",41167,15,225,,94,,,1755,"5/23/2020 19:00","2020-05-23T19:00:00Z","05/23 15:00",79,225,,"2020-05-23T19:00:00Z",,,,2387,59,20,,41167,,,,,,,,,,,"16",0,0,41406,0,41406,,0,0,"d5045457db705ab9c2a68040cbb6ff081f03cb3a",0,0,0,0,0,""
20200524,"ID",2626,239,38780,,"totalTestsPeopleViral",41167,23,225,,94,,,1755,"5/23/2020 19:00","2020-05-23T19:00:00Z","05/23 15:00",79,225,,"2020-05-23T19:00:00Z",,,,2387,59,20,,41167,,,,,,,,,,,"16",31,766,41406,797,41406,,0,0,"77ed47550ec1ca2492b410fbc562722ab8a6e7f8",0,0,0,0,0,""
20200523,"ID",2595,239,38014,,"totalTestsPeopleViral",40370,19,225,,94,,,1735,"5/22/2020 19:00","2020-05-22T19:00:00Z","05/22 15:00",79,225,,"2020-05-22T19:00:00Z",,,,2356,59,20,,40370,,,,,,,,,,,"16",61,953,40609,1008,40609,,2,2,"98b6d0ef3553ab6ef4452d82e67d5a0899ae2ebd",0,0,0,0,0,""
20200522,"ID",2534,233,37061,,"totalTestsPeopleViral",39362,19,223,,92,,,1720,"5/21/2020 19:00","2020-05-21T19:00:00Z","05/21 15:00",77,223,,"2020-05-21T19:00:00Z",,,,2301,,,,39362,,,,,,,,,,,"16",28,679,39595,702,39595,,0,2,"d3cfdfe51dec3063e2b4e4042768385116257022",0,0,0,0,0,""
20200521,"ID",2506,228,36382,,"totalTestsPeopleViral",38660,27,221,,91,,,1688,"5/20/2020 19:00","2020-05-20T19:00:00Z","05/20 15:00",77,221,,"2020-05-20T19:00:00Z",,,,2278,,,,38660,,,,,,,,,,,"16",30,291,38888,316,38888,,0,6,"d0b83fddaeb4983907dc79be99d4defbad05c500",0,0,0,0,0,""
20200520,"ID",2476,223,36091,,"totalTestsPeopleViral",38344,28,215,,89,,,1668,"5/19/2020 19:00","2020-05-19T19:00:00Z","05/19 15:00",77,215,,"2020-05-19T19:00:00Z",,,,2253,,,,38344,,,,,,,,,,,"16",21,477,38567,497,38567,,3,2,"7ca98ec807642c298ef43c262fa7b0d0b22280c1",0,0,0,0,0,""
20200519,"ID",2455,222,35614,,"totalTestsPeopleViral",37847,28,213,,89,,,1649,"5/18/2020 19:00","2020-05-18T19:00:00Z","05/18 15:00",74,213,,"2020-05-18T19:00:00Z",,,,2233,,,,37847,,,,,,,,,,,"16",36,1361,38069,1391,38069,,1,0,"b997e8e31e81717feb788372c58c8821d15df5d4",0,0,0,0,0,""
20200518,"ID",2419,216,34253,,"totalTestsPeopleViral",36456,30,213,,89,,,1612,"5/16/2020 19:00","2020-05-16T19:00:00Z","05/16 15:00",73,213,,"2020-05-16T19:00:00Z",,,,2203,,,,36456,,,,,,,,,,,"16",0,0,36672,0,36672,,0,0,"c7506b96677b34821f5028175606d8893025678c",0,0,0,0,0,""
20200517,"ID",2419,216,34253,,"totalTestsPeopleViral",36456,26,213,,89,,,1612,"5/16/2020 19:00","2020-05-16T19:00:00Z","05/16 15:00",73,213,,"2020-05-16T19:00:00Z",,,,2203,,,,36456,,,,,,,,,,,"16",30,954,36672,971,36672,,0,0,"89d6ea35e02ccc6970cede4e3fac43ca1c5c38e9",0,0,0,0,0,""
20200516,"ID",2389,203,33299,,"totalTestsPeopleViral",35485,19,213,,89,,,1588,"5/15/2020 19:00","2020-05-15T19:00:00Z","05/15 15:00",73,213,,"2020-05-15T19:00:00Z",,,,2186,,,,35485,,,,,,,,,,,"16",38,905,35688,939,35688,,1,1,"d1b849a74967ef49421075759788b4cd4b0d91ea",0,0,0,0,0,""
20200515,"ID",2351,199,32394,,"totalTestsPeopleViral",34546,26,212,,89,,,1573,"5/14/2020 19:00","2020-05-14T19:00:00Z","05/14 15:00",72,212,,"2020-05-14T19:00:00Z",,,,2152,,,,34546,,,,,,,,,,,"16",27,964,34745,990,34745,,3,0,"fa814678f221921a7bb2428a1d6cec6740bf4b85",0,0,0,0,0,""
20200514,"ID",2324,198,31430,,"totalTestsPeopleViral",33556,19,212,,88,,,1557,"5/13/2020 19:00","2020-05-13T19:00:00Z","05/13 15:00",69,212,,"2020-05-13T19:00:00Z",,,,2126,,,,33556,,,,,,,,,,,"16",31,595,33754,622,33754,,0,-2,"3dff11f9cc4d925ff26989dfefa63c74498396cc",0,0,0,0,0,""
20200513,"ID",2293,194,30835,,"totalTestsPeopleViral",32934,20,214,,88,,,1536,"5/12/2020 19:00","2020-05-12T19:00:00Z","05/12 15:00",69,214,,"2020-05-12T19:00:00Z",,,,2099,,,,32934,,,,,,,,,,,"16",33,390,33128,416,33128,,-1,4,"f3acb4ec4c217cdd673edc7ece9f8fc1a2b40999",0,0,0,0,0,""
20200512,"ID",2260,187,30445,,"totalTestsPeopleViral",32518,25,210,,87,,,1508,"5/11/2020 19:00","2020-05-11T19:00:00Z","05/11 15:00",70,210,,"2020-05-11T19:00:00Z",,,,2073,,,,32518,,,,,,,,,,,"16",30,533,32705,557,32705,,3,3,"fddcf54218606bd74a385b19c725ead8fceb8038",0,0,0,0,0,""
20200511,"ID",2230,181,29912,,"totalTestsPeopleViral",31961,30,207,,87,,,1473,"5/9/2020 19:00","2020-05-09T19:00:00Z","05/09 15:00",67,207,,"2020-05-09T19:00:00Z",,,,2049,,,,31961,,,,,,,,,,,"16",0,0,32142,0,32142,,0,0,"e4f9689e8e6fcf9b73cada49c8d764f48a52c010",0,0,0,0,0,""
20200510,"ID",2230,181,29912,,"totalTestsPeopleViral",31961,25,207,,87,,,1473,"5/9/2020 19:00","2020-05-09T19:00:00Z","05/09 15:00",67,207,,"2020-05-09T19:00:00Z",,,,2049,,,,31961,,,,,,,,,,,"16",25,311,32142,333,32142,,0,1,"aba86a5ba5f0a5ec0bb27fe3c8d5c02a019a5a66",0,0,0,0,0,""
20200509,"ID",2205,178,29601,,"totalTestsPeopleViral",31628,19,206,,86,,,1442,"5/8/2020 19:00","2020-05-08T19:00:00Z","05/08 15:00",67,206,,"2020-05-08T19:00:00Z",,,,2027,,,,31628,,,,,,,,,,,"16",27,509,31806,529,31806,,0,0,"2a7db04906f6965ceef85dfa89a3b4c5a23cb182",0,0,0,0,0,""
20200508,"ID",2178,171,29092,,"totalTestsPeopleViral",31099,16,206,,86,,,1420,"5/7/2020 19:00","2020-05-07T19:00:00Z","05/07 15:00",67,206,,"2020-05-07T19:00:00Z",,,,2007,,,,31099,,,,,,,,,,,"16",20,360,31270,381,31270,,1,1,"201c3da3456dfa68cf10976acd8024b60c16f573",0,0,0,0,0,""
20200507,"ID",2158,172,28732,,"totalTestsPeopleViral",30718,20,205,,86,,,1399,"5/6/2020 19:00","2020-05-06T19:00:00Z","05/06 15:00",66,205,,"2020-05-06T19:00:00Z",,,,1986,,,,30718,,,,,,,,,,,"16",31,314,30890,343,30890,,1,2,"880a9fc74b3911429dc0ae8c99ac7858c7290524",0,0,0,0,0,""
20200506,"ID",2127,170,28418,,"totalTestsPeopleViral",30375,21,203,,84,,,1379,"5/4/2020 19:00","2020-05-04T19:00:00Z","05/04 15:00",65,203,,"2020-05-04T19:00:00Z",,,,1957,,,,30375,,,,,,,,,,,"16",21,216,30545,229,30545,,1,2,"fa5d7580d5dee129beb2ebb96e46bc86dac24df9",0,0,0,0,0,""
20200505,"ID",2106,162,28202,,"totalTestsPeopleViral",30146,27,201,,83,,,1358,"5/3/2020 19:00","2020-05-03T19:00:00Z","05/03 15:00",64,201,,"2020-05-03T19:00:00Z",,,,1944,,,,30146,,,,,,,,,,,"16",45,456,30308,495,30308,,0,1,"73e7048087269bba4edbdfdd79de7daf77ef883b",0,0,0,0,0,""
20200504,"ID",2061,156,27746,,"totalTestsPeopleViral",29651,27,200,,83,,,1267,"5/2/2020 19:00","2020-05-02T19:00:00Z","05/02 15:00",64,200,,"2020-05-02T19:00:00Z",,,,1905,,,,29651,,,,,,,,,,,"16",0,0,29807,0,29807,,1,0,"4e16d5a4db37fb79df0961d07a156176619df257",0,0,0,0,0,""
20200503,"ID",2061,156,27746,,"totalTestsPeopleViral",29651,27,200,,83,,,1267,"5/2/2020 19:00","2020-05-02T19:00:00Z","05/02 15:00",63,200,,"2020-05-02T19:00:00Z",,,,1905,,,,29651,,,,,,,,,,,"16",26,291,29807,316,29807,,0,22,"0901e4705bcc32b877679ca5882a2106814f1d9e",0,0,0,0,0,""
20200502,"ID",2035,155,27455,,"totalTestsPeopleViral",29335,23,178,,76,,,1215,"5/1/2020 19:00","2020-05-01T19:00:00Z","05/01 15:00",63,178,,"2020-05-01T19:00:00Z",,,,1880,,,,29335,,,,,,,,,,,"16",20,245,29490,265,29490,,0,0,"b6ebfbc5503319dfcc8f56e4b1119cf535ba58b9",0,0,0,0,0,""
20200501,"ID",2015,155,27210,,"totalTestsPeopleViral",29070,28,178,,75,,,1175,"4/30/2020 19:00","2020-04-30T19:00:00Z","04/30 15:00",63,178,,"2020-04-30T19:00:00Z",,,,1860,,,,29070,,,,,,,,,,,"16",31,348,29225,377,29225,,3,3,"b911ef98fa752bb1d4846b1141519b5d1a4dc56a",0,0,0,0,0,""
20200430,"ID",1984,153,26862,,"totalTestsPeopleViral",28693,36,175,,74,,,1121,"4/29/2020 19:00","2020-04-29T19:00:00Z","04/29 15:00",60,175,,"2020-04-29T19:00:00Z",,,,1831,,,,28693,,,,,,,,,,,"16",32,432,28846,453,28846,,0,2,"0186fb81776c1650c45963cdf463d78298a666e3",0,0,0,0,0,""
20200429,"ID",1952,142,26430,,"totalTestsPeopleViral",28240,39,173,,73,,,1087,"4/28/2020 19:00","2020-04-28T19:00:00Z","04/28 15:00",60,173,,"2020-04-28T19:00:00Z",,,,1810,,,,28240,,,,,,,,,,,"16",35,8295,28382,8188,28382,,2,1,"41bda629e067769590564697d0a3b323d97d782e",0,0,0,0,0,""
20200428,"ID",1917,132,18135,,"totalTestsPeopleViral",20052,41,172,,73,,,1039,"4/27/2020 19:00","2020-04-27T19:00:00Z","04/27 15:00",58,172,,"2020-04-27T19:00:00Z",,,,1785,,,,20052,,,,,,,,,,,"16",20,8,20052,28,20052,,2,3,"5ad405929e86c84264fffe5e8dbc2b209cf1d80f",0,0,0,0,0,""
20200427,"ID",1897,129,18127,,"totalTestsPeopleViral",20024,36,169,,71,,,983,"4/26/2020 19:00","2020-04-26T19:00:00Z","04/26 15:00",56,169,,"2020-04-26T19:00:00Z",,,,1768,,,,20024,,,,,,,,,,,"16",10,516,20024,526,20024,,0,0,"cb5c3d52cf0ff191e1dbc7315e3195023c6b81dd",0,0,0,0,0,""
20200426,"ID",1887,127,17611,,"totalTestsPeopleViral",19498,38,169,,72,,,938,"4/25/2020 19:00","2020-04-25T19:00:00Z","04/25 15:00",56,169,,"2020-04-25T19:00:00Z",,,,1760,,,,19498,,,,,,,,,,,"16",17,0,19498,17,19498,,2,1,"385ccfae0b031ff28257ad66beba23bc989787c1",0,0,0,0,0,""
20200425,"ID",1870,120,17611,,"totalTestsPeopleViral",19481,35,168,,71,,,867,"4/24/2020 19:00","2020-04-24T19:00:00Z","04/24 15:00",54,168,,"2020-04-24T19:00:00Z",,,,1750,,,,19481,,,,,,,,,,,"16",34,0,19481,34,19481,,0,2,"d43359f543b28a5a5848d3aced8143a43afe00d9",0,0,0,0,0,""
20200424,"ID",1836,115,17611,,"totalTestsPeopleViral",19447,31,166,,63,,,822,"4/24/2020 19:00","2020-04-24T19:00:00Z","04/24 15:00",54,166,,"2020-04-24T19:00:00Z",,,,1721,,,,19447,,,,,,,,,,,"16",34,241,19447,275,19447,,0,4,"1a486b0a36784343b125501c05d7fe36efbdc8d3",0,0,0,0,0,""
20200423,"ID",1802,114,17370,,"totalTestsPeopleViral",19172,52,162,,60,,,767,"4/23/2020 19:00","2020-04-23T19:00:00Z","04/23 15:00",54,162,,"2020-04-23T19:00:00Z",,,,1688,,,,19172,,,,,,,,,,,"16",36,966,19172,1002,19172,,3,4,"99fa023de7b797efe6e44b80b0c8ad2dcadc392c",0,0,0,0,0,""
20200422,"ID",1766,107,16404,,"totalTestsPeopleViral",18170,54,158,,58,,,710,"4/22/2020 19:00","2020-04-22T19:00:00Z","04/22 15:00",51,158,,"2020-04-22T19:00:00Z",,,,1659,,,,18170,,,,,,,,,,,"16",30,333,18170,363,18170,,3,1,"a863f40b5501b83768127badc2414b4110fc57b9",0,0,0,0,0,""
20200421,"ID",1736,98,16071,,"totalTestsPeopleViral",17807,69,157,,58,,,660,"4/21/2020 19:00","2020-04-21T19:00:00Z","04/21 15:00",48,157,,"2020-04-21T19:00:00Z",,,,1638,,,,17807,,,,,,,,,,,"16",64,298,17807,362,17807,,3,6,"51a8151f8b0b8eeda81b9abfe15747844365a372",0,0,0,0,0,""
20200420,"ID",1672,91,15773,,"totalTestsPeopleViral",17445,53,151,,53,,,585,"4/19/2020 19:00","2020-04-19T19:00:00Z","04/19 15:00",45,151,,"2020-04-19T19:00:00Z",,,,1581,,,,17445,,,,,,,,,,,"16",4,0,17445,4,17445,,1,0,"725d262cb1160ce2dae8322786018ee031b7179f",0,0,0,0,0,""
20200419,"ID",1668,91,15773,,"totalTestsPeopleViral",17441,43,151,,53,,,520,"4/19/2020 19:00","2020-04-19T19:00:00Z","04/19 15:00",44,151,,"2020-04-19T19:00:00Z",,,,1577,,,,17441,,,,,,,,,,,"16",13,481,17441,494,17441,,1,0,"62f9ca1c1ea09e0fca8f8160809ba0fc8e81b0d9",0,0,0,0,0,""
