"date","state","positive","probableCases","negative","pending","totalTestResultsSource","totalTestResults","hospitalizedCurrently","hospitalizedCumulative","inIcuCurrently","inIcuCumulative","onVentilatorCurrently","onVentilatorCumulative","recovered","lastUpdateEt","dateModified","checkTimeEt","death","hospitalized","hospitalizedDischarged","dateChecked","totalTestsViral","positiveTestsViral","negativeTestsViral","positiveCasesViral","deathConfirmed","deathProbable","totalTestEncountersViral","totalTestsPeopleViral","totalTestsAntibody","positiveTestsAntibody","negativeTestsAntibody","totalTestsPeopleAntibody","positiveTestsPeopleAntibody","negativeTestsPeopleAntibody","totalTestsPeopleAntigen","positiveTestsPeopleAntigen","totalTestsAntigen","positiveTestsAntigen","fips","positiveIncrease","negativeIncrease","total","totalTestResultsIncrease","posNeg","dataQualityGrade","deathIncrease","hospitalizedIncrease","hash","commercialScore","negativeRegularScore","negativeScore","positiveScore","score","grade"
20210307,"KS",295861,,974686,,"posNeg",1270547,235,9387,50,2554,22,411,,"3/5/2021 10:00","2021-03-05T10:00:00Z","03/05 05:00",4812,9387,6473,"2021-03-05T10:00:00Z",2525259,,,,,,,1270547,,,,,,,,,602322,,"20",0,0,1270547,0,1270547,,0,0,"71bcb3a00a03aa1b0c50376fdc9f22e1e9b5156b",0,0,0,0,0,""
20210306,"KS",295861,,974686,,"posNeg",1270547,235,9387,50,2554,22,411,,"3/5/2021 10:00","2021-03-05T10:00:00Z","03/05 05:00",4812,9387,6473,"2021-03-05T10:00:00Z",2525259,,,,,,,1270547,,,,,,,,,602322,,"20",0,0,1270547,0,1270547,,0,0,"33649b9a59196e11fd27d8c0b340131b5830cb0d",0,0,0,0,0,""
20210305,"KS",295861,,974686,,"posNeg",1270547,235,9387,50,2554,22,411,,"3/5/2021 10:00","2021-03-05T10:00:00Z","03/05 05:00",4812,9387,6473,"2021-03-05T10:00:00Z",2525259,,,,,,,1270547,,,,,,,,,602322,,"20",752,5035,1270547,5787,1270547,,-4,32,"f52a797d36b8f3b1adc4228e895e7c7b33defe41",0,0,0,0,0,""
20210304,"KS",295109,,969651,,"posNeg",1264760,203,9355,59,2541,23,411,,"3/3/2021 10:00","2021-03-03T10:00:00Z","03/03 05:00",4816,9355,6431,"2021-03-03T10:00:00Z",2504238,,,,,,,1264760,,,,,,,,,594470,,"20",0,0,1264760,0,1264760,,0,0,"c2d318368625fb1a7c4f5ac56262441f47473ce0",0,0,0,0,0,""
20210303,"KS",295109,,969651,,"posNeg",1264760,203,9355,59,2541,23,411,,"3/3/2021 10:00","2021-03-03T10:00:00Z","03/03 05:00",4816,9355,6431,"2021-03-03T10:00:00Z",2504238,,,,,,,1264760,,,,,,,,,594470,,"20",807,4848,1264760,5655,1264760,,73,65,"d7eeb092af172d1a9324696c91ce6f0b148ef93d",0,0,0,0,0,""
20210302,"KS",294302,,964803,,"posNeg",1259105,165,9290,43,2521,16,411,,"3/1/2021 10:00","2021-03-01T10:00:00Z","03/01 05:00",4743,9290,6387,"2021-03-01T10:00:00Z",2485181,,,,,,,1259105,,,,,,,,,586346,,"20",0,0,1259105,0,1259105,,0,0,"ee3dcb48123a34ab6cc4fda05f30ec0c7f04d07b",0,0,0,0,0,""
20210301,"KS",294302,,964803,,"posNeg",1259105,165,9290,43,2521,16,411,,"3/1/2021 10:00","2021-03-01T10:00:00Z","03/01 05:00",4743,9290,6387,"2021-03-01T10:00:00Z",2485181,,,,,,,1259105,,,,,,,,,586346,,"20",639,4003,1259105,4642,1259105,,8,41,"99faacaf6d4b4e754fffc633c0870f44b51283f8",0,0,0,0,0,""
20210228,"KS",293663,,960800,,"posNeg",1254463,258,9249,63,2510,29,411,,"2/26/2021 10:00","2021-02-26T10:00:00Z","02/26 05:00",4735,9249,6343,"2021-02-26T10:00:00Z",2468690,,,,,,,1254463,,,,,,,,,580453,,"20",0,0,1254463,0,1254463,,0,0,"610cbb40109a5de680c79232b35b88a3ead81c66",0,0,0,0,0,""
20210227,"KS",293663,,960800,,"posNeg",1254463,258,9249,63,2510,29,411,,"2/26/2021 10:00","2021-02-26T10:00:00Z","02/26 05:00",4735,9249,6343,"2021-02-26T10:00:00Z",2468690,,,,,,,1254463,,,,,,,,,580453,,"20",0,0,1254463,0,1254463,,0,0,"da84a730f15e829258f0238ca7a645682b87d261",0,0,0,0,0,""
20210226,"KS",293663,,960800,,"posNeg",1254463,258,9249,63,2510,29,411,,"2/26/2021 10:00","2021-02-26T10:00:00Z","02/26 05:00",4735,9249,6343,"2021-02-26T10:00:00Z",2468690,,,,,,,1254463,,,,,,,,,580453,,"20",826,4869,1254463,5695,1254463,,11,60,"3e5383781d11077dfb60415e87af11c03f748fd0",0,0,0,0,0,""
20210225,"KS",292837,,955931,,"posNeg",1248768,214,9189,52,2482,22,411,,"2/24/2021 10:00","2021-02-24T10:00:00Z","02/24 05:00",4724,9189,6297,"2021-02-24T10:00:00Z",2438740,,,,,,,1248768,,,,,,,,,573408,,"20",0,0,1248768,0,1248768,,0,0,"202ff3da248cd0208820727b6db209587c016b9f",0,0,0,0,0,""
20210224,"KS",292837,,955931,,"posNeg",1248768,214,9189,52,2482,22,411,,"2/24/2021 10:00","2021-02-24T10:00:00Z","02/24 05:00",4724,9189,6297,"2021-02-24T10:00:00Z",2438740,,,,,,,1248768,,,,,,,,,573408,,"20",1122,4147,1248768,5269,1248768,,81,86,"1749c2c3dfcdfd2b807da558e2835e8e078e804a",0,0,0,0,0,""
20210223,"KS",291715,,951784,,"posNeg",1243499,214,9103,52,2466,22,411,,"2/22/2021 10:00","2021-02-22T10:00:00Z","02/22 05:00",4643,9103,6235,"2021-02-22T10:00:00Z",2418896,,,,,,,1243499,,,,,,,,,563612,,"20",0,0,1243499,0,1243499,,0,0,"42fca6554e03fc3c73c7ba9e014f167eefbc8dbc",0,0,0,0,0,""
20210222,"KS",291715,,951784,,"posNeg",1243499,214,9103,52,2466,22,411,,"2/22/2021 10:00","2021-02-22T10:00:00Z","02/22 05:00",4643,9103,6235,"2021-02-22T10:00:00Z",2418896,,,,,,,1243499,,,,,,,,,563612,,"20",883,4193,1243499,5076,1243499,,29,32,"cefa7d405c85d247868631806a45e5d6025a73fc",0,0,0,0,0,""
20210221,"KS",290832,,947591,,"posNeg",1238423,290,9071,82,2457,34,411,,"2/19/2021 10:00","2021-02-19T10:00:00Z","02/19 05:00",4614,9071,6206,"2021-02-19T10:00:00Z",2403075,,,,,,,1238423,,,,,,,,,558292,,"20",0,0,1238423,0,1238423,,0,0,"974a92002590ec5b416c44dd36a2554c7c0428f8",0,0,0,0,0,""
20210220,"KS",290832,,947591,,"posNeg",1238423,290,9071,82,2457,34,411,,"2/19/2021 10:00","2021-02-19T10:00:00Z","02/19 05:00",4614,9071,6206,"2021-02-19T10:00:00Z",2403075,,,,,,,1238423,,,,,,,,,558292,,"20",0,0,1238423,0,1238423,,0,0,"9d13c7ec73367a873da744dead74b46bd794e2f1",0,0,0,0,0,""
20210219,"KS",290832,,947591,,"posNeg",1238423,290,9071,82,2457,34,411,,"2/19/2021 10:00","2021-02-19T10:00:00Z","02/19 05:00",4614,9071,6206,"2021-02-19T10:00:00Z",2403075,,,,,,,1238423,,,,,,,,,558292,,"20",2115,7010,1238423,9125,1238423,,93,69,"d7d69993075063a9cbfa68921cec69cc4d75f991",0,0,0,0,0,""
20210218,"KS",288717,,940581,,"posNeg",1229298,300,9002,68,2432,34,411,,"2/17/2021 10:00","2021-02-17T10:00:00Z","02/17 05:00",4521,9002,6137,"2021-02-17T10:00:00Z",2382523,,,,,,,1229298,,,,,,,,,543223,,"20",0,0,1229298,0,1229298,,0,0,"28cf4d09e2eb0ce19cd7dccf929daf1eb6d7e96c",0,0,0,0,0,""
20210217,"KS",288717,,940581,,"posNeg",1229298,300,9002,68,2432,34,411,,"2/17/2021 10:00","2021-02-17T10:00:00Z","02/17 05:00",4521,9002,6137,"2021-02-17T10:00:00Z",2382523,,,,,,,1229298,,,,,,,,,543223,,"20",1267,3799,1229298,5066,1229298,,115,79,"312b9605d1fcc9f3f1a52439eb76ae6978df1eb2",0,0,0,0,0,""
20210216,"KS",287450,,936782,,"posNeg",1224232,279,8923,77,2421,38,411,,"2/15/2021 10:00","2021-02-15T10:00:00Z","02/15 05:00",4406,8923,6087,"2021-02-15T10:00:00Z",2364665,,,,,,,1224232,,,,,,,,,534602,,"20",0,0,1224232,0,1224232,,0,0,"4ec5e5283abda2a790afb3f172b3b66ec0d4bd27",0,0,0,0,0,""
20210215,"KS",287450,,936782,,"posNeg",1224232,279,8923,77,2421,38,411,,"2/15/2021 10:00","2021-02-15T10:00:00Z","02/15 05:00",4406,8923,6087,"2021-02-15T10:00:00Z",2364665,,,,,,,1224232,,,,,,,,,534602,,"20",1348,5295,1224232,6643,1224232,,42,36,"cc9316b27efd8efacde2503e00feee6cc6002ad2",0,0,0,0,0,""
20210214,"KS",286102,,931487,,"posNeg",1217589,348,8887,87,2413,42,411,,"2/12/2021 10:00","2021-02-12T10:00:00Z","02/12 05:00",4364,8887,6057,"2021-02-12T10:00:00Z",2346453,,,,,,,1217589,,,,,,,,,527485,,"20",0,0,1217589,0,1217589,,0,0,"1d95fc510bde744da2c1cbd4adffe7692fa072c1",0,0,0,0,0,""
20210213,"KS",286102,,931487,,"posNeg",1217589,348,8887,87,2413,42,411,,"2/12/2021 10:00","2021-02-12T10:00:00Z","02/12 05:00",4364,8887,6057,"2021-02-12T10:00:00Z",2346453,,,,,,,1217589,,,,,,,,,527485,,"20",0,0,1217589,0,1217589,,0,0,"321c920bdd168b5f950da7d4700ecaf428c54cc7",0,0,0,0,0,""
20210212,"KS",286102,,931487,,"posNeg",1217589,348,8887,87,2413,42,411,,"2/12/2021 10:00","2021-02-12T10:00:00Z","02/12 05:00",4364,8887,6057,"2021-02-12T10:00:00Z",2346453,,,,,,,1217589,,,,,,,,,527485,,"20",1208,4888,1217589,6096,1217589,,61,47,"7ca565c577aa1f49a3bc89439feeab3f15258fc6",0,0,0,0,0,""
20210211,"KS",284894,,926599,,"posNeg",1211493,377,8840,98,2401,41,411,,"2/10/2021 10:00","2021-02-10T10:00:00Z","02/10 05:00",4303,8840,6018,"2021-02-10T10:00:00Z",2325356,,,,,,,1211493,,,,,,,,,,,"20",0,0,1211493,0,1211493,,0,0,"5298f971709352eb975be2b25bbcab9650493a33",0,0,0,0,0,""
20210210,"KS",284894,,926599,,"posNeg",1211493,377,8840,98,2401,41,411,,"2/10/2021 10:00","2021-02-10T10:00:00Z","02/10 05:00",4303,8840,6018,"2021-02-10T10:00:00Z",2325356,,,,,,,1211493,,,,,,,,,,,"20",1934,5800,1211493,7734,1211493,,106,91,"4dc5738de39d163dfdb072d68e6f46a9b3e1b947",0,0,0,0,0,""
20210209,"KS",282960,,920799,,"posNeg",1203759,319,8749,93,2373,39,411,,"2/8/2021 10:00","2021-02-08T10:00:00Z","02/08 05:00",4197,8749,5954,"2021-02-08T10:00:00Z",2301447,,,,,,,1203759,,,,,,,,,,,"20",0,0,1203759,0,1203759,,0,0,"1632cfba4b9a1bfab6d1d933e4e30954d97a0337",0,0,0,0,0,""
20210208,"KS",282960,,920799,,"posNeg",1203759,319,8749,93,2373,39,411,,"2/8/2021 10:00","2021-02-08T10:00:00Z","02/08 05:00",4197,8749,5954,"2021-02-08T10:00:00Z",2301447,,,,,,,1203759,,,,,,,,,,,"20",1398,5308,1203759,6706,1203759,,96,69,"fd4d36446a5dd8a3eb7adb3fda2d2871072c6889",0,0,0,0,0,""
20210207,"KS",281562,,915491,,"posNeg",1197053,526,8680,129,2361,52,411,,"2/5/2021 10:00","2021-02-05T10:00:00Z","02/05 05:00",4101,8680,5912,"2021-02-05T10:00:00Z",2282959,,,,,,,1197053,,,,,,,,,,,"20",0,0,1197053,0,1197053,,0,0,"b67ec15a3db34221afab9b3e1bd57c5637ff2fa6",0,0,0,0,0,""
20210206,"KS",281562,,915491,,"posNeg",1197053,526,8680,129,2361,52,411,,"2/5/2021 10:00","2021-02-05T10:00:00Z","02/05 05:00",4101,8680,5912,"2021-02-05T10:00:00Z",2282959,,,,,,,1197053,,,,,,,,,,,"20",0,0,1197053,0,1197053,,0,0,"ac2286d19077669732d6c5b91cf785bdd1ae6422",0,0,0,0,0,""
20210205,"KS",281562,,915491,,"posNeg",1197053,526,8680,129,2361,52,411,,"2/5/2021 10:00","2021-02-05T10:00:00Z","02/05 05:00",4101,8680,5912,"2021-02-05T10:00:00Z",2282959,,,,,,,1197053,,,,,,,,,,,"20",2647,7557,1197053,10204,1197053,,206,102,"f47e6df48d7560bd921c474b7acf40fdf5ae08cc",0,0,0,0,0,""
20210204,"KS",278915,,907934,,"posNeg",1186849,526,8578,129,2333,52,411,,"2/3/2021 10:00","2021-02-03T10:00:00Z","02/03 05:00",3895,8578,5810,"2021-02-03T10:00:00Z",2248082,,,,,,,1186849,,,,,,,,,,,"20",0,0,1186849,0,1186849,,0,0,"8abd30dfda03e579801ea48614674b3cbebcb1e4",0,0,0,0,0,""
20210203,"KS",278915,,907934,,"posNeg",1186849,526,8578,129,2333,52,411,,"2/3/2021 10:00","2021-02-03T10:00:00Z","02/03 05:00",3895,8578,5810,"2021-02-03T10:00:00Z",2248082,,,,,,,1186849,,,,,,,,,,,"20",2247,6985,1186849,9232,1186849,,86,89,"c382a670d9a3159a0e31f96910f9e326f5cc3dd6",0,0,0,0,0,""
20210202,"KS",276668,,900949,,"posNeg",1177617,381,8489,97,2311,48,412,,"2/1/2021 10:00","2021-02-01T10:00:00Z","02/01 05:00",3809,8489,5715,"2021-02-01T10:00:00Z",2221814,,,,,,,1177617,,,,,,,,,,,"20",0,0,1177617,0,1177617,,0,0,"33a832e74eb1df1107a37eba5c63369af6159f9e",0,0,0,0,0,""
20210201,"KS",276668,,900949,,"posNeg",1177617,381,8489,97,2311,48,412,,"2/1/2021 10:00","2021-02-01T10:00:00Z","02/01 05:00",3809,8489,5715,"2021-02-01T10:00:00Z",2221814,,,,,,,1177617,,,,,,,,,,,"20",1983,6911,1177617,8894,1177617,,30,72,"88fb4b3de4e2d13d0f5aa8b4a4e3e8c24af88a92",0,0,0,0,0,""
20210131,"KS",274685,,894038,,"posNeg",1168723,550,8417,145,2290,65,412,,"1/29/2021 10:00","2021-01-29T10:00:00Z","01/29 05:00",3779,8417,5647,"2021-01-29T10:00:00Z",2194854,,,,,,,1168723,,,,,,,,,,,"20",0,0,1168723,0,1168723,,0,0,"db7128b36dd9cda8825601ed0444a1a481b9a896",0,0,0,0,0,""
20210130,"KS",274685,,894038,,"posNeg",1168723,550,8417,145,2290,65,412,,"1/29/2021 10:00","2021-01-29T10:00:00Z","01/29 05:00",3779,8417,5647,"2021-01-29T10:00:00Z",2194854,,,,,,,1168723,,,,,,,,,,,"20",0,0,1168723,0,1168723,,0,0,"c6d9635ad03ff8c9e3f0d624d6a2fd76e69037b6",0,0,0,0,0,""
20210129,"KS",274685,,894038,,"posNeg",1168723,550,8417,145,2290,65,412,,"1/29/2021 10:00","2021-01-29T10:00:00Z","01/29 05:00",3779,8417,5647,"2021-01-29T10:00:00Z",2194854,,,,,,,1168723,,,,,,,,,,,"20",2168,6779,1168723,8947,1168723,,61,149,"fd144ba0bec97b5d1400062b16e49cca8f7ae20c",0,0,0,0,0,""
20210128,"KS",272517,,887259,,"posNeg",1159776,649,8268,165,2259,74,412,,"1/27/2021 10:00","2021-01-27T10:00:00Z","01/27 05:00",3718,8268,5544,"2021-01-27T10:00:00Z",2164543,,,,,,,1159776,,,,,,,,,,,"20",0,0,1159776,0,1159776,,0,0,"6ba539229ec54b6fc16920b2c6a31d8ba1548cca",0,0,0,0,0,""
20210127,"KS",272517,,887259,,"posNeg",1159776,649,8268,165,2259,74,412,,"1/27/2021 10:00","2021-01-27T10:00:00Z","01/27 05:00",3718,8268,5544,"2021-01-27T10:00:00Z",2164543,,,,,,,1159776,,,,,,,,,,,"20",3262,8877,1159776,12139,1159776,,96,151,"9c3cf00e279d5221679578b2d47c2c745e86fbb7",0,0,0,0,0,""
20210126,"KS",269255,,878382,,"posNeg",1147637,708,8117,182,2210,66,412,,"1/25/2021 10:00","2021-01-25T10:00:00Z","01/25 05:00",3622,8117,5432,"2021-01-25T10:00:00Z",,,,,,,,1147637,,,,,,,,,,,"20",0,0,1147637,0,1147637,,0,0,"b5607bcff168efa0b1b4341b186f4e72d55aee48",0,0,0,0,0,""
20210125,"KS",269255,,878382,,"posNeg",1147637,708,8117,182,2210,66,412,,"1/25/2021 10:00","2021-01-25T10:00:00Z","01/25 05:00",3622,8117,5432,"2021-01-25T10:00:00Z",,,,,,,,1147637,,,,,,,,,,,"20",2602,7624,1147637,10226,1147637,,24,76,"19df3a941179961f55dc1bee69eb4e558f277427",0,0,0,0,0,""
20210124,"KS",266653,,870758,,"posNeg",1137411,708,8041,182,2181,66,412,,"1/22/2021 10:00","2021-01-22T10:00:00Z","01/22 05:00",3598,8041,5384,"2021-01-22T10:00:00Z",,,,,,,,1137411,,,,,,,,,,,"20",0,0,1137411,0,1137411,,0,0,"aa27dcd61d4e66dddcc2b0857e05e4f714f0d34c",0,0,0,0,0,""
20210123,"KS",266653,,870758,,"posNeg",1137411,708,8041,182,2181,66,412,,"1/22/2021 10:00","2021-01-22T10:00:00Z","01/22 05:00",3598,8041,5384,"2021-01-22T10:00:00Z",,,,,,,,1137411,,,,,,,,,,,"20",0,0,1137411,0,1137411,,0,0,"64771d7070076a4ff7ec00b95b180a3c126c6240",0,0,0,0,0,""
20210122,"KS",266653,,870758,,"posNeg",1137411,708,8041,182,2181,66,412,,"1/22/2021 10:00","2021-01-22T10:00:00Z","01/22 05:00",3598,8041,5384,"2021-01-22T10:00:00Z",,,,,,,,1137411,,,,,,,,,,,"20",3241,8465,1137411,11706,1137411,,23,111,"6ac8c689075962981d2e08643c7fe4f3f43172b5",0,0,0,0,0,""
20210121,"KS",263412,,862293,,"posNeg",1125705,708,7930,182,2141,66,413,,"1/20/2021 10:00","2021-01-20T10:00:00Z","01/20 05:00",3575,7930,5302,"2021-01-20T10:00:00Z",,,,,,,,1125705,,,,,,,,,,,"20",0,0,1125705,0,1125705,,0,0,"fed821e2b1968c9275c89256bb23643b103fa34e",0,0,0,0,0,""
20210120,"KS",263412,,862293,,"posNeg",1125705,708,7930,182,2141,66,413,,"1/20/2021 10:00","2021-01-20T10:00:00Z","01/20 05:00",3575,7930,5302,"2021-01-20T10:00:00Z",,,,,,,,1125705,,,,,,,,,,,"20",3590,8349,1125705,11939,1125705,,50,123,"0864674f21790ac0a4c394dbe6a1718d5e19a31a",0,0,0,0,0,""
20210119,"KS",259822,,853944,,"posNeg",1113766,599,7807,168,2098,61,413,,"1/18/2021 10:00","2021-01-18T10:00:00Z","01/18 05:00",3525,7807,5215,"2021-01-18T10:00:00Z",,,,,,,,1113766,,,,,,,,,,,"20",0,0,1113766,0,1113766,,0,0,"300bc082ec2c3cba1fe0899a5cec12cc67aa56e2",0,0,0,0,0,""
20210118,"KS",259822,,853944,,"posNeg",1113766,599,7807,168,2098,61,413,,"1/18/2021 10:00","2021-01-18T10:00:00Z","01/18 05:00",3525,7807,5215,"2021-01-18T10:00:00Z",,,,,,,,1113766,,,,,,,,,,,"20",3688,9713,1113766,13401,1113766,,23,94,"315b852ba68f7abc6b882b1d74dbf759da9c401d",0,0,0,0,0,""
20210117,"KS",256134,,844231,,"posNeg",1100365,776,7713,201,2068,67,413,,"1/15/2021 10:00","2021-01-15T10:00:00Z","01/15 05:00",3502,7713,5138,"2021-01-15T10:00:00Z",,,,,,,,1100365,,,,,,,,,,,"20",0,0,1100365,0,1100365,,0,0,"b1bcb12495df6bb5badb59423769e5ae5acbd123",0,0,0,0,0,""
20210116,"KS",256134,,844231,,"posNeg",1100365,776,7713,201,2068,67,413,,"1/15/2021 10:00","2021-01-15T10:00:00Z","01/15 05:00",3502,7713,5138,"2021-01-15T10:00:00Z",,,,,,,,1100365,,,,,,,,,,,"20",0,0,1100365,0,1100365,,0,0,"cf929128e3fc6920345817e81fb61d43295b58f3",0,0,0,0,0,""
20210115,"KS",256134,,844231,,"posNeg",1100365,776,7713,201,2068,67,413,,"1/15/2021 10:00","2021-01-15T10:00:00Z","01/15 05:00",3502,7713,5138,"2021-01-15T10:00:00Z",,,,,,,,1100365,,,,,,,,,,,"20",4093,12340,1100365,16433,1100365,,147,173,"e7986b72abd11ad4b812d5a283e54b19b3aef4b3",0,0,0,0,0,""
20210114,"KS",252041,,831891,,"posNeg",1083932,892,7540,217,2027,65,413,,"1/13/2021 00:00","2021-01-13T00:00:00Z","01/12 19:00",3355,7540,5026,"2021-01-13T00:00:00Z",,,,,,,,1083932,,,,,,,,,,,"20",0,0,1083932,0,1083932,,0,0,"4b6869514393eb2819df06c67522cc8f58ea79cc",0,0,0,0,0,""
20210113,"KS",252041,,831891,,"posNeg",1083932,892,7540,217,2027,65,413,,"1/13/2021 00:00","2021-01-13T00:00:00Z","01/12 19:00",3355,7540,5026,"2021-01-13T00:00:00Z",,,,,,,,1083932,,,,,,,,,,,"20",4539,12877,1083932,17416,1083932,,100,189,"3b7f94a3bec7030a17ce6595d1c4bb614eab13cd",0,0,0,0,0,""
20210112,"KS",247502,,819014,,"posNeg",1066516,590,7351,156,1981,48,413,,"1/11/2021 10:00","2021-01-11T10:00:00Z","01/11 05:00",3255,7351,4896,"2021-01-11T10:00:00Z",,,,,,,,1066516,,,,,,,,,,,"20",0,0,1066516,0,1066516,,0,0,"a06e6cee9d6fe3f03e23f2a85e5affd7eb588bb1",0,0,0,0,0,""
20210111,"KS",247502,,819014,,"posNeg",1066516,590,7351,156,1981,48,413,,"1/11/2021 10:00","2021-01-11T10:00:00Z","01/11 05:00",3255,7351,4896,"2021-01-11T10:00:00Z",,,,,,,,1066516,,,,,,,,,,,"20",5180,10129,1066516,15309,1066516,,107,94,"126e83cb6a7595a7bbfc530a85b9549ffced6c43",0,0,0,0,0,""
20210110,"KS",242322,,808885,,"posNeg",1051207,869,7257,221,1955,61,413,,"1/8/2021 10:00","2021-01-08T10:00:00Z","01/08 05:00",3148,7257,4838,"2021-01-08T10:00:00Z",,,,,,,,1051207,,,,,,,,,,,"20",0,0,1051207,0,1051207,,0,0,"20eacdc7a3743043d1b3c29641a85fa3091b0170",0,0,0,0,0,""
20210109,"KS",242322,,808885,,"posNeg",1051207,869,7257,221,1955,61,413,,"1/8/2021 10:00","2021-01-08T10:00:00Z","01/08 05:00",3148,7257,4838,"2021-01-08T10:00:00Z",,,,,,,,1051207,,,,,,,,,,,"20",0,0,1051207,0,1051207,,0,0,"e54bd845abe5589e3bcdae6415c3f762e2a062b4",0,0,0,0,0,""
20210108,"KS",242322,,808885,,"posNeg",1051207,869,7257,221,1955,61,413,,"1/8/2021 10:00","2021-01-08T10:00:00Z","01/08 05:00",3148,7257,4838,"2021-01-08T10:00:00Z",,,,,,,,1051207,,,,,,,,,,,"20",5504,8184,1051207,13688,1051207,,121,144,"dedf4ca19f619262827b20ababe412faf642ca77",0,0,0,0,0,""
20210107,"KS",236818,,800701,,"posNeg",1037519,838,7113,206,1928,70,413,,"1/6/2021 10:00","2021-01-06T10:00:00Z","01/06 05:00",3027,7113,4745,"2021-01-06T10:00:00Z",,,,,,,,1037519,,,,,,,,,,,"20",0,0,1037519,0,1037519,,0,0,"1abb242dcf0a6590d28e347176b66ab32d447f6a",0,0,0,0,0,""
20210106,"KS",236818,,800701,,"posNeg",1037519,838,7113,206,1928,70,413,,"1/6/2021 10:00","2021-01-06T10:00:00Z","01/06 05:00",3027,7113,4745,"2021-01-06T10:00:00Z",,,,,,,,1037519,,,,,,,,,,,"20",5501,7889,1037519,13390,1037519,,130,158,"17ac4f7775b887a473d8785c94e4b8937194b130",0,0,0,0,0,""
20210105,"KS",231317,,792812,,"posNeg",1024129,662,6955,180,1876,65,412,,"1/4/2021 10:00","2021-01-04T10:00:00Z","01/04 05:00",2897,6955,4643,"2021-01-04T10:00:00Z",,,,,,,,1024129,,,,,,,,,,,"20",0,0,1024129,0,1024129,,0,0,"49fb097dcc55bfc53f15a7aab856df7f16a0364b",0,0,0,0,0,""
20210104,"KS",231317,,792812,,"posNeg",1024129,662,6955,180,1876,65,412,,"1/4/2021 10:00","2021-01-04T10:00:00Z","01/04 05:00",2897,6955,4643,"2021-01-04T10:00:00Z",,,,,,,,1024129,,,,,,,,,,,"20",3572,8051,1024129,11623,1024129,,18,52,"dd36e4493074de4e14578e047c71d61be4aec96b",0,0,0,0,0,""
20210103,"KS",227745,,784761,,"posNeg",1012506,825,6903,221,1862,97,412,,"1/1/2021 10:00","2021-01-01T10:00:00Z","01/01 05:00",2879,6903,4612,"2021-01-01T10:00:00Z",,,,,,,,1012506,,,,,,,,,,,"20",0,0,1012506,0,1012506,,0,0,"7e7e9a5c160a243817c6475b1d43f1ecad3f2f84",0,0,0,0,0,""
20210102,"KS",227745,,784761,,"posNeg",1012506,825,6903,221,1862,97,412,,"1/1/2021 10:00","2021-01-01T10:00:00Z","01/01 05:00",2879,6903,4612,"2021-01-01T10:00:00Z",,,,,,,,1012506,,,,,,,,,,,"20",0,0,1012506,0,1012506,,0,0,"cafbaf8373be157c4a01b0b0555f552590e142d4",0,0,0,0,0,""
20210101,"KS",227745,,784761,,"posNeg",1012506,825,6903,221,1862,97,412,,"1/1/2021 10:00","2021-01-01T10:00:00Z","01/01 05:00",2879,6903,4612,"2021-01-01T10:00:00Z",,,,,,,,1012506,,,,,,,,,,,"20",5312,5962,1012506,11274,1012506,,138,143,"6f8a121ad77d9841ddfe9d65bbc2620b48084714",0,0,0,0,0,""
20201231,"KS",222433,,778799,,"posNeg",1001232,767,6760,234,1823,99,412,,"12/30/2020 10:00","2020-12-30T10:00:00Z","12/30 05:00",2741,6760,4517,"2020-12-30T10:00:00Z",,,,,,,,1001232,,,,,,,,,,,"20",0,0,1001232,0,1001232,,0,0,"645d0417b989e110c9661da5a609cad77f4f187d",0,0,0,0,0,""
20201230,"KS",222433,,778799,,"posNeg",1001232,767,6760,234,1823,99,412,,"12/30/2020 10:00","2020-12-30T10:00:00Z","12/30 05:00",2741,6760,4517,"2020-12-30T10:00:00Z",,,,,,,,1001232,,,,,,,,,,,"20",6371,9048,1001232,15419,1001232,,193,192,"05ee9f1f967b1fcea63334cefa1ef2fd0ff7a1f2",0,0,0,0,0,""
20201229,"KS",216062,,769751,,"posNeg",985813,554,6568,117,1762,68,411,,"12/28/2020 10:00","2020-12-28T10:00:00Z","12/28 05:00",2548,6568,4374,"2020-12-28T10:00:00Z",,,,,,,,985813,,,,,,,,,,,"20",0,0,985813,0,985813,,0,0,"3c060d95f1b5a66929db25759e49329d3470b8a0",0,0,0,0,0,""
20201228,"KS",216062,,769751,,"posNeg",985813,554,6568,117,1762,68,411,,"12/28/2020 10:00","2020-12-28T10:00:00Z","12/28 05:00",2548,6568,4374,"2020-12-28T10:00:00Z",,,,,,,,985813,,,,,,,,,,,"20",6373,17236,985813,23609,985813,,41,144,"928f3a755419e5896456c80defe3f1abf5f3b51e",0,0,0,0,0,""
20201227,"KS",209689,,752515,,"posNeg",962204,1014,6424,255,1722,119,411,,"12/23/2020 10:00","2020-12-23T10:00:00Z","12/23 05:00",2507,6424,4286,"2020-12-23T10:00:00Z",,,,,,,,962204,,,,,,,,,,,"20",0,0,962204,0,962204,,0,0,"6f86b8a46adedaf6eaefa967038a3ea0df062b2a",0,0,0,0,0,""
20201226,"KS",209689,,752515,,"posNeg",962204,1014,6424,255,1722,119,411,,"12/23/2020 10:00","2020-12-23T10:00:00Z","12/23 05:00",2507,6424,4286,"2020-12-23T10:00:00Z",,,,,,,,962204,,,,,,,,,,,"20",0,0,962204,0,962204,,0,0,"0f79b2cd4f98c37604be2fd837a6d7547d85e069",0,0,0,0,0,""
20201225,"KS",209689,,752515,,"posNeg",962204,1014,6424,255,1722,119,411,,"12/23/2020 10:00","2020-12-23T10:00:00Z","12/23 05:00",2507,6424,4286,"2020-12-23T10:00:00Z",,,,,,,,962204,,,,,,,,,,,"20",0,0,962204,0,962204,,0,0,"447f12eb2b29b16332f7773b81352fd631c2da9b",0,0,0,0,0,""
20201224,"KS",209689,,752515,,"posNeg",962204,1014,6424,255,1722,119,411,,"12/23/2020 10:00","2020-12-23T10:00:00Z","12/23 05:00",2507,6424,4286,"2020-12-23T10:00:00Z",,,,,,,,962204,,,,,,,,,,,"20",0,0,962204,0,962204,,0,0,"cd9528e1b33d24a01887b214407c4a21f01b9005",0,0,0,0,0,""
20201223,"KS",209689,,752515,,"posNeg",962204,1014,6424,255,1722,119,411,,"12/23/2020 10:00","2020-12-23T10:00:00Z","12/23 05:00",2507,6424,4286,"2020-12-23T10:00:00Z",,,,,,,,962204,,,,,,,,,,,"20",5089,10992,962204,16081,962204,,59,157,"be524b9d092e2e1e70bd2692ecee1ffa15a9c82b",0,0,0,0,0,""
20201222,"KS",204600,,741523,,"posNeg",946123,630,6267,168,1684,92,411,,"12/21/2020 10:00","2020-12-21T10:00:00Z","12/21 05:00",2448,6267,4184,"2020-12-21T10:00:00Z",,,,,,,,946123,,,,,,,,,,,"20",0,0,946123,0,946123,,0,0,"0b1f1d86fe0e6515997d2fd48fb09b4baf2259cf",0,0,0,0,0,""
20201221,"KS",204600,,741523,,"posNeg",946123,630,6267,168,1684,92,411,,"12/21/2020 10:00","2020-12-21T10:00:00Z","12/21 05:00",2448,6267,4184,"2020-12-21T10:00:00Z",,,,,,,,946123,,,,,,,,,,,"20",4174,11143,946123,15317,946123,,107,92,"e64f11bfcabb62557b53924b861eacea762a132a",0,0,0,0,0,""
20201220,"KS",200426,,730380,,"posNeg",930806,688,6175,189,1658,92,411,,"12/18/2020 10:00","2020-12-18T10:00:00Z","12/18 05:00",2341,6175,4125,"2020-12-18T10:00:00Z",,,,,,,,930806,,,,,,,,,,,"20",0,0,930806,0,930806,,0,0,"41e744a7abd6b724e554656b7fb7344d237fcff2",0,0,0,0,0,""
20201219,"KS",200426,,730380,,"posNeg",930806,688,6175,189,1658,92,411,,"12/18/2020 10:00","2020-12-18T10:00:00Z","12/18 05:00",2341,6175,4125,"2020-12-18T10:00:00Z",,,,,,,,930806,,,,,,,,,,,"20",0,0,930806,0,930806,,0,0,"7c4b14f24becd1503951402bd1e401d12d444d4c",0,0,0,0,0,""
20201218,"KS",200426,,730380,,"posNeg",930806,688,6175,189,1658,92,411,,"12/18/2020 10:00","2020-12-18T10:00:00Z","12/18 05:00",2341,6175,4125,"2020-12-18T10:00:00Z",,,,,,,,930806,,,,,,,,,,,"20",5857,6684,930806,12541,930806,,88,125,"224e10b50d341157ed62c14076ea31fb46300910",0,0,0,0,0,""
20201217,"KS",194569,,723696,,"posNeg",918265,858,6050,228,1628,111,409,,"12/16/2020 10:00","2020-12-16T10:00:00Z","12/16 05:00",2253,6050,4051,"2020-12-16T10:00:00Z",,,,,,,,918265,,,,,,,,,,,"20",0,0,918265,0,918265,,0,0,"9ca52ca7c1a5f20045f5f8016f23cb44f1e4bc37",0,0,0,0,0,""
20201216,"KS",194569,,723696,,"posNeg",918265,858,6050,228,1628,111,409,,"12/16/2020 10:00","2020-12-16T10:00:00Z","12/16 05:00",2253,6050,4051,"2020-12-16T10:00:00Z",,,,,,,,918265,,,,,,,,,,,"20",4551,9982,918265,14533,918265,,144,155,"bf2e17ea313694ba0a6d445e50e2820b259b5e72",0,0,0,0,0,""
20201215,"KS",190018,,713714,,"posNeg",903732,623,5895,182,1584,88,409,,"12/14/2020 10:00","2020-12-14T10:00:00Z","12/14 05:00",2109,5895,3938,"2020-12-14T10:00:00Z",,,,,,,,903732,,,,,,,,,,,"20",0,0,903732,0,903732,,0,0,"fb5d55578dc4b9a3630181cf59f696896dd7d6cd",0,0,0,0,0,""
20201214,"KS",190018,,713714,,"posNeg",903732,623,5895,182,1584,88,409,,"12/14/2020 10:00","2020-12-14T10:00:00Z","12/14 05:00",2109,5895,3938,"2020-12-14T10:00:00Z",,,,,,,,903732,,,,,,,,,,,"20",4724,8291,903732,13015,903732,,37,95,"840546d5f9b28619e9c4826c93584a7338dc2213",0,0,0,0,0,""
20201213,"KS",185294,,705423,,"posNeg",890717,1068,5800,271,1564,130,409,,"12/11/2020 10:00","2020-12-11T10:00:00Z","12/11 05:00",2072,5800,3891,"2020-12-11T10:00:00Z",,,,,,,,890717,,,,,,,,,,,"20",0,0,890717,0,890717,,0,0,"639fb5d0fbed6ae84632df6bf64d152a76781c07",0,0,0,0,0,""
20201212,"KS",185294,,705423,,"posNeg",890717,1068,5800,271,1564,130,409,,"12/11/2020 10:00","2020-12-11T10:00:00Z","12/11 05:00",2072,5800,3891,"2020-12-11T10:00:00Z",,,,,,,,890717,,,,,,,,,,,"20",0,0,890717,0,890717,,0,0,"1592f68622c32bbacc6aa3ae3734d3f17b27ef62",0,0,0,0,0,""
20201211,"KS",185294,,705423,,"posNeg",890717,1068,5800,271,1564,130,409,,"12/11/2020 10:00","2020-12-11T10:00:00Z","12/11 05:00",2072,5800,3891,"2020-12-11T10:00:00Z",,,,,,,,890717,,,,,,,,,,,"20",5491,9174,890717,14665,890717,,131,146,"66a34a8089731672dfd742ae3f267788e99b706b",0,0,0,0,0,""
20201210,"KS",179803,,696249,,"posNeg",876052,1109,5654,301,1527,136,409,,"12/9/2020 10:00","2020-12-09T10:00:00Z","12/09 05:00",1941,5654,3793,"2020-12-09T10:00:00Z",,,,,,,,876052,,,,,,,,,,,"20",0,0,876052,0,876052,,0,0,"1f1b7d15bcaf88f2b07ffdbf48dfdaecf4e55735",0,0,0,0,0,""
20201209,"KS",179803,,696249,,"posNeg",876052,1109,5654,301,1527,136,409,,"12/9/2020 10:00","2020-12-09T10:00:00Z","12/09 05:00",1941,5654,3793,"2020-12-09T10:00:00Z",,,,,,,,876052,,,,,,,,,,,"20",5778,8950,876052,14728,876052,,85,145,"599f5afab7525778b2e89fe20cb84256d5a7e7b7",0,0,0,0,0,""
20201208,"KS",174025,,687299,,"posNeg",861324,623,5509,171,1474,86,409,,"12/7/2020 10:00","2020-12-07T10:00:00Z","12/07 05:00",1856,5509,3675,"2020-12-07T10:00:00Z",,,,,,,,861324,,,,,,,,,,,"20",0,0,861324,0,861324,,0,0,"5dbf2ed7a7f6055006f7149977fa0e54a903e4d0",0,0,0,0,0,""
20201207,"KS",174025,,687299,,"posNeg",861324,623,5509,171,1474,86,409,,"12/7/2020 10:00","2020-12-07T10:00:00Z","12/07 05:00",1856,5509,3675,"2020-12-07T10:00:00Z",,,,,,,,861324,,,,,,,,,,,"20",5730,10408,861324,16138,861324,,70,92,"4fd4f89e0bf6e97c3db509a718c9535b72aca7ae",0,0,0,0,0,""
20201206,"KS",168295,,676891,,"posNeg",845186,1143,5417,283,1453,123,409,,"12/4/2020 10:00","2020-12-04T10:00:00Z","12/04 05:00",1786,5417,3615,"2020-12-04T10:00:00Z",,,,,,,,845186,,,,,,,,,,,"20",0,0,845186,0,845186,,0,0,"e6c939351f670a63c78da1156685d214bb47b254",0,0,0,0,0,""
20201205,"KS",168295,,676891,,"posNeg",845186,1143,5417,283,1453,123,409,,"12/4/2020 10:00","2020-12-04T10:00:00Z","12/04 05:00",1786,5417,3615,"2020-12-04T10:00:00Z",,,,,,,,845186,,,,,,,,,,,"20",0,0,845186,0,845186,,0,0,"2fe365ae9546c3c855635ecf054e1e5f3970c051",0,0,0,0,0,""
20201204,"KS",168295,,676891,,"posNeg",845186,1143,5417,283,1453,123,409,,"12/4/2020 10:00","2020-12-04T10:00:00Z","12/04 05:00",1786,5417,3615,"2020-12-04T10:00:00Z",,,,,,,,845186,,,,,,,,,,,"20",6234,7770,845186,14004,845186,,107,127,"c9b8a6e9eada75aa2f29cc380231a22e561b7647",0,0,0,0,0,""
20201203,"KS",162061,,669121,,"posNeg",831182,854,5290,227,1390,92,409,,"12/3/2020 10:00","2020-12-03T10:00:00Z","12/03 05:00",1679,5290,3512,"2020-12-03T10:00:00Z",,,,,,,,831182,,,,,,,,,,,"20",0,0,831182,0,831182,,0,0,"9addc99a331c7a886b8c1bae6ac02447eb9cc4d5",0,0,0,0,0,""
20201202,"KS",162061,,669121,,"posNeg",831182,1196,5290,298,1390,125,409,,"12/3/2020 10:00","2020-12-03T10:00:00Z","12/03 05:00",1679,5290,3512,"2020-12-03T10:00:00Z",,,,,,,,831182,,,,,,,,,,,"20",4615,3683,831182,8298,831182,,119,185,"67840b1e25b890140635f8d25bcd72917a061194",0,0,0,0,0,""
20201201,"KS",157446,,665438,,"posNeg",822884,854,5105,227,1353,92,395,,"11/30/2020 10:00","2020-11-30T10:00:00Z","11/30 05:00",1560,5105,3403,"2020-11-30T10:00:00Z",,,,,,,,822884,,,,,,,,,,,"20",0,0,822884,0,822884,,0,0,"b448def0ced1f87087f3e83dfee4d097bd56f490",0,0,0,0,0,""
20201130,"KS",157446,,665438,,"posNeg",822884,854,5105,227,1353,92,395,,"11/30/2020 10:00","2020-11-30T10:00:00Z","11/30 05:00",1560,5105,3403,"2020-11-30T10:00:00Z",,,,,,,,822884,,,,,,,,,,,"20",4425,6035,822884,10460,822884,,31,87,"62f94cbec1d5731e082160da2dfe8368369a3570",0,0,0,0,0,""
20201129,"KS",153021,,659403,,"posNeg",812424,802,5018,221,1329,73,389,,"11/27/2020 10:00","2020-11-27T10:00:00Z","11/27 05:00",1529,5018,3352,"2020-11-27T10:00:00Z",,,,,,,,812424,,,,,,,,,,,"20",0,0,812424,0,812424,,0,0,"1ce585720c5b3ef4d286a4fddb6db3d619ac87a0",0,0,0,0,0,""
20201128,"KS",153021,,659403,,"posNeg",812424,802,5018,221,1329,73,389,,"11/27/2020 10:00","2020-11-27T10:00:00Z","11/27 05:00",1529,5018,3352,"2020-11-27T10:00:00Z",,,,,,,,812424,,,,,,,,,,,"20",0,0,812424,0,812424,,0,0,"f3481604618c6af4982520ff42172601d27b49f6",0,0,0,0,0,""
20201127,"KS",153021,,659403,,"posNeg",812424,802,5018,221,1329,73,389,,"11/27/2020 10:00","2020-11-27T10:00:00Z","11/27 05:00",1529,5018,3352,"2020-11-27T10:00:00Z",,,,,,,,812424,,,,,,,,,,,"20",5224,8015,812424,13239,812424,,26,97,"448a6b6d0f86a059d7461cfc6e5dbafb0b16079e",0,0,0,0,0,""
20201126,"KS",147797,,651388,,"posNeg",799185,1126,4921,272,1316,102,385,,"11/25/2020 10:00","2020-11-25T10:00:00Z","11/25 05:00",1503,4921,3299,"2020-11-25T10:00:00Z",,,,,,,,799185,,,,,,,,,,,"20",0,0,799185,0,799185,,0,0,"38e806fa17cda6b32199f4a105fed30ed4bfa7e4",0,0,0,0,0,""
20201125,"KS",147797,,651388,,"posNeg",799185,1126,4921,272,1316,102,385,,"11/25/2020 10:00","2020-11-25T10:00:00Z","11/25 05:00",1503,4921,3299,"2020-11-25T10:00:00Z",,,,,,,,799185,,,,,,,,,,,"20",5738,9159,799185,14897,799185,,47,144,"7af8bf5a3cf0c1493bdc4e077df178a1451ccf88",0,0,0,0,0,""
20201124,"KS",142059,,642229,,"posNeg",784288,896,4777,240,1294,89,377,,"11/23/2020 10:00","2020-11-23T10:00:00Z","11/23 05:00",1456,4777,3189,"2020-11-23T10:00:00Z",,,,,,,,784288,,,,,,,,,,,"20",0,0,784288,0,784288,,0,0,"00721a88e8739d9d06ef68d578fd55d75ffdb806",0,0,0,0,0,""
20201123,"KS",142059,,642229,,"posNeg",784288,896,4777,240,1294,89,377,,"11/23/2020 10:00","2020-11-23T10:00:00Z","11/23 05:00",1456,4777,3189,"2020-11-23T10:00:00Z",,,,,,,,784288,,,,,,,,,,,"20",7526,12869,784288,20395,784288,,46,95,"595a10bb8089e0e92b58392d1046a6e24b33f684",0,0,0,0,0,""
20201122,"KS",134533,,629360,,"posNeg",763893,1048,4682,269,1269,109,372,,"11/20/2020 10:00","2020-11-20T10:00:00Z","11/20 05:00",1410,4682,3144,"2020-11-20T10:00:00Z",,,,,,,,763893,,,,,,,,,,,"20",0,0,763893,0,763893,,0,0,"04d5619e4a31641ea94e2d0a351a9f4eb6e9eeb7",0,0,0,0,0,""
20201121,"KS",134533,,629360,,"posNeg",763893,1048,4682,269,1269,109,372,,"11/20/2020 10:00","2020-11-20T10:00:00Z","11/20 05:00",1410,4682,3144,"2020-11-20T10:00:00Z",,,,,,,,763893,,,,,,,,,,,"20",0,0,763893,0,763893,,0,0,"7c6a0ebf35c04ba8423b93b3a4d9ed88a406f4c6",0,0,0,0,0,""
20201120,"KS",134533,,629360,,"posNeg",763893,1048,4682,269,1269,109,372,,"11/20/2020 10:00","2020-11-20T10:00:00Z","11/20 05:00",1410,4682,3144,"2020-11-20T10:00:00Z",,,,,,,,763893,,,,,,,,,,,"20",5939,9693,763893,15632,763893,,84,121,"8faa48df0fdc6764069afe473fc70f4cbb6fa0b7",0,0,0,0,0,""
20201119,"KS",128594,,619667,,"posNeg",748261,1039,4561,253,1241,95,364,,"11/18/2020 10:00","2020-11-18T10:00:00Z","11/18 05:00",1326,4561,3067,"2020-11-18T10:00:00Z",,,,,,,,748261,,,,,,,,,,,"20",0,0,748261,0,748261,,0,0,"e2718fc6761d40fad2db2de4918f5e2aed87dcf7",0,0,0,0,0,""
20201118,"KS",128594,,619667,,"posNeg",748261,1039,4561,253,1241,95,364,,"11/18/2020 10:00","2020-11-18T10:00:00Z","11/18 05:00",1326,4561,3067,"2020-11-18T10:00:00Z",,,,,,,,748261,,,,,,,,,,,"20",5853,8652,748261,14505,748261,,60,130,"dab327041b74930d0df45fb398ba62eede741bcc",0,0,0,0,0,""
20201117,"KS",122741,,611015,,"posNeg",733756,551,4431,163,1205,58,355,,"11/16/2020 10:00","2020-11-16T10:00:00Z","11/16 05:00",1266,4431,3006,"2020-11-16T10:00:00Z",,,,,,,,733756,,,,,,,,,,,"20",0,0,733756,0,733756,,0,0,"bf1ed6ec46028bdc684330b0805f07fa1ecaa323",0,0,0,0,0,""
20201116,"KS",122741,,611015,,"posNeg",733756,551,4431,163,1205,58,355,,"11/16/2020 10:00","2020-11-16T10:00:00Z","11/16 05:00",1266,4431,3006,"2020-11-16T10:00:00Z",,,,,,,,733756,,,,,,,,,,,"20",7234,19735,733756,26969,733756,,10,104,"e000418b46c13366628d8c299957dfeb7db8c173",0,0,0,0,0,""
20201115,"KS",115507,,591280,,"posNeg",706787,811,4327,211,1184,74,348,,"11/13/2020 10:00","2020-11-13T10:00:00Z","11/13 05:00",1256,4327,2960,"2020-11-13T10:00:00Z",,,,,,,,700505,,,,,,,,,,,"20",0,0,706787,0,706787,,0,0,"fc081750e79aaf3301a5abfcbcf495856a004f57",0,0,0,0,0,""
20201114,"KS",115507,,591280,,"posNeg",706787,811,4327,211,1184,74,348,,"11/13/2020 10:00","2020-11-13T10:00:00Z","11/13 05:00",1256,4327,2960,"2020-11-13T10:00:00Z",,,,,,,,700505,,,,,,,,,,,"20",0,0,706787,0,706787,,0,0,"8b5c260dfdb0762fbf2fb9ba7e73712bafbad2dd",0,0,0,0,0,""
20201113,"KS",115507,,591280,,"posNeg",706787,811,4327,211,1184,74,348,,"11/13/2020 10:00","2020-11-13T10:00:00Z","11/13 05:00",1256,4327,2960,"2020-11-13T10:00:00Z",,,,,,,,700505,,,,,,,,,,,"20",6282,0,706787,6282,706787,,41,75,"1c1973e2e95158250453a40ef370d99c79572ac5",0,0,0,0,0,""
20201112,"KS",109225,,591280,,"posNeg",700505,810,4252,210,1167,80,347,,"11/11/2020 10:00","2020-11-11T10:00:00Z","11/11 05:00",1215,4252,2913,"2020-11-11T10:00:00Z",,,,,,,,700505,,,,,,,,,,,"20",0,-3142,700505,-3142,700505,,0,0,"2993fac98343a64dbc367329c56c8b2e52aef80b",0,0,0,0,0,""
20201111,"KS",109225,,594422,,"posNeg",703647,810,4252,210,1167,80,347,,"11/11/2020 10:00","2020-11-11T10:00:00Z","11/11 05:00",1215,4252,2913,"2020-11-11T10:00:00Z",,,,,,,,703647,,,,,,,,,,,"20",5672,7993,703647,13665,703647,,34,114,"0f2b4b4194e88fd109012d2f8f2248cd898f08ce",0,0,0,0,0,""
20201110,"KS",103553,,586429,,"posNeg",689982,500,4138,140,1135,55,339,,"11/9/2020 10:00","2020-11-09T10:00:00Z","11/09 05:00",1181,4138,2842,"2020-11-09T10:00:00Z",,,,,,,,689982,,,,,,,,,,,"20",0,0,689982,0,689982,,0,0,"3e62a14570a9a70fb296b6c63d71cad1f42e422e",0,0,0,0,0,""
20201109,"KS",103553,,586429,,"posNeg",689982,500,4138,140,1135,55,339,,"11/9/2020 10:00","2020-11-09T10:00:00Z","11/09 05:00",1181,4138,2842,"2020-11-09T10:00:00Z",,,,,,,,689982,,,,,,,,,,,"20",5920,7742,689982,13662,689982,,15,71,"1a3a316181d2a46008ad4bb1fc92266f7279be97",0,0,0,0,0,""
20201108,"KS",97633,,578687,,"posNeg",676320,693,4067,183,1122,62,337,,"11/6/2020 10:00","2020-11-06T10:00:00Z","11/06 05:00",1166,4067,2808,"2020-11-06T10:00:00Z",,,,,,,,676320,,,,,,,,,,,"20",0,0,676320,0,676320,,0,0,"beda0127e1f157142e2046ca61fc423238e1452e",0,0,0,0,0,""
20201107,"KS",97633,,578687,,"posNeg",676320,693,4067,183,1122,62,337,,"11/6/2020 10:00","2020-11-06T10:00:00Z","11/06 05:00",1166,4067,2808,"2020-11-06T10:00:00Z",,,,,,,,676320,,,,,,,,,,,"20",0,0,676320,0,676320,,0,0,"6b1778d07396b2949f9b91584a739f38bbc09f22",0,0,0,0,0,""
20201106,"KS",97633,,578687,,"posNeg",676320,693,4067,183,1122,62,337,,"11/6/2020 10:00","2020-11-06T10:00:00Z","11/06 05:00",1166,4067,2808,"2020-11-06T10:00:00Z",,,,,,,,676320,,,,,,,,,,,"20",5418,7222,676320,12640,676320,,79,83,"8c41befb64b3bf219acc9498cfc27c203f9d5f00",0,0,0,0,0,""
20201105,"KS",92215,,571465,,"posNeg",663680,567,3984,160,1106,60,334,,"11/4/2020 10:00","2020-11-04T10:00:00Z","11/04 05:00",1087,3984,2753,"2020-11-04T10:00:00Z",,,,,,,,663680,,,,,,,,,,,"20",0,0,663680,0,663680,,0,0,"0bf4b2466290b1eb04c3d152e1519e149c179685",0,0,0,0,0,""
20201104,"KS",92215,,571465,,"posNeg",663680,567,3984,160,1106,60,334,,"11/4/2020 10:00","2020-11-04T10:00:00Z","11/04 05:00",1087,3984,2753,"2020-11-04T10:00:00Z",,,,,,,,663680,,,,,,,,,,,"20",2988,5425,663680,8413,663680,,41,91,"960d03c90203232789e7d9800acc6001a49ef917",0,0,0,0,0,""
20201103,"KS",89227,,566040,,"posNeg",655267,373,3893,110,1082,39,328,,"11/2/2020 10:00","2020-11-02T10:00:00Z","11/02 05:00",1046,3893,2682,"2020-11-02T10:00:00Z",,,,,,,,655267,,,,,,,,,,,"20",0,0,655267,0,655267,,0,0,"0c5dfd3b888d3628bb09f3c3031645cb11ced7e5",0,0,0,0,0,""
20201102,"KS",89227,,566040,,"posNeg",655267,373,3893,110,1082,39,328,,"11/2/2020 10:00","2020-11-02T10:00:00Z","11/02 05:00",1046,3893,2682,"2020-11-02T10:00:00Z",,,,,,,,655267,,,,,,,,,,,"20",4046,8439,655267,12485,655267,,17,61,"03b4b354d95c6853ddb9ea9d2d74755e053e2976",0,0,0,0,0,""
20201101,"KS",85181,,557601,,"posNeg",642782,512,3832,145,1067,53,323,,"10/30/2020 10:00","2020-10-30T10:00:00Z","10/30 06:00",1029,3832,2659,"2020-10-30T10:00:00Z",,,,,,,,642782,,,,,,,,,,,"20",0,0,642782,0,642782,,0,0,"0566d9d596b44cc334bc80c4c0d28f6f5c58f7eb",0,0,0,0,0,""
20201031,"KS",85181,,557601,,"posNeg",642782,512,3832,145,1067,53,323,,"10/30/2020 10:00","2020-10-30T10:00:00Z","10/30 06:00",1029,3832,2659,"2020-10-30T10:00:00Z",,,,,,,,642782,,,,,,,,,,,"20",0,0,642782,0,642782,,0,0,"7177bf1bb234d0bccd078af0f3ecd6a1c5024580",0,0,0,0,0,""
20201030,"KS",85181,,557601,,"posNeg",642782,512,3832,145,1067,53,323,,"10/30/2020 10:00","2020-10-30T10:00:00Z","10/30 06:00",1029,3832,2659,"2020-10-30T10:00:00Z",,,,,,,,642782,,,,,,,,,,,"20",3136,6613,642782,9749,642782,,22,80,"229916922e39a4e969b79c5d8379452fcd933c77",0,0,0,0,0,""
20201029,"KS",82045,,550988,,"posNeg",633033,432,3752,120,1043,40,318,,"10/28/2020 10:00","2020-10-28T10:00:00Z","10/28 06:00",1007,3752,2604,"2020-10-28T10:00:00Z",,,,,,,,633033,,,,,,,,,,,"20",0,0,633033,0,633033,,0,0,"eadce56eefeda325ca48c6fec9b6e89dfe4410b8",0,0,0,0,0,""
20201028,"KS",82045,,550988,,"posNeg",633033,432,3752,120,1043,40,318,,"10/28/2020 10:00","2020-10-28T10:00:00Z","10/28 06:00",1007,3752,2604,"2020-10-28T10:00:00Z",,,,,,,,633033,,,,,,,,,,,"20",3369,3733,633033,7102,633033,,31,106,"0994830fddd3776a2d967e13db0167d721db2b73",0,0,0,0,0,""
20201027,"KS",78676,,547255,,"posNeg",625931,362,3646,103,1009,39,313,,"10/26/2020 10:00","2020-10-26T10:00:00Z","10/26 06:00",976,3646,2549,"2020-10-26T10:00:00Z",,,,,,,,625931,,,,,,,,,,,"20",0,0,625931,0,625931,,0,0,"3b499752dea295882c3f852acf84a4d055987bfc",0,0,0,0,0,""
20201026,"KS",78676,,547255,,"posNeg",625931,362,3646,103,1009,39,313,,"10/26/2020 10:00","2020-10-26T10:00:00Z","10/26 06:00",976,3646,2549,"2020-10-26T10:00:00Z",,,,,,,,625931,,,,,,,,,,,"20",2446,7223,625931,9669,625931,,1,62,"83de951609850cf8dc2ab3e7a19d4b404011f18a",0,0,0,0,0,""
20201025,"KS",76230,,540032,,"posNeg",616262,403,3584,2,1001,41,309,,"10/23/2020 10:00","2020-10-23T10:00:00Z","10/23 06:00",975,3584,2518,"2020-10-23T10:00:00Z",,,,,,,,616262,,,,,,,,,,,"20",0,0,616262,0,616262,,0,0,"c0977dafe6f052331fa547d6c9bd0878b3e8a477",0,0,0,0,0,""
20201024,"KS",76230,,540032,,"posNeg",616262,403,3584,2,1001,41,309,,"10/23/2020 10:00","2020-10-23T10:00:00Z","10/23 06:00",975,3584,2518,"2020-10-23T10:00:00Z",,,,,,,,616262,,,,,,,,,,,"20",0,0,616262,0,616262,,0,0,"0e0bca0f49c3a342289444a0aa78a59912dc3700",0,0,0,0,0,""
20201023,"KS",76230,,540032,,"posNeg",616262,403,3584,2,1001,41,309,,"10/23/2020 10:00","2020-10-23T10:00:00Z","10/23 06:00",975,3584,2518,"2020-10-23T10:00:00Z",,,,,,,,616262,,,,,,,,,,,"20",1774,8979,616262,10753,616262,,23,78,"5b8d1b57fbbb7c26be96ab78c741b151f2fa7cc8",0,0,0,0,0,""
20201022,"KS",74456,,531053,,"posNeg",605509,329,3506,1,975,45,299,,"10/21/2020 10:00","2020-10-21T10:00:00Z","10/21 06:00",952,3506,2485,"2020-10-21T10:00:00Z",,,,,,,,605509,,,,,,,,,,,"20",0,0,605509,0,605509,,0,0,"7e5d971c51945be7bb8a5a94e338a659880afaa9",0,0,0,0,0,""
20201021,"KS",74456,,531053,,"posNeg",605509,329,3506,1,975,45,299,,"10/21/2020 10:00","2020-10-21T10:00:00Z","10/21 06:00",952,3506,2485,"2020-10-21T10:00:00Z",,,,,,,,605509,,,,,,,,,,,"20",1488,5627,605509,7115,605509,,80,85,"d5d8e931d4efffd89c67a60b86c31b4a9e126da0",0,0,0,0,0,""
20201020,"KS",72968,,525426,,"posNeg",598394,285,3421,81,952,39,294,,"10/19/2020 10:00","2020-10-19T10:00:00Z","10/19 06:00",872,3421,2415,"2020-10-19T10:00:00Z",,,,,,,,598394,,,,,,,,,,,"20",0,0,598394,0,598394,,0,0,"bbb77d566eb1d1cc07df5b804afaad31447dce6d",0,0,0,0,0,""
20201019,"KS",72968,,525426,,"posNeg",598394,285,3421,81,952,39,294,,"10/19/2020 10:00","2020-10-19T10:00:00Z","10/19 06:00",872,3421,2415,"2020-10-19T10:00:00Z",,,,,,,,598394,,,,,,,,,,,"20",2113,7092,598394,9205,598394,,13,51,"9a3194bf152b6f2722f9f08a357afd89be74c76f",0,0,0,0,0,""
20201018,"KS",70855,,518334,,"posNeg",589189,456,3370,123,933,47,284,,"10/16/2020 10:00","2020-10-16T10:00:00Z","10/16 06:00",859,3370,2379,"2020-10-16T10:00:00Z",,,,,,,,589189,,,,,,,,,,,"20",0,0,589189,0,589189,,0,0,"629d03ed333e7c4321379df3c7c6cbf57930c64a",0,0,0,0,0,""
20201017,"KS",70855,,518334,,"posNeg",589189,456,3370,123,933,47,284,,"10/16/2020 10:00","2020-10-16T10:00:00Z","10/16 06:00",859,3370,2379,"2020-10-16T10:00:00Z",,,,,,,,589189,,,,,,,,,,,"20",0,0,589189,0,589189,,0,0,"9beddacbcc6a0d077db2cf163bcf33853397b1be",0,0,0,0,0,""
20201016,"KS",70855,,518334,,"posNeg",589189,456,3370,123,933,47,284,,"10/16/2020 10:00","2020-10-16T10:00:00Z","10/16 06:00",859,3370,2379,"2020-10-16T10:00:00Z",,,,,,,,589189,,,,,,,,,,,"20",1700,7662,589189,9362,589189,,21,61,"cefda8e5a1a2f365429e34dc206b39d146e08ede",0,0,0,0,0,""
20201015,"KS",69155,,510672,,"posNeg",579827,488,3309,128,913,42,280,,"10/14/2020 10:00","2020-10-14T10:00:00Z","10/14 06:00",838,3309,2340,"2020-10-14T10:00:00Z",,,,,,,,579827,,,,,,,,,,,"20",0,0,579827,0,579827,,0,0,"df4be65d9b1c73968091198f80dec2f22a84e12d",0,0,0,0,0,""
20201014,"KS",69155,,510672,,"posNeg",579827,488,3309,128,913,42,280,,"10/14/2020 10:00","2020-10-14T10:00:00Z","10/14 06:00",838,3309,2340,"2020-10-14T10:00:00Z",,,,,,,,579827,,,,,,,,,,,"20",1293,6453,579827,7746,579827,,67,70,"43a91ffe4c721e7b4e2f58fac33f7687c98aaf94",0,0,0,0,0,""
20201013,"KS",67862,,504219,,"posNeg",572081,355,3239,111,890,42,274,,"10/12/2020 10:00","2020-10-12T10:00:00Z","10/12 06:00",771,3239,2301,"2020-10-12T10:00:00Z",,,,,,,,572081,,,,,,,,,,,"20",0,0,572081,0,572081,,0,0,"7e0e54db41f5d5c26603f3e51b6e3a580ac90d60",0,0,0,0,0,""
20201012,"KS",67862,,504219,,"posNeg",572081,355,3239,111,890,42,274,,"10/12/2020 10:00","2020-10-12T10:00:00Z","10/12 06:00",771,3239,2301,"2020-10-12T10:00:00Z",,,,,,,,572081,,,,,,,,,,,"20",2055,9837,572081,11892,572081,,8,54,"48d7b08632c9b8e3d21fbd74771477ad690bf42c",0,0,0,0,0,""
20201011,"KS",65807,,494382,,"posNeg",560189,469,3185,119,877,34,271,,"10/9/2020 10:00","2020-10-09T10:00:00Z","10/09 06:00",763,3185,2275,"2020-10-09T10:00:00Z",,,,,,,,560189,,,,,,,,,,,"20",0,0,560189,0,560189,,0,0,"87c82de56dc091d67a2b3a01ad4f1edb912e0d55",0,0,0,0,0,""
20201010,"KS",65807,,494382,,"posNeg",560189,469,3185,119,877,34,271,,"10/9/2020 10:00","2020-10-09T10:00:00Z","10/09 06:00",763,3185,2275,"2020-10-09T10:00:00Z",,,,,,,,560189,,,,,,,,,,,"20",0,0,560189,0,560189,,0,0,"1d187e9fd7eb6d8c3367f7d4fb45224619ce637f",0,0,0,0,0,""
20201009,"KS",65807,,494382,,"posNeg",560189,469,3185,119,877,34,271,,"10/9/2020 10:00","2020-10-09T10:00:00Z","10/09 06:00",763,3185,2275,"2020-10-09T10:00:00Z",,,,,,,,560189,,,,,,,,,,,"20",1855,8936,560189,10791,560189,,40,64,"543cfe5662f353c794271d77abbe7bebede9dba5",0,0,0,0,0,""
20201008,"KS",63952,,485446,,"posNeg",549398,393,3121,103,849,34,267,,"10/7/2020 10:00","2020-10-07T10:00:00Z","10/07 06:00",723,3121,2231,"2020-10-07T10:00:00Z",,,,,,,,549398,,,,,,,,,,,"20",0,0,549398,0,549398,,0,0,"6e700a0adf79e4d6a0f02b77acbc8a3158318463",0,0,0,0,0,""
20201007,"KS",63952,,485446,,"posNeg",549398,352,3121,103,849,33,267,,"10/7/2020 10:00","2020-10-07T10:00:00Z","10/07 06:00",723,3121,2231,"2020-10-07T10:00:00Z",,,,,,,,549398,,,,,,,,,,,"20",1244,7048,549398,8292,549398,,17,85,"0192fec3bfce795e0c8b6afc1d0cc7a2aab6abd2",0,0,0,0,0,""
20201006,"KS",62708,,478398,,"posNeg",541106,352,3036,103,827,33,261,,"10/5/2020 10:00","2020-10-05T10:00:00Z","10/05 06:00",706,3036,2165,"2020-10-05T10:00:00Z",,,,,,,,541106,,,,,,,,,,,"20",0,0,541106,0,541106,,0,0,"f28e4dfc13b0b03eea03135055ce3cf5548db6cb",0,0,0,0,0,""
20201005,"KS",62708,,478398,,"posNeg",541106,352,3036,103,827,33,261,,"10/5/2020 10:00","2020-10-05T10:00:00Z","10/05 06:00",706,3036,2165,"2020-10-05T10:00:00Z",,,,,,,,541106,,,,,,,,,,,"20",1597,8392,541106,9989,541106,,8,53,"1e4381afc6b34bde37ff7437e0d99e331121f977",0,0,0,0,0,""
20201004,"KS",61111,,470006,,"posNeg",531117,352,2983,103,817,33,259,,"10/2/2020 10:00","2020-10-02T10:00:00Z","10/02 06:00",698,2983,2136,"2020-10-02T10:00:00Z",,,,,,,,531117,,,,,,,,,,,"20",0,0,531117,0,531117,,0,0,"1e645157dee84a1a61916b308e7bf14215d6a4a9",0,0,0,0,0,""
20201003,"KS",61111,,470006,,"posNeg",531117,352,2983,103,817,33,259,,"10/2/2020 10:00","2020-10-02T10:00:00Z","10/02 06:00",698,2983,2136,"2020-10-02T10:00:00Z",,,,,,,,531117,,,,,,,,,,,"20",0,0,531117,0,531117,,0,0,"f2a26d6059c357e7f0c80a74b268ee13b9947e69",0,0,0,0,0,""
20201002,"KS",61111,,470006,,"posNeg",531117,352,2983,103,817,33,259,,"10/2/2020 10:00","2020-10-02T10:00:00Z","10/02 06:00",698,2983,2136,"2020-10-02T10:00:00Z",,,,,,,,531117,,,,,,,,,,,"20",1362,8305,531117,9667,531117,,20,66,"44978874fc87f4e6f612c32c732fc2240c761211",0,0,0,0,0,""
20201001,"KS",59749,,461701,,"posNeg",521450,352,2917,103,801,33,255,,"9/30/2020 10:00","2020-09-30T10:00:00Z","09/30 06:00",678,2917,2095,"2020-09-30T10:00:00Z",,,,,,,,521450,,,,,,,,,,,"20",0,0,521450,0,521450,,0,0,"be66e8186283618c340f4ceadb7a55b8816e3f55",0,0,0,0,0,""
20200930,"KS",59749,,461701,,"posNeg",521450,352,2917,103,801,33,255,,"9/30/2020 10:00","2020-09-30T10:00:00Z","09/30 06:00",678,2917,2095,"2020-09-30T10:00:00Z",,,,,,,,521450,,,,,,,,,,,"20",1120,6421,521450,7541,521450,,41,65,"8e5f6d9093d86631a145f0fb82b681e59d18514c",0,0,0,0,0,""
20200929,"KS",58629,,455280,,"posNeg",513909,270,2852,88,785,29,251,,"9/28/2020 10:00","2020-09-28T10:00:00Z","09/28 06:00",637,2852,2051,"2020-09-28T10:00:00Z",,,,,,,,513909,,,,,,,,,,,"20",0,0,513909,0,513909,,0,0,"fac9f54bd0ff6e268ae3fa96facc4d1a4b471a5b",0,0,0,0,0,""
20200928,"KS",58629,,455280,,"posNeg",513909,270,2852,88,785,29,251,,"9/28/2020 10:00","2020-09-28T10:00:00Z","09/28 06:00",637,2852,2051,"2020-09-28T10:00:00Z",,,,,,,,513909,,,,,,,,,,,"20",2037,9102,513909,11139,513909,,5,36,"d5cff3c304720ca334df6c42cc91b214bc14c8de",0,0,0,0,0,""
20200927,"KS",56592,,446178,,"posNeg",502770,343,2816,121,768,34,250,,"9/25/2020 10:00","2020-09-25T10:00:00Z","09/25 06:00",632,2816,2039,"2020-09-25T10:00:00Z",,,,,,,,502770,,,,,,,,,,,"20",0,0,502770,0,502770,,0,0,"7872f6d11b0e81e0d7081b795afc0f57332c7a40",0,0,0,0,0,""
20200926,"KS",56592,,446178,,"posNeg",502770,343,2816,121,768,34,250,,"9/25/2020 10:00","2020-09-25T10:00:00Z","09/25 06:00",632,2816,2039,"2020-09-25T10:00:00Z",,,,,,,,502770,,,,,,,,,,,"20",0,0,502770,0,502770,,0,0,"24eee72029f0de9c16a9fa6cd0527759016da37d",0,0,0,0,0,""
20200925,"KS",56592,,446178,,"posNeg",502770,343,2816,121,768,34,250,,"9/25/2020 10:00","2020-09-25T10:00:00Z","09/25 06:00",632,2816,2039,"2020-09-25T10:00:00Z",,,,,,,,502770,,,,,,,,,,,"20",1366,9123,502770,10489,502770,,11,50,"94b32df26b8ce2dc89331f39839b57ab2a18ec4d",0,0,0,0,0,""
20200924,"KS",55226,,437055,,"posNeg",492281,313,2766,93,753,27,240,,"9/23/2020 10:00","2020-09-23T10:00:00Z","09/23 06:00",621,2766,2008,"2020-09-23T10:00:00Z",,,,,,,,492281,,,,,,,,,,,"20",0,0,492281,0,492281,,0,0,"886f9090d454709f94bacb2406f9d4c22ff3ff8d",0,0,0,0,0,""
20200923,"KS",55226,,437055,,"posNeg",492281,313,2766,93,753,27,240,,"9/23/2020 10:00","2020-09-23T10:00:00Z","09/23 06:00",621,2766,2008,"2020-09-23T10:00:00Z",,,,,,,,492281,,,,,,,,,,,"20",1267,6323,492281,7590,492281,,21,60,"87b7c6b3e9e7d3f247fc7ee30d39128ce7a39fdf",0,0,0,0,0,""
20200922,"KS",53959,,430732,,"posNeg",484691,216,2706,60,741,23,230,,"9/21/2020 10:00","2020-09-21T10:00:00Z","09/21 06:00",600,2706,1970,"2020-09-21T10:00:00Z",,,,,,,,484691,,,,,,,,,,,"20",0,0,484691,0,484691,,0,0,"273d43b3b93200a3e20fbeb69685a263aefde98b",0,0,0,0,0,""
20200921,"KS",53959,,430732,,"posNeg",484691,216,2706,60,741,23,230,,"9/21/2020 10:00","2020-09-21T10:00:00Z","09/21 06:00",600,2706,1970,"2020-09-21T10:00:00Z",,,,,,,,484691,,,,,,,,,,,"20",1674,8268,484691,9942,484691,,4,35,"6f813e77dffc09251576875020bd4a63b9279725",0,0,0,0,0,""
20200920,"KS",52285,,422464,,"posNeg",474749,286,2671,79,734,23,230,,"9/18/2020 10:00","2020-09-18T10:00:00Z","09/18 06:00",596,2671,1950,"2020-09-18T10:00:00Z",,,,,,,,474749,,,,,,,,,,,"20",0,0,474749,0,474749,,0,0,"85d003df59622072fb7066747698c0a772715d07",0,0,0,0,0,""
20200919,"KS",52285,,422464,,"posNeg",474749,286,2671,79,734,23,230,,"9/18/2020 10:00","2020-09-18T10:00:00Z","09/18 06:00",596,2671,1950,"2020-09-18T10:00:00Z",,,,,,,,474749,,,,,,,,,,,"20",0,0,474749,0,474749,,0,0,"37bd4b34b5862522e3761b08c3bb64a14142d268",0,0,0,0,0,""
20200918,"KS",52285,,422464,,"posNeg",474749,286,2671,79,734,23,230,,"9/18/2020 10:00","2020-09-18T10:00:00Z","09/18 06:00",596,2671,1950,"2020-09-18T10:00:00Z",,,,,,,,474749,,,,,,,,,,,"20",1415,9108,474749,10523,474749,,10,55,"9d5d03af2838413939afec4c0361ba98f6b39f68",0,0,0,0,0,""
20200917,"KS",50870,,413356,,"posNeg",464226,278,2616,83,713,21,225,,"9/16/2020 10:00","2020-09-16T10:00:00Z","09/16 06:00",586,2616,1920,"2020-09-16T10:00:00Z",,,,,,,,464226,,,,,,,,,,,"20",0,0,464226,0,464226,,0,0,"557046db0a19b447fd730162a16c6ed329b4e507",0,0,0,0,0,""
20200916,"KS",50870,,413356,,"posNeg",464226,278,2616,83,713,21,225,,"9/16/2020 10:00","2020-09-16T10:00:00Z","09/16 06:00",586,2616,1920,"2020-09-16T10:00:00Z",,,,,,,,464226,,,,,,,,,,,"20",971,4874,464226,5845,464226,,52,44,"1b113dd7dfec37994d1943a4d36900c46b7fcbc7",0,0,0,0,0,""
20200915,"KS",49899,,408482,,"posNeg",458381,192,2572,50,703,15,221,,"9/14/2020 10:00","2020-09-14T10:00:00Z","09/14 06:00",534,2572,1887,"2020-09-14T10:00:00Z",,,,,,,,458381,,,,,,,,,,,"20",0,0,458381,0,458381,,0,0,"97c2665cb69c4b82887350e818dd7625c076592d",0,0,0,0,0,""
20200914,"KS",49899,,408482,,"posNeg",458381,192,2572,50,703,15,221,,"9/14/2020 10:00","2020-09-14T10:00:00Z","09/14 06:00",534,2572,1887,"2020-09-14T10:00:00Z",,,,,,,,458381,,,,,,,,,,,"20",1513,7938,458381,9451,458381,,23,35,"d894980909767e96c6d0f3957987964de04af1dc",0,0,0,0,0,""
20200913,"KS",48386,,400544,,"posNeg",448930,140,2537,40,690,10,219,,"9/11/2020 10:00","2020-09-11T10:00:00Z","09/11 06:00",511,2537,1859,"2020-09-11T10:00:00Z",,,,,,,,448930,,,,,,,,,,,"20",0,0,448930,0,448930,,0,0,"85985c0ad494f65291590e0307f65bc580203bd1",0,0,0,0,0,""
20200912,"KS",48386,,400544,,"posNeg",448930,140,2537,40,690,10,219,,"9/11/2020 10:00","2020-09-11T10:00:00Z","09/11 06:00",511,2537,1859,"2020-09-11T10:00:00Z",,,,,,,,448930,,,,,,,,,,,"20",0,0,448930,0,448930,,0,0,"4dea653fb531fbebf6ff069c63cb1ccb57e8fe03",0,0,0,0,0,""
20200911,"KS",48386,,400544,,"posNeg",448930,140,2537,40,690,10,219,,"9/11/2020 10:00","2020-09-11T10:00:00Z","09/11 06:00",511,2537,1859,"2020-09-11T10:00:00Z",,,,,,,,448930,,,,,,,,,,,"20",976,6540,448930,7516,448930,,16,67,"3b1686a55391c2652f7233a6406cb8b5f5e9c0a3",0,0,0,0,0,""
20200910,"KS",47410,,394004,,"posNeg",441414,319,2470,92,677,41,218,,"9/9/2020 10:00","2020-09-09T10:00:00Z","09/09 06:00",495,2470,1817,"2020-09-09T10:00:00Z",,,,,,,,441414,,,,,,,,,,,"20",0,0,441414,0,441414,,0,0,"56473c5df9828c22f7cde0dd6cb8c1442b722793",0,0,0,0,0,""
20200909,"KS",47410,,394004,,"posNeg",441414,319,2470,92,677,41,218,,"9/9/2020 10:00","2020-09-09T10:00:00Z","09/09 06:00",495,2470,1817,"2020-09-09T10:00:00Z",,,,,,,,441414,,,,,,,,,,,"20",496,4232,441414,4728,441414,,10,29,"63ab520cf49ab4bec60c7b0541ea700c369d80f1",0,0,0,0,0,""
20200908,"KS",46914,,389772,,"posNeg",436686,177,2441,51,669,25,214,,"9/7/2020 10:00","2020-09-07T10:00:00Z","09/07 06:00",485,2441,1796,"2020-09-07T10:00:00Z",,,,,,,,436686,,,,,,,,,,,"20",0,0,436686,0,436686,,0,0,"f0f590ed3bc99a74bf9a2a8b0e03af6d1d3cc84a",0,0,0,0,0,""
20200907,"KS",46914,,389772,,"posNeg",436686,177,2441,51,669,25,214,,"9/7/2020 10:00","2020-09-07T10:00:00Z","09/07 06:00",485,2441,1796,"2020-09-07T10:00:00Z",,,,,,,,436686,,,,,,,,,,,"20",1694,7787,436686,9481,436686,,4,26,"68e495678121fb55bbb6c5b4adb00f4d02b05fd6",0,0,0,0,0,""
20200906,"KS",45220,,381985,,"posNeg",427205,314,2415,101,661,36,211,,"9/4/2020 10:00","2020-09-04T10:00:00Z","09/04 06:00",481,2415,1785,"2020-09-04T10:00:00Z",,,,,,,,427205,,,,,,,,,,,"20",0,0,427205,0,427205,,0,0,"b7a25b6abe3c7804137c271a4347d72285d4fd15",0,0,0,0,0,""
20200905,"KS",45220,,381985,,"posNeg",427205,314,2415,101,661,36,211,,"9/4/2020 10:00","2020-09-04T10:00:00Z","09/04 06:00",481,2415,1785,"2020-09-04T10:00:00Z",,,,,,,,427205,,,,,,,,,,,"20",0,0,427205,0,427205,,0,0,"c831af63c3ffda4786aa45d001ed6853c2661a1f",0,0,0,0,0,""
20200904,"KS",45220,,381985,,"posNeg",427205,314,2415,101,661,36,211,,"9/4/2020 10:00","2020-09-04T10:00:00Z","09/04 06:00",481,2415,1785,"2020-09-04T10:00:00Z",,,,,,,,427205,,,,,,,,,,,"20",1280,6678,427205,7958,427205,,23,54,"d2302620e2f0c6831d006660577d55b22dbd515e",0,0,0,0,0,""
20200903,"KS",43940,,375307,,"posNeg",419247,336,2361,94,649,35,210,,"9/2/2020 10:00","2020-09-02T10:00:00Z","09/02 06:00",458,2361,1730,"2020-09-02T10:00:00Z",,,,,,,,419247,,,,,,,,,,,"20",0,0,419247,0,419247,,0,0,"8372ef7cdedf96265be26efae1978aad3694ec1b",0,0,0,0,0,""
20200902,"KS",43940,,375307,,"posNeg",419247,336,2361,94,649,35,210,,"9/2/2020 10:00","2020-09-02T10:00:00Z","09/02 06:00",458,2361,1730,"2020-09-02T10:00:00Z",,,,,,,,419247,,,,,,,,,,,"20",1328,4670,419247,5998,419247,,12,57,"2fb5e9ca534101faf1ecd0a31b283a7bb666c313",0,0,0,0,0,""
20200901,"KS",42612,,370637,,"posNeg",413249,211,2304,55,628,21,209,,"8/31/2020 10:00","2020-08-31T10:00:00Z","08/31 06:00",446,2304,1673,"2020-08-31T10:00:00Z",,,,,,,,413249,,,,,,,,,,,"20",0,0,413249,0,413249,,0,0,"781fa6f08bbf44759ae41f3ec5888d5b630208ac",0,0,0,0,0,""
20200831,"KS",42612,,370637,,"posNeg",413249,211,2304,55,628,21,209,,"8/31/2020 10:00","2020-08-31T10:00:00Z","08/31 06:00",446,2304,1673,"2020-08-31T10:00:00Z",,,,,,,,413249,,,,,,,,,,,"20",1564,8538,413249,10102,413249,,3,26,"8f99f0193fa3c55c5284e1da7c01aa41d26e90a2",0,0,0,0,0,""
20200830,"KS",41048,,362099,,"posNeg",403147,328,2278,96,616,31,206,,"8/28/2020 10:00","2020-08-28T10:00:00Z","08/28 06:00",443,2278,1658,"2020-08-28T10:00:00Z",,,,,,,,403147,,,,,,,,,,,"20",0,0,403147,0,403147,,0,0,"70f37a3bb2e9ffb5cbe5483c9dc83110a8361614",0,0,0,0,0,""
20200829,"KS",41048,,362099,,"posNeg",403147,328,2278,96,616,31,206,,"8/28/2020 10:00","2020-08-28T10:00:00Z","08/28 06:00",443,2278,1658,"2020-08-28T10:00:00Z",,,,,,,,403147,,,,,,,,,,,"20",0,0,403147,0,403147,,0,0,"50fe26a5fba561d4b0bc52760df52cf28e36c6d3",0,0,0,0,0,""
20200828,"KS",41048,,362099,,"posNeg",403147,328,2278,96,616,31,206,,"8/28/2020 10:00","2020-08-28T10:00:00Z","08/28 06:00",443,2278,1658,"2020-08-28T10:00:00Z",,,,,,,,403147,,,,,,,,,,,"20",1111,6939,403147,8050,403147,,6,52,"aefdc96d253d190f866766b589d575b5b6421a72",0,0,0,0,0,""
20200827,"KS",39937,,355160,,"posNeg",395097,262,2226,76,603,25,206,,"8/26/2020 10:00","2020-08-26T10:00:00Z","08/26 06:00",437,2226,1624,"2020-08-26T10:00:00Z",,,,,,,,395097,,,,,,,,,,,"20",0,0,395097,0,395097,,0,0,"2853f7262aaca5afc1f7aecf6d2624dc123a6d17",0,0,0,0,0,""
20200826,"KS",39937,,355160,,"posNeg",395097,262,2226,76,603,25,206,,"8/26/2020 10:00","2020-08-26T10:00:00Z","08/26 06:00",437,2226,1624,"2020-08-26T10:00:00Z",,,,,,,,395097,,,,,,,,,,,"20",1536,6604,395097,8140,395097,,11,43,"4ae193c4326b81eb56d2937017cea6512e07b32d",0,0,0,0,0,""
20200825,"KS",38401,,348556,,"posNeg",386957,189,2183,64,590,22,205,,"8/24/2020 10:00","2020-08-24T10:00:00Z","08/24 06:00",426,2183,1535,"2020-08-24T10:00:00Z",,,,,,,,386957,,,,,,,,,,,"20",0,0,386957,0,386957,,0,0,"0d24c760ee8d519bf1798096b71ca49eb71305bd",0,0,0,0,0,""
20200824,"KS",38401,,348556,,"posNeg",386957,189,2183,64,590,22,205,,"8/24/2020 10:00","2020-08-24T10:00:00Z","08/24 06:00",426,2183,1535,"2020-08-24T10:00:00Z",,,,,,,,386957,,,,,,,,,,,"20",1545,19097,386957,20642,386957,,7,24,"17eb6f5193e4632fe18bdd7af1aacb4168fae116",0,0,0,0,0,""
20200823,"KS",36856,,329459,,"posNeg",366315,296,2159,89,584,24,203,,"8/21/2020 10:00","2020-08-21T10:00:00Z","08/21 06:00",419,2159,1520,"2020-08-21T10:00:00Z",,,,,,,,366315,,,,,,,,,,,"20",0,0,366315,0,366315,,0,0,"d9f7c4e45e1fb53042531ad70add31c82b6edc47",0,0,0,0,0,""
20200822,"KS",36856,,329459,,"posNeg",366315,296,2159,89,584,24,203,,"8/21/2020 10:00","2020-08-21T10:00:00Z","08/21 06:00",419,2159,1520,"2020-08-21T10:00:00Z",,,,,,,,366315,,,,,,,,,,,"20",0,0,366315,0,366315,,0,0,"eb8a0c13ce2166d50b0b18f9a930ea96e66e5a91",0,0,0,0,0,""
20200821,"KS",36856,,329459,,"posNeg",366315,296,2159,89,584,24,203,,"8/21/2020 10:00","2020-08-21T10:00:00Z","08/21 06:00",419,2159,1520,"2020-08-21T10:00:00Z",,,,,,,,366315,,,,,,,,,,,"20",966,5509,366315,6475,366315,,8,69,"a72b44302e60b5c5921e939248a47ad82d991e4f",0,0,0,0,0,""
20200820,"KS",35890,,323950,,"posNeg",359840,300,2090,88,567,26,202,,"8/19/2020 10:00","2020-08-19T10:00:00Z","08/19 06:00",411,2090,1472,"2020-08-19T10:00:00Z",,,,,,,,359840,,,,,,,,,,,"20",0,0,359840,0,359840,,0,0,"87971996eb35d5891d979f7b579fe0be4a20ae6f",0,0,0,0,0,""
20200819,"KS",35890,,323950,,"posNeg",359840,300,2090,88,567,26,202,,"8/19/2020 10:00","2020-08-19T10:00:00Z","08/19 06:00",411,2090,1472,"2020-08-19T10:00:00Z",,,,,,,,359840,,,,,,,,,,,"20",723,4855,359840,5578,359840,,6,56,"ab3456e6ac287d34a669d137c66e873162513541",0,0,0,0,0,""
20200818,"KS",35167,,319095,,"posNeg",354262,229,2034,62,560,24,200,,"8/17/2020 10:00","2020-08-17T10:00:00Z","08/17 06:00",405,2034,1409,"2020-08-17T10:00:00Z",,,,,,,,354262,,,,,,,,,,,"20",0,0,354262,0,354262,,0,0,"4ed2c44b0c5416ed0461261794824b7f38d948ba",0,0,0,0,0,""
20200817,"KS",35167,,319095,,"posNeg",354262,229,2034,62,560,24,200,,"8/17/2020 10:00","2020-08-17T10:00:00Z","08/17 06:00",405,2034,1409,"2020-08-17T10:00:00Z",,,,,,,,354262,,,,,,,,,,,"20",1282,9937,354262,11219,354262,,3,14,"8e42456de7798610ab59b21220ea436401bfb115",0,0,0,0,0,""
20200816,"KS",33885,,309158,,"posNeg",343043,311,2020,98,554,33,198,,"8/14/2020 10:00","2020-08-14T10:00:00Z","08/14 06:00",402,2020,1399,"2020-08-14T10:00:00Z",,,,,,,,343043,,,,,,,,,,,"20",0,0,343043,0,343043,,0,0,"1baf080709e6a1f0bc80f8a1772cf61ac995d4c5",0,0,0,0,0,""
20200815,"KS",33885,,309158,,"posNeg",343043,311,2020,98,554,33,198,,"8/14/2020 10:00","2020-08-14T10:00:00Z","08/14 06:00",402,2020,1399,"2020-08-14T10:00:00Z",,,,,,,,343043,,,,,,,,,,,"20",0,0,343043,0,343043,,0,0,"c84e2f58565a1ba5290d1303d25a6cbacf4af5b4",0,0,0,0,0,""
20200814,"KS",33885,,309158,,"posNeg",343043,311,2020,98,554,33,198,,"8/14/2020 10:00","2020-08-14T10:00:00Z","08/14 06:00",402,2020,1399,"2020-08-14T10:00:00Z",,,,,,,,343043,,,,,,,,,,,"20",1338,7142,343043,8480,343043,,7,45,"a236259d06f42c195edb65493095d7b88dc957e8",0,0,0,0,0,""
20200813,"KS",32547,,302016,,"posNeg",334563,357,1975,95,548,29,195,,"8/12/2020 10:00","2020-08-12T10:00:00Z","08/12 06:00",395,1975,1367,"2020-08-12T10:00:00Z",,,,,,,,334563,,,,,,,,,,,"20",0,0,334563,0,334563,,0,0,"64fc815fd5af04017c51ca8b1ec6dc4f575d5e89",0,0,0,0,0,""
20200812,"KS",32547,,302016,,"posNeg",334563,357,1975,95,548,29,195,,"8/12/2020 10:00","2020-08-12T10:00:00Z","08/12 06:00",395,1975,1367,"2020-08-12T10:00:00Z",,,,,,,,334563,,,,,,,,,,,"20",817,7077,334563,7894,334563,,8,64,"ad24d1bea5b68943631a419be251487b8dab72f0",0,0,0,0,0,""
20200811,"KS",31730,,294939,,"posNeg",326669,216,1911,60,534,19,194,,"8/10/2020 10:00","2020-08-10T10:00:00Z","08/10 06:00",387,1911,1319,"2020-08-10T10:00:00Z",,,,,,,,326669,,,,,,,,,,,"20",0,0,326669,0,326669,,0,0,"16dc25b05f2f2574403a41dbf62ead29ca5aeb8f",0,0,0,0,0,""
20200810,"KS",31730,,294939,,"posNeg",326669,216,1911,60,534,19,194,,"8/10/2020 10:00","2020-08-10T10:00:00Z","08/10 06:00",387,1911,1319,"2020-08-10T10:00:00Z",,,,,,,,326669,,,,,,,,,,,"20",1092,9065,326669,10157,326669,,7,36,"4c6ad4a78c63ed70ee9c20e4ad53a19f156f04eb",0,0,0,0,0,""
20200809,"KS",30638,,285874,,"posNeg",316512,333,1875,88,526,26,193,,"8/7/2020 10:00","2020-08-07T10:00:00Z","08/07 06:00",380,1875,1293,"2020-08-07T10:00:00Z",,,,,,,,316512,,,,,,,,,,,"20",0,0,316512,0,316512,,0,0,"62ea241cc318c37ca5c1fc86b070be5afe637d86",0,0,0,0,0,""
20200808,"KS",30638,,285874,,"posNeg",316512,333,1875,88,526,26,193,,"8/7/2020 10:00","2020-08-07T10:00:00Z","08/07 06:00",380,1875,1293,"2020-08-07T10:00:00Z",,,,,,,,316512,,,,,,,,,,,"20",0,0,316512,0,316512,,0,0,"7deb1279928770eb49c09de971c0f4d94ec2eb96",0,0,0,0,0,""
20200807,"KS",30638,,285874,,"posNeg",316512,333,1875,88,526,26,193,,"8/7/2020 10:00","2020-08-07T10:00:00Z","08/07 06:00",380,1875,1293,"2020-08-07T10:00:00Z",,,,,,,,316512,,,,,,,,,,,"20",921,6873,316512,7794,316512,,12,54,"4af2243bc52b82405bd38efdaa3fb8e60c77a5ea",0,0,0,0,0,""
20200806,"KS",29717,,279001,,"posNeg",308718,358,1821,78,516,25,190,,"8/5/2020 10:00","2020-08-05T10:00:00Z","08/05 06:00",368,1821,1254,"2020-08-05T10:00:00Z",,,,,,,,308718,,,,,,,,,,,"20",0,0,308718,0,308718,,0,0,"e756b6305cdc3886d05da7efb2c875a4c0fb2bc3",0,0,0,0,0,""
20200805,"KS",29717,,279001,,"posNeg",308718,358,1821,78,516,25,190,,"8/5/2020 10:00","2020-08-05T10:00:00Z","08/05 06:00",368,1821,1254,"2020-08-05T10:00:00Z",,,,,,,,308718,,,,,,,,,,,"20",841,6038,308718,6879,308718,,3,39,"50c74eb080b92ab3ebff20b49bfbba1b3ff1b7ae",0,0,0,0,0,""
20200804,"KS",28876,,272963,,"posNeg",301839,232,1782,62,505,16,184,,"8/3/2020 10:00","2020-08-03T10:00:00Z","08/03 06:00",365,1782,1196,"2020-08-03T10:00:00Z",,,,,,,,301839,,,,,,,,,,,"20",0,0,301839,0,301839,,0,0,"146ac87974b3c03ce82c16262a88158903b64888",0,0,0,0,0,""
20200803,"KS",28876,,272963,,"posNeg",301839,232,1782,62,505,16,184,,"8/3/2020 10:00","2020-08-03T10:00:00Z","08/03 06:00",365,1782,1196,"2020-08-03T10:00:00Z",,,,,,,,301839,,,,,,,,,,,"20",1064,8268,301839,9332,301839,,7,31,"b873cd3ea9fc20662b31505d40c20c076e3858b3",0,0,0,0,0,""
20200802,"KS",27812,,264695,,"posNeg",292507,366,1751,98,494,26,179,,"7/31/2020 10:00","2020-07-31T10:00:00Z","07/31 06:00",358,1751,1178,"2020-07-31T10:00:00Z",,,,,,,,292507,,,,,,,,,,,"20",0,0,292507,0,292507,,0,0,"caf8eeda8c261c133e98ae3f840f7324f9201ed7",0,0,0,0,0,""
20200801,"KS",27812,,264695,,"posNeg",292507,366,1751,98,494,26,179,,"7/31/2020 10:00","2020-07-31T10:00:00Z","07/31 06:00",358,1751,1178,"2020-07-31T10:00:00Z",,,,,,,,292507,,,,,,,,,,,"20",0,0,292507,0,292507,,0,0,"3015b3b74c5dafdfcb14fea73245b69e5220cf8b",0,0,0,0,0,""
20200731,"KS",27812,,264695,,"posNeg",292507,366,1751,98,494,26,179,,"7/31/2020 10:00","2020-07-31T10:00:00Z","07/31 06:00",358,1751,1178,"2020-07-31T10:00:00Z",,,,,,,,292507,,,,,,,,,,,"20",942,6616,292507,7558,292507,,9,51,"97424131028784d446e5937f7b4532fec911edd6",0,0,0,0,0,""
20200730,"KS",26870,,258079,,"posNeg",284949,393,1700,83,483,29,174,,"7/29/2020 10:00","2020-07-29T10:00:00Z","07/29 06:00",349,1700,1149,"2020-07-29T10:00:00Z",,,,,,,,284949,,,,,,,,,,,"20",0,0,284949,0,284949,,0,0,"3d68f7414496f41ef058a810c0025ae3d703507e",0,0,0,0,0,""
20200729,"KS",26870,,258079,,"posNeg",284949,393,1700,83,483,29,174,,"7/29/2020 10:00","2020-07-29T10:00:00Z","07/29 06:00",349,1700,1149,"2020-07-29T10:00:00Z",,,,,,,,284949,,,,,,,,,,,"20",698,5315,284949,6013,284949,,14,56,"df3babd6f2848516182c273e7c749d2861f3d862",0,0,0,0,0,""
20200728,"KS",26172,,252764,,"posNeg",278936,212,1644,58,465,24,171,,"7/27/2020 10:00","2020-07-27T10:00:00Z","07/27 06:00",335,1644,1108,"2020-07-27T10:00:00Z",,,,,,,,278397,,,,,,,,,,,"20",0,0,278936,0,278936,,0,0,"7c50f9d523bc0f6675a56b647afb3d74f89de902",0,0,0,0,0,""
20200727,"KS",26172,,252764,,"posNeg",278936,212,1644,58,465,24,171,,"7/27/2020 10:00","2020-07-27T10:00:00Z","07/27 06:00",335,1644,1108,"2020-07-27T10:00:00Z",,,,,,,,278397,,,,,,,,,,,"20",1063,-94,278936,969,278936,,9,48,"68a6644023f38ce9984b243220ff7ae959194f2b",0,0,0,0,0,""
20200726,"KS",25109,,252858,,"posNeg",277967,315,1596,98,459,24,166,,"7/24/2020 10:00","2020-07-24T10:00:00Z","07/24 06:00",326,1596,1077,"2020-07-24T10:00:00Z",,,,,,,,277967,,,,,,,,,,,"20",0,0,277967,0,277967,,0,0,"1f75cfe9e2d1cbd0b8cb8c4ba2560b9c0c5651ee",0,0,0,0,0,""
20200725,"KS",25109,,252858,,"posNeg",277967,315,1596,98,459,24,166,,"7/24/2020 10:00","2020-07-24T10:00:00Z","07/24 06:00",326,1596,1077,"2020-07-24T10:00:00Z",,,,,,,,277967,,,,,,,,,,,"20",0,0,277967,0,277967,,0,0,"f80f76deb1665694ef36cafd4173c36357abb77c",0,0,0,0,0,""
20200724,"KS",25109,,252858,,"posNeg",277967,,1596,98,459,24,166,,"7/24/2020 10:00","2020-07-24T10:00:00Z","07/24 06:00",326,1596,1077,"2020-07-24T10:00:00Z",,,,,,,,277967,,,,,,,,,,,"20",1005,8276,277967,9281,277967,,18,51,"566abe985673667a0923d45c430ab1eb9a8d5a1e",0,0,0,0,0,""
20200723,"KS",24104,,244582,,"posNeg",268686,,1545,112,450,28,164,,"7/22/2020 10:00","2020-07-22T10:00:00Z","07/22 06:00",308,1545,1050,"2020-07-22T10:00:00Z",,,,,,,,268686,,,,,,,,,,,"20",0,0,268686,0,268686,,0,0,"5f41b7cf6481c4b1d53940b613c8f77e602e763b",0,0,0,0,0,""
20200722,"KS",24104,,244582,,"posNeg",268686,,1545,112,450,28,164,,"7/22/2020 10:00","2020-07-22T10:00:00Z","07/22 06:00",308,1545,1050,"2020-07-22T10:00:00Z",,,,,,,,268686,,,,,,,,,,,"20",770,6385,268686,7155,268686,,1,48,"86b05f2c0ee5553d14901c56db504666069c613d",0,0,0,0,0,""
20200721,"KS",23334,,238197,,"posNeg",261531,,1497,111,439,21,162,,"7/20/2020 10:00","2020-07-20T10:00:00Z","07/20 06:00",307,1497,1016,"2020-07-20T10:00:00Z",,,,,,,,261531,,,,,,,,,,,"20",0,0,261531,0,261531,,0,0,"bbe6450b58f47368810980cd8b41de8133385fce",0,0,0,0,0,""
20200720,"KS",23334,,238197,,"posNeg",261531,,1497,111,439,21,162,,"7/20/2020 10:00","2020-07-20T10:00:00Z","07/20 06:00",307,1497,1016,"2020-07-20T10:00:00Z",,,,,,,,261531,,,,,,,,,,,"20",1369,10809,261531,12178,261531,,8,44,"26579ee038a90d0b00f33bf23c457ad6ba47da4f",0,0,0,0,0,""
20200719,"KS",21965,,227388,,"posNeg",249353,,1453,58,427,14,161,,"7/17/2020 10:00","2020-07-17T10:00:00Z","07/17 06:00",299,1453,983,"2020-07-17T10:00:00Z",,,,,,,,249353,,,,,,,,,,,"20",0,0,249353,0,249353,,0,0,"cc3d6280c4ea7b3472850a1505c4d47c266d598d",0,0,0,0,0,""
20200718,"KS",21965,,227388,,"posNeg",249353,,1453,58,427,14,161,,"7/17/2020 10:00","2020-07-17T10:00:00Z","07/17 06:00",299,1453,983,"2020-07-17T10:00:00Z",,,,,,,,249353,,,,,,,,,,,"20",0,0,249353,0,249353,,0,0,"6c8ff209315037c41f9da4e7d4ae44369ec36126",0,0,0,0,0,""
20200717,"KS",21965,,227388,,"posNeg",249353,,1453,58,427,14,161,,"7/17/2020 10:00","2020-07-17T10:00:00Z","07/17 06:00",299,1453,983,"2020-07-17T10:00:00Z",,,,,,,,249353,,,,,,,,,,,"20",1032,8947,249353,9979,249353,,0,60,"9d0d4bbd5e5557b2aa93816f302b994cbc84e5de",0,0,0,0,0,""
20200716,"KS",20933,,218441,,"posNeg",239374,,1393,65,418,21,159,,"7/15/2020 10:00","2020-07-15T10:00:00Z","07/15 06:00",299,1393,948,"2020-07-15T10:00:00Z",,,,,,,,239374,,,,,,,,,,,"20",0,0,239374,0,239374,,0,0,"21f288e5214ca0c46e291ef06368094733da8068",0,0,0,0,0,""
20200715,"KS",20933,,218441,,"posNeg",239374,,1393,65,418,21,159,,"7/15/2020 10:00","2020-07-15T10:00:00Z","07/15 06:00",299,1393,948,"2020-07-15T10:00:00Z",,,,,,,,239374,,,,,,,,,,,"20",875,7324,239374,8199,239374,,11,50,"a3d59371f8f4d169305fcd76bd68f8dd9b27cd9e",0,0,0,0,0,""
20200714,"KS",20058,,211117,,"posNeg",231175,,1343,,410,,160,,"7/13/2020 00:00","2020-07-13T00:00:00Z","07/12 20:00",288,1343,920,"2020-07-13T00:00:00Z",,,,,,,,231175,,,,,,,,,,,"20",0,0,231175,0,231175,,0,0,"bf6fefbe2e23ce140f943f365d52e0fc1b6eed36",0,0,0,0,0,""
20200713,"KS",20058,,211117,,"posNeg",231175,,1343,,410,,160,,"7/13/2020 00:00","2020-07-13T00:00:00Z","07/12 20:00",288,1343,920,"2020-07-13T00:00:00Z",,,,,,,,231175,,,,,,,,,,,"20",1447,11949,231175,13396,231175,,4,39,"a4e52433e7c21fbd3a39b0ba5f9aafcf71376624",0,0,0,0,0,""
20200712,"KS",18611,,199168,,"posNeg",217779,,1304,,405,,160,,"7/10/2020 10:00","2020-07-10T10:00:00Z","07/10 06:00",284,1304,905,"2020-07-10T10:00:00Z",,,,,,,,217779,,,,,,,,,,,"20",0,0,217779,0,217779,,0,0,"47410d5fef36b4f02db3f1ded1ec1ba9a9141d2c",0,0,0,0,0,""
20200711,"KS",18611,,199168,,"posNeg",217779,,1304,,405,,160,,"7/10/2020 10:00","2020-07-10T10:00:00Z","07/10 06:00",284,1304,905,"2020-07-10T10:00:00Z",,,,,,,,217779,,,,,,,,,,,"20",0,0,217779,0,217779,,0,0,"aff1bb3c1ff99b03f832cdeac5ad63fb38c2a415",0,0,0,0,0,""
20200710,"KS",18611,,199168,,"posNeg",217779,,1304,,405,,160,,"7/10/2020 10:00","2020-07-10T10:00:00Z","07/10 06:00",284,1304,905,"2020-07-10T10:00:00Z",,,,,,,,217779,,,,,,,,,,,"20",993,8304,217779,9297,217779,,2,35,"5a1aa34f146c7814c6a8e831adacd0b8cd57f8cf",0,0,0,0,0,""
20200709,"KS",17618,,190864,,"posNeg",208482,,1269,,397,,160,,"7/8/2020 10:00","2020-07-08T10:00:00Z","07/08 06:00",282,1269,879,"2020-07-08T10:00:00Z",,,,,,,,208482,,,,,,,,,,,"20",0,0,208482,0,208482,,0,0,"0e0b231bb5403752658a35b773dd83f39e04dd57",0,0,0,0,0,""
20200708,"KS",17618,,190864,,"posNeg",208482,,1269,,397,,160,,"7/8/2020 10:00","2020-07-08T10:00:00Z","07/08 06:00",282,1269,879,"2020-07-08T10:00:00Z",,,,,,,,208482,,,,,,,,,,,"20",717,5546,208482,6263,208482,,2,34,"5c2989ed25cb49013752cfd0a884ff661d1e4ba0",0,0,0,0,0,""
20200707,"KS",16901,,185318,,"posNeg",202219,,1235,,384,,158,,"7/6/2020 10:00","2020-07-06T10:00:00Z","07/06 06:00",280,1235,859,"2020-07-06T10:00:00Z",,,,,,,,202219,,,,,,,,,,,"20",0,0,202219,0,202219,,0,0,"8799624fe6aac8b9a3dc41445ce26be99c3b6e11",0,0,0,0,0,""
20200706,"KS",16901,,185318,,"posNeg",202219,,1235,,384,,158,,"7/6/2020 10:00","2020-07-06T10:00:00Z","07/06 06:00",280,1235,859,"2020-07-06T10:00:00Z",,,,,,,,202219,,,,,,,,,,,"20",982,9676,202219,10658,202219,,3,16,"3de4538cbb0c47c60992e2b8ccc4d44361e9be8d",0,0,0,0,0,""
20200705,"KS",15919,,175642,,"posNeg",191561,,1219,,377,,156,,"7/3/2020 10:00","2020-07-03T10:00:00Z","07/03 06:00",277,1219,842,"2020-07-03T10:00:00Z",,,,,,,,191561,,,,,,,,,,,"20",0,0,191561,0,191561,,0,0,"405912822e176d529debcfca9965ad52dc78b648",0,0,0,0,0,""
20200704,"KS",15919,,175642,,"posNeg",191561,,1219,,377,,156,,"7/3/2020 10:00","2020-07-03T10:00:00Z","07/03 06:00",277,1219,842,"2020-07-03T10:00:00Z",,,,,,,,191561,,,,,,,,,,,"20",0,0,191561,0,191561,,0,0,"8515026fd4e88ab747b88a350810f3e60b3eb18e",0,0,0,0,0,""
20200703,"KS",15919,,175642,,"posNeg",191561,,1219,,377,,156,,"7/3/2020 10:00","2020-07-03T10:00:00Z","07/03 06:00",277,1219,842,"2020-07-03T10:00:00Z",,,,,,,,191561,,,,,,,,,,,"20",929,7459,191561,8388,191561,,5,24,"2bdffc9a12ca44977e67b3dcc12e22cfb3b9bfe4",0,0,0,0,0,""
20200702,"KS",14990,,168183,,"posNeg",183173,,1195,,367,,152,,"7/2/2020 00:00","2020-07-02T00:00:00Z","07/01 20:00",272,1195,834,"2020-07-02T00:00:00Z",,,,,,,,182797,,,,,,,,,,,"20",0,0,183173,0,183173,,0,43,"4086eec7bd49933270d6762ea7fe2b64f3890281",0,0,0,0,0,""
20200701,"KS",14990,,168183,,"posNeg",183173,,1152,,367,,152,,"6/30/2020 10:00","2020-06-30T10:00:00Z","06/30 06:00",272,1152,834,"2020-06-30T10:00:00Z",,,,,,,,182797,,,,,,,,,,,"20",547,5901,183173,6448,183173,,2,0,"25a2ac51a051661333873e91fe245b639e90245c",0,0,0,0,0,""
20200630,"KS",14443,,162282,,"posNeg",176725,,1152,,360,,152,,"6/30/2020 10:00","2020-06-30T10:00:00Z","06/30 06:00",270,1152,794,"2020-06-30T10:00:00Z",,,,,,,,176348,,,,,,,,,,,"20",0,0,176725,0,176725,,0,0,"4d05b75ac5900e269655a0f6fe9377f0c7908033",0,0,0,0,0,""
20200629,"KS",14443,,162282,,"posNeg",176725,,1152,,360,,152,,"6/29/2020 10:00","2020-06-29T10:00:00Z","06/29 06:00",270,1152,794,"2020-06-29T10:00:00Z",,,,,,,,176348,,,,,,,,,,,"20",905,7961,176725,8866,176725,,6,24,"212bce93c3ec7bcf255a020007a8888320be82c7",0,0,0,0,0,""
20200628,"KS",13538,,154321,,"posNeg",167859,,1128,,356,,152,,"6/26/2020 10:00","2020-06-26T10:00:00Z","06/26 06:00",264,1128,779,"2020-06-26T10:00:00Z",,,,,,,,167548,,,,,,,,,,,"20",0,0,167859,0,167859,,0,0,"ed6124709c3b7dec06408b0a1ae76a80548de5ba",0,0,0,0,0,""
20200627,"KS",13538,,154321,,"posNeg",167859,,1128,,356,,152,,"6/26/2020 10:00","2020-06-26T10:00:00Z","06/26 06:00",264,1128,779,"2020-06-26T10:00:00Z",,,,,,,,167548,,,,,,,,,,,"20",0,0,167859,0,167859,,0,0,"2ddb4329dcb20bc74892122e155dfe3c7c20e815",0,0,0,0,0,""
20200626,"KS",13538,,154321,,"posNeg",167859,,1128,,356,,152,,"6/26/2020 10:00","2020-06-26T10:00:00Z","06/26 06:00",264,1128,779,"2020-06-26T10:00:00Z",,,,,,,,167548,,,,,,,,,,,"20",568,5586,167859,6154,167859,,3,46,"bf8fb62bf28ed9223e78c94770b01cd02787a29e",0,0,0,0,0,""
20200625,"KS",12970,,148735,,"posNeg",161705,,1082,,348,,150,,"6/24/2020 10:00","2020-06-24T10:00:00Z","06/24 06:00",261,1082,747,"2020-06-24T10:00:00Z",,,,,,,,161438,,,,,,,,,,,"20",0,0,161705,0,161705,,0,0,"73c5bbde00d020f1c95d08db7924dd19caa5cc03",0,0,0,0,0,""
20200624,"KS",12970,,148735,,"posNeg",161705,,1082,,348,,150,,"6/24/2020 10:00","2020-06-24T10:00:00Z","06/24 06:00",261,1082,747,"2020-06-24T10:00:00Z",,,,,,,,161438,,,,,,,,,,,"20",505,6187,161705,6692,161705,,2,26,"bb11b5441fc6e745a404861720322408264c6a37",0,0,0,0,0,""
20200623,"KS",12465,,142548,,"posNeg",155013,,1056,,342,,149,,"6/22/2020 10:00","2020-06-22T10:00:00Z","06/22 06:00",259,1056,722,"2020-06-22T10:00:00Z",,,,,,,,154770,,,,,,,,,,,"20",0,0,155013,0,155013,,0,0,"dfac51b18dfb0123d9b7f66e1fb62fc71f969682",0,0,0,0,0,""
20200622,"KS",12465,,142548,,"posNeg",155013,,1056,,342,,149,,"6/22/2020 10:00","2020-06-22T10:00:00Z","06/22 06:00",259,1056,722,"2020-06-22T10:00:00Z",,,,,,,,154770,,,,,,,,,,,"20",406,6958,155013,7364,155013,,5,21,"906b0db9adc306551016163a8fb20764545a3114",0,0,0,0,0,""
20200621,"KS",12059,,135590,,"posNeg",147649,,1035,,338,,146,,"6/19/2020 10:00","2020-06-19T10:00:00Z","06/19 06:00",254,1035,715,"2020-06-19T10:00:00Z",,,,,,,,147413,,,,,,,,,,,"20",0,0,147649,0,147649,,0,0,"8ad4589967595d5cbb20b5669b2fd61c78704544",0,0,0,0,0,""
20200620,"KS",12059,,135590,,"posNeg",147649,,1035,,338,,146,,"6/19/2020 10:00","2020-06-19T10:00:00Z","06/19 06:00",254,1035,715,"2020-06-19T10:00:00Z",,,,,,,,147413,,,,,,,,,,,"20",0,0,147649,0,147649,,0,0,"30a37ca680e91062cf8951e725c013a8c0786e92",0,0,0,0,0,""
20200619,"KS",12059,,135590,,"posNeg",147649,,1035,,338,,146,,"6/19/2020 10:00","2020-06-19T10:00:00Z","06/19 06:00",254,1035,715,"2020-06-19T10:00:00Z",,,,,,,,147413,,,,,,,,,,,"20",378,5147,147649,5525,147649,,7,24,"720a0c8830f398f53713d43e946ce26cd11254fb",0,0,0,0,0,""
20200618,"KS",11681,,130443,,"posNeg",142124,,1011,,333,,146,,"6/17/2020 10:00","2020-06-17T10:00:00Z","06/17 06:00",247,1011,696,"2020-06-17T10:00:00Z",,,,,,,,141888,,,,,,,,,,,"20",0,0,142124,0,142124,,0,0,"66fcd99ce91e09ff9ff3bb38e7b2a9420afa2ee1",0,0,0,0,0,""
20200617,"KS",11681,,130443,,"posNeg",142124,,1011,,333,,146,,"6/17/2020 10:00","2020-06-17T10:00:00Z","06/17 06:00",247,1011,696,"2020-06-17T10:00:00Z",,,,,,,,141888,,,,,,,,,,,"20",262,4900,142124,5162,142124,,2,23,"d0087f21a3f10e45e0ef6c8c3e23729a5ecbed90",0,0,0,0,0,""
20200616,"KS",11419,,125543,,"posNeg",136962,,988,,327,,143,,"6/15/2020 13:30","2020-06-15T13:30:00Z","06/15 09:30",245,988,676,"2020-06-15T13:30:00Z",,,,,,,,136741,,,,,,,,,,,"20",0,0,136962,0,136962,,0,0,"d6b2e480d459f7e9e8cda1346f156e712a6b9999",0,0,0,0,0,""
20200615,"KS",11419,,125543,,"posNeg",136962,,988,,327,,143,,"6/12/2020 13:30","2020-06-12T13:30:00Z","06/12 09:30",245,988,676,"2020-06-12T13:30:00Z",,,,,,,,136741,,,,,,,,,,,"20",372,7438,136962,7810,136962,,2,15,"fd806e0c2d354182359060cd1e402430658d3b61",0,0,0,0,0,""
20200614,"KS",11047,,118105,,"posNeg",129152,,973,,324,,143,,"6/12/2020 13:30","2020-06-12T13:30:00Z","06/12 09:30",243,973,667,"2020-06-12T13:30:00Z",,,,,,,,128939,,,,,,,,,,,"20",0,0,129152,0,129152,,0,0,"3cc300702d94b8fc51505eb8ea270b0dfcd5a62d",0,0,0,0,0,""
20200613,"KS",11047,,118105,,"posNeg",129152,,973,,324,,143,,"6/12/2020 13:30","2020-06-12T13:30:00Z","06/12 09:30",243,973,667,"2020-06-12T13:30:00Z",,,,,,,,128939,,,,,,,,,,,"20",0,0,129152,0,129152,,0,0,"ca7eacf199cbe021aba3216b284a767292242ec2",0,0,0,0,0,""
20200612,"KS",11047,,118105,,"posNeg",129152,,973,,324,,143,,"6/12/2020 13:30","2020-06-12T13:30:00Z","06/12 09:30",243,973,667,"2020-06-12T13:30:00Z",,,,,,,,128939,,,,,,,,,,,"20",235,5175,129152,5410,129152,,3,19,"a9f9779d6a59dff20466808d8b8c61f2a3466465",0,0,0,0,0,""
20200611,"KS",10812,,112930,,"posNeg",123742,,954,,316,,139,,"6/10/2020 10:00","2020-06-10T10:00:00Z","06/10 06:00",240,954,657,"2020-06-10T10:00:00Z",,,,,,,,123528,,,,,,,,,,,"20",0,0,123742,0,123742,,0,0,"95b3a7da53dc5c2feb5c95fc704bdd6f0329ddb6",0,0,0,0,0,""
20200610,"KS",10812,,112930,,"posNeg",123742,,954,,316,,139,,"6/10/2020 10:00","2020-06-10T10:00:00Z","06/10 06:00",240,954,657,"2020-06-10T10:00:00Z",,,,,,,,123528,,,,,,,,,,,"20",162,4071,123742,4233,123742,,4,18,"b83235271db951a35d30db41fcae14bf50289a67",0,0,0,0,0,""
20200609,"KS",10650,,108859,,"posNeg",119509,,936,,311,,136,,"6/8/2020 10:00","2020-06-08T10:00:00Z","06/08 06:00",236,936,625,"2020-06-08T10:00:00Z",,,,,,,,119308,,,,,,,,,,,"20",0,0,119509,0,119509,,0,0,"c1c122f0149a264088e408c88bd82758631d61ef",0,0,0,0,0,""
20200608,"KS",10650,,108859,,"posNeg",119509,,936,,311,,136,,"6/8/2020 10:00","2020-06-08T10:00:00Z","06/08 06:00",236,936,625,"2020-06-08T10:00:00Z",,,,,,,,119308,,,,,,,,,,,"20",257,5599,119509,5856,119509,,4,19,"063bc2ba80f7e94396b0b41331a6512002fe1c1c",0,0,0,0,0,""
20200607,"KS",10393,,103260,,"posNeg",113653,,917,,306,,135,,"6/5/2020 10:00","2020-06-05T10:00:00Z","06/05 06:00",232,917,612,"2020-06-05T10:00:00Z",,,,,,,,113465,,,,,,,,,,,"20",0,0,113653,0,113653,,0,0,"427bde881bd3bd76026f03655196ef4167c0b6cf",0,0,0,0,0,""
20200606,"KS",10393,,103260,,"posNeg",113653,,917,,306,,135,,"6/5/2020 10:00","2020-06-05T10:00:00Z","06/05 06:00",232,917,612,"2020-06-05T10:00:00Z",,,,,,,,113465,,,,,,,,,,,"20",0,0,113653,0,113653,,0,0,"36658cc98873fe745073448ce51a603a3b8c1697",0,0,0,0,0,""
20200605,"KS",10393,,103260,,"posNeg",113653,,917,,306,,135,,"6/5/2020 10:00","2020-06-05T10:00:00Z","06/05 06:00",232,917,612,"2020-06-05T10:00:00Z",,,,,,,,113465,,,,,,,,,,,"20",223,5377,113653,5600,113653,,10,27,"c30f33deab90ba7adbf6b6e7309bf01d69457ca8",0,0,0,0,0,""
20200604,"KS",10170,,97883,,"posNeg",108053,,890,,302,,131,,"6/3/2020 10:00","2020-06-03T10:00:00Z","06/03 06:00",222,890,592,"2020-06-03T10:00:00Z",,,,,,,,107870,,,,,,,,,,,"20",0,0,108053,0,108053,,0,0,"eb4c71728f5ce4315e5614039370a77530be4d68",0,0,0,0,0,""
20200603,"KS",10170,,97883,,"posNeg",108053,,890,,302,,131,,"6/3/2020 10:00","2020-06-03T10:00:00Z","06/03 06:00",222,890,592,"2020-06-03T10:00:00Z",,,,,,,,107870,,,,,,,,,,,"20",159,4582,108053,4741,108053,,5,28,"ec502ad55c9d7ddf42a5e3f4452a657533ad1a6c",0,0,0,0,0,""
20200602,"KS",10011,,93301,,"posNeg",103312,,862,,290,,127,,"6/1/2020 10:00","2020-06-01T10:00:00Z","06/01 06:00",217,862,555,"2020-06-01T10:00:00Z",,,,,,,,103139,,,,,,,,,,,"20",0,8071,103312,8071,103312,,0,20,"bd3efe4398a0a76fa37608e9a383e075b1b8dd2d",0,0,0,0,0,""
20200601,"KS",10011,,85230,,"posNeg",95241,,842,,284,,124,,"6/1/2020 10:00","2020-06-01T10:00:00Z","06/01 06:00",217,842,547,"2020-06-01T10:00:00Z",,,,,,,,103139,,,,,,,,,,,"20",292,0,95241,292,95241,,9,0,"e4ff88ac694720f77d4ab1a7191294240de593c6",0,0,0,0,0,""
20200531,"KS",9719,,85230,,"posNeg",94949,,842,,284,,124,,"5/29/2020 10:00","2020-05-29T10:00:00Z","05/29 06:00",208,842,547,"2020-05-29T10:00:00Z",,,,,,,,94780,,,,,,,,,,,"20",0,0,94949,0,94949,,0,0,"997974c83820e2d3095423ae6304c0faf268d977",0,0,0,0,0,""
20200530,"KS",9719,,85230,,"posNeg",94949,,842,,284,,124,,"5/29/2020 10:00","2020-05-29T10:00:00Z","05/29 06:00",208,842,547,"2020-05-29T10:00:00Z",,,,,,,,94780,,,,,,,,,,,"20",0,0,94949,0,94949,,0,0,"4eaeba2e82138ea400c05c3e58df469adf313efd",0,0,0,0,0,""
20200529,"KS",9719,,85230,,"posNeg",94949,,842,,284,,124,,"5/29/2020 10:00","2020-05-29T10:00:00Z","05/29 06:00",208,842,547,"2020-05-29T10:00:00Z",,,,,,,,94780,,,,,,,,,,,"20",382,10079,94949,10461,94949,,3,20,"b0ef46e1f9b10be337879cdd00a08174f4ab652e",0,0,0,0,0,""
20200528,"KS",9337,,75151,,"posNeg",84488,,822,,275,,122,,"5/27/2020 10:00","2020-05-27T10:00:00Z","05/27 06:00",205,822,534,"2020-05-27T10:00:00Z",,,,,,,,84333,,,,,,,,,,,"20",0,0,84488,0,84488,,0,0,"d38bfe002c4c25bc084239f5b0c8ff773d59ef34",0,0,0,0,0,""
20200527,"KS",9337,,75151,,"posNeg",84488,,822,,275,,122,,"5/27/2020 10:00","2020-05-27T10:00:00Z","05/27 06:00",205,822,534,"2020-05-27T10:00:00Z",,,,,,,,84333,,,,,,,,,,,"20",119,2970,84488,3089,84488,,17,22,"7bde439fc277f15e7f4fff2be397d6d3a26ab4bb",0,0,0,0,0,""
20200526,"KS",9218,,72181,,"posNeg",81399,,800,,271,,120,,"5/25/2020 10:00","2020-05-25T10:00:00Z","05/25 06:00",188,800,493,"2020-05-25T10:00:00Z",,,,,,,,81245,,,,,,,,,,,"20",0,0,81399,0,81399,,0,0,"aa67987006709e933b57e64a165c2363f5380e05",0,0,0,0,0,""
20200525,"KS",9218,,72181,,"posNeg",81399,,800,,271,,120,,"5/25/2020 10:00","2020-05-25T10:00:00Z","05/25 06:00",188,800,493,"2020-05-25T10:00:00Z",,,,,,,,81245,,,,,,,,,,,"20",260,4705,81399,4965,81399,,3,13,"66fc889d8537f72d1930d0412dd3d56f91ae786e",0,0,0,0,0,""
20200524,"KS",8958,,67476,,"posNeg",76434,,787,,269,,120,,"5/22/2020 10:00","2020-05-22T10:00:00Z","05/22 06:00",185,787,485,"2020-05-22T10:00:00Z",,,,,,,,76280,,,,,,,,,,,"20",0,0,76434,0,76434,,0,0,"13535d2e253a7b8b40d2a04e10f62a882432359f",0,0,0,0,0,""
20200523,"KS",8958,,67476,,"posNeg",76434,,787,,269,,120,,"5/22/2020 10:00","2020-05-22T10:00:00Z","05/22 06:00",185,787,485,"2020-05-22T10:00:00Z",,,,,,,,76280,,,,,,,,,,,"20",0,0,76434,0,76434,,0,0,"7222b2b9921639f4b4e3fc2d49b8d35368951173",0,0,0,0,0,""
20200522,"KS",8958,,67476,,"posNeg",76434,,787,,269,,120,,"5/22/2020 10:00","2020-05-22T10:00:00Z","05/22 06:00",185,787,485,"2020-05-22T10:00:00Z",,,,,,,,76280,,,,,,,,,,,"20",419,4812,76434,5231,76434,,7,27,"c2a06aed4b0675f2854f3e0f31c4abaeb56f3d83",0,0,0,0,0,""
20200521,"KS",8539,,62664,,"posNeg",71203,,760,,258,,116,,"5/20/2020 10:00","2020-05-20T10:00:00Z","05/20 06:00",178,760,473,"2020-05-20T10:00:00Z",,,,,,,,71048,,,,,,,,,,,"20",0,0,71203,0,71203,,0,0,"beb195952c9957a660c27a839f6e0bc614457743",0,0,0,0,0,""
20200520,"KS",8539,,62664,,"posNeg",71203,,760,,258,,116,,"5/20/2020 10:00","2020-05-20T10:00:00Z","05/20 06:00",178,760,473,"2020-05-20T10:00:00Z",,,,,,,,71048,,,,,,,,,,,"20",199,4014,71203,4213,71203,,5,20,"1ddd0b1ba216d7c0c7ecd202fb25ab268ef6a330",0,0,0,0,0,""
20200519,"KS",8340,,58650,,"posNeg",66990,,740,,250,,115,,"5/18/2020 10:00","2020-05-18T10:00:00Z","05/18 06:00",173,740,465,"2020-05-18T10:00:00Z",,,,,,,,66882,,,,,,,,,,,"20",0,0,66990,0,66990,,0,0,"9d6bd231b734608c7bad31497b25ad891d294f49",0,0,0,0,0,""
20200518,"KS",8340,,58650,,"posNeg",66990,,740,,250,,115,,"5/18/2020 10:00","2020-05-18T10:00:00Z","05/18 06:00",173,740,465,"2020-05-18T10:00:00Z",,,,,,,,66882,,,,,,,,,,,"20",454,4944,66990,5398,66990,,1,16,"529fa6254b2549601e73a968d25f16bd6377a6f9",0,0,0,0,0,""
20200517,"KS",7886,,53706,,"posNeg",61592,,724,,246,,112,,"5/15/2020 10:00","2020-05-15T10:00:00Z","05/15 06:00",172,724,443,"2020-05-15T10:00:00Z",,,,,,,,61488,,,,,,,,,,,"20",0,0,61592,0,61592,,0,0,"f8ae37e5473b0cc91328098ef9eb86865041833b",0,0,0,0,0,""
20200516,"KS",7886,,53706,,"posNeg",61592,,724,,246,,112,,"5/15/2020 10:00","2020-05-15T10:00:00Z","05/15 06:00",172,724,443,"2020-05-15T10:00:00Z",,,,,,,,61488,,,,,,,,,,,"20",0,0,61592,0,61592,,0,0,"a06531169389c365edce85436a39a782cd33e5e0",0,0,0,0,0,""
20200515,"KS",7886,,53706,,"posNeg",61592,,724,,246,,112,,"5/15/2020 10:00","2020-05-15T10:00:00Z","05/15 06:00",172,724,443,"2020-05-15T10:00:00Z",,,,,,,,61488,,,,,,,,,,,"20",418,3546,61592,3964,61592,,8,20,"124bb5dd4f8852c8173d95515d34c0b0ae3ffe2b",0,0,0,0,0,""
20200514,"KS",7468,,50160,,"posNeg",57628,,704,,238,,108,,"5/13/2020 10:00","2020-05-13T10:00:00Z","05/13 06:00",164,704,422,"2020-05-13T10:00:00Z",,,,,,,,57544,,,,,,,,,,,"20",0,0,57628,0,57628,,0,0,"8a7cb18fb3b57889ba847607d7cde29ea8859c9f",0,0,0,0,0,""
20200513,"KS",7468,,50160,,"posNeg",57628,,704,,238,,108,,"5/13/2020 10:00","2020-05-13T10:00:00Z","05/13 06:00",164,704,422,"2020-05-13T10:00:00Z",,,,,,,,54025,,,,,,,,,,,"20",352,3167,57628,3519,57628,,6,44,"a8aa2eda3c4e444f2bb9743f63dabb2853926acf",0,0,0,0,0,""
20200512,"KS",7116,,46993,,"posNeg",54109,,660,,233,,101,,"5/11/2020 10:00","2020-05-11T10:00:00Z","05/11 06:00",158,660,376,"2020-05-11T10:00:00Z",,,,,,,,,,,,,,,,,,,"20",0,0,54109,0,54109,,0,0,"d35363c0a2bee0544ed16fe3dac0e540c2065571",0,0,0,0,0,""
20200511,"KS",7116,,46993,,"posNeg",54109,,660,,233,,101,,"5/11/2020 10:00","2020-05-11T10:00:00Z","05/11 06:00",158,660,376,"2020-05-11T10:00:00Z",,,,,,,,,,,,,,,,,,,"20",168,1436,54109,1604,54109,,1,3,"1c78e86f897cd692c273c3c3c2d268825ad001f6",0,0,0,0,0,""
20200510,"KS",6948,,45557,,"posNeg",52505,,657,,231,,101,,"5/10/2020 10:00","2020-05-10T10:00:00Z","05/10 06:00",157,657,371,"2020-05-10T10:00:00Z",,,,,,,,,,,,,,,,,,,"20",197,2375,52505,2572,52505,,0,22,"ff39331f75757562b3ff12b128f0ae9928e0c874",0,0,0,0,0,""
20200509,"KS",6751,,43182,,"posNeg",49933,,635,,229,,100,,"5/9/2020 10:00","2020-05-09T10:00:00Z","05/09 06:00",157,635,350,"2020-05-09T10:00:00Z",,,,,,,,,,,,,,,,,,,"20",250,1975,49933,2225,49933,,5,27,"a87c8999ac0e37ee4369bfe7e656b73417dac660",0,0,0,0,0,""
20200508,"KS",6501,,41207,,"posNeg",47708,,608,,223,,99,,"5/8/2020 10:00","2020-05-08T10:00:00Z","05/08 06:00",152,608,332,"2020-05-08T10:00:00Z",,,,,,,,,,,,,,,,,,,"20",357,2529,47708,2886,47708,,5,21,"a78905b401e56d98a83ed6ab3d0edd9ef7b55aa2",0,0,0,0,0,""
20200507,"KS",6144,,38678,,"posNeg",44822,,587,,218,,97,,"5/7/2020 10:00","2020-05-07T10:00:00Z","05/07 06:00",147,587,323,"2020-05-07T10:00:00Z",,,,,,,,,,,,,,,,,,,"20",410,2298,44822,2708,44822,,3,16,"6a6a91529c2e453e046d7b3fd5da9340110d20f3",0,0,0,0,0,""
20200506,"KS",5734,,36380,,"posNeg",42114,,571,,213,,96,,"5/6/2020 10:00","2020-05-06T10:00:00Z","05/06 06:00",144,571,318,"2020-05-06T10:00:00Z",,,,,,,,,,,,,,,,,,,"20",276,1746,42114,2022,42114,,7,5,"f49f44addf610346e836e86f078e2ba0a3162918",0,0,0,0,0,""
20200505,"KS",5458,,34634,,"posNeg",40092,,566,,212,,95,,"5/5/2020 10:00","2020-05-05T10:00:00Z","05/05 06:00",137,566,296,"2020-05-05T10:00:00Z",,,,,,,,,,,,,,,,,,,"20",213,1276,40092,1489,40092,,1,13,"554ffce77815fcc51e1859a1771a92002e5a978c",0,0,0,0,0,""
20200504,"KS",5245,,33358,,"posNeg",38603,,553,,209,,95,,"5/3/2020 10:00","2020-05-03T10:00:00Z","05/03 06:00",136,553,291,"2020-05-03T10:00:00Z",,,,,,,,,,,,,,,,,,,"20",215,1610,38603,1825,38603,,2,6,"bb5dadb5b27e04d336d02982e2b995dd000833d5",0,0,0,0,0,""
20200503,"KS",5030,,31748,,"posNeg",36778,,547,,209,,95,,"5/3/2020 10:00","2020-05-03T10:00:00Z","05/03 06:00",134,547,286,"2020-05-03T10:00:00Z",,,,,,,,,,,,,,,,,,,"20",284,1552,36778,1836,36778,,3,6,"3dfcc05bb7e70c5fce67130f0cf02dacd72e3a85",0,0,0,0,0,""
20200502,"KS",4746,,30196,,"posNeg",34942,,541,,206,,95,,"5/2/2020 10:00","2020-05-02T10:00:00Z","05/02 06:00",131,541,286,"2020-05-02T10:00:00Z",,,,,,,,,,,,,,,,,,,"20",297,1611,34942,1908,34942,,1,7,"7fe32a00497b35280c8a86a4ce8759bd955bd87d",0,0,0,0,0,""
20200501,"KS",4449,,28585,,"posNeg",33034,,534,,206,,96,,"5/1/2020 10:00","2020-05-01T10:00:00Z","05/01 06:00",130,534,280,"2020-05-01T10:00:00Z",,,,,,,,,,,,,,,,,,,"20",211,1197,33034,1408,33034,,1,11,"bcdabc20870fc63a21fe116a0f48134f1190c645",0,0,0,0,0,""
20200430,"KS",4238,,27388,,"posNeg",31626,,523,,201,,93,,"4/30/2020 10:00","2020-04-30T10:00:00Z","04/30 06:00",129,523,272,"2020-04-30T10:00:00Z",,,,,,,,,,,,,,,,,,,"20",500,1668,31626,2168,31626,,4,8,"02e26492a749bc4a283b4fb85e6a63df5b7f1c40",0,0,0,0,0,""
20200429,"KS",3738,,25720,,"posNeg",29458,,515,,198,,88,,"4/29/2020 10:00","2020-04-29T10:00:00Z","04/29 06:00",125,515,266,"2020-04-29T10:00:00Z",,,,,,,,,,,,,,,,,,,"20",247,1121,29458,1368,29458,,1,11,"7a07d187e342f7436e9e30ef4346067381868cfe",0,0,0,0,0,""
20200428,"KS",3491,,24599,,"posNeg",28090,,504,,,,,,"4/28/2020 10:00","2020-04-28T10:00:00Z","04/28 06:00",124,504,,"2020-04-28T10:00:00Z",,,,,,,,,,,,,,,,,,,"20",163,760,28090,923,28090,,4,8,"2dc505af122cd5942e42c7a0e9f157498d9e27fe",0,0,0,0,0,""
20200427,"KS",3328,,23839,,"posNeg",27167,,496,,,,,,"4/26/2020 11:00","2020-04-26T11:00:00Z","04/26 07:00",120,496,,"2020-04-26T11:00:00Z",,,,,,,,,,,,,,,,,,,"20",154,786,27167,940,27167,,2,11,"f55f453d17bbc9042497da7520d8a3091d3f043d",0,0,0,0,0,""
20200426,"KS",3174,,23053,,"posNeg",26227,,485,,,,,,"4/26/2020 11:00","2020-04-26T11:00:00Z","04/26 07:00",118,485,,"2020-04-26T11:00:00Z",,,,,,,,,,,,,,,,,,,"20",118,910,26227,1028,26227,,1,11,"1913f8999f7300c839a83393d115ce2886b98e0e",0,0,0,0,0,""
20200425,"KS",3056,,22143,,"posNeg",25199,,474,,,,,,"4/25/2020 11:00","2020-04-25T11:00:00Z","04/25 07:00",117,474,,"2020-04-25T11:00:00Z",,,,,,,,,,,,,,,,,,,"20",279,1332,25199,1611,25199,,6,17,"1068635cfe3ce74d366ada4452a4170fbd05eb56",0,0,0,0,0,""
20200424,"KS",2777,,20811,,"posNeg",23588,,457,,,,,,"4/24/2020 10:00","2020-04-24T10:00:00Z","04/24 06:00",111,457,,"2020-04-24T10:00:00Z",,,,,,,,,,,,,,,,,,,"20",295,1975,23588,2270,23588,,-1,15,"b4e3eda5ad9875859172444438f482e37f7d52c5",0,0,0,0,0,""
20200423,"KS",2482,,18836,,"posNeg",21318,,442,,,,,,"4/23/2020 10:45","2020-04-23T10:45:00Z","04/23 06:45",112,442,,"2020-04-23T10:45:00Z",,,,,,,,,,,,,,,,,,,"20",271,844,21318,1115,21318,,2,10,"bce97bbd8146cd446bedce96dd4db8ec7df070db",0,0,0,0,0,""
20200422,"KS",2211,,17992,,"posNeg",20203,,432,,,,,,"4/22/2020 12:00","2020-04-22T12:00:00Z","04/22 08:00",110,432,,"2020-04-22T12:00:00Z",,,,,,,,,,,,,,,,,,,"20",186,916,20203,1102,20203,,3,13,"f52a2d3dca2e8913c7f5ffb791f060744c1a1bd9",0,0,0,0,0,""
20200421,"KS",2025,,17076,,"posNeg",19101,,419,,,,,,"4/21/2020 12:00","2020-04-21T12:00:00Z","04/21 08:00",107,419,,"2020-04-21T12:00:00Z",,,,,,,,,,,,,,,,,,,"20",39,301,19101,340,19101,,7,14,"415678205292832346a1edfa2b047af4714a810a",0,0,0,0,0,""
20200420,"KS",1986,,16775,,"posNeg",18761,,405,,,,,,"4/20/2020 12:00","2020-04-20T12:00:00Z","04/20 08:00",100,405,,"2020-04-20T12:00:00Z",,,,,,,,,,,,,,,,,,,"20",137,494,18761,631,18761,,8,15,"4d419595d2c204979568164d5566bf161fab786d",0,0,0,0,0,""
20200419,"KS",1849,,16281,,"posNeg",18130,,390,,,,,,"4/19/2020 12:00","2020-04-19T12:00:00Z","04/19 08:00",92,390,,"2020-04-19T12:00:00Z",,,,,,,,,,,,,,,,,,,"20",59,395,18130,454,18130,,6,7,"1f54de867e46ac5abb22c492711323c8c14accc8",0,0,0,0,0,""
20200418,"KS",1790,,15886,,"posNeg",17676,,383,,,,,,"4/18/2020 12:00","2020-04-18T12:00:00Z","04/18 08:00",86,383,,"2020-04-18T12:00:00Z",,,,,,,,,,,,,,,,,,,"20",85,690,17676,775,17676,,2,8,"ffb9c9c6493b9d0b7d5f5a4b618b18dbd73f03ab",0,0,0,0,0,""
20200417,"KS",1705,,15196,,"posNeg",16901,,375,,,,,,"4/17/2020 12:00","2020-04-17T12:00:00Z","04/17 08:00",84,375,,"2020-04-17T12:00:00Z",,,,,,,,,,,,,,,,,,,"20",117,662,16901,779,16901,,4,16,"58195f5ff5e96420c9e5dd86320150a46236830a",0,0,0,0,0,""
20200416,"KS",1588,,14534,,"posNeg",16122,,359,,,,,,"4/16/2020 12:00","2020-04-16T12:00:00Z","04/16 08:00",80,359,,"2020-04-16T12:00:00Z",,,,,,,,,,,,,,,,,,,"20",94,1360,16122,1454,16122,,4,17,"3c67845f7614ea508e5ed6c89e02a8566c0aaf47",0,0,0,0,0,""
20200415,"KS",1494,,13174,,"posNeg",14668,,342,,,,,,"4/15/2020 11:30","2020-04-15T11:30:00Z","04/15 07:30",76,342,,"2020-04-15T11:30:00Z",,,,,,,,,,,,,,,,,,,"20",68,453,14668,521,14668,,7,15,"7563e5c049209cd506ecac99a9112a4b735c73bb",0,0,0,0,0,""
20200414,"KS",1426,,12721,,"posNeg",14147,,327,,,,,,"4/14/2020 12:00","2020-04-14T12:00:00Z","04/14 08:00",69,327,,"2020-04-14T12:00:00Z",,,,,,,,,,,,,,,,,,,"20",50,233,14147,283,14147,,7,18,"f0f50f0f5dddc305b4d11ca9ff1f9953aea404d7",0,0,0,0,0,""
20200413,"KS",1376,,12488,,"posNeg",13864,,309,,,,,,"4/13/2020 11:30","2020-04-13T11:30:00Z","04/13 07:30",62,309,,"2020-04-13T11:30:00Z",,,,,,,,,,,,,,,,,,,"20",39,572,13864,611,13864,,6,11,"7572228f97b21419ea3c58e308e44fcecd55b6fd",0,0,0,0,0,""
20200412,"KS",1337,,11916,,"posNeg",13253,,298,,,,,,"4/12/2020 12:00","2020-04-12T12:00:00Z","04/12 08:00",56,298,,"2020-04-12T12:00:00Z",,,,,,,,,,,,,,,,,,,"20",69,841,13253,910,13253,,1,5,"4935336942d7aa6d0738aa52419c8eff27ac421a",0,0,0,0,0,""
20200411,"KS",1268,,11075,,"posNeg",12343,,293,,,,,,"4/11/2020 11:00","2020-04-11T11:00:00Z","04/11 07:00",55,293,,"2020-04-11T11:00:00Z",,,,,,,,,,,,,,,,,,,"20",102,827,12343,929,12343,,5,19,"b04d54324a9d67802e8aaac6b447adb8fc4229c6",0,0,0,0,0,""
20200410,"KS",1166,,10248,,"posNeg",11414,,274,,,,,,"4/10/2020 09:30","2020-04-10T09:30:00Z","04/10 05:30",50,274,,"2020-04-10T09:30:00Z",,,,,,,,,,,,,,,,,,,"20",60,579,11414,639,11414,,8,11,"f36afa4110db843ab732b27e8247662180bb18e7",0,0,0,0,0,""
20200409,"KS",1106,,9669,,"posNeg",10775,,263,,,,,,"4/9/2020 12:00","2020-04-09T12:00:00Z","04/09 08:00",42,263,,"2020-04-09T12:00:00Z",,,,,,,,,,,,,,,,,,,"20",60,532,10775,592,10775,,4,40,"92eb288cca540e76ae0bd640fcd3c2c27b13986c",0,0,0,0,0,""
20200408,"KS",1046,,9137,,"posNeg",10183,,223,,,,,,"4/7/2020 12:00","2020-04-07T12:00:00Z","04/07 08:00",38,223,,"2020-04-07T12:00:00Z",,,,,,,,,,,,,,,,,,,"20",146,523,10183,669,10183,,11,0,"e908c74ae30d904b036e55a7e52c98c08bda0162",0,0,0,0,0,""
20200407,"KS",900,,8614,,"posNeg",9514,,223,,,,,,"4/7/2020 12:00","2020-04-07T12:00:00Z","04/07 08:00",27,223,,"2020-04-07T12:00:00Z",,,,,,,,,,,,,,,,,,,"20",55,375,9514,430,9514,,2,25,"3f8a2d13df6343fe1d89d7761ef45c12e5307705",0,0,0,0,0,""
20200406,"KS",845,,8239,,"posNeg",9084,,198,,,,,,"4/6/2020 12:00","2020-04-06T12:00:00Z","04/06 08:00",25,198,,"2020-04-06T12:00:00Z",,,,,,,,,,,,,,,,,,,"20",98,763,9084,861,9084,,3,15,"24da2eba2d4d78a123bae14cf4d01aebc02f241e",0,0,0,0,0,""
20200405,"KS",747,,7476,,"posNeg",8223,,183,,,,,,"4/5/2020 12:00","2020-04-05T12:00:00Z","04/05 08:00",22,183,,"2020-04-05T12:00:00Z",,,,,,,,,,,,,,,,,,,"20",49,596,8223,645,8223,,1,11,"7312eb14512cc8c959b53cdecba72b0bf4ef7ae6",0,0,0,0,0,""
20200404,"KS",698,,6880,,"posNeg",7578,,172,,,,,,"4/4/2020 12:00","2020-04-04T12:00:00Z","04/04 08:00",21,172,,"2020-04-04T12:00:00Z",,,,,,,,,,,,,,,,,,,"20",78,426,7578,504,7578,,4,21,"07e14c750b2b053aecebc940a4220098439eb856",0,0,0,0,0,""
20200403,"KS",620,,6454,,"posNeg",7074,,151,,,,,,"4/3/2020 12:00","2020-04-03T12:00:00Z","04/03 08:00",17,151,,"2020-04-03T12:00:00Z",,,,,,,,,,,,,,,,,,,"20",68,395,7074,463,7074,,4,13,"7b2b4dd99a2c2cefd1732de95fde7dc0b78668c9",0,0,0,0,0,""
20200402,"KS",552,,6059,,"posNeg",6611,,138,,,,,,"4/2/2020 12:00","2020-04-02T12:00:00Z","04/02 08:00",13,138,,"2020-04-02T12:00:00Z",,,,,,,,,,,,,,,,,,,"20",70,648,6611,718,6611,,3,24,"560c3e733685174276b5e12a34b453e7635ea090",0,0,0,0,0,""
20200401,"KS",482,,5411,,"posNeg",5893,,114,,,,,,"4/1/2020 11:00","2020-04-01T11:00:00Z","04/01 07:00",10,114,,"2020-04-01T11:00:00Z",,,,,,,,,,,,,,,,,,,"20",54,415,5893,469,5893,,1,35,"6585540a8981bfaf44ec632d28a851948d036807",0,0,0,0,0,""
20200331,"KS",428,,4996,,"posNeg",5424,,79,,,,,,"3/31/2020 11:00","2020-03-31T11:00:00Z","03/31 07:00",9,79,,"2020-03-31T11:00:00Z",,,,,,,,,,,,,,,,,,,"20",60,442,5424,502,5424,,1,13,"11dbded3ce8990852851e2f411be11923c0e7b19",0,0,0,0,0,""
20200330,"KS",368,,4554,,"posNeg",4922,,66,,,,,,"3/30/2020 11:00","2020-03-30T11:00:00Z","03/30 07:00",8,66,,"2020-03-30T11:00:00Z",,,,,,,,,,,,,,,,,,,"20",49,360,4922,409,4922,,2,11,"b27c8867640dffd22bf705fb02ddd2ed237dde24",0,0,0,0,0,""
20200329,"KS",319,,4194,,"posNeg",4513,,55,,,,,,"3/29/2020 11:00","2020-03-29T11:00:00Z","03/29 07:00",6,55,,"2020-03-29T11:00:00Z",,,,,,,,,,,,,,,,,,,"20",58,523,4513,581,4513,,1,28,"7e8432893b30a5606cb51d23bc281d93cf3a0251",0,0,0,0,0,""
20200328,"KS",261,,3671,,"posNeg",3932,,27,,,,,,"3/27/2020 09:00","2020-03-27T09:00:00Z","03/27 05:00",5,27,,"2020-03-27T09:00:00Z",,,,,,,,,,,,,,,,,,,"20",59,442,3932,501,3932,,1,0,"8caf84986441edac22283e67024bd7a82f0975b4",0,0,0,0,0,""
20200327,"KS",202,,3229,,"posNeg",3431,,27,,,,,,"3/27/2020 09:00","2020-03-27T09:00:00Z","03/27 05:00",4,27,,"2020-03-27T09:00:00Z",,,,,,,,,,,,,,,,,,,"20",34,360,3431,394,3431,,1,27,"4ec226cabee290ee8f27b0594fa1a2ccfcea25bc",0,0,0,0,0,""
20200326,"KS",168,,2869,,"posNeg",3037,,,,,,,,"3/26/2020 12:00","2020-03-26T12:00:00Z","03/26 08:00",3,,,"2020-03-26T12:00:00Z",,,,,,,,,,,,,,,,,,,"20",42,509,3037,551,3037,,0,0,"b3aa7cc7d3e8acf0a6a700b751d27cca5aa2e800",0,0,0,0,0,""
20200325,"KS",126,,2360,,"posNeg",2486,,,,,,,,"3/25/2020 12:00","2020-03-25T12:00:00Z","03/25 08:00",3,,,"2020-03-25T12:00:00Z",,,,,,,,,,,,,,,,,,,"20",28,274,2486,302,2486,,1,0,"50aac2f660bc0d0245841bd4292c8ce11b01d15f",0,0,0,0,0,""
20200324,"KS",98,,2086,,"posNeg",2184,,,,,,,,"3/24/2020 12:00","2020-03-24T12:00:00Z","03/24 08:00",2,,,"2020-03-24T12:00:00Z",,,,,,,,,,,,,,,,,,,"20",16,1669,2184,1685,2184,,0,0,"854720e9bcb0748ad17ce7281a4a328e7feca8f8",0,0,0,0,0,""
20200323,"KS",82,,417,,"posNeg",499,,,,,,,,"3/23/2020 11:00","2020-03-23T11:00:00Z","03/23 07:00",2,,,"2020-03-23T11:00:00Z",,,,,,,,,,,,,,,,,,,"20",18,0,499,18,499,,0,0,"a9f93f36b39db721f71fc20522f5cac5757c1420",0,0,0,0,0,""
20200322,"KS",64,,417,,"posNeg",481,,,,,,,,"3/21/2020 11:00","2020-03-21T11:00:00Z","03/21 07:00",2,,,"2020-03-21T11:00:00Z",,,,,,,,,,,,,,,,,,,"20",9,0,481,9,481,,0,0,"f53844a3c099994fe7d4ed6fbcac8f06b44b6df7",0,0,0,0,0,""
20200321,"KS",55,,417,,"posNeg",472,,,,,,,,"3/21/2020 11:00","2020-03-21T11:00:00Z","03/21 07:00",2,,,"2020-03-21T11:00:00Z",,,,,,,,,,,,,,,,,,,"20",11,0,472,11,472,,1,0,"db7655fd3a9d55c16ebc0e6fc97fb30af6faa96d",0,0,0,0,0,""
20200320,"KS",44,,417,,"posNeg",461,,,,,,,,"3/20/2020 11:00","2020-03-20T11:00:00Z","03/20 07:00",1,,,"2020-03-20T11:00:00Z",,,,,,,,,,,,,,,,,,,"20",10,0,461,10,461,,0,0,"a76f8b0f6da8022ee0bd537bd9eb49e02a305c88",0,0,0,0,0,""
20200319,"KS",34,,417,,"posNeg",451,,,,,,,,"3/19/2020 11:00","2020-03-19T11:00:00Z","03/19 07:00",1,,,"2020-03-19T11:00:00Z",,,,,,,,,,,,,,,,,,,"20",18,0,451,18,451,,0,0,"615a76f42cca582dd90313d0750a20a946308225",0,0,0,0,0,""
20200318,"KS",16,,417,,"posNeg",433,,,,,,,,"3/17/2020 15:30","2020-03-17T15:30:00Z","03/17 11:30",1,,,"2020-03-17T15:30:00Z",,,,,,,,,,,,,,,,,,,"20",1,35,433,36,433,,0,0,"c2a50d1169379fcdaccf8487a81b15f692e07300",0,0,0,0,0,""
20200317,"KS",15,,382,,"posNeg",397,,,,,,,,"3/17/2020 13:00","2020-03-17T13:00:00Z","03/17 09:00",1,,,"2020-03-17T13:00:00Z",,,,,,,,,,,,,,,,,,,"20",4,216,397,220,397,,0,0,"5b65c7912a4fcf914d644a859b87f437ecd61052",0,0,0,0,0,""
20200316,"KS",11,,166,,"posNeg",177,,,,,,,,"3/16/2020 16:17","2020-03-16T16:17:00Z","03/16 12:17",1,,,"2020-03-16T16:17:00Z",,,,,,,,,,,,,,,,,,,"20",3,31,177,34,177,,0,0,"8210c511321b25778fa87cfc6d52947765857e49",0,0,0,0,0,""
20200315,"KS",8,,135,,"posNeg",143,,,,,,,,"3/14/2020 13:00","2020-03-14T13:00:00Z","03/14 09:00",1,,,"2020-03-14T13:00:00Z",,,,,,,,,,,,,,,,,,,"20",2,42,143,44,143,,0,0,"8c31dd541dea704f08a4f9f732fe18a71aabb627",0,0,0,0,0,""
20200314,"KS",6,,93,,"posNeg",99,,,,,,,,"3/13/2020 11:00","2020-03-13T11:00:00Z","03/13 07:00",1,,,"2020-03-13T11:00:00Z",,,,,,,,,,,,,,,,,,,"20",0,0,99,0,99,,1,0,"78c8f1e048e1e85137fb34a2a374376a1ca8203a",0,0,0,0,0,""
20200313,"KS",6,,93,,"posNeg",99,,,,,,,,"3/13/2020 11:00","2020-03-13T11:00:00Z","03/13 07:00",,,,"2020-03-13T11:00:00Z",,,,,,,,,,,,,,,,,,,"20",2,52,99,54,99,,0,0,"b948a0ca44840c825e1bdd4ecd2a2dce08dde48a",0,0,0,0,0,""
20200312,"KS",4,,41,,"posNeg",45,,,,,,,,"3/12/2020 00:00","2020-03-12T00:00:00Z","03/11 20:00",,,,"2020-03-12T00:00:00Z",,,,,,,,,,,,,,,,,,,"20",3,0,45,3,45,,0,0,"b09757ae536a550ac8fc67bd39a0bd49f59b3986",0,0,0,0,0,""
20200311,"KS",1,,41,,"posNeg",42,,,,,,,,,,,,,,,,,,,,,,,,,,,,,,,,,"20",0,24,42,24,42,,0,0,"287f67ff48c9e75ad211dd474ffd7c454b40d6ab",0,0,0,0,0,""
20200310,"KS",1,,17,21,"posNeg",18,,,,,,,,,,,,,,,,,,,,,,,,,,,,,,,,,"20",0,6,39,6,18,,0,0,"f75ce4b8f58471cae18deb702b7630896b05b168",0,0,0,0,0,""
20200309,"KS",1,,11,0,"posNeg",12,,,,,,,,,,,,,,,,,,,,,,,,,,,,,,,,,"20",0,0,12,0,12,,0,0,"06a29320a5ee465c495aa9af9ec6fe6fa424e0c4",0,0,0,0,0,""
20200308,"KS",1,,11,0,"posNeg",12,,,,,,,,,,,,,,,,,,,,,,,,,,,,,,,,,"20",1,0,12,1,12,,0,0,"7959958ed9910d13dcd00c214cbfc8284f12e19d",0,0,0,0,0,""
20200307,"KS",0,,11,2,"posNeg",11,,,,,,,,,,,,,,,,,,,,,,,,,,,,,,,,,"20",0,7,13,7,11,,0,0,"122450e5328e041945335db100a2ab30582c48ba",0,0,0,0,0,""
20200306,"KS",0,,4,0,"posNeg",4,,,,,,,,,,,,,,,,,,,,,,,,,,,,,,,,,"20",0,0,4,0,4,,0,0,"a6eb0aa388f08ab9ac3d17995aca2fd65db6cee1",0,0,0,0,0,""