"date","state","positive","probableCases","negative","pending","totalTestResultsSource","totalTestResults","hospitalizedCurrently","hospitalizedCumulative","inIcuCurrently","inIcuCumulative","onVentilatorCurrently","onVentilatorCumulative","recovered","lastUpdateEt","dateModified","checkTimeEt","death","hospitalized","hospitalizedDischarged","dateChecked","totalTestsViral","positiveTestsViral","negativeTestsViral","positiveCasesViral","deathConfirmed","deathProbable","totalTestEncountersViral","totalTestsPeopleViral","totalTestsAntibody","positiveTestsAntibody","negativeTestsAntibody","totalTestsPeopleAntibody","positiveTestsPeopleAntibody","negativeTestsPeopleAntibody","totalTestsPeopleAntigen","positiveTestsPeopleAntigen","totalTestsAntigen","positiveTestsAntigen","fips","positiveIncrease","negativeIncrease","total","totalTestResultsIncrease","posNeg","dataQualityGrade","deathIncrease","hospitalizedIncrease","hash","commercialScore","negativeRegularScore","negativeScore","positiveScore","score","grade"
20210307,"LA",433785,61271,5261679,,"posNeg",5695464,532,,,,75,,415954,"3/7/2021 13:00","2021-03-07T13:00:00Z","03/07 08:00",9748,,,"2021-03-07T13:00:00Z",5634193,,,372514,9033,715,,,,,,,,,,,469967,,"22",740,20578,5695464,21318,5695464,,32,0,"7fd45e084947a390edc7e73d1d9039015369dc7f",0,0,0,0,0,""
20210306,"LA",433045,61051,5241101,,"posNeg",5674146,538,,,,77,,415954,"3/5/2021 13:00","2021-03-05T13:00:00Z","03/05 08:00",9716,,,"2021-03-05T13:00:00Z",5613095,,,371994,9007,709,,,,,,,,,,,466494,,"22",0,0,5674146,0,5674146,,0,0,"65c7241c65fa94c4b04ee3b495596a630b81b888",0,0,0,0,0,""
20210305,"LA",433045,61051,5241101,,"posNeg",5674146,538,,,,77,,415954,"3/5/2021 13:00","2021-03-05T13:00:00Z","03/05 08:00",9716,,,"2021-03-05T13:00:00Z",5613095,,,371994,9007,709,,,,,,,,,,,466494,,"22",518,18643,5674146,19161,5674146,,30,0,"465be64b847f4bf1e732c8cfa05abfdef35f8583",0,0,0,0,0,""
20210304,"LA",432527,60897,5222458,,"posNeg",5654985,554,,,,74,,415954,"3/4/2021 13:00","2021-03-04T13:00:00Z","03/04 08:00",9686,,,"2021-03-04T13:00:00Z",5594088,,,371630,8986,700,,,,,,,,,,,463554,,"22",756,24034,5654985,24790,5654985,,18,0,"0c4e9c36e4da7d02481a6511a864a9b99db1b35d",0,0,0,0,0,""
20210303,"LA",431771,60671,5198424,,"posNeg",5630195,588,,,,78,,415954,"3/3/2021 13:00","2021-03-03T13:00:00Z","03/03 08:00",9668,,,"2021-03-03T13:00:00Z",5569524,,,371100,8973,695,,,,,,,,,,,459742,,"22",500,20999,5630195,21499,5630195,,21,0,"21e0e037b7380636d0580c9492a45ff8145fc937",0,0,0,0,0,""
20210302,"LA",431271,60474,5177425,,"posNeg",5608696,629,,,,89,,408463,"3/2/2021 13:00","2021-03-02T13:00:00Z","03/02 08:00",9647,,,"2021-03-02T13:00:00Z",5548222,,,370797,8957,690,,,,,,,,,,,456777,,"22",767,22425,5608696,23192,5608696,,19,0,"82eb0eb53244edcbaee45cb91c74f7f6bec4da7b",0,0,0,0,0,""
20210301,"LA",430504,60257,5155000,,"posNeg",5585504,629,,,,91,,408463,"3/1/2021 13:00","2021-03-01T13:00:00Z","03/01 08:00",9628,,,"2021-03-01T13:00:00Z",5525247,,,370247,8941,687,,,,,,,,,,,453562,,"22",404,7933,5585504,8337,5585504,,20,0,"87fad22252a38bb7791b7160956f2e3a8eb110fc",0,0,0,0,0,""
20210228,"LA",430100,60152,5147067,,"posNeg",5577167,630,,,,91,,408463,"2/28/2021 13:00","2021-02-28T13:00:00Z","02/28 08:00",9608,,,"2021-02-28T13:00:00Z",5517015,,,369948,8923,685,,,,,,,,,,,452263,,"22",1508,30981,5577167,32489,5577167,,21,0,"846ce00ccaaac928f669281bba70650af6438c44",0,0,0,0,0,""
20210227,"LA",428592,59690,5116086,,"posNeg",5544678,651,,,,95,,408463,"2/26/2021 13:00","2021-02-26T13:00:00Z","02/26 08:00",9587,,,"2021-02-26T13:00:00Z",5484988,,,368902,8906,681,,,,,,,,,,,446071,,"22",0,0,5544678,0,5544678,,0,0,"997f86fadc2da6c2382fe9e1eb7092db8f858a9f",0,0,0,0,0,""
20210226,"LA",428592,59690,5116086,,"posNeg",5544678,651,,,,95,,408463,"2/26/2021 13:00","2021-02-26T13:00:00Z","02/26 08:00",9587,,,"2021-02-26T13:00:00Z",5484988,,,368902,8906,681,,,,,,,,,,,446071,,"22",903,22678,5544678,23581,5544678,,26,0,"ff3a2e16ebb23d1892cfa3183281a06ad60972f5",0,0,0,0,0,""
20210225,"LA",427689,59471,5093408,,"posNeg",5521097,679,,,,100,,408463,"2/25/2021 13:00","2021-02-25T13:00:00Z","02/25 08:00",9561,,,"2021-02-25T13:00:00Z",5461626,,,368218,8885,676,,,,,,,,,,,443438,,"22",764,52436,5521097,53200,5521097,,33,0,"b3432bb259f0f2585c1e43655014dc95b902619c",0,0,0,0,0,""
20210224,"LA",426925,59343,5040972,,"posNeg",5467897,687,,,,102,,408463,"2/24/2021 13:00","2021-02-24T13:00:00Z","02/24 08:00",9528,,,"2021-02-24T13:00:00Z",5408554,,,367582,8860,668,,,,,,,,,,,440757,,"22",877,20853,5467897,21730,5467897,,25,0,"44c031bbb9597881b3cb509d1a41ff8a0530a99b",0,0,0,0,0,""
20210223,"LA",426048,59008,5020119,,"posNeg",5446167,715,,,,111,,396834,"2/23/2021 13:00","2021-02-23T13:00:00Z","02/23 08:00",9503,,,"2021-02-23T13:00:00Z",5387159,,,367040,8834,669,,,,,,,,,,,435095,,"22",1404,20820,5446167,22224,5446167,,26,0,"61755b867ea979537ef80c87f234ab884f65a3ca",0,0,0,0,0,""
20210222,"LA",424644,58342,4999299,,"posNeg",5423943,740,,,,113,,396834,"2/22/2021 13:00","2021-02-22T13:00:00Z","02/22 08:00",9477,,,"2021-02-22T13:00:00Z",5365601,,,366302,8808,669,,,,,,,,,,,429587,,"22",468,6788,5423943,7256,5423943,,11,0,"44dffd41e2974789895e8fc06ec2c349f77be4b1",0,0,0,0,0,""
20210221,"LA",424176,58317,4992511,,"posNeg",5416687,756,,,,120,,396834,"2/21/2021 13:00","2021-02-21T13:00:00Z","02/21 08:00",9466,,,"2021-02-21T13:00:00Z",5358370,,,365859,8798,668,,,,,,,,,,,429239,,"22",1889,24668,5416687,26557,5416687,,26,0,"15ca963d7909645b74ab3779e0301bb50e9c0cee",0,0,0,0,0,""
20210220,"LA",422287,57375,4967843,,"posNeg",5390130,806,,,,129,,396834,"2/19/2021 13:00","2021-02-19T13:00:00Z","02/19 08:00",9440,,,"2021-02-19T13:00:00Z",5332755,,,364912,8778,662,,,,,,,,,,,422850,,"22",0,0,5390130,0,5390130,,0,0,"76b4a2929c24ded798739357613077ae55e06c68",0,0,0,0,0,""
20210219,"LA",422287,57375,4967843,,"posNeg",5390130,806,,,,129,,396834,"2/19/2021 13:00","2021-02-19T13:00:00Z","02/19 08:00",9440,,,"2021-02-19T13:00:00Z",5332755,,,364912,8778,662,,,,,,,,,,,422850,,"22",441,11420,5390130,11861,5390130,,34,0,"845ea8199a2beb1efc5496189ee3b4f978ae4ec4",0,0,0,0,0,""
20210218,"LA",421846,57311,4956423,,"posNeg",5378269,823,,,,128,,396834,"2/18/2021 13:00","2021-02-18T13:00:00Z","02/18 08:00",9406,,,"2021-02-18T13:00:00Z",5320958,,,364535,8753,653,,,,,,,,,,,421512,,"22",828,10349,5378269,11177,5378269,,15,0,"0fc35347ed1513d489403cc2085592b5dc1709a0",0,0,0,0,0,""
20210217,"LA",421018,56994,4946074,,"posNeg",5367092,849,,,,126,,396834,"2/17/2021 13:00","2021-02-17T13:00:00Z","02/17 08:00",9391,,,"2021-02-17T13:00:00Z",5310098,,,364024,8740,651,,,,,,,,,,,418034,,"22",624,20670,5367092,21294,5367092,,66,0,"8ce624e667c7d6cbb664508e01b57981c3ffba79",0,0,0,0,0,""
20210216,"LA",420394,56925,4925404,,"posNeg",5345798,849,,,,137,,380673,"2/15/2021 13:00","2021-02-15T13:00:00Z","02/15 08:00",9325,,,"2021-02-15T13:00:00Z",5288873,,,363469,8691,634,,,,,,,,,,,416361,,"22",0,0,5345798,0,5345798,,0,0,"d38abe1012bfa9ad27c726f556a4d21ba756669f",0,0,0,0,0,""
20210215,"LA",420394,56925,4925404,,"posNeg",5345798,849,,,,137,,380673,"2/15/2021 13:00","2021-02-15T13:00:00Z","02/15 08:00",9325,,,"2021-02-15T13:00:00Z",5288873,,,363469,8691,634,,,,,,,,,,,416361,,"22",503,7261,5345798,7764,5345798,,33,0,"8286f698dd61d439ec6b9a01ac3218afd8020832",0,0,0,0,0,""
20210214,"LA",419891,56905,4918143,,"posNeg",5338034,875,,,,142,,380673,"2/14/2021 13:00","2021-02-14T13:00:00Z","02/14 08:00",9292,,,"2021-02-14T13:00:00Z",5281129,,,362986,8663,629,,,,,,,,,,,415886,,"22",1306,30446,5338034,31752,5338034,,16,0,"8997bb8413a683746f66de9f4945f205c2c8a463",0,0,0,0,0,""
20210213,"LA",418585,56724,4887697,,"posNeg",5306282,1001,,,,151,,380673,"2/12/2021 13:00","2021-02-12T13:00:00Z","02/12 08:00",9276,,,"2021-02-12T13:00:00Z",5249558,,,361861,8646,630,,,,,,,,,,,412988,,"22",0,0,5306282,0,5306282,,0,0,"30c0c742d59ddb7dacdcbe1a9be141c231f73d34",0,0,0,0,0,""
20210212,"LA",418585,56724,4887697,,"posNeg",5306282,1001,,,,151,,380673,"2/12/2021 13:00","2021-02-12T13:00:00Z","02/12 08:00",9276,,,"2021-02-12T13:00:00Z",5249558,,,361861,8646,630,,,,,,,,,,,412988,,"22",1170,27950,5306282,29120,5306282,,37,0,"3031b01626b896a48dfbf5d4afa93d20310eaaa8",0,0,0,0,0,""
20210211,"LA",417415,56377,4859747,,"posNeg",5277162,1052,,,,151,,380673,"2/11/2021 13:00","2021-02-11T13:00:00Z","02/11 08:00",9239,,,"2021-02-11T13:00:00Z",5220785,,,361038,8617,622,,,,,,,,,,,409399,,"22",2728,39044,5277162,41772,5277162,,27,0,"48e1deffb7c757138c9eea24b969466a3e14a9a0",0,0,0,0,0,""
20210210,"LA",414687,55508,4820703,,"posNeg",5235390,1076,,,,151,,380673,"2/10/2021 13:00","2021-02-10T13:00:00Z","02/10 08:00",9212,,,"2021-02-10T13:00:00Z",5179882,,,359179,8594,618,,,,,,,,,,,400029,,"22",333,10529,5235390,10862,5235390,,50,0,"9f706135d250eb432fa4ad7e78575d228727be46",0,0,0,0,0,""
20210209,"LA",414354,55492,4810174,,"posNeg",5224528,1122,,,,151,,363457,"2/9/2021 13:00","2021-02-09T13:00:00Z","02/09 08:00",9162,,,"2021-02-09T13:00:00Z",5169036,,,358862,8559,603,,,,,,,,,,,399659,,"22",1365,26406,5224528,27771,5224528,,20,0,"bcee4a26bace953dae1cf84c4829314e1892cefa",0,0,0,0,0,""
20210208,"LA",412989,54994,4783768,,"posNeg",5196757,1144,,,,149,,363457,"2/8/2021 13:00","2021-02-08T13:00:00Z","02/08 08:00",9142,,,"2021-02-08T13:00:00Z",5141763,,,357995,8541,601,,,,,,,,,,,393696,,"22",1177,20741,5196757,21918,5196757,,23,0,"d1a07383adfb83384634c536405d241fcc78c291",0,0,0,0,0,""
20210207,"LA",411812,54960,4763027,,"posNeg",5174839,1166,,,,143,,363457,"2/7/2021 13:00","2021-02-07T13:00:00Z","02/07 08:00",9119,,,"2021-02-07T13:00:00Z",5119879,,,356852,8522,597,,,,,,,,,,,392574,,"22",1951,33259,5174839,35210,5174839,,43,0,"dd9fc6399e60625babcac7e6d15a159ca0b5a30f",0,0,0,0,0,""
20210206,"LA",409861,54339,4729768,,"posNeg",5139629,1275,,,,167,,363457,"2/5/2021 13:00","2021-02-05T13:00:00Z","02/05 08:00",9076,,,"2021-02-05T13:00:00Z",5085290,,,355522,8482,594,,,,,,,,,,,386571,,"22",0,0,5139629,0,5139629,,0,0,"9340a7f31a64edbb665528ff7f1f0df7b09a3a9e",0,0,0,0,0,""
20210205,"LA",409861,54339,4729768,,"posNeg",5139629,1275,,,,167,,363457,"2/5/2021 13:00","2021-02-05T13:00:00Z","02/05 08:00",9076,,,"2021-02-05T13:00:00Z",5085290,,,355522,8482,594,,,,,,,,,,,386571,,"22",866,17741,5139629,18607,5139629,,32,0,"3d4d5af71eed72d0274b2b27f7fce23360ec3df3",0,0,0,0,0,""
20210204,"LA",408995,54207,4712027,,"posNeg",5121022,1295,,,,162,,363457,"2/4/2021 13:00","2021-02-04T13:00:00Z","02/04 08:00",9044,,,"2021-02-04T13:00:00Z",5066815,,,354788,8453,591,,,,,,,,,,,384783,,"22",2760,28733,5121022,31493,5121022,,38,0,"9eaaba339a04c2f94de01acf1067a7df0186fc1c",0,0,0,0,0,""
20210203,"LA",406235,52728,4683294,,"posNeg",5089529,1386,,,,180,,363457,"2/3/2021 13:00","2021-02-03T13:00:00Z","02/03 08:00",9006,,,"2021-02-03T13:00:00Z",5036801,,,353507,8421,585,,,,,,,,,,,375278,,"22",2041,25050,5089529,27091,5089529,,53,0,"3abf4d1ca4b3ef3f2ebc6c31e07d966e8e992f72",0,0,0,0,0,""
20210202,"LA",404194,51917,4658244,,"posNeg",5062438,1440,,,,189,,344321,"2/2/2021 13:00","2021-02-02T13:00:00Z","02/02 08:00",8953,,,"2021-02-02T13:00:00Z",5010521,,,352277,8375,578,,,,,,,,,,,367908,,"22",2603,40874,5062438,43477,5062438,,41,0,"77c24d6c4e6c76df8e1d923b8423a27d54c205f5",0,0,0,0,0,""
20210201,"LA",401591,50968,4617370,,"posNeg",5018961,1403,,,,187,,344321,"2/1/2021 13:00","2021-02-01T13:00:00Z","02/01 08:00",8912,,,"2021-02-01T13:00:00Z",4967993,,,350623,8340,572,,,,,,,,,,,360086,,"22",965,10548,5018961,11513,5018961,,53,0,"b8959bbff548a3172c4527152bc04606ca731850",0,0,0,0,0,""
20210131,"LA",400626,50929,4606822,,"posNeg",5007448,1416,,,,199,,344321,"1/31/2021 13:00","2021-01-31T13:00:00Z","01/31 08:00",8859,,,"2021-01-31T13:00:00Z",4956519,,,349697,8291,568,,,,,,,,,,,359162,,"22",3350,40046,5007448,43396,5007448,,58,0,"a73660ff8c8af50528182035a047ff95d8db0e27",0,0,0,0,0,""
20210130,"LA",397276,50282,4566776,,"posNeg",4964052,1546,,,,198,,344321,"1/29/2021 13:00","2021-01-29T13:00:00Z","01/29 08:00",8801,,,"2021-01-29T13:00:00Z",4913770,,,346994,8241,560,,,,,,,,,,,353166,,"22",0,0,4964052,0,4964052,,0,0,"6465f60e1e3fbf6874a194a63db6c32970f66f3f",0,0,0,0,0,""
20210129,"LA",397276,50282,4566776,,"posNeg",4964052,1546,,,,198,,344321,"1/29/2021 13:00","2021-01-29T13:00:00Z","01/29 08:00",8801,,,"2021-01-29T13:00:00Z",4913770,,,346994,8241,560,,,,,,,,,,,353166,,"22",2367,22901,4964052,25268,4964052,,58,0,"1880a0e6496448c98c7cc76252d014d58ac410b5",0,0,0,0,0,""
20210128,"LA",394909,49452,4543875,,"posNeg",4938784,1590,,,,206,,344321,"1/28/2021 13:00","2021-01-28T13:00:00Z","01/28 08:00",8743,,,"2021-01-28T13:00:00Z",4889332,,,345457,8202,541,,,,,,,,,,,346830,,"22",2493,28249,4938784,30742,4938784,,55,0,"5356fc91d81855c28180909a0f3777abbab29392",0,0,0,0,0,""
20210127,"LA",392416,48833,4515626,,"posNeg",4908042,1625,,,,203,,344321,"1/27/2021 13:00","2021-01-27T13:00:00Z","01/27 08:00",8688,,,"2021-01-27T13:00:00Z",4859209,,,343583,8152,536,,,,,,,,,,,341039,,"22",3854,30276,4908042,34130,4908042,,67,0,"5a832f56bcdc2b2582767781f038fbb5a043cf94",0,0,0,0,0,""
20210126,"LA",388562,47351,4485350,,"posNeg",4873912,1646,,,,217,,320025,"1/26/2021 13:00","2021-01-26T13:00:00Z","01/26 08:00",8621,,,"2021-01-26T13:00:00Z",4826561,,,341211,8090,531,,,,,,,,,,,332212,,"22",2620,28636,4873912,31256,4873912,,31,0,"1ebe904b7f38286fc2213a1df346ea2ea036e22c",0,0,0,0,0,""
20210125,"LA",385942,46735,4456714,,"posNeg",4842656,1638,,,,219,,320025,"1/25/2021 13:00","2021-01-25T13:00:00Z","01/25 08:00",8590,,,"2021-01-25T13:00:00Z",4795921,,,339207,8064,526,,,,,,,,,,,327660,,"22",2080,25006,4842656,27086,4842656,,25,0,"6de6f6789bed57178232e4c0279f9838ecea8cc7",0,0,0,0,0,""
20210124,"LA",383862,46647,4431708,,"posNeg",4815570,1641,,,,215,,320025,"1/24/2021 13:00","2021-01-24T13:00:00Z","01/24 08:00",8565,,,"2021-01-24T13:00:00Z",4768923,,,337215,8038,527,,,,,,,,,,,326381,,"22",3607,36011,4815570,39618,4815570,,82,0,"6e7714593f0a7c14b67c422635b691aa91438ecb",0,0,0,0,0,""
20210123,"LA",380255,45486,4395697,,"posNeg",4775952,1747,,,,216,,320025,"1/22/2021 13:00","2021-01-22T13:00:00Z","01/22 08:00",8483,,,"2021-01-22T13:00:00Z",4730466,,,334769,7964,519,,,,,,,,,,,317521,,"22",0,0,4775952,0,4775952,,0,0,"00ceea700f05fae56c4c87fe6292e07c41631b79",0,0,0,0,0,""
20210122,"LA",380255,45486,4395697,,"posNeg",4775952,1747,,,,216,,320025,"1/22/2021 13:00","2021-01-22T13:00:00Z","01/22 08:00",8483,,,"2021-01-22T13:00:00Z",4730466,,,334769,7964,519,,,,,,,,,,,317521,,"22",1937,25125,4775952,27062,4775952,,41,0,"5e42dbe9383c79b41a9d5b1481854ebe88abaa2c",0,0,0,0,0,""
20210121,"LA",378318,45345,4370572,,"posNeg",4748890,1800,,,,233,,320025,"1/21/2021 13:00","2021-01-21T13:00:00Z","01/21 08:00",8442,,,"2021-01-21T13:00:00Z",4703545,,,332973,7928,514,,,,,,,,,,,315365,,"22",3736,39673,4748890,43409,4748890,,59,0,"f74526b25fa178f49bec11a392ca6ecaee19fc73",0,0,0,0,0,""
20210120,"LA",374582,44288,4330899,,"posNeg",4705481,1858,,,,243,,320025,"1/20/2021 13:00","2021-01-20T13:00:00Z","01/20 08:00",8383,,,"2021-01-20T13:00:00Z",4661193,,,330294,7881,502,,,,,,,,,,,307053,,"22",2493,29041,4705481,31534,4705481,,59,0,"1c0111d3e2ad14236a3abb1df219c28edb06f083",0,0,0,0,0,""
20210119,"LA",372089,43229,4301858,,"posNeg",4673947,1905,,,,249,,298614,"1/19/2021 13:00","2021-01-19T13:00:00Z","01/19 08:00",8324,,,"2021-01-19T13:00:00Z",4630718,,,328860,7833,491,,,,,,,,,,,300098,,"22",2138,23312,4673947,25450,4673947,,71,0,"e89ea6ad5718601feedf6529e58d22be3b7f35d8",0,0,0,0,0,""
20210118,"LA",369951,42897,4278546,,"posNeg",4648497,1894,,,,239,,298614,"1/18/2021 13:00","2021-01-18T13:00:00Z","01/18 08:00",8253,,,"2021-01-18T13:00:00Z",4605600,,,327054,7784,469,,,,,,,,,,,297680,,"22",971,9180,4648497,10151,4648497,,50,0,"838de7c9e4471bc8c47ccc4df00787f2e304d4a1",0,0,0,0,0,""
20210117,"LA",368980,42879,4269366,,"posNeg",4638346,1930,,,,237,,298614,"1/17/2021 13:00","2021-01-17T13:00:00Z","01/17 08:00",8203,,,"2021-01-17T13:00:00Z",4595467,,,326101,7742,461,,,,,,,,,,,297348,,"22",4127,40791,4638346,44918,4638346,,123,0,"961f3c3d4731c13df64e2124df6229285db519c4",0,0,0,0,0,""
20210116,"LA",364853,42288,4228575,,"posNeg",4593428,2001,,,,242,,298614,"1/15/2021 13:00","2021-01-15T13:00:00Z","01/15 08:00",8080,,,"2021-01-15T13:00:00Z",4551140,,,322565,7631,449,,,,,,,,,,,292095,,"22",0,0,4593428,0,4593428,,0,0,"99b1aae1137ae3fbc4ca3472c5b74654f7b874df",0,0,0,0,0,""
20210115,"LA",364853,42288,4228575,,"posNeg",4593428,2001,,,,242,,298614,"1/15/2021 13:00","2021-01-15T13:00:00Z","01/15 08:00",8080,,,"2021-01-15T13:00:00Z",4551140,,,322565,7631,449,,,,,,,,,,,292095,,"22",3705,25774,4593428,29479,4593428,,0,0,"6d137b69fde03ef7ec3fc473de08e6c1bb974231",0,0,0,0,0,""
20210114,"LA",361148,40686,4202801,,"posNeg",4563949,1975,,,,245,,298614,"1/14/2021 13:00","2021-01-14T13:00:00Z","01/14 08:00",8080,,,"2021-01-14T13:00:00Z",4523263,,,320462,7631,449,,,,,,,,,,,281939,,"22",5313,30778,4563949,36091,4563949,,58,0,"b597c50b0a02bda8860aae33fa5493f8862d1b1f",0,0,0,0,0,""
20210113,"LA",355835,38499,4172023,,"posNeg",4527858,2029,,,,235,,298614,"1/13/2021 13:00","2021-01-13T13:00:00Z","01/13 08:00",8022,,,"2021-01-13T13:00:00Z",4489359,,,317336,7582,440,,,,,,,,,,,267725,,"22",2896,16174,4527858,19070,4527858,,51,0,"5febbb9524bf20c86b559da77576ed49a5451338",0,0,0,0,0,""
20210112,"LA",352939,37357,4155849,,"posNeg",4508788,2035,,,,244,,280373,"1/12/2021 13:00","2021-01-12T13:00:00Z","01/12 08:00",7971,,,"2021-01-12T13:00:00Z",4471431,,,315582,7536,435,,,,,,,,,,,259866,,"22",4705,45336,4508788,50041,4508788,,53,0,"a975e9b7726199346f0c060fc913c7385f5c19fa",0,0,0,0,0,""
20210111,"LA",348234,35944,4110513,,"posNeg",4458747,1982,,,,232,,280373,"1/11/2021 13:00","2021-01-11T13:00:00Z","01/11 08:00",7918,,,"2021-01-11T13:00:00Z",4422803,,,312290,7489,429,,,,,,,,,,,251592,,"22",1405,11423,4458747,12828,4458747,,45,0,"ab850e73fed527d0085192befa46df0300e0c938",0,0,0,0,0,""
20210110,"LA",346829,35872,4099090,,"posNeg",4445919,1960,,,,225,,280373,"1/10/2021 13:00","2021-01-10T13:00:00Z","01/10 08:00",7873,,,"2021-01-10T13:00:00Z",4410047,,,310957,7447,426,,,,,,,,,,,251094,,"22",5398,41263,4445919,46661,4445919,,40,0,"f27819e383a0d793e202484ecf1e8d784a68c5d1",0,0,0,0,0,""
20210109,"LA",341431,34989,4057827,,"posNeg",4399258,2069,,,,220,,280373,"1/8/2021 13:00","2021-01-08T13:00:00Z","01/08 08:00",7833,,,"2021-01-08T13:00:00Z",4364269,,,306442,7411,422,,,,,,,,,,,244578,,"22",0,0,4399258,0,4399258,,0,0,"7a6566fcff985aca287e061ee5b7c637db5b60b4",0,0,0,0,0,""
20210108,"LA",341431,34989,4057827,,"posNeg",4399258,2069,,,,220,,280373,"1/8/2021 13:00","2021-01-08T13:00:00Z","01/08 08:00",7833,,,"2021-01-08T13:00:00Z",4364269,,,306442,7411,422,,,,,,,,,,,244578,,"22",3377,26432,4399258,29809,4399258,,105,0,"abfea9fc7765f7446d5c6b64bff3eb0ff2267215",0,0,0,0,0,""
20210107,"LA",338054,34165,4031395,,"posNeg",4369449,2033,,,,219,,280373,"1/7/2021 13:00","2021-01-07T13:00:00Z","01/07 08:00",7728,,,"2021-01-07T13:00:00Z",4335284,,,303889,7319,409,,,,,,,,,,,239754,,"22",4530,29927,4369449,34457,4369449,,47,0,"5787ec1b336115188e8f72e7afbffbda52023af0",0,0,0,0,0,""
20210106,"LA",333524,33557,4001468,,"posNeg",4334992,1993,,,,207,,280373,"1/6/2021 13:00","2021-01-06T13:00:00Z","01/06 08:00",7681,,,"2021-01-06T13:00:00Z",4301435,,,299967,7273,408,,,,,,,,,,,235661,,"22",6876,20361,4334992,27237,4334992,,46,0,"bac340dbc7d53f4ba713f08e190454bb16a1807b",0,0,0,0,0,""
20210105,"LA",326648,30823,3981107,,"posNeg",4307755,1974,,,,205,,263712,"1/5/2021 13:00","2021-01-05T13:00:00Z","01/05 08:00",7635,,,"2021-01-05T13:00:00Z",4276932,,,295825,7241,394,,,,,,,,,,,223291,,"22",4467,37529,4307755,41996,4307755,,50,0,"696374b12c74bfaaeadb5ca3db45ca18cb022b0a",0,0,0,0,0,""
20210104,"LA",322181,29997,3943578,,"posNeg",4265759,1891,,,,207,,263712,"1/4/2021 13:00","2021-01-04T13:00:00Z","01/04 08:00",7585,,,"2021-01-04T13:00:00Z",4235762,,,292184,7198,387,,,,,,,,,,,217869,,"22",1123,8170,4265759,9293,4265759,,48,0,"fbef716a03ceb11de7a9d1ad9033b5ce57eac1a7",0,0,0,0,0,""
20210103,"LA",321058,29979,3935408,,"posNeg",4256466,1833,,,,204,,263712,"1/3/2021 13:00","2021-01-03T13:00:00Z","01/03 08:00",7537,,,"2021-01-03T13:00:00Z",4226487,,,291079,7162,375,,,,,,,,,,,217582,,"22",5783,36501,4256466,42284,4256466,,49,0,"27962edf4d5f547dd52b94d91c166b0e6adfbebc",0,0,0,0,0,""
20210102,"LA",315275,29798,3898907,,"posNeg",4214182,1731,,,,202,,263712,"12/31/2020 13:00","2020-12-31T13:00:00Z","12/31 08:00",7488,,,"2020-12-31T13:00:00Z",4184384,,,285477,7115,373,,,,,,,,,,,215765,,"22",0,0,4214182,0,4214182,,0,0,"fc756f38a155b19dd250ad85e0553fdabe4bf9e6",0,0,0,0,0,""
20210101,"LA",315275,29798,3898907,,"posNeg",4214182,1731,,,,202,,263712,"12/31/2020 13:00","2020-12-31T13:00:00Z","12/31 08:00",7488,,,"2020-12-31T13:00:00Z",4184384,,,285477,7115,373,,,,,,,,,,,215765,,"22",0,0,4214182,0,4214182,,0,0,"1cf5ee57567fc91d6a2ce88984122e3572e6a043",0,0,0,0,0,""
20201231,"LA",315275,29798,3898907,,"posNeg",4214182,1731,,,,202,,263712,"12/31/2020 13:00","2020-12-31T13:00:00Z","12/31 08:00",7488,,,"2020-12-31T13:00:00Z",4184384,,,285477,7115,373,,,,,,,,,,,215765,,"22",4046,25368,4214182,29414,4214182,,40,0,"89c8b7e882f51e3de9e1e42e4869e30fba5139a4",0,0,0,0,0,""
20201230,"LA",311229,29081,3873539,,"posNeg",4184768,1717,,,,210,,263712,"12/30/2020 13:00","2020-12-30T13:00:00Z","12/30 08:00",7448,,,"2020-12-30T13:00:00Z",4155687,,,282148,7078,370,,,,,,,,,,,211855,,"22",6744,35916,4184768,42660,4184768,,51,0,"adf29a4ce865a6ce323f858c9b6ef0b5f2201440",0,0,0,0,0,""
20201229,"LA",304485,26598,3837623,,"posNeg",4142108,1689,,,,218,,247501,"12/29/2020 13:00","2020-12-29T13:00:00Z","12/29 08:00",7397,,,"2020-12-29T13:00:00Z",4115510,,,277887,7034,363,,,,,,,,,,,199923,,"22",3946,29998,4142108,33944,4142108,,61,0,"b1ff24d4c0557f0934f52d899ad57ee8d861c6da",0,0,0,0,0,""
20201228,"LA",300539,25758,3807625,,"posNeg",4108164,1597,,,,201,,247501,"12/28/2020 13:00","2020-12-28T13:00:00Z","12/28 08:00",7336,,,"2020-12-28T13:00:00Z",4082406,,,274781,6980,356,,,,,,,,,,,195671,,"22",817,4695,4108164,5512,4108164,,45,0,"74620c12aa530732d9fa449f03e8e112ea8fbb14",0,0,0,0,0,""
20201227,"LA",299722,25674,3802930,,"posNeg",4102652,1530,,,,191,,247501,"12/27/2020 13:00","2020-12-27T13:00:00Z","12/27 08:00",7291,,,"2020-12-27T13:00:00Z",4076978,,,274048,6936,355,,,,,,,,,,,195221,,"22",3223,23607,4102652,26830,4102652,,19,0,"61fafbd27c66f78fbad71a1aead3a88ac78aa615",0,0,0,0,0,""
20201226,"LA",296499,25322,3779323,,"posNeg",4075822,1633,,,,199,,247501,"12/24/2020 13:00","2020-12-24T13:00:00Z","12/24 08:00",7272,,,"2020-12-24T13:00:00Z",4050500,,,271177,6918,354,,,,,,,,,,,192515,,"22",0,0,4075822,0,4075822,,0,0,"2d0233043539c21bb09f15527fc6477e06b5f579",0,0,0,0,0,""
20201225,"LA",296499,25322,3779323,,"posNeg",4075822,1633,,,,199,,247501,"12/24/2020 13:00","2020-12-24T13:00:00Z","12/24 08:00",7272,,,"2020-12-24T13:00:00Z",4050500,,,271177,6918,354,,,,,,,,,,,192515,,"22",0,0,4075822,0,4075822,,0,0,"273d2a44789b77a4ee5747dbbde0c63fc8259af5",0,0,0,0,0,""
20201224,"LA",296499,25322,3779323,,"posNeg",4075822,1633,,,,199,,247501,"12/24/2020 13:00","2020-12-24T13:00:00Z","12/24 08:00",7272,,,"2020-12-24T13:00:00Z",4050500,,,271177,6918,354,,,,,,,,,,,192515,,"22",2565,22791,4075822,25356,4075822,,46,0,"fbde7862e363450cb14741e157d2bee99aa646a4",0,0,0,0,0,""
20201223,"LA",293934,24950,3756532,,"posNeg",4050466,1675,,,,196,,247501,"12/23/2020 13:00","2020-12-23T13:00:00Z","12/23 08:00",7226,,,"2020-12-23T13:00:00Z",4025516,,,268984,6877,349,,,,,,,,,,,189580,,"22",2974,24734,4050466,27708,4050466,,68,0,"2fed3c743a8f756ec67a33fdf021316c2bd2b931",0,0,0,0,0,""
20201222,"LA",290960,24007,3731798,,"posNeg",4022758,1647,,,,181,,232725,"12/22/2020 13:00","2020-12-22T13:00:00Z","12/22 08:00",7158,,,"2020-12-22T13:00:00Z",3998751,,,266953,6813,345,,,,,,,,,,,183528,,"22",3699,37750,4022758,41449,4022758,,51,0,"b1fca555ae29c2028f141fc5d9085b2f26d8324f",0,0,0,0,0,""
20201221,"LA",287261,23074,3694048,,"posNeg",3981309,1590,,,,174,,232725,"12/21/2020 13:00","2020-12-21T13:00:00Z","12/21 08:00",7107,,,"2020-12-21T13:00:00Z",3958235,,,264187,6775,332,,,,,,,,,,,177522,,"22",1116,10809,3981309,11925,3981309,,65,0,"4b6289a81689c540e2786e07e7a1f30d645687c4",0,0,0,0,0,""
20201220,"LA",286145,23086,3683239,,"posNeg",3969384,1534,,,,169,,232725,"12/20/2020 13:00","2020-12-20T13:00:00Z","12/20 08:00",7042,,,"2020-12-20T13:00:00Z",3946298,,,263059,6711,331,,,,,,,,,,,177417,,"22",3711,40159,3969384,43870,3969384,,48,0,"45473ce0e700ffcafe639c87b18bdbeb62ab5cc9",0,0,0,0,0,""
20201219,"LA",282434,22531,3643080,,"posNeg",3925514,1547,,,,179,,232725,"12/18/2020 13:00","2020-12-18T13:00:00Z","12/18 08:00",6994,,,"2020-12-18T13:00:00Z",3902983,,,259903,6664,330,,,,,,,,,,,172616,,"22",0,0,3925514,0,3925514,,0,0,"5ac14d301aaee1890551bbe073254907ca38e1fe",0,0,0,0,0,""
20201218,"LA",282434,22531,3643080,,"posNeg",3925514,1547,,,,179,,232725,"12/18/2020 13:00","2020-12-18T13:00:00Z","12/18 08:00",6994,,,"2020-12-18T13:00:00Z",3902983,,,259903,6664,330,,,,,,,,,,,172616,,"22",3113,25577,3925514,28690,3925514,,30,0,"7f9b1981e94c608e90167406344c93746d253c8a",0,0,0,0,0,""
20201217,"LA",279321,21838,3617503,,"posNeg",3896824,1602,,,,169,,232725,"12/17/2020 13:00","2020-12-17T13:00:00Z","12/17 08:00",6964,,,"2020-12-17T13:00:00Z",3874986,,,257483,6637,327,,,,,,,,,,,168007,,"22",3776,29415,3896824,33191,3896824,,31,0,"17a4e9469dd52d3f850a0ca7da671c7e6651d75d",0,0,0,0,0,""
20201216,"LA",275545,21056,3588088,,"posNeg",3863633,1584,,,,167,,232725,"12/16/2020 13:00","2020-12-16T13:00:00Z","12/16 08:00",6933,,,"2020-12-16T13:00:00Z",3842577,,,254489,6607,326,,,,,,,,,,,163264,,"22",3269,22115,3863633,25384,3863633,,38,0,"4c1a8fc4e74ab1581b0a250b79c3562320e0d549",0,0,0,0,0,""
20201215,"LA",272276,19817,3565973,,"posNeg",3838249,1597,,,,152,,217930,"12/15/2020 13:00","2020-12-15T13:00:00Z","12/15 08:00",6895,,,"2020-12-15T13:00:00Z",3818432,,,252459,6577,318,,,,,,,,,,,156087,,"22",2633,31246,3838249,33879,3838249,,50,0,"7b2c25a413f41e8cd32f82d3df818886a7a3b633",0,0,0,0,0,""
20201214,"LA",269643,19351,3534727,,"posNeg",3804370,1527,,,,147,,217930,"12/14/2020 13:00","2020-12-14T13:00:00Z","12/14 08:00",6845,,,"2020-12-14T13:00:00Z",3785019,,,250292,6535,310,,,,,,,,,,,152781,,"22",1030,9139,3804370,10169,3804370,,27,0,"b4200b74db066d43fb74d4711f4eb93f9bbb1235",0,0,0,0,0,""
20201213,"LA",268613,19312,3525588,,"posNeg",3794201,1533,,,,162,,217930,"12/13/2020 13:00","2020-12-13T13:00:00Z","12/13 08:00",6818,,,"2020-12-13T13:00:00Z",3774889,,,249301,6511,307,,,,,,,,,,,152452,,"22",4422,50507,3794201,54929,3794201,,51,0,"f6f39aaf204c2fccb3c51cb9c40cbd22087af7fb",0,0,0,0,0,""
20201212,"LA",264191,18565,3475081,,"posNeg",3739272,1589,,,,167,,217930,"12/11/2020 13:00","2020-12-11T13:00:00Z","12/11 08:00",6767,,,"2020-12-11T13:00:00Z",3720707,,,245626,6465,302,,,,,,,,,,,147092,,"22",0,0,3739272,0,3739272,,0,0,"a02fb3f9afc0470cf3432f604809f4cce11b56bc",0,0,0,0,0,""
20201211,"LA",264191,18565,3475081,,"posNeg",3739272,1589,,,,167,,217930,"12/11/2020 13:00","2020-12-11T13:00:00Z","12/11 08:00",6767,,,"2020-12-11T13:00:00Z",3720707,,,245626,6465,302,,,,,,,,,,,147092,,"22",2862,31545,3739272,34407,3739272,,43,0,"8d4e81c27bf4f4f7ad07b9cffac2e60cb52b6b2d",0,0,0,0,0,""
20201210,"LA",261329,17894,3443536,,"posNeg",3704865,1529,,,,180,,217930,"12/10/2020 13:00","2020-12-10T13:00:00Z","12/10 08:00",6724,,,"2020-12-10T13:00:00Z",3686971,,,243435,6426,298,,,,,,,,,,,142606,,"22",2415,22542,3704865,24957,3704865,,40,0,"0a56de5fc5a5ab18017fdbb34d05d1f17edebeb2",0,0,0,0,0,""
20201209,"LA",258914,17566,3420994,,"posNeg",3679908,1537,,,,177,,217930,"12/9/2020 13:00","2020-12-09T13:00:00Z","12/09 08:00",6684,,,"2020-12-09T13:00:00Z",3662342,,,241348,6393,291,,,,,,,,,,,139641,,"22",4352,28170,3679908,32522,3679908,,32,0,"700521efde1bf9fde09eab1fc7acc82ccfbfc1c9",0,0,0,0,0,""
20201208,"LA",254562,15886,3392824,,"posNeg",3647386,1516,,,,165,,202891,"12/8/2020 13:00","2020-12-08T13:00:00Z","12/08 08:00",6652,,,"2020-12-08T13:00:00Z",3631500,,,238676,6363,289,,,,,,,,,,,129429,,"22",2426,26136,3647386,28562,3647386,,45,0,"35965808e972b88ce6200000268a7aeda76d5a43",0,0,0,0,0,""
20201207,"LA",252136,15257,3366688,,"posNeg",3618824,1423,,,,161,,202891,"12/7/2020 13:00","2020-12-07T13:00:00Z","12/07 08:00",6607,,,"2020-12-07T13:00:00Z",3603567,,,236879,6331,276,,,,,,,,,,,125278,,"22",1013,9728,3618824,10741,3618824,,23,0,"ac044e705b4edab1b4490cebefcba28eab657893",0,0,0,0,0,""
20201206,"LA",251123,15254,3356960,,"posNeg",3608083,1392,,,,162,,202891,"12/6/2020 13:00","2020-12-06T13:00:00Z","12/06 08:00",6584,,,"2020-12-06T13:00:00Z",3592829,,,235869,6309,275,,,,,,,,,,,125101,,"22",3946,37603,3608083,41549,3608083,,36,0,"818c591c166f3f2b9c131b3634dd2e053dd4e73d",0,0,0,0,0,""
20201205,"LA",247177,14698,3319357,,"posNeg",3566534,1357,,,,154,,202891,"12/4/2020 13:00","2020-12-04T13:00:00Z","12/04 08:00",6548,,,"2020-12-04T13:00:00Z",3551836,,,232479,6274,274,,,,,,,,,,,120846,,"22",0,0,3566534,0,3566534,,0,0,"4a72adfa57da37d1a57be8535f4924d7b3ab8556",0,0,0,0,0,""
20201204,"LA",247177,14698,3319357,,"posNeg",3566534,1357,,,,154,,202891,"12/4/2020 13:00","2020-12-04T13:00:00Z","12/04 08:00",6548,,,"2020-12-04T13:00:00Z",3551836,,,232479,6274,274,,,,,,,,,,,120846,,"22",3099,21534,3566534,24633,3566534,,24,0,"2419b3cb78fbdb39471985bf924244f157810ced",0,0,0,0,0,""
20201203,"LA",244078,14049,3297823,,"posNeg",3541901,1325,,,,142,,202891,"12/3/2020 13:00","2020-12-03T13:00:00Z","12/03 08:00",6524,,,"2020-12-03T13:00:00Z",3527852,,,230029,6252,272,,,,,,,,,,,117154,,"22",2743,20659,3541901,23402,3541901,,23,0,"51e89d38092187e271e52bcaf2a6f095b5d964ee",0,0,0,0,0,""
20201202,"LA",241335,13555,3277164,,"posNeg",3518499,1288,,,,134,,202891,"12/2/2020 13:00","2020-12-02T13:00:00Z","12/02 08:00",6501,,,"2020-12-02T13:00:00Z",3504944,,,227780,6231,270,,,,,,,,,,,113951,,"22",3595,60453,3518499,64048,3518499,,46,0,"e3045f1f7054b8a31a9d2c0b1a7cba0384c6c26d",0,0,0,0,0,""
20201201,"LA",237740,13330,3216711,,"posNeg",3454451,1280,,,,128,,192488,"12/1/2020 13:00","2020-12-01T13:00:00Z","12/01 08:00",6455,,,"2020-12-01T13:00:00Z",3441121,,,224410,6194,261,,,,,,,,,,,111778,,"22",5326,45406,3454451,50732,3454451,,35,0,"a8dfd2b3ccaaa36660f88dc9b891bbdd823f293c",0,0,0,0,0,""
20201130,"LA",232414,11993,3171305,,"posNeg",3403719,1241,,,,125,,192488,"11/30/2020 13:00","2020-11-30T13:00:00Z","11/30 08:00",6420,,,"2020-11-30T13:00:00Z",3391726,,,220421,6163,257,,,,,,,,,,,103527,,"22",169,844,3403719,1013,3403719,,13,0,"9dc0d7269fc195a609c00e8915c02a5691a19685",0,0,0,0,0,""
20201129,"LA",232245,11936,3170461,,"posNeg",3402706,1196,,,,125,,192488,"11/29/2020 13:00","2020-11-29T13:00:00Z","11/29 08:00",6407,,,"2020-11-29T13:00:00Z",3390770,,,220309,6152,255,,,,,,,,,,,103317,,"22",1643,22320,3402706,23963,3402706,,16,0,"82bb2c70fbd5f97a957efb777d429d5519756bcb",0,0,0,0,0,""
20201128,"LA",230602,11806,3148141,,"posNeg",3378743,1074,,,,125,,192488,"11/27/2020 13:00","2020-11-27T13:00:00Z","11/27 08:00",6391,,,"2020-11-27T13:00:00Z",3366937,,,218796,6136,255,,,,,,,,,,,102237,,"22",0,0,3378743,0,3378743,,0,0,"af372d79ef150d19bd1d02e53306028dcf7e44e6",0,0,0,0,0,""
20201127,"LA",230602,11806,3148141,,"posNeg",3378743,1074,,,,125,,192488,"11/27/2020 13:00","2020-11-27T13:00:00Z","11/27 08:00",6391,,,"2020-11-27T13:00:00Z",3366937,,,218796,6136,255,,,,,,,,,,,102237,,"22",4964,63074,3378743,68038,3378743,,41,0,"7577e602ba7a6d9bbbf19a00d162d1d385bbec33",0,0,0,0,0,""
20201126,"LA",225638,11401,3085067,,"posNeg",3310705,1077,,,,116,,192488,"11/25/2020 13:00","2020-11-25T13:00:00Z","11/25 08:00",6350,,,"2020-11-25T13:00:00Z",3299304,,,214237,6097,253,,,,,,,,,,,98370,,"22",0,0,3310705,0,3310705,,0,0,"f89e2f2a4715a0b0cfdf810e27cdf0ccf43a867a",0,0,0,0,0,""
20201125,"LA",225638,11401,3085067,,"posNeg",3310705,1077,,,,116,,192488,"11/25/2020 13:00","2020-11-25T13:00:00Z","11/25 08:00",6350,,,"2020-11-25T13:00:00Z",3299304,,,214237,6097,253,,,,,,,,,,,98370,,"22",1235,13086,3310705,14321,3310705,,27,0,"9dc3b08eaa577659b8e94839ea52bd0f85e29561",0,0,0,0,0,""
20201124,"LA",224403,11189,3071981,,"posNeg",3296384,1052,,,,113,,185960,"11/24/2020 13:00","2020-11-24T13:00:00Z","11/24 08:00",6323,,,"2020-11-24T13:00:00Z",3285195,,,213214,6072,251,,,,,,,,,,,96600,,"22",3243,30949,3296384,34192,3296384,,39,0,"81bfd058268cc8e233f3cad487728ba83fa1b86f",0,0,0,0,0,""
20201123,"LA",221160,10066,3041032,,"posNeg",3262192,1012,,,,114,,185960,"11/23/2020 13:00","2020-11-23T13:00:00Z","11/23 08:00",6284,,,"2020-11-23T13:00:00Z",3252126,,,211094,6039,245,,,,,,,,,,,89615,,"22",968,9278,3262192,10246,3262192,,24,0,"ca96016be70c3f87686ecf1702d336f1aeee3b86",0,0,0,0,0,""
20201122,"LA",220192,10068,3031754,,"posNeg",3251946,967,,,,105,,185960,"11/22/2020 13:00","2020-11-22T13:00:00Z","11/22 08:00",6260,,,"2020-11-22T13:00:00Z",3241878,,,210124,6015,245,,,,,,,,,,,89446,,"22",3483,39086,3251946,42569,3251946,,27,0,"57b74c6e08154a8a63470efe1284ab71fb2595e7",0,0,0,0,0,""
20201121,"LA",216709,9670,2992668,,"posNeg",3209377,972,,,,101,,185960,"11/20/2020 13:00","2020-11-20T13:00:00Z","11/20 08:00",6233,,,"2020-11-20T13:00:00Z",3199707,,,207039,5985,248,,,,,,,,,,,86376,,"22",0,0,3209377,0,3209377,,0,0,"4aa182f9bd759eece33cbe2d4316d12b338a1a0d",0,0,0,0,0,""
20201120,"LA",216709,9670,2992668,,"posNeg",3209377,972,,,,101,,185960,"11/20/2020 13:00","2020-11-20T13:00:00Z","11/20 08:00",6233,,,"2020-11-20T13:00:00Z",3199707,,,207039,5985,248,,,,,,,,,,,86376,,"22",4743,93007,3209377,97750,3209377,,34,0,"a8b218b112213d4189088051e1c7789045470b8f",0,0,0,0,0,""
20201119,"LA",211966,9223,2899661,,"posNeg",3111627,929,,,,88,,185960,"11/19/2020 13:00","2020-11-19T13:00:00Z","11/19 08:00",6199,,,"2020-11-19T13:00:00Z",3102404,,,202743,5951,248,,,,,,,,,,,82227,,"22",2052,23726,3111627,25778,3111627,,15,0,"bce54805963ca726716934990eda92561a228c21",0,0,0,0,0,""
20201118,"LA",209914,8932,2875935,,"posNeg",3085849,886,,,,93,,185960,"11/18/2020 13:00","2020-11-18T13:00:00Z","11/18 08:00",6184,,,"2020-11-18T13:00:00Z",3076917,,,200982,5939,245,,,,,,,,,,,79753,,"22",2229,15290,3085849,17519,3085849,,28,0,"c2ed8cd2867eceef957b239bc8630d9a7bffae67",0,0,0,0,0,""
20201117,"LA",207685,8026,2860645,,"posNeg",3068330,874,,,,92,,176107,"11/17/2020 13:00","2020-11-17T13:00:00Z","11/17 08:00",6156,,,"2020-11-17T13:00:00Z",3060304,,,199659,5916,240,,,,,,,,,,,73595,,"22",2626,28468,3068330,31094,3068330,,17,0,"a615b8575bfd2f8c44e6265e64c94fec5ef864db",0,0,0,0,0,""
20201116,"LA",205059,7592,2832177,,"posNeg",3037236,818,,,,81,,176107,"11/16/2020 13:00","2020-11-16T13:00:00Z","11/16 08:00",6139,,,"2020-11-16T13:00:00Z",3029644,,,197467,5902,237,,,,,,,,,,,70833,,"22",546,7094,3037236,7640,3037236,,7,0,"ad670cc4e0ab76e967ccc5598478f70995296f98",0,0,0,0,0,""
20201115,"LA",204513,7589,2825083,,"posNeg",3029596,753,,,,58,,176107,"11/15/2020 13:00","2020-11-15T13:00:00Z","11/15 08:00",6132,,,"2020-11-15T13:00:00Z",3022007,,,196924,5895,237,,,,,,,,,,,70720,,"22",2532,34596,3029596,37128,3029596,,11,0,"bed42bc167a5e57d8536df8e2432b9fbcf76820d",0,0,0,0,0,""
20201114,"LA",201981,7296,2790487,,"posNeg",2992468,692,,,,62,,176107,"11/13/2020 13:00","2020-11-13T13:00:00Z","11/13 08:00",6121,,,"2020-11-13T13:00:00Z",2985172,,,194685,5885,236,,,,,,,,,,,67211,,"22",0,0,2992468,0,2992468,,0,0,"7425233b6eb5e0721488a568f37ca97ef9c1088b",0,0,0,0,0,""
20201113,"LA",201981,7296,2790487,,"posNeg",2992468,692,,,,62,,176107,"11/13/2020 13:00","2020-11-13T13:00:00Z","11/13 08:00",6121,,,"2020-11-13T13:00:00Z",2985172,,,194685,5885,236,,,,,,,,,,,67211,,"22",3450,30530,2992468,33980,2992468,,24,0,"8b46076cbb1bd7a7d579b677244bed4f29d3a13c",0,0,0,0,0,""
20201112,"LA",198531,6642,2759957,,"posNeg",2958488,676,,,,59,,176107,"11/12/2020 13:00","2020-11-12T13:00:00Z","11/12 08:00",6097,,,"2020-11-12T13:00:00Z",2951846,,,191889,5863,234,,,,,,,,,,,,,"22",3829,29736,2958488,33565,2958488,,39,0,"59c230705d25a7c65e51e26d438fafec14465ec0",0,0,0,0,0,""
20201111,"LA",194702,5020,2730221,,"posNeg",2924923,684,,,,66,,172210,"11/11/2020 13:00","2020-11-11T13:00:00Z","11/11 08:00",6058,,,"2020-11-11T13:00:00Z",2919903,,,189682,5829,229,,,,,,,,,,,,,"22",0,0,2924923,0,2924923,,0,0,"72204ad880f65f9d7f3fd89e44ca698296754548",0,0,0,0,0,""
20201110,"LA",194702,5020,2730221,,"posNeg",2924923,684,,,,66,,172210,"11/10/2020 13:00","2020-11-10T13:00:00Z","11/10 08:00",6058,,,"2020-11-10T13:00:00Z",2919903,,,189682,5829,229,,,,,,,,,,,,,"22",1330,25130,2924923,26460,2924923,,10,0,"cda0a2a0a0b93326a9a0674f0c6b9bd50c944e01",0,0,0,0,0,""
20201109,"LA",193372,5020,2705091,,"posNeg",2898463,652,,,,71,,172210,"11/9/2020 13:00","2020-11-09T13:00:00Z","11/09 08:00",6048,,,"2020-11-09T13:00:00Z",2893443,,,188352,5819,229,,,,,,,,,,,,,"22",391,5115,2898463,5506,2898463,,12,0,"cda2a3922cf5e8665341374550263834dc3e1135",0,0,0,0,0,""
20201108,"LA",192981,5020,2699976,,"posNeg",2892957,622,,,,72,,172210,"11/8/2020 13:00","2020-11-08T13:00:00Z","11/08 08:00",6036,,,"2020-11-08T13:00:00Z",2887937,,,187961,5807,229,,,,,,,,,,,,,"22",1266,25215,2892957,26481,2892957,,20,0,"2d85457f59ef2aaef3373976eba698d712958e58",0,0,0,0,0,""
20201107,"LA",191715,5020,2674761,,"posNeg",2866476,644,,,,81,,172210,"11/6/2020 13:00","2020-11-06T13:00:00Z","11/06 08:00",6016,,,"2020-11-06T13:00:00Z",2861456,,,186695,5787,229,,,,,,,,,,,,,"22",0,0,2866476,0,2866476,,0,0,"fd212d556a5be679f7e4eff3d426df7309a097b5",0,0,0,0,0,""
20201106,"LA",191715,5020,2674761,,"posNeg",2866476,644,,,,81,,172210,"11/6/2020 13:00","2020-11-06T13:00:00Z","11/06 08:00",6016,,,"2020-11-06T13:00:00Z",2861456,,,186695,5787,229,,,,,,,,,,,,,"22",870,17940,2866476,18810,2866476,,21,0,"9e8d450887038cfb0fac6ad729c5035081ce3d36",0,0,0,0,0,""
20201105,"LA",190845,5020,2656821,,"posNeg",2847666,636,,,,82,,172210,"11/5/2020 13:00","2020-11-05T13:00:00Z","11/05 08:00",5995,,,"2020-11-05T13:00:00Z",2842646,,,185825,5766,229,,,,,,,,,,,,,"22",681,21066,2847666,21747,2847666,,20,0,"2535e641fdf6488c0094e92c951a2961cec59ff2",0,0,0,0,0,""
20201104,"LA",190164,5020,2635755,,"posNeg",2825919,623,,,,77,,172210,"11/4/2020 13:00","2020-11-04T13:00:00Z","11/04 08:00",5975,,,"2020-11-04T13:00:00Z",2820899,,,185144,5746,229,,,,,,,,,,,,,"22",1016,7043,2825919,8059,2825919,,24,0,"1b0130532ef358a27b87837ba7813924634e5185",0,0,0,0,0,""
20201103,"LA",189148,4379,2628712,,"posNeg",2817860,619,,,,84,,168634,"11/3/2020 13:00","2020-11-03T13:00:00Z","11/03 08:00",5951,,,"2020-11-03T13:00:00Z",2813481,,,184769,5737,214,,,,,,,,,,,,,"22",1153,28223,2817860,29376,2817860,,17,0,"365301b1e5b1485ece3ba7682620de6ea93d32f8",0,0,0,0,0,""
20201102,"LA",187995,4379,2600489,,"posNeg",2788484,596,,,,70,,168634,"11/2/2020 13:00","2020-11-02T13:00:00Z","11/02 08:00",5934,,,"2020-11-02T13:00:00Z",2784105,,,183616,5720,214,,,,,,,,,,,,,"22",275,5091,2788484,5366,2788484,,8,0,"fa7744d7dc4a7ba09a36c509798ac05971375d9f",0,0,0,0,0,""
20201101,"LA",187720,4379,2595398,,"posNeg",2783118,598,,,,70,,168634,"11/1/2020 13:00","2020-11-01T13:00:00Z","11/01 08:00",5926,,,"2020-11-01T13:00:00Z",2778739,,,183341,5712,214,,,,,,,,,,,,,"22",1071,18376,2783118,19447,2783118,,7,0,"14ae03dc595dc11087a59d1a4bb5b072108b326e",0,0,0,0,0,""
20201031,"LA",186649,4379,2577022,,"posNeg",2763671,612,,,,79,,168634,"10/30/2020 13:00","2020-10-30T13:00:00Z","10/30 09:00",5919,,,"2020-10-30T13:00:00Z",2759292,,,182270,5705,214,,,,,,,,,,,,,"22",0,0,2763671,0,2763671,,0,0,"4a13116ce81900fc38457e6cbeec54fda0fe12fe",0,0,0,0,0,""
20201030,"LA",186649,4379,2577022,,"posNeg",2763671,612,,,,79,,168634,"10/30/2020 13:00","2020-10-30T13:00:00Z","10/30 09:00",5919,,,"2020-10-30T13:00:00Z",2759292,,,182270,5705,214,,,,,,,,,,,,,"22",433,11441,2763671,11874,2763671,,11,0,"a76e3116cdd78eae74b3f0ba336b99b6d14563e7",0,0,0,0,0,""
20201029,"LA",186216,4379,2565581,,"posNeg",2751797,612,,,,79,,168634,"10/29/2020 13:00","2020-10-29T13:00:00Z","10/29 09:00",5908,,,"2020-10-29T13:00:00Z",2747418,,,181837,5694,214,,,,,,,,,,,,,"22",394,13002,2751797,13396,2751797,,18,0,"a58e269c0eae571df689833200c92f8743d9e7ed",0,0,0,0,0,""
20201028,"LA",185822,4379,2552579,,"posNeg",2738401,613,,,,80,,168634,"10/28/2020 13:00","2020-10-28T13:00:00Z","10/28 09:00",5890,,,"2020-10-28T13:00:00Z",2734022,,,181443,5676,214,,,,,,,,,,,,,"22",1098,14026,2738401,15124,2738401,,18,0,"d566d75499d2904a5d4f9b53ba55e2aa509c83d1",0,0,0,0,0,""
20201027,"LA",184724,3733,2538553,,"posNeg",2723277,600,,,,91,,165282,"10/27/2020 13:00","2020-10-27T13:00:00Z","10/27 09:00",5872,,,"2020-10-27T13:00:00Z",2719544,,,180991,5666,206,,,,,,,,,,,,,"22",922,19789,2723277,20711,2723277,,18,0,"d2fd0f686badd9da790ba1f1e6c863a080009e69",0,0,0,0,0,""
20201026,"LA",183802,3733,2518764,,"posNeg",2702566,609,,,,71,,165282,"10/26/2020 13:00","2020-10-26T13:00:00Z","10/26 09:00",5854,,,"2020-10-26T13:00:00Z",2698833,,,180069,5648,206,,,,,,,,,,,,,"22",227,4832,2702566,5059,2702566,,17,0,"d441ea4dfd9c1b93aacc0c739de3516549348ee2",0,0,0,0,0,""
20201025,"LA",183575,3733,2513932,,"posNeg",2697507,596,,,,66,,165282,"10/25/2020 13:00","2020-10-25T13:00:00Z","10/25 09:00",5837,,,"2020-10-25T13:00:00Z",2693774,,,179842,5631,206,,,,,,,,,,,,,"22",972,25297,2697507,26269,2697507,,17,0,"d5b34faa9818a7290efd59c3c1eeecc67769b61f",0,0,0,0,0,""
20201024,"LA",182603,3733,2488635,,"posNeg",2671238,620,,,,65,,165282,"10/23/2020 13:00","2020-10-23T13:00:00Z","10/23 09:00",5820,,,"2020-10-23T13:00:00Z",2667505,,,178870,5614,206,,,,,,,,,,,,,"22",0,0,2671238,0,2671238,,0,0,"61661993f50761003c65105cb695f5b91c738563",0,0,0,0,0,""
20201023,"LA",182603,3733,2488635,,"posNeg",2671238,620,,,,65,,165282,"10/23/2020 13:00","2020-10-23T13:00:00Z","10/23 09:00",5820,,,"2020-10-23T13:00:00Z",2667505,,,178870,5614,206,,,,,,,,,,,,,"22",699,19379,2671238,20078,2671238,,21,0,"7c7bebcc71a92fbcdb1f77448b45725ddab2cfbf",0,0,0,0,0,""
20201022,"LA",181904,3733,2469256,,"posNeg",2651160,598,,,,64,,165282,"10/22/2020 13:00","2020-10-22T13:00:00Z","10/22 09:00",5799,,,"2020-10-22T13:00:00Z",2647427,,,178171,5593,206,,,,,,,,,,,,,"22",772,18984,2651160,19756,2651160,,9,0,"45aed690ac9abae84e1966baff08beb66f6175af",0,0,0,0,0,""
20201021,"LA",181132,3733,2450272,,"posNeg",2631404,608,,,,68,,165282,"10/21/2020 13:00","2020-10-21T13:00:00Z","10/21 09:00",5790,,,"2020-10-21T13:00:00Z",2627671,,,177399,5584,206,,,,,,,,,,,,,"22",1363,13584,2631404,14947,2631404,,18,0,"a32b8aadeab00cf59a78fd650cb9e04fce5c0ddb",0,0,0,0,0,""
20201020,"LA",179769,3088,2436688,,"posNeg",2616457,586,,,,62,,161792,"10/20/2020 13:00","2020-10-20T13:00:00Z","10/20 09:00",5772,,,"2020-10-20T13:00:00Z",2613369,,,176681,5572,200,,,,,,,,,,,,,"22",699,18294,2616457,18993,2616457,,6,0,"b0b4d09fd3c909dbdc231092774bcbe806c04520",0,0,0,0,0,""
20201019,"LA",179070,3088,2418394,,"posNeg",2597464,553,,,,64,,161792,"10/19/2020 13:00","2020-10-19T13:00:00Z","10/19 09:00",5766,,,"2020-10-19T13:00:00Z",2594376,,,175982,5566,200,,,,,,,,,,,,,"22",201,4665,2597464,4866,2597464,,16,0,"4a8095887dc38d485b8380344f7a243ea6cb9219",0,0,0,0,0,""
20201018,"LA",178869,3088,2413729,,"posNeg",2592598,550,,,,60,,161792,"10/18/2020 13:00","2020-10-18T13:00:00Z","10/18 09:00",5750,,,"2020-10-18T13:00:00Z",2589510,,,175781,5550,200,,,,,,,,,,,,,"22",1143,25803,2592598,26946,2592598,,23,0,"a72a486abfc69e404488800178a5a29f74c2bf89",0,0,0,0,0,""
20201017,"LA",177726,3088,2387926,,"posNeg",2565652,557,,,,60,,161792,"10/16/2020 13:00","2020-10-16T13:00:00Z","10/16 09:00",5727,,,"2020-10-16T13:00:00Z",2562564,,,174638,5527,200,,,,,,,,,,,,,"22",0,0,2565652,0,2565652,,0,0,"b93c8e926bcb3701bc7fe26b3334b67904dbc48d",0,0,0,0,0,""
20201016,"LA",177726,3088,2387926,,"posNeg",2565652,557,,,,60,,161792,"10/16/2020 13:00","2020-10-16T13:00:00Z","10/16 09:00",5727,,,"2020-10-16T13:00:00Z",2562564,,,174638,5527,200,,,,,,,,,,,,,"22",774,18871,2565652,19645,2565652,,20,0,"e0b7a06fe703e3e696a2a3811f19adf65d3d8474",0,0,0,0,0,""
20201015,"LA",176952,3088,2369055,,"posNeg",2546007,566,,,,61,,161792,"10/15/2020 13:00","2020-10-15T13:00:00Z","10/15 09:00",5707,,,"2020-10-15T13:00:00Z",2542919,,,173864,5507,200,,,,,,,,,,,,,"22",743,25541,2546007,26284,2546007,,12,0,"ee947614458ae5b22c778c7f25738b49dcf9376c",0,0,0,0,0,""
20201014,"LA",176209,3088,2343514,,"posNeg",2519723,582,,,,64,,161792,"10/14/2020 13:00","2020-10-14T13:00:00Z","10/14 09:00",5695,,,"2020-10-14T13:00:00Z",2516635,,,173121,5495,200,,,,,,,,,,,,,"22",880,5996,2519723,6876,2519723,,16,0,"7ec934049a73098b5cb39681004a8e5345655775",0,0,0,0,0,""
20201013,"LA",175329,2528,2337518,,"posNeg",2512847,573,,,,68,,157873,"10/13/2020 13:00","2020-10-13T13:00:00Z","10/13 09:00",5679,,,"2020-10-13T13:00:00Z",2510319,,,172801,5486,193,,,,,,,,,,,,,"22",682,19900,2512847,20582,2512847,,10,0,"5f9d2f0d750ea464a2b77d9429b47e34422a381d",0,0,0,0,0,""
20201012,"LA",174647,2528,2317618,,"posNeg",2492265,577,,,,70,,157873,"10/12/2020 13:00","2020-10-12T13:00:00Z","10/12 09:00",5669,,,"2020-10-12T13:00:00Z",2489737,,,172119,5476,193,,,,,,,,,,,,,"22",60,3337,2492265,3397,2492265,,14,0,"03af8d156748a936f42853baec2c2d585cda9b7b",0,0,0,0,0,""
20201011,"LA",174587,2528,2314281,,"posNeg",2488868,563,,,,71,,157873,"10/11/2020 13:00","2020-10-11T13:00:00Z","10/11 09:00",5655,,,"2020-10-11T13:00:00Z",2486340,,,172059,5462,193,,,,,,,,,,,,,"22",1181,37600,2488868,38781,2488868,,20,0,"b5ac7dd666ba7d4c350e533234da4b48cfc8da98",0,0,0,0,0,""
20201010,"LA",173406,2528,2276681,,"posNeg",2450087,582,,,,78,,157873,"10/9/2020 13:00","2020-10-09T13:00:00Z","10/09 09:00",5635,,,"2020-10-09T13:00:00Z",2447559,,,170878,5442,193,,,,,,,,,,,,,"22",0,0,2450087,0,2450087,,0,0,"aac8996a992ea2d85731de8fc940cf652c312aa2",0,0,0,0,0,""
20201009,"LA",173406,2528,2276681,,"posNeg",2450087,582,,,,78,,157873,"10/9/2020 13:00","2020-10-09T13:00:00Z","10/09 09:00",5635,,,"2020-10-09T13:00:00Z",2447559,,,170878,5442,193,,,,,,,,,,,,,"22",257,9615,2450087,9872,2450087,,26,0,"cbd0994b2c5baab07c48af9b1e761d989a69ae98",0,0,0,0,0,""
20201008,"LA",173149,2528,2267066,,"posNeg",2440215,564,,,,79,,157873,"10/8/2020 13:00","2020-10-08T13:00:00Z","10/08 09:00",5609,,,"2020-10-08T13:00:00Z",2437687,,,170621,5416,193,,,,,,,,,,,,,"22",524,11776,2440215,12300,2440215,,5,0,"4c55d4d934b748d98e8e974378f9538580dd2010",0,0,0,0,0,""
20201007,"LA",172625,2528,2255290,,"posNeg",2427915,552,,,,78,,157873,"10/7/2020 13:00","2020-10-07T13:00:00Z","10/07 09:00",5604,,,"2020-10-07T13:00:00Z",2425387,,,170097,5411,193,,,,,,,,,,,,,"22",2156,21979,2427915,24135,2427915,,12,0,"805aaaebcc67802807f085159402e91e6d51affd",0,0,0,0,0,""
20201006,"LA",170469,1425,2233311,,"posNeg",2403780,567,,,,71,,154163,"10/6/2020 13:00","2020-10-06T13:00:00Z","10/06 09:00",5592,,,"2020-10-06T13:00:00Z",2402355,,,169044,5402,190,,,,,,,,,,,,,"22",532,12228,2403780,12760,2403780,,6,0,"677758b9b3e4d5e6cd808f6cf28d01721248394b",0,0,0,0,0,""
20201005,"LA",169937,1425,2221083,,"posNeg",2391020,547,,,,71,,154163,"10/5/2020 13:00","2020-10-05T13:00:00Z","10/05 09:00",5586,,,"2020-10-05T13:00:00Z",2389595,,,168512,5396,190,,,,,,,,,,,,,"22",218,7132,2391020,7350,2391020,,9,0,"2fb5832e5d2230d23cfdbd3ed9d0b787a7b911fc",0,0,0,0,0,""
20201004,"LA",169719,1425,2213951,,"posNeg",2383670,518,,,,68,,154163,"10/4/2020 13:00","2020-10-04T13:00:00Z","10/04 09:00",5577,,,"2020-10-04T13:00:00Z",2382245,,,168294,5387,190,,,,,,,,,,,,,"22",893,25328,2383670,26221,2383670,,32,0,"b1e4b404f6c5711d4af99c47b0ea92279ec0506d",0,0,0,0,0,""
20201003,"LA",168826,1425,2188623,,"posNeg",2357449,536,,,,74,,154163,"10/2/2020 13:00","2020-10-02T13:00:00Z","10/02 09:00",5545,,,"2020-10-02T13:00:00Z",2356024,,,167401,5355,190,,,,,,,,,,,,,"22",0,0,2357449,0,2357449,,0,0,"9a33f4fa203bee0c297ea25e4da9edc6b895ac5d",0,0,0,0,0,""
20201002,"LA",168826,1425,2188623,,"posNeg",2357449,536,,,,74,,154163,"10/2/2020 13:00","2020-10-02T13:00:00Z","10/02 09:00",5545,,,"2020-10-02T13:00:00Z",2356024,,,167401,5355,190,,,,,,,,,,,,,"22",817,21887,2357449,22704,2357449,,26,0,"9a67a21a905d599eef240307bbf26e92d72b87c2",0,0,0,0,0,""
20201001,"LA",168009,1425,2166736,,"posNeg",2334745,534,,,,75,,154163,"10/1/2020 13:00","2020-10-01T13:00:00Z","10/01 09:00",5519,,,"2020-10-01T13:00:00Z",2333320,,,166584,5329,190,,,,,,,,,,,,,"22",551,15590,2334745,16141,2334745,,8,0,"9e831d198fe9c5e6958984ac994abb582e9ab774",0,0,0,0,0,""
20200930,"LA",167458,1425,2151146,,"posNeg",2318604,553,,,,79,,154163,"9/30/2020 13:00","2020-09-30T13:00:00Z","09/30 09:00",5511,,,"2020-09-30T13:00:00Z",2317179,,,166033,5321,190,,,,,,,,,,,,,"22",610,10237,2318604,10847,2318604,,21,0,"3cbc4c19f8dcb2f9eeea2994d7469c47fcfd5d28",0,0,0,0,0,""
20200929,"LA",166848,1224,2140909,,"posNeg",2307757,578,,,,80,,149640,"9/29/2020 13:00","2020-09-29T13:00:00Z","09/29 09:00",5490,,,"2020-09-29T13:00:00Z",2306533,,,165624,5308,182,,,,,,,,,,,,,"22",533,17606,2307757,18139,2307757,,10,0,"c0d5b123c388682deced17bfaf62faf1d0788d81",0,0,0,0,0,""
20200928,"LA",166315,1224,2123303,,"posNeg",2289618,563,,,,83,,149640,"9/28/2020 13:00","2020-09-28T13:00:00Z","09/28 09:00",5480,,,"2020-09-28T13:00:00Z",2288394,,,165091,5298,182,,,,,,,,,,,,,"22",240,6229,2289618,6469,2289618,,15,0,"119f8a70136cb376a70aed790b67eb975d54eb91",0,0,0,0,0,""
20200927,"LA",166075,1224,2117074,,"posNeg",2283149,557,,,,85,,149640,"9/27/2020 13:00","2020-09-27T13:00:00Z","09/27 09:00",5465,,,"2020-09-27T13:00:00Z",2281925,,,164851,5283,182,,,,,,,,,,,,,"22",923,26161,2283149,27084,2283149,,21,0,"5c05f74d7db1ab67419e33847153107c6c0c2251",0,0,0,0,0,""
20200926,"LA",165152,1224,2090913,,"posNeg",2256065,570,,,,86,,149640,"9/25/2020 13:00","2020-09-25T13:00:00Z","09/25 09:00",5444,,,"2020-09-25T13:00:00Z",2254841,,,163928,5262,182,,,,,,,,,,,,,"22",0,0,2256065,0,2256065,,0,0,"ceeaa65ee4ec9b4c799957719a1b8a2e29f4a96d",0,0,0,0,0,""
20200925,"LA",165152,1224,2090913,,"posNeg",2256065,570,,,,86,,149640,"9/25/2020 13:00","2020-09-25T13:00:00Z","09/25 09:00",5444,,,"2020-09-25T13:00:00Z",2254841,,,163928,5262,182,,,,,,,,,,,,,"22",706,17825,2256065,18531,2256065,,21,0,"b5b1c14da47c2e6f52190f7b20bfa5a7ab0195f1",0,0,0,0,0,""
20200924,"LA",164446,1224,2073088,,"posNeg",2237534,575,,,,92,,149640,"9/24/2020 13:00","2020-09-24T13:00:00Z","09/24 09:00",5423,,,"2020-09-24T13:00:00Z",2236310,,,163222,5241,182,,,,,,,,,,,,,"22",577,16948,2237534,17525,2237534,,16,0,"a65f9da4706226f67b7bd807d3052862522a7e56",0,0,0,0,0,""
20200923,"LA",163869,1224,2056140,,"posNeg",2220009,592,,,,94,,149640,"9/23/2020 13:00","2020-09-23T13:00:00Z","09/23 09:00",5407,,,"2020-09-23T13:00:00Z",2218785,,,162645,5225,182,,,,,,,,,,,,,"22",616,12419,2220009,13035,2220009,,21,0,"ad6430fcfa971346c6784846135666fcc2e035ff",0,0,0,0,0,""
20200922,"LA",163253,1039,2043721,,"posNeg",2206974,571,,,,96,,145570,"9/22/2020 13:00","2020-09-22T13:00:00Z","09/22 09:00",5386,,,"2020-09-22T13:00:00Z",2205935,,,162214,5218,168,,,,,,,,,,,,,"22",752,20430,2206974,21182,2206974,,11,0,"c2102efb5a8753e9fa30a7131accb60fe12fd359",0,0,0,0,0,""
20200921,"LA",162501,1039,2023291,,"posNeg",2185792,587,,,,93,,145570,"9/21/2020 13:00","2020-09-21T13:00:00Z","09/21 09:00",5375,,,"2020-09-21T13:00:00Z",2184753,,,161462,5207,168,,,,,,,,,,,,,"22",243,6550,2185792,6793,2185792,,9,0,"c27195f3d10f557587cbe06ac03b7d1854df834c",0,0,0,0,0,""
20200920,"LA",162258,1039,2016741,,"posNeg",2178999,596,,,,100,,145570,"9/20/2020 13:00","2020-09-20T13:00:00Z","09/20 09:00",5366,,,"2020-09-20T13:00:00Z",2177960,,,161219,5198,168,,,,,,,,,,,,,"22",936,31077,2178999,32013,2178999,,26,0,"2cf93c2f30fb4c38eb7ef4bf6b16ddacc2559bab",0,0,0,0,0,""
20200919,"LA",161322,1039,1985664,,"posNeg",2146986,647,,,,104,,145570,"9/18/2020 13:00","2020-09-18T13:00:00Z","09/18 09:00",5340,,,"2020-09-18T13:00:00Z",2145947,,,160283,5172,168,,,,,,,,,,,,,"22",0,0,2146986,0,2146986,,0,0,"5bc228c2177d4180ac7125d22dce4be48f0b0024",0,0,0,0,0,""
20200918,"LA",161322,1039,1985664,,"posNeg",2146986,647,,,,104,,145570,"9/18/2020 13:00","2020-09-18T13:00:00Z","09/18 09:00",5340,,,"2020-09-18T13:00:00Z",2145947,,,160283,5172,168,,,,,,,,,,,,,"22",979,21817,2146986,22796,2146986,,29,0,"2cfd97e0e878f476294bc96952ddb6f1eb56ac00",0,0,0,0,0,""
20200917,"LA",160343,1039,1963847,,"posNeg",2124190,663,,,,106,,145570,"9/17/2020 13:00","2020-09-17T13:00:00Z","09/17 09:00",5311,,,"2020-09-17T13:00:00Z",2123151,,,159304,5143,168,,,,,,,,,,,,,"22",478,8528,2124190,9006,2124190,,17,0,"c2ece06c3ac905934afd6329decdc8e3e0d513ac",0,0,0,0,0,""
20200916,"LA",159865,1039,1955319,,"posNeg",2115184,678,,,,107,,145570,"9/16/2020 13:00","2020-09-16T13:00:00Z","09/16 09:00",5294,,,"2020-09-16T13:00:00Z",2114145,,,158826,5126,168,,,,,,,,,,,,,"22",612,22614,2115184,23226,2115184,,16,0,"8dbe95f3a34be259d13116de7d1d1f4408ce19d8",0,0,0,0,0,""
20200915,"LA",159253,935,1932705,,"posNeg",2091958,667,,,,99,,140440,"9/15/2020 13:00","2020-09-15T13:00:00Z","09/15 09:00",5278,,,"2020-09-15T13:00:00Z",2091023,,,158318,5108,170,,,,,,,,,,,,,"22",371,12288,2091958,12659,2091958,,26,0,"3b803e5ab75aec34574944cd5fe92b3b4cc5c256",0,0,0,0,0,""
20200914,"LA",158882,935,1920417,,"posNeg",2079299,664,,,,105,,140440,"9/14/2020 13:00","2020-09-14T13:00:00Z","09/14 09:00",5252,,,"2020-09-14T13:00:00Z",2078364,,,157947,5082,170,,,,,,,,,,,,,"22",492,12077,2079299,12569,2079299,,17,0,"dbce5ed137c09de1b0edc437f76d91fa2c658fcb",0,0,0,0,0,""
20200913,"LA",158390,935,1908340,,"posNeg",2066730,680,,,,107,,140440,"9/13/2020 13:00","2020-09-13T13:00:00Z","09/13 09:00",5235,,,"2020-09-13T13:00:00Z",2065795,,,157455,5065,170,,,,,,,,,,,,,"22",1281,27696,2066730,28977,2066730,,33,0,"f775d265388bbd680da5ae080359f3380f443861",0,0,0,0,0,""
20200912,"LA",157109,935,1880644,,"posNeg",2037753,723,,,,117,,140440,"9/11/2020 13:00","2020-09-11T13:00:00Z","09/11 09:00",5202,,,"2020-09-11T13:00:00Z",2036818,,,156174,5032,170,,,,,,,,,,,,,"22",0,0,2037753,0,2037753,,0,0,"8ce42546677d248af4889cc109b60510379babff",0,0,0,0,0,""
20200911,"LA",157109,935,1880644,,"posNeg",2037753,723,,,,117,,140440,"9/11/2020 13:00","2020-09-11T13:00:00Z","09/11 09:00",5202,,,"2020-09-11T13:00:00Z",2036818,,,156174,5032,170,,,,,,,,,,,,,"22",755,26479,2037753,27234,2037753,,41,0,"dcc14a16441ec5413842dba0e75f52885cc67cf7",0,0,0,0,0,""
20200910,"LA",156354,935,1854165,,"posNeg",2010519,762,,,,125,,140440,"9/10/2020 13:00","2020-09-10T13:00:00Z","09/10 09:00",5161,,,"2020-09-10T13:00:00Z",2009584,,,155419,4991,170,,,,,,,,,,,,,"22",464,10093,2010519,10557,2010519,,21,0,"91f8bc6e83cad8c38a71192b31b4a0cdbc5dc663",0,0,0,0,0,""
20200909,"LA",155890,935,1844072,,"posNeg",1999962,782,,,,123,,140440,"9/9/2020 13:00","2020-09-09T13:00:00Z","09/09 09:00",5140,,,"2020-09-09T13:00:00Z",1999027,,,154955,4970,170,,,,,,,,,,,,,"22",1561,30047,1999962,31608,1999962,,22,0,"911ecac25556021cfdc1db14ec10fd5de56ff45c",0,0,0,0,0,""
20200908,"LA",154329,896,1814025,,"posNeg",1968354,799,,,,131,,134432,"9/8/2020 13:00","2020-09-08T13:00:00Z","09/08 09:00",5118,,,"2020-09-08T13:00:00Z",1967458,,,153433,4955,163,,,,,,,,,,,,,"22",256,3869,1968354,4125,1968354,,13,0,"e34105ffe3ecb8a8f8c36dbfeb1f93bdfdb3302f",0,0,0,0,0,""
20200907,"LA",154073,896,1810156,,"posNeg",1964229,787,,,,124,,134432,"9/7/2020 13:00","2020-09-07T13:00:00Z","09/07 09:00",5105,,,"2020-09-07T13:00:00Z",1963333,,,153177,4942,163,,,,,,,,,,,,,"22",309,4676,1964229,4985,1964229,,12,0,"6807dd11482948942033f73d4129bd2fca4a8ff8",0,0,0,0,0,""
20200906,"LA",153764,896,1805480,,"posNeg",1959244,790,,,,119,,134432,"9/6/2020 13:00","2020-09-06T13:00:00Z","09/06 09:00",5093,,,"2020-09-06T13:00:00Z",1958348,,,152868,4930,163,,,,,,,,,,,,,"22",1395,25205,1959244,26600,1959244,,58,0,"11d2d09dec9d98b877e8c823a75048b0e6d7dc08",0,0,0,0,0,""
20200905,"LA",152369,896,1780275,,"posNeg",1932644,808,,,,96,,134432,"9/4/2020 13:00","2020-09-04T13:00:00Z","09/04 09:00",5035,,,"2020-09-04T13:00:00Z",1931748,,,151473,4872,163,,,,,,,,,,,,,"22",0,0,1932644,0,1932644,,0,0,"afc73f26e7b5cceb917f79bc0e84de4de9424955",0,0,0,0,0,""
20200904,"LA",152369,896,1780275,,"posNeg",1932644,808,,,,96,,134432,"9/4/2020 13:00","2020-09-04T13:00:00Z","09/04 09:00",5035,,,"2020-09-04T13:00:00Z",1931748,,,151473,4872,163,,,,,,,,,,,,,"22",822,14723,1932644,15545,1932644,,14,0,"4d0995952fb409ab065139442ffe36be451c6b45",0,0,0,0,0,""
20200903,"LA",151547,896,1765552,,"posNeg",1917099,851,,,,128,,134432,"9/3/2020 13:00","2020-09-03T13:00:00Z","09/03 09:00",5021,,,"2020-09-03T13:00:00Z",1916203,,,150651,4858,163,,,,,,,,,,,,,"22",813,11507,1917099,12320,1917099,,17,0,"4a376c72ed12f7e2e8d3a7ac03d0c1c0eef0aed3",0,0,0,0,0,""
20200902,"LA",150734,896,1754045,,"posNeg",1904779,873,,,,132,,134432,"9/2/2020 13:00","2020-09-02T13:00:00Z","09/02 09:00",5004,,,"2020-09-02T13:00:00Z",1903883,,,149838,4841,163,,,,,,,,,,,,,"22",1151,13102,1904779,14253,1904779,,20,0,"ffc4198ab4fad812c6757d6d43fdce718a808269",0,0,0,0,0,""
20200901,"LA",149583,701,1740943,,"posNeg",1890526,910,,,,128,,127918,"9/1/2020 13:00","2020-09-01T13:00:00Z","09/01 09:00",4984,,,"2020-09-01T13:00:00Z",1889825,,,148882,4821,163,,,,,,,,,,,,,"22",689,16347,1890526,17036,1890526,,34,0,"74590c0cde42cbada5467181d3c564c5d9f74094",0,0,0,0,0,""
20200831,"LA",148894,701,1724596,,"posNeg",1873490,881,,,,132,,127918,"8/31/2020 13:00","2020-08-31T13:00:00Z","08/31 09:00",4950,,,"2020-08-31T13:00:00Z",1872789,,,148193,4787,163,,,,,,,,,,,,,"22",326,3713,1873490,4039,1873490,,19,0,"41400b952e3b99bad791dc7984dde830b8417409",0,0,0,0,0,""
20200830,"LA",148568,701,1720883,,"posNeg",1869451,902,,,,143,,127918,"8/30/2020 13:00","2020-08-30T13:00:00Z","08/30 09:00",4931,,,"2020-08-30T13:00:00Z",1868750,,,147867,4768,163,,,,,,,,,,,,,"22",1624,38648,1869451,40272,1869451,,27,0,"5ac9b6854543abb859cb0b4b230b0e95d266d078",0,0,0,0,0,""
20200829,"LA",146944,701,1682235,,"posNeg",1829179,900,,,,141,,127918,"8/28/2020 13:00","2020-08-28T13:00:00Z","08/28 09:00",4904,,,"2020-08-28T13:00:00Z",1828478,,,146243,4741,163,,,,,,,,,,,,,"22",0,0,1829179,0,1829179,,0,0,"7417ad04e6050275ebc6eb818ae79f5100ece18b",0,0,0,0,0,""
20200828,"LA",146944,701,1682235,,"posNeg",1829179,900,,,,141,,127918,"8/28/2020 13:00","2020-08-28T13:00:00Z","08/28 09:00",4904,,,"2020-08-28T13:00:00Z",1828478,,,146243,4741,163,,,,,,,,,,,,,"22",606,9669,1829179,10275,1829179,,30,0,"e9ce25429dfbc230d383bcea7c17176429c28a0f",0,0,0,0,0,""
20200827,"LA",146338,701,1672566,,"posNeg",1818904,876,,,,145,,127918,"8/27/2020 13:00","2020-08-27T13:00:00Z","08/27 09:00",4874,,,"2020-08-27T13:00:00Z",1818203,,,145637,4711,163,,,,,,,,,,,,,"22",677,9359,1818904,10036,1818904,,23,0,"7508d945b520e3a4627bbe67956b2d7ea24005bb",0,0,0,0,0,""
20200826,"LA",145661,701,1663207,,"posNeg",1808868,914,,,,148,,127918,"8/26/2020 13:00","2020-08-26T13:00:00Z","08/26 09:00",4851,,,"2020-08-26T13:00:00Z",1808167,,,144960,4688,163,,,,,,,,,,,,,"22",1545,13261,1808868,14806,1808868,,54,0,"1b5d7185ab026e9fe2742a213730018a3b4880ab",0,0,0,0,0,""
20200825,"LA",144116,,1649946,,"posNeg",1794062,930,,,,141,,118120,"8/25/2020 13:00","2020-08-25T13:00:00Z","08/25 09:00",4797,,,"2020-08-25T13:00:00Z",1794062,,,144116,4656,141,,,,,,,,,,,,,"22",550,21031,1794062,21581,1794062,,33,0,"39a6f3613e2ebcdc82739818a9c62fbefcfb5aa8",0,0,0,0,0,""
20200824,"LA",143566,,1628915,,"posNeg",1772481,939,,,,152,,118120,"8/24/2020 13:00","2020-08-24T13:00:00Z","08/24 09:00",4764,,,"2020-08-24T13:00:00Z",1772481,,,143566,4623,141,,,,,,,,,,,,,"22",623,8020,1772481,8643,1772481,,18,0,"3b1786d6ef67afccd814c602b64e2f6a5b49e9db",0,0,0,0,0,""
20200823,"LA",142943,,1620895,,"posNeg",1763838,941,,,,152,,118120,"8/23/2020 13:00","2020-08-23T13:00:00Z","08/23 09:00",4746,,,"2020-08-23T13:00:00Z",1763838,,,142943,4605,141,,,,,,,,,,,,,"22",1223,23808,1763838,25031,1763838,,59,0,"7b37f8369e649e12d21ea6e6b290e066a685e85d",0,0,0,0,0,""
20200822,"LA",141720,,1597087,,"posNeg",1738807,1051,,,,172,,118120,"8/21/2020 13:00","2020-08-21T13:00:00Z","08/21 09:00",4687,,,"2020-08-21T13:00:00Z",1738807,,,141720,4546,141,,,,,,,,,,,,,"22",0,0,1738807,0,1738807,,0,0,"bb84e7a0cb4495934e816c8f4cb68af357a95026",0,0,0,0,0,""
20200821,"LA",141720,,1597087,,"posNeg",1738807,1051,,,,172,,118120,"8/21/2020 13:00","2020-08-21T13:00:00Z","08/21 09:00",4687,,,"2020-08-21T13:00:00Z",1738807,,,141720,4546,141,,,,,,,,,,,,,"22",899,18874,1738807,19773,1738807,,50,0,"b722041866d0ab2b27b301f7dbd8d99f1c33c287",0,0,0,0,0,""
20200820,"LA",140821,,1578213,,"posNeg",1719034,1087,,,,178,,118120,"8/20/2020 13:00","2020-08-20T13:00:00Z","08/20 09:00",4637,,,"2020-08-20T13:00:00Z",1719034,,,140821,4496,141,,,,,,,,,,,,,"22",918,13142,1719034,14060,1719034,,28,0,"b4292800506576684eca47f85ffedc25ca6e10a7",0,0,0,0,0,""
20200819,"LA",139903,,1565071,,"posNeg",1704974,1160,,,,175,,118120,"8/19/2020 13:00","2020-08-19T13:00:00Z","08/19 09:00",4609,,,"2020-08-19T13:00:00Z",1704974,,,139903,4468,141,,,,,,,,,,,,,"22",778,14205,1704974,14983,1704974,,55,0,"fa86d087b2b0d38f51490f30b6d2a5fb18ededce",0,0,0,0,0,""
20200818,"LA",139125,,1550866,,"posNeg",1689991,1204,,,,187,,103512,"8/18/2020 13:00","2020-08-18T13:00:00Z","08/18 09:00",4554,,,"2020-08-18T13:00:00Z",1689991,,,139125,4431,123,,,,,,,,,,,,,"22",640,15062,1689991,15702,1689991,,28,0,"6cbec5c9e22d83a308f67cd1aff3803346e5b279",0,0,0,0,0,""
20200817,"LA",138485,,1535804,,"posNeg",1674289,1226,,,,184,,103512,"8/17/2020 13:00","2020-08-17T13:00:00Z","08/17 09:00",4526,,,"2020-08-17T13:00:00Z",1674289,,,138485,4403,123,,,,,,,,,,,,,"22",567,15635,1674289,16202,1674289,,19,0,"38996cbfbaf8913633530df97389d5f41b095149",0,0,0,0,0,""
20200816,"LA",137918,,1520169,,"posNeg",1658087,1196,,,,189,,103512,"8/16/2020 13:00","2020-08-16T13:00:00Z","08/16 09:00",4507,,,"2020-08-16T13:00:00Z",1658087,,,137918,4384,123,,,,,,,,,,,,,"22",1181,19894,1658087,21075,1658087,,77,0,"6ee2d014b2699f4346163f4d23a9f507de63bc09",0,0,0,0,0,""
20200815,"LA",136737,,1500275,,"posNeg",1637012,1243,,,,197,,103512,"8/14/2020 13:00","2020-08-14T13:00:00Z","08/14 09:00",4430,,,"2020-08-14T13:00:00Z",1637012,,,136737,4307,123,,,,,,,,,,,,,"22",0,0,1637012,0,1637012,,0,0,"bef7a5346d9fcdf9e7a598fca68a69c6fd5bda9f",0,0,0,0,0,""
20200814,"LA",136737,,1500275,,"posNeg",1637012,1243,,,,197,,103512,"8/14/2020 13:00","2020-08-14T13:00:00Z","08/14 09:00",4430,,,"2020-08-14T13:00:00Z",1637012,,,136737,4307,123,,,,,,,,,,,,,"22",1298,19734,1637012,21032,1637012,,28,0,"7c8b84e90fb737c379181224274d6bf62efd99fa",0,0,0,0,0,""
20200813,"LA",135439,,1480541,,"posNeg",1615980,1281,,,,196,,103512,"8/13/2020 13:00","2020-08-13T13:00:00Z","08/13 09:00",4402,,,"2020-08-13T13:00:00Z",1615980,,,135439,4279,123,,,,,,,,,,,,,"22",1135,16236,1615980,17371,1615980,,41,0,"d810c833630ca6f184aac541cc278c098a2bc918",0,0,0,0,0,""
20200812,"LA",134304,,1464305,,"posNeg",1598609,1320,,,,211,,103512,"8/12/2020 13:00","2020-08-12T13:00:00Z","08/12 09:00",4361,,,"2020-08-12T13:00:00Z",1598609,,,134304,4238,123,,,,,,,,,,,,,"22",1179,28866,1598609,30045,1598609,,48,0,"b1f87c84e7a1c73b0a633cd7052fa41aaec75c09",0,0,0,0,0,""
20200811,"LA",133125,,1435439,,"posNeg",1568564,1335,,,,214,,89083,"8/11/2020 13:00","2020-08-11T13:00:00Z","08/11 09:00",4313,,,"2020-08-11T13:00:00Z",1568564,,,133125,4195,118,,,,,,,,,,,,,"22",1164,19467,1568564,20631,1568564,,26,0,"f03d129137fad268276478631149741d3fe5caf4",0,0,0,0,0,""
20200810,"LA",131961,,1415972,,"posNeg",1547933,1382,,,,215,,89083,"8/10/2020 13:00","2020-08-10T13:00:00Z","08/10 09:00",4287,,,"2020-08-10T13:00:00Z",1547933,,,131961,4169,118,,,,,,,,,,,,,"22",562,6800,1547933,7362,1547933,,24,0,"82ab73a5c10a496788ec5e132bcf8c8c648eb118",0,0,0,0,0,""
20200809,"LA",131399,,1409172,,"posNeg",1540571,1383,,,,210,,89083,"8/9/2020 00:00","2020-08-09T00:00:00Z","08/08 20:00",4263,,,"2020-08-09T00:00:00Z",1540571,,,131399,4145,118,,,,,,,,,,,,,"22",2653,32916,1540571,35569,1540571,,56,0,"0ca9e7a0da7ddd20cd9de7001c57c47dd16d68c0",0,0,0,0,0,""
20200808,"LA",128746,,1376256,,"posNeg",1505002,1406,,,,207,,89083,"8/7/2020 00:00","2020-08-07T00:00:00Z","08/06 20:00",4207,,,"2020-08-07T00:00:00Z",1505002,,,128746,4089,118,,,,,,,,,,,,,"22",0,0,1505002,0,1505002,,0,0,"9297f0926d72b817c9b388d3b75e50d66b28320a",0,0,0,0,0,""
20200807,"LA",128746,,1376256,,"posNeg",1505002,1406,,,,207,,89083,"8/7/2020 00:00","2020-08-07T00:00:00Z","08/06 20:00",4207,,,"2020-08-07T00:00:00Z",1505002,,,128746,4089,118,,,,,,,,,,,,,"22",1500,18530,1505002,20030,1505002,,61,0,"0f9c6f85e7d57445d61153bbe39a62254f9f7ec0",0,0,0,0,0,""
20200806,"LA",127246,,1357726,,"posNeg",1484972,1457,,,,215,,89083,"8/6/2020 00:00","2020-08-06T00:00:00Z","08/05 20:00",4146,,,"2020-08-06T00:00:00Z",1484972,,,127246,4028,118,,,,,,,,,,,,,"22",1303,13802,1484972,15105,1484972,,50,0,"7f66c243f03c072bf4196fec69ba03aa2898a772",0,0,0,0,0,""
20200805,"LA",125943,,1343924,,"posNeg",1469867,1471,,,,223,,89083,"8/5/2020 13:00","2020-08-05T13:00:00Z","08/05 09:00",4096,,,"2020-08-05T13:00:00Z",1469867,,,125943,3978,118,,,,,,,,,,,,,"22",1482,18528,1469867,20010,1469867,,45,0,"705b0e965639838cd75191778b3756e13b95a2d4",0,0,0,0,0,""
20200804,"LA",124461,,1325396,,"posNeg",1449857,1487,,,,240,,74246,"8/4/2020 13:00","2020-08-04T13:00:00Z","08/04 09:00",4051,,,"2020-08-04T13:00:00Z",1449857,,,124461,3937,114,,,,,,,,,,,,,"22",3615,52332,1449857,55947,1449857,,27,0,"cb996453ded162c2abfe0ee2a635746f21aee118",0,0,0,0,0,""
20200803,"LA",120846,,1273064,,"posNeg",1393910,1496,,,,230,,74246,"8/3/2020 13:00","2020-08-03T13:00:00Z","08/03 09:00",4024,,,"2020-08-03T13:00:00Z",1393910,,,120846,3910,114,,,,,,,,,,,,,"22",1099,13371,1393910,14470,1393910,,17,0,"611f28780d96613f5bdb174fd01d1be48d5a3f6f",0,0,0,0,0,""
20200802,"LA",119747,,1259693,,"posNeg",1379440,1534,,,,221,,74246,"8/2/2020 13:00","2020-08-02T13:00:00Z","08/02 09:00",4007,,,"2020-08-02T13:00:00Z",1379440,,,119747,3893,114,,,,,,,,,,,,,"22",3467,33730,1379440,37197,1379440,,58,0,"657a92e44a422e1a5188b18ce056119950ad3524",0,0,0,0,0,""
20200801,"LA",116280,,1225963,,"posNeg",1342243,1546,,,,222,,74246,"7/31/2020 13:00","2020-07-31T13:00:00Z","07/31 09:00",3949,,,"2020-07-31T13:00:00Z",1342243,,,116280,3835,114,,,,,,,,,,,,,"22",0,0,1342243,0,1342243,,0,0,"0dc928d12c318f7e607981c6a6a48e1c36543aa4",0,0,0,0,0,""
20200731,"LA",116280,,1225963,,"posNeg",1342243,1546,,,,222,,74246,"7/31/2020 13:00","2020-07-31T13:00:00Z","07/31 09:00",3949,,,"2020-07-31T13:00:00Z",1342243,,,116280,3835,114,,,,,,,,,,,,,"22",1799,23054,1342243,24853,1342243,,24,0,"23f190963757984ebed3abc9373b6d8497a811ea",0,0,0,0,0,""
20200730,"LA",114481,,1202909,,"posNeg",1317390,1524,,,,205,,74246,"7/30/2020 13:00","2020-07-30T13:00:00Z","07/30 09:00",3925,,,"2020-07-30T13:00:00Z",1317390,,,114481,3811,114,,,,,,,,,,,,,"22",1708,20551,1317390,22259,1317390,,42,0,"d57792f969d43876117a4fb88d5affc6b3a61f89",0,0,0,0,0,""
20200729,"LA",112773,,1182358,,"posNeg",1295131,1544,,,,221,,74246,"7/29/2020 13:00","2020-07-29T13:00:00Z","07/29 09:00",3883,,,"2020-07-29T13:00:00Z",1295131,,,112773,3769,114,,,,,,,,,,,,,"22",1735,17092,1295131,18827,1295131,,71,0,"339c8c60606c22a517b00a37ea7b9571b909f861",0,0,0,0,0,""
20200728,"LA",111038,,1165266,,"posNeg",1276304,1583,,,,214,,61456,"7/28/2020 13:00","2020-07-28T13:00:00Z","07/28 09:00",3812,,,"2020-07-28T13:00:00Z",1276304,,,111038,3700,112,,,,,,,,,,,,,"22",1121,15161,1276304,16282,1276304,,26,0,"0cbd1e1e0fa7f5d98127b03be78ae1882ebbac97",0,0,0,0,0,""
20200727,"LA",109917,,1150105,,"posNeg",1260022,1600,,,,208,,61456,"7/27/2020 13:00","2020-07-27T13:00:00Z","07/27 09:00",3786,,,"2020-07-27T13:00:00Z",1260022,,,109917,3674,112,,,,,,,,,,,,,"22",2343,24415,1260022,26758,1260022,,23,0,"a24bbbbbf627b84c1524694f96c966e4d1103a70",0,0,0,0,0,""
20200726,"LA",107574,,1125690,,"posNeg",1233264,1557,,,,184,,61456,"7/26/2020 13:00","2020-07-26T13:00:00Z","07/26 09:00",3763,,,"2020-07-26T13:00:00Z",1233264,,,107574,3651,112,,,,,,,,,,,,,"22",3840,29698,1233264,33538,1233264,,48,0,"6360cbbc1421c78dd71c0611b1a3283b7372ed88",0,0,0,0,0,""
20200725,"LA",103734,,1095992,,"posNeg",1199726,1600,,,,197,,61456,"7/24/2020 13:00","2020-07-24T13:00:00Z","07/24 09:00",3715,,,"2020-07-24T13:00:00Z",1199726,,,103734,3603,112,,,,,,,,,,,,,"22",0,0,1199726,0,1199726,,0,0,"87bac44d9548aa6d005645583b30db2db1dbb4ad",0,0,0,0,0,""
20200724,"LA",103734,,1095992,,"posNeg",1199726,1600,,,,197,,61456,"7/24/2020 13:00","2020-07-24T13:00:00Z","07/24 09:00",3715,,,"2020-07-24T13:00:00Z",1199726,,,103734,3603,112,,,,,,,,,,,,,"22",2084,22774,1199726,24858,1199726,,29,0,"addeef02897a42e672c15857b62fb2538d5673dd",0,0,0,0,0,""
20200723,"LA",101650,,1073218,,"posNeg",1174868,1585,,,,197,,61456,"7/23/2020 13:00","2020-07-23T13:00:00Z","07/23 09:00",3686,,,"2020-07-23T13:00:00Z",1174868,,,101650,3574,112,,,,,,,,,,,,,"22",2296,19671,1174868,21967,1174868,,16,0,"4ce2e54c969418c9a7b169a4a6ba99b3b96b3cb1",0,0,0,0,0,""
20200722,"LA",99354,,1053547,,"posNeg",1152901,1581,,,,188,,61456,"7/22/2020 15:30","2020-07-22T15:30:00Z","07/22 11:30",3670,,,"2020-07-22T15:30:00Z",1152901,,,99354,3558,112,,,,,,,,,,,,,"22",2771,27168,1152901,29939,1152901,,62,0,"bf6a1ca786cf5d5056446bd385d0b2e5428d1473",0,0,0,0,0,""
20200721,"LA",96583,,1026379,,"posNeg",1122962,1527,,,,186,,53288,"7/21/2020 13:00","2020-07-21T13:00:00Z","07/21 09:00",3608,,,"2020-07-21T13:00:00Z",1122962,,,96583,3498,110,,,,,,,,,,,,,"22",1691,18347,1122962,20038,1122962,,36,0,"ff053d6904b9d6a7a5628cd0bc727365bd3bb59c",0,0,0,0,0,""
20200720,"LA",94892,,1008032,,"posNeg",1102924,1508,,,,192,,53288,"7/20/2020 13:00","2020-07-20T13:00:00Z","07/20 09:00",3572,,,"2020-07-20T13:00:00Z",1102924,,,94892,3462,110,,,,,,,,,,,,,"22",3186,30434,1102924,33620,1102924,,29,0,"3dc2338ee903aa7fff45140ae50f3e5c78eb0e2a",0,0,0,0,0,""
20200719,"LA",91706,,977598,,"posNeg",1069304,1469,,,,177,,53288,"7/19/2020 13:00","2020-07-19T13:00:00Z","07/19 09:00",3543,,,"2020-07-19T13:00:00Z",1069304,,,91706,3433,110,,,,,,,,,,,,,"22",3116,22248,1069304,25364,1069304,,34,0,"7eda0c1016849822ebef85a5784fc37f9273267b",0,0,0,0,0,""
20200718,"LA",88590,,955350,,"posNeg",1043940,1413,,,,161,,53288,"7/17/2020 13:00","2020-07-17T13:00:00Z","07/17 09:00",3509,,,"2020-07-17T13:00:00Z",1043940,,,88590,3399,110,,,,,,,,,,,,,"22",0,0,1043940,0,1043940,,0,0,"743a416e6a65da8469033fe8687e412c8a2d8035",0,0,0,0,0,""
20200717,"LA",88590,,955350,,"posNeg",1043940,1413,,,,161,,53288,"7/17/2020 13:00","2020-07-17T13:00:00Z","07/17 09:00",3509,,,"2020-07-17T13:00:00Z",1043940,,,88590,3399,110,,,,,,,,,,,,,"22",2179,17624,1043940,19803,1043940,,24,0,"397c2a165ad6b7adb7fc9305219bfc502ce464f8",0,0,0,0,0,""
20200716,"LA",86411,,937726,,"posNeg",1024137,1401,,,,162,,53288,"7/16/2020 13:00","2020-07-16T13:00:00Z","07/16 09:00",3485,,,"2020-07-16T13:00:00Z",1024137,,,86411,3375,110,,,,,,,,,,,,,"22",2280,20657,1024137,22937,1024137,,24,0,"6f51acafc3c5d54106d91824bd38f5e61d690c36",0,0,0,0,0,""
20200715,"LA",84131,,917069,,"posNeg",1001200,1369,,,,149,,53288,"7/15/2020 13:00","2020-07-15T13:00:00Z","07/15 09:00",3461,,,"2020-07-15T13:00:00Z",1001200,,,84131,3351,110,,,,,,,,,,,,,"22",2089,22656,1001200,24745,1001200,,16,0,"2ef0768761dd9cbb38a5e08b3a00236ac21b065b",0,0,0,0,0,""
20200714,"LA",82042,,894413,,"posNeg",976455,1362,,,,146,,46334,"7/14/2020 13:00","2020-07-14T13:00:00Z","07/14 09:00",3445,,,"2020-07-14T13:00:00Z",976455,,,82042,3337,108,,,,,,,,,,,,,"22",2215,20814,976455,23029,976455,,22,0,"2dc052fb3c843ce86c90b76964ce9df075e7542d",0,0,0,0,0,""
20200713,"LA",79827,,873599,,"posNeg",953426,1308,,,,142,,46334,"7/13/2020 13:00","2020-07-13T13:00:00Z","07/13 09:00",3423,,,"2020-07-13T13:00:00Z",953426,,,79827,3315,108,,,,,,,,,,,,,"22",1705,16726,953426,18431,953426,,7,0,"4c2c9d6347faa2960a3ba62fff168f2860527cce",0,0,0,0,0,""
20200712,"LA",78122,,856873,,"posNeg",934995,1243,,,,134,,46334,"7/12/2020 13:00","2020-07-12T13:00:00Z","07/12 09:00",3416,,,"2020-07-12T13:00:00Z",934995,,,78122,3308,108,,,,,,,,,,,,,"22",1319,9229,934995,10548,934995,,13,0,"ffeaafb71c6b047091b8c063ca5bb91444663be7",0,0,0,0,0,""
20200711,"LA",76803,,847644,,"posNeg",924447,1182,,,,121,,46334,"7/11/2020 13:00","2020-07-11T13:00:00Z","07/11 09:00",3403,,,"2020-07-11T13:00:00Z",924447,,,76803,3295,108,,,,,,,,,,,,,"22",2167,17032,924447,19199,924447,,23,0,"961964d9b8da48be3fcf081dd5373e9583c17e95",0,0,0,0,0,""
20200710,"LA",74636,,830612,,"posNeg",905248,1117,,,,122,,46334,"7/10/2020 13:00","2020-07-10T13:00:00Z","07/10 09:00",3380,,,"2020-07-10T13:00:00Z",905248,,,74636,3272,108,,,,,,,,,,,,,"22",2642,22466,905248,25108,905248,,25,0,"c818c7172fd7ca69ef533628df49e13e3b2a396a",0,0,0,0,0,""
20200709,"LA",71994,,808146,,"posNeg",880140,1042,,,,110,,46334,"7/9/2020 13:00","2020-07-09T13:00:00Z","07/09 09:00",3355,,,"2020-07-09T13:00:00Z",880140,,,71994,3247,108,,,,,,,,,,,,,"22",1843,12560,880140,14403,880140,,16,0,"1b3ecd965d47c85e445b5980523e18749397a929",0,0,0,0,0,""
20200708,"LA",70151,,795586,,"posNeg",865737,1022,,,,105,,46334,"7/8/2020 13:00","2020-07-08T13:00:00Z","07/08 09:00",3339,,,"2020-07-08T13:00:00Z",865737,,,70151,3231,108,,,,,,,,,,,,,"22",1888,16251,865737,18139,865737,,20,0,"a216c1b47240d93faaf24b6cf762aa90a3e6824e",0,0,0,0,0,""
20200707,"LA",68263,,779335,,"posNeg",847598,1025,,,,109,,43026,"7/7/2020 13:00","2020-07-07T13:00:00Z","07/07 09:00",3319,,,"2020-07-07T13:00:00Z",847598,,,68263,3211,108,,,,,,,,,,,,,"22",1936,32017,847598,33953,847598,,23,0,"800c8c52256a3d67ddc8648cb1a64a9f8c5fc475",0,0,0,0,0,""
20200706,"LA",66327,,747318,,"posNeg",813645,964,,,,109,,43026,"7/6/2020 13:00","2020-07-06T13:00:00Z","07/06 09:00",3296,,,"2020-07-06T13:00:00Z",813645,,,66327,3188,108,,,,,,,,,,,,,"22",1101,10090,813645,11191,813645,,8,0,"1f39fba13b645063d09de9d344e3e1dd0d9d0ec2",0,0,0,0,0,""
20200705,"LA",65226,,737228,,"posNeg",802454,926,,,,105,,43026,"7/5/2020 13:00","2020-07-05T13:00:00Z","07/05 09:00",3288,,,"2020-07-05T13:00:00Z",802454,,,65226,3180,108,,,,,,,,,,,,,"22",1937,16375,802454,18312,802454,,10,0,"21ab95f8dcdf1cabf31d94ef80a11f962ef0d2f7",0,0,0,0,0,""
20200704,"LA",63289,,720853,,"posNeg",784142,852,,,,93,,43026,"7/3/2020 13:00","2020-07-03T13:00:00Z","07/03 09:00",3278,,,"2020-07-03T13:00:00Z",784142,,,63289,3170,108,,,,,,,,,,,,,"22",0,0,784142,0,784142,,0,0,"6adfb5afa5e4f10fd8435da815b4ff258f284e43",0,0,0,0,0,""
20200703,"LA",63289,,720853,,"posNeg",784142,852,,,,93,,43026,"7/3/2020 13:00","2020-07-03T13:00:00Z","07/03 09:00",3278,,,"2020-07-03T13:00:00Z",784142,,,63289,3170,108,,,,,,,,,,,,,"22",1728,15040,784142,16768,784142,,23,0,"0f61a64f6b417984044760279f2a9cf1aa392c8a",0,0,0,0,0,""
20200702,"LA",61561,,705813,,"posNeg",767374,840,,,,91,,43026,"7/2/2020 13:00","2020-07-02T13:00:00Z","07/02 09:00",3255,,,"2020-07-02T13:00:00Z",767374,,,61561,3147,108,,,,,,,,,,,,,"22",1383,13903,767374,15286,767374,,17,0,"298548ed7663ffc83d2eb5bd8c868ec8c14b57dd",0,0,0,0,0,""
20200701,"LA",60178,,691910,,"posNeg",752088,799,,,,84,,43026,"7/1/2020 13:00","2020-07-01T13:00:00Z","07/01 09:00",3238,,,"2020-07-01T13:00:00Z",752088,,,60178,3130,108,,,,,,,,,,,,,"22",2083,21494,752088,23577,752088,,17,0,"fbe3150e622c4fd4fae238879639c36d30952a09",0,0,0,0,0,""
20200630,"LA",58095,,670416,,"posNeg",728511,781,,,,83,,42225,"6/30/2020 13:00","2020-06-30T13:00:00Z","06/30 09:00",3221,,,"2020-06-30T13:00:00Z",728511,,,58095,3113,108,,,,,,,,,,,,,"22",1014,22860,728511,23874,728511,,22,0,"7050eb411c524fa44660931f7a6a837f4366da73",0,0,0,0,0,""
20200629,"LA",57081,,647556,,"posNeg",704637,737,,,,79,,42225,"6/29/2020 13:00","2020-06-29T13:00:00Z","06/29 09:00",3199,,,"2020-06-29T13:00:00Z",704637,,,57081,3091,108,,,,,,,,,,,,,"22",845,7681,704637,8526,704637,,0,0,"2ce544bc834c0a9a7002d43976557fe5f52f42a3",0,0,0,0,0,""
20200628,"LA",56236,,639875,,"posNeg",696111,715,,,,76,,39792,"6/28/2020 13:00","2020-06-28T13:00:00Z","06/28 09:00",3199,,,"2020-06-28T13:00:00Z",696111,,,56236,3086,113,,,,,,,,,,,,,"22",1467,16638,696111,18105,696111,,9,0,"48965735c401cb29299c28ecfb17558f34228523",0,0,0,0,0,""
20200627,"LA",54769,,623237,,"posNeg",678006,700,,,,73,,39792,"6/26/2020 13:00","2020-06-26T13:00:00Z","06/26 09:00",3190,,,"2020-06-26T13:00:00Z",678006,,,54769,3077,113,,,,,,,,,,,,,"22",0,0,678006,0,678006,,0,0,"bfdfe4b0b4c4aa7f0dc0efc2697196cb641f7d7f",0,0,0,0,0,""
20200626,"LA",54769,,623237,,"posNeg",678006,700,,,,73,,39792,"6/26/2020 13:00","2020-06-26T13:00:00Z","06/26 09:00",3190,,,"2020-06-26T13:00:00Z",678006,,,54769,3077,113,,,,,,,,,,,,,"22",1354,15987,678006,17341,678006,,26,0,"4068c240df92df80743af30489dff13ae81e3df8",0,0,0,0,0,""
20200625,"LA",53415,,607250,,"posNeg",660665,653,,,,77,,39792,"6/25/2020 13:00","2020-06-25T13:00:00Z","06/25 09:00",3164,,,"2020-06-25T13:00:00Z",660665,,,53415,3051,113,,,,,,,,,,,,,"22",938,11222,660665,12160,660665,,12,0,"0fad7c52727a38032d54f80459772daf012e057b",0,0,0,0,0,""
20200624,"LA",52477,,596028,,"posNeg",648505,631,,,,77,,39792,"6/24/2020 13:00","2020-06-24T13:00:00Z","06/24 09:00",3152,,,"2020-06-24T13:00:00Z",648505,,,52477,3039,113,,,,,,,,,,,,,"22",882,11684,648505,12566,648505,,18,0,"e052f8b981dff00cd69c2300266d646bc73a39c2",0,0,0,0,0,""
20200623,"LA",51595,,584344,,"posNeg",635939,646,,,,83,,39792,"6/23/2020 13:00","2020-06-23T13:00:00Z","06/23 09:00",3134,,,"2020-06-23T13:00:00Z",635939,,,51595,3021,113,,,,,,,,,,,,,"22",1356,16519,635939,17875,635939,,17,0,"ee39fbc138a999cdfb6a633b71c07014934b435d",0,0,0,0,0,""
20200622,"LA",50239,,567825,,"posNeg",618064,630,,,,77,,39792,"6/22/2020 13:00","2020-06-22T13:00:00Z","06/22 09:00",3117,,,"2020-06-22T13:00:00Z",618064,,,50239,3004,113,,,,,,,,,,,,,"22",461,6791,618064,7252,618064,,12,0,"54dba08f35a77c763bd54b6b8c63c90e1b8a79a5",0,0,0,0,0,""
20200621,"LA",49778,,561034,,"posNeg",610812,589,,,,69,,37017,"6/21/2020 13:00","2020-06-21T13:00:00Z","06/21 09:00",3105,,,"2020-06-21T13:00:00Z",610812,,,49778,2993,112,,,,,,,,,,,,,"22",393,5603,610812,5996,610812,,1,0,"3f461f1f580acd3f3cafcba775e67d3613e82aea",0,0,0,0,0,""
20200620,"LA",49385,,555431,,"posNeg",604816,574,,,,73,,37017,"6/20/2020 13:00","2020-06-20T13:00:00Z","06/20 09:00",3104,,,"2020-06-20T13:00:00Z",604816,,,49385,2992,112,,,,,,,,,,,,,"22",870,13037,604816,13907,604816,,20,0,"19b374c26b011a3891ff7c82e9c605bbeb38f618",0,0,0,0,0,""
20200619,"LA",48515,,542394,,"posNeg",590909,561,,,,75,,37017,"6/18/2020 13:00","2020-06-18T13:00:00Z","06/18 09:00",3084,,,"2020-06-18T13:00:00Z",590909,,,48515,2972,112,,,,,,,,,,,,,"22",-119,45807,590909,45688,590909,,22,0,"a2171c4566723a1bd9e6802c3fb5020fa53b8025",0,0,0,0,0,""
20200618,"LA",48634,,496587,,"posNeg",545221,585,,,,83,,37017,"6/17/2020 13:00","2020-06-17T13:00:00Z","06/17 09:00",3062,,,"2020-06-17T13:00:00Z",545221,,,48634,2950,112,,,,,,,,,,,,,"22",0,0,545221,0,545221,,0,0,"e4411058715ca5311fa33ce5079b8661482f6f1c",0,0,0,0,0,""
20200617,"LA",48634,,496587,,"posNeg",545221,585,,,,83,,37017,"6/17/2020 13:00","2020-06-17T13:00:00Z","06/17 09:00",3062,,,"2020-06-17T13:00:00Z",545221,,,48634,2950,112,,,,,,,,,,,,,"22",928,11576,545221,12504,545221,,20,0,"94f5e186a8243851b4ae6c03b5ce998d510dad6c",0,0,0,0,0,""
20200616,"LA",47706,,485011,,"posNeg",532717,588,,,,77,,37017,"6/16/2020 13:00","2020-06-16T13:00:00Z","06/16 09:00",3042,,,"2020-06-16T13:00:00Z",532717,,,47706,2930,112,,,,,,,,,,,,,"22",534,13458,532717,13992,532717,,24,0,"98105d2b79c081faaf0ac947dd5aa326179a3387",0,0,0,0,0,""
20200615,"LA",47172,,471553,,"posNeg",518725,568,,,,76,,37017,"6/15/2020 13:00","2020-06-15T13:00:00Z","06/15 09:00",3018,,,"2020-06-15T13:00:00Z",518725,,,47172,2906,112,,,,,,,,,,,,,"22",553,8840,518725,9393,518725,,4,0,"9ac4fe228d503634630ec4c5ac307603d27d882c",0,0,0,0,0,""
20200614,"LA",46619,,462713,,"posNeg",509332,556,,,,76,,33904,"6/14/2020 13:00","2020-06-14T13:00:00Z","06/14 09:00",3014,,,"2020-06-14T13:00:00Z",509332,,,46619,2901,113,,,,,,,,,,,,,"22",336,4613,509332,4949,509332,,10,0,"3494c3b8f020bbb03f625d076a580428598bf121",0,0,0,0,0,""
20200613,"LA",46283,,458100,,"posNeg",504383,542,,,,76,,33904,"6/13/2020 13:00","2020-06-13T13:00:00Z","06/13 09:00",3004,,,"2020-06-13T13:00:00Z",504383,,,46283,2891,113,,,,,,,,,,,,,"22",1288,23561,504383,24849,504383,,8,0,"e2e37e4b67817b9f47c6740fe33becf30372be40",0,0,0,0,0,""
20200612,"LA",44995,,434539,,"posNeg",479534,549,,,,74,,33904,"6/12/2020 13:00","2020-06-12T13:00:00Z","06/12 09:00",2996,,,"2020-06-12T13:00:00Z",479534,,,44995,2883,113,,,,,,,,,,,,,"22",523,9338,479534,9861,479534,,9,0,"83296c31f43ec816fe0b6291ddcb3ae3bef0065f",0,0,0,0,0,""
20200611,"LA",44472,,425201,,"posNeg",469673,553,,,,77,,33904,"6/11/2020 13:00","2020-06-11T13:00:00Z","06/11 09:00",2987,,,"2020-06-11T13:00:00Z",469673,,,44472,2874,113,,,,,,,,,,,,,"22",442,9111,469673,9553,469673,,19,0,"d29d3d1a6fc56eeb5082431eda53377d16d35658",0,0,0,0,0,""
20200610,"LA",44030,,416090,,"posNeg",460120,549,,,,72,,33904,"6/10/2020 13:00","2020-06-10T13:00:00Z","06/10 09:00",2968,,,"2020-06-10T13:00:00Z",460120,,,44030,2855,113,,,,,,,,,,,,,"22",418,6034,460120,6452,460120,,11,0,"28ba0fb9197070b612e85a585153a6fb6b7bbb7f",0,0,0,0,0,""
20200609,"LA",43612,,410056,,"posNeg",453668,568,,,,67,,33904,"6/9/2020 13:00","2020-06-09T13:00:00Z","06/09 09:00",2957,,,"2020-06-09T13:00:00Z",453668,,,43612,2844,113,,,,,,,,,,,,,"22",562,10504,453668,11066,453668,,13,0,"59613216a8c5fcd3a1744f9a955cbe1ab71b3e3b",0,0,0,0,0,""
20200608,"LA",43050,,399552,,"posNeg",442602,582,,,,71,,33904,"6/8/2020 13:00","2020-06-08T13:00:00Z","06/08 09:00",2944,,,"2020-06-08T13:00:00Z",442602,,,43050,2831,113,,,,,,,,,,,,,"22",234,8303,442602,8537,442602,,8,0,"38d61dde02a0a60aaa4784e6293e68d59df24081",0,0,0,0,0,""
20200607,"LA",42816,,391249,,"posNeg",434065,575,,,,74,,31728,"6/7/2020 13:00","2020-06-07T13:00:00Z","06/07 09:00",2936,,,"2020-06-07T13:00:00Z",434065,,,42816,2825,111,,,,,,,,,,,,,"22",330,5666,434065,5996,434065,,11,0,"a59748873feadad788832531ebcc609c2494fecd",0,0,0,0,0,""
20200606,"LA",42486,,385583,,"posNeg",428069,582,,,,77,,31728,"6/6/2020 13:00","2020-06-06T13:00:00Z","06/06 09:00",2925,,,"2020-06-06T13:00:00Z",428069,,,42486,2814,111,,,,,,,,,,,,,"22",497,6786,428069,7283,428069,,13,0,"c7e34649b323582c466ac93c5d6a51252326788d",0,0,0,0,0,""
20200605,"LA",41989,,378797,,"posNeg",420786,604,,,,75,,31728,"6/5/2020 13:00","2020-06-05T13:00:00Z","06/05 09:00",2912,,,"2020-06-05T13:00:00Z",420786,,,41989,2801,111,,,,,,,,,,,,,"22",427,9173,420786,9600,420786,,29,0,"35f1181223f2bbaefe9b987766406f5ecbcc7c33",0,0,0,0,0,""
20200604,"LA",41562,,369624,,"posNeg",411186,613,,,,82,,31728,"6/4/2020 13:00","2020-06-04T13:00:00Z","06/04 09:00",2883,,,"2020-06-04T13:00:00Z",411186,,,41562,2772,111,,,,,,,,,,,,,"22",429,8670,411186,9099,411186,,13,0,"3f937a8508ad784218fffa288df6e6b545d4c1b5",0,0,0,0,0,""
20200603,"LA",41133,,360954,,"posNeg",402087,617,,,,86,,31728,"6/3/2020 13:00","2020-06-03T13:00:00Z","06/03 09:00",2870,,,"2020-06-03T13:00:00Z",402087,,,41133,2759,111,,,,,,,,,,,,,"22",387,8567,402087,8954,402087,,35,0,"4fbd4d6b7efabc3b3bf7128e551af71bc061c73c",0,0,0,0,0,""
20200602,"LA",40746,,352387,,"posNeg",393133,639,,,,83,,31728,"6/2/2020 13:00","2020-06-02T13:00:00Z","06/02 09:00",2835,,,"2020-06-02T13:00:00Z",393133,,,40746,2724,111,,,,,,,,,,,,,"22",405,5358,393133,5763,393133,,34,0,"a0ad12672d0be265832fe7578949892ba43d189d",0,0,0,0,0,""
20200601,"LA",40341,,347029,,"posNeg",387370,661,,,,86,,31728,"6/1/2020 13:00","2020-06-01T13:00:00Z","06/01 09:00",2801,,,"2020-06-01T13:00:00Z",387370,,,40341,2690,111,,,,,,,,,,,,,"22",425,11836,387370,12261,387370,,10,0,"c095caa2a818034a080665c440776a050f7da304",0,0,0,0,0,""
20200531,"LA",39916,,335193,,"posNeg",375109,678,,,,84,,28700,"5/31/2020 13:00","2020-05-31T13:00:00Z","05/31 09:00",2791,,,"2020-05-31T13:00:00Z",375109,,,39916,2686,105,,,,,,,,,,,,,"22",339,5951,375109,6290,375109,,6,0,"0724b932f0c6983fdb53797e290d704898c194eb",0,0,0,0,0,""
20200530,"LA",39577,,329242,,"posNeg",368819,674,,,,84,,28700,"5/30/2020 13:00","2020-05-30T13:00:00Z","05/30 09:00",2785,,,"2020-05-30T13:00:00Z",368819,,,39577,2680,105,,,,,,,,,,,,,"22",775,13017,368819,13792,368819,,19,0,"fe1dd2ceead4893b884982f2c62630b9eec12202",0,0,0,0,0,""
20200529,"LA",38802,,316225,,"posNeg",355027,714,,,,90,,28700,"5/29/2020 13:00","2020-05-29T13:00:00Z","05/29 09:00",2766,,,"2020-05-29T13:00:00Z",355027,,,38802,2661,105,,,,,,,,,,,,,"22",0,0,355027,0,355027,,26,0,"24b4002b1a9305799193907027df9c5acd7f891c",0,0,0,0,0,""
20200528,"LA",38802,,316225,,"posNeg",355027,761,,,,100,,28700,"5/28/2020 13:00","2020-05-28T13:00:00Z","05/28 09:00",2740,,,"2020-05-28T13:00:00Z",355027,,,38802,2635,105,,,,,,,,,,,,,"22",305,7075,355027,7380,355027,,18,0,"02abed101c5fb963f2707e86236a74057a7863af",0,0,0,0,0,""
20200527,"LA",38497,,309150,,"posNeg",347647,798,,,,100,,28700,"5/27/2020 13:00","2020-05-27T13:00:00Z","05/27 09:00",2722,,,"2020-05-27T13:00:00Z",347647,,,38497,2617,105,,,,,,,,,,,,,"22",443,6178,347647,6621,347647,,21,0,"3bd56556097ce6c783c40c6ff13204a854b6982d",0,0,0,0,0,""
20200526,"LA",38054,,302972,,"posNeg",341026,831,,,,103,,28700,"5/26/2020 13:00","2020-05-26T13:00:00Z","05/26 09:00",2701,,,"2020-05-26T13:00:00Z",341026,,,38054,2596,105,,,,,,,,,,,,,"22",245,9883,341026,10128,341026,,11,0,"4ed9a0ad57114aa53bcf1373ea34c0e0003c28ba",0,0,0,0,0,""
20200525,"LA",37809,,293089,,"posNeg",330898,847,,,,102,,28700,"5/25/2020 13:00","2020-05-25T13:00:00Z","05/25 09:00",2690,,,"2020-05-25T13:00:00Z",330898,,,37809,2585,105,,,,,,,,,,,,,"22",640,14222,330898,14862,330898,,0,0,"a12ce87771451fdae46a68a090be5d0770b95549",0,0,0,0,0,""
20200524,"LA",37169,,278867,,"posNeg",316036,813,,,,102,,26249,"5/24/2020 13:00","2020-05-24T13:00:00Z","05/24 09:00",2690,,,"2020-05-24T13:00:00Z",316036,,,37169,2567,123,,,,,,,,,,,,,"22",129,1460,316036,1589,316036,,22,0,"15abebf611fe78bf5093dc06e9b2188840481e4e",0,0,0,0,0,""
20200523,"LA",37040,,277407,,"posNeg",314447,836,,,,112,,26249,"5/23/2020 13:00","2020-05-23T13:00:00Z","05/23 09:00",2668,,,"2020-05-23T13:00:00Z",314447,,,37040,2560,123,,,,,,,,,,,,,"22",115,2524,314447,2639,314447,,0,0,"6b008e613c8ed2056c5ac1d7995d52434953fe8a",0,0,0,0,0,""
20200522,"LA",36925,,274883,,"posNeg",311808,867,,,,104,,26249,"5/22/2020 13:00","2020-05-22T13:00:00Z","05/22 09:00",2668,,,"2020-05-22T13:00:00Z",311808,,,36925,2545,123,,,,,,,,,,,,,"22",421,6006,311808,6427,311808,,39,0,"52970e5ef78da46d9b1c966fa0414c8658ef24ee",0,0,0,0,0,""
20200521,"LA",36504,,268877,,"posNeg",305381,884,,,,107,,26249,"5/21/2020 13:00","2020-05-21T13:00:00Z","05/21 09:00",2629,,,"2020-05-21T13:00:00Z",305381,,,36504,2506,123,,,,,,,,,,,,,"22",1188,18223,305381,19411,305381,,21,0,"4e9243ebd1352db3de0efc685b134e6c4f0fa007",0,0,0,0,0,""
20200520,"LA",35316,,250654,,"posNeg",285970,931,,,,110,,26249,"5/20/2020 13:00","2020-05-20T13:00:00Z","05/20 09:00",2608,,,"2020-05-20T13:00:00Z",285970,,,35316,2485,123,,,,,,,,,,,,,"22",278,7619,285970,7897,285970,,27,0,"6c93eabc75bb165d97372e98457039fc4da10f5c",0,0,0,0,0,""
20200519,"LA",35038,,243035,,"posNeg",278073,1004,,,,112,,26249,"5/19/2020 13:00","2020-05-19T13:00:00Z","05/19 09:00",2581,,,"2020-05-19T13:00:00Z",278073,,,35038,2458,123,,,,,,,,,,,,,"22",329,7996,278073,8325,278073,,18,0,"9a520f65ede29b2987aa06d3f601d76f6cb6ef56",0,0,0,0,0,""
20200518,"LA",34709,,235039,,"posNeg",269748,1031,,,,118,,26249,"5/18/2020 13:00","2020-05-18T13:00:00Z","05/18 09:00",2563,,,"2020-05-18T13:00:00Z",269748,,,34709,2440,123,,,,,,,,,,,,,"22",277,4301,269748,4578,269748,,72,0,"d309ae3469547a85a91280226e5bafd3c28a1112",0,0,0,0,0,""
20200517,"LA",34432,,230738,,"posNeg",265170,1019,,,,111,,22608,"5/17/2020 13:00","2020-05-17T13:00:00Z","05/17 09:00",2491,,,"2020-05-17T13:00:00Z",265170,,,34432,2425,66,,,,,,,,,,,,,"22",315,5113,265170,5428,265170,,12,0,"ad2efcb56ab668b062ebfcc1630ca11e879fbdec",0,0,0,0,0,""
20200516,"LA",34117,,225625,,"posNeg",259742,1028,,,,123,,22608,"5/16/2020 13:00","2020-05-16T13:00:00Z","05/16 09:00",2479,,,"2020-05-16T13:00:00Z",259742,,,34117,2413,66,,,,,,,,,,,,,"22",280,6273,259742,6553,259742,,31,0,"815e1994e9c9c0ab3459aba7b0e3f37b13ef2e8b",0,0,0,0,0,""
20200515,"LA",33837,,219352,,"posNeg",253189,1091,,,,132,,22608,"5/15/2020 13:00","2020-05-15T13:00:00Z","05/15 09:00",2448,,,"2020-05-15T13:00:00Z",253189,,,33837,2382,66,,,,,,,,,,,,,"22",348,5253,253189,5601,253189,,31,0,"57cda3afd16b3c31e07df671bf10e62909930a08",0,0,0,0,0,""
20200514,"LA",33489,,214099,,"posNeg",247588,1193,,,,140,,22608,"5/14/2020 13:00","2020-05-14T13:00:00Z","05/14 09:00",2417,,,"2020-05-14T13:00:00Z",237904,,,33489,2351,66,,,,,,,,,,,,,"22",827,8857,247588,9684,247588,,36,0,"6c3480fbb57141be4947ad21a4ed317b9199b604",0,0,0,0,0,""
20200513,"LA",32662,,205242,,"posNeg",237904,1194,,,,147,,22608,"5/13/2020 13:00","2020-05-13T13:00:00Z","05/13 09:00",2381,,,"2020-05-13T13:00:00Z",228012,,,32662,2315,66,,,,,,,,,,,,,"22",612,9280,237904,9892,237904,,34,0,"a86b5cf8ea671047a28129fa0db3316de9c03b9e",0,0,0,0,0,""
20200512,"LA",32050,,195962,,"posNeg",228012,1320,,,,146,,22608,"5/12/2020 13:00","2020-05-12T13:00:00Z","05/12 09:00",2347,,,"2020-05-12T13:00:00Z",,,,32050,2281,66,,,,,,,,,,,,,"22",235,6947,228012,7182,228012,,39,0,"44bb53f0ff78ac2b6b086988d81b3b41110235e1",0,0,0,0,0,""
20200511,"LA",31815,,189015,,"posNeg",220830,1310,,,,157,,22608,"5/11/2020 13:00","2020-05-11T13:00:00Z","05/11 09:00",2308,,,"2020-05-11T13:00:00Z",,,,31815,2242,66,,,,,,,,,,,,,"22",215,4743,220830,4958,220830,,22,0,"9f69ec9469a0188cbcc74380cd3fe527769633a8",0,0,0,0,0,""
20200510,"LA",31600,,184272,,"posNeg",215872,1324,,,,161,,20316,"5/10/2020 13:00","2020-05-10T13:00:00Z","05/10 09:00",2286,,,"2020-05-10T13:00:00Z",,,,31600,2213,73,,,,,,,,,,,,,"22",183,3532,215872,3715,215872,,19,0,"7434aec928135bcd929afb7b18b5e9ccc670218b",0,0,0,0,0,""
20200509,"LA",31417,,180740,,"posNeg",212157,1333,,,,165,,20316,"5/9/2020 13:00","2020-05-09T13:00:00Z","05/09 09:00",2267,,,"2020-05-09T13:00:00Z",,,,31417,2194,73,,,,,,,,,,,,,"22",562,9179,212157,9741,212157,,40,0,"f023b6e4251ab298e2c3370e5ed28d855df73b96",0,0,0,0,0,""
20200508,"LA",30855,,171561,,"posNeg",202416,1359,,,,185,,20316,"5/8/2020 13:00","2020-05-08T13:00:00Z","05/08 09:00",2227,,,"2020-05-08T13:00:00Z",,,,30855,2154,73,,,,,,,,,,,,,"22",203,1446,202416,1649,202416,,19,0,"fce444666513c0744806a05b3782223435ec0b7c",0,0,0,0,0,""
20200507,"LA",30652,,170115,,"posNeg",200767,1432,,,,189,,20316,"5/7/2020 13:00","2020-05-07T13:00:00Z","05/07 09:00",2208,,,"2020-05-07T13:00:00Z",,,,30652,2135,73,,,,,,,,,,,,,"22",253,5842,200767,6095,200767,,93,0,"7a4f884ef0ab106ad13144898916acad99d4f83a",0,0,0,0,0,""
20200506,"LA",30399,,164273,,"posNeg",194672,1465,,,,187,,20316,"5/6/2020 16:30","2020-05-06T16:30:00Z","05/06 12:30",2115,,,"2020-05-06T16:30:00Z",,,,30399,2042,73,,,,,,,,,,,,,"22",403,6038,194672,6441,194672,,0,0,"953570b3bfd51651d34b88083f45d48096b53fbf",0,0,0,0,0,""
20200505,"LA",29996,,158235,,"posNeg",188231,1512,,,,194,,20316,"5/5/2020 13:00","2020-05-05T13:00:00Z","05/05 09:00",2115,,,"2020-05-05T13:00:00Z",,,,29996,2042,73,,,,,,,,,,,,,"22",323,6977,188231,7300,188231,,51,0,"8a7bf8012d0b7e6583d4e08f9dcaa02ac18eca15",0,0,0,0,0,""
20200504,"LA",29673,,151258,,"posNeg",180931,1502,,,,220,,20316,"5/4/2020 13:00","2020-05-04T13:00:00Z","05/04 09:00",2064,,,"2020-05-04T13:00:00Z",,,,29673,1991,73,,,,,,,,,,,,,"22",333,4438,180931,4771,180931,,52,0,"99d98ec54cad2421d60ef9ae67e6c7f52034ebad",0,0,0,0,0,""
20200503,"LA",29340,,146820,,"posNeg",176160,1530,,,,213,,17303,"5/3/2020 13:00","2020-05-03T13:00:00Z","05/03 09:00",2012,,,"2020-05-03T13:00:00Z",,,,29340,1969,43,,,,,,,,,,,,,"22",200,3102,176160,3302,176160,,19,0,"69ad3dca7d8d6a641a81a9913f56698c58c08c5b",0,0,0,0,0,""
20200502,"LA",29140,,143718,,"posNeg",172858,1545,,,,208,,17303,"5/2/2020 13:00","2020-05-02T13:00:00Z","05/02 09:00",1993,,,"2020-05-02T13:00:00Z",,,,29140,1950,43,,,,,,,,,,,,,"22",429,4178,172858,4607,172858,,23,0,"206230aef62ca16288dc472c8be4f29c6a9d869c",0,0,0,0,0,""
20200501,"LA",28711,,139540,,"posNeg",168251,1607,,,,230,,17303,"5/1/2020 13:00","2020-05-01T13:00:00Z","05/01 09:00",1970,,,"2020-05-01T13:00:00Z",,,,28711,1927,43,,,,,,,,,,,,,"22",710,6232,168251,6942,168251,,65,0,"b8bac7fc3ab22201b841c36156084b3674e0b4f1",0,0,0,0,0,""
20200430,"LA",28001,,133308,,"posNeg",161309,1601,,,,231,,17303,"4/30/2020 13:00","2020-04-30T13:00:00Z","04/30 09:00",1905,,,"2020-04-30T13:00:00Z",,,,28001,1862,43,,,,,,,,,,,,,"22",341,4400,161309,4741,161309,,60,0,"4ef791ebeb5c4f629bfbd3b74d5b2e0ea72f5596",0,0,0,0,0,""
20200429,"LA",27660,,128908,,"posNeg",156568,1629,,,,244,,17303,"4/29/2020 13:00","2020-04-29T13:00:00Z","04/29 09:00",1845,,,"2020-04-29T13:00:00Z",,,,27660,1802,43,,,,,,,,,,,,,"22",374,5086,156568,5460,156568,,44,0,"2042bc7aa46ce2763cba0897c2349db97d489e28",0,0,0,0,0,""
20200428,"LA",27286,,123822,,"posNeg",151108,1666,,,,244,,17303,"4/28/2020 13:00","2020-04-28T13:00:00Z","04/28 09:00",1801,,,"2020-04-28T13:00:00Z",,,,27286,1758,43,,,,,,,,,,,,,"22",218,3901,151108,4119,151108,,61,0,"797557d38a7b7bd3e47e3c25f785bb94c76c2f58",0,0,0,0,0,""
20200427,"LA",27068,,119921,,"posNeg",146989,1683,,,,262,,17303,"4/27/2020 13:00","2020-04-27T13:00:00Z","04/27 09:00",1740,,,"2020-04-27T13:00:00Z",,,,27068,1697,43,,,,,,,,,,,,,"22",295,3658,146989,3953,146989,,11,0,"8b1671c809298860c168adccd68818d3f37bfad1",0,0,0,0,0,""
20200426,"LA",26773,,116263,,"posNeg",143036,1701,,,,265,,14927,"4/26/2020 13:00","2020-04-26T13:00:00Z","04/26 09:00",1729,,,"2020-04-26T13:00:00Z",,,,26773,1670,59,,,,,,,,,,,,,"22",261,3773,143036,4034,143036,,26,0,"cf0c31a4dea813c6d804408cc79ebceb0b579c5c",0,0,0,0,0,""
20200425,"LA",26512,,112490,,"posNeg",139002,1700,,,,268,,14927,"4/25/2020 13:00","2020-04-25T13:00:00Z","04/25 09:00",1703,,,"2020-04-25T13:00:00Z",,,,26512,1644,59,,,,,,,,,,,,,"22",372,518,139002,890,139002,,43,0,"11850c499361610cd6bdeddd35badee9f7243b7a",0,0,0,0,0,""
20200424,"LA",26140,,111972,,"posNeg",138112,1697,,,,286,,14927,"4/24/2020 13:00","2020-04-24T13:00:00Z","04/24 09:00",1660,,,"2020-04-24T13:00:00Z",,,,26140,1601,59,,,,,,,,,,,,,"22",401,198,138112,599,138112,,61,0,"6309b140f0ebc15194b7af375490a83cf1c4c8d0",0,0,0,0,0,""
20200423,"LA",25739,,111774,,"posNeg",137513,1727,,,,274,,14927,"4/23/2020 13:00","2020-04-23T13:00:00Z","04/23 09:00",1599,,,"2020-04-23T13:00:00Z",,,,25739,1540,59,,,,,,,,,,,,,"22",481,186,137513,667,137513,,67,0,"69b561722de9ab3d5a0db7f73a3da34e44eeb972",0,0,0,0,0,""
20200422,"LA",25258,,111588,,"posNeg",136846,1747,,,,287,,14927,"4/22/2020 13:00","2020-04-22T13:00:00Z","04/22 09:00",1532,,,"2020-04-22T13:00:00Z",,,,25258,1473,59,,,,,,,,,,,,,"22",404,0,136846,404,136846,,127,0,"40e4e75444f14bf919c2a68f2217b372f3a14d78",0,0,0,0,0,""
20200421,"LA",24854,,111588,,"posNeg",136442,1798,,,,297,,,"4/21/2020 13:00","2020-04-21T13:00:00Z","04/21 09:00",1405,,,"2020-04-21T13:00:00Z",,,,24854,,,,,,,,,,,,,,,"22",331,0,136442,331,136442,,77,0,"ae6f94ea79ae1f9c09b22c2f9eface8d182ad4fe",0,0,0,0,0,""
20200420,"LA",24523,,111588,,"posNeg",136111,1794,,,,332,,,"4/20/2020 13:00","2020-04-20T13:00:00Z","04/20 09:00",1328,,,"2020-04-20T13:00:00Z",,,,24523,,,,,,,,,,,,,,,"22",595,168,136111,763,136111,,32,0,"98b7864074ace1ddc2895566a1528d86486fecf7",0,0,0,0,0,""
20200419,"LA",23928,,111420,,"posNeg",135348,1748,,,,349,,,"4/19/2020 13:00","2020-04-19T13:00:00Z","04/19 09:00",1296,,,"2020-04-19T13:00:00Z",,,,23928,,,,,,,,,,,,,,,"22",348,-2999,135348,-2651,135348,,29,0,"45db5443a5f326c20f3f6ec61a96bc34d6d82099",0,0,0,0,0,""
20200418,"LA",23580,,114419,,"posNeg",137999,1761,,,,347,,,"4/18/2020 13:00","2020-04-18T13:00:00Z","04/18 09:00",1267,,,"2020-04-18T13:00:00Z",,,,23580,,,,,,,,,,,,,,,"22",462,5550,137999,6012,137999,,54,0,"daf07334b629601f1646d2d79b7edca8f7f8d8de",0,0,0,0,0,""
20200417,"LA",23118,,108869,,"posNeg",131987,1868,,,,363,,,"4/17/2020 13:00","2020-04-17T13:00:00Z","04/17 09:00",1213,,,"2020-04-17T13:00:00Z",,,,23118,,,,,,,,,,,,,,,"22",586,4815,131987,5401,131987,,57,0,"0c7709fe868386017bcb185827d42d997ceca4e9",0,0,0,0,0,""
20200416,"LA",22532,,104054,,"posNeg",126586,1914,,,,396,,,"4/16/2020 13:00","2020-04-16T13:00:00Z","04/16 09:00",1156,,,"2020-04-16T13:00:00Z",,,,22532,,,,,,,,,,,,,,,"22",581,4077,126586,4658,126586,,53,0,"a297d444580a8f51ad9e6eff7f506d408dc0831f",0,0,0,0,0,""
20200415,"LA",21951,,99977,,"posNeg",121928,1943,,,,425,,,"4/15/2020 13:00","2020-04-15T13:00:00Z","04/15 09:00",1103,,,"2020-04-15T13:00:00Z",,,,21951,,,,,,,,,,,,,,,"22",433,3073,121928,3506,121928,,90,0,"f29fe7b7ed04f2b0d2e7243a66420a02dfd16b0e",0,0,0,0,0,""
20200414,"LA",21518,,96904,,"posNeg",118422,1977,,,,436,,,"4/13/2020 13:00","2020-04-13T13:00:00Z","04/13 09:00",1013,,,"2020-04-13T13:00:00Z",,,,21518,,,,,,,,,,,,,,,"22",502,9829,118422,10331,118422,,129,0,"21a17a255862ba1654d79bf0e1d744066d71503f",0,0,0,0,0,""
20200413,"LA",21016,,87075,,"posNeg",108091,2134,,,,461,,,"4/13/2020 13:00","2020-04-13T13:00:00Z","04/13 09:00",884,,,"2020-04-13T13:00:00Z",,,,21016,,,,,,,,,,,,,,,"22",421,3625,108091,4046,108091,,44,0,"d9888d65e2a2aa59e80a182cc47d24276206fe09",0,0,0,0,0,""
20200412,"LA",20595,,83450,,"posNeg",104045,2084,,,,458,,,"4/12/2020 13:00","2020-04-12T13:00:00Z","04/12 09:00",840,,,"2020-04-12T13:00:00Z",,,,20595,,,,,,,,,,,,,,,"22",581,6549,104045,7130,104045,,34,0,"a8c96cecc5af45ef5c16f82b0709b05a6e8e008c",0,0,0,0,0,""
20200411,"LA",20014,,76901,,"posNeg",96915,2067,,,,470,,,"4/11/2020 13:00","2020-04-11T13:00:00Z","04/11 09:00",806,,,"2020-04-11T13:00:00Z",,,,20014,,,,,,,,,,,,,,,"22",761,3874,96915,4635,96915,,51,0,"32e0c6cd7de27d184c456c5ad39d1d06bd813147",0,0,0,0,0,""
20200410,"LA",19253,,73027,,"posNeg",92280,2054,,,,479,,,"4/10/2020 13:00","2020-04-10T13:00:00Z","04/10 09:00",755,,,"2020-04-10T13:00:00Z",,,,19253,,,,,,,,,,,,,,,"22",970,4391,92280,5361,92280,,53,0,"49c3ec2cdcc2e615648d35bae0382ffbd0b4fcd7",0,0,0,0,0,""
20200409,"LA",18283,,68636,,"posNeg",86919,2014,,,,473,,,"4/9/2020 13:00","2020-04-09T13:00:00Z","04/09 09:00",702,,,"2020-04-09T13:00:00Z",,,,18283,,,,,,,,,,,,,,,"22",1253,4260,86919,5513,86919,,50,0,"6d715d35cb3c9009c97f6f5bbb8f4d9f91dd52d9",0,0,0,0,0,""
20200408,"LA",17030,,64376,,"posNeg",81406,1983,,,,490,,,"4/8/2020 13:00","2020-04-08T13:00:00Z","04/08 09:00",652,,,"2020-04-08T13:00:00Z",,,,17030,,,,,,,,,,,,,,,"22",746,6005,81406,6751,81406,,70,0,"8e27aef8efbd59ab46123081b842c817141e2436",0,0,0,0,0,""
20200407,"LA",16284,,58371,,"posNeg",74655,1996,,,,519,,,"4/7/2020 13:00","2020-04-07T13:00:00Z","04/07 09:00",582,,,"2020-04-07T13:00:00Z",,,,16284,,,,,,,,,,,,,,,"22",1417,4072,74655,5489,74655,,70,0,"d92a295444375ad8086737b881363dfca01af2b0",0,0,0,0,0,""
20200406,"LA",14867,,54299,,"posNeg",69166,1981,,,,552,,,"4/6/2020 13:00","2020-04-06T13:00:00Z","04/06 09:00",512,,,"2020-04-06T13:00:00Z",,,,14867,,,,,,,,,,,,,,,"22",1857,6984,69166,8841,69166,,35,0,"c7503ebc4572efaf9e8e2ff4f6f7a90f46b537a2",0,0,0,0,0,""
20200405,"LA",13010,,47315,,"posNeg",60325,1803,,,,561,,,"4/5/2020 13:00","2020-04-05T13:00:00Z","04/05 09:00",477,,,"2020-04-05T13:00:00Z",,,,13010,,,,,,,,,,,,,,,"22",514,1313,60325,1827,60325,,68,0,"bcf8ca192ada09919ca4d4028c49aa06bbe9c5bf",0,0,0,0,0,""
20200404,"LA",12496,,46002,,"posNeg",58498,1726,,,,571,,,"4/4/2020 13:40","2020-04-04T13:40:00Z","04/04 09:40",409,,,"2020-04-04T13:40:00Z",,,,12496,,,,,,,,,,,,,,,"22",2199,2654,58498,4853,58498,,39,0,"d293bd0b03c3b11fdde3e40e961e742f61ce9724",0,0,0,0,0,""
20200403,"LA",10297,,43348,,"posNeg",53645,1707,,,,535,,,"4/3/2020 13:00","2020-04-03T13:00:00Z","04/03 09:00",370,,,"2020-04-03T13:00:00Z",,,,10297,,,,,,,,,,,,,,,"22",1147,1412,53645,2559,53645,,60,0,"2e8d730e4fac52d2f8b3df1da874d4ec2398f555",0,0,0,0,0,""
20200402,"LA",9150,,41936,,"posNeg",51086,1639,,,,507,,,"4/2/2020 13:00","2020-04-02T13:00:00Z","04/02 09:00",310,,,"2020-04-02T13:00:00Z",,,,9150,,,,,,,,,,,,,,,"22",2726,2584,51086,5310,51086,,37,0,"7448897f1c467f7200807326f17bdd865d8e3392",0,0,0,0,0,""
20200401,"LA",6424,,39352,,"posNeg",45776,1498,,,,490,,,"4/1/2020 13:00","2020-04-01T13:00:00Z","04/01 09:00",273,,,"2020-04-01T13:00:00Z",,,,6424,,,,,,,,,,,,,,,"22",1187,5622,45776,6809,45776,,34,0,"481619aaeeec7ecd97f5d0486ff078bf987cd114",0,0,0,0,0,""
20200331,"LA",5237,,33730,,"posNeg",38967,1355,,,,438,,,"3/31/2020 13:00","2020-03-31T13:00:00Z","03/31 09:00",239,,,"2020-03-31T13:00:00Z",,,,5237,,,,,,,,,,,,,,,"22",1212,3722,38967,4934,38967,,54,0,"f90e1bbadfa77408959b428b4403f42eda70dc14",0,0,0,0,0,""
20200330,"LA",4025,,30008,,"posNeg",34033,1185,,,,385,,,"3/30/2020 13:00","2020-03-30T13:00:00Z","03/30 09:00",185,,,"2020-03-30T13:00:00Z",,,,4025,,,,,,,,,,,,,,,"22",485,5677,34033,6162,34033,,34,0,"820f9be934b54e59d4ccdd5c652e2157ce509e6c",0,0,0,0,0,""
20200329,"LA",3540,,24331,,"posNeg",27871,1127,,,,380,,,"3/29/2020 13:00","2020-03-29T13:00:00Z","03/29 09:00",151,,,"2020-03-29T13:00:00Z",,,,3540,,,,,,,,,,,,,,,"22",225,2485,27871,2710,27871,,14,0,"10222aa65a84df900f641e3ce2535d8406b5e618",0,0,0,0,0,""
