"date","state","positive","probableCases","negative","pending","totalTestResultsSource","totalTestResults","hospitalizedCurrently","hospitalizedCumulative","inIcuCurrently","inIcuCumulative","onVentilatorCurrently","onVentilatorCumulative","recovered","lastUpdateEt","dateModified","checkTimeEt","death","hospitalized","hospitalizedDischarged","dateChecked","totalTestsViral","positiveTestsViral","negativeTestsViral","positiveCasesViral","deathConfirmed","deathProbable","totalTestEncountersViral","totalTestsPeopleViral","totalTestsAntibody","positiveTestsAntibody","negativeTestsAntibody","totalTestsPeopleAntibody","positiveTestsPeopleAntibody","negativeTestsPeopleAntibody","totalTestsPeopleAntigen","positiveTestsPeopleAntigen","totalTestsAntigen","positiveTestsAntigen","fips","positiveIncrease","negativeIncrease","total","totalTestResultsIncrease","posNeg","dataQualityGrade","deathIncrease","hospitalizedIncrease","hash","commercialScore","negativeRegularScore","negativeScore","positiveScore","score","grade"
20210307,"MD",387319,,3034546,,"totalTestsViral",8097590,818,35651,215,,,,9703,"3/7/2021 10:00","2021-03-07T10:00:00Z","03/07 05:00",7955,35651,,"2021-03-07T10:00:00Z",8097590,472716,,387319,7773,182,,3421865,,,,198139,28360,169779,,,,,"24",709,2050,3421865,33128,3421865,,14,79,"f0e2e509e56cd4e825ca3673d540a4c6329c9a0c",0,0,0,0,0,""
20210306,"MD",386610,,3032496,,"totalTestsViral",8064462,830,35572,230,,,,9703,"3/6/2021 10:00","2021-03-06T10:00:00Z","03/06 05:00",7941,35572,,"2021-03-06T10:00:00Z",8064462,471762,,386610,7759,182,,3419106,,,,198139,28360,169779,,,,,"24",932,7547,3419106,40384,3419106,,11,194,"c927a3becc363cd3e0a87f102604ad7e0936f374",0,0,0,0,0,""
20210305,"MD",385678,,3024949,,"totalTestsViral",8024078,849,35378,229,,,,9701,"3/5/2021 10:00","2021-03-05T10:00:00Z","03/05 05:00",7930,35378,,"2021-03-05T10:00:00Z",8024078,470625,,385678,7748,182,,3410627,,,,198139,28360,169779,,,,,"24",913,6829,3410627,41728,3410627,,8,74,"1b66a874746c78e6a387ab3204f547ff4e59ee1b",0,0,0,0,0,""
20210304,"MD",384765,,3018120,,"totalTestsViral",7982350,856,35304,216,,,,9691,"3/4/2021 10:00","2021-03-04T10:00:00Z","03/04 05:00",7922,35304,,"2021-03-04T10:00:00Z",7982350,469489,,384765,7740,182,,3402885,,,,198139,28360,169779,,,,,"24",809,5941,3402885,33723,3402885,,3,81,"8cffb6b54a5438e9ecf97a0db058e225cd5d803e",0,0,0,0,0,""
20210303,"MD",383956,,3012179,,"totalTestsViral",7948627,863,35223,228,,,,9685,"3/3/2021 10:00","2021-03-03T10:00:00Z","03/03 05:00",7919,35223,,"2021-03-03T10:00:00Z",7948627,468532,,383956,7737,182,,3396135,,,,198139,28360,169779,,,,,"24",786,5489,3396135,31296,3396135,,14,71,"e4dc756557737d0956a9ffabd874d89017db4064",0,0,0,0,0,""
20210302,"MD",383170,,3006690,,"totalTestsViral",7917331,896,35152,232,,,,9677,"3/2/2021 10:00","2021-03-02T10:00:00Z","03/02 05:00",7905,35152,,"2021-03-02T10:00:00Z",7917331,467555,,383170,7723,182,,3389860,,,,195908,27357,168551,,,,,"24",468,2973,3389860,11040,3389860,,26,83,"6a0503f51019058c3fdbc8b76aef64ac8a9e3da5",0,0,0,0,0,""
20210301,"MD",382702,,3003717,,"totalTestsViral",7906291,904,35069,235,,,,9669,"3/1/2021 10:00","2021-03-01T10:00:00Z","03/01 05:00",7879,35069,,"2021-03-01T10:00:00Z",7906291,466972,,382702,7697,182,,3386419,,,,195908,27357,168551,,,,,"24",603,4132,3386419,19263,3386419,,10,69,"e7aa3a03c41c099682ac5cdd25d3bcf85570e1b5",0,0,0,0,0,""
20210228,"MD",382099,,2999585,,"totalTestsViral",7887028,868,35000,240,,,,9667,"2/28/2021 10:00","2021-02-28T10:00:00Z","02/28 05:00",7869,35000,,"2021-02-28T10:00:00Z",7887028,466224,,382099,7687,182,,3381684,,,,195908,27357,168551,,,,,"24",827,6487,3381684,38783,3381684,,13,73,"ec000ebef1b76c2f74bc08144afd8cbac36da800",0,0,0,0,0,""
20210227,"MD",381272,,2993098,,"totalTestsViral",7848245,892,34927,222,,,,9659,"2/27/2021 10:00","2021-02-27T10:00:00Z","02/27 05:00",7856,34927,,"2021-02-27T10:00:00Z",7848245,465175,,381272,7674,182,,3374370,,,,195908,27357,168551,,,,,"24",836,6547,3374370,44150,3374370,,18,79,"5739f3bcdfadd3f68f438e7ba043d3de894e8cb7",0,0,0,0,0,""
20210226,"MD",380436,,2986551,,"totalTestsViral",7804095,943,34848,245,,,,9643,"2/26/2021 10:00","2021-02-26T10:00:00Z","02/26 05:00",7838,34848,,"2021-02-26T10:00:00Z",7804095,464138,,380436,7656,182,,3366987,,,,195908,27357,168551,,,,,"24",970,7420,3366987,48121,3366987,,33,89,"bb481dfaa670222aacc0511687b1606d59c42813",0,0,0,0,0,""
20210225,"MD",379466,,2979131,,"totalTestsViral",7755974,952,34759,243,,,,9635,"2/25/2021 10:00","2021-02-25T10:00:00Z","02/25 05:00",7805,34759,,"2021-02-25T10:00:00Z",7755974,463130,,379466,7623,182,,3358597,,,,195908,27357,168551,,,,,"24",976,6531,3358597,37184,3358597,,16,87,"c37a397a86df19619348aacb04c7c8acd1888565",0,0,0,0,0,""
20210224,"MD",378490,,2972600,,"totalTestsViral",7718790,960,34672,249,,,,9626,"2/24/2021 10:00","2021-02-24T10:00:00Z","02/24 05:00",7789,34672,,"2021-02-24T10:00:00Z",7718790,461976,,378490,7607,182,,3351090,,,,195908,27357,168551,,,,,"24",862,4940,3351090,29249,3351090,,27,95,"8afa92b3dbfa48b52dd9c4e402f19912b41811e7",0,0,0,0,0,""
20210223,"MD",377628,,2967660,,"totalTestsViral",7689541,978,34577,258,,,,9606,"2/23/2021 10:00","2021-02-23T10:00:00Z","02/23 05:00",7762,34577,,"2021-02-23T10:00:00Z",7689541,460924,,377628,7580,182,,3345288,,,,193813,26456,167357,,,,,"24",662,2964,3345288,12535,3345288,,30,84,"e88323f03a2a5d8d7edbb51de2901c7ba91fea80",0,0,0,0,0,""
20210222,"MD",376966,,2964696,,"totalTestsViral",7677006,992,34493,276,,,,9606,"2/22/2021 10:00","2021-02-22T10:00:00Z","02/22 05:00",7732,34493,,"2021-02-22T10:00:00Z",7677006,460098,,376966,7550,182,,3341662,,,,193813,26456,167357,,,,,"24",611,3993,3341662,22188,3341662,,17,54,"1daf201b0c835a98def70adbfc78ca788a8c5fa4",0,0,0,0,0,""
20210221,"MD",376355,,2960703,,"totalTestsViral",7654818,973,34439,284,,,,9606,"2/21/2021 10:00","2021-02-21T10:00:00Z","02/21 05:00",7715,34439,,"2021-02-21T10:00:00Z",7654818,457509,,376355,7533,182,,3337058,,,,193813,26456,167357,,,,,"24",618,4386,3337058,32164,3337058,,18,84,"d5ec0e648b3cc4456a7e13cddc16deb9ad1c2399",0,0,0,0,0,""
20210220,"MD",375737,,2956317,,"totalTestsViral",7622654,1049,34355,278,,,,9600,"2/20/2021 10:00","2021-02-20T10:00:00Z","02/20 05:00",7697,34355,,"2021-02-20T10:00:00Z",7622654,457509,,375737,7515,182,,3332054,,,,193813,26456,167357,,,,,"24",763,4882,3332054,25434,3332054,,20,90,"eda2b2f686154c2272a5da0463ead5ff569ef871",0,0,0,0,0,""
20210219,"MD",374974,,2951435,,"totalTestsViral",7597220,1016,34265,272,,,,9591,"2/19/2021 10:00","2021-02-19T10:00:00Z","02/19 05:00",7677,34265,,"2021-02-19T10:00:00Z",7597220,457509,,374974,7495,182,,3326409,,,,193813,26456,167357,,,,,"24",1008,6451,3326409,42207,3326409,,16,97,"0d80f13ef0fd062c5ae0a3a5f17b051697715cc9",0,0,0,0,0,""
20210218,"MD",373966,,2944984,,"totalTestsViral",7555013,1048,34168,279,,,,9587,"2/18/2021 10:00","2021-02-18T10:00:00Z","02/18 05:00",7661,34168,,"2021-02-18T10:00:00Z",7555013,456223,,373966,7479,182,,3318950,,,,193813,26456,167357,,,,,"24",986,6568,3318950,35950,3318950,,31,90,"6fbd3f84fcbdde529ec620a1316a63d10097860f",0,0,0,0,0,""
20210217,"MD",372980,,2938416,,"totalTestsViral",7519063,1096,34078,272,,,,9571,"2/17/2021 10:00","2021-02-17T10:00:00Z","02/17 05:00",7630,34078,,"2021-02-17T10:00:00Z",7519063,454985,,372980,7449,181,,3311396,,,,193813,26456,167357,,,,,"24",759,4835,3311396,23155,3311396,,18,98,"eebf269b435786e930bf37842b24652f44262708",0,0,0,0,0,""
20210216,"MD",372221,,2933581,,"totalTestsViral",7495908,1110,33980,293,,,,9571,"2/16/2021 10:00","2021-02-16T10:00:00Z","02/16 05:00",7612,33980,,"2021-02-16T10:00:00Z",7495908,453991,,372221,7430,182,,3305802,,,,191877,25610,166267,,,,,"24",516,2843,3305802,9967,3305802,,32,77,"fc83b73d0d718c4c036314b61a0b434888248485",0,0,0,0,0,""
20210215,"MD",371705,,2930738,,"totalTestsViral",7485941,1113,33903,285,,,,9569,"2/15/2021 10:00","2021-02-15T10:00:00Z","02/15 05:00",7580,33903,,"2021-02-15T10:00:00Z",7485941,453329,,371705,7400,180,,3302443,,,,191877,25610,166267,,,,,"24",722,4336,3302443,19761,3302443,,26,95,"246adad89cdfba788414c057d3d910070e121838",0,0,0,0,0,""
20210214,"MD",370983,,2926402,,"totalTestsViral",7466180,1166,33808,293,,,,9569,"2/14/2021 10:00","2021-02-14T10:00:00Z","02/14 05:00",7554,33808,,"2021-02-14T10:00:00Z",7466180,452414,,370983,7374,180,,3297385,,,,191877,25610,166267,,,,,"24",847,5051,3297385,36438,3297385,,18,80,"08b36274a546e22efe603738e99d96a6baf41cfe",0,0,0,0,0,""
20210213,"MD",370136,,2921351,,"totalTestsViral",7429742,1192,33728,316,,,,9565,"2/13/2021 10:00","2021-02-13T10:00:00Z","02/13 05:00",7536,33728,,"2021-02-13T10:00:00Z",7429742,451276,,370136,7356,180,,3291487,,,,191877,25610,166267,,,,,"24",1159,7608,3291487,41128,3291487,,33,99,"1208753f2a86983b053f871b21a7b7d71c7b1374",0,0,0,0,0,""
20210212,"MD",368977,,2913743,,"totalTestsViral",7388614,1225,33629,326,,,,9559,"2/12/2021 10:00","2021-02-12T10:00:00Z","02/12 05:00",7503,33629,,"2021-02-12T10:00:00Z",7388614,449777,,368977,7324,179,,3282720,,,,191877,25610,166267,,,,,"24",1112,7812,3282720,44606,3282720,,36,121,"b8268e52bf90a143430bffebcbef2250f235fe3d",0,0,0,0,0,""
20210211,"MD",367865,,2905931,,"totalTestsViral",7344008,1272,33508,324,,,,9554,"2/11/2021 10:00","2021-02-11T10:00:00Z","02/11 05:00",7467,33508,,"2021-02-11T10:00:00Z",7344008,448364,,367865,7288,179,,3273796,,,,191877,25610,166267,,,,,"24",1199,7395,3273796,39191,3273796,,21,110,"42c3fd5b88b4c0ccdca0b8d1e629f8b471ad26ea",0,0,0,0,0,""
20210210,"MD",366666,,2898536,,"totalTestsViral",7304817,1282,33398,324,,,,9526,"2/10/2021 10:00","2021-02-10T10:00:00Z","02/10 05:00",7446,33398,,"2021-02-10T10:00:00Z",7304817,446903,,366666,7267,179,,3265202,,,,191877,25610,166267,,,,,"24",1137,4880,3265202,30366,3265202,,33,110,"a4954b65dc021ccb15c1df55b65dc66f467d5bd6",0,0,0,0,0,""
20210209,"MD",365529,,2893656,,"totalTestsViral",7274451,1377,33288,326,,,,9526,"2/9/2021 10:00","2021-02-09T10:00:00Z","02/09 05:00",7413,33288,,"2021-02-09T10:00:00Z",7274451,445481,,365529,7234,179,,3259185,,,,189428,24579,164849,,,,,"24",976,3417,3259185,14360,3259185,,41,101,"439c796572bff55e14f8ac166caa22ef8dcff93a",0,0,0,0,0,""
20210208,"MD",364553,,2890239,,"totalTestsViral",7260091,1413,33187,318,,,,9526,"2/8/2021 10:00","2021-02-08T10:00:00Z","02/08 05:00",7372,33187,,"2021-02-08T10:00:00Z",7260091,444221,,364553,7193,179,,3254792,,,,189428,24579,164849,,,,,"24",903,5187,3254792,22844,3254792,,23,122,"04f4fb93648048c2d7298142fa791fcf4fdd2311",0,0,0,0,0,""
20210207,"MD",363650,,2885052,,"totalTestsViral",7237247,1402,33065,326,,,,9525,"2/7/2021 10:00","2021-02-07T10:00:00Z","02/07 05:00",7349,33065,,"2021-02-07T10:00:00Z",7237247,443007,,363650,7170,179,,3248702,,,,189428,24579,164849,,,,,"24",1566,8174,3248702,48609,3248702,,20,202,"5ee6d238edbcb254f572208e299aeac18a4daada",0,0,0,0,0,""
20210206,"MD",362084,,2876878,,"totalTestsViral",7188638,1419,32863,337,,,,9514,"2/6/2021 10:00","2021-02-06T10:00:00Z","02/06 05:00",7329,32863,,"2021-02-06T10:00:00Z",7188638,439220,,362084,7150,179,,3238962,,,,189428,24579,164849,,,,,"24",1500,6751,3238962,44020,3238962,,42,176,"b18e2569cb3dcc15c57356ae8492ea87e1402f19",0,0,0,0,0,""
20210205,"MD",360584,,2870127,,"totalTestsViral",7144618,1444,32687,341,,,,9514,"2/5/2021 10:00","2021-02-05T10:00:00Z","02/05 05:00",7287,32687,,"2021-02-05T10:00:00Z",7144618,439220,,360584,7109,178,,3230711,,,,189428,24579,164849,,,,,"24",1547,7637,3230711,42260,3230711,,36,156,"ed35a14fe9f1f748c4b4380e39480759dca51aba",0,0,0,0,0,""
20210204,"MD",359037,,2862490,,"totalTestsViral",7102358,1426,32531,340,,,,9511,"2/4/2021 10:00","2021-02-04T10:00:00Z","02/04 05:00",7251,32531,,"2021-02-04T10:00:00Z",7102358,437155,,359037,7074,177,,3221527,,,,189428,24579,164849,,,,,"24",1554,8652,3221527,35487,3221527,,31,125,"45b2de8b0814985aed9906927e40a1d49a8e02fc",0,0,0,0,0,""
20210203,"MD",357483,,2853838,,"totalTestsViral",7066871,1485,32406,361,,,,9511,"2/3/2021 10:00","2021-02-03T10:00:00Z","02/03 05:00",7220,32406,,"2021-02-03T10:00:00Z",7066871,435241,,357483,7043,177,,3211321,,,,189428,24579,164849,,,,,"24",942,2148,3211321,14607,3211321,,32,115,"1e02d7c2a642e4796f2a9cf578250240a9da8b90",0,0,0,0,0,""
20210202,"MD",356541,,2851690,,"totalTestsViral",7052264,1467,32291,366,,,,9502,"2/2/2021 10:00","2021-02-02T10:00:00Z","02/02 05:00",7188,32291,,"2021-02-02T10:00:00Z",7052264,434121,,356541,7012,176,,3208231,,,,186392,23333,163059,,,,,"24",905,3127,3208231,13702,3208231,,34,110,"3a6060adf1ad567adefd3641d061b8d7bf35d677",0,0,0,0,0,""
20210201,"MD",355636,,2848563,,"totalTestsViral",7038562,1437,32181,371,,,,9501,"2/1/2021 10:00","2021-02-01T10:00:00Z","02/01 05:00",7154,32181,,"2021-02-01T10:00:00Z",7038562,433006,,355636,6978,176,,3204199,,,,186392,23333,163059,,,,,"24",1163,7449,3204199,25408,3204199,,27,126,"eca57b0450c578652c46f26887fcffa9887b107b",0,0,0,0,0,""
20210131,"MD",354473,,2841114,,"totalTestsViral",7013154,1471,32055,364,,,,9499,"1/31/2021 10:00","2021-01-31T10:00:00Z","01/31 05:00",7127,32055,,"2021-01-31T10:00:00Z",7013154,429336,,354473,6951,176,,3195587,,,,186392,23333,163059,,,,,"24",1747,9301,3195587,46230,3195587,,20,167,"f0491eab6431346b7dffcd54f6ae7577963a94e7",0,0,0,0,0,""
20210130,"MD",352726,,2831813,,"totalTestsViral",6966924,1560,31888,380,,,,9491,"1/30/2021 10:00","2021-01-30T10:00:00Z","01/30 05:00",7107,31888,,"2021-01-30T10:00:00Z",6966924,429336,,352726,6931,176,,3184539,,,,186392,23333,163059,,,,,"24",2097,10634,3184539,48616,3184539,,31,129,"dca35a6c97363b47917dac776fa605603cbb6da4",0,0,0,0,0,""
20210129,"MD",350629,,2821179,,"totalTestsViral",6918308,1616,31759,367,,,,9482,"1/29/2021 10:00","2021-01-29T10:00:00Z","01/29 05:00",7076,31759,,"2021-01-29T10:00:00Z",6918308,426842,,350629,6900,176,,3171808,,,,186392,23333,163059,,,,,"24",1880,10653,3171808,52783,3171808,,39,145,"5372ccdb04ed59ac9a701a813e177954d87c38fb",0,0,0,0,0,""
20210128,"MD",348749,,2810526,,"totalTestsViral",6865525,1636,31614,376,,,,9482,"1/28/2021 10:00","2021-01-28T10:00:00Z","01/28 05:00",7037,31614,,"2021-01-28T10:00:00Z",6865525,424593,,348749,6861,176,,3159275,,,,186392,23333,163059,,,,,"24",2190,8555,3159275,46476,3159275,,41,146,"a741e7087a66c80048f66ebf0797b291432252cb",0,0,0,0,0,""
20210127,"MD",346559,,2801971,,"totalTestsViral",6819049,1647,31468,374,,,,9479,"1/27/2021 10:00","2021-01-27T10:00:00Z","01/27 05:00",6996,31468,,"2021-01-27T10:00:00Z",6819049,421831,,346559,6821,175,,3148530,,,,186392,23333,163059,,,,,"24",1939,8555,3148530,34887,3148530,,33,138,"470fed3d3986e08b6ef1c499ad8731456c4348f8",0,0,0,0,0,""
20210126,"MD",344620,,2793416,,"totalTestsViral",6784162,1642,31330,367,,,,9477,"1/26/2021 10:00","2021-01-26T10:00:00Z","01/26 05:00",6963,31330,,"2021-01-26T10:00:00Z",6784162,419497,,344620,6788,175,,3138036,,,,183103,22101,161002,,,,,"24",1482,6332,3138036,25926,3138036,,63,142,"090b50314206370018b7a6ea0a69ba6fa9a7fd9c",0,0,0,0,0,""
20210125,"MD",343138,,2787084,,"totalTestsViral",6758236,1669,31188,395,,,,9476,"1/25/2021 10:00","2021-01-25T10:00:00Z","01/25 05:00",6900,31188,,"2021-01-25T10:00:00Z",6758236,417738,,343138,6726,174,,3130222,,,,183103,22101,161002,,,,,"24",1686,7679,3130222,34734,3130222,,35,154,"e08eb4278e54e92f587e251e20dfaaa4280397fa",0,0,0,0,0,""
20210124,"MD",341452,,2779405,,"totalTestsViral",6723502,1668,31034,392,,,,9474,"1/24/2021 10:00","2021-01-24T10:00:00Z","01/24 05:00",6865,31034,,"2021-01-24T10:00:00Z",6723502,415608,,341452,6690,175,,3120857,,,,183103,22101,161002,,,,,"24",2145,7679,3120857,45247,3120857,,28,168,"e3ddd91cb9367276971fc569bd4ba1287cc17357",0,0,0,0,0,""
20210123,"MD",339307,,2771726,,"totalTestsViral",6678255,1717,30866,405,,,,9471,"1/23/2021 10:00","2021-01-23T10:00:00Z","01/23 05:00",6837,30866,,"2021-01-23T10:00:00Z",6678255,413118,,339307,6662,175,,3111033,,,,183103,22101,161002,,,,,"24",2392,11008,3111033,47691,3111033,,45,169,"a150df6aa44aeb77a4e4288c2965638ff2247aee",0,0,0,0,0,""
20210122,"MD",336915,,2760718,,"totalTestsViral",6630564,1768,30697,424,,,,9469,"1/22/2021 10:00","2021-01-22T10:00:00Z","01/22 05:00",6792,30697,,"2021-01-22T10:00:00Z",6630564,410142,,336915,6617,175,,3097633,,,,183103,22101,161002,,,,,"24",2396,11091,3097633,51989,3097633,,57,199,"48a51d71afd6e7acfdb57d0b0fe737f400545833",0,0,0,0,0,""
20210121,"MD",334519,,2749627,,"totalTestsViral",6578575,1812,30498,424,,,,9459,"1/21/2021 10:00","2021-01-21T10:00:00Z","01/21 05:00",6735,30498,,"2021-01-21T10:00:00Z",6578575,407168,,334519,6560,175,,3084146,,,,183103,22101,161002,,,,,"24",2166,9466,3084146,37523,3084146,,46,171,"4a191037cbd73696f5c4981a763da7d9eededefb",0,0,0,0,0,""
20210120,"MD",332353,,2740161,,"totalTestsViral",6541052,1858,30327,420,,,,9457,"1/20/2021 10:00","2021-01-20T10:00:00Z","01/20 05:00",6689,30327,,"2021-01-20T10:00:00Z",6541052,404342,,332353,6514,175,,3072514,,,,183103,22101,161002,,,,,"24",2167,8240,3072514,30896,3072514,,39,170,"a35bdf2116d26dbc28d947c62930f239308fd38f",0,0,0,0,0,""
20210119,"MD",330186,,2731921,,"totalTestsViral",6510156,1875,30157,411,,,,9456,"1/19/2021 10:00","2021-01-19T10:00:00Z","01/19 05:00",6650,30157,,"2021-01-19T10:00:00Z",6510156,401702,,330186,6476,174,,3062107,,,,179774,20915,158859,,,,,"24",1972,7430,3062107,29370,3062107,,54,315,"ee27ab2aa45f8cb5da1bddfc98917806ffdac806",0,0,0,0,0,""
20210118,"MD",328214,,2724491,,"totalTestsViral",6480786,1850,29842,421,,,,9455,"1/18/2021 10:00","2021-01-18T10:00:00Z","01/18 05:00",6596,29842,,"2021-01-18T10:00:00Z",6480786,399284,,328214,6423,173,,3052705,,,,179774,20915,158859,,,,,"24",1769,8027,3052705,25738,3052705,,29,211,"5c6b26cb5930db6008d8ccf60709f636525cd42a",0,0,0,0,0,""
20210117,"MD",326445,,2716464,,"totalTestsViral",6455048,1823,29631,408,,,,9454,"1/17/2021 10:00","2021-01-17T10:00:00Z","01/17 05:00",6567,29631,,"2021-01-17T10:00:00Z",6455048,393883,,326445,6394,173,,3042909,,,,179774,20915,158859,,,,,"24",2414,11257,3042909,46725,3042909,,26,219,"133c5452ece057400a4d6ff0137424fb5e08b3ab",0,0,0,0,0,""
20210116,"MD",324031,,2705207,,"totalTestsViral",6408323,1821,29412,412,,,,9451,"1/16/2021 10:00","2021-01-16T10:00:00Z","01/16 05:00",6541,29412,,"2021-01-16T10:00:00Z",6408323,393883,,324031,6369,172,,3029238,,,,179774,20915,158859,,,,,"24",3292,13534,3029238,55848,3029238,,47,127,"2205886a4efac1926ff3ba90bbf3d5f0438eef09",0,0,0,0,0,""
20210115,"MD",320739,,2691673,,"totalTestsViral",6352475,1848,29285,421,,,,9444,"1/15/2021 10:00","2021-01-15T10:00:00Z","01/15 05:00",6494,29285,,"2021-01-15T10:00:00Z",6352475,389956,,320739,6322,172,,3012412,,,,179774,20915,158859,,,,,"24",2924,12328,3012412,54297,3012412,,45,162,"d99ab1db512498cb058850a61394a3993b9cbfa0",0,0,0,0,0,""
20210114,"MD",317815,,2679345,,"totalTestsViral",6298178,1843,29123,425,,,,9443,"1/14/2021 10:00","2021-01-14T10:00:00Z","01/14 05:00",6449,29123,,"2021-01-14T10:00:00Z",6298178,386395,,317815,6277,172,,2997160,,,,179774,20915,158859,,,,,"24",2948,11783,2997160,43825,2997160,,45,137,"a5595156d0e6a2dfaac08b5b22d9b8fea53ec933",0,0,0,0,0,""
20210113,"MD",314867,,2667562,,"totalTestsViral",6254353,1929,28986,454,,,,9439,"1/13/2021 10:00","2021-01-13T10:00:00Z","01/13 05:00",6404,28986,,"2021-01-13T10:00:00Z",6254353,382784,,314867,6233,171,,2982429,,,,179774,20915,158859,,,,,"24",2516,8820,2982429,34334,2982429,,37,126,"1298b7ddd33742c84140b82f0e38e3aa2951cf0d",0,0,0,0,0,""
20210112,"MD",312351,,2658742,,"totalTestsViral",6220019,1952,28860,456,,,,9434,"1/12/2021 10:00","2021-01-12T10:00:00Z","01/12 05:00",6367,28860,,"2021-01-12T10:00:00Z",6220019,379748,,312351,6196,171,,2971093,,,,173751,19059,154692,,,,,"24",2665,9164,2971093,31254,2971093,,66,129,"93e69ca59983a3078c6666520e028d7dd36d31c3",0,0,0,0,0,""
20210111,"MD",309686,,2649578,,"totalTestsViral",6188765,1957,28731,447,,,,9431,"1/11/2021 10:00","2021-01-11T10:00:00Z","01/11 05:00",6301,28731,,"2021-01-11T10:00:00Z",6188765,376250,,309686,6129,172,,2959264,,,,173751,19059,154692,,,,,"24",3012,13513,2959264,43520,2959264,,29,208,"f5ab56365e34f3aad9428f27e9e25965c9297e5d",0,0,0,0,0,""
20210110,"MD",306674,,2636065,,"totalTestsViral",6145245,1950,28523,485,,,,9427,"1/10/2021 10:00","2021-01-10T10:00:00Z","01/10 05:00",6272,28523,,"2021-01-10T10:00:00Z",6145245,372717,,306674,6100,172,,2942739,,,,173751,19059,154692,,,,,"24",3310,14820,2942739,60177,2942739,,26,227,"84272a7d7416345215125500ee631aae565f8c29",0,0,0,0,0,""
20210109,"MD",303364,,2621245,,"totalTestsViral",6085068,1877,28296,449,,,,9427,"1/9/2021 10:00","2021-01-09T10:00:00Z","01/09 05:00",6246,28296,,"2021-01-09T10:00:00Z",6085068,368626,,303364,6075,171,,2924609,,,,173751,19059,154692,,,,,"24",3758,12654,2924609,55586,2924609,,30,228,"0cf1b9d7c1ac86fd91f530e67856980b155ae02d",0,0,0,0,0,""
20210108,"MD",299606,,2608591,,"totalTestsViral",6029482,1885,28068,447,,,,9419,"1/8/2021 10:00","2021-01-08T10:00:00Z","01/08 05:00",6216,28068,,"2021-01-08T10:00:00Z",6029482,359707,,299606,6047,169,,2908197,,,,173751,19059,154692,,,,,"24",3732,12977,2908197,57050,2908197,,43,168,"86940a724bdcf9d3bcdc943436bba674a867623a",0,0,0,0,0,""
20210107,"MD",295874,,2595614,,"totalTestsViral",5972432,1834,27900,427,,,,9404,"1/7/2021 10:00","2021-01-07T10:00:00Z","01/07 05:00",6173,27900,,"2021-01-07T10:00:00Z",5972432,359707,,295874,6004,169,,2891488,,,,173751,19059,154692,,,,,"24",2970,9368,2891488,39652,2891488,,41,189,"e687a41b1432910205d5f031802e363862a594c9",0,0,0,0,0,""
20210106,"MD",292904,,2586246,,"totalTestsViral",5932780,1862,27711,444,,,,9391,"1/6/2021 10:00","2021-01-06T10:00:00Z","01/06 05:00",6132,27711,,"2021-01-06T10:00:00Z",5932780,356165,,292904,5960,172,,2879150,,,,173751,19059,154692,,,,,"24",3146,10904,2879150,38281,2879150,,50,169,"c60e249395640f7fbcaa2fd7112b19f57ff935c1",0,0,0,0,0,""
20210105,"MD",289758,,2575342,,"totalTestsViral",5894499,1771,27542,410,,,,9388,"1/5/2021 10:00","2021-01-05T10:00:00Z","01/05 05:00",6082,27542,,"2021-01-05T10:00:00Z",5894499,352155,,289758,5913,169,,2865100,,,,173751,19059,154692,,,,,"24",1956,5670,2865100,24882,2865100,,55,175,"e0fbd40005ece99181c3b48646eac4e33724380d",0,0,0,0,0,""
20210104,"MD",287802,,2569672,,"totalTestsViral",5869617,1751,27367,418,,,,9383,"1/4/2021 10:00","2021-01-04T10:00:00Z","01/04 05:00",6027,27367,,"2021-01-04T10:00:00Z",5869617,349733,,287802,5859,168,,2857474,,,,173751,19059,154692,,,,,"24",2483,11291,2857474,35491,2857474,,33,171,"5a8324dba1e3d40d1cc1f8872b6956aef495b328",0,0,0,0,0,""
20210103,"MD",285319,,2558381,,"totalTestsViral",5834126,1709,27196,412,,,,9378,"1/3/2021 10:00","2021-01-03T10:00:00Z","01/03 05:00",5994,27196,,"2021-01-03T10:00:00Z",5834126,346444,,285319,5826,168,,2843700,,,,173751,19059,154692,,,,,"24",2148,7841,2843700,26460,2843700,,27,145,"c486944a764df00ba4dcd59b52439f5abdc9a3f6",0,0,0,0,0,""
20210102,"MD",283171,,2550540,,"totalTestsViral",5807666,1692,27051,415,,,,9374,"1/2/2021 10:00","2021-01-02T10:00:00Z","01/02 05:00",5967,27051,,"2021-01-02T10:00:00Z",5807666,343848,,283171,5799,168,,2833711,,,,173751,19059,154692,,,,,"24",2952,12398,2833711,46132,2833711,,25,232,"fbdbbb519c041db20db239392a6af81680fcd5e8",0,0,0,0,0,""
20210101,"MD",280219,,2538142,,"totalTestsViral",5761534,1734,26819,388,,,,9358,"1/1/2021 10:00","2021-01-01T10:00:00Z","01/01 05:00",5942,26819,,"2021-01-01T10:00:00Z",5761534,340048,,280219,5774,168,,2818361,,,,173751,19059,154692,,,,,"24",3557,12336,2818361,53504,2818361,,47,183,"6c024f4f854a974b86802e49ee70c15a536d3cab",0,0,0,0,0,""
20201231,"MD",276662,,2525806,,"totalTestsViral",5708030,1773,26636,399,,,,9355,"12/31/2020 10:00","2020-12-31T10:00:00Z","12/31 05:00",5895,26636,,"2020-12-31T10:00:00Z",5708030,335400,,276662,5727,168,,2802468,,,,173751,19059,154692,,,,,"24",2973,8950,2802468,35350,2802468,,47,189,"1ab182b48eca30abe946c89e6710856a6673bf81",0,0,0,0,0,""
20201230,"MD",273689,,2516856,,"totalTestsViral",5672680,1756,26447,410,,,,9302,"12/30/2020 10:00","2020-12-30T10:00:00Z","12/30 05:00",5848,26447,,"2020-12-30T10:00:00Z",5672680,331887,,273689,5681,167,,2790545,,,,173751,19059,154692,,,,,"24",2628,8777,2790545,40279,2790545,,45,200,"4398b65c1b1f25375b6274d50ec44ec9c4b0385f",0,0,0,0,0,""
20201229,"MD",271061,,2508079,,"totalTestsViral",5632401,1725,26247,420,,,,9302,"12/29/2020 10:00","2020-12-29T10:00:00Z","12/29 05:00",5803,26247,,"2020-12-29T10:00:00Z",5632401,328355,,271061,5636,167,,2779140,,,,171409,18370,153039,,,,,"24",1878,5754,2779140,20710,2779140,,63,169,"b0089cbf169743b5343a7610b39595e174bf3240",0,0,0,0,0,""
20201228,"MD",269183,,2502325,,"totalTestsViral",5611691,1738,26078,423,,,,9300,"12/28/2020 10:00","2020-12-28T10:00:00Z","12/28 05:00",5740,26078,,"2020-12-28T10:00:00Z",5611691,325932,,269183,5573,167,,2771508,,,,171409,18370,153039,,,,,"24",1985,11384,2771508,38928,2771508,,28,227,"14bd3c68e8c6c2b4e061e20727a4facb71ffd0cb",0,0,0,0,0,""
20201227,"MD",267198,,2490941,,"totalTestsViral",5572763,1692,25851,418,,,,9300,"12/27/2020 10:00","2020-12-27T10:00:00Z","12/27 05:00",5712,25851,,"2020-12-27T10:00:00Z",5572763,323186,,267198,5545,167,,2758139,,,,171409,18370,153039,,,,,"24",1758,8221,2758139,26728,2758139,,32,134,"898445aeed4adc56d4e7f4e310354b48c3e1ce5a",0,0,0,0,0,""
20201226,"MD",265440,,2482720,,"totalTestsViral",5546035,1685,25717,424,,,,9272,"12/26/2020 10:00","2020-12-26T10:00:00Z","12/26 05:00",5680,25717,,"2020-12-26T10:00:00Z",5546035,320964,,265440,5514,166,,2748160,,,,171409,18370,153039,,,,,"24",2280,10916,2748160,38087,2748160,,21,176,"0992a4f63d2a71b844d0bef82830f4270ac78891",0,0,0,0,0,""
20201225,"MD",263160,,2471804,,"totalTestsViral",5507948,1721,25541,424,,,,9272,"12/25/2020 10:00","2020-12-25T10:00:00Z","12/25 05:00",5659,25541,,"2020-12-25T10:00:00Z",5507948,315361,,263160,5493,166,,2734964,,,,171409,18370,153039,,,,,"24",2432,11313,2734964,42080,2734964,,32,469,"89ec0ec078a449dae8d47a2b9bd5d4deef1f7327",0,0,0,0,0,""
20201224,"MD",260728,,2460491,,"totalTestsViral",5465868,1760,25072,426,,,,9197,"12/24/2020 10:00","2020-12-24T10:00:00Z","12/24 05:00",5627,25072,,"2020-12-24T10:00:00Z",5465868,315361,,260728,5462,165,,2721219,,,,171409,18370,153039,,,,,"24",2866,13413,2721219,45869,2721219,,59,0,"447ff776c15aee4332d8b646fa0e325bb007ef9f",0,0,0,0,0,""
20201223,"MD",257862,,2447078,,"totalTestsViral",5419999,1776,25072,419,,,,9197,"12/23/2020 10:00","2020-12-23T10:00:00Z","12/23 05:00",5568,25072,,"2020-12-23T10:00:00Z",5419999,311814,,257862,5402,166,,2704940,,,,171409,18370,153039,,,,,"24",2465,11725,2704940,39810,2704940,,49,117,"a41b2d390dad9f0a6d4f886bcafbc6bed0636544",0,0,0,0,0,""
20201222,"MD",255397,,2435353,,"totalTestsViral",5380189,1717,24955,400,,,,9128,"12/22/2020 10:00","2020-12-22T10:00:00Z","12/22 05:00",5519,24955,,"2020-12-22T10:00:00Z",5380189,308655,,255397,5353,166,,2690750,,,,168378,17546,150832,,,,,"24",2324,14936,2690750,55698,2690750,,48,197,"be7bf59404dd4b3977122d133acdb9eb5f0cef1d",0,0,0,0,0,""
20201221,"MD",253073,,2420417,,"totalTestsViral",5324491,1676,24758,399,,,,9128,"12/21/2020 10:00","2020-12-21T10:00:00Z","12/21 05:00",5471,24758,,"2020-12-21T10:00:00Z",5324491,304829,,253073,5302,169,,2673490,,,,168378,17546,150832,,,,,"24",2265,12634,2673490,40320,2673490,,23,135,"cc32e834764b510fc81824b1f9b91ef99f9f496b",0,0,0,0,0,""
20201220,"MD",250808,,2407783,,"totalTestsViral",5284171,1662,24623,406,,,,9114,"12/20/2020 10:00","2020-12-20T10:00:00Z","12/20 05:00",5448,24623,,"2020-12-20T10:00:00Z",5284171,301795,,250808,5279,169,,2658591,,,,168378,17546,150832,,,,,"24",2054,11063,2658591,42612,2658591,,36,201,"864992d6347ec3987ce3fa8dbff1489c2ebb42b2",0,0,0,0,0,""
20201219,"MD",248754,,2396720,,"totalTestsViral",5241559,1635,24422,385,,,,9098,"12/19/2020 10:00","2020-12-19T10:00:00Z","12/19 05:00",5412,24422,,"2020-12-19T10:00:00Z",5241559,299395,,248754,5242,170,,2645474,,,,168378,17546,150832,,,,,"24",2201,9543,2645474,36405,2645474,,54,112,"ec9beb222b189f10ff96f4b7204922a644fa84cb",0,0,0,0,0,""
20201218,"MD",246553,,2387177,,"totalTestsViral",5205154,1686,24310,399,,,,9064,"12/18/2020 10:00","2020-12-18T10:00:00Z","12/18 05:00",5358,24310,,"2020-12-18T10:00:00Z",5205154,296808,,246553,5188,170,,2633730,,,,168378,17546,150832,,,,,"24",2569,12635,2633730,44178,2633730,,39,174,"674b35b204e4cc4444ec64a432daf9491650fa64",0,0,0,0,0,""
20201217,"MD",243984,,2374542,,"totalTestsViral",5160976,1702,24136,394,,,,9044,"12/17/2020 10:00","2020-12-17T10:00:00Z","12/17 05:00",5319,24136,,"2020-12-17T10:00:00Z",5160976,293698,,243984,5152,167,,2618526,,,,168378,17546,150832,,,,,"24",2217,8698,2618526,29546,2618526,,49,228,"8ecbea478315e0be0ee648010b860f822dbd1b9e",0,0,0,0,0,""
20201216,"MD",241767,,2365844,,"totalTestsViral",5131430,1762,23908,399,,,,8966,"12/16/2020 10:00","2020-12-16T10:00:00Z","12/16 05:00",5270,23908,,"2020-12-16T10:00:00Z",5131430,290913,,241767,5103,167,,2607611,,,,168378,17546,150832,,,,,"24",2405,11329,2607611,36858,2607611,,64,197,"6b31c95cf21b68fee915e9a18be1a68338cb6f73",0,0,0,0,0,""
20201215,"MD",239362,,2354515,,"totalTestsViral",5094572,1799,23711,411,,,,8958,"12/15/2020 10:00","2020-12-15T10:00:00Z","12/15 05:00",5206,23711,,"2020-12-15T10:00:00Z",5094572,287692,,239362,5039,167,,2593877,,,,164680,16775,147905,,,,,"24",2401,10492,2593877,33185,2593877,,64,153,"8cae6f93be03ad7f77aa6bda2668da1f38daf3ec",0,0,0,0,0,""
20201214,"MD",236961,,2344023,,"totalTestsViral",5061387,1742,23558,404,,,,8951,"12/14/2020 10:00","2020-12-14T10:00:00Z","12/14 05:00",5142,23558,,"2020-12-14T10:00:00Z",5061387,284843,,236961,4978,164,,2580984,,,,164680,16775,147905,,,,,"24",2314,13022,2580984,40010,2580984,,25,165,"1fbbf26c057266e61774aea6c271a345888be200",0,0,0,0,0,""
20201213,"MD",234647,,2331001,,"totalTestsViral",5021377,1679,23393,424,,,,8944,"12/13/2020 10:00","2020-12-13T10:00:00Z","12/13 05:00",5117,23393,,"2020-12-13T10:00:00Z",5021377,281931,,234647,4954,163,,2565648,,,,164680,16775,147905,,,,,"24",2638,15556,2565648,51393,2565648,,17,204,"650bb3b771fb9421a11e714bf9527f0b048ec5b9",0,0,0,0,0,""
20201212,"MD",232009,,2315445,,"totalTestsViral",4969984,1719,23189,406,,,,8938,"12/12/2020 10:00","2020-12-12T10:00:00Z","12/12 05:00",5100,23189,,"2020-12-12T10:00:00Z",4969984,278541,,232009,4937,163,,2547454,,,,164680,16775,147905,,,,,"24",3538,16756,2547454,65832,2547454,,36,180,"a4fdbce4fb1c4c6656575ca9716b2baea0dbac01",0,0,0,0,0,""
20201211,"MD",228471,,2298689,,"totalTestsViral",4904152,1729,23009,416,,,,8910,"12/11/2020 10:00","2020-12-11T10:00:00Z","12/11 05:00",5064,23009,,"2020-12-11T10:00:00Z",4904152,274107,,228471,4901,163,,2527160,,,,164680,16775,147905,,,,,"24",2616,14338,2527160,48197,2527160,,52,176,"96208f1f290c430cfc111d1811321b77ef9e17b8",0,0,0,0,0,""
20201210,"MD",225855,,2284351,,"totalTestsViral",4855955,1720,22833,416,,,,8878,"12/10/2020 10:00","2020-12-10T10:00:00Z","12/10 05:00",5012,22833,,"2020-12-10T10:00:00Z",4855955,270854,,225855,4850,162,,2510206,,,,164680,16775,147905,,,,,"24",3202,16766,2510206,49110,2510206,,50,211,"3e2951e556f3016340a5f1410a83721baee1f8f5",0,0,0,0,0,""
20201209,"MD",222653,,2267585,,"totalTestsViral",4806845,1715,22622,416,,,,8833,"12/9/2020 10:00","2020-12-09T10:00:00Z","12/09 05:00",4962,22622,,"2020-12-09T10:00:00Z",4806845,267020,,222653,4801,161,,2490238,,,,164680,16775,147905,,,,,"24",2692,13071,2490238,36013,2490238,,46,201,"30b56a5a2d607e0397d34fc18ab699432da22b1c",0,0,0,0,0,""
20201208,"MD",219961,,2254514,,"totalTestsViral",4770832,1653,22421,396,,,,8801,"12/8/2020 10:00","2020-12-08T10:00:00Z","12/08 05:00",4916,22421,,"2020-12-08T10:00:00Z",4770832,263785,,219961,4755,161,,2474475,,,,160122,15776,144346,,,,,"24",2632,13814,2474475,40400,2474475,,51,162,"2168addba8288dc32fee67049e86a11326923144",0,0,0,0,0,""
20201207,"MD",217329,,2240700,,"totalTestsViral",4730432,1561,22259,388,,,,8797,"12/7/2020 10:00","2020-12-07T10:00:00Z","12/07 05:00",4865,22259,,"2020-12-07T10:00:00Z",4730432,260509,,217329,4705,160,,2458029,,,,160122,15776,144346,,,,,"24",2302,15105,2458029,44956,2458029,,19,164,"fcb84f1b3099f4a125f0451779bb5e3e47a9592f",0,0,0,0,0,""
20201206,"MD",215027,,2225595,,"totalTestsViral",4685476,1576,22095,393,,,,8785,"12/6/2020 10:00","2020-12-06T10:00:00Z","12/06 05:00",4846,22095,,"2020-12-06T10:00:00Z",4685476,257412,,215027,4685,161,,2440622,,,,160122,15776,144346,,,,,"24",2643,14799,2440622,48348,2440622,,26,183,"fd5896c92b06c94f85cdd9324e24945f8ceceddf",0,0,0,0,0,""
20201205,"MD",212384,,2210796,,"totalTestsViral",4637128,1598,21912,379,,,,8780,"12/5/2020 10:00","2020-12-05T10:00:00Z","12/05 05:00",4820,21912,,"2020-12-05T10:00:00Z",4637128,254161,,212384,4659,161,,2423180,,,,160122,15776,144346,,,,,"24",3193,16700,2423180,53900,2423180,,30,156,"b911b1ec312faf776f7a17997c0a44b16676187d",0,0,0,0,0,""
20201204,"MD",209191,,2194096,,"totalTestsViral",4583228,1594,21756,367,,,,8751,"12/4/2020 10:00","2020-12-04T10:00:00Z","12/04 05:00",4790,21756,,"2020-12-04T10:00:00Z",4583228,250295,,209191,4630,160,,2403287,,,,160122,15776,144346,,,,,"24",3792,16154,2403287,55912,2403287,,26,198,"5c47a75e57d10f4d7e5b77ede39679f64b871b96",0,0,0,0,0,""
20201203,"MD",205399,,2177942,,"totalTestsViral",4527316,1573,21558,364,,,,8675,"12/3/2020 10:00","2020-12-03T10:00:00Z","12/03 05:00",4764,21558,,"2020-12-03T10:00:00Z",4527316,245667,,205399,4606,158,,2383341,,,,160122,15776,144346,,,,,"24",2044,9939,2383341,31305,2383341,,49,163,"bc09c35c40ade4a60e68ae1096ae1c0769e772e5",0,0,0,0,0,""
20201202,"MD",203355,,2168003,,"totalTestsViral",4496011,1578,21395,359,,,,8648,"12/2/2020 10:00","2020-12-02T10:00:00Z","12/02 05:00",4715,21395,,"2020-12-02T10:00:00Z",4496011,243152,,203355,4558,157,,2371358,,,,160122,15776,144346,,,,,"24",2220,11427,2371358,35566,2371358,,42,189,"a252bdbe16d2d25ef6f598d8eb5a81757c21d019",0,0,0,0,0,""
20201201,"MD",201135,,2156576,,"totalTestsViral",4460445,1583,21206,350,,,,8613,"12/1/2020 10:00","2020-12-01T10:00:00Z","12/01 05:00",4673,21206,,"2020-12-01T10:00:00Z",4460445,240267,,201135,4516,157,,2357711,,,,158510,15413,143097,,,,,"24",2765,10037,2357711,30696,2357711,,32,155,"daf30885237cae7ac898b49a351ce65c1c894915",0,0,0,0,0,""
20201130,"MD",198370,,2146539,,"totalTestsViral",4429749,1527,21051,344,,,,8608,"11/30/2020 10:00","2020-11-30T10:00:00Z","11/30 05:00",4641,21051,,"2020-11-30T10:00:00Z",4429749,237188,,198370,4486,155,,2344909,,,,158510,15413,143097,,,,,"24",1923,10147,2344909,27350,2344909,,16,174,"c8b7e286487bd4af9784fc5ce194cac7e323bacc",0,0,0,0,0,""
20201129,"MD",196447,,2136392,,"totalTestsViral",4402399,1461,20877,359,,,,8607,"11/29/2020 10:00","2020-11-29T10:00:00Z","11/29 05:00",4625,20877,,"2020-11-29T10:00:00Z",4402399,234821,,196447,4470,155,,2332839,,,,158510,15413,143097,,,,,"24",1999,13270,2332839,39249,2332839,,23,164,"5ba89d8eaa7af04fe1e16936fcf493e2c1ad4e69",0,0,0,0,0,""
20201128,"MD",194448,,2123122,,"totalTestsViral",4363150,1446,20713,351,,,,8599,"11/28/2020 10:00","2020-11-28T10:00:00Z","11/28 05:00",4602,20713,,"2020-11-28T10:00:00Z",4363150,232458,,194448,4447,155,,2317570,,,,158510,15413,143097,,,,,"24",1590,10435,2317570,27708,2317570,,33,201,"f4af6f62d68e5136c49bf1ad6d049b9da6bd9de7",0,0,0,0,0,""
20201127,"MD",192858,,2112687,,"totalTestsViral",4335442,1435,20512,343,,,,8565,"11/27/2020 10:00","2020-11-27T10:00:00Z","11/27 05:00",4569,20512,,"2020-11-27T10:00:00Z",4335442,230545,,192858,4414,155,,2305545,,,,158510,15413,143097,,,,,"24",2378,16000,2305545,47320,2305545,,22,232,"977b5f83d097217a1e1cf1d5170a592e222ea11a",0,0,0,0,0,""
20201126,"MD",190480,,2096687,,"totalTestsViral",4288122,1453,20280,339,,,,8561,"11/26/2020 10:00","2020-11-26T10:00:00Z","11/26 05:00",4547,20280,,"2020-11-26T10:00:00Z",4288122,227713,,190480,4392,155,,2287167,,,,158510,15413,143097,,,,,"24",2319,14188,2287167,41771,2287167,,29,212,"bedf48b02643d032cb054393070db14abe06b7da",0,0,0,0,0,""
20201125,"MD",188161,,2082499,,"totalTestsViral",4246351,1406,20068,308,,,,8549,"11/25/2020 10:00","2020-11-25T10:00:00Z","11/25 05:00",4518,20068,,"2020-11-25T10:00:00Z",4246351,224826,,188161,4363,155,,2270660,,,,158510,15413,143097,,,,,"24",2697,15939,2270660,45515,2270660,,37,154,"1bcb7a09fcc1c8e149bf8e60b700a7091071b470",0,0,0,0,0,""
20201124,"MD",185464,,2066560,,"totalTestsViral",4200836,1341,19914,314,,,,8517,"11/24/2020 10:00","2020-11-24T10:00:00Z","11/24 05:00",4481,19914,,"2020-11-24T10:00:00Z",4200836,221744,,185464,4325,156,,2252024,,,,155805,14868,140937,,,,,"24",1667,11865,2252024,29162,2252024,,33,145,"ceffc2a11c0f6bc4eafb49edffb7512e0e5dc854",0,0,0,0,0,""
20201123,"MD",183797,,2054695,,"totalTestsViral",4171674,1276,19769,289,,,,8511,"11/23/2020 10:00","2020-11-23T10:00:00Z","11/23 05:00",4448,19769,,"2020-11-23T10:00:00Z",4171674,219779,,183797,4293,155,,2238492,,,,155805,14868,140937,,,,,"24",1658,11445,2238492,30947,2238492,,14,133,"8dd51013a2ccf753c6ae1c48f4a57cf38d5f0cf3",0,0,0,0,0,""
20201122,"MD",182139,,2043250,,"totalTestsViral",4140727,1237,19636,268,,,,8506,"11/22/2020 10:00","2020-11-22T10:00:00Z","11/22 05:00",4434,19636,,"2020-11-22T10:00:00Z",4140727,217845,,182139,4279,155,,2225389,,,,155805,14868,140937,,,,,"24",2168,16932,2225389,49895,2225389,,19,202,"d279fcec47833ed3321192af2d23ed8f17a9b768",0,0,0,0,0,""
20201121,"MD",179971,,2026318,,"totalTestsViral",4090832,1229,19434,278,,,,8498,"11/21/2020 10:00","2020-11-21T10:00:00Z","11/21 05:00",4415,19434,,"2020-11-21T10:00:00Z",4090832,215371,,179971,4261,154,,2206289,,,,155805,14868,140937,,,,,"24",2885,17973,2206289,51510,2206289,,17,152,"1ef121b1dd9e7e365584aba0126ec61860f9b124",0,0,0,0,0,""
20201120,"MD",177086,,2008345,,"totalTestsViral",4039322,1207,19282,261,,,,8474,"11/20/2020 10:00","2020-11-20T10:00:00Z","11/20 05:00",4398,19282,,"2020-11-20T10:00:00Z",4039322,212068,,177086,4245,153,,2185431,,,,155805,14868,140937,,,,,"24",2353,13570,2185431,41252,2185431,,26,148,"5b92ab2d7a74adbd6dd2be3fe57a5e5775fea336",0,0,0,0,0,""
20201119,"MD",174733,,1994775,,"totalTestsViral",3998070,1192,19134,260,,,,8441,"11/19/2020 10:00","2020-11-19T10:00:00Z","11/19 05:00",4372,19134,,"2020-11-19T10:00:00Z",3998070,209359,,174733,4220,152,,2169508,,,,155805,14868,140937,,,,,"24",2910,17263,2169508,43963,2169508,,21,175,"1384b4e7a65496c25b93abc9fcd2604673ebe6eb",0,0,0,0,0,""
20201118,"MD",171823,,1977512,,"totalTestsViral",3954107,1144,18959,270,,,,8421,"11/18/2020 10:00","2020-11-18T10:00:00Z","11/18 05:00",4351,18959,,"2020-11-18T10:00:00Z",3954107,205861,,171823,4201,150,,2149335,,,,155805,14868,140937,,,,,"24",2018,11716,2149335,31801,2149335,,16,147,"c1374801c366d6a9dd29d6a8246772fcbc77e270",0,0,0,0,0,""
20201117,"MD",169805,,1965796,,"totalTestsViral",3922306,1046,18812,255,,,,8408,"11/17/2020 10:00","2020-11-17T10:00:00Z","11/17 05:00",4335,18812,,"2020-11-17T10:00:00Z",3922306,203530,,169805,4186,149,,2135601,,,,152750,14367,138383,,,,,"24",2149,10177,2135601,27740,2135601,,26,124,"4a366733d454b35f5e2a69abed76a24c1ccd88c8",0,0,0,0,0,""
20201116,"MD",167656,,1955619,,"totalTestsViral",3894566,985,18688,237,,,,8380,"11/16/2020 10:00","2020-11-16T10:00:00Z","11/16 05:00",4309,18688,,"2020-11-16T10:00:00Z",3894566,201117,,167656,4160,149,,2123275,,,,152750,14367,138383,,,,,"24",1726,11083,2123275,34833,2123275,,7,112,"2b7167f97b5371bc812c1b48b7a50cd796ed5414",0,0,0,0,0,""
20201115,"MD",165930,,1944536,,"totalTestsViral",3859733,938,18576,238,,,,8374,"11/15/2020 10:00","2020-11-15T10:00:00Z","11/15 05:00",4302,18576,,"2020-11-15T10:00:00Z",3859733,199077,,165930,4153,149,,2110466,,,,152750,14367,138383,,,,,"24",1840,10457,2110466,28574,2110466,,9,118,"dc7b833fe566f05665e91b4f09a9a4c203718ab9",0,0,0,0,0,""
20201114,"MD",164090,,1934079,,"totalTestsViral",3831159,921,18458,218,,,,8362,"11/14/2020 10:00","2020-11-14T10:00:00Z","11/14 05:00",4293,18458,,"2020-11-14T10:00:00Z",3831159,197046,,164090,4144,149,,2098169,,,,152750,14367,138383,,,,,"24",2321,11546,2098169,37627,2098169,,20,177,"eeb4220fd55788cb0869eb5409d8dea0ee6a2dbf",0,0,0,0,0,""
20201113,"MD",161769,,1922533,,"totalTestsViral",3793532,914,18281,208,,,,8343,"11/13/2020 10:00","2020-11-13T10:00:00Z","11/13 05:00",4273,18281,,"2020-11-13T10:00:00Z",3793532,194537,,161769,4124,149,,2084302,,,,152750,14367,138383,,,,,"24",1869,10448,2084302,32019,2084302,,12,142,"d4c41ea95a5fd9106137544d3a0a72e5ae17cd0b",0,0,0,0,0,""
20201112,"MD",159900,,1912085,,"totalTestsViral",3761513,863,18139,199,,,,8323,"11/12/2020 10:00","2020-11-12T10:00:00Z","11/12 05:00",4261,18139,,"2020-11-12T10:00:00Z",3761513,192393,,159900,4112,149,,2071985,,,,152750,14367,138383,,,,,"24",1477,9672,2071985,31598,2071985,,12,127,"14ef56852774761fcb4328a231acb3db862faec4",0,0,0,0,0,""
20201111,"MD",158423,,1902413,,"totalTestsViral",3729915,805,18012,193,,,,8313,"11/11/2020 10:00","2020-11-11T10:00:00Z","11/11 05:00",4249,18012,,"2020-11-11T10:00:00Z",3729915,190702,,158423,4100,149,,2060836,,,,152750,14367,138383,,,,,"24",1714,11275,2060836,27257,2060836,,16,98,"61a24ce25284ebc8821f7593966906312a9a9e38",0,0,0,0,0,""
20201110,"MD",156709,,1891138,,"totalTestsViral",3702658,761,17914,176,,,,8305,"11/10/2020 10:00","2020-11-10T10:00:00Z","11/10 05:00",4233,17914,,"2020-11-10T10:00:00Z",3702658,188516,,156709,4084,149,,2047847,,,,150653,14048,136605,,,,,"24",1338,8864,2047847,24549,2047847,,12,81,"79b81c8d956e9f4d49571aac34d8368306314e99",0,0,0,0,0,""
20201109,"MD",155371,,1882274,,"totalTestsViral",3678109,707,17833,168,,,,8297,"11/9/2020 10:00","2020-11-09T10:00:00Z","11/09 05:00",4221,17833,,"2020-11-09T10:00:00Z",3678109,187035,,155371,4072,149,,2037645,,,,150653,14048,136605,,,,,"24",1375,9978,2037645,23650,2037645,,9,103,"0efe39ebe9575b5ea3d0a927070fb5595f96ff3a",0,0,0,0,0,""
20201108,"MD",153996,,1872296,,"totalTestsViral",3654459,655,17730,163,,,,8291,"11/8/2020 10:00","2020-11-08T10:00:00Z","11/08 05:00",4212,17730,,"2020-11-08T10:00:00Z",3654459,185455,,153996,4063,149,,2026292,,,,150653,14048,136605,,,,,"24",1081,9897,2026292,30266,2026292,,11,103,"1cdc0453fdcc96d5d5aa9ed49205638cb564d985",0,0,0,0,0,""
20201107,"MD",152915,,1862399,,"totalTestsViral",3624193,632,17627,153,,,,8284,"11/7/2020 10:00","2020-11-07T10:00:00Z","11/07 05:00",4201,17627,,"2020-11-07T10:00:00Z",3624193,184180,,152915,4052,149,,2015314,,,,150653,14048,136605,,,,,"24",1410,10734,2015314,36496,2015314,,7,90,"cca2c68620830a4d0786ebf5714b40fa598596ac",0,0,0,0,0,""
20201106,"MD",151505,,1851665,,"totalTestsViral",3587697,609,17537,152,,,,8262,"11/6/2020 10:00","2020-11-06T10:00:00Z","11/06 05:00",4194,17537,,"2020-11-06T10:00:00Z",3587697,182511,,151505,4046,148,,2003170,,,,150653,14048,136605,,,,,"24",1541,11606,2003170,35366,2003170,,12,102,"804458275de810bec8ca672b958ec98dad4a1261",0,0,0,0,0,""
20201105,"MD",149964,,1840059,,"totalTestsViral",3552331,588,17435,157,,,,8255,"11/5/2020 10:00","2020-11-05T10:00:00Z","11/05 05:00",4182,17435,,"2020-11-05T10:00:00Z",3552331,180737,,149964,4035,147,,1990023,,,,150653,14048,136605,,,,,"24",1198,9758,1990023,27944,1990023,,10,72,"c0e04623421dbd97bd8edfeace49272abc0bf797",0,0,0,0,0,""
20201104,"MD",148766,,1830301,,"totalTestsViral",3524387,595,17363,154,,,,8235,"11/4/2020 10:00","2020-11-04T10:00:00Z","11/04 05:00",4172,17363,,"2020-11-04T10:00:00Z",3524387,179340,,148766,4025,147,,1979067,,,,150653,14048,136605,,,,,"24",1000,10167,1979067,25270,1979067,,10,51,"28dfdfe0b1c4b1fdccea935bb0ee3c189477ef35",0,0,0,0,0,""
20201103,"MD",147766,,1820134,,"totalTestsViral",3499117,562,17312,143,,,,8223,"11/3/2020 10:00","2020-11-03T10:00:00Z","11/03 05:00",4162,17312,,"2020-11-03T10:00:00Z",3499117,178077,,147766,4015,147,,1967900,,,,148073,13664,134409,,,,,"24",771,6684,1967900,19887,1967900,,7,60,"40a088b842cf080e56eee08989ffc5714156bce9",0,0,0,0,0,""
20201102,"MD",146995,,1813450,,"totalTestsViral",3479230,529,17252,133,,,,8201,"11/2/2020 10:00","2020-11-02T10:00:00Z","11/02 05:00",4155,17252,,"2020-11-02T10:00:00Z",3479230,177158,,146995,4007,148,,1960445,,,,148073,13664,134409,,,,,"24",850,10415,1960445,26814,1960445,,3,74,"e923004061505c204b3efb8f8dc15856387302f6",0,0,0,0,0,""
20201101,"MD",146145,,1803035,,"totalTestsViral",3452416,523,17178,127,,,,8199,"11/1/2020 10:00","2020-11-01T10:00:00Z","11/01 05:00",4152,17178,,"2020-11-01T10:00:00Z",3452416,176150,,146145,4004,148,,1949180,,,,148073,13664,134409,,,,,"24",864,9644,1949180,29754,1949180,,5,85,"59116b42a1497c792dbefaf114702edcd4817a72",0,0,0,0,0,""
20201031,"MD",145281,,1793391,,"totalTestsViral",3422662,520,17093,126,,,,8181,"10/31/2020 10:00","2020-10-31T10:00:00Z","10/31 06:00",4147,17093,,"2020-10-31T10:00:00Z",3422662,175075,,145281,4000,147,,1938672,,,,148073,13664,134409,,,,,"24",967,11187,1938672,32984,1938672,,10,70,"aaf09a107240a1dbe2b6380df9e32b242013400a",0,0,0,0,0,""
20201030,"MD",144314,,1782204,,"totalTestsViral",3389678,513,17023,126,,,,8164,"10/30/2020 10:00","2020-10-30T10:00:00Z","10/30 06:00",4137,17023,,"2020-10-30T10:00:00Z",3389678,173940,,144314,3990,147,,1926518,,,,148073,13664,134409,,,,,"24",927,8743,1926518,28397,1926518,,10,52,"b6bf0507a8ae04987174e3c719696b0f27420bde",0,0,0,0,0,""
20201029,"MD",143387,,1773461,,"totalTestsViral",3361281,502,16971,120,,,,8144,"10/29/2020 10:00","2020-10-29T10:00:00Z","10/29 06:00",4127,16971,,"2020-10-29T10:00:00Z",3361281,172797,,143387,3980,147,,1916848,,,,148073,13664,134409,,,,,"24",962,9934,1916848,27719,1916848,,12,61,"15d921c2a207f9845f4795f0975e5964b42d76f7",0,0,0,0,0,""
20201028,"MD",142425,,1763527,,"totalTestsViral",3333562,501,16910,114,,,,8117,"10/28/2020 10:00","2020-10-28T10:00:00Z","10/28 06:00",4115,16910,,"2020-10-28T10:00:00Z",3333562,171618,,142425,3969,146,,1905952,,,,148073,13664,134409,,,,,"24",684,7174,1905952,22419,1905952,,7,51,"a4fba7812071686be4fa1ebeba524f8c5d9edba1",0,0,0,0,0,""
20201027,"MD",141741,,1756353,,"totalTestsViral",3311143,471,16859,105,,,,8099,"10/27/2020 10:00","2020-10-27T10:00:00Z","10/27 06:00",4108,16859,,"2020-10-27T10:00:00Z",3311143,170766,,141741,3962,146,,1898094,,,,145215,13261,131954,,,,,"24",897,8826,1898094,23187,1898094,,9,40,"fe6d848c6dd747160e5b1c98614588b595c538fc",0,0,0,0,0,""
20201026,"MD",140844,,1747527,,"totalTestsViral",3287956,456,16819,112,,,,8067,"10/26/2020 10:00","2020-10-26T10:00:00Z","10/26 06:00",4099,16819,,"2020-10-26T10:00:00Z",3287956,169684,,140844,3953,146,,1888371,,,,145215,13261,131954,,,,,"24",565,8877,1888371,21807,1888371,,3,62,"d41c93a477c28c2e49754595702bab206b353ec0",0,0,0,0,0,""
20201025,"MD",140279,,1738650,,"totalTestsViral",3266149,446,16757,103,,,,8064,"10/25/2020 10:00","2020-10-25T10:00:00Z","10/25 06:00",4096,16757,,"2020-10-25T10:00:00Z",3266149,169003,,140279,3950,146,,1878929,,,,145215,13261,131954,,,,,"24",792,11210,1878929,31865,1878929,,5,52,"13a63c51c9660d1dde168d4c720d4a73ca1d65f2",0,0,0,0,0,""
20201024,"MD",139487,,1727440,,"totalTestsViral",3234284,455,16705,109,,,,8055,"10/24/2020 10:00","2020-10-24T10:00:00Z","10/24 06:00",4091,16705,,"2020-10-24T10:00:00Z",3234284,168014,,139487,3945,146,,1866927,,,,145215,13261,131954,,,,,"24",796,10837,1866927,32510,1866927,,13,55,"5a96d8735ad429e4f6bb9790f53f3875d381a27d",0,0,0,0,0,""
20201023,"MD",138691,,1716603,,"totalTestsViral",3201774,458,16650,122,,,,8030,"10/23/2020 10:00","2020-10-23T10:00:00Z","10/23 06:00",4078,16650,,"2020-10-23T10:00:00Z",3201774,167025,,138691,3932,146,,1855294,,,,145215,13261,131954,,,,,"24",712,11227,1855294,32472,1855294,,8,47,"b1ca96eb35538fbd299c369d29ee2b7520b6385e",0,0,0,0,0,""
20201022,"MD",137979,,1705376,,"totalTestsViral",3169302,458,16603,125,,,,7999,"10/22/2020 10:00","2020-10-22T10:00:00Z","10/22 06:00",4070,16603,,"2020-10-22T10:00:00Z",3169302,166166,,137979,3924,146,,1843355,,,,145215,13261,131954,,,,,"24",743,10605,1843355,30427,1843355,,12,54,"2363fca274c81e0eface7d7b9a5bc438545b1b38",0,0,0,0,0,""
20201021,"MD",137236,,1694771,,"totalTestsViral",3138875,463,16549,131,,,,7960,"10/21/2020 10:00","2020-10-21T10:00:00Z","10/21 06:00",4058,16549,,"2020-10-21T10:00:00Z",3138875,165228,,137236,3912,146,,1832007,,,,145215,13261,131954,,,,,"24",492,6610,1832007,17076,1832007,,8,33,"dd4428a4552297add08fbec74b72e32340e08ce0",0,0,0,0,0,""
20201020,"MD",136744,,1688161,,"totalTestsViral",3121799,464,16516,123,,,,7926,"10/20/2020 10:00","2020-10-20T10:00:00Z","10/20 06:00",4050,16516,,"2020-10-20T10:00:00Z",3121799,164580,,136744,3904,146,,1824905,,,,142054,12794,129260,,,,,"24",590,7593,1824905,17966,1824905,,9,41,"3416813d0d2937fd5d8d8e8e6062517498bfd780",0,0,0,0,0,""
20201019,"MD",136154,,1680568,,"totalTestsViral",3103833,434,16475,116,,,,7892,"10/19/2020 10:00","2020-10-19T10:00:00Z","10/19 06:00",4041,16475,,"2020-10-19T10:00:00Z",3103833,163872,,136154,3895,146,,1816722,,,,142054,12794,129260,,,,,"24",497,9563,1816722,24671,1816722,,4,40,"dffbf5d77615ed3bb0b2fe6e9e53c6dd07928133",0,0,0,0,0,""
20201018,"MD",135657,,1671005,,"totalTestsViral",3079162,433,16435,115,,,,7890,"10/18/2020 10:00","2020-10-18T10:00:00Z","10/18 06:00",4037,16435,,"2020-10-18T10:00:00Z",3079162,163239,,135657,3891,146,,1806662,,,,142054,12794,129260,,,,,"24",530,11228,1806662,29528,1806662,,1,83,"3e8986db5ebff9a0a052bd9fc5d84abfdc27083c",0,0,0,0,0,""
20201017,"MD",135127,,1659777,,"totalTestsViral",3049634,422,16352,108,,,,7880,"10/17/2020 10:00","2020-10-17T10:00:00Z","10/17 06:00",4036,16352,,"2020-10-17T10:00:00Z",3049634,162576,,135127,3891,145,,1794904,,,,142054,12794,129260,,,,,"24",798,11649,1794904,36527,1794904,,4,64,"150e3562283ee7d84f8b1608220ffc9d0d5e3e45",0,0,0,0,0,""
20201016,"MD",134329,,1648128,,"totalTestsViral",3013107,416,16288,111,,,,7869,"10/16/2020 10:00","2020-10-16T10:00:00Z","10/16 06:00",4032,16288,,"2020-10-16T10:00:00Z",3013107,161583,,134329,3887,145,,1782457,,,,142054,12794,129260,,,,,"24",781,10841,1782457,27647,1782457,,4,33,"9798208c3a7472a45498a4c9254a6c4292ec30e0",0,0,0,0,0,""
20201015,"MD",133548,,1637287,,"totalTestsViral",2985460,412,16255,109,,,,7851,"10/15/2020 10:00","2020-10-15T10:00:00Z","10/15 06:00",4028,16255,,"2020-10-15T10:00:00Z",2985460,160667,,133548,3883,145,,1770835,,,,142054,12794,129260,,,,,"24",630,9551,1770835,28636,1770835,,6,40,"9cc33f4cf932909b880fd6cdb50312f887aebf63",0,0,0,0,0,""
20201014,"MD",132918,,1627736,,"totalTestsViral",2956824,417,16215,113,,,,7812,"10/14/2020 10:00","2020-10-14T10:00:00Z","10/14 06:00",4022,16215,,"2020-10-14T10:00:00Z",2956824,159744,,132918,3877,145,,1760654,,,,142054,12794,129260,,,,,"24",575,8770,1760654,21891,1760654,,10,65,"bc58bd653081293e36af9d5ee78abc0a5c45ae2d",0,0,0,0,0,""
20201013,"MD",132343,,1618966,,"totalTestsViral",2934933,402,16150,102,,,,7744,"10/13/2020 10:00","2020-10-13T10:00:00Z","10/13 06:00",4012,16150,,"2020-10-13T10:00:00Z",2934933,158779,,132343,3868,144,,1751309,,,,138627,12358,126269,,,,,"24",482,8392,1751309,18713,1751309,,9,43,"f0b0700d9dbcaf2704ac2e9c7468fe952ab3c16c",0,0,0,0,0,""
20201012,"MD",131861,,1610574,,"totalTestsViral",2916220,384,16107,93,,,,7738,"10/12/2020 10:00","2020-10-12T10:00:00Z","10/12 06:00",4003,16107,,"2020-10-12T10:00:00Z",2916220,158129,,131861,3859,144,,1742435,,,,138627,12358,126269,,,,,"24",504,10087,1742435,23955,1742435,,4,49,"683366f65c30d922d9ef03b52d50381517426545",0,0,0,0,0,""
20201011,"MD",131357,,1600487,,"totalTestsViral",2892265,393,16058,90,,,,7738,"10/11/2020 10:00","2020-10-11T10:00:00Z","10/11 06:00",3999,16058,,"2020-10-11T10:00:00Z",2892265,157516,,131357,3854,145,,1731844,,,,138627,12358,126269,,,,,"24",562,11480,1731844,29182,1731844,,4,52,"9611fa733bce49d8ca516ac3dc85cf171b46b50c",0,0,0,0,0,""
20201010,"MD",130795,,1589007,,"totalTestsViral",2863083,383,16006,91,,,,7721,"10/10/2020 10:00","2020-10-10T10:00:00Z","10/10 06:00",3995,16006,,"2020-10-10T10:00:00Z",2863083,156068,,130795,3850,145,,1719802,,,,138627,12358,126269,,,,,"24",636,11799,1719802,33660,1719802,,5,50,"cf7a7edbae898051fc9e31b664dc12f5d208a1df",0,0,0,0,0,""
20201009,"MD",130159,,1577208,,"totalTestsViral",2829423,391,15956,96,,,,7704,"10/9/2020 10:00","2020-10-09T10:00:00Z","10/09 06:00",3990,15956,,"2020-10-09T10:00:00Z",2829423,156068,,130159,3845,145,,1707367,,,,138627,12358,126269,,,,,"24",734,10334,1707367,27120,1707367,,11,58,"31c6f31398da8cb0862b67d77b51dbdaf7bad669",0,0,0,0,0,""
20201008,"MD",129425,,1566874,,"totalTestsViral",2802303,403,15898,98,,,,7676,"10/8/2020 10:00","2020-10-08T10:00:00Z","10/08 06:00",3979,15898,,"2020-10-08T10:00:00Z",2802303,155177,,129425,3835,144,,1696299,,,,138627,12358,126269,,,,,"24",761,11634,1696299,29023,1696299,,6,55,"587b2838dd109f7c0784d56353aa5e6d52906316",0,0,0,0,0,""
20201007,"MD",128664,,1555240,,"totalTestsViral",2773280,391,15843,93,,,,7665,"10/7/2020 10:00","2020-10-07T10:00:00Z","10/07 06:00",3973,15843,,"2020-10-07T10:00:00Z",2773280,154217,,128664,3829,144,,1683904,,,,138627,12358,126269,,,,,"24",460,8217,1683904,20734,1683904,,6,52,"4131a010841a2e83c46074a2068e5a0dad978e6e",0,0,0,0,0,""
20201006,"MD",128204,,1547023,,"totalTestsViral",2752546,360,15791,88,,,,7661,"10/6/2020 10:00","2020-10-06T10:00:00Z","10/06 06:00",3967,15791,,"2020-10-06T10:00:00Z",2752546,153621,,128204,3823,144,,1675227,,,,135193,11906,123287,,,,,"24",413,6497,1675227,17746,1675227,,6,46,"51ab95bcc442a90af46c68914442851e202ab657",0,0,0,0,0,""
20201005,"MD",127791,,1540526,,"totalTestsViral",2734800,338,15745,85,,,,7657,"10/5/2020 10:00","2020-10-05T10:00:00Z","10/05 06:00",3961,15745,,"2020-10-05T10:00:00Z",2734800,153142,,127791,3817,144,,1668317,,,,135193,11906,123287,,,,,"24",501,7969,1668317,19570,1668317,,3,40,"f13336bc5d600981c3f2e3822304833dcbde9de6",0,0,0,0,0,""
20201004,"MD",127290,,1532557,,"totalTestsViral",2715230,320,15705,77,,,,7653,"10/4/2020 10:00","2020-10-04T10:00:00Z","10/04 06:00",3958,15705,,"2020-10-04T10:00:00Z",2715230,152548,,127290,3814,144,,1659847,,,,135193,11906,123287,,,,,"24",471,9651,1659847,26364,1659847,,1,35,"313357637729e98b742adc5688fddfab4e0922f3",0,0,0,0,0,""
20201003,"MD",126819,,1522906,,"totalTestsViral",2688866,323,15670,78,,,,7652,"10/3/2020 10:00","2020-10-03T10:00:00Z","10/03 06:00",3957,15670,,"2020-10-03T10:00:00Z",2688866,151997,,126819,3813,144,,1649725,,,,135193,11906,123287,,,,,"24",597,9343,1649725,28066,1649725,,7,96,"a8ef073ceaa3f897054297c7e3409aa27b342da1",0,0,0,0,0,""
20201002,"MD",126222,,1513563,,"totalTestsViral",2660800,323,15574,80,,,,7606,"10/2/2020 10:00","2020-10-02T10:00:00Z","10/02 06:00",3950,15574,,"2020-10-02T10:00:00Z",2660800,151268,,126222,3806,144,,1639785,,,,135193,11906,123287,,,,,"24",712,10873,1639785,30902,1639785,,1,32,"94b7147a0d14b354f0463adc07e857472598e491",0,0,0,0,0,""
20201001,"MD",125510,,1502690,,"totalTestsViral",2629898,331,15542,74,,,,7568,"10/1/2020 10:00","2020-10-01T10:00:00Z","10/01 06:00",3949,15542,,"2020-10-01T10:00:00Z",2629898,150425,,125510,3805,144,,1628200,,,,135193,11906,123287,,,,,"24",785,9408,1628200,23985,1628200,,0,12,"9747e83722e4f653406316ecf4db9af3e54b3a3b",0,0,0,0,0,""
20200930,"MD",124725,,1493282,,"totalTestsViral",2605913,334,15530,77,,,,7536,"9/30/2020 10:00","2020-09-30T10:00:00Z","09/30 06:00",3949,15530,,"2020-09-30T10:00:00Z",2605913,149458,,124725,3805,144,,1618007,,,,135193,11906,123287,,,,,"24",414,7283,1618007,17223,1618007,,3,70,"3de60247654b6e1b61c4849275085876ab07ab3b",0,0,0,0,0,""
20200929,"MD",124311,,1485999,,"totalTestsViral",2588690,344,15460,79,,,,7509,"9/29/2020 10:00","2020-09-29T10:00:00Z","09/29 06:00",3946,15460,,"2020-09-29T10:00:00Z",2588690,148896,,124311,3802,144,,1610310,,,,132108,11517,120591,,,,,"24",431,6780,1610310,15083,1610310,,8,32,"264bcc3f93de01c5f60af64b8c1655f76152abf4",0,0,0,0,0,""
20200928,"MD",123880,,1479219,,"totalTestsViral",2573607,315,15428,82,,,,7476,"9/28/2020 10:00","2020-09-28T10:00:00Z","09/28 06:00",3938,15428,,"2020-09-28T10:00:00Z",2573607,148419,,123880,3793,145,,1603099,,,,132108,11517,120591,,,,,"24",477,8259,1603099,17902,1603099,,3,30,"0518152ff16ea6f8a240c03f5ac9e763b14bd846",0,0,0,0,0,""
20200927,"MD",123403,,1470960,,"totalTestsViral",2555705,328,15398,90,,,,7463,"9/27/2020 10:00","2020-09-27T10:00:00Z","09/27 06:00",3935,15398,,"2020-09-27T10:00:00Z",2555705,147832,,123403,3790,145,,1594363,,,,132108,11517,120591,,,,,"24",431,9632,1594363,30047,1594363,,10,16,"da7cecb9a4f246c5be0f0d2e43863664118e488b",0,0,0,0,0,""
20200926,"MD",122972,,1461328,,"totalTestsViral",2525658,347,15382,81,,,,7458,"9/26/2020 10:00","2020-09-26T10:00:00Z","09/26 06:00",3925,15382,,"2020-09-26T10:00:00Z",2525658,147256,,122972,3780,145,,1584300,,,,132108,11517,120591,,,,,"24",613,11203,1584300,31639,1584300,,8,54,"538172f79c06b9b6ce1824e6ef478d83b492efce",0,0,0,0,0,""
20200925,"MD",122359,,1450125,,"totalTestsViral",2494019,344,15328,79,,,,7431,"9/25/2020 10:00","2020-09-25T10:00:00Z","09/25 06:00",3917,15328,,"2020-09-25T10:00:00Z",2494019,146476,,122359,3772,145,,1572484,,,,132108,11517,120591,,,,,"24",559,10346,1572484,29092,1572484,,8,29,"18075ce51c6ee6bfab89985351191267e678dbc9",0,0,0,0,0,""
20200924,"MD",121800,,1439779,,"totalTestsViral",2464927,349,15299,81,,,,7416,"9/24/2020 10:00","2020-09-24T10:00:00Z","09/24 06:00",3909,15299,,"2020-09-24T10:00:00Z",2464927,145786,,121800,3765,144,,1561579,,,,132108,11517,120591,,,,,"24",503,8971,1561579,23702,1561579,,7,31,"0255d21c9da3b2b3de99abc35dead0f9166ac2e4",0,0,0,0,0,""
20200923,"MD",121297,,1430808,,"totalTestsViral",2441225,332,15268,79,,,,7396,"9/23/2020 10:00","2020-09-23T10:00:00Z","09/23 06:00",3902,15268,,"2020-09-23T10:00:00Z",2441225,145163,,121297,3756,146,,1552105,,,,132108,11517,120591,,,,,"24",385,7706,1552105,19158,1552105,,7,31,"aa2032c4b5db3faccec557baadb8eb9fb4ebbc83",0,0,0,0,0,""
20200922,"MD",120912,,1423102,,"totalTestsViral",2422067,309,15237,77,,,,7394,"9/22/2020 10:00","2020-09-22T10:00:00Z","09/22 06:00",3895,15237,,"2020-09-22T10:00:00Z",2422067,144660,,120912,3748,147,,1544014,,,,128640,10993,117647,,,,,"24",344,6041,1544014,14449,1544014,,12,66,"a909036e5b4226c1ab24f52c899734f79da95d9b",0,0,0,0,0,""
20200921,"MD",120568,,1417061,,"totalTestsViral",2407618,290,15171,71,,,,7378,"9/21/2020 10:00","2020-09-21T10:00:00Z","09/21 06:00",3883,15171,,"2020-09-21T10:00:00Z",2407618,144212,,120568,3739,144,,1537629,,,,128640,10993,117647,,,,,"24",412,7741,1537629,17349,1537629,,4,52,"48280b048baf5a2bba34df28b89fe272c19063fa",0,0,0,0,0,""
20200920,"MD",120156,,1409320,,"totalTestsViral",2390269,281,15119,68,,,,7377,"9/20/2020 10:00","2020-09-20T10:00:00Z","09/20 06:00",3879,15119,,"2020-09-20T10:00:00Z",2390269,143721,,120156,3735,144,,1529476,,,,128640,10993,117647,,,,,"24",412,10260,1529476,28886,1529476,,3,0,"ff039cda30be60e821eb5f36654bc0b5381aa62e",0,0,0,0,0,""
20200919,"MD",119744,,1399060,,"totalTestsViral",2361383,324,15119,75,,,,7374,"9/19/2020 10:00","2020-09-19T10:00:00Z","09/19 06:00",3876,15119,,"2020-09-19T10:00:00Z",2361383,143174,,119744,3732,144,,1518804,,,,128640,10993,117647,,,,,"24",682,13255,1518804,37131,1518804,,7,49,"111143e968c5002226035e44ebd43f103a45f5a3",0,0,0,0,0,""
20200918,"MD",119062,,1385805,,"totalTestsViral",2324252,347,15070,84,,,,7351,"9/18/2020 10:00","2020-09-18T10:00:00Z","09/18 06:00",3869,15070,,"2020-09-18T10:00:00Z",2324252,142395,,119062,3724,145,,1504867,,,,128640,10993,117647,,,,,"24",543,9982,1504867,24644,1504867,,8,62,"9abfdf3e41543cbed0960c3a889112dee03bb640",0,0,0,0,0,""
20200917,"MD",118519,,1375823,,"totalTestsViral",2299608,353,15008,83,,,,7311,"9/17/2020 10:00","2020-09-17T10:00:00Z","09/17 06:00",3861,15008,,"2020-09-17T10:00:00Z",2299608,141723,,118519,3717,144,,1494342,,,,128640,10993,117647,,,,,"24",631,10753,1494342,27343,1494342,,6,49,"c6fa270a7e0908d49d91c507e7b5febdb2473fd6",0,0,0,0,0,""
20200916,"MD",117888,,1365070,,"totalTestsViral",2272265,347,14959,86,,,,7286,"9/16/2020 10:00","2020-09-16T10:00:00Z","09/16 06:00",3855,14959,,"2020-09-16T10:00:00Z",2272265,140960,,117888,3712,143,,1482958,,,,128640,10993,117647,,,,,"24",643,9533,1482958,26599,1482958,,6,41,"31febe063700010afa686782090c8b100f65f3b0",0,0,0,0,0,""
20200915,"MD",117245,,1355537,,"totalTestsViral",2245666,371,14918,93,,,,7254,"9/15/2020 10:00","2020-09-15T10:00:00Z","09/15 06:00",3849,14918,,"2020-09-15T10:00:00Z",2245666,140136,,117245,3706,143,,1472782,,,,125277,10638,114639,,,,,"24",599,7320,1472782,19011,1472782,,10,34,"f8f8c191c6fc08e4f92bdf6d39c598abf8f4925e",0,0,0,0,0,""
20200914,"MD",116646,,1348217,,"totalTestsViral",2226655,347,14884,90,,,,7229,"9/14/2020 10:00","2020-09-14T10:00:00Z","09/14 06:00",3839,14884,,"2020-09-14T10:00:00Z",2226655,139370,,116646,3696,143,,1464863,,,,125277,10638,114639,,,,,"24",536,8482,1464863,19197,1464863,,1,33,"b189e8500ddae75c547cd027a1c7b1547095c51d",0,0,0,0,0,""
20200913,"MD",116110,,1339735,,"totalTestsViral",2207458,351,14851,89,,,,7225,"9/13/2020 10:00","2020-09-13T10:00:00Z","09/13 06:00",3838,14851,,"2020-09-13T10:00:00Z",2207458,138731,,116110,3695,143,,1455845,,,,125277,10638,114639,,,,,"24",577,10816,1455845,23517,1455845,,2,55,"fcf196985fcbbcc86fbc30db31c08dcf69a5021a",0,0,0,0,0,""
20200912,"MD",115533,,1328919,,"totalTestsViral",2183941,361,14796,85,,,,7221,"9/12/2020 10:00","2020-09-12T10:00:00Z","09/12 06:00",3836,14796,,"2020-09-12T10:00:00Z",2183941,137934,,115533,3693,143,,1444452,,,,125277,10638,114639,,,,,"24",809,10767,1444452,33303,1444452,,8,40,"ee825b5468f83e0b838d6052a8703316e86c1a92",0,0,0,0,0,""
20200911,"MD",114724,,1318152,,"totalTestsViral",2150638,369,14756,89,,,,7186,"9/11/2020 10:00","2020-09-11T10:00:00Z","09/11 06:00",3828,14756,,"2020-09-11T10:00:00Z",2150638,136897,,114724,3685,143,,1432876,,,,125277,10638,114639,,,,,"24",646,8503,1432876,22614,1432876,,4,50,"8157f8b75d6358c3ab039e43f94695be25f645ee",0,0,0,0,0,""
20200910,"MD",114078,,1309649,,"totalTestsViral",2128024,358,14706,92,,,,7166,"9/10/2020 10:00","2020-09-10T10:00:00Z","09/10 06:00",3824,14706,,"2020-09-10T10:00:00Z",2128024,136095,,114078,3679,145,,1423727,,,,125277,10638,114639,,,,,"24",503,7702,1423727,18551,1423727,,8,34,"eedb5db14abdacf909e309bf125df878721475ad",0,0,0,0,0,""
20200909,"MD",113575,,1301947,,"totalTestsViral",2109473,370,14672,95,,,,7157,"9/9/2020 10:00","2020-09-09T10:00:00Z","09/09 06:00",3816,14672,,"2020-09-09T10:00:00Z",2109473,135426,,113575,3672,144,,1415522,,,,125277,10638,114639,,,,,"24",336,4588,1415522,9911,1415522,,9,36,"1a88745b417853a482e61a7fb5e62e227a3c8264",0,0,0,0,0,""
20200908,"MD",113239,,1297359,,"totalTestsViral",2099562,365,14636,102,,,,7142,"9/8/2020 10:00","2020-09-08T10:00:00Z","09/08 06:00",3807,14636,,"2020-09-08T10:00:00Z",2099562,135007,,113239,3663,144,,1410598,,,,122033,10303,111730,,,,,"24",356,5053,1410598,12953,1410598,,3,33,"03b626099f3ea9abaddbef25b9dcd93e460fe920",0,0,0,0,0,""
20200907,"MD",112883,,1292306,,"totalTestsViral",2086609,362,14603,109,,,,7112,"9/7/2020 10:00","2020-09-07T10:00:00Z","09/07 06:00",3804,14603,,"2020-09-07T10:00:00Z",2086609,134549,,112883,3660,144,,1405189,,,,122033,10303,111730,,,,,"24",764,11101,1405189,22370,1405189,,5,30,"748f9a287aa02a8e07ed5475be22250e2f520374",0,0,0,0,0,""
20200906,"MD",112119,,1281205,,"totalTestsViral",2064239,341,14573,96,,,,7103,"9/6/2020 10:00","2020-09-06T10:00:00Z","09/06 06:00",3799,14573,,"2020-09-06T10:00:00Z",2064239,133590,,112119,3655,144,,1393324,,,,122033,10303,111730,,,,,"24",512,8357,1393324,16723,1393324,,3,57,"7e50680dbf69dd269fc25f15193688dc7e87c34d",0,0,0,0,0,""
20200905,"MD",111607,,1272848,,"totalTestsViral",2047516,353,14516,100,,,,7099,"9/5/2020 10:00","2020-09-05T10:00:00Z","09/05 06:00",3796,14516,,"2020-09-05T10:00:00Z",2047516,132974,,111607,3652,144,,1384455,,,,122033,10303,111730,,,,,"24",776,12214,1384455,28192,1384455,,7,43,"1fbffba8b3c76f8fb9d313ffd94a73f12ea6a157",0,0,0,0,0,""
20200904,"MD",110831,,1260634,,"totalTestsViral",2019324,395,14473,108,,,,7072,"9/4/2020 10:00","2020-09-04T10:00:00Z","09/04 06:00",3789,14473,,"2020-09-04T10:00:00Z",2019324,132036,,110831,3645,144,,1371465,,,,122033,10303,111730,,,,,"24",819,13041,1371465,29433,1371465,,11,46,"042ecd0a5b319388b43a75a00e85542efbea136d",0,0,0,0,0,""
20200903,"MD",110012,,1247593,,"totalTestsViral",1989891,382,14427,112,,,,7039,"9/3/2020 10:00","2020-09-03T10:00:00Z","09/03 06:00",3778,14427,,"2020-09-03T10:00:00Z",1989891,131077,,110012,3634,144,,1357605,,,,122033,10303,111730,,,,,"24",693,11266,1357605,24960,1357605,,12,76,"81de119aa2f373801dfaac168e0f6344af4188cc",0,0,0,0,0,""
20200902,"MD",109319,,1236327,,"totalTestsViral",1964931,370,14351,113,,,,7026,"9/2/2020 10:00","2020-09-02T10:00:00Z","09/02 06:00",3766,14351,,"2020-09-02T10:00:00Z",1964931,130196,,109319,3623,143,,1345646,,,,122033,10303,111730,,,,,"24",456,6273,1345646,12430,1345646,,5,14,"d401de77b7bebb0bd126cf8f408bc9cec83d4f5d",0,0,0,0,0,""
20200901,"MD",108863,,1230054,,"totalTestsViral",1952501,385,14337,112,,,,6976,"9/1/2020 10:00","2020-09-01T10:00:00Z","09/01 06:00",3761,14337,,"2020-09-01T10:00:00Z",1952501,129682,,108863,3617,144,,1338917,,,,117902,9906,107996,,,,,"24",614,7450,1338917,13655,1338917,,6,34,"7517c6378ba7655ab53c2c463435717d48a625d0",0,0,0,0,0,""
20200831,"MD",108249,,1222604,,"totalTestsViral",1938846,377,14303,107,,,,6124,"8/31/2020 10:00","2020-08-31T10:00:00Z","08/31 06:00",3755,14303,,"2020-08-31T10:00:00Z",1938846,129045,,108249,3612,143,,1330853,,,,117902,9906,107996,,,,,"24",458,11157,1330853,19331,1330853,,3,48,"941b7cd18e5da3c2a4f98769f7929a40dcb5799d",0,0,0,0,0,""
20200830,"MD",107791,,1211447,,"totalTestsViral",1919515,358,14255,107,,,,6124,"8/30/2020 10:00","2020-08-30T10:00:00Z","08/30 06:00",3752,14255,,"2020-08-30T10:00:00Z",1919515,128493,,107791,3609,143,,1319238,,,,117902,9906,107996,,,,,"24",497,14258,1319238,25105,1319238,,6,38,"ee4a41766d0090eaaea9e6b6a7b93f29314a33d9",0,0,0,0,0,""
20200829,"MD",107294,,1197189,,"totalTestsViral",1894410,387,14217,106,,,,6124,"8/29/2020 10:00","2020-08-29T10:00:00Z","08/29 06:00",3746,14217,,"2020-08-29T10:00:00Z",1894410,127872,,107294,3603,143,,1304483,,,,117902,9906,107996,,,,,"24",630,12583,1304483,25483,1304483,,10,33,"4854dd24f74d189cc67e5e0af74c977a5b55f0d8",0,0,0,0,0,""
20200828,"MD",106664,,1184606,,"totalTestsViral",1868927,412,14184,106,,,,6124,"8/28/2020 10:00","2020-08-28T10:00:00Z","08/28 06:00",3736,14184,,"2020-08-28T10:00:00Z",1868927,125830,,106664,3593,143,,1291270,,,,117902,9906,107996,,,,,"24",601,15587,1291270,27502,1291270,,14,43,"b1c0c73720af522c7a4d838a7388c754e39c8cc4",0,0,0,0,0,""
20200827,"MD",106063,,1169019,,"totalTestsViral",1841425,412,14141,107,,,,6080,"8/27/2020 10:00","2020-08-27T10:00:00Z","08/27 06:00",3722,14141,,"2020-08-27T10:00:00Z",1841425,125056,,106063,3580,142,,1275082,,,,117902,9906,107996,,,,,"24",577,11334,1275082,21475,1275082,,5,51,"2125b90b55197135d61f0a9526e211b736a0ff0a",0,0,0,0,0,""
20200826,"MD",105486,,1157685,,"totalTestsViral",1819950,432,14090,106,,,,6061,"8/26/2020 10:00","2020-08-26T10:00:00Z","08/26 06:00",3717,14090,,"2020-08-26T10:00:00Z",1819950,124368,,105486,3574,143,,1263171,,,,117902,9906,107996,,,,,"24",440,7166,1263171,12377,1263171,,10,39,"f15bc1d2918af6e34704d4bd16417e87cd0f618b",0,0,0,0,0,""
20200825,"MD",105046,,1150519,,"totalTestsViral",1807573,411,14051,97,,,,6056,"8/25/2020 10:00","2020-08-25T10:00:00Z","08/25 06:00",3707,14051,,"2020-08-25T10:00:00Z",1807573,123831,,105046,3564,143,,1255565,,,,113157,9431,103726,,,,,"24",377,7595,1255565,12870,1255565,,13,44,"c91542e0b45784f663d6091f0fd450e50a091b25",0,0,0,0,0,""
20200824,"MD",104669,,1142924,,"totalTestsViral",1794703,407,14007,103,,,,6047,"8/24/2020 10:00","2020-08-24T10:00:00Z","08/24 06:00",3694,14007,,"2020-08-24T10:00:00Z",1794703,123344,,104669,3554,140,,1247593,,,,113157,9431,103726,,,,,"24",567,14130,1247593,22047,1247593,,3,51,"64ab093c95b2027bc8f1c791887cb41ebe9ee6ce",0,0,0,0,0,""
20200823,"MD",104102,,1128794,,"totalTestsViral",1772656,407,13956,99,,,,6047,"8/23/2020 10:00","2020-08-23T10:00:00Z","08/23 06:00",3691,13956,,"2020-08-23T10:00:00Z",1772656,122660,,104102,3552,139,,1232896,,,,113157,9431,103726,,,,,"24",579,11876,1232896,21141,1232896,,6,92,"bf844f20ec9ab4e2ec8187a6865cc131a7726ba2",0,0,0,0,0,""
20200822,"MD",103523,,1116918,,"totalTestsViral",1751515,441,13864,98,,,,6047,"8/22/2020 10:00","2020-08-22T10:00:00Z","08/22 06:00",3685,13864,,"2020-08-22T10:00:00Z",1751515,122025,,103523,3546,139,,1220441,,,,113157,9431,103726,,,,,"24",624,15550,1220441,28558,1220441,,11,41,"514bc69691e0409822708c5ae962f6c34f5735fe",0,0,0,0,0,""
20200821,"MD",102899,,1101368,,"totalTestsViral",1722957,455,13823,102,,,,6047,"8/21/2020 10:00","2020-08-21T10:00:00Z","08/21 06:00",3674,13823,,"2020-08-21T10:00:00Z",1722957,121174,,102899,3536,138,,1204267,,,,113157,9431,103726,,,,,"24",670,15921,1204267,29386,1204267,,5,38,"203825055d120f00f3258fdedb2d89db9ee043ea",0,0,0,0,0,""
20200820,"MD",102229,,1085447,,"totalTestsViral",1693571,455,13785,107,,,,6040,"8/20/2020 10:00","2020-08-20T10:00:00Z","08/20 06:00",3669,13785,,"2020-08-20T10:00:00Z",1693571,120372,,102229,3531,138,,1187676,,,,113157,9431,103726,,,,,"24",580,11328,1187676,18041,1187676,,8,41,"c7290876a990d4419f539114935413b92ddb5871",0,0,0,0,0,""
20200819,"MD",101649,,1074119,,"totalTestsViral",1675530,475,13744,107,,,,6030,"8/19/2020 10:00","2020-08-19T10:00:00Z","08/19 06:00",3661,13744,,"2020-08-19T10:00:00Z",1675530,119743,,101649,3522,139,,1175768,,,,113157,9431,103726,,,,,"24",414,8049,1175768,13829,1175768,,11,46,"eca8b926be2f8f3751e8d5ec3e27a6c426837070",0,0,0,0,0,""
20200818,"MD",101235,,1066070,,"totalTestsViral",1661701,453,13698,102,,,,6008,"8/18/2020 10:00","2020-08-18T10:00:00Z","08/18 06:00",3650,13698,,"2020-08-18T10:00:00Z",1661701,119238,,101235,3511,139,,1167305,,,,109333,9051,100282,,,,,"24",520,9173,1167305,16059,1167305,,9,40,"c9b0fefe0262d06e2e000407ff7fa01ffa88022b",0,0,0,0,0,""
20200817,"MD",100715,,1056897,,"totalTestsViral",1645642,435,13658,106,,,,6008,"8/17/2020 10:00","2020-08-17T10:00:00Z","08/17 06:00",3641,13658,,"2020-08-17T10:00:00Z",1645642,118601,,100715,3504,137,,1157612,,,,109333,9051,100282,,,,,"24",503,14699,1157612,34401,1157612,,2,44,"68eb000d4bb6ba96ed73bf745cb4bd00abd4c7f1",0,0,0,0,0,""
20200816,"MD",100212,,1042198,,"totalTestsViral",1611241,475,13614,115,,,,6004,"8/16/2020 10:00","2020-08-16T10:00:00Z","08/16 06:00",3639,13614,,"2020-08-16T10:00:00Z",1611241,117988,,100212,3502,137,,1142410,,,,109333,9051,100282,,,,,"24",519,14239,1142410,25571,1142410,,3,58,"b537aac8867476ad35f65b410faf8e0db18a503b",0,0,0,0,0,""
20200815,"MD",99693,,1027959,,"totalTestsViral",1585670,460,13556,107,,,,5995,"8/15/2020 10:00","2020-08-15T10:00:00Z","08/15 06:00",3636,13556,,"2020-08-15T10:00:00Z",1585670,117306,,99693,3499,137,,1127652,,,,109333,9051,100282,,,,,"24",818,16561,1127652,33600,1127652,,5,48,"0d33b808f60f2405ce796bcaaa2fd90dae3f4ea6",0,0,0,0,0,""
20200814,"MD",98875,,1011398,,"totalTestsViral",1552070,457,13508,107,,,,5986,"8/14/2020 10:00","2020-08-14T10:00:00Z","08/14 06:00",3631,13508,,"2020-08-14T10:00:00Z",1552070,116321,,98875,3495,136,,1110273,,,,109333,9051,100282,,,,,"24",715,14464,1110273,24140,1110273,,11,45,"554b6d262ac0795faaaaf00a27774a7c6e5ea369",0,0,0,0,0,""
20200813,"MD",98160,,996934,,"totalTestsViral",1527930,470,13463,111,,,,5962,"8/13/2020 10:00","2020-08-13T10:00:00Z","08/13 06:00",3620,13463,,"2020-08-13T10:00:00Z",1527930,115312,,98160,3483,137,,1095094,,,,109333,9051,100282,,,,,"24",776,15480,1095094,29842,1095094,,8,115,"89ba5178c36a45322f18512a455ed65838784d3c",0,0,0,0,0,""
20200812,"MD",97384,,981454,,"totalTestsViral",1498088,488,13348,117,,,,5956,"8/12/2020 10:00","2020-08-12T10:00:00Z","08/12 06:00",3612,13348,,"2020-08-12T10:00:00Z",1498088,114406,,97384,3474,138,,1078838,,,,102116,8370,93746,,,,,"24",541,10838,1078838,18015,1078838,,8,82,"2090640c1245bc66fa6654b0ac09102c29619fcc",0,0,0,0,0,""
20200811,"MD",96843,,970616,,"totalTestsViral",1480073,529,13266,121,,,,5935,"8/11/2020 10:00","2020-08-11T10:00:00Z","08/11 06:00",3604,13266,,"2020-08-11T10:00:00Z",1480073,113761,,96843,3467,137,,1067459,,,,102116,8370,93746,,,,,"24",585,10064,1067459,17145,1067459,,13,19,"6da385eb3262b1cd419f0ed5f413eee74d4a1364",0,0,0,0,0,""
20200810,"MD",96258,,960552,,"totalTestsViral",1462928,534,13247,119,,,,5910,"8/10/2020 10:00","2020-08-10T10:00:00Z","08/10 06:00",3591,13247,,"2020-08-10T10:00:00Z",1462928,113011,,96258,3454,137,,1056810,,,,102116,8370,93746,,,,,"24",755,16710,1056810,29532,1056810,,6,70,"bf5cfeffb1b292dc254371392919ad626da91cb0",0,0,0,0,0,""
20200809,"MD",95503,,943842,,"totalTestsViral",1433396,525,13177,128,,,,5910,"8/9/2020 10:00","2020-08-09T10:00:00Z","08/09 06:00",3585,13177,,"2020-08-09T10:00:00Z",1433396,112072,,95503,3448,137,,1039345,,,,102116,8370,93746,,,,,"24",922,18900,1039345,40672,1039345,,8,72,"47b121aa88a470bd0df55476c3c675e1ca2a6ab4",0,0,0,0,0,""
20200808,"MD",94581,,924942,,"totalTestsViral",1392724,515,13105,127,,,,5899,"8/8/2020 10:00","2020-08-08T10:00:00Z","08/08 06:00",3577,13105,,"2020-08-08T10:00:00Z",1392724,110972,,94581,3440,137,,1019523,,,,102116,8370,93746,,,,,"24",775,11924,1019523,20807,1019523,,12,58,"6dedc0dd34abbed887d8e186e1c766575b871b89",0,0,0,0,0,""
20200807,"MD",93806,,913018,,"totalTestsViral",1371917,528,13047,135,,,,5838,"8/7/2020 10:00","2020-08-07T10:00:00Z","08/07 06:00",3565,13047,,"2020-08-07T10:00:00Z",1371917,110068,,93806,3429,136,,1006824,,,,102116,8370,93746,,,,,"24",801,13882,1006824,28583,1006824,,14,69,"b1eaaf4d35cd9d4ad1acd4e95fca9ee9ba515cce",0,0,0,0,0,""
20200806,"MD",93005,,899136,,"totalTestsViral",1343334,535,12978,139,,,,5790,"8/6/2020 10:00","2020-08-06T10:00:00Z","08/06 06:00",3551,12978,,"2020-08-06T10:00:00Z",1343334,109142,,93005,3415,136,,992141,,,,102116,8370,93746,,,,,"24",579,9167,992141,16699,992141,,15,56,"0263e7414ea12901aeb42c1b75e70eabca406bf0",0,0,0,0,0,""
20200805,"MD",92426,,889969,,"totalTestsViral",1326635,555,12922,134,,,,5749,"8/5/2020 10:00","2020-08-05T10:00:00Z","08/05 06:00",3536,12922,,"2020-08-05T10:00:00Z",1326635,108502,,92426,3402,134,,982395,,,,102116,8370,93746,,,,,"24",572,9477,982395,21762,982395,,6,34,"5f5ee9d37eb22b4eab6580bc106297305033687a",0,0,0,0,0,""
20200804,"MD",91854,,880492,,"totalTestsViral",1304873,547,12888,137,,,,5740,"8/4/2020 10:00","2020-08-04T10:00:00Z","08/04 06:00",3530,12888,,"2020-08-04T10:00:00Z",1304873,107832,,91854,3396,134,,972346,,,,96518,7891,88627,,,,,"24",710,10999,972346,16377,972346,,7,56,"1cd6af1d0d7c9e8263b268b3e41c945ea15dc263",0,0,0,0,0,""
20200803,"MD",91144,,869493,,"totalTestsViral",1288496,548,12832,135,,,,5740,"8/3/2020 10:00","2020-08-03T10:00:00Z","08/03 06:00",3523,12832,,"2020-08-03T10:00:00Z",1288496,107019,,91144,3389,134,,960637,,,,96518,7891,88627,,,,,"24",870,14981,960637,24484,960637,,8,86,"b681ab35f5e8d8308debc7a201e93affeedcdaae",0,0,0,0,0,""
20200802,"MD",90274,,854512,,"totalTestsViral",1264012,553,12746,129,,,,5713,"8/2/2020 10:00","2020-08-02T10:00:00Z","08/02 06:00",3515,12746,,"2020-08-02T10:00:00Z",1264012,106014,,90274,3381,134,,944786,,,,96518,7891,88627,,,,,"24",909,14523,944786,23785,944786,,9,74,"9e51a803607e57593bef6b1e341b503b84aaaf1c",0,0,0,0,0,""
20200801,"MD",89365,,839989,,"totalTestsViral",1240227,592,12672,132,,,,5713,"8/1/2020 10:00","2020-08-01T10:00:00Z","08/01 06:00",3506,12672,,"2020-08-01T10:00:00Z",1240227,104907,,89365,3374,132,,929354,,,,96518,7891,88627,,,,,"24",1019,17144,929354,31004,929354,,13,79,"8a5c90bd6d9540635f7970d12cbfb6963929f4fb",0,0,0,0,0,""
20200731,"MD",88346,,822845,,"totalTestsViral",1209223,590,12593,128,,,,5689,"7/31/2020 10:00","2020-07-31T10:00:00Z","07/31 06:00",3493,12593,,"2020-07-31T10:00:00Z",1209223,103840,,88346,3362,131,,911191,,,,96518,7891,88627,,,,,"24",1169,16057,911191,28632,911191,,5,93,"a866f69ad638fef50abc9354b456eac91daeeb3a",0,0,0,0,0,""
20200730,"MD",87177,,806788,,"totalTestsViral",1180591,585,12500,139,,,,5592,"7/30/2020 10:00","2020-07-30T10:00:00Z","07/30 06:00",3488,12500,,"2020-07-30T10:00:00Z",1180591,102659,,87177,3357,131,,893965,,,,96518,7891,88627,,,,,"24",892,14114,893965,25689,893965,,10,52,"77f19a81cd88ccff0b3408fcf5a4f4467c10bcc5",0,0,0,0,0,""
20200729,"MD",86285,,792674,,"totalTestsViral",1154902,571,12448,145,,,,5592,"7/29/2020 10:00","2020-07-29T10:00:00Z","07/29 06:00",3478,12448,,"2020-07-29T10:00:00Z",1154902,101638,,86285,3347,131,,878959,,,,96518,7891,88627,,,,,"24",761,9942,878959,15747,878959,,20,59,"aa6a1bf6c049304f26f5d3c5a891411ecc6cb3cf",0,0,0,0,0,""
20200728,"MD",85524,,782732,,"totalTestsViral",1139155,544,12389,150,,,,5592,"7/28/2020 10:00","2020-07-28T10:00:00Z","07/28 06:00",3458,12389,,"2020-07-28T10:00:00Z",1139155,100717,,85524,3327,131,,868256,,,,,,,,,,,"24",648,12090,868256,23944,868256,,11,50,"7f8a49d4d85772b2e3d389ca1d2e6a3a55ffe498",0,0,0,0,0,""
20200727,"MD",84876,,770642,,"totalTestsViral",1115211,536,12339,145,,,,5434,"7/27/2020 10:00","2020-07-27T10:00:00Z","07/27 06:00",3447,12339,,"2020-07-27T10:00:00Z",1115211,99680,,84876,3315,132,,855518,,,,,,,,,,,"24",1128,15818,855518,23395,855518,,7,56,"c4daee251d27d6d04a171036feb8f1f3611853f7",0,0,0,0,0,""
20200726,"MD",83748,,754824,,"totalTestsViral",1091816,540,12283,153,,,,5434,"7/26/2020 10:00","2020-07-26T10:00:00Z","07/26 06:00",3440,12283,,"2020-07-26T10:00:00Z",1091816,98314,,83748,3309,131,,838572,,,,,,,,,,,"24",694,12552,838572,22041,838572,,7,95,"052faedeed7e0a043498513573c816234625a70e",0,0,0,0,0,""
20200725,"MD",83054,,742272,,"totalTestsViral",1069775,545,12188,157,,,,5434,"7/25/2020 10:00","2020-07-25T10:00:00Z","07/25 06:00",3433,12188,,"2020-07-25T10:00:00Z",1069775,97488,,83054,3304,129,,825326,,,,,,,,,,,"24",1288,19688,825326,34874,825326,,11,69,"ecafd6f6ab67461bc062a121a46bc85ec821ec96",0,0,0,0,0,""
20200724,"MD",81766,,722584,,"totalTestsViral",1034901,533,12119,143,,,,5434,"7/24/2020 10:00","2020-07-24T10:00:00Z","07/24 06:00",3422,12119,,"2020-07-24T10:00:00Z",1034901,96121,,81766,3293,129,,804350,,,,,,,,,,,"24",930,14379,804350,24220,804350,,13,82,"86985760662facf24e9ea5f1c6187a9aa8f1280a",0,0,0,0,0,""
20200723,"MD",80836,,708205,,"totalTestsViral",1010681,528,12037,133,,,,5434,"7/23/2020 10:00","2020-07-23T10:00:00Z","07/23 06:00",3409,12037,,"2020-07-23T10:00:00Z",1010681,95073,,80836,3281,128,,789041,,,,,,,,,,,"24",664,5544,789041,16044,789041,,4,40,"fd3681bfb258c56e7e468740881bc22729e1b1ca",0,0,0,0,0,""
20200722,"MD",80172,,702661,,"totalTestsViral",994637,505,11997,137,,,,5434,"7/22/2020 10:00","2020-07-22T10:00:00Z","07/22 06:00",3405,11997,,"2020-07-22T10:00:00Z",994637,94213,,80172,3276,129,,782833,,,,,,,,,,,"24",627,17839,782833,21021,782833,,3,48,"d92a5793424a1f4ef42182fd7038179c029425b7",0,0,0,0,0,""
20200721,"MD",79545,,684822,,"totalTestsViral",973616,484,11949,131,,,,5380,"7/21/2020 10:00","2020-07-21T10:00:00Z","07/21 06:00",3402,11949,,"2020-07-21T10:00:00Z",973616,93322,,79545,3272,130,,764367,,,,,,,,,,,"24",860,14228,764367,20550,764367,,20,52,"ddb9c85d81c3b42eef92a3ec8f948c6c1308c7a6",0,0,0,0,0,""
20200720,"MD",78685,,670594,,"totalTestsViral",953066,463,11897,136,,,,5344,"7/20/2020 10:00","2020-07-20T10:00:00Z","07/20 06:00",3382,11897,,"2020-07-20T10:00:00Z",953066,92337,,78685,3252,130,,749279,,,,,,,,,,,"24",554,8940,749279,14755,749279,,5,56,"33fe32edb3d080ac6c546e42929e4b33038bcbf3",0,0,0,0,0,""
20200719,"MD",78131,,661654,,"totalTestsViral",938311,449,11841,131,,,,5344,"7/19/2020 10:00","2020-07-19T10:00:00Z","07/19 06:00",3377,11841,,"2020-07-19T10:00:00Z",938311,91615,,78131,3247,130,,739785,,,,,,,,,,,"24",925,17874,739785,28899,739785,,9,53,"74122ee9b931796c995b9fc65b45b2eb04a72280",0,0,0,0,0,""
20200718,"MD",77206,,643780,,"totalTestsViral",909412,448,11788,137,,,,5344,"7/18/2020 10:00","2020-07-18T10:00:00Z","07/18 06:00",3368,11788,,"2020-07-18T10:00:00Z",909412,90508,,77206,3238,130,,720986,,,,,,,,,,,"24",835,11935,720986,18053,720986,,9,60,"b09173eaf7f14d073b9670721e279e396a5bed8a",0,0,0,0,0,""
20200717,"MD",76371,,631845,,"totalTestsViral",891359,434,11728,128,,,,5286,"7/17/2020 10:00","2020-07-17T10:00:00Z","07/17 06:00",3359,11728,,"2020-07-17T10:00:00Z",891359,89541,,76371,3227,132,,708216,,,,,,,,,,,"24",707,14980,708216,24171,708216,,12,41,"dce8b45a391bdba1df4b22d9b3dc081aeac7a515",0,0,0,0,0,""
20200716,"MD",75664,,616865,,"totalTestsViral",867188,436,11687,137,,,,5286,"7/16/2020 10:00","2020-07-16T10:00:00Z","07/16 06:00",3347,11687,,"2020-07-16T10:00:00Z",867188,88713,,75664,3215,132,,692529,,,,,,,,,,,"24",648,11793,692529,16891,692529,,6,62,"73224f6858a34c6bcfce468b83a160f7fe246b41",0,0,0,0,0,""
20200715,"MD",75016,,605072,,"totalTestsViral",850297,447,11625,129,,,,5238,"7/15/2020 10:00","2020-07-15T10:00:00Z","07/15 06:00",3341,11625,,"2020-07-15T10:00:00Z",850297,87891,,75016,3209,132,,680088,,,,,,,,,,,"24",756,13263,680088,21535,680088,,7,140,"0b2e88c147d7e5ea4cf686adbbac6ecb827be03f",0,0,0,0,0,""
20200714,"MD",74260,,591809,,"totalTestsViral",828762,415,11485,118,,,,5238,"7/14/2020 10:00","2020-07-14T10:00:00Z","07/14 06:00",3334,11485,,"2020-07-14T10:00:00Z",828762,86973,,74260,3202,132,,666069,,,,,,,,,,,"24",733,13379,666069,15415,666069,,9,18,"31690e508e157d234d2718bb75858656e5f818d6",0,0,0,0,0,""
20200713,"MD",73527,,578430,,"totalTestsViral",813347,386,11467,108,,,,5230,"7/13/2020 10:00","2020-07-13T10:00:00Z","07/13 06:00",3325,11467,,"2020-07-13T10:00:00Z",813347,86221,,73527,3194,131,,651957,,,,,,,,,,,"24",418,8148,651957,11067,651957,,6,47,"d1fe9652988b6e5a49671f8076ec7dae03a9cd4e",0,0,0,0,0,""
20200712,"MD",73109,,570282,,"totalTestsViral",802280,392,11420,114,,,,5230,"7/12/2020 10:00","2020-07-12T10:00:00Z","07/12 06:00",3319,11420,,"2020-07-12T10:00:00Z",802280,85712,,73109,3188,131,,643391,,,,,,,,,,,"24",642,13472,643391,21140,643391,,9,67,"1b100036c975bde05920e9c96fe3b23a9c37c6aa",0,0,0,0,0,""
20200711,"MD",72467,,556810,,"totalTestsViral",781140,390,11353,120,,,,5190,"7/11/2020 10:00","2020-07-11T10:00:00Z","07/11 06:00",3310,11353,,"2020-07-11T10:00:00Z",781140,84938,,72467,3179,131,,629277,,,,,,,,,,,"24",557,7657,629277,12129,629277,,7,53,"6cb2e48a51e8cd2d1b7c016097fa4fe091b5aac6",0,0,0,0,0,""
20200710,"MD",71910,,549153,,"totalTestsViral",769011,385,11300,122,,,,5157,"7/10/2020 10:00","2020-07-10T10:00:00Z","07/10 06:00",3303,11300,,"2020-07-10T10:00:00Z",769011,84290,,71910,3172,131,,621063,,,,,,,,,,,"24",463,8019,621063,13298,621063,,15,79,"cb365e535561769d0db49e33557ca56a18b5d662",0,0,0,0,0,""
20200709,"MD",71447,,541134,,"totalTestsViral",755713,406,11221,139,,,,5132,"7/9/2020 10:00","2020-07-09T10:00:00Z","07/09 06:00",3288,11221,,"2020-07-09T10:00:00Z",755713,83673,,71447,3160,128,,612581,,,,,,,,,,,"24",586,8887,612581,15119,612581,,13,37,"00479822034691821c3ebaeb96ee0987c7940877",0,0,0,0,0,""
20200708,"MD",70861,,532247,,"totalTestsViral",740594,398,11184,136,,,,5085,"7/8/2020 10:00","2020-07-08T10:00:00Z","07/08 06:00",3275,11184,,"2020-07-08T10:00:00Z",740594,83057,,70861,3149,126,,603108,,,,,,,,,,,"24",465,8265,603108,11934,603108,,9,73,"bb3c5522d3da60d7de541a2b4377c177911f58f6",0,0,0,0,0,""
20200707,"MD",70396,,523982,,"totalTestsViral",728660,404,11111,145,,,,5036,"7/7/2020 10:00","2020-07-07T10:00:00Z","07/07 06:00",3266,11111,,"2020-07-07T10:00:00Z",728660,82431,,70396,3140,126,,594378,,,,,,,,,,,"24",492,6525,594378,9879,594378,,20,15,"b30be705be24df88e2a4cd8fdcf04f0f7fd2405b",0,0,0,0,0,""
20200706,"MD",69904,,517457,,"totalTestsViral",718781,403,11096,142,,,,5029,"7/6/2020 10:00","2020-07-06T10:00:00Z","07/06 06:00",3246,11096,,"2020-07-06T10:00:00Z",718781,81953,,69904,3121,125,,587361,,,,,,,,,,,"24",272,7127,587361,10937,587361,,3,25,"63c65f301eea0bfc3324839655a4c96b42068594",0,0,0,0,0,""
20200705,"MD",69632,,510330,,"totalTestsViral",707844,409,11071,144,,,,5029,"7/5/2020 10:00","2020-07-05T10:00:00Z","07/05 06:00",3243,11071,,"2020-07-05T10:00:00Z",707844,81585,,69632,3118,125,,579962,,,,,,,,,,,"24",291,6329,579962,9076,579962,,7,37,"c0ec48ca41c08e55b541d92989f192122bde1b44",0,0,0,0,0,""
20200704,"MD",69341,,504001,,"totalTestsViral",698768,410,11034,143,,,,5025,"7/4/2020 10:00","2020-07-04T10:00:00Z","07/04 06:00",3236,11034,,"2020-07-04T10:00:00Z",698768,81192,,69341,3111,125,,573342,,,,,,,,,,,"24",380,9128,573342,12955,573342,,13,61,"924f877670935019bdc04b956056f0c44394f13a",0,0,0,0,0,""
20200703,"MD",68961,,494873,,"totalTestsViral",685813,422,10973,143,,,,5023,"7/3/2020 10:00","2020-07-03T10:00:00Z","07/03 06:00",3223,10973,,"2020-07-03T10:00:00Z",685813,80684,,68961,3099,124,,563834,,,,,,,,,,,"24",538,10121,563834,15564,563834,,11,34,"c920042f46567596096a009738c5b6328cc039f0",0,0,0,0,0,""
20200702,"MD",68423,,484752,,"totalTestsViral",670249,441,10939,149,,,,5013,"7/2/2020 10:00","2020-07-02T10:00:00Z","07/02 06:00",3212,10939,,"2020-07-02T10:00:00Z",670249,79758,,68423,3086,126,,553175,,,,,,,,,,,"24",505,10066,553175,13659,553175,,7,37,"a2fb472e5de2e1f404295dbcd661260159a0fcf2",0,0,0,0,0,""
20200701,"MD",67918,,474686,,"totalTestsViral",656590,461,10902,154,,,,5001,"7/1/2020 10:00","2020-07-01T10:00:00Z","07/01 06:00",3205,10902,,"2020-07-01T10:00:00Z",656590,79129,,67918,3077,128,,542604,,,,,,,,,,,"24",359,6390,542604,9571,542604,,15,58,"4bfcb1386411204270a970112372c0ea47475f31",0,0,0,0,0,""
20200630,"MD",67559,,468296,,"totalTestsViral",647019,452,10844,152,,,,4982,"6/30/2020 10:00","2020-06-30T10:00:00Z","06/30 06:00",3190,10844,,"2020-06-30T10:00:00Z",647019,78682,,67559,3062,128,,535855,,,,,,,,,,,"24",305,6237,535855,8682,535855,,15,22,"668809bd0fb3289892cb790145910afa8d671e0c",0,0,0,0,0,""
20200629,"MD",67254,,462059,,"totalTestsViral",638337,447,10822,160,,,,4979,"6/29/2020 10:00","2020-06-29T10:00:00Z","06/29 06:00",3175,10822,,"2020-06-29T10:00:00Z",638337,78273,,67254,3048,127,,529313,,,,,,,,,,,"24",477,9363,529313,12536,529313,,7,29,"737b4229164d8be738303088ef8b55f63bbb5165",0,0,0,0,0,""
20200628,"MD",66777,,452696,,"totalTestsViral",625801,446,10793,158,,,,4976,"6/28/2020 10:00","2020-06-28T10:00:00Z","06/28 06:00",3168,10793,,"2020-06-28T10:00:00Z",625801,77679,,66777,3042,126,,519473,,,,,,,,,,,"24",327,5330,519473,7564,519473,,11,42,"44677764cd23a21d1c4e8e0c77c1fb8b6624ce35",0,0,0,0,0,""
20200627,"MD",66450,,447366,,"totalTestsViral",618237,478,10751,181,,,,4935,"6/27/2020 10:00","2020-06-27T10:00:00Z","06/27 06:00",3157,10751,,"2020-06-27T10:00:00Z",618237,77264,,66450,3030,127,,513816,,,,,,,,,,,"24",335,7084,513816,10414,513816,,15,26,"7ab3c056734ae1eb7f13a94d854f555853195c09",0,0,0,0,0,""
20200626,"MD",66115,,440282,,"totalTestsViral",607823,487,10725,190,,,,4903,"6/26/2020 10:00","2020-06-26T10:00:00Z","06/26 06:00",3142,10725,,"2020-06-26T10:00:00Z",607823,76821,,66115,3015,127,,506397,,,,,,,,,,,"24",338,7100,506397,9914,506397,,13,42,"dd3e62a93c2e37fbad1c62ae2bf1759393725100",0,0,0,0,0,""
20200625,"MD",65777,,433182,,"totalTestsViral",597909,511,10683,209,,,,4874,"6/25/2020 10:00","2020-06-25T10:00:00Z","06/25 06:00",3129,10683,,"2020-06-25T10:00:00Z",597909,76340,,65777,3001,128,,498959,,,,,,,,,,,"24",440,8062,498959,11637,498959,,21,35,"85567d6c79253192f74d97c54129774864251d14",0,0,0,0,0,""
20200624,"MD",65337,,425120,,"totalTestsViral",586272,544,10648,213,,,,4810,"6/24/2020 10:00","2020-06-24T10:00:00Z","06/24 06:00",3108,10648,,"2020-06-24T10:00:00Z",586272,75828,,65337,2978,130,,490457,,,,,,,,,,,"24",330,6592,490457,8887,490457,,16,37,"f1d50b0cf888dc7b41cfe8c592bc4bc9c2f8911d",0,0,0,0,0,""
20200623,"MD",65007,,418528,,"totalTestsViral",577385,561,10611,212,,,,4797,"6/23/2020 10:00","2020-06-23T10:00:00Z","06/23 06:00",3092,10611,,"2020-06-23T10:00:00Z",577385,75363,,65007,2963,129,,483535,,,,,,,,,,,"24",404,8406,483535,10360,483535,,18,39,"965f3495b906e43d76b6874aa6994f3bd82ae1ec",0,0,0,0,0,""
20200622,"MD",64603,,410122,,"totalTestsViral",567025,602,10572,232,,,,4776,"6/22/2020 10:00","2020-06-22T10:00:00Z","06/22 06:00",3074,10572,,"2020-06-22T10:00:00Z",567025,74856,,64603,2945,129,,474725,,,,,,,,,,,"24",297,5397,474725,7433,474725,,8,28,"96e1712f54559dd348a634ccb87596f4e84eef0f",0,0,0,0,0,""
20200621,"MD",64306,,404725,,"totalTestsViral",559592,608,10544,230,,,,4773,"6/21/2020 10:00","2020-06-21T10:00:00Z","06/21 06:00",3066,10544,,"2020-06-21T10:00:00Z",559592,74473,,64306,2937,129,,469031,,,,,,,,,,,"24",350,6401,469031,9424,469031,,14,47,"172e3929287f1ac2e97678747deb1ac0cc32b388",0,0,0,0,0,""
20200620,"MD",63956,,398324,,"totalTestsViral",550168,644,10497,238,,,,4745,"6/20/2020 10:00","2020-06-20T10:00:00Z","06/20 06:00",3052,10497,,"2020-06-20T10:00:00Z",550168,73980,,63956,2923,129,,462280,,,,,,,,,,,"24",408,8203,462280,11802,462280,,22,50,"a8a4f147db00b7e2576bc261c31aee11f28a8fb6",0,0,0,0,0,""
20200619,"MD",63548,,390121,,"totalTestsViral",538366,648,10447,261,,,,4685,"6/19/2020 10:00","2020-06-19T10:00:00Z","06/19 06:00",3030,10447,,"2020-06-19T10:00:00Z",538366,73424,,63548,2901,129,,453669,,,,,,,,,,,"24",319,5742,453669,8628,453669,,14,90,"be24f908a9615926c0827172c18054bdaae238ce",0,0,0,0,0,""
20200618,"MD",63229,,384379,,"totalTestsViral",529738,660,10357,269,,,,4640,"6/18/2020 10:00","2020-06-18T10:00:00Z","06/18 06:00",3016,10357,,"2020-06-18T10:00:00Z",529738,72930,,63229,2886,130,,447608,,,,,,,,,,,"24",260,6005,447608,8562,447608,,20,48,"b6d6cc9317004c6269ba38bbdda37ad432d3977a",0,0,0,0,0,""
20200617,"MD",62969,,378374,,"totalTestsViral",521176,702,10309,283,,,,4596,"6/17/2020 10:00","2020-06-17T10:00:00Z","06/17 06:00",2996,10309,,"2020-06-17T10:00:00Z",521176,72479,,62969,2866,130,,441343,,,,,,,,,,,"24",560,11558,441343,15594,441343,,14,47,"34c596f4d62a89a12be9f2ae68eb3149a6481077",0,0,0,0,0,""
20200616,"MD",62409,,366816,,"totalTestsViral",505582,742,10262,284,,,,4579,"6/16/2020 10:00","2020-06-16T10:00:00Z","06/16 06:00",2982,10262,,"2020-06-16T10:00:00Z",505582,71784,,62409,2851,131,,429225,,,,,,,,,,,"24",377,7740,429225,10497,429225,,35,40,"f8bc32b524bfa18358f57df00fdfa337948526ce",0,0,0,0,0,""
20200615,"MD",62032,,359076,,"totalTestsViral",495085,745,10222,292,,,,4567,"6/15/2020 10:00","2020-06-15T10:00:00Z","06/15 06:00",2947,10222,,"2020-06-15T10:00:00Z",495085,71293,,62032,2817,130,,421108,,,,,,,,,,,"24",331,5468,421108,8486,421108,,8,57,"0f22d32ecd8b87e5e7a54a1807af8bc3bbbb4161",0,0,0,0,0,""
20200614,"MD",61701,,353608,,"totalTestsViral",486599,751,10165,313,,,,4541,"6/14/2020 10:00","2020-06-14T10:00:00Z","06/14 06:00",2939,10165,,"2020-06-14T10:00:00Z",486599,70855,,61701,2811,128,,415309,,,,,,,,,,,"24",396,6155,415309,8480,415309,,13,112,"c62fe1a07127e837f511a90be79b1cffd7d872d7",0,0,0,0,0,""
20200613,"MD",61305,,347453,,"totalTestsViral",478119,799,10053,321,,,,4536,"6/13/2020 10:00","2020-06-13T10:00:00Z","06/13 06:00",2926,10053,,"2020-06-13T10:00:00Z",478119,70320,,61305,2799,127,,408758,,,,,,,,,,,"24",692,7971,408758,10555,408758,,26,130,"ba13406559c792e98a5dc6a16adfe6ff6285d89e",0,0,0,0,0,""
20200612,"MD",60613,,339482,,"totalTestsViral",467564,836,9923,331,,,,4474,"6/12/2020 10:00","2020-06-12T10:00:00Z","06/12 06:00",2900,9923,,"2020-06-12T10:00:00Z",467564,69655,,60613,2773,127,,400095,,,,,,,,,,,"24",416,7309,400095,9748,400095,,25,134,"c3b73c8ba3884eedceefc71f13d192e6f8ac71d6",0,0,0,0,0,""
20200611,"MD",60197,,332173,,"totalTestsViral",457816,902,9789,358,,,,4365,"6/11/2020 10:00","2020-06-11T10:00:00Z","06/11 06:00",2875,9789,,"2020-06-11T10:00:00Z",457816,69087,,60197,2750,125,,392370,,,,,,,,,,,"24",732,6996,392370,11547,392370,,31,34,"2ba79c0f3273c370660873bdb2257a6043c89aea",0,0,0,0,0,""
20200610,"MD",59465,,325177,,"totalTestsViral",446269,955,9755,379,,,,4310,"6/10/2020 10:00","2020-06-10T10:00:00Z","06/10 06:00",2844,9755,,"2020-06-10T10:00:00Z",446269,68174,,59465,2719,125,,384642,,,,,,,,,,,"24",561,5999,384642,8496,384642,,33,79,"91e325b26b2bf709252f1a6efb9055ee78be899c",0,0,0,0,0,""
20200609,"MD",58904,,319178,,"totalTestsViral",437773,970,9676,386,,,,4279,"6/9/2020 10:00","2020-06-09T10:00:00Z","06/09 06:00",2811,9676,,"2020-06-09T10:00:00Z",437773,67562,,58904,2686,125,,378082,,,,,,,,,,,"24",500,6079,378082,8118,378082,,35,47,"2b0ee8d6fd7cc3c57a41002f915200cc3c24ff81",0,0,0,0,0,""
20200608,"MD",58404,,313099,,"totalTestsViral",429655,979,9629,392,,,,4240,"6/8/2020 10:00","2020-06-08T10:00:00Z","06/08 06:00",2776,9629,,"2020-06-08T10:00:00Z",429655,66983,,58404,2653,123,,371503,,,,,,,,,,,"24",431,6269,371503,8101,371503,,27,83,"0d102432cc1cfc865998e6f579f671e11818146a",0,0,0,0,0,""
20200607,"MD",57973,,306830,,"totalTestsViral",421554,1003,9546,404,,,,4240,"6/7/2020 10:00","2020-06-07T10:00:00Z","06/07 06:00",2749,9546,,"2020-06-07T10:00:00Z",421554,66470,,57973,2625,124,,364803,,,,,,,,,,,"24",491,6936,364803,9251,364803,,9,95,"5ce283c333c8e2eddd9bfbfed50b8e134f7e6c0d",0,0,0,0,0,""
20200606,"MD",57482,,299894,,"totalTestsViral",412303,1059,9451,418,,,,4175,"6/6/2020 10:00","2020-06-06T10:00:00Z","06/06 06:00",2740,9451,,"2020-06-06T10:00:00Z",412303,65856,,57482,2616,124,,357376,,,,,,,,,,,"24",712,8938,357376,12490,357376,,38,105,"636007c8a293933aec12db0a6d387dc6fc7f973e",0,0,0,0,0,""
20200605,"MD",56770,,290956,,"totalTestsViral",399813,1076,9346,455,,,,4159,"6/5/2020 10:00","2020-06-05T10:00:00Z","06/05 06:00",2702,9346,,"2020-06-05T10:00:00Z",399813,64919,,56770,2580,122,,347726,,,,,,,,,,,"24",912,9796,347726,13210,347726,,34,129,"db166cb417032eae652062899f9d76a397f0dea1",0,0,0,0,0,""
20200604,"MD",55858,,281160,,"totalTestsViral",386603,1096,9217,456,,,,3985,"6/4/2020 10:00","2020-06-04T10:00:00Z","06/04 06:00",2668,9217,,"2020-06-04T10:00:00Z",386603,63859,,55858,2546,122,,337018,,,,,,,,,,,"24",876,8517,337018,11524,337018,,2,106,"7d54de857f549a9d6cd7c2e8bba16d885fd99a73",0,0,0,0,0,""
20200603,"MD",54982,,272643,,"totalTestsViral",375079,1109,9111,471,,,,3970,"6/3/2020 10:00","2020-06-03T10:00:00Z","06/03 06:00",2666,9111,,"2020-06-03T10:00:00Z",375079,62955,,54982,2544,122,,327625,,,,,,,,,,,"24",807,11003,327625,14385,327625,,20,154,"a556585af08f52e5c3d3efffb2774f3c225df67b",0,0,0,0,0,""
20200602,"MD",54175,,261640,,"totalTestsViral",360694,1148,8957,481,,,,3855,"6/2/2020 10:00","2020-06-02T10:00:00Z","06/02 06:00",2646,8957,,"2020-06-02T10:00:00Z",360694,62014,,54175,2525,121,,315815,,,,,,,,,,,"24",848,6237,315815,8786,315815,,21,71,"1a1329d6f3b6176dc017aabe4835c25826d305bd",0,0,0,0,0,""
20200601,"MD",53327,,255403,,"totalTestsViral",351908,1174,8886,479,,,,3782,"6/1/2020 10:00","2020-06-01T10:00:00Z","06/01 06:00",2625,8886,,"2020-06-01T10:00:00Z",351908,61245,,53327,2505,120,,308730,,,,,,,,,,,"24",549,6300,308730,8772,308730,,29,148,"f7a6ade08607b30e78c31eb251cfbe0295d15e02",0,0,0,0,0,""
20200531,"MD",52778,,249103,,"totalTestsViral",343136,1183,8738,479,,,,3764,"5/31/2020 10:00","2020-05-31T10:00:00Z","05/31 06:00",2596,8738,,"2020-05-31T10:00:00Z",343136,60534,,52778,2476,120,,301881,,,,,,,,,,,"24",763,7172,301881,9412,301881,,34,119,"087a0417545ff02290028a8f22bec0723d9614e4",0,0,0,0,0,""
20200530,"MD",52015,,241931,,"totalTestsViral",333724,1239,8619,492,,,,3649,"5/30/2020 00:00","2020-05-30T00:00:00Z","05/29 20:00",2562,8619,,"2020-05-30T00:00:00Z",333724,59667,,52015,2444,118,,293946,,,,,,,,,,,"24",1027,8401,293946,10845,293946,,24,140,"8fd86f598c5a36592c7a34fbdcf01e327ab3513a",0,0,0,0,0,""
20200529,"MD",50988,,233530,,"totalTestsViral",322879,1296,8479,507,,,,3571,"5/29/2020 10:00","2020-05-29T10:00:00Z","05/29 06:00",2538,8479,,"2020-05-29T10:00:00Z",322879,58514,,50988,2421,117,,284518,,,,,,,,,,,"24",1279,8381,284518,11719,284518,,37,87,"a1fb1da34c871777215e3287d51dc9691a319b31",0,0,0,0,0,""
20200528,"MD",49709,,225149,,"totalTestsViral",311160,1334,8392,511,,,,3468,"5/28/2020 10:00","2020-05-28T10:00:00Z","05/28 06:00",2501,8392,,"2020-05-28T10:00:00Z",311160,57193,,49709,2386,115,,274858,,,,,,,,,,,"24",1286,11517,274858,16354,274858,,43,111,"06342d872b29c31db686466b28311d3f049651a5",0,0,0,0,0,""
20200527,"MD",48423,,213632,,"totalTestsViral",294806,1338,8281,520,,,,3401,"5/27/2020 10:00","2020-05-27T10:00:00Z","05/27 06:00",2458,8281,,"2020-05-27T10:00:00Z",294806,55245,,48423,2343,115,,262055,,,,,,,,,,,"24",736,6832,262055,10556,262055,,41,102,"f2dc7f417de4bdbbd2ec990957827ece730a69d4",0,0,0,0,0,""
20200526,"MD",47687,,206800,,"totalTestsViral",284250,1315,8179,520,,,,3334,"5/26/2020 10:00","2020-05-26T10:00:00Z","05/26 06:00",2417,8179,,"2020-05-26T10:00:00Z",284250,53775,,47687,2302,115,,254487,,,,,,,,,,,"24",535,4375,254487,6126,254487,,38,87,"607b6554594bfdae6bde3e2449558813f61a8246",0,0,0,0,0,""
20200525,"MD",47152,,202425,,"totalTestsViral",278124,1279,8092,517,,,,3329,"5/25/2020 10:00","2020-05-25T10:00:00Z","05/25 06:00",2379,8092,,"2020-05-25T10:00:00Z",278124,53142,,47152,2267,112,,249577,,,,,,,,,,,"24",839,8376,249577,10831,249577,,38,153,"4a78693c3ce72aa20d022029afd5dea8f8d19e47",0,0,0,0,0,""
20200524,"MD",46313,,194049,,"totalTestsViral",267293,1290,7939,503,,,,3319,"5/24/2020 10:00","2020-05-24T10:00:00Z","05/24 06:00",2341,7939,,"2020-05-24T10:00:00Z",267293,52169,,46313,2229,112,,240362,,,,,,,,,,,"24",818,7217,240362,6731,240362,,35,114,"fc77947ffa01aff48cf5e74c81b7fd1eb02f05f7",0,0,0,0,0,""
20200523,"MD",45495,,186832,,"totalTestsViral",260562,1320,7825,524,,,,3283,"5/23/2020 10:00","2020-05-23T10:00:00Z","05/23 06:00",2306,7825,,"2020-05-23T10:00:00Z",260562,51210,,45495,2197,109,,232327,,,,,,,,,,,"24",1071,3354,232327,8715,232327,,32,191,"71b9f72f962ab723316d5e14a190c3222d03ea3f",0,0,0,0,0,""
20200522,"MD",44424,,183478,,"totalTestsViral",251847,1329,7634,506,,,,3243,"5/22/2020 10:00","2020-05-22T10:00:00Z","05/22 06:00",2274,7634,,"2020-05-22T10:00:00Z",251847,50019,,44424,2169,105,,227902,,,,,,,,,,,"24",893,6776,227902,6462,227902,,53,149,"40efc7e2ff335619b281648a98428e1a6b8f59d9",0,0,0,0,0,""
20200521,"MD",43531,,176702,,"totalTestsViral",245385,1374,7485,526,,,,3099,"5/21/2020 10:00","2020-05-21T10:00:00Z","05/21 06:00",2221,7485,,"2020-05-21T10:00:00Z",245385,49129,,43531,2116,105,,220233,,,,,,,,,,,"24",1208,3695,220233,9592,220233,,23,92,"78f70e5b1ca6043ebf501d0c5fbb5484f867dd33",0,0,0,0,0,""
20200520,"MD",42323,,173007,,"totalTestsViral",235793,1410,7393,539,,,,2993,"5/20/2020 10:00","2020-05-20T10:00:00Z","05/20 06:00",2198,7393,,"2020-05-20T10:00:00Z",235793,47697,,42323,2093,105,,215330,,,,,,,,,,,"24",777,5895,215330,7535,215330,,34,194,"f4efc73a5a621be820c62e3e337c1b70d1a04468",0,0,0,0,0,""
20200519,"MD",41546,,167112,,"totalTestsViral",228258,1421,7199,537,,,,2868,"5/19/2020 10:00","2020-05-19T10:00:00Z","05/19 06:00",2164,7199,,"2020-05-19T10:00:00Z",228258,46787,,41546,2061,103,,208658,,,,,,,,,,,"24",1784,5368,208658,5757,208658,,42,113,"a5d24b16bba23fea7459b01e2c468ef6abdb1283",0,0,0,0,0,""
20200518,"MD",39762,,161744,,"totalTestsViral",222501,1447,7086,555,,,,2817,"5/18/2020 10:00","2020-05-18T10:00:00Z","05/18 06:00",2122,7086,,"2020-05-18T10:00:00Z",222501,45932,,39762,2020,102,,201506,,,,,,,,,,,"24",958,5622,201506,6706,201506,,32,93,"605c2c1e703ec0b2cdc293a757453250f92c0cca",0,0,0,0,0,""
20200517,"MD",38804,,156122,,"totalTestsViral",215795,1460,6993,562,,,,2816,"5/17/2020 10:00","2020-05-17T10:00:00Z","05/17 06:00",2090,6993,,"2020-05-17T10:00:00Z",215795,45056,,38804,1989,101,,194926,,,,,,,,,,,"24",836,3915,194926,6335,194926,,50,238,"e3018b99db9422affa85c6777fbeef9403cb07f7",0,0,0,0,0,""
20200516,"MD",37968,,152207,,"totalTestsViral",209460,1500,6755,598,,,,2806,"5/16/2020 10:00","2020-05-16T10:00:00Z","05/16 06:00",2040,6755,,"2020-05-16T10:00:00Z",209460,44114,,37968,1943,97,,190175,,,,,,,,,,,"24",982,6367,190175,7598,190175,,49,76,"a79014128e13ec2f16b526f507f73eb0dcace668",0,0,0,0,0,""
20200515,"MD",36986,,145840,,"totalTestsViral",201862,1496,6679,598,,,,2685,"5/15/2020 10:00","2020-05-15T10:00:00Z","05/15 06:00",1991,6679,,"2020-05-15T10:00:00Z",201862,42939,,36986,1896,95,,182826,,,,,,,,,,,"24",1083,3289,182826,7267,182826,,56,126,"585c60341956bc56e56aed5bd442137e0343039c",0,0,0,0,0,""
20200514,"MD",35903,,142551,,"totalTestsViral",194595,1538,6553,569,,,,2569,"5/14/2020 10:00","2020-05-14T10:00:00Z","05/14 06:00",1935,6553,,"2020-05-14T10:00:00Z",194595,41635,,35903,1840,95,,173574,,,,,,,,,,,"24",1091,3789,178454,6028,178454,,54,149,"2e34cb74a2cbed5eac503b04d1321fdb57e7913b",0,0,0,0,0,""
20200513,"MD",34812,,138762,,"totalTestsViral",188567,1550,6404,572,,,,2456,"5/13/2020 10:00","2020-05-13T10:00:00Z","05/13 06:00",1881,6404,,"2020-05-13T10:00:00Z",188567,40581,,34812,1787,94,,169503,,,,,,,,,,,"24",751,3320,173574,5425,173574,,47,117,"14ec07089a07a26deb233660c499ed173069bdb0",0,0,0,0,0,""
20200512,"MD",34061,,135442,,"totalTestsViral",183142,1563,6287,590,,,,2394,"5/12/2020 10:00","2020-05-12T10:00:00Z","05/12 06:00",1834,6287,,"2020-05-12T10:00:00Z",183142,39787,,34061,1742,92,,,,,,,,,,,,,"24",688,4035,169503,3754,169503,,46,104,"40b4125dffa5515a86789dbe88bc53d1e8445df4",0,0,0,0,0,""
