"date","state","positive","probableCases","negative","pending","totalTestResultsSource","totalTestResults","hospitalizedCurrently","hospitalizedCumulative","inIcuCurrently","inIcuCumulative","onVentilatorCurrently","onVentilatorCumulative","recovered","lastUpdateEt","dateModified","checkTimeEt","death","hospitalized","hospitalizedDischarged","dateChecked","totalTestsViral","positiveTestsViral","negativeTestsViral","positiveCasesViral","deathConfirmed","deathProbable","totalTestEncountersViral","totalTestsPeopleViral","totalTestsAntibody","positiveTestsAntibody","negativeTestsAntibody","totalTestsPeopleAntibody","positiveTestsPeopleAntibody","negativeTestsPeopleAntibody","totalTestsPeopleAntigen","positiveTestsPeopleAntigen","totalTestsAntigen","positiveTestsAntigen","fips","positiveIncrease","negativeIncrease","total","totalTestResultsIncrease","posNeg","dataQualityGrade","deathIncrease","hospitalizedIncrease","hash","commercialScore","negativeRegularScore","negativeScore","positiveScore","score","grade"
20210307,"MP",145,,17429,,"posNeg",17574,,4,,,,,29,"3/8/2021 00:00","2021-03-08T00:00:00Z","03/07 19:00",2,4,,"2021-03-08T00:00:00Z",26131,,,145,2,,,17542,,,,,,,,,,,"69",1,0,17574,1,17574,,0,0,"604ee9ce4dee663fe99123a19a712d867f8a0406",0,0,0,0,0,""
20210306,"MP",144,,17429,,"posNeg",17573,,4,,,,,29,"3/3/2021 00:00","2021-03-03T00:00:00Z","03/02 19:00",2,4,,"2021-03-03T00:00:00Z",26131,,,144,2,,,17542,,,,,,,,,,,"69",0,0,17573,0,17573,,0,0,"35a376584a8c67c08b116525925c782f9e1fa747",0,0,0,0,0,""
20210305,"MP",144,,17429,,"posNeg",17573,,4,,,,,29,"3/3/2021 00:00","2021-03-03T00:00:00Z","03/02 19:00",2,4,,"2021-03-03T00:00:00Z",26131,,,144,2,,,17542,,,,,,,,,,,"69",0,0,17573,0,17573,,0,0,"2b74789c72ad3070c1c9f9401c579ffc388de1ee",0,0,0,0,0,""
20210304,"MP",144,,17429,,"posNeg",17573,,4,,,,,29,"3/3/2021 00:00","2021-03-03T00:00:00Z","03/02 19:00",2,4,,"2021-03-03T00:00:00Z",26131,,,144,2,,,17542,,,,,,,,,,,"69",0,0,17573,0,17573,,0,0,"9d749a95bffcf4e26bfa634ea7f83efdc512f98f",0,0,0,0,0,""
20210303,"MP",144,,17429,,"posNeg",17573,,4,,,,,29,"3/3/2021 00:00","2021-03-03T00:00:00Z","03/02 19:00",2,4,,"2021-03-03T00:00:00Z",26131,,,144,2,,,17542,,,,,,,,,,,"69",1,0,17573,1,17573,,0,0,"dd15b5eaff34af39bf74805c624674bd345fa12c",0,0,0,0,0,""
20210302,"MP",143,,17429,,"posNeg",17572,,4,,,,,29,"2/20/2021 00:00","2021-02-20T00:00:00Z","02/19 19:00",2,4,,"2021-02-20T00:00:00Z",26131,,,143,2,,,17542,,,,,,,,,,,"69",0,0,17572,0,17572,,0,0,"f8a108a632943cfc7b48ce54f0253f9690146a90",0,0,0,0,0,""
20210301,"MP",143,,17429,,"posNeg",17572,,4,,,,,29,"2/20/2021 00:00","2021-02-20T00:00:00Z","02/19 19:00",2,4,,"2021-02-20T00:00:00Z",26131,,,143,2,,,17542,,,,,,,,,,,"69",0,0,17572,0,17572,,0,0,"d872c5d79663615a2733838c052596f7c5a3fdfa",0,0,0,0,0,""
20210228,"MP",143,,17429,,"posNeg",17572,,4,,,,,29,"2/20/2021 00:00","2021-02-20T00:00:00Z","02/19 19:00",2,4,,"2021-02-20T00:00:00Z",26131,,,143,2,,,17542,,,,,,,,,,,"69",0,0,17572,0,17572,,0,0,"82f9fa69343312618cc0dd8e3347a1b93d7a449c",0,0,0,0,0,""
20210227,"MP",143,,17429,,"posNeg",17572,,4,,,,,29,"2/20/2021 00:00","2021-02-20T00:00:00Z","02/19 19:00",2,4,,"2021-02-20T00:00:00Z",26131,,,143,2,,,17542,,,,,,,,,,,"69",0,0,17572,0,17572,,0,0,"baa13cc25d2aa451f4807db48598c304725ced4b",0,0,0,0,0,""
20210226,"MP",143,,17429,,"posNeg",17572,,4,,,,,29,"2/20/2021 00:00","2021-02-20T00:00:00Z","02/19 19:00",2,4,,"2021-02-20T00:00:00Z",26131,,,143,2,,,17542,,,,,,,,,,,"69",0,0,17572,0,17572,,0,0,"eb863a285dbb872a9cadf6606b627f92123ea2a1",0,0,0,0,0,""
20210225,"MP",143,,17429,,"posNeg",17572,,4,,,,,29,"2/20/2021 00:00","2021-02-20T00:00:00Z","02/19 19:00",2,4,,"2021-02-20T00:00:00Z",26131,,,143,2,,,17542,,,,,,,,,,,"69",0,0,17572,0,17572,,0,0,"c9a40f38df48d2100532c88258ded70ba0ec8e73",0,0,0,0,0,""
20210224,"MP",143,,17429,,"posNeg",17572,,4,,,,,29,"2/20/2021 00:00","2021-02-20T00:00:00Z","02/19 19:00",2,4,,"2021-02-20T00:00:00Z",26131,,,143,2,,,17542,,,,,,,,,,,"69",0,0,17572,0,17572,,0,0,"bdb0e6e48bcfa36faac569a4c80fd92ace3b2365",0,0,0,0,0,""
20210223,"MP",143,,17429,,"posNeg",17572,,4,,,,,29,"2/20/2021 00:00","2021-02-20T00:00:00Z","02/19 19:00",2,4,,"2021-02-20T00:00:00Z",26131,,,143,2,,,17542,,,,,,,,,,,"69",0,0,17572,0,17572,,0,0,"7b10e316d590640e0fda58c466d868db22876c20",0,0,0,0,0,""
20210222,"MP",143,,17429,,"posNeg",17572,,4,,,,,29,"2/20/2021 00:00","2021-02-20T00:00:00Z","02/19 19:00",2,4,,"2021-02-20T00:00:00Z",26131,,,143,2,,,17542,,,,,,,,,,,"69",0,0,17572,0,17572,,0,0,"756dce2a0cb9795e9b5f5ca1711867be8940a098",0,0,0,0,0,""
20210221,"MP",143,,17429,,"posNeg",17572,,4,,,,,29,"2/20/2021 00:00","2021-02-20T00:00:00Z","02/19 19:00",2,4,,"2021-02-20T00:00:00Z",26131,,,143,2,,,17542,,,,,,,,,,,"69",8,0,17572,8,17572,,0,0,"e7e05c8db2dffe2ebc6d3a9f1e77896c18743012",0,0,0,0,0,""
20210220,"MP",135,,17429,,"posNeg",17564,,4,,,,,29,"2/16/2021 00:00","2021-02-16T00:00:00Z","02/15 19:00",2,4,,"2021-02-16T00:00:00Z",26131,,,135,2,,,17542,,,,,,,,,,,"69",0,0,17564,0,17564,,0,0,"e0a53bc72ffa2f0b63cd4baf2207fe36b9a1fcc6",0,0,0,0,0,""
20210219,"MP",135,,17429,,"posNeg",17564,,4,,,,,29,"2/16/2021 00:00","2021-02-16T00:00:00Z","02/15 19:00",2,4,,"2021-02-16T00:00:00Z",26131,,,135,2,,,17542,,,,,,,,,,,"69",0,0,17564,0,17564,,0,0,"c4c87e681c249692528bc80a54020c9f99716e21",0,0,0,0,0,""
20210218,"MP",135,,17429,,"posNeg",17564,,4,,,,,29,"2/16/2021 00:00","2021-02-16T00:00:00Z","02/15 19:00",2,4,,"2021-02-16T00:00:00Z",26131,,,135,2,,,17542,,,,,,,,,,,"69",0,0,17564,0,17564,,0,0,"64312b4e4fa8c2f1bd057203e2d6884973ff0c04",0,0,0,0,0,""
20210217,"MP",135,,17429,,"posNeg",17564,,4,,,,,29,"2/16/2021 00:00","2021-02-16T00:00:00Z","02/15 19:00",2,4,,"2021-02-16T00:00:00Z",26131,,,135,2,,,17542,,,,,,,,,,,"69",1,0,17564,1,17564,,0,0,"4fa52bdf55cc5433bc3c997f6f0d143fbd56de5b",0,0,0,0,0,""
20210216,"MP",134,,17429,,"posNeg",17563,,4,,,,,29,"2/12/2021 00:00","2021-02-12T00:00:00Z","02/11 19:00",2,4,,"2021-02-12T00:00:00Z",26131,,,134,2,,,17542,,,,,,,,,,,"69",0,0,17563,0,17563,,0,0,"84367ce47d2df42c908f89de1516262341ec463d",0,0,0,0,0,""
20210215,"MP",134,,17429,,"posNeg",17563,,4,,,,,29,"2/12/2021 00:00","2021-02-12T00:00:00Z","02/11 19:00",2,4,,"2021-02-12T00:00:00Z",26131,,,134,2,,,17542,,,,,,,,,,,"69",0,0,17563,0,17563,,0,0,"70e4d339589ba2d6c1e1159ceff9615a9618ad1e",0,0,0,0,0,""
20210214,"MP",134,,17429,,"posNeg",17563,,4,,,,,29,"2/12/2021 00:00","2021-02-12T00:00:00Z","02/11 19:00",2,4,,"2021-02-12T00:00:00Z",26131,,,134,2,,,17542,,,,,,,,,,,"69",0,0,17563,0,17563,,0,0,"ea4cf4fa095c0d54f759605726e8bd52e145ad30",0,0,0,0,0,""
20210213,"MP",134,,17429,,"posNeg",17563,,4,,,,,29,"2/12/2021 00:00","2021-02-12T00:00:00Z","02/11 19:00",2,4,,"2021-02-12T00:00:00Z",26131,,,134,2,,,17542,,,,,,,,,,,"69",0,0,17563,0,17563,,0,0,"94ea01c4876efee27016d917491a0d3ed7367c3e",0,0,0,0,0,""
20210212,"MP",134,,17429,,"posNeg",17563,,4,,,,,29,"2/12/2021 00:00","2021-02-12T00:00:00Z","02/11 19:00",2,4,,"2021-02-12T00:00:00Z",26131,,,134,2,,,17542,,,,,,,,,,,"69",1,0,17563,1,17563,,0,0,"bc3da4903cf1d799aaa70b06f4cf1bed2fd00255",0,0,0,0,0,""
20210211,"MP",133,,17429,,"posNeg",17562,,4,,,,,29,"2/1/2021 00:00","2021-02-01T00:00:00Z","01/31 19:00",2,4,,"2021-02-01T00:00:00Z",26131,,,133,2,,,17542,,,,,,,,,,,"69",0,0,17562,0,17562,,0,0,"e0b9833814d45a590521ee210d22cf1dda73f2ee",0,0,0,0,0,""
20210210,"MP",133,,17429,,"posNeg",17562,,4,,,,,29,"2/1/2021 00:00","2021-02-01T00:00:00Z","01/31 19:00",2,4,,"2021-02-01T00:00:00Z",26131,,,133,2,,,17542,,,,,,,,,,,"69",0,0,17562,0,17562,,0,0,"97ab788debf31fa33bab98b7c8a82fae5fa74bad",0,0,0,0,0,""
20210209,"MP",133,,17429,,"posNeg",17562,,4,,,,,29,"2/1/2021 00:00","2021-02-01T00:00:00Z","01/31 19:00",2,4,,"2021-02-01T00:00:00Z",26131,,,133,2,,,17542,,,,,,,,,,,"69",0,0,17562,0,17562,,0,0,"ef328a3656c88a44648dba45ccfb2e74f09bcd5d",0,0,0,0,0,""
20210208,"MP",133,,17429,,"posNeg",17562,,4,,,,,29,"2/1/2021 00:00","2021-02-01T00:00:00Z","01/31 19:00",2,4,,"2021-02-01T00:00:00Z",26131,,,133,2,,,17542,,,,,,,,,,,"69",0,0,17562,0,17562,,0,0,"cfc665f0cbc09de2a9ea4e00d81b32e52f66dd86",0,0,0,0,0,""
20210207,"MP",133,,17429,,"posNeg",17562,,4,,,,,29,"2/1/2021 00:00","2021-02-01T00:00:00Z","01/31 19:00",2,4,,"2021-02-01T00:00:00Z",26131,,,133,2,,,17542,,,,,,,,,,,"69",0,0,17562,0,17562,,0,0,"244ad784bb703c93b2f949c42373bf049b11bcfa",0,0,0,0,0,""
20210206,"MP",133,,17429,,"posNeg",17562,,4,,,,,29,"2/1/2021 00:00","2021-02-01T00:00:00Z","01/31 19:00",2,4,,"2021-02-01T00:00:00Z",26131,,,133,2,,,17542,,,,,,,,,,,"69",0,0,17562,0,17562,,0,0,"64d5919ca1bd67ad5b82f1d1098c667b19cdde5b",0,0,0,0,0,""
20210205,"MP",133,,17429,,"posNeg",17562,,4,,,,,29,"2/1/2021 00:00","2021-02-01T00:00:00Z","01/31 19:00",2,4,,"2021-02-01T00:00:00Z",26131,,,133,2,,,17542,,,,,,,,,,,"69",0,0,17562,0,17562,,0,0,"54160f58e6feafbb48a8f64a649c495ce6417886",0,0,0,0,0,""
20210204,"MP",133,,17429,,"posNeg",17562,,4,,,,,29,"2/1/2021 00:00","2021-02-01T00:00:00Z","01/31 19:00",2,4,,"2021-02-01T00:00:00Z",26131,,,133,2,,,17542,,,,,,,,,,,"69",0,0,17562,0,17562,,0,0,"a5bb3a52cbb145a43cc4c473341b3f28bbbe53b2",0,0,0,0,0,""
20210203,"MP",133,,17429,,"posNeg",17562,,4,,,,,29,"2/1/2021 00:00","2021-02-01T00:00:00Z","01/31 19:00",2,4,,"2021-02-01T00:00:00Z",26131,,,133,2,,,17542,,,,,,,,,,,"69",0,0,17562,0,17562,,0,0,"33904eff8d5fe1ddf07a54d3fbbceeff152ac2f5",0,0,0,0,0,""
20210202,"MP",133,,17429,,"posNeg",17562,,4,,,,,29,"2/1/2021 00:00","2021-02-01T00:00:00Z","01/31 19:00",2,4,,"2021-02-01T00:00:00Z",26131,,,133,2,,,17542,,,,,,,,,,,"69",1,0,17562,1,17562,,0,0,"b00d0ab144c09f3bb1abccd33b06d9dc2343634b",0,0,0,0,0,""
20210201,"MP",132,,17429,,"posNeg",17561,,4,,,,,29,"1/29/2021 00:00","2021-01-29T00:00:00Z","01/28 19:00",2,4,,"2021-01-29T00:00:00Z",26131,,,132,2,,,17542,,,,,,,,,,,"69",0,0,17561,0,17561,,0,0,"46dc1cf50d1ba5b19076cb0ea5ed65a452d2c97b",0,0,0,0,0,""
20210131,"MP",132,,17429,,"posNeg",17561,,4,,,,,29,"1/29/2021 00:00","2021-01-29T00:00:00Z","01/28 19:00",2,4,,"2021-01-29T00:00:00Z",26131,,,132,2,,,17542,,,,,,,,,,,"69",0,0,17561,0,17561,,0,0,"444e4560de1c00ca7982ef883f4e45ee56b22d80",0,0,0,0,0,""
20210130,"MP",132,,17429,,"posNeg",17561,,4,,,,,29,"1/29/2021 00:00","2021-01-29T00:00:00Z","01/28 19:00",2,4,,"2021-01-29T00:00:00Z",26131,,,132,2,,,17542,,,,,,,,,,,"69",0,0,17561,0,17561,,0,0,"f9e9e2bc1cca2d7a06ee50e94d4a4ce1dda4a3fb",0,0,0,0,0,""
20210129,"MP",132,,17429,,"posNeg",17561,,4,,,,,29,"1/29/2021 00:00","2021-01-29T00:00:00Z","01/28 19:00",2,4,,"2021-01-29T00:00:00Z",26131,,,132,2,,,17542,,,,,,,,,,,"69",0,0,17561,0,17561,,0,0,"c96f332d4ba685ff230548ee6e3c09e354cb34b1",0,0,0,0,0,""
20210128,"MP",132,,17429,,"posNeg",17561,,4,,,,,29,"1/23/2021 00:00","2021-01-23T00:00:00Z","01/22 19:00",2,4,,"2021-01-23T00:00:00Z",26131,,,132,2,,,17542,,,,,,,,,,,"69",0,0,17561,0,17561,,0,0,"e048e74f7359640c43cb89b0470d2c9acbd9cefc",0,0,0,0,0,""
20210127,"MP",132,,17429,,"posNeg",17561,,4,,,,,29,"1/23/2021 00:00","2021-01-23T00:00:00Z","01/22 19:00",2,4,,"2021-01-23T00:00:00Z",26131,,,132,2,,,17542,,,,,,,,,,,"69",0,0,17561,0,17561,,0,0,"f03085f369e103399240eb28c7a92dc49570c69b",0,0,0,0,0,""
20210126,"MP",132,,17429,,"posNeg",17561,,4,,,,,29,"1/23/2021 00:00","2021-01-23T00:00:00Z","01/22 19:00",2,4,,"2021-01-23T00:00:00Z",26131,,,132,2,,,17542,,,,,,,,,,,"69",0,0,17561,0,17561,,0,0,"ca7f562c37cdb57feb9bd82f78b91b0a1c0b62e3",0,0,0,0,0,""
20210125,"MP",132,,17429,,"posNeg",17561,,4,,,,,29,"1/23/2021 00:00","2021-01-23T00:00:00Z","01/22 19:00",2,4,,"2021-01-23T00:00:00Z",26131,,,132,2,,,17542,,,,,,,,,,,"69",3,0,17561,3,17561,,0,0,"a319ad61a485d0fe0c7fa5fd797f540b08469e1e",0,0,0,0,0,""
20210124,"MP",129,,17429,,"posNeg",17558,,4,,,,,29,"1/21/2021 00:00","2021-01-21T00:00:00Z","01/20 19:00",2,4,,"2021-01-21T00:00:00Z",26131,,,129,2,,,17542,,,,,,,,,,,"69",0,0,17558,0,17558,,0,0,"b18c5b43f7683633eb93b22108113f82d352755d",0,0,0,0,0,""
20210123,"MP",129,,17429,,"posNeg",17558,,4,,,,,29,"1/21/2021 00:00","2021-01-21T00:00:00Z","01/20 19:00",2,4,,"2021-01-21T00:00:00Z",26131,,,129,2,,,17542,,,,,,,,,,,"69",0,0,17558,0,17558,,0,0,"59ee13c0b96f96d4d6e135b3e2b71275ce99f357",0,0,0,0,0,""
20210122,"MP",129,,17429,,"posNeg",17558,,4,,,,,29,"1/21/2021 00:00","2021-01-21T00:00:00Z","01/20 19:00",2,4,,"2021-01-21T00:00:00Z",26131,,,129,2,,,17542,,,,,,,,,,,"69",0,0,17558,0,17558,,0,0,"c5af7412266ac6b5d0d1236e21465d8f8c6e09bf",0,0,0,0,0,""
20210121,"MP",129,,17429,,"posNeg",17558,,4,,,,,29,"1/21/2021 00:00","2021-01-21T00:00:00Z","01/20 19:00",2,4,,"2021-01-21T00:00:00Z",26131,,,129,2,,,17542,,,,,,,,,,,"69",0,0,17558,0,17558,,0,0,"a64586b48c995cf702e89c1407ff275a8afa8da2",0,0,0,0,0,""
20210120,"MP",129,,17429,,"posNeg",17558,,4,,,,,29,"1/16/2021 00:00","2021-01-16T00:00:00Z","01/15 19:00",2,4,,"2021-01-16T00:00:00Z",26131,,,129,2,,,17542,,,,,,,,,,,"69",0,0,17558,0,17558,,0,0,"389449e5782cdb59deb4103d3a21afb8ebf2eca3",0,0,0,0,0,""
20210119,"MP",129,,17429,,"posNeg",17558,,4,,,,,29,"1/16/2021 00:00","2021-01-16T00:00:00Z","01/15 19:00",2,4,,"2021-01-16T00:00:00Z",26131,,,129,2,,,17542,,,,,,,,,,,"69",1,0,17558,1,17558,,0,0,"38f14ace8fd7d75d1f8269537125d1627776c463",0,0,0,0,0,""
20210118,"MP",128,,17429,,"posNeg",17557,,4,,,,,29,"1/14/2021 00:00","2021-01-14T00:00:00Z","01/13 19:00",2,4,,"2021-01-14T00:00:00Z",26131,,,128,2,,,17542,,,,,,,,,,,"69",0,0,17557,0,17557,,0,0,"ed5c1761b62499bd4991194dc320f24eaf9388c9",0,0,0,0,0,""
20210117,"MP",128,,17429,,"posNeg",17557,,4,,,,,29,"1/14/2021 00:00","2021-01-14T00:00:00Z","01/13 19:00",2,4,,"2021-01-14T00:00:00Z",26131,,,128,2,,,17542,,,,,,,,,,,"69",0,0,17557,0,17557,,0,0,"a0e2cad7e084d552add1812e5cfb77a674bcb7ff",0,0,0,0,0,""
20210116,"MP",128,,17429,,"posNeg",17557,,4,,,,,29,"1/14/2021 00:00","2021-01-14T00:00:00Z","01/13 19:00",2,4,,"2021-01-14T00:00:00Z",26131,,,128,2,,,17542,,,,,,,,,,,"69",0,0,17557,0,17557,,0,0,"356c4ab157251cae394eac84d7d5c682b4d94796",0,0,0,0,0,""
20210115,"MP",128,,17429,,"posNeg",17557,,4,,,,,29,"1/14/2021 00:00","2021-01-14T00:00:00Z","01/13 19:00",2,4,,"2021-01-14T00:00:00Z",26131,,,128,2,,,17542,,,,,,,,,,,"69",0,0,17557,0,17557,,0,0,"38ff9e3f99a21a6ccaee4c2fc40bfef8b32d7e13",0,0,0,0,0,""
20210114,"MP",128,,17429,,"posNeg",17557,,4,,,,,29,"1/11/2021 00:00","2021-01-11T00:00:00Z","01/10 19:00",2,4,,"2021-01-11T00:00:00Z",26131,,,128,2,,,17542,,,,,,,,,,,"69",0,0,17557,0,17557,,0,0,"e4c33dc2ed22e49a9c44b60632f2a97018b9a7b6",0,0,0,0,0,""
20210113,"MP",128,,17429,,"posNeg",17557,,4,,,,,29,"1/11/2021 00:00","2021-01-11T00:00:00Z","01/10 19:00",2,4,,"2021-01-11T00:00:00Z",26131,,,128,2,,,17542,,,,,,,,,,,"69",0,0,17557,0,17557,,0,0,"871ff92b136bfcef272963e06c162a1d132d4808",0,0,0,0,0,""
20210112,"MP",128,,17429,,"posNeg",17557,,4,,,,,29,"1/11/2021 00:00","2021-01-11T00:00:00Z","01/10 19:00",2,4,,"2021-01-11T00:00:00Z",26131,,,128,2,,,17542,,,,,,,,,,,"69",3,0,17557,3,17557,,0,0,"086150fc65ef52745bead797f69a27c3624d7b70",0,0,0,0,0,""
20210111,"MP",125,,17429,,"posNeg",17554,,4,,,,,29,"1/6/2021 00:00","2021-01-06T00:00:00Z","01/05 19:00",2,4,,"2021-01-06T00:00:00Z",26131,,,125,2,,,17542,,,,,,,,,,,"69",0,0,17554,0,17554,,0,0,"e898047d40f4729329169946bdc3444f4f28d1ae",0,0,0,0,0,""
20210110,"MP",125,,17429,,"posNeg",17554,,4,,,,,29,"1/6/2021 00:00","2021-01-06T00:00:00Z","01/05 19:00",2,4,,"2021-01-06T00:00:00Z",26131,,,125,2,,,17542,,,,,,,,,,,"69",0,0,17554,0,17554,,0,0,"f1c0718f0040fd5da47593e69a0d21821a918e9c",0,0,0,0,0,""
20210109,"MP",125,,17429,,"posNeg",17554,,4,,,,,29,"1/6/2021 00:00","2021-01-06T00:00:00Z","01/05 19:00",2,4,,"2021-01-06T00:00:00Z",26131,,,125,2,,,17542,,,,,,,,,,,"69",0,0,17554,0,17554,,0,0,"10cbb706282798b11d5174ed0d96c3a58450c9f7",0,0,0,0,0,""
20210108,"MP",125,,17429,,"posNeg",17554,,4,,,,,29,"1/6/2021 00:00","2021-01-06T00:00:00Z","01/05 19:00",2,4,,"2021-01-06T00:00:00Z",26131,,,125,2,,,17542,,,,,,,,,,,"69",0,0,17554,0,17554,,0,0,"f55b75f5baf536c1e9296b39c63a47b92a2f28f2",0,0,0,0,0,""
20210107,"MP",125,,17429,,"posNeg",17554,,4,,,,,29,"1/6/2021 00:00","2021-01-06T00:00:00Z","01/05 19:00",2,4,,"2021-01-06T00:00:00Z",26131,,,125,2,,,17542,,,,,,,,,,,"69",1,0,17554,1,17554,,0,0,"0772c373fd18974efd7731f00aca632905df4114",0,0,0,0,0,""
20210106,"MP",124,,17429,,"posNeg",17553,,4,,,,,29,"1/3/2021 00:00","2021-01-03T00:00:00Z","01/02 19:00",2,4,,"2021-01-03T00:00:00Z",26131,,,124,2,,,17542,,,,,,,,,,,"69",2,0,17553,2,17553,,0,0,"3c3d4066794e074f748886a846e6c6e39dc561f0",0,0,0,0,0,""
20210105,"MP",122,,17429,,"posNeg",17551,,4,,,,,29,"12/30/2020 00:00","2020-12-30T00:00:00Z","12/29 19:00",2,4,,"2020-12-30T00:00:00Z",26131,,,122,2,,,17542,,,,,,,,,,,"69",0,0,17551,0,17551,,0,0,"8e34dd6ebff13be239c398bd64635e9b3fd888b2",0,0,0,0,0,""
20210104,"MP",122,,17429,,"posNeg",17551,,4,,,,,29,"12/30/2020 00:00","2020-12-30T00:00:00Z","12/29 19:00",2,4,,"2020-12-30T00:00:00Z",26131,,,122,2,,,17542,,,,,,,,,,,"69",0,0,17551,0,17551,,0,0,"ae15e70ff1e6e4de3ad4bc896861ca5122e12b0f",0,0,0,0,0,""
20210103,"MP",122,,17429,,"posNeg",17551,,4,,,,,29,"12/30/2020 00:00","2020-12-30T00:00:00Z","12/29 19:00",2,4,,"2020-12-30T00:00:00Z",26131,,,122,2,,,17542,,,,,,,,,,,"69",0,0,17551,0,17551,,0,0,"85374e6867bfd68928338fd8d9ebd7b690c1bf45",0,0,0,0,0,""
20210102,"MP",122,,17429,,"posNeg",17551,,4,,,,,29,"12/30/2020 00:00","2020-12-30T00:00:00Z","12/29 19:00",2,4,,"2020-12-30T00:00:00Z",26131,,,122,2,,,17542,,,,,,,,,,,"69",0,0,17551,0,17551,,0,0,"21ff4c3d2012c4edd9d8bef32bb96c501117c93e",0,0,0,0,0,""
20210101,"MP",122,,17429,,"posNeg",17551,,4,,,,,29,"12/30/2020 00:00","2020-12-30T00:00:00Z","12/29 19:00",2,4,,"2020-12-30T00:00:00Z",26131,,,122,2,,,17542,,,,,,,,,,,"69",0,0,17551,0,17551,,0,0,"3c0393e26aa6464a4ef8068c236ebf0a16b3ba7e",0,0,0,0,0,""
20201231,"MP",122,,17429,,"posNeg",17551,,4,,,,,29,"12/30/2020 00:00","2020-12-30T00:00:00Z","12/29 19:00",2,4,,"2020-12-30T00:00:00Z",26131,,,122,2,,,17542,,,,,,,,,,,"69",0,0,17551,0,17551,,0,0,"245317210f4d8e71b7ab01432e67c5bd8f14973b",0,0,0,0,0,""
20201230,"MP",122,,17429,,"posNeg",17551,,4,,,,,29,"12/30/2020 00:00","2020-12-30T00:00:00Z","12/29 19:00",2,4,,"2020-12-30T00:00:00Z",26131,,,122,2,,,17542,,,,,,,,,,,"69",0,0,17551,0,17551,,0,0,"75266855b4db3b46de8ce14af79e332770ce4b4a",0,0,0,0,0,""
20201229,"MP",122,,17429,,"posNeg",17551,,4,,,,,29,"12/28/2020 00:00","2020-12-28T00:00:00Z","12/27 19:00",2,4,,"2020-12-28T00:00:00Z",26131,,,122,2,,,17542,,,,,,,,,,,"69",0,0,17551,0,17551,,0,0,"479ecc54c1f021fc7bd02b4d361311022fee74d1",0,0,0,0,0,""
20201228,"MP",122,,17429,,"posNeg",17551,,4,,,,,29,"12/27/2020 00:00","2020-12-27T00:00:00Z","12/26 19:00",2,4,,"2020-12-27T00:00:00Z",26131,,,122,2,,,17542,,,,,,,,,,,"69",0,0,17551,0,17551,,0,0,"55e5c54f903917cb0c73c1733e57a644329d83ed",0,0,0,0,0,""
20201227,"MP",122,,17429,,"posNeg",17551,,4,,,,,29,"12/25/2020 00:00","2020-12-25T00:00:00Z","12/24 19:00",2,4,,"2020-12-25T00:00:00Z",26131,,,122,2,,,17542,,,,,,,,,,,"69",0,0,17551,0,17551,,0,0,"e8b02cb8696dc0e437e182e074f2a6da19b08e25",0,0,0,0,0,""
20201226,"MP",122,,17429,,"posNeg",17551,,4,,,,,29,"12/25/2020 00:00","2020-12-25T00:00:00Z","12/24 19:00",2,4,,"2020-12-25T00:00:00Z",26131,,,122,2,,,17542,,,,,,,,,,,"69",4,0,17551,4,17551,,0,0,"43255baa220dfd6670e76be1a19e2499726996bb",0,0,0,0,0,""
20201225,"MP",118,,17429,,"posNeg",17547,,4,,,,,29,"12/23/2020 00:00","2020-12-23T00:00:00Z","12/22 19:00",2,4,,"2020-12-23T00:00:00Z",26131,,,118,2,,,17542,,,,,,,,,,,"69",0,0,17547,0,17547,,0,0,"72bb0ef688d9fcde457cbf1ef9bbc73aaa507c0b",0,0,0,0,0,""
20201224,"MP",118,,17429,,"posNeg",17547,,4,,,,,29,"12/23/2020 00:00","2020-12-23T00:00:00Z","12/22 19:00",2,4,,"2020-12-23T00:00:00Z",26131,,,118,2,,,17542,,,,,,,,,,,"69",2,0,17547,2,17547,,0,0,"2e9331debe1d2045558621e1134e9e4f039c5b41",0,0,0,0,0,""
20201223,"MP",116,,17429,,"posNeg",17545,,4,,,,,29,"12/20/2020 00:00","2020-12-20T00:00:00Z","12/19 19:00",2,4,,"2020-12-20T00:00:00Z",26131,,,116,2,,,17542,,,,,,,,,,,"69",0,0,17545,0,17545,,0,0,"bafed772563bffd9c6015a1e204f69ac774daf90",0,0,0,0,0,""
20201222,"MP",116,,17429,,"posNeg",17545,,4,,,,,29,"12/20/2020 00:00","2020-12-20T00:00:00Z","12/19 19:00",2,4,,"2020-12-20T00:00:00Z",26131,,,116,2,,,17542,,,,,,,,,,,"69",0,0,17545,0,17545,,0,0,"1250097323c04a40cd60ffcb34fa9ece13f1e5b0",0,0,0,0,0,""
20201221,"MP",116,,17429,,"posNeg",17545,,4,,,,,29,"12/20/2020 00:00","2020-12-20T00:00:00Z","12/19 19:00",2,4,,"2020-12-20T00:00:00Z",26131,,,116,2,,,17542,,,,,,,,,,,"69",1,0,17545,1,17545,,0,0,"afd27e69eccd422aa8a53ac8ad9b6d5feaa25b4b",0,0,0,0,0,""
20201220,"MP",115,,17429,,"posNeg",17544,,4,,,,,29,"12/18/2020 00:00","2020-12-18T00:00:00Z","12/17 19:00",2,4,,"2020-12-18T00:00:00Z",26131,,,115,2,,,17542,,,,,,,,,,,"69",0,0,17544,0,17544,,0,0,"3221255896a11138e5294fa92a93c7a946f45d20",0,0,0,0,0,""
20201219,"MP",115,,17429,,"posNeg",17544,,4,,,,,29,"12/18/2020 00:00","2020-12-18T00:00:00Z","12/17 19:00",2,4,,"2020-12-18T00:00:00Z",26131,,,115,2,,,17542,,,,,,,,,,,"69",0,0,17544,0,17544,,0,0,"2ab2a6e9bb32a66fc0275661e113ea2fe06adbd5",0,0,0,0,0,""
20201218,"MP",115,,17429,,"posNeg",17544,,4,,,,,29,"12/18/2020 00:00","2020-12-18T00:00:00Z","12/17 19:00",2,4,,"2020-12-18T00:00:00Z",26131,,,115,2,,,17542,,,,,,,,,,,"69",2,0,17544,2,17544,,0,0,"cf412c595a917154fabcb91d0ff80c1434710a0b",0,0,0,0,0,""
20201217,"MP",113,,17429,,"posNeg",17542,,4,,,,,29,"12/15/2020 00:00","2020-12-15T00:00:00Z","12/14 19:00",2,4,,"2020-12-15T00:00:00Z",26131,,,113,2,,,17542,,,,,,,,,,,"69",0,0,17542,0,17542,,0,0,"39755eff743970d019bdb404746054873c09f4ee",0,0,0,0,0,""
20201216,"MP",113,,17429,,"posNeg",17542,,4,,,,,29,"12/15/2020 00:00","2020-12-15T00:00:00Z","12/14 19:00",2,4,,"2020-12-15T00:00:00Z",26131,,,113,2,,,17542,,,,,,,,,,,"69",0,0,17542,0,17542,,0,0,"5408af60157989305c8118ce5261af8ee9b252ae",0,0,0,0,0,""
20201215,"MP",113,,17429,,"posNeg",17542,,4,,,,,29,"12/14/2020 00:00","2020-12-14T00:00:00Z","12/13 19:00",2,4,,"2020-12-14T00:00:00Z",26131,,,113,2,,,17542,,,,,,,,,,,"69",0,223,17542,223,17542,,0,0,"341f5430636783848facfa4394a846dd48763c4c",0,0,0,0,0,""
20201214,"MP",113,,17206,,"posNeg",17319,,4,,,,,29,"12/9/2020 00:00","2020-12-09T00:00:00Z","12/08 19:00",2,4,,"2020-12-09T00:00:00Z",25523,,,113,2,,,17319,,,,,,,,,,,"69",0,0,17319,0,17319,,0,0,"6b2f2bfea17cb07582ccc69164e970a862afcc19",0,0,0,0,0,""
20201213,"MP",113,,17206,,"posNeg",17319,,4,,,,,29,"12/9/2020 00:00","2020-12-09T00:00:00Z","12/08 19:00",2,4,,"2020-12-09T00:00:00Z",25523,,,113,2,,,17319,,,,,,,,,,,"69",0,0,17319,0,17319,,0,0,"447bdc11be653cab9aee6ccc0b31192c82d16775",0,0,0,0,0,""
20201212,"MP",113,,17206,,"posNeg",17319,,4,,,,,29,"12/9/2020 00:00","2020-12-09T00:00:00Z","12/08 19:00",2,4,,"2020-12-09T00:00:00Z",25523,,,113,2,,,17319,,,,,,,,,,,"69",0,0,17319,0,17319,,0,0,"35492970119605c5994814d5b2cc9657f555af6f",0,0,0,0,0,""
20201211,"MP",113,,17206,,"posNeg",17319,,4,,,,,29,"12/9/2020 00:00","2020-12-09T00:00:00Z","12/08 19:00",2,4,,"2020-12-09T00:00:00Z",25523,,,113,2,,,17319,,,,,,,,,,,"69",0,0,17319,0,17319,,0,0,"e09d96db4c6efda3c17fbaa5e5ca90804b1bfbf0",0,0,0,0,0,""
20201210,"MP",113,,17206,,"posNeg",17319,,4,,,,,29,"12/9/2020 00:00","2020-12-09T00:00:00Z","12/08 19:00",2,4,,"2020-12-09T00:00:00Z",25523,,,113,2,,,17319,,,,,,,,,,,"69",0,0,17319,0,17319,,0,0,"afa5723c95bf08af5cda2194575ad08cc7a093c8",0,0,0,0,0,""
20201209,"MP",113,,17206,,"posNeg",17319,,4,,,,,29,"12/8/2020 00:00","2020-12-08T00:00:00Z","12/07 19:00",2,4,,"2020-12-08T00:00:00Z",25523,,,113,2,,,17319,,,,,,,,,,,"69",2,196,17319,198,17319,,0,0,"8b9466e99fd1df20f996a433d25bd1fd7777462a",0,0,0,0,0,""
20201208,"MP",111,,17010,,"posNeg",17121,,4,,,,,29,"12/7/2020 00:00","2020-12-07T00:00:00Z","12/06 19:00",2,4,,"2020-12-07T00:00:00Z",24641,,,111,2,,,17116,,,,,,,,,,,"69",2,0,17121,2,17121,,0,0,"9f0ff9432bd15806e9c407dd8d209f44c4502f39",0,0,0,0,0,""
20201207,"MP",109,,17010,,"posNeg",17119,,4,,,,,29,"12/7/2020 00:00","2020-12-07T00:00:00Z","12/06 19:00",2,4,,"2020-12-07T00:00:00Z",24641,,,109,2,,,17116,,,,,,,,,,,"69",3,0,17119,3,17119,,0,0,"46e1614dd3df1c305850efb7eda52914d396706a",0,0,0,0,0,""
20201206,"MP",106,,17010,,"posNeg",17116,,4,,,,,29,"12/2/2020 00:00","2020-12-02T00:00:00Z","12/01 19:00",2,4,,"2020-12-02T00:00:00Z",23944,,,106,2,,,17116,,,,,,,,,,,"69",0,0,17116,0,17116,,0,0,"6505c85baafadc3aa165f305c5cbd344c31f85c1",0,0,0,0,0,""
20201205,"MP",106,,17010,,"posNeg",17116,,4,,,,,29,"12/2/2020 00:00","2020-12-02T00:00:00Z","12/01 19:00",2,4,,"2020-12-02T00:00:00Z",23944,,,106,2,,,17116,,,,,,,,,,,"69",0,0,17116,0,17116,,0,0,"dfa2073884d168b33025fba7f4f2cbb5abbc872d",0,0,0,0,0,""
20201204,"MP",106,,17010,,"posNeg",17116,,4,,,,,29,"12/2/2020 00:00","2020-12-02T00:00:00Z","12/01 19:00",2,4,,"2020-12-02T00:00:00Z",23944,,,106,2,,,17116,,,,,,,,,,,"69",0,0,17116,0,17116,,0,0,"5e67174194402d684b7e614e214e9a6eea60d7f8",0,0,0,0,0,""
20201203,"MP",106,,17010,,"posNeg",17116,,4,,,,,29,"12/2/2020 00:00","2020-12-02T00:00:00Z","12/01 19:00",2,4,,"2020-12-02T00:00:00Z",23944,,,106,2,,,17116,,,,,,,,,,,"69",0,0,17116,0,17116,,0,0,"a44aae59c22d48c7713ad66b6271b45102de1181",0,0,0,0,0,""
20201202,"MP",106,,17010,,"posNeg",17116,,4,,,,,29,"12/1/2020 00:00","2020-12-01T00:00:00Z","11/30 19:00",2,4,,"2020-12-01T00:00:00Z",23944,,,106,2,,,17116,,,,,,,,,,,"69",0,0,17116,0,17116,,0,0,"5ff8414df2189c673fda3672db71964af7043c5d",0,0,0,0,0,""
20201201,"MP",106,,17010,,"posNeg",17116,,4,,,,,29,"12/1/2020 00:00","2020-12-01T00:00:00Z","11/30 19:00",2,4,,"2020-12-01T00:00:00Z",23944,,,106,2,,,17116,,,,,,,,,,,"69",0,263,17116,263,17116,,0,0,"a680ffb4fcc4b69ec8b2abfe9bc7c0bc6ac2f79b",0,0,0,0,0,""
20201130,"MP",106,,16747,,"posNeg",16853,,4,,,,,29,"11/30/2020 00:00","2020-11-30T00:00:00Z","11/29 19:00",2,4,,"2020-11-30T00:00:00Z",23944,,,106,2,,,16851,,,,,,,,,,,"69",2,0,16853,2,16853,,0,0,"30c6b3c4091ddbb6867afd4ef5f3e26123bb7506",0,0,0,0,0,""
20201129,"MP",104,,16747,,"posNeg",16851,,4,,,,,29,"11/27/2020 00:00","2020-11-27T00:00:00Z","11/26 19:00",2,4,,"2020-11-27T00:00:00Z",22633,,,104,2,,,16851,,,,,,,,,,,"69",0,0,16851,0,16851,,0,0,"7a0d95c7c81a0141f56880f7caa6efa483bf9109",0,0,0,0,0,""
20201128,"MP",104,,16747,,"posNeg",16851,,4,,,,,29,"11/27/2020 00:00","2020-11-27T00:00:00Z","11/26 19:00",2,4,,"2020-11-27T00:00:00Z",22633,,,104,2,,,16851,,,,,,,,,,,"69",0,0,16851,0,16851,,0,0,"0b30e6f0c96e7341d3b38abf9e3f4ca36c6fe999",0,0,0,0,0,""
20201127,"MP",104,,16747,,"posNeg",16851,,4,,,,,29,"11/27/2020 00:00","2020-11-27T00:00:00Z","11/26 19:00",2,4,,"2020-11-27T00:00:00Z",22633,,,104,2,,,16851,,,,,,,,,,,"69",0,0,16851,0,16851,,0,0,"91d16404f433924459610d0038e4af85dc1bab7f",0,0,0,0,0,""
20201126,"MP",104,,16747,,"posNeg",16851,,4,,,,,29,"11/25/2020 00:00","2020-11-25T00:00:00Z","11/24 19:00",2,4,,"2020-11-25T00:00:00Z",22633,,,104,2,,,16851,,,,,,,,,,,"69",0,0,16851,0,16851,,0,0,"cd126f84d46e1b18c2563e3668bc22fc067096f0",0,0,0,0,0,""
20201125,"MP",104,,16747,,"posNeg",16851,,4,,,,,29,"11/25/2020 00:00","2020-11-25T00:00:00Z","11/24 19:00",2,4,,"2020-11-25T00:00:00Z",22633,,,104,2,,,16851,,,,,,,,,,,"69",0,0,16851,0,16851,,0,0,"7747c96c65923732ba7344491c4ed5d55a839e59",0,0,0,0,0,""
20201124,"MP",104,,16747,,"posNeg",16851,,4,,,,,29,"11/23/2020 00:00","2020-11-23T00:00:00Z","11/22 19:00",2,4,,"2020-11-23T00:00:00Z",22633,,,104,2,,,16851,,,,,,,,,,,"69",0,0,16851,0,16851,,0,0,"087b0b98be1e3c312f3afe8bed868eb4bbc05dde",0,0,0,0,0,""
20201123,"MP",104,,16747,,"posNeg",16851,,4,,,,,29,"11/23/2020 00:00","2020-11-23T00:00:00Z","11/22 19:00",2,4,,"2020-11-23T00:00:00Z",22633,,,104,2,,,16851,,,,,,,,,,,"69",0,280,16851,280,16851,,0,0,"6b2d84e00617176d7a76fc9247db625975b9b3c9",0,0,0,0,0,""
20201122,"MP",104,,16467,,"posNeg",16571,,4,,,,,29,"11/20/2020 00:00","2020-11-20T00:00:00Z","11/19 19:00",2,4,,"2020-11-20T00:00:00Z",22633,,,104,2,,,16567,,,,,,,,,,,"69",1,0,16571,1,16571,,0,0,"e137fb1f8661f85be4e4a280d866389aa356d342",0,0,0,0,0,""
20201121,"MP",103,,16467,,"posNeg",16570,,4,,,,,29,"11/20/2020 00:00","2020-11-20T00:00:00Z","11/19 19:00",2,4,,"2020-11-20T00:00:00Z",23472,,,103,2,,,16567,,,,,,,,,,,"69",0,0,16570,0,16570,,0,0,"47c97ee175607f11a5f9f796bb3169f07c56426c",0,0,0,0,0,""
20201120,"MP",103,,16467,,"posNeg",16570,,4,,,,,29,"11/20/2020 00:00","2020-11-20T00:00:00Z","11/19 19:00",2,4,,"2020-11-20T00:00:00Z",23472,,,103,2,,,16567,,,,,,,,,,,"69",0,0,16570,0,16570,,0,0,"a2b298abf32541888a45bcaab3adbaadb7340c0f",0,0,0,0,0,""
20201119,"MP",103,,16467,,"posNeg",16570,,4,,,,,29,"11/19/2020 00:00","2020-11-19T00:00:00Z","11/18 19:00",2,4,,"2020-11-19T00:00:00Z",23472,,,103,2,,,16567,,,,,,,,,,,"69",0,0,16570,0,16570,,0,0,"be17433ce029532a6f9849751f23647de6386cfc",0,0,0,0,0,""
20201118,"MP",103,,16467,,"posNeg",16570,,4,,,,,29,"11/18/2020 00:00","2020-11-18T00:00:00Z","11/17 19:00",2,4,,"2020-11-18T00:00:00Z",23472,,,103,2,,,16567,,,,,,,,,,,"69",0,0,16570,0,16570,,0,0,"f35ee10f7edd0719d797d10218484d11cf419d6e",0,0,0,0,0,""
20201117,"MP",103,,16467,,"posNeg",16570,,4,,,,,29,"11/17/2020 00:00","2020-11-17T00:00:00Z","11/16 19:00",2,4,,"2020-11-17T00:00:00Z",23472,,,103,2,,,16567,,,,,,,,,,,"69",1,0,16570,1,16570,,0,0,"0353600cb30427d848787862c9ddad03ae9955b8",0,0,0,0,0,""
20201116,"MP",102,,16467,,"posNeg",16569,,4,,,,,29,"11/16/2020 00:00","2020-11-16T00:00:00Z","11/15 19:00",2,4,,"2020-11-16T00:00:00Z",22633,,,102,2,,,16567,,,,,,,,,,,"69",2,0,16569,2,16569,,0,0,"521de02e1b75b8f81a41f16d9ffb4ae946124ff9",0,0,0,0,0,""
20201115,"MP",100,,16467,,"posNeg",16567,,4,,,,,29,"11/13/2020 00:00","2020-11-13T00:00:00Z","11/12 19:00",2,4,,"2020-11-13T00:00:00Z",23472,,,100,2,,,16567,,,,,,,,,,,"69",0,0,16567,0,16567,,0,0,"1aeebeabec86cd0ac3ae819173ba95e3c9e3a347",0,0,0,0,0,""
20201114,"MP",100,,16467,,"posNeg",16567,,4,,,,,29,"11/13/2020 00:00","2020-11-13T00:00:00Z","11/12 19:00",2,4,,"2020-11-13T00:00:00Z",23472,,,100,2,,,16567,,,,,,,,,,,"69",0,0,16567,0,16567,,0,0,"ef8ac047b5a7289cbb345249462f4aa39e907507",0,0,0,0,0,""
20201113,"MP",100,,16467,,"posNeg",16567,,4,,,,,29,"11/13/2020 00:00","2020-11-13T00:00:00Z","11/12 19:00",2,4,,"2020-11-13T00:00:00Z",23472,,,100,2,,,16567,,,,,,,,,,,"69",0,0,16567,0,16567,,0,0,"b36c74067c744db5822fbc8012bf3e3ec5c1c8b5",0,0,0,0,0,""
20201112,"MP",100,,16467,,"posNeg",16567,,4,,,,,29,"11/12/2020 00:00","2020-11-12T00:00:00Z","11/11 19:00",2,4,,"2020-11-12T00:00:00Z",23472,,,100,2,,,16567,,,,,,,,,,,"69",0,0,16567,0,16567,,0,0,"8f6820b079c248ee02484626b59530f2313bd597",0,0,0,0,0,""
20201111,"MP",100,,16467,,"posNeg",16567,,4,,,,,29,"11/10/2020 00:00","2020-11-10T00:00:00Z","11/09 19:00",2,4,,"2020-11-10T00:00:00Z",23472,,,100,2,,,16567,,,,,,,,,,,"69",0,0,16567,0,16567,,0,0,"7cdb05f2f14dae8d657dbb2fc558a7ae7005d223",0,0,0,0,0,""
20201110,"MP",100,,16467,,"posNeg",16567,,4,,,,,29,"11/10/2020 00:00","2020-11-10T00:00:00Z","11/09 19:00",2,4,,"2020-11-10T00:00:00Z",23472,,,100,2,,,16567,,,,,,,,,,,"69",0,474,16567,474,16567,,0,0,"36e96fc5e7ea811d2f068f5d23b2b36ed61739c0",0,0,0,0,0,""
20201109,"MP",100,,15993,,"posNeg",16093,,4,,,,,29,"11/9/2020 00:00","2020-11-09T00:00:00Z","11/08 19:00",2,4,,"2020-11-09T00:00:00Z",22633,,,100,2,,,16085,,,,,,,,,,,"69",2,0,16093,2,16093,,0,0,"575ea14d13aee0a751d467642bed9c0d5339e7b2",0,0,0,0,0,""
20201108,"MP",98,,15993,,"posNeg",16091,,4,,,,,29,"11/6/2020 00:00","2020-11-06T00:00:00Z","11/05 19:00",2,4,,"2020-11-06T00:00:00Z",22633,,,98,2,,,16085,,,,,,,,,,,"69",0,0,16091,0,16091,,0,0,"130648f7743fdd08c6755b2dd5ce410e7f9e3848",0,0,0,0,0,""
20201107,"MP",98,,15993,,"posNeg",16091,,4,,,,,29,"11/6/2020 00:00","2020-11-06T00:00:00Z","11/05 19:00",2,4,,"2020-11-06T00:00:00Z",22633,,,98,2,,,16085,,,,,,,,,,,"69",0,0,16091,0,16091,,0,0,"aaffc3625f2d5eb9b49cdf9e4c0f9ff0832d57ce",0,0,0,0,0,""
20201106,"MP",98,,15993,,"posNeg",16091,,4,,,,,29,"11/6/2020 00:00","2020-11-06T00:00:00Z","11/05 19:00",2,4,,"2020-11-06T00:00:00Z",22633,,,98,2,,,16085,,,,,,,,,,,"69",2,0,16091,2,16091,,0,0,"31287b3a749f6edea4c0ec5c98267e507eda72ae",0,0,0,0,0,""
20201105,"MP",96,,15993,,"posNeg",16089,,4,,,,,29,"11/2/2020 00:00","2020-11-02T00:00:00Z","11/01 19:00",2,4,,"2020-11-02T00:00:00Z",22633,,,96,2,,,16085,,,,,,,,,,,"69",0,0,16089,0,16089,,0,0,"49857f62a0848b3333c69ed428025d55415434c5",0,0,0,0,0,""
20201104,"MP",96,,15993,,"posNeg",16089,,4,,,,,29,"11/2/2020 00:00","2020-11-02T00:00:00Z","11/01 19:00",2,4,,"2020-11-02T00:00:00Z",22633,,,96,2,,,16085,,,,,,,,,,,"69",0,0,16089,0,16089,,0,0,"c10a067a077d93ee5651907af371d82e8eedf0de",0,0,0,0,0,""
20201103,"MP",96,,15993,,"posNeg",16089,,4,,,,,29,"11/2/2020 00:00","2020-11-02T00:00:00Z","11/01 19:00",2,4,,"2020-11-02T00:00:00Z",22633,,,96,2,,,16085,,,,,,,,,,,"69",0,0,16089,0,16089,,0,0,"cc85342e2eb3514e6b743a8111de7dde99d7afcf",0,0,0,0,0,""
20201102,"MP",96,,15993,,"posNeg",16089,,4,,,,,29,"11/2/2020 00:00","2020-11-02T00:00:00Z","11/01 19:00",2,4,,"2020-11-02T00:00:00Z",22633,,,96,2,,,16085,,,,,,,,,,,"69",0,0,16089,0,16089,,0,0,"909bd0ce3be7c98d6cb79e85de5aa86b18e30ee9",0,0,0,0,0,""
20201101,"MP",96,,15993,,"posNeg",16089,,4,,,,,29,"10/31/2020 00:00","2020-10-31T00:00:00Z","10/30 20:00",2,4,,"2020-10-31T00:00:00Z",22633,,,96,2,,,16085,,,,,,,,,,,"69",4,0,16089,4,16089,,0,0,"71d007230f399e9c4af31793cbf1660707015895",0,0,0,0,0,""
20201031,"MP",92,,15993,,"posNeg",16085,,4,,,,,29,"10/30/2020 00:00","2020-10-30T00:00:00Z","10/29 20:00",2,4,,"2020-10-30T00:00:00Z",22633,,,92,2,,,16085,,,,,,,,,,,"69",0,0,16085,0,16085,,0,0,"7ace5c5769a86e75f5ff2ec70c27fae0b458d307",0,0,0,0,0,""
20201030,"MP",92,,15993,,"posNeg",16085,,4,,,,,29,"10/30/2020 00:00","2020-10-30T00:00:00Z","10/29 20:00",2,4,,"2020-10-30T00:00:00Z",22633,,,92,2,,,16085,,,,,,,,,,,"69",0,0,16085,0,16085,,0,0,"a9e4507bc9efe06bbd989c31fb912ba9cb264d27",0,0,0,0,0,""
20201029,"MP",92,,15993,,"posNeg",16085,,4,,,,,29,"10/27/2020 00:00","2020-10-27T00:00:00Z","10/26 20:00",2,4,,"2020-10-27T00:00:00Z",22633,,,92,2,,,16085,,,,,,,,,,,"69",0,0,16085,0,16085,,0,0,"0c4c9ca88dc8e4e3202d041f503771ca3a7761a5",0,0,0,0,0,""
20201028,"MP",92,,15993,,"posNeg",16085,,4,,,,,29,"10/27/2020 00:00","2020-10-27T00:00:00Z","10/26 20:00",2,4,,"2020-10-27T00:00:00Z",22633,,,92,2,,,16085,,,,,,,,,,,"69",0,0,16085,0,16085,,0,0,"1f834ebedf4b1c251d970479eb165c596d85d806",0,0,0,0,0,""
20201027,"MP",92,,15993,,"posNeg",16085,,4,,,,,29,"10/27/2020 00:00","2020-10-27T00:00:00Z","10/26 20:00",2,4,,"2020-10-27T00:00:00Z",22633,,,92,2,,,16085,,,,,,,,,,,"69",0,270,16085,270,16085,,0,0,"22ab6ad304c59d15469a023b1704d613dc19677f",0,0,0,0,0,""
20201026,"MP",92,,15723,,"posNeg",15815,,4,,,,,29,"10/26/2020 00:00","2020-10-26T00:00:00Z","10/25 20:00",2,4,,"2020-10-26T00:00:00Z",22212,,,92,2,,,15811,,,,,,,,,,,"69",4,0,15815,4,15815,,0,0,"a39c1d3fdfa359b38240898d83f841756ce208bc",0,0,0,0,0,""
20201025,"MP",88,,15723,,"posNeg",15811,,4,,,,,29,"10/23/2020 00:00","2020-10-23T00:00:00Z","10/22 20:00",2,4,,"2020-10-23T00:00:00Z",22212,,,88,2,,,15811,,,,,,,,,,,"69",0,0,15811,0,15811,,0,0,"1da0aac589bec2fd0de0b3d2d663bd69a4d3f908",0,0,0,0,0,""
20201024,"MP",88,,15723,,"posNeg",15811,,4,,,,,29,"10/23/2020 00:00","2020-10-23T00:00:00Z","10/22 20:00",2,4,,"2020-10-23T00:00:00Z",22212,,,88,2,,,15811,,,,,,,,,,,"69",0,0,15811,0,15811,,0,0,"56cd94cc80800bfe0b475f0f7b92d794812b0aed",0,0,0,0,0,""
20201023,"MP",88,,15723,,"posNeg",15811,,4,,,,,29,"10/23/2020 00:00","2020-10-23T00:00:00Z","10/22 20:00",2,4,,"2020-10-23T00:00:00Z",22212,,,88,2,,,15811,,,,,,,,,,,"69",0,0,15811,0,15811,,0,0,"04e195c0f11f693dbcef35239d16f32cf182c5a7",0,0,0,0,0,""
20201022,"MP",88,,15723,,"posNeg",15811,,4,,,,,29,"10/19/2020 00:00","2020-10-19T00:00:00Z","10/18 20:00",2,4,,"2020-10-19T00:00:00Z",22212,,,88,2,,,15811,,,,,,,,,,,"69",0,0,15811,0,15811,,0,0,"b30b32d0beb7b8625652246ec45ba4afc07ff930",0,0,0,0,0,""
20201021,"MP",88,,15723,,"posNeg",15811,,4,,,,,29,"10/19/2020 00:00","2020-10-19T00:00:00Z","10/18 20:00",2,4,,"2020-10-19T00:00:00Z",22212,,,88,2,,,15811,,,,,,,,,,,"69",0,0,15811,0,15811,,0,0,"3265f9becb0f6eb54f929632068bd94d015a359f",0,0,0,0,0,""
20201020,"MP",88,,15723,,"posNeg",15811,,4,,,,,29,"10/19/2020 00:00","2020-10-19T00:00:00Z","10/18 20:00",2,4,,"2020-10-19T00:00:00Z",22212,,,88,2,,,15811,,,,,,,,,,,"69",2,267,15811,269,15811,,0,0,"897e165e7bf4d39ea1d03b17fcecfabbb86c2d63",0,0,0,0,0,""
20201019,"MP",86,,15456,,"posNeg",15542,,4,,,,,29,"10/17/2020 00:00","2020-10-17T00:00:00Z","10/16 20:00",2,4,,"2020-10-17T00:00:00Z",19835,,,86,2,,,15533,,,,,,,,,,,"69",0,0,15542,0,15542,,0,0,"61dad696ea9b065b7e47b9cfb1174ff5295b67f0",0,0,0,0,0,""
20201018,"MP",86,,15456,,"posNeg",15542,,4,,,,,29,"10/17/2020 00:00","2020-10-17T00:00:00Z","10/16 20:00",2,4,,"2020-10-17T00:00:00Z",19835,,,86,2,,,15533,,,,,,,,,,,"69",0,0,15542,0,15542,,0,0,"0ae8d2ef2c055d82eee1a54d88bd29012dc78e4a",0,0,0,0,0,""
20201017,"MP",86,,15456,,"posNeg",15542,,4,,,,,29,"10/17/2020 00:00","2020-10-17T00:00:00Z","10/16 20:00",2,4,,"2020-10-17T00:00:00Z",19835,,,86,2,,,15533,,,,,,,,,,,"69",6,0,15542,6,15542,,0,0,"22cc1972a5816bcfb8aa200ced41b5080243ced5",0,0,0,0,0,""
20201016,"MP",80,,15456,,"posNeg",15536,,4,,,,,29,"10/15/2020 00:00","2020-10-15T00:00:00Z","10/14 20:00",2,4,,"2020-10-15T00:00:00Z",21290,,,80,2,,,15533,,,,,,,,,,,"69",3,0,15536,3,15536,,0,0,"9253fe892cd1c35326ca83788528dfe21199c302",0,0,0,0,0,""
20201015,"MP",77,,15456,,"posNeg",15533,,4,,,,,29,"10/15/2020 00:00","2020-10-15T00:00:00Z","10/14 20:00",2,4,,"2020-10-15T00:00:00Z",21290,,,77,2,,,15533,,,,,,,,,,,"69",0,0,15533,0,15533,,0,0,"3a145f5bb447e82ce2b77a7dbd9aa9654bd1f824",0,0,0,0,0,""
20201014,"MP",77,,15456,,"posNeg",15533,,4,,,,,29,"10/13/2020 00:00","2020-10-13T00:00:00Z","10/12 20:00",2,4,,"2020-10-13T00:00:00Z",21290,,,77,2,,,15533,,,,,,,,,,,"69",0,335,15533,335,15533,,0,0,"38327a246237e36325e8d33115956c6c63e84051",0,0,0,0,0,""
20201013,"MP",77,,15121,,"posNeg",15198,,4,,,,,29,"10/13/2020 00:00","2020-10-13T00:00:00Z","10/12 20:00",2,4,,"2020-10-13T00:00:00Z",19835,,,77,2,,,15196,,,,,,,,,,,"69",0,0,15198,0,15198,,0,0,"80a0acab1328368fdf8762f29d81b5a91e33f8eb",0,0,0,0,0,""
20201012,"MP",77,,15121,,"posNeg",15198,,4,,,,,29,"10/10/2020 00:00","2020-10-10T00:00:00Z","10/09 20:00",2,4,,"2020-10-10T00:00:00Z",19835,,,77,2,,,15196,,,,,,,,,,,"69",0,0,15198,0,15198,,0,0,"0551a16c6543ef51a5847d1004c3e2f27504fff5",0,0,0,0,0,""
20201011,"MP",77,,15121,,"posNeg",15198,,4,,,,,29,"10/10/2020 00:00","2020-10-10T00:00:00Z","10/09 20:00",2,4,,"2020-10-10T00:00:00Z",19835,,,77,2,,,15196,,,,,,,,,,,"69",0,0,15198,0,15198,,0,0,"99110bf75f47ff581497b6416d79f3c0dff7f82a",0,0,0,0,0,""
20201010,"MP",77,,15121,,"posNeg",15198,,4,,,,,29,"10/10/2020 00:00","2020-10-10T00:00:00Z","10/09 20:00",2,4,,"2020-10-10T00:00:00Z",19835,,,77,2,,,15196,,,,,,,,,,,"69",2,0,15198,2,15198,,0,0,"809616f578901ddbb953f47716eb31e2f49d5027",0,0,0,0,0,""
20201009,"MP",75,,15121,,"posNeg",15196,,4,,,,,29,"10/8/2020 00:00","2020-10-08T00:00:00Z","10/07 20:00",2,4,,"2020-10-08T00:00:00Z",20709,,,75,2,,,15196,,,,,,,,,,,"69",0,0,15196,0,15196,,0,0,"691f0d25e1b1f138e8f3c0710b280f6468714dc7",0,0,0,0,0,""
20201008,"MP",75,,15121,,"posNeg",15196,,4,,,,,29,"10/6/2020 00:00","2020-10-06T00:00:00Z","10/05 20:00",2,4,,"2020-10-06T00:00:00Z",20709,,,75,2,,,15196,,,,,,,,,,,"69",0,0,15196,0,15196,,0,0,"18c73d42d957e9b65fefa3f17869ffecea698591",0,0,0,0,0,""
20201007,"MP",75,,15121,,"posNeg",15196,,4,,,,,29,"10/6/2020 00:00","2020-10-06T00:00:00Z","10/05 20:00",2,4,,"2020-10-06T00:00:00Z",20709,,,75,2,,,15196,,,,,,,,,,,"69",0,0,15196,0,15196,,0,0,"c8a266633d725c7fbdc784c575277f01077a8c7b",0,0,0,0,0,""
20201006,"MP",75,,15121,,"posNeg",15196,,4,,,,,29,"10/6/2020 00:00","2020-10-06T00:00:00Z","10/05 20:00",2,4,,"2020-10-06T00:00:00Z",20709,,,75,2,,,15196,,,,,,,,,,,"69",0,0,15196,0,15196,,0,0,"294418713379a349298f559efc6466ce98ca64c2",0,0,0,0,0,""
20201005,"MP",75,,15121,,"posNeg",15196,,4,,,,,29,"10/5/2020 00:00","2020-10-05T00:00:00Z","10/04 20:00",2,4,,"2020-10-05T00:00:00Z",20709,,,75,2,,,15196,,,,,,,,,,,"69",2,9,15196,11,15196,,0,0,"7d9feedd41523233981424a790f89695d60a0fc2",0,0,0,0,0,""
20201004,"MP",73,,15112,,"posNeg",15185,,4,,,,,29,"10/2/2020 00:00","2020-10-02T00:00:00Z","10/01 20:00",2,4,,"2020-10-02T00:00:00Z",20419,,,73,2,,,15182,,,,,,,,,,,"69",0,0,15185,0,15185,,0,0,"ed6226996155e8d9ee3f109ed1b4bc8635a4c7b3",0,0,0,0,0,""
20201003,"MP",73,,15112,,"posNeg",15185,,4,,,,,29,"10/2/2020 00:00","2020-10-02T00:00:00Z","10/01 20:00",2,4,,"2020-10-02T00:00:00Z",20419,,,73,2,,,15182,,,,,,,,,,,"69",0,0,15185,0,15185,,0,0,"25cbe441def0b1affce2d2b88af0713abfc8e9b6",0,0,0,0,0,""
20201002,"MP",73,,15112,,"posNeg",15185,,4,,,,,29,"10/2/2020 00:00","2020-10-02T00:00:00Z","10/01 20:00",2,4,,"2020-10-02T00:00:00Z",20419,,,73,2,,,15182,,,,,,,,,,,"69",3,0,15185,3,15185,,0,0,"c9304c5847eba23a36b3f12b2bc22ca4967bf29a",0,0,0,0,0,""
20201001,"MP",70,,15112,,"posNeg",15182,,4,,,,,29,"10/1/2020 00:00","2020-10-01T00:00:00Z","09/30 20:00",2,4,,"2020-10-01T00:00:00Z",20419,,,70,2,,,15182,,,,,,,,,,,"69",0,0,15182,0,15182,,0,0,"b9bc0f20700cd636d3d748fb84654fc42a70fcbb",0,0,0,0,0,""
20200930,"MP",70,,15112,,"posNeg",15182,,4,,,,,29,"9/30/2020 00:00","2020-09-30T00:00:00Z","09/29 20:00",2,4,,"2020-09-30T00:00:00Z",20419,,,70,2,,,15182,,,,,,,,,,,"69",0,336,15182,336,15182,,0,0,"b0fab6e86bf42d629c73df1814e1933cd09e35e4",0,0,0,0,0,""
20200929,"MP",70,,14776,,"posNeg",14846,,4,,,,,29,"9/29/2020 00:00","2020-09-29T00:00:00Z","09/28 20:00",2,4,,"2020-09-29T00:00:00Z",19835,,,70,2,,,14845,,,,,,,,,,,"69",0,0,14846,0,14846,,0,0,"b33c45ae95fa63d0daba1da8207286c30383cc71",0,0,0,0,0,""
20200928,"MP",70,,14776,,"posNeg",14846,,4,,,,,29,"9/28/2020 00:00","2020-09-28T00:00:00Z","09/27 20:00",2,4,,"2020-09-28T00:00:00Z",19835,,,70,2,,,14845,,,,,,,,,,,"69",0,0,14846,0,14846,,0,0,"efe50782630f7e38553fc7ed01d494b98eee99f2",0,0,0,0,0,""
20200927,"MP",70,,14776,,"posNeg",14846,,4,,,,,29,"9/26/2020 00:00","2020-09-26T00:00:00Z","09/25 20:00",2,4,,"2020-09-26T00:00:00Z",19835,,,70,2,,,14845,,,,,,,,,,,"69",1,0,14846,1,14846,,0,0,"ef7798d5ee9b6e3460e46d9510e7d313cf53c12d",0,0,0,0,0,""
20200926,"MP",69,,14776,,"posNeg",14845,,4,,,,,29,"9/25/2020 00:00","2020-09-25T00:00:00Z","09/24 20:00",2,4,,"2020-09-25T00:00:00Z",19835,,,69,2,,,14845,,,,,,,,,,,"69",0,0,14845,0,14845,,0,0,"5cb952e6304ede05c2c9ff0665d4069e12984bb5",0,0,0,0,0,""
20200925,"MP",69,,14776,,"posNeg",14845,,4,,,,,29,"9/25/2020 00:00","2020-09-25T00:00:00Z","09/24 20:00",2,4,,"2020-09-25T00:00:00Z",19835,,,69,2,,,14845,,,,,,,,,,,"69",0,0,14845,0,14845,,0,0,"fdfc837cd004bc29e314b333aa0680cc43ffd38f",0,0,0,0,0,""
20200924,"MP",69,,14776,,"posNeg",14845,,4,,,,,29,"9/23/2020 00:00","2020-09-23T00:00:00Z","09/22 20:00",2,4,,"2020-09-23T00:00:00Z",19835,,,69,2,,,14845,,,,,,,,,,,"69",0,0,14845,0,14845,,0,0,"0e78d4cdc916c9d0616cdc26bb2df0429dba4f3d",0,0,0,0,0,""
20200923,"MP",69,,14776,,"posNeg",14845,,4,,,,,29,"9/22/2020 00:00","2020-09-22T00:00:00Z","09/21 20:00",2,4,,"2020-09-22T00:00:00Z",19835,,,69,2,,,14845,,,,,,,,,,,"69",0,460,14845,460,14845,,0,0,"1867028e43f7b70edddefd57c0d5e9c1c9691a9e",0,0,0,0,0,""
20200922,"MP",69,,14316,,"posNeg",14385,,4,,,,,29,"9/21/2020 00:00","2020-09-21T00:00:00Z","09/20 20:00",2,4,,"2020-09-21T00:00:00Z",18915,,,69,2,,,14375,,,,,,,,,,,"69",0,0,14385,0,14385,,0,0,"fce3c5317a5370d52a1d332e99a2f45cf0d55703",0,0,0,0,0,""
20200921,"MP",69,,14316,,"posNeg",14385,,4,,,,,29,"9/21/2020 00:00","2020-09-21T00:00:00Z","09/20 20:00",2,4,,"2020-09-21T00:00:00Z",18915,,,69,2,,,14375,,,,,,,,,,,"69",1,0,14385,1,14385,,0,0,"2609ae203c38253203d22876190680ee142e7799",0,0,0,0,0,""
20200920,"MP",68,,14316,,"posNeg",14384,,4,,,,,29,"9/20/2020 00:00","2020-09-20T00:00:00Z","09/19 20:00",2,4,,"2020-09-20T00:00:00Z",18915,,,68,2,,,14375,,,,,,,,,,,"69",6,0,14384,6,14384,,0,0,"a7578fb99e8e01ab474d6dfa8125d11a3733af86",0,0,0,0,0,""
20200919,"MP",62,,14316,,"posNeg",14378,,4,,,,,29,"9/17/2020 00:00","2020-09-17T00:00:00Z","09/16 20:00",2,4,,"2020-09-17T00:00:00Z",18915,,,62,2,,,14375,,,,,,,,,,,"69",0,0,14378,0,14378,,0,0,"7d937924423e0e96d3016fe3b235c14c6209665b",0,0,0,0,0,""
20200918,"MP",62,,14316,,"posNeg",14378,,4,,,,,29,"9/17/2020 00:00","2020-09-17T00:00:00Z","09/16 20:00",2,4,,"2020-09-17T00:00:00Z",18915,,,62,2,,,14375,,,,,,,,,,,"69",0,0,14378,0,14378,,0,0,"79c0a6c0f38983a02c0375e60ab8ea340368faa1",0,0,0,0,0,""
20200917,"MP",62,,14316,,"posNeg",14378,,4,,,,,29,"9/17/2020 00:00","2020-09-17T00:00:00Z","09/16 20:00",2,4,,"2020-09-17T00:00:00Z",18915,,,62,2,,,14375,,,,,,,,,,,"69",1,0,14378,1,14378,,0,0,"764c5ab7024491bd2206ec2125d86633bba86ad1",0,0,0,0,0,""
20200916,"MP",61,,14316,,"posNeg",14377,,4,,,,,29,"9/14/2020 00:00","2020-09-14T00:00:00Z","09/13 20:00",2,4,,"2020-09-14T00:00:00Z",18915,,,61,2,,,14375,,,,,,,,,,,"69",0,0,14377,0,14377,,0,0,"f4d8a56ac248b0417f0b91aeed39042505bfbb63",0,0,0,0,0,""
20200915,"MP",61,,14316,,"posNeg",14377,,4,,,,,29,"9/14/2020 00:00","2020-09-14T00:00:00Z","09/13 20:00",2,4,,"2020-09-14T00:00:00Z",18915,,,61,2,,,14375,,,,,,,,,,,"69",0,0,14377,0,14377,,0,0,"65380c4bb5e6b654d3982aea35037fd504df0adb",0,0,0,0,0,""
20200914,"MP",61,,14316,,"posNeg",14377,,4,,,,,29,"9/14/2020 00:00","2020-09-14T00:00:00Z","09/13 20:00",2,4,,"2020-09-14T00:00:00Z",18915,,,61,2,,,14375,,,,,,,,,,,"69",1,0,14377,1,14377,,0,0,"b6b72e1d32a7e298a052ad90338493f6d45e661e",0,0,0,0,0,""
20200913,"MP",60,,14316,,"posNeg",14376,,4,,,,,29,"9/12/2020 00:00","2020-09-12T00:00:00Z","09/11 20:00",2,4,,"2020-09-12T00:00:00Z",18915,,,60,2,,,14375,,,,,,,,,,,"69",0,0,14376,0,14376,,0,0,"071f3734ea7a3e03dfd2eaae46faf82ff2a3eaf2",0,0,0,0,0,""
20200912,"MP",60,,14316,,"posNeg",14376,,4,,,,,29,"9/8/2020 00:00","2020-09-08T00:00:00Z","09/07 20:00",2,4,,"2020-09-08T00:00:00Z",18915,,,60,2,,,14375,,,,,,,,,,,"69",1,0,14376,1,14376,,0,0,"ea57ec2a1c0d20cc670befe9d694fa3bb1fc318e",0,0,0,0,0,""
20200911,"MP",59,,14316,,"posNeg",14375,,4,,,,,29,"9/8/2020 00:00","2020-09-08T00:00:00Z","09/07 20:00",2,4,,"2020-09-08T00:00:00Z",18915,,,59,2,,,14375,,,,,,,,,,,"69",0,0,14375,0,14375,,0,0,"2697886fbf67a97b77bb52e3176942cd2bf35aad",0,0,0,0,0,""
20200910,"MP",59,,14316,,"posNeg",14375,,4,,,,,29,"9/8/2020 00:00","2020-09-08T00:00:00Z","09/07 20:00",2,4,,"2020-09-08T00:00:00Z",18915,,,59,2,,,14375,,,,,,,,,,,"69",0,830,14375,830,14375,,0,0,"8e1cacd28f822ed7b9c67acdccdcd70d0ccf6f40",0,0,0,0,0,""
20200909,"MP",59,,13486,,"posNeg",13545,,4,,,,,29,"9/1/2020 00:00","2020-09-01T00:00:00Z","08/31 20:00",2,4,,"2020-09-01T00:00:00Z",17626,,,59,2,,,13540,,,,,,,,,,,"69",0,0,13545,0,13545,,0,0,"a649c56a0e97f3fe12e9fa925cc337c430c3661e",0,0,0,0,0,""
20200908,"MP",59,,13486,,"posNeg",13545,,4,,,,,29,"9/1/2020 00:00","2020-09-01T00:00:00Z","08/31 20:00",2,4,,"2020-09-01T00:00:00Z",17626,,,59,2,,,13540,,,,,,,,,,,"69",1,0,13545,1,13545,,0,0,"d49cedc1694a66af62e32995fc646b213c3fdbcc",0,0,0,0,0,""
20200907,"MP",58,,13486,,"posNeg",13544,,4,,,,,29,"9/1/2020 00:00","2020-09-01T00:00:00Z","08/31 20:00",2,4,,"2020-09-01T00:00:00Z",17626,,,58,2,,,13540,,,,,,,,,,,"69",0,0,13544,0,13544,,0,0,"2c3c31b71fe36a23e147e81c114812b95325d426",0,0,0,0,0,""
20200906,"MP",58,,13486,,"posNeg",13544,,4,,,,,29,"9/1/2020 00:00","2020-09-01T00:00:00Z","08/31 20:00",2,4,,"2020-09-01T00:00:00Z",17626,,,58,2,,,13540,,,,,,,,,,,"69",0,0,13544,0,13544,,0,0,"d0f1340d949cdb78595bc8f151931b4c4cb0591b",0,0,0,0,0,""
20200905,"MP",58,,13486,,"posNeg",13544,,4,,,,,29,"9/1/2020 00:00","2020-09-01T00:00:00Z","08/31 20:00",2,4,,"2020-09-01T00:00:00Z",17626,,,58,2,,,13540,,,,,,,,,,,"69",1,0,13544,1,13544,,0,0,"1605a053336b645d49f5084f4f8bdd64b37d4b2d",0,0,0,0,0,""
20200904,"MP",57,,13486,,"posNeg",13543,,4,,,,,29,"9/1/2020 00:00","2020-09-01T00:00:00Z","08/31 20:00",2,4,,"2020-09-01T00:00:00Z",17626,,,57,2,,,13540,,,,,,,,,,,"69",0,0,13543,0,13543,,0,0,"c15709fb0c13b311e864c2785decd93a7a20d268",0,0,0,0,0,""
20200903,"MP",57,,13486,,"posNeg",13543,,4,,,,,29,"9/1/2020 00:00","2020-09-01T00:00:00Z","08/31 20:00",2,4,,"2020-09-01T00:00:00Z",17626,,,57,2,,,13540,,,,,,,,,,,"69",0,0,13543,0,13543,,0,0,"3d76d129af3497b5fdbeeec1423aafdfa4e13bd5",0,0,0,0,0,""
20200902,"MP",57,,13486,,"posNeg",13543,,4,,,,,29,"9/1/2020 00:00","2020-09-01T00:00:00Z","08/31 20:00",2,4,,"2020-09-01T00:00:00Z",17626,,,57,2,,,13540,,,,,,,,,,,"69",0,0,13543,0,13543,,0,0,"0bed0a686ee68c30d909c5ff80c45c899e9247f9",0,0,0,0,0,""
20200901,"MP",57,,13486,,"posNeg",13543,,4,,,,,29,"9/1/2020 00:00","2020-09-01T00:00:00Z","08/31 20:00",2,4,,"2020-09-01T00:00:00Z",17626,,,57,2,,,13540,,,,,,,,,,,"69",1,0,13543,1,13543,,0,0,"d3c6229ca0fdc9db945f3993a02bc007ae5cfcf7",0,0,0,0,0,""
20200831,"MP",56,,13486,,"posNeg",13542,,4,,,,,29,"8/26/2020 23:49","2020-08-26T23:49:00Z","08/26 19:49",2,4,,"2020-08-26T23:49:00Z",17626,,,56,2,,,13540,,,,,,,,,,,"69",0,0,13542,0,13542,,0,0,"40c299336000b9b23e7670d7fb3be2b32a198dd7",0,0,0,0,0,""
20200830,"MP",56,,13486,,"posNeg",13542,,4,,,,,29,"8/26/2020 23:49","2020-08-26T23:49:00Z","08/26 19:49",2,4,,"2020-08-26T23:49:00Z",17626,,,56,2,,,13540,,,,,,,,,,,"69",0,0,13542,0,13542,,0,0,"f4cf248d42ffac3cdb02de92f7a6984be605c1f9",0,0,0,0,0,""
20200829,"MP",56,,13486,,"posNeg",13542,,4,,,,,29,"8/26/2020 23:49","2020-08-26T23:49:00Z","08/26 19:49",2,4,,"2020-08-26T23:49:00Z",17626,,,56,2,,,13540,,,,,,,,,,,"69",2,0,13542,2,13542,,0,0,"2cfd783479b022ef123c50736aff2a556c1f0725",0,0,0,0,0,""
20200828,"MP",54,,13486,,"posNeg",13540,,4,,,,,29,"8/26/2020 23:49","2020-08-26T23:49:00Z","08/26 19:49",2,4,,"2020-08-26T23:49:00Z",17626,,,54,2,,,13540,,,,,,,,,,,"69",0,0,13540,0,13540,,0,0,"79f491fb6035347375c0185e478a2ffce16ea90a",0,0,0,0,0,""
20200827,"MP",54,,13486,,"posNeg",13540,,4,,,,,29,"8/26/2020 23:49","2020-08-26T23:49:00Z","08/26 19:49",2,4,,"2020-08-26T23:49:00Z",17626,,,54,2,,,13540,,,,,,,,,,,"69",0,619,13540,619,13540,,0,0,"ec60ee976c4a4c07528228957e85294f02f88248",0,0,0,0,0,""
20200826,"MP",54,,12867,,"posNeg",12921,,4,,,,,29,"8/17/2020 19:35","2020-08-17T19:35:00Z","08/17 15:35",2,4,,"2020-08-17T19:35:00Z",16453,,,54,2,,,12920,,,,,,,,,,,"69",0,0,12921,0,12921,,0,0,"c97b1da581b13b69da19beca8c8fff8d8967ad5c",0,0,0,0,0,""
20200825,"MP",54,,12867,,"posNeg",12921,,4,,,,,29,"8/17/2020 19:35","2020-08-17T19:35:00Z","08/17 15:35",2,4,,"2020-08-17T19:35:00Z",16453,,,54,2,,,12920,,,,,,,,,,,"69",0,0,12921,0,12921,,0,0,"e2c0c218c10efd5d21bd1c944ed41f9ad472b874",0,0,0,0,0,""
20200824,"MP",54,,12867,,"posNeg",12921,,4,,,,,29,"8/17/2020 19:35","2020-08-17T19:35:00Z","08/17 15:35",2,4,,"2020-08-17T19:35:00Z",16453,,,54,2,,,12920,,,,,,,,,,,"69",0,0,12921,0,12921,,0,0,"1b98258bb71a66b4f867bf17d7c7134dd753ee96",0,0,0,0,0,""
20200823,"MP",54,,12867,,"posNeg",12921,,4,,,,,29,"8/17/2020 19:35","2020-08-17T19:35:00Z","08/17 15:35",2,4,,"2020-08-17T19:35:00Z",16453,,,54,2,,,12920,,,,,,,,,,,"69",0,0,12921,0,12921,,0,0,"e0e6e2a9121ed274dbc36b4a6d891ac6c1382a6a",0,0,0,0,0,""
20200822,"MP",54,,12867,,"posNeg",12921,,4,,,,,29,"8/17/2020 19:35","2020-08-17T19:35:00Z","08/17 15:35",2,4,,"2020-08-17T19:35:00Z",16453,,,54,2,,,12920,,,,,,,,,,,"69",0,0,12921,0,12921,,0,0,"e97d855bc3833bb90a6005e9468f4b1c626e466e",0,0,0,0,0,""
20200821,"MP",54,,12867,,"posNeg",12921,,4,,,,,29,"8/17/2020 19:35","2020-08-17T19:35:00Z","08/17 15:35",2,4,,"2020-08-17T19:35:00Z",16453,,,54,2,,,12920,,,,,,,,,,,"69",0,0,12921,0,12921,,0,0,"b8040ed666f59b969173c9f5f1fe2c9d4c0ae650",0,0,0,0,0,""
20200820,"MP",54,,12867,,"posNeg",12921,,4,,,,,29,"8/17/2020 19:35","2020-08-17T19:35:00Z","08/17 15:35",2,4,,"2020-08-17T19:35:00Z",16453,,,54,2,,,12920,,,,,,,,,,,"69",0,1,12921,1,12921,,0,0,"6472ffe5ea1a1419f22f335a0646ebb2df67d90d",0,0,0,0,0,""
20200819,"MP",54,,12866,,"posNeg",12920,,4,,,,,29,"8/17/2020 19:35","2020-08-17T19:35:00Z","08/17 15:35",2,4,,"2020-08-17T19:35:00Z",16453,,,54,2,,,12920,,,,,,,,,,,"69",0,0,12920,0,12920,,0,0,"d3254686c36c838fb4fc29d07b15c770bb8859cb",0,0,0,0,0,""
20200818,"MP",54,,12866,,"posNeg",12920,,4,,,,,29,"8/17/2020 19:35","2020-08-17T19:35:00Z","08/17 15:35",2,4,,"2020-08-17T19:35:00Z",16453,,,54,,,,12920,,,,,,,,,,,"69",1,-1,12920,0,12920,,0,0,"a91ddb487153acef7041950d7a2c3f5f8e0c4ace",0,0,0,0,0,""
20200817,"MP",53,,12867,,"posNeg",12920,,4,,,,,29,"8/17/2020 04:04","2020-08-17T04:04:00Z","08/17 00:04",2,4,,"2020-08-17T04:04:00Z",16453,,,53,,,,12920,,,,,,,,,,,"69",3,615,12920,618,12920,,0,0,"cbe8067b36becd14dfc436246be7d87463c411ee",0,0,0,0,0,""
20200816,"MP",50,,12252,,"posNeg",12302,,4,,,,,29,"8/14/2020 04:04","2020-08-14T04:04:00Z","08/14 00:04",2,4,,"2020-08-14T04:04:00Z",14419,,,50,,,,12301,,,,,,,,,,,"69",0,0,12302,0,12302,,0,0,"e5a075a765dab269399a2c423c1b409f7edbdf55",0,0,0,0,0,""
20200815,"MP",50,,12252,,"posNeg",12302,,4,,,,,29,"8/14/2020 04:04","2020-08-14T04:04:00Z","08/14 00:04",2,4,,"2020-08-14T04:04:00Z",14419,,,50,,,,12301,,,,,,,,,,,"69",0,0,12302,0,12302,,0,0,"48db28501e9ec7ff8bbea753f305d549531fe63f",0,0,0,0,0,""
20200814,"MP",50,,12252,,"posNeg",12302,,4,,,,,29,"8/14/2020 04:04","2020-08-14T04:04:00Z","08/14 00:04",2,4,,"2020-08-14T04:04:00Z",14419,,,50,,,,12301,,,,,,,,,,,"69",1,0,12302,1,12302,,0,0,"0f78c88b9b1c13e4f9accb7a30a21e05df8f77a0",0,0,0,0,0,""
20200813,"MP",49,,12252,,"posNeg",12301,,4,,,,,29,"8/10/2020 17:54","2020-08-10T17:54:00Z","08/10 13:54",2,4,,"2020-08-10T17:54:00Z",14419,,,49,,,,12301,,,,,,,,,,,"69",0,0,12301,0,12301,,0,0,"16d7b0c3d8b8e42b6e6a55724b35404cfe4fbddc",0,0,0,0,0,""
20200812,"MP",49,,12252,,"posNeg",12301,,4,,,,,29,"8/10/2020 17:54","2020-08-10T17:54:00Z","08/10 13:54",2,4,,"2020-08-10T17:54:00Z",14419,,,49,,,,12301,,,,,,,,,,,"69",0,0,12301,0,12301,,0,0,"1c4f052b0b3f30f0c0414ae887811b9273b89bbe",0,0,0,0,0,""
20200811,"MP",49,,12252,,"posNeg",12301,,4,,,,,29,"8/10/2020 17:54","2020-08-10T17:54:00Z","08/10 13:54",2,4,,"2020-08-10T17:54:00Z",14419,,,49,,,,12301,,,,,,,,,,,"69",0,0,12301,0,12301,,0,0,"3f6d0bd26267d855e5e7493aea0ab39fa8a1b32a",0,0,0,0,0,""
20200810,"MP",49,,12252,,"posNeg",12301,,4,,,,,29,"8/9/2020 00:59","2020-08-09T00:59:00Z","08/08 20:59",2,4,,"2020-08-09T00:59:00Z",14419,,,49,,,,12301,,,,,,,,,,,"69",1,-1,12301,0,12301,,0,0,"4a30fb35f975f98741be0b3b6beaebfcbf02e5e2",0,0,0,0,0,""
20200809,"MP",48,,12253,,"posNeg",12301,,4,,,,,29,"8/9/2020 00:59","2020-08-09T00:59:00Z","08/08 20:59",2,4,,"2020-08-09T00:59:00Z",14419,,,48,,,,12301,,,,,,,,,,,"69",0,0,12301,0,12301,,0,0,"3aba1e027bb729b87bb3f0efb0c6372ced284ae3",0,0,0,0,0,""
20200808,"MP",48,,12253,,"posNeg",12301,,4,,,,,29,"8/9/2020 00:59","2020-08-09T00:59:00Z","08/08 20:59",2,4,,"2020-08-09T00:59:00Z",14419,,,48,,,,12301,,,,,,,,,,,"69",1,-1,12301,0,12301,,0,0,"ad6922e4f48ae4931a744f5ab7150131bfc19b3a",0,0,0,0,0,""
20200807,"MP",47,,12254,,"posNeg",12301,,4,,,,,29,"8/6/2020 04:01","2020-08-06T04:01:00Z","08/06 00:01",2,4,,"2020-08-06T04:01:00Z",14419,,,47,,,,12301,,,,,,,,,,,"69",0,0,12301,0,12301,,0,0,"33fdc86fae515e1ee6678977b5bc3437afce5e10",0,0,0,0,0,""
20200806,"MP",47,,12254,,"posNeg",12301,,4,,,,,29,"8/6/2020 04:01","2020-08-06T04:01:00Z","08/06 00:01",2,4,,"2020-08-06T04:01:00Z",14419,,,47,,,,12301,,,,,,,,,,,"69",1,-1,12301,0,12301,,0,0,"0ab17f6a56fe578f54ae3f69d1cb312970971f6a",0,0,0,0,0,""
20200805,"MP",46,,12255,,"posNeg",12301,,4,,,,,29,"8/5/2020 00:22","2020-08-05T00:22:00Z","08/04 20:22",2,4,,"2020-08-05T00:22:00Z",14419,,,46,,,,12301,,,,,,,,,,,"69",0,0,12301,0,12301,,0,0,"3c9dae4ad18645f1425c20ecd84ebf41960cac0c",0,0,0,0,0,""
20200804,"MP",46,,12255,,"posNeg",12301,,4,,,,,29,"8/3/2020 03:26","2020-08-03T03:26:00Z","08/02 23:26",2,4,,"2020-08-03T03:26:00Z",14419,,,46,,,,12301,,,,,,,,,,,"69",0,0,12301,0,12301,,0,0,"31f1a931c966d49d0d24d6862245101b2e0cb631",0,0,0,0,0,""
20200803,"MP",46,,12255,,"posNeg",12301,,4,,,,,29,"8/3/2020 03:26","2020-08-03T03:26:00Z","08/02 23:26",2,4,,"2020-08-03T03:26:00Z",14419,,,46,,,,12301,,,,,,,,,,,"69",1,536,12301,537,12301,,0,0,"7028257f4af55beca3e975a7801d6177c234242a",0,0,0,0,0,""
20200802,"MP",45,,11719,,"posNeg",11764,,4,,,,,29,"8/1/2020 11:33","2020-08-01T11:33:00Z","08/01 07:33",2,4,,"2020-08-01T11:33:00Z",12745,,,45,,,,11759,,,,,,,,,,,"69",3,0,11764,3,11764,,0,0,"c7a47079149f19b0084747eed379ff99167ce7b3",0,0,0,0,0,""
20200801,"MP",42,,11719,,"posNeg",11761,,4,,,,,29,"7/30/2020 02:49","2020-07-30T02:49:00Z","07/29 22:49",2,4,,"2020-07-30T02:49:00Z",12745,,,42,,,,11759,,,,,,,,,,,"69",0,0,11761,0,11761,,0,0,"21969d06622a8a771556ae11964d82fb3ed22aeb",0,0,0,0,0,""
20200731,"MP",42,,11719,,"posNeg",11761,,4,,,,,29,"7/29/2020 23:49","2020-07-29T23:49:00Z","07/29 19:49",2,4,,"2020-07-29T23:49:00Z",12745,,,42,,,,11759,,,,,,,,,,,"69",0,0,11761,0,11761,,0,0,"75b3431af2e254f040bdb28838480baaf54da882",0,0,0,0,0,""
20200730,"MP",42,,11719,,"posNeg",11761,,4,,,,,29,"7/29/2020 23:49","2020-07-29T23:49:00Z","07/29 19:49",2,4,,"2020-07-29T23:49:00Z",12745,,,42,,,,11759,,,,,,,,,,,"69",2,0,11761,2,11761,,0,0,"70d11976bebf2652da05a88f111cd55dba1012b9",0,0,0,0,0,""
20200729,"MP",40,,11719,,"posNeg",11759,,4,,,,,29,"7/29/2020 02:48","2020-07-29T02:48:00Z","07/28 22:48",2,4,,"2020-07-29T02:48:00Z",12745,,,40,,,,11759,,,,,,,,,,,"69",0,0,11759,0,11759,,0,0,"7a24854090a3b64a0b1cba5a537c7991c234112d",0,0,0,0,0,""
20200728,"MP",40,,11719,,"posNeg",11759,,4,,,,,29,"7/28/2020 01:35","2020-07-28T01:35:00Z","07/27 21:35",2,4,,"2020-07-28T01:35:00Z",12745,,,40,,,,11759,,,,,,,,,,,"69",0,0,11759,0,11759,,0,0,"18a3ac9103046a50ca9ee185925a5c54f4cc9e77",0,0,0,0,0,""
20200727,"MP",40,,11719,,"posNeg",11759,,4,,,,,29,"7/27/2020 03:22","2020-07-27T03:22:00Z","07/26 23:22",2,4,,"2020-07-27T03:22:00Z",12745,,,40,,,,11759,,,,,,,,,,,"69",0,419,11759,419,11759,,0,0,"969b204c4a2472328492b70d38acb72c8f13ff9d",0,0,0,0,0,""
20200726,"MP",40,,11300,,"posNeg",11340,,4,,,,,29,"7/25/2020 23:05","2020-07-25T23:05:00Z","07/25 19:05",2,4,,"2020-07-25T23:05:00Z",12745,,,40,,,,11338,,,,,,,,,,,"69",1,0,11340,1,11340,,0,0,"34cae25e615cc4e1d0f5c073451a5193e6df97d6",0,0,0,0,0,""
20200725,"MP",39,,11300,,"posNeg",11339,,4,,,,,29,"7/25/2020 07:47","2020-07-25T07:47:00Z","07/25 03:47",2,4,,"2020-07-25T07:47:00Z",12745,,,39,,,,11338,,,,,,,,,,,"69",1,0,11339,1,11339,,0,0,"821e80bb7a6a413e59d7f4c130f9a50128513975",0,0,0,0,0,""
20200724,"MP",38,,11300,,"posNeg",11338,,4,,,,,29,"7/24/2020 02:47","2020-07-24T02:47:00Z","07/23 22:47",2,4,,"2020-07-24T02:47:00Z",12745,,,38,,,,11338,,,,,,,,,,,"69",0,0,11338,0,11338,,0,0,"12e3f7fa8bb4f84fd68099f4c9f70214271384b0",0,0,0,0,0,""
20200723,"MP",38,,11300,,"posNeg",11338,,4,,,,,29,"7/22/2020 19:22","2020-07-22T19:22:00Z","07/22 15:22",2,4,,"2020-07-22T19:22:00Z",12745,,,38,,,,11338,,,,,,,,,,,"69",0,0,11338,0,11338,,0,0,"07516f46df129bcb034db50c7deedbed704db088",0,0,0,0,0,""
20200722,"MP",38,,11300,,"posNeg",11338,,4,,,,,29,"7/21/2020 08:46","2020-07-21T08:46:00Z","07/21 04:46",2,4,,"2020-07-21T08:46:00Z",12745,,,38,,,,11338,,,,,,,,,,,"69",0,245,11338,245,11338,,0,0,"779fe6f78108332b153912cd216de91c2297a8fd",0,0,0,0,0,""
20200721,"MP",38,,11055,,"posNeg",11093,,4,,,,,29,"7/20/2020 19:53","2020-07-20T19:53:00Z","07/20 15:53",2,4,,"2020-07-20T19:53:00Z",12236,,,38,,,,11092,,,,,,,,,,,"69",1,0,11093,1,11093,,0,0,"a9303b80b73ccd3ff63ce7cf89e1d44b6cde5f9b",0,0,0,0,0,""
20200720,"MP",37,,11055,,"posNeg",11092,,4,,,,,29,"7/19/2020 19:55","2020-07-19T19:55:00Z","07/19 15:55",2,4,,"2020-07-19T19:55:00Z",12236,,,37,,,,11092,,,,,,,,,,,"69",0,389,11092,389,11092,,0,0,"0e25db68fb905dfeb12b932e6403e0a8a4175b40",0,0,0,0,0,""
20200719,"MP",37,,10666,,"posNeg",10703,,4,,,,,29,"7/16/2020 19:06","2020-07-16T19:06:00Z","07/16 15:06",2,4,,"2020-07-16T19:06:00Z",11335,,,37,,,,10697,,,,,,,,,,,"69",0,0,10703,0,10703,,0,0,"c0e3c37c262f2e2a3f54c190879efc7670c63f8e",0,0,0,0,0,""
20200718,"MP",37,,10666,,"posNeg",10703,,4,,,,,29,"7/16/2020 19:06","2020-07-16T19:06:00Z","07/16 15:06",2,4,,"2020-07-16T19:06:00Z",11335,,,37,,,,10697,,,,,,,,,,,"69",0,0,10703,0,10703,,0,0,"7085677723e1430375fdfab4f2a8dacbbdc4bd1f",0,0,0,0,0,""
20200717,"MP",37,,10666,,"posNeg",10703,,4,,,,,29,"7/16/2020 19:06","2020-07-16T19:06:00Z","07/16 15:06",2,4,,"2020-07-16T19:06:00Z",11335,,,37,,,,10697,,,,,,,,,,,"69",1,0,10703,1,10703,,0,0,"feb40b4fcb9abd8f761560faf0a7c88d5d59b253",0,0,0,0,0,""
20200716,"MP",36,,10666,,"posNeg",10702,,4,,,,,29,"7/13/2020 18:48","2020-07-13T18:48:00Z","07/13 14:48",2,4,,"2020-07-13T18:48:00Z",11335,,,36,,,,10697,,,,,,,,,,,"69",0,0,10702,0,10702,,0,0,"23c9ff7206a4912b15df3a8f696816b6a607b98b",0,0,0,0,0,""
20200715,"MP",36,,10666,,"posNeg",10702,,4,,,,,29,"7/14/2020 04:48","2020-07-14T04:48:00Z","07/14 00:48",2,4,,"2020-07-14T04:48:00Z",11335,,,36,,,,10697,,,,,,,,,,,"69",3,0,10702,3,10702,,0,0,"857a2bcbf77414871e2b279ee46c0173cd4e5d4e",0,0,0,0,0,""
20200714,"MP",33,,10666,,"posNeg",10699,,4,,,,,19,"7/12/2020 13:16","2020-07-12T13:16:00Z","07/12 09:16",2,4,,"2020-07-12T13:16:00Z",11335,,,33,,,,10697,,,,,,,,,,,"69",0,0,10699,0,10699,,0,0,"093472fc8f0ed11aa2b0f66b951ce4527d5ea418",0,0,0,0,0,""
20200713,"MP",33,,10666,,"posNeg",10699,,4,,,,,19,"7/12/2020 13:16","2020-07-12T13:16:00Z","07/12 09:16",2,4,,"2020-07-12T13:16:00Z",11335,,,33,,,,10697,,,,,,,,,,,"69",0,0,10699,0,10699,,0,0,"7822423c1f76f1db43cd168abd04da25b46d3390",0,0,0,0,0,""
20200712,"MP",33,,10666,,"posNeg",10699,,4,,,,,19,"7/11/2020 07:01","2020-07-11T07:01:00Z","07/11 03:01",2,4,,"2020-07-11T07:01:00Z",11335,,,33,,,,10697,,,,,,,,,,,"69",2,0,10699,2,10699,,0,0,"deed8ad4a983dbe91d58d58bafd0101bff33ed33",0,0,0,0,0,""
20200711,"MP",31,,10666,,"posNeg",10697,,4,,,,,19,"7/9/2020 11:36","2020-07-09T11:36:00Z","07/09 07:36",2,4,,"2020-07-09T11:36:00Z",11335,,,31,,,,10697,,,,,,,,,,,"69",0,0,10697,0,10697,,0,0,"0652cada81cff700998a3e9189dc7936d9f89d45",0,0,0,0,0,""
20200710,"MP",31,,10666,,"posNeg",10697,,4,,,,,19,"7/9/2020 11:36","2020-07-09T11:36:00Z","07/09 07:36",2,4,,"2020-07-09T11:36:00Z",11335,,,31,,,,10697,,,,,,,,,,,"69",0,0,10697,0,10697,,0,0,"24a33415307c60d3e1f97c395bce303b2614184a",0,0,0,0,0,""
20200709,"MP",31,,10666,,"posNeg",10697,,4,,,,,19,"7/8/2020 12:50","2020-07-08T12:50:00Z","07/08 08:50",2,4,,"2020-07-08T12:50:00Z",11335,,,31,,,,10697,,,,,,,,,,,"69",0,-68,10697,-68,10697,,0,4,"b5fbdd9a41c8b97a900c516f3d99452d674d9043",0,0,0,0,0,""
20200708,"MP",31,,10734,,"posNeg",10765,,,,,,,19,"7/8/2020 00:01","2020-07-08T00:01:00Z","07/07 20:01",2,,,"2020-07-08T00:01:00Z",10765,,,31,,,,,,,,,,,,,,,"69",0,2547,10765,2547,10765,,0,0,"f3bba071b0d3d70919cdac725cb38fb0aa05c190",0,0,0,0,0,""
20200707,"MP",31,,8187,,"posNeg",8218,,,,,,,19,"7/5/2020 02:01","2020-07-05T02:01:00Z","07/04 22:01",2,,,"2020-07-05T02:01:00Z",8217,,,31,,,,,,,,,,,,,,,"69",0,0,8218,0,8218,,0,0,"237ff6a96a10c74d4e060b80405e810a1f527943",0,0,0,0,0,""
20200706,"MP",31,,8187,,"posNeg",8218,,,,,,,19,"7/4/2020 14:01","2020-07-04T14:01:00Z","07/04 10:01",2,,,"2020-07-04T14:01:00Z",8217,,,31,,,,,,,,,,,,,,,"69",0,0,8218,0,8218,,0,0,"c28a0aa70e0c6ea790d94f607df1194c47ace1cc",0,0,0,0,0,""
20200705,"MP",31,,8187,,"posNeg",8218,,,,,,,19,"7/4/2020 14:01","2020-07-04T14:01:00Z","07/04 10:01",2,,,"2020-07-04T14:01:00Z",8217,,,31,,,,,,,,,,,,,,,"69",0,0,8218,0,8218,,0,0,"0c4eeb680615e612473d32690271bdfced9bae23",0,0,0,0,0,""
20200704,"MP",31,,8187,,"posNeg",8218,,,,,,,19,"7/2/2020 18:23","2020-07-02T18:23:00Z","07/02 14:23",2,,,"2020-07-02T18:23:00Z",8217,,,31,,,,,,,,,,,,,,,"69",0,0,8218,0,8218,,0,0,"86436e5f5b8ca81e8e5568555ffcb85bb0eb51ba",0,0,0,0,0,""
20200703,"MP",31,,8187,,"posNeg",8218,,,,,,,19,"7/2/2020 18:23","2020-07-02T18:23:00Z","07/02 14:23",2,,,"2020-07-02T18:23:00Z",8217,,,31,,,,,,,,,,,,,,,"69",1,0,8218,1,8218,,0,0,"cabb16d86aceb7aef82efa8606322b2bcd532117",0,0,0,0,0,""
20200702,"MP",30,,8187,,"posNeg",8217,,,,,,,19,"6/26/2020 00:22","2020-06-26T00:22:00Z","06/25 20:22",2,,,"2020-06-26T00:22:00Z",8217,,,30,,,,,,,,,,,,,,,"69",0,0,8217,0,8217,,0,0,"c8f0ee47ae38668356704371114d30a2c32557b2",0,0,0,0,0,""
20200701,"MP",30,,8187,,"posNeg",8217,,,,,,,19,"6/26/2020 00:22","2020-06-26T00:22:00Z","06/25 20:22",2,,,"2020-06-26T00:22:00Z",8217,,,30,,,,,,,,,,,,,,,"69",0,0,8217,0,8217,,0,0,"e018d960325c70b0320d490ed5f18454766d3305",0,0,0,0,0,""
20200630,"MP",30,,8187,,"posNeg",8217,,,,,,,19,"6/26/2020 00:22","2020-06-26T00:22:00Z","06/25 20:22",2,,,"2020-06-26T00:22:00Z",8217,,,30,,,,,,,,,,,,,,,"69",0,0,8217,0,8217,,0,0,"99b0e04a40f150497126fbc499e8fdf2dd1087fa",0,0,0,0,0,""
20200629,"MP",30,,8187,,"posNeg",8217,,,,,,,19,"6/26/2020 00:22","2020-06-26T00:22:00Z","06/25 20:22",2,,,"2020-06-26T00:22:00Z",8217,,,30,,,,,,,,,,,,,,,"69",0,0,8217,0,8217,,0,0,"40d459f9c6f6a7996bb3a6f170a8adb5d1316813",0,0,0,0,0,""
20200628,"MP",30,,8187,,"posNeg",8217,,,,,,,19,"6/26/2020 00:22","2020-06-26T00:22:00Z","06/25 20:22",2,,,"2020-06-26T00:22:00Z",8217,,,30,,,,,,,,,,,,,,,"69",0,0,8217,0,8217,,0,0,"aa1853f96b4812e2a98a03c9db8987a50075e2a4",0,0,0,0,0,""
20200627,"MP",30,,8187,,"posNeg",8217,,,,,,,19,"6/26/2020 00:22","2020-06-26T00:22:00Z","06/25 20:22",2,,,"2020-06-26T00:22:00Z",8217,,,30,,,,,,,,,,,,,,,"69",0,0,8217,0,8217,,0,0,"5ebcfab7a548ae0842e13dc99036b135de9beae1",0,0,0,0,0,""
20200626,"MP",30,,8187,,"posNeg",8217,,,,,,,19,"6/26/2020 00:22","2020-06-26T00:22:00Z","06/25 20:22",2,,,"2020-06-26T00:22:00Z",8217,,,30,,,,,,,,,,,,,,,"69",0,0,8217,0,8217,,0,0,"5c9c04de893be8e7da5031db299d7a42c41a13b8",0,0,0,0,0,""
20200625,"MP",30,,8187,,"posNeg",8217,,,,,,,19,"6/25/2020 03:22","2020-06-25T03:22:00Z","06/24 23:22",2,,,"2020-06-25T03:22:00Z",8217,,,30,,,,,,,,,,,,,,,"69",0,0,8217,0,8217,,0,0,"6d30bbc03dbfd30a63770032f2810e25557ec658",0,0,0,0,0,""
20200624,"MP",30,,8187,,"posNeg",8217,,,,,,,19,"6/23/2020 23:16","2020-06-23T23:16:00Z","06/23 19:16",2,,,"2020-06-23T23:16:00Z",8217,,,30,,,,,,,,,,,,,,,"69",0,0,8217,0,8217,,0,0,"c88ba1d814ebd0290d16061b951b3acdb102f3bf",0,0,0,0,0,""
20200623,"MP",30,,8187,,"posNeg",8217,,,,,,,19,"6/22/2020 21:40","2020-06-22T21:40:00Z","06/22 17:40",2,,,"2020-06-22T21:40:00Z",8217,,,30,,,,,,,,,,,,,,,"69",0,48,8217,48,8217,,0,0,"546faf72ca43d35aebc68ee572a4310a085172e2",0,0,0,0,0,""
20200622,"MP",30,,8139,,"posNeg",8169,,,,,,,19,"6/21/2020 19:46","2020-06-21T19:46:00Z","06/21 15:46",2,,,"2020-06-21T19:46:00Z",8169,,,30,,,,,,,,,,,,,,,"69",0,0,8169,0,8169,,0,0,"00c99bc2dedd72a815bd29e6c7a4f1fc08251e4c",0,0,0,0,0,""
20200621,"MP",30,,8139,,"posNeg",8169,,,,,,,19,"6/18/2020 21:18","2020-06-18T21:18:00Z","06/18 17:18",2,,,"2020-06-18T21:18:00Z",8169,,,30,,,,,,,,,,,,,,,"69",0,0,8169,0,8169,,0,0,"4e26ddc564e9a578ed81a23b90ba853c9376f296",0,0,0,0,0,""
20200620,"MP",30,,8139,,"posNeg",8169,,,,,,,19,"6/18/2020 21:18","2020-06-18T21:18:00Z","06/18 17:18",2,,,"2020-06-18T21:18:00Z",8169,,,30,,,,,,,,,,,,,,,"69",0,0,8169,0,8169,,0,0,"3e1227b49774cdb5ef0ceef67fe1c4caba22babb",0,0,0,0,0,""
20200619,"MP",30,,8139,,"posNeg",8169,,,,,,,19,"6/18/2020 21:18","2020-06-18T21:18:00Z","06/18 17:18",2,,,"2020-06-18T21:18:00Z",8169,,,30,,,,,,,,,,,,,,,"69",0,0,8169,0,8169,,0,0,"de3cb9b85dd4c574e53c2854f0644016593dfa1c",0,0,0,0,0,""
20200618,"MP",30,,8139,,"posNeg",8169,,,,,,,19,"6/16/2020 18:09","2020-06-16T18:09:00Z","06/16 14:09",2,,,"2020-06-16T18:09:00Z",8169,,,30,,,,,,,,,,,,,,,"69",0,0,8169,0,8169,,0,0,"9787f9e9a6ff066e156d6a1355e93d3fa7c3845a",0,0,0,0,0,""
20200617,"MP",30,,8139,,"posNeg",8169,,,,,,,19,"6/16/2020 18:09","2020-06-16T18:09:00Z","06/16 14:09",2,,,"2020-06-16T18:09:00Z",8169,,,30,,,,,,,,,,,,,,,"69",0,0,8169,0,8169,,0,0,"97df4a680607f445367b35895aab5d6971eb533e",0,0,0,0,0,""
20200616,"MP",30,,8139,,"posNeg",8169,,,,,,,19,"6/15/2020 18:09","2020-06-15T18:09:00Z","06/15 14:09",2,,,"2020-06-15T18:09:00Z",8169,,,30,,,,,,,,,,,,,,,"69",0,0,8169,0,8169,,0,0,"27f9f488c83deeb4517705915aa7e119bda7c4e9",0,0,0,0,0,""
20200615,"MP",30,,8139,,"posNeg",8169,,,,,,,19,"6/14/2020 18:09","2020-06-14T18:09:00Z","06/14 14:09",2,,,"2020-06-14T18:09:00Z",8169,,,30,,,,,,,,,,,,,,,"69",0,0,8169,0,8169,,0,0,"488c8db6101ead4720eb50656cc46ee015952c18",0,0,0,0,0,""
20200614,"MP",30,,8139,,"posNeg",8169,,,,,,,19,"6/14/2020 01:43","2020-06-14T01:43:00Z","06/13 21:43",2,,,"2020-06-14T01:43:00Z",8169,,,30,,,,,,,,,,,,,,,"69",0,233,8169,233,8169,,0,0,"9d44be23c9eb2d075fe1c43fca404e0944b950a8",0,0,0,0,0,""
20200613,"MP",30,,7906,,"posNeg",7936,,,,,,,19,"6/12/2020 18:18","2020-06-12T18:18:00Z","06/12 14:18",2,,,"2020-06-12T18:18:00Z",7936,,,30,,,,,,,,,,,,,,,"69",0,174,7936,174,7936,,0,0,"dcf7a60404483865e28445e5be2372adcf9fce38",0,0,0,0,0,""
20200612,"MP",30,,7732,,"posNeg",7762,,,,,,,19,"6/12/2020 01:20","2020-06-12T01:20:00Z","06/11 21:20",2,,,"2020-06-12T01:20:00Z",7762,,,30,,,,,,,,,,,,,,,"69",0,181,7762,181,7762,,0,0,"ebe8603a1fa962477f1c9949d23e5e49240915d5",0,0,0,0,0,""
20200611,"MP",30,,7551,,"posNeg",7581,,,,,,,19,"6/10/2020 18:00","2020-06-10T18:00:00Z","06/10 14:00",2,,,"2020-06-10T18:00:00Z",7581,,,30,,,,,,,,,,,,,,,"69",0,58,7581,58,7581,,0,0,"ceae928b9d000acd5029a09a528e6f8c85864b58",0,0,0,0,0,""
20200610,"MP",30,,7493,,"posNeg",7523,,,,,,,19,"6/9/2020 18:13","2020-06-09T18:13:00Z","06/09 14:13",2,,,"2020-06-09T18:13:00Z",7523,,,30,,,,,,,,,,,,,,,"69",0,0,7523,0,7523,,0,0,"31d932b070db5854880417c3c2f6bfacd586ce00",0,0,0,0,0,""
20200609,"MP",30,,7493,,"posNeg",7523,,,,,,,19,"6/9/2020 00:00","2020-06-09T00:00:00Z","06/08 20:00",2,,,"2020-06-09T00:00:00Z",7523,,,30,,,,,,,,,,,,,,,"69",2,279,7523,281,7523,,0,0,"94b43ddfdf1ee90696607bb0783d34166fac8734",0,0,0,0,0,""
20200608,"MP",28,,7214,,"posNeg",7242,,,,,,,19,"6/8/2020 00:00","2020-06-08T00:00:00Z","06/07 20:00",2,,,"2020-06-08T00:00:00Z",7241,,,28,,,,,,,,,,,,,,,"69",1,0,7242,1,7242,,0,0,"070fb90ca84c9049f74f51a70e83b93013f524c3",0,0,0,0,0,""
20200607,"MP",27,,7214,,"posNeg",7241,,,,,,,19,"6/7/2020 00:00","2020-06-07T00:00:00Z","06/06 20:00",2,,,"2020-06-07T00:00:00Z",7241,,,27,,,,,,,,,,,,,,,"69",1,545,7241,546,7241,,0,0,"6569689ba7f848ffbac20064e05980ebaf5363a5",0,0,0,0,0,""
20200606,"MP",26,,6669,,"posNeg",6695,,,,,,,16,"6/4/2020 19:04","2020-06-04T19:04:00Z","06/04 15:04",2,,,"2020-06-04T19:04:00Z",6695,,,26,,,,,,,,,,,,,,,"69",0,0,6695,0,6695,,0,0,"9cb1f35cc3f7b7fca2e449fd6d990bb9ba01ab24",0,0,0,0,0,""
20200605,"MP",26,,6669,,"posNeg",6695,,,,,,,16,"6/4/2020 19:04","2020-06-04T19:04:00Z","06/04 15:04",2,,,"2020-06-04T19:04:00Z",6695,,,26,,,,,,,,,,,,,,,"69",0,0,6695,0,6695,,0,0,"96b646d641c63827f4d4b53053e45709115ad45d",0,0,0,0,0,""
20200604,"MP",26,,6669,,"posNeg",6695,,,,,,,16,"6/4/2020 02:45","2020-06-04T02:45:00Z","06/03 22:45",2,,,"2020-06-04T02:45:00Z",6695,,,26,,,,,,,,,,,,,,,"69",3,135,6695,138,6695,,0,0,"33aadd4175459566308d1000aa4eaa8790a4e514",0,0,0,0,0,""
20200603,"MP",23,,6534,,"posNeg",6557,,,,,,,16,"6/3/2020 00:00","2020-06-03T00:00:00Z","06/02 20:00",2,,,"2020-06-03T00:00:00Z",6557,,,23,,,,,,,,,,,,,,,"69",0,0,6557,0,6557,,0,0,"c527c5dc16eb95162180fbed7e37a0844f96c357",0,0,0,0,0,""
20200602,"MP",23,,6534,,"posNeg",6557,,,,,,,16,"6/2/2020 00:00","2020-06-02T00:00:00Z","06/01 20:00",2,,,"2020-06-02T00:00:00Z",6557,,,23,,,,,,,,,,,,,,,"69",1,222,6557,223,6557,,0,0,"f881e0d811c370cee567cd37db1a158e1d21f571",0,0,0,0,0,""
20200601,"MP",22,,6312,,"posNeg",6334,,,,,,,16,"6/1/2020 00:00","2020-06-01T00:00:00Z","05/31 20:00",2,,,"2020-06-01T00:00:00Z",6334,,,22,,,,,,,,,,,,,,,"69",0,161,6334,161,6334,,0,0,"f0e4c6934d91928a81935de46eaffa2d9e559e33",0,0,0,0,0,""
20200531,"MP",22,,6151,,"posNeg",6173,,,,,,,15,"5/30/2020 00:00","2020-05-30T00:00:00Z","05/29 20:00",2,,,"2020-05-30T00:00:00Z",6173,,,22,,,,,,,,,,,,,,,"69",0,165,6173,165,6173,,0,0,"706a1f2389cdc5bbe6fd8de10339203440b54530",0,0,0,0,0,""
20200530,"MP",22,,5986,,"posNeg",6008,,,,,,,15,"5/29/2020 20:27","2020-05-29T20:27:00Z","05/29 16:27",2,,,"2020-05-29T20:27:00Z",6008,,,22,,,,,,,,,,,,,,,"69",0,324,6008,324,6008,,0,0,"ef45181c63d63f5cd63c71f2a588b1a08fec4f1d",0,0,0,0,0,""
20200529,"MP",22,,5662,,"posNeg",5684,,,,,,,13,"5/29/2020 00:00","2020-05-29T00:00:00Z","05/28 20:00",2,,,"2020-05-29T00:00:00Z",5684,,,22,,,,,,,,,,,,,,,"69",0,261,5684,261,5684,,0,0,"3e352ce8f54739a47b5ef77cdc3ba30cbbe52b24",0,0,0,0,0,""
20200528,"MP",22,,5401,,"posNeg",5423,,,,,,,13,"5/28/2020 00:00","2020-05-28T00:00:00Z","05/27 20:00",2,,,"2020-05-28T00:00:00Z",5423,,,22,,,,,,,,,,,,,,,"69",0,223,5423,223,5423,,0,0,"9c935161e01543dd94ef9ad6b7d5585d1ff7b821",0,0,0,0,0,""
20200527,"MP",22,,5178,,"posNeg",5200,,,,,,,13,"5/27/2020 00:00","2020-05-27T00:00:00Z","05/26 20:00",2,,,"2020-05-27T00:00:00Z",5200,,,22,,,,,,,,,,,,,,,"69",0,260,5200,260,5200,,0,0,"8e6a7dd9331c9a7537152736468d1751e51cc208",0,0,0,0,0,""
20200526,"MP",22,,4918,,"posNeg",4940,,,,,,,13,"5/26/2020 00:00","2020-05-26T00:00:00Z","05/25 20:00",2,,,"2020-05-26T00:00:00Z",4940,,,22,,,,,,,,,,,,,,,"69",0,183,4940,183,4940,,0,0,"7bcf884b4c59929773d55237e3b209b5e4653a35",0,0,0,0,0,""
20200525,"MP",22,,4735,,"posNeg",4757,,,,,,,13,"5/24/2020 00:07","2020-05-24T00:07:00Z","05/23 20:07",2,,,"2020-05-24T00:07:00Z",4757,,,22,,,,,,,,,,,,,,,"69",0,0,4757,0,4757,,0,0,"399603df068357ea73657b485548888d4c604bca",0,0,0,0,0,""
20200524,"MP",22,,4735,,"posNeg",4757,,,,,,,13,"5/24/2020 00:00","2020-05-24T00:00:00Z","05/23 20:00",2,,,"2020-05-24T00:00:00Z",4757,,,22,,,,,,,,,,,,,,,"69",0,439,4757,439,4757,,0,0,"cb55ba1fb8d1fe35ab81af2d485321992f59253d",0,0,0,0,0,""
20200523,"MP",22,,4296,,"posNeg",4318,,,,,,,13,"5/22/2020 00:00","2020-05-22T00:00:00Z","05/21 20:00",2,,,"2020-05-22T00:00:00Z",4318,,,22,,,,,,,,,,,,,,,"69",0,0,4318,0,4318,,0,0,"6d5ae63e1ce954a094ecaf409e96d6ab0b732fa5",0,0,0,0,0,""
20200522,"MP",22,,4296,,"posNeg",4318,,,,,,,13,"5/22/2020 00:00","2020-05-22T00:00:00Z","05/21 20:00",2,,,"2020-05-22T00:00:00Z",4318,,,22,,,,,,,,,,,,,,,"69",0,229,4318,229,4318,,0,0,"9a9b91462c440d98974778f125b22268c4cb19bb",0,0,0,0,0,""
20200521,"MP",22,,4067,,"posNeg",4089,,,,,,,13,"5/21/2020 00:00","2020-05-21T00:00:00Z","05/20 20:00",2,,,"2020-05-21T00:00:00Z",4089,,,22,,,,,,,,,,,,,,,"69",1,271,4089,272,4089,,0,0,"31fa664f18d15af9c2c8ceea6968eefc95536443",0,0,0,0,0,""
20200520,"MP",21,,3796,,"posNeg",3817,,,,,,,13,"5/20/2020 00:00","2020-05-20T00:00:00Z","05/19 20:00",2,,,"2020-05-20T00:00:00Z",3817,,,21,,,,,,,,,,,,,,,"69",0,0,3817,0,3817,,0,0,"b4bc19f74321bde05f80ecc885d89e22ca6bf22f",0,0,0,0,0,""
20200519,"MP",21,,3796,,"posNeg",3817,,,,,,,13,"5/19/2020 00:00","2020-05-19T00:00:00Z","05/18 20:00",2,,,"2020-05-19T00:00:00Z",3817,,,21,,,,,,,,,,,,,,,"69",0,397,3817,397,3817,,0,0,"acc2ce945bcfaf57230acbd108f8228b78b5ab77",0,0,0,0,0,""
20200518,"MP",21,,3399,,"posNeg",3420,,,,,,,12,"5/18/2020 00:00","2020-05-18T00:00:00Z","05/17 20:00",2,,,"2020-05-18T00:00:00Z",3420,,,21,,,,,,,,,,,,,,,"69",0,81,3420,81,3420,,0,0,"14c44f9830eb41ad07618db133237763b60ebe7c",0,0,0,0,0,""
20200517,"MP",21,,3318,,"posNeg",3339,,,,,,,12,"5/16/2020 00:00","2020-05-16T00:00:00Z","05/15 20:00",2,,,"2020-05-16T00:00:00Z",3339,,,21,,,,,,,,,,,,,,,"69",0,0,3339,0,3339,,0,0,"9fd61cdc8b9571bcd128e08e8fc4e63319a5976d",0,0,0,0,0,""
20200516,"MP",21,,3318,,"posNeg",3339,,,,,,,12,"5/16/2020 00:00","2020-05-16T00:00:00Z","05/15 20:00",2,,,"2020-05-16T00:00:00Z",3339,,,21,,,,,,,,,,,,,,,"69",2,12,3339,14,3339,,0,0,"abe0042487e0af2ac4f96879de2bccda946f31bf",0,0,0,0,0,""
20200515,"MP",19,,3306,,"posNeg",3325,,,,,,,12,"5/15/2020 00:00","2020-05-15T00:00:00Z","05/14 20:00",2,,,"2020-05-15T00:00:00Z",3325,,,19,,,,,,,,,,,,,,,"69",0,0,3325,0,3325,,0,0,"eb674860e7b55e665fc08feacdda2e3863f04a92",0,0,0,0,0,""
20200514,"MP",19,,3306,,"posNeg",3325,,,,,,,12,"5/14/2020 00:00","2020-05-14T00:00:00Z","05/13 20:00",2,,,"2020-05-14T00:00:00Z",3325,,,19,,,,,,,,,,,,,,,"69",0,285,3325,285,3325,,0,0,"e9556e76b844862d0754b6824d2f4978283086de",0,0,0,0,0,""
20200513,"MP",19,,3021,,"posNeg",3040,,,,,,,12,"5/13/2020 00:00","2020-05-13T00:00:00Z","05/12 20:00",2,,,"2020-05-13T00:00:00Z",3040,,,19,,,,,,,,,,,,,,,"69",0,167,3040,167,3040,,0,0,"670c3b7fe309f16bd13fd03d65838f27161405cb",0,0,0,0,0,""
20200512,"MP",19,,2854,,"posNeg",2873,,,,,,,12,"5/12/2020 00:00","2020-05-12T00:00:00Z","05/11 20:00",2,,,"2020-05-12T00:00:00Z",2873,,,19,,,,,,,,,,,,,,,"69",0,178,2873,178,2873,,0,0,"8433897b37753c19c5c42afe7fc4025cf9beda85",0,0,0,0,0,""
20200511,"MP",19,,2676,,"posNeg",2695,,,,,,,12,"5/11/2020 00:00","2020-05-11T00:00:00Z","05/10 20:00",2,,,"2020-05-11T00:00:00Z",2695,,,19,,,,,,,,,,,,,,,"69",3,355,2695,358,2695,,0,0,"251a1097223061be274abb19dbaaaeda1e03807b",0,0,0,0,0,""
20200510,"MP",16,,2321,,"posNeg",2337,,,,,,,12,"5/9/2020 00:00","2020-05-09T00:00:00Z","05/08 20:00",2,,,"2020-05-09T00:00:00Z",2336,,,16,,,,,,,,,,,,,,,"69",0,0,2337,0,2337,,0,0,"ca8759ebd84d3eb6243929e6a25b17360ba3ff20",0,0,0,0,0,""
20200509,"MP",16,,2321,,"posNeg",2337,,,,,,,12,"5/9/2020 00:00","2020-05-09T00:00:00Z","05/08 20:00",2,,,"2020-05-09T00:00:00Z",2336,,,16,,,,,,,,,,,,,,,"69",1,0,2337,1,2337,,0,0,"80c57a8e82db6738a68cb9cc5711f37a2b958f7a",0,0,0,0,0,""
20200508,"MP",15,,2321,,"posNeg",2336,,,,,,,12,"5/8/2020 00:00","2020-05-08T00:00:00Z","05/07 20:00",2,,,"2020-05-08T00:00:00Z",2336,,,15,,,,,,,,,,,,,,,"69",0,538,2336,538,2336,,0,0,"2dbcb3912b9b74bdabfd6f6c772798b0ec0b4f8a",0,0,0,0,0,""
20200507,"MP",15,,1783,,"posNeg",1798,,,,,,,12,"5/6/2020 00:00","2020-05-06T00:00:00Z","05/05 20:00",2,,,"2020-05-06T00:00:00Z",1797,,,15,,,,,,,,,,,,,,,"69",0,0,1798,0,1798,,0,0,"3b0fd2aecafd1679b71c4a1734be6cdcbd81b502",0,0,0,0,0,""
20200506,"MP",15,,1783,,"posNeg",1798,,,,,,,12,"5/6/2020 00:00","2020-05-06T00:00:00Z","05/05 20:00",2,,,"2020-05-06T00:00:00Z",1797,,,15,,,,,,,,,,,,,,,"69",1,0,1798,1,1798,,0,0,"32f36aeb571bfeb0e28ee05b05c961abb414ebf6",0,0,0,0,0,""
20200505,"MP",14,,1783,,"posNeg",1797,,,,,,,12,"5/5/2020 00:00","2020-05-05T00:00:00Z","05/04 20:00",2,,,"2020-05-05T00:00:00Z",,,,14,,,,,,,,,,,,,,,"69",0,462,1797,462,1797,,0,0,"e90fe6ad4df528690d64be972509885de1d0b3c7",0,0,0,0,0,""
20200504,"MP",14,,1321,,"posNeg",1335,,,,,,,12,"5/4/2020 00:00","2020-05-04T00:00:00Z","05/03 20:00",2,,,"2020-05-04T00:00:00Z",,,,14,,,,,,,,,,,,,,,"69",0,0,1335,0,1335,,0,0,"7245ad06b676f0af83cb7512fd85756a1f6acd7f",0,0,0,0,0,""
20200503,"MP",14,,1321,,"posNeg",1335,,,,,,,12,"5/3/2020 00:00","2020-05-03T00:00:00Z","05/02 20:00",2,,,"2020-05-03T00:00:00Z",,,,14,,,,,,,,,,,,,,,"69",0,387,1335,387,1335,,0,0,"c09ec16390baf24964db781f3c5e64fd00e5f1b2",0,0,0,0,0,""
20200502,"MP",14,,934,,"posNeg",948,,,,,,,12,"5/2/2020 06:37","2020-05-02T06:37:00Z","05/02 02:37",2,,,"2020-05-02T06:37:00Z",,,,14,,,,,,,,,,,,,,,"69",0,185,948,185,948,,0,0,"a48c3f6ee4f95e5c3f9bc1fd56b0271e4e912590",0,0,0,0,0,""
20200501,"MP",14,,749,,"posNeg",763,,,,,,,12,"5/1/2020 06:27","2020-05-01T06:27:00Z","05/01 02:27",2,,,"2020-05-01T06:27:00Z",,,,14,,,,,,,,,,,,,,,"69",0,164,763,164,763,,0,0,"29f0043a7bb873352f3190f0c06bcedac70f1837",0,0,0,0,0,""
20200430,"MP",14,,585,,"posNeg",599,,,,,,,12,"4/30/2020 07:00","2020-04-30T07:00:00Z","04/30 03:00",2,,,"2020-04-30T07:00:00Z",,,,14,,,,,,,,,,,,,,,"69",0,375,599,375,599,,0,0,"e618630b200ab619296e399ec826463dd4f94cbb",0,0,0,0,0,""
20200429,"MP",14,,210,,"posNeg",224,,,,,,,12,"4/29/2020 02:30","2020-04-29T02:30:00Z","04/28 22:30",2,,,"2020-04-29T02:30:00Z",,,,14,,,,,,,,,,,,,,,"69",0,159,224,159,224,,0,0,"ddea88869c7c87eb7a7b4ebcf252fa5fe1bd63e1",0,0,0,0,0,""
20200428,"MP",14,,51,,"posNeg",65,,,,,,,12,"4/28/2020 00:00","2020-04-28T00:00:00Z","04/27 20:00",2,,,"2020-04-28T00:00:00Z",,,,14,,,,,,,,,,,,,,,"69",0,0,65,0,65,,0,0,"d2f7ec06f696a86abb25e03f2efe2abf86de274c",0,0,0,0,0,""
20200427,"MP",14,,51,,"posNeg",65,,,,,,,11,"4/27/2020 00:00","2020-04-27T00:00:00Z","04/26 20:00",2,,,"2020-04-27T00:00:00Z",,,,14,,,,,,,,,,,,,,,"69",0,0,65,0,65,,0,0,"26257a4d95d0a0607944f41ac4d7c87faf5dc61b",0,0,0,0,0,""
20200426,"MP",14,,51,,"posNeg",65,,,,,,,11,"4/26/2020 00:00","2020-04-26T00:00:00Z","04/25 20:00",2,,,"2020-04-26T00:00:00Z",,,,14,,,,,,,,,,,,,,,"69",0,0,65,0,65,,0,0,"85c807c89b3d52ddbfc82e4bc3ac0b4cad2d0736",0,0,0,0,0,""
20200425,"MP",14,,51,,"posNeg",65,,,,,,,11,"4/25/2020 00:00","2020-04-25T00:00:00Z","04/24 20:00",2,,,"2020-04-25T00:00:00Z",,,,14,,,,,,,,,,,,,,,"69",0,0,65,0,65,,0,0,"e084dc84b3ca5cf9b14b4f6aa80eae2973d154de",0,0,0,0,0,""
20200424,"MP",14,,51,,"posNeg",65,,,,,,,11,"4/24/2020 00:00","2020-04-24T00:00:00Z","04/23 20:00",2,,,"2020-04-24T00:00:00Z",,,,14,,,,,,,,,,,,,,,"69",0,0,65,0,65,,0,0,"61e5c9180af4732e3058fdd33cfb8fe494cfd730",0,0,0,0,0,""
20200423,"MP",14,,51,,"posNeg",65,,,,,,,11,"4/23/2020 22:35","2020-04-23T22:35:00Z","04/23 18:35",2,,,"2020-04-23T22:35:00Z",,,,14,,,,,,,,,,,,,,,"69",0,0,65,0,65,,0,0,"2ef3f8ebf3617c41cf779441b78dc347cc1ba25c",0,0,0,0,0,""
20200422,"MP",14,,51,,"posNeg",65,,,,,,,11,"4/23/2020 00:00","2020-04-23T00:00:00Z","04/22 20:00",2,,,"2020-04-23T00:00:00Z",,,,14,,,,,,,,,,,,,,,"69",0,0,65,0,65,,0,0,"d0c9f01c739467691429cf06937c93efa8b6e28f",0,0,0,0,0,""
20200421,"MP",14,,51,,"posNeg",65,,,,,,,11,"4/21/2020 19:25","2020-04-21T19:25:00Z","04/21 15:25",2,,,"2020-04-21T19:25:00Z",,,,14,,,,,,,,,,,,,,,"69",0,0,65,0,65,,0,0,"c4d41f7ed2239f9f906ab9b50dac5f6735b98113",0,0,0,0,0,""
20200420,"MP",14,,51,,"posNeg",65,,,,,,,11,"4/20/2020 00:00","2020-04-20T00:00:00Z","04/19 20:00",2,,,"2020-04-20T00:00:00Z",,,,14,,,,,,,,,,,,,,,"69",0,9,65,9,65,,0,0,"e557f37f6e729e01a9a27381fb54accdd442323a",0,0,0,0,0,""
20200419,"MP",14,,42,4,"posNeg",56,,,,,,,9,"4/19/2020 00:00","2020-04-19T00:00:00Z","04/18 20:00",2,,,"2020-04-19T00:00:00Z",,,,14,,,,,,,,,,,,,,,"69",0,0,60,0,56,,0,0,"5e745a74d8b8be0bbb3b64876d23f20ed97fe8d5",0,0,0,0,0,""
20200418,"MP",14,,42,4,"posNeg",56,,,,,,,9,"4/17/2020 19:15","2020-04-17T19:15:00Z","04/17 15:15",2,,,"2020-04-17T19:15:00Z",,,,14,,,,,,,,,,,,,,,"69",1,0,60,1,56,,0,0,"1d5b84905302dfa8343b00f4666d42758c1ea253",0,0,0,0,0,""
20200417,"MP",13,,42,4,"posNeg",55,,,,,,,,"4/17/2020 19:15","2020-04-17T19:15:00Z","04/17 15:15",2,,,"2020-04-17T19:15:00Z",,,,13,,,,,,,,,,,,,,,"69",0,15,59,15,55,,0,0,"643471b9544ea98f70fef66e50dffd1f05c554e3",0,0,0,0,0,""
20200416,"MP",13,,27,7,"posNeg",40,,,,,,,,"4/15/2020 00:00","2020-04-15T00:00:00Z","04/14 20:00",2,,,"2020-04-15T00:00:00Z",,,,13,,,,,,,,,,,,,,,"69",0,0,47,0,40,,0,0,"2c7ddb07de1263b77594b8bf3a15f41bf5c880c5",0,0,0,0,0,""
20200415,"MP",13,,27,7,"posNeg",40,,,,,,,,"4/14/2020 00:00","2020-04-14T00:00:00Z","04/13 20:00",2,,,"2020-04-14T00:00:00Z",,,,13,,,,,,,,,,,,,,,"69",0,0,47,0,40,,0,0,"b17bd41430c08b00731612fe5f02dfd877f2a69a",0,0,0,0,0,""
20200414,"MP",13,,27,7,"posNeg",40,,,,,,,,"4/14/2020 00:00","2020-04-14T00:00:00Z","04/13 20:00",2,,,"2020-04-14T00:00:00Z",,,,13,,,,,,,,,,,,,,,"69",2,0,47,2,40,,0,0,"ed5a4b7344416ba7ca83535499100bc3ed4281e8",0,0,0,0,0,""
20200413,"MP",11,,27,9,"posNeg",38,,,,,,,,"4/12/2020 00:00","2020-04-12T00:00:00Z","04/11 20:00",2,,,"2020-04-12T00:00:00Z",,,,11,,,,,,,,,,,,,,,"69",0,0,47,0,38,,0,0,"31d497a40495752107164ec00cbd3754c7ceab6e",0,0,0,0,0,""
20200412,"MP",11,,27,9,"posNeg",38,,,,,,,,"4/11/2020 00:00","2020-04-11T00:00:00Z","04/10 20:00",2,,,"2020-04-11T00:00:00Z",,,,11,,,,,,,,,,,,,,,"69",0,0,47,0,38,,0,0,"56a7c2a71b89e59d473120d18e3bd5fd63ab7f9e",0,0,0,0,0,""
20200411,"MP",11,,27,9,"posNeg",38,,,,,,,,"4/11/2020 00:00","2020-04-11T00:00:00Z","04/10 20:00",2,,,"2020-04-11T00:00:00Z",,,,11,,,,,,,,,,,,,,,"69",0,0,47,0,38,,0,0,"9ab28999e187280a05bf5ca6fc1efec58bb91352",0,0,0,0,0,""
20200410,"MP",11,,27,9,"posNeg",38,,,,,,,,"4/10/2020 00:00","2020-04-10T00:00:00Z","04/09 20:00",2,,,"2020-04-10T00:00:00Z",,,,11,,,,,,,,,,,,,,,"69",0,0,47,0,38,,0,0,"afb4420d4047a9f567d2642c29716fa0a1c5746d",0,0,0,0,0,""
20200409,"MP",11,,27,9,"posNeg",38,,,,,,,,"4/8/2020 00:00","2020-04-08T00:00:00Z","04/07 20:00",2,,,"2020-04-08T00:00:00Z",,,,11,,,,,,,,,,,,,,,"69",0,0,47,0,38,,0,0,"4496cccaff4a7425894e997e9ac2178be3d772fd",0,0,0,0,0,""
20200408,"MP",11,,27,9,"posNeg",38,,,,,,,,"4/8/2020 00:00","2020-04-08T00:00:00Z","04/07 20:00",2,,,"2020-04-08T00:00:00Z",,,,11,,,,,,,,,,,,,,,"69",3,12,47,15,38,,0,0,"f5991599e78810cb296bee6129d1bba6a168aaa1",0,0,0,0,0,""
20200407,"MP",8,,15,,"posNeg",23,,,,,,,,"4/7/2020 05:39","2020-04-07T05:39:00Z","04/07 01:39",2,,,"2020-04-07T05:39:00Z",,,,8,,,,,,,,,,,,,,,"69",0,2,23,2,23,,1,0,"fa080da6d96047c1972bee8885f2286a5346f597",0,0,0,0,0,""
20200406,"MP",8,,13,10,"posNeg",21,,,,,,,,"4/6/2020 02:57","2020-04-06T02:57:00Z","04/05 22:57",1,,,"2020-04-06T02:57:00Z",,,,8,,,,,,,,,,,,,,,"69",0,0,31,0,21,,0,0,"a57fcae570cbc79a0653b8124db09b46a12f1079",0,0,0,0,0,""
20200405,"MP",8,,13,10,"posNeg",21,,,,,,,,"4/4/2020 18:30","2020-04-04T18:30:00Z","04/04 14:30",1,,,"2020-04-04T18:30:00Z",,,,8,,,,,,,,,,,,,,,"69",0,0,31,0,21,,0,0,"1cdce6c5eb6eaadd1633279fe01bef4e0e3cfd5b",0,0,0,0,0,""
20200404,"MP",8,,13,10,"posNeg",21,,,,,,,,"4/3/2020 13:30","2020-04-03T13:30:00Z","04/03 09:30",1,,,"2020-04-03T13:30:00Z",,,,8,,,,,,,,,,,,,,,"69",0,0,31,0,21,,0,0,"f88477ee92ac9111572e06109faab8716c8eaa64",0,0,0,0,0,""
20200403,"MP",8,,13,10,"posNeg",21,,,,,,,,"4/2/2020 18:30","2020-04-02T18:30:00Z","04/02 14:30",1,,,"2020-04-02T18:30:00Z",,,,8,,,,,,,,,,,,,,,"69",0,0,31,0,21,,0,0,"24f257a4c097dd6e5cef7ac5ffd490bfb710b92c",0,0,0,0,0,""
20200402,"MP",8,,13,12,"posNeg",21,,,,,,,,"4/2/2020 03:00","2020-04-02T03:00:00Z","04/01 23:00",1,,,"2020-04-02T03:00:00Z",,,,8,,,,,,,,,,,,,,,"69",2,13,33,15,21,,0,0,"5558f240363348f69e5ba13839abf0566bcf0981",0,0,0,0,0,""
20200401,"MP",6,,,,"posNeg",6,,,,,,,,"3/31/2020 21:50","2020-03-31T21:50:00Z","03/31 17:50",1,,,"2020-03-31T21:50:00Z",,,,6,,,,,,,,,,,,,,,"69",4,0,6,4,6,,0,0,"2d1d99aced4baa25b7c78849dae96d39a09ecf6a",0,0,0,0,0,""
20200331,"MP",2,,,,"posNeg",2,,,,,,,,"3/30/2020 18:30","2020-03-30T18:30:00Z","03/30 14:30",1,,,"2020-03-30T18:30:00Z",,,,2,,,,,,,,,,,,,,,"69",0,0,2,0,2,,1,0,"359d864530dffc778de82d23f7e780aab8de5757",0,0,0,0,0,""
20200330,"MP",2,,,,"posNeg",2,,,,,,,,"3/30/2020 01:30","2020-03-30T01:30:00Z","03/29 21:30",0,,,"2020-03-30T01:30:00Z",,,,2,,,,,,,,,,,,,,,"69",0,0,2,0,2,,0,0,"da0e575b007ba5cef9fc6606f1bff34af1fc1858",0,0,0,0,0,""
20200329,"MP",2,,,,"posNeg",2,,,,,,,,"3/29/2020 01:30","2020-03-29T01:30:00Z","03/28 21:30",0,,,"2020-03-29T01:30:00Z",,,,2,,,,,,,,,,,,,,,"69",0,0,2,0,2,,0,0,"84182bc5002f3f9dda4b323778dc57101a927766",0,0,0,0,0,""
20200328,"MP",2,,,,"posNeg",2,,,,,,,,"3/28/2020 04:30","2020-03-28T04:30:00Z","03/28 00:30",0,,,"2020-03-28T04:30:00Z",,,,2,,,,,,,,,,,,,,,"69",2,0,2,2,2,,0,0,"dde6b791d684be258567996153ea78e014761881",0,0,0,0,0,""
20200327,"MP",0,,,,"posNeg",0,,,,,,,,"3/26/2020 13:30","2020-03-26T13:30:00Z","03/26 09:30",0,,,"2020-03-26T13:30:00Z",,,,0,,,,,,,,,,,,,,,"69",0,0,0,0,0,,0,0,"420747131c1fae4d50a242471684bb2d2e43020d",0,0,0,0,0,""
20200326,"MP",0,,,,"posNeg",0,,,,,,,,"3/26/2020 01:30","2020-03-26T01:30:00Z","03/25 21:30",0,,,"2020-03-26T01:30:00Z",,,,0,,,,,,,,,,,,,,,"69",0,0,0,0,0,,0,0,"6476fc4266d9f68aca882190638d3e98639e4950",0,0,0,0,0,""
20200325,"MP",0,,,,"posNeg",0,,,,,,,,"3/24/2020 18:30","2020-03-24T18:30:00Z","03/24 14:30",0,,,"2020-03-24T18:30:00Z",,,,0,,,,,,,,,,,,,,,"69",0,0,0,0,0,,0,0,"1b46dea6e1abd06e7247af1fbf3b24e479233f8c",0,0,0,0,0,""
20200324,"MP",0,,,,"posNeg",0,,,,,,,,"3/23/2020 01:30","2020-03-23T01:30:00Z","03/22 21:30",0,,,"2020-03-23T01:30:00Z",,,,0,,,,,,,,,,,,,,,"69",0,0,0,0,0,,0,0,"b0a424ac480b6c5c8aa4711ee5d18a85b512d8e3",0,0,0,0,0,""
20200323,"MP",0,,,,"posNeg",0,,,,,,,,"3/23/2020 01:30","2020-03-23T01:30:00Z","03/22 21:30",0,,,"2020-03-23T01:30:00Z",,,,0,,,,,,,,,,,,,,,"69",0,0,0,0,0,,0,0,"945baabe17dab0fedcf56a7a3d201784ba2e2a38",0,0,0,0,0,""
20200322,"MP",0,,,,"posNeg",0,,,,,,,,"3/22/2020 01:30","2020-03-22T01:30:00Z","03/21 21:30",0,,,"2020-03-22T01:30:00Z",,,,0,,,,,,,,,,,,,,,"69",0,0,0,0,0,,0,0,"786a312dc6b845d73ca31f4378899d5347d47990",0,0,0,0,0,""
20200321,"MP",0,,,,"posNeg",0,,,,,,,,"3/21/2020 02:30","2020-03-21T02:30:00Z","03/20 22:30",0,,,"2020-03-21T02:30:00Z",,,,0,,,,,,,,,,,,,,,"69",0,0,0,0,0,,0,0,"513daea70fe1f277fcb97631f67d9e2a0bc04f8b",0,0,0,0,0,""
20200320,"MP",0,,,,"posNeg",0,,,,,,,,"3/20/2020 01:30","2020-03-20T01:30:00Z","03/19 21:30",0,,,"2020-03-20T01:30:00Z",,,,0,,,,,,,,,,,,,,,"69",0,0,0,0,0,,0,0,"8053d85f6057896857c6d5c5cc9c9725d94cb2ca",0,0,0,0,0,""
20200319,"MP",0,,,,"posNeg",0,,,,,,,,"3/19/2020 01:30","2020-03-19T01:30:00Z","03/18 21:30",0,,,"2020-03-19T01:30:00Z",,,,0,,,,,,,,,,,,,,,"69",0,0,0,0,0,,0,0,"1bcea93b63249768998133a0a7a7d1568b33d1a5",0,0,0,0,0,""
20200318,"MP",0,,,,"posNeg",0,,,,,,,,"3/18/2020 03:30","2020-03-18T03:30:00Z","03/17 23:30",0,,,"2020-03-18T03:30:00Z",,,,0,,,,,,,,,,,,,,,"69",0,0,0,0,0,,0,0,"b06f989b5670592159e1a3a80e4b2626bb6679e2",0,0,0,0,0,""
20200317,"MP",0,,,,"posNeg",0,,,,,,,,"3/17/2020 01:30","2020-03-17T01:30:00Z","03/16 21:30",,,,"2020-03-17T01:30:00Z",,,,0,,,,,,,,,,,,,,,"69",0,0,0,0,0,,0,0,"81ce9782c47a9715788cf3211151b6cdef6d8f03",0,0,0,0,0,""
20200316,"MP",0,,,,"posNeg",0,,,,,,,,"3/16/2020 15:55","2020-03-16T15:55:00Z","03/16 11:55",,,,"2020-03-16T15:55:00Z",,,,0,,,,,,,,,,,,,,,"69",0,0,0,0,0,,0,0,"a6912d42034d582f75c1583727fcc67a8902fbe5",0,0,0,0,0,""