"date","state","positive","probableCases","negative","pending","totalTestResultsSource","totalTestResults","hospitalizedCurrently","hospitalizedCumulative","inIcuCurrently","inIcuCumulative","onVentilatorCurrently","onVentilatorCumulative","recovered","lastUpdateEt","dateModified","checkTimeEt","death","hospitalized","hospitalizedDischarged","dateChecked","totalTestsViral","positiveTestsViral","negativeTestsViral","positiveCasesViral","deathConfirmed","deathProbable","totalTestEncountersViral","totalTestsPeopleViral","totalTestsAntibody","positiveTestsAntibody","negativeTestsAntibody","totalTestsPeopleAntibody","positiveTestsPeopleAntibody","negativeTestsPeopleAntibody","totalTestsPeopleAntigen","positiveTestsPeopleAntigen","totalTestsAntigen","positiveTestsAntigen","fips","positiveIncrease","negativeIncrease","total","totalTestResultsIncrease","posNeg","dataQualityGrade","deathIncrease","hospitalizedIncrease","hash","commercialScore","negativeRegularScore","negativeScore","positiveScore","score","grade"
20210307,"NE",203026,,771128,,"totalTestsViral",2421684,137,6237,,,,,157144,"3/7/2021 11:15","2021-03-07T11:15:00Z","03/07 06:15",2113,6237,,"2021-03-07T11:15:00Z",2421684,235965,2182938,,,,,974759,,,,,,,,,,,"31",373,542,974154,1,974154,,0,8,"3f55dc5e02818a3abbd58e07cf80bdfe4abc60f1",0,0,0,0,0,""
20210306,"NE",202653,,770586,,"totalTestsViral",2421683,136,6229,,,,,156825,"3/5/2021 09:45","2021-03-05T09:45:00Z","03/05 04:45",2113,6229,,"2021-03-05T09:45:00Z",2421683,235726,2183243,,,,,973781,,,,,,,,,,,"31",343,1354,973239,10138,973239,,1,3,"937634fc6a04b345bc793f53d996b217ac1b22f0",0,0,0,0,0,""
20210305,"NE",202310,,769232,,"totalTestsViral",2411545,143,6226,,,,,156510,"3/5/2021 09:45","2021-03-05T09:45:00Z","03/05 04:45",2112,6226,,"2021-03-05T09:45:00Z",2411545,235280,2173557,,,,,972080,,,,,,,,,,,"31",337,1102,971542,7859,971542,,20,69,"0ece264679e1fb2fd0a04a3553b38008462c5c3d",0,0,0,0,0,""
20210304,"NE",201973,,768130,,"totalTestsViral",2403686,151,6157,,,,,156048,"3/4/2021 10:30","2021-03-04T10:30:00Z","03/04 05:30",2092,6157,,"2021-03-04T10:30:00Z",2403686,234838,2166160,,,,,970639,,,,,,,,,,,"31",365,1349,970103,11285,970103,,1,10,"75d8398bb8c4ad0ae14862e45488e96d83a409ff",0,0,0,0,0,""
20210303,"NE",201608,,766781,,"totalTestsViral",2392401,150,6147,,,,,155933,"3/3/2021 10:00","2021-03-03T10:00:00Z","03/03 05:00",2091,6147,,"2021-03-03T10:00:00Z",2392401,234408,2155329,,,,,968925,,,,,,,,,,,"31",262,1105,968389,10150,968389,,7,7,"08e8b5b97a5a8121f246e094138ce0a4f9e2da79",0,0,0,0,0,""
20210302,"NE",201346,,765676,,"totalTestsViral",2382251,154,6140,,,,,155712,"3/2/2021 10:30","2021-03-02T10:30:00Z","03/02 05:30",2084,6140,,"2021-03-02T10:30:00Z",2382251,233966,2145644,,,,,967551,,,,,,,,,,,"31",400,1216,967022,8520,967022,,2,34,"89a2d10043bdad94b09e1687a1e225cf38996c51",0,0,0,0,0,""
20210301,"NE",200946,,764460,,"totalTestsViral",2373731,158,6106,,,,,155333,"3/1/2021 10:15","2021-03-01T10:15:00Z","03/01 05:15",2082,6106,,"2021-03-01T10:15:00Z",2373731,233457,2137624,,,,,965935,,,,,,,,,,,"31",98,456,965406,2529,965406,,0,4,"861130d73a5fe6e772e135ae47a34a670681433e",0,0,0,0,0,""
20210228,"NE",200848,,764004,,"totalTestsViral",2371202,151,6102,,,,,154909,"2/28/2021 10:15","2021-02-28T10:15:00Z","02/28 05:15",2082,6102,,"2021-02-28T10:15:00Z",2371202,233302,2135250,,,,,965379,,,,,,,,,,,"31",167,598,964852,5076,964852,,0,3,"0b1e6546b3ea12ae6fed56a05dec636d58bfe718",0,0,0,0,0,""
20210227,"NE",200681,,763406,,"totalTestsViral",2366126,154,6099,,,,,154339,"2/27/2021 10:30","2021-02-27T10:30:00Z","02/27 05:30",2082,6099,,"2021-02-27T10:30:00Z",2366126,233075,2130434,,,,,964612,,,,,,,,,,,"31",278,1160,964087,9331,964087,,4,11,"7ea400d049f28599ccb64f360f4ca34f6d0af99f",0,0,0,0,0,""
20210226,"NE",200403,,762246,,"totalTestsViral",2356795,166,6088,,,,,153937,"2/26/2021 10:00","2021-02-26T10:00:00Z","02/26 05:00",2078,6088,,"2021-02-26T10:00:00Z",2356795,232720,2121457,,,,,963170,,,,,,,,,,,"31",297,1405,962649,9342,962649,,15,6,"a7099ae97538c3a81315f2b0bd7a862fdfc096be",0,0,0,0,0,""
20210225,"NE",200106,,760841,,"totalTestsViral",2347453,160,6082,,,,,153753,"2/25/2021 10:30","2021-02-25T10:30:00Z","02/25 05:30",2063,6082,,"2021-02-25T10:30:00Z",2347453,232314,2112522,,,,,961464,,,,,,,,,,,"31",324,1126,960947,12000,960947,,9,23,"8ede2d0cea227a7fcd99de24d63b1d87ac9ff9bd",0,0,0,0,0,""
20210224,"NE",199782,,759715,,"totalTestsViral",2335453,178,6059,,,,,153585,"2/24/2021 12:15","2021-02-24T12:15:00Z","02/24 07:15",2054,6059,,"2021-02-24T12:15:00Z",2335453,231778,2101080,,,,,960014,,,,,,,,,,,"31",380,1448,959497,12443,959497,,4,11,"51004b5df8a777594ec10dcc6b8c46077714d6ee",0,0,0,0,0,""
20210223,"NE",199402,,758267,,"totalTestsViral",2323010,166,6048,,,,,142336,"2/23/2021 10:30","2021-02-23T10:30:00Z","02/23 05:30",2050,6048,,"2021-02-23T10:30:00Z",2323010,231219,2089213,,,,,958180,,,,,,,,,,,"31",357,933,957669,6612,957669,,3,17,"cc402d0f430db33b075e1137ca51afc144366bf8",0,0,0,0,0,""
20210222,"NE",199045,,757334,,"totalTestsViral",2316398,161,6031,,,,,142336,"2/22/2021 09:45","2021-02-22T09:45:00Z","02/22 04:45",2047,6031,,"2021-02-22T09:45:00Z",2316398,230838,2082984,,,,,956892,,,,,,,,,,,"31",96,342,956379,2001,956379,,0,-3,"3e5c8ac5817de4bb261e9bba826a5d09b82dd90e",0,0,0,0,0,""
20210221,"NE",198949,,756992,,"totalTestsViral",2314397,163,6034,,,,,142336,"2/21/2021 10:45","2021-02-21T10:45:00Z","02/21 05:45",2047,6034,,"2021-02-21T10:45:00Z",2314397,230666,2081186,,,,,956452,,,,,,,,,,,"31",198,688,955941,5164,955941,,0,2,"b728aa66e550058fa59865fda7f35cb01404268e",0,0,0,0,0,""
20210220,"NE",198751,,756304,,"totalTestsViral",2309233,170,6032,,,,,142336,"2/20/2021 10:45","2021-02-20T10:45:00Z","02/20 05:45",2047,6032,,"2021-02-20T10:45:00Z",2309233,230417,2076255,,,,,955566,,,,,,,,,,,"31",309,964,955055,7975,955055,,4,23,"29844fd2b62f9dca8477067b84df3fe73f6b8be8",0,0,0,0,0,""
20210219,"NE",198442,,755340,,"totalTestsViral",2301258,185,6009,,,,,142336,"2/19/2021 10:15","2021-02-19T10:15:00Z","02/19 05:15",2043,6009,,"2021-02-19T10:15:00Z",2301258,229934,2068787,,,,,954292,,,,,,,,,,,"31",400,1171,953782,10947,953782,,18,12,"245c5a3319cda8fda99bdb0ad2d5bc1e21bce9a9",0,0,0,0,0,""
20210218,"NE",198042,,754169,,"totalTestsViral",2290311,188,5997,,,,,142336,"2/18/2021 11:30","2021-02-18T11:30:00Z","02/18 06:30",2025,5997,,"2021-02-18T11:30:00Z",2290311,229423,2058349,,,,,952722,,,,,,,,,,,"31",296,962,952211,10386,952211,,7,16,"dd1b721a8d4b99d6842ef33639c83e26404eecbd",0,0,0,0,0,""
20210217,"NE",197746,,753207,,"totalTestsViral",2279925,185,5981,,,,,142335,"2/17/2021 11:30","2021-02-17T11:30:00Z","02/17 06:30",2018,5981,,"2021-02-17T11:30:00Z",2279925,229051,2048349,,,,,951463,,,,,,,,,,,"31",299,1520,950953,22132,950953,,14,17,"74659312bb099412719b03cf36985d8054c35318",0,0,0,0,0,""
20210216,"NE",197447,,751687,,"totalTestsViral",2257793,177,5964,,,,,142335,"2/16/2021 10:00","2021-02-16T10:00:00Z","02/16 05:00",2004,5964,,"2021-02-16T10:00:00Z",2257793,228110,2027634,,,,,949639,,,,,,,,,,,"31",119,332,949134,3235,949134,,1,2,"1952e9e96492e429fcf54aee54c57869fa28a9aa",0,0,0,0,0,""
20210215,"NE",197328,,751355,,"totalTestsViral",2254558,195,5962,,,,,142335,"2/15/2021 10:00","2021-02-15T10:00:00Z","02/15 05:00",2003,5962,,"2021-02-15T10:00:00Z",2254558,227945,2024401,,,,,949187,,,,,,,,,,,"31",92,304,948683,1639,948683,,1,12,"ded77630b071ce384e022320e650049677f8e261",0,0,0,0,0,""
20210214,"NE",197236,,751051,,"totalTestsViral",2252919,197,5950,,,,,142312,"2/14/2021 10:45","2021-02-14T10:45:00Z","02/14 05:45",2002,5950,,"2021-02-14T10:45:00Z",2252919,227838,2023233,,,,,948791,,,,,,,,,,,"31",209,781,948287,5671,948287,,0,8,"b227b7e3122d0e887a54ea5c0e921b2b21c15395",0,0,0,0,0,""
20210213,"NE",197027,,750270,,"totalTestsViral",2247248,201,5942,,,,,142112,"2/13/2021 10:45","2021-02-13T10:45:00Z","02/13 05:45",2002,5942,,"2021-02-13T10:45:00Z",2247248,227596,2018183,,,,,947799,,,,,,,,,,,"31",1542,2051,947297,15802,947297,,0,6,"952069f29a2cb62fc5af77e788d35212f8ebdc84",0,0,0,0,0,""
20210212,"NE",195485,,748219,,"totalTestsViral",2231446,216,5936,,,,,141783,"2/12/2021 10:15","2021-02-12T10:15:00Z","02/12 05:15",2002,5936,,"2021-02-12T10:15:00Z",2231446,226095,2003421,,,,,944189,,,,,,,,,,,"31",479,1722,943704,16875,943704,,12,5,"05d7af8c988f645f7ba5f963a71d177a6ab780cf",0,0,0,0,0,""
20210211,"NE",195006,,746497,,"totalTestsViral",2214571,230,5931,,,,,141236,"2/11/2021 10:30","2021-02-11T10:30:00Z","02/11 05:30",1990,5931,,"2021-02-11T10:30:00Z",2214571,225461,1986778,,,,,941988,,,,,,,,,,,"31",374,1573,941503,9443,941503,,4,3,"db62b7742d05e060ca01b5f3d5710bb2b53e3dea",0,0,0,0,0,""
20210210,"NE",194632,,744924,,"totalTestsViral",2205128,240,5928,,,,,141239,"2/10/2021 11:34","2021-02-10T11:34:00Z","02/10 06:34",1986,5928,,"2021-02-10T11:34:00Z",2205128,225021,1977788,,,,,940043,,,,,,,,,,,"31",462,1392,939556,15069,939556,,8,11,"0c8ff0d2bcad69040598a48816da966da13d58a0",0,0,0,0,0,""
20210209,"NE",194170,,743532,,"totalTestsViral",2190059,257,5917,,,,,141108,"2/9/2021 10:15","2021-02-09T10:15:00Z","02/09 05:15",1978,5917,,"2021-02-09T10:15:00Z",2190059,224467,1963281,,,,,938190,,,,,,,,,,,"31",344,757,937702,6394,937702,,10,16,"7632cdb8e15296af06ba2d2f8eedb249bf5ccd4b",0,0,0,0,0,""
20210208,"NE",193826,,742775,,"totalTestsViral",2183665,250,5901,,,,,140902,"2/8/2021 11:00","2021-02-08T11:00:00Z","02/08 06:00",1968,5901,,"2021-02-08T11:00:00Z",2183665,224093,1957270,,,,,937086,,,,,,,,,,,"31",104,366,936601,2157,936601,,0,5,"9a7a1f2ee17547b76dc6f076946dd94bdb18d3af",0,0,0,0,0,""
20210207,"NE",193722,,742409,,"totalTestsViral",2181508,272,5896,,,,,140408,"2/7/2021 11:15","2021-02-07T11:15:00Z","02/07 06:15",1968,5896,,"2021-02-07T11:15:00Z",2181508,223900,1955313,,,,,936615,,,,,,,,,,,"31",301,1057,936131,10003,936131,,0,9,"41dcfee4209be4bd2fd59193c82d92e2259e246d",0,0,0,0,0,""
20210206,"NE",193421,,741352,,"totalTestsViral",2171505,275,5887,,,,,139885,"2/6/2021 10:30","2021-02-06T10:30:00Z","02/06 05:30",1968,5887,,"2021-02-06T10:30:00Z",2171505,223487,1945734,,,,,935257,,,,,,,,,,,"31",352,1362,934773,12534,934773,,10,14,"5443fedfd6efa65e1d2b41ba2d2e1642c645fc71",0,0,0,0,0,""
20210205,"NE",193069,,739990,,"totalTestsViral",2158971,285,5873,,,,,139287,"2/5/2021 10:30","2021-02-05T10:30:00Z","02/05 05:30",1958,5873,,"2021-02-05T10:30:00Z",2158971,223003,1933683,,,,,933542,,,,,,,,,,,"31",520,1919,933059,12700,933059,,6,11,"8bbbeff01d4c0658864b289dcead86bbe69b98f9",0,0,0,0,0,""
20210204,"NE",192549,,738071,,"totalTestsViral",2146271,278,5862,,,,,138647,"2/4/2021 11:00","2021-02-04T11:00:00Z","02/04 06:00",1952,5862,,"2021-02-04T11:00:00Z",2146271,222359,1921652,,,,,931101,,,,,,,,,,,"31",507,1563,930620,13347,930620,,21,18,"f68b2a1c64f61912e46297a338fbe27e6f0da7c9",0,0,0,0,0,""
20210203,"NE",192042,,736508,,"totalTestsViral",2132924,305,5844,,,,,137684,"2/3/2021 10:45","2021-02-03T10:45:00Z","02/03 05:45",1931,5844,,"2021-02-03T10:45:00Z",2132924,221689,1908965,,,,,929032,,,,,,,,,,,"31",605,2229,928550,22776,928550,,2,12,"4816aad84ec7c21aa964a589dbe2297953b96296",0,0,0,0,0,""
20210202,"NE",191437,,734279,,"totalTestsViral",2110148,305,5832,,,,,137446,"2/2/2021 11:28","2021-02-02T11:28:00Z","02/02 06:28",1929,5832,,"2021-02-02T11:28:00Z",2110148,220917,1887002,,,,,926198,,,,,,,,,,,"31",487,931,925716,7171,925716,,9,17,"51f6ca06bef83e5c4e86a545567f89525602ecdb",0,0,0,0,0,""
20210201,"NE",190950,,733348,,"totalTestsViral",2102977,312,5815,,,,,136972,"2/1/2021 11:30","2021-02-01T11:30:00Z","02/01 06:30",1920,5815,,"2021-02-01T11:30:00Z",2102977,220260,1880481,,,,,924780,,,,,,,,,,,"31",237,629,924298,2854,924298,,0,11,"7d0c6832e7c283ef8ec0bd26969fe72cf9b8399d",0,0,0,0,0,""
20210131,"NE",190713,,732719,,"totalTestsViral",2100123,320,5804,,,,,136686,"1/31/2021 12:45","2021-01-31T12:45:00Z","01/31 07:45",1920,5804,,"2021-01-31T12:45:00Z",2100123,219936,1877955,,,,,923914,,,,,,,,,,,"31",143,338,923432,9161,923432,,0,8,"e87a8de54753dec4fbbf23c796f09d1784c20640",0,0,0,0,0,""
20210130,"NE",190570,,732381,,"totalTestsViral",2090962,325,5796,,,,,135957,"1/30/2021 17:15","2021-01-30T17:15:00Z","01/30 12:15",1920,5796,,"2021-01-30T17:15:00Z",2090962,219706,1873158,,,,,923433,,,,,,,,,,,"31",973,3070,922951,15600,922951,,-1,21,"9c0a94a5760e308ddee792c06bc566aa1a27a4de",0,0,0,0,0,""
20210129,"NE",189597,,729311,,"totalTestsViral",2075362,341,5775,,,,,134492,"1/28/2021 23:15","2021-01-28T23:15:00Z","01/28 18:15",1921,5775,,"2021-01-28T23:15:00Z",2075362,218517,1854627,,,,,919385,,,,,,,,,,,"31",813,1785,918908,11128,918908,,4,19,"f9671f0843c28a40285438fd474d20c386ab4f78",0,0,0,0,0,""
20210128,"NE",188784,,727526,,"totalTestsViral",2064234,343,5756,,,,,133469,"1/27/2021 23:15","2021-01-27T23:15:00Z","01/27 18:15",1917,5756,,"2021-01-27T23:15:00Z",2064234,217494,1844539,,,,,916787,,,,,,,,,,,"31",662,1217,916310,11527,916310,,12,27,"1cc27311512019d734ae8286b26139668b37d958",0,0,0,0,0,""
20210127,"NE",188122,,726309,,"totalTestsViral",2052707,360,5729,,,,,133206,"1/27/2021 00:00","2021-01-27T00:00:00Z","01/26 19:00",1905,5729,,"2021-01-27T00:00:00Z",2052707,216775,1833733,,,,,914909,,,,,,,,,,,"31",329,2151,914431,11920,914431,,11,27,"6ea1fcdca9c57af252c41570c6d252c11b57aa4d",0,0,0,0,0,""
20210126,"NE",187793,,724158,,"totalTestsViral",2040787,373,5702,,,,,132495,"1/25/2021 22:15","2021-01-25T22:15:00Z","01/25 17:15",1894,5702,,"2021-01-25T22:15:00Z",2040787,216396,1822202,,,,,912428,,,,,,,,,,,"31",646,4158,911951,14759,911951,,15,20,"463c0c2a13c5a126b8862166f91c10c61836f2a4",0,0,0,0,0,""
20210125,"NE",187147,,720000,,"totalTestsViral",2026028,392,5682,,,,,132453,"1/24/2021 22:15","2021-01-24T22:15:00Z","01/24 17:15",1879,5682,,"2021-01-24T22:15:00Z",2026028,215632,1808706,,,,,907628,,,,,,,,,,,"31",293,1066,907147,4612,907147,,0,4,"e49993ccf0eddf1c611037a0e1359ce2638d71c7",0,0,0,0,0,""
20210124,"NE",186854,,718934,,"totalTestsViral",2021416,390,5678,,,,,131828,"1/23/2021 22:15","2021-01-23T22:15:00Z","01/23 17:15",1879,5678,,"2021-01-23T22:15:00Z",2021416,215275,1803954,,,,,906268,,,,,,,,,,,"31",599,7181,905788,22978,905788,,1,8,"fd435d1df2026629a687e01ef4a77f7a1518e838",0,0,0,0,0,""
20210123,"NE",186255,,711753,,"totalTestsViral",1998438,414,5670,,,,,131242,"1/22/2021 22:15","2021-01-22T22:15:00Z","01/22 17:15",1878,5670,,"2021-01-22T22:15:00Z",1998438,214492,1784925,,,,,898483,,,,,,,,,,,"31",909,1608,898008,9534,898008,,10,23,"58200e14f622f648114bed955b72392deda938e3",0,0,0,0,0,""
20210122,"NE",185346,,710145,,"totalTestsViral",1988904,421,5647,,,,,130527,"1/21/2021 22:15","2021-01-21T22:15:00Z","01/21 17:15",1868,5647,,"2021-01-21T22:15:00Z",1988904,213854,1763365,,,,,895969,,,,,,,,,,,"31",864,1865,895491,22737,895491,,6,15,"80a5aacaac3771ab4ff45c9dda121e4a1992b1ed",0,0,0,0,0,""
20210121,"NE",184482,,708280,,"totalTestsViral",1966167,433,5632,,,,,129608,"1/20/2021 21:45","2021-01-20T21:45:00Z","01/20 16:45",1862,5632,,"2021-01-20T21:45:00Z",1966167,212272,1761252,,,,,893236,,,,,,,,,,,"31",1164,4167,892762,22156,892762,,12,42,"a2da4fd43d6ae1cb6e09cb1647731534bc1a263d",0,0,0,0,0,""
20210120,"NE",183318,,704113,,"totalTestsViral",1944011,438,5590,,,,,127221,"1/19/2021 00:00","2021-01-19T00:00:00Z","01/18 19:00",1850,5590,,"2021-01-19T00:00:00Z",1944011,209752,1732116,,,,,886764,,,,,,,,,,,"31",900,0,887431,0,887431,,8,0,"29abe730c020da48ac44ddc94116ae908a98613e",0,0,0,0,0,""
20210119,"NE",182418,,704113,,"totalTestsViral",1944011,429,5590,,,,,127221,"1/18/2021 21:30","2021-01-18T21:30:00Z","01/18 16:30",1842,5590,,"2021-01-18T21:30:00Z",1944011,209752,1732116,,,,,886764,,,,,,,,,,,"31",440,335,886531,2267,886531,,5,15,"0087baa6ee234925ef8a33d7c0a8626573a3ce7e",0,0,0,0,0,""
20210118,"NE",181978,,703778,,"totalTestsViral",1941744,429,5575,,,,,126504,"1/17/2021 21:30","2021-01-17T21:30:00Z","01/17 16:30",1837,5575,,"2021-01-17T21:30:00Z",1941744,209674,1729927,,,,,886228,,,,,,,,,,,"31",1068,1816,885756,33052,885756,,0,10,"adacf6a142234f494b6a816d8cf874783d19683f",0,0,0,0,0,""
20210117,"NE",180910,,701962,,"totalTestsViral",1908692,457,5565,,,,,124963,"1/15/2021 21:30","2021-01-15T21:30:00Z","01/15 16:30",1837,5565,,"2021-01-15T21:30:00Z",1908692,206887,1699670,,,,,883344,,,,,,,,,,,"31",0,0,882872,0,882872,,0,0,"3ce36e4b6e0582acd9ce4d33af14e8e78e462f81",0,0,0,0,0,""
20210116,"NE",180910,,701962,,"totalTestsViral",1908692,457,5565,,,,,124963,"1/15/2021 21:30","2021-01-15T21:30:00Z","01/15 16:30",1837,5565,,"2021-01-15T21:30:00Z",1908692,206887,1699670,,,,,883344,,,,,,,,,,,"31",779,1455,882872,14078,882872,,19,26,"8f99e8125bc3b8ac413b1b5ec4304ea1f8cba938",0,0,0,0,0,""
20210115,"NE",180131,,700507,,"totalTestsViral",1894614,465,5539,,,,,124233,"1/14/2021 21:30","2021-01-14T21:30:00Z","01/14 16:30",1818,5539,,"2021-01-14T21:30:00Z",1894614,205736,1686804,,,,,881078,,,,,,,,,,,"31",932,899,880638,7460,880638,,15,19,"8d3e2150ee6624b545d098de17054f717968ce3f",0,0,0,0,0,""
20210114,"NE",179199,,699608,,"totalTestsViral",1887154,449,5520,,,,,123234,"1/13/2021 21:45","2021-01-13T21:45:00Z","01/13 16:45",1803,5520,,"2021-01-13T21:45:00Z",1887154,205069,1680017,,,,,879242,,,,,,,,,,,"31",1529,3169,878807,12447,878807,,12,23,"2a97acf8e334032a316148d320e1eee48d855231",0,0,0,0,0,""
20210113,"NE",177670,,696439,,"totalTestsViral",1874707,457,5497,,,,,120700,"1/12/2021 22:30","2021-01-12T22:30:00Z","01/12 17:30",1791,5497,,"2021-01-12T22:30:00Z",1874707,204358,1668291,,,,,874543,,,,,,,,,,,"31",1000,1271,874109,13341,874109,,19,22,"32e857722abc7ce88ad8a9b51d36dc789eaaf08d",0,0,0,0,0,""
20210112,"NE",176670,,695168,,"totalTestsViral",1861366,484,5475,,,,,122564,"1/11/2021 21:45","2021-01-11T21:45:00Z","01/11 16:45",1772,5475,,"2021-01-11T21:45:00Z",1861366,203155,1656163,,,,,872270,,,,,,,,,,,"31",644,727,871838,9315,871838,,12,15,"8c142020d070496916193def6aeba707a129ff6e",0,0,0,0,0,""
20210111,"NE",176026,,694441,,"totalTestsViral",1852051,475,5460,,,,,121710,"1/10/2021 21:30","2021-01-10T21:30:00Z","01/10 16:30",1760,5460,,"2021-01-10T21:30:00Z",1852051,202327,1647683,,,,,870901,,,,,,,,,,,"31",406,928,870467,3962,870467,,23,16,"d6536858b19425948ac031372cf43556e950cda9",0,0,0,0,0,""
20210110,"NE",175620,,693513,,"totalTestsViral",1848089,471,5444,,,,,120729,"1/9/2021 21:45","2021-01-09T21:45:00Z","01/09 16:45",1737,5444,,"2021-01-09T21:45:00Z",1848089,201900,1644150,,,,,869564,,,,,,,,,,,"31",1006,1809,869133,10418,869133,,4,10,"9238c88a19bccd27ad5cca8613d09bb92fb9122d",0,0,0,0,0,""
20210109,"NE",174614,,691704,,"totalTestsViral",1837671,481,5434,,,,,119393,"1/8/2021 21:30","2021-01-08T21:30:00Z","01/08 16:30",1733,5434,,"2021-01-08T21:30:00Z",1837671,200730,1634913,,,,,866748,,,,,,,,,,,"31",1023,1373,866318,12039,866318,,-78,20,"cffc83d3bbc8e6576225bdbdc45ac0cda9ca84c3",0,0,0,0,0,""
20210108,"NE",173591,,690331,,"totalTestsViral",1825632,491,5414,,,,,117589,"1/7/2021 21:45","2021-01-07T21:45:00Z","01/07 16:45",1811,5414,,"2021-01-07T21:45:00Z",1825632,199599,1624042,,,,,864342,,,,,,,,,,,"31",1122,2038,863922,12110,863922,,108,28,"7b1c711f2f433e89a3ba8dab61a2801fd9081ed4",0,0,0,0,0,""
20210107,"NE",172469,,688293,,"totalTestsViral",1813522,506,5386,,,,,116295,"1/6/2021 22:15","2021-01-06T22:15:00Z","01/06 17:15",1703,5386,,"2021-01-06T22:15:00Z",1813522,198164,1613363,,,,,861182,,,,,,,,,,,"31",1436,1952,860762,17840,860762,,11,28,"738eb915baab1917cb679379b52cba5849f95e0e",0,0,0,0,0,""
20210106,"NE",171033,,686341,,"totalTestsViral",1795682,515,5358,,,,,114249,"1/5/2021 22:15","2021-01-05T22:15:00Z","01/05 17:15",1692,5358,,"2021-01-05T22:15:00Z",1795682,196373,1597330,,,,,857789,,,,,,,,,,,"31",1448,1626,857374,13885,857374,,10,37,"17ac3cd7ff1fd33c05443442ba4debb84e5832be",0,0,0,0,0,""
20210105,"NE",169585,,684715,,"totalTestsViral",1781797,527,5321,,,,,114249,"1/4/2021 21:45","2021-01-04T21:45:00Z","01/04 16:45",1682,5321,,"2021-01-04T21:45:00Z",1781797,194614,1585220,,,,,854716,,,,,,,,,,,"31",585,645,854300,5889,854300,,10,31,"2b7ba8c54bb27dbbd50aeefaca61ee3ea6d7903d",0,0,0,0,0,""
20210104,"NE",169000,,684070,,"totalTestsViral",1775908,511,5290,,,,,112856,"1/3/2021 22:00","2021-01-03T22:00:00Z","01/03 17:00",1672,5290,,"2021-01-03T22:00:00Z",1775908,193920,1580032,,,,,853485,,,,,,,,,,,"31",738,1038,853070,6110,853070,,3,20,"9ff91b224f1897f2795336c6fba0437e36551434",0,0,0,0,0,""
20210103,"NE",168262,,683032,,"totalTestsViral",1769798,503,5270,,,,,105963,"1/2/2021 23:00","2021-01-02T23:00:00Z","01/02 18:00",1669,5270,,"2021-01-02T23:00:00Z",1769798,193046,1574795,,,,,851704,,,,,,,,,,,"31",546,795,851294,3694,851294,,1,5,"96284760a559c176b99d946d1cebab1bd2ba95f7",0,0,0,0,0,""
20210102,"NE",167716,,682237,,"totalTestsViral",1766104,517,5265,,,,,109705,"1/1/2021 21:30","2021-01-01T21:30:00Z","01/01 16:30",1668,5265,,"2021-01-01T21:30:00Z",1766104,192429,1571723,,,,,850362,,,,,,,,,,,"31",918,1378,849953,10284,849953,,17,11,"77c76702d2d90efc6cc0e67acc12d88a49f3f1d1",0,0,0,0,0,""
20210101,"NE",166798,,680859,,"totalTestsViral",1755820,534,5254,,,,,107694,"12/31/2020 21:30","2020-12-31T21:30:00Z","12/31 16:30",1651,5254,,"2020-12-31T21:30:00Z",1755820,191386,1562488,,,,,848067,,,,,,,,,,,"31",1501,1624,847657,12101,847657,,40,34,"872a86b693f159f093dfaf9b637aa9c339d762a6",0,0,0,0,0,""
20201231,"NE",165297,,679235,,"totalTestsViral",1743719,544,5220,,,,,105574,"12/30/2020 21:30","2020-12-30T21:30:00Z","12/30 16:30",1611,5220,,"2020-12-30T21:30:00Z",1743719,189628,1552166,,,,,844942,,,,,,,,,,,"31",1516,2224,844532,17389,844532,,8,33,"28cff1803187659bd68cf9c63cef042ee131f991",0,0,0,0,0,""
20201230,"NE",163781,,677011,,"totalTestsViral",1726330,517,5187,,,,,105135,"12/29/2020 22:00","2020-12-29T22:00:00Z","12/29 17:00",1603,5187,,"2020-12-29T22:00:00Z",1726330,187806,1536623,,,,,841203,,,,,,,,,,,"31",932,1062,840792,8847,840792,,16,28,"5926d2b71d45e9c55e467d540610985204648e8c",0,0,0,0,0,""
20201229,"NE",162849,,675949,,"totalTestsViral",1717483,534,5159,,,,,103592,"12/28/2020 21:45","2020-12-28T21:45:00Z","12/28 16:45",1587,5159,,"2020-12-28T21:45:00Z",1717483,186686,1528896,,,,,839207,,,,,,,,,,,"31",875,1644,838798,11881,838798,,28,51,"6cece4c4bc60c4dbdea8485e479bb43efe2f0f9d",0,0,0,0,0,""
20201228,"NE",161974,,674305,,"totalTestsViral",1705602,527,5108,,,,,102169,"12/27/2020 21:15","2020-12-27T21:15:00Z","12/27 16:15",1559,5108,,"2020-12-27T21:15:00Z",1705602,185515,1518201,,,,,836688,,,,,,,,,,,"31",637,857,836279,4424,836279,,0,4,"3e652279231092fba0a50b2f8bf0c8e77ea5e1a7",0,0,0,0,0,""
20201227,"NE",161337,,673448,,"totalTestsViral",1701178,503,5104,,,,,102012,"12/26/2020 21:15","2020-12-26T21:15:00Z","12/26 16:15",1559,5104,,"2020-12-26T21:15:00Z",1701178,184851,1514442,,,,,835194,,,,,,,,,,,"31",175,389,834785,1651,834785,,1,19,"daf43dbf41a18f8b9d05dfc4702a60dc63b60723",0,0,0,0,0,""
20201226,"NE",161162,,673059,,"totalTestsViral",1699527,505,5085,,,,,94708,"12/25/2020 21:30","2020-12-25T21:30:00Z","12/25 16:30",1558,5085,,"2020-12-25T21:30:00Z",1699527,184584,1513049,,,,,834627,,,,,,,,,,,"31",805,1620,834221,9244,834221,,-10,-3,"7b144403199c2ccd5b0773b41aa4b37de16b1f1d",0,0,0,0,0,""
20201225,"NE",160357,,671439,,"totalTestsViral",1690283,538,5088,,,,,98973,"12/24/2020 19:30","2020-12-24T19:30:00Z","12/24 14:30",1568,5088,,"2020-12-24T19:30:00Z",1690283,183727,1504685,,,,,832201,,,,,,,,,,,"31",695,1352,831796,8512,831796,,7,24,"8ac8c52b9d674c118e9d830a1ed551c7351d03a5",0,0,0,0,0,""
20201224,"NE",159662,,670087,,"totalTestsViral",1681771,572,5064,,,,,96706,"12/23/2020 21:30","2020-12-23T21:30:00Z","12/23 16:30",1561,5064,,"2020-12-23T21:30:00Z",1681771,182843,1497056,,,,,830155,,,,,,,,,,,"31",1338,3150,829749,19447,829749,,40,28,"3d839c1f1ee5a0338df74f6f1380d83e149a9788",0,0,0,0,0,""
20201223,"NE",158324,,666937,,"totalTestsViral",1662324,566,5036,,,,,96359,"12/22/2020 21:30","2020-12-22T21:30:00Z","12/22 16:30",1521,5036,,"2020-12-22T21:30:00Z",1662324,181274,1479195,,,,,825661,,,,,,,,,,,"31",1221,2255,825261,13765,825261,,10,23,"311b879cde5a6505a24865abd56d972a04b9e734",0,0,0,0,0,""
20201222,"NE",157103,,664682,,"totalTestsViral",1648559,582,5013,,,,,95171,"12/21/2020 21:30","2020-12-21T21:30:00Z","12/21 16:30",1511,5013,,"2020-12-21T21:30:00Z",1648559,179794,1466904,,,,,822184,,,,,,,,,,,"31",721,1364,821785,8511,821785,,25,21,"d47a1ef20802cef9a2b22562fcd3a7b2826b0a42",0,0,0,0,0,""
20201221,"NE",156382,,663318,,"totalTestsViral",1640048,582,4992,,,,,93640,"12/20/2020 21:00","2020-12-20T21:00:00Z","12/20 16:00",1486,4992,,"2020-12-20T21:00:00Z",1640048,178989,1459221,,,,,820099,,,,,,,,,,,"31",967,1807,819700,7601,819700,,11,15,"f839f8ba3d14fa2c6e5768eb0aa581835be2f10f",0,0,0,0,0,""
20201220,"NE",155415,,661511,,"totalTestsViral",1632447,598,4977,,,,,92195,"12/19/2020 21:00","2020-12-19T21:00:00Z","12/19 16:00",1475,4977,,"2020-12-19T21:00:00Z",1632447,177808,1452819,,,,,817319,,,,,,,,,,,"31",670,1448,816926,8097,816926,,5,25,"e8675d2a0b17c278c31fa558226da4aeaec7669d",0,0,0,0,0,""
20201219,"NE",154745,,660063,,"totalTestsViral",1624350,612,4952,,,,,89890,"12/18/2020 22:00","2020-12-18T22:00:00Z","12/18 17:00",1470,4952,,"2020-12-18T22:00:00Z",1624350,176966,1445579,,,,,815200,,,,,,,,,,,"31",1345,1990,814808,14965,814808,,17,22,"1521a99a7f85e5090cd747178c7cfc731eb6bd88",0,0,0,0,0,""
20201218,"NE",153400,,658073,,"totalTestsViral",1609385,602,4930,,,,,88176,"12/17/2020 21:00","2020-12-17T21:00:00Z","12/17 16:00",1453,4930,,"2020-12-17T21:00:00Z",1609385,175286,1432281,,,,,811867,,,,,,,,,,,"31",1297,2529,811473,13408,811473,,5,22,"e08f6bf8a261a20f858260cdbbf484fccf3358e7",0,0,0,0,0,""
20201217,"NE",152103,,655544,,"totalTestsViral",1595977,646,4908,,,,,85915,"12/16/2020 21:00","2020-12-16T21:00:00Z","12/16 16:00",1448,4908,,"2020-12-16T21:00:00Z",1595977,173638,1420527,,,,,808043,,,,,,,,,,,"31",1242,2390,807647,13736,807647,,10,24,"5ecf30bb59e99688c1ea24829432dd62da887f77",0,0,0,0,0,""
20201216,"NE",150861,,653154,,"totalTestsViral",1582241,677,4884,,,,,85127,"12/15/2020 23:15","2020-12-15T23:15:00Z","12/15 18:15",1438,4884,,"2020-12-15T23:15:00Z",1582241,172124,1408366,,,,,804403,,,,,,,,,,,"31",1517,2256,804015,19497,804015,,20,53,"d5be233f462579dfcbda7c810a3654fc5f4134ec",0,0,0,0,0,""
20201215,"NE",149344,,650898,,"totalTestsViral",1562744,693,4831,,,,,84063,"12/14/2020 21:45","2020-12-14T21:45:00Z","12/14 16:45",1418,4831,,"2020-12-14T21:45:00Z",1562744,170271,1390721,,,,,800631,,,,,,,,,,,"31",483,836,800242,6217,800242,,45,35,"5db56f18f05b002f5454fb12b5b2caf1f9fb9fa9",0,0,0,0,0,""
20201214,"NE",148861,,650062,,"totalTestsViral",1556527,692,4796,,,,,82568,"12/13/2020 00:00","2020-12-13T00:00:00Z","12/12 19:00",1373,4796,,"2020-12-13T00:00:00Z",1556527,169441,1385350,,,,,799310,,,,,,,,,,,"31",1173,2034,798923,7912,798923,,8,12,"80644e980430e4b1293ef0fdc9fa070873518dd2",0,0,0,0,0,""
20201213,"NE",147688,,648028,,"totalTestsViral",1548615,711,4784,,,,,80829,"12/12/2020 21:00","2020-12-12T21:00:00Z","12/12 16:00",1365,4784,,"2020-12-12T21:00:00Z",1548615,168033,1378863,,,,,796100,,,,,,,,,,,"31",811,1488,795716,9214,795716,,22,19,"54e9e86f8626a0c96e45a45d69405e38a60e8f58",0,0,0,0,0,""
20201212,"NE",146877,,646540,,"totalTestsViral",1539401,759,4765,,,,,78906,"12/11/2020 21:15","2020-12-11T21:15:00Z","12/11 16:15",1343,4765,,"2020-12-11T21:15:00Z",1539401,167059,1370628,,,,,793796,,,,,,,,,,,"31",1103,3221,793417,15056,793417,,14,31,"d9856c24f6a71fca83613207491deefc7c98db31",0,0,0,0,0,""
20201211,"NE",145774,,643319,,"totalTestsViral",1524345,779,4734,,,,,76908,"12/10/2020 23:15","2020-12-10T23:15:00Z","12/10 18:15",1329,4734,,"2020-12-10T23:15:00Z",1524345,165348,1357312,,,,,789469,,,,,,,,,,,"31",1850,3546,789093,19052,789093,,35,35,"bbed1721bd6a88697c082b1a5c7bd8d995fa7da2",0,0,0,0,0,""
20201210,"NE",143924,,639773,,"totalTestsViral",1505293,781,4699,,,,,74597,"12/9/2020 23:15","2020-12-09T23:15:00Z","12/09 18:15",1294,4699,,"2020-12-09T23:15:00Z",1505293,163231,1340385,,,,,784072,,,,,,,,,,,"31",1321,1903,783697,13854,783697,,17,35,"e35c26836ffeacf170ecfd3374850527aa8e4d0f",0,0,0,0,0,""
20201209,"NE",142603,,637870,,"totalTestsViral",1491439,787,4664,,,,,73592,"12/8/2020 23:15","2020-12-08T23:15:00Z","12/08 18:15",1277,4664,,"2020-12-08T23:15:00Z",1491439,161776,1327997,,,,,780842,,,,,,,,,,,"31",1476,2504,780473,17098,780473,,41,45,"e826da7786285822f9771f11091a46054d4f0304",0,0,0,0,0,""
20201208,"NE",141127,,635366,,"totalTestsViral",1474341,810,4619,,,,,72583,"12/6/2020 23:45","2020-12-06T23:45:00Z","12/06 18:45",1236,4619,,"2020-12-06T23:45:00Z",1474341,159705,1312983,,,,,776856,,,,,,,,,,,"31",1293,1529,776493,9500,776493,,31,57,"c611d2d1d835d49e1b1a48a228315b970a69ffb0",0,0,0,0,0,""
20201207,"NE",139834,,633837,,"totalTestsViral",1464841,768,4562,,,,,71188,"12/6/2020 22:45","2020-12-06T22:45:00Z","12/06 17:45",1205,4562,,"2020-12-06T22:45:00Z",1464841,158132,1305054,,,,,774039,,,,,,,,,,,"31",1266,2098,773671,8473,773671,,11,15,"b5c98c68bd5e731f03a1540858e6fd0a750e69e9",0,0,0,0,0,""
20201206,"NE",138568,,631739,,"totalTestsViral",1456368,755,4547,,,,,69840,"12/5/2020 22:45","2020-12-05T22:45:00Z","12/05 17:45",1194,4547,,"2020-12-05T22:45:00Z",1456368,156729,1298009,,,,,770673,,,,,,,,,,,"31",2243,6185,770307,20591,770307,,8,41,"5f0057c7385edbb15d76c6cf55cc287c710fb6a2",0,0,0,0,0,""
20201205,"NE",136325,,625554,,"totalTestsViral",1435777,819,4506,,,,,68355,"12/4/2020 22:15","2020-12-04T22:15:00Z","12/04 17:15",1186,4506,,"2020-12-04T22:15:00Z",1435777,154875,1279277,,,,,762244,,,,,,,,,,,"31",1615,2432,761879,14074,761879,,27,27,"5b9b90390b39b26d3f8f821fdc2f02243b3c5d50",0,0,0,0,0,""
20201204,"NE",134710,,623122,,"totalTestsViral",1421703,845,4479,,,,,67336,"12/3/2020 23:15","2020-12-03T23:15:00Z","12/03 18:15",1159,4479,,"2020-12-03T23:15:00Z",1421703,153194,1266908,,,,,758194,,,,,,,,,,,"31",2180,2671,757832,15380,757832,,31,54,"659f8e9e850b744db0e8fdff10f9f6dd95105bc8",0,0,0,0,0,""
20201203,"NE",132530,,620451,,"totalTestsViral",1406323,853,4425,,,,,65740,"12/2/2020 23:00","2020-12-02T23:00:00Z","12/02 18:00",1128,4425,,"2020-12-02T23:00:00Z",1406323,150764,1253975,,,,,753338,,,,,,,,,,,"31",2336,2279,752981,20122,752981,,48,45,"53463f6f608548875da7b3dee8334b3c4e01ea67",0,0,0,0,0,""
20201202,"NE",130194,,618172,,"totalTestsViral",1386201,869,4380,,,,,64975,"12/2/2020 00:45","2020-12-02T00:45:00Z","12/01 19:45",1080,4380,,"2020-12-02T00:45:00Z",1386201,148080,1236550,,,,,748721,,,,,,,,,,,"31",1787,1855,748366,15866,748366,,62,64,"14ad70d8c3a46234a64e7107e4fd0525f44ab4b1",0,0,0,0,0,""
20201201,"NE",128407,,616317,,"totalTestsViral",1370335,907,4316,,,,,64485,"12/1/2020 00:00","2020-12-01T00:00:00Z","11/30 19:00",1018,4316,,"2020-12-01T00:00:00Z",1370335,146049,1222719,,,,,745080,,,,,,,,,,,"31",1941,2416,744724,16164,744724,,29,39,"63109b7b7b6eba3a72274930872d294b3275f56a",0,0,0,0,0,""
20201130,"NE",126466,,613901,,"totalTestsViral",1354171,896,4277,,,,,63562,"11/29/2020 23:00","2020-11-29T23:00:00Z","11/29 18:00",989,4277,,"2020-11-29T23:00:00Z",1354171,143941,1208672,,,,,740724,,,,,,,,,,,"31",1143,1372,740367,5945,740367,,0,31,"c715f34035eddadf2fe2cf94b0c24c2de5c80058",0,0,0,0,0,""
20201129,"NE",125323,,612529,,"totalTestsViral",1348226,911,4246,,,,,62686,"11/28/2020 22:30","2020-11-28T22:30:00Z","11/28 17:30",989,4246,,"2020-11-28T22:30:00Z",1348226,142643,1204041,,,,,738205,,,,,,,,,,,"31",1257,2115,737852,8881,737852,,5,30,"262a28a4b29631c738331760bd5e732bf3e24902",0,0,0,0,0,""
20201128,"NE",124066,,610414,,"totalTestsViral",1339345,931,4216,,,,,61605,"11/27/2020 22:30","2020-11-27T22:30:00Z","11/27 17:30",984,4216,,"2020-11-27T22:30:00Z",1339345,141216,1196600,,,,,734833,,,,,,,,,,,"31",1114,1725,734480,6744,734480,,2,24,"5a42f6497654b17ada7efd9454124a3e9e037416",0,0,0,0,0,""
20201127,"NE",122952,,608689,,"totalTestsViral",1332601,931,4192,,,,,60654,"11/26/2020 22:15","2020-11-26T22:15:00Z","11/26 17:15",982,4192,,"2020-11-26T22:15:00Z",1332601,139882,1191184,,,,,731994,,,,,,,,,,,"31",2876,5755,731641,18785,731641,,4,10,"9a811f8fde8a149534c7e85cd7584fdb4bdb7da2",0,0,0,0,0,""
20201126,"NE",120076,,602934,,"totalTestsViral",1313816,930,4182,,,,,59677,"11/26/2020 01:45","2020-11-26T01:45:00Z","11/25 20:45",978,4182,,"2020-11-26T01:45:00Z",1313816,137480,1174805,,,,,723363,,,,,,,,,,,"31",2394,3848,723010,21133,723010,,28,56,"1d16979c7f2c21dff79d2a5d34f82680a2f0a0f0",0,0,0,0,0,""
20201125,"NE",117682,,599086,,"totalTestsViral",1292683,936,4126,,,,,59002,"11/25/2020 01:45","2020-11-25T01:45:00Z","11/24 20:45",950,4126,,"2020-11-25T01:45:00Z",1292683,134930,1156248,,,,,717119,,,,,,,,,,,"31",1761,3036,716768,14773,716768,,16,77,"5d8bbb2bdb830a3a50ea4431383ab075fadf85d2",0,0,0,0,0,""
20201124,"NE",115921,,596050,,"totalTestsViral",1277910,971,4049,,,,,58686,"11/23/2020 22:00","2020-11-23T22:00:00Z","11/23 17:00",934,4049,,"2020-11-23T22:00:00Z",1277910,133020,1143389,,,,,712324,,,,,,,,,,,"31",1860,3353,711971,15347,711971,,25,86,"025967978d92ca13670b2b5dac57decbe3ccc49a",0,0,0,0,0,""
20201123,"NE",114061,,592697,,"totalTestsViral",1262563,976,3963,,,,,58057,"11/22/2020 22:00","2020-11-22T22:00:00Z","11/22 17:00",909,3963,,"2020-11-22T22:00:00Z",1262563,130994,1130083,,,,,707108,,,,,,,,,,,"31",1032,2037,706758,6796,706758,,4,19,"c68c2913d10f38d66c059c27804cffea866fe3c2",0,0,0,0,0,""
20201122,"NE",113029,,590660,,"totalTestsViral",1255767,963,3944,,,,,16068,"11/21/2020 11:00","2020-11-21T11:00:00Z","11/21 06:00",905,3944,,"2020-11-21T11:00:00Z",1255767,129834,1124456,,,,,704034,,,,,,,,,,,"31",1368,3481,703689,12514,703689,,8,29,"5e71f327ca62bf61d8607e6b9fb58d341647331e",0,0,0,0,0,""
20201121,"NE",111661,,587179,,"totalTestsViral",1243253,987,3915,,,,,56605,"11/20/2020 22:00","2020-11-20T22:00:00Z","11/20 17:00",897,3915,,"2020-11-20T22:00:00Z",1243253,128313,1113475,,,,,699186,,,,,,,,,,,"31",2381,4305,698840,21988,698840,,43,56,"b078ad9ef0a138a51d73a4aed53333bc71ce6910",0,0,0,0,0,""
20201120,"NE",109280,,582874,,"totalTestsViral",1221265,983,3859,,,,,55885,"11/19/2020 10:00","2020-11-19T10:00:00Z","11/19 05:00",854,3859,,"2020-11-19T10:00:00Z",1221265,125705,1094117,,,,,692494,,,,,,,,,,,"31",2663,3703,692154,18151,692154,,28,133,"826a57ebb24d4e66e2a081d30ec415882dc885bb",0,0,0,0,0,""
20201119,"NE",106617,,579171,,"totalTestsViral",1203114,961,3726,,,,,55037,"11/18/2020 08:00","2020-11-18T08:00:00Z","11/18 03:00",826,3726,,"2020-11-18T08:00:00Z",1203114,122779,1078907,,,,,686122,,,,,,,,,,,"31",2812,3991,685788,21919,685788,,10,0,"d9bc7cde0a59d9d09bc3800dff59850278000b9a",0,0,0,0,0,""
20201118,"NE",103805,,575180,,"totalTestsViral",1181195,978,3726,,,,,54604,"11/18/2020 00:42","2020-11-18T00:42:00Z","11/17 19:42",816,3726,,"2020-11-18T00:42:00Z",1181195,119710,1060089,,,,,679313,,,,,,,,,,,"31",2204,2642,678985,14952,678985,,19,75,"14fee01d2b8ea6421934dae41db2e00fa51123b5",0,0,0,0,0,""
20201117,"NE",101601,,572538,,"totalTestsViral",1166243,938,3651,,,,,54095,"11/16/2020 22:00","2020-11-16T22:00:00Z","11/16 17:00",797,3651,,"2020-11-16T22:00:00Z",1166243,117264,1047604,,,,,674471,,,,,,,,,,,"31",3440,5719,674139,28997,674139,,18,76,"5cad138bbf3992c566bee79163c187ee290a9ed1",0,0,0,0,0,""
20201116,"NE",98161,,566819,,"totalTestsViral",1137246,914,3575,,,,,53528,"11/15/2020 22:00","2020-11-15T22:00:00Z","11/15 17:00",779,3575,,"2020-11-15T22:00:00Z",1137246,113226,1022658,,,,,665310,,,,,,,,,,,"31",1327,2410,664980,7014,664980,,0,24,"496d84f46ca4a38de8a799303da281d2298f11ed",0,0,0,0,0,""
20201115,"NE",96834,,564409,,"totalTestsViral",1130232,889,3551,,,,,52511,"11/14/2020 22:00","2020-11-14T22:00:00Z","11/14 17:00",779,3551,,"2020-11-14T22:00:00Z",1130232,111754,1017117,,,,,661574,,,,,,,,,,,"31",1912,3372,661243,12973,661243,,4,29,"bf0eb47db56974f44aa832040cbf278baa269ae0",0,0,0,0,0,""
20201114,"NE",94922,,561037,,"totalTestsViral",1117259,918,3522,,,,,51928,"11/13/2020 22:00","2020-11-13T22:00:00Z","11/13 17:00",775,3522,,"2020-11-13T22:00:00Z",1117259,109695,1006218,,,,,656286,,,,,,,,,,,"31",2369,2931,655959,14882,655959,,19,62,"52c2a8157514a5aed3ad9a6b1bd5b9501b54b399",0,0,0,0,0,""
20201113,"NE",92553,,558106,,"totalTestsViral",1102377,905,3460,,,,,51017,"11/12/2020 22:00","2020-11-12T22:00:00Z","11/12 17:00",756,3460,,"2020-11-12T22:00:00Z",1102377,107120,993920,,,,,650985,,,,,,,,,,,"31",2611,3197,650659,16585,650659,,25,-21,"775c8267f6e42dd6dea26a0c5996c58db18cfde1",0,0,0,0,0,""
20201112,"NE",89942,,554909,,"totalTestsViral",1085792,885,3481,,,,,50148,"11/11/2020 00:00","2020-11-11T00:00:00Z","11/10 19:00",731,3481,,"2020-11-11T00:00:00Z",1085792,104283,980211,,,,,645173,,,,,,,,,,,"31",2209,3180,644851,14087,644851,,1,115,"3e0334094968c706d81aea1a5347458bb8873cb5",0,0,0,0,0,""
20201111,"NE",87733,,551729,,"totalTestsViral",1071705,860,3366,,,,,49761,"11/10/2020 22:00","2020-11-10T22:00:00Z","11/10 17:00",730,3366,,"2020-11-10T22:00:00Z",1071705,101873,968534,,,,,639788,,,,,,,,,,,"31",2182,3564,639462,22627,639462,,20,45,"ef9011123e4319322cf44e6d45b16e15c4a8e786",0,0,0,0,0,""
20201110,"NE",85551,,548165,,"totalTestsViral",1049078,820,3321,,,,,49314,"11/9/2020 22:00","2020-11-09T22:00:00Z","11/09 17:00",710,3321,,"2020-11-09T22:00:00Z",1049078,99481,948316,,,,,634040,,,,,,,,,,,"31",1582,1997,633716,9380,633716,,7,32,"271d20e5160b2dc6a30fe7f151649dc34993c252",0,0,0,0,0,""
20201109,"NE",83969,,546168,,"totalTestsViral",1039698,794,3289,,,,,48689,"11/8/2020 21:45","2020-11-08T21:45:00Z","11/08 16:45",703,3289,,"2020-11-08T21:45:00Z",1039698,97746,940672,,,,,630459,,,,,,,,,,,"31",1574,2276,630137,7423,630137,,0,9,"9cdb363414133668c574e57db20463fbef6104c5",0,0,0,0,0,""
20201108,"NE",82395,,543892,,"totalTestsViral",1032275,760,3280,,,,,47793,"11/7/2020 19:45","2020-11-07T19:45:00Z","11/07 14:45",703,3280,,"2020-11-07T19:45:00Z",1032275,95992,935011,,,,,626606,,,,,,,,,,,"31",1702,3053,626287,10429,626287,,2,34,"5eea28c55d254791b7cbd43d95387184045bf3e8",0,0,0,0,0,""
20201107,"NE",80693,,540839,,"totalTestsViral",1021846,748,3246,,,,,47259,"11/6/2020 21:45","2020-11-06T21:45:00Z","11/06 16:45",701,3246,,"2020-11-06T21:45:00Z",1021846,94166,926419,,,,,621852,,,,,,,,,,,"31",2681,4808,621532,21621,621532,,27,45,"f22cdf3ddb8660919a8e62a8a62c27378ff81569",0,0,0,0,0,""
20201106,"NE",78012,,536031,,"totalTestsViral",1000225,720,3201,,,,,45658,"11/5/2020 21:45","2020-11-05T21:45:00Z","11/05 16:45",674,3201,,"2020-11-05T21:45:00Z",1000225,91239,907738,,,,,614362,,,,,,,,,,,"31",2124,3615,614043,12727,614043,,5,53,"ad559ee458a0676dda3afb42e3dec5f194102ba8",0,0,0,0,0,""
20201105,"NE",75888,,532416,,"totalTestsViral",987498,698,3148,,,,,45772,"11/4/2020 21:45","2020-11-04T21:45:00Z","11/04 16:45",669,3148,,"2020-11-04T21:45:00Z",987498,88869,897377,,,,,608623,,,,,,,,,,,"31",1828,2586,608304,11966,608304,,9,26,"e9f48cb65ccae9b815649e58d8634ba85e2d0668",0,0,0,0,0,""
20201104,"NE",74060,,529830,,"totalTestsViral",975532,673,3122,,,,,45522,"11/3/2020 21:45","2020-11-03T21:45:00Z","11/03 16:45",660,3122,,"2020-11-03T21:45:00Z",975532,86884,887405,,,,,604209,,,,,,,,,,,"31",1440,2386,603890,15068,603890,,4,46,"9160fcf7a651d287597fa6aba6147db3737b4c27",0,0,0,0,0,""
20201103,"NE",72620,,527444,,"totalTestsViral",960464,642,3076,,,,,45108,"11/2/2020 22:45","2020-11-02T22:45:00Z","11/02 17:45",656,3076,,"2020-11-02T22:45:00Z",960464,85332,873886,,,,,600380,,,,,,,,,,,"31",954,1906,600064,9967,600064,,2,26,"14e87b8628b071f3251c89b2735e8bc185c9eb11",0,0,0,0,0,""
20201102,"NE",71666,,525538,,"totalTestsViral",950497,613,3050,,,,,44773,"11/2/2020 00:00","2020-11-02T00:00:00Z","11/01 19:00",654,3050,,"2020-11-02T00:00:00Z",950497,84310,864956,,,,,597520,,,,,,,,,,,"31",934,1838,597204,5319,597204,,2,8,"fe1b8facf703b1093ea2a529094df774fbe650f9",0,0,0,0,0,""
20201101,"NE",70732,,523700,,"totalTestsViral",945178,612,3042,,,,,44247,"10/31/2020 23:15","2020-10-31T23:15:00Z","10/31 19:15",652,3042,,"2020-10-31T23:15:00Z",945178,83285,860660,,,,,594749,,,,,,,,,,,"31",1087,2327,594432,7055,594432,,6,9,"2b225d3d25089ab6c5d330df05472e658551dc08",0,0,0,0,0,""
20201031,"NE",69645,,521373,,"totalTestsViral",938123,584,3033,,,,,43952,"10/30/2020 21:30","2020-10-30T21:30:00Z","10/30 17:30",646,3033,,"2020-10-30T21:30:00Z",938123,82081,854811,,,,,591333,,,,,,,,,,,"31",1495,3425,591018,17459,591018,,9,56,"834f9406299b3c924bde372ff8c6ca482eca3b08",0,0,0,0,0,""
20201030,"NE",68150,,517948,,"totalTestsViral",920664,528,2977,,,,,43516,"10/29/2020 21:30","2020-10-29T21:30:00Z","10/29 17:30",637,2977,,"2020-10-29T21:30:00Z",920664,80454,838992,,,,,586410,,,,,,,,,,,"31",1605,3764,586098,15374,586098,,9,27,"789ea56a7001b3f703a3e9d6b6386bcad8b30b55",0,0,0,0,0,""
20201029,"NE",66545,,514184,,"totalTestsViral",905290,483,2950,,,,,42850,"10/28/2020 22:00","2020-10-28T22:00:00Z","10/28 18:00",628,2950,,"2020-10-28T22:00:00Z",905290,78673,825406,,,,,581042,,,,,,,,,,,"31",1169,2537,580729,10905,580729,,8,45,"5b566fbf14d71ddbfb6e88f24afa3e51ecdda147",0,0,0,0,0,""
20201028,"NE",65376,,511647,,"totalTestsViral",894385,436,2905,,,,,42633,"10/28/2020 00:30","2020-10-28T00:30:00Z","10/27 20:30",620,2905,,"2020-10-28T00:30:00Z",894385,77406,815775,,,,,577338,,,,,,,,,,,"31",877,3386,577023,11765,577023,,17,30,"96f34f8b00a4a095448f64da123b7ffb56bf3b06",0,0,0,0,0,""
20201027,"NE",64499,,508261,,"totalTestsViral",882620,427,2875,,,,,42245,"10/26/2020 22:00","2020-10-26T22:00:00Z","10/26 18:00",603,2875,,"2020-10-26T22:00:00Z",882620,76425,804996,,,,,573076,,,,,,,,,,,"31",702,2224,572760,9055,572760,,7,29,"2a7b904500eb312e98e9d39537131e9395b6be69",0,0,0,0,0,""
20201026,"NE",63797,,506037,,"totalTestsViral",873565,435,2846,,,,,41930,"10/25/2020 21:15","2020-10-25T21:15:00Z","10/25 17:15",596,2846,,"2020-10-25T21:15:00Z",873565,75643,796729,,,,,570152,,,,,,,,,,,"31",582,1826,569834,4402,569834,,1,13,"31e2f4ccb75abce8b5116a2bf3e7e883a62705a7",0,0,0,0,0,""
20201025,"NE",63215,,504211,,"totalTestsViral",869163,436,2833,,,,,41364,"10/24/2020 21:15","2020-10-24T21:15:00Z","10/24 17:15",595,2833,,"2020-10-24T21:15:00Z",869163,75000,792969,,,,,567744,,,,,,,,,,,"31",705,2446,567426,6283,567426,,4,16,"776a54f8a2cc376cbfa2c33c693bd6a813e22180",0,0,0,0,0,""
20201024,"NE",62510,,501765,,"totalTestsViral",862880,426,2817,,,,,41008,"10/23/2020 21:30","2020-10-23T21:30:00Z","10/23 17:30",591,2817,,"2020-10-23T21:30:00Z",862880,74213,787484,,,,,564589,,,,,,,,,,,"31",1225,3742,564275,15611,564275,,4,34,"c91833d32df968867df56d23b26458a9f33225c8",0,0,0,0,0,""
20201023,"NE",61285,,498023,,"totalTestsViral",847269,389,2783,,,,,40494,"10/22/2020 21:15","2020-10-22T21:15:00Z","10/22 17:15",587,2783,,"2020-10-22T21:15:00Z",847269,72815,773277,,,,,559625,,,,,,,,,,,"31",977,3792,559308,10467,559308,,11,42,"34e280248ba54e1bc00ff40c0f2739ebafe98839",0,0,0,0,0,""
20201022,"NE",60308,,494231,,"totalTestsViral",836802,400,2741,,,,,39905,"10/21/2020 22:00","2020-10-21T22:00:00Z","10/21 18:00",576,2741,,"2020-10-21T22:00:00Z",836802,71719,763923,,,,,554857,,,,,,,,,,,"31",899,3718,554539,13898,554539,,11,35,"4232f4df49a8619e18b9240a399cb3f66ed9cbcb",0,0,0,0,0,""
20201021,"NE",59409,,490513,,"totalTestsViral",822904,380,2706,,,,,39687,"10/20/2020 22:30","2020-10-20T22:30:00Z","10/20 18:30",565,2706,,"2020-10-20T22:30:00Z",822904,70666,751071,,,,,550239,,,,,,,,,,,"31",592,2661,549922,12406,549922,,11,26,"3c05ddac8d7793a421ecdc9a7a79c50ff2f5bd71",0,0,0,0,0,""
20201020,"NE",58817,,487852,,"totalTestsViral",810498,380,2680,,,,,39313,"10/19/2020 22:00","2020-10-19T22:00:00Z","10/19 18:00",554,2680,,"2020-10-19T22:00:00Z",810498,69955,739379,,,,,546986,,,,,,,,,,,"31",749,2707,546669,10919,546669,,6,22,"02bfd117cd2b30fc7b05c940b320ae17edd635a9",0,0,0,0,0,""
20201019,"NE",58068,,485145,,"totalTestsViral",799579,343,2658,,,,,38956,"10/18/2020 21:00","2020-10-18T21:00:00Z","10/18 17:00",548,2658,,"2020-10-18T21:00:00Z",799579,69055,729099,,,,,543530,,,,,,,,,,,"31",734,3352,543213,7949,543213,,0,8,"caf35242f0bc440a465df3562e0806552351dc14",0,0,0,0,0,""
20201018,"NE",57334,,481793,,"totalTestsViral",791630,320,2650,,,,,38629,"10/17/2020 21:00","2020-10-17T21:00:00Z","10/17 17:00",548,2650,,"2020-10-17T21:00:00Z",791630,68235,721983,,,,,539442,,,,,,,,,,,"31",620,3160,539127,7195,539127,,1,3,"330c5048ec540bdc57bb8f390279409feb6ff2ed",0,0,0,0,0,""
20201017,"NE",56714,,478633,,"totalTestsViral",784435,322,2647,,,,,38083,"10/16/2020 21:55","2020-10-16T21:55:00Z","10/16 17:55",547,2647,,"2020-10-16T21:55:00Z",784435,67543,715487,,,,,535661,,,,,,,,,,,"31",1286,4795,535347,13928,535347,,12,16,"ea9795bd18347afe0125572fe94f90505f2072db",0,0,0,0,0,""
20201016,"NE",55428,,473838,,"totalTestsViral",770507,323,2631,,,,,37653,"10/15/2020 22:00","2020-10-15T22:00:00Z","10/15 18:00",535,2631,,"2020-10-15T22:00:00Z",770507,66100,703017,,,,,529581,,,,,,,,,,,"31",961,4528,529266,14047,529266,,5,38,"21bf35851090ad6b9b095e4ed61060cc9243a271",0,0,0,0,0,""
20201015,"NE",54467,,469310,,"totalTestsViral",756460,311,2593,,,,,37122,"10/14/2020 22:00","2020-10-14T22:00:00Z","10/14 18:00",530,2593,,"2020-10-14T22:00:00Z",756460,65022,690063,,,,,524094,,,,,,,,,,,"31",924,3442,523777,12277,523777,,3,38,"e4d3295fd10a0b4053aff682d6d8f13fa9081f83",0,0,0,0,0,""
20201014,"NE",53543,,465868,,"totalTestsViral",744183,315,2555,,,,,36950,"10/13/2020 21:00","2020-10-13T21:00:00Z","10/13 17:00",527,2555,,"2020-10-13T21:00:00Z",744183,63929,678890,,,,,519726,,,,,,,,,,,"31",704,3214,519411,9491,519411,,5,12,"973a95a6e8b8c2ec712ebdbd88a5e52045ad520e",0,0,0,0,0,""
20201013,"NE",52839,,462654,,"totalTestsViral",734692,299,2543,,,,,36734,"10/12/2020 21:00","2020-10-12T21:00:00Z","10/12 17:00",522,2543,,"2020-10-12T21:00:00Z",734692,63121,670224,,,,,515805,,,,,,,,,,,"31",457,3098,515493,6270,515493,,3,17,"b338db4c8ab1cd1d0529d1e021f5a42e819a343b",0,0,0,0,0,""
20201012,"NE",52382,,459556,,"totalTestsViral",728422,304,2526,,,,,36446,"10/11/2020 21:00","2020-10-11T21:00:00Z","10/11 17:00",519,2526,,"2020-10-11T21:00:00Z",728422,62628,664473,,,,,512249,,,,,,,,,,,"31",495,2522,511938,5172,511938,,0,0,"b1846ee42d86a28acf6ef2e4c2921a8abc43daf8",0,0,0,0,0,""
20201011,"NE",51887,,457034,,"totalTestsViral",723250,305,2526,,,,,36091,"10/11/2020 00:00","2020-10-11T00:00:00Z","10/10 20:00",519,2526,,"2020-10-11T00:00:00Z",723250,62066,659869,,,,,509233,,,,,,,,,,,"31",743,3746,508921,7558,508921,,0,27,"297b624b191f94c06461d1cc0907b4ba7fb12e0d",0,0,0,0,0,""
20201010,"NE",51144,,453288,,"totalTestsViral",715692,299,2499,,,,,36091,"10/10/2020 16:30","2020-10-10T16:30:00Z","10/10 12:30",519,2499,,"2020-10-10T16:30:00Z",715692,61254,653140,,,,,504746,,,,,,,,,,,"31",1085,8880,504432,19440,504432,,5,18,"b80b7eda2e68b230b30e1f11447e0bb05f1c0cb4",0,0,0,0,0,""
20201009,"NE",50059,,444408,,"totalTestsViral",696252,293,2481,,,,,35456,"10/8/2020 23:00","2020-10-08T23:00:00Z","10/08 19:00",514,2481,,"2020-10-08T23:00:00Z",696252,61002,633976,,,,,494780,,,,,,,,,,,"31",663,3674,494467,8563,494467,,7,13,"91e0165fe66a050f46424aad39c7cf53c603b708",0,0,0,0,0,""
20201008,"NE",49396,,440734,,"totalTestsViral",687689,288,2468,,,,,35295,"10/7/2020 22:57","2020-10-07T22:57:00Z","10/07 18:57",507,2468,,"2020-10-07T22:57:00Z",687689,61554,624880,,,,,490443,,,,,,,,,,,"31",639,3497,490130,12674,490130,,0,32,"c928b674014bf12b19f2813ae6f573a3b53963c3",0,0,0,0,0,""
20201007,"NE",48757,,437237,,"totalTestsViral",675015,262,2436,,,,,35052,"10/6/2020 20:35","2020-10-06T20:35:00Z","10/06 16:35",507,2436,,"2020-10-06T20:35:00Z",675015,58518,615248,,,,,486306,,,,,,,,,,,"31",498,4483,485994,11417,485994,,4,29,"27e8bc205c75507ad9c75f424b22a36a5a82cdf7",0,0,0,0,0,""
20201006,"NE",48259,,432754,,"totalTestsViral",663598,271,2407,,,,,34830,"10/5/2020 22:10","2020-10-05T22:10:00Z","10/05 18:10",503,2407,,"2020-10-05T22:10:00Z",663598,57938,604432,,,,,481328,,,,,,,,,,,"31",452,3609,481013,8067,481013,,2,10,"6f1b1674334d17ac665e84a831a71e4cf403094b",0,0,0,0,0,""
20201005,"NE",47807,,429145,,"totalTestsViral",655531,249,2397,,,,,34613,"10/4/2020 20:15","2020-10-04T20:15:00Z","10/04 16:15",501,2397,,"2020-10-04T20:15:00Z",655531,57437,596884,,,,,477266,,,,,,,,,,,"31",404,3195,476952,5663,476952,,4,9,"dc21e895e5b240f1edd94a5092f61318a663b253",0,0,0,0,0,""
20201004,"NE",47403,,425950,,"totalTestsViral",649868,249,2388,,,,,34395,"10/3/2020 21:15","2020-10-03T21:15:00Z","10/03 17:15",497,2388,,"2020-10-03T21:15:00Z",649868,56981,591688,,,,,473666,,,,,,,,,,,"31",426,2959,473353,5236,473353,,4,9,"a1466cc93217ef9c45a45d5590b811e2b497e9e7",0,0,0,0,0,""
20201003,"NE",46977,,422991,,"totalTestsViral",644632,232,2379,,,,,34090,"10/2/2020 20:15","2020-10-02T20:15:00Z","10/02 16:15",493,2379,,"2020-10-02T20:15:00Z",644632,56474,586964,,,,,470281,,,,,,,,,,,"31",792,4912,469968,9945,469968,,0,23,"278f7ed2613017ebe4eb9ab731b9fcf1ecc6e814",0,0,0,0,0,""
20201002,"NE",46185,,418079,,"totalTestsViral",634687,227,2356,,,,,33820,"10/1/2020 20:15","2020-10-01T20:15:00Z","10/01 16:15",493,2356,,"2020-10-01T20:15:00Z",634687,55568,577942,,,,,464576,,,,,,,,,,,"31",621,4101,464264,9733,464264,,15,7,"6805c4e5fe89bed8c165a7c7a562f2b80eeb0c33",0,0,0,0,0,""
20201001,"NE",45564,,413978,,"totalTestsViral",624954,226,2349,,,,,33362,"9/30/2020 20:45","2020-09-30T20:45:00Z","09/30 16:45",478,2349,,"2020-09-30T20:45:00Z",624954,54787,569018,,,,,459845,,,,,,,,,,,"31",520,3384,459542,6602,459542,,0,34,"46697af39b1500869de8b334de26a6b70943915c",0,0,0,0,0,""
20200930,"NE",45044,,410594,,"totalTestsViral",618352,215,2315,,,,,33198,"9/29/2020 20:30","2020-09-29T20:30:00Z","09/29 16:30",478,2315,,"2020-09-29T20:30:00Z",618352,54169,563045,,,,,455943,,,,,,,,,,,"31",466,2615,455638,7272,455638,,6,14,"f03b4a39c3683e76d02af376ebdc302c705e939a",0,0,0,0,0,""
20200929,"NE",44578,,407979,,"totalTestsViral",611080,214,2301,,,,,33087,"9/28/2020 21:15","2020-09-28T21:15:00Z","09/28 17:15",472,2301,,"2020-09-28T21:15:00Z",611080,53392,556572,,,,,452862,,,,,,,,,,,"31",515,3681,452557,4238,452557,,2,21,"fdd7b3d7a19797fbe857520c33277c500669f73e",0,0,0,0,0,""
20200928,"NE",44063,,404298,,"totalTestsViral",606842,224,2280,,,,,32824,"9/27/2020 20:30","2020-09-27T20:30:00Z","09/27 16:30",470,2280,,"2020-09-27T20:30:00Z",606842,53031,552696,,,,,448666,,,,,,,,,,,"31",467,2765,448361,5306,448361,,1,1,"f8165e6d0cf54cc03d5f1a9ea2aba1ce57419f17",0,0,0,0,0,""
20200927,"NE",43596,,401533,,"totalTestsViral",601536,226,2279,,,,,32584,"9/26/2020 20:30","2020-09-26T20:30:00Z","09/26 16:30",469,2279,,"2020-09-26T20:30:00Z",601536,52505,547931,,,,,445434,,,,,,,,,,,"31",434,4050,445129,6249,445129,,1,3,"e5dc773a059f26376cbd9f20dad3ba9a9c87714c",0,0,0,0,0,""
20200926,"NE",43162,,397483,,"totalTestsViral",595287,225,2276,,,,,32238,"9/25/2020 20:30","2020-09-25T20:30:00Z","09/25 16:30",468,2276,,"2020-09-25T20:30:00Z",595287,52014,542196,,,,,440947,,,,,,,,,,,"31",431,2910,440645,5078,440645,,6,17,"3d083fa85e067dff611aab2b687b8b05623681c8",0,0,0,0,0,""
20200925,"NE",42731,,394573,,"totalTestsViral",590209,231,2259,,,,,31774,"9/24/2020 20:44","2020-09-24T20:44:00Z","09/24 16:44",462,2259,,"2020-09-24T20:44:00Z",590209,51525,537626,,,,,437603,,,,,,,,,,,"31",453,2482,437304,5113,437304,,0,12,"9f446212a1981d6ed18a251b27e0f1c082d799f4",0,0,0,0,0,""
20200924,"NE",42278,,392091,,"totalTestsViral",585096,200,2247,,,,,31383,"9/23/2020 20:47","2020-09-23T20:47:00Z","09/23 16:47",462,2247,,"2020-09-23T20:47:00Z",585096,50979,533064,,,,,434669,,,,,,,,,,,"31",493,2774,434369,4956,434369,,1,33,"7fe8528f3d15ead6efcd6acfe752d9980190e24f",0,0,0,0,0,""
20200923,"NE",41785,,389317,,"totalTestsViral",580140,197,2214,,,,,31212,"9/22/2020 20:10","2020-09-22T20:10:00Z","09/22 16:10",461,2214,,"2020-09-22T20:10:00Z",580140,50411,528685,,,,,431401,,,,,,,,,,,"31",397,2659,431102,3696,431102,,9,6,"6c4b76320fa4b76c7a27d5c0e01a4bfe39b982a1",0,0,0,0,0,""
20200922,"NE",41388,,386658,,"totalTestsViral",576444,185,2208,,,,,31047,"9/21/2020 20:15","2020-09-21T20:15:00Z","09/21 16:15",452,2208,,"2020-09-21T20:15:00Z",576444,49986,525419,,,,,428341,,,,,,,,,,,"31",305,1925,428046,4420,428046,,10,14,"5956aebcffebfbeed6f30b37484ef1b05c6eea18",0,0,0,0,0,""
20200921,"NE",41083,,384733,,"totalTestsViral",572024,170,2194,,,,,30509,"9/20/2020 20:15","2020-09-20T20:15:00Z","09/20 16:15",442,2194,,"2020-09-20T20:15:00Z",572024,49609,521381,,,,,426110,,,,,,,,,,,"31",286,2170,425816,3667,425816,,0,0,"fe529630d07ae1fae64c117db5b6e02d06f6ac4d",0,0,0,0,0,""
20200920,"NE",40797,,382563,,"totalTestsViral",568357,174,2194,,,,,30509,"9/19/2020 20:15","2020-09-19T20:15:00Z","09/19 16:15",442,2194,,"2020-09-19T20:15:00Z",568357,49300,518025,,,,,423653,,,,,,,,,,,"31",410,2955,423360,5017,423360,,0,0,"ad48bd2b84104008e75fa85e1e7838a1554002f6",0,0,0,0,0,""
20200919,"NE",40387,,379608,,"totalTestsViral",563340,185,2194,,,,,30509,"9/18/2020 20:15","2020-09-18T20:15:00Z","09/18 16:15",442,2194,,"2020-09-18T20:15:00Z",563340,48820,513488,,,,,420291,,,,,,,,,,,"31",466,2954,419995,5583,419995,,0,13,"bbe88b664337d9a20932fa219ef162a6f9174764",0,0,0,0,0,""
20200918,"NE",39921,,376654,,"totalTestsViral",557757,188,2181,,,,,30254,"9/17/2020 20:15","2020-09-17T20:15:00Z","09/17 16:15",442,2181,,"2020-09-17T20:15:00Z",557757,48278,508454,,,,,416868,,,,,,,,,,,"31",502,3222,416575,5967,416575,,3,9,"8df0975640c266fd421544e09181591928a08009",0,0,0,0,0,""
20200917,"NE",39419,,373432,,"totalTestsViral",551790,176,2172,,,,,29966,"9/16/2020 20:15","2020-09-16T20:15:00Z","09/16 16:15",439,2172,,"2020-09-16T20:15:00Z",551790,47671,503094,,,,,413473,,,,,,,,,,,"31",449,3441,412851,5721,412851,,3,5,"053d1861882060597f4f3c4e38ff10cf87b57aec",0,0,0,0,0,""
20200916,"NE",38970,,369991,,"totalTestsViral",546069,167,2167,,,,,29799,"9/15/2020 20:05","2020-09-15T20:05:00Z","09/15 16:05",436,2167,,"2020-09-15T20:05:00Z",546069,47177,497868,,,,,409565,,,,,,,,,,,"31",328,1958,408961,3790,408961,,1,13,"f59e2eb56372256e3725051c50c858cc89e77216",0,0,0,0,0,""
20200915,"NE",38642,,368033,,"totalTestsViral",542279,176,2154,,,,,29597,"9/14/2020 22:10","2020-09-14T22:10:00Z","09/14 18:10",435,2154,,"2020-09-14T22:10:00Z",542279,46778,494481,,,,,407270,,,,,,,,,,,"31",307,2403,406675,3979,406675,,1,15,"6d76f85e9a11dd8e5be930b45f941379a0e7553a",0,0,0,0,0,""
20200914,"NE",38335,,365630,,"totalTestsViral",538300,169,2139,,,,,29405,"9/14/2020 14:00","2020-09-14T14:00:00Z","09/14 10:00",434,2139,,"2020-09-14T14:00:00Z",538300,46431,490851,,,,,404546,,,,,,,,,,,"31",227,3054,403965,4640,403965,,0,2,"b5d8686f242e6f21586ee787b23c0282055e2118",0,0,0,0,0,""
20200913,"NE",38108,,362576,,"totalTestsViral",533660,163,2137,,,,,29167,"9/12/2020 20:15","2020-09-12T20:15:00Z","09/12 16:15",434,2137,,"2020-09-12T20:15:00Z",533660,46179,486466,,,,,401253,,,,,,,,,,,"31",267,3063,400684,4909,400684,,0,6,"24ef0de07096ed360864ae8e2ac77b61594ca96e",0,0,0,0,0,""
20200912,"NE",37841,,359513,,"totalTestsViral",528751,166,2131,,,,,28816,"9/11/2020 20:30","2020-09-11T20:30:00Z","09/11 16:30",434,2131,,"2020-09-11T20:30:00Z",528751,45868,481871,,,,,397904,,,,,,,,,,,"31",468,3074,397354,5737,397354,,4,12,"461ecfa7f1555b762b9a53e17f8385812c908a09",0,0,0,0,0,""
20200911,"NE",37373,,356439,,"totalTestsViral",523014,178,2119,,,,,28513,"9/10/2020 20:10","2020-09-10T20:10:00Z","09/10 16:10",430,2119,,"2020-09-10T20:10:00Z",523014,45320,476686,,,,,394342,,,,,,,,,,,"31",456,3038,393812,5765,393812,,9,11,"d8832f4a7b0df6bff6234e0c74871db85e386fd8",0,0,0,0,0,""
20200910,"NE",36917,,353401,,"totalTestsViral",517249,182,2108,,,,,28175,"9/9/2020 20:10","2020-09-09T20:10:00Z","09/09 16:10",421,2108,,"2020-09-09T20:10:00Z",517249,44810,471433,,,,,390832,,,,,,,,,,,"31",440,4529,390318,5528,390318,,15,19,"3f59a180324affc99ef48c040e22d7c4736dd0d7",0,0,0,0,0,""
20200909,"NE",36477,,348872,,"totalTestsViral",511721,179,2089,,,,,28051,"9/8/2020 20:15","2020-09-08T20:15:00Z","09/08 16:15",406,2089,,"2020-09-08T20:15:00Z",511721,44393,466326,,,,,385852,,,,,,,,,,,"31",502,6547,385349,11552,385349,,2,10,"724e7be1fc89d899eec5e82263d5fd01e8b7bf03",0,0,0,0,0,""
20200908,"NE",35975,,342325,,"totalTestsViral",500169,172,2079,,,,,27921,"9/7/2020 20:10","2020-09-07T20:10:00Z","09/07 16:10",404,2079,,"2020-09-07T20:10:00Z",500169,43743,455426,,,,,378793,,,,,,,,,,,"31",89,750,378300,1033,378300,,0,11,"56f15dde37878d742a684402a02a114ad5e96ea7",0,0,0,0,0,""
20200907,"NE",35886,,341575,,"totalTestsViral",499136,175,2068,,,,,27710,"9/6/2020 20:10","2020-09-06T20:10:00Z","09/06 16:10",404,2068,,"2020-09-06T20:10:00Z",499136,43661,454475,,,,,377939,,,,,,,,,,,"31",81,552,377461,1298,377461,,0,3,"fb345ec98179ae8513090b6c4b606b23190a216e",0,0,0,0,0,""
20200906,"NE",35805,,341023,,"totalTestsViral",497838,176,2065,,,,,27473,"9/5/2020 20:10","2020-09-05T20:10:00Z","09/05 16:10",404,2065,,"2020-09-05T20:10:00Z",497838,43530,453309,,,,,377290,,,,,,,,,,,"31",144,1160,376828,1840,376828,,0,5,"9be1e68fef80cfccf7653b5f5185d9d4bb61034d",0,0,0,0,0,""
20200905,"NE",35661,,339863,,"totalTestsViral",495998,174,2060,,,,,26973,"9/4/2020 20:10","2020-09-04T20:10:00Z","09/04 16:10",404,2060,,"2020-09-04T20:10:00Z",495998,43375,451629,,,,,375973,,,,,,,,,,,"31",192,1740,375524,2922,375524,,0,27,"5133ed5b2bc8f78269ba8fcf22a57c9ae8cbb049",0,0,0,0,0,""
20200904,"NE",35469,,338123,,"totalTestsViral",493076,162,2033,,,,,26766,"9/3/2020 20:30","2020-09-03T20:30:00Z","09/03 16:30",404,2033,,"2020-09-03T20:30:00Z",493076,43147,448935,,,,,374035,,,,,,,,,,,"31",474,4153,373592,5257,373592,,5,6,"85f00b96978220dec979661d1453b441ca7726aa",0,0,0,0,0,""
20200903,"NE",34995,,333970,,"totalTestsViral",487819,172,2027,,,,,26466,"9/2/2020 20:30","2020-09-02T20:30:00Z","09/02 16:30",399,2027,,"2020-09-02T20:30:00Z",487819,42704,444127,,,,,369391,,,,,,,,,,,"31",421,2903,368965,5158,368965,,0,13,"2320daff4b04eaa0ecb4a12ea3aa1a0ac8d3b607",0,0,0,0,0,""
20200902,"NE",34574,,331067,,"totalTestsViral",482661,162,2014,,,,,26363,"9/1/2020 20:30","2020-09-01T20:30:00Z","09/01 16:30",399,2014,,"2020-09-01T20:30:00Z",482661,42215,439461,,,,,366056,,,,,,,,,,,"31",287,2279,365641,3606,365641,,2,8,"fd29e6c45bccb5e422fd0d3196255df58a075f1d",0,0,0,0,0,""
20200901,"NE",34287,,328788,,"totalTestsViral",479055,161,2006,,,,,26177,"8/31/2020 21:45","2020-08-31T21:45:00Z","08/31 17:45",397,2006,,"2020-08-31T21:45:00Z",479055,41883,436188,,,,,363617,,,,,,,,,,,"31",241,1483,363075,2782,363075,,5,12,"ebdaefebf38e93b670e7ddbaef6ab7dfe6ab4bc3",0,0,0,0,0,""
20200831,"NE",34046,,327305,,"totalTestsViral",476273,172,1994,,,,,25969,"8/30/2020 20:30","2020-08-30T20:30:00Z","08/30 16:30",392,1994,,"2020-08-30T20:30:00Z",476273,41592,433700,,,,,361878,,,,,,,,,,,"31",293,3113,361351,4775,361351,,0,2,"b0e9f1f76ff9b1cf402315aabadd6fd68e1408a7",0,0,0,0,0,""
20200830,"NE",33753,,324192,,"totalTestsViral",471498,172,1992,,,,,25727,"8/29/2020 20:20","2020-08-29T20:20:00Z","08/29 16:20",392,1992,,"2020-08-29T20:20:00Z",471498,41264,429254,,,,,358468,,,,,,,,,,,"31",317,2410,357945,4242,357945,,0,10,"056ea49dee5d875722a5d6a1c4e727f8b01f8efa",0,0,0,0,0,""
20200829,"NE",33436,,321782,,"totalTestsViral",467256,168,1982,,,,,25282,"8/28/2020 20:20","2020-08-28T20:20:00Z","08/28 16:20",392,1982,,"2020-08-28T20:20:00Z",467256,40879,425399,,,,,355731,,,,,,,,,,,"31",335,2464,355218,4332,355218,,1,14,"3486b132ecf0dd6ac8b7178ccb5a4a0a5478d2e2",0,0,0,0,0,""
20200828,"NE",33101,,319318,,"totalTestsViral",462924,174,1968,,,,,25009,"8/27/2020 20:25","2020-08-27T20:25:00Z","08/27 16:25",391,1968,,"2020-08-27T20:25:00Z",462924,40483,421468,,,,,352922,,,,,,,,,,,"31",374,3470,352419,5973,352419,,5,14,"da5355e06e55df3f1df5dec0067711eac6241cdf",0,0,0,0,0,""
20200827,"NE",32727,,315848,,"totalTestsViral",456951,166,1954,,,,,24689,"8/26/2020 20:20","2020-08-26T20:20:00Z","08/26 16:20",386,1954,,"2020-08-26T20:20:00Z",456951,40019,415962,,,,,349055,,,,,,,,,,,"31",379,3436,348575,5718,348575,,3,8,"5ac6da1e19d5fe1f133d573c975b408b46aa99ea",0,0,0,0,0,""
20200826,"NE",32348,,312412,,"totalTestsViral",451233,168,1946,,,,,24524,"8/25/2020 20:20","2020-08-25T20:20:00Z","08/25 16:20",383,1946,,"2020-08-25T20:20:00Z",451233,39559,410704,,,,,345243,,,,,,,,,,,"31",301,3978,344760,1934,344760,,0,16,"7c6e5a85f0332aaf8d0aad4c7dc1a5b55cb6659c",0,0,0,0,0,""
20200825,"NE",32047,,308434,,"totalTestsViral",449299,154,1930,,,,,24326,"8/24/2020 21:30","2020-08-24T21:30:00Z","08/24 17:30",383,1930,,"2020-08-24T21:30:00Z",449299,39369,408963,,,,,340958,,,,,,,,,,,"31",158,723,340481,5774,340481,,5,20,"fd62ca23b7bb25e97ee9e30aa92dc05ff2be7860",0,0,0,0,0,""
20200824,"NE",31889,,307711,,"totalTestsViral",443525,146,1910,,,,,24155,"8/23/2020 20:20","2020-08-23T20:20:00Z","08/23 16:20",378,1910,,"2020-08-23T20:20:00Z",443525,39027,403533,,,,,340076,,,,,,,,,,,"31",109,1130,339600,1939,339600,,2,3,"84f83668c67db03c5b333e7069d589594186af65",0,0,0,0,0,""
20200823,"NE",31780,,306581,,"totalTestsViral",441586,139,1907,,,,,23878,"8/22/2020 20:20","2020-08-22T20:20:00Z","08/22 16:20",376,1907,,"2020-08-22T20:20:00Z",441586,38889,401732,,,,,338836,,,,,,,,,,,"31",154,1625,338361,2688,338361,,0,16,"fa6304386693b3c70cd57b7e993ac0f866807f77",0,0,0,0,0,""
20200822,"NE",31626,,304956,,"totalTestsViral",438898,140,1891,,,,,23608,"8/21/2020 20:20","2020-08-21T20:20:00Z","08/21 16:20",376,1891,,"2020-08-21T20:20:00Z",438898,38712,399222,,,,,337058,,,,,,,,,,,"31",278,2537,336582,3931,336582,,3,14,"a1f08c1f63f824b45c76a42524129aeb647bde34",0,0,0,0,0,""
20200821,"NE",31348,,302419,,"totalTestsViral",434967,146,1877,,,,,23292,"8/20/2020 20:20","2020-08-20T20:20:00Z","08/20 16:20",373,1877,,"2020-08-20T20:20:00Z",434967,38378,395632,,,,,334241,,,,,,,,,,,"31",308,3051,333767,4421,333767,,2,26,"106ca37e36be171ed29c980a5e0fc06d0b2a99dc",0,0,0,0,0,""
20200820,"NE",31040,,299368,,"totalTestsViral",430546,156,1851,,,,,22941,"8/19/2020 20:20","2020-08-19T20:20:00Z","08/19 16:20",371,1851,,"2020-08-19T20:20:00Z",430546,38056,391534,,,,,330704,,,,,,,,,,,"31",215,1815,330408,4157,330408,,3,16,"a3e14a684ecbc2a0aecb6cfa7283282b11fa6d26",0,0,0,0,0,""
20200819,"NE",30825,,297553,,"totalTestsViral",426389,160,1835,,,,,22798,"8/18/2020 21:05","2020-08-18T21:05:00Z","08/18 17:05",368,1835,,"2020-08-18T21:05:00Z",426389,37738,387702,,,,,328673,,,,,,,,,,,"31",262,2629,328378,4159,328378,,6,-48,"a3ddacb689c1a9e0f433eab4233c8c203ee41953",0,0,0,0,0,""
20200818,"NE",30563,,294924,,"totalTestsViral",422230,158,1883,,,,,22647,"8/17/2020 20:20","2020-08-17T20:20:00Z","08/17 16:20",362,1883,,"2020-08-17T20:20:00Z",422230,37435,383848,,,,,325782,,,,,,,,,,,"31",191,2305,325487,2184,325487,,1,0,"b2af86d42e659f03947bf3f49b4bc96f0a2ddbf1",0,0,0,0,0,""
20200817,"NE",30372,,292619,,"totalTestsViral",420046,146,1883,,,,,22483,"8/16/2020 20:30","2020-08-16T20:30:00Z","08/16 16:30",361,1883,,"2020-08-16T20:30:00Z",420046,37249,381854,,,,,323287,,,,,,,,,,,"31",131,1984,322991,4436,322991,,0,0,"23fe4a453cc768f534e16aa1d31004aeed9d158a",0,0,0,0,0,""
20200816,"NE",30241,,290635,,"totalTestsViral",415610,144,1883,,,,,22251,"8/15/2020 20:20","2020-08-15T20:20:00Z","08/15 16:20",361,1883,,"2020-08-15T20:20:00Z",415610,37018,377649,,,,,321172,,,,,,,,,,,"31",253,2940,320876,4610,320876,,0,3,"43f65ed7777f52675c3f5ee8626eff0b80719513",0,0,0,0,0,""
20200815,"NE",29988,,287695,,"totalTestsViral",411000,145,1880,,,,,22004,"8/14/2020 20:23","2020-08-14T20:23:00Z","08/14 16:23",361,1880,,"2020-08-14T20:23:00Z",411000,36701,373363,,,,,317977,,,,,,,,,,,"31",328,3131,317683,4412,317683,,1,0,"584d804f429ed80be923ea222137cfd58de48e62",0,0,0,0,0,""
20200814,"NE",29660,,284564,,"totalTestsViral",406588,147,1880,,,,,21463,"8/13/2020 20:15","2020-08-13T20:15:00Z","08/13 16:15",360,1880,,"2020-08-13T20:15:00Z",406588,36307,369348,,,,,314516,,,,,,,,,,,"31",416,4164,314224,5048,314224,,4,0,"82dfe83adf214118a9450bb24be429ed31bee3c6",0,0,0,0,0,""
20200813,"NE",29244,,280400,,"totalTestsViral",401540,152,1880,,,,,21463,"8/12/2020 20:30","2020-08-12T20:30:00Z","08/12 16:30",356,1880,,"2020-08-12T20:30:00Z",401540,35905,364709,,,,,309938,,,,,,,,,,,"31",214,968,309644,3077,309644,,5,0,"2a266d77d0624db92be4a94267e1a6d0a58800e5",0,0,0,0,0,""
20200812,"NE",29030,,279432,,"totalTestsViral",398463,157,1880,,,,,21312,"8/11/2020 19:15","2020-08-11T19:15:00Z","08/11 15:15",351,1880,,"2020-08-11T19:15:00Z",398463,35635,361907,,,,,308755,,,,,,,,,,,"31",334,2396,308462,4142,308462,,3,139,"6a2dcea0f11b5f3d10913c3af44e340e170ade16",0,0,0,0,0,""
20200811,"NE",28696,,277036,,"totalTestsViral",394321,162,1741,,,,,21113,"8/10/2020 15:20","2020-08-10T15:20:00Z","08/10 11:20",348,1741,,"2020-08-10T15:20:00Z",394321,35220,358186,,,,,306023,,,,,,,,,,,"31",264,2833,305732,4499,305732,,3,19,"3b7f2cd7ce004255aed770ea937be975f9181cf9",0,0,0,0,0,""
20200810,"NE",28432,,274203,,"totalTestsViral",389822,146,1722,,,,,20896,"8/9/2020 15:20","2020-08-09T15:20:00Z","08/09 11:20",345,1722,,"2020-08-09T15:20:00Z",389822,34886,354027,,,,,302926,,,,,,,,,,,"31",187,2774,302635,4262,302635,,0,7,"1364c84526f9c1bf07d8663413b128c9c8ff4b80",0,0,0,0,0,""
20200809,"NE",28245,,271429,,"totalTestsViral",385560,147,1715,,,,,20746,"8/8/2020 22:45","2020-08-08T22:45:00Z","08/08 18:45",345,1715,,"2020-08-08T22:45:00Z",385560,34649,350003,,,,,299967,,,,,,,,,,,"31",141,1995,299674,2859,299674,,0,11,"00d01a84affcaf652120096ed69b80d5c40cac04",0,0,0,0,0,""
20200808,"NE",28104,,269434,,"totalTestsViral",382701,156,1704,,,,,20333,"8/7/2020 20:15","2020-08-07T20:15:00Z","08/07 16:15",345,1704,,"2020-08-07T20:15:00Z",382701,34472,347323,,,,,297832,,,,,,,,,,,"31",283,3353,297538,3756,297538,,5,16,"f110ccd27224f3229b3e20780a035d7f0497d7f3",0,0,0,0,0,""
20200807,"NE",27821,,266081,,"totalTestsViral",378945,151,1688,,,,,20176,"8/6/2020 20:15","2020-08-06T20:15:00Z","08/06 16:15",340,1688,,"2020-08-06T20:15:00Z",378945,34224,343825,,,,,294198,,,,,,,,,,,"31",332,3389,293902,5802,293902,,5,7,"cdea4d4616407d7bb34e5467e2b24f9c815e2535",0,0,0,0,0,""
20200806,"NE",27489,,262692,,"totalTestsViral",373143,148,1681,,,,,19885,"8/5/2020 20:30","2020-08-05T20:30:00Z","08/05 16:30",335,1681,,"2020-08-05T20:30:00Z",373143,33756,338496,,,,,290477,,,,,,,,,,,"31",311,2765,290181,5392,290181,,3,37,"1f3ebc628012a1f3f91083e5ddd29659b5ad9983",0,0,0,0,0,""
20200805,"NE",27178,,259927,,"totalTestsViral",367751,151,1644,,,,,19764,"8/4/2020 20:30","2020-08-04T20:30:00Z","08/04 16:30",332,1644,,"2020-08-04T20:30:00Z",367751,33354,333519,,,,,287394,,,,,,,,,,,"31",222,3024,287105,3159,287105,,0,0,"859e1a396ec8be45f1bd1e9812b9885b3846656d",0,0,0,0,0,""
20200804,"NE",26956,,256903,,"totalTestsViral",364592,152,1644,,,,,19677,"8/3/2020 20:35","2020-08-03T20:35:00Z","08/03 16:35",332,1644,,"2020-08-03T20:35:00Z",364592,33090,330640,,,,,284145,,,,,,,,,,,"31",254,2499,283859,3124,283859,,0,14,"bd1f55e72dbaae157f87d304f33b52387d793f57",0,0,0,0,0,""
20200803,"NE",26702,,254404,,"totalTestsViral",361468,144,1630,,,,,19575,"8/2/2020 20:10","2020-08-02T20:10:00Z","08/02 16:10",332,1630,,"2020-08-02T20:10:00Z",361468,32786,327822,,,,,281387,,,,,,,,,,,"31",311,3552,281106,4903,281106,,0,1,"f9202222bb67f7c20f808d2cc8eefda70c72775c",0,0,0,0,0,""
20200802,"NE",26391,,250852,,"totalTestsViral",356565,142,1629,,,,,19325,"8/1/2020 20:10","2020-08-01T20:10:00Z","08/01 16:10",332,1629,,"2020-08-01T20:10:00Z",356565,32460,323249,,,,,277526,,,,,,,,,,,"31",180,1804,277243,4744,277243,,0,7,"0e273e729eb7817c4a312afa3fdb30ec7b60729d",0,0,0,0,0,""
20200801,"NE",26211,,249048,,"totalTestsViral",351821,152,1622,,,,,19172,"7/31/2020 20:10","2020-07-31T20:10:00Z","07/31 16:10",332,1622,,"2020-07-31T20:10:00Z",351821,32142,318824,,,,,275544,,,,,,,,,,,"31",445,3858,275259,4403,275259,,4,12,"a99265a5296bdfdff15a3fdfc448cb289c1cce8b",0,0,0,0,0,""
20200731,"NE",25766,,245190,,"totalTestsViral",347418,150,1610,,,,,18997,"7/29/2020 21:00","2020-07-29T21:00:00Z","07/29 17:00",328,1610,,"2020-07-29T21:00:00Z",347418,31707,314873,,,,,271245,,,,,,,,,,,"31",344,3719,270956,5885,270956,,4,0,"90c1fc6f8ff0a32cb318a416be3352163d00eac1",0,0,0,0,0,""
20200730,"NE",25422,,241471,,"totalTestsViral",341533,137,1610,,,,,18802,"7/29/2020 20:20","2020-07-29T20:20:00Z","07/29 16:20",324,1610,,"2020-07-29T20:20:00Z",341533,31216,309489,,,,,267177,,,,,,,,,,,"31",265,2595,266893,3523,266893,,3,4,"94ef14702eaca9b3c8ed92c39c3efff27298c75c",0,0,0,0,0,""
20200729,"NE",25157,,238876,,"totalTestsViral",338010,122,1606,,,,,18702,"7/28/2020 20:10","2020-07-28T20:10:00Z","07/28 16:10",321,1606,,"2020-07-28T20:10:00Z",338010,30910,306284,,,,,264313,,,,,,,,,,,"31",258,2672,264033,5561,264033,,4,19,"7d68e95683773106faf03bbe5bdaafd6e7d1182d",0,0,0,0,0,""
20200728,"NE",24899,,236204,,"totalTestsViral",332449,117,1587,,,,,18520,"7/27/2020 20:10","2020-07-27T20:10:00Z","07/27 16:10",317,1587,,"2020-07-27T20:10:00Z",332449,30501,301136,,,,,261383,,,,,,,,,,,"31",281,1995,261103,3029,261103,,1,17,"cff00fd48677b5230384249976d615ea6105ca1f",0,0,0,0,0,""
20200727,"NE",24618,,234209,,"totalTestsViral",329420,109,1570,,,,,18097,"7/26/2020 19:15","2020-07-26T19:15:00Z","07/26 15:15",316,1570,,"2020-07-26T19:15:00Z",329420,30148,298461,,,,,259105,,,,,,,,,,,"31",223,3140,258827,3841,258827,,0,3,"1b0555e380851bb532a091937f6a62a5ad4d0741",0,0,0,0,0,""
20200726,"NE",24395,,231069,,"totalTestsViral",325579,103,1567,,,,,18097,"7/25/2020 20:05","2020-07-25T20:05:00Z","07/25 16:05",316,1567,,"2020-07-25T20:05:00Z",325579,29911,294864,,,,,255740,,,,,,,,,,,"31",221,2638,255464,3583,255464,,0,19,"ba942f090c7f830889231ffe510b8d84d668d81a",0,0,0,0,0,""
20200725,"NE",24174,,228431,,"totalTestsViral",321996,122,1548,,,,,17999,"7/24/2020 20:05","2020-07-24T20:05:00Z","07/24 16:05",316,1548,,"2020-07-24T20:05:00Z",321996,29657,291539,,,,,252881,,,,,,,,,,,"31",356,3175,252605,5844,252605,,0,0,"de19f3cee67b0f9fd6c6d3dedca764271826ca66",0,0,0,0,0,""
20200724,"NE",23818,,225256,,"totalTestsViral",316152,126,1548,,,,,17745,"7/23/2020 20:10","2020-07-23T20:10:00Z","07/23 16:10",316,1548,,"2020-07-23T20:10:00Z",316152,29208,286153,,,,,249344,,,,,,,,,,,"31",332,3169,249074,4473,249074,,5,26,"01ca21969014e2bbbbb1229016fb981ca4b56dd0",0,0,0,0,0,""
20200723,"NE",23486,,222087,,"totalTestsViral",311679,125,1522,,,,,17499,"7/22/2020 20:20","2020-07-22T20:20:00Z","07/22 16:20",311,1522,,"2020-07-22T20:20:00Z",311679,28823,282068,,,,,245843,,,,,,,,,,,"31",296,2656,245573,4211,245573,,1,14,"9f81f7890ef19d323dcca3205dfc99b693fa169e",0,0,0,0,0,""
20200722,"NE",23190,,219431,,"totalTestsViral",307468,118,1508,,,,,17389,"7/21/2020 20:30","2020-07-21T20:30:00Z","07/21 16:30",310,1508,,"2020-07-21T20:30:00Z",307468,28419,278266,,,,,242889,,,,,,,,,,,"31",343,3837,242621,6691,242621,,4,6,"084133d0c21a51ac59ad8281fad6321ba657ac8a",0,0,0,0,0,""
20200721,"NE",22847,,215594,,"totalTestsViral",300777,115,1502,,,,,17237,"7/21/2020 00:00","2020-07-21T00:00:00Z","07/20 20:00",306,1502,,"2020-07-21T00:00:00Z",300777,27991,272028,,,,,238692,,,,,,,,,,,"31",264,3281,238441,4406,238441,,5,20,"4dac61a39b5591947fe17147b1a7574b251d6b45",0,0,0,0,0,""
20200720,"NE",22583,,212313,,"totalTestsViral",296371,121,1482,,,,,17112,"7/19/2020 20:00","2020-07-19T20:00:00Z","07/19 16:00",301,1482,,"2020-07-19T20:00:00Z",296371,27632,267985,,,,,235149,,,,,,,,,,,"31",102,2393,234896,2890,234896,,0,1,"2ef0987835887395460db5897b5f1af69163b862",0,0,0,0,0,""
20200719,"NE",22481,,209920,,"totalTestsViral",293481,113,1481,,,,,16801,"7/18/2020 20:00","2020-07-18T20:00:00Z","07/18 16:00",301,1481,,"2020-07-18T20:00:00Z",293481,27538,265190,,,,,232654,,,,,,,,,,,"31",120,1130,232401,2836,232401,,0,1,"e89ca5b027745f7a46e9d22f7a97428ccb8948cc",0,0,0,0,0,""
20200718,"NE",22361,,208790,,"totalTestsViral",290645,105,1480,,,,,16665,"7/17/2020 20:00","2020-07-17T20:00:00Z","07/17 16:00",301,1480,,"2020-07-17T20:00:00Z",290645,27399,262493,,,,,231407,,,,,,,,,,,"31",227,4728,231151,4832,231151,,2,27,"7b3023c49e8676c7f84aa12e83e0e78905f71304",0,0,0,0,0,""
20200717,"NE",22134,,204062,,"totalTestsViral",285813,96,1453,,,,,16501,"7/16/2020 20:30","2020-07-16T20:30:00Z","07/16 16:30",299,1453,,"2020-07-16T20:30:00Z",285813,27134,257927,,,,,226452,,,,,,,,,,,"31",155,2812,226196,3801,226196,,8,0,"2d03176dc49803a8cba384cfb0e44eaa0a52c717",0,0,0,0,0,""
20200716,"NE",21979,,201250,,"totalTestsViral",282012,103,1453,,,,,16324,"7/15/2020 21:00","2020-07-15T21:00:00Z","07/15 17:00",291,1453,,"2020-07-15T21:00:00Z",282012,26917,254354,,,,,223482,,,,,,,,,,,"31",262,3224,223229,4716,223229,,5,11,"7d1a8f14596978f000c19bb5e478d5a7772d0344",0,0,0,0,0,""
20200715,"NE",21717,,198026,,"totalTestsViral",277296,110,1442,,,,,16205,"7/14/2020 20:05","2020-07-14T20:05:00Z","07/14 16:05",286,1442,,"2020-07-14T20:05:00Z",277296,26617,249941,,,,,219996,,,,,,,,,,,"31",318,3190,219743,5158,219743,,-2,11,"3a702a06dd81fdd5b592bc06b08867bba2f94b08",0,0,0,0,0,""
20200714,"NE",21399,,194836,,"totalTestsViral",272138,101,1431,,,,,16025,"7/13/2020 08:05","2020-07-13T08:05:00Z","07/13 04:05",288,1431,,"2020-07-13T08:05:00Z",272138,26291,245118,,,,,216481,,,,,,,,,,,"31",227,4349,216235,4438,216235,,3,10,"32382cda0c9afc344ae80ddf457b267bfe7dbe53",0,0,0,0,0,""
20200713,"NE",21172,,190487,,"totalTestsViral",267700,98,1421,,,,,15860,"7/13/2020 00:00","2020-07-13T00:00:00Z","07/12 20:00",285,1421,,"2020-07-13T00:00:00Z",267700,26005,240972,,,,,211901,,,,,,,,,,,"31",174,3382,211659,5416,211659,,0,0,"3025c93d3f63766568337091e604954c0b715bb2",0,0,0,0,0,""
20200712,"NE",20998,,187105,,"totalTestsViral",262284,95,1421,,,,,15724,"7/11/2020 20:00","2020-07-11T20:00:00Z","07/11 16:00",285,1421,,"2020-07-11T20:00:00Z",262284,25780,235794,,,,,208338,,,,,,,,,,,"31",221,4028,208103,5451,208103,,-1,2,"ca66b5f1595363bfb823a80591e647eeae9802fd",0,0,0,0,0,""
20200711,"NE",20777,,183077,,"totalTestsViral",256833,95,1419,,,,,15499,"7/10/2020 20:00","2020-07-10T20:00:00Z","07/10 16:00",286,1419,,"2020-07-10T20:00:00Z",256833,25520,230616,,,,,204091,,,,,,,,,,,"31",154,2686,203854,3931,203854,,2,0,"38b7711c0056ad4f5c6a7699e719dafbc0f8a919",0,0,0,0,0,""
20200710,"NE",20623,,180391,,"totalTestsViral",252902,100,1419,,,,,15206,"7/9/2020 20:00","2020-07-09T20:00:00Z","07/09 16:00",284,1419,,"2020-07-09T20:00:00Z",252902,25301,226909,,,,,201249,,,,,,,,,,,"31",198,2981,201014,4020,201014,,2,14,"706ed0fe1d759dcec823fa2cc8133bae8f337914",0,0,0,0,0,""
20200709,"NE",20425,,177410,,"totalTestsViral",248882,97,1405,,,,,15031,"7/8/2020 20:00","2020-07-08T20:00:00Z","07/08 16:00",282,1405,,"2020-07-08T20:00:00Z",248882,25047,223148,,,,,198069,,,,,,,,,,,"31",224,2563,197835,4296,197835,,0,7,"312f39d8d3d912626a380acd339cb3a20a105809",0,0,0,0,0,""
20200708,"NE",20201,,174847,,"totalTestsViral",244586,102,1398,,,,,14927,"7/7/2020 20:00","2020-07-07T20:00:00Z","07/07 16:00",282,1398,,"2020-07-07T20:00:00Z",244586,24763,219153,,,,,195281,,,,,,,,,,,"31",155,1820,195048,3368,195048,,-1,29,"7c16fb7472a94255ce1979c1b9fc1db618a34f04",0,0,0,0,0,""
20200707,"NE",20046,,173027,,"totalTestsViral",241218,109,1369,,,,,14759,"7/6/2020 20:00","2020-07-06T20:00:00Z","07/06 16:00",283,1369,,"2020-07-06T20:00:00Z",241218,24522,216032,,,,,193299,,,,,,,,,,,"31",117,1216,193073,1720,193073,,-1,0,"337942ff4c85aeb62b790a6bb480d8c5cf6b73c2",0,0,0,0,0,""
20200706,"NE",19929,,171811,,"totalTestsViral",239498,101,1369,,,,,14641,"7/5/2020 20:00","2020-07-05T20:00:00Z","07/05 16:00",284,1369,,"2020-07-05T20:00:00Z",239498,24379,214455,,,,,191967,,,,,,,,,,,"31",102,1710,191740,1270,191740,,0,1,"c017d9d7aef68de8076af9d7e0ab82bb81df2f07",0,0,0,0,0,""
20200705,"NE",19827,,170101,,"totalTestsViral",238228,109,1368,,,,,14340,"7/4/2020 20:00","2020-07-04T20:00:00Z","07/04 16:00",284,1368,,"2020-07-04T20:00:00Z",238228,24283,213281,,,,,190151,,,,,,,,,,,"31",167,2173,189928,3539,189928,,0,3,"0d26b822aa3dbfd92f202d4235fce7f499d4fa59",0,0,0,0,0,""
20200704,"NE",19660,,167928,,"totalTestsViral",234689,111,1365,,,,,14200,"7/3/2020 20:00","2020-07-03T20:00:00Z","07/03 16:00",284,1365,,"2020-07-03T20:00:00Z",234689,24086,209947,,,,,187808,,,,,,,,,,,"31",208,3246,187588,5452,187588,,2,12,"101d40f4bccc406126e7187ea4000fa74bb201c0",0,0,0,0,0,""
20200703,"NE",19452,,164682,,"totalTestsViral",229237,121,1353,,,,,14022,"7/2/2020 20:30","2020-07-02T20:30:00Z","07/02 16:30",282,1353,,"2020-07-02T20:30:00Z",229237,23794,204801,,,,,184354,,,,,,,,,,,"31",142,1330,184134,2587,184134,,6,10,"f3ee5824837b66582506b74ccd3fd5a0d4d031ed",0,0,0,0,0,""
20200702,"NE",19310,,163352,,"totalTestsViral",226650,117,1343,,,,,13807,"7/1/2020 19:54","2020-07-01T19:54:00Z","07/01 15:54",276,1343,,"2020-07-01T19:54:00Z",226650,23582,202428,,,,,182880,,,,,,,,,,,"31",133,1921,182662,2350,182662,,2,13,"8b1f36fda33d37ec90ac7cb6c6739f2207ca67f9",0,0,0,0,0,""
20200701,"NE",19177,,161431,,"totalTestsViral",224300,120,1330,,,,,13737,"6/30/2020 20:00","2020-06-30T20:00:00Z","06/30 16:00",274,1330,,"2020-06-30T20:00:00Z",224300,23439,200223,,,,,180826,,,,,,,,,,,"31",135,2316,180608,3117,180608,,5,0,"d44b555c88ce398e8c84b7ed69460ae5f8712aed",0,0,0,0,0,""
20200630,"NE",19042,,159115,,"totalTestsViral",221183,121,1330,,,,,13547,"6/29/2020 12:30","2020-06-29T12:30:00Z","06/29 08:30",269,1330,,"2020-06-29T12:30:00Z",221183,23261,197285,,,,,178368,,,,,,,,,,,"31",143,2742,178157,3951,178157,,2,14,"dbc79a205e160ee19e67a2d1f5da0c2c53b57fa5",0,0,0,0,0,""
20200629,"NE",18899,,156373,,"totalTestsViral",217232,117,1316,,,,,13322,"6/28/2020 19:55","2020-06-28T19:55:00Z","06/28 15:55",267,1316,,"2020-06-28T19:55:00Z",217232,23011,193600,,,,,175484,,,,,,,,,,,"31",124,2350,175272,2936,175272,,0,1,"71466ee57843fd8c9aae5445c074694b6bf4cf25",0,0,0,0,0,""
20200628,"NE",18775,,154023,,"totalTestsViral",214296,123,1315,,,,,13053,"6/27/2020 19:55","2020-06-27T19:55:00Z","06/27 15:55",267,1315,,"2020-06-27T19:55:00Z",214296,22877,190801,,,,,173009,,,,,,,,,,,"31",251,3949,172798,6371,172798,,1,3,"77173458babf72bbfbee61808137b1842dfc4df1",0,0,0,0,0,""
20200627,"NE",18524,,150074,,"totalTestsViral",207925,125,1312,,,,,12698,"6/26/2020 20:05","2020-06-26T20:05:00Z","06/26 16:05",266,1312,,"2020-06-26T20:05:00Z",207925,22547,184781,,,,,168800,,,,,,,,,,,"31",178,3418,168598,6228,168598,,6,18,"8381c60e82a268489fe4934fb1481f362de8aaac",0,0,0,0,0,""
20200626,"NE",18346,,146656,,"totalTestsViral",201697,126,1294,,,,,12314,"6/25/2020 19:55","2020-06-25T19:55:00Z","06/25 15:55",260,1294,,"2020-06-25T19:55:00Z",201697,22221,178893,,,,,165195,,,,,,,,,,,"31",125,1707,165002,2410,165002,,3,26,"7e25f0198960a736f5700f91be9e3738e633878c",0,0,0,0,0,""
20200625,"NE",18221,,144949,,"totalTestsViral",199287,131,1268,,,,,12099,"6/24/2020 20:00","2020-06-24T20:00:00Z","06/24 16:00",257,1268,,"2020-06-24T20:00:00Z",199287,22070,176638,,,,,163368,,,,,,,,,,,"31",129,1740,163170,2897,163170,,1,11,"8daa89c96fc89ea6962e3f83f5f70f0a40a344b4",0,0,0,0,0,""
20200624,"NE",18092,,143209,,"totalTestsViral",196390,125,1257,,,,,12099,"6/23/2020 20:00","2020-06-23T20:00:00Z","06/23 16:00",256,1257,,"2020-06-23T20:00:00Z",196390,21887,173929,,,,,161494,,,,,,,,,,,"31",135,2524,161301,2885,161301,,7,23,"743cc080b3f6a042bfa443f04b38a8efe7c61079",0,0,0,0,0,""
20200623,"NE",17957,,140685,,"totalTestsViral",193505,135,1234,,,,,11980,"6/22/2020 20:25","2020-06-22T20:25:00Z","06/22 16:25",249,1234,,"2020-06-22T20:25:00Z",193505,21740,171196,,,,,158827,,,,,,,,,,,"31",147,1987,158642,3508,158642,,5,22,"8214a1acebee3dc5bfcbb6f9e9c54017d15eb6fc",0,0,0,0,0,""
20200622,"NE",17810,,138698,,"totalTestsViral",189997,141,1212,,,,,11776,"6/21/2020 21:50","2020-06-21T21:50:00Z","06/21 17:50",244,1212,,"2020-06-21T21:50:00Z",189997,21512,167929,,,,,156691,,,,,,,,,,,"31",103,2164,156508,2825,156508,,0,0,"50e31d87becbd628b566ea5f9aa5f49be4212fda",0,0,0,0,0,""
20200621,"NE",17707,,136534,,"totalTestsViral",187172,140,1212,,,,,11565,"6/20/2020 19:50","2020-06-20T19:50:00Z","06/20 15:50",244,1212,,"2020-06-20T19:50:00Z",187172,21382,165239,,,,,154423,,,,,,,,,,,"31",116,2271,154241,2942,154241,,0,12,"5b9bf0e03a57913ca4e63e4f3da32fc4b43656fc",0,0,0,0,0,""
20200620,"NE",17591,,134263,,"totalTestsViral",184230,141,1200,,,,,11312,"6/19/2020 19:50","2020-06-19T19:50:00Z","06/19 15:50",244,1200,,"2020-06-19T19:50:00Z",184230,21226,162454,,,,,152040,,,,,,,,,,,"31",176,3832,151854,3434,151854,,4,34,"5f7aa9fa8062b7cd0aafec5815bf816b9e34e43b",0,0,0,0,0,""
20200619,"NE",17415,,130431,,"totalTestsViral",180796,149,1166,,,,,11066,"6/18/2020 19:55","2020-06-18T19:55:00Z","06/18 15:55",240,1166,,"2020-06-18T19:55:00Z",180796,21009,159240,,,,,148039,,,,,,,,,,,"31",189,2844,147846,3591,147846,,6,25,"c32c884bb4305338d3e44283f1b5fe7d97b4245e",0,0,0,0,0,""
20200618,"NE",17226,,127587,,"totalTestsViral",177205,156,1141,,,,,10761,"6/17/2020 20:00","2020-06-17T20:00:00Z","06/17 16:00",234,1141,,"2020-06-17T20:00:00Z",177205,20774,155905,,,,,144996,,,,,,,,,,,"31",195,2231,144813,3652,144813,,3,25,"558e5bf78bc6311d9e0245b5b401cfd1ecdc6bbd",0,0,0,0,0,""
20200617,"NE",17031,,125356,,"totalTestsViral",173553,156,1116,,,,,10529,"6/16/2020 20:15","2020-06-16T20:15:00Z","06/16 16:15",231,1116,,"2020-06-16T20:15:00Z",173553,20503,152535,,,,,142566,,,,,,,,,,,"31",180,2694,142387,3324,142387,,11,28,"28ad6529a8bd66fe71e3ef25ab7399bd33c4a80c",0,0,0,0,0,""
20200616,"NE",16851,,122662,,"totalTestsViral",170229,160,1088,,,,,10351,"6/15/2020 19:50","2020-06-15T19:50:00Z","06/15 15:50",220,1088,,"2020-06-15T19:50:00Z",170229,20296,149423,,,,,139690,,,,,,,,,,,"31",126,1632,139513,3348,139513,,4,13,"4bae1d8d7647e7d3f7149d8d796f2095ad95bf2d",0,0,0,0,0,""
20200615,"NE",16725,,121030,,"totalTestsViral",166881,160,1075,,,,,10121,"6/14/2020 20:00","2020-06-14T20:00:00Z","06/14 16:00",216,1075,,"2020-06-14T20:00:00Z",166881,20073,146309,,,,,137924,,,,,,,,,,,"31",92,1548,137755,2735,137755,,0,5,"ca3e40fb6501e9a9caa75c4a530cbcb24728d9aa",0,0,0,0,0,""
20200614,"NE",16633,,119482,,"totalTestsViral",164146,156,1070,,,,,9879,"6/13/2020 20:00","2020-06-13T20:00:00Z","06/13 16:00",216,1070,,"2020-06-13T20:00:00Z",164146,19929,143727,,,,,136277,,,,,,,,,,,"31",120,1618,136115,2480,136115,,0,3,"5ed1be8700aa6c13757a2f5f8abcb7e5d4587d29",0,0,0,0,0,""
20200613,"NE",16513,,117864,,"totalTestsViral",161666,157,1067,,,,,9610,"6/12/2020 19:00","2020-06-12T19:00:00Z","06/12 15:00",216,1067,,"2020-06-12T19:00:00Z",161666,19772,141410,,,,,134536,,,,,,,,,,,"31",198,3406,134377,3842,134377,,4,38,"64c1fee17d5789de04836abe5bd4581ad329c7ad",0,0,0,0,0,""
20200612,"NE",16315,,114458,,"totalTestsViral",157824,164,1029,,,,,9229,"6/12/2020 21:07","2020-06-12T21:07:00Z","06/12 17:07",212,1029,,"2020-06-12T21:07:00Z",157824,19491,137852,,,,,130933,,,,,,,,,,,"31",290,2821,130773,4137,130773,,17,29,"986446923bed7b0d55382bf486e3029516f8bc8d",0,0,0,0,0,""
20200611,"NE",16025,,111637,,"totalTestsViral",153687,175,1000,,,,,8946,"6/10/2020 20:00","2020-06-10T20:00:00Z","06/10 16:00",195,1000,,"2020-06-10T20:00:00Z",153687,19153,134062,,,,,127830,,,,,,,,,,,"31",142,2358,127662,3422,127662,,4,11,"db6abf164ef9b79fdd5938b29baff27d5c2bd862",0,0,0,0,0,""
20200610,"NE",15883,,109279,,"totalTestsViral",150265,181,989,,,,,8820,"6/9/2020 20:00","2020-06-09T20:00:00Z","06/09 16:00",191,989,,"2020-06-09T20:00:00Z",150265,18900,130898,,,,,125329,,,,,,,,,,,"31",131,2339,125162,3438,125162,,3,22,"4533e7893ca202b7885365ab98786b3b1a9501d9",0,0,0,0,0,""
20200609,"NE",15752,,106940,,"totalTestsViral",146827,176,967,,,,,8637,"6/8/2020 20:30","2020-06-08T20:30:00Z","06/08 16:30",188,967,,"2020-06-08T20:30:00Z",146827,18758,127607,,,,,122850,,,,,,,,,,,"31",118,1167,122692,2519,122692,,0,32,"5f982148e949ec40929d68cf5c0e8d8c135b22fe",0,0,0,0,0,""
20200608,"NE",15634,,105773,,"totalTestsViral",144308,166,935,,,,,8455,"6/7/2020 20:00","2020-06-07T20:00:00Z","06/07 16:00",188,935,,"2020-06-07T20:00:00Z",144308,18528,125328,,,,,121569,,,,,,,,,,,"31",91,1547,121407,2188,121407,,0,7,"d181d79e5ff0c52db4f38d832fca240902974b46",0,0,0,0,0,""
20200607,"NE",15543,,104226,,"totalTestsViral",142120,167,928,,,,,8255,"6/6/2020 20:00","2020-06-06T20:00:00Z","06/06 16:00",188,928,,"2020-06-06T20:00:00Z",142120,18406,123269,,,,,119926,,,,,,,,,,,"31",164,2058,119769,2788,119769,,2,9,"8f5ae9601079276a49042dd0730476eb1c228973",0,0,0,0,0,""
20200606,"NE",15379,,102168,,"totalTestsViral",139332,181,919,,,,,7957,"6/5/2020 19:50","2020-06-05T19:50:00Z","06/05 15:50",186,919,,"2020-06-05T19:50:00Z",139332,18143,120749,,,,,117700,,,,,,,,,,,"31",262,2463,117547,2692,117547,,0,14,"0eb558054daddbe144b8ffb128cb69ec19a4699b",0,0,0,0,0,""
20200605,"NE",15117,,99705,,"totalTestsViral",136640,190,905,,,,,7598,"6/4/2020 16:00","2020-06-04T16:00:00Z","06/04 12:00",186,905,,"2020-06-04T16:00:00Z",136640,17898,118324,,,,,114974,,,,,,,,,,,"31",251,2316,114822,3126,114822,,-1,3,"feebd52c88e6b0e5423bbf90765d9a63047146e0",0,0,0,0,0,""
20200604,"NE",14866,,97389,,"totalTestsViral",133514,211,902,,,,,7005,"6/3/2020 20:00","2020-06-03T20:00:00Z","06/03 16:00",187,902,,"2020-06-03T20:00:00Z",133514,17605,115498,,,,,112409,,,,,,,,,,,"31",255,2034,112255,3906,112255,,6,51,"968a6814a93144ae4956a21844a3c65a5818f953",0,0,0,0,0,""
20200603,"NE",14611,,95355,,"totalTestsViral",129608,194,851,,,,,6743,"6/2/2020 20:00","2020-06-02T20:00:00Z","06/02 16:00",181,851,,"2020-06-02T20:00:00Z",129608,17184,112019,,,,,110119,,,,,,,,,,,"31",266,3282,109966,3014,109966,,3,851,"66cef9ed0f064d351e9e8eec0a6884ecd586b162",0,0,0,0,0,""
20200602,"NE",14345,,92073,,"totalTestsViral",126594,,,,,,,,"6/1/2020 20:00","2020-06-01T20:00:00Z","06/01 16:00",178,,,"2020-06-01T20:00:00Z",126594,16895,109298,,,,,106570,,,,,,,,,,,"31",244,2509,106418,4198,106418,,8,0,"ee9b3c6ee0f5e68d45c6152bdce606ef41a9bbe2",0,0,0,0,0,""
20200601,"NE",14101,,89564,,"totalTestsViral",122396,,,,,,,,"5/31/2020 19:45","2020-05-31T19:45:00Z","05/31 15:45",170,,,"2020-05-31T19:45:00Z",122396,16564,105439,,,,,103813,,,,,,,,,,,"31",196,2327,103665,2250,103665,,0,0,"8d1c21afe9ffabd3a60877e89afa0baa17a8853d",0,0,0,0,0,""
20200531,"NE",13905,,87237,,"totalTestsViral",120146,,,,,,,,"5/30/2020 18:45","2020-05-30T18:45:00Z","05/30 14:45",170,,,"2020-05-30T18:45:00Z",120146,16353,103403,,,,,101290,,,,,,,,,,,"31",251,1883,101142,3497,101142,,0,0,"cca03c8a3adf266433b6a1a1e803e661c0488d59",0,0,0,0,0,""
20200530,"NE",13654,,85354,,"totalTestsViral",116649,,,,,,,,"5/29/2020 19:45","2020-05-29T19:45:00Z","05/29 15:45",170,,,"2020-05-29T19:45:00Z",116649,16029,100232,,,,,99158,,,,,,,,,,,"31",393,3812,99008,5425,99008,,6,0,"d1cac8da2c6109a6a64665c00aaf96291f66c8ce",0,0,0,0,0,""
20200529,"NE",13261,,81542,,"totalTestsViral",111224,,,,,,,,"5/28/2020 19:45","2020-05-28T19:45:00Z","05/28 15:45",164,,,"2020-05-28T19:45:00Z",111224,15483,95358,,,,,95187,,,,,,,,,,,"31",285,1538,94803,2083,94803,,1,0,"5ec8199ae998c0436fb94761bfe98c7d98b21574",0,0,0,0,0,""
20200528,"NE",12976,,80004,,"totalTestsViral",109141,,,,,,,,"5/26/2020 19:45","2020-05-26T19:45:00Z","05/26 15:45",163,,,"2020-05-26T19:45:00Z",109141,15135,93625,,,,,93347,,,,,,,,,,,"31",357,2202,92980,3365,92980,,10,0,"f9fae95d9275a052db668ead07ae87377cd0b4cc",0,0,0,0,0,""
20200527,"NE",12619,,77802,,"totalTestsViral",105776,,,,,,,,"5/26/2020 19:00","2020-05-26T19:00:00Z","05/26 15:00",153,,,"2020-05-26T19:00:00Z",105776,14709,90718,,,,,90748,,,,,,,,,,,"31",264,2115,90421,1976,90421,,3,0,"e4ce087539d3cc4e4696e61711d18eb8d378c557",0,0,0,0,0,""
20200526,"NE",12355,,75687,,"totalTestsViral",103800,,,,,,,,"5/25/2020 19:00","2020-05-25T19:00:00Z","05/25 15:00",150,,,"2020-05-25T19:00:00Z",103800,14457,88998,,,,,88350,,,,,,,,,,,"31",221,2089,88042,2714,88042,,0,0,"5895ee0f8588f9fd950061788a76b334582f25a9",0,0,0,0,0,""
20200525,"NE",12134,,73598,,"totalTestsViral",101086,,,,,,,,"5/24/2020 19:55","2020-05-24T19:55:00Z","05/24 15:55",150,,,"2020-05-24T19:55:00Z",101086,14191,86555,,,,,86027,,,,,,,,,,,"31",145,2382,85732,3870,85732,,3,0,"66dc1ec7e08385b3947e7d2061c3464cf7e40004",0,0,0,0,0,""
20200524,"NE",11989,,71216,,"totalTestsViral",97216,,,,,,,,"5/23/2020 16:15","2020-05-23T16:15:00Z","05/23 12:15",147,,,"2020-05-23T16:15:00Z",97216,13962,82917,,,,,83485,,,,,,,,,,,"31",327,2896,83205,1659,83205,,0,0,"40f083882546cfe4fa0c58a3cfc0411123116db2",0,0,0,0,0,""
20200523,"NE",11662,,68320,,"totalTestsViral",95557,,,,,,,,"5/22/2020 19:45","2020-05-22T19:45:00Z","05/22 15:45",147,,,"2020-05-22T19:45:00Z",95557,13705,81517,,,,,80475,,,,,,,,,,,"31",237,1326,79982,4614,79982,,4,0,"6ab9566ef5e399575afc2d624409d0342628cb6a",0,0,0,0,0,""
20200522,"NE",11425,,66994,,"totalTestsViral",90943,,,,,,,,"5/21/2020 19:50","2020-05-21T19:50:00Z","05/21 15:50",143,,,"2020-05-21T19:50:00Z",90943,13245,77369,,,,,78654,,,,,,,,,,,"31",303,2476,78419,2920,78419,,5,0,"a3a2620745b2fd3d893a7a7254ab552dc11aadaf",0,0,0,0,0,""
20200521,"NE",11122,,64518,,"totalTestsViral",88023,,,,,,,,"5/20/2020 19:55","2020-05-20T19:55:00Z","05/20 15:55",138,,,"2020-05-20T19:55:00Z",88023,12927,74773,,,,,75864,,,,,,,,,,,"31",276,3229,75640,3968,75640,,6,0,"fa635150c917c9d2caf77219c06d8ae63d60778c",0,0,0,0,0,""
20200520,"NE",10846,,61289,,"totalTestsViral",84055,,,,,,,,"5/19/2020 19:00","2020-05-19T19:00:00Z","05/19 15:00",132,,,"2020-05-19T19:00:00Z",84055,12553,71185,,,,,72333,,,,,,,,,,,"31",221,1930,72135,3311,72135,,7,0,"1cb172dd479f17666a361cac455dac707abc45bc",0,0,0,0,0,""
20200519,"NE",10625,,59359,,"totalTestsViral",80744,,,,,,,,"5/18/2020 20:00","2020-05-18T20:00:00Z","05/18 16:00",125,,,"2020-05-18T20:00:00Z",80744,12264,68180,,,,,70147,,,,,,,,,,,"31",277,2206,69984,4046,69984,,2,0,"441289feb89cd090661d61dcd2102d10902688ed",0,0,0,0,0,""
20200518,"NE",10348,,57153,,"totalTestsViral",76698,,,,,,,,"5/17/2020 20:00","2020-05-17T20:00:00Z","05/17 16:00",123,,,"2020-05-17T20:00:00Z",76698,11881,64529,,,,,67649,,,,,,,,,,,"31",128,1733,67501,1425,67501,,0,0,"4675ca7a7d6b4402c85277cc17058ae9e41c3651",0,0,0,0,0,""
20200517,"NE",10220,,55420,,"totalTestsViral",75273,,,,,,,,"5/16/2020 18:15","2020-05-16T18:15:00Z","05/16 14:15",123,,,"2020-05-16T18:15:00Z",75273,11741,63245,,,,,65774,,,,,,,,,,,"31",448,5214,65640,5410,65640,,4,0,"0a2d246d680d407a9f716a29bb767d7068de12e8",0,0,0,0,0,""
20200516,"NE",9772,,50206,,"totalTestsViral",69863,,,,,,,,"5/15/2020 15:45","2020-05-15T15:45:00Z","05/15 11:45",119,,,"2020-05-15T15:45:00Z",69863,11239,58346,,,,,60092,,,,,,,,,,,"31",356,2407,59978,4173,59978,,6,0,"dd3e9400d45a33cac1344bd66db377a94c403a3e",0,0,0,0,0,""
20200515,"NE",9416,,47799,,"totalTestsViral",65690,,,,,,,,"5/14/2020 15:45","2020-05-14T15:45:00Z","05/14 11:45",113,,,"2020-05-14T15:45:00Z",65690,10849,54565,,,,,57315,,,,,,,,,,,"31",341,3533,57215,4921,57215,,6,0,"b2a93642c64f03d6962a2efd798df60d9334a78f",0,0,0,0,0,""
20200514,"NE",9075,,44266,,"totalTestsViral",60769,,,,,,,,"5/13/2020 20:00","2020-05-13T20:00:00Z","05/13 16:00",107,,,"2020-05-13T20:00:00Z",60769,10319,50178,,,,,53427,,,,,,,,,,,"31",383,3233,53341,2781,53341,,4,0,"4b1690ec683ace0cc3ecdd65b673583c4081e993",0,0,0,0,0,""
20200513,"NE",8692,,41033,,"totalTestsViral",57988,192,,81,,56,,,"5/12/2020 20:00","2020-05-12T20:00:00Z","05/12 16:00",103,,,"2020-05-12T20:00:00Z",57988,9925,47798,,,,,49799,,,,,,,,,,,"31",120,1662,49725,3547,49725,,3,0,"e0899cd6ae8324448c300ad55b375058ce5134a7",0,0,0,0,0,""
20200512,"NE",8572,,39371,,"totalTestsViral",54441,192,,81,,56,,,"5/11/2020 20:05","2020-05-11T20:05:00Z","05/11 16:05",100,,,"2020-05-11T20:05:00Z",54441,9647,44530,,,,,48019,,,,,,,,,,,"31",257,1447,47943,1847,47943,,2,0,"ae6828d204cb6436de939a24fc60dce6dfaeb200",0,0,0,0,0,""
20200511,"NE",8315,,37924,,"totalTestsViral",52594,,,,,,,,"5/10/2020 19:45","2020-05-10T19:45:00Z","05/10 15:45",98,,,"2020-05-10T19:45:00Z",52594,9385,42946,,,,,46314,,,,,,,,,,,"31",81,589,46239,682,46239,,2,0,"cc556acd8c5271a1f5028b225bd922ab1a14fded",0,0,0,0,0,""
20200510,"NE",8234,,37335,,"totalTestsViral",51912,,,,,,,,"5/9/2020 19:45","2020-05-09T19:45:00Z","05/09 15:45",96,,,"2020-05-09T19:45:00Z",51912,9303,42348,,,,,45644,,,,,,,,,,,"31",403,2190,45569,2156,45569,,4,0,"3e53a52ffaa0e79d3b1ca31fbe3634d6f7d72305",0,0,0,0,0,""
20200509,"NE",7831,,35145,,"totalTestsViral",49756,,,,,,,,"5/8/2020 18:45","2020-05-08T18:45:00Z","05/08 14:45",92,,,"2020-05-08T18:45:00Z",49756,8914,40586,,,,,43046,,,,,,,,,,,"31",641,1923,42976,4479,42976,,2,0,"e51a7196ea179a06ca4e572da6150863ff039bcb",0,0,0,0,0,""
20200508,"NE",7190,,33222,,"totalTestsViral",45277,,,,,,,,"5/7/2020 17:45","2020-05-07T17:45:00Z","05/07 13:45",90,,,"2020-05-07T17:45:00Z",45277,8092,36930,,,,,40482,,,,,,,,,,,"31",419,2235,40412,3054,40412,,4,0,"3085e8b2cfe308f4b3e3ce8c18ff1ddbc20ae601",0,0,0,0,0,""
20200507,"NE",6771,,30987,,"totalTestsViral",42223,,,,,,,,"5/6/2020 17:45","2020-05-06T17:45:00Z","05/06 13:45",86,,,"2020-05-06T17:45:00Z",42223,7354,34617,,,,,37829,,,,,,,,,,,"31",333,1297,37758,1987,37758,,4,0,"916919ff0ccf2d9496052d84bb8325277f56c1f3",0,0,0,0,0,""
20200506,"NE",6438,,29690,,"totalTestsViral",40236,,,,,,,,"5/5/2020 17:45","2020-05-05T17:45:00Z","05/05 13:45",82,,,"2020-05-05T17:45:00Z",40236,6943,33047,,,,,36194,,,,,,,,,,,"31",355,1164,36128,1737,36128,,4,0,"4dfec393b4c838aa6c63fb7fd543ad445a737fef",0,0,0,0,0,""
20200505,"NE",6083,,28526,,"totalTestsViral",38499,,,,,,,,"5/3/2020 20:45","2020-05-03T20:45:00Z","05/03 16:45",78,,,"2020-05-03T20:45:00Z",38499,6535,31719,,,,,34675,,,,,,,,,,,"31",173,682,34609,2153,34609,,0,0,"60d749b0c050f7ca679b4c15fbd07938f9c7432e",0,0,0,0,0,""
20200504,"NE",5910,,27844,,"totalTestsViral",36346,,,,,,,,"5/3/2020 20:45","2020-05-03T20:45:00Z","05/03 16:45",78,,,"2020-05-03T20:45:00Z",36346,6055,30055,,,,,33819,,,,,,,,,,,"31",584,1908,33754,1651,33754,,2,0,"929d3c9d6854411797149b6efecf9a85c0b323dc",0,0,0,0,0,""
20200503,"NE",5326,,25936,,"totalTestsViral",34695,,,,,,,,"5/2/2020 19:45","2020-05-02T19:45:00Z","05/02 15:45",76,,,"2020-05-02T19:45:00Z",34695,5689,28774,,,,,31332,,,,,,,,,,,"31",488,1426,31262,1772,31262,,3,0,"3baa3d666f641278b4e99f7cceb9a234b4d73d6e",0,0,0,0,0,""
20200502,"NE",4838,,24510,,"totalTestsViral",32923,,,,,,,,"5/1/2020 19:45","2020-05-01T19:45:00Z","05/01 15:45",73,,,"2020-05-01T19:45:00Z",32923,5332,27364,,,,,29557,,,,,,,,,,,"31",557,1406,29348,2124,29348,,3,0,"6765c21e091ff71a506bc62d69e505215a23c9ab",0,0,0,0,0,""
20200501,"NE",4281,,23104,,"totalTestsViral",30799,,,,,,,,"4/30/2020 19:45","2020-04-30T19:45:00Z","04/30 15:45",70,,,"2020-04-30T19:45:00Z",30799,4770,25834,,,,,27577,,,,,,,,,,,"31",497,1567,27385,2672,27385,,2,0,"e2c65bf36e8dec3c48d104afdf4ed489b5af68e3",0,0,0,0,0,""
20200430,"NE",3784,,21537,,"totalTestsViral",28127,,,,,,,,"4/29/2020 19:45","2020-04-29T19:45:00Z","04/29 15:45",68,,,"2020-04-29T19:45:00Z",28127,4171,23776,,,,,25498,,,,,,,,,,,"31",410,1280,25321,1958,25321,,13,0,"a6fff21da0e9d2fe224d1d5539308eec67b23933",0,0,0,0,0,""
20200429,"NE",3374,,20257,,"totalTestsViral",26169,,,,,,,,"4/28/2020 19:45","2020-04-28T19:45:00Z","04/28 15:45",55,,,"2020-04-28T19:45:00Z",26169,3704,22301,,,,,23798,,,,,,,,,,,"31",16,10,23631,18,23631,,0,0,"66702233333e45efa32e7d18d7f59f8e22f22ed6",0,0,0,0,0,""
20200428,"NE",3358,,20247,,"totalTestsViral",26151,,,,,,,,"4/27/2020 19:45","2020-04-27T19:45:00Z","04/27 15:45",55,,,"2020-04-27T19:45:00Z",26151,3692,22295,,,,,23772,,,,,,,,,,,"31",330,912,23605,1249,23605,,-1,0,"e8c6d35d2c1d388d9d3eeaa538770963f823850d",0,0,0,0,0,""
20200427,"NE",3028,,19335,,"totalTestsViral",24902,,,,,,,,"4/26/2020 19:45","2020-04-26T19:45:00Z","04/26 15:45",56,,,"2020-04-26T19:45:00Z",24902,3364,21377,,,,,22525,,,,,,,,,,,"31",296,839,22363,1281,22363,,3,0,"dd7c040185a5379e4c7c45a26a3e55b37ff1dd4e",0,0,0,0,0,""
20200426,"NE",2732,,18496,,"totalTestsViral",23621,,,,,,,,"4/25/2020 19:45","2020-04-25T19:45:00Z","04/25 15:45",53,,,"2020-04-25T19:45:00Z",23621,3047,20415,,,,,21377,,,,,,,,,,,"31",311,944,21228,1473,21228,,3,0,"4778452f28d5b5c4f6abc08f9de05f6df51cb46b",0,0,0,0,0,""
20200425,"NE",2421,,17552,,"totalTestsViral",22148,,,,,,,,"4/24/2020 19:45","2020-04-24T19:45:00Z","04/24 15:45",50,,,"2020-04-24T19:45:00Z",22148,2710,19283,,,,,20112,,,,,,,,,,,"31",297,1064,19973,1632,19973,,3,0,"1800589060b18714c9dd39efc5cf30a6d065c159",0,0,0,0,0,""
20200424,"NE",2124,,16488,,"totalTestsViral",20516,,,,,,,,"4/24/2020 19:45","2020-04-24T19:45:00Z","04/24 15:45",47,,,"2020-04-24T19:45:00Z",20516,2357,18011,,,,,18701,,,,,,,,,,,"31",311,941,18612,1557,18612,,2,0,"0518f20bcbb0208575512e9dd268a6d0c1a5f62c",0,0,0,0,0,""
20200423,"NE",1813,,15547,,"totalTestsViral",18959,,,,,,,,"4/23/2020 19:45","2020-04-23T19:45:00Z","04/23 15:45",45,,,"2020-04-23T19:45:00Z",18959,1953,16863,,,,,17394,,,,,,,,,,,"31",91,590,17360,513,17360,,7,0,"33d0070428e03503370fa169c37279caec7c7671",0,0,0,0,0,""
20200422,"NE",1722,,14957,,"totalTestsViral",18446,,,,,,,,"4/22/2020 19:45","2020-04-22T19:45:00Z","04/22 15:45",38,,,"2020-04-22T19:45:00Z",18446,1892,16415,,,,,16813,,,,,,,,,,,"31",74,233,16679,447,16679,,5,0,"ddd46d684428fb4b71215a2c28988f5610bcb912",0,0,0,0,0,""
20200421,"NE",1648,,14724,,"totalTestsViral",17999,,,,,,,,"4/21/2020 19:45","2020-04-21T19:45:00Z","04/21 15:45",33,,,"2020-04-21T19:45:00Z",17999,1777,16092,,,,,16478,,,,,,,,,,,"31",174,518,16372,808,16372,,5,0,"db32726d1c4bdeb8f63b99489dc5a0b1aab043c1",0,0,0,0,0,""
20200420,"NE",1474,,14206,,"totalTestsViral",17191,,,,,,,,"4/19/2020 19:45","2020-04-19T19:45:00Z","04/19 15:45",28,,,"2020-04-19T19:45:00Z",17191,1583,15483,,,,,15756,,,,,,,,,,,"31",187,918,15680,1125,15680,,0,0,"0d4946980dc9a376d95319ebf7d4b4df762d7c6e",0,0,0,0,0,""
20200419,"NE",1287,,13288,,"totalTestsViral",16066,,,,,,,,"4/19/2020 19:45","2020-04-19T19:45:00Z","04/19 15:45",28,,,"2020-04-19T19:45:00Z",16066,1385,14558,,,,,14652,,,,,,,,,,,"31",149,749,14575,1064,14575,,4,0,"e6ee4cadb7c4f8b16e16b21dffcee6bf4f70e250",0,0,0,0,0,""
20200418,"NE",1138,,12539,,"totalTestsViral",15002,,,,,,,,"4/17/2020 19:42","2020-04-17T19:42:00Z","04/17 15:42",24,,,"2020-04-17T19:42:00Z",15002,1231,13651,,,,,13753,,,,,,,,,,,"31",72,501,13677,525,13677,,0,0,"449fd257afd4f86c2f0377de7a0ff24811d72ea4",0,0,0,0,0,""
20200417,"NE",1066,,12038,,"totalTestsViral",14477,,,,,,,,"4/17/2020 19:42","2020-04-17T19:42:00Z","04/17 15:42",24,,,"2020-04-17T19:42:00Z",14477,1160,13197,,,,,13173,,,,,,,,,,,"31",114,696,13104,790,13104,,3,0,"950c18827777aadf126baadff6058d101f8de612",0,0,0,0,0,""
20200416,"NE",952,,11342,,"totalTestsViral",13687,,,,,,,,"4/16/2020 19:40","2020-04-16T19:40:00Z","04/16 15:40",21,,,"2020-04-16T19:40:00Z",13687,1055,12519,,,,,12324,,,,,,,,,,,"31",51,514,12294,731,12294,,1,0,"aa6a8b678ed8a3f853fe56c19b6b6138fc474ad7",0,0,0,0,0,""
20200415,"NE",901,,10828,,"totalTestsViral",12956,,,,,,,,"4/14/2020 19:45","2020-04-14T19:45:00Z","04/14 15:45",20,,,"2020-04-14T19:45:00Z",12956,972,11877,,,,,11757,,,,,,,,,,,"31",30,342,11729,788,11729,,2,0,"bcff59f075f25fc18009be2d2ae47fb7ca8b27fd",0,0,0,0,0,""
20200414,"NE",871,,10486,,"totalTestsViral",12168,,,,,,,,"4/14/2020 19:45","2020-04-14T19:45:00Z","04/14 15:45",18,,,"2020-04-14T19:45:00Z",12168,866,11199,,,,,11384,,,,,,,,,,,"31",57,328,11357,455,11357,,1,0,"4dda120be322b4def43a9b1727ba8c018cff4cdf",0,0,0,0,0,""
20200413,"NE",814,,10158,,"totalTestsViral",11713,,,,,,,,"4/13/2020 20:03","2020-04-13T20:03:00Z","04/13 16:03",17,,,"2020-04-13T20:03:00Z",11713,814,10805,,,,,10991,,,,,,,,,,,"31",23,258,10972,734,10972,,0,0,"4501f8af2ed5a9203ad53bab1784a8ff5323337e",0,0,0,0,0,""
20200412,"NE",791,,9900,,"totalTestsViral",10979,,,,,,,,"4/12/2020 13:40","2020-04-12T13:40:00Z","04/12 09:40",17,,,"2020-04-12T13:40:00Z",10979,721,10166,,,,,10197,,,,,,,,,,,"31",91,615,10691,809,10691,,0,0,"82cd2977df76e6cc36dc9f7ef02b56b96d7d669d",0,0,0,0,0,""
20200411,"NE",700,,9285,,"totalTestsViral",10170,,,,,,,,"4/11/2020 14:00","2020-04-11T14:00:00Z","04/11 10:00",17,,,"2020-04-11T14:00:00Z",10170,668,9412,,,,,10007,,,,,,,,,,,"31",65,566,9985,675,9985,,2,0,"f22007c0dcf829c1bc2011c71366b6a8590636a3",0,0,0,0,0,""
20200410,"NE",635,,8719,,"totalTestsViral",9495,,,,,,,,"4/10/2020 13:50","2020-04-10T13:50:00Z","04/10 09:50",15,,,"2020-04-10T13:50:00Z",9495,605,8806,,,,,9375,,,,,,,,,,,"31",68,603,9354,812,9354,,1,0,"096730b66a187a8f2fe44cade9b127ee105e6103",0,0,0,0,0,""
20200409,"NE",567,,8116,,"totalTestsViral",8683,,,,,,,,"4/9/2020 13:36","2020-04-09T13:36:00Z","04/09 09:36",14,,,"2020-04-09T13:36:00Z",8683,549,8056,,,,,8852,,,,,,,,,,,"31",48,674,8683,667,8683,,2,0,"5e5d356f26d42a949fb6dbded2943f190add1c59",0,0,0,0,0,""
20200408,"NE",519,,7442,,"totalTestsViral",8016,,,,,,,,"4/8/2020 13:45","2020-04-08T13:45:00Z","04/08 09:45",12,,,"2020-04-08T13:45:00Z",8016,502,7439,,,,,8067,,,,,,,,,,,"31",72,631,7961,561,7961,,2,0,"45f54255d2185d54a758bb0a7b5f07c8bea47df8",0,0,0,0,0,""
20200407,"NE",447,,6811,,"totalTestsViral",7455,,,,,,,,"4/7/2020 14:38","2020-04-07T14:38:00Z","04/07 10:38",10,,,"2020-04-07T14:38:00Z",7455,452,6933,,,,,7269,,,,,,,,,,,"31",38,433,7258,1083,7258,,2,0,"64a902b09413902a2bb1030f366d1893d2167867",0,0,0,0,0,""
