"date","state","positive","probableCases","negative","pending","totalTestResultsSource","totalTestResults","hospitalizedCurrently","hospitalizedCumulative","inIcuCurrently","inIcuCumulative","onVentilatorCurrently","onVentilatorCumulative","recovered","lastUpdateEt","dateModified","checkTimeEt","death","hospitalized","hospitalizedDischarged","dateChecked","totalTestsViral","positiveTestsViral","negativeTestsViral","positiveCasesViral","deathConfirmed","deathProbable","totalTestEncountersViral","totalTestsPeopleViral","totalTestsAntibody","positiveTestsAntibody","negativeTestsAntibody","totalTestsPeopleAntibody","positiveTestsPeopleAntibody","negativeTestsPeopleAntibody","totalTestsPeopleAntigen","positiveTestsPeopleAntigen","totalTestsAntigen","positiveTestsAntigen","fips","positiveIncrease","negativeIncrease","total","totalTestResultsIncrease","posNeg","dataQualityGrade","deathIncrease","hospitalizedIncrease","hash","commercialScore","negativeRegularScore","negativeScore","positiveScore","score","grade"
20210307,"OK",428997,,3146300,2984,"posNeg",3575297,346,24332,100,,,,412177,,,,4534,24332,,,3548479,389855,3146300,,,,,,152279,23139,,,,,,,,,"40",461,0,3578281,461,3575297,,0,55,"3019887dd90821b78021a57adfdafde0617d7a31",0,0,0,0,0,""
20210306,"OK",428536,,3146300,2984,"posNeg",3574836,346,24277,100,,,,411624,,,,4534,24277,,,3548479,389855,3146300,,,,,,152279,23139,,,,,,,,,"40",978,11240,3577820,12218,3574836,,0,120,"975991be71999ea105003738a7c026e558d688d6",0,0,0,0,0,""
20210305,"OK",427558,,3135060,3464,"posNeg",3562618,366,24157,109,,,,410778,,,,4534,24157,,,3536729,389240,3135060,,,,,,148204,21760,,,,,,,,,"40",917,8299,3566082,9216,3562618,,0,54,"98d53791802179a4ba01ae3dea81497d5bc0b293",0,0,0,0,0,""
20210304,"OK",426641,,3126761,3620,"posNeg",3553402,404,24103,118,,,,409728,,,,4534,24103,,,3527683,388328,3126761,,,,,,148204,21760,,,,,,,,,"40",895,10458,3557022,11353,3553402,,0,39,"9f166417bd713ef15a020f737a6cf32ae60221bb",0,0,0,0,0,""
20210303,"OK",425746,,3116303,3021,"posNeg",3542049,427,24064,135,,,,408963,,,,4534,24064,,,3516251,387913,3116303,,,,,,148204,21760,,,,,,,,,"40",747,16023,3545070,16770,3542049,,0,65,"f69ee24f323dd23d507e95d770c4917552a3f2b8",0,0,0,0,0,""
20210302,"OK",424999,,3100280,2435,"posNeg",3525279,447,23999,134,,,,407934,,,,4534,23999,,,3499681,387452,3100280,,,,,,148204,21760,,,,,,,,,"40",111,15451,3527714,15562,3525279,,56,4,"010be62d362bd0b64d9af03fa249f0c54024d1c0",0,0,0,0,0,""
20210301,"OK",424888,,3084829,2965,"posNeg",3509717,484,23995,150,,,,407665,,,,4478,23995,,,3483450,386563,3084829,,,,,,148204,21760,,,,,,,,,"40",380,0,3512682,380,3509717,,50,10,"63626d55dbf1fdd0ffd7d88316192eff3a569edc",0,0,0,0,0,""
20210228,"OK",424508,,3084829,2965,"posNeg",3509337,484,23985,150,,,,407312,,,,4428,23985,,,3471392,386563,3084829,,,,,,148204,21760,,,,,,,,,"40",706,0,3512302,706,3509337,,49,76,"8ce640b15a3c12316f82a689f3b8a6005b55d9f5",0,0,0,0,0,""
20210227,"OK",423802,,3084829,2965,"posNeg",3508631,484,23909,150,,,,406494,,,,4379,23909,,,3471392,386563,3084829,,,,,,148204,21760,,,,,,,,,"40",779,6841,3511596,7620,3508631,,59,30,"1e832ae05de52b5a811b2bf4140ab9d436944524",0,0,0,0,0,""
20210226,"OK",423023,,3077988,3176,"posNeg",3501011,526,23879,150,,,,405367,,,,4320,23879,,,3474706,385898,3077988,,,,,,145659,20802,,,,,,,,,"40",867,43699,3504187,44566,3501011,,18,66,"3e874102ebe8ab6613c7e44377dc518cab69e3d4",0,0,0,0,0,""
20210225,"OK",422156,,3034289,3102,"posNeg",3456445,491,23813,145,,,,404310,,,,4302,23813,,,3429181,383081,3034289,,,,,,145659,20802,,,,,,,,,"40",1146,9858,3459547,11004,3456445,,38,45,"36250f14ab593f72814cdc3cefa55f16313db868",0,0,0,0,0,""
20210224,"OK",421010,,3024431,3773,"posNeg",3445441,591,23768,161,,,,403159,,,,4264,23768,,,3418737,382869,3024431,,,,,,145659,20802,,,,,,,,,"40",798,14553,3449214,15351,3445441,,37,68,"80a2f81b2feb0e50406d9179e076bad3f68ba8ce",0,0,0,0,0,""
20210223,"OK",420212,,3009878,2440,"posNeg",3430090,602,23700,168,,,,401945,,,,4227,23700,,,3402658,380878,3009878,,,,,,145659,20802,,,,,,,,,"40",359,13683,3432530,14042,3430090,,24,16,"a67a4487eba21017ecce3d5cd843c0edcb352340",0,0,0,0,0,""
20210222,"OK",419853,,2996195,871,"posNeg",3416048,620,23684,188,,,,400597,,,,4203,23684,,,3388179,379753,2996195,,,,,,145659,20802,,,,,,,,,"40",499,0,3416919,499,3416048,,22,17,"3a6593168cceff1ba0f516107ccc44c63357de67",0,0,0,0,0,""
20210221,"OK",419354,,2996195,871,"posNeg",3415549,620,23667,188,,,,399817,,,,4181,23667,,,3388179,379753,2996195,,,,,,145659,20802,,,,,,,,,"40",1036,0,3416420,1036,3415549,,26,61,"352bf401ac578d0c76f5e231b1739abe04e351f0",0,0,0,0,0,""
20210220,"OK",418318,,2996195,871,"posNeg",3414513,620,23606,188,,,,398563,,,,4155,23606,,,3388179,379753,2996195,,,,,,145659,20802,,,,,,,,,"40",973,3941,3415384,4914,3414513,,23,69,"15332f0e586a9f32e85aab57bdad4d66696a7b37",0,0,0,0,0,""
20210219,"OK",417345,,2992254,243,"posNeg",3409599,663,23537,199,,,,396736,,,,4132,23537,,,3383210,379464,2992254,,,,,,145659,20802,,,,,,,,,"40",869,5069,3409842,5938,3409599,,20,73,"e3ae57fd5940e9798980e9322aa2a576e815a37e",0,0,0,0,0,""
20210218,"OK",416476,,2987185,206,"posNeg",3403661,705,23464,216,,,,394968,,,,4112,23464,,,3378127,379130,2987185,,,,,,142681,19845,,,,,,,,,"40",618,2542,3403867,3160,3403661,,23,72,"7efdcf2c1efef39493ec676373027ef2736788ff",0,0,0,0,0,""
20210217,"OK",415858,,2984643,207,"posNeg",3400501,711,23392,202,,,,393169,,,,4089,23392,,,3374098,378721,2984643,,,,,,142681,19845,,,,,,,,,"40",1078,27038,3400708,28116,3400501,,28,122,"075e955ad714751be59cf60254ee06e9aa8229fc",0,0,0,0,0,""
20210216,"OK",414780,,2957605,3273,"posNeg",3372385,755,23270,229,,,,391156,,,,4061,23270,,,3343102,376862,2957605,,,,,,142681,19845,,,,,,,,,"40",508,0,3375658,508,3372385,,20,14,"a899253e62e7520344884970efc5d6c63371ed44",0,0,0,0,0,""
20210215,"OK",414272,,2957605,3273,"posNeg",3371877,755,23256,229,,,,389035,,,,4041,23256,,,3343102,376862,2957605,,,,,,142681,19845,,,,,,,,,"40",730,0,3375150,730,3371877,,17,8,"17326ead2e27ca4d5286174dc36d3517a1c8c809",0,0,0,0,0,""
20210214,"OK",413542,,2957605,3273,"posNeg",3371147,755,23248,229,,,,387837,,,,4024,23248,,,3343102,376862,2957605,,,,,,142681,19845,,,,,,,,,"40",1266,0,3374420,1266,3371147,,30,98,"decb3298f9e0e5be64be0d8b60239142df1dcec7",0,0,0,0,0,""
20210213,"OK",412276,,2957605,3273,"posNeg",3369881,755,23150,229,,,,386420,,,,3994,23150,,,3343102,376862,2957605,,,,,,142681,19845,,,,,,,,,"40",1458,9971,3373154,11429,3369881,,35,65,"00f4bb3f2c6c5ecad435122dcf14ce137c17a5b8",0,0,0,0,0,""
20210212,"OK",410818,,2947634,1256,"posNeg",3358452,806,23085,235,,,,384398,,,,3959,23085,,,3332630,376301,2947634,,,,,,139139,18634,,,,,,,,,"40",1417,13331,3359708,14748,3358452,,11,65,"f8ed077d3c82b6314d948914fe296424d1f1f7b7",0,0,0,0,0,""
20210211,"OK",409401,,2934303,3827,"posNeg",3343704,807,23020,240,,,,382342,,,,3948,23020,,,3317797,375771,2934303,,,,,,139139,18634,,,,,,,,,"40",1677,14947,3347531,16624,3343704,,48,90,"554c7dcd901ec1da853258357195631bae9f54ee",0,0,0,0,0,""
20210210,"OK",407724,,2919356,4017,"posNeg",3327080,856,22930,270,,,,380167,,,,3900,22930,,,3302040,374806,2919356,,,,,,139139,18634,,,,,,,,,"40",1660,16304,3331097,17964,3327080,,30,141,"81a31a119c00db7b913113afdca0c03d0613bdff",0,0,0,0,0,""
20210209,"OK",406064,,2903052,2524,"posNeg",3309116,864,22789,256,,,,377678,,,,3870,22789,,,3285081,373582,2903052,,,,,,139139,18634,,,,,,,,,"40",1070,13517,3311640,14587,3309116,,53,15,"8090a8a6d6288beb1b0d3fc19cbd03d4e71b972e",0,0,0,0,0,""
20210208,"OK",404994,,2889535,4128,"posNeg",3294529,917,22774,283,,,,374950,,,,3817,22774,,,3269963,372068,2889535,,,,,,139139,18634,,,,,,,,,"40",1040,0,3298657,1040,3294529,,4,23,"fedffc274b3cc8e969a945087d9344a2a74c7675",0,0,0,0,0,""
20210207,"OK",403954,,2889535,4128,"posNeg",3293489,917,22751,283,,,,373490,,,,3813,22751,,,3269963,372068,2889535,,,,,,139139,18634,,,,,,,,,"40",2174,0,3297617,2174,3293489,,52,158,"ad8949e2be7c4966aca58285bf5ee6c2db8efbc1",0,0,0,0,0,""
20210206,"OK",401780,,2889535,4128,"posNeg",3291315,917,22593,283,,,,371736,,,,3761,22593,,,3269963,372068,2889535,,,,,,139139,18634,,,,,,,,,"40",2053,23118,3295443,25171,3291315,,51,140,"8c1e692b962898955e7dd49c9178e896830671bf",0,0,0,0,0,""
20210205,"OK",399727,,2866417,3688,"posNeg",3266144,951,22453,284,,,,369278,,,,3710,22453,,,3243791,369792,2866417,,,,,,115559,11794,,,,,,,,,"40",2662,11978,3269832,14640,3266144,,29,136,"1d338d34251903f8ee896840e3eaf99d90919e44",0,0,0,0,0,""
20210204,"OK",397065,,2854439,4012,"posNeg",3251504,1008,22317,315,,,,366449,,,,3681,22317,,,3230563,367514,2854439,,,,,,115559,11794,,,,,,,,,"40",2782,15450,3255516,18232,3251504,,27,150,"ecbf5a0e65c30ff9d4d877eb401dc03638d7a7c8",0,0,0,0,0,""
20210203,"OK",394283,,2838989,4227,"posNeg",3233272,1048,22167,303,,,,363808,,,,3654,22167,,,3213657,366140,2838989,,,,,,115559,11794,,,,,,,,,"40",2119,16519,3237499,18638,3233272,,52,171,"bf2d8ffe9e2db6fe7185fde3877ab1a971a72174",0,0,0,0,0,""
20210202,"OK",392164,,2822470,2890,"posNeg",3214634,1123,21996,320,,,,360702,,,,3602,21996,,,3195609,364500,2822470,,,,,,115559,11794,,,,,,,,,"40",1296,27129,3217524,28425,3214634,,38,39,"5180d80046b5b8242e9a4c3aae7150e2af95c29c",0,0,0,0,0,""
20210201,"OK",390868,,2795341,4314,"posNeg",3186209,1184,21957,345,,,,358040,,,,3564,21957,,,3166000,360890,2795341,,,,,,115559,11794,,,,,,,,,"40",1396,0,3190523,1396,3186209,,17,36,"fcfe1dd5acb476858366ff35c2760e8ef2378cd2",0,0,0,0,0,""
20210131,"OK",389472,,2795341,4314,"posNeg",3184813,1184,21921,345,,,,356386,,,,3547,21921,,,3166000,360890,2795341,,,,,,115559,11794,,,,,,,,,"40",2882,0,3189127,2882,3184813,,43,153,"f16705dbbc4a79bdb556e7eb6a8de2485ff2587b",0,0,0,0,0,""
20210130,"OK",386590,,2795341,4314,"posNeg",3181931,1184,21768,345,,,,354223,,,,3504,21768,,,3166000,360890,2795341,,,,,,115559,11794,,,,,,,,,"40",2373,22371,3186245,24744,3181931,,33,148,"c39e0371abe4da0672f79434816f6e8b33c0c471",0,0,0,0,0,""
20210129,"OK",384217,,2772970,4824,"posNeg",3157187,1247,21620,352,,,,351545,,,,3471,21620,,,3139837,357641,2772970,,,,,,113470,11016,,,,,,,,,"40",2787,22490,3162011,25277,3157187,,48,142,"6eef23338aac4caa608975f894e8992c67a61d11",0,0,0,0,0,""
20210128,"OK",381430,,2750480,4596,"posNeg",3131910,1250,21478,341,,,,348836,,,,3423,21478,,,3114290,354444,2750480,,,,,,113470,11016,,,,,,,,,"40",2320,14393,3136506,16713,3131910,,35,164,"d72d0bd5ab1a1fbaf89c808ece96f98668bd9134",0,0,0,0,0,""
20210127,"OK",379110,,2736087,4563,"posNeg",3115197,1322,21314,368,,,,345867,,,,3388,21314,,,3096017,351659,2736087,,,,,,113470,11016,,,,,,,,,"40",2686,19379,3119760,22065,3115197,,65,221,"ad19f755bbace902189121a56c56c80f89395db2",0,0,0,0,0,""
20210126,"OK",376424,,2716708,2584,"posNeg",3093132,1454,21093,410,,,,342697,,,,3323,21093,,,3073902,349548,2716708,,,,,,113470,11016,,,,,,,,,"40",1571,25994,3095716,27565,3093132,,30,40,"fd2e4bbd7c48376e92ecd6916f4bc1382a4be083",0,0,0,0,0,""
20210125,"OK",374853,,2690714,3732,"posNeg",3065567,1595,21053,433,,,,339014,,,,3293,21053,,,3045125,345733,2690714,,,,,,113470,11016,,,,,,,,,"40",1763,0,3069299,1763,3065567,,14,33,"6ecc14ce2a8c82ed887cdd92c66fa748513ba369",0,0,0,0,0,""
20210124,"OK",373090,,2690714,3732,"posNeg",3063804,1595,21020,433,,,,337228,,,,3279,21020,,,3045125,345733,2690714,,,,,,113470,11016,,,,,,,,,"40",2941,0,3067536,2941,3063804,,48,171,"ae4f3045dab6c11cae5a2926ed2998afeec5a82e",0,0,0,0,0,""
20210123,"OK",370149,,2690714,3732,"posNeg",3060863,1595,20849,433,,,,334643,,,,3231,20849,,,3045125,345733,2690714,,,,,,113470,11016,,,,,,,,,"40",4157,16353,3064595,20510,3060863,,44,157,"cc038854a9577617b5f40fd34a6ff43303be4a1d",0,0,0,0,0,""
20210122,"OK",365992,,2674361,4216,"posNeg",3040353,1634,20692,438,,,,330478,,,,3187,20692,,,3025993,343616,2674361,,,,,,111630,10335,,,,,,,,,"40",2946,20759,3044569,23705,3040353,,47,187,"91646f69c66ed1bc1c3e36d5bb9a154776f6d606",0,0,0,0,0,""
20210121,"OK",363046,,2653602,3976,"posNeg",3016648,1722,20505,449,,,,327135,,,,3140,20505,,,3002865,341025,2653602,,,,,,111630,10335,,,,,,,,,"40",2686,11527,3020624,14213,3016648,,55,210,"4db048cd1f79eceab071b41e780f86a9235e11a4",0,0,0,0,0,""
20210120,"OK",360360,,2642075,3664,"posNeg",3002435,1776,20295,474,,,,323240,,,,3085,20295,,,2989880,339128,2642075,,,,,,111630,10335,,,,,,,,,"40",1986,41075,3006099,43061,3002435,,48,200,"ff72528ac718aaf2dfe2f65c9a8d2daec07c7584",0,0,0,0,0,""
20210119,"OK",358374,,2601000,4695,"posNeg",2959374,1866,20095,499,,,,319201,,,,3037,20095,,,2943409,335178,2601000,,,,,,111630,10335,,,,,,,,,"40",1558,0,2964069,1558,2959374,,43,32,"7c382d5a27e5f173ce24f23d840485720ed04b3e",0,0,0,0,0,""
20210118,"OK",356816,,2601000,4695,"posNeg",2957816,1866,20063,499,,,,314236,,,,2994,20063,,,2943409,335178,2601000,,,,,,111630,10335,,,,,,,,,"40",1837,0,2962511,1837,2957816,,7,27,"0a0ed3cf8c776df35e66a247e36bd3feac5dd472",0,0,0,0,0,""
20210117,"OK",354979,,2601000,4695,"posNeg",2955979,1866,20036,499,,,,311883,,,,2987,20036,,,2943409,335178,2601000,,,,,,111630,10335,,,,,,,,,"40",3314,0,2960674,3314,2955979,,35,230,"344e96978d5296aad7a419bbdf4059ed961c85ae",0,0,0,0,0,""
20210116,"OK",351665,,2601000,4695,"posNeg",2952665,1866,19806,499,,,,309057,,,,2952,19806,,,2943409,335178,2601000,,,,,,111630,10335,,,,,,,,,"40",3621,11592,2957360,15213,2952665,,27,190,"b398b2bd02505ecd07ffd1e801ca35a9cb696801",0,0,0,0,0,""
20210115,"OK",348044,,2589408,5356,"posNeg",2937452,1847,19616,470,,,,306874,,,,2925,19616,,,2928413,331450,2589408,,,,,,109422,9516,,,,,,,,,"40",3538,25547,2942808,29085,2937452,,43,156,"f5445b697e69a9bd257f1aec4732a4020216f78e",0,0,0,0,0,""
20210114,"OK",344506,,2563861,5573,"posNeg",2908367,1844,19460,474,,,,303476,,,,2882,19460,,,2898461,327292,2563861,,,,,,109422,9516,,,,,,,,,"40",3142,15835,2913940,18977,2908367,,34,261,"805f5c00b0940a8f99d166a63633d40b5f7f84e0",0,0,0,0,0,""
20210113,"OK",341364,,2548026,4425,"posNeg",2889390,1856,19199,477,,,,299375,,,,2848,19199,,,2881102,325935,2548026,,,,,,109422,9516,,,,,,,,,"40",3907,21403,2893815,25310,2889390,,44,247,"a31c00b4a60be533210ab51e0c9604110b91d1dc",0,0,0,0,0,""
20210112,"OK",337457,,2526623,2797,"posNeg",2864080,1902,18952,471,,,,294629,,,,2804,18952,,,2856548,322888,2526623,,,,,,109422,9516,,,,,,,,,"40",2210,26707,2866877,28917,2864080,,29,67,"8155555f4e484b80a4e807ab4c153a4788e65bbd",0,0,0,0,0,""
20210111,"OK",335247,,2499916,4745,"posNeg",2835163,1926,18885,467,,,,289309,,,,2775,18885,,,2827122,317146,2499916,,,,,,109422,9516,,,,,,,,,"40",3885,0,2839908,3885,2835163,,14,61,"34cda3887d2d523b52c08d7b1e51b5edcc225e77",0,0,0,0,0,""
20210110,"OK",331362,,2499916,4745,"posNeg",2831278,1926,18824,467,,,,285645,,,,2761,18824,,,2827122,317146,2499916,,,,,,109422,9516,,,,,,,,,"40",6487,0,2836023,6487,2831278,,23,186,"b157657170a5565f5b5a64ae3a681f8ce0274001",0,0,0,0,0,""
20210109,"OK",324875,,2499916,4745,"posNeg",2824791,1926,18638,467,,,,281869,,,,2738,18638,,,2827122,317146,2499916,,,,,,109422,9516,,,,,,,,,"40",4289,22588,2829536,26877,2824791,,35,220,"9facfa6a0795bdd7ae072637050c9f13f8638ccf",0,0,0,0,0,""
20210108,"OK",320586,,2477328,5669,"posNeg",2797914,1961,18418,477,,,,280430,,,,2703,18418,,,2799072,313050,2477328,,,,,,109422,9516,,,,,,,,,"40",5232,14387,2803583,19619,2797914,,31,225,"f623d2f057658a9af0c06099e3e21d5fcd89091e",0,0,0,0,0,""
20210107,"OK",315354,,2462941,5744,"posNeg",2778295,1987,18193,489,,,,277828,,,,2672,18193,,,2779745,309980,2462941,,,,,,107663,8943,,,,,,,,,"40",3781,15591,2784039,19372,2778295,,39,307,"069589e6a2971f7f4e07aa703738dc3d3534d686",0,0,0,0,0,""
20210106,"OK",311573,,2447350,4335,"posNeg",2758923,1994,17886,494,,,,274657,,,,2633,17886,,,2759122,306460,2447350,,,,,,107663,8943,,,,,,,,,"40",3305,17585,2763258,20890,2758923,,62,332,"0852489358300fe0bca06e1a7dc038cdc33c088a",0,0,0,0,0,""
20210105,"OK",308268,,2429765,2417,"posNeg",2738033,1909,17554,488,,,,271693,,,,2571,17554,,,2734583,300206,2429765,,,,,,107663,8943,,,,,,,,,"40",1497,35447,2740450,36944,2738033,,19,61,"a1ba921b53f85bd62749ccce4ee53ffc64a8e34b",0,0,0,0,0,""
20210104,"OK",306771,,2394318,4044,"posNeg",2701089,1910,17493,498,,,,267573,,,,2552,17493,,,2691172,291996,2394318,,,,,,107663,8943,,,,,,,,,"40",2699,0,2705133,2699,2701089,,5,52,"cd1ff1c3b9a222d6bc9f0663b523fbe6c99da7c4",0,0,0,0,0,""
20210103,"OK",304072,,2394318,4044,"posNeg",2698390,1910,17441,498,,,,265293,,,,2547,17441,,,2691172,291996,2394318,,,,,,107663,8943,,,,,,,,,"40",8017,0,2702434,8017,2698390,,20,194,"2db6fde938eacfee324c88672ca07b39e806e1b7",0,0,0,0,0,""
20210102,"OK",296055,,2394318,4044,"posNeg",2690373,1910,17247,498,,,,259841,,,,2527,17247,,,2691172,291996,2394318,,,,,,106188,8502,,,,,,,,,"40",5119,0,2694417,5119,2690373,,38,188,"04e074767d08d3c00e3c557739b0c332d86ab477",0,0,0,0,0,""
20210101,"OK",290936,,2394318,4044,"posNeg",2685254,1910,17059,498,,,,255843,,,,2489,17059,,,2691172,291996,2394318,,,,,,106188,8502,,,,,,,,,"40",0,17009,2689298,17009,2685254,,0,0,"09a56c4b9c4deaf8b387e1eb8d37400fdbfa2aa7",0,0,0,0,0,""
20201231,"OK",290936,,2377309,7436,"posNeg",2668245,1924,17059,501,,,,255843,,,,2489,17059,,,2669170,287543,2377309,,,,,,106188,8502,,,,,,,,,"40",3906,14965,2675681,18871,2668245,,36,246,"fa3a6bbdb777dd8d306738802ba8cc7a4db839d1",0,0,0,0,0,""
20201230,"OK",287030,,2362344,6775,"posNeg",2649374,1916,16813,486,,,,252214,,,,2453,16813,,,2650724,283404,2362344,,,,,,106188,8502,,,,,,,,,"40",3249,26435,2656149,29684,2649374,,48,387,"a8367ac075617654b26ec38ce90a0a8e69e2b014",0,0,0,0,0,""
20201229,"OK",283781,,2335909,2528,"posNeg",2619690,1927,16426,499,,,,248748,,,,2405,16426,,,2618975,278250,2335909,,,,,,106188,8502,,,,,,,,,"40",1194,21237,2622218,22431,2619690,,22,90,"ed027b2054d34c782f0f874264cd43493bf076f3",0,0,0,0,0,""
20201228,"OK",282587,,2314672,3048,"posNeg",2597259,1729,16336,451,,,,244676,,,,2383,16336,,,2591908,272549,2314672,,,,,,106188,8502,,,,,,,,,"40",3448,0,2600307,3448,2597259,,13,47,"5169a1b4b5774a2d0c9681cc64cb395cec6accb2",0,0,0,0,0,""
20201227,"OK",279139,,2314672,3048,"posNeg",2593811,1729,16289,451,,,,243018,,,,2370,16289,,,2591908,272549,2314672,,,,,,106188,8502,,,,,,,,,"40",2631,0,2596859,2631,2593811,,13,167,"7e9cb9c992fb7bcfc4ab9c48c79497f53a8e7070",0,0,0,0,0,""
20201226,"OK",276508,,2314672,3048,"posNeg",2591180,1729,16122,451,,,,238103,,,,2357,16122,,,2591908,272549,2314672,,,,,,103518,7767,,,,,,,,,"40",3955,0,2594228,3955,2591180,,29,210,"07f5ae33a5a700820c450d7e75cd97211839f3ef",0,0,0,0,0,""
20201225,"OK",272553,,2314672,3048,"posNeg",2587225,1729,15912,451,,,,234967,,,,2328,15912,,,2591908,272549,2314672,,,,,,103518,7767,,,,,,,,,"40",0,18341,2590273,18341,2587225,,0,0,"10579aca6fdcd625b6ef1168432f01e1f05852cd",0,0,0,0,0,""
20201224,"OK",272553,,2296331,7147,"posNeg",2568884,1836,15912,477,,,,234967,"12/24/2020 00:00","2020-12-24T00:00:00Z","12/23 19:00",2328,15912,,"2020-12-24T00:00:00Z",2570120,268811,2296331,,,,,,103518,7767,,,,,,,,,"40",3277,22352,2576031,25629,2568884,,45,234,"aa064ae3e4d6d5a5d83a0b8049b07bd7e48c9cfe",0,0,0,0,0,""
20201223,"OK",269276,,2273979,6542,"posNeg",2543255,1728,15678,449,,,,231522,"12/23/2020 00:00","2020-12-23T00:00:00Z","12/22 19:00",2283,15678,,"2020-12-23T00:00:00Z",2543976,265379,2273979,,,,,,103518,7767,,,,,,,,,"40",3656,22662,2549797,26318,2543255,,43,274,"f88a08ad7abf16fa5643f674ce89d05272963d82",0,0,0,0,0,""
20201222,"OK",265620,,2251317,2723,"posNeg",2516937,1759,15404,481,,,,228191,"12/22/2020 00:00","2020-12-22T00:00:00Z","12/21 19:00",2240,15404,,"2020-12-22T00:00:00Z",2517012,261271,2251317,,,,,,103518,7767,,,,,,,,,"40",2186,52569,2519660,54755,2516937,,22,46,"8f9e4967699b8fb3fca31a7e32e3d57262340891",0,0,0,0,0,""
20201221,"OK",263434,,2198748,5287,"posNeg",2462182,1704,15358,455,,,,224672,"12/21/2020 00:00","2020-12-21T00:00:00Z","12/20 19:00",2218,15358,,"2020-12-21T00:00:00Z",2455624,252446,2198748,,,,,,103518,7767,,,,,,,,,"40",2596,0,2467469,2596,2462182,,6,49,"11a909e67a390132fd2dd28d7b4f34e21443bd8c",0,0,0,0,0,""
20201220,"OK",260838,,2198748,5287,"posNeg",2459586,1704,15309,455,,,,222874,"12/20/2020 00:00","2020-12-20T00:00:00Z","12/19 19:00",2212,15309,,"2020-12-20T00:00:00Z",2455624,252446,2198748,,,,,,103518,7767,,,,,,,,,"40",4970,0,2464873,4970,2459586,,23,178,"692d98cf441e51ebddcfea73cb367431828ea899",0,0,0,0,0,""
20201219,"OK",255868,,2198748,5287,"posNeg",2454616,1704,15131,455,,,,220474,"12/19/2020 00:00","2020-12-19T00:00:00Z","12/18 19:00",2189,15131,,"2020-12-19T00:00:00Z",2455624,252446,2198748,,,,,,103518,7767,,,,,,,,,"40",4108,6661,2459903,10769,2454616,,28,161,"5ac97a8ce3da217708b36d7264f7e7dc2a815ef2",0,0,0,0,0,""
20201218,"OK",251760,,2192087,6378,"posNeg",2443847,1733,14970,460,,,,217534,"12/18/2020 00:00","2020-12-18T00:00:00Z","12/17 19:00",2161,14970,,"2020-12-18T00:00:00Z",2447260,250641,2192087,,,,,,101297,7147,,,,,,,,,"40",3556,33450,2450225,37006,2443847,,17,149,"f054689e4fc9b184275ed3a204d8e84e5cae92f3",0,0,0,0,0,""
20201217,"OK",248204,,2158637,5902,"posNeg",2406841,1699,14821,481,,,,214290,"12/17/2020 00:00","2020-12-17T00:00:00Z","12/16 19:00",2144,14821,,"2020-12-17T00:00:00Z",2403117,244480,2158637,,,,,,101297,7147,,,,,,,,,"40",2975,0,2412743,2975,2406841,,16,156,"2f59309b1950a9d24affc39c3198cfc45aca3070",0,0,0,0,0,""
20201216,"OK",245229,,2158637,5902,"posNeg",2403866,1717,14665,481,,,,210907,"12/16/2020 00:00","2020-12-16T00:00:00Z","12/15 19:00",2128,14665,,"2020-12-16T00:00:00Z",2403117,244480,2158637,,,,,,101297,7147,,,,,,,,,"40",3238,10680,2409768,13918,2403866,,42,257,"a6453ee17f6b7438ea64d53f782866e9f99829c8",0,0,0,0,0,""
20201215,"OK",241991,,2147957,2777,"posNeg",2389948,1741,14408,471,,,,206896,"12/15/2020 00:00","2020-12-15T00:00:00Z","12/14 19:00",2086,14408,,"2020-12-15T00:00:00Z",2395251,242962,2147957,,,,,,101297,7147,,,,,,,,,"40",2224,37478,2392725,39702,2389948,,14,46,"ceb670e83a5e67be6851258ac0b803bba650b17c",0,0,0,0,0,""
20201214,"OK",239767,,2110479,4546,"posNeg",2350246,1664,14362,452,,,,202532,"12/14/2020 00:00","2020-12-14T00:00:00Z","12/13 19:00",2072,14362,,"2020-12-14T00:00:00Z",2350120,235774,2110479,,,,,,101297,7147,,,,,,,,,"40",2099,0,2354792,2099,2350246,,8,34,"7d16f4a8c3cc0dba91f1768b268b50f50042ec30",0,0,0,0,0,""
20201213,"OK",237668,,2110479,4546,"posNeg",2348147,1664,14328,452,,,,200512,"12/13/2020 00:00","2020-12-13T00:00:00Z","12/12 19:00",2064,14328,,"2020-12-13T00:00:00Z",2350120,235774,2110479,,,,,,101297,7147,,,,,,,,,"40",4332,0,2352693,4332,2348147,,22,158,"2785c8c55be2af90476d55f1054b74d80bb3a210",0,0,0,0,0,""
20201212,"OK",233336,,2110479,4546,"posNeg",2343815,1664,14170,452,,,,198154,"12/12/2020 00:00","2020-12-12T00:00:00Z","12/11 19:00",2042,14170,,"2020-12-12T00:00:00Z",2350120,235774,2110479,,,,,,101297,7147,,,,,,,,,"40",3983,19113,2348361,23096,2343815,,35,198,"d36280a99ca14251f492deaa50348f4fa7a7e7e9",0,0,0,0,0,""
20201211,"OK",229353,,2091366,6707,"posNeg",2320719,1730,13972,456,,,,195643,"12/11/2020 00:00","2020-12-11T00:00:00Z","12/10 19:00",2007,13972,,"2020-12-11T00:00:00Z",2328039,232890,2091366,,,,,,101297,7147,,,,,,,,,"40",3900,19198,2327426,23098,2320719,,27,190,"51745dc7baa77b6d6af1499e2ed64b1f5382f53f",0,0,0,0,0,""
20201210,"OK",225453,,2072168,5716,"posNeg",2297621,1709,13782,459,,,,194229,"12/10/2020 00:00","2020-12-10T00:00:00Z","12/09 19:00",1980,13782,,"2020-12-10T00:00:00Z",2304736,229256,2072168,,,,,,98949,6539,,,,,,,,,"40",2460,16250,2303337,18710,2297621,,35,146,"b3ac6ad9633ee8d79ba1fd32b14b4a02baab90ce",0,0,0,0,0,""
20201209,"OK",222993,,2055918,6466,"posNeg",2278911,1745,13636,465,,,,191525,"12/9/2020 00:00","2020-12-09T00:00:00Z","12/08 19:00",1945,13636,,"2020-12-09T00:00:00Z",2285869,226305,2055918,,,,,,98949,6539,,,,,,,,,"40",2307,16945,2285377,19252,2278911,,23,244,"a2675161d06f496880cb0e470685c05026761bf8",0,0,0,0,0,""
20201208,"OK",220686,,2038973,3173,"posNeg",2259659,1698,13392,469,,,,189020,"12/8/2020 00:00","2020-12-08T00:00:00Z","12/07 19:00",1922,13392,,"2020-12-08T00:00:00Z",2266778,224116,2038973,,,,,,98949,6539,,,,,,,,,"40",2297,30144,2262832,32441,2259659,,11,19,"dd03ec4ce0af477a5cc05faba9e1d1717d536fb3",0,0,0,0,0,""
20201207,"OK",218389,,2008829,7028,"posNeg",2227218,1721,13373,472,,,,184736,"12/7/2020 00:00","2020-12-07T00:00:00Z","12/06 19:00",1911,13373,,"2020-12-07T00:00:00Z",2227777,218948,2008829,,,,,,98949,6539,,,,,,,,,"40",1903,0,2234246,1903,2227218,,15,254,"fa03d3f0683227c10beb5e57dc70abf9eb474612",0,0,0,0,0,""
20201206,"OK",216486,,2008829,7028,"posNeg",2225315,1721,13119,472,,,,182942,"12/6/2020 00:00","2020-12-06T00:00:00Z","12/05 19:00",1896,13119,,"2020-12-06T00:00:00Z",2227777,218948,2008829,,,,,,98949,6539,,,,,,,,,"40",3241,0,2232343,3241,2225315,,22,-9,"b53e6c6605bb4ebb87f731bde64ef628336d432c",0,0,0,0,0,""
20201205,"OK",213245,,2008829,7028,"posNeg",2222074,1721,13128,472,,,,180810,"12/5/2020 00:00","2020-12-05T00:00:00Z","12/04 19:00",1874,13128,,"2020-12-05T00:00:00Z",2227777,218948,2008829,,,,,,98949,6539,,,,,,,,,"40",4370,26060,2229102,30430,2222074,,14,179,"a56a33e663e939c6c8a7d403939fb9a58224e8d1",0,0,0,0,0,""
20201204,"OK",208875,,1982769,6353,"posNeg",2191644,1687,12949,482,,,,177564,"12/4/2020 00:00","2020-12-04T00:00:00Z","12/03 19:00",1860,12949,,"2020-12-04T00:00:00Z",2199782,213944,1982769,,,,,,97315,6248,,,,,,,,,"40",4827,25328,2197997,30155,2191644,,24,176,"b4bfc2d33c84881bbe751c316de81176f71d2187",0,0,0,0,0,""
20201203,"OK",204048,,1957441,8714,"posNeg",2161489,1734,12773,474,,,,174169,"12/3/2020 00:00","2020-12-03T00:00:00Z","12/02 19:00",1836,12773,,"2020-12-03T00:00:00Z",2171465,210176,1957441,,,,,,97315,6248,,,,,,,,,"40",1707,16703,2170203,18410,2161489,,24,195,"85b9b1cd7b6809e7609a6638db34378c7a3a8dad",0,0,0,0,0,""
20201202,"OK",202341,,1940738,8035,"posNeg",2143079,1782,12578,475,,,,170905,"12/2/2020 00:00","2020-12-02T00:00:00Z","12/01 19:00",1812,12578,,"2020-12-02T00:00:00Z",2151411,206750,1940738,,,,,,97315,6248,,,,,,,,,"40",2859,17270,2151114,20129,2143079,,54,285,"d281b43f858bd0f95633fe092884de1df46b9fa9",0,0,0,0,0,""
20201201,"OK",199482,,1923468,2557,"posNeg",2122950,1718,12293,461,,,,167406,"12/1/2020 00:00","2020-12-01T00:00:00Z","11/30 19:00",1758,12293,,"2020-12-01T00:00:00Z",2130748,203926,1923468,,,,,,97315,6248,,,,,,,,,"40",1737,50000,2125507,51737,2122950,,15,35,"3adc7ad94048adaea38fdffc03aaa6132f9d77a6",0,0,0,0,0,""
20201130,"OK",197745,,1873468,8776,"posNeg",2071213,1653,12258,432,,,,163727,"11/30/2020 00:00","2020-11-30T00:00:00Z","11/29 19:00",1743,12258,,"2020-11-30T00:00:00Z",2071937,195044,1873468,,,,,,95129,5828,,,,,,,,,"40",2200,0,2079989,2200,2071213,,7,37,"459ab011903251e962728b6f6287cd77d9114522",0,0,0,0,0,""
20201129,"OK",195545,,1873468,8776,"posNeg",2069013,1653,12221,432,,,,161955,"11/29/2020 00:00","2020-11-29T00:00:00Z","11/28 19:00",1736,12221,,"2020-11-29T00:00:00Z",2071937,195044,1873468,,,,,,95129,5828,,,,,,,,,"40",1721,0,2077789,1721,2069013,,19,141,"2af43fd901f22599e816cc25f3783bab8c9531f7",0,0,0,0,0,""
20201128,"OK",193824,,1873468,8776,"posNeg",2067292,1653,12080,432,,,,159894,"11/28/2020 00:00","2020-11-28T00:00:00Z","11/27 19:00",1717,12080,,"2020-11-28T00:00:00Z",2071937,195044,1873468,,,,,,95129,5828,,,,,,,,,"40",6257,0,2076068,6257,2067292,,13,182,"a00164c22e9fb58c7ee980aa566f48535f4a518e",0,0,0,0,0,""
20201127,"OK",187567,,1873468,8776,"posNeg",2061035,1653,11898,432,,,,152969,"11/26/2020 00:00","2020-11-26T00:00:00Z","11/25 19:00",1704,11898,,"2020-11-26T00:00:00Z",2071937,195044,1873468,,,,,,95129,5828,,,,,,,,,"40",3225,0,2069811,3225,2061035,,24,190,"86bc97ec30cca9c51bd1a943398456b87def8c19",0,0,0,0,0,""
20201126,"OK",184342,,1873468,8776,"posNeg",2057810,1653,11708,432,,,,149345,"11/25/2020 00:00","2020-11-25T00:00:00Z","11/24 19:00",1680,11708,,"2020-11-25T00:00:00Z",2071937,195044,1873468,,,,,,95129,5828,,,,,,,,,"40",0,24905,2066586,24905,2057810,,0,0,"dd45c57ca7ebfa392dc545e56a7ff27fee46de52",0,0,0,0,0,""
20201125,"OK",184342,,1848563,7991,"posNeg",2032905,1604,11708,432,,,,149345,"11/25/2020 00:00","2020-11-25T00:00:00Z","11/24 19:00",1680,11708,,"2020-11-25T00:00:00Z",2043492,191157,1848563,,,,,,95129,5828,,,,,,,,,"40",3732,18164,2040896,21896,2032905,,16,263,"beac89315a3653ab558e02ba0900e3bac323835b",0,0,0,0,0,""
20201124,"OK",180610,,1830399,3958,"posNeg",2011009,1566,11445,446,,,,145686,"11/24/2020 00:00","2020-11-24T00:00:00Z","11/23 19:00",1664,11445,,"2020-11-24T00:00:00Z",2023392,188655,1830999,,,,,,95129,5828,,,,,,,,,"40",2736,40754,2014967,43490,2011009,,15,77,"46a1afb91cd086b5390abc8537a28f7d1c18c64f",0,0,0,0,0,""
20201123,"OK",177874,,1789645,11610,"posNeg",1967519,1505,11368,450,,,,142381,"11/23/2020 00:00","2020-11-23T00:00:00Z","11/22 19:00",1649,11368,,"2020-11-23T00:00:00Z",1975039,180908,1789645,,,,,,95129,5828,,,,,,,,,"40",3544,0,1979129,3544,1967519,,15,35,"43040903231a4acbb602cef29bed53af2eab0e56",0,0,0,0,0,""
20201122,"OK",174330,,1789645,11610,"posNeg",1963975,1505,11333,450,,,,140312,"11/22/2020 00:00","2020-11-22T00:00:00Z","11/21 19:00",1634,11333,,"2020-11-22T00:00:00Z",1975039,180908,1789645,,,,,,95129,5828,,,,,,,,,"40",3406,0,1975585,3406,1963975,,10,149,"20c23a6c4b8f99f4eeec4407e6ade930137122ea",0,0,0,0,0,""
20201121,"OK",170924,,1789645,11610,"posNeg",1960569,1505,11184,450,,,,137887,"11/21/2020 00:00","2020-11-21T00:00:00Z","11/20 19:00",1624,11184,,"2020-11-21T00:00:00Z",1975039,180908,1789645,,,,,,95129,5828,,,,,,,,,"40",3663,49720,1972179,53383,1960569,,21,164,"c726592032ad39dd133abe33f52bd0e0c937c787",0,0,0,0,0,""
20201120,"OK",167261,,1739925,10220,"posNeg",1907186,1428,11020,421,,,,134934,"11/20/2020 00:00","2020-11-20T00:00:00Z","11/19 19:00",1603,11020,,"2020-11-20T00:00:00Z",1917639,173518,1739925,,,,,,95129,5828,,,,,,,,,"40",2921,13704,1917406,16625,1907186,,15,184,"1d89e41c4937a312dd6c71125d1be3f24f3c3e6c",0,0,0,0,0,""
20201119,"OK",164340,,1726221,8601,"posNeg",1890561,1381,10836,389,,,,132268,"11/19/2020 00:00","2020-11-19T00:00:00Z","11/18 19:00",1588,10836,,"2020-11-19T00:00:00Z",1902220,171369,1726221,,,,,,93221,5545,,,,,,,,,"40",2915,18705,1899162,21620,1890561,,18,149,"e67e11c79744a8d7e25059257e5985fbe8d646ef",0,0,0,0,0,""
20201118,"OK",161425,,1707516,7129,"posNeg",1868941,1434,10687,447,,,,130032,"11/18/2020 00:00","2020-11-18T00:00:00Z","11/17 19:00",1570,10687,,"2020-11-18T00:00:00Z",1880494,169267,1707516,,,,,,93221,5545,,,,,,,,,"40",3017,14905,1876070,17922,1868941,,26,206,"1da8c0448361babb4963695e16da7b25c2a50079",0,0,0,0,0,""
20201117,"OK",158408,,1692611,3537,"posNeg",1851019,1381,10481,390,,,,128057,"11/17/2020 00:00","2020-11-17T00:00:00Z","11/16 19:00",1544,10481,,"2020-11-17T00:00:00Z",1859256,166645,1692611,,,,,,93221,5545,,,,,,,,,"40",1551,39012,1854556,40563,1851019,,6,64,"93e30feb17128c0e7378bc2f1ce2c8cd88074d27",0,0,0,0,0,""
20201116,"OK",156857,,1653599,7999,"posNeg",1810456,1247,10417,362,,,,126162,"11/16/2020 00:00","2020-11-16T00:00:00Z","11/15 19:00",1538,10417,,"2020-11-16T00:00:00Z",1816690,159890,1653599,,,,,,93221,5545,,,,,,,,,"40",2729,0,1818455,2729,1810456,,10,45,"b21ea26a1a008dbab29bac2e6faac7f43d510448",0,0,0,0,0,""
20201115,"OK",154128,,1653599,7999,"posNeg",1807727,1247,10372,362,,,,124793,"11/15/2020 00:00","2020-11-15T00:00:00Z","11/14 19:00",1528,10372,,"2020-11-15T00:00:00Z",1816690,159890,1653599,,,,,,93221,5545,,,,,,,,,"40",3923,0,1815726,3923,1807727,,12,101,"07458c2dfa08eef8e08ba35390febc97066a01fd",0,0,0,0,0,""
20201114,"OK",150205,,1653599,7999,"posNeg",1803804,1247,10271,362,,,,123333,"11/14/2020 00:00","2020-11-14T00:00:00Z","11/13 19:00",1516,10271,,"2020-11-14T00:00:00Z",1816690,159890,1653599,,,,,,93221,5545,,,,,,,,,"40",2847,9934,1811803,12781,1803804,,23,165,"12cd3763e27f37f7cd019c807526f0283d54d2cf",0,0,0,0,0,""
20201113,"OK",147358,,1643665,6434,"posNeg",1791023,1279,10106,350,,,,121774,"11/13/2020 00:00","2020-11-13T00:00:00Z","11/12 19:00",1493,10106,,"2020-11-13T00:00:00Z",1803710,156722,1643665,,,,,,93221,5545,,,,,,,,,"40",2667,37862,1797457,40529,1791023,,12,76,"20f0c08753cbccdd7407e3342b83fd4be459e64e",0,0,0,0,0,""
20201112,"OK",144691,,1605803,5720,"posNeg",1750494,1248,10030,340,,,,120426,"11/12/2020 00:00","2020-11-12T00:00:00Z","11/11 19:00",1481,10030,,"2020-11-12T00:00:00Z",1759745,151156,1605803,,,,,,91240,5285,,,,,,,,,"40",2357,0,1756214,2357,1750494,,11,162,"e8146817502405e0458401735657d8f25a4940b9",0,0,0,0,0,""
20201111,"OK",142334,,1605803,5720,"posNeg",1748137,1248,9868,340,,,,119144,"11/11/2020 00:00","2020-11-11T00:00:00Z","11/10 19:00",1470,9868,,"2020-11-11T00:00:00Z",1759745,151156,1605803,,,,,,91240,5285,,,,,,,,,"40",2177,12762,1753857,14939,1748137,,19,186,"b89b26407572792514981c2bf3e07e90ef880d96",0,0,0,0,0,""
20201110,"OK",140157,,1593041,3076,"posNeg",1733198,1102,9682,334,,,,118074,"11/10/2020 00:00","2020-11-10T00:00:00Z","11/09 19:00",1451,9682,,"2020-11-10T00:00:00Z",1746641,150778,1593041,,,,,,91240,5285,,,,,,,,,"40",1702,21720,1736274,23422,1733198,,7,61,"6ce330791aa5fe0174996bfc08b6ef42f3f186a4",0,0,0,0,0,""
20201109,"OK",138455,,1571321,17869,"posNeg",1709776,1045,9621,312,,,,116882,"11/8/2020 00:00","2020-11-08T00:00:00Z","11/07 19:00",1444,9621,,"2020-11-08T00:00:00Z",1720070,145687,1571321,,,,,,91240,5285,,,,,,,,,"40",2197,0,1727645,2197,1709776,,6,51,"b9c27460481820368ba36f9759d99cd1ce02acda",0,0,0,0,0,""
20201108,"OK",136258,,1571321,17869,"posNeg",1707579,1045,9570,312,,,,115030,"11/7/2020 00:00","2020-11-07T00:00:00Z","11/06 19:00",1438,9570,,"2020-11-07T00:00:00Z",1720070,145687,1571321,,,,,,91240,5285,,,,,,,,,"40",4507,0,1725448,4507,1707579,,9,132,"9848d2d502b921cb200b8fc169d548e61bd9ed2e",0,0,0,0,0,""
20201107,"OK",131751,,1571321,17869,"posNeg",1703072,1045,9438,312,,,,113227,"11/6/2020 00:00","2020-11-06T00:00:00Z","11/05 19:00",1429,9438,,"2020-11-06T00:00:00Z",1720070,145687,1571321,,,,,,91240,5285,,,,,,,,,"40",0,13471,1720941,13471,1703072,,0,0,"6cbccf50047d479188b505b734e8ba326e49c071",0,0,0,0,0,""
20201106,"OK",131751,,1557850,6437,"posNeg",1689601,1025,9438,326,,,,113227,"11/6/2020 00:00","2020-11-06T00:00:00Z","11/05 19:00",1429,9438,,"2020-11-06T00:00:00Z",1705067,144206,1557850,,,,,,91240,5285,,,,,,,,,"40",1878,14166,1696038,16044,1689601,,16,100,"12de4cc278f0df04c79d0d259cc7a1de603d37a8",0,0,0,0,0,""
20201105,"OK",129873,,1543684,5883,"posNeg",1673557,1055,9338,337,,,,111695,"11/5/2020 00:00","2020-11-05T00:00:00Z","11/04 19:00",1413,9338,,"2020-11-05T00:00:00Z",1688812,142196,1543684,,,,,,89217,5049,,,,,,,,,"40",2101,14339,1679440,16440,1673557,,21,119,"575795fe3e68dc160447620e846a26d6c240ebd9",0,0,0,0,0,""
20201104,"OK",127772,,1529345,4871,"posNeg",1657117,1026,9219,349,,,,110453,"11/4/2020 00:00","2020-11-04T00:00:00Z","11/03 19:00",1392,9219,,"2020-11-04T00:00:00Z",1671901,139642,1529345,,,,,,89217,5049,,,,,,,,,"40",1246,8532,1661988,9778,1657117,,17,115,"984c7037f76721212ef216cee6f34ef398c5c653",0,0,0,0,0,""
20201103,"OK",126526,,1520813,2807,"posNeg",1647339,974,9104,336,,,,109234,"11/3/2020 00:00","2020-11-03T00:00:00Z","11/02 19:00",1375,9104,,"2020-11-03T00:00:00Z",1663016,138655,1520813,,,,,,89217,5049,,,,,,,,,"40",1331,26181,1650146,27512,1647339,,21,170,"3f84ebada620244166ccf9f5a57155825d8b485c",0,0,0,0,0,""
20201102,"OK",125195,,1494632,5493,"posNeg",1619827,852,8934,322,,,,107893,"11/2/2020 00:00","2020-11-02T00:00:00Z","11/01 19:00",1354,8934,,"2020-11-02T00:00:00Z",1632701,135119,1494632,,,,,,89217,5049,,,,,,,,,"40",1084,0,1625320,1084,1619827,,9,23,"41715ae8dbc92e5c6a1d7243e8ba8712725d05d8",0,0,0,0,0,""
20201101,"OK",124111,,1494632,5493,"posNeg",1618743,852,8911,322,,,,107082,"11/1/2020 00:00","2020-11-01T00:00:00Z","10/31 20:00",1345,8911,,"2020-11-01T00:00:00Z",1632701,135119,1494632,,,,,,89217,5049,,,,,,,,,"40",1349,0,1624236,1349,1618743,,8,22,"d87d46a4d0dd1780b08503cc012473d994da971a",0,0,0,0,0,""
20201031,"OK",122762,,1494632,5493,"posNeg",1617394,852,8889,322,,,,106292,"10/31/2020 00:00","2020-10-31T00:00:00Z","10/30 20:00",1337,8889,,"2020-10-31T00:00:00Z",1632701,135119,1494632,,,,,,89217,5049,,,,,,,,,"40",1267,14352,1622887,15619,1617394,,11,111,"1d307382f1e8fa886a595810c86659ed268cdedc",0,0,0,0,0,""
20201030,"OK",121495,,1480280,6061,"posNeg",1601775,865,8778,301,,,,105137,"10/30/2020 00:00","2020-10-30T00:00:00Z","10/29 20:00",1326,8778,,"2020-10-30T00:00:00Z",1618126,134069,1480280,,,,,,87553,4814,,,,,,,,,"40",1302,14288,1607836,15590,1601775,,20,90,"5c9bb8cd8a4c43932fc83a354ef47f3099604110",0,0,0,0,0,""
20201029,"OK",120193,,1465992,5373,"posNeg",1586185,874,8688,305,,,,103919,"10/29/2020 00:00","2020-10-29T00:00:00Z","10/28 20:00",1306,8688,,"2020-10-29T00:00:00Z",1601776,132701,1465992,,,,,,87553,4814,,,,,,,,,"40",1041,9278,1591558,10319,1586185,,20,79,"0908cab77a7fabced230e056d214a4e5733b1767",0,0,0,0,0,""
20201028,"OK",119152,,1456714,4561,"posNeg",1575866,885,8609,305,,,,102792,"10/28/2020 00:00","2020-10-28T00:00:00Z","10/27 20:00",1286,8609,,"2020-10-28T00:00:00Z",1590622,131411,1456714,,,,,,87553,4814,,,,,,,,,"40",743,10647,1580427,11390,1575866,,13,69,"36e6ea623ae0e8069ade5eefd1d91184c2ce044c",0,0,0,0,0,""
20201027,"OK",118409,,1446067,3078,"posNeg",1564476,907,8540,286,,,,101656,"10/27/2020 00:00","2020-10-27T00:00:00Z","10/26 20:00",1273,8540,,"2020-10-27T00:00:00Z",1578912,130528,1446067,,,,,,87553,4814,,,,,,,,,"40",1010,29043,1567554,30053,1564476,,22,132,"2a492793ec051515c48c2fb65e65f493022f4d49",0,0,0,0,0,""
20201026,"OK",117399,,1417024,6135,"posNeg",1534423,924,8408,305,,,,100357,"10/26/2020 00:00","2020-10-26T00:00:00Z","10/25 20:00",1251,8408,,"2020-10-26T00:00:00Z",1546238,127051,1417024,,,,,,87553,4814,,,,,,,,,"40",663,0,1540558,663,1534423,,2,22,"27000c1b61275bb9bc64b6b3ae419b96a75012ed",0,0,0,0,0,""
20201025,"OK",116736,,1417024,6135,"posNeg",1533760,924,8386,305,,,,99541,"10/25/2020 00:00","2020-10-25T00:00:00Z","10/24 20:00",1249,8386,,"2020-10-25T00:00:00Z",1546238,127051,1417024,,,,,,87553,4814,,,,,,,,,"40",1051,0,1539895,1051,1533760,,4,26,"b3cb3df26bc7270f0df2aed59607f02beb431349",0,0,0,0,0,""
20201024,"OK",115685,,1417024,6135,"posNeg",1532709,924,8360,305,,,,98700,"10/24/2020 00:00","2020-10-24T00:00:00Z","10/23 20:00",1245,8360,,"2020-10-24T00:00:00Z",1546238,127051,1417024,,,,,,87553,4814,,,,,,,,,"40",1829,19328,1538844,21157,1532709,,11,95,"d430ed926718eb0afa54b5511a434ed54b94270c",0,0,0,0,0,""
20201023,"OK",113856,,1397696,6858,"posNeg",1511552,956,8265,313,,,,97490,"10/23/2020 00:00","2020-10-23T00:00:00Z","10/22 20:00",1234,8265,,"2020-10-23T00:00:00Z",1525561,125427,1397696,,,,,,85717,4635,,,,,,,,,"40",1373,19091,1518410,20464,1511552,,13,95,"0703147622e5ca590260f23bc00e9710debdac96",0,0,0,0,0,""
20201022,"OK",112483,,1378605,7112,"posNeg",1491088,910,8170,297,,,,96245,"10/22/2020 00:00","2020-10-22T00:00:00Z","10/21 20:00",1221,8170,,"2020-10-22T00:00:00Z",1504068,123241,1378605,,,,,,85717,4635,,,,,,,,,"40",1628,11235,1498200,12863,1491088,,11,93,"e36be3f95c684186a861eca106a5825f983d4854",0,0,0,0,0,""
20201021,"OK",110855,,1367370,5271,"posNeg",1478225,870,8077,317,,,,94979,"10/21/2020 00:00","2020-10-21T00:00:00Z","10/20 20:00",1210,8077,,"2020-10-21T00:00:00Z",1491841,122518,1367370,,,,,,85717,4635,,,,,,,,,"40",1307,9908,1483496,11215,1478225,,19,113,"70f04386f02f99bef3c6b646bbdfcbbcfdee9eaf",0,0,0,0,0,""
20201020,"OK",109548,,1357462,3137,"posNeg",1467010,821,7964,319,,,,93698,"10/20/2020 00:00","2020-10-20T00:00:00Z","10/19 20:00",1191,7964,,"2020-10-20T00:00:00Z",1480763,121425,1357462,,,,,,85717,4635,,,,,,,,,"40",1475,29930,1470147,31405,1467010,,18,149,"d407f205b622e003d2774d932b498851c93ba7ff",0,0,0,0,0,""
20201019,"OK",108073,,1327532,7287,"posNeg",1435605,792,7815,301,,,,92367,"10/19/2020 00:00","2020-10-19T00:00:00Z","10/18 20:00",1173,7815,,"2020-10-19T00:00:00Z",1448159,118537,1327532,,,,,,85717,4635,,,,,,,,,"40",774,0,1442892,774,1435605,,2,17,"8fe06a86a913b43048aa71d0436a8b2727abfd38",0,0,0,0,0,""
20201018,"OK",107299,,1327532,7287,"posNeg",1434831,792,7798,301,,,,91643,"10/18/2020 00:00","2020-10-18T00:00:00Z","10/17 20:00",1171,7798,,"2020-10-18T00:00:00Z",1448159,118537,1327532,107299,,,,,85717,4635,,,,,,,,,"40",796,0,1442118,796,1434831,,3,28,"900046202633f9a952f92f599390adf1564253f3",0,0,0,0,0,""
20201017,"OK",106503,,1327532,7287,"posNeg",1434035,792,7770,301,,,,90845,"10/17/2020 00:00","2020-10-17T00:00:00Z","10/16 20:00",1168,7770,,"2020-10-17T00:00:00Z",1448159,118537,1327532,106503,,,,,85717,4635,,,,,,,,,"40",1195,14692,1441322,15887,1434035,,14,169,"df3162a02cc1c0b7ec305683375cd83651928456",0,0,0,0,0,""
20201016,"OK",105308,,1312840,8240,"posNeg",1418148,793,7601,291,,,,89815,"10/16/2020 00:00","2020-10-16T00:00:00Z","10/15 20:00",1154,7601,,"2020-10-16T00:00:00Z",1432231,117116,1312840,105308,,,,,83562,4411,,,,,,,,,"40",1472,17908,1426388,19380,1418148,,11,0,"6a929ab86aa8360c94a397518c991174d748e728",0,0,0,0,0,""
20201015,"OK",103836,,1294932,8124,"posNeg",1398768,781,7601,293,,,,88780,"10/15/2020 00:00","2020-10-15T00:00:00Z","10/14 20:00",1143,7601,,"2020-10-15T00:00:00Z",1412757,115879,1294932,103836,,,,,83562,4411,,,,,,,,,"40",1221,11878,1406892,13099,1398768,,11,72,"020f5e67e3d9ae44fabd2888f79b114163c60967",0,0,0,0,0,""
20201014,"OK",102615,,1283054,6224,"posNeg",1385669,749,7529,289,,,,87575,"10/14/2020 00:00","2020-10-14T00:00:00Z","10/13 20:00",1132,7529,,"2020-10-14T00:00:00Z",1399385,114382,1283054,102615,,,,,83562,4411,,,,,,,,,"40",1122,10831,1391893,11953,1385669,,13,264,"85e6276392fdac99aff45784e695471f2ef9bce5",0,0,0,0,0,""
20201013,"OK",101493,,1272223,3126,"posNeg",1373716,760,7265,277,,,,86502,"10/13/2020 00:00","2020-10-13T00:00:00Z","10/12 20:00",1119,7265,,"2020-10-13T00:00:00Z",1387428,113046,1272223,101493,,,,,83562,4411,,,,,,,,,"40",1309,31705,1376842,33014,1373716,,15,-19,"afc93055b51a40917dbe44c5c50e811ca8feda72",0,0,0,0,0,""
20201012,"OK",100184,,1240518,6504,"posNeg",1340702,758,7284,276,,,,85265,"10/12/2020 00:00","2020-10-12T00:00:00Z","10/11 20:00",1104,7284,,"2020-10-12T00:00:00Z",1353634,110157,1240518,100184,,,,,83562,4411,,,,,,,,,"40",797,0,1347206,797,1340702,,6,46,"15e23763c36eb58993359211b2953aecaad4dee6",0,0,0,0,0,""
20201011,"OK",99387,,1240518,6504,"posNeg",1339905,758,7238,276,,,,84520,"10/11/2020 00:00","2020-10-11T00:00:00Z","10/10 20:00",1098,7238,,"2020-10-11T00:00:00Z",1353634,110157,1240518,99387,,,,,83562,4411,,,,,,,,,"40",766,0,1346409,766,1339905,,3,20,"1c9257282d6ca9875d1cf83d512969ba637140c2",0,0,0,0,0,""
20201010,"OK",98621,,1240518,6504,"posNeg",1339139,758,7218,276,,,,83633,"10/10/2020 00:00","2020-10-10T00:00:00Z","10/09 20:00",1095,7218,,"2020-10-10T00:00:00Z",1353634,110157,1240518,98621,,,,,83562,4411,,,,,,,,,"40",1533,15635,1345643,17168,1339139,,4,94,"7a297609fec3abd4280ecf6e8042f44aba318be2",0,0,0,0,0,""
20201009,"OK",97088,,1224883,8256,"posNeg",1321971,749,7124,265,,,,82482,"10/9/2020 00:00","2020-10-09T00:00:00Z","10/08 20:00",1091,7124,,"2020-10-09T00:00:00Z",1336562,108540,1224883,97088,,,,,80939,4185,,,,,,,,,"40",1524,15577,1330227,17101,1321971,,6,102,"9ac3b5dd6385f1e59296c06438bff41d7b65400c",0,0,0,0,0,""
20201008,"OK",95564,,1209306,8307,"posNeg",1304870,697,7022,252,,,,81289,"10/8/2020 00:00","2020-10-08T00:00:00Z","10/07 20:00",1085,7022,,"2020-10-08T00:00:00Z",1318991,107221,1209306,95564,,,,,80939,4185,,,,,,,,,"40",1212,13035,1313177,14247,1304870,,10,93,"5de434dfd6857d8637ff2e05a01690ad11ab6b06",0,0,0,0,0,""
20201007,"OK",94352,,1196271,7520,"posNeg",1290623,738,6929,258,,,,80211,"10/7/2020 00:00","2020-10-07T00:00:00Z","10/06 20:00",1075,6929,,"2020-10-07T00:00:00Z",1305146,105881,1196271,94352,,,,,80939,4185,,,,,,,,,"40",1006,9556,1298143,10562,1290623,,9,113,"e7be9a16bf1b9702405bb06ec7cef9ab08914ef5",0,0,0,0,0,""
20201006,"OK",93346,,1186715,3984,"posNeg",1280061,699,6816,228,,,,79219,"10/6/2020 00:00","2020-10-06T00:00:00Z","10/05 20:00",1066,6816,,"2020-10-06T00:00:00Z",1294532,104865,1186715,93346,,,,,80939,4185,,,,,,,,,"40",1364,29641,1284045,31005,1280061,,11,142,"4ee5a93d8a61dc5956888623e55586d7d3bf2136",0,0,0,0,0,""
20201005,"OK",91982,,1157074,6918,"posNeg",1249056,655,6674,228,,,,78155,"10/5/2020 00:00","2020-10-05T00:00:00Z","10/04 20:00",1055,6674,,"2020-10-05T00:00:00Z",1262313,102465,1157074,91982,,,,,80939,4185,,,,,,,,,"40",665,0,1255974,665,1249056,,3,104,"a8e1aa62fe4e34a1679240c81d58b1b345009657",0,0,0,0,0,""
20201004,"OK",91317,,1157074,6918,"posNeg",1248391,655,6570,228,,,,77606,"10/4/2020 00:00","2020-10-04T00:00:00Z","10/03 20:00",1052,6570,,"2020-10-04T00:00:00Z",1262313,102465,1157074,91317,,,,,80939,4185,,,,,,,,,"40",569,0,1255309,569,1248391,,1,0,"5ec2573c45f25711cac18a57ae62f40d2396e0ba",0,0,0,0,0,""
20201003,"OK",90748,,1157074,6918,"posNeg",1247822,655,6570,228,,,,77004,"10/3/2020 00:00","2020-10-03T00:00:00Z","10/02 20:00",1051,6570,,"2020-10-03T00:00:00Z",1262313,102465,1157074,90748,,,,,80939,4185,,,,,,,,,"40",1189,16473,1254740,17662,1247822,,7,1,"4b3271c59715ddf6f8544c4a6abd59f314d24eff",0,0,0,0,0,""
20201002,"OK",89559,,1140601,6285,"posNeg",1230160,623,6569,234,,,,75753,"10/2/2020 00:00","2020-10-02T00:00:00Z","10/01 20:00",1044,6569,,"2020-10-02T00:00:00Z",1244650,101347,1140601,89559,,,,,78836,3997,,,,,,,,,"40",1190,13529,1236445,14719,1230160,,9,59,"979fc2ad54f035e27cfa2a4fb5346b0dc3a9464e",0,0,0,0,0,""
20201001,"OK",88369,,1127072,8523,"posNeg",1215441,610,6510,239,,,,74483,"10/1/2020 00:00","2020-10-01T00:00:00Z","09/30 20:00",1035,6510,,"2020-10-01T00:00:00Z",1229753,99570,1127072,88369,,,,,78836,3997,,,,,,,,,"40",1170,10243,1223964,11413,1215441,,4,61,"5bd7ab8578ec6fb21a84adcc5f15603b742325fb",0,0,0,0,0,""
20200930,"OK",87199,,1116829,4926,"posNeg",1204028,628,6449,245,,,,73100,"9/30/2020 00:00","2020-09-30T00:00:00Z","09/29 20:00",1031,6449,,"2020-09-30T00:00:00Z",1217581,98631,1116829,87199,,,,,78836,3997,,,,,,,,,"40",980,10645,1208954,11625,1204028,,13,83,"8edee06a8dc7846bb86d60e6fe06701b533f0c24",0,0,0,0,0,""
20200929,"OK",86219,,1106184,3137,"posNeg",1192403,618,6366,225,,,,71957,"9/29/2020 00:00","2020-09-29T00:00:00Z","09/28 20:00",1018,6366,,"2020-09-29T00:00:00Z",1205616,97612,1106184,86219,,,,,78836,3997,,,,,,,,,"40",1025,30709,1195540,31734,1192403,,11,93,"1932c459c6e41badcbd052085c687572e00b6c97",0,0,0,0,0,""
20200928,"OK",85194,,1075475,6653,"posNeg",1160669,579,6273,223,,,,70808,"9/28/2020 00:00","2020-09-28T00:00:00Z","09/27 20:00",1007,6273,,"2020-09-28T00:00:00Z",1172554,94741,1075475,85194,,,,,78836,3997,,,,,,,,,"40",1684,0,1167322,1684,1160669,,3,21,"eb589c23c591e1af964fafd450ed126f22048324",0,0,0,0,0,""
20200927,"OK",83510,,1075475,6653,"posNeg",1158985,579,6252,223,,,,69754,"9/26/2020 00:00","2020-09-26T00:00:00Z","09/25 20:00",1004,6252,,"2020-09-26T00:00:00Z",1172554,94741,1075475,83510,,,,,78836,3997,,,,,,,,,"40",0,0,1165638,0,1158985,,0,0,"0ada20ba67239d89cfa12a940358685a5ccdcade",0,0,0,0,0,""
20200926,"OK",83510,,1075475,6653,"posNeg",1158985,579,6252,223,,,,69754,"9/26/2020 00:00","2020-09-26T00:00:00Z","09/25 20:00",1004,6252,,"2020-09-26T00:00:00Z",1172554,94741,1075475,83510,,,,,78836,3997,,,,,,,,,"40",990,17331,1165638,18321,1158985,,11,60,"12d99bc40e2044288204ac0fa96bc2ab940a6150",0,0,0,0,0,""
20200925,"OK",82520,,1058144,6368,"posNeg",1140664,590,6192,220,,,,68911,"9/25/2020 00:00","2020-09-25T00:00:00Z","09/24 20:00",993,6192,,"2020-09-25T00:00:00Z",1153358,92923,1058144,82520,,,,,76497,3764,,,,,,,,,"40",1276,12462,1147032,13738,1140664,,12,62,"4a6c6d3881fbdfff4a736bf9ef5ac695992c1389",0,0,0,0,0,""
20200924,"OK",81244,,1045682,7430,"posNeg",1126926,593,6130,227,,,,67807,"9/24/2020 00:00","2020-09-24T00:00:00Z","09/23 20:00",981,6130,,"2020-09-24T00:00:00Z",1140178,92217,1045682,81244,,,,,76497,3764,,,,,,,,,"40",1083,11517,1134356,12600,1126926,,11,73,"3e7df69a5fff52b28ba45c6f5eefdd08eb3994a9",0,0,0,0,0,""
20200923,"OK",80161,,1034165,6067,"posNeg",1114326,612,6057,226,,,,66779,"9/23/2020 00:00","2020-09-23T00:00:00Z","09/22 20:00",970,6057,,"2020-09-23T00:00:00Z",1127633,91214,1034165,80161,,,,,76497,3764,,,,,,,,,"40",1089,11398,1120393,12487,1114326,,8,61,"23af8c0ef934686a31adde700911e4cc60b6b506",0,0,0,0,0,""
20200922,"OK",79072,,1022767,3536,"posNeg",1101839,628,5996,244,,,,65482,"9/22/2020 00:00","2020-09-22T00:00:00Z","09/21 20:00",962,5996,,"2020-09-22T00:00:00Z",1114878,90327,1022767,79072,,,,,76497,3764,,,,,,,,,"40",1164,27070,1105375,28234,1101839,,14,100,"254c8fb7c49a957593941371159ae0c6cc859b6e",0,0,0,0,0,""
20200921,"OK",77908,,995697,8878,"posNeg",1073605,522,5896,222,,,,64941,"9/21/2020 00:00","2020-09-21T00:00:00Z","09/20 20:00",948,5896,,"2020-09-21T00:00:00Z",1084302,86886,995697,77908,,,,,76497,3764,,,,,,,,,"40",1101,0,1082483,1101,1073605,,2,53,"62fa5623a8d29755b8a1496001e046fa3cf71f99",0,0,0,0,0,""
20200920,"OK",76807,,995697,8878,"posNeg",1072504,522,5843,222,,,,64467,"9/20/2020 00:00","2020-09-20T00:00:00Z","09/19 20:00",946,5843,,"2020-09-20T00:00:00Z",1084302,86886,995697,76807,,,,,76497,3764,,,,,,,,,"40",1003,0,1081382,1003,1072504,,3,0,"b63ce4f44081992b0008d61a966f02ffd35222a0",0,0,0,0,0,""
20200919,"OK",75804,,995697,8878,"posNeg",1071501,522,5843,222,,,,63960,"9/19/2020 00:00","2020-09-19T00:00:00Z","09/18 20:00",943,5843,,"2020-09-19T00:00:00Z",1084302,86886,995697,75804,,,,,76497,3764,,,,,,,,,"40",1237,16047,1080379,17284,1071501,,4,88,"93144aa91b818c4e073981aaf739cf425d10faab",0,0,0,0,0,""
20200918,"OK",74567,,979650,7491,"posNeg",1054217,516,5755,223,,,,63135,"9/18/2020 00:00","2020-09-18T00:00:00Z","09/17 20:00",939,5755,,"2020-09-18T00:00:00Z",1066896,85471,979650,74567,,,,,74483,3581,,,,,,,,,"40",1249,13131,1061708,14380,1054217,,9,57,"13a92d7631c81a3aa4e34ecf2f18d6edfa7289ea",0,0,0,0,0,""
20200917,"OK",73318,,966519,7456,"posNeg",1039837,516,5698,221,,,,62144,"9/17/2020 00:00","2020-09-17T00:00:00Z","09/16 20:00",930,5698,,"2020-09-17T00:00:00Z",1052756,84029,966519,73318,,,,,74483,3581,,,,,,,,,"40",1034,11207,1047293,12241,1039837,,6,88,"2b503cc366cdd79d8d66efcbf9f914779ebdeafd",0,0,0,0,0,""
20200916,"OK",72284,,955312,6260,"posNeg",1027596,528,5610,213,,,,61026,"9/16/2020 00:00","2020-09-16T00:00:00Z","09/15 20:00",924,5610,,"2020-09-16T00:00:00Z",1040699,83065,955312,72284,,,,,74483,3581,,,,,,,,,"40",970,10118,1033856,11088,1027596,,12,48,"8d0e107d07628a8eec6fb4bedfd521811b252470",0,0,0,0,0,""
20200915,"OK",71314,,945194,706,"posNeg",1016508,561,5562,224,,,,59993,"9/15/2020 00:00","2020-09-15T00:00:00Z","09/14 20:00",912,5562,,"2020-09-15T00:00:00Z",1029511,82404,945194,71314,,,,,74483,3581,,,,,,,,,"40",1091,25018,1017214,26109,1016508,,7,96,"f3980a8ce39d449f7d116affb948bbc30e22e296",0,0,0,0,0,""
20200914,"OK",70223,,920176,6306,"posNeg",990399,499,5466,186,,,,59007,"9/14/2020 00:00","2020-09-14T00:00:00Z","09/13 20:00",905,5466,,"2020-09-14T00:00:00Z",1000912,79689,920176,70223,,,,,74483,3581,,,,,,,,,"40",869,0,996705,869,990399,,0,15,"18233465d38c097770c76d18884ba7c123adf37d",0,0,0,0,0,""
20200913,"OK",69354,,920176,6306,"posNeg",989530,499,5451,186,,,,58560,"9/13/2020 00:00","2020-09-13T00:00:00Z","09/12 20:00",905,5451,,"2020-09-13T00:00:00Z",1000912,79689,920176,69354,,,,,74483,3581,,,,,,,,,"40",695,0,995836,695,989530,,6,27,"8aaa93fe8f6518a301a33456d1fd35aa22fa488f",0,0,0,0,0,""
20200912,"OK",68659,,920176,6306,"posNeg",988835,499,5424,186,,,,58125,"9/12/2020 00:00","2020-09-12T00:00:00Z","09/11 20:00",899,5424,,"2020-09-12T00:00:00Z",1000912,79689,920176,68659,,,,,74483,3581,,,,,,,,,"40",1017,13067,995141,14084,988835,,11,55,"f30addd023e2e738795a7cbb2cc20618655f98d4",0,0,0,0,0,""
20200911,"OK",67642,,907109,6696,"posNeg",974751,509,5369,208,,,,57383,"9/11/2020 00:00","2020-09-11T00:00:00Z","09/10 20:00",888,5369,,"2020-09-11T00:00:00Z",987322,78255,907109,67642,,,,,73173,3453,,,,,,,,,"40",942,12099,981447,13041,974751,,12,51,"dd3a1f21f79fdeeebaec2170d6e7b7c8990bdfbe",0,0,0,0,0,""
20200910,"OK",66700,,895010,6463,"posNeg",961710,513,5318,195,,,,56531,"9/10/2020 00:00","2020-09-10T00:00:00Z","09/09 20:00",876,5318,,"2020-09-10T00:00:00Z",973714,76926,895010,66700,,,,,73173,3453,,,,,,,,,"40",771,7403,968173,8174,961710,,13,65,"5b4ee27c23d4187f1f7136289d26fa9eeec8f3de",0,0,0,0,0,""
20200909,"OK",65929,,887607,2641,"posNeg",953536,462,5253,202,,,,55405,"9/9/2020 00:00","2020-09-09T00:00:00Z","09/08 20:00",863,5253,,"2020-09-09T00:00:00Z",966019,76064,887607,65929,,,,,73173,3453,,,,,,,,,"40",876,27521,956177,28397,953536,,9,116,"72698234863eea9c67a775f484ac0439bf9b6573",0,0,0,0,0,""
20200908,"OK",65053,,860086,5021,"posNeg",925139,472,5137,208,,,,54269,"9/8/2020 00:00","2020-09-08T00:00:00Z","09/07 20:00",854,5137,,"2020-09-08T00:00:00Z",939500,73487,860086,65053,,,,,73173,3453,,,,,,,,,"40",833,0,930160,833,925139,,1,24,"246862e447b22c94436b8e5fb89915a9e321b0f6",0,0,0,0,0,""
20200907,"OK",64220,,860086,5021,"posNeg",924306,472,5113,208,,,,53414,"9/7/2020 00:00","2020-09-07T00:00:00Z","09/06 20:00",853,5113,,"2020-09-07T00:00:00Z",939500,73487,860086,64220,,,,,73173,3453,,,,,,,,,"40",613,0,929327,613,924306,,0,8,"4fe8bd802d57a487363cb4cd46a723deaa883591",0,0,0,0,0,""
20200906,"OK",63607,,860086,5021,"posNeg",923693,472,5105,208,,,,53059,"9/6/2020 00:00","2020-09-06T00:00:00Z","09/05 20:00",853,5105,,"2020-09-06T00:00:00Z",939500,73487,860086,63607,,,,,73173,3453,,,,,,,,,"40",420,0,928714,420,923693,,3,0,"5d3cf64f69950cfbe0a30811434743d3b4299a28",0,0,0,0,0,""
20200905,"OK",63187,,860086,5021,"posNeg",923273,472,5105,208,,,,52740,"9/5/2020 00:00","2020-09-05T00:00:00Z","09/04 20:00",850,5105,,"2020-09-05T00:00:00Z",939500,73487,860086,63187,,,,,73173,3453,,,,,,,,,"40",1147,7731,928294,8878,923273,,4,44,"7910674796a301fff93528b390a9f34bb57e1b0f",0,0,0,0,0,""
20200904,"OK",62040,,852355,6127,"posNeg",914395,518,5061,203,,,,52123,"9/4/2020 00:00","2020-09-04T00:00:00Z","09/03 20:00",846,5061,,"2020-09-04T00:00:00Z",926188,72158,852355,62040,,,,,68964,3006,,,,,,,,,"40",1013,10336,920522,11349,914395,,11,48,"26e850dcf348e7ea4c176530e8a6b4e18b82412b",0,0,0,0,0,""
20200903,"OK",61027,,842019,5981,"posNeg",903046,540,5013,204,,,,51447,"9/3/2020 00:00","2020-09-03T00:00:00Z","09/02 20:00",835,5013,,"2020-09-03T00:00:00Z",914602,70857,842019,61027,,,,,68964,3006,,,,,,,,,"40",909,8895,909027,9804,903046,,14,52,"34c7bd85e488573ff8991befd1ca369e0cf67d88",0,0,0,0,0,""
20200902,"OK",60118,,833124,5331,"posNeg",893242,545,4961,220,,,,50646,"9/2/2020 00:00","2020-09-02T00:00:00Z","09/01 20:00",821,4961,,"2020-09-02T00:00:00Z",904600,69761,833124,60118,,,,,68964,3006,,,,,,,,,"40",719,5611,898573,6330,893242,,12,58,"fec09eabac2ff98dcf994d1a6b2e05944daf3d94",0,0,0,0,0,""
20200901,"OK",59399,,827513,2776,"posNeg",886912,535,4903,207,,,,49989,"9/1/2020 00:00","2020-09-01T00:00:00Z","08/31 20:00",809,4903,,"2020-09-01T00:00:00Z",898288,69077,827513,59399,,,,,68964,3006,,,,,,,,,"40",666,20968,889688,21634,886912,,9,82,"a323665e9c796a61bd460db1f0c7124f0dc203e8",0,0,0,0,0,""
20200831,"OK",58733,,806545,7165,"posNeg",865278,570,4821,214,,,,49184,"8/31/2020 00:00","2020-08-31T00:00:00Z","08/30 20:00",800,4821,,"2020-08-31T00:00:00Z",874676,66512,806545,58733,,,,,68964,3006,,,,,,,,,"40",713,0,872443,713,865278,,1,7,"0bf8069e5c4ceb5eb1c1156aa765fc5ec23bdac0",0,0,0,0,0,""
20200830,"OK",58020,,806545,7165,"posNeg",864565,570,4814,214,,,,48933,"8/30/2020 00:00","2020-08-30T00:00:00Z","08/29 20:00",799,4814,,"2020-08-30T00:00:00Z",874676,66512,806545,58020,,,,,68964,3006,,,,,,,,,"40",667,0,871730,667,864565,,2,20,"48a3113f0decaeedd96c51712ac35e9ecd7e13b9",0,0,0,0,0,""
20200829,"OK",57353,,806545,7165,"posNeg",863898,570,4794,214,,,,48607,"8/29/2020 00:00","2020-08-29T00:00:00Z","08/28 20:00",797,4794,,"2020-08-29T00:00:00Z",874676,66512,806545,57353,,,,,68964,3006,,,,,,,,,"40",1093,7025,871063,8118,863898,,11,75,"9306dcb4830004c465b923e7bbc43e94f5d00d6a",0,0,0,0,0,""
20200828,"OK",56260,,799520,6487,"posNeg",855780,559,4719,229,,,,47762,"8/28/2020 00:00","2020-08-28T00:00:00Z","08/27 20:00",786,4719,,"2020-08-28T00:00:00Z",866185,65073,799520,56260,,,,,67322,2856,,,,,,,,,"40",710,9221,862267,9931,855780,,8,46,"2664751c88eb9ab2a760064f73a8870e3f2e1862",0,0,0,0,0,""
20200827,"OK",55550,,790299,7149,"posNeg",845849,552,4673,211,,,,47186,"8/27/2020 00:00","2020-08-27T00:00:00Z","08/26 20:00",778,4673,,"2020-08-27T00:00:00Z",855824,63967,790299,55550,,,,,67322,2856,,,,,,,,,"40",712,7753,852998,8465,845849,,15,64,"0d1ee8961301cd99f7ff95ebbb35f9545612f7be",0,0,0,0,0,""
20200826,"OK",54838,,782546,,"posNeg",837384,533,4609,211,,,,46414,"8/26/2020 00:00","2020-08-26T00:00:00Z","08/25 20:00",763,4609,,"2020-08-26T00:00:00Z",847060,62969,782546,54838,,,,,67322,2856,,,,,,,,,"40",666,5887,837384,6553,837384,,19,82,"2ec42e0d44a35357211e4918f044aa8b051a32f7",0,0,0,0,0,""
20200825,"OK",54172,,776659,,"posNeg",830831,553,4527,226,,,,45516,"8/25/2020 00:00","2020-08-25T00:00:00Z","08/24 20:00",744,4527,,"2020-08-25T00:00:00Z",840677,62455,776659,54172,,,,,67322,2856,,,,,,,,,"40",650,17324,830831,17974,830831,,14,96,"c794d6904928a6c418adf7b74666663f6e1a2488",0,0,0,0,0,""
20200824,"OK",53522,,759335,,"posNeg",812857,578,4431,237,,,,44660,"8/24/2020 00:00","2020-08-24T00:00:00Z","08/23 20:00",730,4431,,"2020-08-24T00:00:00Z",821289,60433,759335,53522,,,,,67322,2856,,,,,,,,,"40",357,0,812857,357,812857,,4,9,"cc852889a1eebb7182603b5d5dc968679eb13870",0,0,0,0,0,""
20200823,"OK",53165,,759335,,"posNeg",812500,578,4422,237,,,,44409,"8/23/2020 00:00","2020-08-23T00:00:00Z","08/22 20:00",726,4422,,"2020-08-23T00:00:00Z",821289,60433,759335,53165,,,,,67322,2856,,,,,,,,,"40",566,0,812500,566,812500,,1,54,"1a4ccb70d4122557f026eb4d8bd3e2439eae4b37",0,0,0,0,0,""
20200822,"OK",52599,,759335,,"posNeg",811934,578,4368,237,,,,44035,"8/22/2020 00:00","2020-08-22T00:00:00Z","08/21 20:00",725,4368,,"2020-08-22T00:00:00Z",821289,60433,759335,52599,,,,,67322,2856,,,,,,,,,"40",853,10179,811934,11032,811934,,10,52,"b4e2d4edd9b08e69303ad2b1fadb608dd3f6f8d4",0,0,0,0,0,""
20200821,"OK",51746,,749156,,"posNeg",800902,562,4316,246,,,,43417,"8/21/2020 00:00","2020-08-21T00:00:00Z","08/20 20:00",715,4316,,"2020-08-21T00:00:00Z",810120,59448,749156,51746,,,,,65475,2649,,,,,,,,,"40",1077,8931,800902,10008,800902,,6,48,"46da247c4de025586107acbd8a50f2023d630131",0,0,0,0,0,""
20200820,"OK",50669,,740225,,"posNeg",790894,564,4268,248,,,,42695,"8/20/2020 00:00","2020-08-20T00:00:00Z","08/19 20:00",709,4268,,"2020-08-20T00:00:00Z",800216,58523,740225,50669,,,,,65475,2649,,,,,,,,,"40",746,7408,790894,8154,790894,,10,76,"2c2a565670e00ef164827b21a23a1cf4c92565d6",0,0,0,0,0,""
20200819,"OK",49923,,732817,,"posNeg",782740,566,4192,250,,,,42047,"8/19/2020 00:00","2020-08-19T00:00:00Z","08/18 20:00",699,4192,,"2020-08-19T00:00:00Z",791944,57679,732817,49923,,,,,65475,2649,,,,,,,,,"40",597,7143,782740,7740,782740,,17,77,"05939dbed960e3e7753f14928d14ebedb3866db9",0,0,0,0,0,""
20200818,"OK",49326,,725674,,"posNeg",775000,568,4115,240,,,,41370,"8/18/2020 00:00","2020-08-18T00:00:00Z","08/17 20:00",682,4115,,"2020-08-18T00:00:00Z",784218,57102,725674,49326,,,,,65475,2649,,,,,,,,,"40",615,19055,775000,19670,775000,,17,94,"5964136ca81bad9a610c7dcc40d11de92e1a5cd1",0,0,0,0,0,""
20200817,"OK",48711,,706619,,"posNeg",755330,506,4021,236,,,,40531,"8/17/2020 00:00","2020-08-17T00:00:00Z","08/16 20:00",665,4021,,"2020-08-17T00:00:00Z",762899,54870,706619,48711,,,,,65475,2649,,,,,,,,,"40",369,0,755330,369,755330,,4,8,"f45794c792f17afac051a7629bf1fad913f47c1f",0,0,0,0,0,""
20200816,"OK",48342,,706619,,"posNeg",754961,506,4013,236,,,,40224,"8/16/2020 00:00","2020-08-16T00:00:00Z","08/15 20:00",661,4013,,"2020-08-16T00:00:00Z",762899,54870,706619,48342,,,,,65475,2649,,,,,,,,,"40",544,0,754961,544,754961,,4,15,"978b6fbf20596bdd078e80f36a24f0a597aed1e7",0,0,0,0,0,""
20200815,"OK",47798,,706619,,"posNeg",754417,506,3998,236,,,,39907,"8/15/2020 00:00","2020-08-15T00:00:00Z","08/14 20:00",657,3998,,"2020-08-15T00:00:00Z",762899,54870,706619,47798,,,,,65475,2649,,,,,,,,,"40",901,10274,754417,11175,754417,,13,45,"3f53ca95ab186ceae62513fa0816c1953cdfe287",0,0,0,0,0,""
20200814,"OK",46897,,696345,,"posNeg",743242,567,3953,240,,,,39282,"8/14/2020 00:00","2020-08-14T00:00:00Z","08/13 20:00",644,3953,,"2020-08-14T00:00:00Z",751437,53700,696345,46897,,,,,65475,2649,,,,,,,,,"40",794,11176,743242,11970,743242,,6,52,"ae50d2a7e1362080827fb2f007be976e11def6fa",0,0,0,0,0,""
20200813,"OK",46103,,685169,,"posNeg",731272,600,3901,253,,,,38655,"8/13/2020 00:00","2020-08-13T00:00:00Z","08/12 20:00",638,3901,,"2020-08-13T00:00:00Z",739287,52741,685169,46103,,,,,62502,2446,,,,,,,,,"40",705,8460,731272,9165,731272,,11,59,"6f8e3016d0c5f1998a937d6330b0cb6ac4f7997d",0,0,0,0,0,""
20200812,"OK",45398,,676709,,"posNeg",722107,519,3842,216,,,,37988,"8/12/2020 00:00","2020-08-12T00:00:00Z","08/11 20:00",627,3842,,"2020-08-12T00:00:00Z",729940,51862,676709,45398,,,,,62502,2446,,,,,,,,,"40",670,7202,722107,7872,722107,,9,82,"59e43dfb81fa172836283a4c2b982ff7760dc0ad",0,0,0,0,0,""
20200811,"OK",44728,,669507,,"posNeg",714235,530,3760,218,,,,37193,"8/11/2020 00:00","2020-08-11T00:00:00Z","08/10 20:00",618,3760,,"2020-08-11T00:00:00Z",722098,51238,669507,44728,,,,,62502,2446,,,,,,,,,"40",765,19022,714235,19787,714235,,13,135,"eb13e5a4132e8f6f7fec33135b5589bc8bd82297",0,0,0,0,0,""
20200810,"OK",43963,,650485,,"posNeg",694448,594,3625,223,,,,36378,"8/10/2020 00:00","2020-08-10T00:00:00Z","08/09 20:00",605,3625,,"2020-08-10T00:00:00Z",700981,49186,650485,43963,,,,,62502,2446,,,,,,,,,"40",397,0,694448,397,694448,,2,20,"a7d0903c21a00538d451669b535e797a0ba05dba",0,0,0,0,0,""
20200809,"OK",43566,,650485,,"posNeg",694051,594,3605,223,,,,36052,"8/9/2020 00:00","2020-08-09T00:00:00Z","08/08 20:00",603,3605,,"2020-08-09T00:00:00Z",700981,49186,650485,43566,,,,,62502,2446,,,,,,,,,"40",486,0,694051,486,694051,,0,11,"043bc00ac624ab55c09eb189b07ad41f741e613b",0,0,0,0,0,""
20200808,"OK",43080,,650485,,"posNeg",693565,594,3594,223,,,,35745,"8/8/2020 00:00","2020-08-08T00:00:00Z","08/07 20:00",603,3594,,"2020-08-08T00:00:00Z",700981,49186,650485,43080,,,,,62502,2446,,,,,,,,,"40",825,6925,693565,7750,693565,,3,39,"aa83bbdb4fdf688555ef6a44953e09187c6c011d",0,0,0,0,0,""
20200807,"OK",42255,,643560,,"posNeg",685815,561,3555,216,,,,35001,"8/7/2020 00:00","2020-08-07T00:00:00Z","08/06 20:00",600,3555,,"2020-08-07T00:00:00Z",693309,48461,643560,42255,,,,,60293,2272,,,,,,,,,"40",854,10308,685815,11162,685815,,7,58,"0c3d9241e36585fd26768643385bca47397e5193",0,0,0,0,0,""
20200806,"OK",41401,,633252,,"posNeg",674653,643,3497,216,,,,34320,"8/6/2020 00:00","2020-08-06T00:00:00Z","08/05 20:00",593,3497,,"2020-08-06T00:00:00Z",681848,47329,633252,41401,,,,,60293,2272,,,,,,,,,"40",837,9086,674653,9923,674653,,10,52,"a7f3571bd3e70cc47ec74ebfdd3317299f188b20",0,0,0,0,0,""
20200805,"OK",40564,,624166,,"posNeg",664730,645,3445,207,,,,33383,"8/5/2020 00:00","2020-08-05T00:00:00Z","08/04 20:00",583,3445,,"2020-08-05T00:00:00Z",671712,46281,624166,40564,,,,,60293,2272,,,,,,,,,"40",1101,6353,664730,7454,664730,,17,70,"23f535b57c60a5d7aa3c240f88d2970569592dff",0,0,0,0,0,""
20200804,"OK",39463,,617813,,"posNeg",657276,504,3375,232,,,,32319,"8/4/2020 00:00","2020-08-04T00:00:00Z","08/03 20:00",566,3375,,"2020-08-04T00:00:00Z",664579,45521,617813,39463,,,,,60293,2272,,,,,,,,,"40",861,18352,657276,19213,657276,,15,100,"f7b1959f738468e7005961f90c86589e10e03e81",0,0,0,0,0,""
20200803,"OK",38602,,599461,,"posNeg",638063,628,3275,258,,,,31165,"8/3/2020 00:00","2020-08-03T00:00:00Z","08/02 20:00",551,3275,,"2020-08-03T00:00:00Z",644042,43360,599461,38602,,,,,60293,2272,,,,,,,,,"40",377,0,638063,377,638063,,1,34,"839b979469fc43365652d0d74198c2ea3d7902c5",0,0,0,0,0,""
20200802,"OK",38225,,599461,,"posNeg",637686,628,3241,258,,,,30820,"8/2/2020 00:00","2020-08-02T00:00:00Z","08/01 20:00",550,3241,,"2020-08-02T00:00:00Z",644042,43360,599461,38225,,,,,60293,2272,,,,,,,,,"40",494,0,637686,494,637686,,1,13,"1a8fb9fa0fc381469e0547b3f9f090462ca736d1",0,0,0,0,0,""
20200801,"OK",37731,,599461,,"posNeg",637192,628,3228,258,,,,30282,"8/1/2020 00:00","2020-08-01T00:00:00Z","07/31 20:00",549,3228,,"2020-08-01T00:00:00Z",644042,43360,599461,37731,,,,,60293,2272,,,,,,,,,"40",1244,10370,637192,11614,637192,,8,67,"8616104a42b472c7fffc4b5bccd321242c51ecaf",0,0,0,0,0,""
20200731,"OK",36487,,589091,,"posNeg",625578,621,3161,253,,,,29187,"7/31/2020 00:00","2020-07-31T00:00:00Z","07/30 20:00",541,3161,,"2020-07-31T00:00:00Z",632535,42245,589091,36487,,,,,57683,2071,,,,,,,,,"40",747,9815,625578,10562,625578,,5,57,"017b4ce462474c74b842015ba060e92157a45c2e",0,0,0,0,0,""
20200730,"OK",35740,,579276,,"posNeg",615016,647,3104,244,,,,28411,"7/30/2020 00:00","2020-07-30T00:00:00Z","07/29 20:00",536,3104,,"2020-07-30T00:00:00Z",621633,41179,579276,35740,,,,,57683,2071,,,,,,,,,"40",1117,7386,615016,8503,615016,,13,63,"e2c42bc63e91326e6d0fe28604cb66d769370c56",0,0,0,0,0,""
20200729,"OK",34623,,571890,,"posNeg",606513,663,3041,228,,,,27386,"7/29/2020 00:00","2020-07-29T00:00:00Z","07/28 20:00",523,3041,,"2020-07-29T00:00:00Z",613202,40163,571890,34623,,,,,57683,2071,,,,,,,,,"40",848,16539,606513,17387,606513,,14,54,"f2ba53434611010994b2414546a024d6ab0ba8b6",0,0,0,0,0,""
20200728,"OK",33775,,555351,,"posNeg",589126,596,2987,207,,,,26363,"7/28/2020 00:00","2020-07-28T00:00:00Z","07/27 20:00",509,2987,,"2020-07-28T00:00:00Z",595277,38785,555351,33775,,,,,57683,2071,,,,,,,,,"40",1089,19723,589126,20812,589126,,13,115,"a069a2c8585d9b2fb85d453acbb64989c1adce7d",0,0,0,0,0,""
20200727,"OK",32686,,535628,,"posNeg",568314,625,2872,225,,,,25252,"7/27/2020 00:00","2020-07-27T00:00:00Z","07/26 20:00",496,2872,,"2020-07-27T00:00:00Z",573185,36489,535628,32686,,,,,57683,2071,,,,,,,,,"40",1401,0,568314,1401,568314,,0,37,"76dafabee0161f99a3157569e79e01b874df4b61",0,0,0,0,0,""
20200726,"OK",31285,,535628,,"posNeg",566913,625,2835,225,,,,24698,"7/26/2020 00:00","2020-07-26T00:00:00Z","07/25 20:00",496,2835,,"2020-07-26T00:00:00Z",573185,36489,535628,31285,,,,,57683,2071,,,,,,,,,"40",1204,0,566913,1204,566913,,0,67,"9358dc428f6bcb4c326d997384c397148acd4499",0,0,0,0,0,""
20200725,"OK",30081,,535628,,"posNeg",565709,625,2768,225,,,,24053,"7/25/2020 00:00","2020-07-25T00:00:00Z","07/24 20:00",496,2768,,"2020-07-25T00:00:00Z",573185,36489,535628,30081,,,,,57683,2071,,,,,,,,,"40",965,41702,565709,42667,565709,,12,81,"8b41481653a483ccb143d6c216717d1b699421e9",0,0,0,0,0,""
20200724,"OK",29116,,493926,,"posNeg",523042,628,2687,260,,,,23277,"7/24/2020 00:00","2020-07-24T00:00:00Z","07/23 20:00",484,2687,,"2020-07-24T00:00:00Z",527895,32927,493926,29116,,,,,55185,1854,,,,,,,,,"40",1147,8720,523042,9867,523042,,7,91,"fd19d474ea08db8bf376f20077a8741cc870ac62",0,0,0,0,0,""
20200723,"OK",27969,,485206,,"posNeg",513175,607,2596,255,,,,22441,"7/23/2020 00:00","2020-07-23T00:00:00Z","07/22 20:00",477,2596,,"2020-07-23T00:00:00Z",518134,31903,485206,27969,,,,,55185,1854,,,,,,,,,"40",668,6909,513175,7577,513175,,3,56,"af2b6d4e05b774d7730c276f880f8c915eb863ce",0,0,0,0,0,""
20200722,"OK",27301,,478297,,"posNeg",505598,630,2540,257,,,,21596,"7/22/2020 00:00","2020-07-22T00:00:00Z","07/21 20:00",474,2540,,"2020-07-22T00:00:00Z",510359,31051,478297,27301,,,,,55185,1854,,,,,,,,,"40",975,6240,505598,7215,505598,,13,137,"373a4008097cfc91b0ca004fab65a8c61676b412",0,0,0,0,0,""
20200721,"OK",26326,,472057,,"posNeg",498383,613,2403,248,,,,20663,"7/21/2020 00:00","2020-07-21T00:00:00Z","07/20 20:00",461,2403,,"2020-07-21T00:00:00Z",503326,30273,472057,26326,,,,,55185,1854,,,,,,,,,"40",893,21382,498383,22275,498383,,9,0,"675169e89d79f2343a7393a11b5f4e33c71fc567",0,0,0,0,0,""
20200720,"OK",25433,,450675,,"posNeg",476108,604,2403,232,,,,19750,"7/20/2020 00:00","2020-07-20T00:00:00Z","07/19 20:00",452,2403,,"2020-07-20T00:00:00Z",479547,27903,450675,25433,,,,,55185,1854,,,,,,,,,"40",168,0,476108,168,476108,,1,15,"80e73f0adb2c613bec4f9ffec677f7b4dd8df9ed",0,0,0,0,0,""
20200719,"OK",25265,,450675,,"posNeg",475940,547,2388,232,,,,19466,"7/19/2020 00:00","2020-07-19T00:00:00Z","07/18 20:00",451,2388,,"2020-07-19T00:00:00Z",479547,27903,450675,25265,,,,,55185,1854,,,,,,,,,"40",209,0,475940,209,475940,,0,13,"b32126a67eed731bd5cb6bdf3384b2cc4bde2c2a",0,0,0,0,0,""
20200718,"OK",25056,,450675,,"posNeg",475731,547,2375,232,,,,19186,"7/18/2020 00:00","2020-07-18T00:00:00Z","07/17 20:00",451,2375,,"2020-07-18T00:00:00Z",479547,27903,450675,25056,,,,,55185,1854,,,,,,,,,"40",916,9771,475731,10687,475731,,6,86,"f0dab880475e68669104007af6ab1ba14e8ba169",0,0,0,0,0,""
20200717,"OK",24140,,440904,,"posNeg",465044,604,2289,247,,,,18766,"7/17/2020 08:00","2020-07-17T08:00:00Z","07/17 04:00",445,2289,,"2020-07-17T08:00:00Z",468644,26785,440904,24140,,,,,49472,1592,,,,,,,,,"40",699,7528,465044,8227,465044,,7,71,"238e338fa3788d1f8488b39d1ec8cab284df399c",0,0,0,0,0,""
20200716,"OK",23441,,433376,,"posNeg",456817,638,2218,235,,,,18095,"7/16/2020 08:00","2020-07-16T08:00:00Z","07/16 04:00",438,2218,,"2020-07-16T08:00:00Z",460246,25931,433376,23441,,,,,49472,1592,,,,,,,,,"40",628,8864,456817,9492,456817,,6,48,"9fc13e7feffb5a4fefaecc6eda94ed2af9cdf05d",0,0,0,0,0,""
20200715,"OK",22813,,424512,,"posNeg",447325,561,2170,231,,,,17366,"7/13/2020 00:00","2020-07-13T00:00:00Z","07/12 20:00",432,2170,,"2020-07-13T00:00:00Z",450388,24954,424512,22813,,,,,49472,1592,,,,,,,,,"40",1075,4956,447325,6031,447325,,4,54,"84b73343fcd4d3c2d5f5fc4b384c1c2aa9056621",0,0,0,0,0,""
20200714,"OK",21738,,419556,,"posNeg",441294,546,2116,234,,,,16635,"7/13/2020 00:00","2020-07-13T00:00:00Z","07/12 20:00",428,2116,,"2020-07-13T00:00:00Z",444852,24383,419556,21738,,,,,49472,1592,,,,,,,,,"40",993,19519,441294,20512,441294,,4,53,"ff589712e7e0aa231fa776ef8edcfdc201af749c",0,0,0,0,0,""
20200713,"OK",20745,,400037,,"posNeg",420782,499,2063,186,,,,15815,"7/13/2020 00:00","2020-07-13T00:00:00Z","07/12 20:00",424,2063,,"2020-07-13T00:00:00Z",423285,22367,400037,20745,,,,,49472,1592,,,,,,,,,"40",510,0,420782,510,420782,,2,31,"a0ca7cbbfd2c34c88e16fae562724e499dd4f991",0,0,0,0,0,""
20200712,"OK",20235,,400037,,"posNeg",420272,499,2032,186,,,,15485,"7/12/2020 00:00","2020-07-12T00:00:00Z","07/11 20:00",422,2032,,"2020-07-12T00:00:00Z",423285,22367,400037,20235,,,,,49472,1592,,,,,,,,,"40",456,0,420272,456,420272,,1,40,"63cb9dc22aa6e1e3233d352a55d6adc824e6eba9",0,0,0,0,0,""
20200711,"OK",19779,,400037,,"posNeg",419816,499,1992,186,,,,15136,"7/11/2020 00:00","2020-07-11T00:00:00Z","07/10 20:00",421,1992,,"2020-07-11T00:00:00Z",423285,22367,400037,19779,,,,,49472,1592,,,,,,,,,"40",687,8055,419816,8742,419816,,5,43,"b570ddbeb63112f55442d3fdab6ba61d1dd304de",0,0,0,0,0,""
20200710,"OK",19092,,391982,,"posNeg",411074,487,1949,217,,,,14648,"7/10/2020 08:00","2020-07-10T08:00:00Z","07/10 04:00",416,1949,,"2020-07-10T08:00:00Z",414197,21345,391982,19092,,,,,45013,1465,,,,,,,,,"40",596,8724,411074,9320,411074,,6,56,"7aa8317c2ab660571a400ee025351447ae5a1d8f",0,0,0,0,0,""
20200709,"OK",18496,,383258,,"posNeg",401754,453,1893,215,,,,14100,"7/9/2020 08:00","2020-07-09T08:00:00Z","07/09 04:00",410,1893,,"2020-07-09T08:00:00Z",404600,20489,383258,18496,,,,,45013,1465,,,,,,,,,"40",603,6328,401754,6931,401754,,3,89,"8cf39c80c66c21da0279ca6b6c575b0de68127a4",0,0,0,0,0,""
20200708,"OK",17893,,376930,,"posNeg",394823,458,1804,209,,,,13538,"7/8/2020 00:00","2020-07-08T00:00:00Z","07/07 20:00",407,1804,,"2020-07-08T00:00:00Z",397647,19871,376930,17893,,,,,45013,1465,,,,,,,,,"40",673,5132,394823,5805,394823,,3,63,"d7c5e1926e73a2cff857aec9b93feba949fe02e3",0,0,0,0,0,""
20200707,"OK",17220,,371798,,"posNeg",389018,426,1741,182,,,,13005,"7/7/2020 08:00","2020-07-07T08:00:00Z","07/07 04:00",404,1741,,"2020-07-07T08:00:00Z",391881,19241,371798,17220,,,,,45013,1465,,,,,,,,,"40",858,23009,389018,23867,389018,,5,52,"b1b72a5eeffd4e07ea8770f9de7f8b934a733c6b",0,0,0,0,0,""
20200706,"OK",16362,,348789,,"posNeg",365151,391,1689,165,,,,12432,"7/6/2020 08:00","2020-07-06T08:00:00Z","07/06 04:00",399,1689,,"2020-07-06T08:00:00Z",366289,16721,348789,16362,,,,,34490,1171,,,,,,,,,"40",434,0,365151,434,365151,,1,4,"888840392ff0e62bedb8836a947e1e079c27134b",0,0,0,0,0,""
20200705,"OK",15928,,348789,,"posNeg",364717,391,1685,165,,,,12246,"7/5/2020 00:00","2020-07-05T00:00:00Z","07/04 20:00",398,1685,,"2020-07-05T00:00:00Z",366289,16721,348789,15928,,,,,34490,1171,,,,,,,,,"40",283,0,364717,283,364717,,0,9,"a308e9cc502a8c1d7e60fbe65b8656ec0e848ca2",0,0,0,0,0,""
20200704,"OK",15645,,348789,,"posNeg",364434,391,1676,165,,,,11965,"7/4/2020 00:00","2020-07-04T00:00:00Z","07/03 20:00",398,1676,,"2020-07-04T00:00:00Z",366289,16721,348789,15645,,,,,34490,1171,,,,,,,,,"40",580,0,364434,580,364434,,0,15,"0f0efa75da1ec5655c4a2350b224cc2dfb24a426",0,0,0,0,0,""
20200703,"OK",15065,,348789,,"posNeg",363854,391,1661,165,,,,11519,"7/3/2020 00:00","2020-07-03T00:00:00Z","07/02 20:00",398,1661,,"2020-07-03T00:00:00Z",366289,16721,348789,15065,,,,,34490,1171,,,,,,,,,"40",526,10278,363854,10804,363854,,3,46,"173810af098435704b410375f15639b8b22432c2",0,0,0,0,0,""
20200702,"OK",14539,,338511,,"posNeg",353050,368,1615,163,,,,11048,"7/2/2020 08:00","2020-07-02T08:00:00Z","07/02 04:00",395,1615,,"2020-07-02T08:00:00Z",355200,15918,338511,14539,,,,,34490,1171,,,,,,,,,"40",427,6310,353050,6737,353050,,6,62,"1cfd7c05b5ff57aadb426730f319a5e41c3e5aa9",0,0,0,0,0,""
20200701,"OK",14112,,332201,,"posNeg",346313,374,1553,159,,,,10605,"7/1/2020 08:00","2020-07-01T08:00:00Z","07/01 04:00",389,1553,,"2020-07-01T08:00:00Z",348350,15387,332201,14112,,,,,34490,1171,,,,,,,,,"40",355,4361,346313,4716,346313,,2,33,"e3f7b8500d6ed8268dbb972b41fa4cd7cfdd25c6",0,0,0,0,0,""
20200630,"OK",13757,,327840,,"posNeg",341597,315,1520,111,,,,10085,"6/29/2020 08:00","2020-06-29T08:00:00Z","06/29 04:00",387,1520,,"2020-06-29T08:00:00Z",343623,15029,327840,13757,,,,,34490,1171,,,,,,,,,"40",585,14819,341597,15404,341597,,2,31,"e93bd2b41604fa011a642cd31ca19d04cfa2d659",0,0,0,0,0,""
20200629,"OK",13172,,313021,,"posNeg",326193,329,1489,134,,,,9587,"6/29/2020 08:00","2020-06-29T08:00:00Z","06/29 04:00",385,1489,,"2020-06-29T08:00:00Z",327683,13941,313021,13172,,,,,34490,1171,,,,,,,,,"40",228,0,326193,228,326193,,0,33,"487aa3971d1720506773ea925d92fae0cfe36b6a",0,0,0,0,0,""
20200628,"OK",12944,,313021,,"posNeg",325965,329,1456,134,,,,9397,"6/28/2020 00:00","2020-06-28T00:00:00Z","06/27 20:00",385,1456,,"2020-06-28T00:00:00Z",327683,13941,313021,12944,,,,,34490,1171,,,,,,,,,"40",302,0,325965,302,325965,,1,16,"7021bf7fc1df214f3f369226311ae7ae5b206120",0,0,0,0,0,""
20200627,"OK",12642,,313021,,"posNeg",325663,329,1440,134,,,,9155,"6/27/2020 00:00","2020-06-27T00:00:00Z","06/26 20:00",384,1440,,"2020-06-27T00:00:00Z",327683,13941,313021,12642,,,,,34490,1171,,,,,,,,,"40",299,14587,325663,14886,325663,,7,47,"afc17b68ea587fb229b2ffeec8114f8f70397922",0,0,0,0,0,""
20200626,"OK",12343,,298434,,"posNeg",310777,308,1393,126,,,,8817,"6/26/2020 08:00","2020-06-26T08:00:00Z","06/26 04:00",377,1393,,"2020-06-26T08:00:00Z",312454,13338,298434,12343,,,,,30021,1058,,,,,,,,,"40",395,5417,310777,5812,310777,,2,57,"16a8004960b6f3b3bcd235735ac6ab13a469b941",0,0,0,0,0,""
20200625,"OK",11948,,293017,,"posNeg",304965,277,1336,87,,,,8507,"6/25/2020 08:00","2020-06-25T08:00:00Z","06/25 04:00",375,1336,,"2020-06-25T08:00:00Z",306716,13108,293017,11948,,,,,30021,1058,,,,,,,,,"40",438,6249,304965,6687,304965,,3,17,"fcc3c2e3e249634cfa79bdbc56033d071aa92591",0,0,0,0,0,""
20200624,"OK",11510,,286768,,"posNeg",298278,268,1319,90,,,,8144,"6/24/2020 08:00","2020-06-24T08:00:00Z","06/24 04:00",372,1319,,"2020-06-24T08:00:00Z",299930,12498,286768,11510,,,,,30021,1058,,,,,,,,,"40",482,2739,298278,3221,298278,,1,31,"97b23d6cca66c13d90938e661227171aa9815382",0,0,0,0,0,""
20200623,"OK",11028,,284029,,"posNeg",295057,265,1288,111,,,,7888,"6/23/2020 00:00","2020-06-23T00:00:00Z","06/22 20:00",371,1288,,"2020-06-23T00:00:00Z",296988,12295,284029,11028,,,,,30021,1058,,,,,,,,,"40",295,12104,295057,12399,295057,,2,20,"1e084aefe65f4dc4c5ffbd541e98d16c919cefb7",0,0,0,0,0,""
20200622,"OK",10733,,271925,,"posNeg",282658,197,1268,93,,,,7648,"6/22/2020 00:00","2020-06-22T00:00:00Z","06/21 20:00",369,1268,,"2020-06-22T00:00:00Z",283875,11340,271925,10733,,,,,30021,1058,,,,,,,,,"40",218,0,282658,218,282658,,0,25,"0f6e9ae0548ba8690b786c78c0d05d67b7fb8116",0,0,0,0,0,""
20200621,"OK",10515,,271925,,"posNeg",282440,197,1243,93,,,,7531,"6/21/2020 00:00","2020-06-21T00:00:00Z","06/20 20:00",369,1243,,"2020-06-21T00:00:00Z",283875,11340,271925,10037,,,,,30021,1058,,,,,,,,,"40",478,0,282440,478,282440,,1,14,"6dc0181147d6c6bc3cb8d5a20b5648b2b7f5bf01",0,0,0,0,0,""
20200620,"OK",10037,,271925,,"posNeg",281962,197,1229,93,,,,7414,"6/20/2020 08:00","2020-06-20T08:00:00Z","06/20 04:00",368,1229,,"2020-06-20T08:00:00Z",283875,11340,271925,10037,,,,,30021,1058,,,,,,,,,"40",331,7053,281962,7384,281962,,1,20,"32a5458bf429d018b95365e7f70741aa520bf703",0,0,0,0,0,""
20200619,"OK",9706,,264872,,"posNeg",274578,211,1209,96,,,,7212,"6/19/2020 00:00","2020-06-19T00:00:00Z","06/18 20:00",367,1209,,"2020-06-19T00:00:00Z",276316,10834,264872,9706,,,,,27415,974,,,,,,,,,"40",352,4673,274578,5025,274578,,1,63,"636af16a01b378508ff5831c45f750ae9e857990",0,0,0,0,0,""
20200618,"OK",9354,,260199,,"posNeg",269553,197,1146,89,,,,7071,"6/17/2020 00:00","2020-06-17T00:00:00Z","06/16 20:00",366,1146,,"2020-06-17T00:00:00Z",271339,10535,260199,9354,,,,,27415,974,,,,,,,,,"40",450,3671,269553,4121,269553,,2,0,"963b5aa8f381d747fefc145d6dcc9c33513ec355",0,0,0,0,0,""
20200617,"OK",8904,,256528,,"posNeg",265432,181,1146,92,,,,6898,"6/17/2020 08:00","2020-06-17T08:00:00Z","06/17 04:00",364,1146,,"2020-06-17T08:00:00Z",267424,10296,256528,8904,,,,,27415,974,,,,,,,,,"40",259,3368,265432,3627,265432,,1,16,"deb1952e24782f602afda639794d8f5678b7facb",0,0,0,0,0,""
20200616,"OK",8645,,253160,,"posNeg",261805,172,1130,75,,,,6765,"6/16/2020 08:00","2020-06-16T08:00:00Z","06/16 04:00",363,1130,,"2020-06-16T08:00:00Z",263882,10130,253160,8645,,,,,27415,974,,,,,,,,,"40",228,10573,261805,10801,261805,,4,13,"5eca8a54541ff354c8de2da8931ebe156af15dd6",0,0,0,0,0,""
20200615,"OK",8417,,242587,,"posNeg",251004,149,1117,67,,,,6628,"6/15/2020 08:00","2020-06-15T08:00:00Z","06/15 04:00",359,1117,,"2020-06-15T08:00:00Z",252624,9456,242587,8417,,,,,27415,974,,,,,,,,,"40",186,0,251004,186,251004,,0,1,"a055e764d0d0034d416e8cc992c331315587b7d6",0,0,0,0,0,""
20200614,"OK",8231,,242587,,"posNeg",250818,149,1116,67,,,,6578,"6/13/2020 08:00","2020-06-13T08:00:00Z","06/13 04:00",359,1116,,"2020-06-13T08:00:00Z",252624,9456,242587,8231,,,,,27415,974,,,,,,,,,"40",158,4221,250818,4379,250818,,0,5,"4d225c3741a077ab4bc708f349994e993ece53fb",0,0,0,0,0,""
20200613,"OK",8073,,238366,,"posNeg",246439,154,1111,67,,,,6495,"6/12/2020 08:00","2020-06-12T08:00:00Z","06/12 04:00",359,1111,,"2020-06-12T08:00:00Z",248091,9456,238366,8073,,,,,27415,974,,,,,,,,,"40",225,0,246439,225,246439,,0,8,"392bf2e8a7fa827bcb456551881f63bf31829a5c",0,0,0,0,0,""
20200612,"OK",7848,,238366,,"posNeg",246214,154,1103,65,,,,6391,"6/12/2020 08:00","2020-06-12T08:00:00Z","06/12 04:00",359,1103,,"2020-06-12T08:00:00Z",248091,9156,238366,7848,,,,,27415,974,,,,,,,,,"40",222,4547,246214,4769,246214,,2,11,"baec6b03d55aac101ab51dabab45bc6583e6b2e8",0,0,0,0,0,""
20200611,"OK",7626,,233819,,"posNeg",241445,153,1092,58,,,,6263,"6/11/2020 08:00","2020-06-11T08:00:00Z","06/11 04:00",357,1092,,"2020-06-11T08:00:00Z",243214,9395,233819,7626,,,,,23402,863,,,,,,,,,"40",146,4002,241445,4148,241445,,2,17,"b4e18a2acb48ecbc75e58dd9af82726c11fa9cb9",0,0,0,0,0,""
20200610,"OK",7480,,229817,,"posNeg",237297,150,1075,63,,,,6166,"6/9/2020 00:00","2020-06-09T00:00:00Z","06/08 20:00",355,1075,,"2020-06-09T00:00:00Z",239005,8624,229817,7480,,,,,23402,863,,,,,,,,,"40",117,3139,237297,3256,237297,,2,14,"8707463cc6eb9725d5f5192b2c649cd74b977cbc",0,0,0,0,0,""
20200609,"OK",7363,,226678,,"posNeg",234041,148,1061,66,,,,6073,"6/9/2020 00:00","2020-06-09T00:00:00Z","06/08 20:00",353,1061,,"2020-06-09T00:00:00Z",235731,8491,226678,7363,,,,,23402,863,,,,,,,,,"40",158,12080,234041,12238,234041,,5,22,"dfb2aa76a1fe6e10c400360c5024c8d77e7522e0",0,0,0,0,0,""
20200608,"OK",7205,,214598,,"posNeg",221803,158,1039,65,,,,6014,"6/8/2020 00:00","2020-06-08T00:00:00Z","06/07 20:00",348,1039,,"2020-06-08T00:00:00Z",223245,8109,214598,7205,,,,,23402,863,,,,,,,,,"40",55,0,221803,55,221803,,0,13,"96b719fc88c59040add64d8c166ce82f3c559079",0,0,0,0,0,""
20200607,"OK",7150,,214598,,"posNeg",221748,158,1026,65,,,,5981,"6/7/2020 00:00","2020-06-07T00:00:00Z","06/06 20:00",348,1026,,"2020-06-07T00:00:00Z",223245,8109,214598,7150,,,,,23402,863,,,,,,,,,"40",147,0,221748,147,221748,,3,0,"50b911e38304ba4ae2e7435a5322d04d99b3b9ce",0,0,0,0,0,""
20200606,"OK",7003,,214598,,"posNeg",221601,158,1026,65,,,,5867,"6/5/2020 00:00","2020-06-05T00:00:00Z","06/04 20:00",345,1026,,"2020-06-05T00:00:00Z",223245,8109,214598,7003,,,,,23402,863,,,,,,,,,"40",96,5034,221601,5130,221601,,1,12,"f73259eb60f9c1847d779ef097dcb4bf1564e2f5",0,0,0,0,0,""
20200605,"OK",6907,,209564,,"posNeg",216471,164,1014,66,,,,5781,"6/4/2020 00:00","2020-06-04T00:00:00Z","06/03 20:00",344,1014,,"2020-06-04T00:00:00Z",218010,7921,209564,6907,,,,,23402,863,,,,,,,,,"40",0,4749,216471,4749,216471,,0,0,"2d34bc69c579000c0e29f314c7315fa642d65a7c",0,0,0,0,0,""
20200604,"OK",6907,,204815,,"posNeg",211722,148,1014,63,,,,5781,"6/4/2020 00:00","2020-06-04T00:00:00Z","06/03 20:00",344,1014,,"2020-06-04T00:00:00Z",213142,7802,204815,6907,,,,,20278,746,,,,,,,,,"40",102,3568,211722,3670,211722,,3,11,"ebc0c3092f2960995e6975364f0916ba76c95c72",0,0,0,0,0,""
20200603,"OK",6805,,201247,,"posNeg",208052,136,1003,59,,,,5711,"6/3/2020 00:00","2020-06-03T00:00:00Z","06/02 20:00",341,1003,,"2020-06-03T00:00:00Z",209286,7716,201247,6805,,,,,20278,746,,,,,,,,,"40",113,3282,208052,3395,208052,,2,9,"34ba059c45ba47deda378aa9e5b5d3b2a1ad5a74",0,0,0,0,0,""
20200602,"OK",6692,,197965,,"posNeg",204657,124,994,60,,,,5599,"6/2/2020 00:00","2020-06-02T00:00:00Z","06/01 20:00",339,994,,"2020-06-02T00:00:00Z",206116,7628,197965,6692,,,,,20278,746,,,,,,,,,"40",119,11265,204657,11384,204657,,5,8,"12089cea6e61c247547e2a0b5c98958e063c0f9d",0,0,0,0,0,""
20200601,"OK",6573,,186700,,"posNeg",193273,154,986,65,,,,5511,"6/1/2020 00:00","2020-06-01T00:00:00Z","05/31 20:00",334,986,,"2020-06-01T00:00:00Z",194496,7291,186700,6573,,,,,20278,746,,,,,,,,,"40",67,0,193273,67,193273,,0,1,"0c68942597df5772578e5f433d09f430807a9d01",0,0,0,0,0,""
20200531,"OK",6506,,186700,,"posNeg",193206,154,985,65,,,,5492,"5/31/2020 00:00","2020-05-31T00:00:00Z","05/30 20:00",334,985,,"2020-05-31T00:00:00Z",194496,7291,186700,6506,,,,,20278,746,,,,,,,,,"40",88,0,193206,88,193206,,0,3,"c968961bc5231dfb018513839f20652232b7df5d",0,0,0,0,0,""
20200530,"OK",6418,,186700,,"posNeg",193118,154,982,65,,,,5435,"5/30/2020 00:00","2020-05-30T00:00:00Z","05/29 20:00",334,982,,"2020-05-30T00:00:00Z",194496,7291,186700,6418,,,,,20278,746,,,,,,,,,"40",80,5640,193118,5720,193118,,5,0,"e17ada94bce04a5aca77af47ef2c3151f2728e39",0,0,0,0,0,""
20200529,"OK",6338,,181060,,"posNeg",187398,160,982,68,,,,5340,"5/29/2020 00:00","2020-05-29T00:00:00Z","05/28 20:00",329,982,,"2020-05-29T00:00:00Z",188665,7114,181060,6338,,,,,20278,746,,,,,,,,,"40",68,4924,187398,4992,187398,,3,7,"5fa8b739ad6cdd491c9a8ac7a4cd82f62ff45196",0,0,0,0,0,""
20200528,"OK",6270,,176136,,"posNeg",182406,181,975,80,,,,5236,"5/28/2020 00:00","2020-05-28T00:00:00Z","05/27 20:00",326,975,,"2020-05-28T00:00:00Z",183632,7006,176136,6270,,,,,17160,628,,,,,,,,,"40",41,3727,182406,3768,182406,,4,34,"fa62de0c01f26445bf8df5115ccd0b8e69ccd2a4",0,0,0,0,0,""
20200527,"OK",6229,,172409,,"posNeg",178638,156,941,74,,,,5135,"5/27/2020 00:00","2020-05-27T00:00:00Z","05/26 20:00",322,941,,"2020-05-27T00:00:00Z",179842,6948,172409,6229,,,,,17160,628,,,,,,,,,"40",92,18605,178638,18697,178638,,4,0,"d491c773be6475158f638a968693379ffad160c2",0,0,0,0,0,""
20200526,"OK",6137,,153804,,"posNeg",159941,174,941,78,,,,4823,"5/26/2020 00:00","2020-05-26T00:00:00Z","05/25 20:00",318,941,,"2020-05-26T00:00:00Z",160903,6696,153804,6137,,,,,17160,628,,,,,,,,,"40",47,-1139,159941,-1092,159941,,5,3,"a6cf7986e3543a291c57de05759c6db2c8e3b80a",0,0,0,0,0,""
20200525,"OK",6090,,154943,,"posNeg",161033,,938,78,,,,4714,"5/25/2020 12:30","2020-05-25T12:30:00Z","05/25 08:30",313,938,,"2020-05-25T12:30:00Z",160903,6696,154207,6090,,,,,17160,628,,,,,,,,,"40",53,0,161033,53,161033,,2,0,"3915d92fbbb4e7f0e488fafa1e22ca9a850dd291",0,0,0,0,0,""
20200524,"OK",6037,,154943,,"posNeg",160980,174,938,78,,,,4688,"5/23/2020 00:00","2020-05-23T00:00:00Z","05/22 20:00",311,938,,"2020-05-23T00:00:00Z",160903,6696,154207,6037,,,,,17160,628,,,,,,,,,"40",77,0,160980,77,160980,,0,12,"505f651eccae761771bb9581e4b2a4639389be12",0,0,0,0,0,""
20200523,"OK",5960,,154943,,"posNeg",160903,174,926,78,,,,4645,"5/23/2020 00:00","2020-05-23T00:00:00Z","05/22 20:00",311,926,,"2020-05-23T00:00:00Z",160903,6696,154207,5960,,,,,17160,628,,,,,,,,,"40",111,7625,160903,7736,160903,,4,0,"aa4903cbeda42160b1ca0707c8087585e20f5aaa",0,0,0,0,0,""
20200522,"OK",5849,,147318,,"posNeg",153167,190,926,94,,,,4533,"5/22/2020 00:00","2020-05-22T00:00:00Z","05/21 20:00",307,926,,"2020-05-22T00:00:00Z",152998,6589,146409,5849,,,,,13642,459,,,,,,,,,"40",169,3403,153167,3572,153167,,3,9,"58490fa1295c110faa3e19ba1cb7e9b1110fea5d",0,0,0,0,0,""
20200521,"OK",5680,,143915,,"posNeg",149595,201,917,78,,,,4361,"5/21/2020 00:00","2020-05-21T00:00:00Z","05/20 20:00",304,917,,"2020-05-21T00:00:00Z",149447,6464,142983,5680,,,,,13642,459,,,,,,,,,"40",148,5076,149595,5224,149595,,5,12,"4e309979335e05033cd1d98f28bb16b88d01d749",0,0,0,0,0,""
20200520,"OK",5532,,138839,,"posNeg",144371,209,905,92,,,,4266,"5/20/2020 00:00","2020-05-20T00:00:00Z","05/19 20:00",299,905,,"2020-05-20T00:00:00Z",145218,6379,138839,5532,,,,,13642,459,,,,,,,,,"40",43,5181,144371,5224,144371,,5,8,"30b45e38715db3a35597c3b7f7cf2072b67dac57",0,0,0,0,0,""
20200519,"OK",5489,,133658,,"posNeg",139147,167,897,77,,,,4135,"5/19/2020 00:00","2020-05-19T00:00:00Z","05/18 20:00",294,897,,"2020-05-19T00:00:00Z",140262,6221,133658,5489,,,,,13642,459,,,,,,,,,"40",91,15496,139147,15587,139147,,6,12,"a2354907f3aec8c646bda9520960b876a5afb773",0,0,0,0,0,""
20200518,"OK",5398,,118162,,"posNeg",123560,76,885,45,,,,4008,"5/18/2020 00:00","2020-05-18T00:00:00Z","05/17 20:00",288,885,,"2020-05-18T00:00:00Z",123954,5792,118162,5398,,,,,13642,459,,,,,,,,,"40",88,0,123560,88,123560,,0,5,"cff92c1da431a231d7d3cf65f747afea4c1040ac",0,0,0,0,0,""
20200517,"OK",5310,,118162,,"posNeg",123472,180,880,73,,,,3983,"5/17/2020 00:00","2020-05-17T00:00:00Z","05/16 20:00",288,880,,"2020-05-17T00:00:00Z",123954,5792,118162,5310,,,,,13642,459,,,,,,,,,"40",73,0,123472,73,123472,,0,2,"c5e91cf3c254614fc2215a754d0f7125a3f0bace",0,0,0,0,0,""
20200516,"OK",5237,,118162,,"posNeg",123399,180,878,73,,,,3945,"5/16/2020 00:00","2020-05-16T00:00:00Z","05/15 20:00",288,878,,"2020-05-16T00:00:00Z",123954,5792,118162,5237,,,,,13642,459,,,,,,,,,"40",151,5056,123399,5207,123399,,3,15,"97124b2c12d6716d8b2a3ae1f2943c7adc30674c",0,0,0,0,0,""
20200515,"OK",5086,,113106,,"posNeg",118192,215,863,98,,,,3801,"5/15/2020 00:00","2020-05-15T00:00:00Z","05/14 20:00",285,863,,"2020-05-15T00:00:00Z",118751,5645,113106,5086,,,,,13642,459,,,,,,,,,"40",124,5885,118192,6009,118192,,1,5,"a24409b7d33f57c9cce17d2ef164861bc8543848",0,0,0,0,0,""
20200514,"OK",4962,,107221,,"posNeg",112183,217,858,102,,,,3660,"5/14/2020 00:00","2020-05-14T00:00:00Z","05/13 20:00",284,858,,"2020-05-14T00:00:00Z",112647,5426,107221,4962,,,,,,,,,,,,,,,"40",110,2946,112183,3056,112183,,6,10,"25e044e35f2d2c44bf486dfb75a4ab63f3c1cd92",0,0,0,0,0,""
20200513,"OK",4852,,104275,,"posNeg",109127,218,848,93,,,,3559,"5/13/2020 00:00","2020-05-13T00:00:00Z","05/12 20:00",278,848,,"2020-05-13T00:00:00Z",109859,5317,104275,4852,,,,,,,,,,,,,,,"40",120,12896,109127,13016,109127,,0,20,"e09039d058c9eb974f298fa949047af99908b273",0,0,0,0,0,""
20200512,"OK",4732,,91379,,"posNeg",96111,190,828,83,,,,3423,"5/12/2020 00:00","2020-05-12T00:00:00Z","05/11 20:00",278,828,,"2020-05-12T00:00:00Z",106559,5229,101082,4732,,,,,,,,,,,,,,,"40",119,0,96111,119,96111,,4,0,"49a965ea07ae250d5ef658653e501c812e5d35cd",0,0,0,0,0,""
20200511,"OK",4613,,91379,,"posNeg",95992,177,828,93,,,,3241,"5/11/2020 00:00","2020-05-11T00:00:00Z","05/10 20:00",274,828,,"2020-05-11T00:00:00Z",95869,4923,90721,4613,,,,,,,,,,,,,,,"40",24,0,95992,24,95992,,2,2,"9de7ff862aa31ff9af6500c684e40944bfdfc3d5",0,0,0,0,0,""
20200510,"OK",4589,,91379,,"posNeg",95968,177,826,93,,,,3204,"5/10/2020 00:00","2020-05-10T00:00:00Z","05/09 20:00",272,826,,"2020-05-10T00:00:00Z",95869,4923,90721,4589,,,,,,,,,,,,,,,"40",99,0,95968,99,95968,,2,4,"3336b455123933f21c5688f9b0d391bd4b8400ae",0,0,0,0,0,""
20200509,"OK",4490,,91379,,"posNeg",95869,177,822,93,,,,3154,"5/9/2020 00:00","2020-05-09T00:00:00Z","05/08 20:00",270,822,,"2020-05-09T00:00:00Z",95869,4923,90721,4490,,,,,,,,,,,,,,,"40",66,5946,95869,6012,95869,,4,17,"0205cd221d3b07b48e7056adc53a47ccf6351aab",0,0,0,0,0,""
20200508,"OK",4424,,85433,,"posNeg",89857,228,805,96,,,,3064,"5/8/2020 00:00","2020-05-08T00:00:00Z","05/07 20:00",266,805,,"2020-05-08T00:00:00Z",89857,4779,85078,4424,,,,,,,,,,,,,,,"40",94,2876,89857,2970,89857,,6,0,"dde7f854dfd8290a55555843af9a20fd22ebcbe8",0,0,0,0,0,""
20200507,"OK",4330,,82557,,"posNeg",86887,223,805,97,,,,2985,"5/7/2020 00:00","2020-05-07T00:00:00Z","05/06 20:00",260,805,,"2020-05-07T00:00:00Z",87459,4698,82557,4330,,,,,,,,,,,,,,,"40",129,3868,86887,3997,86887,,7,32,"d16f3f703e69898c731bd639af7e447535a371db",0,0,0,0,0,""
20200506,"OK",4201,,78689,,"posNeg",82890,230,773,102,,,,2909,"5/6/2020 00:00","2020-05-06T00:00:00Z","05/05 20:00",253,773,,"2020-05-06T00:00:00Z",83401,4538,78689,4201,,,,,,,,,,,,,,,"40",74,3399,82890,3473,82890,,6,0,"215a99ab8dc65b72d23ac0118312fa600dcb1f43",0,0,0,0,0,""
20200505,"OK",4127,,75290,,"posNeg",79417,236,773,113,,,,2830,"5/5/2020 00:00","2020-05-05T00:00:00Z","05/04 20:00",247,773,,"2020-05-05T00:00:00Z",79892,4430,75290,4127,,,,,,,,,,,,,,,"40",83,15486,79417,15569,79417,,9,20,"b29c3b31fd156dd4af7ba21146d6843bb97ffaec",0,0,0,0,0,""
20200504,"OK",4044,,59804,,"posNeg",63848,236,753,92,,,,2682,"5/3/2020 00:00","2020-05-03T00:00:00Z","05/02 20:00",238,753,,"2020-05-03T00:00:00Z",70368,4150,66084,4044,,,,,,,,,,,,,,,"40",72,0,63848,72,63848,,0,10,"13b654c322dd1d6be1b64b67ac0da94231df7428",0,0,0,0,0,""
20200503,"OK",3972,,59804,,"posNeg",63776,236,743,92,,,,2635,"5/3/2020 00:00","2020-05-03T00:00:00Z","05/02 20:00",238,743,,"2020-05-03T00:00:00Z",70368,4150,66084,3972,,,,,,,,,,,,,,,"40",121,0,63776,121,63776,,0,0,"3e00aac04f4a01a3fd4ed058f44556cb6bd26e66",0,0,0,0,0,""
20200502,"OK",3851,,59804,,"posNeg",63655,236,743,92,,,,2554,"5/2/2020 00:00","2020-05-02T00:00:00Z","05/01 20:00",238,743,,"2020-05-02T00:00:00Z",70368,4150,66084,3851,,,,,,,,,,,,,,,"40",103,0,63655,103,63655,,8,28,"e1be4c907d91cfc789add6ce5b9eac0b98dfa243",0,0,0,0,0,""
20200501,"OK",3748,,59804,,"posNeg",63552,255,715,113,,,,2467,"5/1/2020 00:00","2020-05-01T00:00:00Z","04/30 20:00",230,715,,"2020-05-01T00:00:00Z",66866,4032,62714,3748,,,,,,,,,,,,,,,"40",130,0,63552,130,63552,,8,12,"6065d61032b30ae86d781a9d987892c4269bb28e",0,0,0,0,0,""
20200430,"OK",3618,,59804,,"posNeg",63422,291,703,127,,,,2401,"4/29/2020 00:00","2020-04-29T00:00:00Z","04/28 20:00",222,703,,"2020-04-29T00:00:00Z",63779,3859,59804,3618,,,,,,,,,,,,,,,"40",145,2010,63422,2155,63422,,8,10,"5dd93ad3fc0a43547fab7c919cfab659a1b67f62",0,0,0,0,0,""
20200429,"OK",3473,,57794,,"posNeg",61267,283,693,126,,,,2319,"4/29/2020 00:00","2020-04-29T00:00:00Z","04/28 20:00",214,693,,"2020-04-29T00:00:00Z",61619,3717,57794,3473,,,,,,,,,,,,,,,"40",63,1505,61267,1568,61267,,7,37,"ab08f9ffaf5abd95a6c144899678e1d88ded595e",0,0,0,0,0,""
20200428,"OK",3410,,56289,,"posNeg",59699,288,656,118,,,,2260,"4/28/2020 00:00","2020-04-28T00:00:00Z","04/27 20:00",207,656,,"2020-04-28T00:00:00Z",,,,3410,,,,,,,,,,,,,,,"40",130,6398,59699,6528,59699,,10,0,"2739d3abc217d01d0be8d07b9a31b7d28eb23c18",0,0,0,0,0,""
20200427,"OK",3280,,49891,,"posNeg",53171,306,656,150,,,,2167,"4/27/2020 00:00","2020-04-27T00:00:00Z","04/26 20:00",197,656,,"2020-04-27T00:00:00Z",,,,3280,,,,,,,,,,,,,,,"40",27,0,53171,27,53171,,2,3,"8d65259aed6f124f61b8cab5f61be4844b171e61",0,0,0,0,0,""
20200426,"OK",3253,,49891,,"posNeg",53144,306,653,150,,,,2139,"4/26/2020 00:00","2020-04-26T00:00:00Z","04/25 20:00",195,653,,"2020-04-26T00:00:00Z",,,,3253,,,,,,,,,,,,,,,"40",60,0,53144,60,53144,,1,16,"ed44f57eb0e18dbc6e4554585d683f8f7de6136f",0,0,0,0,0,""
20200425,"OK",3193,,49891,,"posNeg",53084,306,637,150,,,,2080,"4/25/2020 00:00","2020-04-25T00:00:00Z","04/24 20:00",194,637,,"2020-04-25T00:00:00Z",,,,3193,,,,,,,,,,,,,,,"40",72,6872,53084,6944,53084,,6,0,"d8c5b53e1e32c1b81fe7e6d16c082548da84b74f",0,0,0,0,0,""
20200424,"OK",3121,,43019,,"posNeg",46140,310,637,155,,,,1961,"4/24/2020 00:00","2020-04-24T00:00:00Z","04/23 20:00",188,637,,"2020-04-24T00:00:00Z",,,,3121,,,,,,,,,,,,,,,"40",104,0,46140,104,46140,,9,15,"1968c6b9321bdcef3da014c60da824e5be62ace4",0,0,0,0,0,""
20200423,"OK",3017,,43019,,"posNeg",46036,284,622,156,,,,1884,"4/23/2020 00:00","2020-04-23T00:00:00Z","04/22 20:00",179,622,,"2020-04-23T00:00:00Z",,,,3017,,,,,,,,,,,,,,,"40",123,0,46036,123,46036,,9,34,"022d1c2ae0e1d4edc5d13fa50af53c676e94c241",0,0,0,0,0,""
20200422,"OK",2894,,43019,,"posNeg",45913,298,588,147,,,,1772,"4/22/2020 00:00","2020-04-22T00:00:00Z","04/21 20:00",170,588,,"2020-04-22T00:00:00Z",,,,2894,,,,,,,,,,,,,,,"40",87,1482,45913,1569,45913,,6,27,"ce82b8a3494158da74aa938de9045242b6165251",0,0,0,0,0,""
20200421,"OK",2807,,41537,,"posNeg",44344,346,561,164,,,,1702,"4/21/2020 00:00","2020-04-21T00:00:00Z","04/20 20:00",164,561,,"2020-04-21T00:00:00Z",,,,2807,,,,,,,,,,,,,,,"40",127,8571,44344,8698,44344,,21,20,"4075618221d1869d6d8ee0ca6eb4d3e995147a05",0,0,0,0,0,""
20200420,"OK",2680,,32966,,"posNeg",35646,307,541,136,,,,1614,"4/20/2020 00:00","2020-04-20T00:00:00Z","04/19 20:00",143,541,,"2020-04-20T00:00:00Z",,,,2680,,,,,,,,,,,,,,,"40",81,0,35646,81,35646,,3,0,"6f0a75164de755ddaf344935ef73f631a8c48f30",0,0,0,0,0,""
20200419,"OK",2599,,32966,,"posNeg",35565,307,541,136,,,,1575,"4/19/2020 00:00","2020-04-19T00:00:00Z","04/18 20:00",140,541,,"2020-04-19T00:00:00Z",,,,2599,,,,,,,,,,,,,,,"40",29,0,35565,29,35565,,1,0,"f94f96a8a7a5bd9002cf72a668535db480b26970",0,0,0,0,0,""
20200418,"OK",2570,,32966,,"posNeg",35536,307,541,136,,,,1515,"4/18/2020 00:00","2020-04-18T00:00:00Z","04/17 20:00",139,541,,"2020-04-18T00:00:00Z",,,,2570,,,,,,,,,,,,,,,"40",105,1811,35536,1916,35536,,3,13,"9931428e05bfafbf7c73456f8444d99bb879656e",0,0,0,0,0,""
20200417,"OK",2465,,31155,,"posNeg",33620,325,528,155,,,,1331,"4/17/2020 11:35","2020-04-17T11:35:00Z","04/17 07:35",136,528,,"2020-04-17T11:35:00Z",,,,2465,,,,,,,,,,,,,,,"40",108,2613,33620,2721,33620,,5,0,"6ad9df19d46d3db2641fec312216543e370e8c1b",0,0,0,0,0,""
20200416,"OK",2357,,28542,,"posNeg",30899,236,528,163,,,,1240,"4/16/2020 08:00","2020-04-16T08:00:00Z","04/16 04:00",131,528,,"2020-04-16T08:00:00Z",,,,2357,,,,,,,,,,,,,,,"40",94,1586,30899,1680,30899,,8,18,"142034054bfe34acda03dfaf13e8323f2098ea48",0,0,0,0,0,""
20200415,"OK",2263,,26956,,"posNeg",29219,194,510,107,,,,1115,"4/15/2020 08:00","2020-04-15T08:00:00Z","04/15 04:00",123,510,,"2020-04-15T08:00:00Z",,,,2263,,,,,,,,,,,,,,,"40",79,871,29219,950,29219,,15,22,"6c707220e6d3227f3799f38254156a1dc674983d",0,0,0,0,0,""
20200414,"OK",2184,,26085,,"posNeg",28269,194,488,107,,,,1060,"4/14/2020 08:00","2020-04-14T08:00:00Z","04/14 04:00",108,488,,"2020-04-14T08:00:00Z",,,,2184,,,,,,,,,,,,,,,"40",115,5295,28269,5410,28269,,9,31,"35806846edd76174656c5dd527a58ba2d387e395",0,0,0,0,0,""
20200413,"OK",2069,,20790,,"posNeg",22859,383,457,191,,,,865,"4/13/2020 08:00","2020-04-13T08:00:00Z","04/13 04:00",99,457,,"2020-04-13T08:00:00Z",,,,,,,,,,,,,,,,,,,"40",99,0,22859,99,22859,,3,11,"a593a9aed4e93ad4998e2ee168b5e09565d440dc",0,0,0,0,0,""
20200412,"OK",1970,,20790,,"posNeg",22760,383,446,191,,,,865,"4/12/2020 08:00","2020-04-12T08:00:00Z","04/12 04:00",96,446,,"2020-04-12T08:00:00Z",,,,,,,,,,,,,,,,,,,"40",102,0,22760,102,22760,,2,0,"df5dd20aae6a866c9789c10bae0793ff90f54608",0,0,0,0,0,""
20200411,"OK",1868,,20790,,"posNeg",22658,383,446,191,,,,865,"4/11/2020 08:00","2020-04-11T08:00:00Z","04/11 04:00",94,446,,"2020-04-11T08:00:00Z",,,,,,,,,,,,,,,,,,,"40",74,420,22658,494,22658,,6,18,"4337199f87fa45b2714e5cf8f603577e53f61656",0,0,0,0,0,""
20200410,"OK",1794,,20370,,"posNeg",22164,186,428,122,,,,790,"4/10/2020 08:00","2020-04-10T08:00:00Z","04/10 04:00",88,428,,"2020-04-10T08:00:00Z",,,,,,,,,,,,,,,,,,,"40",110,1775,22164,1885,22164,,8,13,"28f4aa4a4fd17edc7cfa2248883a21e2bb255d72",0,0,0,0,0,""
20200409,"OK",1684,,18595,,"posNeg",20279,188,415,120,,,,686,"4/9/2020 08:00","2020-04-09T08:00:00Z","04/09 04:00",80,415,,"2020-04-09T08:00:00Z",,,,,,,,,,,,,,,,,,,"40",160,6774,20279,6934,20279,,1,25,"bcb6427d33c9c1ed96110ad20df87fc57de3faa6",0,0,0,0,0,""
20200408,"OK",1524,,11821,,"posNeg",13345,188,390,120,,,,686,"4/8/2020 08:00","2020-04-08T08:00:00Z","04/08 04:00",79,390,,"2020-04-08T08:00:00Z",,,,,,,,,,,,,,,,,,,"40",52,0,13345,52,13345,,12,14,"5d36367fb78f27295e0f02aef07ca456312b5c02",0,0,0,0,0,""
20200407,"OK",1472,,11821,,"posNeg",13293,186,376,137,,,,612,"4/7/2020 08:00","2020-04-07T08:00:00Z","04/07 04:00",67,376,,"2020-04-07T08:00:00Z",,,,,,,,,,,,,,,,,,,"40",145,10399,13293,10544,13293,,16,36,"2d3b50a2a13d07ab93feaab926e21f30dc76ec28",0,0,0,0,0,""
20200406,"OK",1327,,1422,,"posNeg",2749,161,340,143,,,,522,"4/6/2020 08:00","2020-04-06T08:00:00Z","04/06 04:00",51,340,,"2020-04-06T08:00:00Z",,,,,,,,,,,,,,,,,,,"40",75,21,2749,96,2749,,5,10,"981ee25206402dde88d3202bda8ad3ed39e64156",0,0,0,0,0,""
20200405,"OK",1252,,1401,,"posNeg",2653,,330,,,,,,"4/5/2020 08:00","2020-04-05T08:00:00Z","04/05 04:00",46,330,,"2020-04-05T08:00:00Z",,,,,,,,,,,,,,,,,,,"40",93,39,2653,132,2653,,4,14,"5668ace097180815a822bcbd41239e017a2bf1a4",0,0,0,0,0,""
20200404,"OK",1159,,1362,,"posNeg",2521,,316,,,,,,"4/4/2020 08:00","2020-04-04T08:00:00Z","04/04 04:00",42,316,,"2020-04-04T08:00:00Z",,,,,,,,,,,,,,,,,,,"40",171,47,2521,218,2521,,4,27,"5a16ddead2562f6e3a1d7c22d4e10b4e6d2c3728",0,0,0,0,0,""
20200403,"OK",988,,1315,,"posNeg",2303,171,289,123,,,,383,"4/3/2020 08:00","2020-04-03T08:00:00Z","04/03 04:00",38,289,,"2020-04-03T08:00:00Z",,,,,,,,,,,,,,,,,,,"40",109,50,2303,159,2303,,4,32,"0b2d74b26159350cd041816b8cb652910db7af04",0,0,0,0,0,""
20200402,"OK",879,,1265,,"posNeg",2144,182,257,144,,,,,"4/1/2020 08:00","2020-04-01T08:00:00Z","04/01 04:00",34,257,,"2020-04-01T08:00:00Z",,,,,,,,,,,,,,,,,,,"40",160,17,2144,177,2144,,4,38,"a9cc34edc10f7a29153a3cb990c7ddf057d2e171",0,0,0,0,0,""
20200401,"OK",719,,1248,,"posNeg",1967,174,219,98,,,,,"4/1/2020 08:00","2020-04-01T08:00:00Z","04/01 04:00",30,219,,"2020-04-01T08:00:00Z",,,,,,,,,,,,,,,,,,,"40",154,19,1967,173,1967,,7,42,"af4dfe50558bdb27f69c422a456f28f82efd97a0",0,0,0,0,0,""
20200331,"OK",565,,1229,,"posNeg",1794,,177,83,,,,,"3/31/2020 08:00","2020-03-31T08:00:00Z","03/31 04:00",23,177,,"2020-03-31T08:00:00Z",,,,,,,,,,,,,,,,,,,"40",84,22,1794,106,1794,,6,24,"45abacc70476b97c78b9245c0d66aed3e9efac0c",0,0,0,0,0,""
20200330,"OK",481,,1207,,"posNeg",1688,,153,103,,,,,"3/30/2020 08:00","2020-03-30T08:00:00Z","03/30 04:00",17,153,,"2020-03-30T08:00:00Z",,,,,,,,,,,,,,,,,,,"40",52,2,1688,54,1688,,1,13,"f35036519be2f3cdb98074d61508ede1c46b616b",0,0,0,0,0,""
20200329,"OK",429,,1205,,"posNeg",1634,,140,,,,,,"3/29/2020 08:00","2020-03-29T08:00:00Z","03/29 04:00",16,140,,"2020-03-29T08:00:00Z",,,,,,,,,,,,,,,,,,,"40",52,25,1634,77,1634,,1,14,"546b55a5f68d21d9dda67c44671a4d4bea24cc38",0,0,0,0,0,""
20200328,"OK",377,,1180,,"posNeg",1557,,126,,,,,,"3/27/2020 08:00","2020-03-27T08:00:00Z","03/27 04:00",15,126,,"2020-03-27T08:00:00Z",,,,,,,,,,,,,,,,,,,"40",55,96,1557,151,1557,,7,21,"9510d4ec33540e2c7394ffb7c6e8c57acf818931",0,0,0,0,0,""
20200327,"OK",322,,1084,,"posNeg",1406,,105,,,,,,"3/27/2020 08:00","2020-03-27T08:00:00Z","03/27 04:00",8,105,,"2020-03-27T08:00:00Z",,,,,,,,,,,,,,,,,,,"40",74,126,1406,200,1406,,1,19,"7b807cda3ba895c6acc0b26124ae05dd8c0c347a",0,0,0,0,0,""
20200326,"OK",248,,958,,"posNeg",1206,,86,,,,,,"3/26/2020 08:00","2020-03-26T08:00:00Z","03/26 04:00",7,86,,"2020-03-26T08:00:00Z",,,,,,,,,,,,,,,,,,,"40",84,153,1206,237,1206,,2,27,"ee230d8efb88ea8827dad9f81ccf554343d529ce",0,0,0,0,0,""
20200325,"OK",164,,805,,"posNeg",969,,59,,,,,,"3/25/2020 08:00","2020-03-25T08:00:00Z","03/25 04:00",5,59,,"2020-03-25T08:00:00Z",,,,,,,,,,,,,,,,,,,"40",58,70,969,128,969,,2,34,"7f4f6018f3339c37d5df27fbf5f7de66fdc9b32e",0,0,0,0,0,""
