"date","state","positive","probableCases","negative","pending","totalTestResultsSource","totalTestResults","hospitalizedCurrently","hospitalizedCumulative","inIcuCurrently","inIcuCumulative","onVentilatorCurrently","onVentilatorCumulative","recovered","lastUpdateEt","dateModified","checkTimeEt","death","hospitalized","hospitalizedDischarged","dateChecked","totalTestsViral","positiveTestsViral","negativeTestsViral","positiveCasesViral","deathConfirmed","deathProbable","totalTestEncountersViral","totalTestsPeopleViral","totalTestsAntibody","positiveTestsAntibody","negativeTestsAntibody","totalTestsPeopleAntibody","positiveTestsPeopleAntibody","negativeTestsPeopleAntibody","totalTestsPeopleAntigen","positiveTestsPeopleAntigen","totalTestsAntigen","positiveTestsAntigen","fips","positiveIncrease","negativeIncrease","total","totalTestResultsIncrease","posNeg","dataQualityGrade","deathIncrease","hospitalizedIncrease","hash","commercialScore","negativeRegularScore","negativeScore","positiveScore","score","grade"
20210307,"RI",128781,,677570,,"totalTestEncountersViral",3123348,141,9020,25,,16,,,"3/8/2021 16:31","2021-03-08T16:31:00Z","03/08 11:31",2547,9020,7865,"2021-03-08T16:31:00Z",,153260,2970088,,,,3123348,806351,,,,,,,,,,,"44",265,1421,806351,13513,806351,,0,0,"604774c9b6670cbf0a7060307078cfd0e6504e4d",0,0,0,0,0,""
20210306,"RI",128516,,676149,,"totalTestEncountersViral",3109835,141,9020,25,,16,,,"3/8/2021 16:31","2021-03-08T16:31:00Z","03/08 11:31",2547,9020,7865,"2021-03-08T16:31:00Z",,152964,2956871,,,,3109835,804665,,,,,,,,,,,"44",395,1634,804665,21854,804665,,6,0,"6020697a20d21adb669d1e36a90b1ef18b9346ea",0,0,0,0,0,""
20210305,"RI",128121,,674515,,"totalTestEncountersViral",3087981,141,9020,25,,16,,,"3/5/2021 13:00","2021-03-05T13:00:00Z","03/05 08:00",2541,9020,7865,"2021-03-05T13:00:00Z",,152549,2935432,,,,3087981,802636,,,,,,,,,,,"44",394,1387,802636,22869,802636,,2,18,"b002a515c1592d2d9cfff080b3fca225487b8670",0,0,0,0,0,""
20210304,"RI",127727,,673128,,"totalTestEncountersViral",3065112,148,9002,23,,16,,,"3/4/2021 13:00","2021-03-04T13:00:00Z","03/04 08:00",2539,9002,7842,"2021-03-04T13:00:00Z",,152103,2913009,,,,3065112,800855,,,,,,,,,,,"44",442,1586,800855,23431,800855,,5,20,"9dcc40e6841242b569873d367bf66c24a258fb86",0,0,0,0,0,""
20210303,"RI",127285,,671542,,"totalTestEncountersViral",3041681,147,8982,23,,14,,,"3/3/2021 13:00","2021-03-03T13:00:00Z","03/03 08:00",2534,8982,7823,"2021-03-03T13:00:00Z",,151620,2890061,,,,3041681,798827,,,,,,,,,,,"44",436,1258,798827,19375,798827,,9,16,"2454d5b38bde91cbda75fc3882f43bf5fc11c87f",0,0,0,0,0,""
20210302,"RI",126849,,670284,,"totalTestEncountersViral",3022306,157,8966,25,,17,,,"3/2/2021 13:00","2021-03-02T13:00:00Z","03/02 08:00",2525,8966,7801,"2021-03-02T13:00:00Z",,151143,2871163,,,,3022306,797133,,,,,,,,,,,"44",261,1152,797133,10995,797133,,8,19,"b1a2a4255b709754eb8426918962483a3341c100",0,0,0,0,0,""
20210301,"RI",126588,,669132,,"totalTestEncountersViral",3011311,162,8947,28,,18,,,"3/1/2021 13:00","2021-03-01T13:00:00Z","03/01 08:00",2517,8947,7780,"2021-03-01T13:00:00Z",,150827,2860484,,,,3011311,795720,,,,,,,,,,,"44",152,690,795720,5788,795720,,3,47,"e5a5e58ea7add7e56c606a578e184ea67b11c7ae",0,0,0,0,0,""
20210228,"RI",126436,,668442,,"totalTestEncountersViral",3005523,168,8900,34,,19,,,"3/1/2021 16:42","2021-03-01T16:42:00Z","03/01 11:42",2514,8900,7731,"2021-03-01T16:42:00Z",,150645,2854878,,,,3005523,794878,,,,,,,,,,,"44",343,1637,794878,15080,794878,,2,0,"1404b898ceef76b3551b1932ded59d4e26994397",0,0,0,0,0,""
20210227,"RI",126093,,666805,,"totalTestEncountersViral",2990443,168,8900,34,,19,,,"3/1/2021 16:42","2021-03-01T16:42:00Z","03/01 11:42",2512,8900,7731,"2021-03-01T16:42:00Z",,150268,2840175,,,,2990443,792898,,,,,,,,,,,"44",471,1226,792898,21802,792898,,10,0,"3be358a4960f03e9986531cfc617abd747706aaa",0,0,0,0,0,""
20210226,"RI",125622,,665579,,"totalTestEncountersViral",2968641,168,8900,34,,19,,,"2/26/2021 13:00","2021-02-26T13:00:00Z","02/26 08:00",2502,8900,7731,"2021-02-26T13:00:00Z",,149782,2818859,,,,2968641,791201,,,,,,,,,,,"44",437,1632,791201,21945,791201,,6,25,"7c994a1c2bb2930e8c0faf3fde49ca3c348f98d5",0,0,0,0,0,""
20210225,"RI",125185,,663947,,"totalTestEncountersViral",2946696,163,8875,34,,17,,,"2/25/2021 13:00","2021-02-25T13:00:00Z","02/25 08:00",2496,8875,7713,"2021-02-25T13:00:00Z",,149262,2797434,,,,2946696,789132,,,,,,,,,,,"44",467,1811,789132,24685,789132,,9,25,"a4896ca81e146e7b46b1560a89194d8c475511d4",0,0,0,0,0,""
20210224,"RI",124718,,662136,,"totalTestEncountersViral",2922011,168,8850,32,,16,,,"2/24/2021 13:00","2021-02-24T13:00:00Z","02/24 08:00",2487,8850,7685,"2021-02-24T13:00:00Z",,148754,2773257,,,,2922011,786854,,,,,,,,,,,"44",456,1600,786854,19189,786854,,11,15,"94c6c803fb3f3a8f93d8778c4cce07643d7b3d3d",0,0,0,0,0,""
20210223,"RI",124262,,660536,,"totalTestEncountersViral",2902822,170,8835,32,,19,,,"2/23/2021 13:00","2021-02-23T13:00:00Z","02/23 08:00",2476,8835,7668,"2021-02-23T13:00:00Z",,148283,2754539,,,,2902822,784798,,,,,,,,,,,"44",282,1470,784798,11383,784798,,10,20,"1c0f8663c4d9da98cdb512406c24aa79950b6468",0,0,0,0,0,""
20210222,"RI",123980,,659066,,"totalTestEncountersViral",2891439,186,8815,27,,18,,,"2/22/2021 13:00","2021-02-22T13:00:00Z","02/22 08:00",2466,8815,7648,"2021-02-22T13:00:00Z",,147884,2743555,,,,2891439,783046,,,,,,,,,,,"44",159,787,783046,6094,783046,,3,-55,"6aacf72bf158309ed9b47531d44fbfdfb50744c0",0,0,0,0,0,""
20210221,"RI",123821,,658279,,"totalTestEncountersViral",2885345,177,8870,29,,18,,,"2/22/2021 16:42","2021-02-22T16:42:00Z","02/22 11:42",2463,8870,7705,"2021-02-22T16:42:00Z",,147691,2737654,,,,2885345,782100,,,,,,,,,,,"44",273,1336,782100,10911,782100,,1,0,"041f5c2c3781342162d1bb63c51089b0893343dc",0,0,0,0,0,""
20210220,"RI",123548,,656943,,"totalTestEncountersViral",2874434,177,8870,29,,18,,,"2/22/2021 16:42","2021-02-22T16:42:00Z","02/22 11:42",2462,8870,7705,"2021-02-22T16:42:00Z",,147351,2727083,,,,2874434,780491,,,,,,,,,,,"44",403,1249,780491,20650,780491,,86,0,"e5797e73d2f77124b6c89ae1ace459a436534d21",0,0,0,0,0,""
20210219,"RI",123145,,655694,,"totalTestEncountersViral",2853784,177,8870,29,,18,,,"2/19/2021 13:00","2021-02-19T13:00:00Z","02/19 08:00",2376,8870,7705,"2021-02-19T13:00:00Z",,146886,2706898,,,,2853784,778839,,,,,,,,,,,"44",286,1386,778839,21423,778839,,9,24,"84cba21786e3de6f5f02edaefcd3e5a41c847d31",0,0,0,0,0,""
20210218,"RI",122859,,654308,,"totalTestEncountersViral",2832361,180,8846,32,,18,,,"2/18/2021 13:00","2021-02-18T13:00:00Z","02/18 08:00",2367,8846,7679,"2021-02-18T13:00:00Z",,146502,2685859,,,,2832361,777167,,,,,,,,,,,"44",419,1508,777167,22035,777167,,15,35,"9feca594c835dba9b94fad4a39f005898e4e27d0",0,0,0,0,0,""
20210217,"RI",122440,,652800,,"totalTestEncountersViral",2810326,193,8811,30,,19,,,"2/17/2021 13:00","2021-02-17T13:00:00Z","02/17 08:00",2352,8811,7633,"2021-02-17T13:00:00Z",,146052,2664274,,,,2810326,775240,,,,,,,,,,,"44",368,1773,775240,19330,775240,,8,25,"452c747c696ca98f9c0f6bcb0284f095c6d50c14",0,0,0,0,0,""
20210216,"RI",122072,,651027,,"totalTestEncountersViral",2790996,197,8786,36,,20,,,"2/16/2021 13:00","2021-02-16T13:00:00Z","02/16 08:00",2344,8786,7607,"2021-02-16T13:00:00Z",,145600,2645396,,,,2790996,773099,,,,,,,,,,,"44",285,1107,773099,10557,773099,,10,32,"cf0d170590269ab76020ab24cc30ab665512c043",0,0,0,0,0,""
20210215,"RI",121787,,649920,,"totalTestEncountersViral",2780439,181,8754,35,,16,,,"2/15/2021 13:00","2021-02-15T13:00:00Z","02/15 08:00",2334,8754,7591,"2021-02-15T13:00:00Z",,145248,2635191,,,,2780439,771707,,,,,,,,,,,"44",203,780,771707,5975,771707,,2,65,"1c2155aa7a19c3e97df81db5a44fc90f42981bbb",0,0,0,0,0,""
20210214,"RI",121584,,649140,,"totalTestEncountersViral",2774464,222,8689,39,,20,,,"2/15/2021 16:42","2021-02-15T16:42:00Z","02/15 11:42",2332,8689,7496,"2021-02-15T16:42:00Z",,145010,2629454,,,,2774464,770724,,,,,,,,,,,"44",320,1525,770724,14090,770724,,3,0,"e821022b320337aba5156f3de1498639d28b0af1",0,0,0,0,0,""
20210213,"RI",121264,,647615,,"totalTestEncountersViral",2760374,222,8689,39,,20,,,"2/15/2021 16:42","2021-02-15T16:42:00Z","02/15 11:42",2329,8689,7496,"2021-02-15T16:42:00Z",,144637,2615737,,,,2760374,768879,,,,,,,,,,,"44",443,1448,768879,23401,768879,,39,0,"278262ba689a24fc24a4e41ed489f0ae6b1292d5",0,0,0,0,0,""
20210212,"RI",120821,,646167,,"totalTestEncountersViral",2736973,222,8689,39,,20,,,"2/12/2021 13:00","2021-02-12T13:00:00Z","02/12 08:00",2290,8689,7496,"2021-02-12T13:00:00Z",,144182,2592791,,,,2736973,766988,,,,,,,,,,,"44",440,1860,766988,22782,766988,,16,32,"5a5097a953df13fe1623a33dff68b8cf98f7948b",0,0,0,0,0,""
20210211,"RI",120381,,644307,,"totalTestEncountersViral",2714191,238,8657,45,,22,,,"2/11/2021 13:00","2021-02-11T13:00:00Z","02/11 08:00",2274,8657,7453,"2021-02-11T13:00:00Z",,143674,2570517,,,,2714191,764688,,,,,,,,,,,"44",488,1795,764688,23169,764688,,15,42,"403f68545cfadb6ac9e7ef8d7715337ef6ffad31",0,0,0,0,0,""
20210210,"RI",119893,,642512,,"totalTestEncountersViral",2691022,238,8615,42,,22,,,"2/10/2021 13:00","2021-02-10T13:00:00Z","02/10 08:00",2259,8615,7416,"2021-02-10T13:00:00Z",,143111,2547911,,,,2691022,762405,,,,,,,,,,,"44",459,1384,762405,17674,762405,,11,28,"0219653e1118a7f1363fec81187241854f23293e",0,0,0,0,0,""
20210209,"RI",119434,,641128,,"totalTestEncountersViral",2673348,242,8587,44,,20,,,"2/9/2021 13:00","2021-02-09T13:00:00Z","02/09 08:00",2248,8587,7385,"2021-02-09T13:00:00Z",,142593,2530755,,,,2673348,760562,,,,,,,,,,,"44",330,-33962,760562,5498,760562,,12,38,"e0be657d9970557fd4b21ad4de9daa11f6b3d003",0,0,0,0,0,""
20210208,"RI",119104,,675090,,"totalTestEncountersViral",2667850,241,8549,42,,20,,,"2/8/2021 13:00","2021-02-08T13:00:00Z","02/08 08:00",2236,8549,7354,"2021-02-08T13:00:00Z",,142319,2525531,,,,2667850,794194,,,,,,,,,,,"44",211,3437,794194,5088,794194,,8,81,"2bbb3d39e50ebeea2c65a784015071f6196c439f",0,0,0,0,0,""
20210207,"RI",118893,,671653,,"totalTestEncountersViral",2662762,288,8468,41,,20,,,"2/8/2021 16:42","2021-02-08T16:42:00Z","02/08 11:42",2228,8468,7233,"2021-02-08T16:42:00Z",,142088,2520674,,,,2662762,790546,,,,,,,,,,,"44",372,11005,790546,17710,790546,,5,0,"19751b22bf479293d4c00cec675bf5b56909e69c",0,0,0,0,0,""
20210206,"RI",118521,,660648,,"totalTestEncountersViral",2645052,288,8468,41,,20,,,"2/8/2021 16:42","2021-02-08T16:42:00Z","02/08 11:42",2223,8468,7233,"2021-02-08T16:42:00Z",,141671,2503381,,,,2645052,779169,,,,,,,,,,,"44",630,25801,779169,33795,779169,,11,0,"52bde3c4fdf50ceab15fe8a520af912d62b8aa70",0,0,0,0,0,""
20210205,"RI",117891,,634847,,"totalTestEncountersViral",2611257,288,8468,41,,20,,,"2/5/2021 13:00","2021-02-05T13:00:00Z","02/05 08:00",2212,8468,7233,"2021-02-05T13:00:00Z",,140457,2470800,,,,2611257,752738,,,,,,,,,,,"44",600,1897,752738,22174,752738,,3,56,"19f14d53d8ab509400d7b19c4b336c196db3030e",0,0,0,0,0,""
20210204,"RI",117291,,632950,,"totalTestEncountersViral",2589083,290,8412,43,,23,,,"2/4/2021 13:00","2021-02-04T13:00:00Z","02/04 08:00",2209,8412,7182,"2021-02-04T13:00:00Z",,139763,2449320,,,,2589083,750241,,,,,,,,,,,"44",587,1850,750241,20760,750241,,11,43,"0981579375af07eb04188aac5212f075a8228993",0,0,0,0,0,""
20210203,"RI",116704,,631100,,"totalTestEncountersViral",2568323,298,8369,42,,23,,,"2/3/2021 13:00","2021-02-03T13:00:00Z","02/03 08:00",2198,8369,7136,"2021-02-03T13:00:00Z",,139091,2429232,,,,2568323,747804,,,,,,,,,,,"44",513,1646,747804,14579,747804,,12,38,"a557200c8840b21720dc36b924debb8417852a62",0,0,0,0,0,""
20210202,"RI",116191,,629454,,"totalTestEncountersViral",2553744,307,8331,41,,25,,,"2/2/2021 13:00","2021-02-02T13:00:00Z","02/02 08:00",2186,8331,7096,"2021-02-02T13:00:00Z",,138536,2415208,,,,2553744,745645,,,,,,,,,,,"44",235,660,745645,8240,745645,,13,35,"86ea47a67eeac511a081177bbc11a3931ee2f108",0,0,0,0,0,""
20210201,"RI",115956,,628794,,"totalTestEncountersViral",2545504,316,8296,47,,29,,,"2/1/2021 13:00","2021-02-01T13:00:00Z","02/01 08:00",2173,8296,7054,"2021-02-01T13:00:00Z",,138279,2407225,,,,2545504,744750,,,,,,,,,,,"44",249,975,744750,6710,744750,,5,117,"46dc1debeb8c531f163061881ff7cedc39c1ee89",0,0,0,0,0,""
20210131,"RI",115707,,627819,,"totalTestEncountersViral",2538794,324,8179,50,,31,,,"2/1/2021 16:42","2021-02-01T16:42:00Z","02/01 11:42",2168,8179,6941,"2021-02-01T16:42:00Z",,137983,2400811,,,,2538794,743526,,,,,,,,,,,"44",569,2295,743526,16768,743526,,4,0,"5dd8a941163952b71b35c065629e1f58a99d0ef1",0,0,0,0,0,""
20210130,"RI",115138,,625524,,"totalTestEncountersViral",2522026,324,8179,50,,31,,,"2/1/2021 16:42","2021-02-01T16:42:00Z","02/01 11:42",2164,8179,6941,"2021-02-01T16:42:00Z",,137294,2384732,,,,2522026,740662,,,,,,,,,,,"44",700,2072,740662,24755,740662,,10,0,"a818e2d8bf4dbd8e5f66bffac9e0d32c949cb678",0,0,0,0,0,""
20210129,"RI",114438,,623452,,"totalTestEncountersViral",2497271,324,8179,50,,31,,,"1/29/2021 13:00","2021-01-29T13:00:00Z","01/29 08:00",2154,8179,6941,"2021-01-29T13:00:00Z",,136503,2360768,,,,2497271,737890,,,,,,,,,,,"44",684,2893,737890,23241,737890,,10,48,"6556758a45cc1a3134ee197ba1deac8811216800",0,0,0,0,0,""
20210128,"RI",113754,,620559,,"totalTestEncountersViral",2474030,335,8131,47,,31,,,"1/28/2021 13:00","2021-01-28T13:00:00Z","01/28 08:00",2144,8131,6885,"2021-01-28T13:00:00Z",,135724,2338306,,,,2474030,734313,,,,,,,,,,,"44",745,2939,734313,22883,734313,,9,33,"7643ab76be3197b5d1e82188aedc2a16f677ce46",0,0,0,0,0,""
20210127,"RI",113009,,617620,,"totalTestEncountersViral",2451147,334,8098,50,,35,,,"1/27/2021 13:00","2021-01-27T13:00:00Z","01/27 08:00",2135,8098,6862,"2021-01-27T13:00:00Z",,134852,2316295,,,,2451147,730629,,,,,,,,,,,"44",613,2953,730629,19224,730629,,9,35,"1fd264231cd5a2bf33d447f70678075fc951b55e",0,0,0,0,0,""
20210126,"RI",112396,,614667,,"totalTestEncountersViral",2431923,346,8063,51,,35,,,"1/26/2021 13:00","2021-01-26T13:00:00Z","01/26 08:00",2126,8063,6827,"2021-01-26T13:00:00Z",,134139,2297784,,,,2431923,727063,,,,,,,,,,,"44",642,2054,727063,13904,727063,,16,57,"0f773370aa3879d3c4eacd3e737bf3e7f5262a89",0,0,0,0,0,""
20210125,"RI",111754,,612613,,"totalTestEncountersViral",2418019,347,8006,50,,33,,,"1/25/2021 13:00","2021-01-25T13:00:00Z","01/25 08:00",2110,8006,6778,"2021-01-25T13:00:00Z",,133427,2284592,,,,2418019,724367,,,,,,,,,,,"44",301,1164,724367,7994,724367,,9,162,"779b3e844aba375daa1d789871d19b5e7ecc32cc",0,0,0,0,0,""
20210124,"RI",111453,,611449,,"totalTestEncountersViral",2410025,352,7844,43,,31,,,"1/25/2021 16:42","2021-01-25T16:42:00Z","01/25 11:42",2101,7844,6626,"2021-01-25T16:42:00Z",,133057,2276968,,,,2410025,722902,,,,,,,,,,,"44",742,3108,722902,19787,722902,,4,0,"064c04a95ca76d1e1315f422a573386798e2e805",0,0,0,0,0,""
20210123,"RI",110711,,608341,,"totalTestEncountersViral",2390238,352,7844,43,,31,,,"1/25/2021 16:42","2021-01-25T16:42:00Z","01/25 11:42",2097,7844,6626,"2021-01-25T16:42:00Z",,132156,2258082,,,,2390238,719052,,,,,,,,,,,"44",976,2638,719052,27107,719052,,14,0,"7217a20fe4a5c1309f3bc4bb150d9b7bace3869a",0,0,0,0,0,""
20210122,"RI",109735,,605703,,"totalTestEncountersViral",2363131,352,7844,43,,31,,,"1/22/2021 13:00","2021-01-22T13:00:00Z","01/22 08:00",2083,7844,6626,"2021-01-22T13:00:00Z",,131027,2232104,,,,2363131,715438,,,,,,,,,,,"44",949,3266,715438,22450,715438,,7,57,"e7990f4758d797afb56c6eac2d4e47e846b1719c",0,0,0,0,0,""
20210121,"RI",108786,,602437,,"totalTestEncountersViral",2340681,379,7787,51,,36,,,"1/21/2021 13:00","2021-01-21T13:00:00Z","01/21 08:00",2076,7787,6553,"2021-01-21T13:00:00Z",,129882,2210799,,,,2340681,711223,,,,,,,,,,,"44",910,3115,711223,26772,711223,,18,67,"4694aef6f70fff60e94dbfbdbd7737d102944bc8",0,0,0,0,0,""
20210120,"RI",107876,,599322,,"totalTestEncountersViral",2313909,379,7720,48,,36,,,"1/20/2021 13:00","2021-01-20T13:00:00Z","01/20 08:00",2058,7720,6495,"2021-01-20T13:00:00Z",,128772,2185137,,,,2313909,707198,,,,,,,,,,,"44",810,2504,707198,15908,707198,,13,70,"f803d0759259a7ce071241c601d3301551fadc1e",0,0,0,0,0,""
20210119,"RI",107066,,596818,,"totalTestEncountersViral",2298001,366,7650,50,,37,,,"1/19/2021 13:00","2021-01-19T13:00:00Z","01/19 08:00",2045,7650,6445,"2021-01-19T13:00:00Z",,127862,2170139,,,,2298001,703884,,,,,,,,,,,"44",361,1196,703884,8736,703884,,12,218,"b89fc3960d01b95a0718647506d7ee1f6740c9ef",0,0,0,0,0,""
20210118,"RI",106705,,595622,,"totalTestEncountersViral",2289265,384,7432,51,,35,,,"1/19/2021 17:28","2021-01-19T17:28:00Z","01/19 12:28",2033,7432,6229,"2021-01-19T17:28:00Z",,127399,2161866,,,,2289265,702327,,,,,,,,,,,"44",481,1713,702327,9479,702327,,5,0,"40773df2f9fc5a174ca276bdcea4063023501ac3",0,0,0,0,0,""
20210117,"RI",106224,,593909,,"totalTestEncountersViral",2279786,384,7432,51,,35,,,"1/19/2021 17:28","2021-01-19T17:28:00Z","01/19 12:28",2028,7432,6229,"2021-01-19T17:28:00Z",,126802,2152984,,,,2279786,700133,,,,,,,,,,,"44",752,2846,700133,17237,700133,,9,0,"967b06f2add22c9777f7dd44a1be520f5630f5e0",0,0,0,0,0,""
20210116,"RI",105472,,591063,,"totalTestEncountersViral",2262549,384,7432,51,,35,,,"1/19/2021 17:28","2021-01-19T17:28:00Z","01/19 12:28",2019,7432,6229,"2021-01-19T17:28:00Z",,125913,2136636,,,,2262549,696535,,,,,,,,,,,"44",1029,2354,696535,20254,696535,,14,0,"067c1a1c1c8785f97e2f6fdcb0132a3e12e25676",0,0,0,0,0,""
20210115,"RI",104443,,588709,,"totalTestEncountersViral",2242295,384,7432,51,,35,,,"1/15/2021 13:00","2021-01-15T13:00:00Z","01/15 08:00",2005,7432,6229,"2021-01-15T13:00:00Z",,124747,2117548,,,,2242295,693152,,,,,,,,,,,"44",1057,3519,693152,22490,693152,,9,66,"dc1fe50eb64e3296ac741db63a5e97f701e74e5a",0,0,0,0,0,""
20210114,"RI",103386,,585190,,"totalTestEncountersViral",2219805,375,7366,53,,34,,,"1/14/2021 13:00","2021-01-14T13:00:00Z","01/14 08:00",1996,7366,6175,"2021-01-14T13:00:00Z",,123555,2096250,,,,2219805,688576,,,,,,,,,,,"44",901,3467,688576,20175,688576,,9,56,"3c46320c4509477ccbe8af58e8b9d3a9f7ac5cc5",0,0,0,0,0,""
20210113,"RI",102485,,581723,,"totalTestEncountersViral",2199630,402,7310,49,,35,,,"1/13/2021 13:00","2021-01-13T13:00:00Z","01/13 08:00",1987,7310,6101,"2021-01-13T13:00:00Z",,122522,2077108,,,,2199630,684208,,,,,,,,,,,"44",1092,3226,684208,19809,684208,,17,69,"e89f8a383b0d7caa3994253ff353df22cafa7a6f",0,0,0,0,0,""
20210112,"RI",101393,,578497,,"totalTestEncountersViral",2179821,402,7241,53,,34,,,"1/12/2021 13:00","2021-01-12T13:00:00Z","01/12 08:00",1970,7241,6042,"2021-01-12T13:00:00Z",,121227,2058594,,,,2179821,679890,,,,,,,,,,,"44",786,2695,679890,13001,679890,,23,50,"59ef88c147cb7f37098fb87c4c0a3e13eb70cd4b",0,0,0,0,0,""
20210111,"RI",100607,,575802,,"totalTestEncountersViral",2166820,399,7191,47,,33,,,"1/11/2021 13:00","2021-01-11T13:00:00Z","01/11 08:00",1947,7191,6000,"2021-01-11T13:00:00Z",,120360,2046460,,,,2166820,676409,,,,,,,,,,,"44",568,1975,676409,8328,676409,,7,164,"a63ee931d46965c23de4542e21fc5ada357d7f02",0,0,0,0,0,""
20210110,"RI",100039,,573827,,"totalTestEncountersViral",2158492,390,7027,55,,39,,,"1/11/2021 18:43","2021-01-11T18:43:00Z","01/11 13:43",1940,7027,5860,"2021-01-11T18:43:00Z",,119688,2038804,,,,2158492,673866,,,,,,,,,,,"44",1038,3398,673866,18188,673866,,10,0,"b821e2c6b244230c0853b48ddf115a9858902ee4",0,0,0,0,0,""
20210109,"RI",99001,,570429,,"totalTestEncountersViral",2140304,390,7027,55,,39,,,"1/11/2021 18:43","2021-01-11T18:43:00Z","01/11 13:43",1930,7027,5860,"2021-01-11T18:43:00Z",,118445,2021859,,,,2140304,669430,,,,,,,,,,,"44",1387,2773,669430,24337,669430,,14,0,"281be2e7c797407e6cdbd30b0bf1c45a7eff7f8d",0,0,0,0,0,""
20210108,"RI",97614,,567656,,"totalTestEncountersViral",2115967,390,7027,55,,39,,,"1/8/2021 13:00","2021-01-08T13:00:00Z","01/08 08:00",1916,7027,5860,"2021-01-08T13:00:00Z",,116884,1999083,,,,2115967,665270,,,,,,,,,,,"44",1023,2557,665270,16222,665270,,6,71,"1cc397e9422563aeb00e211c83d46980a8355960",0,0,0,0,0,""
20210107,"RI",96591,,565099,,"totalTestEncountersViral",2099745,397,6956,59,,40,,,"1/7/2021 13:00","2021-01-07T13:00:00Z","01/07 08:00",1910,6956,5794,"2021-01-07T13:00:00Z",,115715,1984030,,,,2099745,661690,,,,,,,,,,,"44",1128,2465,661690,19820,661690,,20,51,"b17a8acb6bbbfe24f08deb1324bba1bde4873bca",0,0,0,0,0,""
20210106,"RI",95463,,562634,,"totalTestEncountersViral",2079925,405,6905,59,,40,,,"1/6/2021 13:00","2021-01-06T13:00:00Z","01/06 08:00",1890,6905,5743,"2021-01-06T13:00:00Z",,114397,1965528,,,,2079925,658097,,,,,,,,,,,"44",1611,2945,658097,20481,658097,,20,68,"c856200b0f961aed8a54d411e8ed312ef223f697",0,0,0,0,0,""
20210105,"RI",93852,,559689,,"totalTestEncountersViral",2059444,409,6837,56,,40,,,"1/5/2021 13:00","2021-01-05T13:00:00Z","01/05 08:00",1870,6837,5682,"2021-01-05T13:00:00Z",,112563,1946881,,,,2059444,653541,,,,,,,,,,,"44",1144,2411,653541,13069,653541,,15,50,"c8c0ceda832689f016501631b7ebd9bebbe1ef69",0,0,0,0,0,""
20210104,"RI",92708,,557278,,"totalTestEncountersViral",2046375,415,6787,53,,40,,,"1/4/2021 13:00","2021-01-04T13:00:00Z","01/04 08:00",1855,6787,5636,"2021-01-04T13:00:00Z",,111253,1935122,,,,2046375,649986,,,,,,,,,,,"44",633,2111,649986,8691,649986,,12,281,"59bd0f1af0104119a3559933e70b4839ec726406",0,0,0,0,0,""
20210103,"RI",92075,,555167,,"totalTestEncountersViral",2037684,426,6506,61,,47,,,"1/4/2021 16:31","2021-01-04T16:31:00Z","01/04 11:31",1843,6506,5381,"2021-01-04T16:31:00Z",,110523,1927161,,,,2037684,647242,,,,,,,,,,,"44",888,2178,647242,10629,647242,,10,0,"7c29583f3ef55b45cf7002feeee80fe045ba4632",0,0,0,0,0,""
20210102,"RI",91187,,552989,,"totalTestEncountersViral",2027055,426,6506,61,,47,,,"1/4/2021 16:31","2021-01-04T16:31:00Z","01/04 11:31",1833,6506,5381,"2021-01-04T16:31:00Z",,109530,1917525,,,,2027055,644176,,,,,,,,,,,"44",783,1961,644176,11599,644176,,10,0,"b75e6fe1c05b54664bb06d3a4ce5bdc440fa528b",0,0,0,0,0,""
20210101,"RI",90404,,551028,,"totalTestEncountersViral",2015456,426,6506,61,,47,,,"1/4/2021 16:31","2021-01-04T16:31:00Z","01/04 11:31",1823,6506,5381,"2021-01-04T16:31:00Z",,108618,1906838,,,,2015456,641432,,,,,,,,,,,"44",863,2904,641432,14674,641432,,14,0,"a76be85ec1a0880f0def7d09ed4c34d1bbf29262",0,0,0,0,0,""
20201231,"RI",89541,,548124,,"totalTestEncountersViral",2000782,426,6506,61,,47,,,"1/4/2021 16:31","2021-01-04T16:31:00Z","01/04 11:31",1809,6506,5381,"2021-01-04T16:31:00Z",,107635,1893147,,,,2000782,637665,,,,,,,,,,,"44",1592,2460,637665,26284,637665,,32,0,"48bb7c49c3f0a0ce7d8729864b1aa40d064e3d71",0,0,0,0,0,""
20201230,"RI",87949,,545664,,"totalTestEncountersViral",1974498,426,6506,61,,47,,,"12/30/2020 13:00","2020-12-30T13:00:00Z","12/30 08:00",1777,6506,5381,"2020-12-30T13:00:00Z",,105661,1868837,,,,1974498,633613,,,,,,,,,,,"44",1160,1581,633613,13252,633613,,17,53,"0bc2f8aa955e5c0c810ebecc98520719a051aa32",0,0,0,0,0,""
20201229,"RI",86789,,544083,,"totalTestEncountersViral",1961246,423,6453,55,,46,,,"12/29/2020 13:00","2020-12-29T13:00:00Z","12/29 08:00",1760,6453,5335,"2020-12-29T13:00:00Z",,104505,1856741,,,,1961246,630872,,,,,,,,,,,"44",1187,2423,630872,13139,630872,,18,50,"fee3b461362e00f06192caeb6545de949c0efaef",0,0,0,0,0,""
20201228,"RI",85602,,541660,,"totalTestEncountersViral",1948107,412,6403,54,,47,,,"12/28/2020 13:00","2020-12-28T13:00:00Z","12/28 08:00",1742,6403,5306,"2020-12-28T13:00:00Z",,103151,1844956,,,,1948107,627262,,,,,,,,,,,"44",661,1935,627262,8118,627262,,3,272,"9111fc57c18ddaae02635f4b0c6d91e070e6e9fb",0,0,0,0,0,""
20201227,"RI",84941,,539725,,"totalTestEncountersViral",1939989,442,6131,49,,35,,,"12/28/2020 16:31","2020-12-28T16:31:00Z","12/28 11:31",1739,6131,5041,"2020-12-28T16:31:00Z",,102386,1837603,,,,1939989,624666,,,,,,,,,,,"44",733,1916,624666,10188,624666,,7,0,"1dddd92a9b9dc411c3a0be8bf662318c18a9354a",0,0,0,0,0,""
20201226,"RI",84208,,537809,,"totalTestEncountersViral",1929801,442,6131,49,,35,,,"12/28/2020 16:31","2020-12-28T16:31:00Z","12/28 11:31",1732,6131,5041,"2020-12-28T16:31:00Z",,101517,1828284,,,,1929801,622017,,,,,,,,,,,"44",226,604,622017,3504,622017,,10,0,"88cd82d976be8ed8f7c1d5203c06392a486c015e",0,0,0,0,0,""
20201225,"RI",83982,,537205,,"totalTestEncountersViral",1926297,442,6131,49,,35,,,"12/28/2020 16:31","2020-12-28T16:31:00Z","12/28 11:31",1722,6131,5041,"2020-12-28T16:31:00Z",,101233,1825064,,,,1926297,621187,,,,,,,,,,,"44",870,3410,621187,17783,621187,,7,0,"511b064663c402cf2064c5173c5eef7bb75e4583",0,0,0,0,0,""
20201224,"RI",83112,,533795,,"totalTestEncountersViral",1908514,442,6131,49,,35,,,"12/28/2020 16:31","2020-12-28T16:31:00Z","12/28 11:31",1715,6131,5041,"2020-12-28T16:31:00Z",,100180,1808334,,,,1908514,616907,,,,,,,,,,,"44",1046,2022,616907,21057,616907,,11,0,"0eee83b87a08dba16a8c3abd2fd61eeef448d81a",0,0,0,0,0,""
20201223,"RI",82066,,531773,,"totalTestEncountersViral",1887457,442,6131,49,,35,,,"12/23/2020 13:00","2020-12-23T13:00:00Z","12/23 08:00",1704,6131,5041,"2020-12-23T13:00:00Z",,99063,1788394,,,,1887457,613839,,,,,,,,,,,"44",879,3032,613839,18029,613839,,26,72,"85363789faba812518997ffe30764032b6c120d7",0,0,0,0,0,""
20201222,"RI",81187,,528741,,"totalTestEncountersViral",1869428,440,6059,54,,38,,,"12/22/2020 13:00","2020-12-22T13:00:00Z","12/22 08:00",1678,6059,4980,"2020-12-22T13:00:00Z",,97959,1771469,,,,1869428,609928,,,,,,,,,,,"44",956,3000,609928,12711,609928,,8,73,"ae325f1a4359a230335aea0fe4701ca8d39b2979",0,0,0,0,0,""
20201221,"RI",80231,,525741,,"totalTestEncountersViral",1856717,429,5986,57,,36,,,"12/21/2020 13:00","2020-12-21T13:00:00Z","12/21 08:00",1670,5986,4927,"2020-12-21T13:00:00Z",,96877,1759840,,,,1856717,605972,,,,,,,,,,,"44",419,1649,605972,7193,605972,,11,164,"43bd7736ea604846bbd5ba784ffc47e273b59094",0,0,0,0,0,""
20201220,"RI",79812,,524092,,"totalTestEncountersViral",1849524,459,5822,56,,29,,,"12/21/2020 16:42","2020-12-21T16:42:00Z","12/21 11:42",1659,5822,4761,"2020-12-21T16:42:00Z",,96349,1753175,,,,1849524,603904,,,,,,,,,,,"44",1029,3109,603904,17614,603904,,15,0,"0210b1d6c520211aa54b81ec4f65e66c42e63ee3",0,0,0,0,0,""
20201219,"RI",78783,,520983,,"totalTestEncountersViral",1831910,459,5822,56,,29,,,"12/21/2020 16:42","2020-12-21T16:42:00Z","12/21 11:42",1644,5822,4761,"2020-12-21T16:42:00Z",,95042,1736868,,,,1831910,599766,,,,,,,,,,,"44",971,1172,599766,14550,599766,,19,0,"df6a2bad3ba65fa328058f3d6a5b42c763927790",0,0,0,0,0,""
20201218,"RI",77812,,519811,,"totalTestEncountersViral",1817360,459,5822,56,,29,,,"12/18/2020 13:00","2020-12-18T13:00:00Z","12/18 08:00",1625,5822,4761,"2020-12-18T13:00:00Z",,93896,1723464,,,,1817360,597623,,,,,,,,,,,"44",522,1157,597623,11156,597623,,23,56,"0b51095631779c87ccedd064ad5253820daaf491",0,0,0,0,0,""
20201217,"RI",77290,,518654,,"totalTestEncountersViral",1806204,479,5766,59,,29,,,"12/17/2020 13:00","2020-12-17T13:00:00Z","12/17 08:00",1602,5766,4695,"2020-12-17T13:00:00Z",,93289,1712915,,,,1806204,595944,,,,,,,,,,,"44",1081,3165,595944,19541,595944,,12,66,"b7d344426826b437455e2153b19def634ec0c608",0,0,0,0,0,""
20201216,"RI",76209,,515489,,"totalTestEncountersViral",1786663,469,5700,62,,30,,,"12/16/2020 13:00","2020-12-16T13:00:00Z","12/16 08:00",1590,5700,4646,"2020-12-16T13:00:00Z",,92036,1694627,,,,1786663,591698,,,,,,,,,,,"44",972,2337,591698,15229,591698,,20,84,"9837e3fc404a76d3bbe9637c5cf8483fca22ac17",0,0,0,0,0,""
20201215,"RI",75237,,513152,,"totalTestEncountersViral",1771434,455,5616,53,,29,,,"12/15/2020 13:00","2020-12-15T13:00:00Z","12/15 08:00",1570,5616,4585,"2020-12-15T13:00:00Z",,90879,1680555,,,,1771434,588389,,,,,,,,,,,"44",1166,2856,588389,12476,588389,,15,82,"6bd0358056ae3f3a99ea876af2e0ba331c6abb64",0,0,0,0,0,""
20201214,"RI",74071,,510296,,"totalTestEncountersViral",1758958,433,5534,47,,31,,,"12/14/2020 13:00","2020-12-14T13:00:00Z","12/14 08:00",1555,5534,4537,"2020-12-14T13:00:00Z",,89578,1669380,,,,1758958,584367,,,,,,,,,,,"44",552,1973,584367,7648,584367,,17,0,"b76258d4d1773f60185566035e6120765b5ac37e",0,0,0,0,0,""
20201213,"RI",73519,,508323,,"totalTestEncountersViral",1751310,433,5534,47,,31,,,"12/14/2020 16:42","2020-12-14T16:42:00Z","12/14 11:42",1538,5534,4537,"2020-12-14T16:42:00Z",,88908,1662402,,,,1751310,581842,,,,,,,,,,,"44",870,3115,581842,14114,581842,,12,48,"9a99d15a18fda5879a1983985614849717db2522",0,0,0,0,0,""
20201212,"RI",72649,,505208,,"totalTestEncountersViral",1737196,440,5486,55,,32,,,"12/14/2020 16:42","2020-12-14T16:42:00Z","12/14 11:42",1526,5486,4491,"2020-12-14T16:42:00Z",,87817,1649379,,,,1737196,577857,,,,,,,,,,,"44",1831,2337,577857,19629,577857,,17,198,"112dca3e62e25ef619abaace31b7ba715c694684",0,0,0,0,0,""
20201211,"RI",70818,,502871,,"totalTestEncountersViral",1717567,466,5288,48,,25,,,"12/11/2020 13:00","2020-12-11T13:00:00Z","12/11 08:00",1509,5288,4288,"2020-12-11T13:00:00Z",,86080,1631487,,,,1717567,573689,,,,,,,,,,,"44",1571,3914,573689,22765,573689,,11,0,"7ede3bb70e010c9ccb95ecd510a49ca0994cd369",0,0,0,0,0,""
20201210,"RI",69247,,498957,,"totalTestEncountersViral",1694802,466,5288,48,,25,,,"12/10/2020 13:00","2020-12-10T13:00:00Z","12/10 08:00",1498,5288,4288,"2020-12-10T13:00:00Z",,84192,1610610,,,,1694802,568204,,,,,,,,,,,"44",948,1227,568204,13473,568204,,14,72,"a832babce56f908795cdfb5de1400a248c044fe7",0,0,0,0,0,""
20201209,"RI",68299,,497730,,"totalTestEncountersViral",1681329,461,5216,42,,24,,,"12/9/2020 13:00","2020-12-09T13:00:00Z","12/09 08:00",1484,5216,4227,"2020-12-09T13:00:00Z",,83164,1598165,,,,1681329,566029,,,,,,,,,,,"44",1232,3911,566029,18041,566029,,14,83,"c386172885d445f5c7045518c91a476ca891e0d1",0,0,0,0,0,""
20201208,"RI",67067,,493819,,"totalTestEncountersViral",1663288,444,5133,43,,25,,,"12/8/2020 13:00","2020-12-08T13:00:00Z","12/08 08:00",1470,5133,4167,"2020-12-08T13:00:00Z",,81512,1581776,,,,1663288,560886,,,,,,,,,,,"44",1249,2677,560886,11667,560886,,22,94,"63d5e17a3a74ad53aa24473767b29ed87ff61ea7",0,0,0,0,0,""
20201207,"RI",65818,,491142,,"totalTestEncountersViral",1651621,422,5039,45,,30,,,"12/7/2020 13:00","2020-12-07T13:00:00Z","12/07 08:00",1448,5039,4104,"2020-12-07T13:00:00Z",,80128,1571493,,,,1651621,556960,,,,,,,,,,,"44",844,2169,556960,7856,556960,,11,0,"4d84090589c892dba985def2092364b90dd1e5f6",0,0,0,0,0,""
20201206,"RI",64974,,488973,,"totalTestEncountersViral",1643765,422,5039,45,,30,,,"12/7/2020 16:42","2020-12-07T16:42:00Z","12/07 11:42",1437,5039,4104,"2020-12-07T16:42:00Z",,79151,1564614,,,,1643765,553947,,,,,,,,,,,"44",1030,2913,553947,13774,553947,,8,55,"2a5a7ef8653ba8958204bad527861a67db9e4737",0,0,0,0,0,""
20201205,"RI",63944,,486060,,"totalTestEncountersViral",1629991,410,4984,42,,30,,,"12/7/2020 16:42","2020-12-07T16:42:00Z","12/07 11:42",1429,4984,4065,"2020-12-07T16:42:00Z",,77958,1552033,,,,1629991,550004,,,,,,,,,,,"44",1807,3138,550004,21143,550004,,16,141,"25903e9005aea6defcb2c4a552205b1c4ac73481",0,0,0,0,0,""
20201204,"RI",62137,,482922,,"totalTestEncountersViral",1608848,408,4843,45,,29,,,"12/4/2020 13:00","2020-12-04T13:00:00Z","12/04 08:00",1413,4843,3939,"2020-12-04T13:00:00Z",,75792,1533056,,,,1608848,545059,,,,,,,,,,,"44",1415,2168,545059,14841,545059,,13,54,"682a93393a0b67a0d7d93c6c964825d2e8d94a22",0,0,0,0,0,""
20201203,"RI",60722,,480754,,"totalTestEncountersViral",1594007,409,4789,45,,31,,,"12/3/2020 13:00","2020-12-03T13:00:00Z","12/03 08:00",1400,4789,3892,"2020-12-03T13:00:00Z",,74263,1519744,,,,1594007,541476,,,,,,,,,,,"44",1717,2853,541476,19476,541476,,9,57,"29da64a10ab990da48cc1fa03d2701bb5abb32f7",0,0,0,0,0,""
20201202,"RI",59005,,477901,,"totalTestEncountersViral",1574531,408,4732,45,,28,,,"12/2/2020 13:00","2020-12-02T13:00:00Z","12/02 08:00",1391,4732,3839,"2020-12-02T13:00:00Z",,72433,1502098,,,,1574531,536906,,,,,,,,,,,"44",1099,2094,536906,12617,536906,,11,62,"669736e0aeae63388283d907c11b7536646fa057",0,0,0,0,0,""
20201201,"RI",57906,,475807,,"totalTestEncountersViral",1561914,410,4670,41,,23,,,"12/1/2020 13:00","2020-12-01T13:00:00Z","12/01 08:00",1380,4670,3777,"2020-12-01T13:00:00Z",,71152,1490762,,,,1561914,533713,,,,,,,,,,,"44",1183,2646,533713,11754,533713,,7,88,"e2e55593d90d1fefc3d52d341bf8be9b8e802c8f",0,0,0,0,0,""
20201130,"RI",56723,,473161,,"totalTestEncountersViral",1550160,365,4582,40,,19,,,"11/30/2020 13:00","2020-11-30T13:00:00Z","11/30 08:00",1373,4582,3737,"2020-11-30T13:00:00Z",,69958,1480202,,,,1550160,529884,,,,,,,,,,,"44",651,2075,529884,7114,529884,,8,0,"f0cc9e44b703b79468efc1baed7d0934b3a504d2",0,0,0,0,0,""
20201129,"RI",56072,,471086,,"totalTestEncountersViral",1543046,365,4582,40,,19,,,"11/30/2020 16:42","2020-11-30T16:42:00Z","11/30 11:42",1365,4582,3737,"2020-11-30T16:42:00Z",,69232,1473814,,,,1543046,527158,,,,,,,,,,,"44",1055,2675,527158,12791,527158,,2,52,"a0d3f37d8908da1ca75cb14bdf8851dbd500d647",0,0,0,0,0,""
20201128,"RI",55017,,468411,,"totalTestEncountersViral",1530255,349,4530,39,,19,,,"11/30/2020 16:42","2020-11-30T16:42:00Z","11/30 11:42",1363,4530,3701,"2020-11-30T16:42:00Z",,68106,1462149,,,,1530255,523428,,,,,,,,,,,"44",1063,1514,523428,11234,523428,,17,122,"ad0f3435bcbab74acb68c9a93e09fc7810ef373d",0,0,0,0,0,""
20201127,"RI",53954,,466897,,"totalTestEncountersViral",1519021,319,4408,37,,23,,,"11/27/2020 13:00","2020-11-27T13:00:00Z","11/27 08:00",1346,4408,3619,"2020-11-27T13:00:00Z",,67027,1451994,,,,1519021,520851,,,,,,,,,,,"44",463,1533,520851,6858,520851,,4,0,"c896b89c08b125c7c993bb8b211fadb90af5774b",0,0,0,0,0,""
20201126,"RI",53491,,465364,,"totalTestEncountersViral",1512163,319,4408,37,,23,,,"11/30/2020 14:58","2020-11-30T14:58:00Z","11/30 09:58",1342,4408,3619,"2020-11-30T14:58:00Z",,66488,1445675,,,,1512163,518855,,,,,,,,,,,"44",1174,2575,518855,19968,518855,,7,82,"4b3905ad3690642efe09f6df5d688beef261846c",0,0,0,0,0,""
20201125,"RI",52317,,462789,,"totalTestEncountersViral",1492195,357,4326,35,,16,,,"11/25/2020 13:00","2020-11-25T13:00:00Z","11/25 08:00",1335,4326,3510,"2020-11-25T13:00:00Z",,65209,1426986,,,,1492195,515106,,,,,,,,,,,"44",893,-1430,515106,12350,515106,,10,74,"1686f94894fd1513880620a11cf740dcec62b401",0,0,0,0,0,""
20201124,"RI",51424,,464219,,"totalTestEncountersViral",1479845,323,4252,30,,16,,,"11/24/2020 13:00","2020-11-24T13:00:00Z","11/24 08:00",1325,4252,3469,"2020-11-24T13:00:00Z",,64207,1415638,,,,1479845,515643,,,,,,,,,,,"44",851,3127,515643,11763,515643,,16,75,"a450ad4ad1fa93c8c2ff2212cc5a2231bf19b466",0,0,0,0,0,""
20201123,"RI",50573,,461092,,"totalTestEncountersViral",1468082,285,4177,30,,14,,,"11/23/2020 13:00","2020-11-23T13:00:00Z","11/23 08:00",1309,4177,3436,"2020-11-23T13:00:00Z",,63259,1404823,,,,1468082,511665,,,,,,,,,,,"44",429,1680,511665,7679,511665,,6,0,"783b67a77c740b281bacd3f25b5a6c11d4ad5808",0,0,0,0,0,""
20201122,"RI",50144,,459412,,"totalTestEncountersViral",1460403,285,4177,30,,14,,,"11/23/2020 13:42","2020-11-23T13:42:00Z","11/23 08:42",1303,4177,3436,"2020-11-23T13:42:00Z",,62740,1397663,,,,1460403,509556,,,,,,,,,,,"44",738,3156,509556,18053,509556,,3,31,"47e39726abde7caff0744ea1abe8841b5b137478",0,0,0,0,0,""
20201121,"RI",49406,,456256,,"totalTestEncountersViral",1442350,293,4146,28,,14,,,"11/23/2020 13:42","2020-11-23T13:42:00Z","11/23 08:42",1300,4146,3402,"2020-11-23T13:42:00Z",,61899,1380451,,,,1442350,505662,,,,,,,,,,,"44",1405,3325,505662,26322,505662,,6,100,"271c6e96b211eb5c32ef5a68d1ec059944909e1e",0,0,0,0,0,""
20201120,"RI",48001,,452931,,"totalTestEncountersViral",1416028,288,4046,24,,14,,,"11/20/2020 13:00","2020-11-20T13:00:00Z","11/20 08:00",1294,4046,3314,"2020-11-20T13:00:00Z",,60371,1355657,,,,1416028,500932,,,,,,,,,,,"44",1050,3093,500932,14865,500932,,6,33,"5d25a0b99616a4ee6591d891c1d28cf1817b0d28",0,0,0,0,0,""
20201119,"RI",46951,,449838,,"totalTestEncountersViral",1401163,298,4013,26,,13,,,"11/19/2020 13:00","2020-11-19T13:00:00Z","11/19 08:00",1288,4013,3277,"2020-11-19T13:00:00Z",,59188,1341975,,,,1401163,496789,,,,,,,,,,,"44",1040,2678,496789,16598,496789,,4,60,"13f1b25c2429bc2ef80f24298e3203ac66c7577b",0,0,0,0,0,""
20201118,"RI",45911,,447160,,"totalTestEncountersViral",1384565,284,3953,22,,13,,,"11/18/2020 13:00","2020-11-18T13:00:00Z","11/18 08:00",1284,3953,3233,"2020-11-18T13:00:00Z",,58041,1326524,,,,1384565,493071,,,,,,,,,,,"44",1383,3438,493071,18973,493071,,6,59,"b8aeac220180aa309f21dddea861ad67cda047ad",0,0,0,0,0,""
20201117,"RI",44528,,443722,,"totalTestEncountersViral",1365592,265,3894,22,,10,,,"11/17/2020 13:00","2020-11-17T13:00:00Z","11/17 08:00",1278,3894,3195,"2020-11-17T13:00:00Z",,56555,1309037,,,,1365592,488250,,,,,,,,,,,"44",605,2245,488250,9875,488250,,8,37,"8d028dfe59bd5c37fe3360967b25b004a088a273",0,0,0,0,0,""
20201116,"RI",43923,,441477,,"totalTestEncountersViral",1355717,256,3857,21,,12,,,"11/16/2020 13:00","2020-11-16T13:00:00Z","11/16 08:00",1270,3857,3172,"2020-11-16T13:00:00Z",,55838,1299879,,,,1355717,485400,,,,,,,,,,,"44",481,1336,485400,6195,485400,,5,0,"9b7cb54cba0aceee2b7dcce0170938392fc45fd7",0,0,0,0,0,""
20201115,"RI",43442,,440141,,"totalTestEncountersViral",1349522,256,3857,21,,12,,,"11/16/2020 13:42","2020-11-16T13:42:00Z","11/16 08:42",1265,3857,3172,"2020-11-16T13:42:00Z",,55296,1294226,,,,1349522,483583,,,,,,,,,,,"44",679,2427,483583,13763,483583,,8,28,"70099470e08658e4e86763c4c17c5b629274faec",0,0,0,0,0,""
20201114,"RI",42763,,437714,,"totalTestEncountersViral",1335759,258,3829,23,,15,,,"11/16/2020 13:42","2020-11-16T13:42:00Z","11/16 08:42",1257,3829,3147,"2020-11-16T13:42:00Z",,54544,1281215,,,,1335759,480477,,,,,,,,,,,"44",1234,2313,480477,20376,480477,,3,73,"24460c99bb9a2e8057c3ca462f24013a16126052",0,0,0,0,0,""
20201113,"RI",41529,,435401,,"totalTestEncountersViral",1315383,250,3756,27,,14,,,"11/13/2020 13:00","2020-11-13T13:00:00Z","11/13 08:00",1254,3756,3086,"2020-11-13T13:00:00Z",,53264,1262119,,,,1315383,476930,,,,,,,,,,,"44",765,1751,476930,14097,476930,,4,55,"24db4a3d4463d791abcf9cf26699db38d4b7b64e",0,0,0,0,0,""
20201112,"RI",40764,,433650,,"totalTestEncountersViral",1301286,232,3701,28,,17,,,"11/12/2020 13:00","2020-11-12T13:00:00Z","11/12 08:00",1250,3701,3052,"2020-11-12T13:00:00Z",,52410,1248876,,,,1301286,474414,,,,,,,,,,,"44",988,2142,474414,20141,474414,,7,45,"81077fbce58726763654532d3154c5d124516221",0,0,0,0,0,""
20201111,"RI",39776,,431508,,"totalTestEncountersViral",1281145,220,3656,25,,17,,,"11/11/2020 12:00","2020-11-11T12:00:00Z","11/11 07:00",1243,3656,3020,"2020-11-11T12:00:00Z",,51353,1229792,,,,1281145,471284,,,,,,,,,,,"44",978,2429,471284,13870,471284,,6,35,"261aac8d3e92b7cff223ba18afb94b7a978467ef",0,0,0,0,0,""
20201110,"RI",38798,,429079,,"totalTestEncountersViral",1267275,218,3621,26,,18,,,"11/10/2020 12:00","2020-11-10T12:00:00Z","11/10 07:00",1237,3621,2989,"2020-11-10T12:00:00Z",,50311,1216964,,,,1267275,467877,,,,,,,,,,,"44",789,2057,467877,9636,467877,,4,37,"46e7672bd0b2ddda88ecdd5993c3ea426f6ad535",0,0,0,0,0,""
20201109,"RI",38009,,427022,,"totalTestEncountersViral",1257639,212,3584,27,,17,,,"11/9/2020 12:00","2020-11-09T12:00:00Z","11/09 07:00",1233,3584,2958,"2020-11-09T12:00:00Z",,49496,1208143,,,,1257639,465031,,,,,,,,,,,"44",266,1181,465031,3975,465031,,1,0,"3c8c880706484566da03caa6aa880b33ebd5ec95",0,0,0,0,0,""
20201108,"RI",37743,,425841,,"totalTestEncountersViral",1253664,212,3584,27,,17,,,"11/9/2020 13:42","2020-11-09T13:42:00Z","11/09 08:42",1232,3584,2958,"2020-11-09T13:42:00Z",,49192,1204472,,,,1253664,463584,,,,,,,,,,,"44",568,2501,463584,13840,463584,,1,26,"6dc5c57665d0ae50a99a79325b12dd5a321ecc8d",0,0,0,0,0,""
20201107,"RI",37175,,423340,,"totalTestEncountersViral",1239824,210,3558,25,,16,,,"11/9/2020 13:42","2020-11-09T13:42:00Z","11/09 08:42",1231,3558,2935,"2020-11-09T13:42:00Z",,48588,1191236,,,,1239824,460515,,,,,,,,,,,"44",795,6073,460515,21908,460515,,7,70,"a47b96405ddec800de19605e5fcd14b50bed5795",0,0,0,0,0,""
20201106,"RI",36380,,417267,,"totalTestEncountersViral",1217916,187,3488,21,,12,,,"11/6/2020 12:00","2020-11-06T12:00:00Z","11/06 07:00",1224,3488,2891,"2020-11-06T12:00:00Z",,47775,1170141,,,,1217916,453647,,,,,,,,,,,"44",630,2589,453647,17165,453647,,2,16,"99109616d485e30a65844b9bd295746aba62663f",0,0,0,0,0,""
20201105,"RI",35750,,414678,,"totalTestEncountersViral",1200751,182,3472,20,,11,,,"11/5/2020 12:00","2020-11-05T12:00:00Z","11/05 07:00",1222,3472,2881,"2020-11-05T12:00:00Z",,47021,1153730,,,,1200751,450428,,,,,,,,,,,"44",628,2779,450428,16392,450428,,8,40,"f0891ae7940b3d5d6d2a040880db9480296cc85c",0,0,0,0,0,""
20201104,"RI",35122,,411899,,"totalTestEncountersViral",1184359,169,3432,21,,11,,,"11/4/2020 12:00","2020-11-04T12:00:00Z","11/04 07:00",1214,3432,2856,"2020-11-04T12:00:00Z",,46304,1138055,,,,1184359,447021,,,,,,,,,,,"44",579,2918,447021,14300,447021,,2,26,"68feff744f29045045665d080a157ad2d9333b98",0,0,0,0,0,""
20201103,"RI",34543,,408981,,"totalTestEncountersViral",1170059,177,3406,24,,12,,,"11/3/2020 12:00","2020-11-03T12:00:00Z","11/03 07:00",1212,3406,2825,"2020-11-03T12:00:00Z",,45607,1124452,,,,1170059,443524,,,,,,,,,,,"44",423,2475,443524,11672,443524,,2,21,"fd50ea648810ee33bb455a904b8e2c173da82b49",0,0,0,0,0,""
20201102,"RI",34120,,406506,,"totalTestEncountersViral",1158387,170,3385,22,,9,,,"11/2/2020 12:00","2020-11-02T12:00:00Z","11/02 07:00",1210,3385,2811,"2020-11-02T12:00:00Z",,45170,1113217,,,,1158387,440626,,,,,,,,,,,"44",232,1060,440626,4560,440626,,3,0,"d4e64d64cf7eb66d6de6ec48c91a458ba4c917cb",0,0,0,0,0,""
20201101,"RI",33888,,405446,,"totalTestEncountersViral",1153827,170,3385,22,,9,,,"11/2/2020 12:14","2020-11-02T12:14:00Z","11/02 07:14",1207,3385,2811,"2020-11-02T12:14:00Z",,44889,1108938,,,,1153827,439334,,,,,,,,,,,"44",480,2293,439334,11900,439334,,3,27,"846d3559743d24e8a380a59b1da77a0a5cac1636",0,0,0,0,0,""
20201031,"RI",33408,,403153,,"totalTestEncountersViral",1141927,153,3358,19,,9,,,"11/2/2020 12:14","2020-11-02T12:14:00Z","11/02 07:14",1204,3358,2802,"2020-11-02T12:14:00Z",,44320,1097607,,,,1141927,436561,,,,,,,,,,,"44",534,3151,436561,17620,436561,,3,49,"aa4cbe47620b28222fa08322b46487c6d3465606",0,0,0,0,0,""
20201030,"RI",32874,,400002,,"totalTestEncountersViral",1124307,152,3309,15,,9,,,"10/30/2020 12:00","2020-10-30T12:00:00Z","10/30 08:00",1201,3309,2763,"2020-10-30T12:00:00Z",,43648,1080659,,,,1124307,432876,,,,,,,,,,,"44",562,2974,432876,17925,432876,,6,37,"436c78dce48070562dfccaeb4f1c5ebfa86efe4f",0,0,0,0,0,""
20201029,"RI",32312,,397028,,"totalTestEncountersViral",1106382,139,3272,16,,9,,,"10/29/2020 12:00","2020-10-29T12:00:00Z","10/29 08:00",1195,3272,2741,"2020-10-29T12:00:00Z",,43038,1063344,,,,1106382,429340,,,,,,,,,,,"44",368,2617,429340,14394,429340,,3,16,"d1149c677391f6b6d6521d0e5dc3478810ac4441",0,0,0,0,0,""
20201028,"RI",31944,,394411,,"totalTestEncountersViral",1091988,136,3256,18,,8,,,"10/28/2020 12:00","2020-10-28T12:00:00Z","10/28 08:00",1192,3256,2729,"2020-10-28T12:00:00Z",,42535,1049453,,,,1091988,426355,,,,,,,,,,,"44",499,2387,426355,14318,426355,,4,27,"a052263f6ccaf3508c31ab10bcefbd0d8baece35",0,0,0,0,0,""
20201027,"RI",31445,,392024,,"totalTestEncountersViral",1077670,168,3229,14,,8,,,"10/27/2020 12:00","2020-10-27T12:00:00Z","10/27 08:00",1188,3229,2672,"2020-10-27T12:00:00Z",,41994,1035676,,,,1077670,423469,,,,,,,,,,,"44",421,3156,423469,10528,423469,,4,21,"23aebf8fb97773811ce125ed2d64fcd908951c47",0,0,0,0,0,""
20201026,"RI",31024,,388868,,"totalTestEncountersViral",1067142,163,3208,14,,8,,,"10/26/2020 12:00","2020-10-26T12:00:00Z","10/26 08:00",1184,3208,2658,"2020-10-26T12:00:00Z",,41572,1025570,,,,1067142,419892,,,,,,,,,,,"44",167,1305,419892,3925,419892,,1,0,"7178a2b425332a0c182a119493e37fde5c4e3b57",0,0,0,0,0,""
20201025,"RI",30857,,387563,,"totalTestEncountersViral",1063217,163,3208,14,,8,,,"10/26/2020 13:53","2020-10-26T13:53:00Z","10/26 09:53",1183,3208,2658,"2020-10-26T13:53:00Z",,41380,1021837,,,,1063217,418420,,,,,,,,,,,"44",274,2071,418420,9963,418420,,0,11,"3b4579e85421508cb68c17b5c0370046f21800bf",0,0,0,0,0,""
20201024,"RI",30583,,385492,,"totalTestEncountersViral",1053254,163,3197,15,,9,,,"10/26/2020 13:53","2020-10-26T13:53:00Z","10/26 09:53",1183,3197,2647,"2020-10-26T13:53:00Z",,41054,1012200,,,,1053254,416075,,,,,,,,,,,"44",465,2760,416075,18682,416075,,6,71,"292797e862353764f9bae1639a43b597abfc4e4f",0,0,0,0,0,""
20201023,"RI",30118,,382732,,"totalTestEncountersViral",1034572,140,3126,13,,9,,,"10/23/2020 12:00","2020-10-23T12:00:00Z","10/23 08:00",1177,3126,2602,"2020-10-23T12:00:00Z",,40550,994022,,,,1034572,412850,,,,,,,,,,,"44",524,4024,412850,18852,412850,,4,10,"56580b47ef0c39ded0eb84bd3bb26e2d6483e8c0",0,0,0,0,0,""
20201022,"RI",29594,,378708,,"totalTestEncountersViral",1015720,140,3116,13,,8,,,"10/22/2020 12:00","2020-10-22T12:00:00Z","10/22 08:00",1173,3116,2595,"2020-10-22T12:00:00Z",,39816,975904,,,,1015720,408302,,,,,,,,,,,"44",471,3151,408302,17160,408302,,4,25,"d6ac16d0a4a0eaf0e4d506ced4fc84cbebd505cb",0,0,0,0,0,""
20201021,"RI",29123,,375557,,"totalTestEncountersViral",998560,130,3091,14,,6,,,"10/21/2020 12:00","2020-10-21T12:00:00Z","10/21 08:00",1169,3091,2580,"2020-10-21T12:00:00Z",,39324,959236,,,,998560,404680,,,,,,,,,,,"44",474,3151,404680,13240,404680,,5,19,"7ff6225757c0052883afabc226282c8c3551ea7e",0,0,0,0,0,""
20201020,"RI",28649,,372406,,"totalTestEncountersViral",985320,135,3072,16,,6,,,"10/20/2020 12:00","2020-10-20T12:00:00Z","10/20 08:00",1164,3072,2558,"2020-10-20T12:00:00Z",,38826,946494,,,,985320,401055,,,,,,,,,,,"44",302,1427,401055,7409,401055,,5,22,"df60c70b61217bd40417577ec76690896b1744a4",0,0,0,0,0,""
20201019,"RI",28347,,370979,,"totalTestEncountersViral",977911,124,3050,16,,4,,,"10/19/2020 12:00","2020-10-19T12:00:00Z","10/19 08:00",1159,3050,2546,"2020-10-19T12:00:00Z",,38619,939292,,,,977911,399326,,,,,,,,,,,"44",85,1017,399326,2927,399326,,1,0,"c2d8cf6540099c232971ebb966b8d8a70722d947",0,0,0,0,0,""
20201018,"RI",28262,,369962,,"totalTestEncountersViral",974984,124,3050,16,,4,,,"10/19/2020 12:08","2020-10-19T12:08:00Z","10/19 08:08",1158,3050,2546,"2020-10-19T12:08:00Z",,38515,936469,,,,974984,398224,,,,,,,,,,,"44",284,3166,398224,13977,398224,,0,11,"e6cf7a80ad2c2a60d703030a4d85a21b2d2332c7",0,0,0,0,0,""
20201017,"RI",27978,,366796,,"totalTestEncountersViral",961007,125,3039,13,,4,,,"10/19/2020 12:08","2020-10-19T12:08:00Z","10/19 08:08",1158,3039,2535,"2020-10-19T12:08:00Z",,38180,922827,,,,961007,394774,,,,,,,,,,,"44",287,4310,394774,25384,394774,,6,24,"492e4fb0e359b66031378c84d8e2fed40301ce30",0,0,0,0,0,""
20201016,"RI",27691,,362486,,"totalTestEncountersViral",935623,137,3015,14,,5,,,"10/16/2020 12:00","2020-10-16T12:00:00Z","10/16 08:00",1152,3015,2501,"2020-10-16T12:00:00Z",,37843,897780,,,,935623,390177,,,,,,,,,,,"44",253,3148,390177,8439,390177,,3,16,"0580499837c0db71b27be6a7f91996ca911d1186",0,0,0,0,0,""
20201015,"RI",27438,,359338,,"totalTestEncountersViral",927184,129,2999,12,,5,,,"10/15/2020 12:00","2020-10-15T12:00:00Z","10/15 08:00",1149,2999,2493,"2020-10-15T12:00:00Z",,37600,889584,,,,927184,386776,,,,,,,,,,,"44",274,3439,386776,14925,386776,,2,15,"ba5b307164f675084707a43ecb29b59373c89b17",0,0,0,0,0,""
20201014,"RI",27164,,355899,,"totalTestEncountersViral",912259,131,2984,13,,4,,,"10/14/2020 12:00","2020-10-14T12:00:00Z","10/14 08:00",1147,2984,2481,"2020-10-14T12:00:00Z",,37306,874953,,,,912259,383063,,,,,,,,,,,"44",204,2165,383063,6610,383063,,8,23,"bd189059aa2ed2d969d6b54b4afc499d032496fb",0,0,0,0,0,""
20201013,"RI",26960,,353734,,"totalTestEncountersViral",905649,126,2961,13,,4,,,"10/13/2020 12:00","2020-10-13T12:00:00Z","10/13 08:00",1139,2961,2463,"2020-10-13T12:00:00Z",,37099,868550,,,,905649,380694,,,,,,,,,,,"44",129,1465,380694,5855,380694,,2,0,"ff94cd3cd83f92e2758442ed63babd257104c4c9",0,0,0,0,0,""
20201012,"RI",26831,,352269,,"totalTestEncountersViral",899794,126,2961,13,,4,,,"10/12/2020 00:00","2020-10-12T00:00:00Z","10/11 20:00",1137,2961,2463,"2020-10-12T00:00:00Z",,36959,862835,,,,899794,379100,,,,,,,,,,,"44",81,1169,379100,3344,379100,,3,11,"496fefae22a4487401d3e78456c58603be3c0f1d",0,0,0,0,0,""
20201011,"RI",26750,,351100,,"totalTestEncountersViral",896450,125,2950,13,,5,,,"10/11/2020 00:00","2020-10-11T00:00:00Z","10/10 20:00",1134,2950,2455,"2020-10-11T00:00:00Z",,36865,859585,,,,896450,377850,,,,,,,,,,,"44",170,3829,377850,13700,377850,,2,16,"4d0bf3cf983201894e9f52bd39458ef305d9f127",0,0,0,0,0,""
20201010,"RI",26580,,347271,,"totalTestEncountersViral",882750,119,2934,12,,5,,,"10/10/2020 00:00","2020-10-10T00:00:00Z","10/09 20:00",1132,2934,2446,"2020-10-10T00:00:00Z",,36635,846115,,,,882750,373851,,,,,,,,,,,"44",286,5504,373851,18112,373851,,2,32,"83e47559dedb6a44deb245170a97421f68371997",0,0,0,0,0,""
20201009,"RI",26294,,341767,,"totalTestEncountersViral",864638,112,2902,10,,6,,,"10/9/2020 12:00","2020-10-09T12:00:00Z","10/09 08:00",1130,2902,2422,"2020-10-09T12:00:00Z",,36345,828293,,,,864638,368061,,,,,,,,,,,"44",249,3498,368061,5209,368061,,3,13,"7894f6e6d36b99c33fc1e67543f981e5d555b78a",0,0,0,0,0,""
20201008,"RI",26045,,338269,,"totalTestEncountersViral",859429,117,2889,12,,6,,,"10/8/2020 12:00","2020-10-08T12:00:00Z","10/08 08:00",1127,2889,2408,"2020-10-08T12:00:00Z",,36145,823284,,,,859429,364314,,,,,,,,,,,"44",269,6695,364314,20947,364314,,1,16,"e599c71a7de5a37199e6e638fcd7f0f9fe05b895",0,0,0,0,0,""
20201007,"RI",25776,,331574,,"totalTestEncountersViral",838482,107,2873,10,,5,,,"10/7/2020 12:00","2020-10-07T12:00:00Z","10/07 08:00",1126,2873,2402,"2020-10-07T12:00:00Z",,35867,802615,,,,838482,357350,,,,,,,,,,,"44",180,3089,357350,10468,357350,,1,24,"43f6e54b79f7c18318b3bc2358c4d9a21051a0b1",0,0,0,0,0,""
20201006,"RI",25596,,328485,,"totalTestEncountersViral",828014,93,2849,8,,4,,,"10/6/2020 12:00","2020-10-06T12:00:00Z","10/06 08:00",1125,2849,2393,"2020-10-06T12:00:00Z",,35665,792349,,,,828014,354081,,,,,,,,,,,"44",177,2643,354081,7709,354081,,4,14,"2cf9d712593eafec84fb5f384bcd2c02e87cd9fb",0,0,0,0,0,""
20201005,"RI",25419,,325842,,"totalTestEncountersViral",820305,92,2835,7,,4,,,"10/5/2020 12:00","2020-10-05T12:00:00Z","10/05 08:00",1121,2835,2381,"2020-10-05T12:00:00Z",,35503,784802,,,,820305,351261,,,,,,,,,,,"44",50,641,351261,1553,351261,,1,0,"8dcf333e0924451e27100f7345fd93c360358f84",0,0,0,0,0,""
20201004,"RI",25369,,325201,,"totalTestEncountersViral",818752,92,2835,7,,4,,,"10/5/2020 12:00","2020-10-05T12:00:00Z","10/05 08:00",1120,2835,2381,"2020-10-05T12:00:00Z",,35441,783311,,,,818752,350570,,,,,,,,,,,"44",124,1833,350570,8801,350570,,1,7,"f61e3cdef7fd21825110f834de34c79170003e86",0,0,0,0,0,""
20201003,"RI",25245,,323368,,"totalTestEncountersViral",809951,94,2828,6,,4,,,"10/5/2020 12:00","2020-10-05T12:00:00Z","10/05 08:00",1119,2828,2374,"2020-10-05T12:00:00Z",,35295,774656,,,,809951,348613,,,,,,,,,,,"44",169,2535,348613,12937,348613,,1,28,"25388d3bb46cfffe245c6bab26e633816ee09267",0,0,0,0,0,""
20201002,"RI",25076,,320833,,"totalTestEncountersViral",797014,96,2800,7,,7,,,"10/2/2020 12:00","2020-10-02T12:00:00Z","10/02 08:00",1118,2800,2346,"2020-10-02T12:00:00Z",,35077,761937,,,,797014,345909,,,,,,,,,,,"44",162,2248,345909,10814,345909,,1,7,"51d891aa570245e4601f36d251e83146fc2278b2",0,0,0,0,0,""
20201001,"RI",24914,,318585,,"totalTestEncountersViral",786200,94,2793,6,,7,,,"10/1/2020 12:00","2020-10-01T12:00:00Z","10/01 08:00",1117,2793,2342,"2020-10-01T12:00:00Z",,34906,751294,,,,786200,343499,,,,,,,,,,,"44",166,2732,343499,16378,343499,,3,11,"60390d9a2337632df2afa2be1a2746c0e0a203f6",0,0,0,0,0,""
20200930,"RI",24748,,315853,,"totalTestEncountersViral",769822,103,2782,7,,6,,,"9/30/2020 12:00","2020-09-30T12:00:00Z","09/30 08:00",1114,2782,2322,"2020-09-30T12:00:00Z",,34686,735136,,,,769822,340601,,,,,,,,,,,"44",192,2511,340601,9594,340601,,1,8,"7e4fc8643d9636ff61e1b8ff91d047962baaf03a",0,0,0,0,0,""
20200929,"RI",24556,,313342,,"totalTestEncountersViral",760228,103,2774,8,,5,,,"9/29/2020 12:00","2020-09-29T12:00:00Z","09/29 08:00",1113,2774,2316,"2020-09-29T12:00:00Z",,34779,725449,,,,760228,337898,,,,,,,,,,,"44",132,2082,337898,7072,337898,,3,49,"7d058f3a7b04b0f1d2768e31ec30816005e00ba7",0,0,0,0,0,""
20200928,"RI",24424,,311260,,"totalTestEncountersViral",753156,94,2725,8,,4,,,"9/28/2020 12:00","2020-09-28T12:00:00Z","09/28 08:00",1110,2725,2278,"2020-09-28T12:00:00Z",,34601,718555,,,,753156,335684,,,,,,,,,,,"44",26,538,335684,2008,335684,,0,0,"2c67fa4c04426213a91ea6ff43023bc44392b728",0,0,0,0,0,""
20200927,"RI",24398,,310722,,"totalTestEncountersViral",751148,94,2725,8,,4,,,"9/27/2020 12:00","2020-09-27T12:00:00Z","09/27 08:00",1110,2725,2278,"2020-09-27T12:00:00Z",,34564,716584,,,,751148,335120,,,,,,,,,,,"44",114,1858,335120,9185,335120,,0,0,"ad825de74a2107a7f8a534d611c59e9b95ff3b52",0,0,0,0,0,""
20200926,"RI",24284,,308864,,"totalTestEncountersViral",741963,94,2725,8,,4,,,"9/26/2020 12:00","2020-09-26T12:00:00Z","09/26 08:00",1110,2725,2278,"2020-09-26T12:00:00Z",,34451,707512,,,,741963,333148,,,,,,,,,,,"44",103,3011,333148,14494,333148,,3,0,"fb352a323cdd27fb6aeedeca0e17ba72fbb69a69",0,0,0,0,0,""
20200925,"RI",24181,,305853,,"totalTestEncountersViral",727469,94,2725,8,,4,,,"9/25/2020 12:00","2020-09-25T12:00:00Z","09/25 08:00",1107,2725,2278,"2020-09-25T12:00:00Z",,34299,693170,,,,727469,330034,,,,,,,,,,,"44",-130,2581,330034,10422,330034,,1,0,"9c2e2d9f004909b07538b0adb2adbdf767dc64b9",0,0,0,0,0,""
20200924,"RI",24311,,303272,,"totalTestEncountersViral",717047,94,2725,8,,4,,,"9/24/2020 12:00","2020-09-24T12:00:00Z","09/24 08:00",1106,2725,2278,"2020-09-24T12:00:00Z",,34111,682936,,,,717047,327583,,,,,,,,,,,"44",134,2329,327583,10469,327583,,4,12,"450ca3dd2e1d6f48a6f4851763d35e666dcf10f5",0,0,0,0,0,""
20200923,"RI",24177,,300943,,"totalTestEncountersViral",706578,86,2713,9,,5,,,"9/23/2020 12:00","2020-09-23T12:00:00Z","09/23 08:00",1102,2713,2275,"2020-09-23T12:00:00Z",,33952,672626,,,,706578,325120,,,,,,,,,,,"44",133,2596,325120,9770,325120,,3,9,"2cfad96e6742831d3275db6567c858a06c924806",0,0,0,0,0,""
20200922,"RI",24044,,298347,,"totalTestEncountersViral",696808,82,2704,10,,7,,,"9/22/2020 12:00","2020-09-22T12:00:00Z","09/22 08:00",1099,2704,2272,"2020-09-22T12:00:00Z",,33791,663017,,,,696808,322391,,,,,,,,,,,"44",112,1713,322391,6527,322391,,2,11,"4aa9a5f2cdafa7143ba9106f281a9f5ea49d553b",0,0,0,0,0,""
20200921,"RI",23932,,296634,,"totalTestEncountersViral",690281,78,2693,10,,4,,,"9/21/2020 12:00","2020-09-21T12:00:00Z","09/21 08:00",1097,2693,2268,"2020-09-21T12:00:00Z",,33671,656610,,,,690281,320566,,,,,,,,,,,"44",52,711,320566,2136,320566,,3,0,"855ba6763294088627116d6d273c7a72ad4c4212",0,0,0,0,0,""
20200920,"RI",23880,,295923,,"totalTestEncountersViral",688145,78,2693,10,,4,,,"9/20/2020 12:00","2020-09-20T12:00:00Z","09/20 08:00",1094,2693,2268,"2020-09-20T12:00:00Z",,33607,654538,,,,688145,319803,,,,,,,,,,,"44",82,1705,319803,8291,319803,,3,6,"c5a1442d48a68b92f7cc2f6d8588751bc3a0169d",0,0,0,0,0,""
20200919,"RI",23798,,294218,,"totalTestEncountersViral",679854,75,2687,11,,4,,,"9/19/2020 12:00","2020-09-19T12:00:00Z","09/19 08:00",1091,2687,2265,"2020-09-19T12:00:00Z",,33449,646405,,,,679854,318016,,,,,,,,,,,"44",178,2283,318016,4746,318016,,3,12,"4550cbc9a9ad25bffb150324609a1ad752b86116",0,0,0,0,0,""
20200918,"RI",23620,,291935,,"totalTestEncountersViral",675108,85,2675,7,,6,,,"9/18/2020 12:00","2020-09-18T12:00:00Z","09/18 08:00",1088,2675,2244,"2020-09-18T12:00:00Z",,33476,641632,,,,675108,315555,,,,,,,,,,,"44",132,2148,315555,9182,315555,,3,7,"066e6d304c9de149818a9564fea02ba2508b89e1",0,0,0,0,0,""
20200917,"RI",23488,,289787,,"totalTestEncountersViral",665926,88,2668,9,,5,,,"9/17/2020 12:00","2020-09-17T12:00:00Z","09/17 08:00",1085,2668,2236,"2020-09-17T12:00:00Z",,33335,632591,,,,665926,313275,,,,,,,,,,,"44",130,1801,313275,11823,313275,,4,6,"5e3595d9e025a5f84ed71c311207db366d66e554",0,0,0,0,0,""
20200916,"RI",23358,,287986,,"totalTestEncountersViral",654103,84,2662,9,,5,,,"9/16/2020 12:00","2020-09-16T12:00:00Z","09/16 08:00",1081,2662,2235,"2020-09-16T12:00:00Z",,33159,620944,,,,654103,311344,,,,,,,,,,,"44",108,1195,311344,11536,311344,,3,12,"5b63100fc65ae32342e84c10be2cd28b9665762b",0,0,0,0,0,""
20200915,"RI",23250,,286791,,"totalTestEncountersViral",642567,81,2650,9,,5,,,"9/15/2020 12:00","2020-09-15T12:00:00Z","09/15 08:00",1078,2650,2228,"2020-09-15T12:00:00Z",,32820,609747,,,,642567,310041,,,,,,,,,,,"44",120,1724,310041,6849,310041,,3,6,"84d20372201c98e05812a8c26f16e44b3ec2f72f",0,0,0,0,0,""
20200914,"RI",23130,,285067,,"totalTestEncountersViral",635718,80,2644,7,,4,,,"9/14/2020 12:00","2020-09-14T12:00:00Z","09/14 08:00",1075,2644,2223,"2020-09-14T12:00:00Z",,32706,603012,,,,635718,308197,,,,,,,,,,,"44",32,682,308197,2208,308197,,0,0,"166443fe6204a616a835910e1f25b480c29d94d6",0,0,0,0,0,""
20200913,"RI",23098,,284385,,"totalTestEncountersViral",633510,80,2644,7,,4,,,"9/12/2020 12:00","2020-09-12T12:00:00Z","09/12 08:00",1075,2644,2223,"2020-09-12T12:00:00Z",,32660,600850,,,,633510,307483,,,,,,,,,,,"44",99,1248,307483,5419,307483,,3,5,"ee2ae63bf01437f58bbcf770938da4eb921c6057",0,0,0,0,0,""
20200912,"RI",22999,,283137,,"totalTestEncountersViral",628091,80,2639,8,,4,,,"9/11/2020 12:00","2020-09-11T12:00:00Z","09/11 08:00",1072,2639,2220,"2020-09-11T12:00:00Z",,32558,595533,,,,628091,306136,,,,,,,,,,,"44",94,3019,306136,12408,306136,,1,19,"4ca6d0f0e11aa38d66abda9a807c679888899929",0,0,0,0,0,""
20200911,"RI",22905,,280118,,"totalTestEncountersViral",615683,80,2620,8,,3,,,"9/11/2020 12:00","2020-09-11T12:00:00Z","09/11 08:00",1071,2620,2201,"2020-09-11T12:00:00Z",,32589,583094,,,,615683,303023,,,,,,,,,,,"44",123,1587,303023,8777,303023,,4,9,"acf8aaeaa1c6aa3462aa7dea7336433a08f73fb9",0,0,0,0,0,""
20200910,"RI",22782,,278531,,"totalTestEncountersViral",606906,76,2611,5,,3,,,"9/10/2020 12:00","2020-09-10T12:00:00Z","09/10 08:00",1067,2611,2197,"2020-09-10T12:00:00Z",,32425,574481,,,,606906,301313,,,,,,,,,,,"44",106,2193,301313,8589,301313,,5,7,"4d5fad95710ff6a57c41df9baffbfd6e790881ce",0,0,0,0,0,""
20200909,"RI",22676,,276338,,"totalTestEncountersViral",598317,82,2604,4,,3,,,"9/9/2020 12:00","2020-09-09T12:00:00Z","09/09 08:00",1062,2604,2185,"2020-09-09T12:00:00Z",,32303,566014,,,,598317,299014,,,,,,,,,,,"44",84,7491,299014,15705,299014,,3,15,"f495155a111b3d382d649c0571242e8872b5ad7d",0,0,0,0,0,""
20200908,"RI",22592,,268847,,"totalTestEncountersViral",582612,73,2589,5,,3,,,"9/8/2020 12:00","2020-09-08T12:00:00Z","09/08 08:00",1059,2589,2179,"2020-09-08T12:00:00Z",,31815,550797,,,,582612,291439,,,,,,,,,,,"44",20,390,291439,1438,291439,,0,0,"0edb08d3c29935ebadb7d0fd89c719158a8154a5",0,0,0,0,0,""
20200907,"RI",22572,,268457,,"totalTestEncountersViral",581174,73,2589,5,,3,,,"9/7/2020 12:00","2020-09-07T12:00:00Z","09/07 08:00",1059,2589,2179,"2020-09-07T12:00:00Z",,31786,549388,,,,581174,291029,,,,,,,,,,,"44",53,1768,291029,4011,291029,,1,2,"ab9ada26721e6c6577ab86ef853bbb3f4de325bf",0,0,0,0,0,""
20200906,"RI",22519,,266689,,"totalTestEncountersViral",577163,79,2587,7,,3,,,"9/7/2020 12:00","2020-09-07T12:00:00Z","09/07 08:00",1058,2587,2172,"2020-09-07T12:00:00Z",,31715,545448,,,,577163,289208,,,,,,,,,,,"44",35,1486,289208,6234,289208,,0,6,"78a0c84548fd7cd5f093ee8385deccbafab0cb8d",0,0,0,0,0,""
20200905,"RI",22484,,265203,,"totalTestEncountersViral",570929,82,2581,9,,4,,,"9/7/2020 12:00","2020-09-07T12:00:00Z","09/07 08:00",1058,2581,2163,"2020-09-07T12:00:00Z",,31667,539262,,,,570929,287687,,,,,,,,,,,"44",241,3440,287687,13407,287687,,3,22,"bc7a27504d8cb7072a93266ce26bb625bcc7e4d8",0,0,0,0,0,""
20200904,"RI",22243,,261763,,"totalTestEncountersViral",557522,76,2559,8,,4,,,"9/4/2020 12:00","2020-09-04T12:00:00Z","09/04 08:00",1055,2559,2147,"2020-09-04T12:00:00Z",,31547,525975,,,,557522,284006,,,,,,,,,,,"44",100,2273,284006,9929,284006,,0,19,"74fe788873f265ab54f4d7103906e3fe73c3d47a",0,0,0,0,0,""
20200903,"RI",22143,,259490,,"totalTestEncountersViral",547593,68,2540,7,,4,,,"9/3/2020 12:00","2020-09-03T12:00:00Z","09/03 08:00",1055,2540,2137,"2020-09-03T12:00:00Z",,31447,516146,,,,547593,281633,,,,,,,,,,,"44",65,2927,281633,11454,281633,,4,-2,"2f42f2155bb1b47f03beba736cac1a9141375891",0,0,0,0,0,""
20200902,"RI",22078,,256563,,"totalTestEncountersViral",536139,78,2542,8,,4,,,"9/2/2020 12:00","2020-09-02T12:00:00Z","09/02 08:00",1051,2542,2130,"2020-09-02T12:00:00Z",,31362,504777,,,,536139,278641,,,,,,,,,,,"44",76,2083,278641,5651,278641,,1,14,"6eab7fe6db4122b1c5fe913c2e2c54d038fd2a30",0,0,0,0,0,""
20200901,"RI",22002,,254480,,"totalTestEncountersViral",530488,81,2528,8,,5,,,"9/1/2020 12:00","2020-09-01T12:00:00Z","09/01 08:00",1050,2528,2113,"2020-09-01T12:00:00Z",,31281,499207,,,,530488,276482,,,,,,,,,,,"44",53,2532,276482,6074,276482,,2,9,"c21f8866b73b7aab5b2b5522484a2af0a009f2c1",0,0,0,0,0,""
20200831,"RI",21949,,251948,,"totalTestEncountersViral",524414,77,2519,9,,5,,,"8/31/2020 12:00","2020-08-31T12:00:00Z","08/31 08:00",1048,2519,2108,"2020-08-31T12:00:00Z",,31198,493216,,,,524414,273897,,,,,,,,,,,"44",46,1835,273897,3936,273897,,1,0,"2d0852f117df97985d116bcb9459081b684478e8",0,0,0,0,0,""
20200830,"RI",21903,,250113,,"totalTestEncountersViral",520478,77,2519,9,,5,,,"8/30/2020 12:00","2020-08-30T12:00:00Z","08/30 08:00",1047,2519,2108,"2020-08-30T12:00:00Z",,31135,489343,,,,520478,272016,,,,,,,,,,,"44",46,1759,272016,5336,272016,,0,5,"22ca78b24f3907967b2d93a94291aa29fe987845",0,0,0,0,0,""
20200829,"RI",21857,,248354,,"totalTestEncountersViral",515142,80,2514,8,,6,,,"8/29/2020 12:00","2020-08-29T12:00:00Z","08/29 08:00",1047,2514,2101,"2020-08-29T12:00:00Z",,31071,484071,,,,515142,270211,,,,,,,,,,,"44",174,3246,270211,10238,270211,,1,18,"52f8f649f683f5b9e6f1e7772b68eeb43e6ec2cf",0,0,0,0,0,""
20200828,"RI",21683,,245108,,"totalTestEncountersViral",504904,81,2496,8,,4,,,"8/28/2020 12:00","2020-08-28T12:00:00Z","08/28 08:00",1046,2496,2084,"2020-08-28T12:00:00Z",,30953,473951,,,,504904,266791,,,,,,,,,,,"44",94,3284,266791,9329,266791,,2,11,"2c14a900a4d2e6402d7a04f9337d0e200908c777",0,0,0,0,0,""
20200827,"RI",21589,,241824,,"totalTestEncountersViral",495575,82,2485,10,,3,,,"8/27/2020 12:00","2020-08-27T12:00:00Z","08/27 08:00",1044,2485,2073,"2020-08-27T12:00:00Z",,30872,464703,,,,495575,263413,,,,,,,,,,,"44",135,3648,263413,10549,263413,,3,7,"e8e1a2aa84c5cd4ba94e869f829dfe54a48db7f7",0,0,0,0,0,""
20200826,"RI",21454,,238176,,"totalTestEncountersViral",485026,80,2478,11,,4,,,"8/26/2020 12:00","2020-08-26T12:00:00Z","08/26 08:00",1041,2478,2069,"2020-08-26T12:00:00Z",,30697,454329,,,,485026,259630,,,,,,,,,,,"44",82,1759,259630,5643,259630,,2,4,"49b27c120e4999e0af9cc009cf6bf475c610e177",0,0,0,0,0,""
20200825,"RI",21372,,236417,,"totalTestEncountersViral",479383,87,2474,11,,2,,,"8/25/2020 12:00","2020-08-25T12:00:00Z","08/25 08:00",1039,2474,2059,"2020-08-25T12:00:00Z",,30440,448943,,,,479383,257789,,,,,,,,,,,"44",70,3045,257789,5713,257789,,4,14,"d48f100fc7192acfdf16fac64b1737dd43dc6793",0,0,0,0,0,""
20200824,"RI",21302,,233372,,"totalTestEncountersViral",473670,80,2460,11,,4,,,"8/24/2020 12:00","2020-08-24T12:00:00Z","08/24 08:00",1035,2460,2052,"2020-08-24T12:00:00Z",,30345,443325,,,,473670,254674,,,,,,,,,,,"44",39,2064,254674,3508,254674,,0,0,"db2b98890bd9cecd963405103c226850971bcb45",0,0,0,0,0,""
20200823,"RI",21263,,231308,,"totalTestEncountersViral",470162,80,2460,11,,4,,,"8/23/2020 12:00","2020-08-23T12:00:00Z","08/23 08:00",1035,2460,2052,"2020-08-23T12:00:00Z",,30300,439862,,,,470162,252571,,,,,,,,,,,"44",88,2357,252571,5490,252571,,0,5,"5cf410a789d8e6b50197f3f9ef192f53e84247c1",0,0,0,0,0,""
20200822,"RI",21175,,228951,,"totalTestEncountersViral",464672,87,2455,9,,4,,,"8/22/2020 12:00","2020-08-22T12:00:00Z","08/22 08:00",1035,2455,2040,"2020-08-22T12:00:00Z",,30211,434461,,,,464672,250126,,,,,,,,,,,"44",153,4119,250126,9695,250126,,5,17,"8c394ec97e26a5a5dcbb626d482718d156a488d5",0,0,0,0,0,""
20200821,"RI",21022,,224832,,"totalTestEncountersViral",454977,81,2438,9,,5,,,"8/21/2020 12:00","2020-08-21T12:00:00Z","08/21 08:00",1030,2438,2031,"2020-08-21T12:00:00Z",,30022,424955,,,,454977,245854,,,,,,,,,,,"44",151,5940,245854,10403,245854,,2,7,"2776435924387a11227a517cb4faebf1edfcc4c4",0,0,0,0,0,""
20200820,"RI",20871,,218892,,"totalTestEncountersViral",444574,84,2431,8,,4,,,"8/20/2020 12:00","2020-08-20T12:00:00Z","08/20 08:00",1028,2431,2021,"2020-08-20T12:00:00Z",,29831,414743,,,,444574,239763,,,,,,,,,,,"44",76,-18627,239763,4447,239763,,1,12,"c654bdcb13ff4f2083bdf39a9e6f38ee7f0c34f2",0,0,0,0,0,""
20200819,"RI",20795,,237519,,"totalTestEncountersViral",440127,82,2419,8,,5,,,"8/19/2020 12:00","2020-08-19T12:00:00Z","08/19 08:00",1027,2419,2013,"2020-08-19T12:00:00Z",,29738,410389,,,,440127,258314,,,,,,,,,,,"44",103,22048,258314,3936,258314,,3,14,"0291c649a65a3c9cb0cbf92f5598afe6b2749b85",0,0,0,0,0,""
20200818,"RI",20692,,215471,,"totalTestEncountersViral",436191,78,2405,8,,4,,,"8/18/2020 12:00","2020-08-18T12:00:00Z","08/18 08:00",1024,2405,2004,"2020-08-18T12:00:00Z",,29522,406669,,,,436191,236163,,,,,,,,,,,"44",120,2221,236163,5186,236163,,1,25,"1dcd1fe6c4f4a9fb3880f2fa3d1289ebb183aab6",0,0,0,0,0,""
20200817,"RI",20572,,213250,,"totalTestEncountersViral",431005,80,2380,11,,3,,,"8/17/2020 12:00","2020-08-17T12:00:00Z","08/17 08:00",1023,2380,1982,"2020-08-17T12:00:00Z",,29317,401688,,,,431005,233822,,,,,,,,,,,"44",58,686,233822,2028,233822,,1,0,"85e1cc09749ca837d7e7c2254b43410d7fc3628a",0,0,0,0,0,""
20200816,"RI",20514,,212564,,"totalTestEncountersViral",428977,80,2380,11,,3,,,"8/16/2020 12:00","2020-08-16T12:00:00Z","08/16 08:00",1022,2380,1982,"2020-08-16T12:00:00Z",,29246,399731,,,,428977,233078,,,,,,,,,,,"44",75,1237,233078,3662,233078,,0,5,"31bb4b0ec1be5fb4376b8df284fe4f6968f73bce",0,0,0,0,0,""
20200815,"RI",20439,,211327,,"totalTestEncountersViral",425315,85,2375,11,,2,,,"8/15/2020 12:00","2020-08-15T12:00:00Z","08/15 08:00",1022,2375,1972,"2020-08-15T12:00:00Z",,29154,396161,,,,425315,231766,,,,,,,,,,,"44",104,1797,231766,4582,231766,,1,25,"266d25e775a6508136288a619fc930ead761ec9c",0,0,0,0,0,""
20200814,"RI",20335,,209530,,"totalTestEncountersViral",420733,79,2350,8,,3,,,"8/14/2020 12:00","2020-08-14T12:00:00Z","08/14 08:00",1021,2350,1953,"2020-08-14T12:00:00Z",,29007,390466,,,,420733,229865,,,,,,,,,,,"44",95,1296,229865,4530,229865,,2,9,"3c47c4a65084aecc10014be61cdad6953df05790",0,0,0,0,0,""
20200813,"RI",20240,,208234,,"totalTestEncountersViral",416203,80,2341,10,,4,,,"8/13/2020 12:00","2020-08-13T12:00:00Z","08/13 08:00",1019,2341,1943,"2020-08-13T12:00:00Z",,28909,387294,,,,416203,228474,,,,,,,,,,,"44",111,2230,228474,4154,228474,,1,5,"f25323dfcc60aa6482db7f217a14b83223dab26b",0,0,0,0,0,""
20200812,"RI",20129,,206004,,"totalTestEncountersViral",412049,89,2336,9,,3,,,"8/12/2020 12:00","2020-08-12T12:00:00Z","08/12 08:00",1018,2336,1929,"2020-08-12T12:00:00Z",,28776,382951,,,,412049,226133,,,,,,,,,,,"44",76,1887,226133,3975,226133,,2,19,"0d10030708ad2e8ec46aa56bdd204bf45de4daea",0,0,0,0,0,""
20200811,"RI",20053,,204117,,"totalTestEncountersViral",408074,88,2317,9,,2,,,"8/11/2020 12:00","2020-08-11T12:00:00Z","08/11 08:00",1016,2317,1911,"2020-08-11T12:00:00Z",409435,28836,380599,,,,408074,224170,,,,,,,,,,,"44",119,1704,224170,4142,224170,,1,6,"7e29ba62209f0f59026d42b23af20259791d01f2",0,0,0,0,0,""
20200810,"RI",19934,,202413,,"totalTestEncountersViral",403932,93,2311,8,,2,,,"8/10/2020 12:00","2020-08-10T12:00:00Z","08/10 08:00",1015,2311,1900,"2020-08-10T12:00:00Z",405152,28707,376445,,,,403932,222347,,,,,,,,,,,"44",28,829,222347,1557,222347,,0,0,"aefabb101da2911f740061a836b07a2117e53341",0,0,0,0,0,""
20200809,"RI",19906,,201584,,"totalTestEncountersViral",402375,93,2311,8,,2,,,"8/9/2020 12:00","2020-08-09T12:00:00Z","08/09 08:00",1015,2311,1900,"2020-08-09T12:00:00Z",403746,28674,375072,,,,402375,221490,,,,,,,,,,,"44",74,1451,221490,3399,221490,,0,17,"050621f3e9741503a8f296fa018f6fb9bfa421d7",0,0,0,0,0,""
20200808,"RI",19832,,200133,,"totalTestEncountersViral",398976,82,2294,9,,2,,,"8/8/2020 12:00","2020-08-08T12:00:00Z","08/08 08:00",1015,2294,1895,"2020-08-08T12:00:00Z",400407,28576,371831,,,,398976,219965,,,,,,,,,,,"44",94,1898,219965,4227,219965,,1,18,"a73698be29ec002ff279a57d9592079c07385be6",0,0,0,0,0,""
20200807,"RI",19738,,198235,,"totalTestEncountersViral",394749,84,2276,10,,4,,,"8/7/2020 12:00","2020-08-07T12:00:00Z","08/07 08:00",1014,2276,1876,"2020-08-07T12:00:00Z",395798,28471,367327,,,,394749,217973,,,,,,,,,,,"44",127,2123,217973,4780,217973,,0,12,"eb84ac7ac2f5de0e1f4a734e796de9d8c97ce64d",0,0,0,0,0,""
20200806,"RI",19611,,196112,,"totalTestEncountersViral",389969,83,2264,11,,4,,,"8/6/2020 12:00","2020-08-06T12:00:00Z","08/06 08:00",1014,2264,1866,"2020-08-06T12:00:00Z",390478,28299,362179,,,,389969,215723,,,,,,,,,,,"44",130,2058,215723,5482,215723,,2,16,"2520a6cae3fbc71af363de234a85105e863a60ed",0,0,0,0,0,""
20200805,"RI",19481,,194054,,"totalTestEncountersViral",384487,79,2248,14,,5,,,"8/5/2020 12:00","2020-08-05T12:00:00Z","08/05 08:00",1012,2248,1855,"2020-08-05T12:00:00Z",384902,28145,356757,,,,384487,213535,,,,,,,,,,,"44",91,1491,213535,3514,213535,,1,6,"11551884b6914ea32ad7afd057cd8b3fae7ff9ee",0,0,0,0,0,""
20200804,"RI",19390,,192563,,"totalTestEncountersViral",380973,80,2242,14,,6,,,"8/4/2020 12:00","2020-08-04T12:00:00Z","08/04 08:00",1011,2242,1848,"2020-08-04T12:00:00Z",381478,28029,353449,,,,380973,211953,,,,,,,,,,,"44",144,1743,211953,4964,211953,,1,11,"ef20282536e329682f59aec3b3d7a36364134dbd",0,0,0,0,0,""
20200803,"RI",19246,,190820,,"totalTestEncountersViral",376009,80,2231,14,,5,,,"8/3/2020 12:00","2020-08-03T12:00:00Z","08/03 08:00",1010,2231,1838,"2020-08-03T12:00:00Z",376671,27878,348793,,,,376009,210066,,,,,,,,,,,"44",224,3826,210066,2733,210066,,3,20,"a1c995ea7a076ca3b29aaa8e3cc223dc61a635aa",0,0,0,0,0,""
20200802,"RI",19022,,186994,,"totalTestEncountersViral",373276,76,2211,15,,5,,,"7/31/2020 12:00","2020-07-31T12:00:00Z","07/31 08:00",1007,2211,1823,"2020-07-31T12:00:00Z",365066,27600,337466,,,,373276,206016,,,,,,,,,,,"44",0,0,206016,3974,206016,,0,0,"c2f66c664f88015b5b028ab8dc5e69425a60498f",0,0,0,0,0,""
20200801,"RI",19022,,186994,,"totalTestEncountersViral",369302,76,2211,15,,5,,,"7/31/2020 12:00","2020-07-31T12:00:00Z","07/31 08:00",1007,2211,1823,"2020-07-31T12:00:00Z",365066,27600,337466,,,,369302,206016,,,,,,,,,,,"44",0,0,206016,5176,206016,,0,0,"45514758432690c29db2b33ed73bcec3136b203f",0,0,0,0,0,""
20200731,"RI",19022,,186994,,"totalTestEncountersViral",364126,76,2211,15,,5,,,"7/31/2020 12:00","2020-07-31T12:00:00Z","07/31 08:00",1007,2211,1823,"2020-07-31T12:00:00Z",365066,27600,337466,,,,364126,206016,,,,,,,,,,,"44",72,1425,206016,4031,206016,,0,9,"bd267b86ad3ce18f9189da9a360c97834564c8e9",0,0,0,0,0,""
20200730,"RI",18950,,185569,,"totalTestEncountersViral",360095,77,2202,13,,5,,,"7/30/2020 12:00","2020-07-30T12:00:00Z","07/30 08:00",1007,2202,1813,"2020-07-30T12:00:00Z",360947,27495,333452,,,,360095,204519,,,,,,,,,,,"44",150,1904,204519,4899,204519,,0,7,"2b0549cca31b9f2bdfc57ac8b7880889b7558c3f",0,0,0,0,0,""
20200729,"RI",18800,,183665,,"totalTestEncountersViral",355196,74,2195,12,,6,,,"7/29/2020 12:00","2020-07-29T12:00:00Z","07/29 08:00",1007,2195,1810,"2020-07-29T12:00:00Z",356186,27348,328838,,,,355196,202465,,,,,,,,,,,"44",75,1430,202465,3724,202465,,2,13,"75398b8deb9682ab20ca7c22f5000a79574bfe8d",0,0,0,0,0,""
20200728,"RI",18725,,182235,,"totalTestEncountersViral",351472,68,2182,10,,7,,,"7/28/2020 12:00","2020-07-28T12:00:00Z","07/28 08:00",1005,2182,1803,"2020-07-28T12:00:00Z",352500,27247,325253,,,,351472,200960,,,,,,,,,,,"44",210,4132,200960,4037,200960,,1,8,"62b02f10f1d489500630a1c1ed84b03bb57045d9",0,0,0,0,0,""
20200727,"RI",18515,,178103,,"totalTestEncountersViral",347435,71,2174,8,,6,,,"7/27/2020 12:00","2020-07-27T12:00:00Z","07/27 08:00",1004,2174,1792,"2020-07-27T12:00:00Z",345652,26961,318691,,,,347435,196618,,,,,,,,,,,"44",291,6299,196618,3001,196618,,2,28,"dc6cfd6fad8936275bfedc98062de931355bd986",0,0,0,0,0,""
20200726,"RI",18224,,171804,,"totalTestEncountersViral",344434,66,2146,6,,5,,,"7/24/2020 12:00","2020-07-24T12:00:00Z","07/24 08:00",1002,2146,1769,"2020-07-24T12:00:00Z",329556,26593,302963,,,,344434,190028,,,,,,,,,,,"44",0,0,190028,4371,190028,,0,0,"63aed51fbaca8556a6ad97869aad00efa4272b35",0,0,0,0,0,""
20200725,"RI",18224,,171804,,"totalTestEncountersViral",340063,66,2146,6,,5,,,"7/24/2020 12:00","2020-07-24T12:00:00Z","07/24 08:00",1002,2146,1769,"2020-07-24T12:00:00Z",329556,26593,302963,,,,340063,190028,,,,,,,,,,,"44",0,0,190028,5825,190028,,0,0,"61cb31019f6af34c6401128a3948aee800f41078",0,0,0,0,0,""
20200724,"RI",18224,,171804,,"totalTestEncountersViral",334238,66,2146,6,,5,,,"7/24/2020 12:00","2020-07-24T12:00:00Z","07/24 08:00",1002,2146,1769,"2020-07-24T12:00:00Z",329556,26593,302963,,,,334238,190028,,,,,,,,,,,"44",76,613,190028,4166,190028,,1,9,"fd9e1dc9ecfefdbeb5c15dbfc49c6991016fd361",0,0,0,0,0,""
20200723,"RI",18148,,171191,,"totalTestEncountersViral",330072,67,2137,7,,4,,,"7/23/2020 12:00","2020-07-23T12:00:00Z","07/23 08:00",1001,2137,1759,"2020-07-23T12:00:00Z",325979,26489,299490,,,,330072,189339,,,,,,,,,,,"44",86,2397,189339,3895,189339,,4,10,"f3bfb28e3aaa40baaaea42f4cd4c0445b60ba001",0,0,0,0,0,""
20200722,"RI",18062,,168794,,"totalTestEncountersViral",326177,67,2127,5,,3,,,"7/22/2020 12:00","2020-07-22T12:00:00Z","07/22 08:00",997,2127,1749,"2020-07-22T12:00:00Z",321872,26350,295522,,,,326177,186856,,,,,,,,,,,"44",76,1816,186856,4328,186856,,1,11,"d823baa979a9a2daadef489f2e32e628868aada4",0,0,0,0,0,""
20200721,"RI",17986,,166978,,"totalTestEncountersViral",321849,64,2116,4,,2,,,"7/21/2020 12:00","2020-07-21T12:00:00Z","07/21 08:00",996,2116,1741,"2020-07-21T12:00:00Z",317544,26222,291322,,,,321849,184964,,,,,,,,,,,"44",82,1257,184964,2662,184964,,1,6,"5e6f043870c1ecb2e03d8b7a1b71f5dba7dbac15",0,0,0,0,0,""
20200720,"RI",17904,,165721,,"totalTestEncountersViral",319187,61,2110,2,,2,,,"7/20/2020 12:00","2020-07-20T12:00:00Z","07/20 08:00",995,2110,1738,"2020-07-20T12:00:00Z",315156,26152,289004,,,,319187,183625,,,,,,,,,,,"44",111,4313,183625,2647,183625,,5,22,"3543d13bf71f11369efd520149fcfb8ef043f320",0,0,0,0,0,""
20200719,"RI",17793,,161408,,"totalTestEncountersViral",316540,62,2088,4,,2,,,"7/17/2020 12:00","2020-07-17T12:00:00Z","07/17 08:00",990,2088,1717,"2020-07-17T12:00:00Z",304770,25966,278804,,,,316540,179201,,,,,,,,,,,"44",0,0,179201,3213,179201,,0,0,"46ce3e950ca82edc6535d07520ef11b2b71fac38",0,0,0,0,0,""
20200718,"RI",17793,,161408,,"totalTestEncountersViral",313327,62,2088,4,,2,,,"7/17/2020 12:00","2020-07-17T12:00:00Z","07/17 08:00",990,2088,1717,"2020-07-17T12:00:00Z",304770,25966,278804,,,,313327,179201,,,,,,,,,,,"44",0,0,179201,4259,179201,,0,0,"8b1c88b90069d01c91c872b97313afe4510d59b7",0,0,0,0,0,""
20200717,"RI",17793,,161408,,"totalTestEncountersViral",309068,62,2088,4,,2,,,"7/17/2020 12:00","2020-07-17T12:00:00Z","07/17 08:00",990,2088,1717,"2020-07-17T12:00:00Z",304770,25966,278804,,,,309068,179201,,,,,,,,,,,"44",82,1731,179201,3774,179201,,2,4,"e46c9b3efd65a0a63a4730157349e479cb3a699c",0,0,0,0,0,""
20200716,"RI",17711,,159677,,"totalTestEncountersViral",305294,64,2084,4,,3,,,"7/16/2020 12:00","2020-07-16T12:00:00Z","07/16 08:00",988,2084,1711,"2020-07-16T12:00:00Z",300801,25850,274951,,,,305294,177388,,,,,,,,,,,"44",71,1442,177388,4232,177388,,1,9,"3074a0e6bb478842c7028c8a6db441da914d20b2",0,0,0,0,0,""
20200715,"RI",17640,,158235,,"totalTestEncountersViral",301062,59,2075,5,,3,,,"7/15/2020 12:00","2020-07-15T12:00:00Z","07/15 08:00",987,2075,1707,"2020-07-15T12:00:00Z",296933,25734,271199,,,,301062,175875,,,,,,,,,,,"44",52,1165,175875,3313,175875,,2,5,"bdb1b83073cf890f14fc359513cd8580018c9bdb",0,0,0,0,0,""
20200714,"RI",17588,,157070,,"totalTestEncountersViral",297749,69,2070,5,,3,,,"7/14/2020 12:00","2020-07-14T12:00:00Z","07/14 08:00",985,2070,1692,"2020-07-14T12:00:00Z",293844,25653,268191,,,,297749,174658,,,,,,,,,,,"44",101,1314,174658,3222,174658,,1,4,"7926c5ad1cfe88fd2c34dbab07601abb9fc91c98",0,0,0,0,0,""
20200713,"RI",17487,,155756,,"totalTestEncountersViral",294527,67,2066,3,,4,,,"7/13/2020 12:00","2020-07-13T12:00:00Z","07/13 08:00",984,2066,1691,"2020-07-13T12:00:00Z",290756,25518,265238,,,,294527,173243,,,,,,,,,,,"44",175,6413,173243,1804,173243,,8,15,"e9a74cec79b95be319bf8f8c8c699593be29f6a1",0,0,0,0,0,""
20200712,"RI",17312,,149343,,"totalTestEncountersViral",292723,61,2051,4,,5,,,"7/10/2020 12:00","2020-07-10T12:00:00Z","07/10 08:00",976,2051,1685,"2020-07-10T12:00:00Z",278357,24885,253472,,,,292723,166655,,,,,,,,,,,"44",0,0,166655,2934,166655,,0,0,"47f06c514dec9007c6d950e9877ea4405c95f6b0",0,0,0,0,0,""
20200711,"RI",17312,,149343,,"totalTestEncountersViral",289789,61,2051,4,,5,,,"7/10/2020 12:00","2020-07-10T12:00:00Z","07/10 08:00",976,2051,1685,"2020-07-10T12:00:00Z",278357,24885,253472,,,,289789,166655,,,,,,,,,,,"44",0,0,166655,4507,166655,,0,0,"2a65ba589aecde31a6232d03259fb1d200b682ac",0,0,0,0,0,""
20200710,"RI",17312,,149343,,"totalTestEncountersViral",285282,61,2051,4,,5,,,"7/10/2020 00:00","2020-07-10T00:00:00Z","07/09 20:00",976,2051,1685,"2020-07-10T00:00:00Z",278357,24885,253472,,,,285282,166655,,,,,,,,,,,"44",69,1449,166655,3747,166655,,2,8,"d98f637537280694d090a7af87430d1a1e983330",0,0,0,0,0,""
20200709,"RI",17243,,147894,,"totalTestEncountersViral",281535,55,2043,4,,3,,,"7/9/2020 00:00","2020-07-09T00:00:00Z","07/08 20:00",974,2043,1684,"2020-07-09T00:00:00Z",274980,24790,250190,,,,281535,165137,,,,,,,,,,,"44",39,1828,165137,3477,165137,,3,0,"9ac2ed0116087b0e67012f9584dee45556f81852",0,0,0,0,0,""
20200708,"RI",17204,,146066,,"totalTestEncountersViral",278058,56,2043,5,,5,,,"7/8/2020 00:00","2020-07-08T00:00:00Z","07/07 20:00",971,2043,1683,"2020-07-08T00:00:00Z",271710,24698,247012,,,,278058,163270,,,,,,,,,,,"44",0,0,163270,3513,163270,,2,7,"ddb00093fdb32a66957ef587e732ca92ed33d7ea",0,0,0,0,0,""
20200707,"RI",17204,,146066,,"totalTestEncountersViral",274545,55,2036,4,,4,,,"7/7/2020 03:00","2020-07-07T03:00:00Z","07/06 23:00",969,2036,1677,"2020-07-07T03:00:00Z",271710,24698,247012,,,,274545,163270,,,,,,,,,,,"44",41,1515,163270,2887,163270,,9,17,"29725049c18e0e3691d070b0edad2c52a22744d3",0,0,0,0,0,""
20200706,"RI",17163,,144551,,"totalTestEncountersViral",271658,61,2019,9,,7,,,"7/6/2020 03:00","2020-07-06T03:00:00Z","07/05 23:00",960,2019,1657,"2020-07-06T03:00:00Z",268294,24624,243670,,,,271658,161714,,,,,,,,,,,"44",55,1504,161714,2962,161714,,0,0,"41942302b0d233e4cd0241f3d8ba4074f8dc6d1a",0,0,0,0,0,""
20200705,"RI",17108,,143047,,"totalTestEncountersViral",268696,61,2019,9,,7,,,"7/5/2020 03:00","2020-07-05T03:00:00Z","07/04 23:00",960,2019,1657,"2020-07-05T03:00:00Z",265484,24523,240961,,,,268696,160155,,,,,,,,,,,"44",24,1374,160155,2374,160155,,0,0,"fba1b205b62680f4676c959df8644d57c402bd10",0,0,0,0,0,""
20200704,"RI",17084,,141673,,"totalTestEncountersViral",266322,61,2019,9,,7,,,"7/4/2020 03:00","2020-07-04T03:00:00Z","07/03 23:00",960,2019,1657,"2020-07-04T03:00:00Z",262612,24477,238135,,,,266322,158757,,,,,,,,,,,"44",27,952,158757,2057,158757,,0,0,"88b6318db27b565b64abf304aaf7eea9d1db7d0c",0,0,0,0,0,""
20200703,"RI",17057,,140721,,"totalTestEncountersViral",264265,61,2019,9,,7,,,"7/3/2020 03:00","2020-07-03T03:00:00Z","07/02 23:00",960,2019,1657,"2020-07-03T03:00:00Z",260333,24425,235908,,,,264265,157778,,,,,,,,,,,"44",22,673,157778,2876,157778,,1,8,"a7f8acf22a3724f5fe48e7edcb0d2f1340c4a9f8",0,0,0,0,0,""
20200702,"RI",17035,,140048,,"totalTestEncountersViral",261389,67,2011,11,,10,,,"7/2/2020 03:00","2020-07-02T03:00:00Z","07/01 23:00",959,2011,1644,"2020-07-02T03:00:00Z",258440,24383,234057,,,,261389,157083,,,,,,,,,,,"44",59,985,157083,4238,157083,,3,4,"08f16118a166d834ac421b2e53c243731fdea4d1",0,0,0,0,0,""
20200701,"RI",16976,,139063,,"totalTestEncountersViral",257151,69,2007,11,,11,,,"7/1/2020 03:00","2020-07-01T03:00:00Z","06/30 23:00",956,2007,1638,"2020-07-01T03:00:00Z",255735,24284,231451,,,,257151,156039,,,,,,,,,,,"44",65,1891,156039,1997,156039,,6,6,"1488362db04d6d30f60d2048f9c76f0557fc0508",0,0,0,0,0,""
20200630,"RI",16911,,137172,,"totalTestEncountersViral",255154,74,2001,13,,13,,,"6/30/2020 03:00","2020-06-30T03:00:00Z","06/29 23:00",950,2001,1631,"2020-06-30T03:00:00Z",251636,24143,227493,,,,255154,154083,,,,,,,,,,,"44",40,974,154083,3756,154083,,4,6,"787b53893ece46248a22b25c2a2b3a61a287e34a",0,0,0,0,0,""
20200629,"RI",16871,,136198,,"totalTestEncountersViral",251398,73,1995,15,,14,,,"6/29/2020 03:00","2020-06-29T03:00:00Z","06/28 23:00",946,1995,1627,"2020-06-29T03:00:00Z",249696,24084,225612,,,,251398,153069,,,,,,,,,,,"44",36,1320,153069,1486,153069,,19,11,"c40cebd2638c48643d592265473d7005e3460940",0,0,0,0,0,""
20200628,"RI",16835,,134878,,"totalTestEncountersViral",249912,91,1984,16,,15,,,"6/28/2020 03:00","2020-06-28T03:00:00Z","06/27 23:00",927,1984,1600,"2020-06-28T03:00:00Z",245990,23998,221992,,,,249912,151713,,,,,,,,,,,"44",22,578,151713,3284,151713,,0,0,"66ff33f8e6d06a8fd52ff6e6f7b191d53a720aaa",0,0,0,0,0,""
20200627,"RI",16813,,134300,,"totalTestEncountersViral",246628,91,1984,16,,15,,,"6/27/2020 03:00","2020-06-27T03:00:00Z","06/26 23:00",927,1984,1600,"2020-06-27T03:00:00Z",244518,23961,220557,,,,246628,151113,,,,,,,,,,,"44",36,1198,151113,2537,151113,,0,0,"f8003aef98fc780827e2b45d9f9047557a7f2f92",0,0,0,0,0,""
20200626,"RI",16777,,133102,,"totalTestEncountersViral",244091,91,1984,16,,15,,,"6/26/2020 03:00","2020-06-26T03:00:00Z","06/25 23:00",927,1984,1600,"2020-06-26T03:00:00Z",241245,23877,217368,,,,244091,149879,,,,,,,,,,,"44",69,1314,149879,2971,149879,,7,3,"12277dc555d2d5604be618dd534074d8f75ca58d",0,0,0,0,0,""
20200625,"RI",16708,,131788,,"totalTestEncountersViral",241120,103,1981,18,,17,,,"6/25/2020 03:00","2020-06-25T03:00:00Z","06/24 23:00",920,1981,1588,"2020-06-25T03:00:00Z",238787,23788,214999,,,,241120,148496,,,,,,,,,,,"44",45,1406,148496,3614,148496,,8,14,"7dc1db697214713b688f957156aff8f5bf54514d",0,0,0,0,0,""
20200624,"RI",16663,,130382,,"totalTestEncountersViral",237506,104,1967,20,,16,,,"6/24/2020 03:00","2020-06-24T03:00:00Z","06/23 23:00",912,1967,1573,"2020-06-24T03:00:00Z",235946,23693,212253,,,,237506,147045,,,,,,,,,,,"44",51,1486,147045,3988,147045,,6,9,"73fd317de82951bd37b04d041f3cec8c6bcc1593",0,0,0,0,0,""
20200623,"RI",16612,,128896,,"totalTestEncountersViral",233518,105,1958,19,,17,,,"6/23/2020 03:00","2020-06-23T03:00:00Z","06/22 23:00",906,1958,1562,"2020-06-23T03:00:00Z",232592,23582,209010,,,,233518,145508,,,,,,,,,,,"44",77,1599,145508,3846,145508,,3,8,"f31f3d30de06e5d94f0d6e0bad99def6777bef04",0,0,0,0,0,""
20200622,"RI",16535,,127297,,"totalTestEncountersViral",229672,106,1950,18,,15,,,"6/22/2020 03:00","2020-06-22T03:00:00Z","06/21 23:00",903,1950,1554,"2020-06-22T03:00:00Z",228842,23434,205408,,,,229672,143832,,,,,,,,,,,"44",59,1596,143832,1072,143832,,9,28,"9b843fea6d9572a5f0000c6b6fc656f0b6d0cbad",0,0,0,0,0,""
20200621,"RI",16476,,125701,,"totalTestEncountersViral",228600,123,1922,23,,12,,,"6/21/2020 03:00","2020-06-21T03:00:00Z","06/20 23:00",894,1922,1515,"2020-06-21T03:00:00Z",225158,23298,201860,,,,228600,142177,,,,,,,,,,,"44",27,623,142177,1958,142177,,0,0,"3ed988049e6bf2459c4722ac846fb33567194fbe",0,0,0,0,0,""
20200620,"RI",16449,,125078,,"totalTestEncountersViral",226642,123,1922,23,,12,,,"6/20/2020 03:00","2020-06-20T03:00:00Z","06/19 23:00",894,1922,1515,"2020-06-20T03:00:00Z",224148,23263,200885,,,,226642,141527,,,,,,,,,,,"44",36,681,141527,3899,141527,,0,0,"6502023c94b8032f720bfdc9439d3f92d5e5bedb",0,0,0,0,0,""
20200619,"RI",16413,,124397,,"totalTestEncountersViral",222743,123,1922,23,,12,,,"6/19/2020 03:00","2020-06-19T03:00:00Z","06/18 23:00",894,1922,1515,"2020-06-19T03:00:00Z",222392,23189,199203,,,,222743,140810,,,,,,,,,,,"44",59,1181,140810,3180,140810,,9,11,"1eec18fce77ed35de242180ca5daeb1b82571b95",0,0,0,0,0,""
20200618,"RI",16354,,123216,,"totalTestEncountersViral",219563,126,1911,23,,13,,,"6/18/2020 03:00","2020-06-18T03:00:00Z","06/17 23:00",885,1911,1502,"2020-06-18T03:00:00Z",218832,23058,195774,,,,219563,139570,,,,,,,,,,,"44",71,1219,139570,2941,139570,,9,13,"2dd097dec9f045a9179b28818669cff9b649d0a6",0,0,0,0,0,""
20200617,"RI",16283,,121997,,"totalTestEncountersViral",216622,126,1898,17,,13,,,"6/17/2020 03:00","2020-06-17T03:00:00Z","06/16 23:00",876,1898,1489,"2020-06-17T03:00:00Z",215817,22913,192904,,,,216622,138280,,,,,,,,,,,"44",51,1207,138280,3118,138280,,11,9,"900f7b0e923c959b74f0ea13fad5fd8aa5e17596",0,0,0,0,0,""
20200616,"RI",16232,,120790,,"totalTestEncountersViral",213504,129,1889,16,,13,,,"6/16/2020 03:00","2020-06-16T03:00:00Z","06/15 23:00",865,1889,1479,"2020-06-16T03:00:00Z",213138,22800,190338,,,,213504,137022,,,,,,,,,,,"44",52,1486,137022,3284,137022,,14,7,"c32b62a02d3c55b3683e6f781fa31f68dcd5e17d",0,0,0,0,0,""
20200615,"RI",16180,,119304,,"totalTestEncountersViral",210220,127,1882,21,,14,,,"6/15/2020 03:00","2020-06-15T03:00:00Z","06/14 23:00",851,1882,1474,"2020-06-15T03:00:00Z",210226,22694,187532,,,,210220,135484,,,,,,,,,,,"44",76,1711,135484,2110,135484,,18,29,"191263ee3d9a4f1f81d7c40835119ff1c17f53e4",0,0,0,0,0,""
20200614,"RI",16104,,117593,,"totalTestEncountersViral",208110,141,1853,28,,17,,,"6/14/2020 03:00","2020-06-14T03:00:00Z","06/13 23:00",833,1853,1435,"2020-06-14T03:00:00Z",207085,22514,184571,,,,208110,133697,,,,,,,,,,,"44",32,884,133697,3130,133697,,0,0,"95af1d7b2cb048570b5a918b57f5f69ae1bb824f",0,0,0,0,0,""
20200613,"RI",16072,,116709,,"totalTestEncountersViral",204980,141,1853,28,,17,,,"6/13/2020 03:00","2020-06-13T03:00:00Z","06/12 23:00",833,1853,1435,"2020-06-13T03:00:00Z",205138,22438,182700,,,,204980,132781,,,,,,,,,,,"44",49,1226,132781,4805,132781,,0,0,"ad389455c9fc2c219e8a73b0189bd6dafd3f13c5",0,0,0,0,0,""
20200612,"RI",16023,,115483,,"totalTestEncountersViral",200175,141,1853,28,,17,,,"6/12/2020 03:00","2020-06-12T03:00:00Z","06/11 23:00",833,1853,1435,"2020-06-12T03:00:00Z",202294,22336,179958,,,,200175,131506,,,,,,,,,,,"44",81,2093,131506,3687,131506,,10,11,"d190ea679287d39f6bc879dc1263d32378ba3851",0,0,0,0,0,""
20200611,"RI",15942,,113390,,"totalTestEncountersViral",196488,146,1842,26,,16,,,"6/11/2020 03:00","2020-06-11T03:00:00Z","06/10 23:00",823,1842,1419,"2020-06-11T03:00:00Z",197705,22130,175575,,,,196488,129332,,,,,,,,,,,"44",87,1438,129332,3179,129332,,11,14,"cf7bacf34053f1d17f107f160ae45b354393897a",0,0,0,0,0,""
20200610,"RI",15855,,111952,,"totalTestEncountersViral",193309,148,1828,27,,16,,,"6/10/2020 03:00","2020-06-10T03:00:00Z","06/09 23:00",812,1828,1406,"2020-06-10T03:00:00Z",194137,21937,172200,,,,193309,127807,,,,,,,,,,,"44",104,1364,127807,2890,127807,,4,13,"807b561306d1cb2710e0054feec78472552c4c1c",0,0,0,0,0,""
20200609,"RI",15751,,110588,,"totalTestEncountersViral",190419,144,1815,31,,19,,,"6/9/2020 03:00","2020-06-09T03:00:00Z","06/08 23:00",808,1815,1398,"2020-06-09T03:00:00Z",191076,21735,169341,,,,190419,126339,,,,,,,,,,,"44",68,1164,126339,1966,126339,,9,8,"26aeb7708063d75fa7c603fd0b784345692af1cb",0,0,0,0,0,""
20200608,"RI",15683,,109424,,"totalTestEncountersViral",188453,146,1807,28,,20,,,"6/8/2020 03:00","2020-06-08T03:00:00Z","06/07 23:00",799,1807,1390,"2020-06-08T03:00:00Z",188324,21516,166808,,,,188453,125107,,,,,,,,,,,"44",45,884,125107,1687,125107,,27,32,"2fed5655f0e9203472aaefbfd18a05ab95be56dd",0,0,0,0,0,""
20200607,"RI",15638,,108540,,"totalTestEncountersViral",186766,182,1775,37,,23,,,"6/7/2020 03:00","2020-06-07T03:00:00Z","06/06 23:00",772,1775,1336,"2020-06-07T03:00:00Z",186461,21401,165060,,,,186766,124178,,,,,,,,,,,"44",49,758,124178,2804,124178,,0,0,"c30c5d1550f13abe9b4d79e84d0636eae10d42ee",0,0,0,0,0,""
20200606,"RI",15589,,107782,,"totalTestEncountersViral",183962,182,1775,37,,23,,,"6/6/2020 03:00","2020-06-06T03:00:00Z","06/05 23:00",772,1775,1336,"2020-06-06T03:00:00Z",184803,21324,163479,,,,183962,123371,,,,,,,,,,,"44",68,1126,123371,3727,123371,,0,0,"7f6a7a1cf41fa219c9b8b4e26f0e91ac9da8150d",0,0,0,0,0,""
20200605,"RI",15521,,106656,,"totalTestEncountersViral",180235,182,1775,37,,23,,,"6/5/2020 03:00","2020-06-05T03:00:00Z","06/04 23:00",772,1775,1336,"2020-06-05T03:00:00Z",182000,21126,160874,,,,180235,122177,,,,,,,,,,,"44",105,1520,122177,4734,122177,,16,10,"e86bbbde5ef3ffef9180ccf91f09dacb29c0a5e9",0,0,0,0,0,""
20200604,"RI",15416,,105136,,"totalTestEncountersViral",175501,185,1765,42,,29,,,"6/4/2020 03:00","2020-06-04T03:00:00Z","06/03 23:00",756,1765,1326,"2020-06-04T03:00:00Z",178303,20913,157390,,,,175501,120552,,,,,,,,,,,"44",117,2000,120552,3735,120552,,14,12,"104770a76c25d2f1b518893e93ebbba4f483baff",0,0,0,0,0,""
20200603,"RI",15299,,103136,,"totalTestEncountersViral",171766,189,1753,44,,30,,,"6/3/2020 03:00","2020-06-03T03:00:00Z","06/02 23:00",742,1753,1311,"2020-06-03T03:00:00Z",173576,20639,152937,,,,171766,118435,,,,,,,,,,,"44",105,1624,118435,3298,118435,,10,10,"23b5e59a11d605c53c8a74c902c84f685c0086ec",0,0,0,0,0,""
20200602,"RI",15194,,101512,,"totalTestEncountersViral",168468,188,1743,48,,31,,,"6/2/2020 03:00","2020-06-02T03:00:00Z","06/01 23:00",732,1743,1302,"2020-06-02T03:00:00Z",169876,20386,149490,,,,168468,116706,,,,,,,,,,,"44",107,1400,116706,2994,116706,,12,19,"9239f7efdeb3a439825d1198d6395cd5a11b2bce",0,0,0,0,0,""
20200601,"RI",15087,,100112,,"totalTestEncountersViral",165474,195,1724,46,,29,,,"6/1/2020 03:00","2020-06-01T03:00:00Z","05/31 23:00",720,1724,1281,"2020-06-01T03:00:00Z",166628,20124,146504,,,,165474,115199,,,,,,,,,,,"44",99,1322,115199,1826,115199,,2,23,"80e733d07806e6993bd8a7d2f085c136f67f8107",0,0,0,0,0,""
20200531,"RI",14988,,98790,,"totalTestEncountersViral",163648,206,1701,46,,29,,,"5/31/2020 03:00","2020-05-31T03:00:00Z","05/30 23:00",718,1701,1252,"2020-05-31T03:00:00Z",163692,19922,143770,,,,163648,113778,,,,,,,,,,,"44",76,850,113778,4123,113778,,7,19,"870cafec89b884d2196fc2e52c263820bb8b5ea4",0,0,0,0,0,""
20200530,"RI",14912,,97940,,"totalTestEncountersViral",159525,219,1682,50,,32,,,"5/30/2020 03:00","2020-05-30T03:00:00Z","05/29 23:00",711,1682,1225,"2020-05-30T03:00:00Z",161819,19776,142043,,,,159525,112852,,,,,,,,,,,"44",104,1828,112852,4340,112852,,18,22,"ed582c2080ea09233adcc4a4b8fb1f7e2912f05c",0,0,0,0,0,""
20200529,"RI",14808,,96112,,"totalTestEncountersViral",155185,219,1660,47,,33,,,"5/29/2020 03:00","2020-05-29T03:00:00Z","05/28 23:00",693,1660,1206,"2020-05-29T03:00:00Z",157650,19565,138085,,,,155185,110920,,,,,,,,,,,"44",178,1537,110920,3716,110920,,16,21,"1a9a5996730a47b62413059ee44cc91fbe14394d",0,0,0,0,0,""
20200528,"RI",14630,,94575,,"totalTestEncountersViral",151469,222,1639,53,,36,,,"5/28/2020 03:00","2020-05-28T03:00:00Z","05/27 23:00",677,1639,1186,"2020-05-28T03:00:00Z",153333,19150,134183,,,,151469,109205,,,,,,,,,,,"44",132,1071,109205,2341,109205,,22,15,"bda2ea698ace06afe3fca49254e5f47d2c2e8294",0,0,0,0,0,""
20200527,"RI",14498,,93504,,"totalTestEncountersViral",149128,218,1624,49,,35,,,"5/27/2020 03:00","2020-05-27T03:00:00Z","05/26 23:00",655,1624,1175,"2020-05-27T03:00:00Z",149715,18813,130902,,,,149128,108002,,,,,,,,,,,"44",133,1104,108002,2904,108002,,21,11,"40365f9af7277b349c78af33daca90c7ccff91d7",0,0,0,0,0,""
20200526,"RI",14365,,92400,,"totalTestEncountersViral",146224,226,1613,50,,36,,,"5/26/2020 03:00","2020-05-26T03:00:00Z","05/25 23:00",634,1613,1158,"2020-05-26T03:00:00Z",147388,18541,128847,,,,146224,106765,,,,,,,,,,,"44",154,1726,106765,1519,106765,,26,33,"79ad44a16bdc55606324a4ee7f5f1df9833676f9",0,0,0,0,0,""
20200525,"RI",14211,,90674,,"totalTestEncountersViral",144705,240,1580,49,,32,,,"5/25/2020 03:00","2020-05-25T03:00:00Z","05/24 23:00",608,1580,1119,"2020-05-25T03:00:00Z",144570,18268,126302,,,,144705,104885,,,,,,,,,,,"44",70,750,104885,1521,104885,,0,0,"914e692699d5a8bbfaf59b6574b5c19ffa94eee8",0,0,0,0,0,""
20200524,"RI",14141,,89924,,"totalTestEncountersViral",143184,240,1580,49,,32,,,"5/24/2020 03:00","2020-05-24T03:00:00Z","05/23 23:00",608,1580,1119,"2020-05-24T03:00:00Z",143070,18134,124936,,,,143184,104065,,,,,,,,,,,"44",84,757,104065,2982,104065,,11,23,"768ea9a2ecc0ac68a1f1a2efbf523cf5f5b76d5e",0,0,0,0,0,""
20200523,"RI",14057,,89167,,"totalTestEncountersViral",140202,233,1557,51,,34,,,"5/23/2020 03:00","2020-05-23T03:00:00Z","05/22 23:00",597,1557,1106,"2020-05-23T03:00:00Z",141567,17983,123584,,,,140202,103224,,,,,,,,,,,"44",108,1317,103224,3510,103224,,18,20,"3e5b752b766802295fb0867941277ff398d39330",0,0,0,0,0,""
20200522,"RI",13949,,87850,,"totalTestEncountersViral",136692,242,1537,56,,40,,,"5/22/2020 03:00","2020-05-22T03:00:00Z","05/21 23:00",579,1537,1084,"2020-05-22T03:00:00Z",138609,17749,120860,,,,136692,101799,,,,,,,,,,,"44",201,1451,101799,4131,101799,,23,31,"ae25c6662158156943f5e168f1ad51d939a43d7f",0,0,0,0,0,""
20200521,"RI",13748,,86399,,"totalTestEncountersViral",132561,254,1506,56,,41,,,"5/21/2020 03:00","2020-05-21T03:00:00Z","05/20 23:00",556,1506,1047,"2020-05-21T03:00:00Z",135291,17405,117886,,,,132561,100147,,,,,,,,,,,"44",169,1939,100147,3096,100147,,18,20,"f68f56c712363401ebae45ac5f9db9254c6a8321",0,0,0,0,0,""
20200520,"RI",13579,,84460,,"totalTestEncountersViral",129465,257,1486,58,,45,,,"5/20/2020 03:00","2020-05-20T03:00:00Z","05/19 23:00",538,1486,1030,"2020-05-20T03:00:00Z",131182,17041,114141,,,,129465,98039,,,,,,,,,,,"44",187,1525,98039,3583,98039,,6,22,"a549b82e7cc79315f4ec530f8afdda905e4d6733",0,0,0,0,0,""
20200519,"RI",13392,,82935,,"totalTestEncountersViral",125882,247,1464,59,,44,,,"5/19/2020 03:00","2020-05-19T03:00:00Z","05/18 23:00",532,1464,1023,"2020-05-19T03:00:00Z",128104,16721,111383,,,,125882,96327,,,,,,,,,,,"44",215,1878,96327,2251,96327,,26,26,"e01317f90473cbbe2c7ad6bf06673c851a834096",0,0,0,0,0,""
20200518,"RI",13177,,81057,,"totalTestEncountersViral",123631,236,1438,62,,46,,,"5/18/2020 03:00","2020-05-18T03:00:00Z","05/17 23:00",506,1438,1012,"2020-05-18T03:00:00Z",124622,16319,108303,,,,123631,94234,,,,,,,,,,,"44",137,1289,94234,2999,94234,,7,20,"1a49b6ac067089205a5b7ceceefb0327cc4e84f7",0,0,0,0,0,""
20200517,"RI",13040,,79768,,"totalTestEncountersViral",120632,260,1418,64,,45,,,"5/17/2020 03:00","2020-05-17T03:00:00Z","05/16 23:00",499,1418,972,"2020-05-17T03:00:00Z",122492,16095,106397,,,,120632,92808,,,,,,,,,,,"44",125,1537,92808,4590,92808,,10,15,"6a3db3db1c34f6fce4bc5ca52a8232b5bf1379bf",0,0,0,0,0,""
20200516,"RI",12915,,78231,,"totalTestEncountersViral",116042,273,1403,66,,44,,,"5/16/2020 03:00","2020-05-16T03:00:00Z","05/15 23:00",489,1403,947,"2020-05-16T03:00:00Z",119564,15872,103692,,,,116042,91146,,,,,,,,,,,"44",252,1764,91146,3839,91146,,10,31,"2d752c7306c048c8b47f8b6b4267d0908379abfd",0,0,0,0,0,""
20200515,"RI",12663,,76467,,"totalTestEncountersViral",112203,272,1372,63,,41,,,"5/15/2020 03:00","2020-05-15T03:00:00Z","05/14 23:00",479,1372,919,"2020-05-15T03:00:00Z",115270,15453,99817,,,,112203,89130,,,,,,,,,,,"44",232,1700,89130,3737,89130,,11,21,"738230ea6006d30169d4d7a347dd99bff8386e9b",0,0,0,0,0,""
20200514,"RI",12431,,74767,,"totalTestEncountersViral",108466,271,1351,65,,42,,,"5/14/2020 03:00","2020-05-14T03:00:00Z","05/13 23:00",468,1351,903,"2020-05-14T03:00:00Z",111593,15089,96504,,,,108466,87198,,,,,,,,,,,"44",228,1927,87198,3981,87198,,6,23,"ce6d94efc73c7609935b850bdb6aca1c3084ad94",0,0,0,0,0,""
20200513,"RI",12203,,72840,,"totalTestEncountersViral",104485,269,1328,68,,48,,,"5/13/2020 03:00","2020-05-13T03:00:00Z","05/12 23:00",462,1328,886,"2020-05-13T03:00:00Z",107994,14782,93212,,,,104485,85043,,,,,,,,,,,"44",196,1924,85043,2998,85043,,18,21,"b70302db2631fb651b7c7489252d404d4d76338e",0,0,0,0,0,""
20200512,"RI",12007,,70916,,"totalTestEncountersViral",101487,277,1307,72,,53,,,"5/12/2020 03:00","2020-05-12T03:00:00Z","05/11 23:00",444,1307,863,"2020-05-12T03:00:00Z",104134,14437,89697,,,,101487,82923,,,,,,,,,,,"44",219,1551,82923,2114,82923,,14,27,"1408e6c0c1274dcecbdbf3e778c9f558d4974aed",0,0,0,0,0,""
20200511,"RI",11788,,69365,,"totalTestEncountersViral",99373,276,1280,73,,52,,,"5/11/2020 03:00","2020-05-11T03:00:00Z","05/10 23:00",430,1280,841,"2020-05-11T03:00:00Z",101331,14067,87264,,,,99373,81153,,,,,,,,,,,"44",175,1259,81153,2397,81153,,8,29,"c9c96fedbb2f61fbcbd3dbf48f62ede3cec327c0",0,0,0,0,0,""
20200510,"RI",11613,,68106,,"totalTestEncountersViral",96976,283,1251,70,,52,,,"5/10/2020 03:00","2020-05-10T03:00:00Z","05/09 23:00",422,1251,809,"2020-05-10T03:00:00Z",99293,13826,85467,,,,96976,79719,,,,,,,,,,,"44",186,1502,79719,3800,79719,,4,33,"fa539da16e2409d201a9faac3755d159bcb82343",0,0,0,0,0,""
20200509,"RI",11427,,66604,,"totalTestEncountersViral",93176,292,1218,77,,56,,,"5/9/2020 03:00","2020-05-09T03:00:00Z","05/08 23:00",418,1218,772,"2020-05-09T03:00:00Z",96926,13549,83377,,,,93176,78031,,,,,,,,,,,"44",286,2266,78031,2957,78031,,19,31,"4ef56a7b3f7e79a524e23f73d0cfbfb4946de9a0",0,0,0,0,0,""
20200508,"RI",11141,,64338,,"totalTestEncountersViral",90219,312,1187,71,,52,,,"5/8/2020 03:00","2020-05-08T03:00:00Z","05/07 23:00",399,1187,730,"2020-05-08T03:00:00Z",93190,13103,80087,,,,90219,75479,,,,,,,,,,,"44",231,1691,75479,3394,75479,,11,34,"c9e53d1287be7cbd335551c2b36217424c8c6fb9",0,0,0,0,0,""
20200507,"RI",10910,,62647,,"totalTestEncountersViral",86825,318,1153,82,,56,,,"5/7/2020 03:00","2020-05-07T03:00:00Z","05/06 23:00",388,1153,696,"2020-05-07T03:00:00Z",90357,12764,77593,,,,86825,73557,,,,,,,,,,,"44",271,1929,73557,3317,73557,,18,30,"3eecd15583f0b6b81e8d3dd34f3099d0b54fbadc",0,0,0,0,0,""
20200506,"RI",10639,,60718,,"totalTestEncountersViral",83508,324,1123,86,,60,,,"5/6/2020 03:00","2020-05-06T03:00:00Z","05/05 23:00",370,1123,665,"2020-05-06T03:00:00Z",87037,12348,74689,,,,83508,71357,,,,,,,,,,,"44",342,1937,71357,3306,71357,,15,31,"ad086faa917777ff0e6581bde689b5552ac8fb85",0,0,0,0,0,""
20200505,"RI",10297,,58781,,"totalTestEncountersViral",80202,327,1092,89,,62,,,"5/5/2020 03:00","2020-05-05T03:00:00Z","05/04 23:00",355,1092,639,"2020-05-05T03:00:00Z",83711,11858,71853,,,,80202,69078,,,,,,,,,,,"44",303,1979,69078,2485,69078,,14,31,"e4d556786f2b63c5c62af0c135a5479a217ea133",0,0,0,0,0,""
20200504,"RI",9994,,56802,,"totalTestEncountersViral",77717,339,1061,84,,61,,,"5/4/2020 03:00","2020-05-04T03:00:00Z","05/03 23:00",341,1061,601,"2020-05-04T03:00:00Z",80398,11423,68975,,,,77717,66796,,,,,,,,,,,"44",291,1569,66796,2443,66796,,21,48,"acbb5cf54195b114d2fcecf12ffa34951c5b84c4",0,0,0,0,0,""
20200503,"RI",9703,,55233,,"totalTestEncountersViral",75274,330,1013,83,,59,,,"5/3/2020 03:00","2020-05-03T03:00:00Z","05/02 23:00",320,1013,565,"2020-05-03T03:00:00Z",77910,11036,66874,,,,75274,64936,,,,,,,,,,,"44",181,1610,64936,2183,64936,,24,36,"d78e68051d73acd7a02a320a1d929780325ac3d3",0,0,0,0,0,""
20200502,"RI",9522,,53623,,"totalTestEncountersViral",73091,333,977,80,,54,,,"5/2/2020 03:00","2020-05-02T03:00:00Z","05/01 23:00",296,977,531,"2020-05-02T03:00:00Z",75458,10752,64706,,,,73091,63145,,,,,,,,,,,"44",189,1295,63145,3540,63145,,17,40,"df70824b0232a38970fbefc71f06e03304ff53d8",0,0,0,0,0,""
20200501,"RI",9333,,52328,,"totalTestEncountersViral",69551,352,937,76,,51,,,"5/1/2020 03:00","2020-05-01T03:00:00Z","04/30 23:00",279,937,485,"2020-05-01T03:00:00Z",73273,10493,62780,,,,69551,61661,,,,,,,,,,,"44",317,2228,61661,3201,61661,,13,41,"a9253cc3be3aacace4ba25c633ed9cbeada865dd",0,0,0,0,0,""
20200430,"RI",9016,,50100,,"totalTestEncountersViral",66350,339,896,85,,54,,,"4/30/2020 03:00","2020-04-30T03:00:00Z","04/29 23:00",266,896,461,"2020-04-30T03:00:00Z",69727,10036,59691,,,,66350,59116,,,,,,,,,,,"44",348,1957,59116,3819,59116,,15,146,"979a89432012bcf11c3415d7bcec132c38e68b37",0,0,0,0,0,""
20200429,"RI",8668,,48143,,"totalTestEncountersViral",62531,269,750,80,,55,,,"4/29/2020 03:00","2020-04-29T03:00:00Z","04/28 23:00",251,750,391,"2020-04-29T03:00:00Z",66523,9604,56919,,,,62531,56811,,,,,,,,,,,"44",372,2454,56811,2673,56811,,12,18,"053f7668d8d2af66b6e6c0a9dfce5b48020a8f1a",0,0,0,0,0,""
20200428,"RI",8296,,45689,,"totalTestEncountersViral",59858,266,732,84,,55,,,"4/28/2020 03:00","2020-04-28T03:00:00Z","04/27 23:00",239,732,466,"2020-04-28T03:00:00Z",62696,9128,53568,,,,59858,53985,,,,,,,,,,,"44",324,1774,53985,1869,53985,,6,14,"88cf26d2c57dd5d008912fb6148ebfdd1d3231b4",0,0,0,0,0,""
20200427,"RI",7972,,43915,,"totalTestEncountersViral",57989,266,718,81,,56,,,"4/27/2020 03:00","2020-04-27T03:00:00Z","04/26 23:00",233,718,452,"2020-04-27T03:00:00Z",60017,8717,51300,,,,57989,51887,,,,,,,,,,,"44",203,1169,51887,2625,51887,,7,27,"7f4418a84656092212320cdbc95f3cf144f14a1e",0,0,0,0,0,""
20200426,"RI",7769,,42746,,"totalTestEncountersViral",55364,258,691,78,,53,,,"4/26/2020 03:00","2020-04-26T03:00:00Z","04/25 23:00",226,691,433,"2020-04-26T03:00:00Z",58143,8467,49676,,,,55364,50515,,,,,,,,,,,"44",276,1886,50515,2599,50515,,11,115,"551a3173931e345c3ee7d8bb6f681ac8016700cd",0,0,0,0,0,""
20200425,"RI",7493,,40860,,"totalTestEncountersViral",52765,263,576,77,,52,,,"4/25/2020 03:00","2020-04-25T03:00:00Z","04/24 23:00",215,576,410,"2020-04-25T03:00:00Z",55513,8151,47362,,,,52765,48353,,,,,,,,,,,"44",305,1789,48353,3775,48353,,13,0,"d92ac782cf45f43cfc6d45c770a9e3bc4c0ba664",0,0,0,0,0,""
