"date","state","positive","probableCases","negative","pending","totalTestResultsSource","totalTestResults","hospitalizedCurrently","hospitalizedCumulative","inIcuCurrently","inIcuCumulative","onVentilatorCurrently","onVentilatorCumulative","recovered","lastUpdateEt","dateModified","checkTimeEt","death","hospitalized","hospitalizedDischarged","dateChecked","totalTestsViral","positiveTestsViral","negativeTestsViral","positiveCasesViral","deathConfirmed","deathProbable","totalTestEncountersViral","totalTestsPeopleViral","totalTestsAntibody","positiveTestsAntibody","negativeTestsAntibody","totalTestsPeopleAntibody","positiveTestsPeopleAntibody","negativeTestsPeopleAntibody","totalTestsPeopleAntigen","positiveTestsPeopleAntigen","totalTestsAntigen","positiveTestsAntigen","fips","positiveIncrease","negativeIncrease","total","totalTestResultsIncrease","posNeg","dataQualityGrade","deathIncrease","hospitalizedIncrease","hash","commercialScore","negativeRegularScore","negativeScore","positiveScore","score","grade"
20210307,"UT",374850,,1560293,,"totalTestsViral",2910121,212,14891,73,2344,,822,358958,"3/7/2021 09:35","2021-03-07T09:35:00Z","03/07 04:35",1976,14891,,"2021-03-07T09:35:00Z",2910121,345990,2564131,,,,,1876802,,,,,,,371319,57683,1002177,60158,"49",412,3204,1935143,6828,1935143,,1,24,"d759cc6bb12e652ba45ca3a0dbd31f3b951eae34",0,0,0,0,0,""
20210306,"UT",374438,,1557089,,"totalTestsViral",2903293,216,14867,77,2344,,822,358249,"3/6/2021 09:37","2021-03-06T09:37:00Z","03/06 04:37",1975,14867,,"2021-03-06T09:37:00Z",2903293,345677,2557616,,,,,1873342,,,,,,,370352,57529,1000187,60002,"49",570,3556,1931527,8211,1931527,,5,26,"db25fac46c2c2b795d3d7b794655b8bb4e6e67d9",0,0,0,0,0,""
20210305,"UT",373868,,1553533,,"totalTestsViral",2895082,238,14841,85,2339,,820,357312,"3/5/2021 09:18","2021-03-05T09:18:00Z","03/05 04:18",1970,14841,,"2021-03-05T09:18:00Z",2895082,345264,2549818,,,,,1869438,,,,,,,367204,57308,989804,59774,"49",1160,3773,1927401,8713,1927401,,15,58,"4eae079aeae22d02461a6f281cbe686a90aebc97",0,0,0,0,0,""
20210304,"UT",372708,,1549760,,"totalTestsViral",2886369,247,14783,92,2331,,818,355033,"3/3/2021 09:08","2021-03-03T09:08:00Z","03/03 04:08",1955,14783,,"2021-03-03T09:08:00Z",2886369,344845,2541524,,,,,1865313,,,,,,,364728,57124,981583,59586,"49",0,4202,1922468,10193,1922468,,0,0,"5360af74c652fda7029b4b3362fe1b5e17f21631",0,0,0,0,0,""
20210303,"UT",372708,,1545558,,"totalTestsViral",2876176,247,14783,92,2331,,818,355033,"3/3/2021 09:08","2021-03-03T09:08:00Z","03/03 04:08",1955,14783,,"2021-03-03T09:08:00Z",2876176,344317,2531859,,,,,1860677,,,,,,,362078,56948,973413,59406,"49",729,4413,1918266,10703,1918266,,6,30,"6e8905313551624f76126c4377b55f8254a2b287",0,0,0,0,0,""
20210302,"UT",371979,,1541145,,"totalTestsViral",2865473,237,14753,92,2324,,818,353737,"3/2/2021 09:39","2021-03-02T09:39:00Z","03/02 04:39",1949,14753,,"2021-03-02T09:39:00Z",2865473,343810,2521663,,,,,1855832,,,,,,,358674,56633,962849,59080,"49",487,3142,1913124,6285,1913124,,9,29,"9782156f28540ba2b6e00305d5749949e031f82d",0,0,0,0,0,""
20210301,"UT",371492,,1538003,,"totalTestsViral",2859188,238,14724,89,2309,,813,352814,"3/1/2021 10:46","2021-03-01T10:46:00Z","03/01 05:46",1940,14724,,"2021-03-01T10:46:00Z",2859188,343473,2515715,,,,,1852407,,,,,,,356517,56440,954594,58884,"49",257,2400,1909495,5273,1909495,,5,29,"727abb561fc69b651a2d40d1494947d3eb526e49",0,0,0,0,0,""
20210228,"UT",371235,,1535603,,"totalTestsViral",2853915,230,14695,84,2308,,813,352303,"2/28/2021 09:00","2021-02-28T09:00:00Z","02/28 04:00",1935,14695,,"2021-02-28T09:00:00Z",2853915,343189,2510726,,,,,1849765,,,,,,,356026,56419,953350,58863,"49",465,3044,1906838,6209,1906838,,6,31,"18621699551b50af4c8159a7f9185d4626a25a8f",0,0,0,0,0,""
20210227,"UT",370770,,1532559,,"totalTestsViral",2847706,252,14664,89,2308,,813,351396,"2/27/2021 10:41","2021-02-27T10:41:00Z","02/27 05:41",1929,14664,,"2021-02-27T10:41:00Z",2847706,342802,2504904,,,,,1846405,,,,,,,355021,56300,951137,58739,"49",686,3465,1903329,8715,1903329,,22,36,"be3dff3de0dac7b42fb0d50a8fa8476740e95d76",0,0,0,0,0,""
20210226,"UT",370084,,1529094,,"totalTestsViral",2838991,254,14628,94,2303,,811,350198,"2/26/2021 11:08","2021-02-26T11:08:00Z","02/26 06:08",1907,14628,,"2021-02-26T11:08:00Z",2838991,342295,2496696,,,,,1842550,,,,,,,352124,56004,942128,58434,"49",651,3536,1899178,9086,1899178,,17,31,"124bf83223b11ea739a9ee173f88ba6b07226acb",0,0,0,0,0,""
20210225,"UT",369433,,1525558,,"totalTestsViral",2829905,248,14597,87,2295,,810,348982,"2/25/2021 10:05","2021-02-25T10:05:00Z","02/25 05:05",1890,14597,,"2021-02-25T10:05:00Z",2829905,341734,2488171,,,,,1838541,,,,,,,350635,55884,935615,58304,"49",832,4183,1894991,10605,1894991,,11,43,"3203aba133fb7b9871c5e6b27ed5ff21094c9239",0,0,0,0,0,""
20210224,"UT",368601,,1521375,,"totalTestsViral",2819300,252,14554,91,2288,,807,347721,"2/24/2021 09:34","2021-02-24T09:34:00Z","02/24 04:34",1879,14554,,"2021-02-24T09:34:00Z",2819300,341007,2478293,,,,,1833776,,,,,,,346818,55574,925044,57982,"49",812,4362,1889976,9940,1889976,,14,34,"74fd79922a1bc3639cc973ee08018751aafb9803",0,0,0,0,0,""
20210223,"UT",367789,,1517013,,"totalTestsViral",2809360,271,14520,95,2280,,801,346157,"2/23/2021 09:23","2021-02-23T09:23:00Z","02/23 04:23",1865,14520,,"2021-02-23T09:23:00Z",2809360,340401,2468959,,,,,1828894,,,,,,,344069,55291,915595,57692,"49",716,3273,1884802,8242,1884802,,12,54,"9afe81140cd13ffa990734eb94552fb74fb0f84d",0,0,0,0,0,""
20210222,"UT",367073,,1513740,,"totalTestsViral",2801118,265,14466,99,2270,,796,344965,"2/22/2021 09:10","2021-02-22T09:10:00Z","02/22 04:10",1853,14466,,"2021-02-22T09:10:00Z",2801118,339861,2461257,,,,,1825158,,,,,,,341347,55010,905357,57399,"49",338,2330,1880813,4774,1880813,,1,21,"298718b2864148bba68d3877c1129a031a0244fb",0,0,0,0,0,""
20210221,"UT",366735,,1511410,,"totalTestsViral",2796344,263,14445,100,2269,,796,344387,"2/21/2021 10:25","2021-02-21T10:25:00Z","02/21 05:25",1852,14445,,"2021-02-21T10:25:00Z",2796344,339548,2456796,,,,,1822541,,,,,,,341072,54964,904200,57347,"49",701,3535,1878145,7462,1878145,,10,24,"0d1069eb56d68c9c363d8c9fe91426b4c3caee1d",0,0,0,0,0,""
20210220,"UT",366034,,1507875,,"totalTestsViral",2788882,260,14421,99,2269,,796,343202,"2/20/2021 10:40","2021-02-20T10:40:00Z","02/20 05:40",1842,14421,,"2021-02-20T10:40:00Z",2788882,338973,2449909,,,,,1818506,,,,,,,339630,54796,901208,57171,"49",778,3531,1873909,8812,1873909,,8,39,"70f3e22ea3d10f99d5f3c09c55ba95fa1b8aaabb",0,0,0,0,0,""
20210219,"UT",365256,,1504344,,"totalTestsViral",2780070,276,14382,103,2265,,793,341731,"2/19/2021 09:53","2021-02-19T09:53:00Z","02/19 04:53",1834,14382,,"2021-02-19T09:53:00Z",2780070,338365,2441705,,,,,1814457,,,,,,,336787,54511,890374,56874,"49",857,3345,1869600,7950,1869600,,21,39,"5ab6c56e6a7ff95af1b81f74055191df7ebaf1b7",0,0,0,0,0,""
20210218,"UT",364399,,1500999,,"totalTestsViral",2772120,291,14343,105,2255,,788,340227,"2/18/2021 10:18","2021-02-18T10:18:00Z","02/18 05:18",1813,14343,,"2021-02-18T10:18:00Z",2772120,337751,2434369,,,,,1810571,,,,,,,334138,54230,880328,56587,"49",1151,4502,1865398,11992,1865398,,7,49,"dfcdbe314d6a3e88858c01fe80ff67be155d8b2b",0,0,0,0,0,""
20210217,"UT",363248,,1496497,,"totalTestsViral",2760128,290,14294,99,2248,,784,338469,"2/17/2021 10:11","2021-02-17T10:11:00Z","02/17 05:11",1806,14294,,"2021-02-17T10:11:00Z",2760128,336849,2423279,,,,,1805277,,,,,,,331311,53890,871265,56228,"49",901,3812,1859745,9213,1859745,,9,55,"667d9c27b84fcad4ca43c57a63b45e1d0ffacb4d",0,0,0,0,0,""
20210216,"UT",362347,,1492685,,"totalTestsViral",2750915,297,14239,106,2231,,779,336460,"2/16/2021 09:22","2021-02-16T09:22:00Z","02/16 04:22",1797,14239,,"2021-02-16T09:22:00Z",2750915,336151,2414764,,,,,1800842,,,,,,,328683,53598,860192,55929,"49",591,2278,1855032,5681,1855032,,1,30,"586ff15f2a55d4a3d03874226355915d29ce11a4",0,0,0,0,0,""
20210215,"UT",361756,,1490407,,"totalTestsViral",2745234,298,14209,104,2228,,778,335049,"2/15/2021 09:56","2021-02-15T09:56:00Z","02/15 04:56",1796,14209,,"2021-02-15T09:56:00Z",2745234,335696,2409538,,,,,1798157,,,,,,,327353,53353,855888,55672,"49",462,2588,1852163,5736,1852163,,2,20,"e13116d3ae5ccb96c886992531d80c304352c83f",0,0,0,0,0,""
20210214,"UT",361294,,1487819,,"totalTestsViral",2739498,307,14189,111,2227,,777,334201,"2/14/2021 10:32","2021-02-14T10:32:00Z","02/14 05:32",1794,14189,,"2021-02-14T10:32:00Z",2739498,335235,2404263,,,,,1795160,,,,,,,327037,53295,854980,55612,"49",710,2986,1849113,6690,1849113,,4,38,"b6c45281c009cca959472e4de9828b27f652de67",0,0,0,0,0,""
20210213,"UT",360584,,1484833,,"totalTestsViral",2732808,333,14151,116,2225,,776,332702,"2/13/2021 10:22","2021-02-13T10:22:00Z","02/13 05:22",1790,14151,,"2021-02-13T10:22:00Z",2732808,334688,2398120,,,,,1791707,,,,,,,325855,53095,851984,55400,"49",943,3591,1845417,9475,1845417,,5,48,"4b22384633f225d24f27f60f0d7468be65f31468",0,0,0,0,0,""
20210212,"UT",359641,,1481242,,"totalTestsViral",2723333,345,14103,118,2217,,770,330949,"2/12/2021 09:56","2021-02-12T09:56:00Z","02/12 04:56",1785,14103,,"2021-02-12T09:56:00Z",2723333,333961,2389372,,,,,1787484,,,,,,,323275,52778,843226,55066,"49",1060,4175,1840883,11135,1840883,,11,49,"564b076a717368db9d7b56548eba106c416ba247",0,0,0,0,0,""
20210211,"UT",358581,,1477067,,"totalTestsViral",2712198,363,14054,128,2212,,766,328315,"2/11/2021 10:23","2021-02-11T10:23:00Z","02/11 05:23",1774,14054,,"2021-02-11T10:23:00Z",2712198,333108,2379090,,,,,1782562,,,,,,,321054,52517,834266,54791,"49",1242,4998,1835648,11904,1835648,,9,47,"b225ccb6b0a6e3f369cadeeff414e10b44cf5110",0,0,0,0,0,""
20210210,"UT",357339,,1472069,,"totalTestsViral",2700294,365,14007,131,2202,,763,326237,"2/10/2021 10:10","2021-02-10T10:10:00Z","02/10 05:10",1765,14007,,"2021-02-10T10:10:00Z",2700294,332097,2368197,,,,,1776684,,,,,,,318125,52127,821952,54383,"49",1299,4527,1829408,11452,1829408,,17,57,"f1575b9d33d7754c1046900280f58f525d5795ad",0,0,0,0,0,""
20210209,"UT",356040,,1467542,,"totalTestsViral",2688842,359,13950,124,2194,,754,324102,"2/9/2021 07:38","2021-02-09T07:38:00Z","02/09 02:38",1748,13950,,"2021-02-09T07:38:00Z",2688842,331123,2357719,,,,,1771304,,,,,,,314517,51649,810070,53886,"49",918,2054,1823582,5426,1823582,,10,61,"61f1cfd4362c13b9d35630f89f93b46d92b5c965",0,0,0,0,0,""
20210208,"UT",355122,,1465488,,"totalTestsViral",2683416,353,13889,112,2173,,751,322825,"2/8/2021 10:24","2021-02-08T10:24:00Z","02/08 05:24",1738,13889,,"2021-02-08T10:24:00Z",2683416,330568,2352848,,,,,1768780,,,,,,,310908,51223,797087,53450,"49",514,2943,1820610,6337,1820610,,2,27,"9c348807c1f4de896ad1d24eedd4c2cb6f112d7e",0,0,0,0,0,""
20210207,"UT",354608,,1462545,,"totalTestsViral",2677079,391,13862,120,2170,,750,321756,"2/7/2021 11:08","2021-02-07T11:08:00Z","02/07 06:08",1736,13862,,"2021-02-07T11:08:00Z",2677079,330053,2347026,,,,,1765389,,,,,,,310646,51166,796208,53389,"49",908,3620,1817153,8083,1817153,,3,34,"04b2f9d9d81cee7e450808ae78b9dd1ea890ad23",0,0,0,0,0,""
20210206,"UT",353700,,1458925,,"totalTestsViral",2668996,419,13828,123,2169,,749,320182,"2/6/2021 10:49","2021-02-06T10:49:00Z","02/06 05:49",1733,13828,,"2021-02-06T10:49:00Z",2668996,329346,2339650,,,,,1761163,,,,,,,309027,50920,792696,53132,"49",1211,4274,1812625,10924,1812625,,5,73,"549beefae80a30354fb6fb9b7ee5d19e185cb16d",0,0,0,0,0,""
20210205,"UT",352489,,1454651,,"totalTestsViral",2658072,433,13755,117,2162,,742,318034,"2/5/2021 10:33","2021-02-05T10:33:00Z","02/05 05:33",1728,13755,,"2021-02-05T10:33:00Z",2658072,328346,2329726,,,,,1756019,,,,,,,305907,50560,780098,52754,"49",1216,4057,1807140,11328,1807140,,17,58,"3f2d22b292e9a73013b15b8796e8fe1a31743935",0,0,0,0,0,""
20210204,"UT",351273,,1450594,,"totalTestsViral",2646744,449,13697,125,2158,,742,315614,"2/4/2021 11:02","2021-02-04T11:02:00Z","02/04 06:02",1711,13697,,"2021-02-04T11:02:00Z",2646744,327393,2319351,,,,,1751100,,,,,,,303130,50209,770263,52386,"49",1273,4397,1801867,10759,1801867,,14,49,"7f0e51b944bf5a4a6691ce1791ea2fef85a12e7c",0,0,0,0,0,""
20210203,"UT",350000,,1446197,,"totalTestsViral",2635985,413,13648,119,2146,,736,312872,"2/3/2021 10:03","2021-02-03T10:03:00Z","02/03 05:03",1697,13648,,"2021-02-03T10:03:00Z",2635985,326398,2309587,,,,,1745845,,,,,,,298966,49806,757818,51959,"49",1591,4767,1796197,12545,1796197,,12,72,"07c484b679e47d3d143f727c0221685a924774e1",0,0,0,0,0,""
20210202,"UT",348409,,1441430,,"totalTestsViral",2623440,485,13576,130,2136,,734,309977,"2/2/2021 09:30","2021-02-02T09:30:00Z","02/02 04:30",1685,13576,,"2021-02-02T09:30:00Z",2623440,325159,2298281,,,,,1739975,,,,,,,295687,49315,746132,51451,"49",1201,3224,1789839,9622,1789839,,17,61,"09930ec0b3c235b1ea2a4b3c7dea32d7a5fa71c4",0,0,0,0,0,""
20210201,"UT",347208,,1438206,,"totalTestsViral",2613818,488,13515,129,2115,,731,307848,"2/1/2021 10:43","2021-02-01T10:43:00Z","02/01 05:43",1668,13515,,"2021-02-01T10:43:00Z",2613818,324317,2289501,,,,,1736035,,,,,,,292128,48785,733183,50888,"49",584,2738,1785414,6460,1785414,,3,47,"4d05395dde6f5e95081d3cea9a4d47bea2fea107",0,0,0,0,0,""
20210131,"UT",346624,,1435468,,"totalTestsViral",2607358,519,13468,131,2114,,731,306385,"1/31/2021 09:16","2021-01-31T09:16:00Z","01/31 04:16",1665,13468,,"2021-01-31T09:16:00Z",2607358,323674,2283684,,,,,1732726,,,,,,,291921,48735,732319,50836,"49",1194,3953,1782092,8955,1782092,,2,41,"2e03dbd93915afe17ee0dde58158d18a30a032d5",0,0,0,0,0,""
20210130,"UT",345430,,1431515,,"totalTestsViral",2598403,522,13427,139,2113,,731,304074,"1/30/2021 08:29","2021-01-30T08:29:00Z","01/30 03:29",1663,13427,,"2021-01-30T08:29:00Z",2598403,322722,2275681,,,,,1727999,,,,,,,290176,48395,728412,50479,"49",1468,4642,1776945,12012,1776945,,8,74,"59c3b80bccfdfb80c75360313c6beca375b0cc4b",0,0,0,0,0,""
20210129,"UT",343962,,1426873,,"totalTestsViral",2586391,533,13353,148,2103,,727,301462,"1/29/2021 09:09","2021-01-29T09:09:00Z","01/29 04:09",1655,13353,,"2021-01-29T09:09:00Z",2586391,321527,2264864,,,,,1722308,,,,,,,287099,47918,717995,49984,"49",1517,4886,1770835,12480,1770835,,35,74,"dadb38bc7ff0884127263945eb4d0a46f6070950",0,0,0,0,0,""
20210128,"UT",342445,,1421987,,"totalTestsViral",2573911,536,13279,157,2092,,725,297638,"1/28/2021 10:14","2021-01-28T10:14:00Z","01/28 05:14",1620,13279,,"2021-01-28T10:14:00Z",2573911,320323,2253588,,,,,1716405,,,,,,,283618,47491,708021,49531,"49",1761,5188,1764432,16033,1764432,,0,62,"3a8d33d10666e8ffd1e7641b0801207c8d5203d4",0,0,0,0,0,""
20210127,"UT",340684,,1416799,,"totalTestsViral",2557878,537,13217,161,2082,,719,293030,"1/27/2021 10:09","2021-01-27T10:09:00Z","01/27 05:09",1620,13217,,"2021-01-27T10:09:00Z",2557878,318759,2239119,,,,,1709903,,,,,,,279203,46996,693217,49010,"49",2009,4603,1757483,12865,1757483,,7,80,"775645e0f46546a75b863319b7ae0ade5f98bff8",0,0,0,0,0,""
20210126,"UT",338675,,1412196,,"totalTestsViral",2545013,540,13137,158,2074,,716,289231,"1/26/2021 11:33","2021-01-26T11:33:00Z","01/26 06:33",1613,13137,,"2021-01-26T11:33:00Z",2545013,317211,2227802,,,,,1703950,,,,,,,275000,46462,680933,48458,"49",1411,3212,1750871,8707,1750871,,16,83,"e8916e039827944a6f5125ed62c079b3e0b98b85",0,0,0,0,0,""
20210125,"UT",337264,,1408984,,"totalTestsViral",2536306,528,13054,179,2054,,709,285852,"1/25/2021 10:52","2021-01-25T10:52:00Z","01/25 05:52",1597,13054,,"2021-01-25T10:52:00Z",2536306,316360,2219946,,,,,1699988,,,,,,,269671,45731,666441,47698,"49",859,2796,1746248,6510,1746248,,2,38,"06f46114b5848078e86f5a28e3a0a1b739029e31",0,0,0,0,0,""
20210124,"UT",336405,,1406188,,"totalTestsViral",2529796,523,13016,182,2054,,708,283690,"1/24/2021 10:58","2021-01-24T10:58:00Z","01/24 05:58",1595,13016,,"2021-01-24T10:58:00Z",2529796,315569,2214227,,,,,1696488,,,,,,,268997,45568,664408,47527,"49",1516,4554,1742593,10827,1742593,,13,68,"c016d53dc8aeb506a21163f7ad6b1c95fd75bfb5",0,0,0,0,0,""
20210123,"UT",334889,,1401634,,"totalTestsViral",2518969,548,12948,196,2052,,707,281854,"1/23/2021 10:49","2021-01-23T10:49:00Z","01/23 05:49",1582,12948,,"2021-01-23T10:49:00Z",2518969,314279,2204690,,,,,1690825,,,,,,,267329,45209,660660,47153,"49",1771,2526,1736523,8415,1736523,,11,64,"7a49db1018b17dabfa99a0ea25fcf4450fa7e078",0,0,0,0,0,""
20210122,"UT",333118,,1399108,,"totalTestsViral",2510554,549,12884,192,2044,,698,279908,"1/22/2021 09:02","2021-01-22T09:02:00Z","01/22 04:02",1571,12884,,"2021-01-22T09:02:00Z",2510554,312953,2197601,,,,,1687143,,,,,,,261010,44503,644117,46402,"49",2649,3949,1732226,12392,1732226,,24,81,"78acd02c30b9adc0f63e58e046d2449607febfed",0,0,0,0,0,""
20210121,"UT",330469,,1395159,,"totalTestsViral",2498162,590,12803,209,2028,,694,276793,"1/21/2021 10:26","2021-01-21T10:26:00Z","01/21 05:26",1547,12803,,"2021-01-21T10:26:00Z",2498162,311235,2186927,,,,,1681691,,,,,,,253888,43418,628565,45275,"49",2089,4443,1725628,12686,1725628,,30,74,"5c0c4c096a4c81a2bef3f05c2295f02de740af14",0,0,0,0,0,""
20210120,"UT",328380,,1390716,,"totalTestsViral",2485476,604,12729,210,2023,,687,272113,"1/20/2021 10:06","2021-01-20T10:06:00Z","01/20 05:06",1517,12729,,"2021-01-20T10:06:00Z",2485476,309614,2175862,,,,,1675795,,,,,,,246991,42831,610661,44661,"49",2159,4820,1719096,12579,1719096,,10,84,"da9b1ebecaa7d992c4227a4adbe7bac8d378e02f",0,0,0,0,0,""
20210119,"UT",326221,,1385896,,"totalTestsViral",2472897,638,12645,216,1994,,681,269487,"1/19/2021 09:55","2021-01-19T09:55:00Z","01/19 04:55",1507,12645,,"2021-01-19T09:55:00Z",2472897,307786,2165111,,,,,1669320,,,,,,,242550,42336,596393,44139,"49",1302,2760,1712117,7224,1712117,,7,69,"c4e353a904e4bb014f1155a257dd31d5bd87d31f",0,0,0,0,0,""
20210118,"UT",324919,,1383136,,"totalTestsViral",2465673,619,12576,214,1980,,679,266752,"1/18/2021 11:10","2021-01-18T11:10:00Z","01/18 06:10",1500,12576,,"2021-01-18T11:10:00Z",2465673,306661,2159012,,,,,1665558,,,,,,,241351,42015,591764,43808,"49",1082,2855,1708055,6940,1708055,,7,58,"9093e6ad4ef94d10feb5b8fd54d244547bf3936f",0,0,0,0,0,""
20210117,"UT",323837,,1380281,,"totalTestsViral",2458733,594,12518,226,1980,,679,265051,"1/17/2021 11:21","2021-01-17T11:21:00Z","01/17 06:21",1493,12518,,"2021-01-17T11:21:00Z",2458733,305744,2152989,,,,,1661906,,,,,,,240354,41752,589651,43529,"49",1585,3836,1704118,9859,1704118,,8,66,"b6afeb036e7ed316c5bf106d145adf353a876cfc",0,0,0,0,0,""
20210116,"UT",322252,,1376445,,"totalTestsViral",2448874,627,12452,231,1979,,678,264246,"1/16/2021 11:10","2021-01-16T11:10:00Z","01/16 06:10",1485,12452,,"2021-01-16T11:10:00Z",2448874,304248,2144626,,,,,1656763,,,,,,,238298,41470,584783,43229,"49",2150,4289,1698697,12569,1698697,,13,101,"ff12631d976820d4373823e106a32621b4b46468",0,0,0,0,0,""
20210115,"UT",320102,,1372156,,"totalTestsViral",2436305,635,12351,210,1967,,677,263256,"1/15/2021 09:57","2021-01-15T09:57:00Z","01/15 04:57",1472,12351,,"2021-01-15T09:57:00Z",2436305,302396,2133909,,,,,1650854,,,,,,,233747,41028,571424,42752,"49",2543,5377,1692258,14503,1692258,,12,102,"8e77f4d8f5e867395b409ddd5fee0bb623c647ea",0,0,0,0,0,""
20210114,"UT",317559,,1366779,,"totalTestsViral",2421802,614,12249,194,1957,,675,260728,"1/14/2021 10:58","2021-01-14T10:58:00Z","01/14 05:58",1460,12249,,"2021-01-14T10:58:00Z",2421802,300381,2121421,,,,,1643713,,,,,,,227903,40351,559136,42040,"49",2742,5274,1684338,14810,1684338,,11,89,"e7d8256b698c11d29c5bae69b85507ed30316dd3",0,0,0,0,0,""
20210113,"UT",314817,,1361505,,"totalTestsViral",2406992,612,12160,194,1945,,673,257824,"1/13/2021 10:34","2021-01-13T10:34:00Z","01/13 05:34",1449,12160,,"2021-01-13T10:34:00Z",2406992,298324,2108668,,,,,1636641,,,,,,,218744,39404,538572,41058,"49",5188,4704,1676322,12444,1676322,,27,101,"afcac10b7f9bc15ea3acd5aff5b40ac5da80b6e4",0,0,0,0,0,""
20210112,"UT",309629,,1356801,,"totalTestsViral",2394548,605,12059,187,1933,,668,253415,"1/12/2021 11:36","2021-01-12T11:36:00Z","01/12 06:36",1422,12059,,"2021-01-12T11:36:00Z",2394548,296407,2098141,,,,,1630279,,,,,,,212834,38501,527054,40124,"49",2146,4785,1666430,12698,1666430,,26,119,"ec23431821592188905885d755e60c663083509c",0,0,0,0,0,""
20210111,"UT",307483,,1352016,,"totalTestsViral",2381850,595,11940,194,1909,,664,251170,"1/11/2021 10:49","2021-01-11T10:49:00Z","01/11 05:49",1396,11940,,"2021-01-11T10:49:00Z",2381850,294508,2087342,,,,,1623779,,,,,,,207343,37694,513177,39280,"49",1484,3089,1659499,7852,1659499,,4,74,"dc60b1f475f73b7668ae5e1743e5d07f4bb31cab",0,0,0,0,0,""
20210110,"UT",305999,,1348927,,"totalTestsViral",2373998,588,11866,189,1902,,663,249390,"1/10/2021 10:20","2021-01-10T10:20:00Z","01/10 05:20",1392,11866,,"2021-01-10T10:20:00Z",2373998,293261,2080737,,,,,1619623,,,,,,,206762,37479,511430,39058,"49",2276,5080,1654926,11978,1654926,,2,88,"51ab7b4b534bd4b8884040b94c499533c1110e3b",0,0,0,0,0,""
20210109,"UT",303723,,1343847,,"totalTestsViral",2362020,592,11778,181,1897,,660,247390,"1/9/2021 10:48","2021-01-09T10:48:00Z","01/09 05:48",1390,11778,,"2021-01-09T10:48:00Z",2362020,291253,2070767,,,,,1612742,,,,,,,203587,37009,505422,38567,"49",2613,4665,1647570,12654,1647570,,9,99,"fbfc966a03f6f82207454918a584640c09ec0843",0,0,0,0,0,""
20210108,"UT",301110,,1339182,,"totalTestsViral",2349366,610,11679,196,1889,,657,244990,"1/8/2021 10:19","2021-01-08T10:19:00Z","01/08 05:19",1381,11679,,"2021-01-08T10:19:00Z",2349366,289077,2060289,,,,,1606141,,,,,,,197084,36256,489562,37782,"49",3793,6083,1640292,16979,1640292,,22,101,"355cc53c1c17430ade929d5956c6df996085dee6",0,0,0,0,0,""
20210107,"UT",297317,,1333099,,"totalTestsViral",2332387,594,11578,187,1880,,654,242361,"1/7/2021 09:56","2021-01-07T09:56:00Z","01/07 04:56",1359,11578,,"2021-01-07T09:56:00Z",2332387,285798,2046589,,,,,1597087,,,,,,,193102,35532,480288,37038,"49",4597,6890,1630416,20004,1630416,,29,115,"ee663b4b2d573854396df999ed8e203f5fca7b43",0,0,0,0,0,""
20210106,"UT",292720,,1326209,,"totalTestsViral",2312383,589,11463,192,1866,,651,239203,"1/6/2021 09:40","2021-01-06T09:40:00Z","01/06 04:40",1330,11463,,"2021-01-06T09:40:00Z",2312383,281936,2030447,,,,,1586582,,,,,,,188053,34606,465950,36049,"49",3769,5654,1618929,16987,1618929,,18,107,"6cd071cd51e71885d866da831c4dfa2e2bc0afe6",0,0,0,0,0,""
20210105,"UT",288951,,1320555,,"totalTestsViral",2295396,578,11356,177,1859,,650,236196,"1/5/2021 11:03","2021-01-05T11:03:00Z","01/05 06:03",1312,11356,,"2021-01-05T11:03:00Z",2295396,278646,2016750,,,,,1577868,,,,,,,184310,33769,454560,35188,"49",3318,3579,1609506,10709,1609506,,7,116,"7cd3c0606d5309d0de3e247f3db6a197266f4854",0,0,0,0,0,""
20210104,"UT",285633,,1316976,,"totalTestsViral",2284687,551,11240,167,1837,,647,234298,"1/4/2021 10:34","2021-01-04T10:34:00Z","01/04 05:34",1305,11240,,"2021-01-04T10:34:00Z",2284687,276257,2008430,,,,,1572029,,,,,,,180295,32643,441464,34033,"49",2160,3667,1602609,9849,1602609,,4,81,"be5392bbeee7ccc572b67292082d6757f486f925",0,0,0,0,0,""
20210103,"UT",283473,,1313309,,"totalTestsViral",2274838,548,11159,164,1830,,643,232355,"1/3/2021 09:23","2021-01-03T09:23:00Z","01/03 04:23",1301,11159,,"2021-01-03T09:23:00Z",2274838,274104,2000734,,,,,1566342,,,,,,,179363,32296,439364,33680,"49",1819,2359,1596782,6651,1596782,,7,58,"77e8499397d84bdf89c6daf076f0db83cd5aba47",0,0,0,0,0,""
20210102,"UT",281654,,1310950,,"totalTestsViral",2268187,552,11101,158,1828,,643,230287,"1/2/2021 10:47","2021-01-02T10:47:00Z","01/02 05:47",1294,11101,,"2021-01-02T10:47:00Z",2268187,272594,1995593,,,,,1562560,,,,,,,178343,31944,436906,33317,"49",5042,8459,1592604,22884,1592604,,25,145,"de7907faa00cc8eaccd75c62439145534e18a513",0,0,0,0,0,""
20210101,"UT",276612,,1302491,,"totalTestsViral",2245303,565,10956,158,1824,,641,224439,"12/31/2020 09:56","2020-12-31T09:56:00Z","12/31 04:56",1269,10956,,"2020-12-31T09:56:00Z",2245303,267800,1977503,,,,,1549731,,,,,,,176272,31285,428308,32636,"49",0,0,1579103,0,1579103,,0,0,"bd3a53eca4b9fbaa97a1be7f170d13d23ece6b20",0,0,0,0,0,""
20201231,"UT",276612,,1302491,,"totalTestsViral",2245303,565,10956,158,1824,,641,224439,"12/31/2020 09:56","2020-12-31T09:56:00Z","12/31 04:56",1269,10956,,"2020-12-31T09:56:00Z",2245303,267800,1977503,,,,,1549731,,,,,,,176272,31285,428308,32636,"49",4672,5624,1579103,17418,1579103,,13,83,"32c1130f95125629b78c21d586129ad18f456284",0,0,0,0,0,""
20201230,"UT",271940,,1296867,,"totalTestsViral",2227885,537,10873,156,1813,,633,221055,"12/29/2020 11:42","2020-12-29T11:42:00Z","12/29 06:42",1256,10873,,"2020-12-29T11:42:00Z",2227885,263878,1964007,,,,,1540411,,,,,,,174180,30583,421857,31909,"49",2614,4593,1568807,13816,1568807,,21,110,"c619f37bd42842e01f82589b0bea4befbf614f05",0,0,0,0,0,""
20201229,"UT",269326,,1292274,,"totalTestsViral",2214069,548,10763,164,1806,,631,218522,"12/29/2020 11:42","2020-12-29T11:42:00Z","12/29 06:42",1235,10763,,"2020-12-29T11:42:00Z",2214069,261358,1952711,,,,,1533487,,,,,,,171965,29797,413901,31086,"49",2736,3104,1561600,10464,1561600,,16,120,"561ff16e50f17cfe86e9fb41a30438aa664bc1ce",0,0,0,0,0,""
20201228,"UT",266590,,1289170,,"totalTestsViral",2203605,532,10643,168,1784,,625,216242,"12/28/2020 09:48","2020-12-28T09:48:00Z","12/28 04:48",1219,10643,,"2020-12-28T09:48:00Z",2203605,259264,1944341,,,,,1528455,,,,,,,169650,29033,406081,30293,"49",1716,2948,1555760,7720,1555760,,5,59,"f57c393f6026141ca123af4786a8df3d4a630de6",0,0,0,0,0,""
20201227,"UT",264874,,1286222,,"totalTestsViral",2195885,517,10584,166,1780,,625,214048,"12/27/2020 10:13","2020-12-27T10:13:00Z","12/27 05:13",1214,10584,,"2020-12-27T10:13:00Z",2195885,257710,1938175,,,,,1524098,,,,,,,169031,28800,404456,30042,"49",796,1187,1551096,3261,1551096,,2,62,"c5a00df6155d0210fc6bb4fd58218752d2314944",0,0,0,0,0,""
20201226,"UT",264078,,1285035,,"totalTestsViral",2192624,526,10522,172,1777,,625,211473,"12/26/2020 10:54","2020-12-26T10:54:00Z","12/26 05:54",1212,10522,,"2020-12-26T10:54:00Z",2192624,257164,1935460,,,,,1522432,,,,,,,168034,28402,402138,29632,"49",3489,8447,1549113,20856,1549113,,8,116,"5728cac533374e364d4ad00a178b9c2bcdad93b3",0,0,0,0,0,""
20201225,"UT",260589,,1276588,,"totalTestsViral",2171768,605,10406,180,1776,,623,204844,"12/24/2020 10:24","2020-12-24T10:24:00Z","12/24 05:24",1204,10406,,"2020-12-24T10:24:00Z",2171768,253733,1918035,,,,,1510916,,,,,,,166594,28010,396276,29207,"49",0,0,1537177,0,1537177,,0,0,"1e4f7f0cbb1f44f2b41ff2f6065a25cb7adb0fce",0,0,0,0,0,""
20201224,"UT",260589,,1276588,,"totalTestsViral",2171768,605,10406,180,1776,,623,204844,"12/24/2020 10:24","2020-12-24T10:24:00Z","12/24 05:24",1204,10406,,"2020-12-24T10:24:00Z",2171768,253733,1918035,,,,,1510916,,,,,,,166594,28010,396276,29207,"49",2892,5748,1537177,16060,1537177,,8,79,"67642caaeed0c97fea0e407087ec7a6e7f9e0201",0,0,0,0,0,""
20201223,"UT",257697,,1270840,,"totalTestsViral",2155708,615,10327,198,1765,,620,200943,"12/23/2020 11:27","2020-12-23T11:27:00Z","12/23 06:27",1196,10327,,"2020-12-23T11:27:00Z",2155708,251372,1904336,,,,,1503058,,,,,,,163821,27384,387973,28545,"49",2612,5093,1528537,14387,1528537,,23,109,"5dfbfbe6b513232bfe61ec4f639457a1601f1b0b",0,0,0,0,0,""
20201222,"UT",255085,,1265747,,"totalTestsViral",2141321,586,10218,202,1757,,615,196951,"12/22/2020 11:21","2020-12-22T11:21:00Z","12/22 06:21",1173,10218,,"2020-12-22T11:21:00Z",2141321,249037,1892284,,,,,1495847,,,,,,,161431,26758,379629,27890,"49",2302,4109,1520832,12256,1520832,,12,116,"f21b81401fd815f21fa74d5212989f8cb199fb60",0,0,0,0,0,""
20201221,"UT",252783,,1261638,,"totalTestsViral",2129065,584,10102,195,1725,,609,194475,"12/21/2020 11:03","2020-12-21T11:03:00Z","12/21 06:03",1161,10102,,"2020-12-21T11:03:00Z",2129065,247225,1881840,,,,,1490136,,,,,,,158782,26001,371826,27103,"49",1819,4204,1514421,10039,1514421,,6,63,"b1ca40a369c54fa446f2f1a429b7e262364ba4eb",0,0,0,0,0,""
20201220,"UT",250964,,1257434,,"totalTestsViral",2119026,582,10039,201,1717,,606,192591,"12/20/2020 10:41","2020-12-20T10:41:00Z","12/20 05:41",1155,10039,,"2020-12-20T10:41:00Z",2119026,245523,1873503,,,,,1484399,,,,,,,158160,25780,370473,26863,"49",1994,5876,1508398,13409,1508398,,7,71,"0ab99370bfc6be99a90ded85fad7c463f7f0ef4b",0,0,0,0,0,""
20201219,"UT",248970,,1251558,,"totalTestsViral",2105617,579,9968,218,1715,,605,190873,"12/19/2020 10:29","2020-12-19T10:29:00Z","12/19 05:29",1148,9968,,"2020-12-19T10:29:00Z",2105617,243544,1862073,,,,,1476730,,,,,,,157166,25530,367937,26600,"49",2408,4983,1500528,13923,1500528,,8,85,"323752cd3d13a8dd831127f55ae95bd05acaa2cb",0,0,0,0,0,""
20201218,"UT",246562,,1246575,,"totalTestsViral",2091694,549,9883,206,1707,,605,188846,"12/18/2020 10:27","2020-12-18T10:27:00Z","12/18 05:27",1140,9883,,"2020-12-18T10:27:00Z",2091694,241472,1850222,,,,,1469845,,,,,,,153950,24869,355690,25905,"49",2644,5506,1493137,15499,1493137,,14,92,"f73eaeff48ffc3f2a29d7cc024e753c30cb1743d",0,0,0,0,0,""
20201217,"UT",243918,,1241069,,"totalTestsViral",2076195,571,9791,211,1694,,601,186564,"12/17/2020 10:39","2020-12-17T10:39:00Z","12/17 05:39",1126,9791,,"2020-12-17T10:39:00Z",2076195,239194,1837001,,,,,1462253,,,,,,,150995,24379,346282,25385,"49",3203,6657,1484987,17289,1484987,,30,99,"35b903be4eb10c6f7311ad83bc309f6029e6fbe1",0,0,0,0,0,""
20201216,"UT",240715,,1234412,,"totalTestsViral",2058906,566,9692,210,1686,,598,182744,"12/16/2020 10:20","2020-12-16T10:20:00Z","12/16 05:20",1096,9692,,"2020-12-16T10:20:00Z",2058906,236254,1822652,,,,,1452925,,,,,,,147438,23771,336818,24736,"49",2928,5685,1475127,15526,1475127,,19,107,"d97fa3b025baa9d0f357bc9dbb7b5bca6a091e5b",0,0,0,0,0,""
20201215,"UT",237787,,1228727,,"totalTestsViral",2043380,568,9585,203,1676,,592,181000,"12/15/2020 12:31","2020-12-15T12:31:00Z","12/15 07:31",1077,9585,,"2020-12-15T12:31:00Z",2043380,233866,1809514,,,,,1445032,,,,,,,144823,23226,328234,24171,"49",1915,3533,1466514,10205,1466514,,15,99,"72c8b5502c04d662618ee4dc2f2140e116856b58",0,0,0,0,0,""
20201214,"UT",235872,,1225194,,"totalTestsViral",2033175,580,9486,211,1641,,585,178395,"12/14/2020 10:54","2020-12-14T10:54:00Z","12/14 05:54",1062,9486,,"2020-12-14T10:54:00Z",2033175,232350,1800825,,,,,1440141,,,,,,,140702,22396,317182,23304,"49",1968,3779,1461066,8840,1461066,,7,65,"e7868683089c6feddb9b7065d496e09519501ab4",0,0,0,0,0,""
20201213,"UT",233904,,1221415,,"totalTestsViral",2024335,558,9421,215,1636,,581,176211,"12/13/2020 10:57","2020-12-13T10:57:00Z","12/13 05:57",1055,9421,,"2020-12-13T10:57:00Z",2024335,230811,1793524,,,,,1434966,,,,,,,140256,22296,316236,23198,"49",2083,6286,1455319,14580,1455319,,17,70,"17be383c5335742e19bfc38330a12398b815b952",0,0,0,0,0,""
20201212,"UT",231821,,1215129,,"totalTestsViral",2009755,562,9351,211,1630,,580,172960,"12/12/2020 10:57","2020-12-12T10:57:00Z","12/12 05:57",1038,9351,,"2020-12-12T10:57:00Z",2009755,228471,1781284,,,,,1426554,,,,,,,139000,22031,313025,22925,"49",3692,7205,1446950,17966,1446950,,13,82,"2046cc6b7a116ccaeeaf4278a192698ea1c48090",0,0,0,0,0,""
20201211,"UT",228129,,1207924,,"totalTestsViral",1991789,586,9269,213,1620,,577,169622,"12/11/2020 09:55","2020-12-11T09:55:00Z","12/11 04:55",1025,9269,,"2020-12-11T09:55:00Z",1991789,225628,1766161,,,,,1416743,,,,,,,134195,21343,299867,22201,"49",2183,5897,1436053,14986,1436053,,9,82,"2b376219a7edb46206d652bfd6fd7e8f2852f0d7",0,0,0,0,0,""
20201210,"UT",225946,,1202027,,"totalTestsViral",1976803,568,9187,220,1604,,573,165042,"12/10/2020 09:57","2020-12-10T09:57:00Z","12/10 04:57",1016,9187,,"2020-12-10T09:57:00Z",1976803,223125,1753678,,,,,1408592,,,,,,,131011,20837,293750,21680,"49",3401,6679,1427973,16912,1427973,,21,82,"8c4857c857c26b94d87cdb8e1273e58e07ec8d0b",0,0,0,0,0,""
20201209,"UT",222545,,1195348,,"totalTestsViral",1959891,592,9105,223,1586,,570,161077,"12/9/2020 10:18","2020-12-09T10:18:00Z","12/09 05:18",995,9105,,"2020-12-09T10:18:00Z",1959891,220042,1739849,,,,,1399051,,,,,,,124939,20351,282991,21178,"49",2574,5956,1417893,15406,1417893,,23,102,"a6a0f1cefb87a3b87065351f995bc398ee09abe7",0,0,0,0,0,""
20201208,"UT",219971,,1189392,,"totalTestsViral",1944485,588,9003,220,1576,,567,158119,"12/8/2020 11:23","2020-12-08T11:23:00Z","12/08 06:23",972,9003,,"2020-12-08T11:23:00Z",1944485,217772,1726713,,,,,1391020,,,,,,,121788,19903,274881,20701,"49",2333,3927,1409363,10931,1409363,,23,107,"aef58d669e83e6d2eb9fbf9bf7c2ab4c460a6682",0,0,0,0,0,""
20201207,"UT",217638,,1185465,,"totalTestsViral",1933554,592,8896,215,1552,,558,154983,"12/7/2020 09:54","2020-12-07T09:54:00Z","12/07 04:54",949,8896,,"2020-12-07T09:54:00Z",1933554,215842,1717712,,,,,1385303,,,,,,,117599,19158,264453,19925,"49",2231,5144,1403103,11318,1403103,,10,74,"013eae410b656e2e65c539e5594fcbf877f6fe25",0,0,0,0,0,""
20201206,"UT",215407,,1180321,,"totalTestsViral",1922236,605,8822,213,1548,,558,153027,"12/6/2020 10:15","2020-12-06T10:15:00Z","12/06 05:15",939,8822,,"2020-12-06T10:15:00Z",1922236,213797,1708439,,,,,1378264,,,,,,,117087,18930,263379,19688,"49",2563,6450,1395728,14448,1395728,,0,57,"867320d491f6bcefd5030f5baeda45bbfc9eea76",0,0,0,0,0,""
20201205,"UT",212844,,1173871,,"totalTestsViral",1907788,611,8765,212,1544,,557,150405,"12/5/2020 11:18","2020-12-05T11:18:00Z","12/05 06:18",939,8765,,"2020-12-05T11:18:00Z",1907788,211276,1696512,,,,,1369526,,,,,,,116285,18736,261279,19485,"49",3674,8539,1386715,20132,1386715,,14,113,"f950ce8efa30b7cf796166b68495cff439e693a5",0,0,0,0,0,""
20201204,"UT",209170,,1165332,,"totalTestsViral",1887656,603,8652,203,1528,,550,146320,"12/4/2020 10:00","2020-12-04T10:00:00Z","12/04 05:00",925,8652,,"2020-12-04T10:00:00Z",1887656,207685,1679971,,,,,1357711,,,,,,,113262,18140,252295,18865,"49",3005,9606,1374502,21599,1374502,,8,104,"5cf86cd71651da5938d26f55f21c870d7c871434",0,0,0,0,0,""
20201203,"UT",206165,,1155726,,"totalTestsViral",1866057,609,8548,209,1517,,544,142939,"12/3/2020 10:12","2020-12-03T10:12:00Z","12/03 05:12",917,8548,,"2020-12-03T10:12:00Z",1866057,203728,1662329,,,,,1344448,,,,,,,110396,17761,246400,18473,"49",3945,6604,1361891,17741,1361891,,11,125,"149fd55ceaec526e445894f178bca0059b5bf777",0,0,0,0,0,""
20201202,"UT",202220,,1149122,,"totalTestsViral",1848316,584,8423,202,1506,,543,138995,"12/2/2020 10:07","2020-12-02T10:07:00Z","12/02 05:07",906,8423,,"2020-12-02T10:07:00Z",1848316,199992,1648324,,,,,1334359,,,,,,,107300,17162,238835,17845,"49",4004,4875,1351342,12722,1351342,,16,144,"16a88def81363e26d371312d11452141ef09c6ea",0,0,0,0,0,""
20201201,"UT",198216,,1144247,,"totalTestsViral",1835594,587,8279,205,1498,,543,136709,"12/1/2020 12:13","2020-12-01T12:13:00Z","12/01 07:13",890,8279,,"2020-12-01T12:13:00Z",1835594,197322,1638272,,,,,1327020,,,,,,,105205,16654,232796,17326,"49",2510,4559,1342463,11548,1342463,,19,144,"446f4606b68c2362a9b12a9a13e2ad61613b51f2",0,0,0,0,0,""
20201130,"UT",195706,,1139688,,"totalTestsViral",1824046,573,8135,205,1476,,533,134296,"11/30/2020 10:17","2020-11-30T10:17:00Z","11/30 05:17",871,8135,,"2020-11-30T10:17:00Z",1824046,195353,1628693,,,,,1320664,,,,,,,102415,15947,224312,16585,"49",1897,2913,1335394,7014,1335394,,3,59,"6012fa31e52d88da1661234e22327aa5171d81c1",0,0,0,0,0,""
20201129,"UT",193809,,1136775,,"totalTestsViral",1817032,575,8076,207,1474,,533,132081,"11/29/2020 09:59","2020-11-29T09:59:00Z","11/29 04:59",868,8076,,"2020-11-29T09:59:00Z",1817032,193755,1623277,,,,,1316299,,,,,,,101928,15751,223171,16378,"49",1722,3769,1330584,8947,1330584,,5,47,"c2163bae0e8c9038994e8f30be34ce945337d31c",0,0,0,0,0,""
20201128,"UT",192087,,1133006,,"totalTestsViral",1808085,581,8029,207,1470,,533,129652,"11/28/2020 11:09","2020-11-28T11:09:00Z","11/28 06:09",863,8029,,"2020-11-28T11:09:00Z",1808085,192126,1615959,,,,,1311013,,,,,,,101071,15463,221197,16081,"49",2043,4695,1325093,10682,1325093,,14,81,"47cd8a4c15e8460a9ab70de503a5347616a237d1",0,0,0,0,0,""
20201127,"UT",190044,,1128311,,"totalTestsViral",1797403,586,7948,205,1458,,532,126690,"11/27/2020 10:07","2020-11-27T10:07:00Z","11/27 05:07",849,7948,,"2020-11-27T10:07:00Z",1797403,190133,1607270,,,,,1304497,,,,,,,100144,15169,217320,15777,"49",6142,14340,1318355,31637,1318355,,15,163,"312bb19f1acdf67250248fd02036d551ea7b67cd",0,0,0,0,0,""
20201126,"UT",183902,,1113971,,"totalTestsViral",1765766,591,7785,207,1440,,526,120890,"11/25/2020 11:10","2020-11-25T11:10:00Z","11/25 06:10",834,7785,,"2020-11-25T11:10:00Z",1765766,183877,1581889,,,,,1284380,,,,,,,96617,14743,207511,15322,"49",0,0,1297873,0,1297873,,0,0,"11e9f8ef1cdae665b4cde8cf34954bccd2805a3d",0,0,0,0,0,""
20201125,"UT",183902,,1113971,,"totalTestsViral",1765766,591,7785,207,1440,,526,120890,"11/25/2020 11:10","2020-11-25T11:10:00Z","11/25 06:10",834,7785,,"2020-11-25T11:10:00Z",1765766,183877,1581889,,,,,1284380,,,,,,,96617,14743,207511,15322,"49",1781,4970,1297873,12306,1297873,,26,83,"c4a2ae3d01fcab9f7a9aadaa3c012fc216778845",0,0,0,0,0,""
20201124,"UT",182121,,1109001,,"totalTestsViral",1753460,565,7702,201,1422,,519,118773,"11/24/2020 11:07","2020-11-24T11:07:00Z","11/24 06:07",808,7702,,"2020-11-24T11:07:00Z",1753460,181977,1571483,,,,,1277742,,,,,,,90193,14039,192109,14575,"49",2701,9077,1291122,17636,1291122,,11,100,"6a0b83fe39ef686bca42d2de0bb9a36fafdfda07",0,0,0,0,0,""
20201123,"UT",179420,,1099924,,"totalTestsViral",1735824,558,7602,199,1400,,516,117104,"11/23/2020 09:53","2020-11-23T09:53:00Z","11/23 04:53",797,7602,,"2020-11-23T09:53:00Z",1735824,179196,1556628,,,,,1266141,,,,,,,86266,13384,182969,13889,"49",2244,4852,1279344,10113,1279344,,4,70,"795be53a641940be3b4598269eb02704b44f5faa",0,0,0,0,0,""
20201122,"UT",177176,,1095072,,"totalTestsViral",1725711,579,7532,197,1398,,516,115904,"11/22/2020 09:42","2020-11-22T09:42:00Z","11/22 04:42",793,7532,,"2020-11-22T09:42:00Z",1725711,177531,1548180,,,,,1259764,,,,,,,85181,13144,181197,13641,"49",3197,9269,1272248,19107,1272248,,6,74,"b50e1f29543dad6a150797e745b265d480f6d45e",0,0,0,0,0,""
20201121,"UT",173979,,1085803,,"totalTestsViral",1706604,571,7458,183,1393,,513,114058,"11/21/2020 11:22","2020-11-21T11:22:00Z","11/21 06:22",787,7458,,"2020-11-21T11:22:00Z",1706604,174097,1532507,,,,,1247317,,,,,,,83987,12986,178501,13469,"49",3395,8712,1259782,17815,1259782,,14,108,"6e176c0bff8d8817d7ef1aad5049ab04bffd723f",0,0,0,0,0,""
20201120,"UT",170584,,1077091,,"totalTestsViral",1688789,554,7350,182,1384,,509,112356,"11/20/2020 10:16","2020-11-20T10:16:00Z","11/20 05:16",773,7350,,"2020-11-20T10:16:00Z",1688789,171125,1517664,,,,,1235847,,,,,,,79187,12515,168904,12983,"49",4588,9757,1247675,21529,1247675,,17,135,"490c34f79e40eefca5cec67d8ff3fa32001c14b2",0,0,0,0,0,""
20201119,"UT",165996,,1067334,,"totalTestsViral",1667260,553,7215,195,1363,,502,110007,"11/19/2020 10:39","2020-11-19T10:39:00Z","11/19 05:39",756,7215,,"2020-11-19T10:39:00Z",1667260,166864,1500396,,,,,1222064,,,,,,,74592,11948,159724,12397,"49",3968,10419,1233330,21968,1233330,,16,108,"4cb4969248fe0c1cd2ad96c6a2f97bbc7f37c7c5",0,0,0,0,0,""
20201118,"UT",162028,,1056915,,"totalTestsViral",1645292,564,7107,201,1350,,495,108182,"11/18/2020 11:31","2020-11-18T11:31:00Z","11/18 06:31",740,7107,,"2020-11-18T11:31:00Z",1645292,162576,1482716,,,,,1207602,,,,,,,71349,11607,152121,12027,"49",3071,7755,1218943,16195,1218943,,8,119,"c11ac3e5f38f6a64b6425bb6ac67e65b00f58b70",0,0,0,0,0,""
20201117,"UT",158957,,1049160,,"totalTestsViral",1629097,537,6988,196,1334,,494,106601,"11/17/2020 11:29","2020-11-17T11:29:00Z","11/17 06:29",732,6988,,"2020-11-17T11:29:00Z",1629097,159951,1469146,,,,,1197365,,,,,,,68235,11079,145406,11466,"49",3178,6382,1208117,13784,1208117,,9,129,"7ff99eac55b79b07c59e2fc8fa3a39d97487bdde",0,0,0,0,0,""
20201116,"UT",155779,,1042778,,"totalTestsViral",1615313,519,6859,198,1303,,487,105481,"11/16/2020 10:21","2020-11-16T10:21:00Z","11/16 05:21",723,6859,,"2020-11-16T10:21:00Z",1615313,157309,1458004,,,,,1188490,,,,,,,65768,10527,139150,10890,"49",1971,7318,1198557,13520,1198557,,5,90,"a61e65d3bbb78838f12822bc1738ff3e5e722b47",0,0,0,0,0,""
20201115,"UT",153808,,1035460,,"totalTestsViral",1601793,502,6769,186,1298,,487,104317,"11/15/2020 12:08","2020-11-15T12:08:00Z","11/15 07:08",718,6769,,"2020-11-15T12:08:00Z",1601793,155439,1446354,,,,,1179407,,,,,,,65328,10401,138449,10760,"49",2667,5877,1189268,13039,1189268,,8,93,"43b303f8cd65d1730ea836e651ba55b2d19c4615",0,0,0,0,0,""
20201114,"UT",151141,,1029583,,"totalTestsViral",1588754,507,6676,184,1297,,486,102514,"11/14/2020 11:34","2020-11-14T11:34:00Z","11/14 06:34",710,6676,,"2020-11-14T11:34:00Z",1588754,152670,1436084,,,,,1170899,,,,,,,63351,10176,135509,10529,"49",5352,10641,1180724,21407,1180724,,9,85,"b6655cc92b46ef3881c0cc4ad205bff416928f16",0,0,0,0,0,""
20201113,"UT",145789,,1018942,,"totalTestsViral",1567347,492,6591,184,1294,,485,100892,"11/13/2020 13:34","2020-11-13T13:34:00Z","11/13 08:34",701,6591,,"2020-11-13T13:34:00Z",1567347,148747,1418600,,,,,1156550,,,,,,,60156,9716,128895,10054,"49",2150,6865,1164731,15697,1164731,,14,104,"abb75eed921d4b7abd65ceaf4a0a13a249ade3ce",0,0,0,0,0,""
20201112,"UT",143639,,1012077,,"totalTestsViral",1551650,484,6487,191,1277,,480,98897,"11/12/2020 10:51","2020-11-12T10:51:00Z","11/12 05:51",687,6487,,"2020-11-12T10:51:00Z",1551650,145649,1406001,,,,,1146746,,,,,,,57803,9344,124502,9674,"49",3919,7784,1155716,16670,1155716,,9,92,"73e31ca3981ff1f40e232825ad0e7e143e19e5e7",0,0,0,0,0,""
20201111,"UT",139720,,1004293,,"totalTestsViral",1534980,466,6395,182,1277,,479,97269,"11/11/2020 10:24","2020-11-11T10:24:00Z","11/11 05:24",678,6395,,"2020-11-11T10:24:00Z",1534980,142522,1392458,,,,,1135944,,,,,,,54679,8800,119260,9118,"49",2335,6050,1144013,12971,1144013,,6,111,"e5ea5453d12c6f03a34857e2d3da899c53841977",0,0,0,0,0,""
20201110,"UT",137385,,998243,,"totalTestsViral",1522009,453,6284,185,1267,,476,95975,"11/10/2020 11:54","2020-11-10T11:54:00Z","11/10 06:54",672,6284,,"2020-11-10T11:54:00Z",1522009,140831,1381178,,,,,1128278,,,,,,,52471,8321,114637,8625,"49",2517,7708,1135628,16429,1135628,,11,122,"759d062621b6714ac007ea83088975678e170c09",0,0,0,0,0,""
20201109,"UT",134868,,990535,,"totalTestsViral",1505580,460,6162,185,1240,,473,94929,"11/9/2020 10:31","2020-11-09T10:31:00Z","11/09 05:31",661,6162,,"2020-11-09T10:31:00Z",1505580,137950,1367630,,,,,1117818,,,,,,,50105,7792,110249,8074,"49",2247,6424,1125403,12787,1125403,,2,78,"a5af7c1b4bf238dc63ec2a757e61897cb3c840cb",0,0,0,0,0,""
20201108,"UT",132621,,984111,,"totalTestsViral",1492793,437,6084,170,1237,,472,93763,"11/8/2020 10:33","2020-11-08T10:33:00Z","11/08 05:33",659,6084,,"2020-11-08T10:33:00Z",1492793,135859,1356934,,,,,1109406,,,,,,,49411,7548,109262,7823,"49",2386,6352,1116732,12256,1116732,,1,64,"79392e2493ee81c66d02dc077753b1beed8f68ec",0,0,0,0,0,""
20201107,"UT",130235,,977759,,"totalTestsViral",1480537,420,6020,175,1232,,471,92656,"11/7/2020 10:32","2020-11-07T10:32:00Z","11/07 05:32",658,6020,,"2020-11-07T10:32:00Z",1480537,133667,1346870,,,,,1100971,,,,,,,48535,7301,107849,7574,"49",2956,8410,1107994,16981,1107994,,9,98,"d2e29ed382e9b875b8b61bc769ce699d7fae7e7c",0,0,0,0,0,""
20201106,"UT",127279,,969349,,"totalTestsViral",1463556,414,5922,167,1216,,465,91340,"11/6/2020 10:12","2020-11-06T10:12:00Z","11/06 05:12",649,5922,,"2020-11-06T10:12:00Z",1463556,130943,1332613,,,,,1089995,,,,,,,46831,6794,103488,7054,"49",2987,7297,1096628,15707,1096628,,17,92,"54a553f1a41dd8bfcd78bb39f5cda1f9e7879dc2",0,0,0,0,0,""
20201105,"UT",124292,,962052,,"totalTestsViral",1447849,409,5830,158,1202,,465,89837,"11/5/2020 11:06","2020-11-05T11:06:00Z","11/05 06:06",632,5830,,"2020-11-05T11:06:00Z",1447849,128445,1319404,,,,,1080308,,,,,,,45298,6470,100163,6720,"49",2807,9585,1086344,18463,1086344,,7,75,"7275ab50da8f8219ea3b8ccb7f75b90712e666d6",0,0,0,0,0,""
20201104,"UT",121485,,952467,,"totalTestsViral",1429386,401,5755,158,1183,,456,88347,"11/4/2020 11:20","2020-11-04T11:20:00Z","11/04 06:20",625,5755,,"2020-11-04T11:20:00Z",1429386,125233,1304153,,,,,1067666,,,,,,,44320,6274,98113,6519,"49",2110,3403,1073952,8531,1073952,,5,90,"93a58b77d458bea5bd18233188267d332871d2f0",0,0,0,0,0,""
20201103,"UT",119375,,949064,,"totalTestsViral",1420855,382,5665,152,1170,,451,87211,"11/3/2020 11:03","2020-11-03T11:03:00Z","11/03 06:03",620,5665,,"2020-11-03T11:03:00Z",1420855,124050,1296805,,,,,1063149,,,,,,,42278,5708,94182,5946,"49",1669,5600,1068439,10710,1068439,,6,89,"406590aa446222a4fe1e5c5f5e65de4447e0ede3",0,0,0,0,0,""
20201102,"UT",117706,,943464,,"totalTestsViral",1410145,366,5576,138,1147,,443,86269,"11/2/2020 10:41","2020-11-02T10:41:00Z","11/02 05:41",614,5576,,"2020-11-02T10:41:00Z",1410145,122406,1287739,,,,,1055982,,,,,,,41611,5545,91159,5778,"49",1196,6583,1061170,11790,1061170,,0,50,"136e0e25d3d6184becee993f2432f7826b154275",0,0,0,0,0,""
20201101,"UT",116510,,936881,,"totalTestsViral",1398355,355,5526,130,1144,,443,85299,"11/1/2020 10:45","2020-11-01T10:45:00Z","11/01 05:45",614,5526,,"2020-11-01T10:45:00Z",1398355,120820,1277535,,,,,1047886,,,,,,,40963,5383,90076,5610,"49",1854,4718,1053391,9293,1053391,,10,63,"4fed94e94e0ae37f9e29945de65701d89b4eb5bd",0,0,0,0,0,""
20201031,"UT",114656,,932163,,"totalTestsViral",1389062,335,5463,132,1138,,437,84101,"10/31/2020 10:59","2020-10-31T10:59:00Z","10/31 06:59",604,5463,,"2020-10-31T10:59:00Z",1389062,119313,1269749,,,,,1041740,,,,,,,40083,5202,88644,5429,"49",1724,5580,1046819,11569,1046819,,3,68,"02c7712bdeb162dc42667a778d5eeb8f38292c34",0,0,0,0,0,""
20201030,"UT",112932,,926583,,"totalTestsViral",1377493,338,5395,133,1117,,432,82752,"10/30/2020 10:07","2020-10-30T10:07:00Z","10/30 06:07",601,5395,,"2020-10-30T10:07:00Z",1377493,117637,1259856,,,,,1034569,,,,,,,39068,5039,85947,5259,"49",2292,7351,1039515,15541,1039515,,3,76,"f401bad26305b76623578a7e32cda8893f446d42",0,0,0,0,0,""
20201029,"UT",110640,,919232,,"totalTestsViral",1361952,338,5319,123,1112,,430,81403,"10/29/2020 10:55","2020-10-29T10:55:00Z","10/29 06:55",598,5319,,"2020-10-29T10:55:00Z",1361952,115669,1246283,,,,,1025357,,,,,,,37934,4836,82886,5051,"49",1837,8073,1029872,14983,1029872,,10,72,"4264fdcce5317b202a89cb13d75b36ec31d0db3f",0,0,0,0,0,""
20201028,"UT",108803,,911159,,"totalTestsViral",1346969,316,5247,117,1098,,425,79918,"10/28/2020 10:55","2020-10-28T10:55:00Z","10/28 06:55",588,5247,,"2020-10-28T10:55:00Z",1346969,113666,1233303,,,,,1015384,,,,,,,36675,4624,80390,4834,"49",1575,4992,1019962,9731,1019962,,10,78,"c0c68c72d8da4bc1f28784e3188f809b13713423",0,0,0,0,0,""
20201027,"UT",107228,,906167,,"totalTestsViral",1337238,309,5169,111,1083,,423,78946,"10/27/2020 11:23","2020-10-27T11:23:00Z","10/27 07:23",578,5169,,"2020-10-27T11:23:00Z",1337238,112356,1224882,,,,,1009148,,,,,,,35547,4419,77271,4622,"49",1145,5448,1013395,3119,1013395,,4,67,"59b7ca6d7f089219b51ca5b4a978f6a2cde99998",0,0,0,0,0,""
20201026,"UT",106083,,900719,,"totalTestsViral",1334119,311,5102,112,1067,,419,78212,"10/26/2020 11:02","2020-10-26T11:02:00Z","10/26 07:02",574,5102,,"2020-10-26T11:02:00Z",1334119,111976,1222143,,,,,1002560,,,,,,,34696,4279,75058,4476,"49",1201,4362,1006802,4659,1006802,,2,53,"93f907691f0eee88f373b4c6bb666877f61bb985",0,0,0,0,0,""
20201025,"UT",104882,,896357,,"totalTestsViral",1329460,313,5049,120,1067,,419,77145,"10/25/2020 11:39","2020-10-25T11:39:00Z","10/25 07:39",572,5049,,"2020-10-25T11:39:00Z",1329460,111451,1218009,,,,,997168,,,,,,,34343,4174,74457,4370,"49",1765,6740,1001239,11115,1001239,,4,52,"1d5de535dacba2ca455ee6d6c843220162b411f4",0,0,0,0,0,""
20201024,"UT",103117,,889617,,"totalTestsViral",1318345,319,4997,110,1062,,417,75776,"10/24/2020 11:39","2020-10-24T11:39:00Z","10/24 07:39",568,4997,,"2020-10-24T11:39:00Z",1318345,109971,1208374,,,,,989146,,,,,,,33663,4055,72847,4248,"49",1608,6989,992734,12974,992734,,1,58,"d38a323cc99709db98a2e27a3dff4de3601c93e6",0,0,0,0,0,""
20201023,"UT",101509,,882628,,"totalTestsViral",1305371,321,4939,109,1056,,415,74688,"10/22/2020 10:18","2020-10-22T10:18:00Z","10/22 06:18",567,4939,,"2020-10-22T10:18:00Z",1305371,108159,1197212,,,,,979959,,,,,,,32781,3932,70201,4116,"49",1960,6051,984137,12352,984137,,4,59,"813a2e543464c87da9f02f4c5a59f56f21669ed2",0,0,0,0,0,""
20201022,"UT",99549,,876577,,"totalTestsViral",1293019,318,4880,110,1050,,409,73586,"10/22/2020 10:18","2020-10-22T10:18:00Z","10/22 06:18",563,4880,,"2020-10-22T10:18:00Z",1293019,106420,1186599,,,,,972432,,,,,,,31854,3768,67628,3944,"49",1543,7691,976126,12708,976126,,6,73,"422646e7b0175362ca9218575619ed0218162ad8",0,0,0,0,0,""
20201021,"UT",98006,,868886,,"totalTestsViral",1280311,338,4807,111,1040,,406,72606,"10/21/2020 10:52","2020-10-21T10:52:00Z","10/21 06:52",557,4807,,"2020-10-21T10:52:00Z",1280311,104675,1175636,,,,,963008,,,,,,,30987,3718,65372,3890,"49",1363,5587,966892,11847,966892,,6,54,"b12852991f8d0e74fc2c8d2cd4408e23ccc12d67",0,0,0,0,0,""
20201020,"UT",96643,,863299,,"totalTestsViral",1268464,311,4753,104,1030,,403,71693,"10/20/2020 11:18","2020-10-20T11:18:00Z","10/20 07:18",551,4753,,"2020-10-20T11:18:00Z",1268464,103173,1165291,,,,,956472,,,,,,,29952,3471,62268,3640,"49",1081,3982,959942,8322,959942,,5,65,"5db0ac1fc0d3547bf7618a6ca47959e48b52a7b1",0,0,0,0,0,""
20201019,"UT",95562,,859317,,"totalTestsViral",1260142,304,4688,103,1022,,401,71035,"10/19/2020 10:30","2020-10-19T10:30:00Z","10/19 06:30",546,4688,,"2020-10-19T10:30:00Z",1260142,101925,1158217,,,,,951553,,,,,,,29106,3288,60235,3451,"49",1168,5466,954879,7159,954879,,3,32,"47717c1b352af08a77c51d365398574baca8765d",0,0,0,0,0,""
20201018,"UT",94394,,853851,,"totalTestsViral",1252983,307,4656,102,1022,,401,70166,"10/18/2020 10:52","2020-10-18T10:52:00Z","10/18 06:52",543,4656,,"2020-10-18T10:52:00Z",1252983,101141,1151842,,,,,945066,,,,,,,28872,3261,59735,3424,"49",1097,5904,948245,9579,948245,,3,46,"2527040893c991611a857aedef413917bd9a441e",0,0,0,0,0,""
20201017,"UT",93297,,847947,,"totalTestsViral",1243404,313,4610,96,1016,,401,69110,"10/17/2020 11:06","2020-10-17T11:06:00Z","10/17 07:06",540,4610,,"2020-10-17T11:06:00Z",1243404,100072,1143332,,,,,937861,,,,,,,28590,3227,59052,3387,"49",1340,14476,941244,11802,941244,,3,51,"2350ba2398022cb0e067bee30f3291506272519f",0,0,0,0,0,""
20201016,"UT",91957,,833471,,"totalTestsViral",1231602,304,4559,96,1007,,400,68092,"10/16/2020 10:01","2020-10-16T10:01:00Z","10/16 06:01",537,4559,,"2020-10-16T10:01:00Z",1231602,98643,1132959,,,,,920788,,,,,,,27965,3157,56742,3312,"49",1496,0,925428,12129,925428,,8,48,"bad118e06d1b53d300e1e61f75445c0d12b2c036",0,0,0,0,0,""
20201015,"UT",90461,,833471,,"totalTestsViral",1219473,277,4511,99,1001,,400,66683,"10/15/2020 10:39","2020-10-15T10:39:00Z","10/15 06:39",529,4511,,"2020-10-15T10:39:00Z",1219473,97365,1122108,,,,,920788,,,,,,,27214,3039,54484,3192,"49",1498,5413,923932,13307,923932,,2,51,"5060ad9afbd3042eff69d562ae08f6e8cd4eccea",0,0,0,0,0,""
20201014,"UT",88963,,828058,,"totalTestsViral",1206166,269,4460,97,991,,396,65472,"10/14/2020 11:12","2020-10-14T11:12:00Z","10/14 07:12",527,4460,,"2020-10-14T11:12:00Z",1206166,95769,1110397,,,,,914140,,,,,,,26547,2964,52937,3116,"49",1144,6753,917021,11745,917021,,5,77,"40faf6505e82f09b94617b7276e60f8dc6b859e3",0,0,0,0,0,""
20201013,"UT",87819,,821305,,"totalTestsViral",1194421,254,4383,90,984,,392,64583,"10/13/2020 10:08","2020-10-13T10:08:00Z","10/13 06:08",522,4383,,"2020-10-13T10:08:00Z",1194421,94467,1099954,,,,,906128,,,,,,,25604,2838,50502,2987,"49",987,7140,909124,8603,909124,,0,52,"18c9a5d109c3ef107948fc39c1cbaa1d68a86cb2",0,0,0,0,0,""
20201012,"UT",86832,,814165,,"totalTestsViral",1185818,259,4331,94,970,,385,63961,"10/12/2020 11:23","2020-10-12T11:23:00Z","10/12 07:23",522,4331,,"2020-10-12T11:23:00Z",1185818,93411,1092407,,,,,898149,,,,,,,24782,2723,48471,2870,"49",988,3243,900997,6434,900997,,5,25,"530288289178d3e9c44d5b6a848611ff34e882ba",0,0,0,0,0,""
20201011,"UT",85844,,810922,,"totalTestsViral",1179384,274,4306,99,969,,385,63307,"10/11/2020 11:48","2020-10-11T11:48:00Z","10/11 07:48",517,4306,,"2020-10-11T11:48:00Z",1179384,92681,1086703,,,,,893948,,,,,,,24623,2698,47745,2845,"49",1200,4847,896766,10814,896766,,7,31,"2075274bd5c45c944107823988735b1ab5c82bfd",0,0,0,0,0,""
20201010,"UT",84644,,806075,,"totalTestsViral",1168570,246,4275,89,968,,385,62401,"10/10/2020 12:33","2020-10-10T12:33:00Z","10/10 08:33",510,4275,,"2020-10-10T12:33:00Z",1168570,91569,1077001,,,,,888447,,,,,,,24447,2687,47303,2833,"49",1354,9196,890719,12969,890719,,5,55,"ae4ad43de8f07514623cf2b3f15410ca1d176979",0,0,0,0,0,""
20201009,"UT",83290,,796879,,"totalTestsViral",1155601,261,4220,86,957,,380,61326,"10/9/2020 10:17","2020-10-09T10:17:00Z","10/09 06:17",505,4220,,"2020-10-09T10:17:00Z",1155601,90238,1065363,,,,,877466,,,,,,,23582,2589,45157,2727,"49",1343,7046,880169,13277,880169,,4,53,"837e2c6f1d215498375d7c441c3bc080dcd0f869",0,0,0,0,0,""
20201008,"UT",81947,,789833,,"totalTestsViral",1142324,251,4167,86,947,,376,60220,"10/8/2020 10:25","2020-10-08T10:25:00Z","10/08 06:25",501,4167,,"2020-10-08T10:25:00Z",1142324,88890,1053434,,,,,869153,,,,,,,22869,2514,43435,2650,"49",1501,8005,871780,12505,871780,,5,54,"a825a70088e071044e9e508b6dd845236795f5ea",0,0,0,0,0,""
20201007,"UT",80446,,781828,,"totalTestsViral",1129819,233,4113,87,941,,371,59289,"10/7/2020 10:49","2020-10-07T10:49:00Z","10/07 06:49",496,4113,,"2020-10-07T10:49:00Z",1129819,87486,1042333,,,,,859771,,,,,,,21669,2371,40491,2507,"49",1007,4207,862274,12188,862274,,8,55,"776a6bae83e80df745fe24fc4254089e4e5ac03d",0,0,0,0,0,""
20201006,"UT",79439,,777621,,"totalTestsViral",1117631,245,4058,79,937,,370,58534,"10/6/2020 00:00","2020-10-06T00:00:00Z","10/05 20:00",488,4058,,"2020-10-06T00:00:00Z",1117631,86258,1031373,,,,,854912,,,,,,,20689,2242,38427,2371,"49",716,1932,857060,10769,857060,,6,39,"dccdf597a905858486dcce30b133ec84ebb66a3e",0,0,0,0,0,""
20201005,"UT",78723,,775689,,"totalTestsViral",1106862,222,4019,74,928,,366,57965,"10/5/2020 10:41","2020-10-05T10:41:00Z","10/05 06:41",482,4019,,"2020-10-05T10:41:00Z",1106862,85111,1021751,,,,,852662,,,,,,,20437,2202,37827,2330,"49",1105,3477,854412,7533,854412,,4,39,"508fde7bebb041f0642f352a506023cfd70bf348",0,0,0,0,0,""
20201004,"UT",77618,,772212,,"totalTestsViral",1099329,220,3980,69,923,,366,57392,"10/4/2020 10:38","2020-10-04T10:38:00Z","10/04 06:38",478,3980,,"2020-10-04T10:38:00Z",1099329,84419,1014910,,,,,848758,,,,,,,18335,2148,34150,2271,"49",1393,5553,849830,9595,849830,,2,24,"d2df8c1b00b29acdab236b677a9334989ea604b8",0,0,0,0,0,""
20201003,"UT",76225,,766659,,"totalTestsViral",1089734,217,3956,65,921,,366,56751,"10/3/2020 11:13","2020-10-03T11:13:00Z","10/03 07:13",476,3956,,"2020-10-03T11:13:00Z",1089734,83429,1006305,,,,,842295,,,,,,,16629,2116,30700,2247,"49",1068,6692,842884,11335,842884,,2,40,"7a8010dbb8b13ca0bbad0a4bafcbfe5c58bdace0",0,0,0,0,0,""
20201002,"UT",75157,,759967,,"totalTestsViral",1078399,258,3916,73,920,,365,56167,"10/2/2020 10:29","2020-10-02T10:29:00Z","10/02 06:29",474,3916,,"2020-10-02T10:29:00Z",1078399,82378,996021,,,,,834634,,,,,,,16355,2106,29880,2225,"49",1107,6881,835124,11494,835124,,15,34,"5286800d1b986a40ac75eb38e11edde12547199f",0,0,0,0,0,""
20201001,"UT",74050,,753086,,"totalTestsViral",1066905,259,3882,76,916,,364,55510,"10/1/2020 10:22","2020-10-01T10:22:00Z","10/01 06:22",459,3882,,"2020-10-01T10:22:00Z",1066905,81091,985814,,,,,826555,,,,,,,15826,2033,28433,2152,"49",1008,6141,827136,10787,827136,,0,35,"8de6d9cbc9ef2f6ffa676c72e2ee79942a6d7f82",0,0,0,0,0,""
20200930,"UT",73042,,746945,,"totalTestsViral",1056118,243,3847,75,912,,363,55141,"9/30/2020 11:13","2020-09-30T11:13:00Z","09/30 07:13",459,3847,,"2020-09-30T11:13:00Z",1056118,80094,976024,,,,,819462,,,,,,,15282,1966,27011,2081,"49",906,6872,819987,11099,819987,,2,40,"c3502d4624eba3519ec78cf59756826ab9f1d088",0,0,0,0,0,""
20200929,"UT",72136,,740073,,"totalTestsViral",1045019,195,3807,71,908,,362,54844,"9/29/2020 10:48","2020-09-29T10:48:00Z","09/29 06:48",457,3807,,"2020-09-29T10:48:00Z",1045019,78862,966157,,,,,811411,,,,,,,14623,1890,25547,2003,"49",694,5519,812209,8919,812209,,4,50,"50d91a43d70e8967214600c0e61790168d8b848c",0,0,0,0,0,""
20200928,"UT",71442,,734554,,"totalTestsViral",1036100,174,3757,66,895,,361,54530,"9/28/2020 10:06","2020-09-28T10:06:00Z","09/28 06:06",453,3757,,"2020-09-28T10:06:00Z",1036100,77905,958195,,,,,804978,,,,,,,14090,1827,24376,1936,"49",827,3861,805996,6272,805996,,0,28,"afb9ecc41858d93cd51304954a32cf77f5855f45",0,0,0,0,0,""
20200927,"UT",70615,,730693,,"totalTestsViral",1029828,184,3729,76,895,,359,54201,"9/27/2020 11:11","2020-09-27T11:11:00Z","09/27 07:11",453,3729,,"2020-09-27T11:11:00Z",1029828,77230,952598,,,,,800467,,,,,,,13996,1823,24235,1931,"49",1068,5753,801308,9401,801308,,5,27,"3ae1d1e40baf341c1ff874332a1d57d2fb66ffa2",0,0,0,0,0,""
20200926,"UT",69547,,724940,,"totalTestsViral",1020427,191,3702,77,890,,358,53806,"9/26/2020 11:02","2020-09-26T11:02:00Z","09/26 07:02",448,3702,,"2020-09-26T11:02:00Z",1020427,76311,944116,,,,,793840,,,,,,,13698,1793,23618,1900,"49",1017,7743,794487,12421,794487,,0,34,"d0a25e595830ff8ff13f37a3fd6a7f91a32ecade",0,0,0,0,0,""
20200925,"UT",68530,,717197,,"totalTestsViral",1008006,190,3668,76,886,,357,53360,"9/25/2020 10:00","2020-09-25T10:00:00Z","09/25 06:00",448,3668,,"2020-09-25T10:00:00Z",1008006,75009,932997,,,,,784859,,,,,,,13019,1744,22051,1849,"49",1411,5904,785727,9893,785727,,4,49,"13b4681d19f0d569d608cf761561b4b8ca045a2b",0,0,0,0,0,""
20200924,"UT",67119,,711293,,"totalTestsViral",998113,216,3619,76,884,,356,52860,"9/24/2020 10:27","2020-09-24T10:27:00Z","09/24 06:27",444,3619,,"2020-09-24T10:27:00Z",998113,73986,924127,,,,,777994,,,,,,,12236,1716,20139,1818,"49",1198,7304,778412,12022,778412,,0,35,"d75fd76de9b0f2d793912b90aff05a3b33a05c52",0,0,0,0,0,""
20200923,"UT",65921,,703989,,"totalTestsViral",986091,190,3584,65,876,,354,52357,"9/23/2020 10:39","2020-09-23T10:39:00Z","09/23 06:39",444,3584,,"2020-09-23T10:39:00Z",986091,72540,913551,,,,,769299,,,,,,,11768,1661,19120,1760,"49",877,6674,769910,10880,769910,,1,34,"4a51627107ace80e17113228f3b5d20df4d4f886",0,0,0,0,0,""
20200922,"UT",65044,,697315,,"totalTestsViral",975211,183,3550,63,869,,352,51945,"9/22/2020 10:33","2020-09-22T10:33:00Z","09/22 06:33",443,3550,,"2020-09-22T10:33:00Z",975211,71421,903790,,,,,761575,,,,,,,11206,1588,17730,1686,"49",650,5619,762359,8162,762359,,2,30,"ca33455fcd1450f55918df390c7e4d5c04864cb3",0,0,0,0,0,""
20200921,"UT",64394,,691696,,"totalTestsViral",967049,154,3520,61,857,,350,51660,"9/21/2020 10:29","2020-09-21T10:29:00Z","09/21 06:29",441,3520,,"2020-09-21T10:29:00Z",967049,70539,896510,,,,,755103,,,,,,,10677,1527,16873,1622,"49",622,3363,756090,5991,756090,,1,26,"46c8a981cbc12c83aaae1d706bf3e7da9467d55a",0,0,0,0,0,""
20200920,"UT",63772,,688333,,"totalTestsViral",961058,187,3494,59,853,,350,51410,"9/20/2020 11:00","2020-09-20T11:00:00Z","09/20 07:00",440,3494,,"2020-09-20T11:00:00Z",961058,69952,891106,,,,,751242,,,,,,,10465,1508,16189,1604,"49",920,5048,752105,8991,752105,,0,17,"c5e2f2ecfa853ab450f524d812150b7de19130b6",0,0,0,0,0,""
20200919,"UT",62852,,683285,,"totalTestsViral",952067,177,3477,49,850,,349,50957,"9/19/2020 10:29","2020-09-19T10:29:00Z","09/19 06:29",440,3477,,"2020-09-19T10:29:00Z",952067,69094,882973,,,,,745472,,,,,,,10401,1493,16093,1588,"49",1077,6080,746137,10266,746137,,3,33,"e2b0fbbab634b964d1c2fa491688f24620e6d695",0,0,0,0,0,""
20200918,"UT",61775,,677205,,"totalTestsViral",941801,184,3444,52,848,,349,50492,"9/18/2020 10:05","2020-09-18T10:05:00Z","09/18 06:05",437,3444,,"2020-09-18T10:05:00Z",941801,67941,873860,,,,,738371,,,,,,,9599,1396,13893,1486,"49",1117,5181,738980,9169,738980,,0,43,"d719168c10f536396e68f421b78e384970b0b551",0,0,0,0,0,""
20200917,"UT",60658,,672024,,"totalTestsViral",932632,170,3401,54,843,,348,50108,"9/17/2020 10:16","2020-09-17T10:16:00Z","09/17 06:16",437,3401,,"2020-09-17T10:16:00Z",932632,66842,865790,,,,,732265,,,,,,,9495,1377,13684,1464,"49",911,5281,732682,9170,732682,,0,20,"950f25f957146a90001f6cfd5568f1f2d5b04d5a",0,0,0,0,0,""
20200916,"UT",59747,,666743,,"totalTestsViral",923462,139,3381,54,837,,348,49728,"9/16/2020 10:38","2020-09-16T10:38:00Z","09/16 06:38",437,3381,,"2020-09-16T10:38:00Z",923462,65768,857694,,,,,725946,,,,,,,9027,1338,12664,1422,"49",747,5412,726490,9039,726490,,1,20,"fe52803709aada396390b2340803c493cf82b742",0,0,0,0,0,""
20200915,"UT",59000,,661331,,"totalTestsViral",914423,178,3361,50,833,,346,49327,"9/15/2020 11:28","2020-09-15T11:28:00Z","09/15 07:28",436,3361,,"2020-09-15T11:28:00Z",914423,64846,849577,,,,,719705,,,,,,,8913,1320,12385,1403,"49",562,4847,720331,7801,720331,,0,23,"bcd3c51fb5de72899ed25ef764bad65c1a7cbf59",0,0,0,0,0,""
20200914,"UT",58438,,656484,,"totalTestsViral",906622,170,3338,54,829,,345,48934,"9/14/2020 10:14","2020-09-14T10:14:00Z","09/14 06:14",436,3338,,"2020-09-14T10:14:00Z",906622,63871,842751,,,,,713943,,,,,,,8321,1263,11216,1345,"49",563,2386,714922,4073,714922,,3,12,"4531599d9ffafa84e6677ed5fc6f6a9628f1c01c",0,0,0,0,0,""
20200913,"UT",57875,,654098,,"totalTestsViral",902549,178,3326,52,828,,344,48690,"9/13/2020 09:56","2020-09-13T09:56:00Z","09/13 05:56",433,3326,,"2020-09-13T09:56:00Z",902549,63495,839054,,,,,711194,,,,,,,8196,1245,11059,1326,"49",628,3114,711973,6237,711973,,0,15,"7c30c0cd49c2d3be1f7570b46ed2f70a2b02f8f7",0,0,0,0,0,""
20200912,"UT",57247,,650984,,"totalTestsViral",896312,176,3311,48,827,,344,48396,"9/12/2020 11:27","2020-09-12T11:27:00Z","09/12 07:27",433,3311,,"2020-09-12T11:27:00Z",896312,62949,833363,,,,,707610,,,,,,,8037,1226,10840,1304,"49",572,4498,708231,8200,708231,,2,23,"a9449e382a4f7867572e717c96a30ef5ca03b122",0,0,0,0,0,""
20200911,"UT",56675,,646486,,"totalTestsViral",888112,170,3288,48,817,,338,48021,"9/11/2020 11:02","2020-09-11T11:02:00Z","09/11 07:02",431,3288,,"2020-09-11T11:02:00Z",888112,62225,825887,,,,,702454,,,,,,,7681,1192,10170,1267,"49",656,4080,703161,7977,703161,,1,15,"57ca99a0276945566cc1e41fc6611ab02b1c4b02",0,0,0,0,0,""
20200910,"UT",56019,,642406,,"totalTestsViral",880135,165,3273,48,814,,337,47545,"9/10/2020 10:40","2020-09-10T10:40:00Z","09/10 06:40",430,3273,,"2020-09-10T10:40:00Z",880135,61573,818562,,,,,697781,,,,,,,7287,1156,9505,1230,"49",346,3770,698425,6448,698425,,3,10,"24aab9f49ec78a1e58599cadbf3b896352011f0b",0,0,0,0,0,""
20200909,"UT",55673,,638636,,"totalTestsViral",873687,137,3263,45,812,,336,47084,"9/9/2020 10:50","2020-09-09T10:50:00Z","09/09 06:50",427,3263,,"2020-09-09T10:50:00Z",873687,61024,812663,,,,,693497,,,,,,,6758,1119,8762,1190,"49",314,2636,694309,4213,694309,,3,21,"32653db58954283554b55536c8de06b15cf968b7",0,0,0,0,0,""
20200908,"UT",55359,,636000,,"totalTestsViral",869474,140,3242,41,803,,334,46722,"9/8/2020 10:26","2020-09-08T10:26:00Z","09/08 06:26",424,3242,,"2020-09-08T10:26:00Z",869474,60647,808827,,,,,690520,,,,,,,6251,1094,7805,1165,"49",326,2228,691359,3435,691359,,1,17,"d28125a5a83f480182afa73e833accdbad8b4d6f",0,0,0,0,0,""
20200907,"UT",55033,,633772,,"totalTestsViral",866039,152,3225,49,802,,334,46468,"9/6/2020 10:51","2020-09-06T10:51:00Z","09/06 06:51",423,3225,,"2020-09-06T10:51:00Z",866039,60311,805728,,,,,687968,,,,,,,6124,1074,7605,1145,"49",373,2509,688805,3832,688805,,1,18,"8191f2483c341828b6576c5d77f831ed53f45ed1",0,0,0,0,0,""
20200906,"UT",54660,,631263,,"totalTestsViral",862207,152,3207,49,802,,333,46233,"9/6/2020 10:53","2020-09-06T10:53:00Z","09/06 06:53",422,3207,,"2020-09-06T10:53:00Z",862207,60014,802193,,,,,685176,,,,,,,6049,1061,7501,1132,"49",388,4097,685923,6786,685923,,2,19,"702431558faa0565cfe9b6db0579a1c3f7228559",0,0,0,0,0,""
20200905,"UT",54272,,627166,,"totalTestsViral",855421,152,3188,49,799,,331,45896,"9/5/2020 11:06","2020-09-05T11:06:00Z","09/05 07:06",420,3188,,"2020-09-05T11:06:00Z",855421,59600,795821,,,,,680694,,,,,,,5922,1053,7333,1124,"49",433,4332,681438,6912,681438,,1,16,"c3ad237a07354fd4944264f96111532ecb272cdc",0,0,0,0,0,""
20200904,"UT",53839,,622834,,"totalTestsViral",848509,144,3172,54,794,,329,45547,"9/4/2020 11:00","2020-09-04T11:00:00Z","09/04 07:00",419,3172,,"2020-09-04T11:00:00Z",848509,59089,789420,,,,,675882,,,,,,,5517,1031,6749,1101,"49",513,4109,676673,6982,676673,,5,19,"e88816fe20d78f1fc2c721142ee9fd6088c03521",0,0,0,0,0,""
20200903,"UT",53326,,618725,,"totalTestsViral",841527,137,3153,43,788,,329,44995,"9/3/2020 10:16","2020-09-03T10:16:00Z","09/03 06:16",414,3153,,"2020-09-03T10:16:00Z",841527,58659,782868,,,,,671383,,,,,,,5247,1013,6367,1081,"49",504,4054,672051,6672,672051,,4,19,"e939508e831edded765b7ce0b7f50c75a8fd8497",0,0,0,0,0,""
20200902,"UT",52822,,614671,,"totalTestsViral",834855,147,3134,47,785,,325,44658,"9/2/2020 11:28","2020-09-02T11:28:00Z","09/02 07:28",410,3134,,"2020-09-02T11:28:00Z",834855,58209,776646,,,,,666899,,,,,,,4975,1002,6038,1070,"49",419,4024,667493,6765,667493,,1,24,"a29c20316560c27a676d1da88e27387a9b679611",0,0,0,0,0,""
20200901,"UT",52403,,610647,,"totalTestsViral",828090,145,3110,44,780,,322,44338,"9/1/2020 11:08","2020-09-01T11:08:00Z","09/01 07:08",409,3110,,"2020-09-01T11:08:00Z",828090,57735,770355,,,,,662452,,,,,,,4710,981,5706,1046,"49",296,3457,663050,5063,663050,,2,17,"23a9a28c2797d44bc0a4b44da31d50b40609fa59",0,0,0,0,0,""
20200831,"UT",52107,,607190,,"totalTestsViral",823027,143,3093,45,776,,319,43990,"8/31/2020 10:16","2020-08-31T10:16:00Z","08/31 06:16",407,3093,,"2020-08-31T10:16:00Z",823027,57334,765693,,,,,658627,,,,,,,4405,943,5334,1008,"49",253,2448,659297,3997,659297,,0,13,"32d3961cbd5d73748146623f04c7bd789b66a702",0,0,0,0,0,""
20200830,"UT",51854,,604742,,"totalTestsViral",819030,134,3080,45,776,,319,43724,"8/30/2020 11:26","2020-08-30T11:26:00Z","08/30 07:26",407,3080,,"2020-08-30T11:26:00Z",819030,57092,761938,,,,,655954,,,,,,,4326,932,5239,997,"49",448,3729,656596,6135,656596,,0,23,"2f15db8bb11c09d472f718dbd93a1f1f7f05504a",0,0,0,0,0,""
20200829,"UT",51406,,601013,,"totalTestsViral",812895,139,3057,48,774,,319,43342,"8/29/2020 11:00","2020-08-29T11:00:00Z","08/29 07:00",407,3057,,"2020-08-29T11:00:00Z",812895,56741,756154,,,,,651909,,,,,,,4198,916,5080,980,"49",458,4378,652419,7188,652419,,0,16,"f45446d38e276929860c1e370e3065282cf90aed",0,0,0,0,0,""
20200828,"UT",50948,,596635,,"totalTestsViral",805707,127,3041,44,773,,318,42959,"8/28/2020 10:45","2020-08-28T10:45:00Z","08/28 06:45",407,3041,,"2020-08-28T10:45:00Z",805707,56239,749468,,,,,647097,,,,,,,4008,885,4825,948,"49",391,3309,647583,5636,647583,,4,26,"d901faeda562ca4d19faafdf475463e2fbf2edcc",0,0,0,0,0,""
20200827,"UT",50557,,593326,,"totalTestsViral",800071,134,3015,41,764,,310,42512,"8/27/2020 10:03","2020-08-27T10:03:00Z","08/27 06:03",403,3015,,"2020-08-27T10:03:00Z",800071,55818,744253,,,,,643398,,,,,,,3797,861,4576,921,"49",383,4072,643883,6769,643883,,2,19,"d3f8f6b9ebd3085b88dce78bc5bb6a2a4ba8c664",0,0,0,0,0,""
20200826,"UT",50174,,589254,,"totalTestsViral",793302,130,2996,40,760,,308,41937,"8/26/2020 10:28","2020-08-26T10:28:00Z","08/26 06:28",401,2996,,"2020-08-26T10:28:00Z",793302,55369,737933,,,,,638917,,,,,,,3588,833,4330,893,"49",407,3888,639428,5973,639428,,4,27,"81135a84e179a3a17bc02ae90d59c986fda4e819",0,0,0,0,0,""
20200825,"UT",49767,,585366,,"totalTestsViral",787329,143,2969,47,753,,306,41529,"8/25/2020 10:08","2020-08-25T10:08:00Z","08/25 06:08",397,2969,,"2020-08-25T10:08:00Z",787329,54966,732363,,,,,634673,,,,,,,3424,822,4135,881,"49",403,3433,635133,5145,635133,,7,28,"503e4e976d30686978f276811d5ba60e8fbbe7bc",0,0,0,0,0,""
20200824,"UT",49364,,581933,,"totalTestsViral",782184,144,2941,57,744,,298,41164,"8/24/2020 10:24","2020-08-24T10:24:00Z","08/24 06:24",390,2941,,"2020-08-24T10:24:00Z",782184,54502,727682,,,,,630821,,,,,,,3224,797,3895,853,"49",249,2575,631297,4197,631297,,5,15,"87aefa109eba5f0fbe3b4580796fda660ea1052b",0,0,0,0,0,""
20200823,"UT",49115,,579358,,"totalTestsViral",777987,156,2926,58,743,,298,40831,"8/23/2020 11:02","2020-08-23T11:02:00Z","08/23 07:02",385,2926,,"2020-08-23T11:02:00Z",777987,54184,723803,,,,,627961,,,,,,,3169,789,3828,844,"49",301,3182,628473,4928,628473,,0,27,"cd68cd337f84d77d5ed88e9813515af259f1720f",0,0,0,0,0,""
20200822,"UT",48814,,576176,,"totalTestsViral",773059,148,2899,56,740,,297,40352,"8/22/2020 10:37","2020-08-22T10:37:00Z","08/22 06:37",385,2899,,"2020-08-22T10:37:00Z",773059,53925,719134,,,,,624542,,,,,,,3097,778,3741,832,"49",369,4910,624990,7148,624990,,2,29,"1a19aa960fe081a0d67cf46b783d67be66eb03e3",0,0,0,0,0,""
20200821,"UT",48445,,571266,,"totalTestsViral",765911,155,2870,58,737,,294,39867,"8/21/2020 10:19","2020-08-21T10:19:00Z","08/21 06:19",383,2870,,"2020-08-21T10:19:00Z",765911,53475,712436,,,,,619215,,,,,,,2949,756,3564,809,"49",463,3629,619711,5455,619711,,2,17,"cc162d1f3e487cf82af5bb9dea9b65c4b75c0ef9",0,0,0,0,0,""
20200820,"UT",47982,,567637,,"totalTestsViral",760456,157,2853,62,732,,292,39364,"8/20/2020 11:07","2020-08-20T11:07:00Z","08/20 07:07",381,2853,,"2020-08-20T11:07:00Z",760456,53057,707399,,,,,615210,,,,,,,2784,737,3368,788,"49",461,4326,615619,6881,615619,,4,21,"1387b1dc7314be18eacf48aff6e109352b48ce9b",0,0,0,0,0,""
20200819,"UT",47521,,563311,,"totalTestsViral",753575,158,2832,63,727,,289,38883,"8/19/2020 10:38","2020-08-19T10:38:00Z","08/19 06:38",377,2832,,"2020-08-19T10:38:00Z",753575,52541,701034,,,,,610403,,,,,,,2614,723,3158,774,"49",364,4284,610832,6595,610832,,8,28,"25ce5683437db32fa5d2b5da380899a139b5eef0",0,0,0,0,0,""
20200818,"UT",47157,,559027,,"totalTestsViral",746980,183,2804,61,718,,288,38555,"8/18/2020 11:07","2020-08-18T11:07:00Z","08/18 07:07",369,2804,,"2020-08-18T11:07:00Z",746980,52144,694836,,,,,605746,,,,,,,2491,714,3000,765,"49",263,3718,606184,5507,606184,,5,22,"5766396c8c2729820f16516c4a7e6272c3dcab44",0,0,0,0,0,""
20200817,"UT",46894,,555309,,"totalTestsViral",741473,156,2782,64,708,,286,38132,"8/17/2020 10:24","2020-08-17T10:24:00Z","08/17 06:24",364,2782,,"2020-08-17T10:24:00Z",741473,51788,689685,,,,,601709,,,,,,,2300,696,2777,747,"49",242,3104,602203,4892,602203,,1,11,"2292c5c320fc10d1c3b89edd659b234c8a28d0e4",0,0,0,0,0,""
20200816,"UT",46652,,552205,,"totalTestsViral",736581,204,2771,64,707,,287,37701,"8/16/2020 13:17","2020-08-16T13:17:00Z","08/16 09:17",363,2771,,"2020-08-16T13:17:00Z",736581,51480,685101,,,,,598329,,,,,,,2269,694,2741,745,"49",331,3448,598857,5469,598857,,0,11,"d9e5e083470ada748fd68b8adb39988f5cf7e697",0,0,0,0,0,""
20200815,"UT",46321,,548757,,"totalTestsViral",731112,186,2760,64,707,,286,37346,"8/15/2020 10:28","2020-08-15T10:28:00Z","08/15 06:28",363,2760,,"2020-08-15T10:28:00Z",731112,51234,679878,,,,,594661,,,,,,,2215,690,2672,740,"49",345,4097,595078,6507,595078,,3,16,"946c94403c9bda4863f09df4c748d5471d894ca7",0,0,0,0,0,""
20200814,"UT",45976,,544660,,"totalTestsViral",724605,190,2744,69,702,,285,36679,"8/14/2020 10:32","2020-08-14T10:32:00Z","08/14 06:32",360,2744,,"2020-08-14T10:32:00Z",724605,50759,673846,,,,,590124,,,,,,,2086,671,2521,720,"49",552,3660,590636,6212,590636,,7,23,"0b052749f9a24f7fee28f946d566e8b9f4033e0d",0,0,0,0,0,""
20200813,"UT",45424,,541000,,"totalTestsViral",718393,206,2721,74,694,,281,35817,"8/13/2020 10:46","2020-08-13T10:46:00Z","08/13 06:46",353,2721,,"2020-08-13T10:46:00Z",718393,50437,667956,,,,,586178,,,,,,,1933,653,2340,702,"49",334,4054,586424,6361,586424,,2,25,"348ca3f25a9836aed3a1a40828d320614ae1eac4",0,0,0,0,0,""
20200812,"UT",45090,,536946,,"totalTestsViral",712032,236,2696,79,690,,279,35311,"8/12/2020 10:39","2020-08-12T10:39:00Z","08/12 06:39",351,2696,,"2020-08-12T10:39:00Z",712032,49964,662068,,,,,581704,,,,,,,1774,644,2147,691,"49",338,3614,582036,5774,582036,,2,19,"0a102b56e4d8d0e1ed15c05d4ab9a39f482403d0",0,0,0,0,0,""
20200811,"UT",44752,,533332,,"totalTestsViral",706258,208,2677,81,685,,277,34764,"8/11/2020 11:14","2020-08-11T11:14:00Z","08/11 07:14",349,2677,,"2020-08-11T11:14:00Z",706258,49529,656729,,,,,577697,,,,,,,1627,630,1949,673,"49",362,2679,578084,4193,578084,,4,35,"21d9c2e699c00a1efbff75fec8fb076a9d0327e8",0,0,0,0,0,""
20200810,"UT",44390,,530653,,"totalTestsViral",702065,222,2642,79,673,,275,34319,"8/10/2020 10:59","2020-08-10T10:59:00Z","08/10 06:59",345,2642,,"2020-08-10T10:59:00Z",702065,49169,652896,,,,,574698,,,,,,,1518,609,1819,649,"49",263,2936,575043,4411,575043,,9,22,"f6e4f98b84632b4c7f4c4d7689e7e77713cb669b",0,0,0,0,0,""
20200809,"UT",44127,,527717,,"totalTestsViral",697654,224,2620,78,669,,274,33914,"8/9/2020 11:38","2020-08-09T11:38:00Z","08/09 07:38",336,2620,,"2020-08-09T11:38:00Z",697654,48912,648742,,,,,571520,,,,,,,1515,606,1816,646,"49",376,4090,571844,6057,571844,,1,16,"7b68c9c54e67a0e9db5e799b9aa0c89e20c94611",0,0,0,0,0,""
20200808,"UT",43751,,523627,,"totalTestsViral",691597,222,2604,77,667,,272,33115,"8/8/2020 11:03","2020-08-08T11:03:00Z","08/08 07:03",335,2604,,"2020-08-08T11:03:00Z",691597,48577,643020,,,,,567127,,,,,,,1484,595,1776,632,"49",376,4263,567378,6477,567378,,0,26,"43082de71906055f1210d13fbb1672783da2df92",0,0,0,0,0,""
20200807,"UT",43375,,519364,,"totalTestsViral",685120,234,2578,81,657,,269,32371,"8/7/2020 10:33","2020-08-07T10:33:00Z","08/07 06:33",335,2578,,"2020-08-07T10:33:00Z",685120,48126,636994,,,,,562461,,,,,,,1438,582,1723,618,"49",460,4865,562739,7637,562739,,5,24,"c74ddb021d878091b2c6a00d692b7a518eaa05f3",0,0,0,0,0,""
20200806,"UT",42915,,514499,,"totalTestsViral",677483,220,2554,80,657,,266,31619,"8/6/2020 10:42","2020-08-06T10:42:00Z","08/06 06:42",330,2554,,"2020-08-06T10:42:00Z",677483,47653,629830,,,,,557186,,,,,,,1393,564,1671,600,"49",587,4368,557414,7130,557414,,3,35,"21a7b4afb09178ed9103b9ada7cea43c0625c547",0,0,0,0,0,""
20200805,"UT",42328,,510131,,"totalTestsViral",670353,220,2519,81,650,,265,30911,"8/5/2020 09:57","2020-08-05T09:57:00Z","08/05 05:57",327,2519,,"2020-08-05T09:57:00Z",670353,47145,623208,,,,,552369,,,,,,,1351,552,1617,587,"49",421,4472,552459,6727,552459,,6,37,"b0c9244b36ca4ad1e04b6ee42fd1224d6eea03d8",0,0,0,0,0,""
20200804,"UT",41907,,505659,,"totalTestsViral",663626,220,2482,81,640,,261,30449,"8/4/2020 10:30","2020-08-04T10:30:00Z","08/04 06:30",321,2482,,"2020-08-04T10:30:00Z",663626,46625,617001,,,,,547434,,,,,,,1315,533,1576,568,"49",378,4119,547566,6077,547566,,7,32,"e7cf4987e8d6a0875cb1950130cc53d1f3dbb691",0,0,0,0,0,""
20200803,"UT",41529,,501540,,"totalTestsViral",657549,252,2450,83,630,,257,29967,"8/3/2020 10:20","2020-08-03T10:20:00Z","08/03 06:20",314,2450,,"2020-08-03T10:20:00Z",657549,46168,611381,,,,,542908,,,,,,,1250,514,1495,547,"49",354,3013,543069,4261,543069,,3,20,"e1f435e060c7eb9e0846e5e651ec4761387c4632",0,0,0,0,0,""
20200802,"UT",41175,,498527,,"totalTestsViral",653288,289,2430,84,628,,256,29389,"8/2/2020 10:32","2020-08-02T10:32:00Z","08/02 06:32",311,2430,,"2020-08-02T10:32:00Z",653288,45913,607375,,,,,539667,,,,,,,1233,508,1469,540,"49",473,3714,539702,5726,539702,,1,18,"09fe228076c8ff6bea30a0b6082c000585b30ba7",0,0,0,0,0,""
20200801,"UT",40702,,494813,,"totalTestsViral",647562,268,2412,82,627,,255,28747,"8/1/2020 11:41","2020-08-01T11:41:00Z","08/01 07:41",310,2412,,"2020-08-01T11:41:00Z",647562,45525,602037,,,,,535603,,,,,,,1210,498,1439,530,"49",506,4741,535515,7214,535515,,6,35,"685a98229f3ad1e7c40a063232b10406ce9f436f",0,0,0,0,0,""
20200731,"UT",40196,,490072,,"totalTestsViral",640348,258,2377,81,618,,250,28130,"7/31/2020 10:58","2020-07-31T10:58:00Z","07/31 06:58",304,2377,,"2020-07-31T10:58:00Z",640348,44961,595387,,,,,530372,,,,,,,1166,489,1402,518,"49",500,3988,530268,6368,530268,,4,31,"83b37db993e17851c39b1774efc384302e15f08b",0,0,0,0,0,""
20200730,"UT",39696,,486084,,"totalTestsViral",633980,238,2346,87,610,,249,27261,"7/30/2020 11:19","2020-07-30T11:19:00Z","07/30 07:19",300,2346,,"2020-07-30T11:19:00Z",633980,44415,589565,,,,,525902,,,,,,,1128,476,1348,503,"49",502,4524,525780,7269,525780,,8,22,"d3c25ffee47c0c028ef12be709ff4a16d8858c8f",0,0,0,0,0,""
20200729,"UT",39194,,481560,,"totalTestsViral",626711,232,2324,88,605,,244,26643,"7/29/2020 10:45","2020-07-29T10:45:00Z","07/29 06:45",292,2324,,"2020-07-29T10:45:00Z",626711,43741,582970,,,,,520791,,,,,,,1097,460,1311,487,"49",339,4858,520754,7075,520754,,6,29,"c5b0bbe7510551ff1aa91f466a5e639a8f73d363",0,0,0,0,0,""
20200728,"UT",38855,,476702,,"totalTestsViral",619636,233,2295,90,592,,240,25905,"7/28/2020 10:15","2020-07-28T10:15:00Z","07/28 06:15",286,2295,,"2020-07-28T10:15:00Z",619636,43214,576422,,,,,515475,,,,,,,1062,444,1270,471,"49",446,4539,515557,6631,515557,,5,42,"c8af55eaa89209606720ebc416abba07c889ae7b",0,0,0,0,0,""
20200727,"UT",38409,,472163,,"totalTestsViral",613005,225,2253,83,580,,239,25321,"7/27/2020 10:59","2020-07-27T10:59:00Z","07/27 06:59",281,2253,,"2020-07-27T10:59:00Z",613005,42648,570357,,,,,510448,,,,,,,1006,427,1207,454,"49",436,3717,510572,5629,510572,,7,19,"2a686eee2fabcc41abfd1c5ac2ca77f9a4d02aa2",0,0,0,0,0,""
20200726,"UT",37973,,468446,,"totalTestsViral",607376,251,2234,83,577,,239,24798,"7/26/2020 10:29","2020-07-26T10:29:00Z","07/26 06:29",274,2234,,"2020-07-26T10:29:00Z",607376,42178,565198,,,,,506331,,,,,,,997,421,1195,448,"49",350,3511,506419,4671,506419,,0,21,"388c12f7d28bb3f8a4aa9df7d258a0b53a816a34",0,0,0,0,0,""
20200725,"UT",37623,,464935,,"totalTestsViral",602705,232,2213,79,576,,238,24390,"7/25/2020 10:57","2020-07-25T10:57:00Z","07/25 06:57",274,2213,,"2020-07-25T10:57:00Z",602705,41845,560860,,,,,502518,,,,,,,943,412,1130,438,"49",661,5535,502558,8093,502558,,1,25,"905fbd41e08619e89c24bda3b5ac73c9ed422a60",0,0,0,0,0,""
20200724,"UT",36962,,459400,,"totalTestsViral",594612,250,2188,97,574,,237,23715,"7/24/2020 10:19","2020-07-24T10:19:00Z","07/24 06:19",273,2188,,"2020-07-24T10:19:00Z",594612,41181,553431,,,,,496399,,,,,,,933,404,1115,427,"49",863,5517,496362,7982,496362,,6,38,"c1b8b501af75e1fe0a03ecd38019acbccd9d3b15",0,0,0,0,0,""
20200723,"UT",36099,,453883,,"totalTestsViral",586630,249,2150,98,568,,234,23093,"7/23/2020 10:55","2020-07-23T10:55:00Z","07/23 06:55",267,2150,,"2020-07-23T10:55:00Z",586630,40519,546111,,,,,490281,,,,,,,881,387,1055,409,"49",521,5738,489982,8295,489982,,7,15,"c612bcc05a9094925d629eb192e7d4a006946548",0,0,0,0,0,""
20200722,"UT",35578,,448145,,"totalTestsViral",578335,234,2135,94,563,,231,22532,"7/22/2020 11:41","2020-07-22T11:41:00Z","07/22 07:41",260,2135,,"2020-07-22T11:41:00Z",578335,39777,538558,,,,,483896,,,,,,,830,369,997,390,"49",566,5530,483723,7953,483723,,9,26,"f01d54e65ba63827c6bc838c43257f7d72033ec3",0,0,0,0,0,""
20200721,"UT",35012,,442615,,"totalTestsViral",570382,219,2109,96,554,,229,22032,"7/21/2020 10:35","2020-07-21T10:35:00Z","07/21 06:35",251,2109,,"2020-07-21T10:35:00Z",570382,39088,531294,,,,,477756,,,,,,,799,354,954,373,"49",486,5086,477627,7559,477627,,4,43,"95bdefaebcdf1be271bb02b3f755e0c77a72d415",0,0,0,0,0,""
20200720,"UT",34526,,437529,,"totalTestsViral",562823,247,2066,105,543,,224,21504,"7/20/2020 10:13","2020-07-20T10:13:00Z","07/20 06:13",247,2066,,"2020-07-20T10:13:00Z",562823,38406,524417,,,,,472108,,,,,,,767,336,912,355,"49",409,4433,472055,6278,472055,,4,33,"11245fa55abce60311ac1f170275cd5a82cb085d",0,0,0,0,0,""
20200719,"UT",34117,,433096,,"totalTestsViral",556545,296,2033,102,543,,222,20915,"7/19/2020 11:08","2020-07-19T11:08:00Z","07/19 07:08",243,2033,,"2020-07-19T11:08:00Z",556545,37938,518607,,,,,467266,,,,,,,762,331,907,350,"49",785,4922,467213,7040,467213,,0,19,"24dbe88ef48608d629999f2bb481c90a18e57cc4",0,0,0,0,0,""
20200718,"UT",33332,,428174,,"totalTestsViral",549505,251,2014,91,541,,222,20421,"7/18/2020 10:53","2020-07-18T10:53:00Z","07/18 06:53",243,2014,,"2020-07-18T10:53:00Z",549505,37418,512087,,,,,461896,,,,,,,748,328,883,345,"49",760,5990,461506,8708,461506,,8,30,"9bd8e04ba400cf1a78ed4ca03fce471fbd6c55d7",0,0,0,0,0,""
20200717,"UT",32572,,422184,,"totalTestsViral",540797,256,1984,96,532,,220,19862,"7/17/2020 09:43","2020-07-17T09:43:00Z","07/17 05:43",235,1984,,"2020-07-17T09:43:00Z",540797,36749,504048,,,,,455338,,,,,,,716,311,845,327,"49",727,6359,454756,8860,454756,,1,28,"a3e944a2c05f31a9a23c0017404947b09396498f",0,0,0,0,0,""
20200716,"UT",31845,,415825,,"totalTestsViral",531937,236,1956,89,523,,214,19214,"7/16/2020 10:58","2020-07-16T10:58:00Z","07/16 06:58",234,1956,,"2020-07-16T10:58:00Z",531937,35922,496015,,,,,448253,,,,,,,694,300,817,315,"49",954,6680,447670,9369,447670,,1,43,"60fdd322961615848494d43fc18d7b0433a11704",0,0,0,0,0,""
20200715,"UT",30891,,409145,,"totalTestsViral",522568,250,1913,83,515,,214,18593,"7/15/2020 11:01","2020-07-15T11:01:00Z","07/15 07:01",233,1913,,"2020-07-15T11:01:00Z",522568,35169,487399,,,,,440920,,,,,,,645,275,758,288,"49",413,6069,440036,8465,440036,,7,25,"350c8ae5922d92ef66558ffbed3e2ccc7bd83fbb",0,0,0,0,0,""
20200714,"UT",30478,,403076,,"totalTestsViral",514103,231,1888,80,505,,210,18111,"7/14/2020 11:21","2020-07-14T11:21:00Z","07/14 07:21",226,1888,,"2020-07-14T11:21:00Z",514103,34462,479641,,,,,434222,,,,,,,601,252,702,264,"49",448,7321,433554,10041,433554,,10,38,"d8b6f33acfb9bfd23d85cf9ff9c6edae1cf51d35",0,0,0,0,0,""
20200713,"UT",30030,,395755,,"totalTestsViral",504062,252,1850,86,487,,208,17728,"7/13/2020 10:41","2020-07-13T10:41:00Z","07/13 06:41",216,1850,,"2020-07-13T10:41:00Z",504062,33682,470380,,,,,426208,,,,,,,517,195,608,204,"49",546,4432,425785,5943,425785,,1,26,"a0763d13c08cb520bfabcb023d803302edcf8915",0,0,0,0,0,""
20200712,"UT",29484,,391323,,"totalTestsViral",498119,276,1824,84,486,,207,17303,"7/12/2020 13:34","2020-07-12T13:34:00Z","07/12 09:34",215,1824,,"2020-07-12T13:34:00Z",498119,33250,464869,,,,,421384,,,,,,,505,183,596,192,"49",629,5409,420807,7519,420807,,3,27,"40696a0a21698d0e84618be9a4ef5ceafc0a95b1",0,0,0,0,0,""
20200711,"UT",28855,,385914,,"totalTestsViral",490600,269,1797,84,483,,207,16897,"7/11/2020 11:13","2020-07-11T11:13:00Z","07/11 07:13",212,1797,,"2020-07-11T11:13:00Z",490600,32656,457944,,,,,415432,,,,,,,477,170,565,179,"49",632,6210,414769,8695,414769,,5,49,"9324dc558811067b75e3a50eea5e52fa1b57608e",0,0,0,0,0,""
20200710,"UT",28223,,379704,,"totalTestsViral",481905,229,1748,79,477,,205,16261,"7/10/2020 10:27","2020-07-10T10:27:00Z","07/10 06:27",207,1748,,"2020-07-10T10:27:00Z",481905,31876,450029,,,,,408537,,,,,,,428,150,500,158,"49",867,5903,407927,8343,407927,,2,48,"adf4b24dc88adbbef0e2ee45e80b60d1fc9740ed",0,0,0,0,0,""
20200709,"UT",27356,,373801,,"totalTestsViral",473562,207,1700,74,472,,204,15661,"7/9/2020 11:13","2020-07-09T11:13:00Z","07/09 07:13",205,1700,,"2020-07-09T11:13:00Z",473562,31144,442418,,,,,401971,,,,,,,371,150,432,158,"49",601,5340,401157,7660,401157,,4,22,"ba289821edace415569788e71d8fffd1d198b58e",0,0,0,0,0,""
20200708,"UT",26755,,368461,,"totalTestsViral",465902,236,1678,76,465,,203,15178,"7/8/2020 11:13","2020-07-08T11:13:00Z","07/08 07:13",201,1678,,"2020-07-08T11:13:00Z",465902,30376,435526,,,,,395941,,,,,,,344,134,399,140,"49",722,5006,395216,7029,395216,,7,25,"400e367edb22901286011555888932167f72d574",0,0,0,0,0,""
20200707,"UT",26033,,363455,,"totalTestsViral",458873,248,1653,84,455,,200,14764,"7/7/2020 10:30","2020-07-07T10:30:00Z","07/07 06:30",194,1653,,"2020-07-07T10:30:00Z",458873,29607,429266,,,,,390234,,,,,,,312,115,362,121,"49",564,5427,389488,7810,389488,,4,49,"a3a10ad6b8a84002a5dfe447baede8aab079b831",0,0,0,0,0,""
20200706,"UT",25469,,358028,,"totalTestsViral",451063,244,1604,83,438,,194,14448,"7/6/2020 11:02","2020-07-06T11:02:00Z","07/06 07:02",190,1604,,"2020-07-06T11:02:00Z",451063,28871,422192,,,,,384126,,,,,,,288,101,331,107,"49",517,3024,383497,4162,383497,,6,22,"0c08c8fee2b9f74edeabcd63227fdff86171c7d7",0,0,0,0,0,""
20200705,"UT",24952,,355004,,"totalTestsViral",446901,237,1582,84,438,,195,14147,"7/5/2020 10:48","2020-07-05T10:48:00Z","07/05 06:48",184,1582,,"2020-07-05T10:48:00Z",446901,28530,418371,,,,,380788,,,,,,,254,67,297,73,"49",410,3090,379956,4168,379956,,3,17,"0190b80e0910645cec3d8de5958c750468c4ac51",0,0,0,0,0,""
20200704,"UT",24542,,351914,,"totalTestsViral",442733,255,1565,88,436,,194,13807,"7/4/2020 10:43","2020-07-04T10:43:00Z","07/04 06:43",181,1565,,"2020-07-04T10:43:00Z",442733,28177,414556,,,,,377370,,,,,,,249,62,292,68,"49",676,5396,376456,7487,376456,,0,36,"493df71bba0368259cb179af6fee34d64fc81b55",0,0,0,0,0,""
20200703,"UT",23866,,346518,,"totalTestsViral",435246,232,1529,85,434,,193,13408,"7/3/2020 11:46","2020-07-03T11:46:00Z","07/03 07:46",181,1529,,"2020-07-03T11:46:00Z",435246,27559,407687,,,,,371417,,,,,,,222,52,258,55,"49",596,5794,370384,7907,370384,,5,24,"33c164946e9ec88e49a068df2dddc7c18a2f8f9d",0,0,0,0,0,""
20200702,"UT",23270,,340724,,"totalTestsViral",427339,229,1505,81,430,,190,13076,"7/2/2020 11:31","2020-07-02T11:31:00Z","07/02 07:31",176,1505,,"2020-07-02T11:31:00Z",427339,26891,400448,,,,,365005,,,,,,,193,47,225,50,"49",554,5711,363994,7940,363994,,3,29,"0ddc64b9387755b3813d3c36ead60aa1c208d2e5",0,0,0,0,0,""
20200701,"UT",22716,,335013,,"totalTestsViral",419399,261,1476,84,423,,187,12707,"7/1/2020 10:10","2020-07-01T10:10:00Z","07/01 06:10",173,1476,,"2020-07-01T10:10:00Z",419399,26186,393213,,,,,358654,,,,,,,177,39,204,42,"49",499,4768,357729,6711,357729,,1,32,"2c85b22c136e804627980713cd633631605e54cc",0,0,0,0,0,""
20200630,"UT",22217,,330245,,"totalTestsViral",412688,250,1444,83,406,,178,12398,"6/30/2020 10:14","2020-06-30T10:14:00Z","06/30 06:14",172,1444,,"2020-06-30T10:14:00Z",412688,25556,387132,,,,,353309,,,,,,,142,31,163,33,"49",553,5180,352462,7237,352462,,4,27,"fc756e811612ecc1e84ffc382323a36165c28b7a",0,0,0,0,0,""
20200629,"UT",21664,,325065,,"totalTestsViral",405451,254,1417,80,394,,170,12205,"6/29/2020 10:25","2020-06-29T10:25:00Z","06/29 06:25",168,1417,,"2020-06-29T10:25:00Z",405451,24753,380698,,,,,347412,,,,,,,139,28,159,29,"49",564,5176,346729,6810,346729,,1,21,"1755c2ad076a6dff88ae1c238cc3e163bb195ea7",0,0,0,0,0,""
20200628,"UT",21100,,319889,,"totalTestsViral",398641,289,1396,83,389,,167,11931,"6/28/2020 11:06","2020-06-28T11:06:00Z","06/28 07:06",167,1396,,"2020-06-28T11:06:00Z",398641,24222,374419,,,,,341740,,,,,,,138,27,158,28,"49",472,5454,340989,7442,340989,,0,31,"73018c752d4c6e8661734f8625bd9bbd88ee44a5",0,0,0,0,0,""
20200627,"UT",20628,,314435,,"totalTestsViral",391199,287,1365,77,388,,166,11658,"6/27/2020 11:17","2020-06-27T11:17:00Z","06/27 07:17",167,1365,,"2020-06-27T11:17:00Z",391199,23736,367463,,,,,335848,,,,,,,136,25,156,26,"49",578,5911,335063,7760,335063,,1,44,"d59fd28d8009b27de0a5689194b21cda05ba4f0b",0,0,0,0,0,""
20200626,"UT",20050,,308524,,"totalTestsViral",383439,238,1321,80,375,,161,11097,"6/26/2020 10:23","2020-06-26T10:23:00Z","06/26 06:23",166,1321,,"2020-06-26T10:23:00Z",383439,23047,360392,,,,,329298,,,,,,,128,25,145,26,"49",676,4488,328574,6208,328574,,2,31,"aecc4b677904b47d8988432ff3e274d56014698a",0,0,0,0,0,""
20200625,"UT",19374,,304036,,"totalTestsViral",377231,230,1290,79,365,,160,10642,"6/25/2020 10:45","2020-06-25T10:45:00Z","06/25 06:45",164,1290,,"2020-06-25T10:45:00Z",377231,22431,354800,,,,,324239,,,,,,,109,24,124,25,"49",590,5156,323410,6874,323410,,1,34,"12f9e86b70fa46c2e965b5a33ee1a86816b47982",0,0,0,0,0,""
20200624,"UT",18784,,298880,,"totalTestsViral",370357,245,1256,77,355,,154,10334,"6/24/2020 10:46","2020-06-24T10:46:00Z","06/24 06:46",163,1256,,"2020-06-24T10:46:00Z",370357,21749,348608,,,,,318451,,,,,,,79,21,91,22,"49",484,4645,317664,6339,317664,,0,30,"1ee91a7678670815fef432326f06baad752e1051",0,0,0,0,0,""
20200623,"UT",18300,,294235,,"totalTestsViral",364018,214,1226,77,344,,153,10057,"6/23/2020 12:09","2020-06-23T12:09:00Z","06/23 08:09",163,1226,,"2020-06-23T12:09:00Z",364018,21146,342872,,,,,313237,,,,,,,76,20,87,21,"49",394,4301,312535,5721,312535,,5,34,"ff5b647f007fa1a76179771e1c4ff69f48dda3a2",0,0,0,0,0,""
20200622,"UT",17906,,289934,,"totalTestsViral",358297,198,1192,67,338,,150,9863,"6/22/2020 12:23","2020-06-22T12:23:00Z","06/22 08:23",158,1192,,"2020-06-22T12:23:00Z",358297,20590,337707,,,,,308406,,,,,,,58,18,69,19,"49",444,3395,307840,4463,307840,,0,8,"1d6e551ca3c56a8a003b1d0369fa21081622341f",0,0,0,0,0,""
20200621,"UT",17462,,286539,,"totalTestsViral",353834,222,1184,67,338,,150,9659,"6/21/2020 12:48","2020-06-21T12:48:00Z","06/21 08:48",158,1184,,"2020-06-21T12:48:00Z",353834,20246,333588,,,,,304692,,,,,,,58,18,69,19,"49",394,4400,304001,6117,304001,,3,23,"f4bfb3222e77d25649e4ea37bfeff83581772dc5",0,0,0,0,0,""
20200620,"UT",17068,,282139,,"totalTestsViral",347717,232,1161,66,333,,149,9390,"6/20/2020 11:33","2020-06-20T11:33:00Z","06/20 07:33",155,1161,,"2020-06-20T11:33:00Z",347717,19736,327981,,,,,299832,,,,,,,57,17,67,17,"49",643,4884,299207,6803,299207,,0,16,"87526af00f436dbc333b7752a75b5158d6a8c0f3",0,0,0,0,0,""
20200619,"UT",16425,,277255,,"totalTestsViral",340914,237,1145,63,330,,148,9113,"6/19/2020 10:20","2020-06-19T10:20:00Z","06/19 06:20",155,1145,,"2020-06-19T10:20:00Z",340914,19112,321802,,,,,294378,,,,,,,50,13,59,13,"49",586,4707,293680,6437,293680,,3,25,"b555213f23f7295c23904b98a847f8db991fb5e0",0,0,0,0,0,""
20200618,"UT",15839,,272548,,"totalTestsViral",334477,282,1120,66,326,,145,8786,"6/18/2020 10:14","2020-06-18T10:14:00Z","06/18 06:14",152,1120,,"2020-06-18T10:14:00Z",334477,18553,315924,,,,,289157,,,,,,,39,11,46,11,"49",495,3596,288387,4995,288387,,3,18,"4164ee12773522fa1403e3ae0b72a7f9f609067b",0,0,0,0,0,""
20200617,"UT",15344,,268952,,"totalTestsViral",329482,270,1102,64,321,,142,8552,"6/17/2020 10:18","2020-06-17T10:18:00Z","06/17 06:18",149,1102,,"2020-06-17T10:18:00Z",329482,17990,311492,,,,,285036,,,,,,,27,11,32,11,"49",407,3464,284296,4966,284296,,4,29,"9e3683a2f76107cdef221b464526f87bc25a89b7",0,0,0,0,0,""
20200616,"UT",14937,,265488,,"totalTestsViral",324516,271,1073,,311,,138,8470,"6/16/2020 10:36","2020-06-16T10:36:00Z","06/16 06:36",145,1073,,"2020-06-16T10:36:00Z",324516,17468,307048,,,,,281094,,,,,,,19,7,22,7,"49",329,3788,280425,5106,280425,,2,32,"fc78e5aec5989cba4cc6b3d9e8ee330d9486391b",0,0,0,0,0,""
20200615,"UT",14608,,261700,,"totalTestsViral",319410,184,1041,72,304,,134,8380,"6/15/2020 10:37","2020-06-15T10:37:00Z","06/15 06:37",143,1041,,"2020-06-15T10:37:00Z",319410,16962,302448,,,,,276882,,,,,,,5,5,5,5,"49",295,3265,276308,4508,276308,,4,13,"10b31d00eb93436b11fc5fd553ab9a5e3ca847c2",0,0,0,0,0,""
20200614,"UT",14313,,258435,,"totalTestsViral",314902,178,1028,,302,,134,8252,"6/14/2020 10:57","2020-06-14T10:57:00Z","06/14 06:57",139,1028,,"2020-06-14T10:57:00Z",314902,16616,298286,,,,,273307,,,,,,,5,5,5,5,"49",332,3882,272748,5291,272748,,0,16,"5199274a5f77e7f5432e818654390871c7c47964",0,0,0,0,0,""
20200613,"UT",13981,,254553,,"totalTestsViral",309611,236,1012,,300,,132,8114,"6/13/2020 10:30","2020-06-13T10:30:00Z","06/13 06:30",139,1012,,"2020-06-13T10:30:00Z",309611,16263,293348,,,,,269099,,,,,,,5,5,5,5,"49",404,4513,268534,6411,268534,,0,24,"3d4ad5c44da0ddd84eebb24490f6d01fb65e4c60",0,0,0,0,0,""
20200612,"UT",13577,,250040,,"totalTestsViral",303200,197,988,,294,,130,7935,"6/12/2020 10:20","2020-06-12T10:20:00Z","06/12 06:20",139,988,,"2020-06-12T10:20:00Z",303200,15816,287384,,,,,264173,,,,,,,5,5,5,5,"49",325,3453,263617,5184,263617,,8,20,"9832d3a3921272c1bdb86636c38d11fcfe0e3fd7",0,0,0,0,0,""
20200611,"UT",13252,,246587,,"totalTestsViral",298016,188,968,,282,,123,7745,"6/11/2020 10:16","2020-06-11T10:16:00Z","06/11 06:16",131,968,,"2020-06-11T10:16:00Z",298016,15416,282600,,,,,260380,,,,,,,3,3,3,3,"49",388,3959,259839,5409,259839,,3,14,"d608b1220f29b486c4d3569c71ca2ddb5d5cd04d",0,0,0,0,0,""
20200610,"UT",12864,,242628,,"totalTestsViral",292607,223,954,,276,,116,7587,"6/10/2020 10:02","2020-06-10T10:02:00Z","06/10 06:02",128,954,,"2020-06-10T10:02:00Z",292607,15021,277586,,,,,256057,,,,,,,,,,,"49",305,4779,255492,6399,255492,,1,23,"d9fc970c2ef162014f1f37a32896cc62c08683c0",0,0,0,0,0,""
20200609,"UT",12559,,237849,,"totalTestsViral",286208,230,931,,274,,116,7391,"6/9/2020 10:32","2020-06-09T10:32:00Z","06/09 06:32",127,931,,"2020-06-09T10:32:00Z",286208,14572,271636,,,,,250862,,,,,,,,,,,"49",237,3906,250408,5367,250408,,3,13,"db62f9b5d7d21d2f760d99e17992979f182eac8d",0,0,0,0,0,""
20200608,"UT",12322,,233943,,"totalTestsViral",280841,182,918,,270,,112,7255,"6/8/2020 15:00","2020-06-08T15:00:00Z","06/08 11:00",124,918,,"2020-06-08T15:00:00Z",280841,14181,266660,,,,,246587,,,,,,,,,,,"49",256,2618,246265,3798,246265,,3,18,"86c056555de34313a0cbb84fb7334f5de53fa2c6",0,0,0,0,0,""
20200607,"UT",12066,,231325,,"totalTestsViral",277043,207,900,,269,,111,7108,"6/7/2020 15:00","2020-06-07T15:00:00Z","06/07 11:00",121,900,,"2020-06-07T15:00:00Z",277043,13969,263074,,,,,243774,,,,,,,,,,,"49",268,3503,243391,4837,243391,,0,10,"3d38f0c5f88633d3c05990476f8f9f809312be5a",0,0,0,0,0,""
20200606,"UT",11798,,227822,,"totalTestsViral",272206,147,890,,266,,110,6939,"6/6/2020 15:00","2020-06-06T15:00:00Z","06/06 11:00",121,890,,"2020-06-06T15:00:00Z",272206,13640,258566,,,,,239975,,,,,,,,,,,"49",546,4323,239620,5947,239620,,1,20,"abae8f6eec99376aab90d379592373211cde5512",0,0,0,0,0,""
20200605,"UT",11252,,223499,,"totalTestsViral",266259,133,870,,262,,109,6788,"6/5/2020 15:00","2020-06-05T15:00:00Z","06/05 11:00",120,870,,"2020-06-05T15:00:00Z",266259,13011,253248,,,,,235074,,,,,,,,,,,"49",439,3283,234751,4638,234751,,3,20,"10114cac8c06495ce12414eb29c922b2388eba34",0,0,0,0,0,""
20200604,"UT",10813,,220216,,"totalTestsViral",261621,164,850,,258,,108,6628,"6/4/2020 15:00","2020-06-04T15:00:00Z","06/04 11:00",117,850,,"2020-06-04T15:00:00Z",261621,12566,249055,,,,,231368,,,,,,,,,,,"49",316,3553,231029,5094,231029,,0,21,"d826ef5fdfedde9aefef5a89d03c4c58baf58c8f",0,0,0,0,0,""
20200603,"UT",10497,,216663,,"totalTestsViral",256527,150,829,,250,,107,6501,"6/3/2020 15:00","2020-06-03T15:00:00Z","06/03 11:00",117,829,,"2020-06-03T15:00:00Z",256527,12133,244394,,,,,227448,,,,,,,,,,,"49",295,3105,227160,4119,227160,,4,28,"6ada62b5808b8251212cc2dff601bab25c08da9f",0,0,0,0,0,""
20200602,"UT",10202,,213558,,"totalTestsViral",252408,159,801,,243,,104,6319,"6/2/2020 15:00","2020-06-02T15:00:00Z","06/02 11:00",113,801,,"2020-06-02T15:00:00Z",252408,11829,240579,,,,,224069,,,,,,,,,,,"49",203,3605,223760,4891,223760,,0,12,"aec2a735b922f63a8234ceefaf38bfd3109b7ad0",0,0,0,0,0,""
20200601,"UT",9999,,209953,,"totalTestsViral",247517,134,789,,242,,102,6251,"6/1/2020 15:00","2020-06-01T15:00:00Z","06/01 11:00",113,789,,"2020-06-01T15:00:00Z",247517,11482,236035,,,,,220147,,,,,,,,,,,"49",202,2774,219952,3708,219952,,0,14,"84ca5fe66052f6f6c552326e81ece2d826e67af1",0,0,0,0,0,""
20200531,"UT",9797,,207179,,"totalTestsViral",243809,142,775,,242,,102,6137,"5/31/2020 15:00","2020-05-31T15:00:00Z","05/31 11:00",113,775,,"2020-05-31T15:00:00Z",243809,11296,232513,,,,,217211,,,,,,,,,,,"49",264,3645,216976,4840,216976,,1,12,"5ec00241e2f64d3a89641b4d3b5baf199e7b6c24",0,0,0,0,0,""
20200530,"UT",9533,,203534,,"totalTestsViral",238969,139,763,,241,,102,5995,"5/30/2020 15:00","2020-05-30T15:00:00Z","05/30 11:00",112,763,,"2020-05-30T15:00:00Z",238969,11030,227939,,,,,213334,,,,,,,,,,,"49",269,3905,213067,4973,213067,,5,10,"f0e4e96428b19cd1eeb465d61f8466008e884a55",0,0,0,0,0,""
20200529,"UT",9264,,199629,,"totalTestsViral",233996,135,753,,237,,102,5813,"5/29/2020 10:19","2020-05-29T10:19:00Z","05/29 06:19",107,753,,"2020-05-29T10:19:00Z",233996,10710,223286,,,,,209133,,,,,,,,,,,"49",343,2790,208893,4076,208893,,1,19,"e3fa8778b11ca922af93406f14129815b3a2c500",0,0,0,0,0,""
20200528,"UT",8921,,196839,,"totalTestsViral",229920,169,734,,231,,98,5623,"5/28/2020 10:04","2020-05-28T10:04:00Z","05/28 06:04",106,734,,"2020-05-28T10:04:00Z",229920,10396,219524,,,,,206073,,,,,,,,,,,"49",215,3143,205760,4520,205760,,1,18,"e8fec7ee4392d77617e04429f9a37d847f44a494",0,0,0,0,0,""
20200527,"UT",8706,,193696,,"totalTestsViral",225400,127,716,,223,,94,5499,"5/27/2020 11:04","2020-05-27T11:04:00Z","05/27 07:04",105,716,,"2020-05-27T11:04:00Z",225400,10081,215319,,,,,202646,,,,,,,,,,,"49",86,2522,202402,3349,202402,,4,20,"d7c0f51c4dd828bb567090606690389f7b184377",0,0,0,0,0,""
20200526,"UT",8620,,191174,,"totalTestsViral",222051,134,696,,217,,89,5346,"5/26/2020 10:19","2020-05-26T10:19:00Z","05/26 06:19",101,696,,"2020-05-26T10:19:00Z",222051,9841,212210,,,,,199914,,,,,,,,,,,"49",99,1696,199794,2276,199794,,3,4,"bf7989f95dbdc0a21657df00c46e5c9cbe0b661a",0,0,0,0,0,""
20200525,"UT",8521,,189478,,"totalTestsViral",219775,131,692,,215,,88,5218,"5/25/2020 10:15","2020-05-25T10:15:00Z","05/25 06:15",98,692,,"2020-05-25T10:15:00Z",219775,9687,210088,,,,,198084,,,,,,,,,,,"49",129,2044,197999,2776,197999,,1,4,"6f048a337f85995305bc19470e34191b561bdeda",0,0,0,0,0,""
20200524,"UT",8392,,187434,,"totalTestsViral",216999,128,688,,215,,88,5081,"5/24/2020 10:39","2020-05-24T10:39:00Z","05/24 06:39",97,688,,"2020-05-24T10:39:00Z",216999,9567,207432,,,,,195942,,,,,,,,,,,"49",132,3217,195826,4112,195826,,0,12,"e1a7cb79366ff7b7fa74989caba7a50c04883bb5",0,0,0,0,0,""
20200523,"UT",8260,,184217,,"totalTestsViral",212887,165,676,,213,,88,4898,"5/23/2020 11:28","2020-05-23T11:28:00Z","05/23 07:28",97,676,,"2020-05-23T11:28:00Z",212887,9403,203484,,,,,192588,,,,,,,,,,,"49",203,3317,192477,4316,192477,,4,16,"d56e8eb49d4ec189f1a40a858862c8d73cb7d48c",0,0,0,0,0,""
20200522,"UT",8057,,180900,,"totalTestsViral",208571,163,660,,210,,88,4748,"5/22/2020 15:00","2020-05-22T15:00:00Z","05/22 11:00",93,660,,"2020-05-22T15:00:00Z",208571,9181,199390,,,,,189097,,,,,,,,,,,"49",183,3045,188957,3924,188957,,1,13,"6193759747def5ce2faa5ff51f9d36059ce6f0ae",0,0,0,0,0,""
20200521,"UT",7874,,177855,,"totalTestsViral",204647,169,647,,207,,88,4596,"5/21/2020 10:45","2020-05-21T10:45:00Z","05/21 06:45",92,647,,"2020-05-21T10:45:00Z",204647,8969,195678,,,,,185886,,,,,,,,,,,"49",164,3061,185729,4230,185729,,2,16,"6b58c20b59781327c0e007c4e2098a095566e283",0,0,0,0,0,""
20200520,"UT",7710,,174794,,"totalTestsViral",200417,144,631,,200,,87,4423,"5/20/2020 10:15","2020-05-20T10:15:00Z","05/20 06:15",90,631,,"2020-05-20T10:15:00Z",200417,8768,191649,,,,,182659,,,,,,,,,,,"49",192,3426,182504,4566,182504,,2,12,"330934d6d3ca51b6df02f7a9580146427fbdf3e1",0,0,0,0,0,""
20200519,"UT",7518,,171368,,"totalTestsViral",195851,96,619,,197,,84,4275,"5/18/2020 10:29","2020-05-18T10:29:00Z","05/18 06:29",88,619,,"2020-05-18T10:29:00Z",195851,8549,187302,,,,,179044,,,,,,,,,,,"49",134,3175,178886,4217,178886,,8,24,"05d08253279f2b93bfbd0d9d9030f966150657f7",0,0,0,0,0,""
20200518,"UT",7384,,168193,,"totalTestsViral",191634,179,595,,197,,84,4183,"5/18/2020 10:29","2020-05-18T10:29:00Z","05/18 06:29",80,595,,"2020-05-18T10:29:00Z",191634,8323,183311,,,,,175664,,,,,,,,,,,"49",146,2552,175577,3300,175577,,0,9,"c9d9b6e23d22e34dfca00c9550c0f73b516562fb",0,0,0,0,0,""
20200517,"UT",7238,,165641,,"totalTestsViral",188334,181,586,,196,,84,4075,"5/17/2020 12:04","2020-05-17T12:04:00Z","05/17 08:04",80,586,,"2020-05-17T12:04:00Z",188334,8166,180168,,,,,172990,,,,,,,,,,,"49",170,3256,172879,4066,172879,,2,8,"ba92988bfb763c1ba74e1f0e8a2266818b56e2d4",0,0,0,0,0,""
20200516,"UT",7068,,162385,,"totalTestsViral",184268,168,578,,194,,84,3896,"5/16/2020 10:21","2020-05-16T10:21:00Z","05/16 06:21",78,578,,"2020-05-16T10:21:00Z",184268,7972,176296,,,,,169572,,,,,,,,,,,"49",155,3161,169453,4098,169453,,1,12,"96e4a91b0f0194b3108ac51e5fc8a9cbf16f02e6",0,0,0,0,0,""
20200515,"UT",6913,,159224,,"totalTestsViral",180170,161,566,,190,,83,3719,"5/15/2020 10:27","2020-05-15T10:27:00Z","05/15 06:27",77,566,,"2020-05-15T10:27:00Z",180170,7784,172386,,,,,166252,,,,,,,,,,,"49",164,3267,166137,4213,166137,,2,8,"a45395d3f531daecfdb6f8b1a171a2476279ec9a",0,0,0,0,0,""
20200514,"UT",6749,,155957,,"totalTestsViral",175957,142,558,,187,,83,3566,"5/14/2020 10:07","2020-05-14T10:07:00Z","05/14 06:07",75,558,,"2020-05-14T10:07:00Z",175957,7593,168364,,,,,162817,,,,,,,,,,,"49",129,2931,162706,3761,162706,,0,5,"2687420ecc36590669ea8318062050674def5478",0,0,0,0,0,""
20200513,"UT",6620,,153026,,"totalTestsViral",172196,158,553,,182,,81,3406,"5/13/2020 15:00","2020-05-13T15:00:00Z","05/13 11:00",75,553,,"2020-05-13T15:00:00Z",172196,7386,164810,,,,,159737,,,,,,,,,,,"49",188,3895,159646,4958,159646,,2,18,"e722a786285fc0bec6efd8aecf130bd17062d12a",0,0,0,0,0,""
20200512,"UT",6432,,149131,,"totalTestsViral",167238,166,535,,178,,80,3267,"5/12/2020 15:00","2020-05-12T15:00:00Z","05/12 11:00",73,535,,"2020-05-12T15:00:00Z",167238,7148,160090,,,,,155657,,,,,,,,,,,"49",70,2749,155563,3409,155563,,5,18,"3dc2110c8a8c8592e78e3fdbf49bdaecaefd61ed",0,0,0,0,0,""
20200511,"UT",6362,,146382,,"totalTestsViral",163829,160,517,,169,,76,3181,"5/11/2020 15:00","2020-05-11T15:00:00Z","05/11 11:00",68,517,,"2020-05-11T15:00:00Z",163829,7036,156793,,,,,152814,,,,,,,,,,,"49",111,1711,152744,2182,152744,,1,5,"ebc72c4f178e4c8f79836959c4043d5b6ffdbebc",0,0,0,0,0,""
20200510,"UT",6251,,144671,,"totalTestsViral",161647,144,512,,168,,76,3033,"5/10/2020 10:31","2020-05-10T10:31:00Z","05/10 06:31",67,512,,"2020-05-10T10:31:00Z",161647,6956,154691,,,,,151026,,,,,,,,,,,"49",148,2471,150922,3139,150922,,1,14,"92d11f73357709eec423b2b15ad0f06d142f0b1a",0,0,0,0,0,""
