"date","state","positive","probableCases","negative","pending","totalTestResultsSource","totalTestResults","hospitalizedCurrently","hospitalizedCumulative","inIcuCurrently","inIcuCumulative","onVentilatorCurrently","onVentilatorCumulative","recovered","lastUpdateEt","dateModified","checkTimeEt","death","hospitalized","hospitalizedDischarged","dateChecked","totalTestsViral","positiveTestsViral","negativeTestsViral","positiveCasesViral","deathConfirmed","deathProbable","totalTestEncountersViral","totalTestsPeopleViral","totalTestsAntibody","positiveTestsAntibody","negativeTestsAntibody","totalTestsPeopleAntibody","positiveTestsPeopleAntibody","negativeTestsPeopleAntibody","totalTestsPeopleAntigen","positiveTestsPeopleAntigen","totalTestsAntigen","positiveTestsAntigen","fips","positiveIncrease","negativeIncrease","total","totalTestResultsIncrease","posNeg","dataQualityGrade","deathIncrease","hospitalizedIncrease","hash","commercialScore","negativeRegularScore","negativeScore","positiveScore","score","grade"
20210307,"WA",344532,19479,,,"totalTestEncountersViral",5393756,431,19599,98,,43,,,"3/6/2021 02:59","2021-03-06T02:59:00Z","03/05 21:59",5041,19599,,"2021-03-06T02:59:00Z",,324994,5068404,325053,,,5393756,,,,,,,,,,,,"53",664,0,344532,24040,344532,,0,43,"d05df9ca1d090fd6a3f3f864eb442dc471e5861e",0,0,0,0,0,""
20210306,"WA",343868,19399,,,"totalTestEncountersViral",5369716,431,19556,98,,30,,,"3/5/2021 02:59","2021-03-05T02:59:00Z","03/04 21:59",5041,19556,,"2021-03-05T02:59:00Z",,324428,5044931,324469,,,5369716,,,,,,,,,,,,"53",778,0,343868,25314,343868,,9,56,"9c3d51898827e2a22da6bd3c711dc1f5e33ac644",0,0,0,0,0,""
20210305,"WA",343090,19251,,,"totalTestEncountersViral",5344402,413,19500,108,,57,,,"3/4/2021 02:59","2021-03-04T02:59:00Z","03/03 21:59",5032,19500,,"2021-03-04T02:59:00Z",,323771,5020273,323839,,,5344402,,,,,,,,,,,,"53",854,0,343090,24021,343090,,20,34,"078b9df9fe8e12351c7bd32105879bada84ba66b",0,0,0,0,0,""
20210304,"WA",342236,19113,,,"totalTestEncountersViral",5320381,461,19466,121,,61,,,"3/3/2021 02:59","2021-03-03T02:59:00Z","03/02 21:59",5012,19466,,"2021-03-03T02:59:00Z",,323057,4996968,323123,,,5320381,,,,,,,,,,,,"53",795,0,342236,18873,342236,,24,33,"406adfbf28c14b781aa58d405e33340f17ed3235",0,0,0,0,0,""
20210303,"WA",341441,18954,,,"totalTestEncountersViral",5301508,467,19433,131,,64,,,"3/2/2021 02:59","2021-03-02T02:59:00Z","03/01 21:59",4988,19433,,"2021-03-02T02:59:00Z",,322430,4978720,322487,,,5301508,,,,,,,,,,,,"53",733,0,341441,21178,341441,,19,61,"3fe4eb4ae0439801b47489f01d076af009c00413",0,0,0,0,0,""
20210302,"WA",340708,18827,,,"totalTestEncountersViral",5280330,473,19372,125,,61,,,"3/1/2021 02:59","2021-03-01T02:59:00Z","02/28 21:59",4969,19372,,"2021-03-01T02:59:00Z",,321822,4958153,321881,,,5280330,,,,,,,,,,,,"53",935,0,340708,45898,340708,,13,53,"df2280e8791072f3365a7360178c1b346da9f8f8",0,0,0,0,0,""
20210301,"WA",339773,18694,,,"totalTestEncountersViral",5234432,498,19319,135,,58,,,"2/27/2021 02:59","2021-02-27T02:59:00Z","02/26 21:59",4956,19319,,"2021-02-27T02:59:00Z",,321014,4913062,321079,,,5234432,,,,,,,,,,,,"53",0,0,339773,0,339773,,0,0,"d09e21118d736eaffaf6b2a9053715435abe95f1",0,0,0,0,0,""
20210228,"WA",339773,18694,,,"totalTestEncountersViral",5234432,498,19319,135,,58,,,"2/26/2021 02:59","2021-02-26T02:59:00Z","02/25 21:59",4956,19319,,"2021-02-26T02:59:00Z",,321014,4913062,321079,,,5234432,,,,,,,,,,,,"53",951,0,339773,21008,339773,,0,44,"10a010d30d841afad37ec751a61addb58228f1ab",0,0,0,0,0,""
20210227,"WA",338822,18505,,,"totalTestEncountersViral",5213424,498,19275,135,,59,,,"2/26/2021 02:59","2021-02-26T02:59:00Z","02/25 21:59",4956,19275,,"2021-02-26T02:59:00Z",,320250,4892820,320317,,,5213424,,,,,,,,,,,,"53",1169,0,338822,20174,338822,,14,51,"357c28aa54fd824756c92e1b0f551896020373bf",0,0,0,0,0,""
20210226,"WA",337653,18155,,,"totalTestEncountersViral",5193250,548,19224,168,,62,,,"2/25/2021 02:59","2021-02-25T02:59:00Z","02/24 21:59",4942,19224,,"2021-02-25T02:59:00Z",,319438,4873457,319498,,,5193250,,,,,,,,,,,,"53",1088,0,337653,25737,337653,,30,13,"6c5e8145bbbf49cf8bbe87ef83fbe500f5ac2470",0,0,0,0,0,""
20210225,"WA",336565,18055,,,"totalTestEncountersViral",5167513,534,19211,152,,60,,,"2/24/2021 02:59","2021-02-24T02:59:00Z","02/23 21:59",4912,19211,,"2021-02-24T02:59:00Z",,318442,4848716,318510,,,5167513,,,,,,,,,,,,"53",872,0,336565,21996,336565,,31,51,"e12f3a3a2eb47278e00669814d984b51b9c6cccf",0,0,0,0,0,""
20210224,"WA",335693,17888,,,"totalTestEncountersViral",5145517,544,19160,98,,58,,,"2/23/2021 02:59","2021-02-23T02:59:00Z","02/22 21:59",4881,19160,,"2021-02-23T02:59:00Z",,317740,4827423,317805,,,5145517,,,,,,,,,,,,"53",731,0,335693,25291,335693,,24,50,"631a12d71948112877c86fa72ac3e3d7c2e6270f",0,0,0,0,0,""
20210223,"WA",334962,17739,,,"totalTestEncountersViral",5120226,565,19110,121,,55,,,"2/22/2021 02:59","2021-02-22T02:59:00Z","02/21 21:59",4857,19110,,"2021-02-22T02:59:00Z",,317161,4802711,317223,,,5120226,,,,,,,,,,,,"53",1168,0,334962,46148,334962,,35,77,"da415d5852123847b64e2ae345f54b0d21f47901",0,0,0,0,0,""
20210222,"WA",333794,17608,,,"totalTestEncountersViral",5074078,608,19033,123,,54,,,"2/20/2021 02:59","2021-02-20T02:59:00Z","02/19 21:59",4822,19033,,"2021-02-20T02:59:00Z",,316119,4757606,316186,,,5074078,,,,,,,,,,,,"53",0,0,333794,0,333794,,0,0,"9de8273864eddb7c1a43d7f4a34917a8b5dd3e00",0,0,0,0,0,""
20210221,"WA",333794,17608,,,"totalTestEncountersViral",5074078,608,19033,123,,54,,,"2/20/2021 02:59","2021-02-20T02:59:00Z","02/19 21:59",4822,19033,,"2021-02-20T02:59:00Z",,316119,4757606,316186,,,5074078,,,,,,,,,,,,"53",890,0,333794,26024,333794,,0,64,"5dd0c219e13eb3dd9fc82743b2713c41360aeec4",0,0,0,0,0,""
20210220,"WA",332904,17485,,,"totalTestEncountersViral",5048054,608,18969,123,,59,,,"2/19/2021 02:59","2021-02-19T02:59:00Z","02/18 21:59",4822,18969,,"2021-02-19T02:59:00Z",,315364,4732340,315419,,,5048054,,,,,,,,,,,,"53",897,0,332904,22760,332904,,19,35,"8150e925fc2fb429eeb347109e52f7b99ba00f17",0,0,0,0,0,""
20210219,"WA",332007,17352,,,"totalTestEncountersViral",5025294,600,18934,129,,64,,,"2/18/2021 02:59","2021-02-18T02:59:00Z","02/17 21:59",4803,18934,,"2021-02-18T02:59:00Z",,314601,4710363,314655,,,5025294,,,,,,,,,,,,"53",1200,0,332007,27554,332007,,44,73,"7abb435652ee2081b037746577fba100fe5fbdb5",0,0,0,0,0,""
20210218,"WA",330807,17174,,,"totalTestEncountersViral",4997740,628,18861,151,,60,,,"2/17/2021 02:59","2021-02-17T02:59:00Z","02/16 21:59",4759,18861,,"2021-02-17T02:59:00Z",,313595,4683820,313633,,,4997740,,,,,,,,,,,,"53",1061,0,330807,30274,330807,,50,97,"de2e67b20566c2bc27686fd3861fefa2d55239cf",0,0,0,0,0,""
20210217,"WA",329746,16918,,,"totalTestEncountersViral",4967466,628,18764,151,,55,,,"2/16/2021 02:59","2021-02-16T02:59:00Z","02/15 21:59",4709,18764,,"2021-02-16T02:59:00Z",,312773,4654384,312828,,,4967466,,,,,,,,,,,,"53",1699,0,329746,71312,329746,,34,121,"f66c27e147df46d5c4e3629aaaf4783107970880",0,0,0,0,0,""
20210216,"WA",328047,16759,,,"totalTestEncountersViral",4896154,628,18643,151,,57,,,"2/13/2021 02:59","2021-02-13T02:59:00Z","02/12 21:59",4675,18643,,"2021-02-13T02:59:00Z",,311237,4584757,311288,,,4896154,,,,,,,,,,,,"53",0,0,328047,0,328047,,0,0,"eefd0dd070d7d40e03e152be7e31e14c5f2ccccc",0,0,0,0,0,""
20210215,"WA",328047,16759,,,"totalTestEncountersViral",4896154,628,18643,151,,62,,,"2/13/2021 02:59","2021-02-13T02:59:00Z","02/12 21:59",4675,18643,,"2021-02-13T02:59:00Z",,311237,4584757,311288,,,4896154,,,,,,,,,,,,"53",0,0,328047,0,328047,,0,0,"6236eee677cf8b2eeaee174397e6b3defbf81921",0,0,0,0,0,""
20210214,"WA",328047,16759,,,"totalTestEncountersViral",4896154,628,18643,151,,52,,,"2/13/2021 02:59","2021-02-13T02:59:00Z","02/12 21:59",4675,18643,,"2021-02-13T02:59:00Z",,311237,4584757,311288,,,4896154,,,,,,,,,,,,"53",880,0,328047,29161,328047,,0,39,"c4f039713ce446c1405237230a88569759630743",0,0,0,0,0,""
20210213,"WA",327167,16626,,,"totalTestEncountersViral",4866993,628,18604,151,,48,,,"2/12/2021 02:59","2021-02-12T02:59:00Z","02/11 21:59",4675,18604,,"2021-02-12T02:59:00Z",,310521,4556332,310541,,,4866993,,,,,,,,,,,,"53",1008,0,327167,26917,327167,,42,73,"69aa829c80dbe05d486bfdf7a831d1a0c5dddf99",0,0,0,0,0,""
20210212,"WA",326159,16486,,,"totalTestEncountersViral",4840076,678,18531,151,,79,,,"2/11/2021 02:59","2021-02-11T02:59:00Z","02/10 21:59",4633,18531,,"2021-02-11T02:59:00Z",,309629,4530317,309673,,,4840076,,,,,,,,,,,,"53",1453,0,326159,25411,326159,,30,15,"c1f3ac80d7e4175aab21d1475aa5d74381df7bfb",0,0,0,0,0,""
20210211,"WA",324706,16314,,,"totalTestEncountersViral",4814665,687,18516,151,,61,,,"2/10/2021 02:59","2021-02-10T02:59:00Z","02/09 21:59",4603,18516,,"2021-02-10T02:59:00Z",,308338,4506197,308392,,,4814665,,,,,,,,,,,,"53",681,0,324706,20740,324706,,45,-14,"330b0d0e35e7ca6c310797201b8c387beb1a4133",0,0,0,0,0,""
20210210,"WA",324025,16158,,,"totalTestEncountersViral",4793925,704,18530,160,,62,,,"2/9/2021 02:59","2021-02-09T02:59:00Z","02/08 21:59",4558,18530,,"2021-02-09T02:59:00Z",,307829,4485964,307867,,,4793925,,,,,,,,,,,,"53",811,0,324025,22088,324025,,107,50,"656ca186400cbf9c3a0d1082ce46cb1c0aa3cbea",0,0,0,0,0,""
20210209,"WA",323214,16025,,,"totalTestEncountersViral",4771837,719,18480,188,,78,,,"2/8/2021 02:59","2021-02-08T02:59:00Z","02/07 21:59",4451,18480,,"2021-02-08T02:59:00Z",,307163,4464543,307189,,,4771837,,,,,,,,,,,,"53",3068,0,323214,54978,323214,,2,197,"0fbf2970bb48590dfabcc953586e4a5586dbbf33",0,0,0,0,0,""
20210208,"WA",320146,15764,,,"totalTestEncountersViral",4716859,737,18283,186,,73,,,"2/6/2021 02:59","2021-02-06T02:59:00Z","02/05 21:59",4449,18283,,"2021-02-06T02:59:00Z",,304315,4412414,304382,,,4716859,,,,,,,,,,,,"53",0,0,320146,0,320146,,0,0,"fa48fda9e7c63156184e71da417adf889ceb7be7",0,0,0,0,0,""
20210207,"WA",320146,15764,,,"totalTestEncountersViral",4716859,737,18283,186,,73,,,"2/6/2021 02:59","2021-02-06T02:59:00Z","02/05 21:59",4449,18283,,"2021-02-06T02:59:00Z",,,,304382,,,4716859,,,,,,,,,,,,"53",775,0,320146,22209,320146,,0,127,"0ce8cdf10331e626c8bd3692437b3bf15cb2f443",0,0,0,0,0,""
20210206,"WA",319371,15410,,,"totalTestEncountersViral",4694650,737,18156,186,,73,,,"2/5/2021 02:59","2021-02-05T02:59:00Z","02/04 21:59",4449,18156,,"2021-02-05T02:59:00Z",,,,303961,,,4694650,,,,,,,,,,,,"53",1493,0,319371,23835,319371,,33,85,"e355815df26d5f08352004368736ee88e638ed08",0,0,0,0,0,""
20210205,"WA",317878,15096,,,"totalTestEncountersViral",4670815,789,18071,183,,80,,,"2/4/2021 02:59","2021-02-04T02:59:00Z","02/03 21:59",4416,18071,,"2021-02-04T02:59:00Z",,,,302782,,,4670815,,,,,,,,,,,,"53",1584,0,317878,24987,317878,,28,84,"7f45049dafc1302a62de25a83a51598579d0f543",0,0,0,0,0,""
20210204,"WA",316294,14922,,,"totalTestEncountersViral",4645828,789,17987,183,,83,,,"2/3/2021 02:59","2021-02-03T02:59:00Z","02/02 21:59",4388,17987,,"2021-02-03T02:59:00Z",,,,301372,,,4645828,,,,,,,,,,,,"53",1602,0,316294,31042,316294,,72,95,"bcad286aae6614b4ea36782bbcdae6918eb11373",0,0,0,0,0,""
20210203,"WA",314692,14674,,,"totalTestEncountersViral",4614786,838,17892,194,,89,,,"2/2/2021 02:59","2021-02-02T02:59:00Z","02/01 21:59",4316,17892,,"2021-02-02T02:59:00Z",,,,300018,,,4614786,,,,,,,,,,,,"53",1357,0,314692,17196,314692,,-2,80,"5c52cb35ff27f057e7091e545bf72ff1433dad42",0,0,0,0,0,""
20210202,"WA",313335,14237,,,"totalTestEncountersViral",4597590,814,17812,203,,90,,,"2/1/2021 02:59","2021-02-01T02:59:00Z","01/31 21:59",4318,17812,,"2021-02-01T02:59:00Z",,,,299098,,,4597590,,,,,,,,,,,,"53",1738,0,313335,49351,313335,,33,106,"472bbceec837622f51955d95030eedfbffba1ab8",0,0,0,0,0,""
20210201,"WA",311597,14084,,,"totalTestEncountersViral",4548239,797,17706,193,,88,,,"1/31/2021 02:59","2021-01-31T02:59:00Z","01/30 21:59",4285,17706,,"2021-01-31T02:59:00Z",,,,297513,,,4548239,,,,,,,,,,,,"53",0,0,311597,0,311597,,0,0,"92791f97f0788b3462068049676dde0000e4f0c8",0,0,0,0,0,""
20210131,"WA",311597,14084,,,"totalTestEncountersViral",4548239,797,17706,193,,88,,,"1/31/2021 02:59","2021-01-31T02:59:00Z","01/30 21:59",4285,17706,,"2021-01-31T02:59:00Z",,,,297513,,,4548239,,,,,,,,,,,,"53",1796,0,311597,24018,311597,,0,163,"83ebdebcdaf7b1fcb3402188a97df52a23847951",0,0,0,0,0,""
20210130,"WA",309801,13940,,,"totalTestEncountersViral",4524221,797,17543,193,,102,,,"1/29/2021 02:59","2021-01-29T02:59:00Z","01/28 21:59",4285,17543,,"2021-01-29T02:59:00Z",,,,295861,,,4524221,,,,,,,,,,,,"53",1992,0,309801,28758,309801,,42,26,"905df65dbe3b2ebf9ba5b12050e30ba62d38a1fc",0,0,0,0,0,""
20210129,"WA",307809,13831,,,"totalTestEncountersViral",4495463,806,17517,195,,102,,,"1/28/2021 02:59","2021-01-28T02:59:00Z","01/27 21:59",4243,17517,,"2021-01-28T02:59:00Z",,,,293978,,,4495463,,,,,,,,,,,,"53",2520,0,307809,25248,307809,,32,68,"7ea6a7fa6739a52623885257a32f09abab1eef24",0,0,0,0,0,""
20210128,"WA",305289,13588,,,"totalTestEncountersViral",4470215,823,17449,197,,99,,,"1/27/2021 02:59","2021-01-27T02:59:00Z","01/26 21:59",4211,17449,,"2021-01-27T02:59:00Z",,,,291701,,,4470215,,,,,,,,,,,,"53",1807,0,305289,23371,305289,,44,95,"2658050249df0efa1f5206b9a4361e3dea75f945",0,0,0,0,0,""
20210127,"WA",303482,13314,,,"totalTestEncountersViral",4446844,869,17354,184,,100,,,"1/26/2021 02:59","2021-01-26T02:59:00Z","01/25 21:59",4167,17354,,"2021-01-26T02:59:00Z",,,,290168,,,4446844,,,,,,,,,,,,"53",1341,0,303482,22614,303482,,19,95,"d20f4da4e6cc903ac80dbd1d830600e56acb2c29",0,0,0,0,0,""
20210126,"WA",302141,13193,,,"totalTestEncountersViral",4424230,846,17259,173,,82,,,"1/25/2021 02:59","2021-01-25T02:59:00Z","01/24 21:59",4148,17259,,"2021-01-25T02:59:00Z",,,,288948,,,4424230,,,,,,,,,,,,"53",1943,0,302141,50584,302141,,34,130,"fe1d363e6193784483d4f48737c99718448e8dbb",0,0,0,0,0,""
20210125,"WA",300198,13167,,,"totalTestEncountersViral",4373646,916,17129,242,,100,,,"1/23/2021 02:59","2021-01-23T02:59:00Z","01/22 21:59",4114,17129,,"2021-01-23T02:59:00Z",,,,287031,,,4373646,,,,,,,,,,,,"53",0,0,300198,0,300198,,0,0,"451394ff45c15698db369a008ad086b69c5db430",0,0,0,0,0,""
20210124,"WA",300198,13167,,,"totalTestEncountersViral",4373646,916,17129,242,,100,,,"1/23/2021 02:59","2021-01-23T02:59:00Z","01/22 21:59",4114,17129,,"2021-01-23T02:59:00Z",,,,287031,,,4373646,,,,,,,,,,,,"53",1949,0,300198,23867,300198,,0,92,"bf86632bfe277463890608d5b0c705c475c61a2d",0,0,0,0,0,""
20210123,"WA",298249,13062,,,"totalTestEncountersViral",4349779,916,17037,242,,83,,,"1/22/2021 02:59","2021-01-22T02:59:00Z","01/21 21:59",4114,17037,,"2021-01-22T02:59:00Z",,,,285187,,,4349779,,,,,,,,,,,,"53",2162,0,298249,23981,298249,,49,98,"1ae105704f4842d9c8dd02f701d27f438aa5da66",0,0,0,0,0,""
20210122,"WA",296087,12899,,,"totalTestEncountersViral",4325798,1012,16939,243,,80,,,"1/21/2021 02:59","2021-01-21T02:59:00Z","01/20 21:59",4065,16939,,"2021-01-21T02:59:00Z",,,,283188,,,4325798,,,,,,,,,,,,"53",2070,0,296087,28492,296087,,125,91,"d02861f78fe2b07675588ac7e42ab4a01ea48c93",0,0,0,0,0,""
20210121,"WA",294017,12759,,,"totalTestEncountersViral",4297306,977,16848,221,,99,,,"1/20/2021 02:59","2021-01-20T02:59:00Z","01/19 21:59",3940,16848,,"2021-01-20T02:59:00Z",,,,281258,,,4297306,,,,,,,,,,,,"53",2028,0,294017,31758,294017,,0,206,"2f579425dfc9a3b4232826a4ad0b61a5325d7095",0,0,0,0,0,""
20210120,"WA",291989,12568,,,"totalTestEncountersViral",4265548,1012,16642,243,,104,,,"1/19/2021 02:59","2021-01-19T02:59:00Z","01/18 21:59",3940,16642,,"2021-01-19T02:59:00Z",,,,279421,,,4265548,,,,,,,,,,,,"53",2050,0,291989,31790,291989,,37,84,"85673520113d3f81949768985144f197a54e6e0f",0,0,0,0,0,""
20210119,"WA",289939,12535,,,"totalTestEncountersViral",4233758,1066,16558,238,,158,,,"1/17/2021 02:59","2021-01-17T02:59:00Z","01/16 21:59",3903,16558,,"2021-01-17T02:59:00Z",,,,277404,,,4233758,,,,,,,,,,,,"53",0,0,289939,0,289939,,0,0,"5b6c9e8e9f968c9b7f7a832804b0e0333e934d24",0,0,0,0,0,""
20210118,"WA",289939,12535,,,"totalTestEncountersViral",4233758,1066,16558,238,,158,,,"1/17/2021 02:59","2021-01-17T02:59:00Z","01/16 21:59",3903,16558,,"2021-01-17T02:59:00Z",,,,277404,,,4233758,,,,,,,,,,,,"53",3969,0,289939,53925,289939,,0,188,"5d031f02abac992d39fab51939f498def79dba14",0,0,0,0,0,""
20210117,"WA",285970,12267,,,"totalTestEncountersViral",4179833,1066,16370,238,,105,,,"1/15/2021 02:59","2021-01-15T02:59:00Z","01/14 21:59",3903,16370,,"2021-01-15T02:59:00Z",,,,273703,,,4179833,,,,,,,,,,,,"53",0,0,285970,0,285970,,0,0,"21e8654167d53398ce00a7c3fd90adab2d894ed8",0,0,0,0,0,""
20210116,"WA",285970,12267,,,"totalTestEncountersViral",4179833,1066,16370,238,,105,,,"1/15/2021 02:59","2021-01-15T02:59:00Z","01/14 21:59",3903,16370,,"2021-01-15T02:59:00Z",,,,273703,,,4179833,,,,,,,,,,,,"53",2193,0,285970,26619,285970,,27,290,"7295dd4972432a45dc9ca10e57ecc4c6bb001b24",0,0,0,0,0,""
20210115,"WA",283777,12134,,,"totalTestEncountersViral",4153214,1105,16080,202,,93,,,"1/14/2021 02:59","2021-01-14T02:59:00Z","01/13 21:59",3876,16080,,"2021-01-14T02:59:00Z",,,,271643,,,4153214,,,,,,,,,,,,"53",2575,0,283777,24797,283777,,38,0,"975a3018e744f84a243de94a126ba24245146ad5",0,0,0,0,0,""
20210114,"WA",281202,12001,,,"totalTestEncountersViral",4128417,1083,16080,215,,93,,,"1/13/2021 02:59","2021-01-13T02:59:00Z","01/12 21:59",3838,16080,,"2021-01-13T02:59:00Z",,,,269201,,,4128417,,,,,,,,,,,,"53",2658,0,281202,17770,281202,,49,12,"8b6cee0898f14a89cc54f2d71791533beba6562f",0,0,0,0,0,""
20210113,"WA",278544,11843,,,"totalTestEncountersViral",4110647,1076,16068,216,,111,,,"1/12/2021 02:59","2021-01-12T02:59:00Z","01/11 21:59",3789,16068,,"2021-01-12T02:59:00Z",,,,266701,,,4110647,,,,,,,,,,,,"53",1858,0,278544,23116,278544,,90,90,"e774ce5bcadf550b8f1b6d5ac12673bb2ccaf680",0,0,0,0,0,""
20210112,"WA",276686,11374,,,"totalTestEncountersViral",4087531,1074,15978,234,,116,,,"1/11/2021 02:59","2021-01-11T02:59:00Z","01/10 21:59",3699,15978,,"2021-01-11T02:59:00Z",,,,265312,,,4087531,,,,,,,,,,,,"53",5091,0,276686,52757,276686,,1,207,"e9f07425f40384ba66645b48f90d6cbbbbb25274",0,0,0,0,0,""
20210111,"WA",271595,11235,,,"totalTestEncountersViral",4034774,1177,15771,245,,86,,,"1/9/2021 02:59","2021-01-09T02:59:00Z","01/08 21:59",3698,15771,,"2021-01-09T02:59:00Z",,,,260360,,,4034774,,,,,,,,,,,,"53",0,0,271595,0,271595,,0,0,"99573b4d3be2500cdbad2e55bc405f9b5ef497f1",0,0,0,0,0,""
20210110,"WA",271595,11235,,,"totalTestEncountersViral",4034774,1177,15771,245,,86,,,"1/9/2021 02:59","2021-01-09T02:59:00Z","01/08 21:59",3698,15771,,"2021-01-09T02:59:00Z",,,,260360,,,4034774,,,,,,,,,,,,"53",2988,0,271595,24990,271595,,-1,214,"31b165574e9596ce781a08d2dfc1387ab2ede98d",0,0,0,0,0,""
20210109,"WA",268607,11160,,,"totalTestEncountersViral",4009784,1177,15557,245,,118,,,"1/8/2021 02:59","2021-01-08T02:59:00Z","01/07 21:59",3699,15557,,"2021-01-08T02:59:00Z",,,,257447,,,4009784,,,,,,,,,,,,"53",4595,0,268607,22646,268607,,65,-11,"ae50afb581bb3119885e1a29b3054ae0d6b7ad5b",0,0,0,0,0,""
20210108,"WA",264012,10611,,,"totalTestEncountersViral",3987138,1197,15568,242,,104,,,"1/7/2021 02:59","2021-01-07T02:59:00Z","01/06 21:59",3634,15568,,"2021-01-07T02:59:00Z",,,,253401,,,3987138,,,,,,,,,,,,"53",3260,0,264012,17549,264012,,29,153,"984e1cb0d438f3e97948af6f7ad3c4d33b4a3111",0,0,0,0,0,""
20210107,"WA",260752,10446,,,"totalTestEncountersViral",3969589,1159,15415,266,,109,,,"1/6/2021 02:59","2021-01-06T02:59:00Z","01/05 21:59",3605,15415,,"2021-01-06T02:59:00Z",,,,250306,,,3969589,,,,,,,,,,,,"53",1985,0,260752,19957,260752,,64,88,"8d1d46ce5e28b9353b663015c75a07e311defbdb",0,0,0,0,0,""
20210106,"WA",258767,10187,,,"totalTestEncountersViral",3949632,1167,15327,262,,121,,,"1/5/2021 02:59","2021-01-05T02:59:00Z","01/04 21:59",3541,15327,,"2021-01-05T02:59:00Z",,,,248580,,,3949632,,,,,,,,,,,,"53",2332,0,258767,13872,258767,,59,167,"7ca725715a2393cc642d723c49ec8ed727f6fc94",0,0,0,0,0,""
20210105,"WA",256435,10059,,,"totalTestEncountersViral",3935760,1117,15160,249,,109,,,"1/4/2021 02:59","2021-01-04T02:59:00Z","01/03 21:59",3482,15160,,"2021-01-04T02:59:00Z",,,,246376,,,3935760,,,,,,,,,,,,"53",1039,0,256435,25788,256435,,23,49,"7ba0359667729afb0cf70d10974d23b3d3a6fa4b",0,0,0,0,0,""
20210104,"WA",255396,10015,,,"totalTestEncountersViral",3909972,1138,15111,248,,116,,,"1/3/2021 02:59","2021-01-03T02:59:00Z","01/02 21:59",3459,15111,,"2021-01-03T02:59:00Z",,,,245381,,,3909972,,,,,,,,,,,,"53",8644,0,255396,73152,255396,,-2,363,"d3aad91a89c1e41e333e6c18fc93c8f428c5e537",0,0,0,0,0,""
20210103,"WA",246752,9587,,,"totalTestEncountersViral",3836820,1138,14748,248,,118,,,"12/31/2020 02:59","2020-12-31T02:59:00Z","12/30 21:59",3461,14748,,"2020-12-31T02:59:00Z",,,,237165,,,3836820,,,,,,,,,,,,"53",0,0,246752,0,246752,,0,0,"98f364782c0217190bcf73411f88313df64111b2",0,0,0,0,0,""
20210102,"WA",246752,9587,,,"totalTestEncountersViral",3836820,1138,14748,248,,118,,,"12/31/2020 02:59","2020-12-31T02:59:00Z","12/30 21:59",3461,14748,,"2020-12-31T02:59:00Z",,,,237165,,,3836820,,,,,,,,,,,,"53",0,0,246752,0,246752,,0,0,"aaa87a3f6f8f02b268bd5f6b728a445fedf167fc",0,0,0,0,0,""
20210101,"WA",246752,9587,,,"totalTestEncountersViral",3836820,1138,14748,248,,118,,,"12/31/2020 02:59","2020-12-31T02:59:00Z","12/30 21:59",3461,14748,,"2020-12-31T02:59:00Z",,,,237165,,,3836820,,,,,,,,,,,,"53",4422,0,246752,31430,246752,,41,177,"39482dbee26883b0e9a52613b78c1d51f7b0c968",0,0,0,0,0,""
20201231,"WA",242330,9337,,,"totalTestEncountersViral",3805390,1088,14571,235,,118,,,"12/30/2020 02:59","2020-12-30T02:59:00Z","12/29 21:59",3420,14571,,"2020-12-30T02:59:00Z",,,,232993,,,3805390,,,,,,,,,,,,"53",1484,0,242330,7069,242330,,51,126,"8a5757b99b3f85e377588e1e6a0fe29e1b11e16d",0,0,0,0,0,""
20201230,"WA",240846,9122,,,"totalTestEncountersViral",3798321,1201,14445,245,,108,,,"12/29/2020 02:59","2020-12-29T02:59:00Z","12/28 21:59",3369,14445,,"2020-12-29T02:59:00Z",,,,231724,,,3798321,,,,,,,,,,,,"53",2174,0,240846,29659,240846,,174,169,"3748194e9e18010778fca2d3947e50985c1874ea",0,0,0,0,0,""
20201229,"WA",238672,9000,,,"totalTestEncountersViral",3768662,1280,14276,265,,105,,,"12/28/2020 02:59","2020-12-28T02:59:00Z","12/27 21:59",3195,14276,,"2020-12-28T02:59:00Z",,,,229672,,,3768662,,,,,,,,,,,,"53",1953,0,238672,57883,238672,,11,180,"33f3eb4c402c6254c5b3c698b2eabbe6c629aaea",0,0,0,0,0,""
20201228,"WA",236719,8924,,,"totalTestEncountersViral",3710779,1200,14096,243,,90,,,"12/26/2020 02:59","2020-12-26T02:59:00Z","12/25 21:59",3184,14096,,"2020-12-26T02:59:00Z",,,,227795,,,3710779,,,,,,,,,,,,"53",0,0,236719,0,236719,,0,0,"6b12baa961f72dffe8655ba33e51fe8b8cf48b64",0,0,0,0,0,""
20201227,"WA",236719,8924,,,"totalTestEncountersViral",3710779,1200,14096,243,,90,,,"12/26/2020 02:59","2020-12-26T02:59:00Z","12/25 21:59",3184,14096,,"2020-12-26T02:59:00Z",,,,227795,,,3710779,,,,,,,,,,,,"53",3626,0,236719,61569,236719,,0,188,"4cf10cf77f93b94f3e1f4bb9645a8ef71055be4a",0,0,0,0,0,""
20201226,"WA",233093,8694,,,"totalTestEncountersViral",3649210,1200,13908,243,,108,,,"12/24/2020 02:59","2020-12-24T02:59:00Z","12/23 21:59",3184,13908,,"2020-12-24T02:59:00Z",,,,224399,,,3649210,,,,,,,,,,,,"53",0,0,233093,0,233093,,0,0,"83ae82f4c6f36b91df7ca74cf8f03d48c1fa1235",0,0,0,0,0,""
20201225,"WA",233093,8694,,,"totalTestEncountersViral",3649210,1200,13908,243,,108,,,"12/24/2020 02:59","2020-12-24T02:59:00Z","12/23 21:59",3184,13908,,"2020-12-24T02:59:00Z",,,,224399,,,3649210,,,,,,,,,,,,"53",2891,0,233093,28560,233093,,22,291,"50be06a47db783ff27a2b8d56d919db3e5f369c7",0,0,0,0,0,""
20201224,"WA",230202,8507,,,"totalTestEncountersViral",3620650,1202,13617,263,,105,,,"12/23/2020 02:59","2020-12-23T02:59:00Z","12/22 21:59",3162,13617,,"2020-12-23T02:59:00Z",,,,221695,,,3620650,,,,,,,,,,,,"53",2315,0,230202,30191,230202,,31,27,"62a4192de89f8f1376014f750eed2cb5b646e75c",0,0,0,0,0,""
20201223,"WA",227887,8303,,,"totalTestEncountersViral",3590459,774,13590,195,,97,,,"12/22/2020 02:59","2020-12-22T02:59:00Z","12/21 21:59",3131,13590,,"2020-12-22T02:59:00Z",,,,219584,,,3590459,,,,,,,,,,,,"53",1252,0,227887,30764,227887,,25,75,"03c06b58f4581059d23ce1786d4692ba55b8f229",0,0,0,0,0,""
20201222,"WA",226635,8220,,,"totalTestEncountersViral",3559695,1207,13515,272,,128,,,"12/21/2020 02:59","2020-12-21T02:59:00Z","12/20 21:59",3106,13515,,"2020-12-21T02:59:00Z",,,,218415,,,3559695,,,,,,,,,,,,"53",4035,0,226635,56118,226635,,2,124,"ded12df47dea65c287eb0fec71bbaefbce169c75",0,0,0,0,0,""
20201221,"WA",222600,8134,,,"totalTestEncountersViral",3503577,1175,13391,258,,137,,,"12/19/2020 02:59","2020-12-19T02:59:00Z","12/18 21:59",3104,13391,,"2020-12-19T02:59:00Z",,,,214466,,,3503577,,,,,,,,,,,,"53",0,0,222600,0,222600,,0,0,"a7100b7d3df5f23f1f159bada65fd1ab726227d3",0,0,0,0,0,""
20201220,"WA",222600,8134,,,"totalTestEncountersViral",3503577,1175,13391,258,,137,,,"12/19/2020 02:59","2020-12-19T02:59:00Z","12/18 21:59",3104,13391,,"2020-12-19T02:59:00Z",,,,214466,,,3503577,,,,,,,,,,,,"53",2332,0,222600,24949,222600,,0,100,"02dc10e3e4eaa29ee3d14a7f25b8a1f74f8602f0",0,0,0,0,0,""
20201219,"WA",220268,7985,,,"totalTestEncountersViral",3478628,1175,13291,258,,144,,,"12/18/2020 02:59","2020-12-18T02:59:00Z","12/17 21:59",3104,13291,,"2020-12-18T02:59:00Z",,,,212283,,,3478628,,,,,,,,,,,,"53",3063,0,220268,45736,220268,,-13,56,"eb3791fe16e61041ee0168cdcf75e290780424f0",0,0,0,0,0,""
20201218,"WA",217205,7861,,,"totalTestEncountersViral",3432892,1231,13235,273,,150,,,"12/17/2020 02:59","2020-12-17T02:59:00Z","12/16 21:59",3117,13235,,"2020-12-17T02:59:00Z",,,,209344,,,3432892,,,,,,,,,,,,"53",2940,0,217205,0,217205,,75,161,"bb4ecc5d2e21990d085a5e536aa00c19b02c01f9",0,0,0,0,0,""
20201217,"WA",214265,7671,,,"totalTestEncountersViral",3432892,1233,13074,279,,141,,,"12/16/2020 02:59","2020-12-16T02:59:00Z","12/15 21:59",3042,13074,,"2020-12-16T02:59:00Z",,,,206594,,,3432892,,,,,,,,,,,,"53",61,0,214265,21216,214265,,89,301,"4f3b0199bb4a49745c7167f9709b1f6197b4e28d",0,0,0,0,0,""
20201216,"WA",214204,7660,,,"totalTestEncountersViral",3411676,1181,12773,260,,138,,,"12/15/2020 02:59","2020-12-15T02:59:00Z","12/14 21:59",2953,12773,,"2020-12-15T02:59:00Z",,,,206544,2953,,3411676,,,,,,,,,,,,"53",667,0,214204,31332,214204,,35,124,"357709c3b30fd01be48da19ddbed938b7a93d556",0,0,0,0,0,""
20201215,"WA",213537,7512,,,"totalTestEncountersViral",3380344,1144,12649,250,,128,,,"12/14/2020 02:59","2020-12-14T02:59:00Z","12/13 21:59",2918,12649,,"2020-12-14T02:59:00Z",,,,206025,2918,,3380344,,,,,,,,,,,,"53",652,0,213537,32441,213537,,39,124,"703b3421ae62c0d2215bf35083104c13e863b268",0,0,0,0,0,""
20201214,"WA",212885,7472,,,"totalTestEncountersViral",3347903,1140,12525,248,,147,,,"12/13/2020 02:59","2020-12-13T02:59:00Z","12/12 21:59",2879,12525,,"2020-12-13T02:59:00Z",,,,205413,2879,,3347903,,,,,,,,,,,,"53",1410,0,212885,27833,212885,,0,157,"1da9ff73fa1a63a48ddf8ec8f075c4b57446cfc5",0,0,0,0,0,""
20201213,"WA",211475,7415,,,"totalTestEncountersViral",3320070,1140,12368,248,,131,,,"12/12/2020 02:59","2020-12-12T02:59:00Z","12/11 21:59",2879,12368,,"2020-12-12T02:59:00Z",,,,204060,2879,,3320070,,,,,,,,,,,,"53",2228,0,211475,34134,211475,,0,131,"6b20e5af8b556a863a265564ec1d105afaa3d203",0,0,0,0,0,""
20201212,"WA",209247,7247,,,"totalTestEncountersViral",3285936,1140,12237,248,,133,,,"12/11/2020 02:59","2020-12-11T02:59:00Z","12/10 21:59",2879,12237,,"2020-12-11T02:59:00Z",,,,202000,2879,,3285936,,,,,,,,,,,,"53",2421,0,209247,29098,209247,,29,153,"41bdb16c220a3796450771541dd4c13790a5e04e",0,0,0,0,0,""
20201211,"WA",206826,7097,,,"totalTestEncountersViral",3256838,1166,12084,262,,133,,,"12/10/2020 02:59","2020-12-10T02:59:00Z","12/09 21:59",2850,12084,,"2020-12-10T02:59:00Z",,,,199729,2850,,3256838,,,,,,,,,,,,"53",2557,0,206826,31410,206826,,-166,88,"791cc8e1d05fb735ef91ea9889813a5ebf2d8acb",0,0,0,0,0,""
20201210,"WA",204269,6935,,,"totalTestEncountersViral",3225428,1177,11996,294,,144,,,"12/9/2020 02:59","2020-12-09T02:59:00Z","12/08 21:59",3016,11996,,"2020-12-09T02:59:00Z",,,,197334,3016,,3225428,,,,,,,,,,,,"53",2977,0,204269,28378,204269,,49,155,"b755b9bb7a91124e42a2ea71a567d0d4de6cde99",0,0,0,0,0,""
20201209,"WA",201292,6687,,,"totalTestEncountersViral",3197050,1114,11841,294,,141,,,"12/8/2020 02:59","2020-12-08T02:59:00Z","12/07 21:59",2967,11841,,"2020-12-08T02:59:00Z",,,,194605,2967,,3197050,,,,,,,,,,,,"53",3650,0,201292,32336,201292,,26,145,"6cc4f834fbe6022b45e78bbbdb86855771f28f49",0,0,0,0,0,""
20201208,"WA",197642,6401,,,"totalTestEncountersViral",3164714,1094,11696,281,,135,,,"12/7/2020 02:59","2020-12-07T02:59:00Z","12/06 21:59",2941,11696,,"2020-12-07T02:59:00Z",,,,191241,2941,,3164714,,,,,,,,,,,,"53",1182,0,197642,21714,197642,,16,152,"148c10c0f0ed5c0a9521d37adfd366be4e6bdc34",0,0,0,0,0,""
20201207,"WA",196460,6361,,,"totalTestEncountersViral",3143000,1099,11544,274,,135,,,"12/6/2020 02:59","2020-12-06T02:59:00Z","12/05 21:59",2925,11544,,"2020-12-06T02:59:00Z",,,,190099,2925,,3143000,,,,,,,,,,,,"53",1773,0,196460,9155,196460,,0,69,"3d61dca02f175f8501034ddda913a3f8fe17d777",0,0,0,0,0,""
20201206,"WA",194687,6276,,,"totalTestEncountersViral",3133845,1099,11475,274,,136,,,"12/4/2020 02:59","2020-12-04T02:59:00Z","12/03 21:59",2925,11475,,"2020-12-04T02:59:00Z",,,,188411,2925,,3133845,,,,,,,,,,,,"53",3080,0,194687,13699,194687,,0,202,"31db6a71d7120c191c4854c7ae1d331df2dfd5ee",0,0,0,0,0,""
20201205,"WA",191607,6114,,,"totalTestEncountersViral",3120146,1099,11273,274,,132,,,"12/4/2020 02:59","2020-12-04T02:59:00Z","12/03 21:59",2925,11273,,"2020-12-04T02:59:00Z",,,,185493,2925,,3120146,,,,,,,,,,,,"53",3138,0,191607,225779,191607,,25,78,"afbeb4b557304d36b3b9ea96c5f91c0e248fe2a0",0,0,0,0,0,""
20201204,"WA",188469,5912,,,"totalTestEncountersViral",2894367,1097,11195,278,,137,,,"12/3/2020 02:59","2020-12-03T02:59:00Z","12/02 21:59",2900,11195,,"2020-12-03T02:59:00Z",,,,182557,2900,,2894367,,,,,,,,,,,,"53",3312,0,188469,0,188469,,50,241,"6ad91f7b6803ba0d2fef2e4f12fb9159fefae659",0,0,0,0,0,""
20201203,"WA",185157,5744,,,"totalTestEncountersViral",2894367,1083,10954,274,,135,,,"12/2/2020 02:59","2020-12-02T02:59:00Z","12/01 21:59",2850,10954,,"2020-12-02T02:59:00Z",,,,179413,2850,,2894367,,,,,,,,,,,,"53",3401,0,185157,0,185157,,45,34,"856f97160163fed8ee65ff4abbdc799418d1d9bc",0,0,0,0,0,""
20201202,"WA",181756,5478,,,"totalTestEncountersViral",2894367,1077,10920,284,,128,,,"12/1/2020 02:59","2020-12-01T02:59:00Z","11/30 21:59",2805,10920,,"2020-12-01T02:59:00Z",,,,176278,2805,,2894367,,,,,,,,,,,,"53",4702,0,181756,0,181756,,31,25,"f00ed30f96be37a12a1685dd0fc13f9776608cfd",0,0,0,0,0,""
20201201,"WA",177054,5276,,,"totalTestEncountersViral",2894367,1003,10895,260,,113,,,"11/30/2020 02:59","2020-11-30T02:59:00Z","11/29 21:59",2774,10895,,"2020-11-30T02:59:00Z",,,,171778,2774,,2894367,,,,,,,,,,,,"53",1314,0,177054,0,177054,,71,136,"314471ef5834d7f4dcc74f1c2ab3de69a6da048b",0,0,0,0,0,""
20201130,"WA",175740,5215,,,"totalTestEncountersViral",2894367,989,10759,256,,103,,,"11/29/2020 02:59","2020-11-29T02:59:00Z","11/28 21:59",2703,10759,,"2020-11-29T02:59:00Z",,,,170525,2703,,2894367,,,,,,,,,,,,"53",2179,0,175740,0,175740,,0,96,"6685c70c255797f154df9a0267fb9a8b548c530a",0,0,0,0,0,""
20201129,"WA",173561,5142,,,"totalTestEncountersViral",2894367,983,10663,236,,94,,,"11/28/2020 02:59","2020-11-28T02:59:00Z","11/27 21:59",2703,10663,,"2020-11-28T02:59:00Z",,,,168419,2703,,2894367,,,,,,,,,,,,"53",2624,0,173561,0,173561,,0,167,"03b6f7b7725bfbc823edf6053cf5122c9e7e909e",0,0,0,0,0,""
20201128,"WA",170937,5031,,,"totalTestEncountersViral",2894367,990,10496,207,,83,,,"11/27/2020 02:59","2020-11-27T02:59:00Z","11/26 21:59",2703,10496,,"2020-11-27T02:59:00Z",,,,165906,2703,,2894367,,,,,,,,,,,,"53",530,0,170937,0,170937,,-1,254,"7f5cc9908957d6eb29740628433530b11ff95630",0,0,0,0,0,""
20201127,"WA",170407,5023,,,"totalTestEncountersViral",2894367,1002,10242,226,,102,,,"11/25/2020 02:59","2020-11-25T02:59:00Z","11/24 21:59",2704,10242,,"2020-11-25T02:59:00Z",,,,165384,2704,,2894367,,,,,,,,,,,,"53",2936,0,170407,0,170407,,0,0,"d77e88712f44b72d4446b8bd03aa1629fb1424d3",0,0,0,0,0,""
20201126,"WA",167471,4881,,,"totalTestEncountersViral",2894367,1007,10242,215,,102,,,"11/25/2020 02:59","2020-11-25T02:59:00Z","11/24 21:59",2704,10242,,"2020-11-25T02:59:00Z",,,,162590,2704,,2894367,,,,,,,,,,,,"53",3157,0,167471,0,167471,,14,76,"a07a35b02cb1e8522d8edafb7b7a74d6e91f2558",0,0,0,0,0,""
20201125,"WA",164314,4702,,,"totalTestEncountersViral",2894367,932,10166,214,,101,,,"11/24/2020 02:59","2020-11-24T02:59:00Z","11/23 21:59",2690,10166,,"2020-11-24T02:59:00Z",,,,159612,2690,,2894367,,,,,,,,,,,,"53",3678,0,164314,0,164314,,35,70,"b06c06b12ca95b13ab38b26d7b39df0432e4cc34",0,0,0,0,0,""
20201124,"WA",160636,4482,,,"totalTestEncountersViral",2894367,894,10096,187,,82,,,"11/23/2020 02:59","2020-11-23T02:59:00Z","11/22 21:59",2655,10096,,"2020-11-23T02:59:00Z",,,,156154,2655,,2894367,,,,,,,,,,,,"53",1405,0,160636,0,160636,,36,331,"d6cc361f277d0f7ee85544e8f3cc876092a45ba9",0,0,0,0,0,""
20201123,"WA",159231,4430,,,"totalTestEncountersViral",2894367,893,9765,165,,86,,,"11/21/2020 02:59","2020-11-21T02:59:00Z","11/20 21:59",2619,9765,,"2020-11-21T02:59:00Z",,,,154801,2619,,2894367,,,,,,,,,,,,"53",1890,0,159231,0,159231,,0,0,"76443b14006d189462a734460efa795cd23e0cc1",0,0,0,0,0,""
20201122,"WA",157341,4345,,,"totalTestEncountersViral",2894367,887,9765,199,,86,,,"11/21/2020 02:59","2020-11-21T02:59:00Z","11/20 21:59",2619,9765,,"2020-11-21T02:59:00Z",,,,152996,2619,,2894367,,,,,,,,,,,,"53",3193,0,157341,16473,157341,,0,48,"5f533e466f5c3e91b05304359fa12a87ec6b3f27",0,0,0,0,0,""
20201121,"WA",154148,4228,,,"totalTestEncountersViral",2877894,876,9717,206,,87,,,"11/20/2020 02:59","2020-11-20T02:59:00Z","11/19 21:59",2619,9717,,"2020-11-20T02:59:00Z",,,,149920,2619,,2877894,,,,,,,,,,,,"53",3082,0,154148,21420,154148,,16,64,"3e69aa7efcf224202ea463279de21de59e8a22e0",0,0,0,0,0,""
20201120,"WA",151066,4022,,,"totalTestEncountersViral",2856474,844,9653,209,,94,,,"11/19/2020 02:59","2020-11-19T02:59:00Z","11/18 21:59",2603,9653,,"2020-11-19T02:59:00Z",,,,147044,2603,,2856474,,,,,,,,,,,,"53",3070,0,151066,21002,151066,,11,31,"0923b8ffe0f5134a65478bd00b4d96fb8f3e9a8a",0,0,0,0,0,""
20201119,"WA",147996,3835,,,"totalTestEncountersViral",2835472,748,9622,191,,85,,,"11/18/2020 02:59","2020-11-18T02:59:00Z","11/17 21:59",2592,9622,,"2020-11-18T02:59:00Z",,,,144161,2592,,2835472,,,,,,,,,,,,"53",3216,0,147996,22391,147996,,21,49,"050042840a70a500a056b9cda77e3589f47c99f8",0,0,0,0,0,""
20201118,"WA",144780,3670,,,"totalTestEncountersViral",2813081,738,9573,208,,87,,,"11/17/2020 02:59","2020-11-17T02:59:00Z","11/16 21:59",2571,9573,,"2020-11-17T02:59:00Z",,,,141110,2571,,2813081,,,,,,,,,,,,"53",3454,0,144780,17345,144780,,23,55,"df0e7be20db4295dd3b0e2f83eb32d901b830f97",0,0,0,0,0,""
20201117,"WA",141326,3405,,,"totalTestEncountersViral",2795736,707,9518,167,,85,,,"11/16/2020 02:59","2020-11-16T02:59:00Z","11/15 21:59",2548,9518,,"2020-11-16T02:59:00Z",,,,137921,2548,,2795736,,,,,,,,,,,,"53",1169,0,141326,17641,141326,,29,93,"d888461513cf606418c933745613305b2b2c289a",0,0,0,0,0,""
20201116,"WA",140157,3386,,,"totalTestEncountersViral",2778095,681,9425,177,,84,,,"11/15/2020 02:59","2020-11-15T02:59:00Z","11/14 21:59",2519,9425,,"2020-11-15T02:59:00Z",,,,136771,2519,,2778095,,,,,,,,,,,,"53",1881,0,140157,29313,140157,,0,144,"a45d60c9d62eb01b0022fd58a0c21c5a9e94f0b5",0,0,0,0,0,""
20201115,"WA",138276,3353,,,"totalTestEncountersViral",2748782,658,9281,156,,75,,,"11/14/2020 02:59","2020-11-14T02:59:00Z","11/13 21:59",2519,9281,,"2020-11-14T02:59:00Z",,,,134923,2519,,2748782,,,,,,,,,,,,"53",2610,0,138276,26695,138276,,0,15,"c8ff34ad1ab962110e8e11ca49f6ad516ae21372",0,0,0,0,0,""
20201114,"WA",135666,3204,,,"totalTestEncountersViral",2722087,698,9266,154,,121,,,"11/13/2020 02:59","2020-11-13T02:59:00Z","11/12 21:59",2519,9266,,"2020-11-13T02:59:00Z",,,,132462,2519,,2722087,,,,,,,,,,,,"53",2910,0,135666,27917,135666,,12,88,"9cec8b39a31f459607b40e442f149b5ccae771bc",0,0,0,0,0,""
20201113,"WA",132756,3068,,,"totalTestEncountersViral",2694170,653,9178,147,,76,,,"11/12/2020 02:59","2020-11-12T02:59:00Z","11/11 21:59",2507,9178,,"2020-11-12T02:59:00Z",,,,129688,2507,,2694170,,,,,,,,,,,,"53",2163,0,132756,49745,132756,,25,86,"c0ff043f09d6938862ddf94bfe28d3e05c2dd28b",0,0,0,0,0,""
20201112,"WA",130593,2945,,,"totalTestEncountersViral",2644425,628,9092,115,,58,,,"11/10/2020 02:59","2020-11-10T02:59:00Z","11/09 21:59",2482,9092,,"2020-11-10T02:59:00Z",,,,127648,2482,,2644425,,,,,,,,,,,,"53",2384,0,130593,0,130593,,0,0,"1bff47cefc89b34ea492f46b7594f81998b11614",0,0,0,0,0,""
20201111,"WA",128209,2813,,,"totalTestEncountersViral",2644425,589,9092,107,,58,,,"11/10/2020 02:59","2020-11-10T02:59:00Z","11/09 21:59",2482,9092,,"2020-11-10T02:59:00Z",,,,125396,2482,,2644425,,,,,,,,,,,,"53",2713,0,128209,16910,128209,,22,61,"fd43741aaa77a760c0813c197105fb489c415e80",0,0,0,0,0,""
20201110,"WA",125496,2682,,,"totalTestEncountersViral",2627515,537,9031,110,,62,,,"11/10/2020 02:59","2020-11-10T02:59:00Z","11/09 21:59",2460,9031,,"2020-11-10T02:59:00Z",,,,122814,2460,,2627515,,,,,,,,,,,,"53",777,0,125496,15317,125496,,21,228,"df68d5389760aa7f9110849a9c0715a0eaeb43c4",0,0,0,0,0,""
20201109,"WA",124719,2672,,,"totalTestEncountersViral",2612198,526,8803,105,,55,,,"11/8/2020 02:59","2020-11-08T02:59:00Z","11/07 21:59",2439,8803,,"2020-11-08T02:59:00Z",,,,122047,2439,,2612198,,,,,,,,,,,,"53",1407,0,124719,19432,124719,,0,8,"4cb56959bfcd791355b76a862b293939f99e7ba9",0,0,0,0,0,""
20201108,"WA",123312,2630,,,"totalTestEncountersViral",2592766,504,8795,103,,45,,,"11/7/2020 02:59","2020-11-07T02:59:00Z","11/06 21:59",2439,8795,,"2020-11-07T02:59:00Z",,,,120682,2439,,2592766,,,,,,,,,,,,"53",1931,0,123312,24509,123312,,0,4,"892b3ffe717a38efa4ef4cb4eea04e74fd758a59",0,0,0,0,0,""
20201107,"WA",121381,2570,,,"totalTestEncountersViral",2568257,510,8791,133,,61,,,"11/6/2020 02:59","2020-11-06T02:59:00Z","11/05 21:59",2439,8791,,"2020-11-06T02:59:00Z",,,,118811,2439,,2568257,,,,,,,,,,,,"53",2124,0,121381,27183,121381,,8,7,"7ccbdd23c78d06a972ff5cdf9308e78d457b2f6e",0,0,0,0,0,""
20201106,"WA",119257,2478,,,"totalTestEncountersViral",2541074,492,8784,128,,48,,,"11/5/2020 02:59","2020-11-05T02:59:00Z","11/04 21:59",2431,8784,,"2020-11-05T02:59:00Z",,,,116779,2431,,2541074,,,,,,,,,,,,"53",1872,0,119257,21580,119257,,15,49,"ad7cce1986c09a32c741f5891f30bdc60587f402",0,0,0,0,0,""
20201105,"WA",117385,2395,,,"totalTestEncountersViral",2519494,476,8735,128,,62,,,"11/4/2020 02:59","2020-11-04T02:59:00Z","11/03 21:59",2416,8735,,"2020-11-04T02:59:00Z",,,,114990,2416,,2519494,,,,,,,,,,,,"53",1595,0,117385,24343,117385,,16,60,"57720eefbe62eb3ee022641d040230cd5039d3ea",0,0,0,0,0,""
20201104,"WA",115790,2308,,,"totalTestEncountersViral",2495151,480,8675,131,,58,,,"11/3/2020 02:59","2020-11-03T02:59:00Z","11/02 21:59",2400,8675,,"2020-11-03T02:59:00Z",,,,113482,2400,,2495151,,,,,,,,,,,,"53",1706,0,115790,24966,115790,,22,41,"ec5264cc782d5eac4fb47a4e78cafe96468b4b99",0,0,0,0,0,""
20201103,"WA",114084,2228,,,"totalTestEncountersViral",2470185,471,8634,124,,48,,,"11/2/2020 02:59","2020-11-02T02:59:00Z","11/01 21:59",2378,8634,,"2020-11-02T02:59:00Z",,,,111856,2378,,2470185,,,,,,,,,,,,"53",543,0,114084,1039,114084,,12,23,"f3cdf30f7913a68b4f3909a07938b4b3b4a58385",0,0,0,0,0,""
20201102,"WA",113541,2225,,,"totalTestEncountersViral",2469146,464,8611,103,,47,,,"11/1/2020 02:59","2020-11-01T02:59:00Z","10/31 22:59",2366,8611,,"2020-11-01T02:59:00Z",,,,111316,2366,,2469146,,,,,,,,,,,,"53",787,0,113541,19024,113541,,0,40,"67a93f08ffd2949a71ce954349a3b89dda19e594",0,0,0,0,0,""
20201101,"WA",112754,2201,,,"totalTestEncountersViral",2450122,470,8571,112,,47,,,"11/1/2020 02:59","2020-11-01T02:59:00Z","10/31 22:59",2366,8571,,"2020-11-01T02:59:00Z",,,,110553,2366,,2450122,,,,,,,,,,,,"53",1147,0,112754,23737,112754,,0,49,"f33b1080b8d3580f6999a1fd1121e782fcb3a660",0,0,0,0,0,""
20201031,"WA",111607,2150,,,"totalTestEncountersViral",2426385,450,8522,114,,52,,,"10/30/2020 02:59","2020-10-30T02:59:00Z","10/29 22:59",2366,8522,,"2020-10-30T02:59:00Z",,,,109457,2366,,2426385,,,,,,,,,,,,"53",1245,0,111607,21033,111607,,7,55,"fff6c2b57040db908cca9bff18c4f512af5ba0af",0,0,0,0,0,""
20201030,"WA",110362,2111,,,"totalTestEncountersViral",2405352,433,8467,112,,46,,,"10/29/2020 02:59","2020-10-29T02:59:00Z","10/28 22:59",2359,8467,,"2020-10-29T02:59:00Z",,,,108251,2359,,2405352,,,,,,,,,,,,"53",1102,0,110362,22020,110362,,6,84,"2409c568ab3f9d90d895144a5e244fd797a8ea85",0,0,0,0,0,""
20201029,"WA",109260,2068,,,"totalTestEncountersViral",2383332,426,8383,112,,40,,,"10/28/2020 02:59","2020-10-28T02:59:00Z","10/27 22:59",2353,8383,,"2020-10-28T02:59:00Z",,,,107192,2353,,2383332,,,,,,,,,,,,"53",1075,0,109260,20737,109260,,16,25,"4309ee4f0a34238e35688fa9ad99dbbaddbdfb9e",0,0,0,0,0,""
20201028,"WA",108185,2028,,,"totalTestEncountersViral",2362595,417,8358,100,,44,,,"10/27/2020 02:59","2020-10-27T02:59:00Z","10/26 22:59",2337,8358,,"2020-10-27T02:59:00Z",,,,106157,2337,,2362595,,,,,,,,,,,,"53",1133,0,108185,-10001,108185,,16,36,"03e7473ff547f3a8cfb030729dea4764a94e0ff2",0,0,0,0,0,""
20201027,"WA",107052,1986,,,"totalTestEncountersViral",2372596,422,8322,88,,37,,,"10/26/2020 02:59","2020-10-26T02:59:00Z","10/25 22:59",2321,8322,,"2020-10-26T02:59:00Z",,,,105066,2321,,2372596,,,,,,,,,,,,"53",348,0,107052,12209,107052,,25,42,"1f1572e13e9fbbfc71267d980bd94178117f56ca",0,0,0,0,0,""
20201026,"WA",106704,1969,,,"totalTestEncountersViral",2360387,389,8280,100,,43,,,"10/25/2020 02:59","2020-10-25T02:59:00Z","10/24 22:59",2296,8280,,"2020-10-25T02:59:00Z",,,,104735,2296,,2360387,,,,,,,,,,,,"53",589,0,106704,0,106704,,0,0,"31e5b85c420a7318ca167af18fb462c029e7dd67",0,0,0,0,0,""
20201025,"WA",106115,1964,,,"totalTestEncountersViral",2360387,405,8280,101,,43,,,"10/25/2020 02:59","2020-10-25T02:59:00Z","10/24 22:59",2296,8280,,"2020-10-25T02:59:00Z",,,,104151,2296,,2360387,,,,,,,,,,,,"53",835,0,106115,41456,106115,,0,49,"ca2092140722a671601f4856459a19946d8b19a1",0,0,0,0,0,""
20201024,"WA",105280,1917,,,"totalTestEncountersViral",2318931,412,8231,114,,48,,,"10/23/2020 02:59","2020-10-23T02:59:00Z","10/22 22:59",2296,8231,,"2020-10-23T02:59:00Z",,,,103363,2296,,2318931,,,,,,,,,,,,"53",849,0,105280,22656,105280,,7,48,"4ff1eab45899127db85a7181590c02d15b3133cd",0,0,0,0,0,""
20201023,"WA",104431,1881,,,"totalTestEncountersViral",2296275,437,8183,103,,49,,,"10/23/2020 02:59","2020-10-23T02:59:00Z","10/22 22:59",2289,8183,,"2020-10-23T02:59:00Z",,,,102550,2289,,2296275,,,,,,,,,,,,"53",785,0,104431,19822,104431,,3,34,"2c3ea5d473bfb4412ad7c8250c884e5d92d686b4",0,0,0,0,0,""
20201022,"WA",103646,1854,,,"totalTestEncountersViral",2276453,407,8149,92,,43,,,"10/23/2020 02:59","2020-10-23T02:59:00Z","10/22 22:59",2286,8149,,"2020-10-23T02:59:00Z",,,,101792,2286,,2276453,,,,,,,,,,,,"53",918,0,103646,23665,103646,,4,25,"a95857af5a26ba4964bc29b5bee639eccc6c73a2",0,0,0,0,0,""
20201021,"WA",102728,1822,,,"totalTestEncountersViral",2252788,414,8124,109,,43,,,"10/20/2020 02:59","2020-10-20T02:59:00Z","10/19 22:59",2282,8124,,"2020-10-20T02:59:00Z",,,,100906,2282,,2252788,,,,,,,,,,,,"53",913,0,102728,8452,102728,,24,47,"dbcf3483ee4170efd61b7ef7945a86361e32e1fd",0,0,0,0,0,""
20201020,"WA",101815,1786,,,"totalTestEncountersViral",2244336,392,8077,82,,36,,,"10/19/2020 02:59","2020-10-19T02:59:00Z","10/18 22:59",2258,8077,,"2020-10-19T02:59:00Z",,,,100029,2258,,2244336,,,,,,,,,,,,"53",298,0,101815,13551,101815,,19,59,"36b41fe53ed881a8f416a81d44273f2bd00b82ed",0,0,0,0,0,""
20201019,"WA",101517,1783,,,"totalTestEncountersViral",2230785,388,8018,72,,26,,,"10/18/2020 02:59","2020-10-18T02:59:00Z","10/17 22:59",2239,8018,,"2020-10-18T02:59:00Z",,,,99734,2239,,2230785,,,,,,,,,,,,"53",409,0,101517,16225,101517,,0,24,"b9078e9d4152ad0f24212794b38331139073eed5",0,0,0,0,0,""
20201018,"WA",101108,1774,,,"totalTestEncountersViral",2214560,376,7994,91,,26,,,"10/18/2020 02:59","2020-10-18T02:59:00Z","10/17 22:59",2239,7994,,"2020-10-18T02:59:00Z",,,,99334,2239,,2214560,,,,,,,,,,,,"53",664,0,101108,20306,101108,,0,23,"4dab7531a996d3ca704b2c27f31eeb29352839fa",0,0,0,0,0,""
20201017,"WA",100444,1740,,,"totalTestEncountersViral",2194254,396,7971,82,,27,,,"10/16/2020 02:59","2020-10-16T02:59:00Z","10/15 22:59",2239,7971,,"2020-10-16T02:59:00Z",,,,98704,2239,,2194254,,,,,,,,,,,,"53",770,0,100444,25062,100444,,7,15,"4b7043ac20d9770a397d779b0e9b55f3577160c5",0,0,0,0,0,""
20201016,"WA",99674,1714,,,"totalTestEncountersViral",2169192,376,7956,77,,18,,,"10/15/2020 02:59","2020-10-15T02:59:00Z","10/14 22:59",2232,7956,,"2020-10-15T02:59:00Z",,,,97960,2232,,2169192,,,,,,,,,,,,"53",771,0,99674,22683,99674,,11,73,"3264db626443ad16504debb0abc04588b4c2f76c",0,0,0,0,0,""
20201015,"WA",98903,1689,,,"totalTestEncountersViral",2146509,373,7883,82,,25,,,"10/14/2020 02:59","2020-10-14T02:59:00Z","10/13 22:59",2221,7883,,"2020-10-14T02:59:00Z",,,,97214,2221,,2146509,,,,,,,,,,,,"53",768,0,98903,22601,98903,,10,9,"535fc014d5c719e083676e1eb2aad63e0c113ee6",0,0,0,0,0,""
20201014,"WA",98135,1650,,,"totalTestEncountersViral",2123908,367,7874,83,,26,,,"10/13/2020 02:59","2020-10-13T02:59:00Z","10/12 22:59",2211,7874,,"2020-10-13T02:59:00Z",,,,96485,2211,,2123908,,,,,,,,,,,,"53",867,0,98135,0,98135,,0,0,"61c4cfa6dac05aafa6a7e3dc793f5bc2cf3cd6f6",0,0,0,0,0,""
20201013,"WA",97268,1619,,,"totalTestEncountersViral",2123908,376,7874,76,,26,,,"10/13/2020 02:59","2020-10-13T02:59:00Z","10/12 22:59",2211,7874,,"2020-10-13T02:59:00Z",,,,95649,2190,,2123908,,,,,,,,,,,,"53",253,0,97268,62470,97268,,21,88,"79039c140390414f91ac38db237166ce19495fb0",0,0,0,0,0,""
20201012,"WA",97015,1613,,,"totalTestEncountersViral",2061438,352,7786,59,,27,,,"10/12/2020 02:59","2020-10-12T02:59:00Z","10/11 22:59",2190,7786,,"2020-10-12T02:59:00Z",,,,95402,2190,,2061438,,,,,,,,,,,,"53",383,0,97015,0,97015,,0,0,"d5fe89941e4b7b9cfaf448996bf54f5955e1a76f",0,0,0,0,0,""
20201011,"WA",96632,1605,,,"totalTestEncountersViral",2061438,373,7786,70,,27,,,"10/12/2020 02:59","2020-10-12T02:59:00Z","10/11 22:59",2190,7786,,"2020-10-12T02:59:00Z",,,,95027,2190,,2061438,,,,,,,,,,,,"53",701,0,96632,23492,96632,,0,24,"473160915f064663c9232983689c3a76ce7f829c",0,0,0,0,0,""
20201010,"WA",95931,1571,,,"totalTestEncountersViral",2037946,364,7762,69,,30,,,"10/9/2020 02:59","2020-10-09T02:59:00Z","10/08 22:59",2190,7762,,"2020-10-09T02:59:00Z",,,,94360,2190,,2037946,,,,,,,,,,,,"53",726,0,95931,21475,95931,,7,29,"b9889197841d90f3d6b3676e87cfadb171f09f59",0,0,0,0,0,""
20201009,"WA",95205,1535,,,"totalTestEncountersViral",2016471,357,7733,72,,29,,,"10/8/2020 02:59","2020-10-08T02:59:00Z","10/07 22:59",2183,7733,,"2020-10-08T02:59:00Z",,,,93670,2183,,2016471,,,,,,,,,,,,"53",723,0,95205,28994,95205,,6,30,"ce6771f7b94aa1daf5902ac22b6daf22509b2027",0,0,0,0,0,""
20201008,"WA",94482,1506,,,"totalTestEncountersViral",1987477,383,7703,73,,30,,,"10/7/2020 02:59","2020-10-07T02:59:00Z","10/06 22:59",2177,7703,,"2020-10-07T02:59:00Z",,,,92976,2177,,1987477,,,,,,,,,,,,"53",723,0,94482,26410,94482,,12,30,"9fa3cccb3ae115c7694dbb308f78df94227fe79e",0,0,0,0,0,""
20201007,"WA",93759,1475,,,"totalTestEncountersViral",1961067,355,7673,68,,31,,,"10/6/2020 02:59","2020-10-06T02:59:00Z","10/05 22:59",2165,7673,,"2020-10-06T02:59:00Z",,,,92284,2165,,1961067,,,,,,,,,,,,"53",906,0,93759,9660,93759,,7,51,"04a05c0a0837ef54df9ce50e54b7c5c61e604eb1",0,0,0,0,0,""
20201006,"WA",92853,1429,,,"totalTestEncountersViral",1951407,347,7622,64,,31,,,"10/5/2020 02:59","2020-10-05T02:59:00Z","10/04 22:59",2158,7622,,"2020-10-05T02:59:00Z",,,,91424,2158,,1951407,,,,,,,,,,,,"53",252,0,92853,15508,92853,,16,-6,"542bd02b8396dadd22266a9ff8fc7b26885e9b9e",0,0,0,0,0,""
20201005,"WA",92601,1423,,,"totalTestEncountersViral",1935899,367,7628,78,,29,,,"10/4/2020 02:59","2020-10-04T02:59:00Z","10/03 22:59",2142,7628,,"2020-10-04T02:59:00Z",,,,91178,2142,,1935899,,,,,,,,,,,,"53",403,0,92601,12943,92601,,0,17,"ea0e7e1cd357f26e0740961ce0c045c2cb2e2d70",0,0,0,0,0,""
20201004,"WA",92198,1412,,,"totalTestEncountersViral",1922956,370,7611,82,,26,,,"10/3/2020 02:59","2020-10-03T02:59:00Z","10/02 22:59",2142,7611,,"2020-10-03T02:59:00Z",,,,90786,2142,,1922956,,,,,,,,,,,,"53",628,0,92198,17197,92198,,-1,25,"237d9ce09fe691a46a4aa15532df0db35b9edc26",0,0,0,0,0,""
20201003,"WA",91570,1384,,,"totalTestEncountersViral",1905759,361,7586,77,,40,,,"10/2/2020 02:59","2020-10-02T02:59:00Z","10/01 22:59",2143,7586,,"2020-10-02T02:59:00Z",,,,90186,2143,,1905759,,,,,,,,,,,,"53",580,0,91570,21685,91570,,11,13,"3d9c9cd89a87f88422f5ed792add1ef4c30fddce",0,0,0,0,0,""
20201002,"WA",90990,1355,,,"totalTestEncountersViral",1884074,371,7573,88,,33,,,"10/1/2020 02:59","2020-10-01T02:59:00Z","09/30 22:59",2132,7573,,"2020-10-01T02:59:00Z",,,,89635,2132,,1884074,,,,,,,,,,,,"53",618,0,90990,15985,90990,,6,40,"bca518a19db80b9fc632fcbd50fd6ea6eb3f0362",0,0,0,0,0,""
20201001,"WA",90372,1325,,,"totalTestEncountersViral",1868089,410,7533,90,,32,,,"10/1/2020 02:59","2020-10-01T02:59:00Z","09/30 22:59",2126,7533,,"2020-10-01T02:59:00Z",,,,89047,2126,,1868089,,,,,,,,,,,,"53",633,0,90372,13690,90372,,2,50,"5975bafd88687b9b50ea5d2367e3307677d88232",0,0,0,0,0,""
20200930,"WA",89739,1301,,,"totalTestEncountersViral",1854399,384,7483,91,,26,,,"9/29/2020 02:59","2020-09-29T02:59:00Z","09/28 22:59",2124,7483,,"2020-09-29T02:59:00Z",,,,88438,2124,,1854399,,,,,,,,,,,,"53",778,0,89739,5936,89739,,24,6,"cfe00d156f4979401ab434693a6acbee8fc45b4b",0,0,0,0,0,""
20200929,"WA",88961,1275,,,"totalTestEncountersViral",1848463,362,7477,75,,43,,,"9/28/2020 02:59","2020-09-28T02:59:00Z","09/27 22:59",2100,7477,,"2020-09-28T02:59:00Z",,,,87686,2100,,1848463,,,,,,,,,,,,"53",200,0,88961,11257,88961,,0,22,"fdb634804d139b0e1d861b45ea95a0176f4f2fc9",0,0,0,0,0,""
20200928,"WA",88761,1274,,,"totalTestEncountersViral",1837206,355,7455,71,,25,,,"9/27/2020 02:59","2020-09-27T02:59:00Z","09/26 22:59",2100,7455,,"2020-09-27T02:59:00Z",,,,87487,2100,,1837206,,,,,,,,,,,,"53",328,0,88761,16583,88761,,0,24,"a3cf38702556288cdf06fa2d6f21dafffe612a64",0,0,0,0,0,""
20200927,"WA",88433,1262,,,"totalTestEncountersViral",1820623,395,7431,90,,31,,,"9/26/2020 02:59","2020-09-26T02:59:00Z","09/25 22:59",2100,7431,,"2020-09-26T02:59:00Z",,,,87171,2100,,1820623,,,,,,,,,,,,"53",521,0,88433,19602,88433,,0,19,"d59e17467eec2c5fbfb513cc243f340abe974ba7",0,0,0,0,0,""
20200926,"WA",87912,1246,,,"totalTestEncountersViral",1801021,383,7412,86,,28,,,"9/25/2020 02:59","2020-09-25T02:59:00Z","09/24 22:59",2100,7412,,"2020-09-25T02:59:00Z",,,,86666,2100,,1801021,,,,,,,,,,,,"53",588,0,87912,17742,87912,,20,55,"99f372b437e7f0cb37c4f3a8c1273ed32b150ee6",0,0,0,0,0,""
20200925,"WA",87324,1216,,,"totalTestEncountersViral",1783279,401,7357,87,,27,,,"9/24/2020 02:59","2020-09-24T02:59:00Z","09/23 22:59",2080,7357,,"2020-09-24T02:59:00Z",,,,86108,2080,,1783279,,,,,,,,,,,,"53",595,0,87324,39983,87324,,-1,8,"06dd2bcb851bdc36c5d6b08830b10cee6b8aff1a",0,0,0,0,0,""
20200924,"WA",86729,1189,,,"totalTestEncountersViral",1743296,384,7349,101,,27,,,"9/23/2020 02:59","2020-09-23T02:59:00Z","09/22 22:59",2081,7349,,"2020-09-23T02:59:00Z",,,,85540,2081,,1743296,,,,,,,,,,,,"53",599,0,86729,2397,86729,,11,35,"fcf00d2169548a3a0ca9e3a031520419cb2c7e42",0,0,0,0,0,""
20200923,"WA",86130,1159,,,"totalTestEncountersViral",1740899,361,7314,90,,32,,,"9/22/2020 02:59","2020-09-22T02:59:00Z","09/21 22:59",2070,7314,,"2020-09-22T02:59:00Z",,,,84971,2070,,1740899,,,,,,,,,,,,"53",669,0,86130,0,86130,,0,0,"893b55b0c1f44b21db57dcaba243bf5a0504fe66",0,0,0,0,0,""
20200922,"WA",85461,1136,,,"totalTestEncountersViral",1740899,487,7314,85,,32,,,"9/20/2020 02:59","2020-09-20T02:59:00Z","09/19 22:59",2070,7314,,"2020-09-20T02:59:00Z",,,,84325,2070,,1740899,,,,,,,,,,,,"53",196,0,85461,4343,85461,,33,52,"6a30f400af95a1b95f7343808ce30f1c45317d0f",0,0,0,0,0,""
20200921,"WA",85265,1132,,,"totalTestEncountersViral",1736556,377,7262,69,,21,,,"9/20/2020 02:59","2020-09-20T02:59:00Z","09/19 22:59",2037,7262,,"2020-09-20T02:59:00Z",,,,84133,2037,,1736556,,,,,,,,,,,,"53",323,0,85265,13516,85265,,0,14,"f88e8144288ecced6a14d1ef526bc6c9c243e388",0,0,0,0,0,""
20200920,"WA",84942,1126,,,"totalTestEncountersViral",1723040,380,7248,85,,26,,,"9/19/2020 02:59","2020-09-19T02:59:00Z","09/18 22:59",2037,7248,,"2020-09-19T02:59:00Z",,,,83816,2037,,1723040,,,,,,,,,,,,"53",535,0,84942,18370,84942,,0,33,"d3cd433c0cbad6f396047699d5a81007c09b97df",0,0,0,0,0,""
20200919,"WA",84407,1108,,,"totalTestEncountersViral",1704670,395,7215,93,,34,,,"9/18/2020 02:59","2020-09-18T02:59:00Z","09/17 22:59",2037,7215,,"2020-09-18T02:59:00Z",,,,83299,2037,,1704670,,,,,,,,,,,,"53",478,0,84407,0,84407,,0,0,"ead461ed6951a791079ac7f3ff54ea2836c3dfe2",0,0,0,0,0,""
20200918,"WA",83929,1082,,,"totalTestEncountersViral",1704670,379,7215,,,34,,,"9/18/2020 02:59","2020-09-18T02:59:00Z","09/17 22:59",2037,7215,,"2020-09-18T02:59:00Z",,,,82847,2037,,1704670,,,,,,,,,,,,"53",471,0,83929,13623,83929,,6,19,"3d171d43c7840bf438be21ed75db370bf40c531b",0,0,0,0,0,""
20200917,"WA",83458,1062,,,"totalTestEncountersViral",1691047,380,7196,,,36,,,"9/17/2020 02:59","2020-09-17T02:59:00Z","09/16 22:59",2031,7196,,"2020-09-17T02:59:00Z",,,,82396,2031,,1691047,,,,,,,,,,,,"53",482,0,83458,14345,83458,,11,34,"15b4c9493eabff39e0e01caf662342984cb72151",0,0,0,0,0,""
20200916,"WA",82976,1039,,,"totalTestEncountersViral",1676702,357,7162,,,29,,,"9/16/2020 02:59","2020-09-16T02:59:00Z","09/15 22:59",2020,7162,,"2020-09-16T02:59:00Z",,,,81937,2020,,1676702,,,,,,,,,,,,"53",511,0,82976,10987,82976,,5,35,"36138c833a8affb6b78c59cdbe64f3f0d5805fdb",0,0,0,0,0,""
20200915,"WA",82465,1001,,,"totalTestEncountersViral",1665715,348,7127,,,28,,,"9/15/2020 02:59","2020-09-15T02:59:00Z","09/14 22:59",2015,7127,,"2020-09-15T02:59:00Z",,,,81464,2015,,1665715,,,,,,,,,,,,"53",138,0,82465,11748,82465,,9,29,"e7ceb0a77a9df51edc4310fcb3c06f956cfbbaae",0,0,0,0,0,""
20200914,"WA",82327,1000,,,"totalTestEncountersViral",1653967,385,7098,,,26,,,"9/14/2020 02:59","2020-09-14T02:59:00Z","09/13 22:59",2006,7098,,"2020-09-14T02:59:00Z",,,,81327,2006,,1653967,,,,,,,,,,,,"53",239,0,82327,9382,82327,,15,17,"ac0387795ac54bbc93fe4c7f333a3469b01854d8",0,0,0,0,0,""
20200913,"WA",82088,992,,,"totalTestEncountersViral",1644585,371,7081,,,29,,,"9/13/2020 02:59","2020-09-13T02:59:00Z","09/12 22:59",1991,7081,,"2020-09-13T02:59:00Z",,,,81096,1991,,1644585,,,,,,,,,,,,"53",478,0,82088,13423,82088,,0,33,"71261ff4be3326c307f0cfcc78b0f969c83206ca",0,0,0,0,0,""
20200912,"WA",81610,961,,,"totalTestEncountersViral",1631162,384,7048,,,19,,,"9/11/2020 02:59","2020-09-11T02:59:00Z","09/10 22:59",1991,7048,,"2020-09-11T02:59:00Z",,,,80649,1991,,1631162,,,,,,,,,,,,"53",475,0,81610,16414,81610,,0,30,"3cd1038643b0fbcdda6fecd3bf0714e0d2dcd46a",0,0,0,0,0,""
20200911,"WA",81135,938,,,"totalTestEncountersViral",1614748,392,7018,,,19,,,"9/11/2020 02:59","2020-09-11T02:59:00Z","09/10 22:59",1991,7018,,"2020-09-11T02:59:00Z",,,,80197,1991,,1614748,,,,,,,,,,,,"53",536,0,81135,16761,81135,,6,25,"8bbfe4f74c1a0141a71a39a08143dabc4f897b82",0,0,0,0,0,""
20200910,"WA",80599,905,,,"totalTestEncountersViral",1597987,382,6993,,,29,,,"9/10/2020 02:59","2020-09-10T02:59:00Z","09/09 22:59",1985,6993,,"2020-09-10T02:59:00Z",,,,79694,1985,,1597987,,,,,,,,,,,,"53",564,0,80599,14084,80599,,7,27,"760769ff9397a55f3525a90e57a9f376a088daa9",0,0,0,0,0,""
20200909,"WA",80035,878,,,"totalTestEncountersViral",1583903,358,6966,,,34,,,"9/9/2020 02:59","2020-09-09T02:59:00Z","09/08 22:59",1978,6966,,"2020-09-09T02:59:00Z",,,,79157,1978,,1583903,,,,,,,,,,,,"53",219,0,80035,20850,80035,,25,53,"dbd4d354aea60ba4f2ec604c19f49dc815961e2c",0,0,0,0,0,""
20200908,"WA",79816,867,,,"totalTestEncountersViral",1563053,376,6913,,,40,,,"9/6/2020 02:59","2020-09-06T02:59:00Z","09/05 22:59",1953,6913,,"2020-09-06T02:59:00Z",,,,78949,1953,,1563053,,,,,,,,,,,,"53",163,0,79816,0,79816,,0,53,"4f1808c3e69ce8455036ed811c8e2fe3d25c6e5f",0,0,0,0,0,""
20200907,"WA",79653,858,,,"totalTestEncountersViral",1563053,384,6860,,,37,,,"9/6/2020 02:59","2020-09-06T02:59:00Z","09/05 22:59",1953,6860,,"2020-09-06T02:59:00Z",,,,78795,1953,,1563053,,,,,,,,,,,,"53",304,0,79653,12576,79653,,0,18,"6f21012c75bdc0cfc3c13c255af70ca40d4e955d",0,0,0,0,0,""
20200906,"WA",79349,846,,,"totalTestEncountersViral",1550477,403,6842,,,34,,,"9/5/2020 02:59","2020-09-05T02:59:00Z","09/04 22:59",1953,6842,,"2020-09-05T02:59:00Z",,,,78503,1953,,1550477,,,,,,,,,,,,"53",507,0,79349,16387,79349,,0,-6,"13b3be7d67e6c12b3d5f4e8332673527cd509e26",0,0,0,0,0,""
20200905,"WA",78842,808,,,"totalTestEncountersViral",1534090,417,6848,,,48,,,"9/4/2020 02:59","2020-09-04T02:59:00Z","09/03 22:59",1953,6848,,"2020-09-04T02:59:00Z",,,,78034,1953,,1534090,,,,,,,,,,,,"53",527,0,78842,16001,78842,,8,14,"3fd1ce6f19798489ea0345a95270186ff790756f",0,0,0,0,0,""
20200904,"WA",78315,792,,,"totalTestEncountersViral",1518089,399,6834,,,50,,,"9/3/2020 02:59","2020-09-03T02:59:00Z","09/02 22:59",1945,6834,,"2020-09-03T02:59:00Z",,,,77523,1945,,1518089,,,,,,,,,,,,"53",528,0,78315,21736,78315,,10,39,"743b404db504729d9766000ce028fe35e68956a1",0,0,0,0,0,""
20200903,"WA",77787,746,,,"totalTestEncountersViral",1496353,408,6795,,,65,,,"9/2/2020 02:59","2020-09-02T02:59:00Z","09/01 22:59",1935,6795,,"2020-09-02T02:59:00Z",,,,77041,1935,,1496353,,,,,,,,,,,,"53",549,0,77787,16314,77787,,4,8,"e8cc8e4266ab41ebbeb76ab32575fd631c3a0e20",0,0,0,0,0,""
20200902,"WA",77238,716,,,"totalTestEncountersViral",1480039,416,6787,,,48,,,"9/1/2020 02:59","2020-09-01T02:59:00Z","08/31 22:59",1931,6787,,"2020-09-01T02:59:00Z",,,,76522,1931,,1480039,,,,,,,,,,,,"53",596,0,77238,6794,77238,,16,24,"dc63cd7787676905bd3e9eab93b89e8c23114582",0,0,0,0,0,""
20200901,"WA",76642,676,,,"totalTestEncountersViral",1473245,392,6763,,,49,,,"8/31/2020 02:59","2020-08-31T02:59:00Z","08/30 22:59",1915,6763,,"2020-08-31T02:59:00Z",,,,75966,1915,,1473245,,,,,,,,,,,,"53",162,0,76642,11891,76642,,10,23,"f38e698570c278f617d394ec153cff6ba349f81a",0,0,0,0,0,""
20200831,"WA",76480,671,,,"totalTestEncountersViral",1461354,411,6740,,,51,,,"8/30/2020 02:59","2020-08-30T02:59:00Z","08/29 22:59",1905,6740,,"2020-08-30T02:59:00Z",,,,75809,1905,,1461354,,,,,,,,,,,,"53",325,0,76480,0,76480,,0,0,"348a53a3152b4affa0975c06c37fad48880e4fe4",0,0,0,0,0,""
20200830,"WA",76155,665,,,"totalTestEncountersViral",1461354,415,6740,,,51,,,"8/30/2020 02:59","2020-08-30T02:59:00Z","08/29 22:59",1905,6740,,"2020-08-30T02:59:00Z",,,,75490,1905,,1461354,,,,,,,,,,,,"53",499,0,76155,37583,76155,,0,61,"fbe8e81e51de9171a7c64a711c521daa19f76c62",0,0,0,0,0,""
20200829,"WA",75656,614,,,"totalTestEncountersViral",1423771,425,6679,,,46,,,"8/28/2020 02:59","2020-08-28T02:59:00Z","08/27 22:59",1905,6679,,"2020-08-28T02:59:00Z",,,,75042,1905,,1423771,,,,,,,,,,,,"53",533,0,75656,15607,75656,,15,5,"8c6f782ca005888f5c694383d658d7f60845621f",0,0,0,0,0,""
20200828,"WA",75123,568,,,"totalTestEncountersViral",1408164,443,6674,,,45,,,"8/27/2020 02:59","2020-08-27T02:59:00Z","08/26 22:59",1890,6674,,"2020-08-27T02:59:00Z",,,,74555,1890,,1408164,,,,,,,,,,,,"53",598,0,75123,16855,75123,,10,34,"e532a84afbf607c42ceecb975040cbab147a0346",0,0,0,0,0,""
20200827,"WA",74525,536,,,"totalTestEncountersViral",1391309,459,6640,,,37,,,"8/26/2020 02:59","2020-08-26T02:59:00Z","08/25 22:59",1880,6640,,"2020-08-26T02:59:00Z",,,,73989,1880,,1391309,,,,,,,,,,,,"53",609,0,74525,11205,74525,,4,45,"16b217d130d5650d9e7f954775025d77c9ec188a",0,0,0,0,0,""
20200826,"WA",73916,502,,,"totalTestEncountersViral",1380104,441,6595,,,47,,,"8/25/2020 02:59","2020-08-25T02:59:00Z","08/24 22:59",1876,6595,,"2020-08-25T02:59:00Z",,,,73414,1876,,1380104,,,,,,,,,,,,"53",632,0,73916,54,73916,,9,53,"a7d2962b0df9b75302fd2e55bc6a05fd524eb92b",0,0,0,0,0,""
20200825,"WA",73284,490,,,"totalTestEncountersViral",1380050,421,6542,,,37,,,"8/24/2020 02:59","2020-08-24T02:59:00Z","08/23 22:59",1867,6542,,"2020-08-24T02:59:00Z",,,,72794,1867,,1380050,,,,,,,,,,,,"53",217,0,73284,0,73284,,4,12,"e9a487026c9811bd4042811c3a78e64c31e88df8",0,0,0,0,0,""
20200824,"WA",73067,488,,,"totalTestEncountersViral",1380050,454,6530,,,36,,,"8/23/2020 02:59","2020-08-23T02:59:00Z","08/22 22:59",1863,6530,,"2020-08-23T02:59:00Z",,,,72579,1863,,1380050,,,,,,,,,,,,"53",274,0,73067,1014,73067,,6,30,"c5761824c247958fa7cf74077017502047b2c995",0,0,0,0,0,""
20200823,"WA",72793,487,,,"totalTestEncountersViral",1379036,455,6500,,,42,,,"8/22/2020 02:59","2020-08-22T02:59:00Z","08/21 22:59",1857,6500,,"2020-08-22T02:59:00Z",,,,72306,1857,,1379036,,,,,,,,,,,,"53",551,0,72793,2503,72793,,7,31,"7a21c504f92946a4a44db374547a11cf8e3eb43e",0,0,0,0,0,""
20200822,"WA",72242,462,,,"totalTestEncountersViral",1376533,469,6469,,,45,,,"8/21/2020 02:59","2020-08-21T02:59:00Z","08/20 22:59",1850,6469,,"2020-08-21T02:59:00Z",,,,71780,1850,,1376533,,,,,,,,,,,,"53",509,0,72242,7269,72242,,13,69,"47639939f8ecd4776259d336fc14badb6c612a1f",0,0,0,0,0,""
20200821,"WA",71733,431,,,"totalTestEncountersViral",1369264,481,6400,,,48,,,"8/20/2020 02:59","2020-08-20T02:59:00Z","08/19 22:59",1837,6400,,"2020-08-20T02:59:00Z",,,,71302,1837,,1369264,,,,,,,,,,,,"53",628,0,71733,12396,71733,,15,12,"1c1062975214bcbcb8842d3ac9bbf114c486b1ae",0,0,0,0,0,""
20200820,"WA",71105,406,,,"totalTestEncountersViral",1356868,498,6388,,,44,,,"8/19/2020 02:59","2020-08-19T02:59:00Z","08/18 22:59",1822,6388,,"2020-08-19T02:59:00Z",,,,70699,1822,,1356868,,,,,,,,,,,,"53",624,0,71105,12825,71105,,13,30,"6395eef504c2bfb3d18fbc2506016c79375d9bc8",0,0,0,0,0,""
20200819,"WA",70481,393,,,"totalTestEncountersViral",1344043,481,6358,,,43,,,"8/18/2020 02:59","2020-08-18T02:59:00Z","08/17 22:59",1809,6358,,"2020-08-18T02:59:00Z",,,,70088,1809,,1344043,,,,,,,,,,,,"53",670,0,70481,14827,70481,,24,62,"c9533bb451350a4f62666312a2b742e73c5595e5",0,0,0,0,0,""
20200818,"WA",69811,382,,,"totalTestEncountersViral",1329216,475,6296,,,39,,,"8/17/2020 02:59","2020-08-17T02:59:00Z","08/16 22:59",1785,6296,,"2020-08-17T02:59:00Z",,,,69429,1785,,1329216,,,,,,,,,,,,"53",164,0,69811,15101,69811,,4,41,"fcedd7b724b1441bf70d1fdb5b8a48c9e7edfdb9",0,0,0,0,0,""
20200817,"WA",69647,381,,,"totalTestEncountersViral",1314115,487,6255,,,43,,,"8/16/2020 02:59","2020-08-16T02:59:00Z","08/15 22:59",1781,6255,,"2020-08-16T02:59:00Z",,,,69266,1781,,1314115,,,,,,,,,,,,"53",359,0,69647,16187,69647,,15,25,"984fd9baea6dbb40ceda5c2e5ddd233297587e90",0,0,0,0,0,""
20200816,"WA",69288,377,,,"totalTestEncountersViral",1297928,504,6230,,,55,,,"8/15/2020 02:59","2020-08-15T02:59:00Z","08/14 22:59",1766,6230,,"2020-08-15T02:59:00Z",,,,68911,1766,,1297928,,,,,,,,,,,,"53",673,0,69288,4951,69288,,11,24,"689595fc2a13caa64f99d10e10be707ea6c30629",0,0,0,0,0,""
20200815,"WA",68615,352,,,"totalTestEncountersViral",1292977,529,6206,,,58,,,"8/13/2020 02:59","2020-08-13T02:59:00Z","08/12 22:59",1755,6206,,"2020-08-13T02:59:00Z",,,,68263,1755,,1292977,,,,,,,,,,,,"53",628,0,68615,8836,68615,,19,24,"fde29ef3f0e604d14e73b160529a87d6479547b0",0,0,0,0,0,""
20200814,"WA",67987,340,,,"totalTestEncountersViral",1284141,519,6182,,,58,,,"8/13/2020 02:59","2020-08-13T02:59:00Z","08/12 22:59",1736,6182,,"2020-08-13T02:59:00Z",,,,67647,1736,,1284141,,,,,,,,,,,,"53",632,0,67987,14510,67987,,12,45,"cf5b872b0bdc9abfdc242b289e94a53c17880e49",0,0,0,0,0,""
20200813,"WA",67355,319,,,"totalTestEncountersViral",1269631,513,6137,,,40,,,"8/11/2020 02:59","2020-08-11T02:59:00Z","08/10 22:59",1724,6137,,"2020-08-11T02:59:00Z",,,,67036,1724,,1269631,,,,,,,,,,,,"53",725,0,67355,15117,67355,,8,35,"872a85b5ce86b838e01bee8f8e2037d9f007d8cc",0,0,0,0,0,""
20200812,"WA",66630,300,,,"totalTestEncountersViral",1254514,480,6102,,,59,,,"8/11/2020 02:59","2020-08-11T02:59:00Z","08/10 22:59",1716,6102,,"2020-08-11T02:59:00Z",,,,66330,1716,,1254514,,,,,,,,,,,,"53",824,0,66630,16612,66630,,19,53,"192649b42919191937bd90c33e2ab47beab69d9d",0,0,0,0,0,""
20200811,"WA",65806,290,,,"totalTestEncountersViral",1237902,495,6049,,,35,,,"8/10/2020 02:59","2020-08-10T02:59:00Z","08/09 22:59",1697,6049,,"2020-08-10T02:59:00Z",,,,65516,1697,,1237902,,,,,,,,,,,,"53",213,0,65806,15951,65806,,9,48,"bdd78c1ebc0ab0698610465dfb60c505cdfa1379",0,0,0,0,0,""
20200810,"WA",65593,286,,,"totalTestEncountersViral",1221951,532,6001,,,49,,,"8/9/2020 02:59","2020-08-09T02:59:00Z","08/08 22:59",1688,6001,,"2020-08-09T02:59:00Z",,,,65307,1688,,1221951,,,,,,,,,,,,"53",364,0,65593,18954,65593,,0,105,"e78db2978db04b34e2355f2c50e8be70cbdfd12f",0,0,0,0,0,""
20200809,"WA",65229,281,,,"totalTestEncountersViral",1202997,531,5896,,,60,,,"8/8/2020 02:59","2020-08-08T02:59:00Z","08/07 22:59",1688,5896,,"2020-08-08T02:59:00Z",,,,64948,1688,,1202997,,,,,,,,,,,,"53",674,0,65229,4990,65229,,16,6,"b6b432a052dbc9b93f8986ee2130778370c6f866",0,0,0,0,0,""
20200808,"WA",64555,268,,,"totalTestEncountersViral",1198007,551,5890,,,56,,,"8/6/2020 20:30","2020-08-06T20:30:00Z","08/06 16:30",1672,5890,,"2020-08-06T20:30:00Z",,,,64287,1672,,1198007,,,,,,,,,,,,"53",732,0,64555,9342,64555,,19,16,"068fa92e2b9bf5723fd5a0364826ecdc13098289",0,0,0,0,0,""
20200807,"WA",63823,256,,,"totalTestEncountersViral",1188665,505,5874,,,50,,,"8/6/2020 02:59","2020-08-06T02:59:00Z","08/05 22:59",1653,5874,,"2020-08-06T02:59:00Z",,,,63567,1653,,1188665,,,,,,,,,,,,"53",768,0,63823,15015,63823,,29,34,"a9595ad2e3542a398952ff63f3e56a84bad6bfec",0,0,0,0,0,""
20200806,"WA",63055,244,,,"totalTestEncountersViral",1173650,518,5840,,,58,,,"8/5/2020 02:59","2020-08-05T02:59:00Z","08/04 22:59",1624,5840,,"2020-08-05T02:59:00Z",,,,62811,1624,,1173650,,,,,,,,,,,,"53",872,0,63055,14589,63055,,5,61,"3c328a91a6d71416cd082249912c239fdbd42f37",0,0,0,0,0,""
20200805,"WA",62183,223,,,"totalTestEncountersViral",1159061,525,5779,,,47,,,"8/4/2020 02:59","2020-08-04T02:59:00Z","08/03 22:59",1619,5779,,"2020-08-04T02:59:00Z",,,,61960,1619,,1159061,1009486,,,,,,,,,,,"53",871,0,62183,15068,62183,,19,35,"9e0d0963324cf7f05a1c664be4ee88c33a252c4f",0,0,0,0,0,""
20200804,"WA",61312,205,,,"totalTestEncountersViral",1143993,518,5744,,,52,,,"8/3/2020 02:59","2020-08-03T02:59:00Z","08/02 22:59",1600,5744,,"2020-08-03T02:59:00Z",,,,61107,1600,,1143993,1008822,,,,,,,,,,,"53",238,0,61312,16374,61312,,4,52,"f66c1ebb91fa6222062c0042c282c0906d2a4778",0,0,0,0,0,""
20200803,"WA",61074,204,,,"totalTestEncountersViral",1127619,512,5692,,,51,,,"8/2/2020 02:59","2020-08-02T02:59:00Z","08/01 22:59",1596,5692,,"2020-08-02T02:59:00Z",,,,60870,1596,,1127619,1008280,,,,,,,,,,,"53",416,0,61074,17534,61074,,4,37,"fad0a190c79009fd7d6091dc2a011d2090607d1c",0,0,0,0,0,""
20200802,"WA",60658,202,,,"totalTestEncountersViral",1110085,530,5655,,,57,,,"8/1/2020 02:59","2020-08-01T02:59:00Z","07/31 22:59",1592,5655,,"2020-08-01T02:59:00Z",,,,60456,1592,,1110085,1001528,,,,,,,,,,,"53",711,0,60658,4787,60658,,28,87,"a59016eeaeb09177c38b62cd99f43c81b3746372",0,0,0,0,0,""
20200801,"WA",59947,176,,,"totalTestEncountersViral",1105298,532,5568,,,56,,,"7/30/2020 02:59","2020-07-30T02:59:00Z","07/29 22:59",1564,5568,,"2020-07-30T02:59:00Z",,,,59771,1564,,1105298,973654,,,,,,,,,,,"53",751,0,59947,8996,59947,,0,0,"175818e11469753603fbf19e9630395aed8b9737",0,0,0,0,0,""
20200731,"WA",59196,167,,,"totalTestEncountersViral",1096302,526,5568,,,56,,,"7/30/2020 02:59","2020-07-30T02:59:00Z","07/29 22:59",1564,5568,,"2020-07-30T02:59:00Z",,,,59029,1564,,1096302,973654,,,,,,,,,,,"53",898,0,59196,14816,59196,,9,92,"9d2f89f27eb2d08279a4c133926e940c823a7f8c",0,0,0,0,0,""
20200730,"WA",58298,149,,,"totalTestEncountersViral",1081486,530,5476,,,57,,,"7/29/2020 02:59","2020-07-29T02:59:00Z","07/28 22:59",1555,5476,,"2020-07-29T02:59:00Z",,,,58149,1555,,1081486,958307,,,,,,,,,,,"53",959,0,58298,14588,58298,,7,2,"149862124ff6078069d2d92341810a75446c0943",0,0,0,0,0,""
20200729,"WA",57339,137,,,"totalTestEncountersViral",1066898,509,5474,,,48,,,"7/28/2020 02:59","2020-07-28T02:59:00Z","07/27 22:59",1548,5474,,"2020-07-28T02:59:00Z",,,,57202,1548,,1066898,945234,,,,,,,,,,,"53",1001,0,57339,15276,57339,,30,77,"8598548cfc23607b58830364603d3a9f9a485689",0,0,0,0,0,""
20200728,"WA",56338,121,,,"totalTestEncountersViral",1051622,478,5397,,,49,,,"7/27/2020 02:59","2020-07-27T02:59:00Z","07/26 22:59",1518,5397,,"2020-07-27T02:59:00Z",,,,56217,1518,,1051622,933304,,,,,,,,,,,"53",337,0,56338,16103,56338,,17,23,"23b1120587af92e0b78d1672112bfdab3f4ca586",0,0,0,0,0,""
20200727,"WA",56001,119,,,"totalTestEncountersViral",1035519,481,5374,,,42,,,"7/26/2020 02:59","2020-07-26T02:59:00Z","07/25 22:59",1501,5374,,"2020-07-26T02:59:00Z",,,,55882,1501,,1035519,919347,,,,,,,,,,,"53",475,0,56001,17296,56001,,7,33,"e61959bd329695f5726af5ca660b2e99fdde034e",0,0,0,0,0,""
20200726,"WA",55526,118,,,"totalTestEncountersViral",1018223,494,5341,,,51,,,"7/25/2020 02:59","2020-07-25T02:59:00Z","07/24 22:59",1494,5341,,"2020-07-25T02:59:00Z",,,,55408,1494,,1018223,903674,,,,,,,,,,,"53",810,0,55526,4944,55526,,-1,40,"b16e85d3e22b23c2bdc57b1c45ddb01c19d91926",0,0,0,0,0,""
20200725,"WA",54716,108,,,"totalTestEncountersViral",1013279,520,5301,,,52,,,"7/24/2020 02:59","2020-07-24T02:59:00Z","07/23 22:59",1495,5301,,"2020-07-24T02:59:00Z",,,,54608,1495,,1013279,883982,,,,,,,,,,,"53",907,0,54716,9569,54716,,13,25,"cdae5ac0b1fdcc457e4c0db063cfeb518d437d34",0,0,0,0,0,""
20200724,"WA",53809,83,,,"totalTestEncountersViral",1003710,517,5276,,,47,,,"7/23/2020 02:59","2020-07-23T02:59:00Z","07/22 22:59",1482,5276,,"2020-07-23T02:59:00Z",,,,53726,1482,,1003710,870763,,,,,,,,,,,"53",1027,0,53809,15175,53809,,14,65,"24dcd9880573182b1fa390597d87b5e86cb85bd4",0,0,0,0,0,""
20200723,"WA",52782,76,,,"totalTestEncountersViral",988535,527,5211,,,55,,,"7/22/2020 02:59","2020-07-22T02:59:00Z","07/21 22:59",1468,5211,,"2020-07-22T02:59:00Z",,,,52706,1468,,988535,855152,,,,,,,,,,,"53",1096,0,52782,14453,52782,,3,50,"2232253d6038675298b0dbf7adb50ee17e7d197b",0,0,0,0,0,""
20200722,"WA",51686,69,,,"totalTestEncountersViral",974082,546,5161,,,51,,,"7/21/2020 02:59","2020-07-21T02:59:00Z","07/20 22:59",1465,5161,,"2020-07-21T02:59:00Z",,,,51617,1465,,974082,841184,,,,,,,,,,,"53",1000,0,51686,15767,51686,,12,59,"cfa4fad14d17713fc4e30a5018465e83f4603510",0,0,0,0,0,""
20200721,"WA",50686,66,,,"totalTestEncountersViral",958315,494,5102,,,43,,,"7/20/2020 02:59","2020-07-20T02:59:00Z","07/19 22:59",1453,5102,,"2020-07-20T02:59:00Z",,,,50620,1453,,958315,826354,,,,,,,,,,,"53",343,0,50686,17057,50686,,6,39,"eec965a1efe255c0f8ca7eec95fc0f7fd68ba0d4",0,0,0,0,0,""
20200720,"WA",50343,65,,,"totalTestEncountersViral",941258,511,5063,,,42,,,"7/19/2020 02:59","2020-07-19T02:59:00Z","07/18 22:59",1447,5063,,"2020-07-19T02:59:00Z",,,,50278,1447,,941258,809339,,,,,,,,,,,"53",535,0,50343,17727,50343,,3,30,"7665f0e48445c28d65b96c6c62737bc4645c33f5",0,0,0,0,0,""
20200719,"WA",49808,65,,,"totalTestEncountersViral",923531,534,5033,,,62,,,"7/18/2020 02:59","2020-07-18T02:59:00Z","07/17 22:59",1444,5033,,"2020-07-18T02:59:00Z",,,,49743,1444,,923531,791786,,,,,,,,,,,"53",908,0,49808,5211,49808,,10,49,"80befea89c8b750b85e2ea08a4c0215ef0ba19cd",0,0,0,0,0,""
20200718,"WA",48900,51,,,"totalTestEncountersViral",918320,524,4984,,,46,,,"7/17/2020 02:59","2020-07-17T02:59:00Z","07/16 22:59",1434,4984,,"2020-07-17T02:59:00Z",,,,48849,1434,,918320,767657,,,,,,,,,,,"53",861,0,48900,9687,48900,,7,40,"0e8ab97c259abb7a3fa48a6a5a6960e4f6330d41",0,0,0,0,0,""
20200717,"WA",48039,41,,,"totalTestEncountersViral",908633,536,4944,,,45,,,"7/16/2020 02:59","2020-07-16T02:59:00Z","07/15 22:59",1427,4944,,"2020-07-16T02:59:00Z",,,,47998,1427,,908633,753174,,,,,,,,,,,"53",1000,0,48039,16397,48039,,6,115,"619e10e4be62bf4136c5bfcf7b70521737372843",0,0,0,0,0,""
20200716,"WA",47039,23,,,"totalTestEncountersViral",892236,527,4829,,,53,,,"7/15/2020 02:59","2020-07-15T02:59:00Z","07/14 22:59",1421,4829,,"2020-07-15T02:59:00Z",,,,47016,1421,,892236,733886,,,,,,,,,,,"53",969,0,47039,15411,47039,,17,41,"f8f3a6f806e2ea142110886492c50f47799c4864",0,0,0,0,0,""
20200715,"WA",46070,22,,,"totalTestEncountersViral",876825,497,4788,,,55,,,"7/14/2020 02:59","2020-07-14T02:59:00Z","07/13 22:59",1404,4788,,"2020-07-14T02:59:00Z",,,,46048,1404,,876825,718234,,,,,,,,,,,"53",1093,0,46070,16850,46070,,5,10,"db746a4d71691700d3926a7973b8a81c45767f81",0,0,0,0,0,""
20200714,"WA",44977,17,,,"totalTestEncountersViral",859975,445,4778,,,39,,,"7/13/2020 02:59","2020-07-13T02:59:00Z","07/12 22:59",1399,4778,,"2020-07-13T02:59:00Z",,,,44960,1399,,859975,708274,,,,,,,,,,,"53",344,0,44977,17913,44977,,-39,27,"edf00ec15614486a21259586226343d5d1ba1322",0,0,0,0,0,""
20200713,"WA",44633,17,,,"totalTestEncountersViral",842062,443,4751,,,35,,,"7/12/2020 02:59","2020-07-12T02:59:00Z","07/11 22:59",1438,4751,,"2020-07-12T02:59:00Z",,,,44616,1438,,842062,686005,,,,,,,,,,,"53",542,0,44633,18560,44633,,14,89,"9ce6a2df24b5d109d2276cc065cbcbac7b08e570",0,0,0,0,0,""
20200712,"WA",44091,17,,,"totalTestEncountersViral",823502,447,4662,,,57,,,"7/10/2020 02:59","2020-07-10T02:59:00Z","07/09 22:59",1424,4662,,"2020-07-10T02:59:00Z",,,,44074,1424,,823502,668466,,,,,,,,,,,"53",850,0,44091,5382,44091,,0,0,"7567db0bf2627f2f807b146ac609c4fdacbe2351",0,0,0,0,0,""
20200711,"WA",43241,15,,,"totalTestEncountersViral",818120,447,4662,,,57,,,"7/10/2020 02:59","2020-07-10T02:59:00Z","07/09 22:59",1424,4662,,"2020-07-10T02:59:00Z",,,,43226,1424,,818120,668466,,,,,,,,,,,"53",866,0,43241,10343,43241,,15,-3,"ba3d3361c7a038459d8a6aac13c6bf60ae0842ca",0,0,0,0,0,""
20200710,"WA",42375,11,,,"totalTestEncountersViral",807777,460,4665,,,60,,,"7/9/2020 02:59","2020-07-09T02:59:00Z","07/08 22:59",1409,4665,,"2020-07-09T02:59:00Z",,,,42364,1409,,807777,660330,,,,,,,,,,,"53",972,0,42375,14227,42375,,15,35,"8a7dd9cd80f13cf639fd2a5ba7e78b3610034f5a",0,0,0,0,0,""
20200709,"WA",41403,9,,,"totalTestEncountersViral",793550,468,4630,,,59,,,"7/8/2020 02:59","2020-07-08T02:59:00Z","07/07 22:59",1394,4630,,"2020-07-08T02:59:00Z",,,,41394,1394,,793550,645072,,,,,,,,,,,"53",1062,0,41403,12499,41403,,10,48,"10b5feb212d11066dac98ed42bd68bbbf1e32f20",0,0,0,0,0,""
20200708,"WA",40341,9,,,"totalTestEncountersViral",781051,425,4582,,,52,,,"7/7/2020 02:59","2020-07-07T02:59:00Z","07/06 22:59",1384,4582,,"2020-07-07T02:59:00Z",,,,40332,1384,,781051,635524,,,,,,,,,,,"53",985,0,40341,15397,40341,,14,38,"deeee5dd5e39ed6e0efdbe7003feff33fa1f3a0c",0,0,0,0,0,""
20200707,"WA",39356,7,,,"totalTestEncountersViral",765654,407,4544,,,37,,,"7/6/2020 02:59","2020-07-06T02:59:00Z","07/05 22:59",1370,4544,,"2020-07-06T02:59:00Z",,,,39349,1370,,765654,629256,,,,,,,,,,,"53",301,0,39356,17656,39356,,11,62,"6ab21a739b81d18d775a9bd954bc8147aa738997",0,0,0,0,0,""
20200706,"WA",39055,7,,,"totalTestEncountersViral",747998,398,4482,,,39,,,"7/5/2020 02:59","2020-07-05T02:59:00Z","07/04 22:59",1359,4482,,"2020-07-05T02:59:00Z",,,,39048,1359,,747998,612706,,,,,,,,,,,"53",241,0,39055,17749,39055,,5,9,"a66d31bce36bddacca56d52c54a6f94ec0850112",0,0,0,0,0,""
20200705,"WA",38814,7,,,"totalTestEncountersViral",730249,412,4473,,,56,,,"7/4/2020 02:59","2020-07-04T02:59:00Z","07/03 22:59",1354,4473,,"2020-07-04T02:59:00Z",,,,38807,1354,,730249,607276,,,,,,,,,,,"53",453,0,38814,4803,38814,,2,10,"4d902aeecb00ae14518cfe4a497ffdab3e844088",0,0,0,0,0,""
20200704,"WA",38361,7,,,"totalTestEncountersViral",725446,446,4463,,,58,,,"7/3/2020 02:59","2020-07-03T02:59:00Z","07/02 22:59",1352,4463,,"2020-07-03T02:59:00Z",,,,38354,1352,,725446,599975,,,,,,,,,,,"53",888,0,38361,4634,38361,,10,21,"8fd17cc81babcf3ebae91b4f50284a8b69ccf821",0,0,0,0,0,""
20200703,"WA",37473,7,,,"totalTestEncountersViral",720812,460,4442,,,62,,,"7/2/2020 02:59","2020-07-02T02:59:00Z","07/01 22:59",1342,4442,,"2020-07-02T02:59:00Z",,,,37466,1342,,720812,584989,,,,,,,,,,,"53",884,0,37473,10069,37473,,3,40,"430d031db34513318dfab16e6bbe9ee28ad4e661",0,0,0,0,0,""
20200702,"WA",36589,7,,,"totalTestEncountersViral",710743,430,4402,,,57,,,"7/1/2020 02:59","2020-07-01T02:59:00Z","06/30 22:59",1339,4402,,"2020-07-01T02:59:00Z",,,,36582,1339,,710743,571964,,,,,,,,,,,"53",920,0,36589,14811,36589,,7,41,"0b23067d2486d341ef838cb616e11b973c2a748a",0,0,0,0,0,""
20200701,"WA",35669,5,,,"totalTestEncountersViral",695932,427,4361,,,50,,,"6/30/2020 02:59","2020-06-30T02:59:00Z","06/29 22:59",1332,4361,,"2020-06-30T02:59:00Z",,,,35664,1332,,695932,557275,,,,,,,,,,,"53",989,0,35669,16148,35669,,12,38,"d6b3c4b184ba8acde7b4e6800188b8f9b2e82dc9",0,0,0,0,0,""
20200630,"WA",34680,5,,,"totalTestEncountersViral",679784,395,4323,,,50,,,"6/29/2020 02:59","2020-06-29T02:59:00Z","06/28 22:59",1320,4323,,"2020-06-29T02:59:00Z",,,,34675,1320,,679784,548220,,,,,,,,,,,"53",266,0,34680,17729,34680,,10,48,"123658e747b1fbf64a6727eeca4b0dbcb77638f1",0,0,0,0,0,""
20200629,"WA",34414,5,,,"totalTestEncountersViral",662055,387,4275,,,52,,,"6/28/2020 02:59","2020-06-28T02:59:00Z","06/27 22:59",1310,4275,,"2020-06-28T02:59:00Z",,,,34409,1310,,662055,534443,,,,,,,,,,,"53",493,0,34414,17616,34414,,0,35,"fc6f104b61cf344e0a8c37d32682629371c0870f",0,0,0,0,0,""
20200628,"WA",33921,5,,,"totalTestEncountersViral",644439,400,4240,,,58,,,"6/27/2020 02:59","2020-06-27T02:59:00Z","06/26 22:59",1310,4240,,"2020-06-27T02:59:00Z",,,,33916,1310,,644439,525802,,,,,,,,,,,"53",626,0,33921,4854,33921,,6,46,"6f070b34e547d37e9468b1bf783d0629d994c4bf",0,0,0,0,0,""
20200627,"WA",33295,3,,,"totalTestEncountersViral",639585,386,4194,,,50,,,"6/26/2020 02:59","2020-06-26T02:59:00Z","06/25 22:59",1304,4194,,"2020-06-26T02:59:00Z",,,,33292,1304,,639585,514428,,,,,,,,,,,"53",661,0,33295,8678,33295,,4,88,"ae1d7d7143aadb0d5e4f14d82be92d952614b8aa",0,0,0,0,0,""
20200626,"WA",32634,2,,,"totalTestEncountersViral",630907,372,4106,,,49,,,"6/25/2020 02:59","2020-06-25T02:59:00Z","06/24 22:59",1300,4106,,"2020-06-25T02:59:00Z",,,,32632,1300,,630907,505795,,,,,,,,,,,"53",676,0,32634,13587,32634,,7,13,"03129fa727f1e0927c23416e2c3d2b81d9d78d39",0,0,0,0,0,""
20200625,"WA",31958,2,,,"totalTestEncountersViral",617320,402,4093,,,56,,,"6/24/2020 02:59","2020-06-24T02:59:00Z","06/23 22:59",1293,4093,,"2020-06-24T02:59:00Z",,,,31956,1293,,617320,495498,,,,,,,,,,,"53",620,0,31958,13233,31958,,9,26,"ea9e6da13d317471563fb2f0e62816c5ad1882f6",0,0,0,0,0,""
20200624,"WA",31338,,,,"totalTestEncountersViral",604087,386,4067,,,44,,,"6/23/2020 02:59","2020-06-23T02:59:00Z","06/22 22:59",1284,4067,,"2020-06-23T02:59:00Z",,,,31338,1284,,604087,487059,,,,,,,,,,,"53",724,0,31338,14545,31338,,8,5,"8e023f82089e9bd5b1c1769f5684ab826e159ab8",0,0,0,0,0,""
20200623,"WA",30614,,,,"totalTestEncountersViral",589542,372,4062,,,37,,,"6/22/2020 02:59","2020-06-22T02:59:00Z","06/21 22:59",1276,4062,,"2020-06-22T02:59:00Z",,,,30614,1276,,589542,477204,,,,,,,,,,,"53",191,0,30614,13098,30614,,6,13,"69590d8cdbe5f04d456bea4b5a685c3af267729f",0,0,0,0,0,""
20200622,"WA",30423,,,,"totalTestEncountersViral",576444,362,4049,,,42,,,"6/22/2020 02:59","2020-06-22T02:59:00Z","06/21 22:59",1270,4049,,"2020-06-22T02:59:00Z",,,,30423,1270,,576444,474938,,,,,,,,,,,"53",315,0,30423,13634,30423,,5,19,"06cc6bebde470b6a8a0e66f763faa1babbacff39",0,0,0,0,0,""
20200621,"WA",30108,,,,"totalTestEncountersViral",562810,371,4030,,,54,,,"6/21/2020 02:59","2020-06-21T02:59:00Z","06/20 22:59",1265,4030,,"2020-06-21T02:59:00Z",,,,30108,1265,,562810,466069,,,,,,,,,,,"53",521,0,30108,3797,30108,,10,27,"04addb0f46865eedea2ef10105fc9bb91112e746",0,0,0,0,0,""
20200620,"WA",29587,,,,"totalTestEncountersViral",559013,359,4003,,,49,,,"6/20/2020 02:59","2020-06-20T02:59:00Z","06/19 22:59",1255,4003,,"2020-06-20T02:59:00Z",,,,29587,1255,,559013,474876,,,,,,,,,,,"53",542,0,29587,7072,29587,,10,44,"2d86d58654e6424fa81a7f75c0e63252a95f2dcc",0,0,0,0,0,""
20200619,"WA",29045,,,,"totalTestEncountersViral",551941,396,3959,,,47,,,"6/18/2020 02:59","2020-06-18T02:59:00Z","06/17 22:59",1245,3959,,"2020-06-18T02:59:00Z",,,,29045,1245,,551941,474187,,,,,,,,,,,"53",460,0,29045,10006,29045,,19,21,"d027202c6e68128a1714999cd5aee1e0b8a0a856",0,0,0,0,0,""
20200618,"WA",28585,,,,"totalTestEncountersViral",541935,373,3938,,,47,,,"6/17/2020 02:59","2020-06-17T02:59:00Z","06/16 22:59",1226,3938,,"2020-06-17T02:59:00Z",,,,28585,1226,,541935,469768,,,,,,,,,,,"53",494,0,28585,9795,28585,,-5,23,"46d3a3f43a74eab6ebd076504599219d1356ccc0",0,0,0,0,0,""
20200617,"WA",28091,,,,"totalTestEncountersViral",532140,359,3915,,,47,,,"6/16/2020 02:59","2020-06-16T02:59:00Z","06/15 22:59",1231,3915,,"2020-06-16T02:59:00Z",,,,28091,1231,,532140,463149,,,,,,,,,,,"53",520,0,28091,10795,28091,,10,21,"f46d4eb50a9474b064767c494c7cf43aa83ec0c2",0,0,0,0,0,""
20200616,"WA",27571,,,,"totalTestEncountersViral",521345,342,3894,,,38,,,"6/15/2020 02:59","2020-06-15T02:59:00Z","06/14 22:59",1221,3894,,"2020-06-15T02:59:00Z",,,,27571,1221,,521345,454236,,,,,,,,,,,"53",136,0,27571,12560,27571,,4,38,"9ade4abd35f79aa642f9b7d8de4f2e0eb1ed0c90",0,0,0,0,0,""
20200615,"WA",27435,,,,"totalTestEncountersViral",508785,357,3856,,,41,,,"6/14/2020 02:59","2020-06-14T02:59:00Z","06/13 22:59",1217,3856,,"2020-06-14T02:59:00Z",,,,27435,1217,,508785,443294,,,,,,,,,,,"53",193,0,27435,11883,27435,,4,11,"3186888c45d1260bf3ed80a024db2e9e296e5ec1",0,0,0,0,0,""
20200614,"WA",27242,,,,"totalTestEncountersViral",496902,350,3845,,,49,,,"6/13/2020 02:59","2020-06-13T02:59:00Z","06/12 22:59",1213,3845,,"2020-06-13T02:59:00Z",,,,27242,1213,,496902,432619,,,,,,,,,,,"53",390,0,27242,4093,27242,,9,28,"02a9c5c99e7eb3417af060e20993bddcae585c2f",0,0,0,0,0,""
20200613,"WA",26852,,,,"totalTestEncountersViral",492809,372,3817,,,43,,,"6/12/2020 02:59","2020-06-12T02:59:00Z","06/11 22:59",1204,3817,,"2020-06-12T02:59:00Z",,,,26852,1204,,492809,428859,,,,,,,,,,,"53",400,0,26852,6423,26852,,10,45,"4cf0dde043cb3b64193489fbe5d8a83397fca7d5",0,0,0,0,0,""
20200612,"WA",26452,,,,"totalTestEncountersViral",486386,386,3772,,,8,,,"6/12/2020 02:59","2020-06-12T02:59:00Z","06/11 22:59",1194,3772,,"2020-06-12T02:59:00Z",,,,26452,1194,,486386,422770,,,,,,,,,,,"53",371,0,26452,9637,26452,,4,-1,"94eb463abafa76a5dd80f2e373b0cfab3ae438f6",0,0,0,0,0,""
20200611,"WA",26081,,,,"totalTestEncountersViral",476749,384,3773,,,63,,,"6/11/2020 02:59","2020-06-11T02:59:00Z","06/10 22:59",1190,3773,,"2020-06-11T02:59:00Z",,,,26081,1190,,476749,413579,,,,,,,,,,,"53",409,0,26081,11970,26081,,14,26,"a10240eb0873bdecc2566dc9f62f8ff94b9142ef",0,0,0,0,0,""
20200610,"WA",25672,,,,"totalTestEncountersViral",464779,350,3747,,,92,,,"6/10/2020 02:59","2020-06-10T02:59:00Z","06/09 22:59",1176,3747,,"2020-06-10T02:59:00Z",,,,25672,1176,,464779,402370,,,,,,,,,,,"53",510,0,25672,12421,25672,,15,48,"05905c18aeeb16bf60c438db8ac1eb18d833a246",0,0,0,0,0,""
20200609,"WA",25162,,,,"totalTestEncountersViral",452358,372,3699,,,60,,,"6/8/2020 02:59","2020-06-08T02:59:00Z","06/07 22:59",1161,3699,,"2020-06-08T02:59:00Z",,,,25162,1161,,452358,390815,,,,,,,,,,,"53",110,0,25162,11751,25162,,2,30,"46eb583c363aa4f20fe8930c3f1f0f47cf045d46",0,0,0,0,0,""
20200608,"WA",25052,,,,"totalTestEncountersViral",440607,350,3669,,,66,,,"6/7/2020 02:59","2020-06-07T02:59:00Z","06/06 22:59",1159,3669,,"2020-06-07T02:59:00Z",,,,25052,1159,,440607,381030,,,,,,,,,,,"53",163,0,25052,10560,25052,,6,17,"5b076764159f94cbb5c21b64bb8fb7aacf300ed6",0,0,0,0,0,""
20200607,"WA",24889,,,,"totalTestEncountersViral",430047,446,3652,,,57,,,"6/6/2020 02:59","2020-06-06T02:59:00Z","06/05 22:59",1153,3652,,"2020-06-06T02:59:00Z",,,,24889,1153,,430047,372754,,,,,,,,,,,"53",393,0,24889,3125,24889,,4,13,"0c9fc82a3cece29adeff0841b79516118a01492d",0,0,0,0,0,""
20200606,"WA",24496,,,,"totalTestEncountersViral",426922,479,3639,,,86,,,"6/6/2020 02:59","2020-06-06T02:59:00Z","06/05 22:59",1149,3639,,"2020-06-06T02:59:00Z",,,,24496,1149,,426922,370382,,,,,,,,,,,"53",327,0,24496,4772,24496,,11,24,"b7b5cee1bdb77345f72147f54051adcaa68030a0",0,0,0,0,0,""
20200605,"WA",24169,,,,"totalTestEncountersViral",422150,519,3615,,,91,,,"6/5/2020 00:00","2020-06-05T00:00:00Z","06/04 20:00",1138,3615,,"2020-06-05T00:00:00Z",,,,24169,1138,,422150,366633,,,,,,,,,,,"53",382,0,24169,8069,24169,,3,37,"155a13eb5dfba2a331bf308c6a4bb87b33e17f81",0,0,0,0,0,""
20200604,"WA",23787,,,,"totalTestEncountersViral",414081,484,3578,,,94,,,"6/4/2020 02:59","2020-06-04T02:59:00Z","06/03 22:59",1135,3578,,"2020-06-04T02:59:00Z",,,,23787,1135,,414081,360374,,,,,,,,,,,"53",417,0,23787,6377,23787,,6,35,"4df36332864ca631968e22493b8d5d4cc8b93687",0,0,0,0,0,""
20200603,"WA",23370,,,,"totalTestEncountersViral",407704,474,3543,,,89,,,"6/3/2020 00:00","2020-06-03T00:00:00Z","06/02 20:00",1129,3543,,"2020-06-03T00:00:00Z",,,,23370,1129,,407704,355785,,,,,,,,,,,"53",410,0,23370,7329,23370,,5,26,"b21c731e06333b74275e265f3f54e200c317b002",0,0,0,0,0,""
20200602,"WA",22960,,,,"totalTestEncountersViral",400375,473,3517,,,48,,,"6/2/2020 00:00","2020-06-02T00:00:00Z","06/01 20:00",1124,3517,,"2020-06-02T00:00:00Z",,,,22960,1124,,400375,350457,,,,,,,,,,,"53",100,0,22960,8470,22960,,6,16,"12310a89f9f443fa1b9eba9707a1e813705f9b49",0,0,0,0,0,""
20200601,"WA",22860,,,,"totalTestEncountersViral",391905,497,3501,,,52,,,"6/1/2020 00:00","2020-06-01T00:00:00Z","05/31 20:00",1118,3501,,"2020-06-01T00:00:00Z",,,,22860,1118,,391905,344050,,,,,,,,,,,"53",149,0,22860,8023,22860,,0,21,"9cec24c2c316ea292bb83794ffc631a6a0db6582",0,0,0,0,0,""
20200531,"WA",22711,,,,"totalTestEncountersViral",383882,536,3480,,,67,,,"5/31/2020 02:59","2020-05-31T02:59:00Z","05/30 22:59",1118,3480,,"2020-05-31T02:59:00Z",,,,22711,1118,,383882,337852,,,,,,,,,,,"53",344,0,22711,2922,22711,,7,25,"c88eb83fcc4a5bc399fc602db42709a253e14d01",0,0,0,0,0,""
20200530,"WA",22367,,,,"totalTestEncountersViral",380960,541,3455,,,88,,,"5/30/2020 02:59","2020-05-30T02:59:00Z","05/29 22:59",1111,3455,,"2020-05-30T02:59:00Z",,,,22367,1111,,380960,335508,,,,,,,,,,,"53",302,0,22367,4087,22367,,5,42,"ec9aa0136dfa82fc2dd519191ebf5f70e6c5df06",0,0,0,0,0,""
20200529,"WA",22065,,,,"totalTestEncountersViral",376873,547,3413,,,85,,,"5/29/2020 02:59","2020-05-29T02:59:00Z","05/28 22:59",1106,3413,,"2020-05-29T02:59:00Z",,,,22065,1106,,376873,332210,,,,,,,,,,,"53",351,0,22065,6840,22065,,11,19,"9d62b9f41cbe536113f64b65c78927de0814f74f",0,0,0,0,0,""
20200528,"WA",21714,,,,"totalTestEncountersViral",370033,524,3394,,,94,,,"5/27/2020 02:59","2020-05-27T02:59:00Z","05/26 22:59",1095,3394,,"2020-05-27T02:59:00Z",,,,21714,1095,,370033,326818,,,,,,,,,,,"53",400,0,21714,6822,21714,,17,56,"3ce5f788241b1842c8e7e05bb85928ec36b44d43",0,0,0,0,0,""
20200527,"WA",21314,,,,"totalTestEncountersViral",363211,521,3338,,,53,,,"5/26/2020 02:59","2020-05-26T02:59:00Z","05/25 22:59",1078,3338,,"2020-05-26T02:59:00Z",,,,21314,1078,,363211,321586,,,,,,,,,,,"53",149,0,21314,7309,21314,,8,48,"07c97b6da577234dcb977fa5b02106f67cfd7dac",0,0,0,0,0,""
20200526,"WA",21165,,,,"totalTestEncountersViral",355902,509,3290,,,51,,,"5/25/2020 02:59","2020-05-25T02:59:00Z","05/24 22:59",1070,3290,,"2020-05-25T02:59:00Z",,,,21165,1070,,355902,315843,,,,,,,,,,,"53",102,0,21165,8770,21165,,9,3,"30a1ef2b6b8b9139ba4f3052fbe6a5d90f792cda",0,0,0,0,0,""
20200525,"WA",21063,,,,"totalTestEncountersViral",347132,536,3287,,,47,,,"5/24/2020 02:59","2020-05-24T02:59:00Z","05/23 22:59",1061,3287,,"2020-05-24T02:59:00Z",,,,21063,1061,,347132,308948,,,,,,,,,,,"53",151,0,21063,3303,21063,,6,31,"b7094b284f8aebf3b198ac0d4c9227d5d1148bc1",0,0,0,0,0,""
20200524,"WA",20912,,,,"totalTestEncountersViral",343829,560,3256,,,74,,,"5/23/2020 02:59","2020-05-23T02:59:00Z","05/22 22:59",1055,3256,,"2020-05-23T02:59:00Z",,,,20912,1055,,343829,306465,,,,,,,,,,,"53",313,0,20912,2823,20912,,5,26,"84ca16cd7bc0197c8df11295c52241e8b454e40e",0,0,0,0,0,""
20200523,"WA",20599,,,,"totalTestEncountersViral",341006,553,3230,,,96,,,"5/22/2020 02:59","2020-05-22T02:59:00Z","05/21 22:59",1050,3230,,"2020-05-22T02:59:00Z",,,,20599,1050,,341006,304123,,,,,,,,,,,"53",297,0,20599,3350,20599,,6,74,"7336caae42982e93aa78a750b14c8df92b2c21a2",0,0,0,0,0,""
20200522,"WA",20302,,,,"totalTestEncountersViral",337656,572,3156,,,85,,,"5/21/2020 02:59","2020-05-21T02:59:00Z","05/20 22:59",1044,3156,,"2020-05-21T02:59:00Z",,,,20302,1044,,337656,301452,,,,,,,,,,,"53",268,0,20302,5844,20302,,7,31,"3f510ae741245370ad1a3eac3227b3dfc97680e1",0,0,0,0,0,""
20200521,"WA",20034,,,,"totalTestEncountersViral",331812,518,3125,,,70,,,"5/20/2020 02:59","2020-05-20T02:59:00Z","05/19 22:59",1037,3125,,"2020-05-20T02:59:00Z",,,,20034,1037,,331812,296884,,,,,,,,,,,"53",299,0,20034,5733,20034,,6,3125,"d5cae73181a01284551581834a08d04ee52e3529",0,0,0,0,0,""
20200520,"WA",19735,,,,"totalTestEncountersViral",326079,504,,52,,,,,"5/19/2020 02:59","2020-05-19T02:59:00Z","05/18 22:59",1031,,,"2020-05-19T02:59:00Z",,,,19735,1031,,326079,292212,,,,,,,,,,,"53",319,0,19735,7060,19735,,29,0,"f6ac2616cf0ded47c4a47ba04ad092e8524a051d",0,0,0,0,0,""
20200519,"WA",19416,,,,"totalTestEncountersViral",319019,539,,52,,,,,"5/18/2020 02:59","2020-05-18T02:59:00Z","05/17 22:59",1002,,,"2020-05-18T02:59:00Z",,,,19416,1002,,319019,286574,,,,,,,,,,,"53",64,0,19416,8633,19416,,1,0,"f08ac553940d9bc42109bfd16399678e7e6c03fd",0,0,0,0,0,""
20200518,"WA",19352,,,,"totalTestEncountersViral",310386,558,,52,,,,,"5/17/2020 02:59","2020-05-17T02:59:00Z","05/16 22:59",1001,,,"2020-05-17T02:59:00Z",,,,19352,1001,,310386,279478,,,,,,,,,,,"53",118,0,19352,8462,19352,,1,0,"f0d7053d959e5df5bbc553bd0edfb9acbb5b82fb",0,0,0,0,0,""
20200517,"WA",19234,,,,"totalTestEncountersViral",301924,581,,52,,,,,"5/17/2020 00:00","2020-05-17T00:00:00Z","05/16 20:00",1000,,,"2020-05-17T00:00:00Z",,,,19234,1000,,301924,272496,,,,,,,,,,,"53",282,0,19234,2468,19234,,8,0,"d8780bedf9aa44fa97f434c39fe9b86f05e5917d",0,0,0,0,0,""
20200516,"WA",18952,,,,"totalTestEncountersViral",299456,663,,90,,,,,"5/16/2020 00:00","2020-05-16T00:00:00Z","05/15 20:00",992,,,"2020-05-16T00:00:00Z",,,,18952,992,,299456,270526,,,,,,,,,,,"53",271,0,18952,3498,18952,,9,0,"65207e13fe8a715c522ae86ce0c1e4156b7ad32a",0,0,0,0,0,""
20200515,"WA",18681,,,,"totalTestEncountersViral",295958,626,,114,,,,,"5/15/2020 00:00","2020-05-15T00:00:00Z","05/14 20:00",983,,,"2020-05-15T00:00:00Z",,,,18681,983,,295958,267697,,,,,,,,,,,"53",312,0,18681,6541,18681,,8,0,"01601e239501b02b1153720c9a1fc8add02628bf",0,0,0,0,0,""
20200514,"WA",18369,,,,"totalTestEncountersViral",289417,645,,111,,,,,"5/14/2020 00:00","2020-05-14T00:00:00Z","05/13 20:00",975,,,"2020-05-14T00:00:00Z",,,,18369,975,,289417,262293,,,,,,,,,,,"53",251,0,18369,6373,18369,,13,0,"3e6817377b2f35f2077f9253abd1f9ffbee60442",0,0,0,0,0,""
20200513,"WA",18118,,,,"totalTestEncountersViral",283044,562,,114,,,,,"5/13/2020 00:00","2020-05-13T00:00:00Z","05/12 20:00",962,,,"2020-05-13T00:00:00Z",,,,18118,962,,283044,257288,,,,,,,,,,,"53",294,0,18118,6144,18118,,17,0,"179bba4715227dff949a6f341219a328b7f2d94c",0,0,0,0,0,""
20200512,"WA",17824,,,,"totalTestEncountersViral",276900,321,,94,,,,,"5/12/2020 00:00","2020-05-12T00:00:00Z","05/11 20:00",945,,,"2020-05-12T00:00:00Z",,,,17824,945,,276900,252541,,,,,,,,,,,"53",61,0,17824,6106,17824,,14,0,"d176900763ac4faa7b88b1bb2ea19c898531a853",0,0,0,0,0,""
20200511,"WA",17763,,,,"totalTestEncountersViral",270794,350,,110,,,,,"5/11/2020 00:00","2020-05-11T00:00:00Z","05/10 20:00",931,,,"2020-05-11T00:00:00Z",,,,17763,931,,270794,247565,,,,,,,,,,,"53",126,0,17763,6198,17763,,10,0,"3aa1aaace85fbc4e652e63bd8632076b0bcd09c6",0,0,0,0,0,""
20200510,"WA",17637,,,,"totalTestEncountersViral",264596,335,,101,,,,,"5/10/2020 00:00","2020-05-10T00:00:00Z","05/09 20:00",921,,,"2020-05-10T00:00:00Z",,,,17637,921,,264596,242722,,,,,,,,,,,"53",254,0,17637,1776,17637,,16,0,"2b814ca74ac916d7149c6073d9f0aa71247af96b",0,0,0,0,0,""
20200509,"WA",17383,,,,"totalTestEncountersViral",262820,393,,128,,,,,"5/9/2020 00:00","2020-05-09T00:00:00Z","05/08 20:00",905,,,"2020-05-09T00:00:00Z",,,,17383,905,,262820,241361,,,,,,,,,,,"53",266,0,17383,2508,17383,,14,0,"72ec35666e5b903e75062dc71457b4ed32e4b439",0,0,0,0,0,""
20200508,"WA",17117,,,,"totalTestEncountersViral",260312,393,,122,,,,,"5/8/2020 00:00","2020-05-08T00:00:00Z","05/07 20:00",891,,,"2020-05-08T00:00:00Z",,,,17117,891,,260312,239267,,,,,,,,,,,"53",289,0,17117,6096,17117,,21,0,"e59a226a68ab53be787d9de19359bec48dd3c07f",0,0,0,0,0,""
20200507,"WA",16828,,,,"totalTestEncountersViral",254216,358,,144,,,,,"5/7/2020 00:00","2020-05-07T00:00:00Z","05/06 20:00",870,,,"2020-05-07T00:00:00Z",,,,16828,870,,254216,234092,,,,,,,,,,,"53",259,0,16828,5514,16828,,8,0,"799dab49e410a7548ae1dca2bbc3946cf06846fb",0,0,0,0,0,""
20200506,"WA",16569,,,,"totalTestEncountersViral",248702,390,,127,,,,,"5/6/2020 00:00","2020-05-06T00:00:00Z","05/05 20:00",862,,,"2020-05-06T00:00:00Z",,,,16569,862,,248702,229508,,,,,,,,,,,"53",388,0,16569,6412,16569,,21,0,"a489e8873b771a9e4b164b8a2d16338cf39a3375",0,0,0,0,0,""
20200505,"WA",16181,,,,"totalTestEncountersViral",242290,292,,102,,,,,"5/5/2020 00:00","2020-05-05T00:00:00Z","05/04 20:00",841,,,"2020-05-05T00:00:00Z",,,,16181,841,,242290,224209,,,,,,,,,,,"53",85,0,16181,6125,16181,,7,0,"a2a9c41de02d3c1e2221021f09f0c04d341ed7ba",0,0,0,0,0,""
20200504,"WA",16096,,,,"totalTestEncountersViral",236165,263,,86,,,,,"5/4/2020 00:00","2020-05-04T00:00:00Z","05/03 20:00",834,,,"2020-05-04T00:00:00Z",,,,16096,834,,236165,219140,,,,,,,,,,,"53",113,0,16096,6365,16096,,4,0,"7221b1e95934be25834dda63fd2eb73921fa5ff4",0,0,0,0,0,""
20200503,"WA",15983,,,,"totalTestEncountersViral",229800,411,,120,,,,,"5/3/2020 00:00","2020-05-03T00:00:00Z","05/02 20:00",830,,,"2020-05-03T00:00:00Z",,,,15983,,,229800,213630,,,,,,,,,,,"53",318,0,15983,1797,15983,,6,0,"c4f83b6d0ea59d5515e9201b25d019f0645dcf02",0,0,0,0,0,""
20200502,"WA",15665,,,,"totalTestEncountersViral",228003,428,,117,,,,,"5/2/2020 00:00","2020-05-02T00:00:00Z","05/01 20:00",824,,,"2020-05-02T00:00:00Z",,,,15665,,,228003,212146,,,,,,,,,,,"53",247,0,15665,2704,15665,,10,0,"28338bcc4e44107f7089eaac92ede2f0f2cb1e64",0,0,0,0,0,""
20200501,"WA",15418,,,,"totalTestEncountersViral",225299,470,,120,,,,,"5/1/2020 00:00","2020-05-01T00:00:00Z","04/30 20:00",814,,,"2020-05-01T00:00:00Z",,,,15418,,,225299,209827,,,,,,,,,,,"53",328,0,15418,5695,15418,,13,0,"a1ee2ad2cd2e1b27d7f8489d81960cfe3295480a",0,0,0,0,0,""
20200430,"WA",15090,,,,"totalTestEncountersViral",219604,474,,145,,,,,"4/30/2020 00:00","2020-04-30T00:00:00Z","04/29 20:00",801,,,"2020-04-30T00:00:00Z",,,,15090,,,219604,205035,,,,,,,,,,,"53",295,0,15090,5526,15090,,15,0,"9f6867ee4a48bbd218226276b851404d05b1224a",0,0,0,0,0,""
20200429,"WA",14795,,,,"totalTestEncountersViral",214078,490,,156,,,,,"4/29/2020 00:00","2020-04-29T00:00:00Z","04/28 20:00",786,,,"2020-04-29T00:00:00Z",,,,14795,,,214078,200153,,,,,,,,,,,"53",370,0,14795,5696,14795,,21,0,"90c9af3483f629df68278df33ee1ab5ee166a5c1",0,0,0,0,0,""
20200428,"WA",14425,,,,"totalTestEncountersViral",208382,436,,158,,,,,"4/28/2020 00:00","2020-04-28T00:00:00Z","04/27 20:00",765,,,"2020-04-28T00:00:00Z",,,,14425,,,208382,195230,,,,,,,,,,,"53",114,0,14425,5968,14425,,16,0,"4b6cac866c745b3c307cd861e25cfd347c704d1f",0,0,0,0,0,""
20200427,"WA",14311,,,,"totalTestEncountersViral",202414,536,,115,,,,,"4/27/2020 00:00","2020-04-27T00:00:00Z","04/26 20:00",749,,,"2020-04-27T00:00:00Z",,,,14311,,,202414,189883,,,,,,,,,,,"53",166,0,14311,5797,14311,,11,0,"2ee3c393e2c44903beba32de5e0e4d3bef08084b",0,0,0,0,0,""
20200426,"WA",14145,,,,"totalTestEncountersViral",196617,508,,145,,,,,"4/26/2020 00:00","2020-04-26T00:00:00Z","04/25 20:00",738,,,"2020-04-26T00:00:00Z",,,,14145,,,196617,184766,,,,,,,,,,,"53",351,0,14145,2085,14145,,73,0,"a91c788b266fa2f79f8e3fec17df2c63171d4c13",0,0,0,0,0,""
20200425,"WA",13794,,,,"totalTestEncountersViral",194532,455,,174,,,,,"4/25/2020 00:00","2020-04-25T00:00:00Z","04/24 20:00",665,,,"2020-04-25T00:00:00Z",,,,13794,,,194532,182988,,,,,,,,,,,"53",275,0,13794,3448,13794,,6,0,"46ab26a2bb71679a7c19655f0e9f06b20082f5f9",0,0,0,0,0,""
20200424,"WA",13519,,,,"totalTestEncountersViral",191084,551,,164,,,,,"4/24/2020 00:00","2020-04-24T00:00:00Z","04/23 20:00",659,,,"2020-04-24T00:00:00Z",,,,13519,,,191084,179977,,,,,,,,,,,"53",284,0,13519,6176,13519,,5,0,"62fccc45a0ade1342b20c3c007982cc1caa44ace",0,0,0,0,0,""
20200423,"WA",13235,,,,"totalTestEncountersViral",184908,544,,151,,,,,"4/23/2020 00:00","2020-04-23T00:00:00Z","04/22 20:00",654,,,"2020-04-23T00:00:00Z",,,,13235,,,184908,174468,,,,,,,,,,,"53",268,0,13235,4963,13235,,7,0,"5f0e67613ccf9c7e72462c89902003235cd7a22b",0,0,0,0,0,""
20200422,"WA",12967,,,,"totalTestEncountersViral",179945,543,,161,,,,,"4/22/2020 00:00","2020-04-22T00:00:00Z","04/21 20:00",647,,,"2020-04-22T00:00:00Z",,,,12967,,,179945,170130,,,,,,,,,,,"53",334,0,12967,5127,12967,,7,0,"e8a10667d5107b076dcec12587b29864b82f1b49",0,0,0,0,0,""
20200421,"WA",12633,,,,"totalTestEncountersViral",174818,503,,161,,,,,"4/21/2020 00:00","2020-04-21T00:00:00Z","04/20 20:00",640,,,"2020-04-21T00:00:00Z",,,,12633,,,174818,165706,,,,,,,,,,,"53",96,0,12633,4791,12633,,11,0,"a67cdc30ac52072c682d26ab1a2d86799b4c72e7",0,0,0,0,0,""
20200420,"WA",12537,,,,"totalTestEncountersViral",170027,403,,122,,,,,"4/20/2020 00:00","2020-04-20T00:00:00Z","04/19 20:00",629,,,"2020-04-20T00:00:00Z",,,,12537,,,170027,161504,,,,,,,,,,,"53",176,0,12537,4968,12537,,14,0,"34c08e1a9bded528852351b3c9667ae956aa97be",0,0,0,0,0,""
20200419,"WA",12361,,,,"totalTestEncountersViral",165059,586,,193,,,,,"4/19/2020 00:00","2020-04-19T00:00:00Z","04/18 20:00",615,,,"2020-04-19T00:00:00Z",,,,12361,,,165059,157116,,,,,,,,,,,"53",347,0,12361,1967,12361,,17,0,"6b2ab60285912637a63c90657e85a36bc128656d",0,0,0,0,0,""
20200418,"WA",12014,,,,"totalTestEncountersViral",163092,518,,155,,,,,"4/18/2020 00:00","2020-04-18T00:00:00Z","04/17 20:00",598,,,"2020-04-18T00:00:00Z",,,,12014,,,163092,155439,,,,,,,,,,,"53",309,0,12014,2568,12014,,13,0,"8e4456bb494d1329d0a5a9b57cf658ac68ac4580",0,0,0,0,0,""
20200417,"WA",11705,,,,"totalTestEncountersViral",160524,622,,195,,,,,"4/17/2020 00:00","2020-04-17T00:00:00Z","04/16 20:00",585,,,"2020-04-17T00:00:00Z",,,,11705,,,160524,153193,,,,,,,,,,,"53",329,0,11705,5123,11705,,14,0,"d61784fa06e8d26cd55dec22a4feb5b1ec5e11cb",0,0,0,0,0,""
20200416,"WA",11376,,,,"totalTestEncountersViral",155401,595,,196,,,,,"4/16/2020 00:00","2020-04-16T00:00:00Z","04/15 20:00",571,,,"2020-04-16T00:00:00Z",,,,11376,,,155401,148741,,,,,,,,,,,"53",302,0,11376,4702,11376,,20,0,"d76c401264553ae62fc9e6183bb4b3197c2b894a",0,0,0,0,0,""
20200415,"WA",11074,,,,"totalTestEncountersViral",150699,645,,194,,,,,"4/15/2020 00:00","2020-04-15T00:00:00Z","04/14 20:00",551,,,"2020-04-15T00:00:00Z",,,,11074,,,150699,144393,,,,,,,,,,,"53",371,0,11074,4498,11074,,9,0,"706e6237bd2ee955375e1f59f013621910906cf5",0,0,0,0,0,""
20200414,"WA",10703,,,,"totalTestEncountersViral",146201,387,,98,,,,,"4/14/2020 00:00","2020-04-14T00:00:00Z","04/13 20:00",542,,,"2020-04-14T00:00:00Z",,,,10703,,,146201,140247,,,,,,,,,,,"53",90,0,10703,4658,10703,,16,0,"196b2e96591c3c4f24927d83a4d48d550069f0a2",0,0,0,0,0,""
20200413,"WA",10613,,,,"totalTestEncountersViral",141543,527,,166,,,,,"4/13/2020 00:00","2020-04-13T00:00:00Z","04/12 20:00",526,,,"2020-04-13T00:00:00Z",,,,10613,,,141543,135938,,,,,,,,,,,"53",155,0,10613,4586,10613,,17,0,"5c3dec68c2729913644585855a79882d2d97f7a6",0,0,0,0,0,""
20200412,"WA",10458,,,,"totalTestEncountersViral",136957,642,,191,,,,,"4/12/2020 00:00","2020-04-12T00:00:00Z","04/11 20:00",509,,,"2020-04-12T00:00:00Z",,,,10458,,,136957,131718,,,,,,,,,,,"53",309,0,10458,1481,10458,,15,0,"6ab876824f5574bc04f15f0fb8e4876a8d0fd3a0",0,0,0,0,0,""
20200411,"WA",10149,,,,"totalTestEncountersViral",135476,649,,191,,,,,"4/11/2020 00:00","2020-04-11T00:00:00Z","04/10 20:00",494,,,"2020-04-11T00:00:00Z",,,,10149,,,135476,130287,,,,,,,,,,,"53",363,0,10149,2187,10149,,18,0,"9c994330cfa4bc34cad1e0e84f1075e880f5497f",0,0,0,0,0,""
20200410,"WA",9786,,,,"totalTestEncountersViral",133289,642,,191,,,,,"4/10/2020 00:00","2020-04-10T00:00:00Z","04/09 20:00",476,,,"2020-04-10T00:00:00Z",,,,9786,,,133289,128211,,,,,,,,,,,"53",346,0,9786,4481,9786,,17,0,"a4d3ab80e3bba5946e8d6ce6e115fe5923fa8060",0,0,0,0,0,""
20200409,"WA",9440,,,,"totalTestEncountersViral",128808,650,,191,,,,,"4/9/2020 00:00","2020-04-09T00:00:00Z","04/08 20:00",459,,,"2020-04-09T00:00:00Z",,,,9440,,,128808,123912,,,,,,,,,,,"53",413,0,9440,4491,9440,,16,0,"0808a5631797dc92c735f689bb5c131682c95084",0,0,0,0,0,""
20200408,"WA",9027,,,,"totalTestEncountersViral",124317,655,,186,,,,,"4/8/2020 00:00","2020-04-08T00:00:00Z","04/07 20:00",443,,,"2020-04-08T00:00:00Z",,,,9027,,,124317,119606,,,,,,,,,,,"53",395,0,9027,5065,9027,,14,0,"4e8781a1ed2df33170be85bd93c905850e7bee32",0,0,0,0,0,""
20200407,"WA",8632,,,,"totalTestEncountersViral",119252,641,,190,,,,,"4/7/2020 00:00","2020-04-07T00:00:00Z","04/06 20:00",429,,,"2020-04-07T00:00:00Z",,,,8632,,,119252,114802,,,,,,,,,,,"53",171,0,8632,5476,8632,,22,0,"82a2c2c813956bed31147b0de66629325c5145d7",0,0,0,0,0,""
