"date","state","positive","probableCases","negative","pending","totalTestResultsSource","totalTestResults","hospitalizedCurrently","hospitalizedCumulative","inIcuCurrently","inIcuCumulative","onVentilatorCurrently","onVentilatorCumulative","recovered","lastUpdateEt","dateModified","checkTimeEt","death","hospitalized","hospitalizedDischarged","dateChecked","totalTestsViral","positiveTestsViral","negativeTestsViral","positiveCasesViral","deathConfirmed","deathProbable","totalTestEncountersViral","totalTestsPeopleViral","totalTestsAntibody","positiveTestsAntibody","negativeTestsAntibody","totalTestsPeopleAntibody","positiveTestsPeopleAntibody","negativeTestsPeopleAntibody","totalTestsPeopleAntigen","positiveTestsPeopleAntigen","totalTestsAntigen","positiveTestsAntigen","fips","positiveIncrease","negativeIncrease","total","totalTestResultsIncrease","posNeg","dataQualityGrade","deathIncrease","hospitalizedIncrease","hash","commercialScore","negativeRegularScore","negativeScore","positiveScore","score","grade"
20210307,"WY",54764,8367,182264,,"totalTestsViral",649293,21,1391,,,,,53550,"3/5/2021 00:00","2021-03-05T00:00:00Z","03/04 19:00",682,1391,,"2021-03-05T00:00:00Z",649293,38993,602513,46397,,,,228661,,,,,,,,,,,"56",0,0,237028,0,237028,,0,0,"9cbc8bdcabbaf1f301ec1e48f8c23a4c65753282",0,0,0,0,0,""
20210306,"WY",54764,8367,182264,,"totalTestsViral",649293,21,1391,,,,,53550,"3/5/2021 00:00","2021-03-05T00:00:00Z","03/04 19:00",682,1391,,"2021-03-05T00:00:00Z",649293,38993,602513,46397,,,,228661,,,,,,,,,,,"56",0,0,237028,0,237028,,0,0,"1c663524ab25a7f876788a0a2e4dc12a0026ecbd",0,0,0,0,0,""
20210305,"WY",54764,8367,182264,,"totalTestsViral",649293,21,1391,,,,,53550,"3/5/2021 00:00","2021-03-05T00:00:00Z","03/04 19:00",682,1391,,"2021-03-05T00:00:00Z",649293,38993,602513,46397,,,,228661,,,,,,,,,,,"56",79,307,237028,3114,237028,,0,2,"0bb724dd37746ba6f6cf1a322600bb0cd13b4d98",0,0,0,0,0,""
20210304,"WY",54685,8357,181957,,"totalTestsViral",646179,23,1389,,,,,53481,"3/4/2021 00:00","2021-03-04T00:00:00Z","03/03 19:00",682,1389,,"2021-03-04T00:00:00Z",646179,38946,599452,46328,,,,228285,,,,,,,,,,,"56",69,276,236642,2703,236642,,0,1,"bafad46ba8420fbbba342b4739be877ac62c0050",0,0,0,0,0,""
20210303,"WY",54616,8348,181681,,"totalTestsViral",643476,24,1388,,,,,53375,"3/3/2021 00:00","2021-03-03T00:00:00Z","03/02 19:00",682,1388,,"2021-03-03T00:00:00Z",643476,38905,596799,46268,,,,227949,,,,,,,,,,,"56",89,278,236297,2096,236297,,0,3,"716c8498948f8b7ab25227b0beb294adcacf307a",0,0,0,0,0,""
20210302,"WY",54527,8337,181403,,"totalTestsViral",641380,24,1385,,,,,53339,"3/2/2021 00:00","2021-03-02T00:00:00Z","03/01 19:00",682,1385,,"2021-03-02T00:00:00Z",641380,38847,594768,46190,,,,227593,,,,,,,,,,,"56",56,207,235930,786,235930,,11,1,"76fff3d29fa6c93bfd938e380e3ea483f561a7b8",0,0,0,0,0,""
20210301,"WY",54471,8324,181196,,"totalTestsViral",640594,28,1384,,,,,53248,"3/1/2021 00:00","2021-03-01T00:00:00Z","02/28 19:00",671,1384,,"2021-03-01T00:00:00Z",640594,38827,594005,46147,,,,227343,,,,,,,,,,,"56",77,370,235667,3878,235667,,0,2,"22c0594820e39b5eb6dbff2eeffaf0872d5123c5",0,0,0,0,0,""
20210228,"WY",54394,8318,180826,,"totalTestsViral",636716,25,1382,,,,,53132,"2/28/2021 00:00","2021-02-28T00:00:00Z","02/27 19:00",671,1382,,"2021-02-28T00:00:00Z",636716,38734,590006,46076,,,,226870,,,,,,,,,,,"56",44,0,235220,0,235220,,0,1,"982a303a24c06c94955ee7e070b80e2db2db381d",0,0,0,0,0,""
20210227,"WY",54350,8306,180826,,"totalTestsViral",636716,25,1381,,,,,52998,"2/26/2021 00:00","2021-02-26T00:00:00Z","02/25 19:00",671,1381,,"2021-02-26T00:00:00Z",636716,38734,590006,46044,,,,226870,,,,,,,,,,,"56",0,0,235176,0,235176,,0,0,"1ecfc50f307fa3847adfb8bc0c2c0afb8567a13c",0,0,0,0,0,""
20210226,"WY",54350,8306,180826,,"totalTestsViral",636716,25,1381,,,,,52998,"2/26/2021 00:00","2021-02-26T00:00:00Z","02/25 19:00",671,1381,,"2021-02-26T00:00:00Z",636716,38734,590006,46044,,,,226870,,,,,,,,,,,"56",148,358,235176,3090,235176,,0,4,"64d18c3e8cf78e5f534cb11416a641c05384a49a",0,0,0,0,0,""
20210225,"WY",54202,8277,180468,,"totalTestsViral",633626,20,1377,,,,,52879,"2/25/2021 00:00","2021-02-25T00:00:00Z","02/24 19:00",671,1377,,"2021-02-25T00:00:00Z",633626,38686,586971,45925,,,,226393,,,,,,,,,,,"56",214,240,234670,3788,234670,,0,3,"19d068d31678f424ea7f838ba939c938883f8d02",0,0,0,0,0,""
20210224,"WY",53988,8187,180228,,"totalTestsViral",629838,25,1374,,,,,52679,"2/24/2021 00:00","2021-02-24T00:00:00Z","02/23 19:00",671,1374,,"2021-02-24T00:00:00Z",629838,38597,583283,45801,,,,226029,,,,,,,,,,,"56",44,797,234216,4802,234216,,0,1,"76ad8e4233c919a03e85ddd982edac30140b8910",0,0,0,0,0,""
20210223,"WY",53944,8164,179431,,"totalTestsViral",625036,21,1373,,,,,52668,"2/23/2021 00:00","2021-02-23T00:00:00Z","02/22 19:00",671,1373,,"2021-02-23T00:00:00Z",625036,38552,581297,45780,,,,225177,,,,,,,,,,,"56",44,0,233375,0,233375,,9,1,"895bd2a53dd024230de8f5c78f1c1e36cb105611",0,0,0,0,0,""
20210222,"WY",53900,8154,179431,,"totalTestsViral",625036,21,1372,,,,,52567,"2/22/2021 00:00","2021-02-22T00:00:00Z","02/21 19:00",662,1372,,"2021-02-22T00:00:00Z",625036,38508,578588,45746,,,,225177,,,,,,,,,,,"56",105,783,233331,4648,233331,,0,3,"6c216800443d9c8671037da3f07470bc0eb6428d",0,0,0,0,0,""
20210221,"WY",53795,8142,178648,,"totalTestsViral",620388,31,1369,,,,,52431,"2/21/2021 00:00","2021-02-21T00:00:00Z","02/20 19:00",662,1369,,"2021-02-21T00:00:00Z",620388,38351,574121,45653,,,,224231,,,,,,,,,,,"56",112,0,232443,0,232443,,0,2,"b9bb9c6fed22c0b23ab0cd2ddf0f1538bcc11b20",0,0,0,0,0,""
20210220,"WY",53683,8100,178648,,"totalTestsViral",620388,31,1367,,,,,52259,"2/19/2021 00:00","2021-02-19T00:00:00Z","02/18 19:00",662,1367,,"2021-02-19T00:00:00Z",620388,38351,574121,45583,,,,224231,,,,,,,,,,,"56",0,0,232331,0,232331,,0,0,"31b330aac593c503b49863bf773a1580f1a615f5",0,0,0,0,0,""
20210219,"WY",53683,8100,178648,,"totalTestsViral",620388,31,1367,,,,,52259,"2/19/2021 00:00","2021-02-19T00:00:00Z","02/18 19:00",662,1367,,"2021-02-19T00:00:00Z",620388,38351,574121,45583,,,,224231,,,,,,,,,,,"56",152,259,232331,2920,232331,,0,3,"0258ec36e6dac115e9905dab65fdf03f6f122dfd",0,0,0,0,0,""
20210218,"WY",53531,8060,178389,,"totalTestsViral",617468,31,1364,,,,,52149,"2/18/2021 00:00","2021-02-18T00:00:00Z","02/17 19:00",662,1364,,"2021-02-18T00:00:00Z",617468,38266,571305,45471,,,,223860,,,,,,,,,,,"56",81,347,231920,2131,231920,,0,1,"f2e040405c4c4e9d7110c8b266f73bec8791b768",0,0,0,0,0,""
20210217,"WY",53450,8012,178042,,"totalTestsViral",615337,32,1363,,,,,52039,"2/17/2021 00:00","2021-02-17T00:00:00Z","02/16 19:00",662,1363,,"2021-02-17T00:00:00Z",615337,38213,569232,45438,,,,223480,,,,,,,,,,,"56",99,227,231492,981,231492,,0,2,"999b5fff1a3a8ed66eb779ca41c2bfc58daa6749",0,0,0,0,0,""
20210216,"WY",53351,7964,177815,,"totalTestsViral",614356,34,1361,,,,,52000,"2/16/2021 00:00","2021-02-16T00:00:00Z","02/15 19:00",662,1361,,"2021-02-16T00:00:00Z",614356,38169,568297,45387,,,,223202,,,,,,,,,,,"56",215,2768,231166,9778,231166,,15,5,"2475cc22751316c97bbca23d24d0c3f52c1ec3d0",0,0,0,0,0,""
20210215,"WY",53136,7911,175047,,"totalTestsViral",604578,44,1356,,,,,51716,"2/14/2021 00:00","2021-02-14T00:00:00Z","02/13 19:00",647,1356,,"2021-02-14T00:00:00Z",604578,37735,559222,45225,,,,220258,,,,,,,,,,,"56",0,0,228183,0,228183,,0,0,"bf4b431c523f498ef1c65eef27ec6e480b614a52",0,0,0,0,0,""
20210214,"WY",53136,7911,175047,,"totalTestsViral",604578,44,1356,,,,,51716,"2/14/2021 00:00","2021-02-14T00:00:00Z","02/13 19:00",647,1356,,"2021-02-14T00:00:00Z",604578,37735,559222,45225,,,,220258,,,,,,,,,,,"56",50,0,228183,0,228183,,0,45,"be8129de3e31d1d204f35a7ad8eff53edb236fd3",0,0,0,0,0,""
20210213,"WY",53086,7875,175047,,"totalTestsViral",604578,44,1311,,,,,51640,"2/12/2021 00:00","2021-02-12T00:00:00Z","02/11 19:00",647,1311,,"2021-02-12T00:00:00Z",604578,37735,559222,45211,,,,220258,,,,,,,,,,,"56",0,0,228133,0,228133,,0,0,"bd208c00fc36cd0ae9831e979387976ff67846c3",0,0,0,0,0,""
20210212,"WY",53086,7875,175047,,"totalTestsViral",604578,44,1311,,,,,51640,"2/12/2021 00:00","2021-02-12T00:00:00Z","02/11 19:00",647,1311,,"2021-02-12T00:00:00Z",604578,37735,559222,45211,,,,220258,,,,,,,,,,,"56",107,439,228133,3475,228133,,0,2,"b2e9127b411e3c2f6c704d198ff7e08300b71c00",0,0,0,0,0,""
20210211,"WY",52979,7824,174608,,"totalTestsViral",601103,41,1309,,,,,51525,"2/11/2021 00:00","2021-02-11T00:00:00Z","02/10 19:00",647,1309,,"2021-02-11T00:00:00Z",601103,37659,555831,45155,,,,219763,,,,,,,,,,,"56",105,279,227587,3254,227587,,0,3,"3f265779b51b1f1fa5547c88da08464110cda390",0,0,0,0,0,""
20210210,"WY",52874,7806,174329,,"totalTestsViral",597849,45,1306,,,,,51419,"2/10/2021 00:00","2021-02-10T00:00:00Z","02/09 19:00",647,1306,,"2021-02-10T00:00:00Z",597849,37588,552662,45068,,,,219397,,,,,,,,,,,"56",44,344,227203,1879,227203,,0,0,"7c8ad8177c79a23a8db7082a5171467d17068ff9",0,0,0,0,0,""
20210209,"WY",52830,7774,173985,,"totalTestsViral",595970,32,1306,,,,,51386,"2/9/2021 00:00","2021-02-09T00:00:00Z","02/08 19:00",647,1306,,"2021-02-09T00:00:00Z",595970,47688,657100,45056,,,,219041,,,,,,,,,,,"56",46,234,226815,-108866,226815,,23,0,"196177b1f6926f278b75073223633ee44997ab97",0,0,0,0,0,""
20210208,"WY",52784,7737,173751,,"totalTestsViral",704836,41,1306,,,,,51291,"2/8/2021 00:00","2021-02-08T00:00:00Z","02/07 19:00",624,1306,,"2021-02-08T00:00:00Z",704836,47688,657100,45047,,,,218798,,,,,,,,,,,"56",157,838,226535,21422,226535,,0,4,"75f5759a2c0c30c43a5dd15ed05d947d6732d44e",0,0,0,0,0,""
20210207,"WY",52627,7730,172913,,"totalTestsViral",683414,44,1302,,,,,51016,"2/7/2021 00:00","2021-02-07T00:00:00Z","02/06 19:00",624,1302,,"2021-02-07T00:00:00Z",683414,47008,636359,44897,,,,217824,,,,,,,,,,,"56",9,0,225540,0,225540,,0,-1,"f57bad150fb14cb411a7a697f13c45f1fb8a2e94",0,0,0,0,0,""
20210206,"WY",52618,7685,172913,,"totalTestsViral",683414,44,1303,,,,,51018,"2/6/2021 00:00","2021-02-06T00:00:00Z","02/05 19:00",624,1303,,"2021-02-06T00:00:00Z",683414,47008,636359,44933,,,,217824,,,,,,,,,,,"56",42,0,225531,0,225531,,0,1,"17d7dd1383ccf903bfa3379af1ff77584833d8c7",0,0,0,0,0,""
20210205,"WY",52576,7665,172913,,"totalTestsViral",683414,44,1302,,,,,50926,"2/5/2021 00:00","2021-02-05T00:00:00Z","02/04 19:00",624,1302,,"2021-02-05T00:00:00Z",683414,47008,636359,44911,,,,217824,,,,,,,,,,,"56",108,487,225489,12726,225489,,0,2,"146475154c69d67b3ad512e2e645a4aec67051d6",0,0,0,0,0,""
20210204,"WY",52468,7620,172426,,"totalTestsViral",670688,48,1300,,,,,50775,"2/4/2021 00:00","2021-02-04T00:00:00Z","02/03 19:00",624,1300,,"2021-02-04T00:00:00Z",670688,46545,624095,44848,,,,217274,,,,,,,,,,,"56",180,258,224894,14145,224894,,0,7,"c34ec86fe49b0daf7ad2e22a66a52f025ea07402",0,0,0,0,0,""
20210203,"WY",52288,7684,172168,,"totalTestsViral",656543,47,1293,,,,,50499,"2/3/2021 00:00","2021-02-03T00:00:00Z","02/02 19:00",624,1293,,"2021-02-03T00:00:00Z",656543,46250,610246,44604,,,,216772,,,,,,,,,,,"56",160,343,224456,9394,224456,,0,4,"9db6483102c7a39f72dba05fa879bd35acca8f7e",0,0,0,0,0,""
20210202,"WY",52128,7659,171825,,"totalTestsViral",647149,53,1289,,,,,50431,"2/2/2021 00:00","2021-02-02T00:00:00Z","02/01 19:00",624,1289,,"2021-02-02T00:00:00Z",647149,46168,607903,44469,,,,216294,,,,,,,,,,,"56",71,-1554,223953,-4642,223953,,28,0,"d4f8539dd99c3032e55fd856ce9e21605d6c9244",0,0,0,0,0,""
20210201,"WY",52057,7603,173379,,"totalTestsViral",651791,53,1289,,,,,50317,"2/1/2021 00:00","2021-02-01T00:00:00Z","01/31 19:00",596,1289,,"2021-02-01T00:00:00Z",651791,46137,605608,44454,,,,217833,,,,,,,,,,,"56",145,922,225436,16806,225436,,0,5,"bac18a9aede504a1b043a0096fa0d2e0658331fe",0,0,0,0,0,""
20210131,"WY",51912,7608,172457,,"totalTestsViral",634985,54,1284,,,,,50003,"1/31/2021 00:00","2021-01-31T00:00:00Z","01/30 19:00",596,1284,,"2021-01-31T00:00:00Z",634985,45638,588897,44304,,,,216573,,,,,,,,,,,"56",208,0,224369,0,224369,,0,5,"da22f1f8649cfd5979c8b3fd6f85788e61d78c18",0,0,0,0,0,""
20210130,"WY",51704,7582,172457,,"totalTestsViral",634985,54,1279,,,,,49981,"1/30/2021 00:00","2021-01-30T00:00:00Z","01/29 19:00",596,1279,,"2021-01-30T00:00:00Z",634985,45638,588897,44122,,,,216573,,,,,,,,,,,"56",14,0,224161,0,224161,,0,0,"775c23a0e4eca6a159f330a8992e3ad462f8bde8",0,0,0,0,0,""
20210129,"WY",51690,7574,172457,,"totalTestsViral",634985,54,1279,,,,,49785,"1/29/2021 00:00","2021-01-29T00:00:00Z","01/28 19:00",596,1279,,"2021-01-29T00:00:00Z",634985,45638,588897,44116,,,,216573,,,,,,,,,,,"56",260,380,224147,9603,224147,,0,7,"e05e438833e11284caf46e218bf3389792015370",0,0,0,0,0,""
20210128,"WY",51430,7546,172077,,"totalTestsViral",625382,64,1272,,,,,49592,"1/28/2021 00:00","2021-01-28T00:00:00Z","01/27 19:00",596,1272,,"2021-01-28T00:00:00Z",625382,45277,579654,43884,,,,215961,,,,,,,,,,,"56",62,389,223507,8705,223507,,0,2,"74da2dcb9623b70ee65d9b0728de748417cf8ab0",0,0,0,0,0,""
20210127,"WY",51368,7542,171688,,"totalTestsViral",616677,70,1270,,,,,49338,"1/27/2021 00:00","2021-01-27T00:00:00Z","01/26 19:00",596,1270,,"2021-01-27T00:00:00Z",616677,45120,571105,43826,,,,215514,,,,,,,,,,,"56",216,2170,223056,7104,223056,,0,5,"6ed43182be22336f51b5ecc5befb6dc11ce497b6",0,0,0,0,0,""
20210126,"WY",51152,7501,169518,,"totalTestsViral",609573,71,1265,,,,,49268,"1/26/2021 00:00","2021-01-26T00:00:00Z","01/25 19:00",596,1265,,"2021-01-26T00:00:00Z",609573,44908,564215,43651,,,,213169,,,,,,,,,,,"56",90,2147,220670,35705,220670,,25,1,"4ac646ed22a51dc31f818e8e488bebd8ccb674b9",0,0,0,0,0,""
20210125,"WY",51062,7463,167371,,"totalTestsViral",573868,66,1264,,,,,49008,"1/25/2021 00:00","2021-01-25T00:00:00Z","01/24 19:00",571,1264,,"2021-01-25T00:00:00Z",573868,44303,551775,43599,,,,210412,,,,,,,,,,,"56",164,0,218433,0,218433,,0,5,"fc3b4bbdc5be45b6ce1d392738df9264afe9b700",0,0,0,0,0,""
20210124,"WY",50898,7455,167371,,"totalTestsViral",573868,65,1259,,,,,48571,"1/24/2021 00:00","2021-01-24T00:00:00Z","01/23 19:00",571,1259,,"2021-01-24T00:00:00Z",573868,43473,530355,43443,,,,210412,,,,,,,,,,,"56",315,0,218269,0,218269,,0,8,"b464ee84e23ca35d3fb5485610afea58582d558b",0,0,0,0,0,""
20210123,"WY",50583,7432,167371,,"totalTestsViral",573868,75,1251,,,,,48316,"1/22/2021 00:00","2021-01-22T00:00:00Z","01/21 19:00",571,1251,,"2021-01-22T00:00:00Z",573868,43473,530355,43151,,,,210412,,,,,,,,,,,"56",0,0,217954,0,217954,,0,0,"fa1bb1eb809ae144b62a2fdfaa92445188fae7c7",0,0,0,0,0,""
20210122,"WY",50583,7432,167371,,"totalTestsViral",573868,75,1251,,,,,48316,"1/22/2021 00:00","2021-01-22T00:00:00Z","01/21 19:00",571,1251,,"2021-01-22T00:00:00Z",573868,43473,530355,43151,,,,210412,,,,,,,,,,,"56",159,0,217954,0,217954,,21,3,"fd091b4d116fd2677df660d7de5293c517e98b4e",0,0,0,0,0,""
20210121,"WY",50424,7383,167371,,"totalTestsViral",573868,84,1248,,,,,47964,"1/21/2021 00:00","2021-01-21T00:00:00Z","01/20 19:00",550,1248,,"2021-01-21T00:00:00Z",573868,43473,530355,43041,,,,210412,,,,,,,,,,,"56",300,512,217795,6418,217795,,0,8,"1ecd024b542b0d276e8675692fe9a6556717fd64",0,0,0,0,0,""
20210120,"WY",50124,7336,166859,,"totalTestsViral",567450,81,1240,,,,,47693,"1/20/2021 00:00","2021-01-20T00:00:00Z","01/19 19:00",550,1240,,"2021-01-20T00:00:00Z",567450,43188,524223,42788,,,,209647,,,,,,,,,,,"56",202,376,216983,4413,216983,,0,4,"034b57fcade04c20822b861f5d064429cdc41e63",0,0,0,0,0,""
20210119,"WY",49922,7284,166483,,"totalTestsViral",563037,88,1236,,,,,47583,"1/19/2021 00:00","2021-01-19T00:00:00Z","01/18 19:00",550,1236,,"2021-01-19T00:00:00Z",563037,42994,520004,42638,,,,209121,,,,,,,,,,,"56",214,1682,216405,13232,216405,,28,4,"5ef9d1370d672d35ed6a537623cfe9ee61da1eac",0,0,0,0,0,""
20210118,"WY",49708,7193,164801,,"totalTestsViral",549805,85,1232,,,,,46908,"1/18/2021 00:00","2021-01-18T00:00:00Z","01/17 19:00",522,1232,,"2021-01-18T00:00:00Z",549805,42087,507680,42515,,,,206574,,,,,,,,,,,"56",345,0,214509,0,214509,,0,9,"20a1ea1662b425e3bff03addea4007959e67b3ae",0,0,0,0,0,""
20210117,"WY",49363,7190,164801,,"totalTestsViral",549805,84,1223,,,,,46820,"1/17/2021 00:00","2021-01-17T00:00:00Z","01/16 19:00",522,1223,,"2021-01-17T00:00:00Z",549805,42087,507680,42173,,,,206574,,,,,,,,,,,"56",295,0,214164,0,214164,,0,8,"98ab00f5e12a58a30106434f0a61d07b935efe53",0,0,0,0,0,""
20210116,"WY",49068,7151,164801,,"totalTestsViral",549805,86,1215,,,,,46734,"1/16/2021 00:00","2021-01-16T00:00:00Z","01/15 19:00",522,1215,,"2021-01-16T00:00:00Z",549805,42087,507680,41917,,,,206574,,,,,,,,,,,"56",159,0,213869,0,213869,,0,4,"ca7c2d538dccebebd9cd4745a8097f193333e707",0,0,0,0,0,""
20210115,"WY",48909,7136,164801,,"totalTestsViral",549805,89,1211,,,,,46502,"1/15/2021 00:00","2021-01-15T00:00:00Z","01/14 19:00",522,1211,,"2021-01-15T00:00:00Z",549805,42087,507680,41773,,,,206574,,,,,,,,,,,"56",208,2173,213710,7489,213710,,0,4,"12ab3e64dd46d09947b4ef035869e57c9e6a89d9",0,0,0,0,0,""
20210114,"WY",48701,7073,162628,,"totalTestsViral",542316,89,1207,,,,,46127,"1/14/2021 00:00","2021-01-14T00:00:00Z","01/13 19:00",522,1207,,"2021-01-14T00:00:00Z",542316,41241,501049,41628,,,,204256,,,,,,,,,,,"56",412,220,211329,4637,211329,,0,10,"6c12db63b377161a93b429d85c5851ea5c58bc88",0,0,0,0,0,""
20210113,"WY",48289,7006,162408,,"totalTestsViral",537679,82,1197,,,,,45904,"1/13/2021 00:00","2021-01-13T00:00:00Z","01/12 19:00",522,1197,,"2021-01-13T00:00:00Z",537679,41036,496617,41283,,,,203691,,,,,,,,,,,"56",217,221,210697,1609,210697,,0,5,"028919191b29283b00e18a0348f1c40314b7734d",0,0,0,0,0,""
20210112,"WY",48072,6956,162187,,"totalTestsViral",536070,106,1192,,,,,45223,"1/12/2021 00:00","2021-01-12T00:00:00Z","01/11 19:00",522,1192,,"2021-01-12T00:00:00Z",536070,40935,495110,41116,,,,203303,,,,,,,,,,,"56",677,-85,210259,1456,210259,,33,-24,"b0e8be3191fc35932ebc6f7f647d617a6d2ab0f6",0,0,0,0,0,""
20210111,"WY",47395,6841,162272,,"totalTestsViral",534614,98,1216,,,,,44982,"1/11/2021 00:00","2021-01-11T00:00:00Z","01/10 19:00",489,1216,,"2021-01-11T00:00:00Z",534614,40816,493776,40554,,,,202826,,,,,,,,,,,"56",563,581,209667,6477,209667,,0,16,"db093a04bb24f1e50e8d289edd997e1e70b3ca0e",0,0,0,0,0,""
20210110,"WY",46832,6819,161691,,"totalTestsViral",528137,108,1200,,,,,44556,"1/10/2021 00:00","2021-01-10T00:00:00Z","01/09 19:00",489,1200,,"2021-01-10T00:00:00Z",528137,40391,487724,40013,,,,201573,,,,,,,,,,,"56",113,0,208523,0,208523,,0,3,"2701ccfd686b937f6b316319e115b130f45940e9",0,0,0,0,0,""
20210109,"WY",46719,6794,161691,,"totalTestsViral",528137,108,1197,,,,,44490,"1/9/2021 00:00","2021-01-09T00:00:00Z","01/08 19:00",489,1197,,"2021-01-09T00:00:00Z",528137,40391,487724,39925,,,,201573,,,,,,,,,,,"56",72,0,208410,0,208410,,0,1,"b34d76ceb9e1157efc546f96c997d1ffd707e4e7",0,0,0,0,0,""
20210108,"WY",46647,6765,161691,,"totalTestsViral",528137,108,1196,,,,,44279,"1/8/2021 00:00","2021-01-08T00:00:00Z","01/07 19:00",489,1196,,"2021-01-08T00:00:00Z",528137,40391,487724,39882,,,,201573,,,,,,,,,,,"56",479,424,208338,5449,208338,,0,12,"fecea2e7795db547f442b2eb563ef1c67a13c6b4",0,0,0,0,0,""
20210107,"WY",46168,6692,161267,,"totalTestsViral",522688,112,1184,,,,,43949,"1/7/2021 00:00","2021-01-07T00:00:00Z","01/06 19:00",489,1184,,"2021-01-07T00:00:00Z",522688,40097,482574,39476,,,,200743,,,,,,,,,,,"56",278,200,207435,4849,207435,,25,8,"b71515a6324c9f6fc72c9fa36b4a7ba6cd3bebd9",0,0,0,0,0,""
20210106,"WY",45890,6675,161067,,"totalTestsViral",517839,112,1176,,,,,43642,"1/6/2021 00:00","2021-01-06T00:00:00Z","01/05 19:00",464,1176,,"2021-01-06T00:00:00Z",517839,39842,477981,39215,,,,200282,,,,,,,,,,,"56",321,240,206957,2312,206957,,0,8,"f674ba89c741e43f2ab4810e76513634c646a959",0,0,0,0,0,""
20210105,"WY",45569,6615,160827,,"totalTestsViral",515527,114,1168,,,,,43563,"1/5/2021 00:00","2021-01-05T00:00:00Z","01/04 19:00",464,1168,,"2021-01-05T00:00:00Z",515527,38891,462878,38954,,,,199781,,,,,,,,,,,"56",322,154,206396,1193,206396,,26,45,"e7df20ce3630becba48d128913e98c15fe657d20",0,0,0,0,0,""
20210104,"WY",45247,6505,160673,,"totalTestsViral",514334,114,1123,,,,,43420,"1/4/2021 00:00","2021-01-04T00:00:00Z","01/03 19:00",438,1123,,"2021-01-04T00:00:00Z",514334,38891,462878,38742,,,,199415,,,,,,,,,,,"56",372,1145,205920,12550,205920,,0,9,"8075ea86ea64a0a2b6a118ba4d9a98534b92916f",0,0,0,0,0,""
20210103,"WY",44875,6435,159528,,"totalTestsViral",501784,99,1114,,,,,43068,"1/3/2021 00:00","2021-01-03T00:00:00Z","01/02 19:00",438,1114,,"2021-01-03T00:00:00Z",501784,38891,462878,38440,,,,197538,,,,,,,,,,,"56",302,0,204403,0,204403,,0,8,"c1ef4cd9607674e0499a321db8dde7aa82c04768",0,0,0,0,0,""
20210102,"WY",44573,6410,159528,,"totalTestsViral",501784,95,1106,,,,,43037,"1/2/2021 00:00","2021-01-02T00:00:00Z","01/01 19:00",438,1106,,"2021-01-02T00:00:00Z",501784,38891,462878,38163,,,,197538,,,,,,,,,,,"56",164,0,204101,0,204101,,0,4,"33b104b41c66f444c58c32b7a9443b66521165a3",0,0,0,0,0,""
20210101,"WY",44409,6399,159528,,"totalTestsViral",501784,113,1102,,,,,42570,"12/31/2020 00:00","2020-12-31T00:00:00Z","12/30 19:00",438,1102,,"2020-12-31T00:00:00Z",501784,38891,462878,38010,,,,197538,,,,,,,,,,,"56",0,0,203937,0,203937,,0,0,"c3c0fda5a314e87fb5c3ca146cfca40d107033eb",0,0,0,0,0,""
20201231,"WY",44409,6399,159528,,"totalTestsViral",501784,113,1102,,,,,42570,"12/31/2020 00:00","2020-12-31T00:00:00Z","12/30 19:00",438,1102,,"2020-12-31T00:00:00Z",501784,38891,462878,38010,,,,197538,,,,,,,,,,,"56",276,598,203937,3721,203937,,33,6,"a145f6e14ea42b6a7ce52c20da43e90e7eaee93c",0,0,0,0,0,""
20201230,"WY",44133,6335,158930,,"totalTestsViral",498063,113,1096,,,,,42197,"12/30/2020 00:00","2020-12-30T00:00:00Z","12/29 19:00",405,1096,,"2020-12-30T00:00:00Z",498063,38651,459398,37798,,,,196728,,,,,,,,,,,"56",210,522,203063,3672,203063,,0,3,"8973d737b84d05056a7121ca2ca5ad8a3079304f",0,0,0,0,0,""
20201229,"WY",43923,6203,158408,,"totalTestsViral",494391,119,1093,,,,,42123,"12/29/2020 16:06","2020-12-29T16:06:00Z","12/29 11:06",405,1093,,"2020-12-29T16:06:00Z",494391,38439,455938,37720,,,,196128,,,,,,,,,,,"56",219,231,202331,1311,202331,,0,40,"459cd47fb4597b7a7392260d1da38b99f7571055",0,0,0,0,0,""
20201228,"WY",43704,6081,158177,,"totalTestsViral",493080,115,1053,,,,,41878,"12/28/2020 00:00","2020-12-28T00:00:00Z","12/27 19:00",405,1053,,"2020-12-28T00:00:00Z",493080,38363,454706,37623,,,,195800,,,,,,,,,,,"56",504,2123,201881,14729,201881,,32,13,"e7a2c68f484fe3c3e7ab256835045a506b53916e",0,0,0,0,0,""
20201227,"WY",43200,6033,156054,,"totalTestsViral",478351,146,1040,,,,,41346,"12/27/2020 00:00","2020-12-27T00:00:00Z","12/26 19:00",373,1040,,"2020-12-27T00:00:00Z",478351,37502,440841,37167,,,,192754,,,,,,,,,,,"56",54,0,199254,0,199254,,0,1,"a33795c6c380d2dad78d6ad2440b428c73a626b0",0,0,0,0,0,""
20201226,"WY",43146,6017,156054,,"totalTestsViral",478351,146,1039,,,,,40423,"12/26/2020 00:00","2020-12-26T00:00:00Z","12/25 19:00",373,1039,,"2020-12-26T00:00:00Z",478351,37502,440841,37129,,,,192754,,,,,,,,,,,"56",482,0,199200,0,199200,,0,12,"630ad9336ae7f4ec7c404839b3068a25a8efc0a0",0,0,0,0,0,""
20201225,"WY",42664,5964,156054,,"totalTestsViral",478351,146,1027,,,,,40258,"12/23/2020 00:00","2020-12-23T00:00:00Z","12/22 19:00",373,1027,,"2020-12-23T00:00:00Z",478351,37502,440841,36700,,,,192754,,,,,,,,,,,"56",0,0,198718,0,198718,,0,0,"f9bd09ddb888f4d97ce23ffbdf8aeeebed1db3bb",0,0,0,0,0,""
20201224,"WY",42664,5964,156054,,"totalTestsViral",478351,161,1027,,,,,40258,"12/23/2020 00:00","2020-12-23T00:00:00Z","12/22 19:00",373,1027,,"2020-12-23T00:00:00Z",478351,37502,440841,36700,,,,192754,,,,,,,,,,,"56",0,0,198718,0,198718,,0,0,"bc535e54838e438c205d0876e530f32249d73506",0,0,0,0,0,""
20201223,"WY",42664,5964,156054,,"totalTestsViral",478351,161,1027,,,,,40258,"12/23/2020 00:00","2020-12-23T00:00:00Z","12/22 19:00",373,1027,,"2020-12-23T00:00:00Z",478351,37502,440841,36700,,,,192754,,,,,,,,,,,"56",285,453,198718,2551,198718,,0,4,"6e7489820b5f55b864868d90a1ebc55a4a967d38",0,0,0,0,0,""
20201222,"WY",42379,5829,155601,,"totalTestsViral",475800,161,1023,,,,,40128,"12/22/2020 00:00","2020-12-22T00:00:00Z","12/21 19:00",373,1023,,"2020-12-22T00:00:00Z",475800,37303,438489,36550,,,,192151,,,,,,,,,,,"56",261,658,197980,2281,197980,,22,5,"368de3e50f0cb3c1c703a1b3fc46040bb5efcd86",0,0,0,0,0,""
20201221,"WY",42118,5726,154943,,"totalTestsViral",473519,162,1018,,,,,39820,"12/21/2020 00:00","2020-12-21T00:00:00Z","12/20 19:00",351,1018,,"2020-12-21T00:00:00Z",473519,37140,436371,36392,,,,191335,,,,,,,,,,,"56",456,1438,197061,9766,197061,,0,11,"e4311dd26abbabaa4bd4478ca5b1a2c7bbed0d8e",0,0,0,0,0,""
20201220,"WY",41662,5680,153505,,"totalTestsViral",463753,157,1007,,,,,39080,"12/20/2020 00:00","2020-12-20T00:00:00Z","12/19 19:00",351,1007,,"2020-12-20T00:00:00Z",463753,36505,427157,35982,,,,189265,,,,,,,,,,,"56",174,0,195167,0,195167,,0,5,"1c50caa2d87f83c8c77a6e4bb19d3ff1d17e5a27",0,0,0,0,0,""
20201219,"WY",41488,5670,153505,,"totalTestsViral",463753,157,1002,,,,,38620,"12/19/2020 00:00","2020-12-19T00:00:00Z","12/18 19:00",351,1002,,"2020-12-19T00:00:00Z",463753,36505,427157,35818,,,,189265,,,,,,,,,,,"56",129,0,194993,0,194993,,0,1,"e61ce980947c4b1f71a0f0e9f499ae5cae43f959",0,0,0,0,0,""
20201218,"WY",41359,5599,153505,,"totalTestsViral",463753,157,1001,,,,,38544,"12/18/2020 00:00","2020-12-18T00:00:00Z","12/17 19:00",351,1001,,"2020-12-18T00:00:00Z",463753,36505,427157,35760,,,,189265,,,,,,,,,,,"56",766,379,194864,6541,194864,,0,18,"2861a08dacec7981b4477a4cd0792c88a9608d25",0,0,0,0,0,""
20201217,"WY",40593,5480,153126,,"totalTestsViral",457212,169,983,,,,,37953,"12/17/2020 00:00","2020-12-17T00:00:00Z","12/16 19:00",351,983,,"2020-12-17T00:00:00Z",457212,36183,420938,35113,,,,188239,,,,,,,,,,,"56",283,903,193719,-604,193719,,23,7,"e097550ae210edea2778507b4b7d17b5cb94e8ef",0,0,0,0,0,""
20201216,"WY",40310,5427,152223,,"totalTestsViral",457816,173,976,,,,,37458,"12/16/2020 00:00","2020-12-16T00:00:00Z","12/15 19:00",328,976,,"2020-12-16T00:00:00Z",457816,36306,421419,34883,,,,187106,,,,,,,,,,,"56",246,705,192533,7792,192533,,0,5,"03ca45d0ce5515b4987edf53611971ab90231005",0,0,0,0,0,""
20201215,"WY",40064,5352,151518,,"totalTestsViral",450024,178,971,,,,,37361,"12/15/2020 00:00","2020-12-15T00:00:00Z","12/14 19:00",328,971,,"2020-12-15T00:00:00Z",450024,35311,414622,34712,,,,186230,,,,,,,,,,,"56",289,257,191582,9735,191582,,7,4,"5d19f87b4a9bd4238cb762035c7854dc3ced12b1",0,0,0,0,0,""
20201214,"WY",39775,5215,151261,,"totalTestsViral",440289,184,967,,,,,36487,"12/14/2020 00:00","2020-12-14T00:00:00Z","12/13 19:00",321,967,,"2020-12-14T00:00:00Z",440289,34425,405773,34560,,,,185821,,,,,,,,,,,"56",415,1725,191036,0,191036,,0,11,"e4b0f60c1803f5f95b45a63e056d8331040a31c0",0,0,0,0,0,""
20201213,"WY",39360,5192,149536,,"totalTestsViral",440289,184,956,,,,,35281,"12/13/2020 00:00","2020-12-13T00:00:00Z","12/12 19:00",321,956,,"2020-12-13T00:00:00Z",440289,34425,405773,34168,,,,183195,,,,,,,,,,,"56",453,0,188896,0,188896,,0,11,"598379c7224a9e35e3ef10984a991b4a05a6528e",0,0,0,0,0,""
20201212,"WY",38907,5150,149536,,"totalTestsViral",440289,187,945,,,,,35165,"12/12/2020 00:00","2020-12-12T00:00:00Z","12/11 19:00",321,945,,"2020-12-12T00:00:00Z",440289,34425,405773,33757,,,,183195,,,,,,,,,,,"56",122,0,188443,3229,188443,,0,3,"3ba65ed63569c10d42768b82e8b91558b06291b9",0,0,0,0,0,""
20201211,"WY",38785,5126,149536,,"totalTestsViral",437060,207,942,,,,,35080,"12/11/2020 00:00","2020-12-11T00:00:00Z","12/10 19:00",321,942,,"2020-12-11T00:00:00Z",437060,34425,405773,33659,,,,183195,,,,,,,,,,,"56",562,874,188321,0,188321,,22,13,"82acd4f655230fb6eb34c196ed9577a07dcfabe0",0,0,0,0,0,""
20201210,"WY",38223,5020,148662,,"totalTestsViral",437060,206,929,,,,,33891,"12/10/2020 00:00","2020-12-10T00:00:00Z","12/09 19:00",299,929,,"2020-12-10T00:00:00Z",437060,34098,402871,33203,,,,181865,,,,,,,,,,,"56",338,1128,186885,5627,186885,,0,9,"c71ba4f4ffc3ca8e11246c5d6baa07eb5af3cb2d",0,0,0,0,0,""
20201209,"WY",37885,4996,147534,,"totalTestsViral",431433,203,920,,,,,32612,"12/9/2020 00:00","2020-12-09T00:00:00Z","12/08 19:00",299,920,,"2020-12-09T00:00:00Z",431433,33611,397815,32889,,,,180423,,,,,,,,,,,"56",410,395,185419,2269,185419,,19,9,"2eadb64cb42222c633529179e193523eb502490c",0,0,0,0,0,""
20201208,"WY",37475,4920,147139,,"totalTestsViral",429164,203,911,,,,,32234,"12/8/2020 00:00","2020-12-08T00:00:00Z","12/07 19:00",280,911,,"2020-12-08T00:00:00Z",429164,33416,395741,32555,,,,179694,,,,,,,,,,,"56",490,873,184614,3248,184614,,0,10,"6502d60328bf3f1aa0ece9ac1892e17f77939064",0,0,0,0,0,""
20201207,"WY",36985,4789,146266,,"totalTestsViral",425916,206,901,,,,,30988,"12/7/2020 00:00","2020-12-07T00:00:00Z","12/06 19:00",280,901,,"2020-12-07T00:00:00Z",425916,33038,392871,32196,,,,178462,,,,,,,,,,,"56",668,1690,183251,8289,183251,,23,49,"58f6f3553a7bea3e8c88bd76ef37ecf7f9d91127",0,0,0,0,0,""
20201206,"WY",36317,4756,144576,,"totalTestsViral",417627,212,852,,,,,29656,"12/6/2020 00:00","2020-12-06T00:00:00Z","12/05 19:00",257,852,,"2020-12-06T00:00:00Z",417627,32083,385537,31561,,,,175623,,,,,,,,,,,"56",376,0,180893,0,180893,,0,9,"b03dd13c17908ec9c1ce7eca28ec0677f628b490",0,0,0,0,0,""
20201205,"WY",35941,4691,144576,,"totalTestsViral",417627,222,843,,,,,29533,"12/5/2020 00:00","2020-12-05T00:00:00Z","12/04 19:00",257,843,,"2020-12-05T00:00:00Z",417627,32083,385537,31250,,,,175623,,,,,,,,,,,"56",204,0,180517,5342,180517,,0,5,"a64ad44ebebb1e63a4bde61c98f44019ea861744",0,0,0,0,0,""
20201204,"WY",35737,4690,144576,,"totalTestsViral",412285,222,838,,,,,28468,"12/4/2020 00:00","2020-12-04T00:00:00Z","12/03 19:00",257,838,,"2020-12-04T00:00:00Z",412285,30891,377427,31047,,,,175623,,,,,,,,,,,"56",659,1299,180313,0,180313,,0,15,"220cc026ccfa044f9cbe609a75a06e25a41767fc",0,0,0,0,0,""
20201203,"WY",35078,4560,143277,,"totalTestsViral",412285,234,823,,,,,28113,"12/3/2020 00:00","2020-12-03T00:00:00Z","12/02 19:00",257,823,,"2020-12-03T00:00:00Z",412285,30891,377427,30518,,,,173795,,,,,,,,,,,"56",571,1811,178355,3960,178355,,27,14,"2ecbbc8dc08ddc7059b59263afb22135cf3e7116",0,0,0,0,0,""
20201202,"WY",34507,4541,141466,,"totalTestsViral",408325,234,809,,,,,26568,"12/2/2020 00:00","2020-12-02T00:00:00Z","12/01 19:00",230,809,,"2020-12-02T00:00:00Z",408325,30297,374015,29966,,,,170519,,,,,,,,,,,"56",702,0,175973,-11262,175973,,0,16,"3f6e9a98216c60ed18fe4ccd652b619ff3e18324",0,0,0,0,0,""
20201201,"WY",33805,4416,141466,,"totalTestsViral",419587,239,793,,,,,26003,"12/1/2020 00:00","2020-12-01T00:00:00Z","11/30 19:00",230,793,,"2020-12-01T00:00:00Z",419587,32316,387265,29389,,,,170519,,,,,,,,,,,"56",500,0,175271,0,175271,,15,9,"4cd1142dbc7fab54c51cbe73cf9cb78eb559cbda",0,0,0,0,0,""
20201130,"WY",33305,4252,141466,,"totalTestsViral",419587,247,784,,,,,24478,"11/30/2020 00:00","2020-11-30T00:00:00Z","11/29 19:00",215,784,,"2020-11-30T00:00:00Z",419587,32316,387265,29053,,,,170519,,,,,,,,,,,"56",816,2562,174771,26211,174771,,0,22,"49711e1145ac7e89ae848bebd658eb93b7403284",0,0,0,0,0,""
20201129,"WY",32489,4237,138904,,"totalTestsViral",393376,225,762,,,,,23022,"11/29/2020 00:00","2020-11-29T00:00:00Z","11/28 19:00",215,762,,"2020-11-29T00:00:00Z",393376,27640,357394,28252,,,,166501,,,,,,,,,,,"56",560,0,171393,0,171393,,0,14,"d9e5e2fda56d6f035f27e09c254d3ea543729010",0,0,0,0,0,""
20201128,"WY",31929,4191,138904,,"totalTestsViral",393376,225,748,,,,,22798,"11/28/2020 00:00","2020-11-28T00:00:00Z","11/27 19:00",215,748,,"2020-11-28T00:00:00Z",393376,27640,357394,27738,,,,166501,,,,,,,,,,,"56",156,0,170833,-136,170833,,0,28,"5a28fe0ef4d3af525a62730c21f5d801ccb17c2a",0,0,0,0,0,""
20201127,"WY",31773,4176,138904,,"totalTestsViral",393512,224,720,,,,,21700,"11/25/2020 00:00","2020-11-25T00:00:00Z","11/24 19:00",215,720,,"2020-11-25T00:00:00Z",393512,27640,357394,27597,,,,166501,,,,,,,,,,,"56",1012,7116,170677,8472,170677,,0,0,"112d1550b785606fd2ced7bb68281217c1172c6f",0,0,0,0,0,""
20201126,"WY",30761,4084,131788,,"totalTestsViral",385040,226,720,,,,,20113,"11/25/2020 00:00","2020-11-25T00:00:00Z","11/24 19:00",215,720,,"2020-11-25T00:00:00Z",385040,27640,357394,26677,,,,155135,,,,,,,,,,,"56",0,0,162549,0,162549,,0,0,"219c3e6fd37836c1861d22a115ce03fc543f06ec",0,0,0,0,0,""
20201125,"WY",30761,4084,131788,,"totalTestsViral",385040,226,720,,,,,20113,"11/25/2020 00:00","2020-11-25T00:00:00Z","11/24 19:00",215,720,,"2020-11-25T00:00:00Z",385040,27640,357394,26677,,,,155135,,,,,,,,,,,"56",802,0,162549,29,162549,,13,19,"4cf97e923a2430a446aee464bcfdd9efdee8833d",0,0,0,0,0,""
20201124,"WY",29959,3984,131788,,"totalTestsViral",385011,228,701,,,,,17896,"11/24/2020 00:00","2020-11-24T00:00:00Z","11/23 19:00",202,701,,"2020-11-24T00:00:00Z",385011,27637,357374,25975,,,,155135,,,,,,,,,,,"56",528,0,161747,286,161747,,0,11,"55f37e464f7f1a9140f1dfe8bc42f3e78e92865b",0,0,0,0,0,""
20201123,"WY",29431,3871,131788,,"totalTestsViral",384725,224,690,,,,,17452,"11/23/2020 16:56","2020-11-23T16:56:00Z","11/23 11:56",202,690,,"2020-11-23T16:56:00Z",384725,27600,357125,25560,,,,155135,,,,,,,,,,,"56",1262,0,161219,2515,161219,,26,31,"07e3fcae07dc92b7591fbbdfed1646f92e8a898a",0,0,0,0,0,""
20201122,"WY",28169,3860,131788,,"totalTestsViral",382210,235,659,,,,,16807,"11/22/2020 11:41","2020-11-22T11:41:00Z","11/22 06:41",176,659,,"2020-11-22T11:41:00Z",382210,27274,354936,24309,,,,155135,,,,,,,,,,,"56",759,0,159957,745,159957,,0,0,"ad7f42827c3374c05d5e2fb93f4906d2da98f0a1",0,0,0,0,0,""
20201121,"WY",27410,3843,131788,,"totalTestsViral",381465,219,659,,,,,16530,"11/21/2020 12:39","2020-11-21T12:39:00Z","11/21 07:39",176,659,,"2020-11-21T12:39:00Z",381465,27135,354330,23567,,,,155135,,,,,,,,,,,"56",281,0,159198,796,159198,,0,6,"acd214a215f8393ccf811630f2dc40fcda0acee3",0,0,0,0,0,""
20201120,"WY",27129,3782,131788,,"totalTestsViral",380669,219,653,,,,,16316,"11/20/2020 00:00","2020-11-20T00:00:00Z","11/19 19:00",176,653,,"2020-11-20T00:00:00Z",380669,26936,353733,23347,,,,155135,,,,,,,,,,,"56",960,1658,158917,4546,158917,,0,24,"508f1e0788d5b3f001e3cc4059bd90de4dc13f9a",0,0,0,0,0,""
20201119,"WY",26169,3680,130130,,"totalTestsViral",376123,209,629,,,,,14904,"11/19/2020 00:00","2020-11-19T00:00:00Z","11/18 19:00",176,629,,"2020-11-19T00:00:00Z",376123,26321,349802,22489,,,,152619,,,,,,,,,,,"56",894,2443,156299,6831,156299,,21,20,"8772185a4f199f0ce77d9ab8c5086393e0841257",0,0,0,0,0,""
20201118,"WY",25275,3525,127687,,"totalTestsViral",369292,210,609,,,,,13752,"11/18/2020 16:55","2020-11-18T16:55:00Z","11/18 11:55",155,609,,"2020-11-18T16:55:00Z",369292,25562,343730,21750,,,,148734,,,,,,,,,,,"56",822,0,152962,5300,152962,,0,20,"a78e4ba307bebdca9912033bfaf06970c655f4c3",0,0,0,0,0,""
20201117,"WY",24453,3406,127687,,"totalTestsViral",363992,204,589,,,,,13407,"11/17/2020 17:32","2020-11-17T17:32:00Z","11/17 12:32",155,589,,"2020-11-17T17:32:00Z",363992,24821,339171,21047,,,,148734,,,,,,,,,,,"56",1260,-2521,152140,6972,152140,,11,13,"40a3928ffd392c0ef06cc7704e91005a64e6cffa",0,0,0,0,0,""
20201116,"WY",23193,3308,130208,,"totalTestsViral",357020,191,576,,,,,12902,"11/16/2020 16:46","2020-11-16T16:46:00Z","11/16 11:46",144,576,,"2020-11-16T16:46:00Z",357020,23903,333117,19885,,,,148451,,,,,,,,,,,"56",699,0,153401,9190,153401,,0,-4,"a08f76a9c84acee489c1c2e64c3afb5340b5dc1b",0,0,0,0,0,""
20201115,"WY",22494,3196,130208,,"totalTestsViral",347830,189,580,,,,,12453,"11/15/2020 12:03","2020-11-15T12:03:00Z","11/15 07:03",144,580,,"2020-11-15T12:03:00Z",347830,22704,325126,19298,,,,148451,,,,,,,,,,,"56",613,0,152702,1027,152702,,0,0,"450e7dccc19088f963d4c58cf5c193c840798531",0,0,0,0,0,""
20201114,"WY",21881,3155,130208,,"totalTestsViral",346803,202,580,,,,,12247,"11/14/2020 13:01","2020-11-14T13:01:00Z","11/14 08:01",144,580,,"2020-11-14T13:01:00Z",346803,22490,324313,18726,,,,148451,,,,,,,,,,,"56",540,0,152089,1121,152089,,17,15,"f34e5145734f640eabc8ddf28e210959dc6dcd1e",0,0,0,0,0,""
20201113,"WY",21341,3098,130208,,"totalTestsViral",345682,195,565,,,,,12082,"11/13/2020 17:01","2020-11-13T17:01:00Z","11/13 12:01",127,565,,"2020-11-13T17:01:00Z",345682,22258,323424,18243,,,,148451,,,,,,,,,,,"56",862,1400,151549,4629,151549,,0,7,"b880ce6b76a93d21ead7a49b99d8106fcaf00e5d",0,0,0,0,0,""
20201112,"WY",20479,3037,128808,,"totalTestsViral",341053,192,558,,,,,11585,"11/12/2020 17:44","2020-11-12T17:44:00Z","11/12 12:44",127,558,,"2020-11-12T17:44:00Z",341053,21557,319496,17442,,,,146250,,,,,,,,,,,"56",1105,1569,149287,6252,149287,,0,13,"9003078eb1cae45b5808bbdd0c7954bbb7738e00",0,0,0,0,0,""
20201111,"WY",19374,2856,127239,,"totalTestsViral",334801,178,545,,,,,11234,"11/11/2020 11:36","2020-11-11T11:36:00Z","11/11 06:36",127,545,,"2020-11-11T11:36:00Z",334801,20728,314073,16518,,,,143757,,,,,,,,,,,"56",132,91,146613,4903,146613,,0,3,"671faa829ecddfe3797c88537cc0ab6ab02c7412",0,0,0,0,0,""
20201110,"WY",19242,2800,127148,,"totalTestsViral",329898,178,542,,,,,11098,"11/10/2020 17:23","2020-11-10T17:23:00Z","11/10 12:23",127,542,,"2020-11-10T17:23:00Z",329898,20046,309852,16442,,,,142459,,,,,,,,,,,"56",1232,0,146390,7086,146390,,13,22,"8616c1851655be5e7da974e4d5dabc3325a3e834",0,0,0,0,0,""
20201109,"WY",18010,2699,127148,,"totalTestsViral",322812,172,520,,,,,10699,"11/9/2020 15:45","2020-11-09T15:45:00Z","11/09 10:45",114,520,,"2020-11-09T15:45:00Z",322812,19180,303632,15311,,,,142459,,,,,,,,,,,"56",700,3379,145158,7958,145158,,0,15,"ad629d489fd26d1877033be62ee12f06860b6ec1",0,0,0,0,0,""
20201108,"WY",17310,2619,123769,,"totalTestsViral",314854,148,505,,,,,10315,"11/8/2020 11:52","2020-11-08T11:52:00Z","11/08 06:52",114,505,,"2020-11-08T11:52:00Z",314854,18151,296703,14691,,,,137640,,,,,,,,,,,"56",713,0,141079,1004,141079,,9,0,"f8248a64932ad77807d83abf4767c8bf01caef59",0,0,0,0,0,""
20201107,"WY",16597,2552,123769,,"totalTestsViral",313850,147,505,,,,,10142,"11/7/2020 11:51","2020-11-07T11:51:00Z","11/07 06:51",105,505,,"2020-11-07T11:51:00Z",313850,17943,295907,14045,,,,137640,,,,,,,,,,,"56",192,0,140366,1081,140366,,0,6,"d27e515271ba31836999da7951cb23b37aa2abc3",0,0,0,0,0,""
20201106,"WY",16405,2534,123769,,"totalTestsViral",312769,147,499,,,,,10012,"11/6/2020 17:10","2020-11-06T17:10:00Z","11/06 12:10",105,499,,"2020-11-06T17:10:00Z",312769,17681,295088,13871,,,,137640,,,,,,,,,,,"56",996,965,140174,4564,140174,,0,7,"638272b8317679c5407033f7715eb5da7c95b9e3",0,0,0,0,0,""
20201105,"WY",15409,2455,122804,,"totalTestsViral",308205,134,492,,,,,9709,"11/5/2020 16:50","2020-11-05T16:50:00Z","11/05 11:50",105,492,,"2020-11-05T16:50:00Z",308205,17063,291142,12954,,,,135758,,,,,,,,,,,"56",365,2087,138213,4955,138213,,0,11,"e69d8312717c65c120dc20eca3d597212417a830",0,0,0,0,0,""
20201104,"WY",15044,2369,120717,,"totalTestsViral",303250,138,481,,,,,9501,"11/4/2020 17:00","2020-11-04T17:00:00Z","11/04 12:00",105,481,,"2020-11-04T17:00:00Z",303250,16473,286777,12675,,,,133116,,,,,,,,,,,"56",425,0,135761,5162,135761,,12,10,"0dd0497a6c91ff2959a68db70e538d34c922d347",0,0,0,0,0,""
20201103,"WY",14619,2220,120717,,"totalTestsViral",298088,124,471,,,,,9312,"11/3/2020 17:31","2020-11-03T17:31:00Z","11/03 12:31",93,471,,"2020-11-03T17:31:00Z",298088,15728,282360,12399,,,,133116,,,,,,,,,,,"56",452,866,135336,6390,135336,,6,13,"82ae624505b5e7cb6d15927e298ba35eb6f8059e",0,0,0,0,0,""
20201102,"WY",14167,2108,119851,,"totalTestsViral",291698,132,458,,,,,8963,"11/2/2020 17:43","2020-11-02T17:43:00Z","11/02 12:43",87,458,,"2020-11-02T17:43:00Z",291698,15044,276654,12059,,,,131910,,,,,,,,,,,"56",444,2589,134018,6952,134018,,0,16,"dce27b0aab7bd641e826de1aa128a1d7525c4e17",0,0,0,0,0,""
20201101,"WY",13723,2085,117262,,"totalTestsViral",284746,117,442,,,,,8676,"11/1/2020 11:41","2020-11-01T11:41:00Z","11/01 06:41",87,442,,"2020-11-01T11:41:00Z",284746,14387,270359,11638,,,,128538,,,,,,,,,,,"56",425,0,130985,828,130985,,0,3,"194362e891d99ff85464b5327fab5125a3c8425d",0,0,0,0,0,""
20201031,"WY",13298,2022,117262,,"totalTestsViral",283918,120,439,,,,,8541,"10/31/2020 11:58","2020-10-31T11:58:00Z","10/31 07:58",87,439,,"2020-10-31T11:58:00Z",283918,14269,269649,11276,,,,128538,,,,,,,,,,,"56",270,307,130560,798,130560,,0,-1,"7db3bbf375d12b02cce9d9a004fe39a1ce9b29ce",0,0,0,0,0,""
20201030,"WY",13028,2008,116955,,"totalTestsViral",283120,120,440,,,,,8455,"10/30/2020 17:27","2020-10-30T17:27:00Z","10/30 13:27",87,440,,"2020-10-30T17:27:00Z",283120,14117,269003,11020,,,,127544,,,,,,,,,,,"56",521,0,129983,3685,129983,,0,6,"81a76e7592d83343545e5aab08325fd46290c6d0",0,0,0,0,0,""
20201029,"WY",12507,1918,116955,,"totalTestsViral",279435,109,434,,,,,8236,"10/29/2020 17:42","2020-10-29T17:42:00Z","10/29 13:42",87,434,,"2020-10-29T17:42:00Z",279435,13744,265691,10589,,,,127544,,,,,,,,,,,"56",361,3269,129462,4153,129462,,10,13,"9a5b52663b3d0622e4af2d0987420249f6f6a274",0,0,0,0,0,""
20201028,"WY",12146,1858,113686,,"totalTestsViral",275282,104,421,,,,,8105,"10/28/2020 16:44","2020-10-28T16:44:00Z","10/28 12:44",77,421,,"2020-10-28T16:44:00Z",275282,13297,261985,10288,,,,122604,,,,,,,,,,,"56",340,0,125832,4412,125832,,0,10,"55a8c04ef1f8a467c57c05d664a788813a508e36",0,0,0,0,0,""
20201027,"WY",11806,1771,113686,,"totalTestsViral",270870,105,411,,,,,7906,"10/27/2020 17:19","2020-10-27T17:19:00Z","10/27 13:19",77,411,,"2020-10-27T17:19:00Z",270870,12882,257988,10035,,,,122604,,,,,,,,,,,"56",329,0,125492,5411,125492,,0,10,"5d5ad5c11e643303370fb672636d863e381c8f00",0,0,0,0,0,""
20201026,"WY",11477,1694,113686,,"totalTestsViral",265459,102,401,,,,,7675,"10/26/2020 17:24","2020-10-26T17:24:00Z","10/26 13:24",77,401,,"2020-10-26T17:24:00Z",265459,12386,253073,9783,,,,122604,,,,,,,,,,,"56",436,0,125163,6055,125163,,9,7,"191c53c637f6930d4c82a9dab38ab9ce0dfb9efd",0,0,0,0,0,""
20201025,"WY",11041,1645,113686,,"totalTestsViral",259404,95,394,,,,,7525,"10/25/2020 11:52","2020-10-25T11:52:00Z","10/25 07:52",68,394,,"2020-10-25T11:52:00Z",259404,11873,247531,9396,,,,122604,,,,,,,,,,,"56",236,0,124727,594,124727,,0,2,"5b1f0dc421cf1294d46d59a96f8d3c1175762b07",0,0,0,0,0,""
20201024,"WY",10805,1628,113686,,"totalTestsViral",258810,83,392,,,,,7471,"10/24/2020 11:58","2020-10-24T11:58:00Z","10/24 07:58",68,392,,"2020-10-24T11:58:00Z",258810,11751,247059,9177,,,,122604,,,,,,,,,,,"56",260,0,124491,989,124491,,0,0,"022a0593e798f158d320a427035227c53d595ef9",0,0,0,0,0,""
20201023,"WY",10545,1627,113686,,"totalTestsViral",257821,83,392,,,,,7357,"10/23/2020 18:20","2020-10-23T18:20:00Z","10/23 14:20",68,392,,"2020-10-23T18:20:00Z",257821,11559,246262,8918,,,,122604,,,,,,,,,,,"56",426,1864,124231,3927,124231,,0,19,"9f021b14dd3bf9eefea1bf3a721409105e4a5e35",0,0,0,0,0,""
20201022,"WY",10119,1582,111822,,"totalTestsViral",253894,81,373,,,,,7220,"10/22/2020 18:18","2020-10-22T18:18:00Z","10/22 14:18",68,373,,"2020-10-22T18:18:00Z",253894,11172,242722,8537,,,,120127,,,,,,,,,,,"56",271,0,121941,4469,121941,,7,0,"612b3060a2976f837dc0393e20f3f1a8dd70dfc9",0,0,0,0,0,""
20201021,"WY",9848,1543,111822,,"totalTestsViral",249425,66,373,,,,,7070,"10/21/2020 17:23","2020-10-21T17:23:00Z","10/21 13:23",61,373,,"2020-10-21T17:23:00Z",249425,10742,238683,8305,,,,120127,,,,,,,,,,,"56",322,3068,121670,4292,121670,,0,2,"d9ea786787b15d15dd64cd0c29c8f884178fbc80",0,0,0,0,0,""
20201020,"WY",9526,1456,108754,,"totalTestsViral",245133,66,371,,,,,6944,"10/20/2020 17:55","2020-10-20T17:55:00Z","10/20 13:55",61,371,,"2020-10-20T17:55:00Z",245133,10351,234782,8070,,,,116091,,,,,,,,,,,"56",215,0,118280,4982,118280,,4,7,"1949d4857b56026bd510c66b9d7aaaccd5933f2f",0,0,0,0,0,""
20201019,"WY",9311,1387,108754,,"totalTestsViral",240151,68,364,,,,,6796,"10/19/2020 16:57","2020-10-19T16:57:00Z","10/19 12:57",57,364,,"2020-10-19T16:57:00Z",240151,9921,230230,7924,,,,116091,,,,,,,,,,,"56",286,0,118065,6226,118065,,0,4,"56593b1803fa69608fe6d780d82b48fc02117384",0,0,0,0,0,""
20201018,"WY",9025,1352,108754,,"totalTestsViral",233925,51,360,,,,,6627,"10/18/2020 11:34","2020-10-18T11:34:00Z","10/18 07:34",57,360,,"2020-10-18T11:34:00Z",233925,9345,224580,7673,,,,116091,,,,,,,,,,,"56",209,0,117779,797,117779,,0,2,"aaf5e3abd97d32f494d16aaeadd6c03e70f704f0",0,0,0,0,0,""
20201017,"WY",8816,1337,108754,,"totalTestsViral",233128,51,358,,,,,6559,"10/17/2020 11:49","2020-10-17T11:49:00Z","10/17 07:49",57,358,,"2020-10-17T11:49:00Z",233128,9246,223882,7479,,,,116091,,,,,,,,,,,"56",151,0,117570,721,117570,,0,-1,"2b6363f917c1ced64c9511bebd78c86473bd53ab",0,0,0,0,0,""
20201016,"WY",8665,1328,108754,,"totalTestsViral",232407,51,359,,,,,6494,"10/16/2020 18:11","2020-10-16T18:11:00Z","10/16 14:11",57,359,,"2020-10-16T18:11:00Z",232407,9147,223260,7337,,,,116091,,,,,,,,,,,"56",290,740,117419,3328,117419,,0,5,"535de3203f1f71d27241fd0ec2807de87b49433f",0,0,0,0,0,""
20201015,"WY",8375,1286,108014,,"totalTestsViral",229079,51,354,,,,,6360,"10/15/2020 16:40","2020-10-15T16:40:00Z","10/15 12:40",57,354,,"2020-10-15T16:40:00Z",229079,8831,220248,7089,,,,115103,,,,,,,,,,,"56",198,5165,116389,3561,116389,,0,2,"441dcb9276ff321cf44e2ccb9bc4307bd111a54b",0,0,0,0,0,""
20201014,"WY",8177,1263,102849,,"totalTestsViral",225518,45,352,,,,,6261,"10/14/2020 16:32","2020-10-14T16:32:00Z","10/14 12:32",57,352,,"2020-10-14T16:32:00Z",225518,8535,216983,6914,,,,109763,,,,,,,,,,,"56",213,-3030,111026,4336,111026,,0,9,"1e9d09e9af76a327f9cceb7b6596831c7a27a45e",0,0,0,0,0,""
20201013,"WY",7964,1224,105879,,"totalTestsViral",221182,46,343,,,,,6181,"10/13/2020 05:23","2020-10-13T05:23:00Z","10/13 01:23",57,343,,"2020-10-13T05:23:00Z",221182,8239,212943,6740,,,,112619,,,,,,,,,,,"56",162,2703,113843,4840,113843,,3,5,"449e71ec8dc28d93f3f9a9e378c1cac719d1ebf2",0,0,0,0,0,""
20201012,"WY",7802,1174,103176,,"totalTestsViral",216342,51,338,,,,,6058,"10/12/2020 05:52","2020-10-12T05:52:00Z","10/12 01:52",54,338,,"2020-10-12T05:52:00Z",216342,7875,208467,6628,,,,109402,,,,,,,,,,,"56",191,0,110978,5833,110978,,0,15,"e4cffd84154074096b6f785d5d501f34bd274150",0,0,0,0,0,""
20201011,"WY",7611,1135,103176,,"totalTestsViral",210509,54,323,,,,,5877,"10/11/2020 11:49","2020-10-11T11:49:00Z","10/11 07:49",54,323,,"2020-10-11T11:49:00Z",210509,7576,202933,6476,,,,109402,,,,,,,,,,,"56",156,0,110787,601,110787,,0,0,"7694a972c1031c3a9c6c62e67594f50ccf99fdfd",0,0,0,0,0,""
20201010,"WY",7455,1117,103176,,"totalTestsViral",209908,54,323,,,,,5807,"10/10/2020 12:06","2020-10-10T12:06:00Z","10/10 08:06",54,323,,"2020-10-10T12:06:00Z",209908,7523,202385,6338,,,,109402,,,,,,,,,,,"56",120,0,110631,867,110631,,0,6,"7fd848c372474fe648b4126db0011cb91f300f57",0,0,0,0,0,""
20201009,"WY",7335,1109,103176,,"totalTestsViral",209041,54,317,,,,,5732,"10/9/2020 16:44","2020-10-09T16:44:00Z","10/09 12:44",54,317,,"2020-10-09T16:44:00Z",209041,7423,201618,6226,,,,109402,,,,,,,,,,,"56",243,1326,110511,3017,110511,,0,4,"c7a621c7d9b541c3c9e1c6e7ef0293d48da31655",0,0,0,0,0,""
20201008,"WY",7092,1061,101850,,"totalTestsViral",206024,56,313,,,,,5603,"10/8/2020 16:56","2020-10-08T16:56:00Z","10/08 12:56",54,313,,"2020-10-08T16:56:00Z",206024,7224,198800,6031,,,,107881,,,,,,,,,,,"56",193,904,108942,3321,108942,,1,8,"4ad51e92d55039c0de221b5f01645ae231f4172e",0,0,0,0,0,""
20201007,"WY",6899,1033,100946,,"totalTestsViral",202703,47,305,,,,,5504,"10/7/2020 16:49","2020-10-07T16:49:00Z","10/07 12:49",53,305,,"2020-10-07T16:49:00Z",202703,7002,195701,5866,,,,106812,,,,,,,,,,,"56",129,1034,107845,4195,107845,,0,1,"ad4b034dd5be989e220a9b1b8ba6cf691d959fce",0,0,0,0,0,""
20201006,"WY",6770,1019,99912,,"totalTestsViral",198508,44,304,,,,,5418,"10/6/2020 17:20","2020-10-06T17:20:00Z","10/06 13:20",53,304,,"2020-10-06T17:20:00Z",198508,6718,191790,5751,,,,105663,,,,,,,,,,,"56",141,379,106682,5935,106682,,0,10,"603d59299f5d9106fccc0bb48eb1dbcae2bc086a",0,0,0,0,0,""
20201005,"WY",6629,969,99533,,"totalTestsViral",192573,36,294,,,,,5272,"10/5/2020 16:29","2020-10-05T16:29:00Z","10/05 12:29",53,294,,"2020-10-05T16:29:00Z",192573,6433,186140,5660,,,,105193,,,,,,,,,,,"56",125,2469,106162,6539,106162,,0,12,"dfb8966c8029c96f53840a29888a5f6cd9c5cb95",0,0,0,0,0,""
20201004,"WY",6504,958,97064,,"totalTestsViral",186034,32,282,,,,,5160,"10/4/2020 11:31","2020-10-04T11:31:00Z","10/04 07:31",53,282,,"2020-10-04T11:31:00Z",186034,6099,179935,5546,,,,102353,,,,,,,,,,,"56",139,0,103568,672,103568,,0,1,"5f39528b3fa641e052d5f2925674183734277142",0,0,0,0,0,""
20201003,"WY",6365,950,97064,,"totalTestsViral",185362,32,281,,,,,5083,"10/3/2020 11:59","2020-10-03T11:59:00Z","10/03 07:59",53,281,,"2020-10-03T11:59:00Z",185362,6047,179315,5415,,,,102353,,,,,,,,,,,"56",151,0,103429,776,103429,,0,1,"139ef6e8d8c92b4182eb7687bfcd8dda5b185084",0,0,0,0,0,""
20201002,"WY",6214,925,97064,,"totalTestsViral",184586,32,280,,,,,4989,"10/2/2020 17:20","2020-10-02T17:20:00Z","10/02 13:20",53,280,,"2020-10-02T17:20:00Z",184586,5980,178606,5289,,,,102353,,,,,,,,,,,"56",131,1852,103278,2772,103278,,0,6,"b1233da2802993cabd216b3aa19ce660686f021d",0,0,0,0,0,""
20201001,"WY",6083,913,95212,,"totalTestsViral",181814,27,274,,,,,4853,"10/1/2020 16:00","2020-10-01T16:00:00Z","10/01 12:00",53,274,,"2020-10-01T16:00:00Z",181814,5778,176036,5170,,,,100258,,,,,,,,,,,"56",135,0,101295,3441,101295,,3,2,"3432524d2e6be9681861bc85352a5b61586dacba",0,0,0,0,0,""
20200930,"WY",5948,902,95212,,"totalTestsViral",178373,24,272,,,,,4791,"9/30/2020 17:28","2020-09-30T17:28:00Z","09/30 13:28",50,272,,"2020-09-30T17:28:00Z",178373,5602,172771,5046,,,,100258,,,,,,,,,,,"56",127,490,101160,3687,101160,,0,5,"05ce2b2f629b01f293c971c35a650ca4edb70b86",0,0,0,0,0,""
20200929,"WY",5821,873,94722,,"totalTestsViral",174686,22,267,,,,,4702,"9/29/2020 17:54","2020-09-29T17:54:00Z","09/29 13:54",50,267,,"2020-09-29T17:54:00Z",174686,5417,169269,4948,,,,99670,,,,,,,,,,,"56",67,360,100543,5236,100543,,0,3,"003d682fea85a6ea9d6687e0628bb31fe5aab000",0,0,0,0,0,""
20200928,"WY",5754,857,94362,,"totalTestsViral",169450,22,264,,,,,4613,"9/28/2020 18:00","2020-09-28T18:00:00Z","09/28 14:00",50,264,,"2020-09-28T18:00:00Z",169450,5240,164210,4897,,,,99259,,,,,,,,,,,"56",121,1956,100116,4151,100116,,0,2,"c6a5a0df9324c07a45bb6812e496da8219af3970",0,0,0,0,0,""
20200927,"WY",5633,853,92406,,"totalTestsViral",165299,22,262,,,,,4519,"9/27/2020 11:33","2020-09-27T11:33:00Z","09/27 07:33",50,262,,"2020-09-27T11:33:00Z",165299,5054,160245,4780,,,,96991,,,,,,,,,,,"56",168,0,98039,326,98039,,0,4,"cd9b7126a494cc8688a5de827ea52eb86b798965",0,0,0,0,0,""
20200926,"WY",5465,847,92406,,"totalTestsViral",164973,22,258,,,,,4479,"9/26/2020 11:55","2020-09-26T11:55:00Z","09/26 07:55",50,258,,"2020-09-26T11:55:00Z",164973,5033,159940,4618,,,,96991,,,,,,,,,,,"56",45,0,97871,351,97871,,0,2,"b596f0fd0e05aba63a234bfaaa89a9209d79ecca",0,0,0,0,0,""
20200925,"WY",5420,835,92406,,"totalTestsViral",164622,22,256,,,,,4450,"9/25/2020 17:57","2020-09-25T17:57:00Z","09/25 13:57",50,256,,"2020-09-25T17:57:00Z",164622,5007,159615,4585,,,,96991,,,,,,,,,,,"56",115,1071,97826,1969,97826,,0,1,"52080904adbef2eef965e088e367896b8f0ce25e",0,0,0,0,0,""
20200924,"WY",5305,817,91335,,"totalTestsViral",162653,19,255,,,,,4364,"9/24/2020 16:19","2020-09-24T16:19:00Z","09/24 12:19",50,255,,"2020-09-24T16:19:00Z",162653,4898,157755,4488,,,,95823,,,,,,,,,,,"56",136,1511,96640,2923,96640,,0,2,"e6d55805c5cb5477b893c71984ef9e5a8a0fb5ff",0,0,0,0,0,""
20200923,"WY",5169,801,89824,,"totalTestsViral",159730,21,253,,,,,4277,"9/23/2020 17:25","2020-09-23T17:25:00Z","09/23 13:25",50,253,,"2020-09-23T17:25:00Z",159730,4725,155005,4368,,,,94055,,,,,,,,,,,"56",153,0,94993,2750,94993,,1,0,"f4b228624cbb479c69c1bada045d59db46a96c6f",0,0,0,0,0,""
20200922,"WY",5016,785,89824,,"totalTestsViral",156980,21,253,,,,,4230,"9/22/2020 17:10","2020-09-22T17:10:00Z","09/22 13:10",49,253,,"2020-09-22T17:10:00Z",156980,4582,152398,4231,,,,94055,,,,,,,,,,,"56",72,637,94840,3087,94840,,0,6,"0d593098a171f7b21727898bf13d411a29dd5051",0,0,0,0,0,""
20200921,"WY",4944,755,89187,,"totalTestsViral",153893,23,247,,,,,4172,"9/21/2020 16:47","2020-09-21T16:47:00Z","09/21 12:47",49,247,,"2020-09-21T16:47:00Z",153893,4469,149424,4189,,,,93376,,,,,,,,,,,"56",73,1627,94131,3817,94131,,0,4,"eea06e2e5f57fd37c6270501ec3aaaa2e21de1e1",0,0,0,0,0,""
20200920,"WY",4871,747,87560,,"totalTestsViral",150076,16,243,,,,,4111,"9/20/2020 11:36","2020-09-20T11:36:00Z","09/20 07:36",49,243,,"2020-09-20T11:36:00Z",150076,4300,145776,4124,,,,91569,,,,,,,,,,,"56",91,0,92431,274,92431,,0,1,"b246416a2a801dd71a8fd717a9cbd917ebe4787f",0,0,0,0,0,""
20200919,"WY",4780,741,87560,,"totalTestsViral",149802,16,242,,,,,4092,"9/19/2020 12:08","2020-09-19T12:08:00Z","09/19 08:08",49,242,,"2020-09-19T12:08:00Z",149802,4283,145519,4039,,,,91569,,,,,,,,,,,"56",33,0,92340,353,92340,,0,2,"5e78f745a31c907bb6c3b20fd660bd6fc64e7310",0,0,0,0,0,""
20200918,"WY",4747,738,87560,,"totalTestsViral",149449,16,240,,,,,4044,"9/18/2020 16:51","2020-09-18T16:51:00Z","09/18 12:51",49,240,,"2020-09-18T16:51:00Z",149449,4248,145201,4009,,,,91569,,,,,,,,,,,"56",95,760,92307,1550,92307,,0,4,"860ab6186304dda651a80ca669ee4af3e9c32041",0,0,0,0,0,""
20200917,"WY",4652,716,86800,,"totalTestsViral",147899,16,236,,,,,4000,"9/17/2020 17:49","2020-09-17T17:49:00Z","09/17 13:49",49,236,,"2020-09-17T17:49:00Z",147899,4175,143724,3936,,,,90736,,,,,,,,,,,"56",86,1397,91452,2269,91452,,3,1,"bfac8b1b1abd18779f6c9c0afabb7eddc740766c",0,0,0,0,0,""
20200916,"WY",4566,700,85403,,"totalTestsViral",145630,16,235,,,,,3971,"9/16/2020 18:17","2020-09-16T18:17:00Z","09/16 14:17",46,235,,"2020-09-16T18:17:00Z",145630,4116,141514,3866,,,,89269,,,,,,,,,,,"56",128,96,89969,2315,89969,,0,5,"9805d9fde5f51af86a3758a71f362fb7913e4b08",0,0,0,0,0,""
20200915,"WY",4438,676,85307,,"totalTestsViral",143315,16,230,,,,,3925,"9/15/2020 17:45","2020-09-15T17:45:00Z","09/15 13:45",46,230,,"2020-09-15T17:45:00Z",143315,4042,139273,3762,,,,89069,,,,,,,,,,,"56",46,693,89745,2499,89745,,0,0,"45b1592f4cc22679877142f823513802148e0a1e",0,0,0,0,0,""
20200914,"WY",4392,669,84614,,"totalTestsViral",140816,13,230,,,,,3884,"9/14/2020 17:29","2020-09-14T17:29:00Z","09/14 13:29",46,230,,"2020-09-14T17:29:00Z",140816,3986,136830,3723,,,,88337,,,,,,,,,,,"56",46,2523,89006,2763,89006,,4,2,"96871f7e08a26d7e8c75d2bc059cf2b474d15c77",0,0,0,0,0,""
20200913,"WY",4346,667,82091,,"totalTestsViral",138053,12,228,,,,,3768,"9/13/2020 12:02","2020-09-13T12:02:00Z","09/13 08:02",42,228,,"2020-09-13T12:02:00Z",138053,3883,134170,3679,,,,85696,,,,,,,,,,,"56",49,0,86437,238,86437,,0,-59,"5a65b98b53ca366ee2b6606c093afd7007d301cd",0,0,0,0,0,""
20200912,"WY",4297,662,82091,,"totalTestsViral",137815,12,287,,,,,3740,"9/12/2020 12:22","2020-09-12T12:22:00Z","09/12 08:22",42,287,,"2020-09-12T12:22:00Z",137815,3865,133950,3635,,,,85696,,,,,,,,,,,"56",33,0,86388,301,86388,,0,60,"2f921f19d9951417b68937fcce75244800eccff7",0,0,0,0,0,""
20200911,"WY",4264,659,82091,,"totalTestsViral",137514,12,227,,,,,3724,"9/11/2020 17:31","2020-09-11T17:31:00Z","09/11 13:31",42,227,,"2020-09-11T17:31:00Z",137514,3848,133666,3605,,,,85696,,,,,,,,,,,"56",65,991,86355,1650,86355,,0,3,"1a9bf8cfa1afcc883c08d3dd704d64eaa4543063",0,0,0,0,0,""
20200910,"WY",4199,640,81100,,"totalTestsViral",135864,12,224,,,,,3553,"9/10/2020 17:32","2020-09-10T17:32:00Z","09/10 13:32",42,224,,"2020-09-10T17:32:00Z",135864,3797,132067,3559,,,,84659,,,,,,,,,,,"56",48,416,85299,2492,85299,,0,3,"0b0892799684e339b610ca109c1d3134210b54d1",0,0,0,0,0,""
20200909,"WY",4151,631,80684,,"totalTestsViral",133372,12,221,,,,,3484,"9/9/2020 17:46","2020-09-09T17:46:00Z","09/09 13:46",42,221,,"2020-09-09T17:46:00Z",133372,3749,129623,3520,,,,84204,,,,,,,,,,,"56",48,3318,84835,2107,84835,,0,2,"1a2b4c9496eb6c5d18158b451828f2eba42f58ff",0,0,0,0,0,""
20200908,"WY",4103,620,77366,,"totalTestsViral",131265,17,219,,,,,3451,"9/8/2020 16:23","2020-09-08T16:23:00Z","09/08 12:23",42,219,,"2020-09-08T16:23:00Z",131265,3710,127555,3483,,,,80849,,,,,,,,,,,"56",71,3054,81469,2248,81469,,0,0,"edf22371fafc7ffe98ef9ff79c35efcaf81ff89e",0,0,0,0,0,""
20200907,"WY",4032,607,74312,,"totalTestsViral",129017,15,219,,,,,3416,"9/6/2020 11:25","2020-09-06T11:25:00Z","09/06 07:25",42,219,,"2020-09-06T11:25:00Z",129017,3660,125357,3425,,,,77685,,,,,,,,,,,"56",0,0,78344,1132,78344,,0,0,"3f404715ca3cff9c90d9c2d5645e78f71ba2f332",0,0,0,0,0,""
20200906,"WY",4032,607,74312,,"totalTestsViral",127885,15,219,,,,,3416,"9/6/2020 11:25","2020-09-06T11:25:00Z","09/06 07:25",42,219,,"2020-09-06T11:25:00Z",127885,3644,124241,3425,,,,77685,,,,,,,,,,,"56",26,0,78344,202,78344,,0,-4,"7a8958dc05968fc0f98df462d4a94691a3a3bb86",0,0,0,0,0,""
20200905,"WY",4006,620,74312,,"totalTestsViral",127683,15,223,,,,,3404,"9/5/2020 11:21","2020-09-05T11:21:00Z","09/05 07:21",42,223,,"2020-09-05T11:21:00Z",127683,3638,124045,3386,,,,77685,,,,,,,,,,,"56",17,0,78318,250,78318,,0,0,"403431a5c116527a71f0f80e2ee4a63db556d35d",0,0,0,0,0,""
20200904,"WY",3989,616,74312,,"totalTestsViral",127433,15,223,,,,,3393,"9/4/2020 17:44","2020-09-04T17:44:00Z","09/04 13:44",42,223,,"2020-09-04T17:44:00Z",127433,3623,123810,3373,,,,77685,,,,,,,,,,,"56",50,750,78301,1328,78301,,1,0,"cc90a7dbb97fd8ec83ac7d30e1f79502aeb49d94",0,0,0,0,0,""
20200903,"WY",3939,605,73562,,"totalTestsViral",126105,15,223,,,,,3290,"9/3/2020 16:56","2020-09-03T16:56:00Z","09/03 12:56",41,223,,"2020-09-03T16:56:00Z",126105,3578,122527,3334,,,,76896,,,,,,,,,,,"56",28,663,77501,2225,77501,,0,2,"dc2b8412796cfb75de5406887eaf62a5f17a0542",0,0,0,0,0,""
20200902,"WY",3911,600,72899,,"totalTestsViral",123880,14,221,,,,,3249,"9/2/2020 18:11","2020-09-02T18:11:00Z","09/02 14:11",41,221,,"2020-09-02T18:11:00Z",123880,3543,120337,3311,,,,76210,,,,,,,,,,,"56",45,198,76810,1683,76810,,0,2,"db16c30c452d1947f5529333b5220eb40fc7e0ef",0,0,0,0,0,""
20200901,"WY",3866,584,72701,,"totalTestsViral",122197,13,219,,,,,3206,"9/1/2020 17:36","2020-09-01T17:36:00Z","09/01 13:36",41,219,,"2020-09-01T17:36:00Z",122197,3500,118697,3282,,,,75983,,,,,,,,,,,"56",24,270,76567,1500,76567,,4,4,"b5e61eced652a5e0ad67a0497ace2acbf290bc9b",0,0,0,0,0,""
20200831,"WY",3842,578,72431,,"totalTestsViral",120697,16,215,,,,,3181,"8/31/2020 16:43","2020-08-31T16:43:00Z","08/31 12:43",37,215,,"2020-08-31T16:43:00Z",120697,3480,117217,3264,,,,75695,,,,,,,,,,,"56",22,958,76273,1703,76273,,0,0,"f3f5a66178d1db0d5ccb68a981801c333dde3bc5",0,0,0,0,0,""
20200830,"WY",3820,575,71473,,"totalTestsViral",118994,15,215,,,,,3136,"8/30/2020 12:02","2020-08-30T12:02:00Z","08/30 08:02",37,215,,"2020-08-30T12:02:00Z",118994,3440,115554,3245,,,,74669,,,,,,,,,,,"56",36,0,75293,240,75293,,0,0,"bbd35b410f9abfe42b4f92103a1fd566f27e36b6",0,0,0,0,0,""
20200829,"WY",3784,574,71473,,"totalTestsViral",118754,15,215,,,,,3116,"8/29/2020 12:59","2020-08-29T12:59:00Z","08/29 08:59",37,215,,"2020-08-29T12:59:00Z",118754,3433,115321,3210,,,,74669,,,,,,,,,,,"56",21,0,75257,267,75257,,0,0,"5dcd5ce93d10633d4afd29ed5fbe08c84461b063",0,0,0,0,0,""
20200828,"WY",3763,567,71473,,"totalTestsViral",118487,15,215,,,,,3086,"8/28/2020 17:53","2020-08-28T17:53:00Z","08/28 13:53",37,215,,"2020-08-28T17:53:00Z",118487,3429,115058,3196,,,,74669,,,,,,,,,,,"56",41,663,75236,1377,75236,,0,0,"a7a6d01c01821df38827906baa4e91ed2ee27729",0,0,0,0,0,""
20200827,"WY",3722,556,70810,,"totalTestsViral",117110,13,215,,,,,3060,"8/27/2020 17:45","2020-08-27T17:45:00Z","08/27 13:45",37,215,,"2020-08-27T17:45:00Z",117110,3404,113706,3166,,,,73976,,,,,,,,,,,"56",38,3916,74532,1262,74532,,0,2,"a03a376a90038568557ccf1812ec7de5525a1706",0,0,0,0,0,""
20200826,"WY",3684,549,66894,,"totalTestsViral",115848,17,213,,,,,3028,"8/26/2020 16:28","2020-08-26T16:28:00Z","08/26 12:28",37,213,,"2020-08-26T16:28:00Z",115848,3382,112466,3135,,,,69983,,,,,,,,,,,"56",50,0,70578,1280,70578,,0,0,"9ec974818265a41e79060106d11f1289969e025b",0,0,0,0,0,""
20200825,"WY",3634,545,66894,,"totalTestsViral",114568,18,213,,,,,2965,"8/25/2020 17:25","2020-08-25T17:25:00Z","08/25 13:25",37,213,,"2020-08-25T17:25:00Z",114568,3339,111229,3089,,,,69983,,,,,,,,,,,"56",31,4475,70528,1479,70528,,0,2,"27710b5e9623b738c0cf11c84cb82e8214680146",0,0,0,0,0,""
20200824,"WY",3603,535,62419,,"totalTestsViral",113089,20,211,,,,,2927,"8/24/2020 16:39","2020-08-24T16:39:00Z","08/24 12:39",37,211,,"2020-08-24T16:39:00Z",113089,3309,109780,3068,,,,65487,,,,,,,,,,,"56",24,1106,66022,1651,66022,,0,4,"2eb07a1eee6dfecb099ef960e0d0712a4e0ea1e3",0,0,0,0,0,""
20200823,"WY",3579,533,61313,,"totalTestsViral",111438,19,207,,,,,2896,"8/23/2020 11:32","2020-08-23T11:32:00Z","08/23 07:32",37,207,,"2020-08-23T11:32:00Z",111438,3244,108194,3046,,,,64307,,,,,,,,,,,"56",36,0,64892,258,64892,,0,4,"cc1145e407569067761a2c4e674de8b662d0051d",0,0,0,0,0,""
20200822,"WY",3543,534,61313,,"totalTestsViral",111180,19,203,,,,,2879,"8/22/2020 12:00","2020-08-22T12:00:00Z","08/22 08:00",37,203,,"2020-08-22T12:00:00Z",111180,3236,107944,3009,,,,64307,,,,,,,,,,,"56",19,0,64856,250,64856,,0,0,"f47251bdba8071098526b85d7abf4f23ee74def9",0,0,0,0,0,""
20200821,"WY",3524,530,61313,,"totalTestsViral",110930,19,203,,,,,2864,"8/21/2020 17:22","2020-08-21T17:22:00Z","08/21 13:22",37,203,,"2020-08-21T17:22:00Z",110930,3227,107703,2994,,,,64307,,,,,,,,,,,"56",56,607,64837,849,64837,,3,1,"b67e49b0b6cacc522391dd185251e224bf44c731",0,0,0,0,0,""
20200820,"WY",3468,528,60706,,"totalTestsViral",110081,18,202,,,,,2832,"8/20/2020 17:42","2020-08-20T17:42:00Z","08/20 13:42",34,202,,"2020-08-20T17:42:00Z",110081,3198,106883,2940,,,,63646,,,,,,,,,,,"56",38,1042,64174,1276,64174,,0,5,"21bd4d14622b6760bbfa90d2a4b3a6b460c85057",0,0,0,0,0,""
20200819,"WY",3430,521,59664,,"totalTestsViral",108805,12,197,,,,,2786,"8/19/2020 18:11","2020-08-19T18:11:00Z","08/19 14:11",34,197,,"2020-08-19T18:11:00Z",108805,3172,105633,2909,,,,62573,,,,,,,,,,,"56",67,586,63094,1408,63094,,0,4,"68f8a54a573f775451a5408ce86f5df874648f48",0,0,0,0,0,""
20200818,"WY",3363,513,59078,,"totalTestsViral",107397,12,193,,,,,2759,"8/18/2020 16:42","2020-08-18T16:42:00Z","08/18 12:42",34,193,,"2020-08-18T16:42:00Z",107397,3141,104256,2850,,,,61928,,,,,,,,,,,"56",32,1511,62441,1578,62441,,1,-2,"c71f98c759447a2b02df1bf6c896c5a4f2e53f4d",0,0,0,0,0,""
20200817,"WY",3331,502,57567,,"totalTestsViral",105819,13,195,,,,,2699,"8/17/2020 16:57","2020-08-17T16:57:00Z","08/17 12:57",33,195,,"2020-08-17T16:57:00Z",105819,3096,102723,2829,,,,60396,,,,,,,,,,,"56",45,758,60898,2227,60898,,3,4,"60db4b71e5d2783121e7cabe06b41d12804bd6be",0,0,0,0,0,""
20200816,"WY",3286,497,56809,,"totalTestsViral",103592,13,191,,,,,2668,"8/16/2020 11:47","2020-08-16T11:47:00Z","08/16 07:47",30,191,,"2020-08-16T11:47:00Z",103592,3034,100558,2789,,,,59503,,,,,,,,,,,"56",59,0,60095,339,60095,,0,0,"b3bff5d92b8699c119433ba9fd72428e312a833d",0,0,0,0,0,""
20200815,"WY",3227,497,56809,,"totalTestsViral",103253,13,191,,,,,2659,"8/15/2020 12:11","2020-08-15T12:11:00Z","08/15 08:11",30,191,,"2020-08-15T12:11:00Z",103253,3022,100231,2730,,,,59503,,,,,,,,,,,"56",44,0,60036,401,60036,,0,0,"047591de0c62154f53fac5bee583541b51b180e1",0,0,0,0,0,""
20200814,"WY",3183,489,56809,,"totalTestsViral",102852,13,191,,,,,2641,"8/14/2020 18:08","2020-08-14T18:08:00Z","08/14 14:08",30,191,,"2020-08-14T18:08:00Z",102852,3019,99833,2694,,,,59503,,,,,,,,,,,"56",64,357,59992,1587,59992,,0,2,"63d42d700e8d5ad02021506472f323bb69ee0532",0,0,0,0,0,""
20200813,"WY",3119,492,56452,,"totalTestsViral",101265,14,189,,,,,2601,"8/13/2020 17:51","2020-08-13T17:51:00Z","08/13 13:51",30,189,,"2020-08-13T17:51:00Z",101265,2973,98292,2627,,,,59079,,,,,,,,,,,"56",33,207,59571,2757,59571,,1,2,"db5de878ebf7e0273d63d2e05a403ec70aa79c93",0,0,0,0,0,""
20200812,"WY",3086,486,56245,,"totalTestsViral",98508,15,187,,,,,2577,"8/12/2020 18:05","2020-08-12T18:05:00Z","08/12 14:05",29,187,,"2020-08-12T18:05:00Z",98508,2934,95574,2600,,,,58845,,,,,,,,,,,"56",13,466,59331,3033,59331,,0,4,"985dc2651dedf2d7e6dc1dcc7438e971c6114aeb",0,0,0,0,0,""
20200811,"WY",3073,489,55779,,"totalTestsViral",95475,15,183,,,,,2541,"8/11/2020 18:39","2020-08-11T18:39:00Z","08/11 14:39",29,183,,"2020-08-11T18:39:00Z",95475,2865,92610,2584,,,,58363,,,,,,,,,,,"56",31,1139,58852,3374,58852,,1,4,"a3c90d02e20beb504a415c12dbeaa17fb77a23b2",0,0,0,0,0,""
20200810,"WY",3042,477,54640,,"totalTestsViral",92101,15,179,,,,,2483,"8/10/2020 17:39","2020-08-10T17:39:00Z","08/10 13:39",28,179,,"2020-08-10T17:39:00Z",92101,2795,89306,2565,,,,57205,,,,,,,,,,,"56",-8,1015,57682,2303,57682,,0,2,"5a57240c8d289478ba6b44a565132cb2ab639a95",0,0,0,0,0,""
20200809,"WY",3050,517,53625,,"totalTestsViral",89798,17,177,,,,,2465,"8/9/2020 11:46","2020-08-09T11:46:00Z","08/09 07:46",28,177,,"2020-08-09T11:46:00Z",89798,2752,87046,2533,,,,56115,,,,,,,,,,,"56",37,0,56675,384,56675,,0,0,"d9396a7d1354758dd8cf106b51052d65d9a93641",0,0,0,0,0,""
20200808,"WY",3013,515,53625,,"totalTestsViral",89414,17,177,,,,,2462,"8/8/2020 12:22","2020-08-08T12:22:00Z","08/08 08:22",28,177,,"2020-08-08T12:22:00Z",89414,2743,86671,2498,,,,56115,,,,,,,,,,,"56",13,0,56638,455,56638,,0,1,"bdff6a33e276c7d6ae0a9e07250a024c09a3a34a",0,0,0,0,0,""
20200807,"WY",3000,510,53625,,"totalTestsViral",88959,17,176,,,,,2420,"8/7/2020 17:53","2020-08-07T17:53:00Z","08/07 13:53",28,176,,"2020-08-07T17:53:00Z",88959,2735,86224,2490,,,,56115,,,,,,,,,,,"56",42,475,56625,1264,56625,,1,5,"70e3c04aa0611c7b2fe8ce2e1c3a07b9c288e2f0",0,0,0,0,0,""
20200806,"WY",2958,509,53150,,"totalTestsViral",87695,16,171,,,,,2366,"8/6/2020 17:00","2020-08-06T17:00:00Z","08/06 13:00",27,171,,"2020-08-06T17:00:00Z",87695,2702,84993,2449,,,,55599,,,,,,,,,,,"56",35,359,56108,1188,56108,,0,2,"43f873de7643f10209fce9a7f010d3bcebc2ddda",0,0,0,0,0,""
20200805,"WY",2923,499,52791,,"totalTestsViral",86507,16,169,,,,,2323,"8/5/2020 16:45","2020-08-05T16:45:00Z","08/05 12:45",27,169,,"2020-08-05T16:45:00Z",86507,2660,83847,2424,,,,55215,,,,,,,,,,,"56",39,432,55714,1156,55714,,0,0,"eec497f281e3fe39a7e731c395c243233c1cf163",0,0,0,0,0,""
20200804,"WY",2884,492,52359,,"totalTestsViral",85351,17,169,,,,,2284,"8/4/2020 17:26","2020-08-04T17:26:00Z","08/04 13:26",27,169,,"2020-08-04T17:26:00Z",85351,2620,82731,2392,,,,54751,,,,,,,,,,,"56",36,327,55243,1404,55243,,0,2,"ff0467d13b92892f49813960e7df4c6577b3224d",0,0,0,0,0,""
20200803,"WY",2848,484,52032,,"totalTestsViral",83947,19,167,,,,,2214,"8/3/2020 16:25","2020-08-03T16:25:00Z","08/03 12:25",27,167,,"2020-08-03T16:25:00Z",83947,2580,81367,2364,,,,54396,,,,,,,,,,,"56",40,1459,54880,1839,54880,,1,0,"de50f94d5b7b4b3cd905236f48141b75a961d40d",0,0,0,0,0,""
20200802,"WY",2808,475,50573,,"totalTestsViral",82108,18,167,,,,,2173,"8/2/2020 12:28","2020-08-02T12:28:00Z","08/02 08:28",26,167,,"2020-08-02T12:28:00Z",82108,2541,79567,2333,,,,52827,,,,,,,,,,,"56",39,0,53381,221,53381,,0,0,"837db085a310691e06b857cb331e4abffd295dc3",0,0,0,0,0,""
20200801,"WY",2769,472,50573,,"totalTestsViral",81887,18,167,,,,,2153,"8/1/2020 12:06","2020-08-01T12:06:00Z","08/01 08:06",26,167,,"2020-08-01T12:06:00Z",81887,2533,79354,2297,,,,52827,,,,,,,,,,,"56",43,0,53342,220,53342,,0,1,"348cd940f6a83efecc50dc11b4824f2033a0da73",0,0,0,0,0,""
20200731,"WY",2726,472,50573,,"totalTestsViral",81667,18,166,,,,,2123,"7/31/2020 17:26","2020-07-31T17:26:00Z","07/31 13:26",26,166,,"2020-07-31T17:26:00Z",81667,2527,79140,2254,,,,52827,,,,,,,,,,,"56",40,618,53299,891,53299,,0,0,"e7249836493f5a37a1e298760b1ffa33ea3af106",0,0,0,0,0,""
20200730,"WY",2686,469,49955,,"totalTestsViral",80776,18,166,,,,,2065,"7/30/2020 16:47","2020-07-30T16:47:00Z","07/30 12:47",26,166,,"2020-07-30T16:47:00Z",80776,2501,78275,2217,,,,52172,,,,,,,,,,,"56",58,571,52641,1038,52641,,0,1,"af33f38bbc4c01e645be87fe9ce1d22d922b8ba7",0,0,0,0,0,""
20200729,"WY",2628,456,49384,,"totalTestsViral",79738,16,165,,,,,2022,"7/29/2020 16:32","2020-07-29T16:32:00Z","07/29 12:32",26,165,,"2020-07-29T16:32:00Z",79738,2459,77279,2172,,,,51556,,,,,,,,,,,"56",39,1193,52012,1085,52012,,0,3,"4e6e700d9aaa8125cfae4e4f73c73dabe4c55c99",0,0,0,0,0,""
20200728,"WY",2589,453,48191,,"totalTestsViral",78653,15,162,,,,,1970,"7/28/2020 17:39","2020-07-28T17:39:00Z","07/28 13:39",26,162,,"2020-07-28T17:39:00Z",78653,2406,76247,2136,,,,50327,,,,,,,,,,,"56",69,2368,50780,1156,50780,,1,4,"9200cff273fab081b445e9796813bbdac42a8636",0,0,0,0,0,""
20200727,"WY",2520,448,45823,,"totalTestsViral",77497,17,158,,,,,1915,"7/27/2020 16:45","2020-07-27T16:45:00Z","07/27 12:45",25,158,,"2020-07-27T16:45:00Z",77497,2377,75120,2072,,,,47745,,,,,,,,,,,"56",45,0,48343,2224,48343,,0,0,"73175a127935eaf42e0e1799012b61cf67d82969",0,0,0,0,0,""
20200726,"WY",2475,446,45823,,"totalTestsViral",75273,14,158,,,,,1883,"7/26/2020 11:37","2020-07-26T11:37:00Z","07/26 07:37",25,158,,"2020-07-26T11:37:00Z",75273,2291,72982,2029,,,,47745,,,,,,,,,,,"56",29,0,48298,259,48298,,0,0,"4206b84e45cd8aec2e36576576aca685af4e477f",0,0,0,0,0,""
20200725,"WY",2446,438,45823,,"totalTestsViral",75014,14,158,,,,,1866,"7/25/2020 11:36","2020-07-25T11:36:00Z","07/25 07:36",25,158,,"2020-07-25T11:36:00Z",75014,2277,72737,2008,,,,47745,,,,,,,,,,,"56",41,0,48269,185,48269,,0,3,"e13be434f33bea02cbfe7a25074b3b77c4c4b7f5",0,0,0,0,0,""
20200724,"WY",2405,433,45823,,"totalTestsViral",74829,14,155,,,,,1857,"7/24/2020 18:18","2020-07-24T18:18:00Z","07/24 14:18",25,155,,"2020-07-24T18:18:00Z",74829,2256,72573,1972,,,,47745,,,,,,,,,,,"56",58,0,48228,765,48228,,0,2,"9c3b36e1c537e7fab29aa80e5d763a5a953a47b5",0,0,0,0,0,""
20200723,"WY",2347,424,45823,,"totalTestsViral",74064,15,153,,,,,1794,"7/23/2020 17:37","2020-07-23T17:37:00Z","07/23 13:37",25,153,,"2020-07-23T17:37:00Z",74064,2211,71853,1923,,,,47745,,,,,,,,,,,"56",59,3896,48170,968,48170,,0,1,"193ad880750c55d449fad6840e2ea003c5108dde",0,0,0,0,0,""
20200722,"WY",2288,424,41927,,"totalTestsViral",73096,13,152,,,,,1745,"7/22/2020 18:02","2020-07-22T18:02:00Z","07/22 14:02",25,152,,"2020-07-22T18:02:00Z",73096,2163,70933,1864,,,,43605,,,,,,,,,,,"56",50,0,44215,1267,44215,,0,6,"fe430915e3170403b975858e457f8c581b02ebd1",0,0,0,0,0,""
20200721,"WY",2238,408,41927,,"totalTestsViral",71829,13,146,,,,,1694,"7/21/2020 17:55","2020-07-21T17:55:00Z","07/21 13:55",25,146,,"2020-07-21T17:55:00Z",71829,2112,69717,1830,,,,43605,,,,,,,,,,,"56",51,0,44165,1492,44165,,1,2,"f81798d10f51a2e8850f66249101b39106e75b58",0,0,0,0,0,""
20200720,"WY",2187,397,41927,,"totalTestsViral",70337,13,144,,,,,1652,"7/20/2020 17:57","2020-07-20T17:57:00Z","07/20 13:57",24,144,,"2020-07-20T17:57:00Z",70337,2077,68260,1790,,,,43605,,,,,,,,,,,"56",61,0,44114,2255,44114,,0,1,"d0569e8fd3c06228e8cea7b61cf6da1525b32571",0,0,0,0,0,""
20200719,"WY",2126,398,41927,,"totalTestsViral",68082,17,143,,,,,1615,"7/19/2020 14:29","2020-07-19T14:29:00Z","07/19 10:29",24,143,,"2020-07-19T14:29:00Z",68082,2017,66065,1728,,,,43605,,,,,,,,,,,"56",18,0,44053,246,44053,,0,1,"91638faff35fb23ebe6f053e9cdc56d922e26691",0,0,0,0,0,""
20200718,"WY",2108,395,41927,,"totalTestsViral",67836,16,142,,,,,1611,"7/18/2020 12:02","2020-07-18T12:02:00Z","07/18 08:02",24,142,,"2020-07-18T12:02:00Z",67836,2000,65836,1713,,,,43605,,,,,,,,,,,"56",39,0,44035,328,44035,,0,2,"05f534df44fb275472066d6f01e8ca72714e9895",0,0,0,0,0,""
20200717,"WY",2069,391,41927,,"totalTestsViral",67508,19,140,,,,,1590,"7/17/2020 17:49","2020-07-17T17:49:00Z","07/17 13:49",24,140,,"2020-07-17T17:49:00Z",67508,1976,65532,1678,,,,43605,,,,,,,,,,,"56",43,501,43996,1087,43996,,0,9,"7b3e7141da2dd6906d969a37a74e176413c0f691",0,0,0,0,0,""
20200716,"WY",2026,382,41426,,"totalTestsViral",66421,18,131,,,,,1540,"7/16/2020 17:23","2020-07-16T17:23:00Z","07/16 13:23",24,131,,"2020-07-16T17:23:00Z",66421,1920,64501,1644,,,,43070,,,,,,,,,,,"56",41,497,43452,1138,43452,,2,0,"5381c951a8415816bd1eed93d5b2d02a6690bd18",0,0,0,0,0,""
20200715,"WY",1985,380,40929,,"totalTestsViral",65283,17,131,,,,,1506,"7/15/2020 18:02","2020-07-15T18:02:00Z","07/15 14:02",22,131,,"2020-07-15T18:02:00Z",65283,1865,63418,1605,,,,42534,,,,,,,,,,,"56",34,2852,42914,1239,42914,,0,3,"f0ffc6710c04b878aec45b7fda2343f22e91048b",0,0,0,0,0,""
20200714,"WY",1951,370,38077,,"totalTestsViral",64044,14,128,,,,,1462,"7/14/2020 18:08","2020-07-14T18:08:00Z","07/14 14:08",22,128,,"2020-07-14T18:08:00Z",64044,1817,62227,1581,,,,39552,,,,,,,,,,,"56",47,0,40028,1604,40028,,1,4,"481a43f5d6c65a16aa449b1aabe7a49f51fac533",0,0,0,0,0,""
20200713,"WY",1904,359,38077,,"totalTestsViral",62440,17,124,,,,,1372,"7/12/2020 11:42","2020-07-12T11:42:00Z","07/12 07:42",21,124,,"2020-07-12T11:42:00Z",62440,1769,60671,1545,,,,39552,,,,,,,,,,,"56",42,0,39981,2229,39981,,0,0,"06d175bcff65f72d2675c496e8c12f40d8eb9546",0,0,0,0,0,""
20200712,"WY",1862,356,38077,,"totalTestsViral",60211,12,124,,,,,1372,"7/12/2020 12:00","2020-07-12T12:00:00Z","07/12 08:00",21,124,,"2020-07-12T12:00:00Z",60211,1715,58496,1506,,,,39552,,,,,,,,,,,"56",23,0,39939,207,39939,,0,1,"845245d19dd0a72954b1eb81f13f7e606c3a696c",0,0,0,0,0,""
20200711,"WY",1839,351,38077,,"totalTestsViral",60004,12,123,,,,,1361,"7/11/2020 11:44","2020-07-11T11:44:00Z","07/11 07:44",21,123,,"2020-07-11T11:44:00Z",60004,1704,58300,1488,,,,39552,,,,,,,,,,,"56",49,0,39916,204,39916,,0,2,"774e615252b7c71cf91eee433da4fc40caa0bed7",0,0,0,0,0,""
20200710,"WY",1790,345,38077,,"totalTestsViral",59800,12,121,,,,,1327,"7/10/2020 13:50","2020-07-10T13:50:00Z","07/10 09:50",21,121,,"2020-07-10T13:50:00Z",59800,1694,58106,1445,,,,39552,,,,,,,,,,,"56",16,806,39867,926,39867,,0,0,"36d3d173a4414f4ecfb68b006dfe9c46f4bbe67a",0,0,0,0,0,""
20200709,"WY",1774,346,37271,,"totalTestsViral",58874,12,121,,,,,1313,"7/9/2020 17:45","2020-07-09T17:45:00Z","07/09 13:45",21,121,,"2020-07-09T17:45:00Z",58874,1667,57207,1428,,,,38699,,,,,,,,,,,"56",34,1193,39045,1167,39045,,0,1,"8d3940bb423703c3f2014c27a79da12f7c56a677",0,0,0,0,0,""
20200708,"WY",1740,336,36078,,"totalTestsViral",57707,13,120,,,,,1291,"7/8/2020 17:23","2020-07-08T17:23:00Z","07/08 13:23",21,120,,"2020-07-08T17:23:00Z",57707,1627,56080,1404,,,,37456,,,,,,,,,,,"56",29,0,37818,1071,37818,,1,1,"be76568557235c17669bc7792eb61633cf3a020b",0,0,0,0,0,""
20200707,"WY",1711,333,36078,,"totalTestsViral",56636,10,119,,,,,1274,"7/7/2020 17:47","2020-07-07T17:47:00Z","07/07 13:47",20,119,,"2020-07-07T17:47:00Z",56636,1596,55040,1378,,,,37456,,,,,,,,,,,"56",36,2385,37789,1306,37789,,0,0,"58b2ef258d7d41c8b9af1436c07786173b130fd8",0,0,0,0,0,""
20200706,"WY",1675,326,33693,,"totalTestsViral",55330,9,119,,,,,1172,"7/5/2020 13:36","2020-07-05T13:36:00Z","07/05 09:36",20,119,,"2020-07-05T13:36:00Z",55330,1570,53760,1349,,,,34926,,,,,,,,,,,"56",41,0,35368,1463,35368,,0,0,"5cdc123a6774471c25b99d85ca2f322bdd135ef2",0,0,0,0,0,""
20200705,"WY",1634,322,33693,,"totalTestsViral",53867,8,119,,,,,1172,"7/5/2020 13:36","2020-07-05T13:36:00Z","07/05 09:36",20,119,,"2020-07-05T13:36:00Z",53867,1513,52354,1312,,,,34926,,,,,,,,,,,"56",28,0,35327,239,35327,,0,0,"46b6ae06ff761809e04c4936419695232a04ddc4",0,0,0,0,0,""
20200704,"WY",1606,317,33693,,"totalTestsViral",53628,8,119,,,,,1169,"7/4/2020 12:20","2020-07-04T12:20:00Z","07/04 08:20",20,119,,"2020-07-04T12:20:00Z",53628,1505,52123,1289,,,,34926,,,,,,,,,,,"56",24,0,35299,216,35299,,0,0,"92237fd7d45450ddca3a1eea33d3134345c8beb0",0,0,0,0,0,""
20200703,"WY",1582,315,33693,,"totalTestsViral",53412,8,119,,,,,1154,"7/3/2020 11:24","2020-07-03T11:24:00Z","07/03 07:24",20,119,,"2020-07-03T11:24:00Z",53412,1490,51922,1267,,,,34926,,,,,,,,,,,"56",32,0,35275,519,35275,,0,0,"c8b24579354670a9341009ac9d0fdfafe73ad80c",0,0,0,0,0,""
20200702,"WY",1550,317,33693,,"totalTestsViral",52893,9,119,,,,,1139,"7/2/2020 17:52","2020-07-02T17:52:00Z","07/02 13:52",20,119,,"2020-07-02T17:52:00Z",52893,1466,51427,1233,,,,34926,,,,,,,,,,,"56",36,1508,35243,1376,35243,,0,2,"f4707f3ede97b9d0f0eda7bf95f73112e75d0783",0,0,0,0,0,""
20200701,"WY",1514,311,32185,,"totalTestsViral",51517,9,117,,,,,1119,"7/1/2020 17:40","2020-07-01T17:40:00Z","07/01 13:40",20,117,,"2020-07-01T17:40:00Z",51517,1426,50091,1203,,,,33369,,,,,,,,,,,"56",27,0,33699,1230,33699,,0,0,"375196072f44a934d6f2378e9a19b9656f1aee59",0,0,0,0,0,""
20200630,"WY",1487,303,32185,,"totalTestsViral",50287,6,117,,,,,1097,"6/30/2020 16:55","2020-06-30T16:55:00Z","06/30 12:55",20,117,,"2020-06-30T16:55:00Z",50287,1397,48890,1184,,,,33369,,,,,,,,,,,"56",37,1779,33672,1620,33672,,0,5,"8b9303575f0944ae91509d26fc527c1cf542cbac",0,0,0,0,0,""
20200629,"WY",1450,299,30406,,"totalTestsViral",48667,7,112,,,,,1070,"6/29/2020 16:57","2020-06-29T16:57:00Z","06/29 12:57",20,112,,"2020-06-29T16:57:00Z",48667,1368,47299,1151,,,,31485,,,,,,,,,,,"56",33,0,31856,1981,31856,,0,0,"c56c7034a5f2cbfc33bf7739e76be77eeec89965",0,0,0,0,0,""
20200628,"WY",1417,296,30406,,"totalTestsViral",46686,5,112,,,,,1057,"6/28/2020 13:01","2020-06-28T13:01:00Z","06/28 09:01",20,112,,"2020-06-28T13:01:00Z",46686,1332,45354,1121,,,,31485,,,,,,,,,,,"56",25,0,31823,209,31823,,0,1,"228807c5f35ba390f5787683540bf7f8c1380650",0,0,0,0,0,""
20200627,"WY",1392,295,30406,,"totalTestsViral",46477,5,111,,,,,1054,"6/27/2020 12:25","2020-06-27T12:25:00Z","06/27 08:25",20,111,,"2020-06-27T12:25:00Z",46477,1322,45155,1097,,,,31485,,,,,,,,,,,"56",24,0,31798,244,31798,,0,-1,"ab7f0a0d4e30cfb36826c2cb8b34df7f5529c212",0,0,0,0,0,""
20200626,"WY",1368,289,30406,,"totalTestsViral",46233,5,112,,,,,1033,"6/26/2020 18:15","2020-06-26T18:15:00Z","06/26 14:15",20,112,,"2020-06-26T18:15:00Z",46233,1316,44917,1079,,,,31485,,,,,,,,,,,"56",42,1537,31774,1250,31774,,0,1,"317bde1436e8e1eeda1935304e7636c7e719d151",0,0,0,0,0,""
20200625,"WY",1326,274,28869,,"totalTestsViral",44983,7,111,,,,,996,"6/25/2020 17:19","2020-06-25T17:19:00Z","06/25 13:19",20,111,,"2020-06-25T17:19:00Z",44983,1290,43693,1052,,,,29885,,,,,,,,,,,"56",44,0,30195,1327,30195,,0,2,"a94cb4fdab7bef3c652d85c7ef226d14eaebb13a",0,0,0,0,0,""
20200624,"WY",1282,266,28869,,"totalTestsViral",43656,7,109,,,,,966,"6/24/2020 16:59","2020-06-24T16:59:00Z","06/24 12:59",20,109,,"2020-06-24T16:59:00Z",43656,1259,42397,1016,,,,29885,,,,,,,,,,,"56",28,1384,30151,1267,30151,,0,0,"ad402871c5222fb465b0372e62ff627c6a0baca8",0,0,0,0,0,""
20200623,"WY",1254,262,27485,,"totalTestsViral",42389,8,109,,,,,953,"6/23/2020 17:46","2020-06-23T17:46:00Z","06/23 13:46",20,109,,"2020-06-23T17:46:00Z",42389,1231,41158,992,,,,28477,,,,,,,,,,,"56",24,1323,28739,1140,28739,,0,4,"a15fb170d730d9849e71aed3daca6196ee71ef86",0,0,0,0,0,""
20200622,"WY",1230,256,26162,,"totalTestsViral",41249,8,105,,,,,931,"6/22/2020 04:50","2020-06-22T04:50:00Z","06/22 00:50",20,105,,"2020-06-22T04:50:00Z",41249,1201,40048,974,,,,27109,,,,,,,,,,,"56",33,0,27392,1550,27392,,0,5,"74ac479f2b05777b480f8f45a7f4d6f3e15b8f45",0,0,0,0,0,""
20200621,"WY",1197,250,26162,,"totalTestsViral",39699,8,100,,,,,909,"6/21/2020 11:59","2020-06-21T11:59:00Z","06/21 07:59",20,100,,"2020-06-21T11:59:00Z",39699,1159,38540,947,,,,27109,,,,,,,,,,,"56",18,0,27359,150,27359,,0,2,"5abf253ecc0ef59340b0216bb8316c0ad779d92e",0,0,0,0,0,""
20200620,"WY",1179,249,26162,,"totalTestsViral",39549,8,98,,,,,896,"6/20/2020 12:00","2020-06-20T12:00:00Z","06/20 08:00",20,98,,"2020-06-20T12:00:00Z",39549,1154,38395,930,,,,27109,,,,,,,,,,,"56",6,-9139,27341,190,27341,,0,0,"40aac45cb4a27ceb54fd4da1c56dc94adab9f9a5",0,0,0,0,0,""
20200619,"WY",1173,246,35301,,"totalTestsViral",39359,8,98,,,,,889,"6/19/2020 18:00","2020-06-19T18:00:00Z","06/19 14:00",20,98,,"2020-06-19T18:00:00Z",39359,1146,38213,927,,,,,,,,,,,,,,,"56",29,291,36474,751,36474,,2,1,"c6fd9ce7d4cc440fd65e6c2c10ee1dc11e6f6bd8",0,0,0,0,0,""
20200618,"WY",1144,238,35010,,"totalTestsViral",38608,8,97,,,,,870,"6/18/2020 18:00","2020-06-18T18:00:00Z","06/18 14:00",18,97,,"2020-06-18T18:00:00Z",38608,1129,37479,906,,,,,,,,,,,,,,,"56",30,1055,36154,1131,36154,,0,0,"342c6bda5e1c71c55c0711e835fab1fa1e414c5e",0,0,0,0,0,""
20200617,"WY",1114,230,33955,,"totalTestsViral",37477,7,97,,,,,862,"6/17/2020 18:00","2020-06-17T18:00:00Z","06/17 14:00",18,97,,"2020-06-17T18:00:00Z",37477,1107,36370,884,,,,,,,,,,,,,,,"56",25,631,35069,846,35069,,0,1,"2eab833a8beea19114179852186eac90befc807f",0,0,0,0,0,""
20200616,"WY",1089,223,33324,,"totalTestsViral",36631,7,96,,,,,852,"6/15/2020 18:00","2020-06-15T18:00:00Z","06/15 14:00",18,96,,"2020-06-15T18:00:00Z",36631,1084,35547,866,,,,,,,,,,,,,,,"56",10,1778,34413,787,34413,,0,3,"ad7067f8d861614040095b8223e3e0c04d24a081",0,0,0,0,0,""
20200615,"WY",1079,223,31546,,"totalTestsViral",35844,4,93,,,,,834,"6/15/2020 18:00","2020-06-15T18:00:00Z","06/15 14:00",18,93,,"2020-06-15T18:00:00Z",35844,1065,34779,856,,,,,,,,,,,,,,,"56",19,-459,32625,902,32625,,0,0,"857694ced12d08fdda8eace5d340bda65f35b88a",0,0,0,0,0,""
20200614,"WY",1060,219,32005,,"totalTestsViral",34942,5,93,,,,,834,"6/14/2020 12:00","2020-06-14T12:00:00Z","06/14 08:00",18,93,,"2020-06-14T12:00:00Z",34942,1030,33912,841,,,,,,,,,,,,,,,"56",10,0,33065,127,33065,,0,0,"6d8d6c39c5436fa53c344865add9febd0cf9017b",0,0,0,0,0,""
20200613,"WY",1050,218,32005,,"totalTestsViral",34815,5,93,,,,,833,"6/13/2020 12:00","2020-06-13T12:00:00Z","06/13 08:00",18,93,,"2020-06-13T12:00:00Z",34815,1027,33788,832,,,,,,,,,,,,,,,"56",23,1132,33055,165,33055,,0,1,"156b3c63181969b626b648b65cc8d2d0ed59976a",0,0,0,0,0,""
20200612,"WY",1027,216,30873,,"totalTestsViral",34650,5,92,,,,,814,"6/12/2020 18:00","2020-06-12T18:00:00Z","06/12 14:00",18,92,,"2020-06-12T18:00:00Z",34650,1026,33624,811,,,,,,,,,,,,,,,"56",18,264,31900,696,31900,,0,0,"dcf623e7f4bd11000dbf7d3a806fd609dc095faf",0,0,0,0,0,""
20200611,"WY",1009,216,30609,,"totalTestsViral",33954,7,92,,,,,814,"6/11/2020 16:12","2020-06-11T16:12:00Z","06/11 12:12",18,92,,"2020-06-11T16:12:00Z",33954,1006,32948,793,,,,,,,,,,,,,,,"56",29,737,31618,781,31618,,0,0,"4285d848118eaaaee870081eb22d560d5b8149d9",0,0,0,0,0,""
20200610,"WY",980,212,29872,,"totalTestsViral",33173,8,92,,,,,804,"6/10/2020 00:00","2020-06-10T00:00:00Z","06/09 20:00",18,92,,"2020-06-10T00:00:00Z",33173,990,32183,768,,,,,,,,,,,,,,,"56",10,506,30852,687,30852,,1,1,"f61b5151fdb8a2ca78c01178f19fad52ad84415d",0,0,0,0,0,""
20200609,"WY",970,210,29366,,"totalTestsViral",32486,8,91,,,,,789,"6/9/2020 17:48","2020-06-09T17:48:00Z","06/09 13:48",17,91,,"2020-06-09T17:48:00Z",32486,978,31508,760,,,,,,,,,,,,,,,"56",10,352,30336,671,30336,,0,0,"4003bd175c65d65dc9a653ed965eec437efc764e",0,0,0,0,0,""
20200608,"WY",960,212,29014,,"totalTestsViral",31815,7,91,,,,,773,"6/8/2020 17:54","2020-06-08T17:54:00Z","06/08 13:54",17,91,,"2020-06-08T17:54:00Z",31815,958,30857,748,,,,,,,,,,,,,,,"56",13,1210,29974,607,29974,,0,1,"b198c44641ff43c49921716ac100cab55c7f0666",0,0,0,0,0,""
20200607,"WY",947,213,27804,,"totalTestsViral",31208,4,90,,,,,757,"6/7/2020 11:52","2020-06-07T11:52:00Z","06/07 07:52",17,90,,"2020-06-07T11:52:00Z",31208,931,30277,734,,,,,,,,,,,,,,,"56",8,235,28751,98,28751,,0,0,"2194699f774b66661dea09ba59a65b522bfe8a36",0,0,0,0,0,""
20200606,"WY",939,213,27569,,"totalTestsViral",31110,4,90,,,,,757,"6/6/2020 00:00","2020-06-06T00:00:00Z","06/05 20:00",17,90,,"2020-06-06T00:00:00Z",31110,926,30184,726,,,,,,,,,,,,,,,"56",6,890,28508,97,28508,,0,0,"ab3607bba58cb8068bef48ac1f138bfac7f3dd8f",0,0,0,0,0,""
20200605,"WY",933,212,26679,,"totalTestsViral",31013,4,90,,,,,755,"6/5/2020 00:00","2020-06-05T00:00:00Z","06/04 20:00",17,90,,"2020-06-05T00:00:00Z",31013,917,30096,721,,,,,,,,,,,,,,,"56",12,605,27612,595,27612,,0,3,"a9cbd9215e2a2660abefe9122ca74619a0a526a7",0,0,0,0,0,""
20200604,"WY",921,212,26074,,"totalTestsViral",30418,4,87,,,,,714,"6/3/2020 00:00","2020-06-03T00:00:00Z","06/02 20:00",17,87,,"2020-06-03T00:00:00Z",30418,906,29512,709,,,,,,,,,,,,,,,"56",6,361,26995,887,26995,,0,0,"729a2bc9d1c4997ed1a7cd0693b073555c658b82",0,0,0,0,0,""
20200603,"WY",915,212,25713,,"totalTestsViral",29531,4,87,,,,,714,"6/3/2020 00:00","2020-06-03T00:00:00Z","06/02 20:00",17,87,,"2020-06-03T00:00:00Z",29531,893,28638,703,,,,,,,,,,,,,,,"56",3,881,26628,601,26628,,0,1,"615ba1b5dee12a9fb852f7cb67c853b0833e93ac",0,0,0,0,0,""
20200602,"WY",912,211,24832,,"totalTestsViral",28930,7,86,,,,,667,"6/1/2020 00:00","2020-06-01T00:00:00Z","05/31 20:00",17,86,,"2020-06-01T00:00:00Z",28930,875,28055,701,,,,,,,,,,,,,,,"56",2,595,25744,695,25744,,0,0,"9743ee83ac3480fb25b2cc0f03a47b70704a89f9",0,0,0,0,0,""
20200601,"WY",910,210,24237,,"totalTestsViral",28235,8,86,,,,,667,"5/31/2020 00:00","2020-05-31T00:00:00Z","05/30 20:00",17,86,,"2020-05-31T00:00:00Z",28235,867,27368,700,,,,,,,,,,,,,,,"56",7,747,25147,810,25147,,1,1,"6abd6ab460aea69e586fe060b23e363ba925b94b",0,0,0,0,0,""
20200531,"WY",903,210,23490,,"totalTestsViral",27425,13,85,,,,,658,"5/31/2020 00:00","2020-05-31T00:00:00Z","05/30 20:00",16,85,,"2020-05-31T00:00:00Z",27425,859,26566,693,,,,,,,,,,,,,,,"56",5,305,24393,203,24393,,0,0,"2873f4451675ced10d249ba62237cb46e2fbe197",0,0,0,0,0,""
20200530,"WY",898,210,23185,,"totalTestsViral",27222,13,85,,,,,658,"5/30/2020 00:00","2020-05-30T00:00:00Z","05/29 20:00",16,85,,"2020-05-30T00:00:00Z",27222,855,26367,688,,,,,,,,,,,,,,,"56",7,807,24083,141,24083,,1,1,"e2e41ce100237c5021d90123e96bd4fe21e5d175",0,0,0,0,0,""
20200529,"WY",891,209,22378,,"totalTestsViral",27081,13,84,,,,,634,"5/28/2020 00:00","2020-05-28T00:00:00Z","05/27 20:00",15,84,,"2020-05-28T00:00:00Z",27081,854,26227,682,,,,,,,,,,,,,,,"56",15,92,23269,696,23269,,0,2,"c3f916f904c9ee77c1334da38034e67975d781e1",0,0,0,0,0,""
20200528,"WY",876,209,22286,,"totalTestsViral",26385,15,82,,,,,624,"5/28/2020 00:00","2020-05-28T00:00:00Z","05/27 20:00",15,82,,"2020-05-28T00:00:00Z",26385,841,25544,667,,,,,,,,,,,,,,,"56",16,1634,23162,1869,23162,,2,0,"e3374302bc0fd69b18e15233e3a6ebbe7f0359cb",0,0,0,0,0,""
20200527,"WY",860,207,20652,,"totalTestsViral",24516,12,82,,,,,607,"5/27/2020 00:00","2020-05-27T00:00:00Z","05/26 20:00",13,82,,"2020-05-27T00:00:00Z",24516,827,23689,653,,,,,,,,,,,,,,,"56",10,0,21512,975,21512,,0,0,"8ae76ad529232f9344e6157a515893911b4fc525",0,0,0,0,0,""
20200526,"WY",850,202,20652,,"totalTestsViral",23541,14,82,,,,,607,"5/26/2020 00:00","2020-05-26T00:00:00Z","05/25 20:00",13,82,,"2020-05-26T00:00:00Z",23541,811,22730,648,,,,,,,,,,,,,,,"56",7,1101,21502,841,21502,,1,3,"f04c3c5a345ccb6f74ad47044d5220361e63d650",0,0,0,0,0,""
20200525,"WY",843,199,19551,,"totalTestsViral",22700,10,79,,,,,575,"5/24/2020 00:00","2020-05-24T00:00:00Z","05/23 20:00",12,79,,"2020-05-24T00:00:00Z",22700,782,21918,644,,,,,,,,,,,,,,,"56",5,330,20394,176,20394,,0,1,"fe7104503ba8faa42d2438eaf2e4f698109fe8b8",0,0,0,0,0,""
20200524,"WY",838,200,19221,,"totalTestsViral",22524,10,78,,,,,556,"5/23/2020 00:00","2020-05-23T00:00:00Z","05/22 20:00",12,78,,"2020-05-23T00:00:00Z",22524,779,21745,638,,,,,,,,,,,,,,,"56",25,0,20059,156,20059,,0,1,"fdc4ef00cc25ac6d912bca926ec0c1af5c96d3e4",0,0,0,0,0,""
20200523,"WY",813,198,19221,,"totalTestsViral",22368,10,77,,,,,551,"5/23/2020 00:00","2020-05-23T00:00:00Z","05/22 20:00",12,77,,"2020-05-23T00:00:00Z",22368,775,21593,615,,,,,,,,,,,,,,,"56",10,600,20034,193,20034,,0,1,"2ee6f5675c845134af1c9be5b1bb751c6fb77d71",0,0,0,0,0,""
20200522,"WY",803,195,18621,,"totalTestsViral",22175,10,76,,,,,551,"5/21/2020 18:02","2020-05-21T18:02:00Z","05/21 14:02",12,76,,"2020-05-21T18:02:00Z",22175,770,21405,608,,,,,,,,,,,,,,,"56",2,568,19424,780,19424,,1,1,"decc7a0f573a350cc8cd1f7b60711700daf6d439",0,0,0,0,0,""
20200521,"WY",801,193,18053,,"totalTestsViral",21395,8,75,,,,,534,"5/20/2020 16:54","2020-05-20T16:54:00Z","05/20 12:54",11,75,,"2020-05-20T16:54:00Z",21395,745,20650,608,,,,,,,,,,,,,,,"56",14,0,18854,923,18854,,0,1,"8224de1c3e4870da6933fc881cd28fb9cb630a89",0,0,0,0,0,""
20200520,"WY",787,191,18053,,"totalTestsViral",20472,9,74,,,,,528,"5/20/2020 16:15","2020-05-20T16:15:00Z","05/20 12:15",11,74,,"2020-05-20T16:15:00Z",20472,728,19744,596,,,,,,,,,,,,,,,"56",11,969,18840,602,18840,,1,1,"93ebe8b8fcccfcefe3698447a1f6e7979e04cee4",0,0,0,0,0,""
20200519,"WY",776,193,17084,,"totalTestsViral",19870,8,73,,,,,504,"5/18/2020 00:00","2020-05-18T00:00:00Z","05/17 20:00",10,73,,"2020-05-18T00:00:00Z",19870,720,19150,583,,,,,,,,,,,,,,,"56",10,753,17860,645,17860,,2,0,"058e4b3d3e46a862cc31e826e2e71489f646118c",0,0,0,0,0,""
20200518,"WY",766,189,16331,,"totalTestsViral",19225,8,73,,,,,498,"5/17/2020 00:00","2020-05-17T00:00:00Z","05/16 20:00",8,73,,"2020-05-17T00:00:00Z",19225,703,18522,577,,,,,,,,,,,,,,,"56",12,0,17097,656,17097,,0,3,"cd9266b6f3aede6b2c5e29c4accc94c8d5b04df5",0,0,0,0,0,""
20200517,"WY",754,188,16331,,"totalTestsViral",18569,8,70,,,,,498,"5/16/2020 15:07","2020-05-16T15:07:00Z","05/16 11:07",8,70,,"2020-05-16T15:07:00Z",18569,677,17892,566,,,,,,,,,,,,,,,"56",13,653,17085,107,17085,,1,1,"f66cc703eec0ca00d2da37f1cee7286f16075268",0,0,0,0,0,""
20200516,"WY",741,182,15678,,"totalTestsViral",18462,8,69,,,,,496,"5/15/2020 16:20","2020-05-15T16:20:00Z","05/15 12:20",7,69,,"2020-05-15T16:20:00Z",18462,671,17791,559,,,,,,,,,,,,,,,"56",25,371,16419,222,16419,,0,1,"12603b5bafa05f54d36972a0c0aa8a3353533125",0,0,0,0,0,""
20200515,"WY",716,175,15307,,"totalTestsViral",18240,8,68,,,,,487,"5/14/2020 00:00","2020-05-14T00:00:00Z","05/13 20:00",7,68,,"2020-05-14T00:00:00Z",18240,665,17575,541,,,,,,,,,,,,,,,"56",15,578,16023,654,16023,,0,1,"fd41aabb2e072dfa971e10249d00479042a2907c",0,0,0,0,0,""
20200514,"WY",701,172,14729,,"totalTestsViral",17586,8,67,,,,,480,"5/14/2020 00:00","2020-05-14T00:00:00Z","05/13 20:00",7,67,,"2020-05-14T00:00:00Z",17586,642,16944,529,,,,,,,,,,,,,,,"56",13,345,15430,573,15430,,0,0,"562a7e16c78e3fe7a423f366d1f47f5697ce1790",0,0,0,0,0,""
20200513,"WY",688,165,14384,,"totalTestsViral",17013,10,67,,,,,477,"5/12/2020 15:50","2020-05-12T15:50:00Z","05/12 11:50",7,67,,"2020-05-12T15:50:00Z",17013,630,16383,523,,,,,,,,,,,,,,,"56",13,0,15072,499,15072,,0,0,"c0a3ea6428f7c2ca0d83b7cf9723367b4cd6074b",0,0,0,0,0,""
20200512,"WY",675,162,14384,,"totalTestsViral",16514,10,67,,,,,477,"5/12/2020 15:50","2020-05-12T15:50:00Z","05/12 11:50",7,67,,"2020-05-12T15:50:00Z",16514,620,15894,513,,,,,,,,,,,,,,,"56",6,2981,15059,508,15059,,0,1,"8c2af0b80db4e70681caa41b9dbb540e10e12e93",0,0,0,0,0,""
20200511,"WY",669,159,11403,,"totalTestsViral",16006,12,66,,,,,443,"5/10/2020 17:38","2020-05-10T17:38:00Z","05/10 13:38",7,66,,"2020-05-10T17:38:00Z",16006,603,15403,510,,,,,,,,,,,,,,,"56",7,0,12072,616,12072,,0,1,"145d1f2b7e974ab292a7bba378cd87c8afe3e5ef",0,0,0,0,0,""
20200510,"WY",662,158,11403,,"totalTestsViral",15390,12,65,,,,,443,"5/10/2020 16:00","2020-05-10T16:00:00Z","05/10 12:00",7,65,,"2020-05-10T16:00:00Z",15390,580,14810,504,,,,,,,,,,,,,,,"56",9,0,12065,103,12065,,0,1,"be69dd38ae17b67707f87ea93be9d5ed6b3de78a",0,0,0,0,0,""
20200509,"WY",653,158,11403,,"totalTestsViral",15287,12,64,,,,,438,"5/8/2020 13:58","2020-05-08T13:58:00Z","05/08 09:58",7,64,,"2020-05-08T13:58:00Z",15287,580,14707,495,,,,,,,,,,,,,,,"56",9,0,12056,128,12056,,0,4,"86ce42671774ea8a24751090092603bab9ad2133",0,0,0,0,0,""
20200508,"WY",644,154,11403,,"totalTestsViral",15159,9,60,,,,,428,"5/7/2020 04:28","2020-05-07T04:28:00Z","05/07 00:28",7,60,,"2020-05-07T04:28:00Z",15159,579,14580,490,,,,,,,,,,,,,,,"56",9,0,12047,482,12047,,0,1,"d3866e60646d1938c7dc01a7c83295b562d99b31",0,0,0,0,0,""
20200507,"WY",635,152,11403,,"totalTestsViral",14677,11,59,,,,,416,"5/6/2020 15:27","2020-05-06T15:27:00Z","05/06 11:27",7,59,,"2020-05-06T15:27:00Z",14677,563,14114,483,,,,,,,,,,,,,,,"56",4,0,12038,528,12038,,0,-1,"171d7fdb20e81d70af08a2f73ba55e093d509d12",0,0,0,0,0,""
20200506,"WY",631,152,11403,,"totalTestsViral",14149,11,60,,,,,409,"5/5/2020 15:30","2020-05-05T15:30:00Z","05/05 11:30",7,60,,"2020-05-05T15:30:00Z",14149,555,13594,479,,,,,,,,,,,,,,,"56",27,1084,12034,600,12034,,0,0,"29be46b15418bbcfa5d6caedb86c345e72b30947",0,0,0,0,0,""
20200505,"WY",604,152,10319,,"totalTestsViral",13549,13,60,,,,,405,"5/4/2020 17:02","2020-05-04T17:02:00Z","05/04 13:02",7,60,,"2020-05-04T17:02:00Z",13549,543,13006,452,,,,,,,,,,,,,,,"56",8,451,10923,441,10923,,0,0,"b510444e25852d981ce72eb94ca35509322ab896",0,0,0,0,0,""
20200504,"WY",596,152,9868,,"totalTestsViral",13108,13,60,,,,,391,"5/4/2020 01:56","2020-05-04T01:56:00Z","05/03 21:56",7,60,,"2020-05-04T01:56:00Z",13108,524,12584,444,,,,,,,,,,,,,,,"56",10,228,10464,580,10464,,0,0,"66539bd57de20ca9b116fc80d6ab03091752ad6b",0,0,0,0,0,""
20200503,"WY",586,151,9640,,"totalTestsViral",12528,13,60,,,,,391,"5/2/2020 13:12","2020-05-02T13:12:00Z","05/02 09:12",7,60,,"2020-05-02T13:12:00Z",12528,493,12035,435,,,,,,,,,,,,,,,"56",7,177,10226,126,10226,,0,2,"ba59b4690ed9a151064f4098420063ed1bd8c9db",0,0,0,0,0,""
20200502,"WY",579,150,9463,,"totalTestsViral",12402,13,58,,,,,387,"5/1/2020 15:49","2020-05-01T15:49:00Z","05/01 11:49",7,58,,"2020-05-01T15:49:00Z",12402,493,11909,429,,,,,,,,,,,,,,,"56",13,327,10042,123,10042,,0,2,"48895c8b364ca5a0d914a424709d2ceda487c0b0",0,0,0,0,0,""
20200501,"WY",566,146,9136,,"totalTestsViral",12279,13,56,,,,,373,"4/30/2020 00:00","2020-04-30T00:00:00Z","04/29 20:00",7,56,,"2020-04-30T00:00:00Z",12279,487,11792,420,,,,,,,,,,,,,,,"56",7,234,9702,619,9702,,0,0,"e893bed7263f662ad12c82ed6fc6e3b02c703d26",0,0,0,0,0,""
20200430,"WY",559,144,8902,,"totalTestsViral",11660,13,56,,,,,371,"4/29/2020 00:00","2020-04-29T00:00:00Z","04/28 20:00",7,56,,"2020-04-29T00:00:00Z",11660,471,11189,415,,,,,,,,,,,,,,,"56",15,221,9461,434,9461,,0,0,"7c3aaff7a172fcb381a61636e2d9cd723108381c",0,0,0,0,0,""
20200429,"WY",544,140,8681,,"totalTestsViral",11226,12,56,,,,,362,"4/29/2020 00:00","2020-04-29T00:00:00Z","04/28 20:00",7,56,,"2020-04-29T00:00:00Z",11226,460,10766,404,,,,,,,,,,,,,,,"56",8,455,9225,444,9225,,0,0,"11aebcf1c06b92ab29b22838f459de960f0cc6b7",0,0,0,0,0,""
20200428,"WY",536,140,8226,,"totalTestsViral",10782,16,56,,,,,343,"4/27/2020 17:05","2020-04-27T17:05:00Z","04/27 13:05",7,56,,"2020-04-27T17:05:00Z",10782,453,10329,396,,,,,,,,,,,,,,,"56",16,429,8762,671,8762,,0,2,"db4e85d82e9ff09a30e0f71ba859557e419cf84d",0,0,0,0,0,""
20200427,"WY",520,131,7797,,"totalTestsViral",10111,16,54,,,,,342,"4/26/2020 13:58","2020-04-26T13:58:00Z","04/26 09:58",7,54,,"2020-04-26T13:58:00Z",10111,441,9670,389,,,,,,,,,,,,,,,"56",18,0,8317,581,8317,,0,0,"a65b09b4fd54d9f2fb29135ae43ddad0fb66e0e0",0,0,0,0,0,""
20200426,"WY",502,132,7797,,"totalTestsViral",9530,16,54,,,,,334,"4/25/2020 17:20","2020-04-25T17:20:00Z","04/25 13:20",7,54,,"2020-04-25T17:20:00Z",9530,427,9103,370,,,,,,,,,,,,,,,"56",11,0,8299,77,8299,,0,0,"80460cb0e8a3a2fc7df415b9711449634f3d8f1b",0,0,0,0,0,""
20200425,"WY",491,129,7797,,"totalTestsViral",9453,16,54,,,,,321,"4/24/2020 16:02","2020-04-24T16:02:00Z","04/24 12:02",7,54,,"2020-04-24T16:02:00Z",9453,423,9030,362,,,,,,,,,,,,,,,"56",18,101,8288,97,8288,,0,0,"a457c014114d9eaed1277a82fa2fc1a86bcce37f",0,0,0,0,0,""
20200424,"WY",473,124,7696,,"totalTestsViral",9356,16,54,,,,,321,"4/24/2020 00:00","2020-04-24T00:00:00Z","04/23 20:00",7,54,,"2020-04-24T00:00:00Z",9356,420,8936,349,,,,,,,,,,,,,,,"56",20,455,8169,418,8169,,0,2,"9ea629ee174834f934cbacd52d418af77976ecc5",0,0,0,0,0,""
20200423,"WY",453,121,7241,,"totalTestsViral",8938,,52,,,,,275,"4/23/2020 16:27","2020-04-23T16:27:00Z","04/23 12:27",7,52,,"2020-04-23T16:27:00Z",8938,396,8542,332,,,,,,,,,,,,,,,"56",6,-60,7694,269,7694,,1,0,"27aa8d4e7a45c596ba95a3fad0d3713a81ba4fd4",0,0,0,0,0,""
20200422,"WY",447,121,7301,,"totalTestsViral",8669,19,52,,,,,254,"4/22/2020 23:00","2020-04-22T23:00:00Z","04/22 19:00",6,52,,"2020-04-22T23:00:00Z",8669,373,8296,326,,,,,,,,,,,,,,,"56",6,0,7748,289,7748,,0,0,"370a34f3b6434ce4da4fb8ac2d58b4001fe062e6",0,0,0,0,0,""
20200421,"WY",441,119,7301,,"totalTestsViral",8380,19,52,,,,,237,"4/21/2020 16:20","2020-04-21T16:20:00Z","04/21 12:20",6,52,,"2020-04-21T16:20:00Z",8380,356,8024,322,,,,,,,,,,,,,,,"56",13,228,7742,297,7742,,4,1,"39d7ec0db0243ffe9528c9dc842cf145f28c2eb2",0,0,0,0,0,""
20200420,"WY",428,111,7073,,"totalTestsViral",8083,19,51,,,,,233,"4/19/2020 00:00","2020-04-19T00:00:00Z","04/18 20:00",2,51,,"2020-04-19T00:00:00Z",8083,347,7736,317,,,,,,,,,,,,,,,"56",2,101,7501,299,7501,,0,1,"9272943e8880e9ce798e2350580a1fa84c1e1e33",0,0,0,0,0,""
20200419,"WY",426,113,6972,,"totalTestsViral",7784,19,50,,,,,227,"4/19/2020 00:00","2020-04-19T00:00:00Z","04/18 20:00",2,50,,"2020-04-19T00:00:00Z",7784,338,7446,313,,,,,,,,,,,,,,,"56",4,755,7398,83,7398,,0,0,"af685f3c8a4927c9cc02f0793a1e4a583e71c72a",0,0,0,0,0,""
20200418,"WY",422,113,6217,,"totalTestsViral",7701,19,50,,,,,206,"4/17/2020 16:02","2020-04-17T16:02:00Z","04/17 12:02",2,50,,"2020-04-17T16:02:00Z",7701,334,7367,309,,,,,,,,,,,,,,,"56",10,86,6639,99,6639,,0,7,"02db671bf235af532e2be15f1118310c6d269ca3",0,0,0,0,0,""
20200417,"WY",412,107,6131,,"totalTestsViral",7602,19,43,,,,,148,"4/17/2020 16:02","2020-04-17T16:02:00Z","04/17 12:02",2,43,,"2020-04-17T16:02:00Z",7602,330,7272,305,,,,,,,,,,,,,,,"56",11,0,6543,296,6543,,0,0,"d57f0ff8187aa9e0d28cd95c03aaabe1b4f3caaa",0,0,0,0,0,""
20200416,"WY",401,105,6131,,"totalTestsViral",7306,19,43,,,,,148,"4/16/2020 20:15","2020-04-16T20:15:00Z","04/16 16:15",2,43,,"2020-04-16T20:15:00Z",7306,323,6983,296,,,,,,,,,,,,,,,"56",8,89,6532,240,6532,,0,0,"b3dfafbb1305c41acf06500a5c51903ee1641883",0,0,0,0,0,""
20200415,"WY",393,105,6042,,"totalTestsViral",7066,,43,,,,,129,"4/15/2020 12:30","2020-04-15T12:30:00Z","04/15 08:30",2,43,,"2020-04-15T12:30:00Z",7066,318,6748,288,,,,,,,,,,,,,,,"56",10,353,6435,235,6435,,1,0,"699ebd3e6909522f6c88f960b9988b528fbe5d61",0,0,0,0,0,""
20200414,"WY",383,101,5689,,"totalTestsViral",6831,,43,,,,,140,"4/14/2020 16:05","2020-04-14T16:05:00Z","04/14 12:05",1,43,,"2020-04-14T16:05:00Z",6831,310,6521,282,,,,,,,,,,,,,,,"56",10,0,6072,307,6072,,0,2,"5331d2dc2e56067085bd5c86153fe3e7de189579",0,0,0,0,0,""
20200413,"WY",373,98,5689,,"totalTestsViral",6524,,41,,,,,138,"4/13/2020 15:19","2020-04-13T15:19:00Z","04/13 11:19",1,41,,"2020-04-13T15:19:00Z",6524,295,6229,275,,,,,,,,,,,,,,,"56",9,491,6062,314,6062,,1,1,"543d8eb03aaf5b31990d792b46fb03228091b4d4",0,0,0,0,0,""
20200412,"WY",364,94,5198,,"totalTestsViral",6210,,40,,,,,137,"4/11/2020 18:00","2020-04-11T18:00:00Z","04/11 14:00",0,40,,"2020-04-11T18:00:00Z",6210,287,5923,270,,,,,,,,,,,,,,,"56",21,0,5562,47,5562,,0,3,"8ab20369d94f5054d7e7fb6953c9fe04c0671ee1",0,0,0,0,0,""
20200411,"WY",343,82,5198,,"totalTestsViral",6163,,37,,,,,129,"4/11/2020 18:00","2020-04-11T18:00:00Z","04/11 14:00",0,37,,"2020-04-11T18:00:00Z",6163,287,5876,261,,,,,,,,,,,,,,,"56",3,462,5541,104,5541,,0,0,"4e5384bbdd052beee4ef0380b1e2b955bc222e7d",0,0,0,0,0,""
20200410,"WY",340,87,4736,,"totalTestsViral",6059,,37,,,,,105,"4/9/2020 18:00","2020-04-09T18:00:00Z","04/09 14:00",0,37,,"2020-04-09T18:00:00Z",6059,281,5778,253,,,,,,,,,,,,,,,"56",20,816,5076,272,5076,,0,3,"24d48239eb291c2b853b3478fff439718cef4925",0,0,0,0,0,""
20200409,"WY",320,81,3920,,"totalTestsViral",5787,,34,,,,,94,"4/8/2020 16:59","2020-04-08T16:59:00Z","04/08 12:59",0,34,,"2020-04-08T16:59:00Z",5787,270,5517,239,,,,,,,,,,,,,,,"56",17,77,4240,328,4240,,0,1,"31ee36790366bf9ab5e4b2170e9c6554ce8232fd",0,0,0,0,0,""
20200408,"WY",303,73,3843,,"totalTestsViral",5459,,33,,,,,62,"4/7/2020 18:21","2020-04-07T18:21:00Z","04/07 14:21",0,33,,"2020-04-07T18:21:00Z",5459,256,5203,230,,,,,,,,,,,,,,,"56",87,54,4146,279,4146,,0,0,"20734de65951cfed963de3dc1e39d7b3a26f0975",0,0,0,0,0,""
20200407,"WY",216,,3789,,"totalTestsViral",5180,,33,,,,,62,"4/7/2020 10:57","2020-04-07T10:57:00Z","04/07 06:57",0,33,,"2020-04-07T10:57:00Z",5180,241,4939,216,,,,,,,,,,,,,,,"56",6,70,4005,367,4005,,0,10,"571f232484a6c6426f7ec7148e90e6809e53e5a3",0,0,0,0,0,""
20200406,"WY",210,,3719,,"totalTestsViral",4813,,23,,,,,52,"4/6/2020 11:32","2020-04-06T11:32:00Z","04/06 07:32",0,23,,"2020-04-06T11:32:00Z",4813,228,4585,210,,,,,,,,,,,,,,,"56",13,679,3929,433,3929,,0,0,"c561f34133ae66a845338c0380b69a9f59fbeee5",0,0,0,0,0,""
20200405,"WY",197,,3040,,"totalTestsViral",4380,,23,,,,,50,"4/5/2020 09:23","2020-04-05T09:23:00Z","04/05 05:23",0,23,,"2020-04-05T09:23:00Z",4380,221,4159,200,,,,,,,,,,,,,,,"56",10,95,3237,148,3237,,0,0,"84ada557e53c0ffe015e86565dc635adb75cb072",0,0,0,0,0,""
20200404,"WY",187,,2945,,"totalTestsViral",4232,,23,,,,,49,"4/4/2020 09:49","2020-04-04T09:49:00Z","04/04 05:49",0,23,,"2020-04-04T09:49:00Z",4232,217,4015,187,,,,,,,,,,,,,,,"56",25,241,3132,165,3132,,0,2,"483061a42312650a38792a3e8c01e5586cf5ea38",0,0,0,0,0,""
20200403,"WY",162,,2704,,"totalTestsViral",4067,,21,,,,,37,"4/3/2020 10:42","2020-04-03T10:42:00Z","04/03 06:42",0,21,,"2020-04-03T10:42:00Z",4067,210,3857,162,,,,,,,,,,,,,,,"56",12,265,2866,404,2866,,0,2,"bd52893512cc2312a7e12e380e6dbbaba04363c3",0,0,0,0,0,""
20200402,"WY",150,,2439,,"totalTestsViral",3663,,19,,,,,31,"4/2/2020 10:30","2020-04-02T10:30:00Z","04/02 06:30",0,19,,"2020-04-02T10:30:00Z",3663,203,3460,153,,,,,,,,,,,,,,,"56",20,221,2589,425,2589,,0,1,"343cbe3fe0b4945ac40d42a4ed1759d558dceb04",0,0,0,0,0,""
20200401,"WY",130,,2218,,"totalTestsViral",3238,,18,,,,,31,"3/31/2020 19:44","2020-03-31T19:44:00Z","03/31 15:44",0,18,,"2020-03-31T19:44:00Z",3238,188,3050,137,,,,,,,,,,,,,,,"56",21,219,2348,316,2348,,0,1,"1d956afa8a2c359da3fa19ae38930e67975c5136",0,0,0,0,0,""
20200331,"WY",109,,1999,,"totalTestsViral",2922,,17,,,,,26,"3/31/2020 10:37","2020-03-31T10:37:00Z","03/31 06:37",0,17,,"2020-03-31T10:37:00Z",2922,158,2764,120,,,,,,,,,,,,,,,"56",15,159,2108,281,2108,,0,0,"c2e770b3bb8d38f058eb0830d5a5dbdc76f78306",0,0,0,0,0,""
